,Unnamed: 0,电影id,电影名称,用户id,用户名,评分,评论日期,评论内容,有用数,没用数,回应数
3,3,26266919,最好的我们,2583baa1137d4a68dcaf0139f35a97dd,c225bcf1ae1a41b013427d5d816d8c9c,1.0,2019-06-09 09:19:39,"6月7日，高考。 6月6日，《最好的我们》电影版上映。 占据了无数九零后一整个青春回忆的《最好的我们》，最终还是从一本写满文字只能靠想象的书变成一部24集的网剧再浓缩成110分钟的电影。 表现怎么样？ 豆瓣，6.0。 虽然分数刚刚及格，但对比很多青春片，竟然还算不错？ 况且，端午节期间其他几部电影的表现，似乎也不怎么样。 可以算是骑虎并降。  并且，作为整个端午假期唯一一部青春题材的电影，可能会成为刚刚经历过高考的同学们的电影首选。 可能就像几年前的....《小时代》？ 当然，比也不能这么比。 毕竟在大家的心中，至少在条姐的心中，八月长安和郭敬明是完全不同的。 虽然同写青春，但八月长安的书就像是白月光，既美好让人向往，又平淡有共鸣感，不是疼痛青春，也不是心灵鸡汤式的忠告，看她的书，嘴角总是会不经意间上扬。 而郭敬明的书就是，狗血狗血狗血，《小时代》更是集各种青春故事之大成，同居怀孕，堕胎撞车，偷情绝症全占全了。  社会社会。 来说回《最好的我们》。 《最好的我们》是八月长安“振华三部曲”中的第一部。（剩下的两部是《你好，旧时光》和《暗恋·橘生淮南》） 主角，耿耿和余淮。 她叫耿耿，他叫余淮，耿耿余淮，耿耿于怀。 很巧很特别。 而2016年谭松韵和刘昊然版的耿耿和余淮更是特别，看剧时就像是把中学时的快乐活生生的从记忆中拉扯出来，和他们一起追忆往昔。 要说选角，简直100%成功。 原著里描述余淮的片段是这样写的，“乍一看不是很帅的那一种，眼睛小小的，但仔细看，尖尖的虎牙笑起来还是一副很可爱的模样”，刘昊然就是完全符合。 谭松韵更是一副邻家少女的傻傻模样。 俩人的互动一个摸摸头的小动作就能撩的旁边的剧主不停嘤嘤嘤。  就算加了个原著中本来没有的路星河，也完全不会违和。 最后豆瓣评分8.9，这大概就是最迷人的青春，像极了我们一起度过的青春。 网友更是说“刘昊然之后再无余淮”“青春欠我们一个余淮”。 因为有珠玉在前，所以不光是剧主，条姐听说要改变成电影版的时候内心也是拒绝的。 果然，没有辜负条姐的“期待”。 失望。 就算前前后后的姐妹都泣不成声，条姐我内心还是毫无波澜，甚至有点想笑。  从剧情到人物，看的是崩溃的。 电影改编，和以往的电视剧改编，最显著的差别就是时长。 俩人平淡的学习日常，情感上的转变，确实不可能像电视剧一样循序渐进，是蛮有难度的。 不过，电影竟然选择了最无脑的一种：普通？日常？统统不要，戏剧性的爱情部分才是他们的最爱。 并且，为了突出通稿中的“这是属于耿耿和余淮两个人的故事”，自杀式的对其他重要的人物关系删删减减，甚至做出颠覆性的改变。 比如蒋年年，贝塔。 当二流子贝塔出现的那一刹那，我简直想骂街。 贝塔是女汉子，但她不是小混混好吗。 头上梳个哪吒头，编着五颜六色的小辫子，还带着街边五毛钱的彩色小卡子，手上还带着更low的手环。  嘴里嚼着口香糖感觉下一秒就要把口香糖吐对方脸上。 再流里流气的搭着耿耿和简单的肩膀说：“知道为什么我们会是好姐妹吗？因为我们仨成绩最差，我们以后就要做——垫底姐妹花！” ？？？你没问题吧？？？ 且不说这是贝塔和耿耿第一次见面，就算俩人已经熟悉，耿耿才不是那种想要垫底的人，她虽然成绩不好，但一直很努力。 再比如简单。 没有了韩叙的简单，变成了没头脑。 整天只会和贝塔一起撮合耿耿和余淮。 这还不是最主要的，最主要的是把耿耿都改了。 原著中的耿耿，是单亲家庭的孩子，并且已经有了一个重组家庭。 单亲是非常重要的一点，并非可有可无。 耿耿初入振华时，父亲刚刚再婚，她变得无依无靠，不管是和父亲还是和母亲都非常生疏，有多生疏呢？大概就是自己的妈妈来看她进门时她都要说一句：“妈，你怎么来了？” 这让耿耿突然觉得，自己的家庭不是完整的，而是已经朝三个方向渐行渐远。 她急需找一根稻草抓住，保证自己不会掉下去。 这时，她遇到了余淮，恰好余淮就是那个最温暖的陌生人，对她说着，我们做同桌吧，俩人的好感就是从这里开始。  到了影版，不仅这个重要的设定被咔嚓减掉，第一次的相遇还变成了那种最烂俗，最抓马的情节。 俩人在红榜前相遇，砰，好甜好甜的一米八几和一米六的最萌撞击。 转头的一瞬间，女主（我都不想叫她耿耿）就以一种“哇，他好帅”的花痴眼光看着男主（我也不想叫他余淮）。 而男主这时的装扮，很酷，脖子上是头戴式大耳机，单肩背包。 然后邪魅一笑，“你看，我左边那个人，叫耿耿，我们连在一起就是耿耿于怀”。 女主这时眼神故意的闪躲，并且愣了几秒，其实心里在说“啊，天哪天哪，我们也太有缘分了吧”，然后说出“我，我就叫耿耿”。 





 接着，男主伸手“以后我们就是同学啦”，哦，这莫名其妙的握手梗..... 好了，下面就请各种欣赏“一无是处的花痴学渣和无所不能的情场高手”之间的爱情故事。 摇身一变，从学习之余的喜欢变成了喜欢之余的学习。 什么你在教室我要故意靠着你。（还被当成了彩蛋，我惊了） 





 什么你在天台我给你戴耳机。 





 什么你在合唱队伍里我看着你给你唱《勇气》。  果然，还是梁静茹给了他们《勇气》。 一切情节都进展得如此神速，仿佛是原作按了10倍速的快进在播放。 又好像是一只一百分钟的MV，主题来自一本同名小说，叫最好的我们，或者干脆就叫，耿耿余淮传。 MV中反复出现的让人涕泗横流的句子—— “当时的他是最好的他，后来的我是最好的我，最好的我们之间隔着一整个青春。” 会有人问，这就是原作最戳心的台词啊。 没错，这是经典，不过用在影版里，简直就是无病呻吟。 我看不到那时余淮的好，只看到一个狂拽酷炸的社会气“小爷”。  我也完全看不到能让耿耿崇拜的地方，只看到了两人通过各种手段疯狂想早恋，耿耿好像随时都能陷入爱河。 我也同样不觉得后来的耿耿是最好的耿耿，耿耿能变得更好，是因为她从小就喜欢摄影，而不是在高中脖子上挂个相机随便咔咔两下，长大后换身职业装，说自己是开了个工作室就是优秀。 最后终于要说到选角了。 余淮的扮演者陈飞宇，陈凯歌的儿子。 翻了翻评论，有朋友是这么说的——  呵呵，什么没有复制刘昊然的风格，什么诠释了一个不一样的余淮。 对，所有的都可以用一句话解释，因为他演的是吴亦凡！！  从《将夜》开始，陈飞宇就被称为“低配版吴亦凡”。 这到底是侮辱了吴亦凡还是不看好陈飞宇？ 首先戏外，在拍时尚感的大片时，他的时尚感就不如吴亦凡。  其次，戏内，在管理面部表情方面，陈飞宇还不如吴亦凡。 陈飞宇的表情，大概是眉毛之下全无表情。 





 而我们的吴亦凡，至少他在说“菩萨知不知道我心里有多难过”时，脸上还是在用力笑的.... 





 而这次，陈飞宇确实变了，变得越来越朝吴亦凡靠拢了。 长相，声音，动作，让我频频跳戏，好几个瞬间，甚至怀疑自己看到了《致青春》中的吴亦凡。 哼、哈、切、抬下巴，本人天下第一帅。 





 余淮不是这样的。 我心中的余淮应该是一个虽然没有完美无缺，但仍旧一路拼搏的，身边的你或者我。 而不是一个不用努力就第一的学霸，一个只会撩来撩去的情圣。 影版《最好的我们》，看似书中的很多梗都放了进去，通过零零碎碎的画面将它们粘合在一起，却成了四不像。 耿耿余淮的感情没有了根深蒂固的铺垫，那么七年后如何能做到那样的耿耿于怀？ 哎，唯一触动到我的大概就是万年不变的张平老师。 当他在黑板上写下“高考倒计时4天”时，终于把我们带回了那个熟悉的“振华中学”，那个属于你我的高中。 





 这一段，不容置疑，刚高考完的同学肯定比条姐这个离开高中好多年的感觉还要深刻。 不过，总体来说，这不再是那个属于耿耿和余淮的故事了，打个不恰当的比喻，我们八月长安冲着去，你却给了我个郭敬明。 这合适吗？ 哦，对了，友情提醒，中间有彩蛋。 第一个，好妹妹电台。 第二个，继把第三者路星河删去后，又加了个原创角色，某个在雨中嚎叫的怪胎学长..... 我只能说，想念刘昊然谭松韵。",176.0,11.0,37
4,4,26266919,最好的我们,b9f20cea19243b1286c59a8fab9a9f19,6e2dfd5319bbfa889b71d2904f21166f,2.0,2019-06-07 21:02:53,"电影看到一半的时候，我在影院里坐立不安，甚至发出疑虑：我是谁，我在哪里，我在做什么？高考前一晚，热搜里出现了“张平老师高考嘱托”的短视频，看完后确实对这部电影产生了想要去看的兴趣，并且带着一丝期待，毕竟网剧版刘昊然和谭松韵的“耿耿余淮”令无数走出青春期的人感叹不已，想必电影版也不会令人失望。 根据网剧改编的电影不少，前两年的《匆匆那年》就收获了很不错的口碑，也令很多人一下子回到了自己的青葱岁月时光。看得出来《最好的我们》也抓住了这一卖点，在电影中拼命的将“情怀”推到了高处，可是这往往会适得其反，会从制高点狠狠地摔下来，血肉模糊。    电影难道完全不行吗，当然不是，一个剧组的努力一定会有值得点赞的地方。张平和张峰老师的塑造依然很好，张平初次当班主任的青涩以及对孩子们细腻的照顾是一眼就能看出来的，数学老师张峰的专业和敬业感也被演绎的恰到好处。 全剧最感动的点就是张平老师擦掉黑板上高考倒计时的数字，然后最后再一次对学生们老生常谈起注意事项，每一个有过类似经验的人都会有所触动，恋恋不舍的情怀不自禁的流露出来，和老师和同学和学校之间浓重的感情在一场开始之后就分道扬镳，从此再也不会有焦点，泪水代替了所有的不舍之情。  不得不提及的还有电影的插曲、主题曲及推广曲，几首歌曲的创作几乎是贴近了耿耿和余淮这两个人物，相知相识的默契及懵懂暗恋的青涩，都被逐一的唱进了歌曲里。   光良和葛大为合作的《最近的永远》我反复听了好几遍，可终究没有找到“青春到底是什么”的答案。“等你回头，才发现重点也在起点旁边，想牵的手，隔着最近的遥远”是不是像极了当年你暗恋的那个人，想要表白却迟迟没有勇气，最后只好作罢，留着遗憾很久很久。光良的童话故事里就曾说过，那些美好的事情都是骗人的，陪你到最后的人未必是最爱的。如今他又一次告诉大家，爱着的人仍然是“最近的永远”，勇敢实在太难。  汪苏泷创作的《耿》几乎唱出了大家的青春，无论是纸条还是盛夏都在歌曲里，而那些遗憾也被他最直接的问出：你还有遗憾吗？敢不敢回答？这些问题在心中早就有了答案，可自己却偏偏不敢和不想承认。如果那年盛夏没有如此深刻的记忆，谁又会有如此的感同身受呢？ 电影里还出现了《勇气》这首歌，在学校大合唱的舞台上，孩子们一同唱着这首甜蜜的情歌，是需要多大的勇气啊。这首歌的旋律一响起，我便起了鸡皮疙瘩，曾经没有勇气做的事情终于有人有勇气的去做了，只能用“美好”两个字来形容。   写完这些我再次打开豆瓣，电影的评分从6.0分将到5.9分，不过这个分数一点儿也不意外，毕竟看电影时的我比这个分数还要尴尬。不谈及爆红的网剧版，仅和同类的青春题材的电影作比较，这部电影就被甩到十万八千里之外。 编剧其实很想要触发观众们青春时期的柔软之处，但他万万没想诸多的触发点都显得很老套，很多观众早就不买账了，当看到硬生生的催泪眼，似乎也没有观众愿意再掏出纸巾擦拭眼泪。 最后的一些片段总是觉得和整部电影格格不入，硬生生的将男主后来的生活写的如此之惨，都9102年了，能不能稍稍思考下这些生硬的桥段实在很难让人找到共鸣。      主演两个人的青涩感也不是很到位，女主少了点少女的活泼，与原著里耿耿的形象离得太远，包括成年时期的造型和感觉都不是很到位。男主少了点青春期男孩儿的灵气，原著里余淮的骄傲感也没有被表现出来，反而呈现出了一点点痞气，还有空洞的眼神里看不出他对耿耿的感情。
 其他几个角色塑造的也不是很到位，蒋年年被演出了另一个人的感觉，没有一点点机灵感，反而被演出了大姐大的感觉。学生时期的徐延亮被弱化了，以及和余淮的感情描述不多，这导致最后徐延亮说出余淮消失的真实原因有点生硬。 总之这部电影看到一半时就想要逃出影院，但为了19.9元的票款，我还是硬生生的忍了下来，果不其然它没有令我失望，从头烂到尾。这应该是我看过的最没有诚意的青春题材电影了，配得上“最烂的我们”的标题。 - 最后，我要向剧组辛苦劳作的人员说，很抱歉没能如你们所愿给出好的评价，但也要为你们的辛苦劳作致敬，无论如何总归付出了很多汗水。     作者：张羊，主持人，撰稿人 一个不会唱歌的音乐DJ，爱好收集唱片 原创内容，转载请私信",55.0,7.0,34
5,5,26266919,最好的我们,7d6bfece69da7b3d8eaf3c738af16664,5030173e64543e7d31aaf55eb198dc1a,1.0,2019-06-11 11:39:00,文/梦里诗书 《最好的我们》里，电影用青春令人重逢的并不是那段纯粹而又美好的岁月，相反在矫揉造作的故事架构下，这部电影甚令人匪夷所思与主创人员是否有过青春的记忆，其苍白割裂的情感，虚假空洞的人设，用无数看似感动的片段拼凑而起的空中楼阁，实则只是让人如坐针毡。   不曾看过小说，也没有看过网剧，单从电影的角度来说看《最好的我们》就是一部尤为典型的国产青春烂片，为了冲突而制造冲突，在这部电影里导演只是单一的，将一件件发生在校园中的矛盾爱恋串联在了一起，意图诱发观众对青春的共鸣，但遗憾的是电影却全然忽视了对人物该有的铺垫刻画，纵观全片我找不到一个真正有血有肉的角色。其所有人物都只是如提线木偶的完成了自己的戏份。 电影人物的崩塌除了执导的平庸外，选角的失败同样也占据了不少成因，饰演男主余淮的陈飞宇，从头至尾只是一味的在耍帅装酷，这样的形象或许更切合一个浪子，却演不出电影所需的学霸，至于饰演女主耿耿的何蓝逗，则根本没有多少演技可言，男女主两人虚于表现的浮夸演技，使这部本就在人物刻画上极尽苍白的电影，所得见的哪还有一星半点的青春纯情，只有狗血尴尬罢了。   如果一部电影连奠基的人物都聊胜于无，那么其所建立起来的一切也就根本无从去挑动观众的思绪了，这也就能解释这部电影很多情感的缔结演变在最后看来都是莫名其妙的，而自诩的高潮时刻也只是感动了自己，甚至于如果你对这部电影的期望单只是回望一下昔日的高中生活，可以说除了电影中戏份不多的班主任还算有点真实外，便在无可取之处，被无聊冗长的爱情套路占据了所有镜头的呈现，如此青春实则与你我都并未关联。 好的青春电影是不论你处于任何时代，任何国家，都会被电影的故事所感动。例如《少年时代》的成长，也例如《情书》中的爱恋，我们虽然不曾经历过他们的时代，不曾体验他们的校园，但总有一份源于青春的共情之处足以去撬动心房，但这部《最好的我们》中有什么呢？剥开一件件似曾相识的外衣套路，我看不到源于电影自身所构建的内核，言之无物的呈现，只是将那些关于青春本自弥足珍贵的美好变的廉价。  如同这个世界没有一片相同的树叶，这个世界也没有一段绝对相同的青春，我们之所以能在一部青春电影中找到自己的影子，是源于年少的梦想，源于纯情的爱恋，源于在这最好的岁月里，我们想看到一个最好的我们，但绝不是如这部《最好的我们》般，用套路填充梦想，用浮夸演绎爱情，作践着这最好的岁月。,17.0,,1
6,6,26266919,最好的我们,0921b39aeef70f931d1c3dd82b8077b4,a9ad68d8e48ec51c0e0ba143b02dac57,4.0,2019-06-10 22:32:47,"武汉二中2019届毕业生,高三补习时看着这部电影在学校拍。  电影其实一般，但我和同伴都很感动，不是因为剧情，而是因为自己一点也不浪漫，安稳而充实的青春。   就算没有啤酒没有大雨，我们也有上去就被通报批评的天台，有绝对让你没时间跟女友/男友补习的晚晚自习与周练，有在一班而不是五班的保送清北的竞赛大神，有跟你不厌其烦讲题的数学老师，有我们的高中三年。 高考加油。",22.0,,6
7,7,26266919,最好的我们,f5594b5c2c27e20c8cccb3e6713d0534,66bc58c7101cd95c7ebef65a6866f50b,4.0,2019-06-07 22:13:21,今天一个人去看了《最好的我们》，看这部电影是因为被它的一句话触动： 过去的你是最好的你，现在的我是最好的我，最好的我们之间，隔了一整个青春。 电影里，太多关于初恋的小细节。喜欢他，是上课偷偷递纸条，因为有些话不敢当面跟他讲；喜欢他，是明明觉得他超帅呀，嘴巴却还在逞强；喜欢他，是偷看了他一万遍睡觉的模样，等他醒来却装作认真听课的样子……这是耿耿的喜欢，那个故意丢掉自行车钥匙想让他送她回家的耿耿。 喜欢她，是在她喝醉时背她回家；喜欢她，是在合唱比赛上唱歌偷偷表白；喜欢她，是扬言要罩着她；喜欢她，是明明不相信永远，却还要许愿永远永远；喜欢她，是把她纹在手臂上；喜欢她，是默默离去藏起了最后也没能说出的话……这是余淮的喜欢，那个明明什么都懂，却举手说老师我听不懂的余淮。 大概，每个人的青春都是这样过来的吧，懵懂的心里藏着一个人，就像藏了一整个世界。 电影结束后，灯光亮起来，我看见前排的一个女孩在哭，大家都陆续离场了，她一个人坐在那里哭得泣不成声。我不知道她经历了什么，但看得出来她真的很难过。成年后的耿耿哭着对余淮说：“我就是白痴，因为白痴才会等了你七年，因为白痴才会到现在都耿耿于怀。”那个在电影院独自哭泣的女孩，可能连说出这种话的机会都没有了吧。 其实，我们人生当中会有很多的遗憾，可是为什么却偏偏对青春里的遗憾耿耿于怀，大概是因为，再也不会有比青春更单纯美好的岁月了，因为太过美好，所以连遗憾都变成一种惨烈般的绚烂。 就在昨天，国民女神林志玲宣布结婚了，所有人都在缅怀，女神结婚了，可惜新郎却不是相恋了多年的言承旭。看言承旭之前在节目里讲这段感情，他说：“其实分手的时候很想搭个梯子爬到她的窗前，跟她说一声对不起，可是到最后什么都没能说出来。”我看了很感怀，忍不住在微博里发了一句话：你心目中的金童玉女最终也没能在一起，其实，这才是生活本来的样子。有人回复说太扎心了，是啊，太扎心了，我已经变成了最好的我，可我却失去了最好的你。如果可以重来，重新回到故事开始的地方，你还会喜欢我吗？我们的结果会不会不一样？ 如果，你也有偷偷喜欢的那个人，如果，你还没有勇气说出想说的话，那么，就约她|他去看《最好的我们》吧，一定要坚持到最后的彩蛋，只能帮你到这里了，趁现在，他|她还在，一切都还来得及……,32.0,11.0,3
8,8,26266919,最好的我们,a13c754e735160e134697dea122f19bf,d491f6446eec3cb2cf1acac803d18a6b,1.0,2019-06-28 21:30:54,预告是一流的预告 一星给预告 女主偷亲前紧张的呼吸 不敢动作加上配乐just cant win 完美的烘托了夏天里青涩心动的情愫。 所以我就被骗去看了 但是电影完全配不上预告。剧情不连贯，演员表现木讷，何蓝逗稍微好一些 但是经常性用力过猛。本来对何蓝逗在预告和结爱中的表现是非常可爱灵动的 为啥到了正片就很一般呢 谴责演员的同时 必须得问责导演 明显没有花心思去拍电影 去调教演员,1.0,,0
