,Unnamed: 0,电影id,电影名称,用户id,用户名,评分,评论日期,评论内容,有用数,没用数,回应数
32,32,26266919,最好的我们,8510754c78c571022f866481623463e5,06f4a3abc92489c6e3d18dc5b377fba4,4.0,2020-11-15 18:50:18,这部电影从上映到现在看了两遍，不可否认的即使电影在俗套，自己仍然两次都哭的难以自已。国产好多爱情片都是悲剧收场，这可能与国人内敛的性格有关，导致触手可得的情感变动遥不可及。但电影本身确实让我想起的很多之前的故事，能给人思考，便不能再说这是一部烂片。游历多年青春片战场，不难发现，总有一个高高在上的，光环效应显著的男主或女主，本片也是一样，飞宇同学确实帅，而蓝逗同学也确实有那么一丝丝“普通”（小翔哥口音）。选角问题，多半是之前电视剧先入为主。 上课提问，文理分科，同桌情谊，高考风波，总有一点会让你想到曾经的自己。高考的压抑导演们一般是会主动回避，在我看来，高中即使是高三也不是那么难过，毕竟自己也没有一点伤害的顺利渡入大学。电影前半段也都是无关紧要的过程，好多情节甚至都是没必要的开展，但是青春不就是这样的吗？从电影后半段开始，也就是老师讲述高考考前细则的那段，在影院里哭的稀里哗啦，边上的曾经女友都没有我的反应大，整个后半段自己一直在哭，一个大男生抱着身边女友姐姐的胳膊抽泣。甚至看完之后，我都沉浸在电影情节中，以至于之后甚至不知到自己为什么会有那么大感触。直到昨天同舍友再一次看这部片子，现在的女友姐姐已经成为前女友，自己还是在记忆中的那个点又开始泪流满面。 青春电影真的是在卖情怀吗？我觉得不是，因为，每个人青春都是不一样的但每个人的青春又是一样的，就像，人永远都会后悔一般，人永远都觉得之前的才是最好的。这次观影让自己，印象最深的是，耿耿余淮在站点等公交，余淮没说出口的话，依然没有说出口，公车来了，余淮上车，但从后门下车，又回到耿耿身边，“我还要请你吃饭呢”。让我顿时想起了同前女友姐姐的分手，要是我当初上了那辆28路从后门下了车回到他身边，抱住她，或许事件就会改变。但是当初的自己怎么又会考虑那么多，那么理智可以处理好所有情感，那么正确的找到感情的突破口，不会的，自己的青春就是这样的，不会分别之后还会重逢，这段感情不会有那么多信物可以继续回想起来，不会高考前经历那么痛苦的经历，不会那么多年心中永远只是一个人，不会一同跑到山顶重逢，不会的，我们都是活在现实中的平凡的一个。 我们也有痛苦也有快乐，所有情感都不会少，但所有情感都不会夸大，我们就是这样平凡的活着，不会有那么多刻骨铭心的经历可以提供分享，我们所怀念的只不过是平凡的过去那个平凡的自己。电影过后，擦干泪水我们还是要面对第二天的工作，第二天的生活。 我们只不过是会感叹一句，青春就这样匆匆忙忙的结束了，仅此而已。,1.0,,0
33,33,26266919,最好的我们,deb87a344a04fd1dec1ee6a6ce4fcdcd,c16a8df5754ec16bdbcc14f04499ba7d,4.0,2020-11-14 09:29:06,"你好我叫耿耿，你好我是余淮，耿耿余淮成了同桌

那是记忆里最美好的时光，“学渣”耿耿和余淮“学霸”成为了同桌，还结识了一帮小伙伴，让校园里充满着男少女们的懵懂，怦然心动和勇敢，于是他们之间都有了约定！

当时的他是最好的他，后来的我是最好的我，最好的我们之间隔着一整个青春。

看完电影之后仿佛回想起了学生的时代，那些快乐，开心，笑和泪水，喜欢一个人藏在心底一直不敢说出的话，每一个人心里都是有着一个念念不忘的人。

人每一段青春都从“你好”开始以“对不起”结束，加油吧！",,,0
34,34,26266919,最好的我们,04aa2a7a9fd2ad09bafda0180596b3a1,466beee1e4eabc1df0151357be09212d,2.0,2020-08-16 21:53:17,总结一下：失望远远大于期待 前两年，八月长安同名小说《最好的我们》被改编为网剧，性格耿直的刘昊然和完美童颜的谭松韵形象的演绎出了耿耿和余淮三年的纷往，带回青春时代。 非常抱歉的是，我并没有看完网剧。尽管如此，仅仅只是几个镜头也让我确信刘昊然就是余淮了。 回到主题，刚考完期末的我和朋友一起去看这部片子，原本是抱了不少期待的……刚开场就把我尴尬到了。 女主宛如十几年前的发型和始终如一的表情实在是把我吓到了。傲娇到什么都反着来的、心口不一的女主和高高帅帅学习体育全能还温柔的不像话的男主，再加上一两个或大条或冲动的女主闺蜜……我真的是对这种组合厌烦了。 为什么青春剧总是这样的配置，合着每个人都是这样心口不一还矫揉造作的吗？！ 这不会是我们每个人最简单平淡却难以忘怀的青春，编剧用许许多多的“名场面”和身高远超常人的偶像搭在一起的，是他们臆想的十八岁。 太假的东西，就不是情怀了。 年纪过大的配角、女主用力过度的“讨厌”、和男主看不出来的突如其来的“喜欢”、还有八百年前的刻板印象的教导主任……要是真正的高中学生来看，十分钟都看不下去。 严重怀疑编剧的高中是在各种电视剧里度过的……再不然，就是久远的甚至不记得了。 剧情也是一大败笔。看过原著的笔者表示，书里对男女主的情感过渡都处理的很好，平淡而且真实。但是在电影里，由我看来，导演只是截取了“经典”的剧情堆砌出来的，剧情不合理不说，还非常不连贯。其中逻辑让我看得十分尴尬。 整部片子的精华，看看预告片就可以了。预告片是全片处理的最完美的部分了。喧嚣的江轮、女孩子小心又慌张的眼神和动作，男孩子嘴角勾起的一点点笑意，都比电影院里尴尬又用力过度的表演好。 对了，电影的拍摄地点在武汉，学校外景在武汉大学内完成。欢迎报考风景甚佳、容易恋爱的武汉大学。,,,0
35,35,26266919,最好的我们,d3c2f01bd163900f46e7e76702bc675f,5b0e93ffff4cd9b5a953651e3fa71a28,3.0,2020-06-20 22:28:20,文献学作业，老师要一份，我交了三份，写完的时候累得有几秒钟直接处于窒息状态，接下来的一个小时都呼吸困难，所以决定看部电影奖励一下自己。 本来是想念武汉、想念华师才看的，因为是在华师取景，但后来也算笑着哭着看完了一部电影。女主没有剧版谭松韵的灵气，男主也没有刘昊然那种感觉，但我还是想给五星，因为我看到了当时那个自卑又敏感的自己和温暖温柔的他。虽然剧情老套，但我确实泪失禁地哭了。虽然最开始觉得女主不好看，但也承认其实还蛮可爱的。 我可以理解为什么豆瓣评分不高，因为这部电影需要共鸣——不代表电影本身好，只是我在其中感受到了一直以来被自己刻意想忽略的情感。 我也不知道再过三年、五年、十年我会怎么看我的高中。虽然我已经完全走出来了，但我永远感激那个温暖了当时的我且只爱我的他。电影安排的结尾是大团圆，但现实不是电影，错过的人怎么也回不到从前，我们可能这辈子就这么错过了，但现在的我也不觉得遗憾了，我总不能阻止他奔向比我更好的人吧——这句话适用于我所有的前男友。 “当时的他是最好的他，后来的我是最好的我，可最好的我们中间隔了一整个青春，怎么追也追不上的青春。” 你没有如期归来，正是我们离别的意义。,,,0
36,36,26266919,最好的我们,3948b6e1afd1a2eabd7df9d677cc6bf8,73e316e0537feb5e14b9081ee6b65b04,,2020-06-16 11:35:59,"晴空 11:21:43
如果当初我喜欢你没说出口

晴空 11:22:06
现在的我们会不会是很好的朋友

晴空 11:23:55
喜欢一个人，有时默默地藏在心里，也便不会有失落失望痛苦

晴空 11:27:36
我很傻，表露了自己的全部心迹，还“迷之自信”地以为你会喜欢我。可能有些事情没做到位，伤了你的心，我希望有机会可以弥补

晴空 11:28:38
怪我，搞丢了可爱又聪明的你

晴空 11:31:48
当时的你是最好的你

晴空 11:31:57
现在的我是最好的我

晴空 11:32:20
最好的我们之间相隔了一整个青春

晴空 11:32:39
我追也追不上的青春",,,0
37,37,26266919,最好的我们,d8f193089d190083164b68a81befe36b,05737a575bfe89eef1cc536d075268fd,5.0,2020-06-15 14:30:01,最好的我们，这是一部青春剧，反应了许多人的高中生活，剧中的耿耿，余淮更是一对欢喜冤家，两人初次相遇，余淮就见证了耿耿出丑的一面，脑袋被门栏夹住了，被余淮好一顿笑，最后把她解救出来。这也是她们两个第一次相遇。耿耿初中学习成绩不太好，用她的话说，就是走了狗屎运考进了当地最好的高中，振华，而余淮则因为失误没有进尖子班，耿耿余淮被分到了一个班，并阴差阳错的成为了同桌。随后两个人慢慢的产生了感情，余淮想尽一切办法帮耿耿提高成绩，耿耿也是很关心余淮。   大二上学期，文理分科，成为了他俩的阻碍，耿耿理科成绩不太好，她的家人，和她自己都有学文的念头，但她舍不得余淮，终究还是没有去学文，两个人还是继续坐同桌。除了这两个主人公之外，帅气的路星河，耿耿的强力追求者，在剧中也是层出不穷，各种大张旗鼓的追求耿耿。   三个人上演了一部完美的青春剧。在高考这条路上，可谓是都使出了自己的杀手锏，余淮热爱物理，和他的好朋友周末一起进行了封闭式的训练，训练期间，因不让玩手机而不能与耿耿联系，导致心神不宁，展示了一段懵懂的爱情。结果自然而然的，一想便知，余淮物理竞赛失败。耿耿热爱摄影，为了和余淮履行一起考入北京的承诺，决定放弃出国的机会，选择了考北京电影学院，初试过了，但是复试没有过，就这样，两个人又回到了振华，开始了和许多人一样的，最原始的考大学之路。   如人所愿，耿耿经过不懈的努力，考上了北京一所不错的大学，而余淮自高考过后就杳无音讯。直到十年后，两个人在医院意外碰面，说出了当时的真实情况，余淮说出了自己的难言之隐，而在这十年里，路星河对耿耿是百般的照顾，先后求婚就有五十六次，但最后还是抵挡不住余淮的一句话，对不起，我来晚了。或许这就是真爱的，我们替耿耿余淮，他们感到幸福，同时，也心疼路星河。,,,0
38,38,26266919,最好的我们,94454cddb00f5dbd219d0bf4a3495946,1dc784d4152692817fce9da3428bcdd6,3.0,2020-05-24 16:06:30,改编自一个八月长安的一部同名小说，主要讲述了耿耿与余淮这两个因为名字而有缘相识的高中学生，在最为宝贵的高中三年经历的成长、离别与重新遇到的故事。    当时的你是最好的你，后来的我是最好的我。最好的我们之间，却隔了一整个青春，还好，我隔着青春追上了你。  高中开学的头一天，耿耿在学校，到公布栏看自己的分班撞到也来看分班的余淮，然后发现他们的名字一起念居然是个成语耿耿余淮，这就是缘分吧第一节让选座位，大家选好的时候，余淮站起来说要和耿耿一起做，耿耿就过去了。   余淮上课睡觉，罚站，第一个交卷拿最高分，打篮球，帮她治疗手伤，所以耿耿恋爱了，想着如何和余淮一起。闺蜜知道后就开始出谋划策。这天余淮妈妈到学校问老师为什么余淮会跟耿耿做一起，让老师换一个优秀的同桌。可这些都被耿耿看到了。可余淮没有放弃耿耿，耿耿选择了理科，他们坐了三年的同桌。   在学校军歌大赛的时候，唱情歌，海害得全班拿不到名次，顺便表白，之后他们的感情升温得很快，打算读同一所大学，放假一起。  耿耿用相机闪了余淮的眼，那相机里保留了他们最美好的样子，后来毕业了，耿耿最后一次见到余淮是在高考前的晚上，余淮再也没有出现过，耿耿星河欲曙天，余淮消失了七年，耿耿想不明白为什么。  考试放榜那天学校门口见面，结果余淮人都没来。就这样过了7年，而这样完全找不到人，直到一次同学聚会，余淮出现了，耿耿哭着问他为什么不见了，为什么让她等了那么多年，余淮没有回答，他的同学告诉耿耿，余淮根本没去美国，他母亲得了尿毒症，他交不起学费，就去了工学院，后来辍学照顾他的母亲了。    最终耿耿决定告知余淮，希望两人在当初那个充满回忆的“晚秋高地”见面，当耿耿到达之后，并没有看到余淮的身影，原本在失落至极之下，余淮在背后现身，两人会心一笑后，电影结束。 此时，余淮很狼狈，耿耿很耀眼，但爱情里本来就没有配的上谁配不上之说，总有一些坚持，能从一寸冰封的土地里，培育出十万朵怒放的蔷薇，像耿耿和余淮。 时间改变了我们，却没有改变爱，原来所有的选择，都要听从自己的内心，我们才会无悔，才能得到真的幸福。,,,0
