,Unnamed: 0,电影id,电影名称,用户id,用户名,评分,评论日期,评论内容,有用数,没用数,回应数
9,9,26266919,最好的我们,6d70357e795785092b4f846be182247b,7751a344b01474655278c40ceb87dc1f,4.0,2019-06-04 15:34:16,我从来没想过，有一天我会给一部青春爱情片打四星。 其实《最好的我们》倒也没好到那个程度。说到底，现今大部分青春片不过都是《致青春》套路的延续，依然走不出“上学时两小无猜→长大后各奔东西→同学聚会重逢，感情死灰复燃”的固定模式。甚至连色调，也永远是上学时的“回忆黄”和长大后的“现实灰”两种。 如果这片子只有这些，别说打四星，我连星都不会打。 但不同的是，这片子有一个人：耿耿。  已经很久没有在中国大银幕上看到让我如此心动的少女角色了。 “你叫余淮啊，我就叫耿耿。”说这话的时候，耿耿眼睛斜斜瞟着这个胳肢窝都比自己高的男生，话说得吞吞吐吐的。在他的面前介绍自己，也许是她这辈子做的最大胆的事。 就算大胆，在余淮伸出手的时候，她依然不知所措，姐妹过来叫她，她转身就跑了。 在后面的日子里，余淮面前的耿耿，永远是一副没自信的样子。 她蘑菇头，个不高，单眼皮，学渣，一张胖嘟嘟的小圆脸，跑起来歪歪扭扭的。而余淮是学霸，是只要他上篮球场，场边就注定有一圈女生的存在，光是站在那里，就自带光芒。 她不敢相信余淮会喜欢自己，甚至就算坐在了他自行车的后座，她都不敢触碰他的衣角，甚至在天台上被深情凝视，她都要把头别到一边。她喜欢拍照，相机里全都是余淮，但被他看到，还是要气呼呼地说：“拍得不好看，我都删了！” 唯一敢放肆自己的时候，就是深夜在自己的小屋里，对着幻想中的余淮偷偷傻乐。  这样的耿耿，像极了我大学时的一个女同学。 像耿耿一样，她经常自卑于自己的小圆脸，不如校花般妖冶绽放。成绩也一般般，在那个学习好就是有魅力的时代，她没有什么闪光的资本。她喜欢打篮球，但白天的球场属于男生们，和男生们的长发女友，只有在夜里，她才敢偷偷地一个人跑到操场投篮。 她不相信这个世界上会有人喜欢她。 但是她笑起来很好看，像是初雪后的早晨；她一直很努力地对所有人都好，像是夏天吹过湖岸的轻风；她总能想办法让自己开心，就算是哭，她也不会把脸高高抬起，让别人看见她哭。 就像电影里的耿耿，班主任在黑板上写下分别的日期时，她用大拇指狠狠刮着眼睛，不让眼泪掉下来。  也许你猜到了，我喜欢这个女同学。 虽然我没余淮帅，但起码我比余淮勇敢——她就是我的初恋。 耿耿这样的姑娘，其实真挺多的。她们是班里不起眼的那个，她们自己小小的喜怒哀乐，不是全班人的谈资，而是她们自己的秘密。 她本不应该是青春片的女主角，青春片是属于那些好看的人的，属于他们张扬激烈的青春，属于他们被全校瞩目的青春。 但是耿耿，才是青春最真实的样子。  但耿耿绝对不是一个简单的姑娘。 高二文理分班，耿耿本是一个最怕数学的理科学渣，按理说学文是板上钉钉的事。而且像耿耿这么怂的人，让她去理科班挨虐，可能会要了她的命吧？ 但因为余淮选了理科班，所以耿耿就一定要去。 重新坐在余淮身边的时候，耿耿的眼里全是坚定，嘴角轻轻上扬。她一字一顿地跟余淮说： “余淮，我想一直做你的同桌。” 余淮被吓到了，眼前的这个姑娘他似乎从来不认识。  姐妹对耿耿说：“男人就像猴子，猴子永远喜欢摘桃子，不喜欢捡桃子。”耿耿说：“我不要做被他捡的桃子，我要长得高高的，让他够。” 她做到了。她不再是曾经的学渣，她考上了美国的名校。 在高考前的一晚，余淮最后一次送耿耿回家。他心事重重，耿耿看得出来。余淮那句藏了三年的话最终也没说出口，耿耿也不逼问，她只说了一句：“我等你。” 故事到这里，余淮和耿耿的身份发生了奇妙的转换，过去笼罩在余淮身上的那些光，似乎全都被耿耿的光淹没。 耿耿这样的姑娘，从来就不是胆小鬼，她们可以很强大，为了自己爱的人。 在我看来，这样的姑娘，就像是金子一般。  再写下去，我可能就要陷进回忆里出不来了，所以，就写到这。 耿耿是国产青春片女主角中的异类，我写这篇，不为了夸这个电影，只为她。 你是耿耿吗？你的身边，有耿耿吗？,11.0,3.0,6
10,10,26266919,最好的我们,1562452f548cf5cd7308889d5d52d7e9,569957bcd7439724ace682c7468377c4,3.0,2019-06-13 22:14:54,嗯，在三星和二星之间犹豫，觉得打三星的话，之前打三星的阿丽塔很无辜，打二星吧，又觉得低了点，就冲武汉的各处取景，也还是要支持下。陈飞宇演的宁缺还挺有感觉的，但是余淮似乎感觉差了点，正如评论里有人言，陈飞宇演的不是余淮，是吴亦凡！一副自恋臭美还嘚瑟的表情，哎，真是，可惜了还不错的颜！刘昊然饰演的余淮，长相并不出众，个子高挑，有邻家男孩的亲近感，人物也比较亲和温暖，是那种青春萌动女孩会喜欢的样子。哈哈，就算不说所有女生，反正阿姨我年轻的时候喜欢的男生就是这样的，可以长得不出众，但是简单、阳光、高挑、温暖、成绩好、会打篮球、会偷偷地照顾喜欢的女孩子……哈哈哈，昊然演的余淮全中我的萌点！陈飞宇的余淮，帅则帅矣，但是锋芒太露，棱角太硬，还自恋臭美，完全没有get到萌点。何蓝逗的耿耿还可以吧，虽然有些呆，但比较自然真实。嗯，看电影的时候，本以为洪山礼堂会一个人包场，结果进放映厅坐定，看到三三俩俩的大妈进入，我就有些尴尬了……最后被几个大妈的前后夹击，听着她们不时商量剧情，打电话的声音，很出戏地看完了。不过好在这部电影本身也就出戏中结束……,1.0,,2
11,11,26266919,最好的我们,2e63d7523a8779fafaa6083d7f4b4bc9,c655fe70b466c3c335c8c5bc4d7a59a2,5.0,2019-06-08 23:34:01,今天，高考结束的日子。 午觉醒来，突然很想感受一下大脑缺氧的状态，于是就来到了游泳池。原本我的想法是在大脑极度缺氧的状态，我会想到哪些事情？或许我会想到生命、价值，又或者是宇宙之宏大，人类之渺小之类的东西，但结果我想到的却是：这水氯是不是超标了。 离开健身房，转角来到了电影院，看哪一部呢？就最近一场的吧，选择了一个角落的位置。    《最好的我们》，这部电影是很随机的选择，但是不得不承认它给了我很大的惊喜。 不煽情，不做作，就连女主的配音也略带稚嫩，而我恰恰觉得这是可爱之处。 带着轻松的节奏，我们来到了08年的夏天，这一年，确实发生了很多事情，南方大雪，汶川地震，北京奥运会，神七发射……故事中的男女主角刚刚步入高中生活，很巧，我也是。    女主叫耿耿，男主叫余淮，连在一起就是“耿耿于怀”。耿耿是学渣，余淮是学霸。从开学的第一天起，他们就开始了“相爱相杀”的同桌生活。    如你所愿，青春里淡淡的喜欢、悸动、青涩、含蓄、小秘密、冲动、试探、小心翼翼、单纯的小美好，阳光、白衬衫、微风、葱郁的树木、傍晚，理想、现实、愿望、高考、毕业，如同所有致敬青春的故事一样，这些都存在。 如果真的有世界末日，那一定不会在夏天来临。可是在青春里，每一次带有仪式感，盛大的别离，都是在那个躁动不安的夏天。大概在每个人的内心深处都有一段无处安放的青涩回忆，而在我的记忆深处，也是在那个明媚而坦荡的夏天！    每一次收到信息，都希望是她。 舍不得删她的信息，如果收件箱提示已满，那就挑选字数最短的删掉，比如：晚安。好的。 盼望断电，恨不得把给学校供电的电厂炸毁，不是因为可以不用学习，而是可以和她溜到公园里。现在我讨厌断电，如果断电，我会崩溃的，瞧，男人都是善变的。 无条件信任，知道她一定会等你，不管天多么黑，你知道她肯定会等你。 每一次见面，心脏都跳的厉害，真的是小鹿乱撞，而且都快撞死个屁的。 故意路过她们班，然后会在门缝偷偷看她，看到她就会觉得莫名的心安。刚心安，这边一个同学猛拍我肩膀，你鬼鬼祟祟做什么？我……我我学生会的，我来查查你们班学习氛围如何。 为她刻苦学习古文诗词，所以给语文老师一种错觉，我在这方面很有天赋。 有机会在校园电台点歌，会点最最最能想到她的歌，比如《U make me wanna》。 坐在一起，吹着晚风，看着日落，那一刻恨不得这就是生命的终点。幸好没有，不然第二天全国人口第一大县的报纸头版头条新闻标题，《两青年殉情于城西闸》，这这这这就悲剧了。 ………… 不写了，这太甜了，让我一个单身狗如何安好 微凉的夜晚，高考的结束，让我着实怀旧一把。昨天，堂弟问我，到我们这个年纪，还会有真爱吗？我迟疑了一下说：当然有，任何时候都有，只不过越往后越难了吧！ 原文公众号：叁肆柒,8.0,4.0,0
12,12,26266919,最好的我们,c2e5ca8c5fb574b33843a902c4be6c65,11100c1bf23f72110de9d4cfd5cdc1cc,2.0,2019-06-02 19:07:50,我没看过小说，但是非常喜欢网剧，简单评价下观影感受吧~ 首先，先说女主。耿耿是一名高中女孩，和所有高中时代怀揣花季梦想的女孩一样，对懵懂的恋情即害羞又期待。而影片里的女主，眼神是空洞的。她虽然身体表现出了紧张、害羞和期待，但是她的眼神却毫无感情，这就严重说明了在演的时候内心戏不足，所谓把一个角色演的灵动、演活，内心戏是非常重要的，眼睛是心灵的窗户，这一点谭松韵演的就非常好，对比来看，非常明显。 其次，男主。不得不说，颜值为本片加了不少分。但是男主的动作，“哼、哈、切、抬下巴”，这几个在剧中反复出现并具有代表性的动作，我先不评论。先说说余淮。余淮也是和广大青春男孩一样，进入了青春的悸动期，也对恋爱是懵懂，但又骄傲、霸道的。他的傲气来源于他的学习成绩。再说说男主的这几个动作，完全是属于痞气型，和原型的余淮确实有相同点“霸道”，但是让人感觉不到骄傲，而且有点像小流氓。 然后就是其他几个重要角色，塑造的不够到位和强烈。蒋年年完全没有剧里的那种鬼精灵、但又心思细腻、敢爱敢恨的形象，而反而有那么一点像校园霸凌里的大姐大的感觉。怪胎学长感觉完全就是为了登台的那一首歌。我知道原著里是没有路星河的，也没有周末，但是看了电影后感觉没有了路星河和韩叙以及周末的剧情感觉那么的单一。感觉网剧就像耿耿余淮、耿耿星河、简单韩叙等等几条支线共同撑起了一条大主线，缺了哪条支线主线都无法成立。而看完电影后再回想其中的情节，唯一能想起的就只有耿耿余淮两人你侬我侬的学习，并没有太多青春美好的记忆。 最后就是剧情，我没看过小说，但简单看了看网上的评价。可能电影的剧情更贴近小说一些吧。但是说实话，我却感觉电影更空乏。而网剧所勾勒的，却更是我想要的，想过的，真实所希望发生的青春。最好的我们，虽然每个人最好的时间都是不同的，但是每个人最好的年岁都是一样的。在那样一个充满梦想，幻想，理想和希望的时光中，我们都想成为那个最好的自己，但是回顾自己过往的时光，谁又能否认那不是曾经自己最美好的时光呢？ PS：最后的尾映确实太虐狗了。,23.0,5.0,5
13,13,26266919,最好的我们,87b3d313f51906a1fb4c77ff35a8f3a5,87b3d313f51906a1fb4c77ff35a8f3a5,4.0,2019-06-11 01:19:25,今年不知道什么原因，看了好几部知名的青春小说+相关电视剧、电影，这部无疑是非常接近我那个青春的一个。 （原著发生在比我晚三届的学弟学妹之间，时期非常接近了。电影则发生在更晚之后的五年。） 出于对陈飞宇的（莫名其妙的）信任和对何蓝逗长相的喜爱（其实也就是在向往的生活中看了一眼），我在几天前把小说先看了一遍。看到结尾处我快要崩溃了——作为一个小甜剧爱好者，我越来越没办法忍受非HE的故事——生活已经如此乱七八糟了，为什么我还要在虚拟世界感受这些？我不要，我只想看甜。哪怕它们与我毫无关系。 小说看完我又去“循例”看了一眼电视剧——印象中刘昊然是非常少年非常符合男主形象的人，但我却在看完一头一尾后更加崩溃——这肤浅又敷衍的演法是怎么回事？？？他还是那个我心目中那个骄傲又腼腆的少年吗？？？一丁点细腻都找不到。结尾处的形象更是令人不适——青春剧中好多男演员都有这样的问题：小朋友去演，学生时代就毫无违和，但成年部分就像小孩装大人；成人去演，学生时代就像在装嫩......刘昊然就是成年部分令人不适的。 但让人非常惊喜的是——陈飞宇竟然hold住了两种形象！！！虽然成年后的造型无比接近贺军翔，但丝毫没有违和。何蓝逗更是学生时代和成年后都非常的融洽，尤其她的学生时代造型，就像当年高中时班里的某一个女同学。 班主任的演员也非常喜欢！电视剧和电影都是同一个人出演，虽然年龄与我当年的班主任相差甚远，但两个人对于大家的意义都是同样深远。毕业前的部分看到电影院里大家都在偷偷哭泣，就像是又经历了一遍同样的青春。,3.0,3.0,1
14,14,26266919,最好的我们,3c6d36b7d36f69322e1ebc72df385e38,d33c14d7c10c6a3c4277c0fcfab523cc,1.0,2021-11-15 08:32:37,"



       故事大概就是想玩个谐音梗。 不知道玩谐音梗是要扣钱的么？ 一个耿耿，一个余淮，从此以后对青春期的爱情耿耿于怀。 在安排，没毛病。
     类似的青春片，没点病痛灾难什么的，编故事的人大概都不知道怎么编，导演可能也不知道怎么拍。 这男生女生之间的青春，最终总是会有一个人站出来莫名其妙的消失。 如果真的那么决绝，那就决定好一辈子不要见面啊。 可惜的是，心里还是有那么点小希望。 希望自己当年的悲壮被另一个人看见，然后感动得她（他）一塌糊涂。 然后，两个人欢欢喜喜的在一起。
     拜托，好好说话不行吗？ 这在树上刻名字的事儿，本身还有的浪漫被这么一糟践，彻彻底底变成了一件有违公德的乱写乱画。 还是安利一首老歌吧。 周治平——青梅竹马。    青梅竹马音乐：周治平-青梅竹马 是谁和谁的心，刻在树上的痕迹。 是谁和谁的名，留在墙上未曾洗去。 是谁给谁的信，藏在深锁的抽屉。 是谁和谁的身影，留在泛黄的相片里。
 或许，这才是青春应该有的样子。",1.0,,0
15,15,26266919,最好的我们,e6224a416f18f6bf4ddc42dc7002cbe2,9a0ee702f9230aee04a66c5c683ab619,,2021-08-18 22:48:50,电影版真的高出预期！开始的时候期待着经典剧情的重现，期待包书皮，期待篮球赛，期待天台上的秘密，期待那句“我来晚了”。然鹅看了不到三分之一，就完全被电影中的耿耿余淮吸引了。逗逗（饰耿耿）演技真的进步好多，青春感满分，颜值也在线。陈飞宇（饰余淮）可能是演了太多青春剧的缘故，看着看着就串戏了。不论怎么说，耿耿余淮真的就是我们可欲不可求的青春。一些镜头真的拍的很美很灵动。♡七年后的部分没有拍， emmm……算是有点小遗憾吧,,,0
16,16,26266919,最好的我们,889eeb4725dbf261517b0fed18855487,95cf9fca0070c217f2e28d9c07542f41,1.0,2021-08-03 23:17:38,尬住了家人们，但是还是要感谢导演 看完我家房子都大了一点呢， 为啥？ 脚趾头抠出来的三室一厅 就不评价演员的演技了，大家有目共睹 单说台词，真给我真无语了呗 直白的地方直白的要死，抒情又搞得特别书面化，配合着演员本来就不OK的演技和背诵般的演技原地高潮。烂的给我看yue 了，台词尬到我以为是我写的 。,,,0
17,17,26266919,最好的我们,a04b1292093ccecf80e568459f228384,e6ecbaddf7a219e9befbcc4a582ce30f,,2021-07-07 00:12:24,回首往昔，青春的时光恍如昨日，历历在目。似水流年，关于青春的故事又说再见。那么青春里住着的那个人呢？听着一首歌，看着一部电影，生活中某一个细节，就猛的想起某一个人某一件事，一大段思绪就会翻涌而来，你也不会知道自己为什么活在回忆里。很多人有着相同的经历，一样的感同身受，会不会有人在突然间出现，你又开始新的一，段旅程，会不会有人反复出现在你的生活，而她始终只是一个过客。,1.0,,0
18,18,26266919,最好的我们,93f50fc29a82db192856d2a8a60723c3,b76c53508f10c02d269ae1f53a4a0748,3.0,2021-03-31 14:01:27,"我们每个人在学生时代都有暗恋过人，心里也都会幻想过对方也是喜欢自己的，但是在毕业后、在工作后，我们不一定会相见，相见了我们不一定会记得曾经那两颗砰砰跳动的心，或许我们已经成家立业，有了那个让你曾经的幻想变成现实的那个人，已经儿女成群，有了生活的重心和自己的责任。但看这部电影并不亏，因为它不仅讲了耿耿和余淮的故事，还有高三五班的故事。

很巧，我高三也是五班的。

人们总说青春已逝，但我觉得奋斗的每一天都是青春，有颜色的青春，我们哭过笑过闹过吵过疯过。

回想过去，我们不会记得在宿舍里窝着玩手机的那一刻你手机里的画面是什么，但你会记得你为梦想奋斗过的某一个画面、体验过的某一种感觉、让你心跳加速的某一个人。",1.0,,0
