,Unnamed: 0,电影id,电影名称,用户id,用户名,评分,评论日期,评论内容,有用数,没用数,回应数
0,0,26266919,最好的我们,f72fb0b1a7b1c7d5cd5074c88f8a5fc2,574f8c73c2444732e5b616248dfcf47b,1.0,2019-05-26 00:05:14,"补评一下:我认为国内青春片可以不用一直勇敢追爱了，大家都经历过学生时期，暗恋过多少同桌多少隔壁班同学也都很清楚，世界上的绝大部分人都只是一个偷偷隐藏心事却又假装大大咧咧的青春期男孩女孩，我不需要勇敢张扬的、肆意乱叫青春美好我真舍不得的青春片了，那太虚假了，我没办法从里面得到个人情感上的共鸣了，因为我们从始至终就不会是校园里张扬青春的人。我只想要一部很清淡的却总在细微处让我流泪想起青春苦涩与暗自欣喜的电影，这样的电影是需要电影工作者从上到下细细打磨的，是良心制作还是敷衍了事，其实我们心里清楚。 —————————— 复盘一下《最好的我们》电影版吧，总之不论是书粉还是青春片热爱者，都十分不推荐去看这部电影。

这部电影成为我第一部看十分钟就不耐烦想离开的电影，但为了能够相对客观地批评这部电影，我坚持坐到了最后。也是佩服我自己。

从电影叙事上来讲，也不提小说的漫长叙事，整个叙事和情感表达就是支离破碎的，几乎没有一个情感点可以触动，每一个情感开始得莫名其妙也高潮得莫名其妙。
我觉得这部电影的弊病在于它贪图省事，不动脑筋扁平化叙事，任何需要揣摩的、需要让观影者领悟的细微情感变化都直接省略，也许是因为这部电影建立在极度有共鸣感的青春小说基础上，所以电影制作者一方面仗着原著而省略情感变化的细节，另一方面又因为这些细节太过耗时难处理而选择放弃进行模板化的扁平处理。所以整个电影都像是把观众当猴子耍逗着玩，以为观众看不出来，以为观众会流泪，以为观众会共鸣感动，包括雨中男同学给叶展颜弹吉他唱歌告白，我被这个电影里同学的欢呼围观与尖叫给白痴到了，只想翻白眼。

总之，这一点都不是一部诚意之作。这部电影看完，我真正感到遗憾，电视剧电影好坏都已经拍完了，再也不可能有另外的《最好的我们》了，一种青春的形式再也不可能以“最好的我们”来展示了，然而展示出来的版本又实在是令人有些(。)

电影开头那会说，余淮他狡诈尖酸刻薄，这是耿耿吐槽他的话，像是在一开始设定欢喜冤家套路，实在是过于模板化了，一开始就套进了一般青春片的叙事里。随后简单和贝塔说，余淮啊，令女生尖叫(大致就是这意思)。我看着电影，就在一直否定，不是的不是的，余淮不是那样的男孩，不是王大陆演的那种类型男孩，也不是江直树的那种男孩，也不是最近青春剧流行的高冷面瘫男。余淮不是令女生尖叫的那种男孩，他真的相当常见，成绩好一点脑子聪明一点的男孩，很接地气很会开玩笑，作业写得很快上课可以不怎么听，成绩很不错却也不是年级里最最突出的那些，在男孩和女孩里都受欢迎。是一种明知他耀眼却也不刺眼的光芒，八月长安说是“蓄着太阳能”。

所以从陈飞宇这个选角开始就错了，陈飞宇太不接地气，他不像是能够融入人群插科打诨的人，甚至他在电影中的表现都像是从来没有做过普通男高中生(一种感觉猜测啊，不知道他的学习经历)，上课坐姿就不像一个深谙应试教育之道并在其间混得如鱼得水(上课睡觉，有自己的学习节奏)的男高中生样。

余淮这个人物，其实有点直男的。他绝对不会做出给耿耿剥了一整盘龙虾这种不符合纯情直男高中生的行为，也不会直接对着受伤的耿耿说“从今天起，就让小爷我罩着你”这种话。我觉得余淮是羞于去表达这些的，就算是要说，也只会假装心不在焉地说一-句“小爷我一直都在”，而不是有点正经地有些温柔地说这句话。

耿耿这个人物，看着大大咧咧其实很羞涩的。她也不可能这么肆无忌惮有恃无恐，就像是早已熟知彼此心意。她其实一直诚惶诚恐，在各种事物之间矛盾纠结，也从不会如此对余淮如此笃定。

他们之间原本就是《流水混账》，本就是细水长流的同桌故事，日子一天天浪费过去，竟然也就自得其乐开心得不得了，哪怕是有各种沮丧和失意，“我不幸是世界上最不快乐的那种人，没能力，却有上进心;没天赋，却有梦想;越努力，越难过。”这样的耿耿和“嬉皮笑脸地随手摘取你费劲九牛二虎之力才够到的神仙果,然后却表现出并不是很稀罕的态度”的余淮相差了十万八千里，可还是觉得“青春浪费在你身上”，也真是值得的一件事。这样的日子又怎么会去如此热烈和直接地表达情感呢，怎么余淮就会去说“我也有个喜欢的女孩，我也想在舞台上唱歌给她听”这种话呢。这个故事真的不是电影里刻意煽情地演唱《勇气》一样勇敢，这不是一个勇敢追爱的故事，他们会会绝口不提喜欢，各自隐藏着继续同桌生活。 “逼仄拥挤的青春里，他送我一程，然后转身踏上自己的旅程。他的世界很大，路很长，很遥远，我只能站在自家门口，独守着小小的天地，目送他离开。他活着，便精彩。”这才是这个故事人物的内核。如果不是一种童话式的七年后结局，这个故事就是遗忘在时间里的青春，慢慢消逝淡去，却也留下些印记影响着。 
这就是有一点点乏善可陈的青春，乏善可陈的耿耿，还有一个其实挺普通的余淮。",646.0,16.0,139
1,1,26266919,最好的我们,f3939efa1f8edcc29410f87125e46210,2e01f495a4d55ba0b91f20af375ff9a7,2.0,2019-06-07 10:04:21,影版《最好的我们》整体气质抓马化了，甚至有那么一点点狗血气息 青春影视剧已然成为市场的香饽饽，像“优爱腾”每个月都各自上新至少一部青春题材的网剧。虽然爆款的比例低了许多，但青春影视剧丝毫没有降温的趋势，一方面是，“没有人永远青春，却永远有人正青春”，这一题材永远有追随者；另一方面，青春影视剧的制作门槛低、成本低、政策风险小、收益率高。而如果是IP，那就更不容错过了。 八月长安的“振华三部曲”，可以说是青春校园小说的超级IP。“振华三部曲”是以振华中学为背景的三部小说，分别是《你好，旧时光》《最好的我们》《橘生淮南》，这三部小说分别已经改编成网剧。其中剧版《最好的我们》于2016播出，由刘昊然、谭松韵饰演男女主角，该剧播出后大获成功，当时点击率超过20亿。如果说赵薇《致青春》拉开了青春电影的帷幕，那么《最好的我们》则掀起了青春网剧的热潮，正是《最好的我们》的成功让资本注意到这一市场的广阔天地。除了《最好的我们》，剧版《你好，旧时光》于2017年播出，由李兰迪、张新成主演，而剧版《暗恋橘生淮南》也将于6月10日播出。 “振华三部曲”分别改编成了网剧 于6月6日起全国公映，由陈飞宇、何蓝逗主演的影版《最好的我们》，是“振华三部曲”首次搬上大银幕。影版《最好的我们》会否复制剧版的成功？ 影版《最好的我们》海报 对于影版来说，原著和剧版的巨大影响力，是一把双刃剑。有利的是，剧版粉丝基础雄厚，影版在宣发上事半功倍；问题是，剧版实在太深入人心，刘昊然的余淮、谭松韵的耿耿受到书迷的一致好评，甚至有剧迷说，不是刘昊然、谭松韵在演耿耿余淮，而仿佛是八月长安看到他俩，才写出了这样的故事。观众难免会对比，影版的压力可想而知。 剧版的耿耿余淮深入人心 首先得搞明白，八月长安的小说原著有怎样的特征？何以成为大IP？客观地评价，如果以精英文学的标准衡量，那么八月长安的“振华三部曲”也是快餐文学；但假若与同题材的快餐文学相比，那么“振华三部曲”的写作则有质感多了，至少是那种清淡可口、色香味俱全的快餐。八月长安出生于1987年，是2006年哈尔滨市的高考文学状元，她是名副其实的学霸，本身文学功底就挺好的，85后的成长经历也让她小说中的细节叙述贴近80后、90后。但“振华三部曲”最与众不同的地方，还在于它的真实。 如今“真实”是一个用滥了的评价，任何青春影视剧播出时打出的宣传旗号里，一定会说反映了真实的青春云云。但并不是说主人公穿着校服、听着那个年代的流行歌曲、纠结于文理分班等，就代表这部剧真实了。真实不仅仅是体现在服化道的细节和一些标志性的事件上，它更体现在叙事的肌理、人物的塑造上。绝大多数人的高中生活用两个字来形容，就是普通，绝大多数高中生，也是普通人。因此，真实的奥秘，即“普通”。 在高考的指挥棒下，高中生活里哪有那么多抓马的风波，学生们就是教室-食堂-宿舍/家三点一线地来回奔波，为着每日的功课、每月的月考以及发下来的成绩单愁苦。而一群普通的高中生，哪怕你智商再高，终究也就是一个还未步入社会的小屁孩，会紧张、会焦虑、会恐慌、会退缩，没有偶像剧里霸道总裁那一套一套的“英雄救美”。 八月长安很聪明，她抓住了校园生活和高中生“普通”这一特质。当然一部小说要好看，肯定不能是流水账，八月长安在普通的基础上，赋予了小说足够的戏剧性和幽默感。小说也会给读者带来言情小说小鹿乱撞的那种心动感，但这一心动是亲切的、熨帖的、似乎触手可及的，因为它是发生在你我这样的普通人之间，能给我们带来强烈的真实感。 以小说《最好的我们》为例。单看梗概，它跟现在市面上扎堆的青春校园故事似乎没太大差别。一方是学霸，一方是学渣，俩人是同桌，从相互看不顺眼到日久生情，文理分班各种纠结，学渣为了跟学霸考上同一所大学拼命学习，结果高考时学霸出了意外，或者学霸为了跟学渣同一所学校故意“失利”，两人就此分离…… 大部分故事，是按玛丽苏偶像剧或者甜宠剧的模式写的，男主角自带霸道总裁气质，如果他恰好是学霸，那么一定是雷打不动考第一，无论遇到什么事都从容淡定；而学校也好像是被《流星花园》里的英德学院“附体”了，三天两头就有各种抓马的大事发生。总之，故事的核心是男女主角轰轰烈烈一波三折的恋爱，学习主要是作为一个叙事背景。 《最好的我们》不同，它虽然讲述的是耿耿余淮“耿耿于怀”的故事，但主线仍旧是平平淡淡、波澜不惊的校园生活；耿耿余淮相互喜欢，是学习之余喜欢，而不是喜欢之余学习。小说也没有那种夸张甜腻的撒糖，哪怕俩人其实已经暗生情愫，但余淮对于耿耿依旧是“一小部分时间施以援手，大部分时间落井下石”。学生嘛，主业总归是埋头苦学。 最为关键的是，小说成功地刻画了一个有弱点的男主角。余淮虽然是学霸，但不是那种天才般的学神，稍不留神他的名次会往下掉，竞赛会落榜；余淮虽然自称“小爷”，看上去如此开朗、活泼、无所畏惧，可实际上他“不过是一个十几岁的、考不好了就会怀疑自我的少年”，他也会畏惧、会怀疑、会自卑、会逃避。 剧版《最好的我们》之所以赢得高口碑，根本在于它充分还原了小说中那一份真实与普通，还原了一个虽然闪闪发亮，但也有弱点的少年余淮。影版若想保持原著的精髓，改编也得遵循这一个大方向。 刘昊然版余淮与原著非常贴近 剧版《最好的我们》有24集，但影版只有110分钟，大概网剧3集的篇幅，这意味着影版必须大量删减。该如何删减，是影版面对的最大的挑战。 如此短的篇幅里，既要拍出平淡真实的学习日常，又要充分反映耿耿余淮的情感累积，是蛮有难度的。可惜啊，影版采取的编剧策略是最简单的那一种：删除小说中那些普通的、日常的部分，保留那些具有冲突性的情节，并予以放大。 编剧的出发点是为了保障戏剧性和可看性，只是整个故事的内核由此也转向玛丽苏偶像剧了，电影中耿耿余淮的主要任务好像是谈恋爱，到处都有宠溺的细节；两个人的情感进展神速，也有偶像剧里那种抓马型的起冲突的情节。就比如小说中，余淮的妈妈家长会后请求老师不要让余淮与耿耿同桌，耿耿也没受太大伤害，事后还偷偷向林杨打听余淮与初中同桌的故事；到了电影中，这个冲突被放大，耿耿生气暴走，直接走进有人正在打球的篮球场，余淮则在一旁大喊。 影版“加”了一些情节，非常偶像剧 也就是说，影版《最好的我们》整体气质抓马化了，甚至有那么一点点狗血气息。何蓝逗版耿耿，与谭松韵版耿耿各有千秋，但陈飞宇版的余淮，就比刘昊然版余淮逊色不少。陈飞宇也非常帅气，少年感也非常足，奈何大部分时候稍显僵硬，欠缺那么一点灵动；当然这也怪剧本，一开始没有表现出余淮的弱点，家庭变故后他突然的“堕落”也就显得欠缺说服力。 陈飞宇版余淮，少年气十足，只是演技稍稍生硬 应该说明的是，从剧本改编角度看，影版《最好的我们》并不成功，但这并不意味着电影上映后市场境遇也会不成功。影版《最好的我们》的起承转合，跟之前的《比悲伤更悲伤的故事》有点像，虽然一部是校园爱恋最终大团圆，一部以悲剧收场，但两部电影都特别适合现在以及曾经的高中女生边看边哭。《比悲伤更悲伤的故事》的目标受众，与《最好的我们》是重叠的，前者虽然口碑惨淡但票房近10亿元，影版《最好的我们》口碑是没太大指望了，祝愿它票房好运吧。 ——版权属于澎湃新闻——,232.0,9.0,89
2,2,26266919,最好的我们,0b80a1b1b97b7b61a85db88b7180f8f5,c671181674ce3bc07c977226746d7d0f,1.0,2019-06-07 15:58:11,"我来说说电影版最好的我们吧，实在没忍住好奇心，虽然提前看了一下预告就有一种毁原著的感觉，如果不是因为宿舍太热我打死都不会来看的。

一句话总结这部电影，把剧版的几个情节复制粘贴了一边（鬼，配不上复制粘贴这个词，一点都不像）你说，你改编，把它当做一个普通青春片看，我呵呵，你顶着最好的我们这个名字，顶着许多人难以忘怀的耿耿余淮，就应当负责拍出好片子，你要改编就改，问题是整个电影仿佛流水账一样，人物不立体，剧情没有冲击性，选人尤其是女主几乎完全错误。被剧版吊打，同时也毁原著……
1，耿耿考上振华完全是运气，当年中考只考了语文数学，结果你倒好什么都不交代，就说她成绩差还是考上了振华？？？这样开头就让我摸不着头脑，更别说路人了，你自己完全没有交代清楚，这是谁的锅？
2.简单一点都不像，一点都不像！！！剧版的简单（别跟我说改编，就这水准）性格单纯，喜欢韩叙，被打击之后迅速成长，而且怎么会对其他所谓的帅哥感兴趣???把她塑造成一个八卦女孩？？？？人物性格塑造真的单一，且没有厚度，没有深度，就路人甲乙丙，配角完蛋。
3不仅.简单性格不对，那将年年呢？活活演成了一个小太妹，不学无术，原来她性格中的闪光点，仗义，大大咧咧，直率坦然，整部电影全都是八卦，小太妹作风，我甚至感觉有点沙雕＋一点点陈雪君上身。
4.老师张平张峰最像 因为一个人，也因为演的是真的很好，盛淮南董力还不错毕竟没啥镜头
4.余淮……说不出哪里不对，就是好怪，原来的余淮是学霸，可是他自己学霸都是努力而来的，电影中全部都是体现，余淮好强，什么都会，学神一样？？有一点小痞子，大哥，我求你了，很多人喜欢余淮，不仅是这些，他的物理竞赛的失败，他的颓废，哪里不是生活中我们的影子，没有天分只能自己一步步走而已，他也体贴负责。
5.成年的耿耿实在是尴尬，巨尴尬，你留一个长发就是成长了？呵呵。。你长发的样子真的一点都不像耿耿，眼里没有纯真，也不可爱。谭松韵演的耿耿，工作之后依然有当初年轻时的青涩，不然路星河也不会喜欢那么多年。她 依然未经世事 哪怕她工作了，何蓝逗演的呢？你是要走成熟女性路线吗？风尘女子路线

6.感情突如其来没有铺垫，剧情没有铺垫！她们不是一见钟情，完全没有完整的故事线啊，影片刚开始多久就开始喜欢喜欢了？？？你要放糖也请你掂量掂量演员的演技，接不住剧本。


8.雨中尴尬，那个情节突然出现，是真的尴尬！
9，对勾变成了幸运符，真的好俗气
10
08年，你高一的相机[em]e400726[/em]这样，高三就变成了豪华单反？

 10.何蓝逗这个女演员我一生黑，一点都不像，你真的研究了剧本吗？你会跳起来挂余淮身上？你会作死的吼？台词输出全靠吼，差点破音？耿耿她是温柔，可爱，普普通通，但她不是一个女疯子啊，不是一个靠吼的女生，她委屈但她也会保留自己的骄傲。
最后著名的晚秋高地……你一笑我蒙了，谭松韵的笑是满足的，期待的，毫不夸张的说有层次感，你……傻笑我emm？！？？？？看到什么了你是？
  

槽点太多了，豆瓣肯定5分了会一点点降低
我真的太失望了  何蓝逗陈飞宇……
你们这部电影和胡一天的橘生淮南到时候比比谁能拿振华三部曲最差吧…… 浏览快破万了哦，下面有些评论挺让我懵逼的，大家不是一眼就看出来这部电影不好吗？？ 那我搬搬知乎上面的   这都是热评……please尊重事实哦。 如果还觉得是我们看电影人的错，原著粉剧粉的错。。那你们还记得昨天买热搜的两位吗？？      害，明明演的不好 团队的操作就挺无语de 买热搜看实时直接被嘲 我有那么一瞬间都怀疑自己是不是看得不是这一个电影…… 我只是说了实话…… 不好就是不好 不攻击两个演员本身 只是说不适合 没那么用心  编剧错也大   不好意思，何蓝逗这个女演员是真的差 人品也差 活该被黄老师怼  破两万了 豆瓣小透明谢谢大家",148.0,13.0,90
