,Unnamed: 0,电影id,电影名称,用户id,用户名,评分,评论日期,评论内容,有用数,没用数,回应数
28,28,26716348,金属之声,01a78d53b4383fa41111e07aee549c9a,660cd4eb058ff0cedb88dd966f914718,4.0,2021-05-06 21:54:52,"这是一部真正在灵魂处拷问，在生理上震撼，又在感情里安抚你的电影。  它要讲的是一个人如何面对残缺，或者更虚化地说，一个人如何面对失去。

接受还是反抗？
当一位金属音乐人失去了听力，电影两条路都给了。
这里的接受并非完全消极，反抗也并非势不两立。导演不批判谁，也不赞颂谁，好的电影把人物扔到命运里，让他们做选择，不管怎么选，都是一场前史丰富，充满说服力的奇遇。
当我们陪主角走过一段深刻而真实的路程，五官共通，心灵共振，观众会自己帮主角找到最合理的解释。
这就是导演要留给我们最终的意义，是我们在一片汪洋的感情中蒸馏结晶之后的自我解读，不知不觉印证了观看他人就是观看自己的学问。  
01 从主角鲁本失聪开始，怎么办？怎么办？一直萦绕在观众心头。
电影先给我们的，是情感抚慰。 
观众与鲁本被带到一个乐园，从这个听障人士社区开始，我们与鲁本开启听觉相融模式，一同经历一场修行。
长达几分钟，观众要忍受0字幕看手语，因为鲁本还没学会手语。好不容易等到有了字幕，又为鲁本摇摆的心智不停担心。
一方面社区生活充满爱与平和，社区的人看着鲁本，好像在耐心地等着一个相同基因细胞的融入。一方面金属之魂在隐隐发作，那个叫做人工耳蜗的东西，像遥远的繁华人间之门，在向鲁本和观众不停挥手。
要命的是，观众也说不出该留该走，如何是好？ 
如果只是同类相亲，还不足以如此纠结。
社区最大的魅力，是安静的力量。
这种力量差一点，驯服了一个来自金属的躁动的生灵。
镜头缓缓扫过，传达出绝对的平静，同学们用手语比赛，把手放在钢琴上感受音乐.....而鲁本，被社区的主人要求一个人呆在小房间里，只能在眼前的白纸上写字。
看到这里我是惊讶的，没有想到导演的解决方案竟透出一种类似于禅修的智慧。一人、一桌、一窗，你能感到鲁本把愤怒发泄在纸上，现实中越来越柔软、包容，开始交流与给予。
生理上隔绝声音，需要在心理上更大程度地感受自我，需要训练出另一种语言与世界交流，外在是手语，更重要的，是学会将五感重心转换，用另一种角度去化解，去自洽。好像僧人自苦，是为了更接近天地之灵，灵气飘渺，宁静却夯实在心田。
唯有这样，才能摒弃对声音的欲望，面对声色不慕不躁。
对于喧嚣热闹恨不得天天烈火烹油的城市生活，人类在这里能享受到的安稳平和，简直像上帝的另一种馈赠。社区的主人深谙“平静”的智慧，他像某种门派的师父一样，训练鲁本对抗浮躁与欲望的功力。 
导演想用这种近似乌托邦的柔软自在，传递对残障的另一种认识。到这里，不需要修复，因为这个乐园的人找到了完整的自我。
当你快要被社区的一切同化时，不得不承认两件事，一件是人是需要同类的，另外一件更玄妙，当平静降临在一个人身上，他可以抵挡一切灾难。
  02 社区有乐园的一面，也有局限的一面，这里有不可违背的“教义”。
那就是相信自己是完整的，听障，不用修复。这里的人对此进行近乎洗脑式的练习、确认、接受，这当然是他们生存的方式。
但对于以怀疑、愤怒、反抗为食的金属乐手，这是毁灭性的改造。
鲁本可以在这里度过美好的一生吗？可以。电影甚至安排了一位漂亮的女老师秋波暗送，总之一切生活下去的条件都具备了！
那么金属呢？一个佛系男孩如何带领乐迷燥起来？更现实的问题是，鲁本还需要金属吗？
比起听障，这才是真正的灵魂拷问！ 
然后鲁本给我们看了什么是真正的生命力，社区视为珍宝的同类与宁静，这些都是很好的，鲁本必须抛下它们，因为他心里有更好的自己。
卖了房车，植入人工耳蜗，流离失所，身无分文，孤注一掷。
在那张“修行”的圆桌前，他对社区主人说：“我在拯救我的人生。”这场对话里，接受者是生命的智慧，而反抗者，是生命的可贵。
生命的力量在于不顺从，哪怕对方是天堂；在于没有人可以告诉你对或错，哪怕你已经看似一无所有。
然而命运的玩笑还没开够。当那个令人魂牵梦绕的人工耳蜗被启动，我们和鲁本一起，听到了一种金属的声音，类似于坏掉的机器人在说话，观众马上明白，人工耳蜗带来的声音，不可能让鲁本继续追求音乐。此时此刻，宿命感扼住了观众的喉咙，这就是物理意义上“金属之声”。 
此后在巴黎，鲁本回答女友父亲，他从小失去父亲，与母亲颠沛流离。鲁本的人物线终于饱满了，幼年没有家，如今又背离同类，导演故意让鲁本孤独得那么彻底，他对金属乐迷恋也彻底与命运接轨。
某种程度上，听力是被鲁本造没的，他对金属乐的依恋，就像所有拿健康换快乐的东西一样，比如可乐，比如咖啡，比如一切上瘾的物质。
当鲁本说“我会把房车赎回来，我们过以前的生活。”，减了短发的女友犹豫而敷衍，一切尘埃都轻巧而沉重地落定了。爱情与梦想曾经给过鲁本救赎，现在他们都要离去了。
坐在巴黎街头，他取下了人工耳蜗，金属的声音消失。
教堂的尖顶像一幅画印在巴黎天空，宁静平和，冷酷俊美，连一丝轻叹也没有。
宿命刺破人们的天空，
接受是第一场修行，接受之后还敢反抗是第二场修行，至于命运给你怎样的结果，就如同他给你怎样的开头一样不可追问。
  
03 两种选择的博弈之外，电影最大的出彩之处在于声音的设计。
为了模拟听障人士通过感受震动获取声音，音效师尼古拉斯将接触式麦克风安装在鲁本嘴里，靴子里，用来捕捉不易被察觉到的细微声音。
他甚至改良出一种独特的听诊器，来捕捉身体里各种机能的声响。于是我们听到了鲁本的心跳、脉搏，与血液流过血管的动静，彻底被拉入一个听障人士的世界。
外面的声音没了，内心的声音才会凸显，这些声音向我们讲述着鲁本生命的独特与强悍。 
有时候，导演也会故意把声音放出来，鲁本第一次在社区聚餐时，餐具一直乒乒乓乓，桌上的人毫不知情，而观众已经觉得被冒犯，实在不舒服不礼貌。这种烦躁与当时餐桌上什么也听不到看不懂的鲁本心情异曲同工。同时也在提醒大家，他们可能不适合外面的世界。
而在人工耳蜗启动之后，我们更是要经受直击精神的折磨，仿佛耳朵里住了个坏掉的机器人，烦躁值与绝望感达到顶峰。
导演对于声音的巧妙安排，不仅牵动观众情绪，与人物情感融合，甚至带动剧情发展。  04 关于失去与挫折的教化，我们在学生时代的课堂上一贯是见识贝多芬口咬竹棍感受钢琴的钢铁意志，那是一个被直接提纯的概念，多少有些粗暴而强势。
到了《金属之声》这里，失去听力，是一个全新版本的体悟。在一个坚毅而伟大的身躯背后，它给了我们一个低回的，细微的，丰富的故事，它让我们身临其境体会那层层叠叠情感。
一个人失去生存技能，失去梦想，失去灵魂的一部分后，何以面对今后，课本没有说的，这里都说了。",2.0,,0
29,29,26716348,金属之声,9c30d9a8114b53edceb38972d62a96d9,f183b0c97a0e97541d1bf0d4f6857ea0,3.0,2021-05-02 20:48:05,"7
片名与剧情是反期待的吧，而且也是反高潮的叙事，反而更贴近现实。
有点类似于《NRSA》的味道，生活就是这样冗长无趣甚至沉闷，偶然有开头那样的放肆激情。
如果换成查泽雷，音乐肯定换成爵士，两个人的感情会更突出，但前面已有《爱乐之城》，也不必再重复。本片则和《漩涡俱乐部》有点相似，都有一个人美歌甜的法国女友。
父亲出场时，有点期待他把男女主分开，比如让女主有新男朋友，也许更有戏剧性，但最后鲁本只是平静地离开了她，幸好是离开了，绝对不想看到两个人继续在一起。
结尾李姐静静地看着远方，让人想起《CMBYN》结尾甜茶的“壁炉凝视”桥段，而正是这一点让人物丰满了。并且最后平静地坐在长椅上也呼应了剧中老人让他静坐。
李姐出演失聪者，安东尼出演阿兹海默症患者，两人都奉献出不错的演技，李姐也值得一座奥斯卡。 开头就是李姐特写，我想总有人会注意到，也有人注意不到胸口文身“Please kill me”，而后房车上面也有繁体的“自杀”字样。也许刚好契合重金属文化，但也和全片相衬。有人提到类似于《骑士》自我救赎，但二者内核相反，骑士最终救赎了自我，鲁本却失去了一切，只剩下混杂着尖锐噪音的耳蜗。 生活就是这么无趣，没有太多大起大落的情节，只有平淡的日子。
最后片尾曲很好听。",1.0,,0
30,30,26716348,金属之声,7e45195a4d31ae260a8300d8274fe62e,3aa075c7c976a11f3a5c2ece17540824,4.0,2021-05-01 10:11:57,一个「鼓手失聪」的故事，电影声效太有代入感，和男主一起被命运的重锤砸得措手不及，体无完肤，喜欢结局走向不是爽文，男主也没有揭竿而起，发奋图强，改写命运，走上人生巅峰，就是普通人如何磕磕绊绊慢慢扛住命运之锤的事儿。 不管是现在自嘲的“情绪稳定的成年人”，还是叶嘉莹先生说“弱德之美”，亦或者打小背的“知止而后有定，定而后能静，静而后能安，安而后能虑，虑而后能得 ”，归根结底，相信「平静」的力量。世界吵闹，都得学会“主动降噪”。,,,0
31,31,26716348,金属之声,5c9c4b82bfa462ff3f6d153526db26d1,7cc7de91ce782cd38510a2c63ca87df3,4.0,2021-04-29 19:02:52,今年奥斯卡最佳男主角的人选里，有三位令我印象深刻，除了二度问鼎的安东尼·霍普金斯和遗憾落败的“黑豹”之外，还有一位令我眼前一亮，那就是英国演员里兹·阿迈德。这位巴基斯坦裔的穆斯林演员同时也是一名说唱歌手，曾出演过《谍影重重5》和《侠盗一号》等商业大片，此次在《金属之声》里扮演一位失聪的摇滚鼓手而名声鹊起，在奥斯卡颁奖季获得不少最佳男主角的提名。无独有偶地，他这个角色和霍普金斯在《困在时间里的父亲》一样，都是有缺陷的人物，而且两部电影都采用主人公的第一人称视角，引领着观众沉浸到病患角色的内心世界，由此体验人物的焦灼不安状态与艰难的生存困境。 有别于《困在时间里的父亲》里运用扰乱时空的叙事呈现主人公记忆衰退的手法，这部《金属之声》的出色之处在于声音的设计和处理，给人耳目一新的感受。模拟主人公突然失聪后的情形，画面上突然寂静无声，只看到果汁机的转动，莲蓬头喷出的水柱落在他身上，之后画面又随着主人公转到充满声音的药店。无声和正常声交替出现的画面，暗中交代出主观和客观视点的转换，视听表现手法颇为惊艳。 之后在听障者互助社区的情节更是在声音处理上别出心裁。一屋子人坐在饭桌前凭剧烈夸张的手语和敲桌子的声音进行交流，而主人公和小男孩在金属滑梯上用敲击来感受震动的频率节奏感，他带领孩子们击鼓的一幕更是如此，透过外在的声音让观众感受角色的情绪波动变化。在刚结束不久的奥斯卡上，影片成功拿下了最佳音效奖，足以证明这种手法有其新颖的创意。  尽管片名和海报都让人误以为这是一部摇滚音乐人的传记题材，但事实上并非如此。里兹·阿迈德精彩演绎了一位意外失聪的鼓手，他从消极反抗到逐渐面对现实，最终与残疾缺陷和平共处。乍一看，像是那种身残志坚的励志题材，但事实上却走向了这种好莱坞常见类型的反面。一个音乐人失去了赖以为生的听觉，自然令人扼腕痛惜，但重点并不在男主角如何努力恢复听力的过程，而是花去大量篇幅描述他在听障者互助中心学习手语以及克服内心的骚动。由此，透露出主题：身体上的缺陷很常见，关键是勇敢接受和面对自身的缺陷，学习新的生存技能，找到新生活，而不是留恋过去。 这一点在主人公和女友的关系上得到有趣的印证。此前两人搭档巡回演出，染上吸毒的顽疾，并不时出现自残的行为，正是这场突如其来的“失聪”给两人机会重新审视这段病态的关系。结尾的反转暗示昔日反叛的富家千金女做回乖乖女，而男主角也顿然醒悟两人无法回到过去放浪形骸的日子，终于懂得和身体缺陷以及过去和解，重新迎接新的生活。从突然失聪，到植入人工耳蜗恢复听力，再到摘下耳蜗回复失聪，这种反类型的设计令影片比同类型题材的立意和表达更为深刻和耐人寻味。,,,0
32,32,26716348,金属之声,158d3296fa8fc090e0db02715cdd81e0,d966ce9ac655f43440127389171a4d5d,4.0,2021-04-28 21:23:29,片子不短有两个小时，沉下心来看，《金属之声》是一部不错的片子。能让一个健全人体会到不少听障人士的痛苦。很细腻的一部电影，有大段的默片，很考验演员的演技。中国观众如果有80％能觉得这是不错的片子。相信那些《澳门风云》《唐探》等相对较差的片子就不会动辄收获20亿的天量票房，中国的电影市场票房提高了很大，现在急需的是提高观众的欣赏水平，为好的影片买单，促进全球优秀电影的发展。,,,0
33,33,26716348,金属之声,8999dc1a25060e6f4789d39ff0078cc6,b7b5e423109fa19cd623f7b8f6d5649e,4.0,2021-04-27 01:11:21,短评字数竟然超了，只能挪到这里 今年奥斯卡的最佳音效，最佳剪辑影片，我挺喜欢的。 自我救赎的内核，虽然能猜到个大概，但还是给了我一定的惊喜。 一个摇滚鼓手突然失去了感知声音的能力，这是一个接受自己「从有到无」的过程。 机构负责人说 “我失去了家人，我失去了一切，不过让我失去这些并不是因为我聋了，而是因为我酗酒”，他们不把失聪当成一种缺陷或者疾病，于是教ruben学会和自己独处，用写字把情绪外化出来，这是救赎的第一步，即「他人介入的救赎」 影片的前半段几乎没有任何背景音，只有大自然传来的微弱的生命之音，直到ruben决定要做手术的时候，钢琴有了声音，然后调适设备后，世界变得嘈杂而又尖锐。 影片模拟失聪者手术后听到世界的声音，ruben的形容是「又高又尖」，确实如此，医生说你的耳朵功能还是失灵了，但是手术让你的大脑误以为你能听到声音，现在的声音和本来的声音不同，你要去适应它。 直到再次见到lu，他终于明白自己的生活再也回不到过去。 很喜欢结尾的处理方式，一个画面，ruben从lu家出来，街道上有一对少年为了滑板吵架，接着远处的钟声传来刺耳的声音，ruben摘下了耳朵上的设备，下一个镜头，争吵的滑板少年和好也预示着rubem与自己和解，世界一片安静，抬头看向天空，太阳依旧耀眼，这是救赎的最后一步，「自我救赎」然后影片悄然落幕。 影片名字也挺有意思的，「金属之声」一个是玩金属乐的声音，一个是失聪后装上“金属”之后的声音，当外部声音和内心之声和谐，自我也能达到和解。 突然想到ruben胸前的那个纹身“please kill me”，孤独感油然而生……,,,4
34,34,26716348,金属之声,1703752fefc61c5c99c339f6d7ca798c,30357e076587835516d3578f4d1e8704,4.0,2021-04-27 09:33:58,我的影评被删了一次，只好重新写一个吧。这个电影很好的为我们展示了听障人士的感觉。这是继《寂静之地》后，又一部以声音为观感主线的电影。拍得很有意思。       刚开始用了很多的静音和减小音量来让观众体会失聪的痛苦。作为一个美术工作者，想象一下自己瞎了。那直接就让人活不起了。那一个考音乐吃饭的人呢？他即失去了功能，也是去了工作。甚至是作为一个人的成就感和自身的价值认知，都没有了。最震撼，其实是他做完手术之后的效果。观众都以为要么好了，要么不好使。但结果却是杂音。这太痛苦了。有很多时候都不如没有。既不能恢复了回去搞音乐，也不能享受寂静。这个把身家都卖了换来的手术，感觉好像被耍了一样。    这个电影让人身临其境的感受了一次听障人士的世界。体验感满满。,,,0
