,Unnamed: 0,电影id,电影名称,用户id,用户名,评分,评论日期,评论内容,有用数,没用数,回应数
7,7,26716348,金属之声,cd2ba80848672e321de2ab6d4b53fd70,b792cf532c555a5dd3bfeb2dd36d3350,4.0,2021-04-15 00:25:07,"陈小姐：2021奥斯卡黑马佳作现身！全片读解！ 影片是在亚马逊流媒体上的线。一上来很猛喔，一场重金属音乐的现场演出，乐队一共就两个人，他们是影片的男主女角。金属乐非常复杂，分好多好多流派。短短一场戏，有几个标志性元素可能可以帮助观众迅速做一丢丢判断。他们应该属于重金属音乐中的死亡金属乐。这种音乐标志性的特点就是超高速、强有力、攻击性的鼓点，另外主唱的演唱几乎不带旋律感，而是以一种近乎咆哮的方式嘶吼。在歌词方面，死亡金属乐写的内容总是会涉及到一些极端的行为。还有，请注意，男主角最显著的正面纹身是please kill me，切一个房车里的镜头，让你注意女主角手臂上的自残痕迹，表示她有自我毁灭的倾向。点点滴滴均暗示着强烈的死亡符号。这些信息都在最短时间帮助着观众建立对人物的判断。 好的导演不是用台词叙事。好的导演就是懂得用视听语言叙事。有观影经验的观众，要习惯接收到这些信息。这又是一个新导演的处女作长片，今年的奥斯卡绝对不是小年啊，新人辈出！ 他们生活在一辆房车里，以巡游演出为生。平日里两人的闲谈话题也会时不时涉及死亡，聊了以后，有些话就会直接变成他们的歌词，soulmate，很令人羡慕。又是一站巡演，两人在做着准备工作，影片到这里，我都以为这是一支音乐题材的电影，但是很快剧情直奔主题。男主人公，鲁本，忽然失聪了，原来矛盾做在这个点上，一个鼓手失聪了。鲁本非常惶恐，他独自去药店咨询并迅速接受专业检查。女友也很崩溃，决定立刻停止巡演，把他送去一个失聪人士的互助社区。 离奥斯卡颁奖日期越来越近，所以我最近集中看了大量的奥斯卡各奖项入围影片，与上一个读解视频所推荐的《thefather》一样，这部作品也拿了6个重量级提名，我记得是最佳影片，最佳男主，最佳男配，最佳音效，最佳剪辑和最佳原创剧本。我看了以后的感觉，这是一匹十分值得期待的黑马级的作品。这个片子，男主和男配都太强了。甚至让我时不时去对标那年的《达拉斯买家俱乐部》。今年，看了《father》，原本以为安东尼爷爷的影帝已经稳了，但是鲁本，演得太好了。今年的演员奖竞争超厉害喔。而且根据经验判断，最佳男女主最后也很有可能颁给《蓝调天后》的两个黑人主演，因为奥斯卡真正的风向标——工会奖，已经揭晓喽。 乔是失聪社区的精神教父，在他的组织下，社区无偿为失聪人士提供住所，教他们手语，组织他们互助。突如其来的失聪让鲁本陷入绝望，女友为了让他安心留在社区，毅然离他而去。鲁本勉强开始了他在社区的生活，导演很有耐心地细致展现了这群弱势群体在深林中的生活内容，他们的世界虽然无声，但是他们很快乐。 一个以声音为生计的鼓手，失去了他的声音，等于失去了世界。影片经常用音效模拟出鲁本的主观听觉，让观众切身感受那种什么都听不清，仿佛被蒙在鼓里的那种感觉。这是一种忽然被全世界抛弃的感觉，鲁本很郁闷，超郁闷。剧作对主人公心理刻画的走向是合乎人之常情的，你非常能够感同身受这种突如其来的绝望。乔带鲁本来到手语学校，手语学校有个漂亮的女老师，长着一双会说话的眼睛，这个片子的演员真的都非常好。 思路那么清楚、表达也那么清晰的影片，难以相信这又是一个导演的长片处女作。导演耐心地展现鲁本在失聪后的郁闷，有些怪怪的乔，可以说是他的心灵导师。他要鲁本学着安静下来。乔在一开始就说了，这里修复的不是一个人的听力，而是一个人的心灵。影片就此构筑起了一对矛盾，也是本片深刻的主题，到了这里你看出来了吗？鲁本的进展是做在与孩子的一场对手戏上面，这里也设计得很好，闷闷的金属振动有点像鼓声，这是他第一次在这个世界为自己找到了一丝存在感。 鲁本开始渐渐与这个无声的世界交融了。他开始能坐得下来了，可以写东西了。这些人与人之间的很纯粹的、不带功利性的交流，其实是非常可贵的，非常温暖的。导演处理得也很纯粹，很节制，不煽情。乔看到鲁本的状态越来越好，提议他留在这个世界，在这里工作，在这里生活。鲁本忍不住又去网上找女友的视频，他疯狂思念女朋友，他想念外面的这个有声的世界。 让他重新听到声音，当代医学不难做到，只是需要钱。鲁本变卖了他所有的家当毅然去做了人工耳蜗的植入手术。乔对他非常失望，他拒绝再为鲁本提供帮助，把他赶出了社区。当观众第一次跟随电影声效，跟随鲁本重新获得世界的声音的时候，我也与他一样激动不已，但是他听到的始终是一个失真的世界，所有的声音都呈现出一种尖锐的金属质感。 鲁本飞到法国，找到女朋友的家。女朋友其实是富二代，不得不离开鲁本的她，回归到了布尔乔亚的生活中。当天刚好是女朋友父亲的生日party，昔日的重金属女王不再嘶吼，而是唱着忧伤的法兰西香颂，曲调与歌词都暗示了两人情感的分道扬镳。两人分手的戏也处理得隐晦而含蓄。女友的造型变了，她从前染白眉，长发及肩，手臂上遍布伤痕。如今她活脱脱适应了白富美的新角色，俏丽的短发，漂亮的眉毛，不再伤害自己，讲优雅的法语，唱香颂。他们曾经那么要好，无话不谈，空气在他们的交流时不会冷却。但现在，他们已不再是同一个世界的人，所以，一场高明的分手戏，其实不需要太多。能懂的观众可以懂。 鲁本离开了女友家，他在街上坐了下来，看到一群孩子。他开始思念失聪社区的孩子们了。影片的结尾处理得非常非常高明。教堂的钟声传来，在鲁本听来，仍是刺耳的金属之声。他终于，主动摘下人工耳蜗……世界忽然安静了。 看到这里的时候我心里其实一直在说，不能这样结束，我靠你这样结束我抽死你鸭。 影片，结束了。 眼前一黑，我又一次体验了被一脚踹下山崖的感觉。 从6个奥斯卡奖提名可以看出，这匹黑马处女作有几个显而易见的看点，也是影片极大的优点。技术层面，影片的剪辑、声效非常出色。影片的对白量不大，因为是描述一个听不见的世界，所以要靠镜头来讲故事，出色的剪辑让叙事很清晰，人物的心理变化层层递进。声效很用心，让观众能够切身体会到主人公的境遇。两个表演奖的提名是对演员的充分肯定，男主是英国演员，也是一位说唱歌手，生于1982年，毕业于牛津大学。鲁本这个角色在表演上很有难度，镜头数量多，几乎整个影片是他的独角戏，大量内心的激战，深沉内敛的情绪处理，他太棒了。男配在饰演一位古怪的心灵救赎者时，也找到了自己的方法，寥寥几场谈话戏很见角色性格，据传他自己的父母就是失聪人士，所以他流利的手语很可能源于真实生活。 这是一个牵动人心的故事，关涉弱势群体，但是，如果导演把重点做在对他们给予同情，那就真俗了。他们，不需要同情，需要同情的过得猪狗不如的是我们啊！如果，这部影片仅仅只有简单的一个鼓手失聪的故事，它是不可能拿奥斯卡最佳影片的提名的。 这部影片，之所以让我觉得是一匹黑马，是因为在一个失聪的表层故事下，我又一次看到作者探讨了困扰当代西方知识分子永恒的问题。那就是，科学技术的昌明，真的能带领人类前往更美好的家园吗？其实，这部视听语言极其朴素的作品，探讨的问题与炫目的英剧《黑镜》，和我读解过的美剧《西部世界》都是差不多的。 影片中指代科技的是现代医学，指代精神家园的是林中失聪人士的社区。现代医学，尤其是西医，哪里不好医哪里嘛，对吧，哪里坏了换哪里，几乎可以说是现代人的上帝，而科技这个“上帝”究竟会把我们带去何处？ 我生活在上海，以中国现在的国力，上海这样的国际都市，所出产的文艺作品，怎么能不去触碰人类共同的痛点命题呢？不知道托了谁的福，还真没有。只看到新外滩滨江带多漂亮，房价有多贵。 所以，难得出一两个娄烨，探讨都市现代性，不容易啊。 西方最前卫的影视作品几乎无一例外均是指向这个主题。因为对现代性的反思可以说就是西方当代哲学的核心中的核心。对于这部影片的理解，我觉得可以借用当代活着的最伟大的哲学家哈贝马斯的观点，不应过分强调技术的重要性，而应强调人与人交往的重要性。 影片中的失聪社区是一个无声的世界，但是人与人之间的交往却貌似回复到了一种前现代的纯粹和美好。然而鲁本强烈的要回归正常生活的欲望还是促使他倾家荡产拥抱了现代医学，将科技奉为上帝的他,却永失所爱。故事的走向是一种作者态度，是意识形态，是创作立场。 最后，街上的孩子指向的是人与人之间纯真的交往关系，头顶的教堂钟声指向的是精神世界，是信仰，是家园。这部作品好就好在，提出了思考，但并没有尖锐的批判性，导演只是让鲁本摘下了耳蜗，在影片的最后，重新思考他的人生抉择。 所谓“金属之声”，象征的正是这个物质世界露出来的本质材料。这个本质，真的是我们想要去往的方向吗？",13.0,2.0,4
8,8,26716348,金属之声,551c10ac750d5c66f46d3607e10d6796,b1a3103c9862c7a8586166a24f05abad,2.0,2021-07-02 05:40:36,小时候被家人保护得很好，爸妈会帮我过滤掉社会中所有的灰，让我觉得活在这世界实在太过美妙。我像是童话故事中的公主，仿佛只需要在自己糖果做成的城堡里唱唱歌、和小动物们说说话、和找到属于我的那个他就好。 也许因为一直被保护，到开始工作时才瞬间意识到父母帮我挡掉了多少的困难。 工作时不管有多拼命，等待我做的任务都只增不减。我时常在质疑自己辛苦工作是否真的有意义。遇到的客户大都只认钱，有些为了多出一丢丢的利润谎话可以信口拈来。仿佛在他们的字典里，“真”这个字可能并不存在。 不仅是在工作中，生活中同样也堆积着太多的事情需要我们做。当生活和工作同时布置了看不见底的任务时，有时会有种被命运扼住咽喉、喘不上气的感觉。当自己终于做完了大部分的着急事，终于可以喘口气时，命运有时又会蹦蹦跳跳出来向我们抛出更多的困难来作考验。 在人生路上跟命运PK时，我们似乎总是落得有些狼狈。电影《金属之声》中的主角Ruben本是一位优秀的摇滚乐队鼓手，可命运偏偏让他遇到失去听力这件不能再糟的事。也许命运就像歌者给地球丢二向箔那么随意地安排了Ruben失聪，可这给Ruben带来的是比死亡更可怕的影响：失去最爱的工作和女孩。 宋岳庭有首歌里唱到：”Life's a struggle，日子还要过“。人生路固然一直艰难，可我们还是得一点一点走下去。就算被困难绊倒、被命运”嘲弄“，我们也不能那么轻易认输。也许在我们放手一搏后，困难就会变得越来越小。也许在未来的某一天，我们真的能过上自己想要的那种生活。 *电影选取的题材很特别，但情节被呈现得太过平缓，看电影时有些昏昏欲睡。遇见这种设定很棒但拍摄得很一般的电影总会尤为生气，真的是浪费了精彩的故事。  **我的微博（aka爱读书的丸子）上有更多电影/电视剧/书籍推荐，欢迎大家关注！ https://weibo.com/u/3179898575,1.0,1.0,0
9,9,26716348,金属之声,fd9982d111f4b1ff47dada8d0aa44c13,7020fcb4b8bb37024ff33541e27e6b5d,,2020-12-06 01:29:15,Ruben与自己失聪的妥协，是整部电影的动线。旁听侧敲中，得知Ruben和母亲辗转于美国各地长大，和同样被单亲的Lou相依为命，两人曾一起度过人生的灰暗时光。在一切朝光明图景发展之时，Ruben的突然失聪，让一切原本朝前的事物止步。两人也不得已被迫做离别的抉择—Ruben住进聋人疗养院，Lou回法国找自己的父亲。与外界隔绝的Ruben逐渐学会适应“不健全人”的生活，Lou则在“健全人”的生活里面逐渐起步。当聋人教师Diane的角色出现，以及Ruben和Diane的互动，还以为故事会以两人圆满为结束。实则不然，导演/编剧将所有电影时长，用来描述“不健全”的Ruben如何与自己妥协，在费进钱财做完手术戴上助听器之后，如何亲手将其摘下。 影片前部分，Ruben和Lou说，如果她死了，他会将她的骨灰混进刺青的墨中，再用这些墨在他的后背刻一个小丑。影片结束时，Ruben赤裸的背上多了一个小丑，离开Lou在法国的家。猜测Ruben在来法国之前，已经知道这是和Lou的告别。这种别离，是一种瘾的戒断。越战失聪老兵向Ruben解释他执意卖掉房车换取手术费的意念，像是一种瘾在牵绊着。故事折叠起来比对，似乎是在描述当我们习惯了一种状态，或呆在一个安全区域过久之后，我们很难和这种成瘾的状态割舍。 影片里面，导演/编剧将Ruben失用言语的次数，侧面反映Ruben在疗养院的状态。Ruben后来已鲜少使用言语，和身边的伙伴也相处融洽。 老兵无法接受Ruben做完手术继续呆在疗养院，正是由于Ruben无法完全接受自己的“不健全”，而疗养院的其他聋人都认为自己是“健全的”，他的“不健全”会使疗养院失衡，因此拒绝了他的要求。Ruben意识到自己费尽心力回到“健全”社会的时候，属于他的“健全”社会已经不再。导演用一个美好、温暖的生日聚会，去唤醒Ruben内心对“健全社会”的认知。生日聚会上宾朋满座，音乐美酒相伴，宾客之间交际性往来好不热闹；聋人的聚会里手舞足蹈拍桌子，是一片真诚大笑的和谐景象。此两景比较，“健全人的聚会”与“不健全人的聚会”，又有何不同？ 当巴黎街上的钟声敲响，一片欣欣然的早晨图景中，Ruben摘下了助听器。,8.0,,1
10,10,26716348,金属之声,6976170bb1cc636fd2801293bbcdeb42,20c55c4c3760e6f8850dca627f1b8fed,5.0,2021-09-21 09:34:21,大量引入的第一视角视听感受，使人代入性极强，仿佛身临其境，看着难以置信的突聋降临之始，他暴躁的反抗以失败告终，又在经历令人心碎的离别后，日渐温和地走入友爱的听障社区，再到为了爱情孤注一掷接受手术，却发现正常的生活已经全是奢望，世界尖锐嘈杂，美妙的歌声也变得刺耳，最终不堪其扰，拔掉人造耳蜗，开始主动接受绝对的安宁。自始至终，我无所选择，内心备受冲击，与角色一同揪心、窒息、绝望。 恍然意识到，哪怕仅仅是“正常”的身体和生活，都是一种莫大的恩赐。 突如其来的残缺实在太残忍，最难的是如何接受无法失而复得的人生。不止是听力，人生还充斥着各式各样珍贵的逝去，在无法实现失而复得的理想之际，学会和自己讲和才是万应之道。既然无法再选择廉价的幸福，那就接受高贵的苦难吧。 当然，我也知道远远没有说起来这么简单，轻飘飘的“接受”二字后，有多少次崩溃的发问“为什么是我而不是别人”“为什么我偏偏这么不幸”。对于没有信仰的我们而言，这个问题仍然似乎难以回答，处境也难以接受。 影片里用听障社区来回答了这样一个问题。社区的理念很有意思，也有普适性。困境无时且无处不在，不要把失去当成缺陷，要视其为生命不同阶段的新体验。 推之四海，或许，以相同的信念构筑起牢固的信任，围绕以充沛的集体友爱与支持，再辅之以自己葆有的对生活的热爱与敏感，破局会变得容易许多。,1.0,,0
11,11,26716348,金属之声,5d9adcb77273cf68eb60eb5a533cbf52,1fc712e414ebfcc6269191a6d5b9ac1c,4.0,2021-03-28 21:32:13,影片的最后，鲁本摘下帽子，取下了助听器，一瞬间，整个世界又重归寂静。不远处直插云霄的教堂尖顶，两个学者玩滑板的小男孩，钻出葱郁树叶的金色阳光，一切都还是原来的模样。 这不是一部典型的励志片，甚至算不上是一部励志片。 男主角鲁本，一个重金属摇滚乐队的鼓手，偶然发现自己的听觉与这个世界已经开始割裂。只剩下一两成听力的诊断结果，无疑是个晴天霹雳，砸向了这个普通摇滚小子本还算平稳的生活。一番挣扎后，鲁本与女朋友开房车四处巡演的计划被中止，而他自己去了一个经纪人帮忙介绍的聋哑人社区，并在那里学习聋哑人的生活。 金属之声，无疑是个具有很强迷惑性的片名。除去开头的重金属摇滚现场表演之外，全片与摇滚乐剩下的联系寥寥无几。但回头来再看，男主身上的一些特质倒是与金属或金属乐有几分相像之处。 硬朗，是男主给我最直接最强烈的感受，如开头的架子鼓演奏一样，铿锵有力，干脆利落。得知自己听力受损的消息，他尽力克制自己的情绪，单刀直入地询问医生有没有治疗方法。得知诊断结果后，他又掉过头来宽慰伤心焦虑的女朋友，并盘算着继续巡回演出的计划赚钱治病。他不愿意因为失聪这道坎放弃现在拥有的一切，但在别人面前，尤其是在女友面前，他必须这样表现得无所畏惧。 但硬朗之余，他不免在噩耗的作用下渐渐失去理智，变得横冲直撞。餐厅里的电话独白令人印象深刻。面对电话里另一头的经纪人，鲁本劈头盖脸给了一通好似漫不经心又略带夸张的解释。他听不见，仿佛与世隔绝，那一通电话，他是在有意识地发泄，去向世界表达一个“失聪者”的不满与沮丧。虽无法在台上敲响重金属乐，鲁本依然可以自己发声，讽刺的是，和在舞台上一样，他听不清他观众的回应，而仅仅是被一片嘈杂声包裹。 鲁本需要改变。 但想要改变，从来都不容易。 相比于用工整的手法拉出一个完整的故事，影片更倾向于用氛围的营造去感染观众，让观众掉落到人物的情绪之中。音效，承担了主要任务。 从片头开始，电影便交替给出正常人听到的与听力受损的鲁本听到的这两种声音。后者嘈杂的声音如同飞机起飞时的轰鸣声，令人耳膜不适，一度使我被迫摘下耳机缓一缓。但正是这强烈的“噪声”，使观众代入到了鲁本的世界中，去体会他的无助。 鲁本被迫来到了聋哑人社区。表面上，社区想要帮助鲁本重新振作起来积极面对生活，但实际上，它只是想要给他灌输社区理念将其同化罢了。在逐渐适应的过程中，鲁本也会被社区的乐观精神所感染。但在我看来，他的内心还是孤独的。所谓的把自己当作正常人来对待，只不过是一种自欺欺人的托辞，让鲁本在小的群体里自我麻痹。 这是一个被动接受的过程，短暂有效但根基不牢。被关在社区里的鲁本，心心念念的依然是他和女朋友许下的诺言，卖车攒钱冲出社区去买助听装置。影片中两种声音的交替，更像是一种被迫接受和主动接受的对立。真实世界里的声音，清晰明了，却也无法回避。它会在不知不觉中包裹住你，逼迫你去接受。鲁本铁下心来给自己添置了助听装置，耳边却还是杂乱不堪的噪音。 郁闷了大半部片子的鲁本，缘何如此？医生的指导，女友的劝说，社区工作者的要求，不论是谁，他们一直把鲁本当作破旧的机器。医生想给它添上润滑油争取重新运转，女友想给它找个好的垃圾场作别，社区工作者想直接让它报销回炉重塑，而鲁本自己，也在别人的“声音”下逐渐迷失自己，他牢记医生提到的助听装置，聆听社区工作者的教导，却也在一步步失去主动与世界“沟通”的能力。 做好手术的鲁本来到了女朋友的家中，适逢他女友父亲的生日宴会，席上一首父女合唱令人心碎。饰演鲁本的里兹•阿迈德贡献了完美的表演，哭戏层次感十足，他逐渐开始思考，与这个世界开始对接。与这个世界沟通，只能通过声音吗？ 影片的最后，鲁本摘下了助听装置，他选择以一种沉默的姿态，主动去和这个世界交谈比画。与其说鲁本最终达成了与自己内心的和解，毋宁说是他在痛苦挣扎后做出了另一种选择。 “声音”不仅仅是用分贝衡量的听觉印象，更是我们的内心与外界沟通的桥梁，桥梁可以塌，但我们要保住我们过河的信念与希望。,5.0,1.0,0
