,Unnamed: 0,电影id,电影名称,用户id,用户名,评分,评论日期,评论内容,有用数,没用数,回应数
14,14,26715617,双生,7e81287895b6868766106011238d5d87,a4b58169ce1aee6dbc3abb89306a9074,3.0,2019-05-20 12:43:02,"有人流转千回才换来一个机会，

有人按部就班忽天降机缘，

人生际遇却妙不可言。



刘昊然的出道，确实算是顺风顺水没有一点的波折。不像是与他亲密搭档的王宝强，寒门农家出身，少小离家，从少林寺孑然一身，义无反顾的踏入北漂之路。本以为凭借着一身功夫能够有所作为。就是没想到生活给了他一个大大的惊喜。没资历，没学历，又是“泥腿子”出身，王宝强的未来怎么看都是迷茫一片。每天蹲守在电影学院的门口。一个跑龙套的机会对他就是莫大的鼓励。这也许就是他证明自己的机会。功夫不负有心人。 2003年，王宝强被导演李扬挑中，主演独立电影《盲井》， 这部电影改变了王宝强在演艺圈的生涯，让他从一个武行获得金马奖最佳新人、法国第五届杜威尔电影节“最佳男主演奖”、第四十届台湾电影金马奖“最佳新人奖”以及第二届曼谷国际电影节“最佳男演员奖”。 这些耀眼的成就就是他成功最大的回报。

对此，刘昊然的出道怎么看都像是幸运之子受到天的眷顾一般，作为没有经过任何表演培训的高中生，受邀参演《北京爱情故事》，当时的陈思诚感言：当自己看到刘昊然的资料时，感觉像是“踏破铁鞋无觅处”，当即敲定刘昊然出演“宋歌”。刘昊然外形帅气腼腆，因为影片的题材和故事完美契合，也在影片中向观众证明了他极具表演天赋的实力。他的笑容，他的恼怒，他的害羞，他的单纯，影片中真实且真挚的表演，留给观众很深的印象。

后来的际遇是开挂一般，加入了陈思诚的团队《唐人街探案》。和此时已成为演员大佬的王宝强做搭档。正是这段经历让他从一个小鲜肉成为真正正正的演员。彻底去掉青涩与稚嫩。

“秦风”这个角色让他演技的可塑性，单纯、正义、害羞加一点口吃，这些角色特点被刘昊然诠释得灵动而富有生气，和王宝强的搞笑对戏也十分放松，松弛有度，给人印象深刻。

从《北京爱情故事》，到《唐人街探案》。再到《最好的我们》、《妖猫传》。这些演艺生涯丰富了他的演技，也开阔了他的视界，有时也会让人忽略他的绝世美颜，和青涩稚嫩的小鲜肉形象。后来更是被选为，具有潜力的十大青年演员之一。

颜值与演技双在线，还特认真努力的小年青，不得不受关注。

可是今天就不得不说，刘昊然“被拍”了一部真真正正的“烂片”。为什么会这样说呢？根据这部电影导演金振成所说。原版的《双生》讲述的是一对同卵双讲述的是一对同卵双胞胎男孩认识了一对同卵双胞胎女孩的故事，而李品也在那次坠楼事件中身亡了,活下来的是另外一个双胞胎。而电影版的双生，将双胞胎剪辑成里一个人（刘昊然出演的角色），那么这部电影的基本设定大概已经完全被打破，而变成了另外一部电影。

我们首先说一下这部电影的剧情是怎样？

留着一头符合艺术家身份的长发飘飘飘泡面头的刘昊然，找到了一份月薪十万的工作，去一栋豪宅为一个女孩要画肖像（卧槽！画家这么能挣钱吗？一副画十万，想到小编累死累活月月吃土忍不住泪流满面）。

豪宅里边的魔鬼女管家，一副性冷淡的样子，见谁都臭着一张脸，仿佛谁欠了 她一屁股帐似的。对刘昊然是各种不满，各种挑剔，果然在鸡蛋里挑出了骨头，嚼觉咬碎。

然后一个坐着轮椅美仑美奂，仿佛仙女一般到女猪脚出现，叫涛，两人见面火花炸裂，一个美的爆炸，一个帅到爆炸，两人一见面发生了化学反应。两人一见钟情，千百轮回才换的一世回眸，吧啦吧啦一通说话。（让我们忘了画画这件事）。

一番坦诚相见，进行了非常友好的访问交谈，刘昊然得知女主家庭的一般情况，还知道有个姐姐叫烙，但是刘昊然发现每次提到女主的姐姐女主就会有一种诡异的表情。不过这些都不是事儿，然后刘昊然在这个别墅里住下。

但是总是会回忆一些美好的事。主要表现在她的轮椅很奇怪，俩人聊着聊着天突然轮椅就会四处乱跑，他晚上睡觉的时候房门会被打开，床铺上会捡到长头发丝，总之种种迹象吧，他觉得女主有双重人格，另一个人格是他姐，变成她姐的时候就会画画啊梦游之类的。

但是事实却不是如此，女主的确有个姐姐，就在轮椅后面的那个空间里面，是另一个黑化的陈都灵，妆容也非常漂亮。两个人因为要做分离手术，但却只有一个心脏，这意味着需要有一个人放弃生命。这个抉择交给刘昊然手里，刘昊然喜欢谁谁活着，颇为无辜的刘昊然，在不知情的情况下决定了一个人的生死，但也实话实说，喜欢非常柔弱的陈都灵，然后就没有然后了。一个女主活着另一个死了，两个人当然在一起了。

正如导演所说，电影在剧情衔接上出现了一些问题，剪辑师以主线强行拼图组装故事。

电影上映两天，《双生》豆瓣评分3.9分，好于“4%悬疑片”和“2%爱情片”，打一星、二星的观众超过了78%。


就这部分观众里面，还有不少是为了刘昊然多加了感情分的，某位网友就说“这部电影如果不是刘昊然演的，将被我激情辱骂三分钟”。

还有观众为“昊然弟弟”可惜，认为这部影片拉低了他的作品在豆瓣的平均分。

此外，大概就像一位网友说的“刘昊然本人看了都尴尬到抬不起头来的电影”。

人在江湖身不由己。

作为普通观众确实没想到在影视行业里居然出现如此境况，一部好好的电影作品，因为制片方的胡搞瞎弄拖延资金，竟然这样一部好好的电影剪辑的乱七八糟。

说实话两个演员的演技在线，不过剧情，构图方面差强人意，我相信在演员接受剧本的时候本不会这样，而是后期的剪辑所致，故事是一个好的故事，演员也是演技在线，一把好牌硬是打的稀巴烂，小编也是呵呵了。

根据导演导据说也非常期待，原版的《双生》是什么样的。

【完】

PS:这篇文章基于导演对制片方控诉所作，《双生》这部电影究竟如何谁又能说得清呢！",9.0,1.0,1
15,15,26715617,双生,97e094b8257cdb1cbeb520893a260109,27674d77411d0d1a443d7300c1eb89fc,,2020-04-04 06:54:42,这部根据韩国电影翻拍，加上悬疑成分，总体上给人耳目一新的感觉。作为翻拍剧集来说是最容易让观众对此诟病的，因为人们总是下意识与原作品比较，演员们想要超越并让人记忆深刻这本就是难上加难的事情。为此制作组请来了更好的翻译与导演就影片的细节进行讨论与研磨，并进行了大量的补拍和重新剪辑，这一来一去又花费了三年的时间。被问及为何会做出如此耗时耗力的决定，导演表示拍电影要先过自己这一关，再拿去给观众看。,3.0,,0
16,16,26715617,双生,b2cbf2edecb717a7b594b271fd74d8b1,49d09fef36a41e6937643fce7d251f03,3.0,2019-06-24 23:35:53,三星是因为心疼我昊然迪迪… 求求某些投资方不要乱选人，昊然迪迪不要再接这种莫名其妙的东西了。这部电影绝逼是他整个演绎生涯的耻辱，什么鬼剧情烂剪辑，毫无逻辑可言，天啊，辣眼睛。 女主全程毫无演技，昊然迪迪脸上全是疲惫，真的看到一半忍不住狂笑，什么鬼东西，还上影院😂😂😂 算了算了，就当我看了个昊然弟弟的PPT吧😂 刘昊然，我告诉你，你不许再接这种沙雕电影，不然就算是你也不买账了，哼！,1.0,1.0,0
17,17,26715617,双生,fc5e57a95a4138b419391409a006ce9f,cffa0f9a67fbce54aa6f65c9fde5a00a,2.0,2019-06-16 18:13:16,第一次写点啥。 这几个星期昊然弟弟（侄侄）圈粉了，收看他全部作品和一些综艺节目，大晚上居然在油管上看到了这部悄默生息电影，狂喜。让老公先睡，我接着熬夜看完电影。每看十分钟，都忍不住要拿手机翻看豆瓣，但咬牙忍住了，怕错过想象中的伏笔和不存在的反转剧情。结果，结果， sh*t！！！实在想不通为毛昊然弟弟如此糟蹋自己，急急忙忙看了豆瓣，才明白个中缘由。 昊然弟弟是我见过最帅气阳光的小眼睛男生。我们正在努力生宝宝，希望宝宝将来如果是男生的话，也会是个漂亮小眼睛男生（我老公小眼睛😏）余淮的角色非常适合他，温暖阳光。看见他接了耿耿最后一通电话，在医院抱头痛苦的时候，真心心疼在他还很稚嫩的时候生活给了余淮太多沉重的包袱。他那是应该觉得这么些年的沉重负担有委屈有心酸有不得已有孤单有无助，但同时也是感到幸福的，因为有耿耿依然在，终于不再“耿耿于怀”了。我们普通人谁不是负重佝偻前行，咬牙尽量让背脊挺直一点儿呢？但最后他们在晚秋高地再次重逢并决定携手共度一生时，他的笑容让我心里如释重负，暖暖的，毕竟这也是我们对生活的期待。 琅琊榜2里面，平旌就像当年金陵城里明亮如火的少年，虽然他和苏哥哥都经历了人生从明亮到晦暗再到明亮的过程，幸运的是，他比苏哥哥的生活好幸福很多。尤其是后期他表现出了虽然是逼不得已急急忙忙长大的，但他继承父亲和哥哥果敢，睿智和胸怀气度！ 在诸多角色中，我还是偏爱余淮，也许因为“最好的我们”让我想起了似乎快要忘记了高中同学老师和那些迷茫苦涩高中时光。幸而，他们虽然曾经走失过，但最终因为爱找到彼此，并终生不再放手！ 春夏秋冬，朝朝暮暮，因为有你，我才一直是最好的我，陪着最好的你！,2.0,,0
18,18,26715617,双生,b02afd24bb71136ac1ef99872b251b96,58a6f11575c43f869d9c4e11951d203d,1.0,2019-06-10 23:46:48,"不论片子原版是怎样 只论给观众呈现出来的电影
这简直是侮辱观众智商
昊然选择时候简直是渣男金句
因为妹妹没有姐姐坚强而选择妹妹
我怎么看都是嫌弃姐姐没长起来
最后选择无感情基础的妹妹而放弃了有着共同爱好聊的来的姐姐
？？？
真的恶心到我了 看妹妹的状态并不单纯无比姐姐也不霸道凌人 选择过后妹妹一脸清纯无辜简直傻白甜一只呀 这电影不仅烂还恶心人",3.0,,5
19,19,26715617,双生,94454cddb00f5dbd219d0bf4a3495946,1dc784d4152692817fce9da3428bcdd6,2.0,2021-06-22 09:28:03,该片讲述了艺术学校的学生李品找到了一份兼职工作，为女孩涛画肖像画，来到了一处偏僻的林中豪宅，期间发生了一系列诡异事件的故事。   李品是个画家。突然接到了一单生意。去别墅为一个女孩画肖像。一个月十万块。   李品来到一个类似于宫殿的大房子里，里面有各色各样的名画。房子里的女管家贞姨接待了李品，并且帮他理了长发，换了干净的衣服。一个原来留着长发，看上去有些邋遢的艺术学生摇身一变成为了一个秀气的文艺男生。  贞姨对李品约法三章，不能和外界联系，不能说出房子里的事情，只能手机短信联系。当李品见到房子里的女主人之后，她是一个秀气的女生叫做涛，但却坐在轮椅上，而且叫李品为路海，说他是交往一年多的男友。  面对面画肖像，免不了沟通。但是两人沟通及其不顺利。要不就是涛闭口不谈，要不就是被贞姨打断。晚上，路海还是惯例跟薇薇聊天。两人还约定好一起去巴黎。涛透入自己很想去巴黎， 随后路海无意中偷听到了贞姨跟外人的对话。涛一个月之内就要做手术。 晚上，路海惯例跟薇薇聊天，薇薇既然提到了贞姨。她怎么会知道？她肯定就在别墅里 。由于经常听到一些怪异的声音。路海很想逃离这个别墅。  在房间的挂画上有好多两个女孩的合影。涛告诉路海，自己有个双胞胎姐姐。叫做 烙。 烙无论是钢琴还是画画都比自己厉害，但是在一个车祸中跟自己父母一起身亡。这是路海知道涛的父亲是一名知名画家，恰好是自己的偶像。随既决定坚持到一个月结束。  晚上，涛的手机不见了。白天两人画画的时候吵了一架。都怀疑是贞姨，但又不好明说。 晚上，路海依旧再跟薇薇聊天。但是涛已经没有手机了。早上醒来，路海的画册多出来一页。看笔迹还是烙的。这时候迎来了剧情第二个拐点，路海在给涛画肖像的时候，薇薇发来信息，但是此时贞姨涛都在面前。这就说明薇薇另有其人，及有可能是烙。把画放在画册里的也是她。 晚上，路海偷了贞姨的钥匙打算找遍别墅把烙找出来。但被贞姨发现 还挨了顿骂。 白天谜底揭晓。烙从轮椅另一边出来，原来涛与烙是连体双胞胎。两个人小时候玩捉迷藏就吓到了一个小朋友，导致摔下楼梯身亡。姐姐因为疾病，没有长得妹妹那么高，手部皮肤也发生病变。所以她不敢出现在李品面前，但她多次深夜探访熟睡中的李品 ，直藏在轮椅后面的暗箱里。 现在距离切割手术只剩下一个月。心脏只有一个，两姐妹决定让路海选择跟谁在一起，谁就可以活下来。  而路海选择了涛，理由是涛没有烙坚强，所以想留在涛的身边保持她，明明和烙在一起网恋多时，却选择了见面没有多久的涛。理由是保护弱者，这个选择有些太迁强。 在姐姐接受不了将要失去爱情和生命时，情绪失控，用轮椅跟涛同归于尽。被路海阻止 然后轮椅把路海撞下楼梯，这一幕简直跟小时候一模一样。路海还活着，和涛顺利在一起，而烙成为了他们的牺牲品。,,,0
20,20,26715617,双生,9c99bd454fc0ab43aec224496387fd07,6655969d4526a28990cff61a1851a71d,1.0,2020-12-02 17:51:53,和我妈一起去看的 没什么想看的电影因为刘昊然选了这个看 尴尬得我如坐针毡如芒刺背如鲠在喉 简直要用脚趾抠出一座城堡 故弄玄虚 整得像个恐怖片  狗血到我第一次明白什么叫做烂片 剪成这样不管你本来想表达什么对得起买票去电影院原速看完的观众吗  如果不是粉丝不建议看 我不是粉丝 看这个之前没看过刘昊然演的任何一个角色 但是这个电影让我对他费心营销的一点点少的可怜的滤镜彻底破碎,,,0
21,21,26715617,双生,1606980e5bb72a2e4b36b60279a0abe8,f306be617ffb9d30cf6a6964ce332550,3.0,2020-11-23 09:05:58,今天看了《双生》，我很喜欢这一部电影。更准确的来说我喜欢这种风格。可惜的是，他剪辑有点问题。不明白为什么上映时影片才86分钟。是我看过时长最短的电影了 我觉得电影拍的非常好。这个伏笔埋得非常的深刻。比如那些儿时的回忆。涛和烙的妈妈不让她们照镜子。因为她们是连体婴。她妈妈怕吓到她们。 以及那些，涛为什么一直坐在轮椅上？为什么有时轮椅会失控？烙又在哪里？他们要做什么手术？ 路海又是谁？李品又是谁？ 难道我以为是讲一个人格分裂的故事 结果是讲一个连体婴儿的故事 涛一直坐在轮椅上，因为她们是连体婴，那个轮椅是相连的。而烙一直藏在轮椅的后面。 她们的手术，是分离手术。 可是只有一个心脏，两个人只能活一个。 在我的猜测，李品和路海应该是两个人。 因为影片中出现这样一幕。 刘浩然打字的时候，有一幕是用九键，有一幕用26键。 这可能暗示刘昊然演绎的角色可能也是两个人 有一个是摔死的。一个活了下来。 不知道为什么剪辑最后会剪成一个了 影片的前半段非常的好，各个伏笔埋得很好 但后面感觉看的不怎么懂。也有许多伏笔没怎么揭开。比如李品和路海 我看了导演的微博。这个作品失踪了一段时间。被制片人弄走了还拉黑了导演。等到上映时，导演也表示大吃一惊可惜影片中有些内容都被删掉了。只剩下了这86分钟。 如果剪辑时没有出现这些问题，我相信是个不错的电影。 涛和烙，两个角色。分的非常明显。觉得陈都灵演的很不错。 刘昊然演的也很好。,,,0
22,22,26715617,双生,a5cdf7dd17435e95c2efae3d629d31eb,b3ee797d46ffae472a013e38de225b18,2.0,2020-08-03 13:42:58,"先说说剧情吧，其实没什么剧情，也没什么情节，只有很刻意烘托的气氛。个人感觉，要是女主是个双重人格，还能多少挽回点电影的评分。可能是我看的不仔细，不过我还是想知道，陆海是谁？李品又是谁？为什么涛和贞姨会有矛盾？电影的细节交代的不清楚。
    陈都灵，乍一看，确实很清纯，通过这部电影，我觉得，也就只有清纯了。刘昊然，其实还是不错的，演技也还好。
    电影太一般。",,,0
23,23,26715617,双生,937a020c971b2f1545438d9e0c67ccb5,d96d877dbe3f078e881dec8345d1ad6b,,2020-05-24 14:42:44,"本来是陪喜欢刘昊然的小姐妹补这个电影，看完以后我脑袋里满脑袋的问号。不为别的，只为最后男主的选择。

我最大的槽点就是晚上梦里和男主卿卿我我的是姐姐，和男主在网上聊了那么久的女网友也是男主一开始喜欢的，是姐姐。而且姐姐喜欢的是男主本身，李品。但是妹妹只是把男主当成了路海。而且男主明显也知道这一点....就好比你和一个人谈恋爱她一辈子都在叫她初恋的名字，完了你还说没事我会一辈子陪着你？？？？选择妹妹的理由居然还是：你妹妹没有你坚强。？？？？姐姐不可怜吗？一辈子都躲在乌龟壳里，啥都是妹妹先看，都没出来过。养分也是妹妹有的多。我真的太迷惑了。  另外，姐姐是真的好可怜....太卑微了。",,,0
24,24,26715617,双生,270b5b1695cfa9979e0c1c44c279c092,582aa307b136c9bfbc78c169348185ab,4.0,2020-03-24 23:48:41,"与你初时在《北爱》，那时你青涩懵懂，仿佛就是你的样子。《真男》里让我见证了你的成年礼，你是如此坚毅。考进“中戏”，让我对你刮目相看，因为我觉得中戏培养的大多数都是演员，真真正、踏踏实实演戏钻研的演员，也希望在这里，你可以度过自己独一无二的大学生活。让我吃惊的是《唐探》中的秦风，你真正意义上的诠释一个角色，跟剧里其他演员相比，并不逊色。让大家着迷的非《最我》中的余淮莫属，剧本真切踏实，而你的诠释更有代入感。

　　在《双生》拍摄之前，我常常在想，你的第一部主演的作品会是什么类型？一如既往的清新好感风还是勇于挑战？作为一名事业粉，很开心看到你接了这样一部戏。也许这种题材，在国内并不占据优势，但是它对你的挑战绝对是巨大的。我相信，你可以从中学习很多，我也相信，你会给我们惊喜！就像你每次在荧幕上的出现，都会让我觉得你在进步！也许会有不足，也有会有遗憾，但你仍在成长，欣喜每次在荧幕上见到你，都是更优秀的你！",1.0,,0
25,25,26715617,双生,14dea52ddea585fa650b20af6a9a78dc,e1718afa1ce2c553f547495df49999de,,2020-02-22 14:41:46,一段青春的邂逅。         18岁的刘昊然在这部电影中与饰演女主角的陈都灵首次开展了一场悬疑暗黑系的爱情故事。       整部电影看后感觉是打着青春片的名号，可双生却又走着与青春片不一样的套路，突破国产校园情感励志的枷锁，特立独行的走起悬疑道路。在电影最后的结尾个人认为有些交代的仓促。       其实作为翻拍剧集来说是最容易让观众对此诟病的，因为人们总是下意识与原作品比较，演员们想要超越并让人记忆深刻这本就是难上加难的事情。这部电影也因为禁韩令影响，上映时间也是一推再推。 个人还是认为影片的画面感还是有的，就是感觉有的地方给人结局有些仓促，画风突变,4.0,,0
26,26,26715617,双生,189ab785fe9bb7bff3c326d3799a6244,87e5ea5325c0142f7a22a288cd863ad3,3.0,2020-02-15 16:33:42,陈都灵和刘昊然的无敌颜值组合，满屏都是青春的气息。故事的题材很新颖，既有青春片的唯美，也有悬疑片的神秘，整体还不错，陈都灵的角色暗藏玄机呦，就先不做剧透了，大家自己感受吧[好爱哦] “希望大家的每一次启程 都是去见喜欢的人”人生只要两次幸运就好 一次遇见你 一次走到底.年轻人得选择不要给未来留下遗憾,,,0
