,Unnamed: 0,电影id,电影名称,用户id,用户名,评分,评论日期,评论内容,有用数,没用数,回应数
28,28,27193043,一条狗的回家路,2ca646e4832593c101d00c696ac03342,639c238028ca7a3d2d6efd459f1b170c,3.0,2020-01-08 20:22:45,"“你知道我在寻找你吗？跨越了千山万水，放弃了可以停靠的港湾，心里只有你。”狗狗大概是这个世界上最能与人心意相通的动物了，看完电影后，我觉得这是一部很温馨很治愈的电影，适合家人、朋友一同观看。   影片中的贝拉让我不禁想起了以前看过的《忠犬八公》，八公是一条秋田犬。虽然它们一个是踏上回家之路寻找主人，一个是等待守候主人回家，但它们都是忠诚、有爱的狗狗，一切都是因为爱。
贝拉的勇敢坚持、不离不弃、不畏艰险令我感动。在成长和学习的过程中，我们也难免会遇到这样那样的困难，我们应该像贝拉那样，克服困难，内心坚定，勇敢地去追逐自己的梦想。",,,0
29,29,27193043,一条狗的回家路,b82a3a060518c02f58afe8098aa1b989,7fce128995c5b962979af1246a0318a7,4.0,2019-12-09 15:58:32,小流浪狗被主人带回家养，后来无奈被送走后，开始了慢慢回家路，跟流浪狗群学会找吃的，和大猫咪（美洲狮）相伴，救了雪崩滑雪者，被另外两个滑雪者短暂养着，被流浪汉困住跟他作伴，被路过小孩解救，一路跑回家，被车撞到腿瘸，最终找到主人，看她瘸着跑向主人那段有点泪目，和大猫咪的日常也是满满爱意，从照顾小猫咪到被大猫咪照顾，那种相依为命的陪伴的感觉真好,,,0
30,30,27193043,一条狗的回家路,b38fac2fee6285145c40094139d6d062,75fe2bae8013252a8129a1550c3cd0e8,5.0,2019-10-22 06:58:55,最后的那一幕场景，我直接泪崩，眼泪直接噼里啪啦、稀里哗啦地往下掉...最后贝拉找到了自己的卢卡斯，找到了属于自己的主人，很感人。    无法想象，一条狗撑起了整个一部电影。    中间的情节中，我不知道贝拉走过了哪里，只知道他走过了四百英里的道路。后来看简介说：他翻过雪山和草原，沿着落基山脉，跨越危机四伏的科罗拉多荒野，毅然踏上了未知而艰险的，长达四百英里的冒险归家路程。    一步一个脚印，只为了回到属于自己的地方。           贝拉不知道，其实卢卡斯只是为了贝拉不被坏人安乐死，所以才把贝拉暂时地送走，贝拉那样努力，一步一个脚印地踏过这些土地，踏过雪山，度过两个寒冷的冬天，养大了一直猫豹，抢了很多的事物，陪伴了一个流浪汉，这个流浪汉原本把小狗狗拴在一条链子上面，但是后来他在临死前，他把小狗狗贝拉拴在了一根铁链子上，不让他逃离，贝拉差一点点就死了，我真的很慌，我怕他就此死在了河边，看着汩汩流动的水花，看着水花里面跳动的小鱼，但是无能为力，什么也做不了。    贝拉还救了一个雪崩时被压到的人物，和他自己的狗狗一起，原来狗狗真的可以救人类，这样一想，我觉得真的很感动。    贝拉一点一滴地走着自己的道路，Never give up.    所以，人和狗狗的感情，是可以如此感动人，想起《忠犬八公》，想起这个为了等待自己的主人，一直一直站在火车站前的人们。    看完这部电影，很感动，很感动。,,,0
31,31,27193043,一条狗的回家路,0509028874a86bd5b569701a1d2fa7a9,0e75a9a0b6bdfed61c0d3fda9bcee6d8,4.0,2019-10-04 08:43:17,电影不停地讲了分离，失去依靠，重逢。有些分离就再也不会相见。可能每一次都是离别。不是所有人贝拉，不是所有离别都会重逢。动物管理员在一次找上门来，这一次带来了更多的警察，妈妈和其他老兵代表各自部队拒绝带走贝拉，妈妈以医院属于联邦财产，不属于丹佛市为由反抗。最后警察队长说出自己也是退伍军人，并且因动物管理员收到举报太多为由，革了他的职。最后补充了一句话，所有车辆都要给狗狗让行。,,,0
32,32,27193043,一条狗的回家路,592ede1c6bcaf5f526cd38431631da01,0d8d7f09b9a4242fd8d0ad93ce35f7ed,3.0,2019-09-23 14:00:12,"而最触动我的。就是观影结束以后的拷问。对于狗来说，我们就是它的上帝。我们的任何举动，都可以改变它的命运。对狗来说，我们是它的全部。它们的一生只重复做一件事。就是爱它的主人。这也是它生命的唯一的使命和意义。

可是我们的上帝究竟要我们干嘛？我们的意义又在哪里？这么辛辛苦苦，诚诚恳恳，忙忙碌碌的一生，活出了什么？留下了什么？终其一生，我们仅仅都在试图洗干净十个手指头。",,,0
33,33,27193043,一条狗的回家路,0e357afd9faf62d1fd3acaa8e9118179,444f3cdfa33899a1d76e1c02d36071d2,4.0,2019-09-22 18:04:15,对于这种类型的电影毫无抵抗力😭😭😭😭，这个相比与人类的互动更着重于刻画狗狗经历感受，它觉得自己被需要被爱所以就更多的给予人类它的爱。 这一条路他遇到各种各样的人和小伙伴儿，他们有的想锁住它让它陪在他身边，有的想接纳它给它一个家，有的想带着它一起自由自在不被束缚的生活…… 可因为它和主人在更早的时候有了羁绊，所以它只要他只要回到他身边，有点像小王子。 贝拉的爱好无私，好宽容，它为了主人可以那么勇敢和坚定，想起就好催泪啊。,2.0,,0
34,34,27193043,一条狗的回家路,71b6271644628af3d1d66a006ffab80a,6f47f39f1397fb6d3a0962f6027c2e24,4.0,2019-09-14 16:04:09,我看了很多部关于狗狗的电影，无一不泪流满面的！ 这部电影依旧是讲述人与狗直接的感情！一只狗狗因为意外被迫被送到很远的地方，虽然生活没什么不同，但是她毅然踏上了寻找主人的路，影片就讲述了她回家的路上所遭遇的事！被宠爱的狗狗忍受着流浪的痛苦，最终伤横累累筋疲力尽地到达主人所在的城市，知道主人也从未放弃她，怎么不令人感动呢！ 狗狗对主人绝对忠诚与依赖！也希望各位，可以不喜欢，请不要伤害！在没有足够的条件下不要领养宠物，养了就不要抛弃！,,,0
35,35,27193043,一条狗的回家路,05d7d3d001f0576b508a255d0d2cc47c,3e9a290f7afdd034e7741b9c02dce74a,4.0,2019-08-31 14:42:10,"之前看过使命篇，意外的好看，因此回家路上映时也计划好了去看。当时正值春节前夕，都市的来客都早早回了家，大街小巷略显空旷，影院当场放映厅只有后排的我和前排的两父子。荧幕上的贝拉跋山涉水在回家，荧幕外的人们水陆空在团聚，莫名觉得很契合。  家是什么？我不清楚在一条狗的认知里是否有“家”这个概念，但我觉得它已经身体力行了一定的精髓：无可替代的陪伴。从意外走失，与主人阴差阳错的分隔，到沿着落基山脉，一路翻越雪山穿行草原跨越荒野，再到退伍军人医院里的最终重逢，家，才是它的终点站。而在这途中，贝拉也结识了同类小分队，也遇到过短暂的收养，尤其是还遇到了毛茸茸的小伙伴美洲狮，但都没有停下脚步。小时候的陪伴，长大后的并肩，或许小狮子也把贝拉当做了自己的家人，一眼就能认出它，但面对互相的邀请，还是有不同的决定。最后美洲狮独自走回草原深处的镜头略显伤感，但也注定是它自由的天性。  虽然是以一只狗狗的视角来展开影片，但形形色色的人类生活也很有真实感。 确实很难，但还是希望所有像贝拉一样暖心的小家伙们都能有自己的家。此外沿途的景色也很美，四季轮转，美好的景色，暖心的善良、坚定的愿望~
  嗯。。敲字中突然想到了小虎还乡动画，片尾曲（还是片首曲？）很好听来着 。不过以动物为主角的影片摄制应该挺不容易的，加油，期待更多的作品💪",,,0
36,36,27193043,一条狗的回家路,54749569d1266bf47fad2c945ea93a17,15f67a1793fb8331bc9030c7ee5fd714,3.0,2019-07-30 22:31:57,贝拉是一条被遗弃的小狗，在遇见他的主人之前，它和一群同样被遗弃的猫生活在一起。后来，遇到了一个好心的年轻人，把它捡回了家。在那里，它过上了愉快的生活，谁知道好景不长，一次偶然的原因，它被迫与主人远离，从此踏上了漫漫回家路。它一路上的经历，不可谓不艰险，但也像极了我们的人生。遇见过友善的同伴，但经过一天的玩耍，它们都各自回家，留下孤独的自己。遇见那个曾经需要保护的“山猫”，后来又被长大的“山猫”所保护，一如我们人生路途上彼此守护的同伴，但最终因为各自的目标不同而渐行渐远，但却在彼此的生命中留下一段美好的回忆。还有遇上好心人的收留，会给它温暖的家，但终究不是它的心之所往，就像我们在职场上，或许也会遇到一个好的领导，好的单位，但终日舒服的日子不是你最终的理想，你还是会选择离开，朝着自己的目标飞奔而去。在贝拉的心里，回家两个字如灯塔一般引领着它不畏艰险，跨越四百多英里的漫漫长路向家的方向前进，一如我们在梦想的指引下，脚步坚定地朝着自己的目标一步步靠近，最终实现梦想。,,,0
37,37,27193043,一条狗的回家路,0751e84830854727578d407eb19a56e2,d0517340fbaf52fbf03d7bff3e498037,4.0,2019-07-05 13:43:12,昨晚上自己个把这部电影看完了，说实话，看的时候有好几个地方都哭了 1、贝拉跟四个小流浪狗一起找吃的时候，白天他们一起开心的玩耍，到了晚上，各自都回家了，爆炸头邀请贝拉去他家里，贝拉拒绝了，贝拉内心独白“但他们不需要我，妈妈需要我，卢卡斯需要我”，这里我突然就泪目了，就很心疼，感觉贝拉好孤单，家人再好，终究不是自己的家人。 2、“达奇找到了他的卢卡斯，现在我要去找我的卢卡斯”，贝拉遇到了两个特别好的人，给他一个特别舒适温暖的家，但是他还是毅然决然的踏上回家的旅程，他回过头跟那俩人和达奇道别的时候，忽然就戳中了我的泪点。 3、“现在只剩下我们俩了，贝拉，我只有你”，“我爱你，贝拉”，“好像世界都把我忘了，但是我不放弃”，流浪汉在生命的最后一刻，把贝拉紧紧拴在自己身上，又好笑又可怜，一个人活到最后，只剩下一只狗狗陪他，他自私的抓住这最后的温暖，虽然这对贝拉并不公平。 4、贝拉第二次被群狼围攻时，美洲狮突然出现救了他，这里看的敲激动，时隔这么久的时间，朋友间的情意依然存在，但是贝拉依然要回家，寻找卢卡斯，所以他和大猫咪只能分开，而且以后大概都不会再遇到了，他们分别这一幕好难过，好心疼。 5、贝拉历经千辛万苦，带着一身伤痕，终于找到了卢卡斯，还有那么多陪伴过他的退伍军人，大晚上的看到这里，一整集积蓄的情绪突然爆发，哭的根本控制不住。,1.0,,0
38,38,27193043,一条狗的回家路,3fc9b39eb190d2a28469621d04596fff,6aff1ee17a706eb5fa7e2150a3cfcb7e,3.0,2019-07-01 21:35:30,本片为《一条狗的使命》姊妹篇，讲述了狗狗贝拉穿越四百英里回家的故事。 男主角卢卡斯在一座废弃建筑里偶遇幼犬贝拉。尽管他的母亲禁止养狗，他还是说服母亲将贝拉带回抚养，并把贝拉带到他工作的退伍军人医院，为病人们带去欢乐和慰藉。一次意外让长大的贝拉不慎走失，阴错阳差的与主人分隔两地。与主人分离的贝拉心急如焚，翻过雪山和草原，沿着落基山脉、跨越危机四伏的科罗拉多荒野，毅然踏上了未知而艰险的，长达四百英里的冒险归家旅程，只为回到主人卢卡斯身边，回到家里。,,,0
39,39,27193043,一条狗的回家路,acc17d47687f64564fe8fa02e9fa3e52,6961477279021adb40b9ff88b1a8b075,5.0,2019-06-23 21:29:08,该影片是一部不错的讲述动物的温情的电影，以一条从废弃建筑物中救出来的狗狗贝拉为第一人称视角，讲述了与主人卢卡斯的美好生活，由于该地区法律规定不让斗牛犬出现在街道上，被送去朋友家照顾而和主人分离，由于狗狗坚定的想回到主人身边，而走上了一条充满艰难险阻的回家的路，途中遇到小豹子的妈妈被猎人打死，主动担当起小豹子的妈妈的责任；和滑雪人的狗狗达奇的相遇，由于遇到雪崩，滑雪人受伤被送去医院，而达奇和贝拉就被同样滑雪的人收养了一段时间；和有家庭的狗狗一起觅食玩耍；和退伍老军人的相伴直到老人去世，遇到狼群围攻险些丧命时，小豹子的出现救了它；再到后来走上公路被撞伤了一条前腿，这些都没能阻挡狗狗贝拉回家的决心，最后终于找到了家，回到了主人卢卡斯身边，找到了它真正的归属，正如影片所说：引领狗狗贝拉回到主人卢卡斯身边的无形的绳子就是爱，对主人百分之百的爱。影片体现出人情的冷暖，动物之间的友谊，以及动物和主人之间的爱，赚足了欢笑与泪水。,,,0
