,Unnamed: 0,电影id,电影名称,用户id,用户名,评分,评论日期,评论内容,有用数,没用数,回应数
24,24,30176393,误杀,7157ac54079ddc7a9cb0f5c322a07e0c,953220d0a3de8457a5099cfec7b216a3,4.0,2019-12-16 18:37:32,中立是西方戏剧文学的传统。 从古希腊戏剧开始，作者/观众就拥有上帝的视角。确实你也可以于其中看到善恶好坏，但你的立场是超然的。  莎士比亚戏剧中的人物，是完全可以从时代/社会背景中抽离的。 因为他们是纯粹的个人，是心理剧，你可以把莎士比亚的人物放到任何时代里，任何国家里，核心还是不变。  哈姆雷特放到非洲大草原一样能成为狮子王演出王子复仇记。 但韩国电影并不遵循西方文学传统，它更有马列主义的倾向。 人并不仅是一个单纯的人，人处在一个时代中，一个国家中，人也不仅是他自己，他是某一类人的代表，或者说某个阶级的代表。 因此，韩国电影并不平等的看待每一个角色。以《寄生虫》为例，在描写无产阶级家庭时，电影表现出温情与理解，是自然主义的，到了资产阶级家庭，运用地则是漫画式的手法（但并不是不精彩，《寄生虫》最精彩之处是它对代表资产阶级的那一家人生动刻画）。 《寄生虫》中的资产阶级，是无产阶级眼中的资产阶级，作者代入的是无产阶级立场，而非上帝视角。 而中文版《误杀》和印度版不一样的地方，就在于它像韩国电影一样，它进一步把人物放在社会中，放在时代中，每一个人物都是一种典型。（并且它不超然，它坚定的站在弱者的立场上。） 一个恶警背后，有千万个恶警。 一个滥用职权当权者背后，有千万个当权者。 一个被扭曲的伦理道德绑架的受害女性背后，有千万个受害的女性。 这就是本片力量来源，它能豪不费力的调动观众的情绪和想象力，因为它根植于现实中的不公平，并不仅仅是一部电影，也是一种带有鲜明立场的控诉。 在印度版本中，男主角是一个中产阶级 所以印度原版里的阶级对立和强弱对峙并不像中文版里如此强烈。 印度版本的最大趣味，是计谋与悬念。 但中文版本完全不一样，你即使已经完全被剧透，你依然能陷入到这个故事中。 因为本片实际上最吸引人的部分，是在极度的权力不平等的情况下，弱者何以与强者较量。 本片最好看的两场戏，是审讯，是一个小人物在充满了威胁和暴力的审讯现场，如何周璇。 影片最后实际上，是男主利用了舆论和媒体保护了自己。 这也是以弱胜强的唯一出路，媒体和舆论事实上是弱者唯一有机会操控的力量。 这种力量本身在道德上是中性的，经常被利用，但在很多地方是唯一的制衡。 影片有两点，是可以令人回味的。 一是陈冲饰演的警察局长，她的出场时让人颇具好感的，她不是一个恶人。 但是当她需要的时候 她手中的权力给予她的支持，是普通人难以企及的。她身上没有收到足够限制的权力，才是她的可恨之处。 从情感反应来讲，她是完全可以理解的。 任何一个人有钱有权，怎么会不替自己儿子脱罪，复仇呢？ 二是男主角的影迷人设 男主没有机会接受教育 但电影给了他丰富的常识和非常先进的价值观念。 这是比从电影中学习计谋，更加让人动容的地方。,6,2.0,2
25,25,30176393,误杀,1af6812e9daa24978982f02491d5d1ae,131b98dac8609f781484f08c22a8abaa,1.0,2019-12-16 10:08:32,因为评论还不错去看了下，感觉和网评状态差异很大，很不喜欢核心逻辑撑不住的电影。感觉打1星2星差不多。 1，影片剧情简单，很容易就猜的出来后面剧情发展。 2，还以为会有个怎样的完美犯罪，但其实简单的不行，处理手段low到不行 3，处理为修改时间，但这个时间逻辑根本撑不住，不可能找不到证据证明时间线，完全导演的自嗨，所有人都被他洗脑换就时间。 4，导演都没想好表达什么，结局处理让一堆群众发表广泛性看法就结尾了，如果想彰显法律正义，至少有个宣判吧。 5，片尾彩蛋算个鬼👻，放这个画面完全不知道想表达什么 6，一堆愚民什么都不知道就去闹事弄政治，单纯的导演自嗨 7，没想到微博热搜各种评论居然还挺好，太假了 一星,27,9.0,15
26,26,30176393,误杀,649a38b43c881df41a7018e5ee66907f,13c569fe0e3f3ab2e7cf95f08420bdf7,4.0,2019-12-15 23:01:28,这两张海报是《误杀》排片之前做的宣发，先于影片发布。 仔细看第一张，是李维杰为了制造一家人的不在场证明而带着全家去罗统，吃奶油蛋糕的情节。图中依次为妈妈（阿玉）、平平、安安和爸爸（李维杰）。 第二张就比较有意思了，是李维杰带着小女儿安安，两人脸上挂着诡异的笑容。倒在他们前面的是侵犯姐姐的官二代——素察。 仔细看！！！ 素察的头上有血，李维杰手里的铲子上也有血。很多人分析李维杰虽然知道素察可能是由于吞舌假死，但害怕之后自己一家被报复，所以放任不管，最后造成了素察的死亡，棺材上的抓痕和安安在吃饭的时候用叉子不停刮桌子暗示了这一点。 但是我要说，很可能最后李维杰为了转移“尸体”打开棺材后，发现素察还活着。并且用铲子敲死了他！而安安很可能被李维杰带在身边，目睹了这一切。（也许是李维杰故意为之，利用了小孩子不会说谎这点，为了钓拉韫“上钩”）有三点可以证明： 第一，安安用叉子疯狂刮桌子是看到或听到素察用指甲刮棺材板，否则不可能会做出如此反常的举动。 第二，安安那天看到的明明是妈妈在掩埋尸体，可是那天她们一家上警车的时候，她却一直在说：“爸爸对不起！”（当然也可能是觉得辜负了爸爸的努力，但是那么小的孩子能不能明白爸爸所做的牺牲？） 第三，此后安安学会了说谎。为了得到爸爸承诺的口琴，她把试卷上的70分，修改为100分，是什么造成了这种转变？李维杰教全家做假证的时候，让她们说的，可都是真话。（可能有多因导致安安撒谎这一果，比如：一家在电影院看《天才枪手》、她隐约明白爸爸在做一件事情掩盖什么…可能最后李维杰带安安共同挖尸的这一点，促使了她往阴暗面的转变，使她为了达到某些目的，做一些在她看来是“正义”的事情。第一张海报上也有“我希望这个世界，没有坏人，只要家人。”（为了达到自己认为的“最优解”，必须做出某些牺牲）） 以上仅为个人猜测。一般来说海报应该符合剧情，个人觉得，第二张海报也算是一个大彩蛋，在暗示观众一些非常重要的情节。,69,10.0,35
27,27,30176393,误杀,1212199aef8f4442562a574d886f59d1,dad1e91de623a51856624de744c258b5,4.0,2019-12-15 18:58:13,"大家好，我是戴着眼镜拿着话筒的阿拉斯加，片片。 昨天的《走光被抓的人》，啊不《被光抓走的人》不是很对我的胃口，本来周末已经不准备去电影院了。 但好多人纷纷给我安利了另一部院线电影《误杀》，这部电影还很出奇地成为了周五的单日票房冠军。     我带着些许怀疑和好奇就去刷了这部电影。 毫不避讳地说，进电影院之前，我是不大看好《误杀》的： 一来它是一部翻拍电影，国产翻拍电影一般是什么水准，大家都心知肚明； 二来它翻拍自印度高分电影《误杀瞒天记》，很多人哪怕没看过电影，也一定听说过那个很有名的梗：
二号去听经，晚上住旅店，三号去餐厅，然后看电影。
其实《误杀瞒天记》也是翻拍自一部印度电影《较量》。     这种极具咖喱特色又飞得不行的片子，哪怕原封不动地照搬，也可能落一个不及格的下场。但看完这部翻拍的《误杀》后我却有点感叹：尽管结尾让我很不满意，但它完全说得上是近几年来最优秀的国产翻拍电影。按老规矩我还是尽量少剧透地跟大家唠唠剧情，好让大家对故事有个大概的了解。故事发生在开口萨瓦迪卡闭口卡坤卡的东南亚某国（架空，没有明说）。男主阿杰（肖央饰）和女主阿玉（谭卓饰）都是华人，定居在这里，抚养着上高中的大女儿平平和5岁的小女儿安安。    男主为人善良，收到过全镇人的好人卡。虽然他小学没毕业，但却靠奋斗开了家网络公司，主营业务可能就是修修网线。除了是老板，男主还是个骨灰级影迷，一年能看八百多部电影。说实话，虽然大家管我叫小肝肝肝大片，但我一年也看不了八百部。从男主给女儿起的名字就能看出来，一家人就想过平平安安的小日子，但你不惹事，事也可能来找你。青春靓丽的大女儿平平在去夏令营时被富二代盯上。被迷晕后遭到性侵并被录影，事后富二代不肯罢休上门继续纠缠。    被逼无奈的母女俩和富二代对峙起来，结果女儿不慎击中富二代头部，一探已经没了气。而且富二代的身份特殊，他母亲就是警察局的督察长，想调查那就是易如反掌。但匆匆赶回的男主还是决定想办法为女儿脱罪，而他唯一能利用的，就是他看过的上千部电影。男主有句口头禅：“当你看过一千部以上的电影，你会发现这个世界根本没有什么离奇的事情。”他必须从电影中找到灵感，把整个案子伪装成一起找不到真凶的完美犯罪，而最重要的就是要有完美的不在场证据。* 以下部分涉及剧透最终一部叫做《蒙太奇》的韩国电影给了男主灵感。这跟电影中的蒙太奇其实是一样的，把发生在不同时间的事通过剪辑放在一起，给人一种所有事都发生在同一时间的错觉。    在事发当晚也就是2号，男主其实是在外地出差的，是因为家中没人接电话才着急赶回了家。男主在外地看了拳赛，保留了票根，还在ATM上取了钱在监控里露过脸，因此他不在场证明很完美。他要做的就是制造出妻子女儿都跟着他去了外地的假象。    要做到这一点男主精心制造了物证和人证，首先在3号带一家人去了出差的地方，故意到有监控的地方转悠，保留了消费凭证。但这顶多能证明他们一家人3号在外地。所以男主还找来了2号的拳赛票，并且趁酒店前台不注意的时候悄悄改了入住记录，并且通过帮酒店维修网络之便删掉了酒店的监控录像。    如此一来物证就已经相当完备了，缺的就只是人证了。男主特地给这个故事里牵扯到的所有人洗了脑，先是故意做出特殊的举动让所有人都印象深刻：比如狂吹彩虹屁夸餐馆老板的奶油蛋糕好吃,在旅店和前台吵架等等。然后男主多次回到这些当事人面前，一开口就是，我们一家人，二号去看拳，晚上住旅店，三号去餐厅，然后看电影。  





  这些人在3号的确见到了男主一家人，而在男主的洗脑下，他们统统认定男主一家2号就在外地。说实话这件事一点也不扯淡，人的记忆力就是这么不靠谱，在半真半假的事情上更是如此。到这里男主这一环又一环的计谋才露出了一小部分，整个诡计比我形容的还要有意思得多，但再往下说，就剧透得有点太过了，所以就到此为止。    作为一部翻拍电影，《误杀》免不了会被拿来和最经典的《误杀瞒天记》进行比较。我觉得，《误杀》的改编有功有过，但总的来说是成功的。首先，相较于印度版的163分钟，《误杀》缩短到了112分钟。在保留最精髓的作案部分的同时，节奏加快了很多，由此带来的紧张感也更强，在观影体验上也是更舒适的。再就是特地强化了陈冲饰演的这个女警局督察长的角色。《误杀瞒天记》里这个角色出场较晚，也远没有陈冲这个版本精明干练，全程就是男主把大家耍得团团转。    而《误杀》里却加强了男主和女警察的对手戏，男主自恃聪明，“当你看过一千部以上的电影，你会发现这个世界根本没有什么离奇的事情。”女警察则夸耀自己的经验，“当你破过1000个以上的案件，就会发现这世界上根本就没有什么离奇案件”。还有两位母亲的较量，一个痛失爱子，一个女儿受辱，为了孩子都在所不惜。这种对抗感一出来，影片的氛围就紧张了很多，爽快感大大增强。   接下来跟大家聊聊很明显的几处改动，比如大女儿原本是被偷拍洗澡，现在是被强暴，做了一些动机上的补足，感觉没什么问题。再就是原本是把4号5号发生的事嫁接到2号3号，《误杀》却改编成为了用3号一天伪装，感觉上更严谨了。不过也留下比较致命的破绽，就是特地删掉了酒店2号的监控录像，如果警方能恢复数据，男主就满盘皆输了。所以此处算是个不够完美的改编。（印度版酒店里没有监控）当然也有相当出彩的地方，比如照顾了一些人的迷影情结。比如电影一开始就致敬了《活埋》，在电影院里一家人看的电影是《天才枪手》，男主的观影记录里有《狩猎》等等。而且有几处并非是单纯的致敬，而是大有深意。    女警察最终能勘破男主的大部分诡计，靠的居然是“查他一年的观影记录”，所以说豆瓣以后就是办案专用APP了？最后来说说这部电影的缺点。导演的有些镜头太过刻意，好多悬疑点导演生怕你不知道特地划了重点。尤其是藏尸体的那个坑导演还故意给了特写，这其实还是蛮影响观影体验的。影片的结尾也出现了问题，男主在瞒天过海逃出生天后最终选择了自首，随后母女俩也选择了认罪。嗯？怎么有种熟悉的味道，这不就是《嫌疑人X的献身》？    说实话这里面肯定有方便过审的考虑，而且导演还为男主安排了很充分的自首动机。这跟很多只在片尾打一行字幕“×××后来已经自首”的方式比起来，显得更加用心。男主最后愿意自首，一是因为他和富二代的死脱不了关系（这点大家看片自行了解），他本身也信佛过不了自己心里的坎；二是外国警察的肆意妄为引发了民众的暴乱，男主的父母就死于暴乱，他选择说出事实平息暴乱；三就是自己的行为给小女儿做了不好的榜样，小女儿也学会了说谎，男主最终决定要给孩子做个好榜样于是自首。    男主从畏畏缩缩的中年老好人变成了一个光辉伟岸的父亲，整体的动机详实而充分，算是个不错的改编了。但坏就坏在明明已经把结尾说圆了，导演还试图强行上价值，上的价值还不是很能让人认同。    这部电影的英文名叫做《Sheep Without a Shepherd》，翻译过来就是“群龙无首、乌合之众”的意思。其实是在讽刺当地的警民关系，警察从保护者变成了施暴者。最后还让电影中人物模仿《杀人回忆》中结尾宋康昊凝视镜头的那一幕，但实际上两者没有什么共通之处，顶多都有对警察的讽刺。    不过不管是《杀人回忆》，还是印度版《误杀瞒天记》，都是反映了一定时期里当地警察的腐败和无能，都很有现实意义。但在《误杀》这部电影里，背景和国家都是架空的，但明显就是一群中国人在泰国的故事，时而中文时而泰语，显得相当出戏。你真要本土化，搞架空就再飞一点，整个汉东省啥的不香吗？非让泰国背锅总觉得有点不伦不类。再加上导演是个马来西亚人，整个落地改编没能让我感受到本土化的魅力，自然其中的讽刺也没让我产生共鸣。而且在略显冗长的结尾当中，电影始终没能直击问题的本质，私力救济的界限到底在哪里，这是每一部复仇电影都在探寻的答案。    如果不能给出一个恰如其分的答案的话，电影完全可以只讲故事，真没必要整那些有的没的。只要能讲好故事，那就肯定是部好电影。总的来说，《误杀》是一部合格的翻拍片，这样说甚至有点保守，它是近几年来最优秀的国产翻拍片。少较真一点的话，我甚至愿意给它8分，也算是相当出色的一部犯罪悬疑片了。    不过结尾就不是很能让我满意，我知道带着镣铐跳舞的确不容易。但是哪怕是戴着镣铐，跳广场舞和霓裳羽衣舞的美感也是有差别的，所以还是希望导演能多琢磨琢磨。那么今天就说到这里，如果有人想看片片解说原版《误杀瞒天记》，那就点个在看让我知道知道，我好给大家安排上。拜了个拜。",10,1.0,4
28,28,30176393,误杀,847d26922836d1cc7a0a68ae59e43102,98ed4ebe2749a3bb9e3afb1e213c11c8,4.0,2019-12-15 11:27:23,"《误杀》翻拍自印度电影《误杀瞒天记》，讲述了一个只有小学毕业却爱看电影的中年父亲（李维杰/肖央饰演）在女儿（平平/许文姗饰演）失手“误杀”了警察局长（拉韫/陈冲饰演）的儿子之后，利用电影蒙太奇手法制造证据隐瞒凶案的故事（警察局长的儿子在之前的夏令营中迷奸了平平）。我没看过原版，就不对比了，因为这对我来说不重要。但据说《误杀》还是拍出了自己的特色，甚至有很多地方比原版还要精彩。  我相信已经看过的人中大部分和我一样，觉得这电影更像是陈思诚的导演作品，因为《误杀》不仅和《唐人街探案》一样把故事背景架设在泰国社会，其中当然考虑了涉及公权力内容的过审。同时《误杀》对人物群像的描画以及人性的挖掘，都让人想起《唐人街探案》，尤其是最后秦沛(饰演李维杰的朋友，十分信任并积极帮助李维杰)对着镜头意味深长的笑，让人一下子就想到彼时还很小的张子枫在《唐人街探案》中最后露出来的笑容，都十分耐人寻味。 这是一部看起来很爽的电影，一方面剧情紧凑，看到李维杰的设计一步一步成功，让人有好人可以脱身的快感。同时，肖央、谭卓、陈冲的演技炉火纯青，尤其是两位母亲为了自己的孩子而在警察局对质的一幕，还有......  演员的演技，故事剧情与节奏能够决定一部电影的质量是否到“不错”。在这两件事的基础上，加上很多耐人寻味以及深远的立意才能构成一部优秀的电影。《误杀》中关于“误杀”的内涵就能引人很多思考。陈思诚也在微博里引导大家对故事结果做出自己的思考。 影片中反复出现羊，以及寺庙与和尚，都给人很多解读的空间。  首先，剧情表面一定是警察局长的儿子被“误杀”。然而《误杀》的英文名叫《Sheep Without A Shepherd》乌合之众。很明显，电影制作者不想单纯聚焦在一件刑事案件上透出来的父爱与母爱以及家庭亲情。其中也用很多篇幅表达群众和舆论在这刑事案件中的推动作用，因为警察局长的丈夫刚好在选当地市长。李维杰利用了邻里朋友以及局长丈夫的竞选对手，利用他们形成群众和舆论压力，迫使警察局长不敢在案件上滥用职权。
警察押着一家人挖坟找尸体的时候，群情汹涌的群众围住了警察，同时竞选对手也找来了很多媒体。警察在众目睽睽之下挖开别人的坟墓，却只看到一只死羊。群众终于爆发了，和警察发生冲撞，警察还开枪击中了一位市民，最后酿成骚乱。在骚乱中撤退的媒体留下一句清晰的话，“竞选对手可以提前庆祝胜选了”。警察局长拉韫和她的丈夫的政治前途都被“误杀”了。当然，那个中枪的市民，甚至包括那只死羊也都可以算是被“误杀”。  李维杰利用了大众，包括利用朋友的信任制造全家人的不在场证据，最后利用他们对于不公以及掘坟事件的反抗，甚至还利用了竞选对手的势力，终于把执意要破案着急找到儿子的警察局长赶下台，也摧毁了警察局长丈夫的选市长之路。影片中大众舆论和群体反抗是争取到了“正义”，这看起来理解起来都很爽。可抛开所谓正义和弱势群体这些层面的东西，实际上李维杰还是用假象蒙蔽了朋友和大众。而这恰好是危险的，因为当大众被坏人蒙蔽的时候，同样也会导向一件很危险的事情，比如现在的香港。这就是乌合之众的内涵，容易被煽动被操弄，像一把刀，好人用是铲奸除恶，坏人用就是草菅人命。像刀不能代替法律做是非判断，自顾自就去裁决，大众也不能越过法律和司法正义直接将暴力施加在个人或事件上，因为这都是很危险的理念。  影片的末尾，李维杰投案后，记者采访秦沛，问他觉得李维杰是个什么样的人，秦沛什么都没说，只是露出了耐人寻味的笑容。
我宁愿相信，这时候秦沛脸上的笑容，也表露了自己被李维杰欺骗后的复杂情绪，因为他作为大众，也被李维杰的精心设计所“误杀”到。之所以复杂是因为他也能理解这些设计背后的无奈。
    -End- “你们就是我的实验啊~” 来自订阅号“5号实验室”",2,,9
