,Unnamed: 0,电影id,电影名称,用户id,用户名,评分,评论日期,评论内容,有用数,没用数,回应数
0,0,30176393,误杀,6f7bb9b5c8db02e3f3789641502562d2,4fe6ba9c006bc7ddb4bc5e1c1db17f5d,4.0,2019-12-06 00:42:34,"一，为何自首   1，动机，从李维杰和街坊邻居的相处中不难看出李维杰生性善良，乐于助人，平时有点胆小怕事，是个虔诚的佛教徒。案发后他回家见到妻子，妻子第一时间想着就是报警，李维杰回答道：“现在报警连坐牢的机会都没有，死的是警察局长的儿子。” 李维杰知道平平是受害者，但是心里也觉得杀了人有不对，他做这一切的动机本来就不是为了刻意瞒天过海，逃脱法律的制裁，是因为李维杰亲眼目睹法制破坏，恶警横行，深知如果报警连坐牢的机会都没有，所以他才选择用电影里学到的知识帮助家人脱罪。后来李维杰发现素察死亡真相后内心更加愧疚，加上暴乱之后从记者的街头采访可以看出警民关系有所改善，拉韫夫妇也都下台了，并且在他面前真心忏悔，所以李维杰选择出来自首； 动机   2，教育，安安最后考试其实只考了70分，为了得到想要的小提琴将成绩涂改成100分，男主当时表情凝重，转头去买口琴，此刻背景音乐《We All lie》响起，We All lie对应着他们都撒谎了，小女儿安安也学会了，这首配乐并不是随随便便选的，《We All Lie》是韩剧《天空之城》的片尾曲，《天空之城》主要讲的就是子女的教育问题，和这里的主题完全对应。之前李维杰一家人在电影院看的电影《天才枪手》讲的故事也是关于作弊、教育，最后主角改邪归正放弃再通过作弊的手段获利，也对应了这里的主题。回顾全片，你会发现这部电影对教育这个主题着墨不少，“有的孩子是孩子,有的孩子就是个禽兽！”警察局长一家就是因为缺乏对子女的教育，一个过于溺爱一个过于冷漠，最终教育出素察这样的禽兽。男主选择去自首，其实也是为了教育孩子，以身作则； 安安修改成绩  3，暴乱，群众因为对李维杰的信任，在事情发酵后开始暴乱，袭警，打砸抢烧，这次事件就是对法制的一种“误杀”，群众做了他的“替罪羊”。李维杰从小就是孤儿，父母死于暴乱，他知道暴乱会造成无数不幸的家庭，他的邻居也在暴乱中受伤了（最后男主让妻子付医药费，就是给那个受伤的邻居的）。最后李维杰站在天台上看着远处的硝烟，那里还在发生暴乱，他想着这一切都是自己造成的，我不杀伯仁，伯仁却因我而死。 李维杰身世         联想到片中特意介绍的佛统塔的传说：        “相传很久以前，这里的君王生了一个儿子，有个法师说儿子长大会杀死父亲，君王无奈打算将儿子饿死荒野。一个好心的农妇收养了这个孩子，孩子长大后率众起义杀死了君王，当孩子意外得知君王是他亲生父亲后，十分悔恨，一怒之下又杀死了收养他的农妇，屡酿大错，他悔恨莫及。僧人告诉他，要赎罪，只有建一座鸽子飞不到顶的大塔，于是有了这座佛统塔，又称忏悔之塔。”        李维杰一家人所犯之错和王子所犯之错一样，都是君王/素察先有恶念，自己为了自保才不得已反抗，杀害君王/素察后，又祸及了农妇/群众，如果说君王/素察罪有应得，但农妇/群众总是无辜的，李维杰怎么可能做到毫无愧疚的面对暴乱继续、生灵涂炭？比起单纯的以暴制暴、瞒天过海，最后李维杰在佛统塔的忏悔的钟声下，选择救赎，不是更好吗？  4，彩蛋，结尾的彩蛋，和片头李维杰讲的故事相呼应，这里是一个有趣的首尾呼应的结尾，想要解读这个彩蛋必须结合片头的故事。有很多人根据片头的故事解读成了最后李维杰越狱失败被活埋，但是李维杰是自首的，没必要越狱。那么片头的用意到底是什么呢，我的理解是这样的，片头是李维杰根据自己观看的电影编的故事，结尾要表达是整部电影其实也是导演观摩了很多电影之后改编的故事。在片头李维杰讲完故事后，颂叔作为听众马上出来吐槽：“弄了这么半天，最后还是没有逃出去，这是个什么狗屁结局！”李维杰答道：  “一定要逃出去才是好结局吗？/Why does everyone want a successful prison break?” 导演的表达         这句话，不也对应了整部电影吗？就是导演想告诉观众，“不一定非得最后瞒天过海逃过法律的惩罚才是好结局！”          5，某种众所周知的原因。 二、羊的隐喻        羊在基督教中的意义为替罪、救赎以及牺牲：上帝为了考验亚拉伯罕的忠诚，叫他把他的独生子以撒杀了作成祭品，献给上帝。正当亚伯拉罕要动手时有个天使加以阻止，说：“现在我知道你是敬畏上帝的了，前面林子里有一只羊，你可用它来‘祭献’上帝。”于是，亚伯拉罕便把小树林中的那只山羊抓来杀了，代替他的儿子；        羊在片中的四次出现：第一次在湖边看到男主抛车（知道男主有罪），第二次被警察打死（代替男主受罚），第三次开棺验尸（作为替罪羊，帮男主掩埋真相），前三次出现时影片色彩逐渐变暗，暗示男主心魔越来越重，第四次男主决定自首后，活羊重新出现，色彩一下明亮起来，变得通透圣洁，寺庙响起钟声（都预示着男主释然，已经放下心结，决心认罪接受惩罚）； 羊的四次出现        本片的片尾曲是萧敬腾演唱的《亡羊》，是以上面那个被误杀的羊为对象创作的一首歌。《误杀》英文片名是《Sheep Without a Shepherd》，直译过来就是没有牧羊人的羊（意译是乌合之众），隐喻当地的警民关系。在片尾采访中，一个普通民众说到“羊只要能好好的吃草，才不会管是谁在褥他们身上的毛呢？”羔羊们想要的仅仅是能过好安定平安的生活，牧羊人褥点羊毛割点韭菜他们是不会在意的。牧羊人作为当权者本应该是作为保护羊的存在，但当牧羊人变成屠夫，不再保护羔羊时，便是羔羊奋起反抗的时候，影片中最后的暴乱是在民众对当权者的积怨下造成的。这里也对应了李维杰两个女儿的名字分别是平平和安安，想表达的就是小人物只求能平平安安就满足了（话说大女儿平平叫李平，那小女儿是不是就叫李安）； “羔羊”的想法        警察去抓大女儿平平的时候，老师讲课讲到：“羊是一种群居动物，视力极差，当它们单独行动时，很容易被肉食动物捕食。”对应着平平单独行动被侵犯，素察单独行动被误杀。想要表达的应该是，在这个险恶的世界里，防人之心不可无，一定要保护好自己。同时也对应这里的警方找落单的平平盘问的剧情，告诉观众落单的羊很危险，营造紧张的气氛，让观众为平平担心。 三、一些细节    1，藏尸地，素察的尸体埋在新警察局里。片中有很多伏笔，首先是颂叔向新警察局的承包商介绍了李维杰，负责去铺设网线线路，中间李维杰跟着承包商一起去工地时盯着地上的那个大坑看了很久，然后承包商把工地钥匙给了李维杰，这为李维杰埋尸体提供了充足的条件，最后警察不方便透露藏尸地点也说明了地点比较敏感，不方便明说。 藏尸地   2，第一个彩蛋，第一个彩蛋采访颂叔怎么看，其实是打破了第四堵墙，想问观看电影的观众对这个案子怎么看，那么你怎么看呢？ 你觉得李维杰该自首吗？   3，结局，结局只有李维杰一个人坐牢了，虽然最后妻子女儿也自首了，但是由于妻子女儿连尸体在哪怎么死的都不知道，所以警察理所当然相信李维杰的话，这一切也是在李维杰的计划之中，“我是一个没有什么本事的男人，也没有能力让你们过的更好，我唯一能做的就是挡在你们前面，不让你们受伤害！”   4，叉子，案发后一家人吃饭时小女儿安安用叉子划桌子，划桌子的声音让男主联想到素察用手指抓棺材的声音，想到素察死前痛苦的挣扎，内心深处十分煎熬，所以马上制止了小女儿。 李维杰表情凝重  5，郝蕾， 本片最开始导演和女主角都是由郝蕾担任的，后来因故改成柯汶利和谭卓，所以电影最后字幕上有一句话“特别鸣谢 郝蕾女士”； 特别鸣谢 四，迷影元素：     比起那些细节隐喻，我最喜欢的还是本片中的迷影元素。我喜欢这部电影里面的处处致敬经典，当我发现它们时会会心一笑；我喜欢李维杰和普通观影者聊经典台词、聊蒙太奇、聊希区柯克时的一脸兴奋，这不正是我吗？我喜欢这个影迷战胜神探的故事，因为我也是一个影迷，我深爱着电影。         开篇米黄色的监狱场景《监狱风云》，越狱《肖申克的救赎》，棺材里点火《活埋》，通过电视画面出现的电影还有纽约五行杀人案《唐人街探案2》，镜头剪辑《蒙太奇》，用演技脱罪《控方证人》，唯一提到的电影人悬疑片大师希区柯克，全片一共出现了三张海报，分别是《肖申克的救赎》《英雄本色》《猫鼠游戏》，在电影院看的电影是《天才枪手》，念剧情简介的电影有《狩猎》《七宗罪》《白夜行》《蒙太奇》，最后面对摄像机的镜头借鉴《杀人回忆》（肖央已经有点河北宋康昊的感觉了），棺材盖上的抓痕和《妖猫传》很像，暴乱戏能够联想到《小丑》，小女儿看到妈妈埋人的镜头，和《唐人街探案》的思诺的镜头神似，囚车的戏有《我不是药神》的影子。（片中还有了哪些电影欢迎补充） 电影《唐2》《蒙太奇》《控方证人》 海报《肖申克的救赎》《英雄本色》《猫鼠游戏》        2，台词，影片中出现了两句《肖申克的救赎》里的经典台词：        “ 有些鸟儿是关不住的，因为它们的羽毛太美丽了。”        “这些围墙很有趣，最开始你憎恨它，慢慢你习惯它，最后你依赖它。”         作为一个影迷，看过那么多部电影，多年之后具体故事大都会忘记，但那些经典的台词却能牢牢记在脑海里。比如《天堂电影院》里的“生活不像电影，生活比电影难多了”，比如《一一》里的“电影的发明使我们的人生延长了三倍， 因为我们在里面获得了至少两倍不同的人生经验”，那么这部电影呢？我想记忆最深的几句是：        “当你看过一千部以上的电影，你就会发现这个世界压根就没有什么离奇的事情。”这句台词应该是编剧特意写给影迷朋友们的。        “仔细研究过一千件案子，你就会发现这个世界压根就没有什么离奇的案子。”这句话致敬了经典悬疑小说《福尔摩斯》里的名言：犯罪行为都有它非常类似的地方，如果你对一千个案子的详情细节都能了如指掌，而对一千零一件案子竟不能解释的话，你才是怪事。         “给我查他一年的观影纪录！”         “有的孩子是孩子,有的孩子就是个禽兽！”     “我是一个没有什么本事的男人，也没有能力让你们过的更好，我唯一能做的就是挡在你们前面，不让你们受伤害！”         “羊只要能好好的吃草，才不会管是谁在褥他们身上的毛呢？”           3，蒙太奇，当不同镜头拼接在一起时，往往又会产生各个镜头单独存在时所不具有的特定含义。蒙太奇是一种非常常见的电影语言，但是要用的好也不是那么简单，我们熟知的希区柯克、诺兰就是用蒙太奇的高手，这部电影也是一部很好的蒙太奇教学片。         定义：片头黄毛指着《唐人街探案2》说这个才叫紧张刺激，李维杰说到“这个嘛，就叫蒙太奇了。就是镜头剪辑加特效，看着刺激其实都是骗人”；展示：片中李维杰看拳赛和妻子女儿误杀素察的一端交叉剪辑就是很好的一段蒙太奇展示；高阶：李维杰的犯罪手法就是一种蒙太奇，将2号和3号两天发生的事情交叉剪辑后。误导大家以为李维杰一家人2号3号都在罗统，从而做到瞒天过海。 蒙太奇     4，希区柯克，在吐槽完《唐人街探案2》后，李维杰转身对着颂叔说“希区柯克这种紧张，那才是真紧张！”那么，什么叫做希区柯克式紧张呢？ 希区柯克式紧张         希区柯克有一个很著名的“炸弹比喻”：两个人谈话，半小时后桌子下的炸弹突然爆炸，观众会觉得很惊讶，但这个故事没什么悬念，如果故事改成在走进屋子前，观众首先看到一个凶手进屋子将炸弹藏在桌子下，接着两个人走进屋子却没有发现炸弹，仍然坐下来谈话。那么观众就会时时刻刻想着炸弹会不会爆炸。这就是希区柯克式紧张，希式紧张可以用希区柯克的名言来说明——“炸弹绝不能爆炸，炸弹不爆炸，观众就老在惴惴不安。”这里理论讲的就是，紧张情绪的酝酿，需要在故事开始之前，向观众展示一个危机，观众知道，但剧情中的人物并不知道，而这个危机似乎随时都可能爆发。这样，便形成了悬念和故事张力。         这部电影就很好的实践了这个理论，在警察行动之前，观众就知道了凶手是谁，但警方不知道，所以在后面的剧情中，观众就会一直保持着紧张的情绪看李维杰一家人到底能不能瞒天过海逃过警方的审问，具有很强的悬念和故事张力。
     题外话        《误杀瞒天记》在印度一共有三个版本，外文名都叫《Drishyam》，最初的版本是2013年的《较量》，大家熟知的是2015年的《误杀瞒天记》。本片翻拍自自《误杀瞒天记》，保留了原版主体架构，动用了六个编剧对具体细节进行了大规模的改动，算得上国产翻拍电影的优秀代表，最后成功入选豆瓣2019华语电影十佳也说明了这一点。         本片导演柯汶利和监制陈思诚的悬疑新作《唐人街探案网剧》已经上线了，一共三个故事，每个故事的长度和一部电影差不多，喜欢悬疑推理的可以去看看（第一个故事有一点惊悚元素，胆小就不要看了啦；第三个故事注水有点严重，可以不看）。          影评修改于2020.03.20，目前还没完全写好，会尽量做到图文并茂条理清晰（还挺费时的），方便各位影迷们阅读，转载本影评到其他平台标明出处就可以了。最初版本见 https://movie.douban.com/subject/30176393/discussion/616599361/ ——有用破万了/2020/10/26/",12221,179.0,1569
1,1,30176393,误杀,6cfa122a1a56bbee68ddbc348576644b,28558b257a47492e466be306b3955965,3.0,2019-12-13 20:52:37,（update，本来就觉得这个电影拍得太傻了，好笑，也没功夫写影评，饭前随便敲了几行字吐槽一下，没想到被顶上来了。。。也没人给打钱谁给这种电影写影评啊。。。反正不管说什么都会有骂闲街的，无所谓，也不想较劲。具体修辞懒得改了，矫情的责任感会让人想额外提一句，电影的很多改编方式是正确的并且能感受到一点点幕后鸡贼情怀，这些都是在咱国影市里属于老百姓喜闻乐见的加分项，所谓烧脑高大上什么的，能卖钱比什么都重要） 1. 在《误杀》之前，曾经有过两部同故事印度电影《较量》和《误杀瞒天记》，时间跨度也不过十年，算是有点拍烂的题材。 2.一帮子大陆，香港，台湾三地不同口音的演员跑到泰国拍了一个假装不是泰国的电影 3.影迷情结而不是迷影情结，肖大宝：只要你看过1000部电影，那这个世界就没有什么好离奇的。 我笑死在电影院。 4.警察推理案件的关键：查他一年以来的观影记录。 5.一年看了838部电影，老影迷了。一年以来接连看的电影包括《七宗罪》《白夜行》 6.看每一部电影写叨逼叨短评留念的样子在大陆语境里你也只能想到豆瓣用户 7.陈思诚在路演提到，豆瓣用户不行，印度翻拍版比大陆版高了一分，崇洋媚外 8.是的，陈思诚就是这样一个捞逼 9.机关算尽，拼了命把故事架空最后结果还是要给一个太监结局，你说咱国好不好笑 10.好吧，我们最后再说回电影。大女儿是陈冲的闺女，大女儿唯二的两部电影都和陈冲合作，上一次是绝世高手演年轻陈冲。生抬亲闺女啊 11.可是陈冲在这里面虽然很酷，但是演的跟《演员的诞生》一样疯逼，太过了姐姐 12.当然也不能只怪陈冲，整个电影除了肖大宝每个演员都挺拼了命去“演戏”的 13.实际上你看剪辑音效，都完全在傻大黑粗的疯逼气质上一去不返的 14.肖大宝没去韩国发展一下子真挺可惜的，这个市场对不住这种能瞎贫也能耍浑的演员 15.陈思诚监制的最大影响除了他在拍摄流畅度的掌控度之外就是给电影套上了一层格外油腻，一点也不聪明的小聪明和一点也不彩蛋的小彩蛋 16.电影里的语言切换诡异到令人发指，几乎所有角色张嘴之前你都说不准会说泰语还是普通话 17.当然蒙太奇相当重要，尤其是简单正反打都能穿帮的电影中,1292,1013.0,1129
