,Unnamed: 0,电影id,电影名称,用户id,用户名,评分,评论日期,评论内容,有用数,没用数,回应数
0,0,30219560,邻居同居2,52ef0e2db73560012ff3090bfff25433,0b08ec16cd005b82296a22f3fe99b5f9,5,2020-03-15 00:38:00,真的好甜，虽然剧情简单直接，可是大雨里那幕我至今还觉得感人，第一部也有大雨的戏，可是我感觉第二部更好看啊！漫改电影第二部更有漫画感的啊啊啊 大家都去看看涨涨分啊为什么现在腾讯只能看第一部，难道只是因为第一部演员人气高吗?第二部也很甜的好不好？和第一部感觉区别很大。反正我觉得第二部好甜好甜好甜最后好暖好暖好暖啊,5.0,,6
1,1,30219560,邻居同居2,b1fd35dd2ecc11b2f0d9f72f6f3a67a7,8bde987f024ffaefbff0828be19b250c,3,2019-09-05 10:09:56,"别误会，喵酱要说的可不是要打码的那种电影。 而是，少女漫画中经常出现的桥段：高冷校草爱上平凡女高中生！ 什么？你说这种画面你看腻了？ 那···难度升级，两大校草和平凡少女秘密同居，其中一个还经常不穿衣服晃悠！这么羞耻的漫改电影你见过吗？   没错，它来了——
 邻居同居2L・DK ひとつ屋根の下、『スキ』がふたつ。
  在开始说故事之前，喵酱先问大家一个问题： 你知道构成少女电影的必要元素是什么吗？ 剧情？画面？ 不不不，最重要的当然是男主！ 对于少女电影来说，女主可以不聪明不漂亮，但男主必须要狂拽酷帅吊炸天。 尤其是帅。 &lt;邻居同居第一部找了山崎贤人当主角。 





 说实话，喵酱之前一直get不到他的颜值，但看了&lt;致命之吻后：对不起！我为我的瞎表示抱歉！ 





 第二部呢？前面说了，这次玩点大的，双男主上线。 杉野遥亮，身高一米八五的盐系美男子，和女主角（上白石萌音饰）站在一起特别戳少女心！  顺便也品一品他在《诈骗》里的造型（100遍我可以！）。  横滨流星，这两年势头很猛的新晋小生，去年顶着一头粉毛和深田恭子上演禁忌师生恋； 日剧：初恋那一天所读的故事 喵酱很怀疑他拍完那部剧之后，就无缝接档演了&lt;邻居同居，因为电影里面的发色也类似；   在&lt;轮到你了里面没有夸张发色，而且高智（yan）商（zhi）的学霸身份，也有不少萌点。
  那说回故事，和两大帅哥同居是什么体验呢？ 女主：看我表情。  在同居1中，平凡少女和腹黑校草因误会而不得不住在一起，最后互通心意。 而同居2，则是讲恋爱后的故事。 既然都恋爱了，那么画面肯定是比前一部要羞耻一丢丢的。 首先吻戏必须安排上！  吻戏来了，那船戏还会远吗·····
  女主：  船戏当然是没有的，双方家长知道两人住在一起后，女主爸爸给出警示：
  那电影就一直是甜甜甜下去的吗？没用痛怎么能叫青春呢？导演，给我虐！ 第一虐：秘密同居X地下恋情。 一个是光芒四射的超级大校草；一个是普普通通的平凡女高中生，这要是被爆出恋情无疑会引起轩然大波。 况且学校也不容许有同居现象，所以两人一直都是秘密恋爱，出门都要分个前后时间。  这也导致的一个情况就是：我的男人被无数女人觊觎着，我却始终不能拥有姓名。  女主：导演没事，这我还顶得住！
 第二虐：校草不自信怎么办？ 没错，你没看错，某亚洲富豪集团的唯一继承人、拥有超高智商和超高颜值的天选之子——少女漫男主，他不自信！  这不自信的源头，当然是由华丽出场的男二（横滨流星饰）引起的。  男二，作为男主的堂弟，颜值和家世一脉相承，这没啥好竞争的了。 那从性格上来讲，男主是腹黑高冷犬系，平日只对女主一人温柔；  男二是傲娇暴躁猫系，一出场就是各种撩妹（他撩妹是有原因的，大家可以在电影里看）；  男二的任务是把自家堂哥带回美国继承大业，可堂哥沉迷恋爱不愿离开怎么办？堂弟表示：那我倒要看看这个女人有什么好！ 于是，三人同居就此开始。  起初男主抱着一种“我让你瞅瞅我媳妇多么优秀”的炫耀感邀请堂弟入住，可没想到，这该死的迷人的女人，让傲娇鬼也悄悄动了心。  发现堂弟秘密的男主当然如临大敌，主权是必须要表明的，kiss要当着他的面！    在家还能秀秀恩爱，在外情况却逆转了。有人拍到男女主拥抱在一起的照片，男二挺身解救：我和她才是一对！  并且当场发动公主抱技能！  男主：我明明可以解释的泥奏凯！ 可全校都默认他们才是情侣了怎么办？男主：我慌了。
  不过对于这类纯爱电影来说，虐点是真的可以忽略不计的。 虽然它也有一些老毛病，例如出现的套路基本可以猜到，但男女主颜值在线，演技也在线，相比前作，已经是有一丢丢进步了。
 如果想看甜甜的恋爱，拯救下自己干涸的少女心，那听我的，选它！",16.0,,0
2,2,30219560,邻居同居2,4304c7bb499b4f204e7255b5f8cb428b,b734e6f811154b8bcfee81c9c91dbefb,3,2021-01-25 23:29:56,"男主一开始没漏正脸的时候我从氛围上能get到他的帅，后来露正脸的时候我真的不是很能get到了，做大表情的时候崩的还是挺厉害的，尤其是下雨跑的那一幕emmmm
好了diss完男主颜值说一下剧情，虽然这种剧确实只为了爽所以不要考虑逻辑啥的，但我确实对把戏剧冲突设置在去不去美国上表示接受无能，看得我就很别扭。而且男主为啥能接受自己表弟和自己npy一起住呢？？？为了同居而同居着实大可不必，我也没觉得三个人同居那一段拍的很有爽点。
再有就是，男二站出来说女主是他npy的解释是怕别人知道男主和女主同居被学校开除，butbutbut男二自己不也和女主同居呢吗？被别人发现两个人一起同居那结果不是女主被开除吗？那如果这样的话女主为什么要在学校隐瞒呢？直接公布她和男主恋爱不就好了…而且现在被公布之后女主是在被开除学籍的危险地带徘徊，既然已经这样了那男主为什么不站出来认领自己的npy呢？说白了不就是担心自己被退学吗，那他就可以任由npy冒着被退学的风险保护他，天呐这样的话男主很渣诶。 虽然恋爱番不需要逻辑，但这种逻辑bug看了不仅不会觉得甜，反而觉得男主是个绝世大渣男诶，照我看这行为完全是在玩弄人家小姑娘啊？！不懂…我还是喜欢萌音…萌音这剧里颜值明显提升，老母亲看着甚是欣慰",,,0
3,3,30219560,邻居同居2,14414a7952f3d3b6a595405c7dddb815,413eb8afa117a3aa4136d47290aff723,4,2019-09-13 23:16:44,啊啊啊好甜！好甜！！身高差赛高！！！想拍这样的情侣写真！！！算是1的剧情后续，也拍了1的名场面作为回忆。当然少不了壁咚啦，印象深刻的是1回忆里佟圣被小葵腿咚了直接握着她的小腿咚回去……2流星在图书馆里一手壁咚一手摁着女孩子后腰，哇，色气得要命！也太会了吧，流星弟弟不可限量啊不可限量～虽然中间有一些比较迷的地方（主要是看少女漫我就不带脑子了）但瑕不掩瑜！特别前半段小葵努力让流星认可自己时，佟圣看着她不由自主露出的笑容甜死了，像在说看啊，这就是我喜欢你的地方，最喜欢这样的你了！ 而且比较少见的是，这部描述的不是少年男女相识相爱的故事，而是“在一起以后”——在一起以后，童话还在继续。两个人的同居生活，他会为她吹头发，温温柔柔；她会节俭地买特价肉末，觉得节俭得生活也别有趣味；她很会做家务照顾人，可他也不会理所当然大爷状，而是从她手里拿过削皮刀，帮忙一起做饭；一个人洗碗一个人擦，彼此嫌弃速度慢，很快笑成一团……就是理想中相爱的人住在一起的生活啊！！！ 佟圣吃醋也太萌了QAQ在墙外听妹子夸流星，进了门直接以吻封缄，那个侧脸帅到爆！也不直说吃醋，只是温柔地看着她的眼睛，说“我回来了”；小葵愣了一下，甜甜蜜蜜地眯起眼睛笑，说“欢迎回家”。我要是流星，大概那时候就能感觉到，这两个人一定是无法被拆散的吧？ 另外，流星露额头更好看，偷亲小葵被推开的阴郁侧脸好帅，想看他演变态小狼狗wwww荒木飞羽弟弟也可爱！总之真甜啊，已经二刷！,,,2
4,4,30219560,邻居同居2,682c3b3d9c93b276669f46b3ec890ef0,b9caac79752396ee0f03e1057b104306,2,2019-08-24 20:48:08,虽然第一部剧情老套， 前半部还行吧，后半部又开始“玛丽玛丽哄哄”了··········································································································································· 但是人物相对美型一些，完整看过第一部，再看第二部就有些落差了，我一看第二部的女主就想到她演《窈窕舞妓》的样子。,,1.0,0
