,Unnamed: 0,电影id,电影名称,用户id,用户名,评分,评论日期,评论内容,有用数,没用数,回应数
10,10,33436135,只有芸知道,d52f3771ad5fe84afc24eb31b2c9ce42,aad3cfead24cab0d7b02756d12943972,3.0,2019-12-20 00:06:59,"冯小刚导演的新片《只有芸知道》上映前开启大规模点映，很多人都被看哭了。 我从中间开始哭到影片结束，全场到后来一片静默...... 同伴的脸上被银幕亮光映照得晶莹闪烁。 但说实话，若这不是真实发生在冯小刚导演友人身上的，我多半要觉得它狗血。  《只有芸知道》海报 那是一个发生在现实中的童话故事。 （以下有剧透） 两颗孤独的灵魂在异国他乡相遇。 男孩隋东风（黄轩 饰）和女孩罗芸（杨采钰 饰），在房东林太（徐帆 饰）的小花园里一见钟情。  





初遇 结婚，搬离林太的小屋，前往偏僻但风景如画的小镇定居—— 新西兰南岛克莱德。故事有着绝美的背景。 大片大片的绿色山麓氤氲，隋东风和芸开着一家不大不小的中餐馆，过着日出而作，日落结伴回家的田园牧歌式的生活......     没有孩子，有狗，四十多岁了，芸依然向往蓝鲸，隋东风买来巨幅鲸鱼广告牌挂在床头，打上射灯，宛如置身于幽蓝的海洋之中。   他们还去北极圈看极光，许愿。 远离故土，远离俗世琐碎，只有浪漫的二人世界，和克莱德小镇美得出世的风景。 前半段已然不真实，后半段的“绝症”更是让人嗅到一股中二时代偶像剧的味道......  大手术前的拥抱 然而，这是发生在冯小刚导演友人身上的真人真事。 似乎是为了堵住悠悠之口，片尾还特地放出了好些旧照片。 有冯小刚导演和夫妇俩的合照。  原型张述罗洋夫妇（左一、二） 我不禁感叹：艺术果然源于生活。 然而生活又高于艺术。 如果不是真人真事，这部电影恐怕真的会沦为烂俗言情剧。 因为在烂俗言情偶像剧里，没有人物命运的过渡和复杂细腻到需要像剥洋葱一样一层一层去撕的情感。 但《只有芸知道》有。  罗芸（杨采钰 饰） 罗芸，是一个生命有阴影的人。 杨采钰演出了阴影赋予这个角色的特质—— 如影随形的淡淡的哀伤，大多数时候遇到事情都波澜不惊，偶尔却非常激烈。 同时，她又是一个恣意生长，却从不挥霍生命的女孩。 两者有矛盾之处，这是有原因的。 而在知晓原因前，你始终会有一丝疑虑。  忧愁的芸 芸有一条鲜艳的红裙子，影片特意给了这条裙子各种特写。 挂在晾衣架上的，穿在女主身上随风飘扬的。     她享受生活的姿态是贪婪的，当下的每一分每一秒，她都要充分体验。 她又是那个时代的开放者。 90年代，即使是在国外，一个中国女孩认识一个男孩子没多久便主动走进他的房间，也是非常大胆的事。  “闻闻，还腥吗” 更别说她在海鲜市场打工不戴手套，用一次赌博决定了自己的婚事，结婚算上房东，总共才三个人......  结婚 她似是毫不在意自己的形象、别人的目光、人间的输赢，只要自己开心。 这样的女孩子，却会说：“我是个不幸的人，跟我在一起，不会有好结果。” 他们的狗狗死后，芸更是变了一个人。 可电影却没有表现她为狗狗流一滴眼泪。 相反，她出奇的平静。 是她决定送狗狗上路，狗狗被送去安乐死的那天，芸在家里照常干着家务。 哭得稀里哗啦的是黄轩饰演的隋东风。  芸 她像是早就经历过一次死亡。 脸上没有隐忍的表情，更多的是平静，略带些漠然。 他们的中餐馆被火烧成灰烬时，芸也是这副表情。 她对“毁灭”似乎习以为常。 但仔细看她的表情，又会觉出不一样来。 她虽凝视着前方，眼神却在很远很远的地方。 这种沉思状的表情后来越来越频繁地发生在芸身上。  芸站在埋葬爱犬的树下 敏锐的我们能感知到，这不是普通的哀伤。 更像是一种感应。 芸是感觉到了什么。   她也越来越向往远方。 我们以为那是她厌倦了一成不变的小镇生活，后来才知道这里头更深层的原因...... 等等这些，都是冯小刚导演对芸这个角色的雕琢，他花了大量心思给这个角色蒙上一层薄纱。 叫人看花非花雾非雾。  芸 直到结局，真相揭晓的那一刻，心里一下子敞亮起来。 之前那些没想通的，一瞬间都通了...... 随即，一阵悲伤压上来。 方才明白，片名《只有芸知道》是什么意思。 这和许茹芸的歌真的没有一点关系。 只是一声低喃，一声哀伤的叹息~  黄轩饰演隋东风 虽然是以隋东风的回忆和讲述展开，但芸才是真正的主角。 “只有芸知道”的，是一个秘密，这个秘密和芸的人生阴影有关。 它让芸的生命，和与隋东风的相守，具有了跳脱于俗世的美感。   芸与人群，始终保有淡淡的疏离。 她独自远渡重洋来到异国他乡，独自打工，独自生活，婚后又搬到远离都市的小镇。 她喜欢的事物，看鲸鱼，看极光，都是远离繁华的清冷之地。 她对无法怀孕这件事，并没有什么遗憾和痛苦。 她并不渴望孩子。 但同时，她对生活和生命的感知又异常敏锐。   她与隋东风的生活，之所以是现代版的田园牧歌，正是因为有着太多的日常诗意。 有山，有花，有绿地，有蓝天白云。 生活在大自然的怀抱里。  





 一起打理餐馆，日落携手而归，多年之后，仍然会有将卧室改造成梦幻鲸鱼主题的浪漫之举。  





 在这些诗意里，我们仿佛窥见了几千年前古人心有灵犀，相尊如宾的生活。 晨起画眉，红袖添香。 一季做一种点心，花上几个时辰，几天，几个月，做一种香料，一壶茶，一杯酒。 正合了电影开头的一段话： 从前的日色，变得慢，车，马，邮件，都慢。 一生只够爱一个人。 这应该就是打动冯小刚导演的地方。 美好的爱情千千万，而像这样复古的爱情，不多。 而芸的离开，又将这段爱情推向高潮。 生离死别，向来东方人不能承受之重，却是一段爱情升华的阶梯。   在隋东风怀念亡妻的众多片段里，最打动我的，就是撒骨灰的长镜头。 隋东风把妻子的骨灰带到蓝鲸出没的海域，让它随风散入海中。  





隋东风将芸的骨灰撒入蓝鲸出没的大海 一般导演或许会把镜头对准隋东风的脸，而冯小刚导演却停留在他的手。 通过他的手来展示这个男人的柔情，和对妻子绵长的爱。 这个长镜头又一次让我的眼泪夺眶而出...... 冯小刚导演果然还是细腻的感性男。 不然你看，芭莎镜头里，他和徐帆有多抢镜啊，简直就是戏外的感情线了。   最后，友情提醒，看这部电影一定要备足纸巾，一定啊！ （首发于 今日头条号：天涯小鸟movie）",111.0,10.0,35
11,11,33436135,只有芸知道,21b1800029ac98d86811be7431d39551,880c5feb6d240e6a054a7b3990449bcc,3.0,2019-12-22 23:22:57,"突发奇想要去看冯小刚改编自挚友真实爱情经历的电影《只有芸知道》，是源于一篇在朋友圈看到的赞扬黄轩演技的文。这篇文的题目超级霸气----《今年华语电影最残忍的一帧画面，来自黄轩》，文里还特别提到黄轩能在《只有芸知道》饰演隋东风，是“对的时间遇到对的电影，是演员的幸运。” 看完电影，我打了三颗星，一颗给风景，一颗给黄轩的三场哭戏，一颗给女主角的颜值。只是，无关编剧、无关主题、无关所谓爱情秘密。 来自北京的隋东风和罗芸在新西兰打工，他们同时遇上了一个好房东，这是他们的幸运之初。接下来，想要恋爱时，遇上彼此；想要结婚时，遇上赌博成功，还发了一笔横财；想要创业时，刚好房东有亲戚低价转让餐馆；想要开业时，空降一个貌美如花聪慧伶俐的外国妞；想要养狗了，就有人送来一只流浪狗布鲁。他们爱情，既没有隔着家仇国恨，也没有颠沛流离，甚至没有上有老下有小的一地鸡毛，人生简直顺利得令人生妒。所以连女主都说上天也觉得太过于厚待她,所以要她历经死劫。于是布鲁得了病不得不安乐死,女主也在45岁时死于心脏病,留下男主一人独自怀念. 看电影简介说女主罗芸隐藏了一个只有她知道的秘密，秘密的背后却是她对隋东风刻骨铭心的爱…… 这个秘密给了我悬念，我一直在等待揭晓这个秘密。然而，所以等了解到这个所谓的“只有芸知道”，竟只是这样一个毫无意义的，无关痛痒的“秘密”时，我简直啼笑皆非。把天意当成人为的烦恼，实在是庸人自扰之。 冯小刚说拍这部电影是为了纪念一段相濡以沫的动人爱情。是，我承认这是一个几乎像童话一样美好的爱情故事，但正因为太过美好，太纯粹，反倒失去了感动人的力量。 毕竟他们两个比起这世间的太多夫妻已经是太幸运了。曾在一期《朗读者》里知道一对85后的小夫妻----丁一舟和赖敏。赖敏得了一种医学术语叫做“遗传性的小脑共济失调症”的罕见病，俗称“企鹅病”。这个病基本无药可医，患病的人发病后小脑会逐渐萎缩，行动和语言也相应地退化，接着内脏也会跟着萎缩掉，直至死去。 当年轻的赖敏开始随时摔跤，无法正常行走时，丁一舟来到她身边；当赖敏无比憧憬地提出想要到处走走看看时，丁一舟兜里揣着全部家当的200块，骑上一辆三蹦子，就带着赖敏上路了。一路打工一路走，他们不知道这一去路途中会发生什么，只要守着彼此，开心快乐就无所畏惧。 接下来他们还面临着更大的考验，这个病具有遗传性，赖敏的妈妈就是因为这种病去世的。所以，当赖敏怀孕时，他们不得不做出选择…… 《只有芸知道》里罗芸因为早产心脏天生发育不全，所以当时医生预言她只能活到二十岁。但她不仅活过了二十岁，遇到了将她当做掌中宝的隋东风，一直活到45岁。对他们而言，这25年简直就是上帝对他们格外开恩的眷顾。这是电影要表达的最大遗憾，也是催人泪下的痛点。只因为“半路留下来的那个人，苦啊......” 再看每天都在和上天争分夺秒相守的赖敏和丁一舟，面对如此际遇，镜头前的赖敏依旧笑容灿烂，不悲天悯人，不阴郁沉沦。而丁一舟说“我并不认为她在拖累我。她其实是在成全我，成全了我作为男人的一份担当和责任。真正在发光的是她，而幸运的是我，因为我能占有这份温暖。”相比这段朴实的言语，只觉得《只有芸知道》讲述的爱情秘密太过于苍白而矫情。人生就是含辛茹苦，而生离死别便是最平常的一种。 我们的感情空间无限，而感情也有很多种。有的人离开，但活着的人还要继续。我们纪念的方式也有很多种，“过往不恋，未来不迎，当下不负。”不是沉在痛苦里无法自拔，重要的是活着的人要好好的活，用你的心长久地保存对他的爱，这才是对曾对你付出深情的人最好的安慰。 我好友的父母亲非常恩爱，但父亲47岁患癌症去世。好友妈妈守寡二十多年，却在77岁的时候遇到一份新的爱情，去年两个年龄加在一起超过150岁的老人领了证，结了婚，甜甜蜜蜜过起令人羡慕的二人世界。 谁说这个世界上爱情只有一次呢。谁说一次死别人生就没了期盼呢？两个老人让我们再次见证了爱情的模样。 简贞在《四月裂帛》有句话“深情即是一桩悲剧 必得以死来句读”，所以我想《只有芸知道》是贯彻了用死句来读的，然而，这之后还有一句“你真是一个令人欢喜的人,你的杯不应该为我而空”。重要的是我们爱过，拥有过。这样看来这部电影其实应该算是人间喜剧。",21.0,2.0,5
12,12,33436135,只有芸知道,45e546865171474c8ab64d49e21b13ac,26dd0dc7ba78966667e66397880feabf,4.0,2019-12-22 15:06:20,或许二刷以后可能会想给3星，但是在此只想抛开理性把万事看的纯粹，爱情本该就是一个简单的存在，没有撕心裂肺没有歇斯底里，只有陪伴和依偎；记得最深的是林太那一句“不可能没有离开的念头，但是两个人在一起就是熬，睡一觉，第二天什么事都没了。”这或许就是大多数人相濡以沫的原因，最大的安全感不是物质，是爱人的支持与鼓励。再一最深的感触来自那句“在半路上留下来的人，苦啊”想起朋友，而我又见证了她的苦痛我感受到了当他们未来的路上只剩她自己的时候那个绝望，我直接崩溃，替她哭红了眼睛，我多希望她和他的来生以后可以如此热烈滚烫，别再在相伴的路上抛下对方。冯小刚选择了最残忍的桥段，直击我脆弱敏感的神经让我来不及思考故事的真实性。即便是改编我也谢谢编剧带来了如此美好的故事背景，让观者不至于绝望的彻底，也感谢取景，再不能感同身受的人也能当成美景宣传片，激起去奥克兰的欲望。电影不满的可能就是黄轩那双手吧，频频出戏；还有blue的死亡，对我来说太残忍了，被老套的宠物离去桥段骗去泪水的我真的不甘心。 希望二刷的我也能保持天真，相信爱情的忠贞。（近几年华语喜欢的相濡以沫的故事不多，上一部算是《归来》吧） 好吧二刷过的我，甘之如饴～,14.0,1.0,3
13,13,33436135,只有芸知道,704062d035ace89909026ae29fa2084c,ff8351e195adf36d7a86c38ded7ac9d9,2.0,2019-12-20 14:13:18,此片是中老年油腻男，以自嗨的方式对老婆的一次勤切献礼。 油画一般的景致，纸片一样的人物，尿不净一般的叙事。 继北海道旅游大使之后，刚导可能又得拨冗多拿个新西兰荣誉市民的身份了，无奈旅游宣传片拍得再美，叙事终究停留在小学生作文的尴尬水平。 如果说现在很多国产喜剧都是在强挠胳肢窝逗乐观众，那本片就充斥着掐脖子逼人落泪的尴尬和无奈。 片中罹患绝症的芸依偎在风的怀里，喃喃说道，啊我可能是世界上最幸运的人。我们心想，不，您不是人，您是上帝。 因为，老婆说要有光，于是就见到了（极）光；老婆说饭店要毁，饭店就（烧）毁了；老婆说要押注，就中头奖了，而且还得double；老婆说想见鲸鱼，鲸鱼成群的前来赴约。老婆只要发话了，甭管是反常识、反季节还是反物理，就是统统能办。你别不信，不信就是不接收人类的温情共感，就是不尊重故事的客观原型。 但不管是温情还是纪实，都不应成为本片难看和弱智的理由；“基于真实事件改编”更不应作为烂片的庇护所。影史上优秀的基于现实的温情片太多了，懒得举例了。 本以为此次刚导低调行事，隐忍创作，可以拿出个诚意作品，能证明浮华之后，北京老炮峥嵘犹在。无奈全片散发着讨好敷衍的油腻气息，所以若有下次，便想多问一句，刚导，尚能饭否？,18.0,6.0,5
14,14,33436135,只有芸知道,e00ccec00eb83731d2f5814ea3bf9552,046f638bd0646a73e230480a0e69795c,4.0,2019-12-21 19:32:21,窦文涛曾经在节目里对安全感表达过困惑：为什么那么多人喜欢大谈特谈自己做什么事都是为了安全感？每个人其实都生活在一个充满不确定与危险的世界，哪来的安全感。舒国治在文章里也质疑过这个问题：什么是安全感？难道你出门带把枪就安全了么？ 电影前半部讲了女主不断追求安全感，要有房子，要有生意，要有宠物，为此她先生也一起努力，甚至为此放弃了对艺术的追求，两个人一起在异国他乡开个小餐馆，生意不错，也非常辛苦，赚了些小钱，等到终于可以好好享受生活了，女主又羡慕起在她餐馆打工的女孩子，觉得自己追求安稳的生活也挺乏味单调，就去女孩子不断旅行体验生活的其中某个地方待了几天，看了极光，结果回到家，发现餐馆发生意外被烧了，正中女主下怀，她其实早就不想继续那种在小城镇开小餐馆的生活，其间宠物得病死了，女主非常伤心，最后女主也得病死了。电影后半部讲了男主追忆跟女主的美好爱情。 有一点蛮有意思，当男女主刚来到小城镇买了一个转让的偏远的风景极其美好的屋子，原来的屋主说自己卖的原因是因为她太太腻了这种太过安静的乡村生活，然后男主说女主就是喜欢这份清净，屋主说，他太太刚搬过来也这么说。结果，过了很多年的乡村田园风光的生活，女主也腻了，把这个屋子卖了，然而这次接手的也是一对夫妻，女方表示了对此田园生活的向往，男女主啥也没说。 整部作品配乐非常满，看了某个公众号对冯小刚的采访，冯小刚说，他就是喜欢音乐，电影里配乐放满一点他挺喜欢。里面对于男主的塑造我觉得有些过于完美了，也许冯小刚上了年纪，怀起那种纯粹美好爱情的旧来就不管不顾。太煽情了。冯小刚在跟公众号的访谈里说，他其实在电影生涯里想说的话都说完了，没啥遗憾，以后如果再拍电影基本上就是兴之所至。所以，冯小刚这次本来就是拍给自己看的电影。某个意义来说，这部电影是芳华的另一个版本。 大家都知道昆汀和新海诚是恋足癖，其实我觉得冯小刚八成也是，芳华里对女性美好大腿的展示非常充分。这部里，女主坐在男主的自行车上，阳光，树影，微风，长裙飘飘，镜头停留在女主美丽的小腿上足足十几秒，不忍移开。不过，拍的挺美，我没啥意见。,18.0,1.0,4
15,15,33436135,只有芸知道,294f60de1aaa3dccad55c9b9faa378d2,160337d34cad8e67acc0561d181134e5,1.0,2019-12-20 20:04:53,剧情没有一点逻辑可言，经不起一丁点的推敲和思考，在架空的剧本下呈现了一种特别特别美好的生活，假到你怀疑人生的地步，强行催泪，强行烘托气氛，这音乐随便给哪个导演用上都tm能催泪，你不哭都不好使，最最重要的是女主那么一个简单的梦想你tm死了都不满足她，你咋想的啊，孩子死了你来奶了你哭你🐎啊，还有冯小刚的电影越来越不好看了，圈钱明显，和同时期的导演去比技术拙劣的明显，没有那么大的格局也没有那么浓重的文化气息，只是运气好站在的风力而已。,37.0,12.0,11
16,16,33436135,只有芸知道,248cf84ec50af6322d39abaa37069049,42985c1546770f447de8e69d9cbf5c20,,2020-01-19 18:38:50,其实我一开始本没有想去看这部片子，是在大三上最后一门考试结束后，又一个无聊的下午，张家耀同学提出来的。我看了一下简介——文艺、爱情，立马拒绝了他，我可不想在影院把他叫醒一次又一次。估计是他不想再和我坐在教室打一下午王者荣耀了，死皮赖脸一起去了柳巷。 片子很长，我最开心的一点是，家耀终于没有睡着，认认真真和我一起看了一部文艺片。我又哭了，我真的是个泪点过分奇怪的人，看什么都能哭得稀里哗啦。从前日子都变得慢，一生只够爱一个人。 今天在剪周天拍摄的一个男嘉宾的视频，其中有一个问题，他回答到——执子之手，与子偕老。果然即使在木呆呆的程序员口中，这句话讲出来依旧那么温柔，充满了爱与期待。 我是相信这些东西的，就像我觉得，书里的故事之所以可以流传千古，一定是因为始终会有人愿意坚信，并且正在发生着。历史很长，但人的一生终其有限不过几十年，总会有人经历着那些美好的瞬间。有些姑娘就是始终美丽且幸运，而那些男孩也愿意始终陪伴在意中人身旁，执子之手与子偕老，也就不会只是个美好的愿望。,1.0,1.0,2
17,17,33436135,只有芸知道,e8ca90b0e105994da742a40da06e467c,d27fbb47db76b29aa1f4b1453755f127,3.0,2020-01-06 16:23:46,好一场美妙的风光大片，碧海蓝天，青草牛羊，蜿蜒的公路曲折向远方。故事的开始，一封信，一张邮票，以前的日子很慢，慢到一辈子只够爱一个人~ 爱情，真是让人难以捉摸。爱情里有欺骗，欺骗自己从娘胎里带来的重病，欺骗自己想要把一起奋斗过的餐厅付之一炬。爱情里有绝望，不能生育的绝望，不能挽留生命的绝望，不能实现梦想的绝望。爱情里有分离，不能白头偕老，不能久久相伴。 爱情那么痛苦，为何两人要相爱？ 第一次相见的扑通扑通的心跳？北京到奥克兰两两次相遇的缘分？ 这份爱情里，满是男士的付出与奉献，满是女士的隐瞒与欺骗。 男主的爱，只是女主这个人，为了这个人可以放弃理想、信念、希望以及往后余生； 女主的爱，是为了有那份安全感，而这份安全感像是无底洞一样深不可测~ 最后的最后，女主又有了别的渴望，渴望像梅琳达的人生，又渴望成全男主的梦想~ 男主也无脑输出，输出青春，输出15年的光阴。而只有刚刚结婚的时候，与女主讨论了人生的规划，买房子买餐馆的计划，而这些计划，只是为了满足女主的安全感。但往后的15年，女主几次问男主难道以后就如此了么？15年啊，都没有决定或者再讨论一次~ 平淡的人生是大多数人的，无可厚非； 虽然夫妻会充满了欺骗，隐瞒和谎言 但电影是第三人的视角,1.0,2.0,0
18,18,33436135,只有芸知道,66be54b3ab230993394f147caf51d546,3548e1b019867300a81aeeffdee44504,4.0,2019-12-29 10:26:02,一场异国他乡的邂逅与别离，一段私人化的独家记忆，一个身边人的追忆感怀，本以为对文艺爱情片百毒不侵的我，看着《只有芸知道》，哭得稀里哗啦。那些克制地煽情，恰好和我的情绪产生了某些化学作用，触及泪腺的阀门。       “从前书信很慢，车马很远，一生只爱一个人。”爱或许不是惊天动地，不是波澜壮阔，而是举案齐眉，是平淡相守，是我们疲惫生活中的英雄梦想。隋东风与罗芸相遇、相识、相见、相守，平凡的日常下是不平凡的深情。我们一路上其实都在学着如何和亲人、和朋友告别。“半路上留下的那个人，苦啊...”可我们还得带着这份苦，带着对方的梦，带着彼此的情继续向前走。也许不想分离，可终将散去，在回忆里，在以后漫长的岁月里，去路迢迢，终有一日相见。         散文诗一样的电影里装着百转千回的柔情。云淡风轻地讲述一段平常又真挚的感情。冯小刚说：“心还是热的，过了冬至就是惊蛰！”那些岁月里走散的人终会回来。,3.0,2.0,0
