,Unnamed: 0,电影id,电影名称,用户id,用户名,评分,评论日期,评论内容,有用数,没用数,回应数
24,24,33436135,只有芸知道,12424b5c9d3bc11b92265afc29b40c5b,053c9279047a07a6c999231743525f0c,5.0,2019-12-20 18:02:00,"原文载于头条号：宁馨儿的世界 我有所念人，隔在远远乡。我有所感事，结在深深肠。乡远去不得，无日不瞻望。肠深解不得，无夕不思量。——唐《白居易》  走出电影院后，脑海里挥之不去的是新西兰绿草如茵的田园牧场，白云包裹的雪山之峰，还有隋东风和罗芸夫妻在克莱德小镇屋子前一起看云卷云舒，望日出日落的画面。 风吹过的时候，小狗布鲁在罗芸的腿上耷拉着脑袋，远方的牛羊吃着青草。 一切都凝固在异国他乡风清气爽，五彩斑斓的时光里。 正如影片一开头木心那首娓娓道来的诗： “从前的日色变得慢 车，马，邮件都慢 一生只够爱一个人” 而这部电影，至始至终，都给我一种云淡风轻的安静感和温暖祥和的柔情感。  故事的节奏很慢，慢得你可以去欣赏影片的每一帧风光，去感受主角的每一次拥抱，去品味人物的每一句台词…… 在豆瓣上，看到很多人吐槽这部片子的无趣，戏谑是新西兰的风光旅游风光片，而我却认为，在这部片子平缓的叙述和自然稳重的节奏之后，是一段跨越15年的纯美爱情和婚姻。 它是对生活由激情到平淡的还原，得到与失去的诠释，懊悔和弥补的刻画。 总之，这是隋东风和罗芸的故事，也是寻常夫妻的生活，尤其在今天这个物欲纵横的社会，如此纯粹的感情已难得寻见。  【一、激情和平淡：从热恋到婚姻，隋东风和罗芸曾经有甜蜜爱情，却在后来陷于生活的琐碎，像极了每个中年人一地鸡毛的日子】 影片开始后不久，我们随着男主角隋东风的思绪，来到二人搬到克莱德的画面。 刚来的新婚小夫妻，对一切都充满了新鲜感。罗芸在车里探出头，呼吸牧场的空气，享受阳光的气息。背景音乐里，杨坤嘶哑的声音唱着“酒窝装满笑容发着光，枕边的太阳，喂，听见吗，你藏在哪一朵云的背后…… 画面美好、温馨、甜蜜、祥和。 清晨，他们坐在草地上谈天说地，聊日常因为学习英文闹出的笑话，聊对未来生活的期望。 隋东风说咱住的这地方太静，邻居们隔得老远，扯着嗓子喊也只有几头牛能听见。 但罗芸说：我就喜欢这种清静。  可其实，她是一个想自由而不想安稳的人。 餐厅的服务员梅琳达到世界游历，做了老师，当了义工，收留了孤儿，见到了更大的世界，而隋东风和罗芸还在日复一日的柴米油盐中讨生活。 罗芸开始有些倦怠，他们在自家餐厅的门口叹着气晒太阳，收养的小狗布鲁依偎在女主身边，好像这种日子特别绵长。 罗芸看到朋友梅琳达寄来的明信片时，感叹对方像云像风一样自由，想去哪里就去哪里，言语中透露出羡慕。 终于有一天，她忍不了这波澜不惊，一成不变的日子，问隋东风：难道我们要在这个地方待一辈子？ 然而丈夫跟他说想趁着生意好，多挣点钱再去过好的日子。  姜文在《狗日的中年》一文中说：“狗日的中年不仅消融掉我浓密的长发，也弄丢了我蓬勃的激情和梦想”。 此时的隋东风和罗芸，像我们每一个活在狗日中年的人，年少时志在四方，中年却一地鸡毛：为了更好的生活必须付出双手和青春，为了让家人过得更好，起早贪黑，放弃了光荣和梦想，放弃了休闲和乐趣，从此锅碗瓢盆的咣当声取代了笛声悠扬，成为生活的奴隶。 林太说：“长久的夫妻就是能熬。” 中年人的人生哪里有什么岁月静好，不过是每天的负重前行。  【二、得到和失去：隋东风和罗芸相遇、相爱、相知、相守，有过幸福的日子，然而却痛失爱情的结晶和陪伴身边的小狗布鲁，最后阴阳相隔】 人这一辈子，好像总是在不断地得到和失去，好运气和坏运气相生。 隋东风和罗芸，曾经是那么的美好： 他拉着她的手问：你有没有男朋友？ 他不知道她用哪一款护手霜，索性把好多牌子的都买回来。 他骑着自行车载着她穿过金黄的树林，任阳光洒在她红色的裙子和柔美的脸庞上，时光醉了，人也醉了……  成婚后的东风，陪着妻子罗芸，牵着“儿子”布鲁，悠闲地在家门口的山坡上散步，一起说笑，嘲笑她想养蓝鲸的心愿。 罗芸说她喜欢蓝鲸，于是东风找人把一块印有蓝鲸的广告牌运回家，做成了床后的背景墙。搂着妻子说“现在我和鲸鱼都在你身边，布鲁给你看家，彻底踏实了吧”。 剧中，梅琳达说罗芸对鲸鱼的依恋正是对安全感的渴盼，隋东风做到了给妻子安全感。 结婚那天，隋东风在林太面前对罗芸深情告白：“我喝水，你喝酒；我吃饭，你吃肉……我一定竭尽全力会给你最好的……” 他也的确给了她最好的一切：房子、车子、餐馆，还有每日的陪伴，他们很幸福。  但是，他们也失去了很多。 自从承诺要给妻子最好的一切后，东风就被生活的琐碎牵绊——喜好音乐的他出卖自己的手艺成了一名中餐馆的厨子，向往自由的罗芸成了老板娘，切菜、端菜、结账……甚至为了一顿饭钱和吃霸王餐的人争吵，险些被人伤害。 他们不敢关闭餐馆，因为生活所迫；他们不敢去远方，因为要赚钱过更好的日子。在日复一日的辛劳里，疲于奔命中，逐渐失去了自由和自我。 同时，也在时间的流逝里失去亲人和朋友——小狗布鲁患了癌症离去，在日月星辰下和屋门口的大树作伴；林太在一次造访前的一周突然离世，遗憾错过最后一面；好友梅琳达游走四方，山南水北。 有人说“世间之事不过一场聚散离别”。 人这一辈子，总是在不断得到和失去，相聚又离别。离别了故乡，会遇到心动的灵魂，得到了彼此的爱，又一起面对生活的考验，在一天天柴米油盐的日子里，少了风花雪月，多了琐碎日常，一次次迎来送别里，也慢慢和所爱之人，所喜之物告别。  【三、懊悔和弥补：隋东风曾和罗芸相约一起去看蓝鲸，无奈败兴而归，蓝鲸没有看成，此后隋东风忙于生意，再也没有带罗芸去看过蓝鲸。罗芸去世后，隋东风带着她的骨灰前往凯库拉，在海上把骨灰洒入大海，与蓝鲸相遇，完成她生前的遗愿】 铁凝在《珍重身上衣》里写道： “我们都太喜欢等，固执地相信等待永远没有错，美好的岁月就这样一日又一日被等待消耗掉”。 很多时候，我们对每天陪伴在身边的爱人熟视无睹，纵使她提出一些心愿和请求，但最终埋没在各种借口和搪塞里，进而忘得一干二净。 罗芸想去看蓝鲸，东风就带她去，但一次跟人起冲突败兴而归后，二人再也没有去看了。 就像我们总跟朋友说下次聚聚，其实再也没有聚过；总想忙完这阵陪陪孩子，却从年初推到了年尾。 总觉得时间那么多，生命那么长，总有机会。 你可以等，但生活不能等，你永远不知道明天和意外谁先来。很多时候，人们都是失去了才知道珍惜。  著名主持人李咏去世后，其妻哈文在微博上发出一段文字，结尾是“永失我爱”四字，读起来心酸而凄凉。 曾经枕边相拥，如今阴阳相隔。 刘若英在《后来》里唱到“后来，我总算学会了如何去爱，可惜你早已远去，消失在人海，后来，终于在眼泪中明白，有些人一旦失去就不在……” 失去罗芸的隋东风，面对着空无一人的家，产生了她回来的幻觉，在怅然若失之后，带着妻子的骨灰踏上征途，奔向二人曾经想去的地方——凯库拉，只为完成她生前那个看过极光后看鲸鱼的夙愿。 不要等到越过崇山峻岭，才发现真的无人等候，不要等到转身后寻不到，才后悔当初没有牵手。与其在失去后懊悔，在错过后叹息，不如把握当下，做想做的事，见想见的人，谈想谈的情，成想成的人。 生命来来往往，来日并不方长。 





 在电影的最后，隋东风牵着新的小狗“布鲁”，走过一片青草郁郁葱葱的公园，在一把蓝颜色的椅子上停了下来，上面写着“WHEREVER YOU ARE IS MY HOME”（你在哪儿，哪里就是我的家）。 这是妻子生前让东风以她的名义捐的蓝色长椅，他累了就坐下，就像坐在她的怀里。 而那些曾经初见的美好，相爱的欢愉，新婚的喜悦，共处的欢乐便随着岁月的流逝，白银苍狗，化为东风内心最宝贵的记忆。 主角黄轩说“演了这样一部电影，走进这样一个人物，面对过这样一份情感，它潜移默化地影响了我。如果我将来有一个太太，我也会改变我对生活和家庭的理解，更珍惜这样的一种情愫。” 面对这样一部纯美的电影，相信当你经历了生活蹉跎，尝过得到与失去，你会更加珍惜当下。 所谓夫妻之间的纯爱，就是一日三餐，就是走心陪伴，哪怕只是执手不言语，只是相视不纵情，也是一段曼妙的风景。  原文同步载于今日头条 看不懂《只有芸知道》，说明你可能还年轻 https://m.toutiaocdn.com/group/6772160999760855563/",19.0,2.0,2
25,25,33436135,只有芸知道,28d821dae13d82bd48612bf5366cc133,bc3c6ffb87e81780847c729b5d8f4428,3.0,2019-12-20 12:54:41,1。严重怀疑这部电影是这样诞生的：杨采钰的金主（或投资方，没有贬低的意思）说我们有钱让她演部大导电影主角吧，冯小刚的东阳美拉也刚好想在崔范一役之后复出，拍点什么呢，刚好身边有个朋友故事，然鹅，故事不是重点，故事平淡没有故事戏剧性不足以撑足两小时也没关系，咱们有堪比明信片的新西兰绝美风光啊，再加上电影从头至尾连绵不绝的配乐，好了，当作新西兰风光大片看也是养眼的，欧耶。 2。所以我们就要在观影之时不要再去思考某些逻辑性，比如芸那么想去不同的世界看看，作为那么爱她的老公，实现这个真的很难么，他们可以象梅林达一样边旅游边打工啊，反正也没孩子的牵绊。还有电影最后芸的父母终于告知了隋有关女儿的心脏问题，我就想问，他俩结婚前，或者这共同生活的十五年间，他竟然不知道这个？！ 3。Maybe黄轩的演技也是电影创作的初衷之一吧，毕竟他的表演是可以撑得起一部正经八百的片子的。 4。中国现在的确是强大了。所以，我们现在终于知道当初身边的朋友、同学、熟人等移民海外都经历了怎样艰难辛苦寂寞的生活，所以是现在而不是十年前，这样的电影主题的确很合适。 5。还是回到猜想的电影产生初衷，所以我觉得好像很明白为什么这部片子只有黄轩、杨采钰和徐帆几个主角，然后配角一堆老外，这是最省事儿的私家班底么。 6。电影中的新西兰的确美的像一幅幅画，但是对于已经去过二十来个国家但还没去过新西兰的我来说，看完却没有太多想去的欲望，也许，是美景之中蕴藏的深深的深深的寂寞，让我不想靠近和探究。,37.0,7.0,13
26,26,33436135,只有芸知道,b66de7a070a588935e2e652dcc2c6243,45b82062e806ef69a21e95e26456612e,4.0,2019-12-16 02:41:35,这部电影不管是视听语言 剪辑 或者是剧情 我都觉得很好啊 至少达到且高于特别多国产片 在不满意什么呢 ？ 演员演技不好吗？挺好的吧 男主女主都没有一个人会让人觉得“不行跳戏跳戏”他们开心的时候难过的时候 都很牵动人的情绪 林太也很好吧 武汉话居然也可以说的这么温柔 在怀念死去的老公的那段也算是全片感人片段之一吧 全片塑造的人物不都挺丰满的吗？ 细节不好吗？男主给女主的骨灰盒扣了安全带 两人初来乍到国外生涩的口音到后来越来越流畅 最后的凳子是蓝色的 他们狗的名字叫blue 剪辑不好吗？正插倒三合一 居然可以做到根本不乱 也完全看懂导演在说什么 就算出神了也知道到底在表达什么 这种叙述方式用这种剪辑可以这样我觉得已经很难得了啊 病房那段打光设计的不好吗？女主在阴影处男主在光亮处 最后两个人一起进了阴影处 嘴上说着你会好 但是所有的表现都是“我真的不会好了 动手术动完我也没了我们心知肚明了 但是嘴上还是在安慰安慰” 而且有些人真的非常败兴 说这个电影很烂的原因 就是因为女主不坦白病情 这是在骗婚 听了女主的爸妈说了句“这是你替她抢来的十几年”所以觉得看了都要气死 看完的感受只有气愤 最终得出了婚前体检很重要这个结论？ ？？？？我晕 你是去电影院看电影 还是去法院听民事案件？这是什么理解啊请问？要表达的难道不是感谢男主带给女主这么美好的生活吗？ 这简直不亚于《末代皇帝》溥仪拿出了蟋蟀结果最后有人在那边大喊“蟋蟀不可能活这么久”一样让人解嗨,4.0,1.0,42
27,27,33436135,只有芸知道,b78a697f02989a8566aff6e5aca349e0,a7a20c83329456f1ea12b1874a9abe64,1.0,2019-12-15 19:04:17,"因为这是根据真实事件改编的电影，所以写下评价前我必须声明，我是没有资格评判他人的生活与爱情的，对于他人的人生我只有敬意，以下言论仅针对作为文化产品的改编电影《只有芸知道》。

之所以写声明是因为我非常讨厌这部电影，甚至觉得这个故事的结尾令我觉得恶心和愤怒。

《只有芸知道》是一个爱情故事，风景拍得特别美，主角杨采钰也特别好看，但是作为一部商业化的电影来说，我觉得它是失败的。因为它的故事真的很平淡，全片几乎没有什么戏剧冲突，作为单身狗，看着主角在大银幕上谈两小时恋爱，我的难受和煎熬是多过于感动的。我旁边的老夫老妻也在电影中重头的病院戏说了一句不耐烦的“紧裹（还在讲…）”，我看的那场也有个别忍受不住平淡剧情中途退场的观众。

当然，要作为文艺片去看这部电影，也还成，偶有感动，但是这部电影的结尾太恶心人了。

下面涉及剧透，谨慎观看。

女主心脏有问题，医生说活不过20岁，但她却隐瞒了这个情况嫁给了男主，死之后男主才知道这件事，女主父母感动地对男主说“这多活的二十来年是你替她向老天讨的。”

？？？？？

开什么玩笑？！我认为夫妻间最重要的就是一个“诚”字，这种不知道什么时候会死的大病结婚前就该说清楚，要不然应该叫“骗婚”！女主也知道“半路留下来的人苦”，但她却这样骗了男主一辈子……女主做了这么自私的决定，你却跑来告诉我这叫爱情？

女主这多活的二十来年不是向老天要来的，是向男主偷来的！！！

试问一个男人知道自己的老婆随时会死，还会想着房子生意和安全感吗？他们的生活还会平淡地在村子里过15年吗？当时的男主还会放弃自己的音乐爱好吗？这个女主的癌症还会直接拖到晚期吗？

一个结尾自以为聪明的反转，毁了前面所有的小感动，一段相濡以沫的爱情立马变成了一个婚姻陷阱……所以看到最后我除了愤怒，真的什么感觉都没有。

最后提醒大家，婚前体检很有必要。明知会失去却还敢去拥有，这才是真正的爱情，所以请给对方一个“明知”的机会。",5.0,1.0,14
28,28,33436135,只有芸知道,2ce78d3da466d4003cae8cea1146c671,eae835e83c0494a376229f254f7d3392,1.0,2019-11-28 01:33:33,自从《私人订制》，我就对冯小刚很有意见，利用影迷对他的信赖拍烂片圈钱，让人心寒，不会再花钱看他的电影了。 说回《只有芸知道》，预告片给我的感觉是三个字：“不真实”。这显然是一部文艺片，故事超越现实正常，但表现手法假里假气，扭捏作态，难免让人怀疑冯导驾驭文艺片的水平，甚至是否懂什么叫文艺片？ 冯小刚以前的电影还不错，有一点对底层的现实主义刻画，有一点幽默的艺术，但我怀疑这些都得意于王朔的编剧。 后来的《非诚勿扰2》较差，《我不是潘金莲》像白开水一样无味，或许他真的江郎才尽了。,2.0,,62
29,29,33436135,只有芸知道,be2ade635c507e6807008d8beb90efce,dfa7def093f2a40838258f60fe23319c,4.0,2020-10-06 01:44:34,不是只有芸知道，看进去片子的人都应该能知道，深深的知道。我不喜欢看太虐的片子，因为要么就是纪录片太过于真实主题明确表达社会现象，也不喜欢太矫揉造作的片子，什么都是刻意的给你看，你猜也会猜得到只是懒得换台懒得走而已；这部片子我觉得就是淡淡的浓愁，为什么是淡淡又浓愁？自己再激烈争斗撕心裂肺在别人看来都是尔尔，能得到共鸣就是成功了。我挺喜欢这部片子的叙述风格，特别是找到一个match的人一眼相中的人，就是个好人，就是个长相厮守的人，愿意把什么好的都给彼此，没有什么别的因素，片子里有一句话：你就是我最大的安全感，这其实就是人生扶持的意义！虽然可能没有Melinda一样潇洒到处飞实现自己小小愿望，但最大愿望就是平静的安在美丽，太美丽的景色里，根本没必要再去寻找，因为已经找到了自然和人相容的栖息地了！所以我有时候爱山喜水，就是希望回归到自然里，但同时保留社会人的属性，他们就做到了！而且还有一条狗，还有激情~（恶趣味了~哈哈）！人美，自然也美，又有社会价值，ok了，我觉得是上天也嫉妒了太完美了，所以要跌宕所以要呈现给我们看确实有，而且是真实的，可期的！！ 所以我会说知道了，确实我们摆脱不了圈，摆脱不了周而复始，摆脱不了周围人认为是对的而自己却不这样认为的事情，更摆脱不了羁绊和束缚~~我们只能在有限空间内做的随心，随意~且这个随心随意是有意义的（不是看抖音网游浪费时间的随意），而是有一件事没有尝试过，有一个小理想还没有开始过，有一个地方还没有去过，尽力去做释放天性的去做~这也就是尽可能的点点改变了~因为不想失去本心，不想失去稚气，不想活的一马平川，不想“ 梦想被稳当往里藏 ”，就算平庸也要自己心里爽~~~ 当一无所有的时候反而选择是最轻松的~一旦拥有好像就背负了很多扔不掉的东西~~我个人一直在强调跌宕经历，有了这些自己才会不停的思考，总结结晶~长大用成熟坚硬的壳去包裹着幼稚的心，最终还是回归自然的平静~ 从小就知道会有这么个人~这么段经历~这么个故事~,1.0,1.0,0
30,30,33436135,只有芸知道,541c569061d023ca8d802fc93ce91b22,f75e8937c59c613872ab3658331af29a,3.0,2020-02-23 09:12:39,"女主小芸是一个从小‘不幸运的人’, 但一人却又很幸运地度过了一生。作为观众总是会被这样的爱情惊讶和在这个故事是被真实事件改编的两极中产生疑问，接下来我来具体分析一下他们的爱情。  她的好运气让她遇到了好房东，好室友。在房东的介绍下还有北京缘分东风向他求婚了，但是她拒绝了，理由是她不会给东风带来好运气的。之后，也许是她想和命运赌一把，比较戏剧化的出现了在赌场定终身的一幕，就像用尽了所用运气遇到了你和你在一起这句话说的那样。  他们在一起之后就是安家，不停的为女主维护让她感受到安全感的东西，鲸鱼，狗还有餐馆。开中餐馆认识了Melinda， 这个生活充满着可能性，来去自由的女学生。我觉得她后期的离开寄回来的明信片都是让女主不安分的情绪逐渐激化，想去改变又不知道如何做的催化剂。 这是她做的就是对东风说，没有我的日子你想怎么过，还有在大树下的依偎，问东风说，难道我们就开一辈子餐馆么？东风都是淡淡回应，并没有把问题深入，倘若他能再深追一点，是不是就不会有餐馆的这一幕呢？餐馆的着火，让女主变得对东风自责，更加不敢向她多说，两人出现了隔阂。 然而后来这些安全感都依依走丢的时候，女主心里受伤了，后来又被检查出来身体上的癌症。  对于男主来说，他更多的就是陪伴和满足小芸想要的，有你在的地方就是家。为他涂满整个墙壁的鲸鱼，一起照顾布鲁，还有最后开车几千公里去完成小芸的遗愿。令我最印象深刻的就是她后来生病男主在病床上搂着她互相回顾一生说心里话的片段。他们的爱情美么，我觉得是美的，看得到的当然是男主很爱很爱女主，但女主同样也深爱着男主，以一种默默的在心里的爱的方式回报东风。他们的日常不是喧闹的是安静的，不在中餐馆工作的时候他们就会一起静静地坐在大树下边，墙边，默不作声，时而说一些话语，抽着烟眼睛看向远方。在他们刚搬过来的时候，东风问小芸，这地方真的太安静了，小芸回说有你在日子就不无聊。看得到的当然是男主很爱很爱女主，但女主同样也深爱着男主，以一种默默的在心里的爱的方式回报东风。 他们的爱情就像涓涓细流，不停得滴灌对方，无形亦有形。",2.0,1.0,0
31,31,33436135,只有芸知道,fbd78069deb6158a6fcfaa927f92537a,705da23959fa17c5d11d7a53a6157a19,3.0,2020-01-31 18:11:42,"我认为冯小刚导演的剧作结构有很大的问题，并不仅仅是电影段落的排布混乱，还在于描述的方式，如果把本电影改为普普通通的回忆形式，从开始去讲起，至少会比现在的段落要好。
      还有，如果想要表现出忧郁的女主角，那完全可以让女主角不出现，直到最后登场，会比现在的角色形象更加爆满，但考验男主角黄轩的技法就高一些。但多数的情节来看，都是黄轩的演技在硬撑剧情点，让观众多少有点无感。
         还有就是，我本来认为这是一部显示题材的电影，但从电影的内核来看，导演很明显想要加入喜剧的外衣，但很明显并不成功，尴尬的笑点放在这个严肃的剧情之中显得很生硬，至少观众看来是如此，各种不符合常理的事情也有很多。
        但要承认冯小刚导演的导演功底依旧，优美的构图和冷暖色调的装换就显得电影高级了不少，是多年导演的积累在支撑，很惊喜小刚导演在拍过很多喜剧片之后还能不忘本，拍出成片质量这么高的电影。",1.0,1.0,0
