,Unnamed: 0,电影id,电影名称,用户id,用户名,评分,评论日期,评论内容,有用数,没用数,回应数
0,0,33436135,只有芸知道,42ea451216582c06e3525db984737a1a,1d805e7ff170f5152313dcab064b71a3,1.0,2019-12-21 20:10:07,看的时候影院后排有人打呼，还有不少人玩手机，我也发了十几次信息。这不代表我们不懂爱情，欣赏不来纯爱，否则我也不会贡献这个票房。但我想说，爱情和矫情是两码事。 女主体弱，男主忠贞，一男一女不食人间烟火谈情说爱的片子不少，头一次看到靠赌博发家致富的。两千块全押熊猫的时候我心想，要是中了可真是连两星都不配，果然……搏一搏，单车变航母。 不收房租的房东，要看极光有极光，要看鲸鱼有鲸鱼……全世界都为爱情铺路的傻瓜剧情，原谅我年纪大了，实在入不了戏。 根据真实事件改编就能成为烂的遮羞布？观众没法共鸣就说是私货？那你别搬上大荧幕啊！好的故事拍得再朴素也能叫人落泪，但烂俗的梗和台词，人物再怎么哭的稀里哗啦，再怎么靠美景撑场面，再怎么从头到尾的煽情bgm，都毫无灵魂可言。 最莫明其妙的梗当属女主的极光心愿，因为自家的店困住了自己，所以想毁了店？真是满脸黑人问号！！！大姐，你已经靠赌博赚了第一桶金，在风景如画的新西兰有一个独栋大房子，还有一个生意不错的餐厅，有一个爱你的丈夫，你还要怎样啊？如果说你是富家千金，这样为赋新词强说愁也就算了。你明明是个向天借命，多活一天都是赚了的人设，怎么就突然不知足了？你让荧幕前天天吸雾霾、加班如狗、挤公交地铁、背几十年房贷、连病都不敢生的我们如何共鸣？ 先天心脏发育不好的女主，一会儿弱的像黛玉似的，但遇到抢车位、吃白食的，突然秒变杉菜上去就骂……就为了显示男主的纯爷们，设置这么个脑残的青春偶像剧剧情，还敢再low点吗？顺便吐槽下女主在浴室晕倒的姿势，还能再不自然一点吗？ 全片充满了不接地气的矫揉造作。男主爱吹笛子，自从开餐馆后就没吹过，就为了写他为生活放弃理想？可明明二人还带着狗散步呢，怎么就没时间吹笛子了？狗的名字叫blue，最后男主又养了只blue，树下放个blue的椅子，蓝色生死恋？几十年前韩剧玩剩的套路。 总的来说，餐馆的妹子很招人喜欢，徐帆演的也很好。最后灯亮的一刻，我听见旁边女生由衷说了句，终于结束了……作天作地命不好，我这个买票的傻逼命更不好！,410.0,86.0,240
1,1,33436135,只有芸知道,5511669a11cc15ce6e792bc60ebc04d1,55a773625640ee9f335e0faffde6d6b4,1.0,2019-12-17 10:26:55,长话短说，冯小刚的又一部爱情电影，很容易让人联想到大概十年前的《非诚勿扰》，不管是内在表达还是风格处理冯小刚仍旧保持着他的特点，虽然在我看来保持下来的特点都不是作为电影的优点。对于冯小刚来说，电影的情感传递靠的不是真正意义上的属于电影的语言组合，不是一种状态和氛围，更不是通过视听的设定去挖掘人物内在的复杂性，而是音乐、风光与人物无时无刻不在蹩脚煽情的台词。最明显的就是音乐的使用，开场没有几场戏，就起了两大段音乐，一段纯配乐，一段歌曲，后面更是不用说，即便在这样一个歌颂相濡以沫的爱情电影中，也显得是一种滥用，总希望能够通过音乐快速、直接、凶猛地把情绪给到因为处在电影院洞穴里而十分脆弱的观众。对于电影创作来说，其实是一种最偷懒的做法。继十年前的北海道风光之后，我们又来到了新西兰，依旧是同样味道的风光宣传片。 有趣的是，电影中男女主人公居住了十五年的那所大房子，是从一个外国人的手里买到的，在门前交房的情景特意突显出，男女主人公是从大城市来到安静的乡村，比起大都市更喜欢安静遥远的村庄。这个外国人屋主表示，最初他与妻子来到这里，也是因为喜爱村庄的宁静。等到十五年后，男女主人公把房子出售给另外一对年轻夫妇的时候，他们依旧强调他们之所以离开城市就是因为向往和喜爱乡村的安静，希望能够给孩子提供一个美好的成长环境。接连三次的强调不管从哪个方面看都决不是无意识的设置，相反，也许这才是藏在这样一个爱情故事背后真正拿住很多观众命门的东西，可以说是爱情的诗与远方。回想一下今天会让我们疯狂讨论的社会新闻有哪些，关于996，关于社畜生活，关于剧烈竞争时代每个人的压抑、焦虑，甚至是关于真挚爱情的遥远。 事实上，开篇那首木心《从前慢》的引入就已经显现出创作者最大的考量是什么。冯小刚在这部电影中给了观众全部，异国乡村的风光、完满的运气、可爱的宠物、绝美的爱情，包括所谓更自由更有意义生活的追寻，在电影中梅琳达这个角色主要承载着这样一个功能。这种气味让人感到非常熟悉，似乎就是那些畅销旅行文学的质感。并不是说表达这些不好，只是和那些畅销旅行文学一样，这部电影的表达能够让人非常直观地感觉到，不是真正对这种生活的描述，更多地还是一种遮蔽性的传递，一种想象，或者说带着强烈冲动、自我感怀的想象。所以我说，郭敬明是怎么写有钱人的，冯小刚就是怎么拍爱情戏的，意淫是关键词。但对于今天生活在这样布满紧绷和怀疑的社会中的很多人来说，走进电影院，冯小刚用极致的视听洗脑攻击你的感官，很容易就会有拙劣的感动，并且痛点如此准确，日。电影在这里完成了它被观看的使命之一，如同梦的本质，通过银幕的观看完成想象性满足。 看着我旁边被打动而流下真挚泪水的姑娘，真的心疼。不希望电影创作者是通过强J、剥削观众感官的方式来让观众首先从生理层面感动到不行。这样让人感动，不管观众意愿为何，在我看来，真的很不好。,242.0,63.0,220
2,2,33436135,只有芸知道,976170af1c149d543af087505222852f,619e5827f76ab558c351585a9800f738,2.0,2019-12-29 12:17:26,拍完自己的故事，冯小刚讲起了朋友的故事。 《只有芸知道》猛放音乐狂煽情，大美风光新西兰，这都是熟悉的冯氏老套路。明眼人却看得出，冯小刚每一步，都走得小心翼翼，不敢有任何越线造次，更不敢去拨什么弦外之音。加上黄轩文工团演员的角色设定，不少人难免要以为，冯小刚是不是在赔偿好人刘峰在《芳华》的巨额精神损失。 很奇怪的事情发生了，以往不喜冯小刚作品，因为他总有鸡贼的算计。哪怕沾上大历史，依然不改其投机的立场。《只有芸知道》却活像二十多年前的《永失我爱》等通俗爱情，遗憾水平没进步。旅拍Style，MV风，公益广告主题，导致画面滤镜太浓，电影感适得其反。它的闪回叙事，穿插引入，相当有耐心，无奈故事一直在原地打转，没有任何真正的冲突矛盾发生。  只有椅子知道  电影讲述一对漂泊海外的年轻华人（北京人），他们交上了好运（相遇相识结婚），又用十五年时间（买房养狗开餐馆），耗费掉了这等运气。一时人生如梦。未见鲸影，先识鲸落。 《只有芸知道》的局限性在于，打着真实故事改编旗号的电影，冯小刚也确实被感动了，可作为故事本身，它更像老掉牙的绝症爱情（罗芸有先天疾病），而编剧甚至没有想过包装加工得好看一些。 电影里打动观众的点，一处是埋狗。狗的遭遇，和罗芸差不多，一直在忍耐。一处是撒骨灰，实现妻子遗愿。冯小刚把这两个地方拍得十分细致，譬如两次去宠物医院，多次在大树底下陪伴偎依。问题来了，把两处段落从电影里截出来，易名、模糊掉演员角色，依然不会减损它们的煽情力度。 道理很简单，观众会产生恻隐之心是基于我们的人生常识，而不是这个电影剧本的特殊性。这些东西，网友自制的朋友圈短视频也能做到。《只有芸知道》的问题就在于它不是无法复制的爱情案例，而像是无意复制了其他绝症爱情。只不过，它拍得更加平淡如水。长达132分钟的电影，也非常适合谱写各类感动文案，发在朋友圈。 好运气是《只有芸知道》反复触及的话题。对罗芸来说，她能遇上隋东风这一辈子最大的运气。在隋东风看来，他从逆境走出，是明白了罗芸才是老天的赏赐。 作为恋人，他们反复遇上了好人相助。好心的房东，开朗的服务生，就连“不怕你赢，就怕你不来”的赌场，也匪夷所思地给他们一笔买房基金。 可是，观众被麻醉的同时似乎忘了，电影并没有解释，这对北京人是交了什么好运，他们缘何要到海外闯荡。全片故事里，隋东风好像孤身一人，而罗芸父母也放任有重疾隐患的女儿在南半球生活。这对幸福的人，根本就是活在真空，在几个情景之间，来回移动。 另一方面，《只有芸知道》也揭示了现实婚恋问题。男人总以为钱赚够了，可以给人生放个悠悠长假。结果一晃，就过了十五年。明明那么容易看鲸鱼和北极光，他却真把十五年时间拿去喂狗了——那可是在新西兰啊。 电影动辄赏极光、看鲸鱼的高配难度项目，这都是建立在冯小刚老一辈人的经验基础上。对于二十多岁的当下年轻人，这些早写上人生清单，并没有那么难实现。《只有芸知道》兜兜转转，只为解决这两项早已小清新的游玩项目，浑然要把它们演为人生不可承受之重，彻底失去了平衡。  南岛中餐馆  《只有芸知道》就是拍得笨。即便它努力要讲一个打动观众的爱情故事，可是，却很难让人产生深刻共情。原因就出在隋东风和罗芸看似每日同油盐酱醋烟火气打交道，可这个故事被过滤得过于干净，近乎干瘪，就剩下读者文摘上的人间有真爱故事梗概。如果不是最后回到奥克兰的年轻岁月还有点冲劲，有未来可期，隋东风的人设简直无趣到匪夷所思。你想想看，关掉馆子以后，他居然去当一名社区警察，完全不记得妻子到底想要什么样的生活。 无怪乎很多人说，电影里，演得最好的是那条叫布鲁（Blue）的狗。 这样说可能有点侮辱人。演得最好的，是给黄轩递狗绳的小老外。 刊载于《新民周刊》  到底谁知道,69.0,20.0,26
3,3,33436135,只有芸知道,fc1b09503e98ae1a090c3660299cc76f,88068e33c78eb72f1b371c7110846085,,2019-12-25 15:42:47,"我是先看的电影，后看的影评。这么一趟下来，有些感触。 首先，这部电影是朋友的邀请下去看的，看之前对这部电影抱有的期待六七分的样子，不是很高。但是看完之后，我陷入一种莫名的情感里无法自拔。后来我仔细想了想是什么，明白了。看完这部电影，我是真真切切的对隋东风和罗云的爱情感动了。（说句个人看法，我看完电影，我是特别喜欢杨采钰这个演员和杨采钰饰演罗云这个角色。当我看完她演的这个角色，让我有一种想马上进入电影之中，成为隋东风这个人，陪伴着着罗云走那几十年的路。这是我个人看完电影的感受。） 看完电影，我觉得演的很真实，对我也很有触动。但是当我看完数个影评以后，我真的是....有的说这电影矫情，有的说这电影逻辑不强，有的说是新西兰宣传片等等。但是我想说的是，这部电影我看的过程中并没有发现其中的逻辑不强，也没有感受到矫情。同时也没有觉得它就是新西兰的宣传片，我感受到的都是两位演员演绎出来的真情实感，我没有去刻意想那么多。我可能个人本身逻辑不是很强，有时候我看电影习惯跟着导演的镜头走。例如想电影中，隋东风到国外考上音乐学院，但没钱读书。后来打工，具体挣没挣到钱。电影里没拍。但是我觉得这个不拍无伤大雅，为什么就一定要按逻辑走呢。导演不拍就有他不拍的理由，甚至说导演忘记拍这个镜头，又能怎么样。导演想表达的，就是隋东风没钱上学，租房子偶遇罗芸，之后的一系列故事。为什么一定要把隋东风具体挣没挣到钱，为什么不继续读书等一些镜头拍出来呢?还有我看到一个影评说“
饭馆里来了一个的恶汉，由于观众都知道芸最后会死。所以当观众看到这恶汉身上有枪，很自然的就想到了，芸是死于这次枪杀。结果呢，虚晃一枪，啥事没有，人走了，而且饭馆接着开。这个惊心动魄的事件产生的唯一结果就是，他们跟这个姑娘的关系更好了，仅此而已。那搞这么一下干嘛呢？就是让大家误会一下，你们是不是以为芸被枪杀了？哈哈，不是！猜错了吧！是这个意思吗” 我不知道各位看完这个影评什么想法，或许你可能会说这个影评分析的很正确啊，他就是这么没有逻辑，这个事件发生就是没有多大的用处啊!可是我想说，为什么一个事件发生了就要有很大的作用。假如，这就是导演朋友真实事情发生过的呢，导演就想给他拍出来，未尝不可啊。（不过我只是说假如真的发生过此事。）导演并没有想让此事件对整部电影产生多大影响啊。虽然说，逻辑上这个影评说的很到位，但是各位，这是爱情片，我们不要太逻辑了好吗?爱情片感受的是情感，不要把这种片也太过于强调逻辑了!还有那些写影评说这片子丝毫没有逻辑的，看电影途中玩手机，吃东西等等的。我想说，你们的思维真强，你们就适合搞科研去，适合去当侦探，按着超强的逻辑去推理断案，去搞那些实验。你们就是没有感情的机器。不管是前面那些镜头，还是后面真实的描述，让一个有那么点感情的人看了，他看了都会有所触动。我不知道为什么会有人觉得无趣。 还有一些人说，我根本感受不到这电影带给我的情感。我只能说每个人经历的不一样，年龄不一样。或许这片子，让你们四五十的人看了，就觉得小儿科，矫情等等，但是也有四五十 ，五六十的人看完之后，觉得这个电影真实，他们看到了这就是我们的归宿。而我们这一辈的年轻人，还没有经历那么多爱情，我们感受到的就是对爱情的美好，对那份爱情可以长长久久的羡慕啊。 真的各位，我们不要把这部片子完全按照合理的逻辑走啊。微博上，也放出了冯小刚和挚友在车上，改台词的那一段视频。两个年过半百的人，坐在车上，点根烟。说着那些话，完全都是真情实感的流露。那个视频结尾处，冯小刚导演抽着烟说完那些话，留下眼泪。他的挚友听完也是下车去了，他再想起他的爱人还是会心疼。这部电影想流露的就是冯小刚的那种情感。这里边可能存在逻辑不合理问题，但是请不要把他们都一一挑出。那样就真的没意思了。那个视频我反反复复看了好多遍，真的感动。导演的挚友和他的妻子的爱情，是我这一辈子要用心体会的。我也希望在以后我可以遇到这样一个人，我也可以也一段相濡以沫的爱情。",355.0,15.0,122
4,4,33436135,只有芸知道,1c7eeda92b5f4f5197ef9d069e30ed10,2c519cf87b60c94db8dcdd2ebbdc2150,2.0,2019-12-19 09:35:31,在开头声明一点：这篇影评并不针对故事原型张述和罗洋老师，也不针对黄轩和杨采钰老师，仅仅是表达一个普通观众对张翎编剧和冯小刚导演的《只有芸知道》的个人观感。         看完这部电影，贯穿始终的一个感觉：尴尬。         首先，看各种影评，做好了电影没有什么情节的准备。看完我觉得说电影没情节是不对的。电影通过隋东风在罗芸去世后，相继去克莱德、海上以及罗芸北京的家安放罗芸的骨灰，然后在这一过程中通过倒叙（而且在倒叙时没有直接以线性叙事，有选择性地打破故事发生顺序），交代了隋东风和罗芸一起度过的三段生活：在奥克兰相识、结婚；从奥克兰转战克莱德开中餐馆；离开克莱德后返回奥克兰，罗芸重病去世。这个架构是OK的，也考验编剧、导演、剪辑等人的功力，从大方向看是没有问题的。但是，具体到每一段落的叙事时，明显感觉到编剧和导演是硬生生地通过一些生活场景拼凑情节，给我的观感是，机关领导列好发言大纲后，秘书从网上东一榔头西一棒子down了一堆东西，堆砌后交差完事，不排除偶尔有灵光乍现的金句出现，但掩盖不了平庸乏味的本质。         我讲一下二人在克莱德开餐厅的故事。这一段作为二人重要的相濡以沫期（整整15年），导演安排了哪些情节呢？我觉得主要归结为三个方面：二人装修餐馆时爱好环球世界游的麦林达（音译）从天而降（这样的安排电影中比比皆是，比如来一只狗了、餐厅来一场火灾了、来两场赌场胜利、来两次病魔……），这以后在片中以二人挚友的角色贯穿着；二人在餐馆回家路上或者自己家里，有一搭没一搭地逃离厨房油烟味后，聊着鲸鱼和罗芸一直未填满的安全感；收养一只狗，某种意义上是罗芸不能生育的替代和寄托，二人都寄予了很深的感情，但是很不幸狗得直肠癌不得不安乐死去。任何一部电影想要输出情感，必须做到技术上（主要是剧情设计层面）的精确。冯导在这一段故事中，想要输出的上述三种情感，有多大程度做到了呢？         从二人有麦林达这样的知交挚友这一条来说。很抱歉，电影中呈现的日常的餐馆交流、夜斗吃霸王餐的持枪者，甚至收到麦林达的明信片、坐直升飞机探访麦林达看极光，我只看到很平庸的情节铺展，这些情节就像电影中总是爱出现的隋东风和罗芸充满仪式感地倚在一起或倚在树上及房屋的画面以及隋东风和罗芸那些尴尬的语言梗，除了刻意的设计和潦草的剧情需要，完全让人get不到这段真挚友谊究竟为何发生、体现何处、又为何延续。         至于二人的爱情，同样陷入了叙事很没说服力的困境。开头鬼片一样的设定后，杨坤的音乐就出来了，旋律好听歌词也很感人，但就是感觉很乱入。隋东风在去克莱德的路上（电影中关于长路和远方的镜头特别多，我承认景色美，但也仅仅是景色美而已），到达后与麦林达相遇，展开了上面提到的15年的相濡以沫期。看之前我对自己说：网上都说这是一部很感人的爱情片，那种平凡人细水长流、润物无声的感人片……从开始我其实一直在期待，来吧，导演，尽情地戳我的心脏吧……一度被磨得没有耐心的时候，我都自我催眠，大招在后边，那些微博大V还是很在乎自己声誉的……实在忍不住的时候，我看了下手机，已经开场39分钟了……而剧情一再展现给我的，仍是隋东风和罗芸像两个刚进剧组的演员，接到任务要演一对情侣，两人在编剧和导演的拙劣安排下，卖力地配合演出，自己给自己加油鼓劲：我们是那么相爱的两个人……那些相拥的时刻、那些汽车里的告白、那些卧室里急不可耐的情欲戏，请一起为他们加油……很可惜，除了看出来隋东风和罗芸是两个扁平化的好人以及他们的假客套外，并没有感觉到这对情侣感情深在哪里、为何而深。         而且，后面只有罗芸知道的秘密之一，就是在所谓的世外桃源这里，一直有着一颗向往远方和诗的心，也就是说，soulmate，根本不存在的，隋东风知道罗芸的内心世界还没有所谓的闺蜜麦林达知道的多。仅仅让人觉得两个好人得有多能忍啊：隋东风在克莱德拥挤的油烟中坚守着卖力挣钱，兑现林太所谓的安全感；罗芸在所谓的世外桃源般的牢笼里隐忍着内心逃离的渴望……而且两人一忍就是15年！我一个旁观者，都觉得这种生活有些boring了，我们的男女主角，两人宿命般的老好人，苦苦撑了下来（对于他们这种老好人思想，我觉得真的应该在民主生活会好好批斗一番了），尤其是女主角，还隐藏得那么深。我并不是说平凡之中没有真情，真情有时就是平平淡淡，我看《平如美棠》的时候也会感动，但是很遗憾，看电影的时候我只感觉到尴尬。那些看似文艺腔十足的灵魂交流，甚至那些对情节助力作用几乎为零的旁白，时刻暴露出编剧和导演拙劣的叙事能力。我不否认他们铆足了劲，在自己的理念池注满了各种深情厚谊，正像现在那些影评所鼓吹和兜售的，但是，想是一回事，做到又是另一回事。         相濡以沫期作为重头戏，在我的观感中，除了在具体场景玩转花样调度、演员拼尽全力装深沉卖力演出，做到有限度的精致外，这些缺乏内在深层次关联的机械罗列，并没有完成整体层面的叙事效果。至于后面的一见钟情、赌博式婚姻，甚至后面的重病去世，其实在某种意义上已经不具有多大说服力了，何况这些叙事几乎和相濡以沫期一样，中规中矩地选取事件，平庸乏力地完成叙事目的。电影中让我觉得有些尴尬的场景是，一次是隋东风在兽医所楼道哭泣，旁边知心阿姨说我懂你的感受，一次是隋东风在渔船上给船主讲完故事后，船主打电话给自己妻子说“I love you”，我的妈呀，9102年都快过完了，还玩这种浅层次的人情梗。         整部电影看完之后，给我的感觉就像我开头对电影大纲的归纳一样，编剧和导演用足足的132分钟（算了，反正我的时间不值钱），仅仅做到了告诉我一个故事梗概，就是一个异国他乡漂泊的情侣情深不寿的故事。而我真的发自肺腑的说一句，我是带着十分的诚意和百分的期待，准备去邂逅一场沉浸式的情感旅程的。而张翎和冯小刚，只给了我一张导航图。         看电影过程中，导演有意无意选取明信片般的风景镜头，再配以简洁的音乐，那一瞬间我以为走到了《断背山》的片场，不好意思又要吐槽了，同样是多个时期的段落叙事，《断背山》为什么能从平淡的生活流中截取事件，到最后积蓄成感人至深的冲击力，编剧和导演你们如果真的在学习和致敬，不应该只学到皮毛。另外，关于两个漂泊他乡孤独的人相恋的故事，华语电影里也不是没有先例，不怕人笑话，我重温一次哭一次，电影叫《甜蜜蜜》，拜托编剧和导演了解一下。         几乎两年之前的同一时间，我也是冒着严寒去一家影院看了某部电影的点映，当时好像也是被评论蛊惑，准备邂逅一场情感洗礼的，但看完电影糟糕的叙事之后，我在豆瓣短评留下了“完全get不到冯导的表达点，叙事感觉真的很一般。。。”的评论。没想到惊人般相似的历史又这么快故伎重演。而且，我个人觉得，《芳华》的质量与口碑和票房是名不副实的（甚至包括现在豆瓣7.6的评分）。如果套用一句网络流行语，“谁给了冯小刚拍《只有芸知道》的勇气”？我觉得是两年前的虚假繁荣给的，我现在只有一点期望，《只有芸知道》千万不要得逞，否则2021年12月估计冯导又要搞什么温情大戏了：打着情怀的名义，枉顾叙事的乏力。,198.0,38.0,150
