,Unnamed: 0,电影id,电影名称,用户id,用户名,评分,评论日期,评论内容,有用数,没用数,回应数
6,6,33436135,只有芸知道,afba7e61655d756f7af4ab3b3674ffa4,e9b44867a1c171bf09189e0c75a803d2,3.0,2019-12-22 08:55:20,"昨天上映的冯小刚新作《如果芸知道》，看了预告暖心温情，今天跟友人看完，有些想法不吐不快，可能跟主流的很多观后感大相径庭，但只想带你透过现象看本质，提升认知，更加深入的思索，顺带做一些情感科普，看到那个虚幻光影下所透露出没有告诉你的人生真理，多一种可能性更加全面的看待后再去思索你想要怎样的人生怎样的感情。当然以下论述仅代表个人观点。（如有雷同，我也不管~）




￼



写在开始


可能有部分剧透个别章节和片中的表达，旨在探讨。

先上一波网络评论

（不知道怎么回事复制过来的图片都发不了只能发在文末了…）



通篇大部分人就是好唯美好感动，羡慕这样的爱情，“一生一世一双人”，然后海报也是，打出来就是宣扬一种价值观，问他们对方你想过怎样的人生和生活？就是一句“有你的日子，就是我要过的日子”。。。


等等两个人大眼瞪小眼嘛，就两个人待着嘛？啥都不干还是随便找个活计怎么过怎么活什么都不重要了。。。


影片其实展现了很多不健康的婚恋观包括一些行为过于美化忽略事实，以至于最后就是演成一个童话大家YY一样。



￼



既然没人戳破那些美丽的泡泡，那我来简单说下它里面传递的一些观念和表述导致的人生悲剧在哪吧，可能真相扎心，但我希望更多的人其实不要走他们的老路。可能是因为自己做情感这个行业所以也会更加理性的去看待背后的一言一行。


按照时间顺序一一说说问题在哪？

本质上两个人的结合就是一个托付心态极重的女人和一个付出心态极重的男人，两个随波逐流毫无规划的人，没有活出自我，互相耽误，只是搭伴相濡以沫一辈子，靠给彼此的那点支撑和依赖，离群索居一辈子也没啥自己社交圈，相伴到老，感情最终告别尘世美其名曰包装了一个凄美矢志不渝的爱情故事。


各种影视作品也好，文学作品也好，似乎所有大众所接收到的信息就是“真爱至上，有一个对的人在身边怎样都是无所谓的，日子就是幸福的不负此生了，人生最高的需求是什么？马斯洛需求理论都有云 “自我实现”





这两个人的人生根本就是与世界乃至身边的人都没有创造什么独属于自己本身的存在价值和意义。始终挣扎在第一第二需求，找个人相爱然后怎样过都行，当然这也是大多数人一辈子的状态从未思索也没有去努力想说不一样的生活更大的世界来此一遭自己能够做些什么得到自身的价值感和成就感。




一 开始的结合




就像现在明星娱乐的八卦一样，一问起你们当初为什么在一起的，就是我们当初是一见钟情。。。哪有那么多一见钟情，片中两个人之所以能够走在一起，更像是两个漂泊异乡前路未卜又没太多社交的人惺惺相惜，而且重点是在同一个屋檐下，有心理学上的“曝光效应”由来，俗话说的日久生情，跟学生时代比较容易有人喜欢也是一样，天天看见的越多了解越多自然，前期彼此的了解互动开始产生了基础好感，再加上影片没交代啥前因后果，不过由于当时两个人的职业可推断，漂泊异乡混的也都不咋地前路未卜，出现了一个看似“老熟人”，以前还打过照面，就感叹一句真是“缘分”啊，主要是彼此当初都年少气盛，青葱时光，而且也没什么更好的选择不是。。。无限放大后，就这么在一起了。。。


那些桥段呢，就是所有青春片里演的一样，你像个男人一样的抗争勇敢，为我打架，感动不已，骗骗小女孩就算了，这种不打不相识的好感真的要扼杀在摇篮里，不然以后谁家闺女青春期还要担心被坏小子的英勇表现就把魂给勾跑了。。。





￼

二

答应结婚



女主因为男方一些好感的示意传递，立马主动送上门睡了，睡完男主第二天就是一句“嫁给我”。。。尊重下感情的正常发展过程好嘛，虽然浪漫都是演绎。女主说一句我不会跟任何人结婚的，有苦衷却不说，然后，就是直接来个“赌约”，赌场看天意决定自己嫁不嫁。。。自己什么早产儿心脏病活不久事实通通隐瞒，这里其实还涉及到一个伦理和人性情感话题的讨论，讲真在大家感情还没那么深厚的时候或者起码求婚前，伴侣彼此的身体状态难道不应该跟对方兜底嘛？


你一个人在那里赌命另一个人在指望着白头偕老，这难道不是一种自私和间接的情感利用嘛？更何况这还不是什么学历 经济负债情况 家庭背景这种客观条件可改变或者影响没那么大的，当然我不怀疑有重感情的人依然知道了会选择，但是直接因为害怕对方可能放弃的风险就选择隐瞒，一定程度上这不是害对方吗？


虽然说人生中天灾人祸也时有发生未来不可料，但是这种短命的身体状态怎么着也该给对方提前说说不是，片中是意外流产了没办法怀孕的，但如果真的能怀，妊娠在心脏病影响下也不一定能顺利生产。可能就会出现“保大人还是保小孩”这样的两难选择出现，先告知一下对方是不是才是一种尊重。当然除此之外，大一点的客观因素诸如经济 家庭等等也都是提前该沟通好的，而这一点女方原生家庭的父母也是帮凶，等到了去世的时候回到北京，女方父母才说出这些话语，在此之外从未告知，理性一点去看待的时候，我想很多人在面对一个随时可能会离开的伴侣多多少少会多一分的纠结。




三 安全感


房子和生意 供养者和寄生者


片中提到所有一切感情话题中永远要涉及到的安全感问题，林太那句“半路留下的人苦啊。。。”当然是承认的，但林太本身也是在这段婚姻中活成了一个寄养者的状态，年老也没啥喜好，活在缅怀之中，一生跟着对方，找到一个十全十美完美男人的定义就是“对方没有梦想，对方以你为重，一生围着你转，无限迁就和依赖”吗？间接你就是毁了他自己本来的人生。


还嘱咐男方给罗芸最大的安全感就是 房子+生意 也就是物质保障，这不就是找个打着爱情美丽外衣旗下 长期包养的饭票角色吗？揭露的依然是主流配对思想“男财女貌”，现实之下放弃了自己音乐梦想后，日复一日围着灶台转，领证结完婚 就需要下一步 赚钱 然后就是开起了餐馆 然后放弃梦想，日子开始重复，而这段婚姻中表现异常相爱的两个人，唯一 一次关于理想生活的探讨，在对方给了个你在就好，依然没有后续，不了了之


反倒是一个极光愿望成真毁了餐馆开始被迫改变，就是两个走一步看一步的人一生都在被动抉择中生存。一个给的心甘情愿 一个要的问心无愧，两个人打着珍惜的旗号却连内心希望改变生活的愿望都不敢跟伴侣坦诚沟通，谈什么真爱？女方其实挺自私的。。。




女方罗芸诚然是更被爱的那个，享受着宠爱的同时，真的有去理解体谅对方吗？真的有为共同的生活努力过吗？不过一生都是一个寄生于供养者的同时，说的好听，嫁鸡随鸡去哪都行，另一个角度而已，他们两个只是一段共生关系，并且是两个人都无法往前走进步，有所成长的关系，从来都没有主动努力付出想过如何去改变现状，深知连表达都不敢，借由愿望打破生活的平衡，始终都是男方在默默辛劳付出的讨好，而被需要给对方最大的安全感就是男主人生的意义。


女方几乎没有什么主动付出。珍惜是相互的，不该是因为对方说出爱你就是我人生的主题而沾沾自喜找对了人，爱对方应该是相互扶持帮助他找到自己的人生愿景，就像笛子音乐梦想也好，明明心底有，为什么爱人在的时候就是不可以去追寻就是必须要放弃的呢，死后才让对方有勇气去追寻，陪伴彼此尝试追梦的过程不也挺好的嘛，还是有手有脚的两个年轻人真的也不至于被饿死。。。


感情中最大的安全感不该只是来自于一方心甘情愿的陪伴，这就是严重托付的心态，把自己人生可以过得更好的希望完全交由另一个人去满足。而是自己有能力给自己给对方彼此带来的安全感。不该是共生状态，而是“独立而亲密”，才是最健康的状态。






￼



四 我们该拥有怎样的人生观


其实也是我最想跟大家去探讨的，影片看来更像是两个没想清楚的人互相耽误了一生，一定程度上可以这么说，两个人在一起不是仅仅只是在一起而已，24小时黏在一起日复一日真的有意义吗？你们本可以去做更多的尝试，体验更大的世界，经由彼此找到自己独立于彼此存在的意义才该是我们每个人的终极目标，而不是“爱情”，两个字，找到个人，人生就够了就算了


而他们显然也不是真的安贫乐道足够安于现状的人，不然也不会有两次的疑问打算未来，只是一想好难算了，就先过好现在吧。然后继续机械重复。这个问题在这里郑重的引申出来，你越重视越在意，开始的越早，你的人生或许会有不同的轨迹，过得更加清晰而明确，别逃避，去认真想。


就像片中一直有一条形成反差的人生轨迹在他们的身边，就是他们的雇员梅琳达，也感谢导演并行的把两种人生观价值观放在一起，触达到观众的时候有一定的对比和借鉴意义。


活出自我是我们来此世界走一遭的终极目的，当然这里提到一个认知问题，我当然尊重不同的活法，这里就涉及到我们是否愿意改变，当你的思维方式升级过后，你的考虑想法不同想要的东西自然不同，就像男女主和梅琳达就完全是两种人生态度。


梅琳达辛劳打工，然后攒钱接受教育 全世界游走支教 去肯尼亚看动物大迁徙 收养黑人女孩，在极光下许下“希望全球不再变暖，企鹅有家能回”的愿望，听起来可能有一些乌托邦理想化，她似乎不需要安定不需要爱情不需要婚姻，一个人规划着自己人生中一段段体验并且靠自己去实践，不得不说，世界的改变很大程度上是因为有这些能够放下小我，心有大我，心系世界，去感恩去付出去影响传递更多能够给不相干人群的人所带来的。肆意而洒脱的状态不是没有被罗芸羡慕过，但是两个人却自始至终没有去尝试体验过，改动的勇气和放弃的果断都没有，除了看极光也就是一个短期旅行性质。。。




这也是生活中大多数人主动选择了稳定后却时时怀有着一颗不安分的心，但却不敢改变现状的常态，梅琳达代表了什么样的人，就是活出自我的人，看似好像也是没有明确的规划，但是却一直在路上，不囿于时间和地点，而男女主看似是被“餐厅所困”，其实是被这份感情困于原地十五年不敢改变，这也是为什么说其实是互相耽误彼此。一个以给对方安全感有保障的生活、让她开心为人生目标，一个安于享受这份好一同辅佐安慰自己这也是在完成男方的理想呢，两个人自欺欺人不敢深入探讨达成共识才有许愿“餐厅倒闭”那些心里的小九九产生，这一点来说，梅琳达比起他们，活得自在清晰多得多。


很多女生依然寄希望于此生就是要找一个对自己好（凡事以自己为重的人），那其实也是变相对另一个人的消耗，伴侣本应是共同进退的，你有你的独立自我我有我的，二者和而不同彼此牵绊。真的爱对方是真正去帮助对方寻找挖掘除了感情之外家庭之外自己想做的事情，不仅是按部就班走完人生所谓的结婚生子奉献养育就够了。。。


随遇而安确实是一种活法，无可厚非。这个角度上是可以说他们也过上了想要的人生，有人就是没那么拼搏没那么多想法啊，这里只是想多提一个建议和角度，当你的认知改变了，体验过不同的活法过后，你再次选择那是深思熟虑，那不是被迫无奈那才是主动选择而不是随波逐流，但如果你只是单调重复只有这个，无非只是思想上给自己的行为合理化，最后就成为了无限放大感情的力量，和你在一起就是最好的日子。。。


如果说两个人既在一起又能做自己真正喜欢热爱的事情甚至能够帮助影响更多的人，两个人的成就感和幸福感你确定不会更大吗？认知改变是无法倒退的，所以在感动的同时，先问问清楚，自己想要的是什么，怎样过完走一生，那个人就算在身边了，那么你呢？你的自我价值呢？希望每个人都能够活出自我，这才是我希望借由这个电影推崇的人生观，


多尝试多体验，多丰富多影响，生命漫长不要是有彼此孤单的风景相随。世界很大，错过不再。






❆

五 人生在世别遗憾


影片其实很奇怪两个明明在外都没什么独立生活能力的人，出生北京，为什么非得在国外定居生活，远离家人，过得辛劳，而且基本上彼此跟家人的联系和链接都非常的寡淡，我们的一生中一定不是只有伴侣就行了，人是需要一段一段的关系组成最后人生的整个回忆，你最看重的当然是你最珍视的，但是如果说有了一再不去接纳培养形成其他关系，人生其实会失去很多的乐趣


就像《廊桥遗梦》之所以称之为经典也好，里面的三天感情多么的“歌功颂德”“求而不得”爱得伟大外，另一个角度来说不是因为双方的世界太过于乏善可陈单调无味吗？


女主把后面的日日夜夜过成了每一天重复的命题，才会说有三天的回忆就足以缅怀支撑一生走过去，再直白点说就是没经历过事好么！！！


除了爱情之外，我们的人生需要亲人 朋友 甚至志同道合的人 因为有不同关系的牵连，我们日后回忆的画面里才不会只有那一页纸，如果能够写一本书，为什么要拒绝尝试呢？


最后男主随东风泪洒骨灰的场景纵然非常感人，鲸鱼成群围绕在身边，但女主罗芸痴迷了一生的鲸鱼为什么迟迟没机会自己去亲眼看看呢？人总归是得有点梦想的，学会赚钱是支撑梦想的底气，主动寻求机会改变也是，一生在世时都没为想看鲸鱼的想法去行动也是一种悲哀，我们需要让自己能够有机会去追寻有闲有钱的生活，同时生前的遗憾别带到以后


如果想去看鲸鱼的话，是我，赶紧去，不等死后，念想和目标这个东西也是一样，完成了一个你才会想要去接二连三的完成其他。人生过的更有厚度和层次，当你可以去见天地见众人后，你的世界可能就不只是当下眼前的一饭一蔬而已了。


以上





-END-

❤❤❤❤
写在最后，送波小福利，其实两性相处中你会遇到很多的场景需要去不断探讨和学习，我之前从事婚恋情感行业中，在会员和学员们的真实案例中整理了不少的干货，都是真实场景下的一些可以拿来直接用的小方法，如果你们有需要，可以私信发给你

另外每个月会有情感公开课的直播分享，也会组建答疑群给大家交流，欢迎私信加我来撩，捧场听课啦~

课程列表部分截图


内容都是整理好的文档形式，直接根据真实案例做的反馈

如何获取课件内容：
先声明 资料是直接免费送的！！

如何获取，请大家私信楼主加我 暗号{情感手册}，看到了一定抽时间回复
平常白天需要学习专业写东西指导学员，比较忙，事情比较多，可能没办法第一时间回复，晚上一定会回复。请大家体谅下 谢谢大家
觉得不错的，点个赞吧，这样下次你也可以在浏览记录里，直接搜到这篇文章。而且可以鼓励我，继续跟大家分享更新更多的情感干货，学员的一些案例故事也会陆续整理出来
么么哒~
希望教会你更多人爱与被爱的能力，收获高质量亲密关系
你原本就可以更幸福！







人的成长可能就来自于，以前泪目向往满满感动，现在知道拿走的失去的流逝的代价是什么，每个人都应先是它自己再去爱对方…没有人应该一生只为对方而承担负责…更理性的视角去看待每个人的选择，不负遇见也不想亏欠…你的人生很精彩有我添砖加瓦，一同规划过得更开心足矣",55.0,5.0,15
