,Unnamed: 0,电影id,电影名称,用户id,用户名,评分,评论日期,评论内容,有用数,没用数,回应数
19,19,5327156,被涂污的鸟,bcea270ce9a33ee779437b69e67964cb,9f4c45a49e2684a73280c19ce04e3aa0,4.0,2020-10-22 22:55:28,这是一出关于歧视、排挤、迫害、凌辱、剥削和侵犯的连环悲剧。虽然事前已经知道会很阴暗，但没想到如此阴暗，全程令人感到不适。 影片以多个相对独立的故事，刻画了生活在那个时代的几类人： Marta（小男孩的姨婆）——信奉犹太教的犹太人在当时的欧洲基督教世界属于少数族类，处处受到欺凌，因此只能远离人群独立居住。就像影片开头出现的那只貂一样，姨婆暴毙后的结局是被一把火烧掉，犹如经历了伺候异教徒的火刑。 Olga（巫医）——那些愚昧的村民由于生活在偏远村落而仍然信奉原始宗教，他们排挤流浪至此的吉普赛人，认为他们是魔鬼的化身，并且会带来不幸。小男孩被卖给当地的巫医，被埋在地里只露出一颗头被乌鸦啄食的神秘仪式，便是未开化的当地人迷信巫术、畏惧恶魔的缩影。 Miller（磨坊主）——代表了当时信奉天主教的普通百姓，坚决唾弃妻子出轨因此经常家暴妻子。一次家养的猫的交配成为导火索，揭开了自己对于妻子不忠的猜忌，进而挖出了男佣的双眼。 Lekh &amp; Ludmila（捕鸟人和荡妇）——代表一些远离人群生活的边缘人物，他们不信奉任何宗教、也不受任何道德约束，因此他们酗酒、野战、教唆饮酒、勾引少年，必然被当时的主流观念所鄙夷、排挤。最后荡妇的结局是被众人殴打致死，就像被涂污的鸟被放回鸟群后遭受群鸟围攻而死一样；而身为无神论者，少了心灵上的支撑、面对悲剧精神更加脆弱，最终捕鸟人不堪打击选择了上吊自杀。 Hans（德国军官）——小男孩遇到的苏联红军怕窝藏犹太人引火上身而把小男孩转交给德国士兵，而后他面对的德国军官却也对屠杀无辜并不感兴趣而放走小男孩。他们代表了集体中人的复杂成分，没有所谓非黑即白，并不是所有苏联红军都能贯彻布尔什维克信仰的积极面，同样也并不是所有纳粹士兵都认同并执行元首的种族灭绝政策。这里发生了小男孩试图拯救断腿的马的插曲，其结局是被村民用其他马合力勒死，暗合了当时的波兰夹在欧洲列强之间只能任人宰割，德国和苏联都难辞其咎。 Priest &amp; Garbos（神父和恋童癖）——小男孩被发现他的纳粹分子抓到镇上，死里逃生后被神父救走成为教堂的侍童，但很不幸又被托付给一个恋童癖暂时收养，遭受了性侵和虐待。他代表了纳粹统治下的多数沉默着作恶的民众，维持着表面的伪善却保留了内心的阴暗。小男孩被吊起来被狼狗攻击，暗喻纳粹统治下的民众自发对犹太人的迫害。 Labina（少女）——小男孩被老人和少女收留，然而老人死后发育完全的少女性欲得不到释放，胁迫还未发育完全的小男孩与自己发生关系，并且因为得不到满足而在小男孩面前与山羊进行兽交以羞辱他。她同样代表着远离人群生活的边缘人物，一再突破道德底线而纵任被欲望支配。山羊在希腊神话里的寓意为生性好色的潘神、同时也是天主教对魔鬼的形象化，人类因其受困于色欲之原罪。 Mitka（苏联士兵）——小男孩被一个隶属苏军的狙击手带回军营，换上苏军士兵的服装，被灌输唯斯大林是尊的思想。他代表了苏军内部散播的个人崇拜思潮， 同时被教育了以牙还牙，并被赠予了一把手枪。此后小男孩的眼神和内心都发生了变化，学会了对于释放无端的恶意的人开枪报复。 Nikodem &amp; Joska（小男孩的父亲和小男孩）——父亲和小男孩终究团聚并踏上回家的道路，可两人分别经历了如人间地狱般的一切，此时的团聚已经毫无重逢的喜悦可言。父亲问出“你还记得自己的名字么”，因为顶着犹太名字是无法在那个时代生存的，这就是一种污名化的极端。影片结尾于一只在空中独自飞行的鸟，就像是那个时代所有犹太人的处境，孤立无援、颠沛流离。 在那个混乱且压抑的年代，人们放任内心的恶野蛮生长，道德和法律在冲突中分崩离析、沦为荒芜，人间无限接近于地狱。群体对异己出于未知、偏见而实施排挤、迫害，无中生有的猜疑、嫉妒带来仇恨、攻击，意识形态和道德标准的差异带来冲突、矛盾和分裂，无端滋生的傲慢、优越挑起对同等生命的蔑视，对欲望的放任强者对弱者进行生理心理上的剥削、凌辱——失去秩序的人类必然从文明走回野蛮。 在这个黑暗的大环境下，几乎没有一个人内心能独自保持纯净，小孩也不例外——甚至能见到比成年人更多的阴暗面，强暴、野战、兽交、私刑、屠杀、致残，全都因为小男孩的来临而连续发生。当然也有闪光存在，但由于人类趋于堕落的本性，相比黑暗还是少得凄惨。起初的小男孩仅仅因为外表就成为鸟群中那只被涂污的鸟，而在经历了一系列的悲剧之后，原本默默承受的他渐渐见识到了人性，同时学会了在乱世生存的法则——自保、自私、抗争、还手。 看完之后我最大的感想是：曾经的我笃信才华和智慧，如今我更认同善良而非聪敏是人类的至高品质。 影片改编自同名原著，因此参考了小说的章节式设计，虽然将不同主题的故事天然地分隔开来便于理解与总结，但也在一定程度上产生了情绪的割裂，观众不得不带着未尽的情绪重新进入下一道门。片长近3小时，虽然由9个章节组成但仍然略感拖沓。全片对白极少，使用黑白色调，可谓东欧闷片典范，风格使然不做评价。结局并没有惊喜，但老实说在那么多情绪的铺垫过后，小男孩弑父都不会感到意外。小男孩作为主角弧光不够丰满，人设可以更加立体，经历了这一切应当产生更大的心灵上的冲击和变化。优秀之处在于细节设计得不错，比如在许多故事中都植入了相关动物的隐喻，对于了解东欧二战时期历史的观众是不错的体验；构图较为精良，体现了相当的审美，在演绎残酷的剧情的同时不落观赏的美感。,3.0,,1
20,20,5327156,被涂污的鸟,5d67b0f61a9bc06c5b3e0706d327e5dc,94e75fd9890afdf57ec0d9f4ddb5f35e,4.0,2020-09-22 15:59:36,天地不仁以万物为刍狗 一个二战期间的犹太孩子Joska，在逃离了纳粹的魔爪后，他在东欧平原上又会遇见什么？愚昧而有敌意的斯拉夫农夫和村妇，荡妇、鸡奸犯，残暴的哥萨克和冷酷的德军……几乎所有的人都能成为或可能成为他生存的威胁。 萨特说，他人即地狱。 两千年前，犹大向罗马人出卖了弥赛亚耶稣，犹太人从此被贴上了标签，被逐出了家园，流散于各地，遭人歧视，勉强生存。 在电影中，一只小鸟被捕鸟人涂污了以后放飞，它看见了同类，便欣喜地向鸟群飞去。然而被涂污的鸟已经不被同类接纳。它们疯狂的攻击它、啄食它，致死方休。 犹太人是那只被涂污的鸟吗？ 把Joska赶到河里的农夫是普通人，攻击捕鸟人和他情人的村妇们是普通人，把Joska扔到教堂粪坑的村民们是普通人，与公羊交簧的渔女是普通人，作为酿酒师的鸡奸者也是普通人。当他们被哥萨克骑兵烧杀抢掠，惨遭屠戮奸淫的时候他们是受害者；而当他们遇到比他们更弱小的Joska，他们则无情的攻击、虐待，他们又变成了加害者。 他们抢夺死去犹太人的财务，甚至剥去死者的衣物；他们把Joska找到的折腿的马，用马群在地上拖着，直到死去。简直邪恶。 宗教乃至迷信只能提供短暂的庇护。村庄里的巫婆，用神秘的方法治愈了Joska的热病，为他提供了短暂的庇护，但随即就被恶意的农夫赶到河里。好心的神父把Joska安置在教堂，却又被鸡奸者领养。一旦年迈的神父病逝，虎视眈眈的村民就又把他当做恶魔扔进了粪坑。 Joska最后的救赎是由一个红军战士来完成的。他用子弹告诉Joska：要以眼还眼，以牙还牙。随后在他再次被欺负的时候，他用跟红军狙击手学来的经验，以及那把馈赠的手枪，打死了欺负他的男人。 面对残酷的环境，Joska不得不也变得残酷。年少的他一共杀死了几个人？三个。鸡奸者，无辜的路人老者，市场上的欺凌者。是战争和人心的邪恶，把一个知道救助仓鼠和病马的孩子变成了杀人凶手。人性之恶呵！ 大部分的时间里，这部电影都堪称大师之作。电影的编剧、布景、化妆等无不用心，摄影的技术更是一流，一帧帧的画面有着北欧式的简洁之美。黑白胶片的质感更带来了纪录片的严肃感。 导演通过Joska这样一个犹太孩子的经历，展示了“天地不仁”的上帝视角。让一个涉世未深的孩子来经历世间人心的阿鼻地狱，可谓用心良苦。战争之下，人性中的善良被封闭起来，人类求生的意念中潜藏着的动物本能流露了出来。杀戮、鸡奸、纵欲、强者生存……文明褪去，只剩下那种原始的蒙昧。 顾随先生的《驼庵诗话》中说“绘画的，神品；雕刻的，能品。《水浒》近于前者，《红楼》近于后者”。就是说施耐庵写《水浒》时，用简笔而近乎自然，而《红楼》则用繁笔过于雕饰。施公笔下的梁山好汉全无心肝。李逵母亲被老虎吃了，“众人大笑”；武松杀潘金莲时，是扯开衣服，剖五脏；杨雄杀潘巧云时又是割舌取五脏。简洁利落，没有带入一丝个人的立场，只是讲一个个故事，只为了“诛前人既死之心”，“防后人未然之心”。 又比如，K.J.库彻写《迈克尔.K的生活和年代中》，当中身为种族隔离制度下的底层黑人K，也是用这种上帝视角。他眼睁睁地看着K在不公的社会中悲惨地死去、腐烂。 再比如，伊萨克.巴别尔写《骑兵军》，其故事的背景Joska的故事背景非常接近。在波兰、乌克兰和南俄的敖萨德一带，哥萨克们暴虐地杀害每一个犹太人。 “在我窗前，有几名哥萨克正以间谍罪处死一名白发苍苍的犹太老人。那老人突然尖叫一声，挣脱了开来。说时迟，那时快，机枪队的一名鬈发的小伙子揪过老头的脑袋，夹到胳肢窝里。犹太老头不再吱声，两条腿劈了开来。鬈毛用右手抽出匕首，轻手轻脚地杀死了老头，不让血溅出来”。然后巴别尔不发一言，转身就去写其他了。 也许最高级的创作都是如此吧：只尽可能地真实讲述，不置一评。就如同水墨山水中的留白，你留下的空间越多，人们的想象空间就越多。一旦你掺杂了过多的个人立场，你的作品就越属于你个人了。 如果要说这部电影的可惜，那就是导演没能将上帝视角进行到底。 一个犹太儿童要在满是敌人的东欧平原上存活下来，概率几近于零。然而最终导演却让Joska与父亲团聚，并且和解。这就是雕琢的工匠气了，取悦了观众，却没能做到自然啊，也就不成其为伟大的作品了。,,,1
21,21,5327156,被涂污的鸟,4b57d3a7bef4484b0220046910ee079e,36edd8fb20bdd9a60ecf3c70e9fb4867,4.0,2020-08-28 15:55:09,"



  农民们最喜爱的娱乐活动之一,便是逮住一只只鸟儿,把它们的羽毛涂成彩色,然后放了它们,让它们返回鸟群中。这些色彩鲜艳的生灵飞到同类中寻找安全,可其他鸟儿视其为有威胁的异类,纷纷攻击和撕扯它们,直到把这些弃儿活活杀死。 1965年，美籍波兰裔作家耶日·科辛斯基创的同名小说《被涂污的鸟》出版后， 东欧最有成就、最受尊崇的作家，
 对他提出了警告。 说他会不得善终， 且将在里维埃拉的某个破败旅馆割喉自尽。  不难看出，当时人们对于作品中的一些描述，是难以接受的。 如同我们难以接受“伤痕文学”的沉重。  事隔经年，同名电影上映后， 豆瓣和IMDB的评分也出现了差距： 以国人为主的豆瓣给出了8.1分的高分，  而大名鼎鼎的IMDB，却只达到了优秀影片的及格线。  这是什么原因造成的呢？ 今天，我们就一起来探讨一下这部电影， 看看差距是如何产生的。  （以下内容涉及剧透，请慎重浏览。）   1 无名男孩也曾有过一个快乐的童年。 





 他没有名字，家人也都不知去向。  在玛尔塔奶奶的照顾下，日子还算过的不错。 





 然而一个寂静夜晚，玛尔塔奶奶撒手尘寰了。 





 无名男孩惊愕之中失手掉落了油灯，房屋付之一炬。 





 自此，孑然一身的他踏上了未知的旅途。  水中摇摆的纸船，犹如男孩缥缈的未来。 





 回家之路伴随着各种危险，男孩直面死亡。  他看见众生皆苦， 





 看到生命无常。 





 因为眼睛和发色不同，无名男孩被当成异端四处驱赶。 





 看似虔诚的信徒，其实是恋童癖者。 





 教众们以圣洁之名，  对他行尽污秽之事。 





 男孩就像那只被涂污的鸟儿， 





 明明在自己的种群中， 却被无情的攻击。 





 直至死亡。  经历了这一切， 无名男孩变得凶狠残暴起来。 他杀死了侵犯、虐待他的教友。 





 袭击手无寸铁的老人 





 他目睹了疯狂与杀戮， 





 见到了战争的残酷， 





 宗教也无能为力。 





 人存在的价值到底是什么？ 无名男孩感到迷茫、困惑。 





 最终，他找到了久未谋面的父亲。 





 在窗上写出自己名字，回归自我。  此时，我们可以得出结论：
 影片在欧美国家分数不高， 一方面是由于对教会的抨击。 而另一方面，
便是因为对于苏联和斯大林的颂扬。 





 相比IMDB，这次豆瓣的评分更为客观。  2 电影是一种描述世界的方法， 比起文字更加直观。 影片采用黑白片的拍摄手法，
画面干净、主体突出。  剧中人物身处黑白世界， 发色和眼睛的颜色，并没有差异。 导演通过上帝视角告诉我们， 所谓差异，都是后天的偏见与预设。 我们只有一个种族，那就是： 人。  3 电影整体表现优异，但遗憾的是：
女性角色在影片中，被严重的符号化。 被怀疑偷情的老妇、 





 诱惑少年的少妇、 





 情窦初开的少女。 





 之所以这样安排三人的命运， 是由于小说写于上世纪60年代， 欧美女权运动和性解放运动如日中天。
 而作者对此应该是持否定态度。
 这点通过三位女性角色的结局，可以看出。
（三人分别被殴打、被虐杀、欲望无法被满足。）
 这不禁令人唏嘘，
 不过站在当时的时间节点看过去，
 也是可以理解的。
    “尔时无有男女、尊卑、上下，亦无异名，众共生世故名众生。”  如果喜欢，请随手关注我，或转发给和你一样热爱电影的朋友",3.0,,0
22,22,5327156,被涂污的鸟,977029f807ec00cd89d8625c74fa7e21,c16738a7a13f34cfbdf2ef7ec31a6d3a,3.0,2020-07-15 14:34:50,3星，还不错，黑白片很有胶质感，影片的故事表达的比较晦涩，虽说显得有点凌乱，但不难理解，主题就是是反思战争创伤，小男孩从跟随寄养奶奶，到被巫婆利用，到信仰上帝被抛弃，被淫魔浪女玩弄，最后被苏军教会以暴制暴的过程。是一个战争扭曲人性，压抑使人疯狂发泄报复的过程。 小男孩从被虐者，变成了 施虐者。战乱可以使人变成魔，行为荒诞，滥用暴力，毫无理性。,1.0,,0
