,Unnamed: 0,电影id,电影名称,用户id,用户名,评分,评论日期,评论内容,有用数,没用数,回应数
27,27,5327156,被涂污的鸟,15af00bf5ae882669b834186e53efffc,685c2fd0b799f96f9d16fff536214c2e,5.0,2020-06-22 22:32:31,片首男主的宠物小白兔的遭遇几乎是男主后来命运的缩影——被欺凌、被虐杀、 被嘲弄、被忽视，全是人世间最底层的黑暗和最卑微的艰难，无可修饰，所以除了最后的字幕全片没有音乐只是剧情原本的声音：惨叫、哭泣、怒骂、鞭打声、枪击声、乌鸦的呱呱、老鼠的吱吱、……，这种没有配乐的音效跟没有色彩的黑白片一起，将东欧某处乡村二战期间的一段生活，最原生态地抛给了观众，凄厉的风雪、无边的森林，在宽银幕里最深广地呈现出来。生活让一个原本狗屁不通的孩子越来越坚韧，也越来越冷酷，甚至越来越阴暗，如果他能活过战争，他会成为什么？人？还是鬼？,,,1
28,28,5327156,被涂污的鸟,ed42ebcc3b0a83156490fe67e865e98a,74cbe7ee17127f7d6c43b60b83f63994,5.0,2020-06-19 01:32:07,"不知道 被玷污的鸟 的导演有没有看过 闪闪的红星。如果电影在150分钟开枪时终止，那么就是一版现代版 闪闪的红星。
恕我眼拙，在游击队把小孩子送给德军前，我完全不知道他犹太人的身份。顶多认为是个二战捷克的浮世绘，甚至都没想人性本恶。第二个点是被苏联正规军救下，突然就有了闪闪的红星的感觉。这孩子肯定会杀人的，只是憋着看杀谁，毕竟全片除了神父几乎没一个好人，观众情绪到了，恨不能砸一颗原子弹。
包括牯岭街，都是少年杀人，但论憋尿，被玷污的鸟 憋的最久。两部华语的无论怎样，都在前面结构故事，尚有波峰波谷，杀人只是最后的结局。被玷污的鸟 前面几乎是一条直线，只是展示，不做评论。
为了不太闷，电影在技术环节上进行了大量的包装。黑白，大特写，印象派的构图，故意减少台词放大环境声。反正目标人群不是好莱坞那批观众，弄些极致的视听语言，也是讨好亚文化圈精英的一小撮。
估计后浪们不喜欢，因为需要思考和一些知识积累。但给高分是肯定的，因为可以装逼去草逼。其实当年 闪闪的红星 也有这样的作用。管他文艺青年还是进步青年，都是逼。",1.0,1.0,0
29,29,5327156,被涂污的鸟,fe4f801ac4f1097c1af8e4a1622a9cd2,5633748c0345371428d76dbe3a18746f,,2020-06-05 09:17:19,"最近心情很糟糕，搞不清楚生活对我而言又意味着什么，生活就是生存吗，可是我的存在并不愉快，既然我不能理解什么是真正的愉快，就看看真正的绝望吧。

被涂污的鸟，以二战为背景展开的，我们一想到关于二战，就会想到德军的种族屠杀，日本对中国的侵略，这也是大部分关于二战电影的主要的内容，但全片关于战争的画面很少，即使是士兵的画面也就几个片段而已，电影虽然有士兵对犹太人的屠杀，对整个村庄的灭口，画面依旧是那么的残暴血腥和不堪入目，但更令人绝望的是战争中另一部分人的人性性的丧失。他们也是遭受战争压迫的人们，他们没有参与战争，却成了在战争中苟活的衣冠禽兽。他们是人类兽性的代表，恐惧、欲望、傲慢、控制欲、虚伪、残暴……在那个黑暗的角落里侵蚀着人们的灵魂，披着人皮的恶魔也不过如此吧，真正的德性失去了它的光芒。当然他们不仅仅存在于战争时期，他们存在于任何时代，或是我们的身边，或是我们的内心。

电影的主人公是一个十岁左右的小男孩，他有着一双大大的眼睛，眼睛里却满是恐惧，恐惧是没有颜色的，因此整部电影也是一如既往的黑白色调。

或许是因为犹太人的缘故，他走到去哪里哪里就会有歧视，他就像一只被涂污的鸟，被村民包围着辱骂殴打，他哭喊着“我想回家，我想回家……”，这却是他在电影里说的第一句话也是最后一句话，可是此时的他已经没有家了，在集中营的爸爸妈妈也同样经受着非人的遭遇；他被当成恶魔装在麻袋里鞭打，被扔进粪坑，所有的歧视、谩骂、恐吓、侮辱、殴打……伤害了他幼小的心灵，他不得不把内心的良善隐藏在最深处，他知道只有无情与麻木可以保护自己，可以让自己活下去。

在当时身份特殊的他来说，活着是一种幸运，同事时也是不幸，幸运的是活着，不幸的是仅仅是活着却丢失了作为人的尊严，这足以说明他的勇敢，死太容易了，可是活着就是如此艰难，他不但要目睹不公还要经历不公，在当时，存在就是一种勇气。",,,0
30,30,5327156,被涂污的鸟,bc419da2b35c05bfab926dedec22eb5f,031e63cf80f42edfe9a4ab9d1c98a064,,2020-05-29 11:40:32,"《被涂污的鸟》讲述了一个小男孩于二战时期，在东欧农村的流浪经历。电影用三个小时的篇幅，不厌其烦地描述被现代社会边缘化了的山村生活。残缺的家庭，强烈的欲望，弱肉强食的生存关系，人活的跟动物没什么两样，人与人之间的残杀毫不留情，真像是回到了中世纪。小男孩处处经历着愚昧、野蛮，还有瘟疫的种种残害，常常是才逃出狼窝，又入了虎口，时刻体会着苦难。日复一日，年复一年，春夏秋冬都是沉甸甸的苦难。
       愚昧落后、矛盾深重的社会与战争缘分更大。电影故事背景赶上了德国纳粹反犹太运动，赶上了俄国国内战争，外面战局怎样，这里全然不知，任由政治家们操纵，留给民众的只有愚昧、邪恶与苦难。在这种局势下，世上根本就没有什么正义与善良的东西，拯救自己要靠机智勇敢，这点电影故事表现的很清楚。纯粹的苦难只能教会人们丛林规则，以眼还眼，以牙还牙。经历过如此深重的苦难之后，小男孩此类的心里只有仇恨，他们的复仇会针对所有的人，针对整个社会。
       电影黑白制作，没有多少对话，都是些活生生的事情，许多惨不忍睹的画面。感到编导通过这个苦难的流浪故事，在反思被现代社会边缘化了的那部分人，反思人类社会到底应该怎么发展，人与人之间、不同民族之间、不同国度之间应该建立怎么的关系。",,,0
31,31,5327156,被涂污的鸟,6cf4c073a7a4c9e1cdad384078a2e92d,ec7d84f5bfed736021da9c478a1ca2dc,5.0,2020-05-25 23:28:35,"整部电影，我大致总结出一下几个特点：第一，黑白色调，沉闷的压抑感。第二，寥寥无几的台词，尤其主角，小男孩的台词我只记得一句，就是开始他说的我只是想回家。第三，所有演员几乎没有笑脸，也没有笑声，都是死气沉沉的，麻木的，恐惧的表情。第四，整部影片全程无配乐。  虽然没有传说中的那么血腥，但是还是透漏出无比的黑暗，尺度也是非常大胆（刚焦，瘦胶，乱纶），这不禁让我想起另一部电影《沃伦》，沃伦相比被涂污的鸟血腥程度让人瞠目结舌，而且这两部电影都出自波兰，那么波兰到底经历了什么？ 波兰这个国家一共经历了3次亡国 1、1795年，俄国、普鲁士、奥地利三家分波，波兰第一次灭亡。 1795年1月3日，俄、奥签订第三次瓜分波兰的协定，10月24日，普鲁士也在协定上签署。根据该协定，波兰领土被全部瓜分。 2、1815年，拿破仑在波兰建立的华沙公国被普鲁士和奥地利瓜分，波兰再次灭亡。 1809年拿破仑一世在波兰中部建立华沙公国，作为法兰西的一个卫星国。1815年拿破仑战败，华沙公国被肢解，其西部土地成为波兹南公国，受普鲁士管辖，在克拉科夫成立了中立的克拉科夫共和国（也叫克拉科夫自由市）。在其主要地区成立了波兰王国，由俄国沙皇兼领国王。 3、1939年，德国闪击战占领波兰西部，苏联趁机占领东部，波兰第三次灭亡。 1939年9月1日，德国以闪电战突袭波兰，迅速侵占波兰大部分领土。1940年9月17日，苏联领导人斯大林以建立东方防线为由，命令60万苏联红军越过苏波边界，进攻波兰东部，占领了西乌克兰和西白俄罗斯。 9月18日，苏军与德军在布列斯特—立托夫斯克会师，苏、德两军以皮萨河—那累夫河—维斯瓦河—桑河一线为界瓜分了波兰。9月28日，德军攻陷华沙，波兰再次沦亡。波兰人民开始了反法西斯民族解放战争 我想起著名制片人方励老师说的话，一个人如果失去了女人，他死不了，但是如果一个人失去了国家，失去了民族，失去了信仰，WC那他还怎么活？波兰，你太难了！
我不知道大家有没有注意，就是小男孩在一个喜欢和妓女邂逅的那个老爷爷，老爷爷把一只涂了白色的鸟放飞了之后，被群殴，后来掉下来死了，像极了影片的主角小男孩，只不过他的肉体没有死，可能心已经死了吧，好在结尾这个孩子坐上了回家的车，摄像机摇向了天空，这时候突然飞来一只鸟，我觉得这只鸟隐喻就是之前被涂的那只，象征着新生。",1.0,1.0,2
32,32,5327156,被涂污的鸟,aafc1656cc8e25c9eed6c471d7defadc,c7877b6ed59305a273ba118d715ace47,,2020-05-22 20:07:39,：看完这部电影内心很沉重，来豆瓣看到有这么多打低分的让我心情更沉重，这世界到底怎么了，现如今的人性如果置换到电影中的那个时代会更加邪恶，扭曲，另类，变态！人类最大的弱点就是自以为是，注重表象，疯狂追求那些虚无缥缈，不切实际的东西，现在很少有人会静下心来好好想想自己到底需要什么，应该为什么而活！希望大家多推这部片子和另一部《何以为家》，让更多人去看，我相信看过这两部片子绝对会让大部分人对生活有新的认知。,,,0
33,33,5327156,被涂污的鸟,c046285bb5388aea45f05fbd5f3197ee,8742e6afd24153358c7874aba21deac7,4.0,2020-05-15 06:28:08,被涂污的鸟是个意蕴丰富的象征，是诗化的意象，在这个简单的词语中，包含两个指向：一个指向涂污的人，一个指向受污的鸟。有了这层思考，通过片名，我们就能感受到电影浩渺、梦幻的延申性：《被涂污的鸟》就像一只想象中的鸟，插上由两个指向组成的翅膀，在银幕中飞翔；由于两个指向方向不一，鸟的这双翅膀相互掣肘，不断撕扯、折磨着鸟，它疲乏无力、面目全非。鸟在文学中，是个非常重要、常见的意象，古今中外，莫不如此，似乎人类的潜意识是相通的。,,,0
34,34,5327156,被涂污的鸟,c0d0e56f544838858720a5f0a1b6c97e,82f11b56209348adc77faf26c1e33402,5.0,2020-05-14 01:24:39,观影提示：在将近3小时的时间里，你会看尽人性最丑恶的行为，若你还对生活抱有幻想性的满足，劝你别看下去了；倘若你愿对黑暗后的光芒执着不放，就把他经历的苦难记在心间，别让它再出现。 169分钟，在片尾，小男孩用稚嫩的笔记写出了自己的名字：JOSKA（乔斯卡），如果他就是一名跟随父亲回家的普通小孩该有多好，可片中的一年时光，乔斯卡经历了人间炼狱般的苦难生活，他遇到的所有人都拼命剥夺着一个孩子天真、快乐的童年。仇视、恶毒、恐吓、鞭笞、重担、肉欲......所有的人间罪恶泯灭了眼中的光芒，呆滞的目光是因为遭受了我们难以想象的丑恶生活。 故事背景是在我们尚能感知到时代：二战。它是全体人类记忆里最黑暗的时刻，近亿人被战争吞噬了生命。一个个黑暗的斑点是一名名受苦受难的人民，乔斯卡就是其中最微弱的一个。他与奶奶两人，在波兰最苦寒的乡间相依为命，影片的最后我们也将得知乔斯卡的父母是被关进了集中营。 一场大火之后，乔斯卡独自一人在风寒大地上开启了炼狱之旅。    奥尔加【人与鸟都忍不住要撕裂他】 穷乡中易生出歹毒愚钝的心，一群乡民用棍棒捶打这个异族人，甚至想把他淹死。将乔斯卡带去巫医那判定时，却被巫医救了下来，留在身边。在这一段里最揪心的当属乌鸦群攻幼小无助的脑袋时，尖锐的鸟喙直接啄烂了乔斯卡露在黑色泥土外的头顶，瞬间血流如注，心揪难忍。     米勒【暴力、死亡与肉欲即将展开弥天的黑手】 乔斯卡与悲苦的命运一同漂流，他来到了一位老匠人家里，胆小的妻子和笨拙的学徒暗暗释放出了紧张。乔斯卡在这里见识了人与人的猜忌、暴力、愤怒和原罪，人就像动物般止不住的交配、肆叫，离开这个不幸之地是唯一的选择。     莱克&amp;露德米拉【攻击异类是生命的天性，但残忍是人性】 鸟本应以自由的天性飞驰天际，却因为人的私欲被桎梏在狭小的笼中，但或许人只是因为嫉妒，全因自身已禁锢在方寸大小的生活里，逃脱不出，唯有死亡可选。乔斯卡在这里窥见了死亡的阴影，即便莱克有诸多恶习，但并没像后面所遇见的人一样向乔斯卡下黑手，他是多么渴望救下莱克，尽管适得其反。 人性阴暗的一幕也从陋习中窥见：莱克将一只美丽的小鸟涂上了异样的颜色，小鸟用鸣叫引来了同类，可当小鸟带着奇异的颜色出现在鸟群中时，恐怖出现了。群鸟跟疯了般，向它发起了攻击，飞翔已不再是舞蹈，惊鸣与痛苦在天空中炸开，美丽的小鸟猛烈的坠向大地。 根据原作者解释，这是出现在东欧民间的一种游戏，将鸟涂上异彩，放回鸟群，就会受到同类的攻击，直至死亡。     汉斯【地狱之外仍是地狱，死亡飞驰在大地之上】 一匹为人类服务的马，在何时死亡？在对人没价值时。乔斯卡救下了一匹马，却辗转进到苏联红军的军营，对于现在的人来说这应该是喜讯，但等待他的却是轨道尽头的枪决。幸好去执行死刑的人是一名好人，他放走了乔斯卡。 最惊心动魄的出现在之后，一列运送犹太人的火车在草甸上飞驰，车厢内的人们焦急的等待着，车厢门板终于被敲出了一个大洞，人群带着仅有的行李跳下了列车，他们本以为只要不在终点下车死亡就不会降临，但车后暗藏的机枪没有留下一个活口，即便是怀抱婴儿的年轻母亲和婴儿。 这一段极短暂的屠杀场景，相对于集中营来说，可能算是天堂了。乔斯卡目睹了一切，他也拿走了一双仅可裹脚的鞋。  神父&amp;加波斯【上帝带走了天使，撒旦让恶鬼留在人间】 乔斯卡被纳粹抓走了，到达高墙之后一定就是死亡。当生命在身边崩散，乔斯卡竟然因为一个心痛的举动被放走了，或许这就是权力，可以决定一个人去死，也可以让一个人活，全凭瞬间的心意。 一名和善的天主教神父带走了乔斯卡，上帝终于看到他了么？没有，转瞬间他就被魔鬼带走了，一名恋童癖撕裂了黑夜里安宁的时光。随时遭受的吊打和欺辱，究竟给他带来了什么，我们不得而知，乔斯卡只想逃，可逃不掉。 就亲手杀了他吧，是生活教会乔斯卡怎么保护自己，离开噩梦。    拉比娜【欲贯满身，温柔的异性也将化身丑陋的魔鬼】 封闭而狭窄的生活会带来什么，一个性癖恶魔，这次是女人。孙女刚下葬了自己的爷爷，就忍不住占有稚嫩的乔斯卡，她用粗贱的大腿埋没了乔斯卡的身躯，可能异性的缘故，乔斯卡起初对她还抱有好感，甚至有些放弃抵抗，但他还是个孩子啊，他的身躯怎么能满足如此饥渴的成年女性，她甚至辱骂、嘲讽、抽打乔斯卡，最后最不堪入目的一幕彻底击垮了乔斯卡。山羊在古希腊象征着强大的性欲，一个献血淋漓的羊头当成为最惊恐的诅咒。 乔斯卡又跑了。   米特卡【集中营里有爸爸妈妈，还有死亡】 德国人来了！黑马、战车、坦克、死亡骑士，一阵暴怒的烧杀抢掠摧毁了整个村庄。苏联人也来了，在死亡后带来沉寂。乔斯卡在河边遇到了一名苏联军官，他在军营里收留了这名战争孤儿。但这位军官的战友恐怕对乔斯卡影响更深，他教会了乔斯卡：以牙还牙。 愤怒而惊恐的波兰村民在深夜杀死了几名来到村里的苏联士兵，没有人敢于以反击，因为他们是平民，他们应该是来保护波兰人民的。但军官不认可，清晨间，军官带上步枪独自一人去了村庄，可乔斯卡也紧随其后。那就让这位尝尽人间苦难的小孩看看吧，他应该学会怎么保护自己，怎么以牙还牙。 在乔斯卡被送去孤儿院的临行前，军官送了一把锃亮的手枪给他。乔斯卡也是用这把手枪亲手杀死了一个小摊贩，仅仅因为小摊贩怀疑他会偷东西，并打了他。     最后杀人这一幕，很震惊很欣慰也很心慌。曾经一个软弱胆怯的孩童，经过在人间炼狱的一趟旅行，他不仅更加脆弱也更加愤怒，只要他有了剥夺他人生命的能力，他就恶狠的出击，再出击，直至杀死对方。 战争不仅用恶鬼带来苦难，让人间生出万般呻吟，它还让人也毫无顾忌的为他人带来苦难，因为自保、愤怒、恐惧、不满和傲慢。 在这样的时代，没有人有姓名，他们只用恶行和良善区分，或者在一些人眼里是种族。 回到开端说道：汽车玻璃上的姓名。只有安稳富足的生活才能给人带来生命的希望、安宁和姓名，那个时代的人用几年时间的苦难救赎了整个世纪的生命，他们经历的我们不敢经历，甚至连想都不敢想。 169分钟，对于乔斯卡一年非人的磨难，对于那几年犹太人被屠杀的血海历史，不算长，就用这一瞬的时光在我们心口划上浅浅的伤口，历久弥合，但永生不忘。,1.0,,0
35,35,5327156,被涂污的鸟,dbedec2df1ba5572b0ebe130d0580c6a,87d226f5496b8bd1704a0bd066c2dc35,3.0,2020-05-11 19:29:15,我是不赞同前面有人说战争异化了人性，我觉得至少在这部作品里，表现出来的人性的恶跟战争没有什么直接关系，即使没有战争，影片每一段故事里的每一种恶都不会衰减。前半小时是金狮的水平，后面发现剧本用室友姐姐的话来说就是在“鬼打墙”，剧情取舍很有问题。剧本需要打磨，也要找个高水平剪辑师来收束一下，不能舍不得剪，不能自得其乐。氛围和视听语言从头到尾都是上乘之作。可惜了。,,,0
36,36,5327156,被涂污的鸟,00462773fc988dc27574930fb18031d5,667d64614dd565fe6a791394d29401c4,4.0,2020-05-11 15:30:39,鸟儿一旦成为异类，就会立刻被逐出集体。 整片非常致郁，活生生看着一个会因鸟儿被同类杀死而哭泣的小孩开枪杀了一个人，但能怪小孩变坏了吗？只能怪整个社会太变态了。我在想，是贫穷衍生那么多的恶，还是人性本恶，越是失序的世界，越是可以见到人性的不堪。 我想他那双被称为罪恶的双眼，实则是看到罪恶的双眼，眼睁睁看着被活生生烧死的宠物，看着逝去的亲人消失的火光中，从此开始一个人的流浪。因为被误解成放毒的人而差点被打死，被巫婆救下，巫婆不一定是巫婆，可能是站着拉尿的巫师。染上疾病，露出土地的脑袋，虎视眈眈的乌鸦，多么讽刺，就像《饥饿的苏丹》照片一样，沦为鸟儿的食物。看到因为出轨而被打的半死不活的少妇，被活生生挖出双眼的男人，差点被猫咪吃掉的眼珠，瞧，这人世间因为恨可以做出多少出格的事情。那个来自森林中的裸女，她带来了一只鸟，一场欢爱，带走了一个男人的心，最后这个女人被活活打死的场景，让我想起《西西里的美丽传说》玛莲娜，如果性爱有错的话，偷尝禁果的那个人是不是也该受到惩罚，为什么最后的错误却全部要女人来承担。也是在这里，小孩亲眼看到被涂污的鸟儿，被同类活生生杀死，亲眼看到因为失去心爱的女人而上吊自杀的男人，看着一个人慢慢死去的过程，就如同那只鸟儿一样，慢慢挣扎死去，却无能为力，或许离开反而是最好的选择，至少不用面对如此荒诞的世界。后来他被苏联人送给德军，最后他却被德国士兵放走了，让我想起《钢琴家》里面为史标曼送食物和大衣的德国军官，有些人因为国家的立场不得不站在道德的对立面，但并不代表他的内心认同国家的做法，只是身处战乱时代，个人的力量是微薄的，但是当你挽救一个人的生命时，就相当于挽救整个世界。小孩死里逃生之后，跟随神父做事，无论在哪里，小孩逃离不了人的歧视，即使在上帝面前。后来神父把他送给一个单身男人，没想到是个恋童癖，原来刚开始的善意，都只是伪装罢了，人性的恶是个无底洞，永远不知道有多深。见得多了，也就麻木了。如果是我那个小孩，在那种情况之下，我想自己也会拉动内心罪恶的绳，把一个人送进地狱，让自己逃离地狱，只可惜他的地狱还没有结束。后来他遇到了一个女人，寂寞疯狂的女人，如饥似渴，可以与老人做，与小孩做，与畜生做，为什么电影中的女人都如此饥渴，性到了这个地步，就有点恶心了，毫无底线的性，与兽何异？两场不一样的性爱，两种绝望的方式。我不知道他对后来遇到的那个女人拥有怎样的感情，但无论哪种感情，我想都带有爱的成分，只可惜这样的爱很快就烟消云散了。后来他跟随着苏联军队生活了一段时间，也是人生第一次，有人真正教他如何做人，“以眼还眼，以牙还牙”，也是第一次，看见他笑了，或许他终于找到同类人，他不是怪胎，或许有些人并不想做恶人，但是你越怯懦越容易被欺负，你只有强大起来，才有能力去解决一切的伤害。暴力不能解决根源性问题，暴力只会解决暂时的仇恨，但我不知道他最后杀了那个人的选择是否正确，因为我不是他，我永远无法真正体验到他的感受，我也不能随意评断他的选择。时代背景不一样，我不知道哪个才是真正的解决方法，但无论在哪个时代，遇到一系列的伤害和歧视，很难不形成反社会人格。虽然他一直知道自己是谁，但从不能真正做自己，没有主动选择的权利，都是被动接受，只有杀人的时候，才是自主意识。那双眼见过太多的罪恶，透过眼睛，罪恶早已开始浸染他的思想。,1.0,,0
37,37,5327156,被涂污的鸟,687199525df7b7b790d577b4b4d4548e,35e541425423ca219ca858b4d419994e,,2020-05-08 01:13:43,全场此起彼伏的开纸巾的声音，我倒是一滴眼泪没掉，我可能是对人性的恶比较麻木，对制度的恶比较敏感，所以我看香港市民聚在一起唱歌的视频都会哭。我是不赞同前面有人说战争异化了人性，我觉得至少在这部作品里，表现出来的人性的恶跟战争没有什么直接关系，即使没有战争，影片每一段故事里的每一种恶都不会衰减。前半小时是金狮的水平，后面发现剧本用室友姐姐的话来说就是在“鬼打墙”，剧情取舍很有问题。剧本需要打磨，也要找个高水平剪辑师来收束一下，不能舍不得剪，不能自得其乐。氛围和视听语言从头到尾都是上乘之作。可惜了。,,,0
38,38,5327156,被涂污的鸟,587b81bcb3ddea4b9fd4c5685085a7af,d8956ecde905721548f98353fca1f1af,4.0,2020-05-04 18:12:00,因为出生，他被贴上邪恶的标签，然而他所遇之人，却一个比一个邪恶；他被嫌弃被驱逐，遭遇一次比一次更残忍的侮辱与迫害……二战期间，一个犹太小男孩在东欧流浪、逃亡，命如蝼蚁，直到他举起了枪！是的，小男孩是缩影，背后是一个民族的流亡史。无论我沉默多久，我始终记得我的名字！          他怜爱小猫小狗，他曾是谦谦少年，但有一天，他也毫不犹豫举起了枪，向侮辱过他的小贩，扣动扳机，平静如水！那一刻，你会想到一个民族，二战后在追捕战犯、捍卫土地上表现出来的誓不罢休。以牙还牙是铁律，但是，世界会更好吗？          没看原著小说先看电影，挺好的！黑白摄影的唯美与纯粹，映衬着形形色色的伪善与残忍。镜头组接挺风格化的，但电影整体似乎又奔着很写实去的，会一定程度影响两种艺术风格上的极致追求吧。用男孩个人指代一个民族，被涂物的鸟比喻一个民族的困境，处理得刻意了些。,,,0
