,Unnamed: 0,电影id,电影名称,用户id,用户名,评分,评论日期,评论内容,有用数,没用数,回应数
5,5,6981153,爱尔兰人,a7337b9cf39edc1d0c55206fa940eac5,1e2826d2f929bd8a6eb2a80dd79b02f1,5.0,2019-12-02 20:37:19,"昨天看了《爱尔兰人》，感恩节周末的最后一天，在32寸显示器上看了3个半小时，从黄昏到黑夜。如果不带过多偏见，不厚古薄今，《爱尔兰人》所代表的好莱坞可以说继承延续发展壮大了莎士比亚的传统，莎剧的文雅粗俗暴力血腥双关语三角恋男扮女装子报父仇都可以找到对应，你甚至可以把弗兰克比作一个生了几个女儿的李尔王。 莎士比亚没把自己太当回事，在伦敦赚够了钱回老家当阔佬养老去了，对自己的文字也不在意，传世的六个签名连拼写都不一样，剧本靠朋友在死后张罗出版——这一点好莱坞也继承了，一百年前的卓别林在油管看还要掏两块九毛九，但稍有名气的好莱坞电影剧本都在网上找得到，《爱尔兰人》的剧本也已经有了。维多利亚时代戏剧潮退去后留下了莎士比亚，到今天同时代的马洛只剩下英语文学专业读者。也许几百年后科波拉的《教父》取得了《哈姆雷特》的地位，而斯科塞斯的《爱尔兰人》如同马洛的《马耳他岛的犹太人》一般被人遗忘——但这对我来说并不重要，因为我见证了电影的黄金时代并且是其中的一部分。 严格说，《爱尔兰人》是Netflix投资，不是一般意义上的好莱坞梦工厂。科波拉卢卡斯斯科塞斯们刚出道时想拍艺术电影对抗传统的好莱坞，但最终被大多数人记住的很可能是《教父》《星球大战》和《好家伙》。《爱尔兰人》结束我继续看演员表直至最后，看到制作特效的是卢卡斯的公司，而卢卡斯本人已经把《星球大战》的IP以四十亿美元的价格卖给了迪斯尼。斯科塞斯最近批评当代电影已经变成主题公园引起轩然大波，而迪斯尼正是主题公园的最大制造商。 曾经读过一篇《围城》的英文评论文章，谈“围城“这个标题的几层含义。第一层是书的历史背景，抗战时期上海这个被包围的城市和租界。第二层是男女关系和婚姻。书里直接写到，也一再被引用。第三层是知识分子的纠结。比如董斜川出国当军事参赞，却批评同事上司中文的文理不通；方鸿渐在三闾大学不得志看不惯，一心想写封漂亮的辞职信出气，但是当发现只有他没有收到新学期的聘书后，却如热锅上的蚂蚁。第四层是人类的普遍困境。一开始那条被无情无尽无际的大海包围的肮脏法国邮船即是一座围城是全书的缩影， 被困在上面满是机巧，扰攘和希望的人们即是全人类的缩影。 优秀的文艺作品可以有多层解读，《围城》这样的小说如此，好电影也一样，比如卓别林《城市之光》的结尾。 假扮百万富翁的流浪汉让失明的卖花女做手术重见光明。她买了一家花店，和祖母一起工作。隔着玻璃窗，我们看到从前的盲女在镜子里端详自己的脸。她一直在等待救她的神秘恩人。一个穿着考究的优雅男人来到店里，她以为是她的恩人。 因为被指控给卖花女的钱是偷来的，流浪汉进了监狱。关了好些时候后被放出来，衣衫褴褛，在街头徘徊，去她以前卖花的地方，却找不到她。被人捉弄间无意中，流浪汉隔着窗子看见已经开了花店的卖花女。两人之间的玻璃是一道屏障，却让两人在全片临近结束时第一次互相对视。他当然一下子就认出了她，但她却完全不知道这个绝望滑稽的小个男人就是那个爱她，帮助她的人。 她从祖母手里拿了个硬币想给他，他看到后转身要走。她追到街上，给他硬币，他不要，于是她给他一朵花，他收下了。她又拉过他的手，塞给他硬币。当她把他手放上自己的手上时，她终于“看见”了他。此刻她又一次失明了，通过触摸，她意识到眼前就是给她一切的人。 “是你？”她问道。
他点头。
他问她是否能看见。
“是的，我现在看见了。” 
两人默默地看着对方，电影结束。 “我现在看见了”这句话中，她同时说了三件不同的事：  她说她眼睛能看见了。
她告诉他，她现在能看见他了。
她让他让观众知道，她终于明白了这一切。 可是看见他之后，一座她围绕着他建立起来的幻想大厦却坍塌了。 有人在她的表情中看到了爱，有人看到的只是温柔和怜悯，有人看到了遗憾，有人甚至从她脸上看到了震惊和失望。结局是悲剧，还是喜剧？整部影片是悲剧，还是喜剧？ 《爱尔兰人》的结尾，弗兰克让牧师不要把门全关上： Don't shut the door all the way.
I don't like that. Just...
- leave it open a little bit.  这个镜头同样也可以多层解读。 杀手的本能。以前美国枪击案发生时，有警察来公司上课，说自己去饭店吃饭，总是先看后门在哪里，进去后坐在面朝大门，并且能看到大部分顾客的位子。当弗兰克听说他的律师已经死了的时候，他第一反应是Who did it? 也是本能的反应。 那条留着的门缝是对女儿的到来留着的一点希望。这个圣诞节他是在轮椅上一个人度过的，之前他拄着拐杖排队去看在银行柜台工作的佩琪，佩琪看到他以后却调转柜台上那块牌子，摆出""closed"",  起身离开。 这条门缝呼应了前面的另一条门缝。当时弗兰克和阿尔·帕西诺饰演的霍法刚接上头，两人住一个套间，弗兰克住外间。临睡霍法走进里间，关上两扇的时留了条门缝。他也许以此在圣诞节时怀念霍法。之前有个镜头拍他手的特写，一只戒指一只手表。戒指是罗素给他的，金表是霍法给他颁的奖，两个影响他一生的人。 这条门缝是对前面挑选棺材和安葬地的呼应。他说他不会选择火葬，也不想葬入地下：That's why I would never go for cremation，because it's so...it's so final.This... This one.That's the hardest part of anybody when they bury youse,is when they go into the ground because it's...it's so final.If you go into a building,the building's there.The crypt is there.It has to be a metal casket,and they have you in the room. ”   最后那句话，they have you in the room，也可以说描述了最后一个镜头。他活着，可同时代的人都死了；他生了那么多女儿，却没有一个人接他出去过圣诞，甚至来看他。他在这个房间里一个人活着，也可以说是死了。这个房间，也是他的墓地，是他自己选择的墓地——这又呼应了一开始他说起他在战争中的经历，他拿着枪让两个战俘自掘坟墓，而他自己的一生可以说是拿着枪在给自己掘墓。 注：关于《城市之光》的结尾，参考引用了我正在翻译的一本书：Show People: A History of the Film Star (暂定译名《戏梦人生：一部电影明星史》）。",163,13.0,22
6,6,6981153,爱尔兰人,4f4fda6be9ea17459e65e193a40b66a6,8093a32450075324682d01456d6e3919,4.0,2019-11-04 14:49:02,"作者：DaveItzkoff / 《纽约时报》 译文首发于《虹膜》  伦敦——没有资料记录过那次相遇，当事人也无法确切说出日期，但上世纪六十年代末，大概是在曼哈顿东村的某个地方，叫做罗伯特·德尼罗和阿尔·帕西诺的两个新人演员首次相遇。 他们都是崭露头角的新星，很早就尝到了稳定工作和引人注目的滋味，也早就知道彼此。他们互相比较履历，估量对方的能力——帕西诺仍然记得德尼罗有着「不寻常的外表和某种能量」——然后各自离开，想着自己和刚刚遇到的那个人的未来会是什么样。 半个世纪过去，他们走进泰晤士河边一家豪华酒店的套房，谈论他们的新电影《爱尔兰人》，很多不确定性早就烟消云散了。作为演员，德尼罗和帕西诺几乎做到了一切，甚至超越了他们年轻时的巨大抱负。 《爱尔兰人》 他们在大银幕上奉献了一些最令人震撼、最具爆发力的角色，这些里程碑式的电影包括《出租车司机》、《疤面煞星》、《愤怒的公牛》和《教父》系列。 在此过程中，他们的发展轨迹出人意料地交织在一起。他们不仅是同行和偶尔的合作者，还是真正的朋友，偶尔会抽出时间来了解、交流可能进行的电影项目并相互督促。 《出租车司机》 「我们聚在一起聊天、交换意见，」德尼罗解释说。「我们不会特别想念对方，但时不时会想到。」 也许最令人惊讶的是，在他们可以轻松地安于现状的时候——有时也会因此受到指责——79岁的帕西诺和76岁的德尼罗仍然对他们的演技极其在意。 《爱尔兰人》由马丁·斯科塞斯执导，将于11月1日登录各大院线，11月27日网飞上线，是德尼罗和帕西诺的第三次大银幕同框（译者注：两人此前一同出演的电影有《教父2》《盗火线》和《火线特攻》，但《教父2》中两人分饰两代教父，并无对手戏）。 这部犯罪题材的电影格局宏大、野心勃勃，同时是对往昔的回顾，并清醒地意识到，一切终将结束。 《爱尔兰人》 这是帕西诺深深产生共鸣的主题，他在片中饰演难以对付的货车司机国际兄弟会（International Brotherhood of Teamsters）主席吉米·霍法，德尼罗是影片的制片人，并在片中饰演主角弗兰克·希兰，一名货车司机官员和据称谋杀了霍法的歹徒。 两位演员都很在意自己的遗产，在《爱尔兰人》中，他们的表演和以往一样必不可少。只是现在，他们已经不需要再向观众证明什么，转而从超越自己的基准、赶上彼此的步调中找到动力。 在两人并肩合作的情况下，帕西诺说，「有些东西会削弱，另一些东西会增强。」 《爱尔兰人》 他们在大众面前的形象如此鲜明，以至于有人给他们创作了漫画肖像，而这些漫画并非完全没有根据。长发扎成马尾辫的帕西诺更有狂想曲的风格，而轮廓分明的德尼罗则是比较沉默的一个。(当被问及他和斯科塞斯是如何让帕西诺出演《爱尔兰人》时，德尼罗回答，「我说，『马蒂，你觉得阿尔来演霍法怎么样？』他说，『嗯，挺好。』」) 但他们也有共同的习惯，那就是一起坐着的时候，他们会互相调侃，享受恶搞对方的乐趣。聊到帕西诺必须参加《爱尔兰人》的试镜，他们俩都笑得非常开心。 「我问他能不能读几行台词，」德尼罗故作讽刺地说。他举起一只手，突然结束了假想的试镜场面：「哦，这太棒了，很好,」他继续说。 帕西诺顺着德尼罗往下演，用柔和而略带沙哑的声音描述了他印象中假想的任务：「你说，『听着，我一直在为此做准备——这不是你的剧本，但我正在演《李尔王》，现在我给你读几个片段。』」 随后他们大笑，德尼罗眯起眼睛，露出那种著名的咧嘴式笑容（ear-to-ear grin），环视着整个房间。 如果说他们现在可以共享一个关于自己精英地位的笑话，那是因为他们都有过毫无名气的时候，而且他们永远不会忘记在成长的过程中所忍受的不断的拒绝。 正如帕西诺所解释的那样，「我要对今天的年轻演员们说，无论你做了什么，永远不要抱着得到角色的期望。」(德尼罗补充道：「这是理所当然的。」) 《爱尔兰人》 两人都成长于二战后的纽约，帕西诺在南布朗克斯区，德尼罗则在格林威治村和小意大利区。他们都是离异家庭的孩子，并前后进入了表演学校——演员工作室（the Actors Studio）、斯特拉·阿德勒表演工作室（Stella Adler Studio of Acting）和赫伯特·伯格霍夫工作室（HBStudio）——并被这些学校颇具影响力的校友所吸引，比如马龙·白兰度、詹姆斯·迪恩、杰拉丹·佩姬和金·斯坦利。 演戏让他们沉浸在其他人的生活中，以某种自发性给自己带来惊喜。斯科塞斯在一封电子邮件中解释了两人的不同做法，他说：「我认为，阿尔倾向于流动性和韵律，而鲍勃则喜欢确认思维状态和存在感，并融入进去。但我认为这只是他们的直觉和个人取向的问题。正如一位表演老师可能会说的，他们都是拥有强大『工具』的伟大艺术家。」 帕西诺最早的突破出现在舞台剧《印第安人想要布朗克斯》（the Indian Wantsthe Bronx）和《老虎打领带吗？》（Does a Tiger Wear a Necktie？），德尼罗则从《战鼓轻悄》和《穷街陋巷》开始崭露头角（他与斯科塞斯合作的第一部电影）。当他们的事业处于发展的良好势头时，他们之间的友谊变得更加重要，作为同行，他们能够理解成名的尴尬。 《穷街陋巷》 「我们处在一个不同寻常的位置，」帕西诺说。「成名是一个完全不同的概念。和现在的情况很不一样，出名没那么容易。」他以一种更为淘气的语气补充说，「它还没有流行起来。」 德尼罗表示同意，说：「我们在一起可以聊聊这些，感觉很棒。」 弗朗西斯·福特·科波拉执导的《教父》系列电影对两人影响深远。帕西诺更是凭借1972年第一部《教父》里对迈克尔·柯里昂的迷人刻画一举迈入神殿——该角色还得到了德尼罗和其他众多演员的竞相争取。 《教父》 德尼罗并没有将帕西诺视为对手：「竞争意味没有那么强」，他还看中过逊尼·柯里昂那个角色，但最终归属于詹姆斯·肯恩。 「如果一个演员得到了一个角色，而且演得很好，那也没什么，」 他解释说。「但是当一个演员不适合这个角色，却因为不正当的原因被选中了，你就会后悔，甚至都不是嫉妒。你会对自己说，好吧，就这样了。事情就是这样。」 德尼罗凭借两年后上映的《教父2》获得了他的第一座奥斯卡金像奖。影片中，他饰演年轻时的维托·柯里昂。（「我说过我想让鲍勃做我的爸爸，」帕西诺开玩笑说。） 《教父2》 多年来，让他们一起出现在大银幕上似乎是一项无法实现的壮举，但这并不是因为他们缺乏尝试：他们几乎要联合主演《大街小瘪三》（埃里克·罗伯茨和米基·洛克代替了他们）；贝尔纳多·贝托鲁奇执导的《1900》（德尼罗参演了，帕西诺没有）；还有詹姆斯·弗雷执导的电影版《大亨游戏》（帕西诺参演了，德尼罗没有）。 当被问及为什么这些合作没能成行时，他们只是耸耸肩，归咎于世事的变幻莫测。 1995年，在迈克尔·曼执导的犯罪片《盗火线》中，他们终于相遇，短暂但引人瞩目，该片讲述了足智多谋的窃贼（德尼罗饰）和追踪他的重案组警官（帕西诺 饰）之间的故事。 曼在一次采访中解释说，他邀请这两位演员不仅是因为他们在电影行业里的声望，还因为他们本身就表达了一种思想，即两个人可以既相似又截然不同。 《盗火线》 「就像正题和反题，他们有一些共同的特征，而那些相异的特征是截然相反的，」曼谈到演员时说。「阿尔提前两周就在练习对白——这是一种自由形式的心理吸收。鲍勃则决心要完全沉浸在当下。」 最终，曼继续说，「他们都有一种完全的艺术沉浸感——但他们达到那种感觉的方式是完全不同的。」 十三年之后德尼罗和帕西诺才在《火线特攻》中重聚，一部普普通通的警匪片，两个人都没有特别美好的回忆。「我们完成了，」德尼罗谦逊地说。「我们完成了。」 《火线特攻》 即便如此，又过了很久两人才携手合作《爱尔兰人》。这部电影源于德尼罗对查尔斯·布兰特的书《听说你刷房子了》（I Heard You Paint Houses）的喜爱。 这本书是德尼罗在与斯科塞斯研究另一个潜在项目时发现的，它记述了希兰借由一个宾夕法尼亚犯罪家族的崛起，并于与霍法和肯尼迪家族的故事相穿插。 「故事的规模非常宏大，」德尼罗说。「历史人物的结局一直悬而未决，而这个故事根据这个角色给出了答案，而我相信这个角色。」 但是，完成电影耗费了超过十年的时间，因为德尼罗和他的合作者们都在等待斯蒂文·泽里安完成剧本，以及斯科塞斯在自己繁忙的日程安排中腾出档期。 《爱尔兰人》还需要网飞的赞助，据报道，该公司提供1.6亿美元的预算。这部电影的部分成本还包括在片中对德尼罗、帕西诺和乔·佩西等人使用的降龄特效，他们要在一些场景中饰演自己年轻时的角色。（德尼罗说，他们考虑过让更年轻的演员在这些场景中扮演他们。） 《爱尔兰人》 《爱尔兰人》是德尼罗和斯科塞斯合作的第九部电影，但是帕西诺的第一次。尽管他们已经相识——多年前，帕西诺找到斯科塞斯，邀请他执导一个最终并未实现的项目，而他本人则计划在这个项目中饰演莫迪里亚尼——斯科塞斯仍然希望在这位还不太熟悉的明星身上获得一些进展。 德尼罗回忆道，「马蒂说，『阿尔是什么样的人？』我回答，『他是个甜心。你会知道的。』」（帕西诺并没有介意这样的描述。「我就笑笑，」他说。） 除了有机会和斯科塞斯以及彼此合作之外，德尼罗和帕西诺还把《爱尔兰人》视为一个机会，让他们再次投入到现实生活中的人物身上，在从里到外塑造角色的过程中，仔细研究这些人物的相关文件和录音。 《爱尔兰人》 帕西诺近年来刻画了一系列真实的人物，比如乔·帕特诺、菲尔·斯佩克特和杰克·科沃基恩，他说，自己的责任不是复刻一个霍法，而是扮演他认为最令人信服的那个版本。 「你必须在某种程度上找到它的虚构性，」帕西诺说。「你必须找到戏剧性和特征。否则，就不如拍一部纪录片。」 他接着以更温和的口吻说，「我想扮演乔治·华盛顿。真的。」 德尼罗看起来非常惊讶，「你真的这样想吗？」他疑惑地说。「好吧。」 他们承认，都是被《爱尔兰人》的哀伤基调所吸引的，这些人物——不管怎么说，都是幸存下来的人——进入了暮年，很大程度上处于孤独之中，思考着历史将如何铭记他们。 斯科塞斯说，对于他和他的主角们来说，探讨这个悲伤的主题是适当且在所难免的。「我想我们都需要回顾过去——我、鲍勃、阿尔、乔，以及他们所扮演的角色」他说。「我们也处在这个年纪。我们只是想把它在电影院里呈现出来。」 《爱尔兰人》 但演员们认为要解释为什么影片的这一方面吸引他们非常微妙，而且原因显而易见：谁会愿意承认自己更接近于事情的结束，而不是开始呢？正如曼所言，「不会有人一边四处游荡一边想，噢，我现在是一位元老级的人物了？或是心里暗暗在想，长大之后要做什么？」 犹豫了一会儿，德尼罗说他和帕西诺必须面对《爱尔兰人》提出的存在主义问题。 「我们正在接近看到」——他做了一个夸张的手势来寻找合适的词语——「我不想说结局，而是，地平线的时刻，」德尼罗说。「转过身去走向另外一边的开端。」 帕西诺说，电影杀青后，他对这些想法的认识更清楚了；无论他们在他的表演中达到了何种程度，他说，都是斯科塞斯的指导和这部电影漫长酝酿的结果。 《爱尔兰人》 「我不认为10年前，他会拍这样一部电影，」帕西诺说。「他被访问了——这是我用的一个新词，但我很喜欢——他访问了一些我甚至无法触摸到的东西，我很惊讶我也能有所感受。我们处于什么情况？我们在做什么，四处游荡吗？」 让他们承认希望自己的电影经受住时间的考验是个更简单的问题——「你当然会考虑这些，」德尼罗说。「你希望人们记住你做过的一些事情是特别的，甚至不止于特别。」（《爱尔兰人》让帕西诺、德尼罗和斯科塞斯获得了超乎以往的热烈反响，似乎符合德尼罗的这一分类。） 如果要求他们对自己的表演做出评价，感觉很没礼貌。所以反过来，我请问他们喜欢对方的什么表演。 德尼罗立刻做出了回答：「我想到了《教父》和《教父2》。」 帕西诺也旋即做出应答：「我第一时间想到的是《愤怒的公牛》，」帕西诺说，但接着他怀疑自己是否在忽视了德尼罗的其他成就，并开始滔滔不绝地讲出更多的电影。 《愤怒的公牛》 「当然还有《出租车司机》，」他有些心不在焉地说。「我在想你的电影，鲍勃。我要举办一个鲍勃·德尼罗电影节。」当帕西诺这么说的时候，德尼罗的脸上开始浮现出一种不舒服的搞怪表情，就好像是听到了他最熟悉的片名就会让他不舒服似的。 帕西诺突然露出恍然大悟的表情，继续说：「他得过几次奥斯卡奖，」然后问道，「你得到奥斯卡奖是因为——？」但没有获得回应，因为德尼罗似乎因恼怒而不知所措。帕西诺于是自言自语道：「哦，《教父2》！」他喊道。「他在那里面也很出色。」（德尼罗的另一个奥斯卡奖是凭借《愤怒的公牛》拿到的，当然帕西诺不需要提醒。） 在《爱尔兰人》中，希兰和霍法的亲近性最终让他们之间建立了一种温柔的友谊——至少在鲜血淋漓的高潮之前——但德尼罗和帕西诺解释说，宣传这部电影的职责并没有使他们两人之间复制这种关系。 即使是像这种全球宣传之旅中，在所有的首映式、红毯和酒会派对上，帕西诺说，「我们甚至都没怎么见过对方。」 德尼罗也补充道，「每个人都有自己的事，回家，工作，出去玩一会儿。」没有必要实时透露行踪，他说，因为他们最终还是会再次相遇。 帕西诺用一种揶揄但又充满真情实感的声音补充道：「只是知道他在那里就很好了。",91,5.0,8
