,Unnamed: 0,电影id,电影名称,用户id,用户名,评分,评论日期,评论内容,有用数,没用数,回应数
20,20,26997663,寂静之地,d88a1e2e24251d6e30423554643e564c,42d6968c77af4b9a518bfc66301c8456,4,2018-06-01 20:20:23,大家好，我是中国人民的老朋友张大户  现象级恐怖片 《寂静之地》  自从在国内上映以来，引发了太多的争议。我听到最多的两个字就是“过誉”。 也难怪广大国内观众会发出这样的评价。因为这部电影在北美的评价实在是太高了，高的有点离谱。 烂番茄新鲜度95%（惊人的成绩）  MTC媒体评分：82分  还被MTC评为“2018年度最佳电影第18名”“2018年度最受关注电影第5名”“2018年度分享最多电影第3名”  1700万美元的预算，全球票房3亿美元。 《寂静之地》无论是评价还是网络热度还是票房成绩都是现象级的。热度堪比去年大热的恐怖片《小丑回魂》和《逃出绝命镇》。  不过在国内上映之后，口碑非常的两极分化，不像北美一片叫好的声音。 国内成绩也是不错的。豆瓣评分：6.4分  你可千万别小看6.4分，恐怖片的整体评分在豆瓣都是偏低的，6分以上就是不错的恐怖电影了。 截止到6月1号国内票房成绩1.9亿。是好莱坞恐怖片近年来在华取得最好成绩。（毕竟好莱坞的恐怖片很少有能在国内上映的）。  虽然口碑和票房都尚可，但同样有大量的国内观众觉得本片“过誉”了。 最忍受不了的就是本片众多的“bug”。 首当其冲的就是“都世界末日了，你还要怀孕生孩子？”  当我看到女主怀孕的时候我都懵了，我知道你们一家子心大，但这心也太大了吧。 要是在怪兽来之前你就怀孕了，那我就忍了。关键是怪兽都来这么长时间，想存活下来都费劲，您还生孩子呢？  你不知道怪兽听力好，听见了就来杀人啊。你生孩子不出声啊，孩子生下来不哭啊。 不怪国内观众diss你，这操作实在是太逆天。  对于怀孕生孩子的设定，导演卡拉辛斯基也有自己的想法：“失去孩子的痛苦，通常会导致两种结果，要不然夫妻两人分手，要不然强迫自己向前看，再生一个孩子”。  当然还有另一层用意就是增加他们的生存难度，强化戏剧冲突和恐怖氛围。 除了怀孕这点，还有众多观众吐槽的点。 墙上挂满了照片，桌上摆满了东西。都不怕东西掉下来吗？ 走路的时候让小儿子走在最后边，姐姐把明知道会出声的玩具给弟弟，这一家人心都太大了。  反正情节上可以吐槽的点太多了，这个真不怪国内观众。 不过有槽点也正常，哪部电影没有槽点。我觉得这些槽点对于整部电影来说，是瑕与玉的关系，瑕不掩瑜。  电影院里有2大优势，1个是影像的优势，另1个就是音效的优势。 电影院里巨大的环绕立体声是绝大多数家庭设备不能比拟的。 《寂静之地》反其道而行之，用了“谁先出声谁先死”的设定。简直是自断一臂。练就了神奇的“独臂刀”。  要知道恐怖电影之所以恐怖，很大一部分原因就是因为音效的缘故。（尤其是那该死的水琴）。不信你把那些恐怖片中的音乐改成喜羊羊的音乐，我保管你不仅不害怕，还能乐出声来。 《寂静之地》用了极少的音效，达到了惊人的观影效果。这种观影体验是我极少能感受到的。  电影院里静的掉根针都能听见，银幕上一点声音没有，银幕下也安静的可怕，没人吃东西，也没人打电话。偶尔发出声响，不管这响声出自哪里都能把人吓的一激灵。 《寂静之地》对于整个氛围的营造达到了极致。当怪兽出现的时候，连观众都不自觉的屏住了呼吸。  当女主孩子要生了的时候，我都替她难受，太疼啦。 孩子生了，我也出了一身的白毛汗。这种观影体验真的非常棒。  钉子那部分，很多人吐槽。其实这不是典型的希区柯克式的“定时炸弹”叙事技巧嘛。 大家都知道钉子就竖在那，就是不知道什么时候引爆，让你的心一直悬着。踩到的那一刻，我反倒觉得如释重负。  《寂静之地》情节上有这样那样的bug不假，但是它另辟蹊径，把整个恐怖氛围做到了极致。不同于那些经典的恐怖大作，走出了一条自己的路。就凭这一点。 《寂静之地》在整个恐怖电影历史中，也有它的一席之地。 彩  蛋 1.已经证实，《寂静之地》铁定要拍摄续集 2.在一家人的地下室中，贴满了报纸的墙上，其中一个标题写着“一颗流星如同核武器一般落在了墨西哥”，这可能暗示怪兽是如何来到地球的。,6,7.0,0
21,21,26997663,寂静之地,75d80d05812a27c76848efe4718c0dd8,f2c4474c6ad40a75130e014b5ac3c7e8,5,2018-04-15 07:32:06,"If they hear you, they hunt you. 这部影片还没上映的时候，就把这个很有意思的基本设定抛给了观众，确实吊足了胃口。实际上，这个设定在自然界中也有迹可循：很多洞穴生物在漆黑一片的环境里，视觉都严重退化，大多依赖极其灵敏的触觉或者嗅觉来捕猎。不过，正常情况下，听觉在自然界生物中更多的是用来躲避天敌的存在。比如大蜡螟能够感知高达300千赫兹的频率，远超人类2至5千赫兹的频率范围，就是用来探测蝙蝠发出的超声波的。 而这一次《寂静之地》的过人之处，则是把听觉也提升到了捕猎者的高度，从而设定出了一种依靠听觉进行捕猎的强悍生物。遗憾的是，这个设定在自然科学背景“匮乏”的豆瓣电影里，竟然引发了争议，还导致影片的评分居然呈现出了下降的趋势。 比如，某高赞影评提到：只要在空地大放广场舞，怪物就会聚集起来然后被集体团灭啦。 恕我直言，这是对生物进化规律最基本无视。 “Hunt”，即狩猎，是一种需要大量后天学习的复杂行为，而非简单的非条件反射。作为一种依靠听觉狩猎的生物，可以想象，其一生中最主要的学习内容，就是如何在纷繁嘈杂的声音环境里敏锐地辨别出猎物的存在，并且予以高效的猎杀。这也迎合了这种怪物的行动异常迅速设定：如果动作不够快，猎物在发出声音之后就变化了位置，这哪里还捕得着？ 而这种后天学习来的捕猎能力，必然意味着这种捕食者是不可能被简单的噪音所吸引的。否则，大瀑布旁边才是最危险的地方：那里每天都必然聚集着大量闻声而来的怪物才对啊。 显然，影片中的场景不是这样。 影片中的怪物，有着极其敏锐的听觉，也必然具备从大量的声音输入中辨别出猎物的能力。这种能力一定是后天学习来的，大致可以为遵循着如下规律： 1、感受到某种声音  2、前往声源处进行猎杀 3、猎杀成功 如果在这次出击过程中1、2、3按顺序逐项达成，那么这一次的声音模式就会被认为是有效的猎杀反馈，从而在下次再次出现时激活猎杀行为。需要注意的是，如此敏锐的听觉能力，也必然意味着对应的声音判断能力：对于两次声响是否属于同一种模式的最终决策，绝对不是简单地依靠频率或者固定的模式就达成的。而且更重要的是，这次声音输入，很可能是任何一种声音。比如在某只怪物的记忆中，很可能就有这样的记录： 锅碗瓢盆掉在地上的声音 -- 一种两条腿易猎杀的猎物 但这也意味着对于另外一只怪物的来说，这条记录很可能不存在。所以靠单一音源吸引所有怪物，不太可能。 这是其一。 其二，既然要依赖于声音做判断，捕猎者必然也要具备对无效声音的过滤能力。如果出现了多次“锅碗瓢盆掉在地上的声音”没有对应到“两条腿易猎杀的猎物”，那么这条记录就应该被优先级降低甚至过滤。 这也就意味着，对于第一次出现的、闻所未闻的声音，或者突然出现的巨大声响，很可能是可以吸引到怪物的，而一旦声源被认定无效，或者声音不断地无效重复，那么这个声音就没有意义了。更重要的是，不止这次的声音失去作用，而是整个声音模式都会失去作用。比如：将来所有的“音乐”都不可能吸引到这只怪物。这个很容易理解，哪怕是人类，也能轻而易举地分辨出那些声音属于“音乐”，怪物的这个能力只会更强，而且需要的学习时间更短。 所以，对于一群怪物来说，基本上不存在依靠某种声响把它们全召集起来的可能性。或者说，设计出这样一种能欺骗所有怪物的声音源的难度，是极其巨大的。 还有一点，这里的怪物应该是外星来的。因为它身上的盔甲实在太厚了，攻击力也太强了（撕铁皮跟撕纸一样），这绝非地球环境下能进化出来的结果。这也意味着，从来到地球开始，怪物依靠听觉的捕猎能力也一直在不断地高效学习中。 至于影片中其他的“bug”，有些确实存在，但都不威胁这个最基础的设定，也不影响观感。比如钉子啦，生孩子啦这些，推进剧情需要罢了。 但能够肯定的是：作为支撑这部影片好评如潮的基础，Hear和Hunt之间生物学关系和逻辑，没有任何疏漏。 总体上4星和8分肯定有的。某些人建议多看看动物世界和初中生物再好来吐槽。 【给杠精、脑残以及阅读能力不足者的一点提示】 修正：怪物的行为并不是为了捕食，而是纯粹的猎杀。前面的说法有误但不影响结论。并且，既然不是捕猎，那么更大的声响确实具备转移注意力的作用（烟花 VS 分娩） 第一：怪物必然有比人类更强的声音处理能力（降权、过滤、提权、分类、标记），长期重复出现的声音模式会被“降权”（比如瀑布和其他自然界噪音）。 第二：突发或者巨大声响对怪物必然有更强的吸引力（你作为视觉动物，黑暗处突然出现的强光必然会吸引到你的注意）。 第三：但是有吸引力不一定会触发攻击和聚集，而是取决于条件一的处理结果。 所以， 烟花，闹钟，电视突然发出的声音属于（二）。 脑残播放的广场舞在第一次出现的时候属于（二），播放了一段时间后会属于（三）。如果中断足够的时间再出现，很可能还会属于（二），但这取决于具体个体的处理结果，不同怪物得出的结论是不一样的。就好比有的脑残就喜欢一惊一乍。",346,214.0,138
22,22,26997663,寂静之地,ea1324dde2fb8159a9f814606bb07a83,836f1864c9df7935e5e13fbe8b32efee,2,2018-05-26 09:43:41,总体感觉这部影片也就一般般。说句实话，故事讲得有很多地方逻辑不通，显得有意而为之，为讲故事而编造的感觉，不明白为什么会热映。  如果从惊悚的角度上讲，倒是挺吓人的。我能说它成功地吓退了我吗？  我突然想起有一首英文歌曲叫《寂静之声》，和这部影片相比，歌曲可是要好听多了。  同样的孤独，同样的不知道何去何从。,42,3.0,0
23,23,26997663,寂静之地,80b22f2ce1292f3340b1fcd23e22da94,cec01e21715eed22191dca989a059e80,1,2018-05-19 10:43:01,去电影院看的，手语没翻译，对白刚开始翻译了，后面就没有翻译了。 小女孩的脸怎么看怎么讨厌。 剧情没有逻辑，设定蠢的死，最后竟然那么低级的一个东西就能控制住怪物，早干嘛了，全人类都这么蠢不知道怪物的弱点是声音？？？竟然快灭绝了？卧槽。 那爸爸死的时候我要吐血了，心里在想快点死快点死，偏偏慢镜头煽情，镜头再给到那个小女孩，怎么看都觉得她像在笑，是不是她爸爸为她死了，她觉得她爸爸终于是个英雄了满足了她的期望了？？ 这么多好评，豆瓣上还有6.9分，它比国产烂片还要烂好吗？？ 为了平衡一下分数，我要给它打个最低分泄我心头之恨。,25,14.0,4
24,24,26997663,寂静之地,a9d56c2025e7db86b38a11f3c022ae6d,df1fefd2155e4df5f2a46ca11d4ba0d8,4,2018-05-18 04:19:19,终于有一部专治啊啊啊嗷嗷嗷呀呀呀的恐怖片了！ 虽然2018还没过一半，《寂静之地》已经堪称年度最佳了。   讲电影之前，先要说明一个问题：如何评价一部恐怖电影吓不吓人？ 很多人会想，当然是影厅的分贝数了！ 每当看到恐怖镜头的时候，胆子小的人叫起来那是惊天动地，更伴随着大幅度的肢体动作！就比如前段时间很火的《昆池岩》，用影院散落的爆米花，来彰显其恐怖程度。   然而，《寂静之地》与众不同的是，即便当你看到吓人的镜头，也会下意识的捂住嘴巴，而不是像其他恐怖片一样大喊大叫。更不敢发出一点声响，甚至连爆米花都不敢下嘴！   电影的背景设置在近未来，2020年左右，地球上突然出现了一群怪物，大量的人类惨遭杀害。这种怪物有一个特点，它会杀掉任何发出声响的有机体。 话说，阿伯特一家四口为了躲避杀害，只能在无声状态下生活。他们通过手语交流，用光脚走路，吃饭、洗衣服等更是小心翼翼。影片进展到一大半，你才听到了真正意义上的人声。   那么，恐怖的地方在哪里呢？ 女主角Evelyn眼睁睁看着自己的孩子Beau被杀，捂住嘴大哭却不敢出声；她的脚被钢钉穿刺，忍着痛不敢出声；生孩子这种10级阵痛，照样不敢出声。 放屁、打嗝、咳嗽忍不住怎么办？只有死路一条！鼾声大的人更没跑了！   怪物攻击的速度非常快，一眨眼的功夫便能削掉人的头颅；而且皮肤异常坚硬，子弹根本穿不透。通过男主角Lee的视角你能看到，他们周围至少活跃着3只这样的生物。 它们有弱点吗？有！不过当Evelyn和Regan发现其弱点，并进行反攻的时候，影片戛然而止，留下了一个开放式的结局。（导演表示，电影会拍续集）   《寂静之地》最值得讨论的地方在于，它的“无声”情节的前提设定，以及处理恐怖氛围的手法。 一方面，它处理怪物的方式，借鉴了很多经典电影，比如斯皮尔伯格的《大白鲨》和斯科特老爷子的《异形》系列。怪物就像跟你捉迷藏一样，一步一步揭开恐怖的面纱，每一次出场都能吓你一跳。   除此之外，《寂静之地》还有一个最大的卖点——“互动性”。从某种程度上而言，“声音”是这部电影的主角。 观者在电影院的座椅上，会不由自主地控制自己所发出的声音。“不敢作声”的紧张程度，与剧情的进展息息相关。 它开创了一种新式恐怖，反常规的新奇体验，让观影的过程十分带感。它不仅仅是一部恐怖电影，也是一部彩色默片，更是一种突破“第四堵墙”让人同呼吸共命运的沉浸式体验。   其实，为了让恐怖氛围更具真实感，好多电影尝试了手持DV的拍摄形式，植入更多的主观镜头，像《女巫布莱尔》、《鬼影实录》、《昆池岩》等。 而日本很多恐怖片，对于生活中熟悉场景的运用，也出于此目的，如《午夜凶铃》的电视、《鬼娃娃花子》的卫生间、《鬼水怪谈》的电梯等。   不过，大多数恐怖电影营造氛围的方式，只是单纯激起你的情绪。它们并没有深入研究情绪，并利用生理反应去制造一种新的吓人方式，这也是很多恐怖片看完就被人遗忘的原因。一旦恐惧消散，血压也恢复正常。 相比之下，最令人难忘的恐怖电影，几乎都将“恐怖”开创了一个新的维度。 就比如《闪灵》中的237号房间，只有走进去才能解决问题，即便你知道里面有什么。这种手法其实就是在告诉我们，战胜“恐怖”的唯一方式，就是要鼓起勇气直面“恐怖”本身。   《寂静之地》中，当主人公投身战斗的时候，我们其实也和他一起踏上了征程，直面最恐怖的怪物，以及最恐怖的结果。 看完电影，很多人会有这么一个疑问。在这个“发声”就等同于“死亡”的世界，为什么Lee和Evelyn就不能控制一下自己的欲望，非要造出一个孩子。   细想之下，其实也符合情理。片头Evelyn小儿子被杀，为了缓解伤痛，一个新生命会让家人更加凝聚在一起。   而且，为了孩子的降生，夫妇俩也做了充足的准备，婴儿罩氧气瓶、隔音地下室、甚至为了掩盖生产过程中的喊叫，还准备了诱导怪物的烟花礼炮（也不排除是其他原因）。 而且，为了人类的未来，也得生！,73,68.0,25
25,25,26997663,寂静之地,b55a8af3c788e36693cc69d6fb7686c9,eb37ead093896b590dfe8bb897ed591e,3,2018-05-12 00:05:07,一架武装直升机能干掉多少怪兽！！！不要说怪兽的外壳坚不可摧，结局也证明了只要怪兽打开耳朵就很容易被干掉。而除非是静止的声源，否则只要声源在动，怪兽就要打开耳朵重新定位，让一架武装直升机在低空低速盘旋是很容易让他们打开耳朵的。除非他们不攻击空中声源（是有成群的鸟儿活着），不过这不是更好吗？只要在空中就不会有事，反正不明白为什么这种生物能人类几近灭绝！！,5,1.0,3
26,26,26997663,寂静之地,d2300f508d878bed566eec3c2b7fd036,0d862cc7ac300830079681e5f268c9ea,2,2018-04-12 05:12:14,本剧起点其实较高，怪物侵袭后的末日设定，所有人必须噤声生活，稍微大一点的声响都会将怪物引来，寂静无声的紧张气氛很容易将观众带入情景，跟着角色来屏气凝声，这也是本片能够在众多电影节之中能够脱颖而出的原因吧 但是细究起来，本片实在是充满了bug，无论如何是配不上如此高的评分和评价。 1.过于依赖噤声设定，前十分钟还好，全程如此观众会疲乏，影片看下来有一种憋着一口气始终不能抒发出来的感觉 所有高潮点无外乎就是不该发声—》不得已或者不小心发声—〉怪物来了—》怪物走了 2.情节如此单调，最后的结局就不要还开放了哈，一个炸弹怪物全挂让我抒了这口恶气可好哟 3.人物性格不鲜明，技能满点的父亲最先挂，元气满满的母亲最强大，善良可爱的儿子你快长大，天性洒脱不羁爱自由的女儿，你…你就把你耳麦带好吧 4.既然怪物已经存在，就不要拘束于物理攻击，各种技能加持外挂模式干死丫的，一味忍让退步小心翼翼真是让人憋得慌，最后结尾如果能够以一种爆裂状态消灭怪物，会不会有一种长舒一口气的畅快感呢？… 看完电影后心情真是难以言表，与国内恐怖烂片不同，他是一部精心制作的烂片，让你体验一下满心期待后的失望重创，相当刺激 我今天晚上需要再看一部电影缓解我内心的创伤，不然我真的不知道如何再进电影院了…… 以上,59,24.0,9
27,27,26997663,寂静之地,37203f0ef82c870c36cd6f99e1fbfe4c,343ad7484098dab5b83464b49fbe5fa3,2,2018-12-08 05:02:55,当然是自编自导自演夫妻同台什么的细思极恐。 Bug多到不停出戏，声音都不能有哪来的电？既然家里有那么多电灯干嘛还搞个煤油灯？爹妈基因都挺好这女儿长得一张猪腰子脸是为啥？已经害死一个弟弟了女儿还在作死你凭啥那么吊？你妈都要生了还不老实帮点忙，丑人多作怪吗？家里挂那么多相框不怕掉下来了？早知道要生了都没有应急预案吗？枪都上好了你换把斧头是几个意思？ 速度快，爪子尖，听觉灵敏就能灭绝人类了？被一个刚生了孩子的女人一枪爆头了好嘛？还好意思说上海沦陷了，你知道这样小龙虾一样的怪物到了中国离人工饲养有几天吗？,61,10.0,10
