,Unnamed: 0,电影id,电影名称,用户id,用户名,评分,评论日期,评论内容,有用数,没用数,回应数
6,6,26997663,寂静之地,5f51194f0b8c819c7d5cd37f0bf697d2,7cd8e243c0c56beb8231dec9f8231952,1,2018-04-17 20:03:23,"很久没有被一部电影戏弄到怀疑自己选片品味的地步了
——出离愤怒的包老师 我是一名忠实的索狗。 忠实到什么程度呢，索尼第一方的看家作品我基本都是白金，第一时间入手实体版这种成都就不用提了，翻来覆去体验无数次高清重置版还得买。所以当我和太太走进电影院看这部电影的第一眼时，我就觉得有戏： 因为这场景和最后生还者（The Last of Us）太TM像了啊！ 你能理解我心中的狂喜吗，这种感觉就像是自己偷摸处了10好几年的小女朋友终于被爹妈认可、可以进门挑日子行大礼了。 但是越往下看就越不对了。    首先要声明的是我是在遥远的非洲大陆观看的。 但不是这种电影院 语言问题对于英语十级的我并没有什么障碍，另外就是因为开篇很久都没正儿八经听到什么声音。当然原因后面会慢慢讲到：不知道是什么时候，我们生活的地球，不知道被什么东西入侵了还是生物变异还是化工企业污染还是其他什么奇奇怪怪的原因，出现了一种奇奇怪怪的生物。 这种生物有多奇怪呢，首先，它看不到，其次，它听力很好。嗯？等等，你确定这不是最后生还者（The Last of Us）里面的循声者吗？（为避免引起不适此处无图请自行搜索） 当然不是了我们的怪物有坚硬的盔甲以及刀锋般的四肢以及迅猛的移动速度呢 哦那和隔壁卡家的生化危机还真是不像呢。    设定上面就已经让我犯了嘀咕，那么继续看下去呢。 开篇主角一家人神神秘秘的在药店中搜罗药品，病恹恹的大儿子瘫在地上，女主角小心翼翼的动作让事先做了点功课的我不禁觉得这种循声而来的怪物可能真的很可怕，小儿子从一开始就花样作死，不仅硬要去够高处的玩具，偏偏好死不死还是个带响的。最后果然在长征5人组回家的途中玩玩具被怪物叼走。片子到这里其实讲的还不错，交代了几个人主要的人物关系，小萝莉听力障碍等一些基本信息，但是出场时候的一惊一乍就已经让人很难舒服的看下去了。 时间一转到了几年后，男主一家人居住在偏远的郊区，享受着安静平和（？）的乡村生活。镜头一转，我们伟大的女主角怀孕了——是的。 心中一万匹草泥马奔腾而过：为什么要怀孕？你不知道怪物是听声的吗？生了三个孩子还不知道小孩子能有多大声吗？末世期间避孕手段虽然比较落后，但是那你们俩就不能等等吗？生孩子跟生个定时炸弹有毛毛区别？ 事实证明，不能。 即便是在男主角试图向外界发求救信号的档口，这女的还风姿妖娆的下楼找老公要亲亲。 WTF？？？请你们俩有点末世的样子好吗。    时间慢慢流逝，小萝莉由于小弟弟的被gank，自己心中一直存有愧疚，在父女发生争执后前往弟弟的被gank地点。老爹带着儿子出门去捕鱼补贴家用。在河边和瀑布边，男主角向儿子传授避险大法：躲在比自己声音大的地方，怪物就听不到我们的声音。 等等，我怎么没看见瀑布边有好十几头怪物？还是说怪物能分辨人声和自然界的声音？不对啊，之前的确是看到怪物会被各种各样的声音吸引啊？好的，这些都是小细节不必在意。 终于，到了女主角生产的这天。果不其然的，老公儿子小萝莉都不在身边，而在这个关口，奇奇怪怪的怪物又由于女主角的一个不注意进到了屋子里了。呵呵呵呵，真是好一串巧合啊。 女主角下楼去，观众们的眼睛明镜似的看到楼梯上有个钉子，而且这个钉子在之前的情节中已经勾上了女主角的洗衣袋，而且这个钉子的位置就在他们日常上下楼留下的脚印或者是标记上，但是这些都无关紧要，我们的女主角还是为了恶心你，毅然决然的踩上了钉子。 这是全片最让我觉得不适的镜头。其一是因为这种疼痛感可想而知，另外的一个原因是，这个钉子的位置是如此正点以至于让我想不出任何一个合理的理由可以解释为什么这个钉子会出现在这里，除非是有人钉上去的，百般思索无解后我只想说：导演你是不是觉得我是个傻子。 废柴老公果然在女主角最痛最无助的时期过了之后回到家中，令我觉得意外的是，他还拎着把枪。我想问一下男主角，你该不会在逗我吧，一把枪能解决的怪物，能把人类团灭成这个样子吗？ 好的无论如何，我们的男主角来救女主角了，但是你还有俩孩子在外头呢。 这俩倒霉孩子在谷仓遇险的经历就不多说了，这段剧情可以说完全是导游说什么就是什么。小儿子胳膊腿儿什么的比小萝莉弱多了，还不是说拽就拽上来了。不想多费口舌。 我们继续来看孩子生下来之后。是个男孩。与众不同，一生下来，就非常安静。 前文已经告诉我们男主角另外安排了一处母婴休息室。当下即刻将老婆孩子转移到此处，一番缠绵之后，想起还有俩孩子在外面，于是拉上床垫出门去了。 等等，床垫？对啊。 一张床垫可以隔音？对啊。 哦原来这样怪物都听不到我们了啊！那人类还为什么被团灭啊！ 之前的片子有交代：男主局在谷仓上生起篝火，镜头转向遥远的山林中，林中影影绰绰的亮起了几处篝火，表明周边还是有人的。后面小萝莉点篝火求救，但是周围就是一片漆黑，那就是说周边的人类被灭了呗，没人了呗。但是谁家能没两张床垫啊！你会挖地下室别人都不会了呗！ 但是还是那句话，这都是无关紧要的细节。男主角拉上床垫的时候，地上出现了水迹，镜头一转，漏水的地方就在不远处。诶等等啊男主，你家漏水了，你老婆孩子还在下面哦。“什么？我听不见。” 毫无意外的，女主角再次，奇迹般的，在世间罕见的乖儿子的助攻下，逃离了水下地下室和奇奇怪怪怪物的追击。嗯可以的。666。 男主角当然为了救俩孩子领便当了。导演这里安排丈夫的手语告别是要赚观众眼泪，可惜电影院里齐刷刷的爆米花声让我觉得导演很可能除了自己谁也没感动到。最终两个孩子坐着破车滑梯回到家门口。响亮的关车门声让我不禁要问，你们到底什么套路？？？ 当然了，我们的女主角和小萝莉无意间发现了怪物的弱点，最后终于迎来了大团圆的结局。但是你们这一脸“还有谁”的表情难道不违和吗？你们的爹和你的老公刚被干掉了耶，你们在怪物的阴影下生活了好久耶，你们这一副来几个杀几个的凶相给谁看啊？    在车里跟太太讨论剧情的时候觉得，太太觉得唯一的亮点就是追声怪物的设定，我表示你觉得这是亮点的唯一原因是你没看我玩The Last of us。太过雷同的末世设定，一边是老男人带小萝莉，这边是两口子带仨孩子，大家同样在末世求生活，这怪物活脱脱循声者和生化危机的混合体，就连男主角和Joel也有几分神似。从讲故事的层面来讲，能讲的比The Last of us还好的末世题材电影，我还真心觉得没几个。 莫名其妙的怪物是本片最大的硬伤。瞎子一个，空有一身肌肉，但是只能听声辨位。这种怪物最大的用处可能就是围着广场舞大妈的喇叭绕圈圈吧，竟然还把人类给团灭了？再说了，这东西看起来不擅上树，就算把人类灭了，最后还是得被叽叽喳喳的鸟群遛得到处跑啊？怪物的杀戮动机也令人生疑，片子完全不解释怪物为什么和人类这么大仇这么大怨。而且从林中撞见的老夫妇来看，怪物攻击人不是为了吃，也就不是为了补充营养，所以我猜就是单纯为了爽咯。既然是为了爽，为什么不去攻击明显简单点的动物呢？人类作为猎物来说也还算是hard模式的吧。 全片充斥着咋咋呼呼的吓点，俩孩子碰面了要吓你，油灯掉地要吓你，女主角生孩子要吓你，反正就是你能想到的地方我一个不落地吓你，你想不到的地方我也要恶心你。这样的片子完全只能是浪费时间。",254,82.0,61
7,7,26997663,寂静之地,c9bc43185f5ea73abee8b1644292cc01,da2647b11e448db727d44fb2a7f183fb,2,2018-05-18 13:12:07,"上半年最受期待恐怖片，《寂静之地》一定算一个。 在国内上映之前，《寂静之地》就已经在北美口碑大爆，《滚石》《好莱坞报道》等多家媒体，对它都不吝赞美—— 片中母亲提出疑问：‘我们是谁？如果我们连自己的孩子都保护不了？’影片以复杂、情感真切的方式给出答案，它证明了家人所在之处即是家。
——《滚石》
上一个在非现实世界把恐惧与父母责任结合得这么好的影片，已经是2011年的《寻求庇护》了。
——《好莱坞报道》
回归恐怖片的基本，不依赖于怪物的长相来制造恐惧。
—— 烂番茄 好口碑带来高票房，《寂静之地》以1700万美元的低成本，收获了2.7亿美元票房。 今天，这部让人期待已久的恐怖片终于在大陆上映。  海报营造的感觉很好，还有几张警示语海报：“不要发出声响”“不要偏离道路”“红色代表快跑”。 可看完之后，就很想咆哮：95%的烂番茄新鲜度和82的MTC评分是怎么肥四！ 这一年来，出彩的恐怖片不算少，《小丑回魂》《忌日快乐》都有不错的评价，国内以豆瓣为代表的观众群，对它们的评价都比较接近。《寂静之地》7.2分，《小丑回魂》7.3分，《忌日快乐》7.2分，考虑上恐怖片的天然劣势，可以说都是备受认可了。 然而…… 《寂静之地》：IMDb8分，烂番茄新鲜度95%，MTC82分。 《小丑回魂》：IMDb7.5分，烂番茄新鲜度85%，MTC69分。 《忌日快乐》：IMDb6.5分，烂番茄新鲜度71%，MTC57分。 外网和豆瓣的差异暂且不论，单看这样明显的差距，大家抱着比《小丑回魂》更高的期待去看《寂静之地》，不过分吧？ 可惜，它没能实现这份期待。 注意力全在吐槽上，谁还会专心被吓？ 下文有重度剧透，吐槽部分加粗标出，请选择性阅读 抛开外媒的大吹特吹不说，《寂静之地》的设定其实是足够吸引人的。 神秘生物入侵地球，多数人类死亡，所见之处都是一片衰败和荒无人烟，这种怪物看不见东西，但能以极其敏锐的听觉发现及捕杀猎物，幸存的人类必须保持安静。 小儿子玩个玩具火箭，搞出了声音，妈妈、女儿、大儿子全都惊恐万分，爸爸更是疾奔着冲向孩子。  开场就便当的小儿子。 接着，怪物噌地冒出，小儿子死了。 故事由此在这幸存的一家人身上展开。 不得不说，这10分钟的开头还是很刷好感的，紧张的背景音乐，千钧一发的惊险时刻，最让人欣喜的是，音乐只在旋律上制造惊悚感，而不企图用音量撞击人心，最危急的时刻，一家人四口或是屏住呼吸或是沉默奔跑，没有咋咋呼呼的尖叫和失措。 一年过去，状况没有一丝一毫的改善，相反，一家人活在没有保护好小儿子的阴霾中。 父亲不懈地研究无线电，试图向其他幸存者求救。大儿子年纪虽小，却在用功学开车和英文拼写。女儿是个听障儿童，因此一家人懂手语，日常以此沟通。与此同时，父亲也在尝试制作人工耳蜗，帮助女儿恢复听力，可惜屡屡失败。  父亲尝试接收外界信息。 而母亲…… 她、她、她……怀孕了？！ 等等，翻回去，之前说这是怪物入侵的第几天？ 472天！ 就是说，这对夫妻，在听见声音就杀人、定位能力堪比导弹、速度仿佛会瞬移的怪物四处游荡的情况下，还交配，还要生娃！ 生娃可以不出声音的吗？  没关系，妈妈一脸从容地在月历10月23日这天，标记了“BIRTH DATE（出生日）”，他们一定已准备万全，且让我们拭目以待，看这一家人如何机智求生。 父亲带儿子外出捕鱼，告诉他在水流边可以不必那么悄不做声，因为水流的声音盖过人声，怪物就不会来。甚至，他们可以在喧闹的瀑布边欢笑、交谈、大喊大叫，释放压抑的情绪。  父亲带儿子在瀑布边说话。 母亲一个人在家中，发现楼梯上有个突起的钉子，此时镜头给了钉子一个长时间聚焦。 然后，果不其然，毫不意外，再次经过的时候，她被钉子扎了。 好了！知道你被钉子扎脚很痛，拼命忍着不能叫出声也很艰辛，也看得出来你演技挺好的，可是……在内心飘满吐槽弹幕时，没有人能沉浸到这段剧情里！ 发现钉子不及时处理，经过时也不知道小心看着，中间又不是隔了十几二十天，一定要这么做作这么套路吗？ 更套路的是，怪物果然出现了。机智的母亲设了个闹铃，引开怪物。 这时候，母亲要分娩了，在外看到母亲亮起的红灯从而收到警报的父亲，指使儿子放弃烟花，父亲则赶回去找母亲。  在有怪物时一个人生孩子，佩服。 再等一下，这个怪物不是只对人的声音敏感啊，是对什么声音都敏感，一个闹钟响了都急不可耐扑过去，那为什么水流声引不来怪物？ 我们可以勉强解释为，怪物对持续的响动充耳不闻了，据说这片区域只有三只怪物，大自然里每天动不动这响那响的，这怪物怎么就那么赶巧，老是出现在这家人跟前，小儿子惨死一回，母亲在家一回，父亲回程的路上也撞上一回哦！ 你们是一家子枪兵吧？ 孩子顺利地生下来，父亲带着母亲和新生儿逃进一个地下场所，这里隔音效果很好，我们终于能听到本片除瀑布场景外第一句对白。 那……这么轻易就能隔音，你们人类是怎么被灭了这么多的？你们之前又为什么坚持在地上生活，不小心撞倒个灯都吓破胆？  更多无伤大雅的小槽就不吐了，只再说一个。 以绝对力量把人类赶尽杀绝的怪物，被母亲一枪打爆头。 你们之前的军人都干嘛吃的啦！ 结尾，父亲救家人牺牲了自己，在监控录像上，母亲看到剩下两只怪物狂奔而来。 这暗示了这坑爹的电影似乎还有第二部。 白瞎了好设定，把恐怖盛宴变成人机游戏 讲真，《寂静之地》如果真出续集，我们相信还是值得期待，因为这个不能出声的设定很有意思。 怪物对声音敏感的设定其实不新鲜，最近的就能找到一个月前的《湮灭》，人语熊在调查队员们没发出声音时就不会攻击。  娜塔莉·波特曼饰演的调查员屏息逃避人语熊的攻击。 但是《寂静之地》的特点是，将此作为一个支点撑起全片。因此，撑没撑得住成为评价该片的重点。 在上映之前，关于本片台词很少全靠演技的宣传就满天飞。 平心而论，导演兼男主角约翰·卡拉辛斯基和女主角艾米丽·布朗特这对戏外真夫妻，在戏内也表现绝佳，失去小儿子后的些微龃龉，一起守护家庭的生死真情，全都表达得细致动人。  不论是躲避怪物时的惊慌还是面对孩子时的担忧，布朗特的情感表现都很沉稳又到位，就像本片的背景音乐一样，精确不浮夸。 可我们对于“台词很少全靠演技”的含义，本来有更高期待。 这种期待，绝对不包括把“用手语和字幕代替台词”等同于“台词很少”。 是的，虽然到剩余30分钟的时候，大家才能听到室内说的第一句台词，但在此之前，一句句飘过的字幕，都是这家子人在沟通对话。 这不是硬伤，而是很聪明的投机取巧，但这样一来，怪物看不见却听觉灵敏、不能出声这些核心设定，根本没有把作用发挥到极致。  “嘘”，片中最常出现的手势之一。
 更毁这个设定的，是前文吐槽过的，怪物听力好，似乎仅限于听声辩位，但一丛烟花、一个闹钟，就能把它的注意力引走，这不仅造成人类几近灭亡这个结果毫无说服力，仿佛一个地球九成的人都是智障，更把这个本该制造恐惧的主体，弱化得仿佛一只看见飞盘就追的狗。 这个设定，明明随便想想就可以制造很多有趣的困难，比如在不能出声的情况下如何获取食物，比如人如何解决无法控制的响动，可故事非要轻易放弃这些，一条流动的河流就解决了吃饭问题。 所以，给钉子特写就会被扎到，扎到后一定会招来怪物，这些并不是最要命的俗套点，最要命的是，当强大、弱点不明的怪物，轻易就有了诸如瀑布边安全、闹钟可引走一类的高度可控性，那么一场恐怖盛宴，就沦为了一场可预知的人机对战游戏，你看，这个怪物和网游里的副本boss有什么区别，他们有固定的行动机制，还可以卡bug呢。 亲情戏这么作，你们怎么被感动的？ 按理说外媒也不都是傻子，《寂静之地》的槽点也没那么难看出来，翻翻豆瓣评论，十个有八个在批它的逻辑严谨性。 为什么他们给出了比《小丑回魂》更高的评价？ 家庭温情，他们吃这套。  父亲保护着儿子和女儿。 回去看《好莱坞报道》这些媒体的夸奖语，有几个在说这部恐怖片氛围营造得真好、设定真是有趣并且利用得很好，都没完没了的“家庭”“父母”“责任”。 恐怖片的确不是只吓人就好，甚至不吓人也可以很好。 《寻求庇护》整体不评价，但就情感这点做得不错。一个普通的工人时常做噩梦，当梦境越来越逼真，他开始相信一切灾难都将真切降临，为此他丢了工作，做出一系列家人难以理解的行为，但他仍然坚持，一定要做好防御，保护好家人。 其中的情感，多是用动人的细节表现，比如表现男主的害怕：在第N次从梦境中醒来时，他惊骇地发现自己吓尿了床，并小心隐瞒妻子。  《寻求庇护》中父亲抱着听障女儿。 《负重前行》是一部以丧尸片为皮、以亲情为里的短片，7分钟的时长，打动了所有看过的人，豆瓣热门短评说：“推荐给大家哭一哭。”可见一斑。 没有人会给这样的影片挑不吓人、设定不精彩的错，因为它们不以此为卖点，并且把基本任务完成了。 《寂静之地》是让人对这个新鲜设定有了期待，却没能实现，而家庭温情的部分，又不足以构成赞扬该片的强力理由。 整部电影，以没保护好小儿子为起因，连带出不要命也要娃、生个娃拼老命、为了娃没了命一连串后续，但在人物行为动机不合常理的前提下，我们普通人很难会被这样发展出来的家人互相保护、携手对抗怪物所感动。 首先小儿子会死，就是这心大的一家人，把会出大动静的玩具给他玩，虽然此前母亲拔掉了电池，是孩子又把电池装回去了，但制造厂商都知道提示，危险的东西不要放在小孩子能碰到的地方，养了仨孩子的父母不知道，这也就算了，可以说谁没个一时疏忽，可一个正在多动年龄的孩子，你们一家人怎么敢让他一人走在队伍的最末尾？  我男朋友都知道让我走马路内侧，哼！ 接着为了弥补伤痛，一定要再怀一个，那请问，你们作死不要紧，活着的那俩孩子活该跟着你们死啊？为了缓解自己的愧疚感，恨不能搭上俩孩子的命，这逻辑我们普通人不懂，你们需要灭霸治一治。 





 这些都是创作中先后颠倒的行为，别人是编了个故事，表现个情感，《寂静之地》是为表现个情感，编了个故事，还特不符合人类脑回路。 为了制造这类情感效果，还有一个很作的设计。 父亲带着儿子捕鱼回程的路上，遇上一个伴侣被怪物杀死的老人，见到父子俩，老人在绝望之中故意大吼一声，吸引来怪物，想要大家一起死干净。 结尾，为了救家人，父亲也大吼一声，以自己的生命为代价，转移了怪物的注意力。 此处应做阅读理解，正确答案：以对比的手法，突出表现了父亲的高尚人格和如山父爱。 最后免不得理客中一下—— 《寂静之地》不是烂片，它有很宝贵的克制精神，从头到尾不燥不闹，从音乐到故事节奏，都符合这个不能发声的地方该有的气质，多亏这点，让它总算有个可取之处。 也许有人偏爱这样恐怖片中难得的沉静气质，最终让它在豆瓣得到了与《小丑回魂》《忌日快乐》持平的7.2分，还算合理，但烂番茄95%，MTC82，我们真的难以苟同。  本文首发于公众号 架空（ID：jiakong2017），这里是科幻奇幻惊悚的世界，欢迎关注。",641,407.0,185
