,Unnamed: 0,电影id,电影名称,用户id,用户名,评分,评论日期,评论内容,有用数,没用数,回应数
0,0,26997663,寂静之地,1d1c091a786db0af5376d0050aacbc1c,ae39c956fa99c3cb27f14addc584bf4c,2,2018-04-08 17:11:10,不写影评已经好久了，但是最近实在实在看电影的价值观上收到了很大的冲击。忍不住在这发些牢骚。 寂静之地是一部豆瓣8.0，imdb8.3的高分电影，这是个什么概念呢，以经典恐怖片做对比来说，闪灵豆瓣8.0，异形豆瓣8.0，寂静岭豆瓣7.5，咒怨豆瓣7.3。这么看来这部寂静之地实在是堪称影史经典的，不输各种大师巅峰之作的恐怖片传世佳品了。然而恕我直言，虽不敢妄称专业，但作为一个钟情恐怖片的老影迷，这部电影真的不！好！看！（说实话我很少用好看不好看来评价一部电影）看到豆瓣也好imdb也好，几乎零差评的点评，有些槽不吐不快啊，难道我的审美真的和别人差这么多吗！ 首先，如果以一个传世经典的标准来看这部电影，逻辑上的漏洞和各种乱七八糟的缺陷简直多到让人不能直视，闪灵也好，电锯惊魂也好，甚至是我并不太喜欢的恐怖游轮，虽然都是恐怖片但无一例外的即使经过后人无数次的分析研究也找不到太多的漏洞和逻辑上的缺陷，但这部电影就不一样了，多到数不过来！你能想象父亲研究了n久都不知道weakness是什么的看似无敌一般的怪物一枪就能打死吗？都末世模式开启了结果家里又有电又有自来水，市政的工人都这么拼的？怪物只要有一声枪响就都能找过来，你找个广场放个最炫民族风然后咣咣的往里扔炸弹不就拯救全人类了？一个床垫子都能把声音隔绝让怪物找不着，你家天天大门从来都不关，也不知道封窗户，还在屋里鞋都不穿的蹑手蹑脚糊弄鬼呢？男主回家救老婆带着枪，然后跑到怪物丛生的野外救孩子就赤手空拳抖M心泛滥了？还有最最奇葩的，都特么世界末日了，还有闲心生孩子，那个能让人听不到小孩哭声的装置卖我一个可好，我给我邻居免费送过去！毫无智商的硬上恐怖点真的好吗？看恐怖片经常会细思极恐，这根本就是越细思越不害怕嘛！ 当然，这是一部恐怖片，去楞挑逻辑漏洞是很闲的蛋疼的一件事。那么抛开逻辑不讲，我们来说剧情。看恐怖片的时候为什么会恐怖呢，通常是一种代入感在作祟，随着剧情的推进，感受着主角的的无力和绝望。这一点来讲，咒怨，电锯惊魂甚至死神来了都有一个很好的前车之鉴，随着故事的发展无力感觉来越强，对未知或已知的东西越来越害怕最终在电影的结尾达到巅峰时收场，这是一个不新颖但是很经得起推敲的套路。但是反观这部电影，抱歉，我真的从头到尾看！不！到！剧！情！这部电影的编剧可能是世界上最轻松的编剧了，因为只需要在剧本上写“只能听见声音的怪物入侵地球了，女主角生孩子遇到危险了，男主角保护家人死了，人类战胜了怪物！剩下的请导演随意发挥”就可以了。看到那颗楼梯上竖起来的钉子的时候我真的是发自内心的厌恶，抱歉，往后倒就能被钉子扎头，下楼梯就能被钉子扎脚这种剧情如果你在10年前用算你跟得上潮流，现在用？抱歉，国产恐怖片都觉得这东西俗暴了！ 如果只是逻辑和剧情上的缺陷我可能会给这部“佳作”打3星，毕竟这是有诚意的，但是作为一部恐怖片来讲，你不吓人，对不起，并不能给及格分。可能很多人都会说哪里不吓人啊，分明我看的时候很紧张啊。呵呵，如果换一个电影，一个聋哑病人医院出了一个变态杀人狂，然后给你每安静五分钟就来个足以让你心脏病爆发的超响音效，我觉得也可以做到这种效果。且不说美国佬们在怪物造型上的想象力是多么的匮乏，都2018年了还在copy异形，从什么时候开始靠一惊一乍的音效吓人变成一个值得夸奖的噱头了？从影片的一开始刺啦一声然后房顶跳下来两只胖猫，到中间啪嚓一声女主伸手告诉男主她还没死，到后来咣当一声弟弟温柔的抓住了姐姐的手，请问，这种纯靠音效吓人的恐怖片什么时候变成标新立异的创新了？我真的从头到尾只看到了被无数人用烂了的各种梗被串联在了一个没有剧情的故事中，然后几个演员配以了默片的噱头在尬演！看这样一部电影，紧张吗？害怕吗？是的我紧张我害怕，因为如果有心脏病的人都会被这种音效吓到吃药，但是出了电影院呢？呵呵，什么玩意！ 最后再说点题外话，在看过这部电影再看了豆瓣和imdb评分后我真的有点开始怀疑我的审美了，有的时候坚持自己的看法也很难，会有人喷，但是我真的不想自己的观影体验被各种噱头绑架了，“头号玩家”抛去了那些致敬的噱头真的有那么好看吗？说句不好听的，看到恐龙喊着，哇侏罗纪公园哎，好感动好怀念的人，有几个真的被斯皮尔伯格93年的恐龙模型惊到下巴掉下来过。李安一部“少年派”可以让你在看3D画面美到各种哇塞的时候，对这个故事感慨万千，这才是好电影，请关注电影本身而不被各种媒体的宣传也好噱头也好，水军也好别人的推荐也好绑架。 看到好多人说我没看懂啊，给我解释各种bug，喷我装X什么的。在此声明，说这些逻辑漏洞仅仅是在吐槽，我打低分的原因是空洞的剧情和一惊一乍的吓人方式，说我电影看不明白就来吐槽的请先看明白我的影评。同时，也并不是想借头号玩家证明自己的审美高别人一筹，只是在希望大家更多的关注电影的本身而不是各式各样的宣传与迎合他人时候“皇帝的新衣”式为了提升自己逼格而强行给五星。最后，我不是杠精，只是个爱看恐怖片的老影迷，请大家给与些许包容，允许不同意见的存在。,3959,891.0,834
1,1,26997663,寂静之地,9f7827a926656abbef5ae073df18643d,27482e3d9a08b0e3f75b93c565589a8e,1,2018-04-14 13:11:50,1. 找个高楼，一根长杆子，挂上个闹钟 2. 挖个深坑，埋点铁签子，扔个闹钟进去 3. 倒上汽油，中心放个闹钟，点把火 4. 埋好地雷，放个闹钟 5. 做个大号铁刺猬，里面放个闹钟 6. 找个高点的地方，扔个闹钟下去，怪物来了扔个手雷下去 7. 每人一把枪，找个单入口隧道，堵在入口处，吸引来怪物一枪一个 8. 做个吊网陷阱，扔个闹钟，抓住了之后随便怎么搞死 9. 找个大号硫酸桶， 贴个闹钟在外面 10. 做个大捕兽夹子，里面放个闹钟 这么严重的剧情bug下，实在没法欣赏这部电影.......,2244,827.0,690
2,2,26997663,寂静之地,f3b3c01242b7940929251dc2810f8a81,2a950a9c6781345b542cdf20462d04c5,3,2018-04-06 19:43:16,看了这个电影，总的来说，感觉还好，戏剧张力还是挺强的，看了不少评论，感觉一部分人觉得bug比较多，谈谈个人脑补感想和解读：  0. 我觉得真的是很刻意、人为设置的几处不能算bug但是显得很虚假的段落： 小儿子的死。我很难理解，为什么一家人走路，会让最小的儿子走在最后面，尤其是周围有怪物的情况下，再怎么样大人也应该是殿后的。这是常识吧，这里的设置很反人类、不真实。为了死而死。 其次就是那个钉子，真的是出现在一百万部恐怖片里的常用道具，一定会弹出来，一定会插到人脚，而且永远也没人管它。 1. 为啥怪物这么容易打死，还拖了一年，还没搞定？ 因看的也没特别专注，但感觉电影只是讲述了一个大的世界观下的一个偏远村落的事情，有报纸一闪而过军队还是整个国家已经被怪物击溃，但那些已经是一年前的新闻，接下来这一家人基本和外界隔绝了，没有新的消息来源，父亲也联系不到别人。可以看得出，他们住的这个区域，人员比较少，老弱病残偏多（丧偶老头之类的），好像科技也不算发达，应该是逃难、或者是当地很少的人居住。 而怪物的设定，应该是攻击力惊人，且十分敏捷，难以瞄准射击，防子弹，且其他人一发出声响就会被秒。属于高敏捷、高机动性战士属性。 就这个区域的人，确实比较难快速消灭怪物。一年内被这三个怪物统治，不算bug。 至于整个国家如何，情况我们不得而知，电影只说这个区域有三个怪物，全国状态不明。 最坏的情况，也许全国已被怪物支配，也可能，人类正在与之搏斗，这我们不得而知。电影只截取了一个很小的点，大环境没有交代。但逻辑上来说，这些应该不算bug，只能说电影没有交代。  2. 为啥非要生孩子？ 个人感觉主要还是父母对死去小孩子的愧疚想再生个，以及某种奇怪的生殖冲动？感觉电影想要表现的应该是前者居多。 我个人人为，如果非要让女主生孩子，可以写成，在怪物来临前女主刚好怀孕，而电影可以拍怪物来临九个月后，女主要生孩子了。这样显得比较没那么刻意。  3.为啥不搬到瀑布边上？ 这个问题就比较奇怪了，搬家太麻烦，比如一整套的监视警戒、电力、农作物，可能不好携带。明显弊大于利。而且水声也是会吸引怪物的，虽然会掩盖主人公的声音，但怪物来的概率却明显大很多。但我觉得可以在生孩子期间去瀑布边上度假。  4 描述老头有啥意义？ 一方面突出怪物恐怖，激励孩子成长，一方面和父亲大吼牺牲自己做呼应。有人说这里莫名其妙，我倒不觉得，这不是很正常的一种编剧形式么，拍个路人npc的惨状，来烘托恐怖氛围，很难理解么。  5.为什么大家会觉得很多bug？ 其实前面的所有问题，归根结底就是，个人感觉，这个电影的编剧方式，是因果倒置、概念先行、人物逻辑随后自行补充的。 这个电影一切的吓人手段、激发戏剧冲突的手段，都是强行的、人为的，这种人为的设置，比如为了激发冲突，搞个钉子，让女主当天生产，漏水，使得一切显得刻意、虚假，短时间内观众无法信服，便会产生很多电影并没有完全说明的对人物逻辑、剧情结构的质疑。 这种质疑一旦产生，其实观众的信任程度和投入程度就已经降低了。 比如说，我看过一个作家说，一个电梯失事，里面的情侣患难见真情，这是感人的。 可如果情侣明明可以走出来，却还在里面生离死别，这样的强行抒情就显得很无厘头了。 当然啦，换句话说，可能看这种概念在前，各方面水准都挺不错（比如配乐、结构、戏剧张力、演员表演、视听效果啥的）的恐怖怪兽片，或许我们首先需要催眠自己，不理会各种bug，真的相信，主人公就不肯搬家，怪物就是一直无法消灭，女主就要生孩子，钉子就要弹出来一定要扎人家脚，在这种情况下，我们就会发现，这个电影还是挺好看的。   －－－－－－－－－－－－－－－－－－－－－－－ 最近国内上映了，这篇文章下面很多观众留言，增添选答环节：   GnBenjamin : 第一个明显就是理解错了，看报纸还有男主人公收听无线电的情况，明显不是这个小山村受灾而是世界性的毁灭。  - 对，这肯定是世界性的灾难，但很明显这个家庭在这个村落被隔绝了，取得不到外界的信息，所以这一年里外界发生了什么，我们好像也是不得而知的，也许很多地方都已经有人发现怪物弱点并且取得胜利了吧。   秦时明月 ： 你有资源吗？有的话分享给我，谢谢！  － 没有。   grehan: 关于钉子，我觉得拔它肯定会发出声音吧......   王俊杰 : 你要敲钉子？ － 有人对钉子有质疑。那么我们来看，这种木质的楼梯，为什么会在制作过程中，把钉子从下往上，钉在楼梯中间呢。一般情况下，无非就是两边加固吧？这个钉子出现的位置首先就是不合理的吧。其次，不一定要拔或者敲，还是可以提醒一下的吧。不过当时母亲就要临盆，应该无暇顾及，这里说得过去。   zenzenzen: 女主生孩子的时候，孩子刚出来的哭声到底为什么没有引来怪物，糊弄过去了就  －我也没注意看，好像是刚生下来的时候孩子没哭，后来就送地下室了？  我爱大懒人： 为什么要集中在逻辑讨论方面，难道不应该更关注表演形式以及这个题材新颖吗？那种会让人不由掩耳盗铃的代入感会让人觉得这真是相当的不错，非常的震撼，太关注逻辑推理的观众根本就不应该来看恐怖片啊！  －一部分人的观点，认为看恐怖片不能注重逻辑。 其实，如果让剧情更通顺，逻辑稍微自然一点，观众就不容易出戏，应该会更投入吧，这么说来，恐怖片更需要好的自然的逻辑吧？比如我喜欢的温子仁的潜伏前两部，有很多有意思的时空循环，比如恐怖游轮，也在轮回、循环上有详尽的设定，比如贞子、咒怨这些鬼片，其实对鬼的特异功能的设定也是有用心设计的。哪怕是前一阵子的昆池岩，虽然没有明着揭露精神病院的秘密，但是不少细节上的铺垫，其实是告诉了观众比如精神病人、女院长的故事的。 前面说了，我认为这个片子的形式、题材都很好看，但是就是有几个地方，明显是编剧为了制造效果，而简单粗暴地选择了最容易制造drama的那种剧情，多多少少显得让人有些出戏吧。   💤  你如果玩过最后生还者 就不会提这些问题了 －没玩过。  江湖骗子： 说为什么小儿子会走在最后面的一定是没看过小鬼当家...感觉外国父母生那么多孩子 未必有那么紧张小孩...而且怪物不是一天两天了 不可能总是24小时都盯着小孩的  －从小光在cctv6就看过十遍小鬼当家，我觉得这两部电影无法类比。小鬼当家的父母有一堆孩子，当时赶车，特别匆忙，才忘了小儿子还在家里，这和这部电影里父母明知有怪物，有生命危险（这可不是赶车，他们走得可悠闲了），还把最小的儿子落在后面，还一路上都没有注意他偷拿了玩具，这样的奇怪剧情完全不可类比。我觉得，哪怕写成，父母一直保护着儿子，但就在另一个儿子哮喘发作无暇顾及小儿子的时候，他弄响了玩具，都比现在这个剧情要合理一点点吧？ 外国父母不紧张儿子，这个是主观臆断，不讨论了。 是不可能24小时顶着孩子的，后来他们也让女儿自己出去了。但那个最小的孩子只有三四岁吧，而且当时是全家谨慎的出去搜寻物资，这里依然大大咧咧不注意小儿子，依然属于编剧不用心，粗暴设计让小儿子死去。,695,347.0,307
3,3,26997663,寂静之地,5a51366ab4cf7d8b5455c2a0729f47cf,246dbf229a00e2347a3f989f955b426c,5,2018-04-13 12:21:28,我们曾经生活不见天日的地方，按你们人类的话来说，就是地底生物。不知道从多久开始，我们就生活在那里，距离地表十多公里的地壳层下方。随着怪口膨胀，我们开始向四面八方发展，在石缝中挖出可居住的空间，没想到有一天居然把“天”给挖穿了。大家伙都非常好奇，于是就拉帮结派的出来旅个游，都来这“天”上人间参观（听）下。据说后来全球各地的怪物都先后把“天”挖穿了，一时间好不热闹。 其实我们一开始就是随便看看，但貌似一出来就被人骂长太丑，太吓人，还用高分贝的声波攻击我们，那我们就不乐意了。你也知道，我们干啥全靠听，对我们尖叫就等同于对你们人类一见面就戳对方眼睛，很不礼貌。而且鬼知道你们人类身体那么脆弱，只是想随便推搡两下就把你们大卸八块了。还有些同胞想要和你们击个掌，就把对方切成了两半。于是乎人类开始还击，我们也开始反击，一来二去一不小心就把你们人类给灭了。太不好意思了。一切其实都是误会啊。 当然你们人类还是相当有智慧的，不过架不住我们怪口多，地下十几多公里密密麻麻全是我们的怪。这场误会，你们人类基本灭亡，我们怪物也是元气大伤，基本不用再担心怪口问题了。想以前我们家一百多口怪，现在就剩仨了。。。 不过也有一些怪不是在战争中死亡的。你们可能不知道，虽然我们怪物奔跑速度很快，但快速奔跑对我们来说都是在玩命啊。我好几个叔啊姨啊就是在地表跑high了，一头撞在石头上撞死的。据不靠谱的统计表明，和平年代百分之五十的怪物都死于这种交通事故。听说你们人类不是靠听声音来辨别周围，而是用眼睛？那可真是个好东西啊！ 这场惨烈的旅游过后，大部分怪都选择了回到老家，只有少部分选择了继续留在地表。我们仨兄弟就留了下来。这片区域除了我们好像也没有其他怪了，貌似也没有什么隐藏的人。刚开始，我还能找到些漏网之人，他们好像有些很不好的习惯，据说叫做打鼾、磨牙、放响屁、打嗝。后来把这些有坏习惯的人清除后，就很难再找到其他人了。 不说了，我兄弟说他好像听见有个女人的尖叫声，叫我跟他一起去看看。你们有啥想问的可以给我留个言，我有空会回复。 祝你们耳聪目明！,870,276.0,125
