,Unnamed: 0,电影id,电影名称,用户id,用户名,评分,评论日期,评论内容,有用数,没用数,回应数
12,12,27172872,呼吸,f0da9065a926fa6969820596b39585ee,221544273747fc4efc08fbbc5ce444f2,4.0,2021-03-05 13:57:24,"偶然的惊喜，人性的感动，散落的缺口
——法国电影：呼吸 Dans la brume (2018)影评        先说打分的原因：4星是推荐，所以···我选4星，但并不代表整个电影拍摄值4星，5分的话大概3.4分吧，整体豆瓣评分我觉得还是很合理的。 以下内容包含剧透，请至少看完几分钟的解说后看本影评···    从以下几个方面分析该部电影，谈一谈自己的一些短见： 1.对本片的定义 2.该片的亮点 3.电影中的人性分析 4.影片中的剧情漏洞和不太合理可以弥补的不足 5.电影可以带来的思考、价值和感悟    1 对本片的定义 多个网站给出的分类不尽相同，大多数第一个都是科幻片，我觉得从电影片名都知道这不尽合理。首先应该是灾难剧情片，其次恐怖片（而非惊悚片），温情家庭片，然后后面的就只是擦边了：科幻片，剧情伦理片，悬疑片··· 对于科幻片的定义，我觉得没有那么重，这种败气症的设定并没有那么先进，毕竟新闻还有说有人对wifi过敏，有一些病确实是要一直待在特殊的无菌室或者无菌隔离仓中。所以科幻是对于这种特殊雾气的设定。 2 该片的亮点 这部电影看完，虽然没有其他悬疑片看起来那么吃力，浅显易懂，但编剧、导演还是设定了一些巧妙铺垫，整体逻辑还是很通顺的。 ①在男主与戴氧气面罩的贝卡森先生刚开始的对话中就提到最近污染很严重 ②在男主出去寻找氧气罩的时候，狗的出现代表了希望，同时为女孩能够无影响的生活做铺垫 ③看到有人评论说到一个巧妙的铺垫：女主说她相信物理中的作用力与反作用力，就说明了这个特殊的毒雾也会有相对应的“反作用力”，特殊的“疾病”。而且老人和女主谈论病情时也指出这种变异类的疾病新生儿越来越多。（这个剧情我找了下，在男主第二次测量毒雾上升高度的时候她们聊天的背景声音，第一次看的时候都没注意到）  ④爆炸之前的明火铺垫 ⑤开始时男主对男孩女孩的感情开玩笑 ··· 本片以为女儿换隔离舱电池为时间线，夫妻俩做了全部的努力。 男主在跟女主聊天时提到了“不能越过那条线”，这是灾难片的精华之处，当人类文明社会受到重创，死亡率和存活率不能得到一个好的掌控，社会将会越来越乱，恶性循环。当然本片中只是些许体现了这个方面，而且收音机里政府的指导还是不错的。 同时配乐好评，在不同情境下给出的BGM挺符合当时气氛的，尤其是男主女主氧气瓶只剩一点，男主女主煽情的配乐。  本篇带来了许多的感动，比如开头女主为一个努力的学生补课；父母对子女的爱和期望（尤其是顶楼的吕西安先生对儿子雷米的希望，我相信他感动了很多人），老两口历经风风雨雨依旧爱得深沉；救援队舍生忘死的帮助镇上的其他人，有没有新冠武汉救援队的影子？两个老人给予男主和女主很多的帮助和安慰，也都体现了两个老人强大的善良立场，是电影感情线的重要支撑点。 3 电影中的人性分析 本片的男主人性把握的十分到位：人死不能复生，在灾难来临时，更要对活着的幸存者怜悯。在与警察的搏斗中是人格的真实反映，虽然可能有破绽，但是警察在灾难面前依旧有冲突，同时又是获胜者的身上，我没有任何同情心，这是为了保命，即便让警察丧命依然合理。而在影片末尾骑车的过程中突然出现的男孩，男主并没有想，下意识的闪开，这就是人性。所以男主是集责任智慧、担当、优秀丈夫和优秀父亲于一体的优秀人物。 男二吕西安先生是一个十足的法国绅士，毋庸置疑。在灾难面前给予老伴安慰和信心，关怀儿子，活在当下，面对困难施以援手，且对男主和女主有很强的信任感，就说明他平时的为人就特别值得尊敬。他脖子微缩略显佝偻的身躯真的很让人感动。有个影评说的很感人：人类可能是唯一的动物，能够在灾难面前放下恐惧，去选择跟爱的人一起结束。  女主理所当然地体现出了对丈夫的爱和对女儿的爱，这里一定要说两遍爱，因为这两种爱真的是不同的啊。说实话本剧中女主故事虽然不出彩，但真的很难演。 女孩萨拉算是女二了吧，很真实的表演。在去找防护服之前，很多人应该都觉得在危急关头先不要管其他人了，先管好自己的事情。导演让女孩告诉我们：如果我自己一个人在这，你会不会想让他们父母来看看我。是啊，这是真实的最纯洁美好的人性。假设抛开男孩女孩是小情侣的设定，如果真的所有人能够这样想，那应对灾难的时候，效率可就真的提升不知道几倍了。在面对母亲不戴氧气罩的情况下给自己换电池，当然下意识地一直要问你为什么不戴氧气罩，你快回去。我相信不论是谁都会这样问，因为你的妈妈可能因为你就快要牺牲了！在女主丧生之后女孩的悲痛和对父亲的不理睬（我想不出用什么词可以形容），真实体现了此时她的心理状态，她到底应该怪谁，怪她父亲还是怪她自己，还是怪一个不知道的人，为什么这一切会发生（还有一个感动的地方，女孩说 这都是我的错，男主说 你怎么能这么说，我不允许你这么说，你妈妈听到会伤心的。那是她的选择，不是你的错，她知道她在干什么）···女孩的剧情除了引出时间线和主题，依旧体现了女孩本来该有的稚嫩、纯真和青春期爱的期盼。 这是一个五人演绎的电影，但是女三Ms.吕西安相对戏份较弱，就不探讨了，但我觉得是个很温和的妻子，我想要！ 在灾难到来的时刻，法国这个小镇上依然有很多温情存在，人类是群居性动物，如果世界要毁灭，我们同样要把握好最后的时间，把爱带在身边。 4 影片中的剧情漏洞和不太合理可以弥补的不足 结合其他小伙伴提出的漏洞，简单总结一下： ①在男主去贝卡森先生家找氧气的设定，是不应该这样把命就堵在一次试探中，应该有计划性的一步一步做，正赶上今年两会的举办，第十四届政协委员会第四次会议，聚焦十四五规划。且有一个优秀的瓣友提出可以制作简易空气存储器，毕竟男女主智商足够高，当然如果电影可以这样，那就显得没那么恐怖了，有点不太好圆。 ②为了去找防护服就把两次氧气罐都用上两个人一起去显得男女主不明智，其次路上没有使用现成的交通工具来节省时间也是不明智的，当然可能那种紧急情况下没想到？ ③男女主因为一条狗逃亡的剧情显得不太合理，首先在与狗距离较远的情况下是不是可以躲在车里，路上跑的时候女主突然调头没有给出合理的原因使得男主坠河，这个设定就特别明显得只是想设定一个高潮转折给人戏剧感。 ④在生化实验室发现明火的设定虽然在很多灾难片中都有涉及，但我觉得还是尽量不要这样直接铺垫，显得很傻。在有灭火器的情况下，即便时间有点紧急，你可以先尝试灭一下火，毕竟你还是要生活在这附近，灾难面前的二次灾难可能会变得异常的大，因为此时已经没有消防员了。你可以急忙的尝试灭灭火，然后人火急火燎地离开之后镜头再给一个小火苗萌生引起大火爆炸的剧情应该更为合理，而不是男女主傻傻站在门口等着爆炸。 ⑤女主为了给女儿换电池不戴氧气罩下楼的戏表演的不够真实。这里不是指剧情不合理，在不制作简易氧气存储器的设定下，剧情是合理的，但跑的也太远了点，表演不够真实，没看出憋得无法呼吸，满脸紫态。同时，巧合设定下男主在女主回去的路上回来看到女主倒地，第一时间难道不是赶紧拔下氧气管塞给女主进行抢救吗，如果是时间有点长了导演也应该拍出来，其次回到顶楼也没把女主带上来，让她一直在楼梯上嘛？ ⑥另外女孩的梦，两次在晴朗天气下的丛中愉悦的奔跑还有一次多个人一起奔跑，没弄懂是想表达什么。 ⑦影片最后男主在隔离舱里的拍摄显得格格不入，有点像被关在笼子里，昏迷的时候女儿也没有陪在身边，好人没好报，是个悲剧！ 5电影可以带来的思考、价值和感悟 灾难面前，人性依旧存在，为什么生活在（中国）一个非常非常和平的年代，依旧经常体会到一些奇葩物种的奇葩操作。老年人竟然讹上一个尚未工作的孩子，父亲能把自己亲生女儿给强奸，身为医生、教师或者警察的不作为，滥用职权···这些职业是多么高贵，他们的情怀让那条凶恶的狗给吃了··· 父爱和母爱作为社会情感非常特殊的一类，真的一直打动我的内心，希望全天下的父母能够少操心，过好自己的晚年生活，幸福美满。在这个国家养老体系压力日益增大的今天，独生子对二老的渴望真的只是想让你们过得更快乐一点··· 末尾处老两口放弃挣扎而选择随心结束是个十分浪漫的剧情设定：“没必要，我们的终点就在这里，我不想没有儿子一个人活，我们有过美好的生活，谢谢你。”两个小孩子在灾难面前依旧相互奔赴，体现了人类对爱的最纯真的反应。 故事主题，女孩的“基因缺陷”能够适应特殊的自然环境变化，这会寓意这一轮新的物竞天择，适者生存。   好啦，就这些吧···一上午没了",3.0,,0
13,13,27172872,呼吸,d21a395a2fa78115643872b2dee9d5e7,81b9d9bd4bc1f02737aeda1fec0e1507,4.0,2021-01-24 17:25:39,本文发表于《上海电视》2020年10月某期。如需转载，请一定联系本人、一定注明、一定附上豆瓣链接！  ------------  《呼吸》是两年半前在法国上映的电影，在豆瓣还不到6分，最近引入中国放映，时局变换，观众心情亦变，虚构故事和人物心境也不再那么遥远。看很多豆瓣短评质疑此片的视角局限，我意识到差评来源于人们对灾难缺乏想象力。好莱坞模式化大片长期展现的是全方位上帝视角，我们习惯于看到灾难从起因讲到结尾、从普通一家讲到将军总统、从衣食住行讲到医疗军警，《呼吸》却是局限于三口一家及邻居老年夫妻五个人活动视角的电影，观众不习惯，但这种不见森林只见树木的角度，正是灾难中真实的人类你我他之处境。灾难之下，停电停交通停通讯，人只能看见自己和房间。逃上屋顶的他人，暴乱群众，好警恶警，活狗死鸟，都是主角们目之所及的其他树木。导演的思路，大概是把五个各有特质的普通人放置在突降灾难的环境里，看看会发生什么。导演连普通人憋气时间都算得刚刚好，不是《战狼2》水下打斗那样超现实的憋气时间。 罗曼·杜里斯，是法国影坛中青年男演员里的中坚力量，虽年过四十才凭《新女友》提名法国凯撒奖，但他的表演自然，毫不夸张，有说服力，可喜剧可悲剧，可深情忧郁可跑跳动感，像梁朝伟那样容易让人遐想他即片中之人。从十九岁入行，他与法国老中青几乎所有优秀女演员都合作过，本片也是与“邦女郎”欧嘉·柯瑞兰寇合作。我见证他从饰演愣头青或忧郁青年，到目前频频饰演慈父，从文艺片演到法国主流商业片，再到好莱坞饰演配角——非英语国家所有一流演员在美国的角色困境。罗曼的演技，是稍有文艺性的商业电影的保障。 我不担心他演父亲，他会时刻担心患呼吸疾病而住在隔离舱内无法逃生的女儿，会在致命浓雾笼罩的巴黎执行一个个保护家人的短期任务，让脸部和身体呈现疑惑、紧张、焦虑、惧怕，这位文艺片常客游刃有余，而那些上房顶、落水、酷跑、飙摩托的戏，正值壮年的他亦能驾驭。这对十几年夫妻的感情有递进感，两位演员对此都很明确，片头他们有些隔阂，两人在后面戏份里彼此身体相对时的状态也说明如此，这是法国人即便在商业片里也不会放弃的、高于好莱坞的情感细节刻画。老年夫妻在深知儿子已死之后欣然在家等待死亡，也是欧洲价值观里动人的生命观。 中年夫妻为女儿“白忙活”，正是灾难时人最可能的处境，没人知道事态会如何发展，这也是关于亲子关系的隐喻。狗的几次出场，都是物种不会灭绝、人类尚有转机的铺垫。此片有“灾难元年”的意味，故事可继续讲，也可就此结束。,1.0,,0
14,14,27172872,呼吸,a9601de9139c55e689f2d47bb1d445b3,a567268bff00afebab2701b97a726d0c,4.0,2020-10-26 23:01:52,人类本能的会对不确定和尚未理解的事物产生恐惧，同时习惯在固定的思考模式或行为模式下寻找答案，而这种寻找往往带来的是答案可遇不可求，结果总会出奇意料。恰巧在这一场让人产生不确定恐惧感的疫情中，在只有两个带着口罩的姑娘的电影院里看了这部电影，在这种时间背景下，其实被这部电影触动到一些点。不要太在意很多细节的话，这算得上是一部比较清新的灾难片，恐怕也只有法国人能拍出如此人文和辩证的灾难片，没有美式灾难片的英雄主义和宏大场面，更多的是思考一些社会和人性层面的问题。说在前面，这不能算是一篇对电影故事情节或内容的赞许或者评论，只是借这部电影对近期思考问题的一种总结和应用。也因为这是在中国国内第一次在Alliance Française以外的普通院线影院看到法国电影，所以多打一星。 第一个有趣的思考点是，政权和政府的意义，大部分的灾难片还是会表现执政者在灾难下的抉择，而这部电影有趣的是它构想了政府失效即无政府状态的景象。暂且不谈政府表象的利益分配功能和隐藏的阶级统治功能，普遍认同的政府意义在于秩序的维持和公共利益的最大化，而这一作用的体现很多时候未必是出于该本意，而是作为其他某些功能的工具，但是在灾难或危机发生时，这一功能能够最纯粹的表现其意义，不妨想想疫情下各国政府的处理。遗憾的是，这就如同全民一起买份大额保险，这份保险在必要时还有强制力，但保险毕竟是保险，无法生效的情况也是有的，电影中就表现了这种可能性，突发的人口损失量达到一定程度的时候，社会和政府的架构将彻底崩塌，那么秩序就一定会无法维持了么？电影中给出的答案是肯定的，但从现实社会中的例子来看，有两种情况下未必如此。一种是我们大多考虑的是一个本来有政府的社会架构突然政府失效，但是世界上不乏尚未有政府的群体，仍可以一种自发的形式维持一定秩序，这也是无政府主义者们赞同的主动性秩序的合理性。另一种情况是，即便突然政府失效，不同社会风格和教育背景的群体可能会出现不同反应，在此不好明说哪些国家在这种情况的确有做到自发维持秩序的案例，只能说在一个国家的政府很好的体现其服务价值和公共意义的情况下，大抵在失效时公民尚可主动自发的维持一定秩序，那么如果公民的社会观念已经发展到这一水平了，其实政府的权威和保险价值就已经在一定程度上淡化了。所以，一起买份大额保险在什么样的背景和情况下是有意义的呢，或者说从个人的角度下，是否有可能我不买任何一份保险，独立于任何一种构架下呢？ 下一个有趣的思考点是，普通的老夫妇最终选择一起终结生命。这其实是一个很感人很煽情的情节，但单从人性思考层面上来看，人恐怕是唯一知道自己会死，对这一事实会产生恐惧感的同时，却也能靠自我意识选择结束生命的生物。重点在于人可以从意识出发自发选择终结自己的意识。当然很多时候，人做出这一选择是因为这从生物趋利性来讲对别的人或生物更有意义。电影中的老夫妇是因为人生已经不再有意义而选择到此为止，只有人类中才不乏做出这种选择的情况，追寻意义是意识所趋，而反问意义有那么重要么，为什么人一定要赋予某种意义，这不正是叔本华口中的“意志之毒”么，人的“意识”在某种程度上扼杀了“意识”自己。人类是否有可能在有意识的情况下，彻底抛弃寻找任何意义？ 最后私以为很有意思的点是结尾，虽然看到不少人诟病于此。这是一个很法式思考的结尾，并不突兀，却显得很有哲学味道。在人类有局限性的意识和思考中，其实未必能预料到情况的反转，不确定和不理解的结尾是开放性的，如同一切事物并无孰是孰非，一切事情对所有人来讲也并非一定非利即害。人类就是如此渺小和无力，甚至答案都是碰运气得出的，今天的自由之身明天就变成了缸中游鱼也未尝不可。换个有趣的角度看，这也可能是高于人类的智能开启的一场新的自然选择。 当然，电影中还是有很多比较不科学的情节，比如在女儿接近死亡的90秒内还顾得上谈论女儿的情窦初开有点浪漫的过于反人性，以及对现象的解释不充分等等。但毕竟这部电影的意义或许不是在探讨科幻和环境问题，而是激发观影者思考社会和人性，作为一种警示，也提供一种思考角度。,,,0
15,15,27172872,呼吸,65449fee958f49f962e1e48c4115fc62,98d3fe0b7c0b9695408a90e786eb8da7,,2020-10-26 10:03:03,大自然如果真正的有危险来临，我们人类是阻挡不住的，呼吸都成为了渴望。这部电影看出了人们对生命的渴望，还有父母对孩子的爱，没有抛弃有先天性呼吸病的女儿，可以为了给女儿换电池，可以重新跑下去寻找女儿，给女儿求一线生机，果然天底下的爸爸妈妈对女儿都非常的好。那么问题来了，如果我们面临相同的问题，我们该怎么办呢？,,,0
16,16,27172872,呼吸,2dfdf02a4942b14c40df19097c1a4b5b,eb1cb7828c61e3f20109721b435ea9e3,4.0,2020-10-25 13:00:03,电影总体拍的还不错，想法十分的吸引，但有些地方拍的匪夷所思。如：那得得病的女孩不能呼吸正常空气，却可以呼吸有毒的空气；没有介绍，这雾是什么东西；剧情不够曲折等。画面效果也不错，有一点像全球风暴和后天，而且法国也很少搞科幻片，这部电影值得一看。但里面还有一个很大的问题，那就是人憋气能憋得那么久吗？正常的来说啊，20秒人就会眩晕，60秒人差不多就嗝屁了，但电影里上下楼梯至少要个差不多一二分钟，何况还要换电池呢，有一些不科学。不过电影里面也有很感人，那就是那两位老人的选择和母爱的伟大，雾气上来时，男主角想给老人们也拿呼吸面具和防护服，但老人们却不要，防护服选择了安详的迎接死亡的到来死亡的到来，因为他们知道自己的孩子雷米已经死。另一个是那位女主角孩子的电池快没电，为了孩子他不付一切代价，冲下去给她换电池因为没有带呼吸机，所以上楼的时候她偶因缺氧而死了。这部电影我可以给他打的4.8分，因为场面还是比较大的，而且也有很多打人的地方，而且他还让我懂得这一个道理：住在楼下可能不一定好。,1.0,,0
