,Unnamed: 0,电影id,电影名称,用户id,用户名,评分,评论日期,评论内容,有用数,没用数,回应数
17,17,27172872,呼吸,7f11fe8cbd3c97d3cdafca838fc41d9e,f55c9792ab855cbce7a0921582b421ea,,2020-10-23 23:21:02,"新锐导演丹尼尔·罗比执导，卢米埃奖影帝罗曼·杜里斯、邦女郎欧嘉·柯瑞兰寇出演的3D灾难电影《呼吸》，今日正式登陆全国院线。该片在海外上映后于各大电影节斩获四项大奖，被媒体评为“逼真到像末日预言！”

电影《呼吸》讲述了未知迷雾蔓延全城，幸存者寥寥，城市陷入恐慌。女儿萨拉（芳汀·阿杜安饰）因患怪病只能生活在氧气仓里，马蒂厄（罗曼·杜里斯饰）和妻子安娜（欧嘉·科瑞兰蔻饰）必须在有限的时间里为女儿争取存活空间。谁料迷雾不断上升，全城停电，女儿危在旦夕。夫妻俩必须离开安全地带，屏住呼吸末日跑毒，在绝境中寻求一线生机的故事。

看点一：全新设定，身临其境体验窒息感受

电影《呼吸》从生存之本——空气作为切入点，直面“窒息”感受，给观众一种全新的观影体验。当每天生活的城市被未知且致命的烟雾淹没时，除了狂奔没有任何办法。未知烟雾每天都在蔓延，人类赖以生存的氧气和空间被剥夺。影片所呈现的窒息感配合逼真的环境音效，深深扼住了观众口鼻。

影片雾气弥漫的拍摄现场，连演员呼吸也受到阻碍，给他们带来不小的挑战。女主角欧嘉·科瑞兰蔻表示:“尽管戴着面具，我仍觉得自己氧气不足!在戏里又跑又跳，而现场施放的烟雾让我好几次都呛到连吃NG，几次拍下来都害怕自己会窒息晕过去。”

看点二：感官盛宴，3D展现毒雾逼真视效

影片的3D效果极大丰富了观众的观影体验，让毒雾迸发的视觉效果极为真实。从毒雾冒出、扩散，到将整座城市全部污染，恐慌感与紧迫感感扑面而来，让观众真切感受毒雾遍布时的惊心动魄。

导演在拍摄的时候，考虑到如果影片全部用后期特效制作完成，影片将失去质感，所以采用了“真雾”加“特效”结合的拍摄手法。正所谓“假作真时真亦假”，经过后期制作慢慢调整，摄制组终于找到了在特效与真实之间最完美的呈现方式。影片打造出寂寥宁静中危机四伏的视觉美学，使人如入真境般感受到雾气弥漫的窒息感，借此斩获加拿大影视奖和魁北克影视奖最佳视效大奖。

看点三：高楼跑酷，实景还原巴黎街景

为把末日巴黎做到极致，导演更是大手笔造城。剧组在棚内打造了一座长达一公里长的巴黎街道，把近百辆汽车和公车挪到棚内，一比一高度还原了整个巴黎街区景况。

男主角罗曼·杜里斯表示，自己一开始被毒霾淹没的巴黎场景深深吸引，但当他站上超过五层楼高的屋顶拍摄时却深感后悔。让他崩溃的是，导演除了一开始让他连续跳楼跳了10次，后来更加码让他学在高楼攀爬、在屋顶上行走，脚下就是难辨空间的浓雾。罗曼苦笑着说:”我只能把自己想像成蜘蛛人，想像他如何在高楼摆荡。”

看点四：高潮迭起，剧情紧凑线索密布毫无尿点

电影一开始便展现出被致命浓雾疯狂侵城的惊心动魄感，给影片定下扣人心弦的基调。影片导演丹尼尔·罗比曾获加拿大金尼奖最佳新导演奖，擅长讲述起伏跌宕、反转不停的故事。在他的细心铺排下，全片毫无冷场，高潮迭起，剧情紧凑。最关键的是，导演把观众置身其中，与男女主角共同面对绝境当下迷惘绝望的惊惧──究竟这毒气是什么？它从哪儿来？有没有救援队帮忙？断电及氧气罐用尽后如何支撑下去？这些都是必须随着剧情深入，抽丝剥茧而一探其秘辛的冒险。

而且，影片还精心埋下了诸多伏笔，等待观众一一发现。不少乍看令人困惑不解的细节，看到后面会发现原来背后隐藏着震惊世人的真相，增加了观影乐趣。对此，有观众惊叹：“原来导演下了这么大一盘棋，实在是太能铺排设计了。”

看点五：即使未来艰难险阻，唯有爱一往无前

在剧情人物的设定上，《呼吸》以无言的行动，展现相互依赖的亲情、相濡以沫的爱情。影片没有浓重笔墨表现父母子女之间的羁绊，也没有高谈阔论、海誓山盟的叙说爱情；而是随着剧情推进，把亲情的温暖、爱情的感动深深根植于观众心中。

马蒂厄夫妇为拯救危在旦夕的女儿，不惜以身犯险进入迷雾。一路上躲避疯狗，逃离爆炸现场，甚至愿意牺牲自己换取女儿生存机会。片中一对相濡以沫愿生死相随的老年夫妻，则贡献出电影最大泪点。两人携手躺在床上的画面，被誉为催泪度不亚于《泰坦尼克号》，令爱成为贯穿全片的信念，成为惨烈末日人们内心唯一的慰藉，温暖着银幕下的观众。

看点六：超强阵容，冲破迷雾拯救你

电影两位主演均是有口皆碑的颜值加演技派演员。饰演安娜的欧嘉·科瑞兰蔻，曾凭借电影处女作《无名指》获得布鲁克林国际电影节最佳女演员，后因《007：大破量子危机》中邦女郎一角被内地观众熟知和喜爱。而曾获法国“金球奖”卢米埃尔奖影帝的男主角罗曼·杜里斯，是欧容、雅克·欧迪亚等文艺大导爱将，主演的《西班牙公寓》、《只爱陌生人》、《危险青年》等作品在豆瓣电影均获得8分以上的成绩，多次提名法国凯撒电影奖最佳男主角，在去年国内上映的《金钱世界》中也奉献了绝佳演技，实力不可小觑。此次二人携手演绎一对夫妻，两大演技派的激烈碰撞，委实令人期待。",,,0
18,18,27172872,呼吸,d04de6ffd3bc4a6568f5a96e539667f6,4a87b734686ea5debeaceac004e69e7b,4.0,2020-10-24 00:51:46,本来就想写个评论的，字数超了变影评了，不会起题目，写的也一般，不喜勿喷。          刚看完，一家人去看的，结尾我妈说了句“这就结束了？莫名其妙的。”我反倒觉得主题挺深刻的，你看到的是全片在歌颂母爱？我看到的是对现实生活的讽刺“父母过度的保护往往孩子并不需要”。         开头三个小孩说自己是观赏金鱼，结局翻转，父亲变成了观赏金鱼，这是第一层，第二层是主导角色的转变，女儿在隔离仓代表的是父母赡养子女的阶段，主导者是父母，父亲在隔离仓在我看来是现实中人老去后的状态，当然法国电影可能法国导演不是这么想的，但在我这个中国人眼里看来这里就是子女赡养老人的状态，主导角色换成女儿，父母赡养子女的时候可以一心扑在子女身上，但当需要子女赡养老人的时候她可能得忙着恋爱（也有可能是子女或者别的东西），所以最后镜头只有父亲看不到女儿，父亲在呼唤女儿的时候电影结束。         当然了里面还有一些探讨末日中人性的表现，老夫妻部分也非常感人，骗我眼泪，作为一个女生非常向往这种感情，我爸觉得这作为一部灾难片不够刺激惊险，确实如此，不过我个人反而会觉得有点纪录片的调调，更真实的感觉。,2.0,,0
19,19,27172872,呼吸,7f11fe8cbd3c97d3cdafca838fc41d9e,f55c9792ab855cbce7a0921582b421ea,,2020-10-23 23:21:29,韩国以监狱和死囚作为题材的电影并不少见，而《呼吸》却选择用死囚将要结束的生命与初生的爱情萌芽作为视角讲述了一个关于爱和尊严的故事。衣食无忧的女主角妍(智雅饰)至从丈夫有了外遇之后开始迷失了人生的方向。偶然在电视里看到死刑犯张震的新闻后，妍产生了微妙的感觉，对死刑犯张震有了一丝怜悯之心。于是为了见到张震，妍去了教导所，妍把自己儿时差点死掉的经历告诉了张震，妍开始敞开了自己紧闭已久的心……,,,0
