,Unnamed: 0,电影id,电影名称,用户id,用户名,评分,评论日期,评论内容,有用数,没用数,回应数
8,8,27197086,国家破产之日,c34ea0131352e9ea51cabefda739517f,1b887d4572186931b6881db43c619365,4.0,2019-01-09 18:11:26,"刘亚仁演的《燃烧》没有拿到戛纳大奖，他默默又去拍了一部《国家破产之日》。这部电影主要讲的是韩国在97年申请IMF援助的一些（被艺术创作后）的故事，韩版的标题直译就是“国家破产之日”，目前看到的中国香港和中国台湾地区的宣传海报，分别翻译做《救韩大时代》和《分秒币争》。 可能这样取名字是出于吸引当地观众进入电影院的目的吧，比如说“xxx大时代”，粤语片观众就知道“要讲商战的了”，《分秒币争》这种错别字用法，很容易跟什么从天儿降，怦然星动这样的片子联系起来耶。 韩版的宣传海报，把主要人物和他们的角色定位都展示在了海报上。     韩版海报 베팅할 것인가就是我赌一下吧，这句话巧妙地在左边这三个人物上分布，这三个人在影片中的共同点就是利用危机实现自己（机构）的利益。 막을것인가 就是你会停下来吗（我不知道有没有让停下来的意思，原谅韩语初学者吧），完全落在了女主角金惠秀的框框里，指的是在影片中，她不屈不挠伸张正义谴责“黑心”IMF。 살아남을것인가 就是能否生存下来，落在了女主角和影片破产小企业主大叔的框框里。 这部电影为了营造紧张气氛，将故事发生的时间点选在了韩国97年接受IMF救助前的一周左右时间，为了让观影的群众（未必学过经济学金融学）知道发生了什么，男（刘亚仁）女（金惠秀）主角反复多次说“此时距离大韩民国破产只有一周的时间”。 感觉上是要怎么样争分夺秒似的，但熟悉东亚经济的读者应该和我有同感：怎么走到这一步你们心里没点数啊，只剩一周了来这里争分夺秒给我们看。 虽然叫国家破产，其实是外汇危机导致债务危机加深。一个国家发生点经济方面的危机也不是只有韩国，比如我们都熟悉的“欧债危机”，就是那些个国家“债务”方面的危机。 大家都知道，1997年7月2日，亚洲金融风暴席卷泰国，不久，风暴波及亚洲其他国家。泰国、印尼、韩国等国的货币大幅贬值。 货币的贬值，给当时外债规模很高的韩国带来了危机，它的外债在1997年6月底达到1168亿美元，居当时世界之首。受亚洲金融危机的影响，国际金融机构逐渐减少对韩国发放融资贷款，韩国的大企业集团经营困难，银行坏账急剧增加，加速韩元的贬值走势。在韩元趋于贬值的情况下，外资撤离资金的情况加剧，到1997年11月中旬，由于本国货币的崩溃，韩国政府放弃了对韩元的保卫，请求国际货币基金组织（IMF）提供救助方案。 这份一揽子救助方案对韩国提出了很多附加条件，包括修改韩国的银行法；贸易更加自由化；资本账户的自由化；劳动力市场改革，解雇员工更加容易以及推行非正式工合同；关闭综合金融服务公司；提高利率等等。 97年韩国的这个外汇危机以及和IMF谈判的过程，电影里面做了一些通俗化和戏剧化的处理，便于观众欣赏。
 这个危机是怎么出现的呢？电影里没有展开讲，那我来给大家讲吧，让我们先回到1948年。 李承晚自1948年至1960年担任韩国前三届总统，他在任期间，经济凋敝还伴随着政治的腐败。1961年韩国的经济数据比朝鲜要差得多——发电量：朝鲜116万千瓦，韩国20万千瓦；煤产量：朝鲜1200万吨，韩国590万吨。
 在这样的背景下，军人朴正熙发动兵变，1963年成为了总统，执政长达18年，这一时期也是韩国经济起飞、“汉江奇迹”的开创期。 在朴正熙执政期，有两项重要的经济政策：出口导向和重化工业驱动政策。与之配套的综合商社制度，是一项直接导致韩国财阀产生的制度。 那些我们熟悉的韩国财团的名字，虽然有一些在韩国成立之前就已经存在了。比如三星的创始人、现代以及韩华的创始人的事业已经开展十年了。但他们的发展壮大是在70年代。 经过了70年代的债务危机和石油危机之后，三星和大宇首先向韩国政府提出了参照日本建立综合商社的方案。于是1975年，在政府公布了综合商社的标准后，三星物产登记为第1号综合商社，随后是大宇，其后多家实业均逐一登记。 由于综合商社得到了韩国政府在进出口贷款方面的高度优惠，而在出口导向政策下韩国企业本来就高度依赖国外市场，有资格登记成为综合商社的又只可能是少数大型企业（（1）自有资本总额不少于约250万美元；（2）年度出口额在5000万美元以上；（3）出口产品7项以上，每种产品出口规模50万美元以上；（4）产品的出口国要在10个以上，每一个国家的出口额不低于100万美元；（5）需有10个以上海外分支机构等），因此直接导致大量陷入生存危机的中小企业被少数综合商社所并购，韩国大型企业由此演变为跨界财阀。1980年，韩国前十大财阀收入的GDP占比已达48.1%。 朴正熙的经济政策需要这些大的企业去执行，为了得到企业家的支持，政策自然就是有利于这些大企业。当时，韩国的执政利益+财阀利益+普通国民利益，这三者是紧密相连的。 在资本密集、投资规模巨大的重化工业时期，这些财阀为了保持自身对企业的控制权，偏好债务融资而非股权融资（也是由于FDI受到限制）。由于资本匮乏，通过金融压制和高利率将资源集中于这些企业，创造出高负债率的财阀。1980年代，韩国间接融资比例高达79%。1979年韩国外债占GDP比例上升至33%。
 在全斗焕和卢泰愚执政期间，韩国财阀在重化工业、造船业等领域继续开拓全球市场。韩国人均GDP从1980年的1674美元增加至1989年的5438美元，中产阶级生活方式普及，1987年的调查显示，韩国中产阶级家庭超过90%拥有冰箱、彩电、电话和相机，超过一半拥有钢琴，42%拥有小轿车。 1988年韩国举办了奥运会，许多韩国影视剧里面怀想的1988年，是韩国一代人全盛的记忆。     得益于前三十年的经济发展，1996年，金泳三执政期间，韩国成为OECD第29个成员国，跻身发达国家之列。 在此期间，财阀的高负债经营情况并未得到改变。1988-1996年期间，韩国公司的负债水平达到348%。1997年，位列韩国前三十的财阀，其债务权益比已达到518%的惊人程度，其中有5家甚至超过了1000%。 做财务分析的时候，很多人会告诉你，负债权益比=1：3，公司的财务状况OK，如负债权益比50%，就要当心了。而当时，有5家的这个比例是：10:1。 90年代中期，韩国的短期外债甚至增长到超过外汇储备300%的水平。 由于亚洲金融危机，外国的银行开始对韩国收紧放贷，不再向韩国企业续展短期贷款，韩国的银行体系面临崩溃。这个在电影里面也通过金惠秀之口陈述了出来，在计算需要展期金额时，金额巨大，却被告知不再接受展期。     （为了表现外资怎么撤离，电影拍了个华尔街交易室模样的场景，一位老外写了封邮件。邮件后缀实名挂的大摩么哈哈哈） 于是，从韩宝钢铁破产开始，到1997年底，破产企业总数高达3万。电影里将一个个破产企业的名字在危机救助小组的名单栏里用红笔划去，危机的顶峰，第二大财阀、作为韩国象征之一的大宇集团也申请破产。
 韩国政府被迫向IMF再次求援，这是20年来首次由OECD国家向IMF请求援助，对韩国国民的自尊心造成极大打击。就连电影里靠危机发国难财的刘亚仁，看到自己曾经工作的金融公司被挤兑时，脸上也难掩悲怆。 事实上，韩国选择的经济腾飞道路并不是只有它独自走过。 英国金融服务管理局(FSA)前主席阿代尔·特纳在《债务和魔鬼:货币、信贷和全球金融体系》一书里写到： 日本、韩国和中国台湾，这些经济体的发展致富政策各有千秋，但无一不大量使用工业关税、金融抑制和信贷指导等政策。 乔·史塔威尔在他的《亚洲模式》书中也总结了日本、韩国和中国台湾崛起的秘诀： ……二是鼓励发展世界级制造业的产业政策，一方面抵制国外竞争者入侵本国市场，一方面大力支持本国企业进军出国市场。特别是韩国，以公开的国家战略来支持钢铁、化工和造船等重工业争创世界领先水平。……三是对金融体系特别是银行体系严格的政策指导。这条经验以日本和韩国较为典型。政策指导的目标有两个：维持较高的投资水平和确保投资最终配置到生产率较高的领域。 阿代尔·特纳还在书里写到： 这些经济体的发展致富几乎违背了“华盛顿共识”的所有教条，也不符合新古典经济学关于经济效率的理论。……不过在这些国家/经济体快速发展时期，“华盛顿共识”尚未形成，他们应该为此感到幸运。 华盛顿共识就是下面这张图：    华盛顿共识（Washington Consensus），是指20世纪80年代以来位于华盛顿的三大机构——国际货币基金组织（IMF）、世界银行和美国政府，根据20世纪80年代拉美国家减少政府干预，促进贸易和金融自由化的经验提出来并形成的一系列政策主张。
 它被运用在东欧国家的转轨上，结果证明是有一些问题的。 让我们再来看看IMF给韩国提的一揽子救助方案，来和华盛顿共识连连线，“输入性外国直接投资的自由化”等等。 再回忆一下电影里：金惠秀大声谴责“IMF总裁来韩后就一直与一同前来的美国财政部副部长（住在酒店的同一层）交流，不知道在密谋些什么，提出一些损害韩国利益的救助方案”。（生怕观众看不懂，说得很直接了） 华盛顿共识就是由IMF、WorldBank和美国政府一起提出的嘛，人家就在一层楼里商量了，怎么了。 《国家破产之日》里将IMF救助及其附加的“苛刻”条款视为洪水猛兽视之为金融主权丧失，给观众的感觉是“IMF你是魔鬼/吧？”。 这有点让人联想到刘亚仁的《燃烧》中，片中人物说“因为中国和美国一样，是大陆国家，他们的中心永远在自己那里”，而韩国人则是“整天看着别人的眼色过日子”，表现了自己国家在美国的保护下，被伤害的自尊心隐隐作痛，又无处安放。 当然，这或多或少也暴露出了，IMF在90年代亚洲金融危机救助时，“更多地秉承华盛顿共识而较少地考虑不同国家的独特性“带来的不足吧。 但是时代在进步，IMF的份额改革也在推进中，虽然美国仍是份额（份额基本上决定成员国在基金组织决策中的投票权）最多的国家，但新兴市场和发展中国家也逐渐被关注到。根据IMF2016年报，中国成为基金组织第三大成员国，目前基金组织份额最大的十个成员国中有四个新兴市场和发展中国家（巴西、中国、印度和俄罗斯）。 影片最后用了一个“开放式”结尾，以女主金惠秀又被政府请回去参与经济改革这个镜头作为结尾。 后面的事情，其实观众也都知道，韩国并没有在这次危机的泥坑里停留太长的时间。 由这个危机，政府进行了一系列的改革，还设立了一个金融监管机构，1997年修订了《韩国银行法》设立了“金融监管委员会”（FSC），下设执行机构“金融监管局”（FSS）。 1999年7月14日，韩国产业银行所持有的浦项制铁8%的股份，在纽约证券交易所以1997年以来每股最高价格售出，回收资金总额达到10.1亿美元。这被认为是韩国克服了外汇危机的信号。    （这里通常会有东亚三国影视、历史，不时会有东西方美术史碎碎念，以及突如其来的感悟） 更 多 精 彩 东亚三国影视系列：（*为推荐阅读） 1.不仅有长腿欧巴，还有古往今来大千世界
 2.“输”给了是枝裕和的李沧东和他的《燃烧》  3.小偷家族|被遗弃的人儿相互取暖  4.坐火车去传说中的湘南海岸  5.《高岭之花》|谁来继承月岛流这样的家族企业 6.《无双》|画丢勒的李问为什么可以画华盛顿（*） 7.又发债的Netflix，拿着这笔钱去影响韩国影视工业了吗（*） 8.《今生是第一次》|看穿婚姻的契约本质还是要恋爱要结婚么 东亚三国历史系列：（*为推荐阅读） 1.日本人和韩国人是中国古代移居先民的后代吗？
 2.韩国的传贳房租是怎么一回事儿？ 3.八百万神灵的居所，日本纪行之神社篇（*） 4.一休哥和金阁寺主人不得不说的故事（上）（*） 5.一休哥和金阁寺主人不得不说的故事（下）（*） 6.日本的美术馆为什么对收藏西方美术作品情有独钟（*） 7.《宋徽宗》|书画误国的皇帝？东方美弟奇？（*） 西方美术史系列：（*为推荐阅读）
 1.读史不心慌：看图识波旁王朝、法国大革命及拿破仑（一）（*）",42.0,3.0,0
9,9,27197086,国家破产之日,2a3d407fc88ed23c3bfa5da569c6e930,601ba717a4ead7d3eb78d90e80965193,4.0,2019-01-10 14:47:52,"97东南亚金融危机绝对是具有大片基底的故事元素。不疯魔不成活的香港电影里出现了一大批以此为历史背景的影片，从宏观到围观，从人性的制度，其中，彭浩翔的《维多利亚一号》从买房的女主角切入，融入香港电影惯有的猎奇，以及磨坊电影的血腥和艳情，把人在遭遇困境时所迸发出的恶意和狠意表现的淋漓尽致。     深受香港电影影响的韩国，最近也拿出了一部，同样以97东南亚金融危机为背景的剧情片——《国家破产之日》。     由刘亚仁和金惠秀主演的《国家破产之日》上映首周就以 106 万观影人次登顶票房冠军，把一众好莱坞电影拉下了马。有的韩国观众看完全片后非常激动，"" 这是一部比刀枪还要恐怖的经济惊悚片 ""，"" 想到经济危机时的父亲就哭了 ""，“这部电影在讲述我们今天的贫富分化、雇佣不安和青年失业问题的根源""，带有强烈民族情绪的韩国人对这场经济浩劫记忆犹新，很容易唤起共情，引发情绪共振。     《国家破产之日》用了一个“韩国式”的角度进入主题，提领全片。香港的《维多利亚一号》是底层的反抗，由小及大；那么韩国的《国家破产之日》则展现了精英阶层和政府高层之间的博弈。影片为此选取了3组人物作为社会横切面，以他们的反应，凸显韩国政府面对危机时的“不作为”和阴谋论。全国银行的中层韩诗贤作为特别小组组长，发现了潜藏的危机，提出了质疑，     政府高层警醒，面对韩国即将在几周内“破产”的威胁，他们最终选择了放弃中小企业和普通市民。韩诗贤虽然据理力争，当因为拿不出有效的“止血”方法，加上高层默许，导致最后韩国的经济彻底被国际货币组织把控。     韩诗贤是韩国精英阶层的代表，她的反抗，她对人民的守护，对政府不作为的愤怒，代表了众多韩国影片中，韩国有识人士对政府天然的不信任感，以及警惕。影片中，整个上层架构，几乎没有人考虑普通人，或者中小企业，他们列出了一张大表，上面全是韩国本土巨头企业名单，他们只想保住他们，甚至提前透露信息，让寡头能够趁火打劫，收购其他企业。有的高层人士，就希望借此让韩国经济和社会走入资本寡头的时代，即政府和最有势力的企业政企联合，从各个层面接管和控制韩国。    在韩诗贤的斗争之下，另一组人物则凭借经济敏感性，改变了自身的命运，完成了阶层跨越。刘亚仁饰演的尹正学原本是金融机构的职员，他通过数据分析和多年的行业经验推测出韩国的经济必然出现问题。     他拉拢到两位以前的客户，让他们买入大量美元，坐等韩币贬值，然后凭借汇率差价，用美元大量买入价格暴跌的房产。尹正学看透了韩国高层的把戏，同时深谙人性之道，在疯狂赚钱的同时，他也流露出了对于金钱和欲望的反感，     他知道，一个人完成阶层跨越的同时，很多人会被迫阶层下滑，有人笑，就有人哭。比如，另一组人物小企业老板岬秀。他无法预料什么经济危机，更不懂银行贷款的危险。     金融危机山呼海啸般袭来，他的生活和家庭一点一点被卷入了深渊。原料价格因为货币贬值飞速攀升，商店关门，他们的货品断了销路，同时，他们的债务即将到期，下游链条催他们还款，而这时，他们只能贱卖自己的不动产作为抵押，资金链迅速断裂，他们难以维继。在看到原料供应商老板被迫自杀后，他也差点迈出了自毁的脚步，是家人让他鼓足了最后的勇气。     片尾，3组人物巧妙的完成了叙事拼图的重新聚合。影片也渐渐透露出它所期望表达的主题，20年过后，97金融风暴的惨状已渐渐被人遗忘，年轻人大多对金融危机不会有感知，但经历过的人依然记忆犹新。韩诗贤依然在研究韩国的经济走势，国家银行感知到了新的危机即将爆发，她被邀请进入研究小组，为新的经济战争做好准备；     尹正学摇身一变为经济预言家，学巴菲特，约一次午饭500万韩元，他凭借第一桶金建立了属于自己的资本公司，20年后，他坚信危机到来时，政府会估计重施，他暗中观察着经济走势，准备再次书写传奇；而小企业老板岬秀靠着与韩诗贤的亲戚关系，成功贷款，让工厂度过了危机。20年后，当年决定韩国经济命脉的政客踏入商界，成为了资本巨头的话事人，操控者，在信息差面前，在即将到来的新危机前，他们开始各自投入全新的战场中。《国家破产之日》希望以此警醒韩国民众和政府经济危机的周期性，以及遭遇危机时政府的职责所在。     《国家破产之日》很容易让人联想到好莱坞大热的同题材影片《大空头》，2008年席卷全球的金融危机在《大空头》中被生动形象的表现出来，什么是次贷危机，如何激活经济等问题都在影片中得到了解答，而且戏剧性冲突更加强烈。     《大空头》直指人性的贪恋，以及金融寡头“吸血”的本性；《国家破产之日》更具社会属性，是本土化元素强烈的韩国电影，它继续凸显韩国精英阶层对高层的警惕，以及对下层的同情。现实中，韩国高层政府官员总是陷入丑闻，遭到弹劾，甚至沦为阶下囚，其实都与那次经济危机有关。     韩国经济一方面被美国和国际货币基金组织把控，另一面为了安全和自保，政府几乎把所有资源向本土寡头倾泻，整个政权体系从上之下都被资本巨头控制，成为巨头既得利益的维护者。政府官员不得不对这些资本寡头唯首是瞻，也许他们还有维护人民利益的理想，但最终只能成为资本的奴隶。《国家破产之日》想表达的是，依然有群人在反抗这个体系，如韩诗贤一样代表这人民的利益，为国家的利用誓不妥协、挺身而出。",18.0,1.0,2
