,Unnamed: 0,电影id,电影名称,用户id,用户名,评分,评论日期,评论内容,有用数,没用数,回应数
19,19,27197086,国家破产之日,94ce6189052e1b553d26798ea9067286,3fc505e3d7ae3784c300e9213065191b,4.0,2019-04-21 17:06:29,"第一次看到这部电影，觉得韩国人现在真是胆大，各种题材都敢在电影中探讨和涉猎，在国内简直不敢想象。反念一想，自从韩国上世纪末取消电影审查制度，实行电影分级制度之后，电影产业的真的是大爆发，各种类型，各种社会话题的电影，都刻画的入木三分。政治，谍战，惊悚，科幻，黑帮，爱情，各种代表性的电影纷呈迭出，可以说在亚洲电影行业首屈一指。今天要说的这部《国家破产之日》就是基于1997的亚洲金融危机而来，生动刻画了韩国社会不同阶层，在危机前夕和危机爆发后的不同面孔。 开头就可以看到一幕，华尔街发出了所有投资者撤出韩国的警告。华尔街可谓是世界金融的核心大脑，这么直白的警告，一定是嗅出了极大的危机，发出了严重的投资警告。 各种大佬都教过我们，“祸兮福之所倚，福兮祸之所伏”，最繁荣的时候往往隐藏着最深的危机，鲜花着锦，烈火烹油。其时，韩国正处在经济发展的高速期，摩天大楼林立，申奥成功，工业发展迅速，进出口贸易额一路上扬，而且成功的加入了OECD经合组织，一排歌舞升平的气象。 引爆危机的暗流却早已埋下，一路发展，临近破裂的节点。 企业过度扩张无收益性的事业，银行端毫无审核就贷款出去，政客们对此进行游说，监督局疏于监督等等各种爆点汇聚齐全，大企业大量的不良债券，而各种上下游的中小企业，又与大企业一荣俱荣，一损俱损。天时地利各种不占，一个大大的泡沫就这样戳破了。 就如同末日来临，基督审判时的景象一样，在暗流中各种不同阶层呈现出多色的面孔，我们不妨取代表性几个来看看。 第一类是韩国银行货币政策组组长韩诗贤，这是一位非常负责，也非常具有实干精神的政府雇员。因为管理着国家的货币政策，拥有各种货币和贸易的数据，所以她是最先发现韩国经济岌岌可危，国家面临破产危机的人。这是一位非常有行动力的女强人，在发现危机的起始，就做了一份详尽的报告放在了直属上司的办公桌上，可由于各种原因耽搁，上司直到十多天后才认真看到这份详实的报告，继而大惊失色。 报告打了很多次上去，小姐姐还是非常的尽职的，但由于官僚体系内部的不重视，危机被重视起来的时候，已经错过了最初的时间了。 在政府内部组织的内部讨论会上，小姐姐也是和财务部次官各种diss。从一开始决定要不要把危机公之于众开始，一路到后面要不要请求IMF的救助，各种diss。在这里我们不妨从两人的背景来分析下。从后面身为小企业主的哥哥来求助韩诗贤，可以看出她的出身背景并不高，父母很大概率是普通小市民或者小企业主，其本人既然能做到韩国银行货币政策组组长的位置，在韩国这个极其重视流派和圈子的社会，她应该是从小成绩优异，一路考上韩国名校，然后毕业后进入银行系统工作的。，可以说她是更多的站在中下阶级民众和中小企业的角度来考虑问题。 而财务部次官呢，从后面其和日星集团的公子（这里影射的是某星）谈论校友的关系，以及讨论接班人培训的问题的时候，可以得知，这几位都是哈佛大学MBA的校友,平常经常聚在一起聊天和分享咨询，这几位由财务部的高管，有大财阀的管理者，大家都居于高位，明显的是政治和财阀的结合，代表的是财阀的利益。 所以韩诗贤和财务部次官的屡次辩驳和争论，其实就是掌握大量资源和权力的大财阀和普通民众的斗争，结果毫无意外，拥有大量资源和权力的前者获得胜利。 第二类是原高丽综合金融的雇员尹正学。这位小哥哥虽然年轻，但凭借敏锐的金融嗅觉和专业的知识，也是最早一批觉察出韩国经济出了大问题之人。其透过大量外资短时间内撤离韩国的情形，加上电台中关于就业和经济不景气的社会报道，以及对于韩国官僚体系的了解，从而得出一个坚定的结论，国家经济危机在即，年内即将破产。然后就召集了一票投资者，给大家宣导他的理论，虽然大多数人持怀疑态度，但最后仍然有一位中年大叔和街舞小弟信任了他，关键是小弟很有钱，也没人约束，一次掏出10亿的巨额存款来投资。尹正学和两位投资人在这里扮演的就是投机者的角色了。 小哥哥带着小弟和中年大叔买入美元，以及美元的看涨期权，坐等汇率崩盘。其实在这里，有一个关键的崩盘因素，那就是银行担保的汇票所连接的整个金融信用链条，中间的资金有一环断裂就会出问题。从前面我们提到的银行贷出大量未审核的贷款可以知晓，大量的坏账和不良资产到了一定程度，引发了整个金融体系的崩盘（现在我们也面临者这个问题，银行和各种金融公司为了逐利，各种贷款广告横飞，全民贷款负债，这一点已经造成不少波澜）。 在外汇和股市赚钱之后，小哥哥又带着小弟和中年男转战房屋中介。这时候因为债务的引爆，很多人低价转出自己的房屋，快速获得资金填补负债，此时正是抄底的好时机。小哥哥就让中介把小户型房子都留给他。就在街上出现很多自杀，身为小企业主的大叔也把自家房屋贱卖之后，小哥哥三人组抄底买到了大量的小户型房产。我们都学过基础的经济概论，知晓资本主义的经济危机周期性的特点。三人组趁着低价囤积了大量的不动产，在几年后的经济复苏阶段高价卖出，赚的盆满钵满。 利用自己的国家经济危机，做空经济赚钱，这类人是属于在尖刀上跳舞的人。唯利是图是他们的性格，即便是在无数普通民众的破产和鲜血洒落的背景之下，资本世界赤裸裸的丛林法则，在我们面前展露无遗，它的背后同样是刀光剑影，远不是表面那样的平和和故作姿态。 第三类就是以财务部次官和日星集团大公子所代表的政治和财阀的合体。 他们在面对国家经济破产危机时，首先考虑的不是普通民众的生存，更多的是如何利用危机是自身阶层的利益最大化。千万个家庭和手工业者的破产和毁灭，在他们眼中不过是小事情。他们经常利用自身的政治特权和经济特权互相交换信息，提前告知日星工资国家不日即将破产的消息就是明证。这是一个利益的小集团，他们形成了一个圈子，靠着自身的影响力互相分享资讯，甚至不惜引入IMF，通过损害国家的经济主权，大量中小企业破产来养肥自身所在的阶层。久在高位，哪里懒得去看一眼尘世中的蝼蚁。再多的普通民众家庭的破产甚至人命，都不过被他们一句这是调整经济结构要付出的代价，给轻飘飘的带过。而在剧情的最后，我们发现财务部次官摇身一变成了大财阀公司的CEO，身份变了，可是他的属性没变，政治和财阀的关系纠结之深，可谓是韩国的摆不脱的噩梦。 “让贫穷的人更加贫穷，让富有的人更加富有”，“天之道，损有余而补不足，人之道，损不足以奉有余”，这赤裸裸的揭示了资本社会中存在的严重的社会不公，不是一句有没有能力可以解释的，大多数人被这种压力压弯了脊梁，苟且的活着。前一段看的香港的一定一档节目，请富翁体验清洁工人的生活，住儅房，一天只有50港币的消费额度，刚开始富翁还秉持着贫穷的人之所以穷，是由于懒惰造成的，可在体验的第二天还没结束，他就顶不住了，申请了退出。清洁工人比任何人都勤奋，而且起早贪黑，而他们的贫穷不是一两句话就可以揭示的。在基本的生活中就已经被耗光了力气的人，实在是没有多余的精力来仰望星辰和大海的。 第四类人是以小企业主为代表的大叔。在接到了大企业美都波百货的大量订单后，本以为更美好的生活正在招手，殊不知这只是一个走向破灭的开端。为了扩大生产，大叔和合伙人一起申请了银行的贷款，而美都波用来偿付货款的是商业汇票。这个是有期限性和局束性的，当经济危机到来，金融体系崩盘的时候，美都波公司即将破产，导致了大叔的货款收不回来，承兑汇票变成了一张白纸，小企业走到了破产边缘，即使是卖房抵债，都还是不够。合伙人入狱，大叔决定从窗台跳楼自杀，然而被妻儿惊扰，最后倚在窗前无助的大哭。 每个成年人身上都有着千钧的重担，他们是一个家庭的支柱和脊梁，而在危机和洪流中，他们是这样轻易的就会被吞没。在大潮之下，每个人都是那样的脆弱，一人之兴，一家之兴，一人之衰，一家之破，可谓然也。 国家的主体是人民，就像驯龙高手里说的那样，人在哪里，哪里就是博克岛，套用在这里也合适。有人民生活的地方，就是这个国家的精髓之所在。个人的力量是极其弱小的，在时代的滚滚洪流面前，往往显得不堪一击。所以组成了氏族，部落，进而形成了社群，民族和国家，生存在这里的人才最有发言权，他们是渺小的，也是崇高的，国家因着每个个体的奋斗而兴旺富强，而国家也是每个个人的保护伞和避难所。这不是那种随时搞一票就跑的人可比的，他们土生土长在这里，深爱着这里，所以危机面前才会有更大的勇气来保护这里。金融危机后，韩国民众纷纷开展的献金运动，正是最好的明证。 没有国，哪有家。国家和人民，权力和意志，从来都不是独立的概念，这一点，生活在这片土地上的千千万万，最普通的民众最有发言权，他们不是那些投机者和大财阀眼中的蝼蚁，正相反，他们是脊梁，是支柱，是千千万万条支撑起大厦的檩条。 最后，真诚的愿危机不再重演，不论国界！",3.0,,1
20,20,27197086,国家破产之日,c2f34e1e64b7bfa5aeee3a752fe41ad7,31f99ec2d2d35df7f8e93f97a3616dc0,3.0,2019-01-18 09:00:08,文/斯嘉丽 香港的市井之气从他们对电影的翻译里喷薄而出。这次的标本是——《救韩大时代》。 这样的名字简直是在撒播紧迫感，你看了标题忍不住猜测一定有很多欲罢不能热火朝天的争斗。甚至让人想到《拯救大兵瑞恩》。商业化和煽动性真刀真枪地在海报上跳来跳去。 但是到了大陆——《国家破产之日》。 陈述句，冷静，大格局。特别是用了一个“之”，再激动的时间也即刻文绉绉起来。果然两地文化氛围不一样。 从纯电影角度来看，论煽动性，该向香港学习，论客观贴切表达电影内涵，站大陆翻译。 为什么呢？ 影片主要讲述的是韩国在97金融危机面对国家即将破产的局面时，财阀，政党，中产，投机分子，以及中小企业主和平民百姓各个阶层的应变（假如跳楼也算一种应变的话）。每个人都有自己的目的和结局。救韩？不存在的。大时代，那倒是真的。 其实这是一部披着政治外壳的金融影片。因为，韩国人特别擅长把像《大空投》这种全程飙专业词汇，不懂的人会看睡着，语速跟开飞机一样，貌似很专业的电影改编成普通大众能看得懂的，自带黑政府属性的，顺带煽情的，同时充满专业范的电影。 “普罗大众能看懂”这一点无需过多解释。 电影里面非常明显的平行叙事，几个阶层的人都在乱世寻找出路。 财阀和政党勾结，希望乘国家经济大乱之时洗牌，干掉不听话的，比我强的，以及想挑战我的。但他们狭路相逢了一个有良心的中产—-国家银行货币政策组组长。金慧秀的演技多年之前就被证明，《老手》里的性感《信号》里的不可替代，所以有她在的电影你要相信不会差。比如影片里，她汇报工作时看向不同领导的眼神都不一样，开始是激动，觉得国之将亡了，你怎么还能愚蠢到懵懂不知呢？后来是无语，似乎在说这么多傻逼的领导，完全不清楚状况，国家的钱都喂了什么样的狗啊。再然后又是愤怒，你们到底是哪个国家的人啊！。。。。。。等等等等。韩国人为什么那么擅长用眼神来演戏？ 这位组长反对政府向民众隐瞒真相，反对跟被美国操纵的IMF进行不平等谈判，反对政府把危机嫁接给无辜的中小企业和民众。不管在电影之外你说韩国借贷IMF好不好该不该，时间已经过去二十多年了，这个世界并没有变得更好，“螺旋式前进”道尽了规律。但是导演的意图很明显：国家即将破产，高居庙堂之人寡廉鲜耻，官商依旧沆瀣一气，只顾寻求自己的利益最大化，韩国政府在做财阀的狗这条路上花样百出，完全无视民众的死活。这是必须揭露的真相。 这条线看的时候，颇让人坐立不安。尤其是当组长被排挤出谈判组，找了媒体去发布，结果没有一家媒体敢向民众揭露真相，这个事情很有意思。你看好莱坞最近干什么，他们无论多么辛苦地黑政府，都会创造一个英雄式的人物。以前是《新闻编辑室》现在是《华盛顿邮报》，他们创造局势的黑暗，是为了反衬英雄的勇敢。最后他们还是要给人以希望。以及输出一下美国自由资本主义是能开始自由民主之花的。这是建立在经济基础之上的大国自信啊。但是韩国不。他们自黑起来全情投入。也许真相就是这样。当然了，还看你愿意相信谁。 组长最后的结果让人唏嘘，她阻击失败以后，还要面对自己哥哥这个无辜的中小企业主背上政府和财阀乱象之后的锅。我要是她我都活不下去了。基本跟茕茕孑立没两样。但是她居然勇敢地在二十年后政府某些有良心的中产的请求下再度出山。类似的故事，可以看看HBO出品，纯香港演员吴镇宇演技担当的经典《东方华尔街》。也是一群有良心的中产希望创造相对公平的金融环境的故事。 刘亚仁饰演的是投机份子。韩国有刘亚仁真是幸福。当年《老手》看得人不寒而栗，《燃烧》又看得人默默无言，我们有能与之抗衡的新生代吗？胡歌吧。可惜他只有一部《琅琊榜》，而刘亚仁，则从未停步。每一部电影里，他都能把自己饰演角色的气质，揣摩得淋漓尽致，他演什么就是什么。看完《老手》我一度很害怕他。这哪里是在演一个富二代变态，这就是个变态。李刚的儿子完全比不上，也只有那个台湾女星狄莺私藏枪支准备扫射无辜的儿子可比了。这大概就是演技的最高境界。不是演什么像什么，而是演什么是什么。 这次所饰演的投机分子也贯彻了刘亚仁一贯塑造人物性格的优势：立体。虽然有对利益追逐的渴望，有对市场敏锐的嗅觉，有当机立断的魄力，有对人性的洞察，更有对人性的失望。通常国内影视剧塑造的坏人，都坏的很扁平。而刘亚仁大拳一辉打在委托人脸上说“永远不要为赚钱而高兴”，其实他内心为自己的洞察而悲哀。因为他的成功意味着无数普通人的失败。他用自己的所有来堵政府的贪婪无知和无能为力。无论谁赢了，都开心不起来，韩国人对外的形象，一直都是爱国而团结的。片尾也交代了，在政府无力偿还债务时，民众都把自己的私房黄金捐了出来。大概这就是韩国人最值得敬佩的地方。 组长的哥哥，就代表了最普通的中小企业主。金融危机食物链的底端。当时跟普通民众的痛苦一无二致，他的妻子也遭遇了IMF式临时工。影片非常明显地表达了国家政策对普通民众的影响太大了，随波逐流性和知情权被剥夺的时候，赤裸裸的被欺骗和被伤害的人。我怎么想到了自己。真的是一部让人汗毛竖立的电影。太平盛世里，你该看一看。 也许每个人的成功不尽相同，但是很多时候，根本原因都是相似的。想想我们去年经历的互联网创业的疯狂成功和今年众多企业的纷纷倒台。投机分子们都在为赚钱而高兴，却没有刘亚仁式的冷静。当螺旋式经济危机山雨欲来风满楼，他依然警惕“我是不会被骗的”，你呢？ 2019年1月10日  ===========================   影片信息   片名：国家破产之日   导演：崔国希   主演：金惠秀 刘亚仁   上映时间：2018年11月28日  韩国              2019年1 月17日 香港 译名：救韩大时代   类型：剧情/   时长：114分钟  ============================ 当你看电影时 其实在看自己到不了的人生 不如长按下图 识别二维码关注我 让我们一起聊聊 人生的无数个可能,3.0,,1
21,21,27197086,国家破产之日,8a5e6a317955ca0258b906a7d5f7eabb,8444af0faf2ba9f14c3c8829608a42e5,4.0,2019-01-05 00:05:09,"四星送给能拍此类题材的韩国电影，因为这在有容乃大的天朝文化里太稀缺了。少给的一星得问问编剧逻辑。

无知与无耻。

小利与大利。

信用，谁值得相信？

真有力量还是纸老虎？ 
所有的经济危机都是人为自食恶果在作死，是丛林强盗的黑手，与市场没有一毛钱关系。呵呵，历史上的背锅侠好像也不缺我这一个。

出了问题，政府不可信，老板不可信，人都不可信。什么可信？丛林可信，市场可信，人性可信，人心不可信。

资本市场只认钱，除此之外没有其它任何歧视，没有种族、国家、民族、地缘、血缘的歧视，只有资本歧视，更大的开放，更大的自由，将释放更大的财富，资本上层重新洗牌，市场竞争更加残酷，丛林垄断的剥削将日削殆尽，底层民众获得的资本红利将更大，水涨船高。当然一切都以稳定为根基，而混乱将走向自由的反面，可持续增长的大利益将猥琐为一锤子抢劫。

人有两种选择：1不患寡而患不均，坐吃等死，幸福在他人不由己，一起后退，2自由竞争，小人物的不幸，大人物的进步，一起前进。

从熟人社会到陌生人社会，从血缘纽带到契约精神，人的感情其实是被释放出来的， 感情其实是变的纯粹了。
感情不需要再作为熟人社会里的人情货币，不需要礼仪制度来区分亲疏有别。

女猪脚一副忠臣好人的面孔，心怀救世主情怀，一本正经的理论说辞，企怀以通往天堂的美好愿望，实而给大韩民国铺就一条通往地狱之路。

男主角，我是不会被骗的，我投资的是恶人的无耻和愚人的无知。",10.0,5.0,8
22,22,27197086,国家破产之日,b66b81eb419ff9582eeb205bffebb1c0,903588cc03cc78322f0d0b5a6da3bf22,4.0,2019-01-11 10:50:37,1997年，以索罗斯为代表的国际金融炒家发动了对亚洲国家的金融攻击，新加坡、香港、泰国、韩国等亚洲国家先后发生了金融风暴。 史称“亚洲金融危机”。 危机来临，每个国家竭尽所能地平息危机，恢复生产，其中，韩国民众自发 “捐金”，用个人财富帮助韩国走出了经济危机的泥沼。 五年后，韩国偿清外债，走出危机，而“捐金救国”也成了历史课本上的一段佳话。     “危机游戏”周而复始，从不停止  得益于相对宽松的审查制度，韩国电影人可以以政治事件、社会问题为话题，创作电影。 权钱交易、热点问题、官商勾结，只要是公众关心的问题，韩国导演便能将其改编为电影。 2018年11月28日，韩国导演严成民执导的《国家破产之日》上映。 这次，镜头对准了十一年前韩国金融风暴中的“危机游戏”。    20世纪70年代，韩国开始崛起，创造了一个又一个“南韩”奇迹。 进出口额超1000亿美金；经济增速领跑“四小龙”；举办1988年汉城奥运会。 成功进入发达国家行列。 从政府决策者，到企业家，再到普通公民，每个人都沉浸在喜悦之中无法自拔，渴望在经济浪潮中一显身手，创造自己的价值。    各行各业欣欣向荣、生机勃勃之时，一场金融浩劫却骤然降临。 长期无监管的信用透支让韩国背负了近百亿美金的国际外债，国际金融做空韩国货币，让韩国的待还贷款瞬间超出了外汇储备量。 即：韩国资不抵债，国家将要破产。 国家破产之日即将来临，社会各界走上了艰难的求生之路。 以韩国银行通货政策小组组长韩诗贤为代表的救亡派，期望通过经济措施有效的干预经济，让韩国经济平稳过度。 她努力寻找真实的贷款数据，却发现所有人都在算着“糊涂账”，透支国家信用，所有人都清楚最终的结果，却没有人想要改变它。 更可怕的是，经济次长早已决定与IMF谈判，根本没给韩诗贤施展的机会。    以投机商人尹正学为首的投机派，他们预先知晓了经济危机的降临，提前兑换货币，购买期权，做好了应对准备。 危机降临，所有人财产贬值时，他们狠狠地发了以一笔国难财，成功改变了自己的社会地位。 但尹正学是危机中唯一的“投机者”吗？ 当然不是，比他成功的还有成功摆脱贷款的大企业，成功整治金融业的经济次长，成功做空韩国的索罗斯，血洗韩国经济的IMF，以及其身后的美国。    以岬秀为首的普通民众则是危机的承受者，他们没有足够的信息预知危机，也没有足够的财力应对危机，更没有足够的财力熬过危机。 他们祈祷决策者救市，等来的却是监管机构的不作为。 他们希望能够有人扶持，却只能独自熬过寒冬。    三位主人公保持着独立的故事线索，直至危机结束，也未能像历史课本中那样众志成城共抗危机。 他们在危机中艰难摸索着自己的出路，摸索着家庭的出路，摸索着国家的出路..... 最终春天来临，生活回复平静，可岬秀却谁也不相信了。    影片没有将危机归因于索罗斯为首的金融炒家，而是找到了更为根本的主体因素：当时糟糕的经济政策。 以汇票为代表的金融工具透支民众的信用之时，决策者不仅置之不理，还官商勾结，用“合法”的方式侵占国家的贷款。 危机将至，决策者竭尽所能的隐藏消息，仍旧高调的赞赏韩国经济，仅将外汇亏空归结为公民的高额出国消费。 危机到来，大厦将倾之时，决策者又舍卒保帅，以民众权益外代价争取国际借款，让数万小企业破产，无数民众被迫下岗。 危机过后，一切种种随风而逝，糟糕的决策者继续决策，普通民众继续过着普通的生活。    有一千种方法可以阻挡危机，或者降低危机的破坏程度，但决策者却选择了最糟糕的一种。 岬秀不满，可他无能为力；诗贤不满，但她有力难为，尹正也不满，他渴望更大的危机让他拥有更大的机会。 如片中所言，这就是自由市场的规则吗？ 显然这不是。 市场主体的消费者、生产者只是案板上的鱼肉，他们没有丝毫的知情权，更谈不上信息的对称。 他们只是“危机游戏”的牺牲品。    当岬秀将这种情绪通过电话告诉下一代时，它就被无限放大，成了一种波及面更广的社会情绪。 所有人都不值得信任，一切事情都丢失了价值。 或许他们可以如《咏鹅》中的允英，通过追根，寻找自己的来处，也可以像《燃烧》中的李宗秀，点燃自我，用熊熊的火焰证明自己来过。 或者他们打开韩剧，为欧巴疯狂打call，过完幸福充实的一天。  “为刘亚仁打call”  诚然，这不是一部足够优秀的电影，其对经济政策的有意贬损也让电影的人物多了一份脸谱感，少了一丝真实感。 但这并没有影响他对“危机游戏”的深度剖析。 它就像一面“镜子”，不仅照亮了韩国，也照醒了我们。 《国家破产之日》，强烈推荐。  码字民工：小配角 免费编辑：威震天  关注小配角，邂逅好电影。,4.0,,0
