,Unnamed: 0,电影id,电影名称,用户id,用户名,评分,评论日期,评论内容,有用数,没用数,回应数
15,15,27197086,国家破产之日,609a8d12c562155d8b022d784d2db969,3369c39061cb8de16d734c842117523a,3.0,2019-02-03 13:11:32,在春节回家的高铁上看完。  一部很规整的韩国电影，用三条主线讽刺政府的懦弱无能。看完有几点延伸思考。 1.普通人的无力感（民营老板）： 当初面试时领导问一个关于悲观与否问题，他解释说意思是是否经常在现实生活中感到渺小和无力。这个问题时常在我脑中闪回，也许当时并非只是考察性格的测试，也许真的只是长者看到新人突然有了些想表达和分享的欲望。 在目前的人生阶段我甚至还没有体会电影中群体灾难前的机会，只是在小伤小悲后发出无病呻吟的感慨。有时我会想象影视剧经常出现的场景，在一个挫败的晚上只身站在高楼天台，俯身看着闪着零星灯光的钢筋水泥森林，与最后一根稻草抗争。然而更可悲的现实是，我只能在压抑的出租屋对着白墙发呆。 2.体制内的抗争者（智库中层）： 我怀疑体制内的既得利益者是否真的会做出超脱个人得失的抗争行为，以及成功的概率何如。可能大多数拗不过国家机器，或者直接被人利用。 韩组长下定决心把关于IMF携手内幕透露给媒体的情节出现后，我一度以为会有《聚焦》《华盛顿邮报》等美国电影里媒体顶住压力对抗公权的后续。“识时务”的人果然还是占大多数。 3.投机倒把者的原罪（投资代表）： 权力阶层熟谙挟国家之名损个体利益之道，甚至不惜两败俱伤、一损俱损，却能始终义正言辞站在道德高地，这是大恶。 有趣的是当IMF和美国势力出现时，韩国政府也只能妥协，裹挟于亚洲兄弟国家的危机之中，这是大大恶。 韩组长有种兼济天下的品质，所以不难理解导演把她和民营厂长设定为兄妹，在最后辞职时刻，两条平行支线相交。 作为唯一独立的剧情线主导人物，尹代表有种难以捉摸的气质，亦正亦邪，喜怒无常。 扇对股市狂跌作出过分狂喜表现的投资伙伴耳光和在购买的住宅发现自杀的前户主镇定无情的矛盾表现，让我我没有完全读出导演设置尹代表这条线的褒贬态度。 但和为国家大恶买单的对象一样，尹代表借国家愚行大发横财，最终压榨的也都是盲目相信国家的普通民众，这是小恶。 也许导演想表达的是只乱世的残酷生存之道，借民营厂长之口说出的血泪教训，“谁都不要相信！”,2.0,,2
16,16,27197086,国家破产之日,8331da16af99ff9114156768d3c324ad,b864b786197bbf130497e1a15fcce96f,4.0,2019-01-28 15:45:49,"可以当成一个纪录片来看。
影片通过三个角色讲述了97年亚洲金融危机时韩国发生的事情。
第一个角色是韩国银行的一位女组长，能力突出，十多天前就感觉到了危机，但由于行长的疏忽，而错失前期处理。但在应对金融危机的整个过程中，女组长始终站在国家和人民的一方，积极应对，与政府与IMF据理力争。但个人的力量在政府和财阀的面前不堪一击，韩国最终还是破产了。
第二个角色是做碗的小厂长，看到最后的时候才发现原来跟女组长是兄妹。因为政府的故意隐瞒，在面对使用承兑支付的合同签署时尽管小心谨慎，但最终还是在合伙人的怂恿下签了合同，成为了破产链条上的一环。最后甲方破产，合同承兑成为一张白纸。好在手下职工能理解，虽然期间动了跳楼自杀的念头，但还是在最后成功克服困难，企业起死回生。
第三个角色是一位看清了政府套路的投资达人，嗅觉灵敏，及时止损，最终在金融危机期间大赚。
影片看完，对我的感触是多懂点经济吧，不然当潮水袭来的时候，只有自己会游泳才不会被淹死，千万不能指望着有人会开着大船来救你。开船的人或许忙着自救呢。",5.0,,2
17,17,27197086,国家破产之日,6185e76984fce7710ad2c287296d3e20,e7864018f72a2e1185f8ace182bd7b86,4.0,2019-01-20 22:39:48,实力派小生刘亚仁联手韩国影坛天后金惠秀大胆呈现1997年韩国金融风暴中不为人知的故事｜韩国实力派演员齐聚揭开韩国「国耻日」的历史秘密 —《国家破产之日》  你与电影只差一个公号：电影新鲜度 1997年，亚洲金融风暴，韩国经济面临空前危机，距离国家破产还剩下一周之时，韩国银行货币政策经理韩诗贤（金惠秀饰）提前预测到国家即将遭遇这重大经济危机。财经顾问尹正学（刘亚仁饰）也观察到这场风暴即将来临，他决定逆向操作，趁机赌上一笔，大发国难财，同时，小工厂老板岬秀（许峻豪饰）与大型零售商签下巨额合约，却不知一场政府都支撑不住的金融风暴即将袭卷而来... 韩诗贤在摸索突破的方法时，却面对来自长官（赵宇镇饰）及各方权力系统高层的压力，眼见国家政策决定放弃经济自主权，向IMF（国际货币基金组织）主席（文森卡索饰）求助，她要如何坚守信念，力挽狂澜？  在1960年代末，韩国、台湾、香港及新加坡先后推行出口导向型战略，从原本以农业与轻工业为主导，慢慢转型成劳动密集型的加工产业，利用本身能够提供优质但廉价的劳动力为诱因，获得已开发国家转移劳动密集型产业的机会，借此吸引外国大量的资金和技术投资 在迅速发展的同时，还能因为当时属于开发家中国家的「优势」，享受其他国家、如日本、美国的进、出口商品普惠制待遇。大环境的转变与政府政策的推动，让韩国、台湾、香港及新加坡得以在众多亚洲国家中快速窜起，成为继日本后新兴的已开发国家，被获得「亚洲四小龙」之国际美誉。  亚洲四小龙的成功，引起其他亚洲国家注意，纷纷开始效仿这四国的经济运作模式，到了1980年代不少国家都有显著的经济发展，其中又以泰国、马来西亚、菲律宾与印尼为最，故后来也有人以「亚洲四小虎」称之。 这时候的亚洲已吸引将近一半的向开发中国家的资本净流入，对讲求高回报率的外国投资者而言，拥有许多开发中国家的亚洲无疑是最好的选择，因此投入庞大资金到亚洲区，造成亚洲区资产价格（资产转换为货币的比例）有着剧烈的上涨，韩国、新加坡、泰国、马来西亚等国在1980年代末至1990年代初经历8%-12%的高GDP（国内生产总值，是国内生产与附加价值的加总）增长，被称作为「亚洲经济奇迹」。  不过到了1990年代中期，却因连续遭遇美国经济复苏、投资客转向投资美国、人民币和日币贬值等冲击，亚洲区国家开始失去国际竞争力，部分东南亚国家出口增长预期下滑明显，经常账户（本国与外国进行经济交易而经常发生的项目，是国际收支平衡表中最主要的项目，包括对外贸易收支、非贸易往来和单方面转移收支三个项目）更为恶化。 而真正开启日后被称为「亚洲金融风暴」危机开端的，是在1997年7月泰国宣布放弃固定汇率制（国家间货币采用固定汇率进行货币交换的制度）改实行浮动汇率制（由外汇市场或自由市场需求与供应来决定升贬的汇率制度）后，宣布当日泰铢兑换美元的汇率就暴降多达17%，造成外汇及其他金融市场一片混乱，菲律宾、印尼、马来西亚、香港、南韩、日本相继受到波及，其中又以泰国、南韩以及印尼影响最严重，几乎到了破产状态，不得不向国际组织低头寻求支援。 这场亚洲金融风暴猛力打击亚洲区各国，导致几年内社会动荡不安、政局不稳，最终不少国家政府因此纷纷倒台被迫负起责任。  「所有投资者立刻离开韩国！」 《国家破产之日》从11月17日开始，那是南韩面临国家破产的前夕，当时南韩举国同庆如愿加入OECD（经济合作暨发展组织，南韩于1996年加入），人民无不相信未来会更好，但他们不知道的是从泰国开始引发的金融风暴问题，正逐步朝着南韩而来 事实上不仅人民没有感受到，就连当时南韩政府也还没察觉，只有长期在关注亚洲经济发展的欧美地区投资者先一步发现正悄然发生的金融危机，在他们呼吁投资者开始撤资的不久，韩国银行（中央银行）通货政策组组长韩诗贤根据每天都在变动不停的数据资料，终于发现这潜在危机，并将之制成报告向上呈报，不过上头却都没有太过重视，直到韩圜对美元的汇率跌破纪录后，南韩政府才意识到这不可避免的经济危机。 与此同时，于高丽综合金融担任财经顾问的尹正学，透过自身的敏锐度与观察力，抢在政府前观察到这现象，打算先行脱身并借此机会大赚一笔，化身投机客（指在期货市场上通过『买空卖空』、『卖空买空』，希望以较小的资金来博取利润的投资者）预备豪赌一把。  为了阻止这场经济灾难侵袭南韩，由韩诗贤带领的小组旋即展开对策，在上头帮助下开始和相关政府官员展开会议，虽韩诗贤不断提出建议，却总是遭到财务局次官补大荣讥笑驳回，甚至连总统都听从他的话，决定对人民隐瞒国家即将破产的事实，无奈之余韩诗贤只得另想其他办法，企图靠她们自己挽救国家。 只是就算政府不让人民知道真相，市场发生剧变他们是不可能无感的，在不少中小企业甚至大型公司陆续宣布破产后，政府高层终算体认到这场风暴威力。韩诗贤和组员研拟各种计划，尽可能地要让伤害降到最低，未料补大荣再提要向IMF（国际货币基金组织）提出求援的提案，竟要放弃南韩经济自主权、被迫打开经济市场，以换取IMF的救助金 更错愕的是总统点头答应接受IMF救援，当IMF主席抵达南韩递出协议合约，韩诗贤惊查到这一切都有美国政府在背后搞鬼，他们的「合作」都是为了趁这机会强制打开南韩的大门...  「不管你怎么挣扎，还是不会改变的。」 《国家破产之日》以亚洲金融风暴为题，毫不遮掩的将当时被南韩国民视为「国耻日」的事发经过拍出，1997年对南韩而言是永生难忘的一年，和IMF签约确实改变了南韩经济体系，大幅度且明显的冲击了人民生计，失业率来到史无前例的高，不能说政府无能挽回劣势，只能说是这风暴来得太快又太凶猛，政府无力去扭转。 当时政府发起献金运动，号召人民捐出家中金子好救国，在政府号召下全国果真动了起来，人民自发性地将金钱、珠宝等捐给国家，盼国家能够度过这次危机，总以民族性、团结力为傲的大韩民国，在这次献金运动中体现了此精神，用行动力告召全世界南韩不会轻易被打倒。 如今南韩无论在各方面都可说是名列前茅，重摔一跤后迅速站起，并重整旗鼓再度往前冲，短短20年就满血复原，让许多国家望尘莫及。  《国家破产之日》的剧本结构非常札实，从多个视角去看国家破产这件事，上至政府下至人民，每个人都被牵扯其中，导演并没有错放任何一人，编撰几位人物作为代表，呈现事发当时他们的反应、态度、作为、以及所受影响的部分，尽可能完整地将此过去作多方面呈现。 「相信一切会更好。」是电影中不断被提起的一句话，说的是人民的信仰，他们真的相信政府会带领着他们走向更好的未来，听来有些讽刺，毕竟观众看见当事情发生政府想方设法想隐瞒人民，可人民却还是选择相信，或许就是因为这样的单纯与天真，才会在献金运动时如此投入，不单是因为团结，还有这股信念。 看到电影最后，会不禁想着「搞不好不应该追求更好，只要不要再坏了就好」，历史是不停地重复发生，这样的危机何尝不也可能再度出现？有涨必有跌，就像是股票，不能只有出手快，而是还要有一双利眼与善于观察的心，才能在最准确的时机作出最精准的判断。  电影本身非常好看，节奏明朗快速，即便不是很懂金融方面的事，依旧可以感受到《国家破产之日》里所带给人的紧张感，仿佛真的就是跟着角色再走一次亚洲金融风暴。 不过满建议事前可以多做功课，去查查相关资料，甚至可能的话还可以先去了解专业名词、术语，因为电影里大量出现不少听过但不了解的名词与术语，在看的时候难免会觉得有些吃力，事实上看到一半我是有点半放弃去接收这些新知，决定将所有心神放在感受电影，去享受演员的演技。 上面很多都是回家后上网查的，参考如维基百科、MBA智库百科等，好不容易稍稍明白了前因后果，可能还是说的不够对、也可能会有错误，再请专业的指正。,3.0,,0
18,18,27197086,国家破产之日,5e7c1d0afb4c2cc679f7d649c92495e9,af7abfe8e152baf652053852e4076bf1,3.0,2019-01-14 13:53:04,"最近杀姐很焦虑。 一方面是好片好剧少的可怜，另一方面是看了一部让人添堵的电影—— 《国家破产之日》     看阵容。 女主金惠秀，韩国百想艺术大赏的视后，主演的《信号》击败《请回答1988》，拿下最佳电视剧。     男主刘亚仁，最年轻的韩国青龙奖影帝，领衔的《燃烧》刷新戛纳场刊高分记录。     配角许俊豪、赵宇镇都是资历丰富的老戏骨。 但这部片真正吸引杀姐的，是它的题材—— 1997年亚洲金融风暴。 尹学正（刘亚仁 饰）韩国某银行的小职员。 这天他突然交了辞职信，说自己要去干一番大事业。 主管问他原因，尹学正神气的说：“国家就要破产了，我要去发国难财。”     大家都笑了，因为尹学正并不是第一个自恃金融奇才的“独醒者”。 “上次国债危机也有人这么说，国家哪那么容易破产？” 另一头，盘碗工厂的老板甲秀（许俊豪 饰），最近谈了笔大买卖。 一家百货公司，要跟他签长期订单。 但这笔交易，百货公司方面的用是银行汇票。     当甲秀望着汇票犹豫时，对方还嘲笑：“现在交易，哪还有人用现金？” 第三条线，韩国银行的韩诗贤（金惠秀 饰），查探到韩元兑美金的汇率，一直在跌破记录，众多外资纷纷逃离本土。 她紧急联系经济首席，希望国家能对即将面临的破产有所应对。     却遭到经济部门二把手朴大荣（赵宇镇 饰）的冷嘲热讽。  





   有经验的朋友应该猜到了。 在电影里立flag，绝对帅不过3秒。 于是，韩国经济一夜间分崩离析。 无数龙头企业，都被画上了破产的红线。     咋崩的这么快？ 这里就要谈到，韩国当年的经济政策了。 金融危机之前，韩国长时间受军政统治。 贪污腐败，收贿受贿，整个国家乌烟瘴气。 而且本土的金融机构都受政府控制，但凡是大企业去贷款，全部开绿灯。 大额汇票，如流水一般涌入市场，各大银行根本不顾，国家对外的债台高筑。     这也铸就了现代、LG、以及全领域涉足的三星，这些巨无霸般的企业。 此时，大洋彼岸的美国，早已虎视眈眈。 再加上，韩国人普遍喜欢投机。 买房、炒股什么来钱快，玩什么。 一场压倒性的贸易战，已经悄然而至。 随后，美国勾结IMF（国际货币基金组织），假意援助韩国，实则打着低价收购韩国破产企业的算盘。     影片涉及的金融知识不少，呈现的方式却很通俗。 再加上“平民+政府+投机者”多线叙事的结构，看起来很像《大空头》。 但老实说，这部片子处理矛盾的方式太简单： 所有的矛头，全都直指政府高层。 他们不懂经济，不看报表，要么巴结富家公子，要么窝在办公室打高尔夫。     还总想着愚弄百姓，公开演讲满嘴都是谎言。 越是高官，越智商下线。 好像刚刚改制民主的韩国，还是一个闭塞腐败的国家。（不太了解韩国历史，如果真这么智障，我也是服气的） 而且刘亚仁的发挥，有点傻嗨。 他似乎还没脱离《燃烧》中的角色。 反倒是其他角色，稳扎稳打，为我们勾勒出了那个时代。 国内生产力过剩，内需拉不起来，汇率屡创新低，外储强行高抬。     影片开头，尹学正偶然发现一个电台，连线的听众正在给主播倒苦水。 说是丈夫失业，家庭举步维艰。 尹学正顺势摸到电台，却找出了两麻袋来自不同家庭的“诉苦”信件。     当他开讲堂，借此向别人推销“国难商机”，所有人都走了。 “经济有政府管控怕什么？” “这么反动的言论，我不举报你就不错了！” 没错，大家每天听着国富民强的新闻； 看各种专家在节目中反复“辟谣”；  





   就连韩国的球队，都能在世界赛场上大杀四方。 美国算什么？ 他们的领袖不就是个跳梁小丑吗？ 但当年韩国的经济，早已命悬一线。 虽然在金融危机时，随即上任的韩国总统金大中，靠演讲鼓动民众捐金，没日没夜的四处谈判借钱，让风雨飘摇中的韩国幸免于难。     但真正能做到，举国上下同心同力的国家能有几个？ 《国家破产日》想向观众阐明的，是一种危机意识。 而它让杀姐添堵的，也正是这种危机意识。 我当然坚信，大天朝是一个强大的国家，我们一定会在党的引领下，走向繁荣富强。 但有时候大家也应该冷静下来，好好看看这个世界。 或许，还不晚。",6.0,1.0,0
