,Unnamed: 0,电影id,电影名称,用户id,用户名,评分,评论日期,评论内容,有用数,没用数,回应数
22,22,27615398,罪人,5e76ee98e182d94d0411032575386dcc,c7bb3af93ff756f706ec7830a08ae8ed,4.0,2020-03-29 21:25:12,"首发公众号：偲固乡 没什么文化，就是爱自说自话    疫情以来，大家被迫宅家接受各种信息轰炸，相信很多人已经感到疲惫了。各种谣言漫天飞舞，传播速度之快令人咋舌，而事实却被丢在角落无人问津。这不由得让人陷入思索，是否面对各种信息时，我们先入为主地任由自己的认知去主观臆断，给了一个错误的判定之后，就无暇，或者说不愿去找寻背后的真相呢？有一部小场景电影似乎符合这种微妙的现状——丹麦导演古斯塔夫·莫勒所执导的电影《罪人》。  《罪人》海报 说起小场景电影，出色的有不少：《狙击电话亭》因“声优嫌疑犯”而大出风头，“死侍”瑞安·雷诺兹主演的《活埋》听名字就让人紧张，而韩国的《恐怖直播》更是直击政府痛点。而《罪人》却和上述影片有点不同，它并没有过多的紧张刺激的情节，与这些小场景电影比较起来，它反而是一部需要静下心来沉浸在男主心境和情绪里的影片。
男主人公阿斯格（雅各布·克德格恩饰演）因为犯错而被降职做一名普通的报警接线员，今天是他需要做这份工作的最后一天，明天他将接受庭审，而后便能顺理成章的官复原职。“当一天和尚撞一天钟”，既然是最后一天，那么敷衍一点熬到下班也没有关系。存着这样的想法，再加上阿斯格的老道经验和狠辣目光，他工作起来毫不费力。从只言片语中，他就能识破报警的人吸了毒；两三句话，他就推断出对方因嫖娼没给钱而被抢劫。 接电话的时候还在玩球 而这平静的局面被一通电话打破。一个叫做伊本的女人报了警，却丝毫不提自己的处境，却是用温柔的语气在电话里说：“嗨，宝贝。”“别害怕。”“妈妈出门去兜风。”阿斯格敏锐地觉察出事情的不对，这个看似平静的女人实则被绑架了，而绑架她的，正是她的丈夫。丰富的经验令他能够迅速处理这种突发情况。他和聪慧的女主角不露声色地交流之后，他转接了调度中心，要求他们派出巡逻车搜索伊本所在的车。    在伊本不断被丈夫打断电话的情况下，阿斯格还是迅速获得了伊本的相关信息，并找到了她的家。电话打过去，是一个稚嫩的童音，那是伊本年仅六岁的孩子玛蒂尔达，她和她的弟弟奥利弗在等待妈妈回家。阿米克，伊本的前夫，也就是绑架伊本的人，是个有着犯罪前科，还依然带刀出行的人。幼小的玛蒂尔达已经被父母之间时常争吵打骂的可怕气氛影响了，她十分担心妈妈的安危。   从接到伊本电话的那一刻，阿斯格漫不经心的态度就已经全然改变，此刻听到孩子的哭诉，他更是给予了保证，要让伊本安全得救。不过凡事往往不如人愿，他一心想要救下伊本，却奈何自己现在的身份只是个没有多大权力的接线员，调度中心的员工办事不力，不肯配合，还嫌他多管闲事。   不得不佩服，主演的表情拿捏十分到位，明明从一开始就是那副不苟言笑的样子，人物内心的起伏却表现的恰到好处。阿斯格有气不能撒，可同时他恍然领悟了自己以往的举措是否也与这些尸位素餐的人类似，给别人带来了诸多不便和阻碍。于是他为过去的言行向自己的同事道歉，并诚恳打听了能否换电脑的问题。这寥寥几句交谈，让角色更加丰满了起来，那种负气、焦急和人情味儿在个镜头里表现的淋漓尽致。  阿斯格道歉 而导演的精明之处在于，在如此小格局之中，利用有限的场景变化，灯光变化和拍摄角度，暗示和烘托角色内心的情感波动。阿斯格换到了一个单独的办公室，这似乎也意味着角色为这起绑架案的全心投入。氛围终于从此刻开始有了紧张的意味。  阿斯格独自在办公室 在求助遭拒的情况下，阿斯格动用了自己的私人关系去调查伊本的丈夫。而此时，前去伊本家安抚孩子的警察带来了噩耗——伊本的小儿子奥利弗死了，且死相惨烈。角色的怒气在此刻达到了顶峰，他打给伊本的丈夫米克尔，言语间的怒意喷薄而出。   关上窗帘，暗示的不正是心中愤懑和一意孤行吗？再次接到伊本的来电，阿斯格教了伊本自保的方法。他不仅要伊本平安，也要拿下米克尔这个罪魁祸首。然而就在一切应该完满结束的时候，令他震惊不已的事情这才一步步显露出来，而这，足以击垮他心中的正义防线。   此处就不剧透了，但我们可以通过导演的绝妙光影表现感受角色心中的巨大震动。办公室里仅剩一盏红通通的信号灯，男主呆坐在无边的沉默中难以平复。而此情此景，正是网络上众人面对自己义愤填膺为之奔走呼号的事情，被揭开真面目时的感受吧？“雪花论”依旧被挂在嘴边，人们的善意和正义涌动而来的时候，是否能够保证自己的判断就是无误的呢？又有多少人，在这种愤怒下，能够克制住冲动言语？更遑论，网络上所维护的一方是否利用了这种善意，行了一场骗局？大多数人，被所谓曝光和正义驱使之时，便成了虚假的缔造者和传播者之一。那么，真相揭露之后，他们会怎么面对自己呢？  这里的光影色彩值得注意  电影中，平复了心情，接受了事实的阿斯格，走出了这个困室。绝妙的镜头，房间内是代表愤怒和冲动的红色，由同事打开的门外则是冷静和充满秩序的蓝色。再次坐在电话前，阿斯格恢复了克制和理智，且将自己最大的、准备掩藏的秘密公之于众。他内心的正义，终于做出了审判。电影的最后，是他怅然若失，又如释重负的离开这个接线厅。穿越走廊，站在门口的他，是否参透了人情和法律，正义和邪恶的奥义呢？85分钟，迟迟响起的背景乐阐述的是对于这些的疑问，又像是已经得到答案的叹息。 有人说这部电影太过沉闷，并且和观众太有距离感。我不否认它是需要沉下心来感受的，但有人若有这种观影体验，不正是我们对于一切闹剧的旁观之感吗？不如去看看，85分钟后，你是怎样的体会呢？",1.0,,0
23,23,27615398,罪人,bf8f174395fcd47a2b6049d7ed2f5e67,840299e18e1e520ea0d892f7920015f7,4.0,2020-02-22 20:22:53,全场基本上就只有一个人，一个半小时，你就傻傻的盯着这个人， 看着他发呆， 看着他喝水， 看着他接电话， 看着他安慰孩子， 看着他跟同事打屁， 看着他安排调度， 看着他摔电话， 看着他自白， 看着他絮絮叨叨… 然后脑补一切画面，慢慢挖掘他的故事，和他正在经手的案子， 从绑架案到家暴到谋杀再到神经病到自我救赎和解脱… 当一切事实都清晰以后，再用内心独白自我忏悔的方式去做一个结尾。 相信每个观看过这部电影的人都会有些收获， 比如，他太自以为是， 自以为举世皆浊我独清，自以为众人皆醉我独醒， 突然醒来，才发现醉的其实是自己，而且似乎也没那么清澈见底。 还好，最终，他走出了那间屋子，那间困囚自己的屋子。  能这么拍，敢这么演的人， 不是天才，就是疯子， 不是牛逼，就是傻逼。 很高兴，能看到一部天才的牛逼电影！ 如果有音频版，这也注定是会是一部伟大的作品， 只可惜说的是丹麦语…,,,0
24,24,27615398,罪人,7f0e92632260fc3dcbdba2b4a5c7621c,2538e36057eeac6ca7914e44892a17b0,4.0,2020-01-04 19:38:47,一部冷门，但非常优秀的悬疑犯罪电影，也是一部小成本佳作。 尽管拍摄只用了13天，但在镜头语言、灯光布景、声音运用等方面，堪称「教科书级」。 杰克·吉伦哈尔将主演它的英文翻拍版，同时担任影片制片人。 《罪人》讲述一名正在接受调查的警官Asger Holm接到一通来自被绑架的女人电话后，开始搜寻那位女性的故事。但在营救过程中，他逐渐意识到他所处理的案件远比自己想象的要复杂很多...... 85分钟的时长里，影片仅靠两部手机、接线员和他的同事，以及一通通连线，就将“罪人”这一主题串联起。在不知道外界情况的前提下，作为观众的我们就只能随着接线员Asger的思路去探索真相，凭借想象去拼凑电话背后的故事和人性纠葛。 虽然Asger的全部戏份只发生在小小的办公间，但听着电话那头传来的警车鸣笛声，警方抓捕、审问犯罪嫌疑人的声音，以及杂乱的脚步声，不难想象现场抓捕时的紧张氛围。而另一方面，在这种吵闹的氛围中，导演又通过光影对比，通过Asger面部特写，以及安静氛围中无限被放大的钟表走动声等，加重了悬疑、压抑的氛围。最后的反转也给了一个大大的惊喜....,,,0
25,25,27615398,罪人,362d95a4aaf2a64610f37d29c38c1666,34d8ec77e37e455a5e16e87127e2fad8,3.0,2019-10-07 15:22:03,一个人、一部电话、两个房间，只靠来往的通话即推动了整部电影的剧情发展，从一开始认定的一家人中的妻子被丈夫绑架、儿子被丈夫杀害，到后来的原来妻子是精神病、儿子是被妈妈杀害的！一切推动得顺理顺章，毫无突兀，但也因如此缺少了悬疑电影别人震撼的“我去，原来是这样”的反转感觉，结构算是较为少见的清新，但作为悬疑电影差点意思！ 而作为电影副剧情的警察杀人案件，也随着案件的推动，警察自己将真相在同事面前，全盘推出，完成了自我的心理救赎！,,,0
26,26,27615398,罪人,70b0b97a1db4eac798da69a3dd9c57ed,bab710b332a83aac6f682b763e849369,2.0,2019-10-06 22:21:55,这片我不知道为什么会有7.6分，我挺好奇那些打四星五星的你们看完真觉得好看？豆瓣我都是只浏览不登陆，更不会写评论，但是这电影让我想特地发条评论感慨一下，倒不是说它有多烂，而是想说它是第一部让我看完只觉得自己上当了的电影，不知道是不是我对7.6分有什么误解，通篇让人感觉昏昏欲睡，反转并无多大波澜，至于男主自己的坦白说实话没给我多大触动，这种表现手法的电影2018年了也不是什么稀奇题材了吧，然而在观看过程中我认为唯一支撑我看下去的动力就是7.6这个评分，如果不是出于对豆瓣评分的信任我一定在十几分钟之后就关掉了。,3.0,,2
27,27,27615398,罪人,b7042b23bc2df02924509fb581b1075e,9f341e6ac9fdb8e77030e2b4d9f463c8,5.0,2019-09-01 20:56:39,阿斯格是一位警官，因卷入一起正在诉讼的案件而被限制在报警中心工作。偶然间，他接到一位名叫伊本的女士打来了求救电话，从她时断时续地描述分析，伊本极有可能是被其前夫米克尔绑架，目前正在一辆驶向北方的白色货车厢内。阿斯格调查了很多关于伊本的信息，在获得伊本的家用电话号码后，他立即拨打过去。接听电话的是伊本六岁九个月的女儿玛蒂尔达，女孩哭诉着说家中只有自己和襁褓中的弟弟奥弗尔，爸爸妈妈在家中发生争斗后一同离开了。阿斯格立即呼叫了区域警方前往伊本家照看两个孩子。当警察赶到家中发现被反锁在卧室里的男孩奥弗尔已被杀害。由此，阿斯格判定，杀人者一定是伊本的前夫米克尔。他不断地通过电话同惊恐不安的伊本了解详细情况，同时，利用定位系统侦测伊本和米克尔的地理位置。正当他殚思竭虑地谋划营救策略的时候，恍然间，他从伊本的话语中洞悉了真相。原来，真正的凶手是身患精神疾病的伊本，她声泪俱下地诉说着儿子奥弗尔身体里有一条“蛇”，她要杀死那条蛇…… 米克尔正驾车载着伊本前往丹麦北部的一所精神病院。当车在途中停下后，伊本冲出了汽车，袭击了米克尔，然后独自奔逃而去，她来到一座桥上，给阿斯格再次打来了电话。此时的阿斯格正陷入一片无奈和沮丧之中。电话中，已经神志稍清醒的伊本万念俱灰，准备从桥上跳下。阿斯格一边竭力进行言语安抚，一边联系附近的警方前往阻止。最终，在阿斯格的努力下，伊本得救了。 关于阿斯格被卷入的那场官司的真相也浮出了水面。阿斯格在执法过程中，枪杀了一名19岁的歹徒。他已经同他的助手商定了明日在法庭上正当防卫的说辞。在经历了伊本事件后，阿斯格的灵魂感觉到了颤栗。枪杀那名歹徒并非是正当防卫，而是因为嫉恶如仇的他认为，这名歹徒的身体里也有一条无恶不作的“蛇”。整部影片都在屋内拍摄，一个男人，一部设备，不断地电话铃声，扣人心弦的故事和跌宕起伏的人性。这是一部礼赞生命的影片，诚恳而真挚，充满理性又不失人性的温暖。,,,0
28,28,27615398,罪人,cfe799c262ec4bf057bdace9c0afbb93,6b2570f000b8a3bfc6dbf5d80c83af34,4.0,2019-08-29 13:27:08,《罪人》 7.5 ① 繁复的，我就希望它更繁复，最好花团锦簇；简约的，我就希望它更简约，最好摒弃所有修饰。 一处地点两个房间，几乎全程独角戏，只靠台词就撑起一个惊心动魄的悬疑故事。《罪人》已经足够简单，但我还是不停想着，为什么不把那些在现场的「同事」也省略，转而用镜头代替呢？ 当然也有人比我更进一步，他们说，「为什么不干脆做成广播剧？」 好主意。 ② 就像以前那么多故事里说的，仿徨者开导另一个仿徨者，伤心人抚慰另一个伤心人，罪人通过拯救另一个罪人，完成了他的「赎罪」。 201811202,,,0
29,29,27615398,罪人,aae65982969e52c461c8a815b0aada75,f494bc676f9af4e5c4e3b8e0ff85a70e,4.0,2019-08-10 11:02:25,喜欢北欧的电影，画面冷峻清静，故事单刀直面。 想起曾经在冰岛度过一周，车子行驶在没有来往的山路间，广阔的山脉相随起伏，你极目所见的是羊群和草垛。生活在自然充盈的世界里有另一种寂寥，那种看似广阔实则无以倾诉的密闭。 故事本身简单，一个报警接线员Asger在接到一通奇怪电话后，认定电话中的女子被绑架。为了试图营救这位女子，他一步步将自我的情感迁入其中，并最终发现真相的故事。 所有情节的展开，都倚靠Asger的座机与手机电话；而观众，则安静地成为一名窃听者，和主角一起在声音的情绪中编造着故事的真相。 而当那位打来电话的女主角伊本成为主要的叙述者时，我们和Asger都会逐渐投入情感，天然地给与弱者同情，认为那位故事中始终未发言的男性是一位彻头彻尾的暴力者。但是导演却让故事发生了反转，他告诉我们人世的真相无法被单一地判断，所有的弱者与强者都情有可原，而任何一个个体当下的叙述，都无法反映故事的整体——只有亲身经历事件的人去自我发现，Asger扣动扳机的那一刻究竟出于恶或者善的动机。 这部电影的画面没有人间来往，Asger始终身处在工作环境中，却又做着超越了本职工作的事情。画面伊始，导演描绘了一旁吃汉堡等下班的同事，工作中接听私人电话的Asger被上司警告，这些细节都表明了Asger根本无法恪守规则的性格。紧接着导演并再无赘述，而是直接开始故事主线，让接线员Asger一点点剥离原本单调的身份。 随着情节推进，Asger从开放的工作环境走进封闭的办公室，这一空间的转换代表着他对于接线员身份的逐渐脱离，他不再是那个传递信息的话务员，而是想要守卫正义的勇士。 富有巧思的是，Asger并没有寻求在场工作伙伴的帮助，他清楚明白自己身份与价值观的对立。于是那个黑暗的办公室实则是他内心光芒的曝露，而此刻观众开始紧张，担心Asger越线的行为被发现，担心电话中另一条平行故事的主人公惨遭杀害。 北欧电影的最大特点，是冰冷之下的热火。Asger正义的血脉喷张对应工作伙伴的冷漠，电话中家庭的燃烧崩塌对应政府的不作为。尤其在与Asger电话时指派工作的女性，她始终专业而冷静，无功无过，但不近人情。 很多人说这部电影展现了主人公Asger的自我救赎，但我更多地体会到电影所展现的一种人性的温度，这种温度在彼此看不见的对话中更显得珍贵。让我想起人生的很多境遇，危难时刻给与援手的，恰恰是那些短暂谋面的陌生人。 想起伊本在电话中说她喜欢去海洋馆，因为在蔚蓝色海底行走的时候，可以享受无人干扰的寂静。这种寂静并非与世隔离的冷漠，而是每一种生命都游走在自己安宁的世界里，却彼此相关，来来往往。,,,0
30,30,27615398,罪人,4b350068e77f332f0b8134a58142d51c,c63e594c304c6dc4f2134f0a2cee9e0d,3.0,2019-06-16 22:09:30,很容易让人联想到哈利·贝瑞的《致命呼叫》。论故事张力，还是《致命呼叫》强，虽然漏洞更多。 以“电话”勾连一个故事，这种题材很多见了，《一线声机》（港版《保持通话》）、《来电惊魂》、《狙击电话亭》、《活埋》，等等，要玩出新意不容易。 基本是独角戏，对男主要求很高，他的演技还好吧，不如《狙击电话亭》的男主。 这个故事最大的亮点是电话中爸爸、妈妈的“嫌疑犯身份”的反转。然后就没什么可说的了。,,,0
31,31,27615398,罪人,c939035e348a79aefa812cf736ba1812,b1b49612d800509d4a91fb1538c8093d,4.0,2019-05-05 15:50:48,"【罪人】
真滴低成本电影哇   
一间屋子一个主演一台电话
全程是男主不断接听、拨打、保持通话的画面
靠通话的对白和人物情绪来不断推进的故事
所有发生的主体故事都得靠观众自己脑补
单一有限的画面结构很像【活埋】和【恐怖直播】
但个人觉得没有【活埋】第一视角的代入感强
就营造悬疑和紧张的氛围也没有【恐怖直播】好
本片而言
先入为主的保持通话的悬疑故事
开始让我觉得结构情节好像【致命呼叫】
但是过程中求救电话的bug太多  
没想到这些bug   
在故事的不断推进中也暗示了真凶的多重反转
“罪人拯救了罪人，最后被罪人所拯救”",,,0
32,32,27615398,罪人,2f91b597be985985a9d7fd5e5e7d1f86,5f3b9eb4730e482172bb0aa48ec11d07,4.0,2019-04-30 15:38:52,1、厄夜追緝令（Den skyldige，2018）中，照射在主角臉上的光色變換，從辦公室的白光，進入暗房後的冷色調光，到失敗後的血色光，以及重返辦公室的白光，說明了一段經歷自我（員警）、超我（英雄）、本我（罪人）再回復自我的過程。 2、性格決定命運，這一場紛亂起源於主角的衝動，哪怕是富有正義感的嗔。 3、主人公弄巧成拙。莊子逍遙遊有「鷦鷯巢於深林，不過一枝，偃鼠飲河，不過滿腹。歸休乎君，予無所用天下為。庖人雖不治庖，尸祝不越樽俎而代之矣」一句，意思是，古代的庖人在廚房裡的工作不只是切菜、炒菜、作筵席，還得負責殺豬宰羊，可是廚子都不做了，就在這罷工的時間裡，尤其祭祀這麼重大的事件時，該怎麼辦？廚子不去料理廚房裡的事，尸和祝這些要被祭的代表者或祝禮的儐相，需不需要穿著禮袍，爬過祭壇，翻過酒杯盤子，甚至於跨過陳列肉的砧板與架子，然後到廚房做菜呢？不需要。即使是天大的事，也不必緊急的代替著去做，因為社會最重要的就是各就最真實的自我去生活，不要越俎代庖，做了反成為社會的亂源。 因此，故事主角無可遏止的熱忱與擔憂，反而導致了更可怕的結果，還不如只做好轉接電話的紀錄工作。隨劇情揭露，觀眾得知他是習慣性的去介入與干涉，表現自我的膨脹，人間世所謂「所存於己者未定，何暇至於暴人之所行」，不是嗎？ 4、這裡可以留意一個結構的使用。從電影原名與情節中女精神病患者口中的蛇，兩項暗示指示著聖經中的典故：蛇在伊甸園迷惑了夏娃，夏娃隨後迷惑了亞當，電影故事的結構脫胎於此。,,,0
33,33,27615398,罪人,e68b1d9e73af516b02b4dcaec1d50467,954b32a0c1ace08056b00ef0f5eddfb6,4.0,2019-04-08 01:41:22,看过了《网络迷踪》（Searching）、看过了《解除好友：暗网2》（Unfriended: Dark Web 2），“电脑屏幕叙事法”就算体会得差不多了，这回的《罪人》尝试了一个“电话音效叙事法”。创意突破，悬疑反转，流畅精彩。 下放到报警中心工作的刑警男主接到一通女性求救电话，疑似被绑架。男主想尽办法定位、联系、组织搜救、甚至差遣自己的哥儿们，终于解决了问题。——全部场景只有两间报警中心办公室，全部戏份基本落在男主身上（其他同事基本属于背景），全部的故事都在一通又一通电话的对白和音效中推进发展。影片完成度之高，独角戏效果之丰富不单调，令人赞赏。此外，对正义执法、对警察暴力的反思，为影片奠定了扎实稳健的价值观基调。  PS：今年的奥斯卡外语片短名单9部，我看了6部: 《奥斯卡印象九分之六》,,,0
