,Unnamed: 0,电影id,电影名称,用户id,用户名,评分,评论日期,评论内容,有用数,没用数,回应数
27,27,30293828,中国合伙人2,664b7502bf3a3608c5607b8feb3c91ee,ccdb6f9f331e113c151fa3f1a07c64d3,3.0,2019-01-08 19:47:53,"励志的片子大多都是为了燃起人们奋斗的热情，鼓励人们去实现自己的梦想。
《中国合伙人2》是励志的片子，要给准备创业的人们泼一盆冷水。
故事聚焦的是疯狂的互联网领域创业。
我们经常看到互联网行业创业成功的例子，都是超级的财富，让我们自动过滤了那些失败的大多数。
这个行业本身就是疯狂。
一开始赵立新饰演的楚振辉就不停地来回奔走，埋头写程序，再到转变，坚持自己的态度去拒绝投资人，在事业出现问题的时候能够秉承初心，这才是创业者应该有的姿态。
不管会不会成功。
可能我们平常人羡慕的只是那创业的合伙人中的另外俩个，努力过，挣到过钱，这就可以了，不需要那么多野心。
那么疯狂起来是什么样呢？
为了表达这种疯狂的历程，作为三个主演中间的绝对主角，赵立新的表演也是疯狂。
我们好像有点跟不上他的进度，远远地跟着他往前冲，就像创业的路上，会有很多想不到的未来要去闯。
他不是流量明星，是表演的明星，每一次被谈及也都是夸赞他的表演。
好，只是好像局限在了一个舞台上，自己在用尽全力地表达。
像个领头羊，带着自己的合伙人去战斗，这就是合伙人，像战友一样。 我是章鱼看电影，欢迎关注，和我一起看完电影说八道",1.0,,0
28,28,30293828,中国合伙人2,fc3f8242c2143a5dbd469d0d32908923,ee12b0ffced7db3471e5c0b6c893aa4c,2.0,2019-01-05 20:52:14,无论作为一个创作者，还是创业者，经营者。楚振辉都是失败的。 第一点：太情绪化，影片从一开始，就处于一种焦躁，竭嘶底里的状态，我很难相信一个情绪时刻处于狂暴，狂怒状态的人，怎么去做好一件事情，或者做成功一件事情。真正的王者，是默无声息的。无论他经受多大的屈辱与打击，都会默默承受，然后默默强大，默默解决。而只有无能与弱者，才会让自己处于一种情绪化中，毁灭！ 这种在失败与挫折中的情绪宣泄，太多了。让人看不到一个创意创作者的气质与姿态！ 楚振辉的失败几乎是注定的！ 第二点，还是情绪化与弱智！ 其中有一个镜头，就是秦磊找来融资者，在嗨歌玩耍时，楚振辉，他根本就不是这个世界里的人。又表现出一种创业者的痴迷与呆滞。既然这样迫切需要自己的非凡网被认可，那为什么要在平时那般毫无理智地浪费时间与精力。发脾气，狂躁呢？ 这不是个成功创业者的表现！ 第三点：无一不犯了，金钱盲目至上的，一种绝望的感觉， 创业与创作，创意，在金钱面前就是个狗屁！  前段时间看的电视剧《创业时代》，似乎也是这种金融资本至上，为主宰！ 让真正有才华创业的人挺绝望！ 事实也许就是这样吧！ 知识就是力量，就是主宰的时代似乎已经过去。 人们不尊重人才，也不尊重创作，更不尊重原创！ 任何高科技都可以抄袭，甚至在创造者的前面完成！ 郭鑫年的魔晶就是个典型的例子。 现在树立楷模与天才的时代已经成为遥远的过去！ 发现人才与培养人才的时代也过去！人们的克隆抄袭水平已经跨越了一切！ 原始创作者，都去死吧！ 你们的孤傲与不识时务已经害了你们！ 然后，如何叫一个创作者走上创业者乃至经营者的路上呢？ 真是充满了困惑与无奈！ 这是个迷茫失去方向的年代，分工一边要精细专业，一边又要经营世俗，中国的创业人，太艰难了！ 但中国有钱人的资本都怎么来的呢？ 不是靠原创，靠研发，靠真正的创作者，真正有才华的人挣来的。 而是靠着垄断，与国家得来的。‘不是所有，但是大多数！这是个悲哀的现象。 这也是中国在中美贸易战面前，不堪一击的主要原因！根本就没有拿的出手的自己的产业，自己的产品，唯独金融资本！,1.0,1.0,0
29,29,30293828,中国合伙人2,1146cde07acbfcf3a47db4ca39eac8d0,255e03a1c5acd992af839024f2919b5e,1.0,2018-12-27 11:31:29,说实话因为中国合伙人1和赵立新的原因开始还抱着希望看到一部好电影的想法来观赏，结果就想吃了一大碗翔。什么TMD局外人看不懂，什么创业的过程你不知道，我只知道电影是一个给大众看的东西，一个故事能深入浅出，清晰明了的讲好的电影就是好电影。其他的特效，明星人气等等都是附加上去的。在这里我就想问下：这部讲清楚了吗？整不电影中我只看到赵立新神经质的在一个个场景中，与人对话被打断，然后整个场景按下暂停键等主角演讲时就被拍死。你想讲什么，你的困难？你的挫折？你创业的艰辛？你坚持的不易？能不能就一个主题讲清楚下。可是整部都没看到一个完整的故事线，然后就在评论区里看到一大波所谓的程序员，创业者跳出来说这个东西你们局外人看不懂，你妹，全中国14亿人口，你们才有几个，绝大多数都属于你们口中的局外人来着，我们看不懂，不喜欢还不能说了。一部好的电影就是把一个个好的坏的故事让普罗大众能看懂，而一部烂片就是大家都看不懂然后一堆SB就跳出来说你不懂！！！,11.0,1.0,2
30,30,30293828,中国合伙人2,e2df8caf67091f2b8f514952ceb0f4dc,6c92285fa6d3e827b198d120ea3ac674,3.0,2018-12-23 16:29:48,作为一个程序猿创业者，不仅是梦碎的时候，人会心塞，更有随时处在崩溃的边缘，内分泌失调是100%的，猝死率也在各行业稳居第一。 作为一个资深的小编辑，写文贵在真实，贵在传播社会的良知。不是一味的吹捧+无限流就算是符合人口味的小说。而是根据个人的经验所得融入进他人的故事构成一种不空洞、不夸张、趣味性十足的逻辑质感。 怎么说，创业时代的翻版算不上，想比于创业时代，演员们的表演还不算太浮夸。那么究竟是什么原因导致了3.2左右的评分呢？（个人感觉应该是3.2） 是票价太贵，像这种烂片哪个导演敢说自己没拍过？蓄意的电影有什么值得人评价的地方？,,2.0,0
31,31,30293828,中国合伙人2,2e8f97a911144f04f6658fc209e0229b,28c1e37e317b935a387dbe232bc9f803,3.0,2018-12-21 23:44:58,本片再次让我意识到，演员个人演的再好，最多也只能影响到最后呈现质量的20%；如同一个软件项目，起决定作用的不是程序员一样。多么遗憾赵立新凌潇肃这样的演员没碰上好导演好本子。 以一名程序员的眼光看来，主要人物设定和剧情经不起推敲，社交障碍技术极客突然变身路演明星？三角形明明最稳定，可这仨合伙人也太不均衡了吧？为啥要有那么多KTV和迪厅情节？感情线很假很鸡肋，倒叙插叙有何必要？最后问题危机怎么解决的，资本家又又又又被情怀打动了？...... 天时角度上讲，碰上ofo事件，为了情怀理想一意孤行的创始人太不讨喜了，确实拉别人陪葬不负责任啊！ 不过目前4.2的评分太低了。 最后，在中关村美嘉看着电影里十几年前的中关村大街，挺好玩的，感觉自己透视眼了似的。不知是否时间滤镜，那会儿的理想色彩和野蛮生长突围还是令我羡慕，我为什么从来没有那种认准某个方向一路死磕的决心呢？,,1.0,0
32,32,30293828,中国合伙人2,1ebaf087a3e644d3f2b22afcb68e67f9,469a32447498e6238dab042c08098b98,2.0,2018-12-21 18:26:50,评论电影好坏总有很多种标准，但对于门外汉来说这是不是一个好电影主要标准就是是否给我们讲好了一个完整的故事。 豆瓣评分2星，猫眼5.8，由于影评还不多顺路粗略地看了一下《中国合伙人》的影评，其间发现了很多影评里对比了《合伙人》和《社交网络》二者，又抓紧时间补了一遍《社交网络》，然与本文关系不大暂略。 既然如此，那我们也对比着看《中国合伙人》总体节奏紧凑，开头进入节奏快，三个主人公的介绍以及人物设定简明扼要。至于几次闪回相关手法（例如签证/谈判）都用得没有让人觉得突兀，且几名主人公发挥不错，杜鹃让人惊艳，配乐用心让人难忘以及“燕京大学”“美国大爷”等取景体现出的年代感都让人印象深刻。抛开故事价值观，主人公口语等一些细节，总体是个让人看完觉得很不错的故事。 《中国合伙人2》来了，前些天和家人一起看《无名之辈》时看到了《合伙人2》的片花，提到说好像是雷军为原型的故事，由于第一部建立起的好感，并没有犹豫就买了票，然而真的不能用差强人意来描述我的感受了。 都说赵立新老戏骨，然而从开头故事到强行进入会议室我都一直在努力把楚的行为向正常人靠拢，不说知识分子或是程序员或是偏执人格的定位，我真的不知道世界上有没有这种奇怪的人存在。好吧憋坏了酒吧发泄去了，毕加索梗来了，给一星的都说一星给在“毕加索”上，我实在不敢苟同，确实笑了，尬笑。 后面被收购，不开窗，追签字合同，修电脑，换办公室一些列故事说好听点像是在无止境的挖坑，说难听点真的是不知所云。当然片尾办公室给了个镜头圆上了，虽然还是没说明白吧。为了自己继续能够沉浸在观影状态中只能把这些理解为导演试图让主人公形象立体起来，或是埋下了梗留待后文呼应。 其间和苗小丰打了乒乓球，可能把苗小丰的离开视作叛变行为，后面对其的挤垮直至他的自杀可能都是为了烘托主人公最后侃侃而谈的“坚持”，感觉或多或少有些牵强。其间秦带着楚一起去拉投资，嚷嚷+切歌+自己恋曲1980大概也是要突出一下人物性格特点，但还是不合逻辑。不仅楚不合逻辑，秦的反应同样不合逻辑。自己all in与楚合作创业，辛苦公关付之东流就一句话“钱难赚屎难吃”，然后继续合作？这恐怕也不太合理。 正好说到秦磊，不说的话可能都快忘了他是干啥的了，所以到底是干啥的？楚原部门里的死忠？“总有一天你会知道我想要什么”，所以要的是什么？尊重or平等？前者的话ktv切歌怕是变本加厉地蹂躏尊重二字了，平等就更别提了，楚是连长是核心竞争力，凭啥平等……江湖义气？等等，你和楚说江湖不怕他切你的歌吗？ 至于徐的定位本来应该是故事的梳理和串联者，然而并不尽如人意，但是平台有限，发挥有限也是情理之中。 最后爱情线实在是让人摸不着头脑，我可以理解陷入工作无法自拔忽略了身边人的感受，也可以理解对方说离开时因为恼羞成怒把她推倒在地，也可以理解面试公司意外邂逅时的尴尬和些许无地自容。可最后重逢时候一直心里惦记着她还差点儿睡一起是啥意思啊？对方也一直惦记所以干柴烈火了就开房办事儿了？然后想起过去种种又觉得不妥又贤者了？然后聊半截公司一个电话又给叫走了？无巧不成书可以，可这波重逢燃烧激情又突然烂尾是想讲啥啊？ 可能还有些暗线想说比如开始照相闭眼后面睁眼了之类的，不知是不是想暗示楚当前的状态，总之有些过于露骨却又寡淡无味。 最后总结一下还是觉得从头到尾没看到一个完整的故事，全程东一榔头西一棒子，我们不知道故事的主人公是个什么样的人，也不知道故事要告诉我们什么道理。也不知道里面埋下的伏笔该去哪里找答案。总之既没有完整的故事，也没有合理的逻辑，像是看了乏善可陈的一篇烂尾剧。 就像那部《邪不压正》。,4.0,,0
33,33,30293828,中国合伙人2,c1c300bfaaef14bc29ebc4ebc4ae4cf1,8f65de38f3e428176563572aa36c9704,3.0,2018-12-20 15:59:12,《中国合伙人2》是一部讲述互联网创业的电影，而第一部是教育事业，所以两部没什么关系。现在这种剧情还是挺多的，所以感觉反响平平，首映才破百万。说到这部片起其实按照正常情况来看是赶制出来的。首先这部电影几年6月份才开始拍摄，两个月之后就杀青了，时间上面对于其他精心制作的电影来讲短了点，所以感觉有点赶。其次后期制作也很赶，所以总体给人的感觉就有点混乱。 　　《中国合伙人2》讲述的是程序员徐顺之为追求梦想创业的故事，据说原形是雷军，但是很多看完电影的网友觉得更像刘强东。而且好像主角有点混乱，前后不搭，被吐槽是流水账式创业故事，为此豆瓣评分很低，才4.2分，跟第一部的7.8分想比实在是差太多。当然了还跟这部电影的宣传有关系，它的宣传是为了改革开放四十周年向上的作品，所以很多人都没怎么关注，再加上除了赵立新比较有名其外，其余都名气不大，因此票房不高   　　同档期的印度电影《印度合伙人》都比《中国合伙人2》票房要好，可见这部电影有多糟糕，现在口碑这么差，那谁来背这个锅呢？很多人觉得导演编剧和演员都要承担。首先编剧写的这个故事太普遍了，没什么激情，不能带动人们的情绪。其次演员不是流量明星，还有赵立新这为老前辈用力过猛，使得观众产生错觉分不清主次。第三导演的关系吧，新人没有陈可辛这种老前辈的经验，所以整部片子让人感觉太混乱了，导致票房升不上去，希望后面几天你那个有所转变，你们觉得呢？,,4.0,2
34,34,30293828,中国合伙人2,d4817ebb032d12ec9e9bb367a0758f2d,a693348ca2a7d546a197c055e12a9db3,3.0,2018-12-19 16:28:24,"《中国合伙人2》上来看的有点懵圈，各种情节的拼凑加上赵老师神经质般用力过猛的演出，感觉自己在看一部极具蒙太奇手法的话剧。但是也要承认影片各种服化道做的还是很用心的，充满了年代感。但是已经50岁的赵老师演起来年轻的楚振辉总有种少年老成的错感，再加上臭硬臭硬的过力演出，看着非常出戏，而且前半部的楚振辉做为程序员居然不写代码，天天喝酒、打架、泡妞。不仅想问“你们到底在演什么?"" 等到后面电子商务网站非凡网面世，中关村卖电子光盘起家，融资后要自建物流，而且把竞争对对手都数落了一边：天猫，淘宝，国美，苏宁，当当网，易趣网，卓越网，中关村电子，唯独就剩下一个京东，哈哈，原来你们讲的是刘强东啊！我可是看过《创京东》这本书的，京东的早期投资人是今日资本的徐新，跟非凡网的投资人徐顺之一个姓。你们讲的也太隐晦了，绕这么大弯子，上来先开发操作系统要代替微软，我还纳闷呢，中国到现在也没有一个成功商业化的自主操作系统，不管是PC还是智能手机，这个楚振辉是虚构的吧。因为东哥创建京东之前的唯一一次创业是开饭馆，虽然再之前也编过几套程序，但都是别人外包给他的。另外他们那个时候就讲”金主爸爸“，这个词应该是穿越了吧。 还有一点跟东哥比较相近的是楚振辉老大不小了一直没有结婚，还被媒体问起。东哥也是在自己40岁游学美国哥伦比亚大学的时候才认识了自己现在的妻子”奶茶妹妹“章泽天。写到这里不禁想起最近网上又被热炒的”插刀教“的事，其中一位网友评论说：印小天是不是好人我不知道，但是我相信刘强东，因为东哥说过”小天是我见过的最纯真的女孩子“。哈哈哈，笑死我了！但是感觉东哥一直是比较稳重的，没有赵老师演的这么神经质。 知道是刘强东的故事以后，后面的理解一下顺畅了许多，因为京东的B2C+自建物流仓储模式确实非常重而且利润薄，虽然市值节节攀升，但是一直在亏钱，所以也承受了业界的不少质疑。片中的楚振辉和非凡网也因此一直承受着投资人带来的各种压力，尤其是出现了供应商假货门的严重信用危机之后，即将上市的非凡网忽然面临着要倒闭的困境，如山的压力铺面而来。正在创业中的我这块还是很感同身受的，影片才渐入佳境，尤其是楚振辉的最后的两次演讲还是很精彩的，一次是违章停车后对自己的两个创业的兄弟秦磊和徐顺之，三个人对合伙人有三个理解：秦磊的理解合伙人就是朋友，忠诚且平等；徐顺之理解的合伙人就是责任，为了完成共同的目标而负责；而楚振辉理解的合伙人是战友，要一起打仗，打败仗的时候他作为连长要带领战士突围，甚至不惜牺牲自己来保全战士。这句还是令人感动的。我没读过MBA，没法告诉大家谁说的对。但他们还是基于自己的地位和立场来说的，所以个人认为”合伙人“应该三者观点的结合体。第二次在影片要结束时楚振辉对媒体的演讲，”当我把第一张光盘、鲜花和巧克力递给我的第一个客户时，我就没有退路了，只能一直走下去，直到自己什么也做不了""。创业之路无比艰辛，很多无法想象，无法预知，创业者是这个世界上最艰难的职业，是值得尊敬的。作为一个创业者我已经半年没有任何收入了，一直在投入，但是孩子（公司）已经出生了，我只能继续坚持下去。 后来的刘强东又发生了很多事情，14年京东上市，后来东哥结婚生子，京东越做越大，成了中国仅次于BAT，位列互联网公司第二梯队的领头羊。东哥也是不断回馈家乡、母校和社会。虽然后来的“性侵门”出现的有些狗血，但现在还没宣判我就不多说了。但就影片而言刚渐入佳境，熬过“假货门”就嘎然而止了还是很遗憾的。",6.0,5.0,14
35,35,30293828,中国合伙人2,fbc0de31a7123b1054617b52a11ac1fb,d694965c421ea81c6867db6ecbf9bdd5,2.0,2018-12-19 15:03:07,满屏恶臭的电影，最讨厌赵立新的角色 这个故事反应了很多创业人的现状。初期、跟狗一样求投资，只有自己的情怀，要个钱还牛逼哄哄的。 成功高峰期飞扬跋扈趾高气昂，自己是连长，其他都是兵，错都是别人的，不思悔改。破产期特么为了自己的情怀不顾队友怎么活。最后开个发布会还要卖弄情怀，供货商钱赔了吗，假货顾客赔偿好了吗。 投资人说的对，一个假货就把你这网站弄死了。知道风险存在，一点风险预估都没有。他们三个人的成功，只有投资小哥和要钱小哥自己有脑子。知道目标在哪，自己要干什么，赵立新的角色从头到尾就是梦想，情怀，作为创始人最应该有的前瞻性和决策力完全没有。 唯一一次还是在办公室当着员工面吵架，说连夜出公关稿。那位女总监，公司出了事，没有应对方案，等着老大发话，一路跟着不像是总监，像是前台 这里面最重要的投资人的部分，全篇感觉要塑造成反派，最后还要被那几个创业者diss。 这部电影里故事的成功，偶然性太高了，并不是他对市场预估的准确或是重要产品的诞生，就特么就最开始的1kw帮的忙。至于背后是不是很有头脑，我看不到，至少电影没说出来 这部电影尴尬的地方，就是不是互联网的人没共鸣，互联网人觉得业余,2.0,,2
36,36,30293828,中国合伙人2,4463d330dec76336379c8c58a110eb24,c65de1b43288f7b1bd026662bebeac1e,1.0,2018-12-19 13:14:35,中午去闲着没事儿看个电影 太没劲了 追着一张纸跑 人长得都差不多 认认真真睡了一中午 凌潇肃不错 这里面最突出的形象 真的好没劲 下次看电影一定要先看看评价再去 真是看电影 白花了我30多块钱 真的是太垃圾了 为什么要超过140个字呢 我对这个电影没什么好说的了 剧情就是创业很艰难 又没拍出爆点 一开始说不让同情 就是陈述故事 可是这个故事 太没劲了,5.0,,0
37,37,30293828,中国合伙人2,8a3484ed76feb2f72554916344ad6564,d9754cbf72f827300b36a055de5fa2fa,5.0,2019-02-04 04:10:43,很久没写影评了，看到心目中的好片被锤的稀巴烂，实在忍不住想叨叨两句。 嗯还是再来段题外话吧： 20世纪八九十年代据说国内电影界，关于电影，人们会聊的更多的是哪个导演得了什么奖，但如今呢大众对电影的评价似乎更多取决于谁的票房高 请的什么电影明星谁就是好电影。 二三十年前，精英不仅垄断了话语权，更是唯一有消费者的群体，从某种意义上来说电影就是拍给他们看得透，能满足这些人的胃口，听父辈说起来仿佛那是个人人都在读尼采的书，念北岛的诗的年代。 但三十年的经济高速增长，一张电影票只要四五十块钱，但消费主体改变了。这就导致了一种现象：大众在拼命消费大众在拼命吐槽。人们不喜欢一些深邃复杂的东西，就喜欢简单直接。  好了打住，切入正题： 为什么在我的视角里这是一部被严重打偏分的电影 来首先聊聊电影自身的角度，略看了下豆瓣影评，大致说剧情混乱，镜头穿插的毫无头绪。 这点盘的其实并没有逻辑，电影中刻画的人物楚振辉从一个低情商的程序员，不懂social技巧，对不喜欢的投资人随意反驳自己的人形于颜色。丝毫没有城府，到后来在第一次记者咄咄逼人采访下，面露微笑巧妙的避过记者问题中的雷坑。 从一开始经历挫折一绝不振倒后来面对公关危机临危不乱。   一条完整的人物成长线已经刻画出来呀。在诸多磨砺 甚至说深陷绝望都不为过。经历恋人离去，经过六年的努力红中本可以翻盘的却被领导层否决，投简历被筛，生活一片窘迫，真可谓是经历到绝望了。到重新创业从零起步跪着挣钱被城管赶，去女生宿舍送光盘。。 至少对于像我这样一个经历过绝望的人真的太真实了太容易引起共鸣了。  好聊感情线，低谷时期碰到深爱的前女友的窘迫，高峰时期滚到床上了却戛然而止怀疑眼前的女人到底喜欢自己哪一点。不愧是老戏骨，这演技可圈可点不服不行，那些流量偶像明显能比吗？ 再聊系统聊聊价值观的传递，看到豆瓣人聊的挺令我诧异的。有人评论作为决策者的楚没有前瞻性，为了一己私欲个人情怀而坚决不出售公司导致供应商拖欠， 是可能最近网上沸沸腾腾的ofo戴威的一票否决权打烂了所有的好牌，由于情怀葬送了ofo大好前程，惹得一番众骂。 但你知道案例还原过程中，戴威的决策战略定位是坚决不出学校吗最后还是屈服于资本。 为什么不聊facebook扎伯特20亿没能出售股权。 创始人没有情怀不懂坚持不懂隐忍搞笑呢，你去跟投资人聊你的计划：五年公司争取上市，然后光荣套现移民海外。 你看有人会投资吗，即便你手上有一手好牌。 不可能的。 在投行里大概没人不知道那句：投资就是投人。 电影中很多细节都耐人寻味，值得人去思考： 公司股东的定位，一起打江山的兄弟和空降高管间的左右派问题， b2c与情怀和信用飞轮间的关联，股权结构主次的重要性，股权反收购。那再说个简单一点也是最难的，你看影片中的楚振辉低情商，但反过头试问现在的年轻人们有多少人可以做到不露声色，面对价值观不合的投资人 合伙人不喜欢的人面前，还能沉的住气？ 包括我在内我也做不到。 影片中多次出现的台词看山又是山，相信各位看官并不陌生。出自佛经中的“看山是山，看水是水，看山不是山看水不是水，看山又是山，看水又是水。”  他诠释的是人看待一件事物的三种境界。  我想这也是结尾导演想表达给观众的意思吧。,14.0,8.0,8
