,Unnamed: 0,电影id,电影名称,用户id,用户名,评分,评论日期,评论内容,有用数,没用数,回应数
18,18,4058933,一个明星的诞生,001f229f260137806c2264ebcb2985c7,78742eedcf1ea7887a77e9377f34532c,4.0,2019-01-15 19:00:16,"或許音樂電影對我來說總有種難以言說的魅力吧，平時不太看爆米花電影的我，只要接觸到音樂系列的電影，無論形式總是能讓我著迷，尤其只要歌曲深得我心，基本上就會一股腦兒的陷進去。 回想當初深陷 Adam Lavine 在《曼哈頓戀習曲》中的魅力後，播放清單維持了好幾個禮拜就只有一首&lt;Lost Stars，而午夜夢迴之際，總會想起 Dan 和 Greta 那段藉由”音源分享器” 而加深的友誼，也總會希望在現實生活中能遇見如此的友情甚至是愛情。 再次出发之纽约遇见你 (2013)8.62013 / 美国 / 喜剧 爱情 音乐 / 约翰·卡尼 / 凯拉·奈特莉 马克·鲁弗洛  Begin Again9.1Various Artists / 2014 而論《一個明星的誕生》的故事本身，其實對我來說是比較沒有吸引力的，說起來，他其實就是由幾個大型MV拼接而成的音樂電影，而主角 Lady Gaga 的光環及歌聲基本上照耀了全片；換句話說，這部片簡直可以說是單純的「Lady Gaga的誕生」紀錄片，除此之外並無其他。 不過值得一提的是，本片由 Bradley Cooper 根據 1937年的《星海浮沉錄》自編自導自演，而該片已經歷了多次翻拍，分別在 1954年 及1976年；由此可知，這是一個美國人非常喜歡的劇本，然而，一個已經被拍爛的劇本要如何拍出新意大概是這部電影能在 2018年年末 驚豔眾人的原因所在了。 本片與最初的版本最大的不同在於，本片的背景設定由原先的好萊塢改成了搖滾樂壇，而其餘的故事以及轉折則並沒有太大的差異。 一个明星的诞生 (1937)7.11937 / 美国 / 剧情 / 威廉·A·韦尔曼 杰克·康威 / 珍妮·盖诺 弗雷德里克·马奇  一个明星的诞生 (1954)7.61954 / 美国 / 剧情 爱情 歌舞 / 乔治·库克 / 朱迪·加兰 詹姆斯·梅森  一个明星的诞生 (1976)6.21976 / 美国 / 剧情 爱情 音乐 / 弗兰克·皮尔森 / 芭芭拉·史翠珊 克里斯·克里斯托佛森 關於電影本身，我想說的並不多，而且我相信本片刮起的風潮大概也讓大多數的朋友們都觀看過了，所以在這裡我只是想提一些我在本片中特別喜歡的幾個元素，與你們分享。 第一個讓我特別喜歡的部份，也是全片唯一一個讓我感動的片段，是當 Jackson 向 Ally 求婚時用吉他弦拗製的戒指。  我突然發現，好像很多的音樂電影都會有一個信物，好像是想以此將人們與音樂及生活串連起來。如此說來，音樂其實是一個看似很虛無的存在，很像裝在氣球裡的空氣，你好像擁有它但卻也未曾擁有過，你需要把“那東西”裝入氣球裡，再用一條線狠狠地綁緊了，也才能握在手上，好像你擁有它一樣。所以，人們與音樂其實既親密又疏離，有它陪伴你得以活下去，可沒有它卻好像也死不了；基於此，在音樂電影中，好像總是需要某個物品，讓音樂化成一種形式，讓電影中的人們能夠緊緊握住那樣東西，好似音樂總是伴著他們左右。  像是《曼哈頓戀習曲》中，將 Dan 和 Greta 串連起來的“音源分享器”，還有《曾經，愛是唯一》中，將兩個陌生人串連起來的“吸塵器”，以及在本片中，將兩人的愛情套牢的“吉他弦戒指”。也許是我太浪漫了吧，或者其實「音樂」無形之中影響了我的人生很多很多；我總是特別喜歡音樂電影中表達愛情的形式，不溫不火卻能讓我感動很久，總是希望導演在片中想出的伎倆，有一天我也能用在現實生活中，並且另一半也能懂我的感動，每每這樣想起來就能讓自己又再感動了一次。比如今天，我在寫《一個巨星的誕生》的觀影心得，寫著寫著忽然想起了《曼哈頓戀習曲》中的那支「音源分享器」，也就臨時決定再重溫一次總是能讓我在最後五分鐘熱淚盈匡的電影了。 音樂之於我，大概是一種浪漫的形式吧，而我也總是希望我的另一半能理解我的感動，雖然很難，可是心中仍然會奢望如此一般的感情能夠發生在自己身上。  而第二個我很喜歡的段落，是 Jackson 和 Ally 在天臺上一起看著 Ally的巨型看板時的對話。 那時 Ally 正在準備演唱會，大概是對自己的不信任，讓 Ally 始終無法敞開心胸接受自己正準備登台演出的事實，那時 Jackson 溫柔地將 Ally 摟在懷裡，並說著：「All you got is you, and what you wanna say to people. They are listening now. They’re not gonna be listening forever. Trust me. So you gotta grab it. And you don’t apologize, you don’t worry about why they’re listening or how long they’re gonna be listening. You just tell them what you wanna say. Cos how you say it is the stuff of angels.」 聽到這段話時，連我都全身充滿了力量，我忽然明白原來「溫柔」可以是最強韌的後盾，他能夠讓人擁有征服世界的勇氣與力量。 前陣子深陷寫作瓶頸的時候，我特別在意別人的目光，再加上一直以來的自卑感，我不僅無法說服自己擁有的能力，甚至開始懷疑起自我價值；很多時候，我覺得自己的文字沒有任何魅力，儼然是失去靈魂的存在，因此也就越來越不能理解為什麼會有人想要閱讀我寫出來的東西，以及別人又會怎麼看待這樣空洞的文字。 Jackson說的那段話，正是所有我經歷的，我曾經對我的讀者感到抱歉、也曾無法理解別人閱讀我的文字的原因、甚至也會去擔心讀者的離去…，因為我無法相信我自己。  很久以後，我終於靠著自己走了出來，雖然一路走得踉蹌，但我很高興現在能夠開始相信自己，而我也相信如果 Jackson 能夠提早出現在我的人生裡，那我大概能走得更快也更順遂。 所以我想對不相信自己的你說：「你就是你，所有你該擔心的就是：『你是不是以“真正的自己”活著。』你不需要過度在意別人的眼光，因為那些人不會一直在你身邊，所以你真正必須做的就是“活出自我”，因為你很棒、非常棒了。」 藉著 Jackson 的那番話，我們互相鼓勵，因為我們都是獨一無二的個體，而每一個我們都已經夠棒了。",9,,3
19,19,4058933,一个明星的诞生,8f7372fe8aa5a06ed8087fcb8246acfa,fa3d633cb3ccf365430b4ef710849e40,4.0,2018-11-23 16:03:21,"当我19岁时决定成为一名音乐家、歌手、词曲作者时，我是真的想做到。我拖着我的钢琴走遍整个纽约到处敲门，我真的相信自己。 当华纳宣布Lady Gaga加盟[一个明星的诞生]、担任女主角时，争议就已经开始了。 有人表示信不过，还是老老实实蹲录音室去、把说好的新专弄出来再说吧(怨念脸)； 有人看过她在“美恐”第五季挑大梁，觉得这片儿的期待值，一下子变得更高了。 [美国恐怖故事：旅馆]，抱走73届金球奖迷你剧/电视电影最佳女主角 任你们怎么说，这回Gaga的战绩惊人，被[时代周刊]纳入今年的十佳表演，明年有望提名奥斯卡。 除了出演剧集女主角，以前她还客串过[黑衣人3]、在[辛普森一家]里配音过自己、在[罪恶之城2]演过配角、拍过自传纪录片[嘎嘎：五尺二寸]，等等。 剧情片女主角，这还是第一次； 而首次尝试就能获得如此高的赞誉，更是难得—— 短暂的经验、惊人的天赋、满腔的热情和自带的光环，对她来说已经足够。 《纽约时报》作家曼诺拉·达吉斯评价：“Gaga这次的真实呈现，使女主角艾丽更真诚可信、更具夺目的品质——她这个角色，成为了本电影主题中的首要原则。” 大家早就猜这片会像个长长的MV——也没错 Gaga在电影颁奖季的斩获，大多都是歌曲方面的； 这次当然也为大家开了嗓，不过更闪耀的、将会在之后各种典礼大放光芒的，会是她的表演。 电影中，她饰演一名因不会表现自我而不得志的歌手；她爱上了摇滚明星、并在他的关心和帮助下终究取得成功。 三十多岁的女主角艾丽，多年来被人拒绝和否认，早已放弃了音乐追求； 而Gaga自己说：我和艾丽，是完完全全不同的。 她的斗志，永远都不会消失。但那些坎坷，她不是没经历过。 ① 开唱，释放独特的起点 “当我19岁时决定成为一名音乐家、歌手、词曲作者时，我是真的想做到。我拖着我的钢琴走遍整个纽约到处敲门，我真的相信自己。” Gaga十一岁时被送到圣心修道院，曼哈顿上东区出名的私立天主教女校—— 她的父母从下层阶级奋斗到富裕的上西区，深知教育的重要性； 但作为一个好学自律的学生，她与同龄人的格格不入还是招来了麻烦： 她喜欢晒很黑，她留着奇特的发型，她长了两根异常粗的眉毛……她缺乏安全感，被同学嘲笑“挑衅又过于古怪”。 “你是拉拉吗？你上学为什么要扮成这样？你真是个荡妇。”无情的欺凌，从那时候就开始了。 Gaga最早频繁进入公众视野，就因台上台下的奇特造型 一开始她甚至不想上学，后来她明白了这都是自己前行的动力。 还好，像电影中艾丽的父亲一样，Gaga的母亲很重视艺术文化—— 父母鼓励她追求音乐事业，从小给她报钢琴课、创意夏令营。 在这些地方，她找到了属于自己的热爱，她拿起麦克风开始唱歌，她参加演出活动。 她在还够不着钢琴踏板的时候，就开始弹琴了，音乐对她来说，是这么有亲和力，又这么得心应手。 她是天生的音乐家，她从小就知道。 强大的能力是掩饰不住的——像片中一样，她当时的事业发展如过山车 从纽约大学著名的蒂什(Tisch)艺术学院辍学后，她很快被环球旗下的嘻哈厂牌戴夫·杰姆唱片公司签下，却在三个月后解约—— “我这样的，不适合他们。” 她一度在酒吧表演露骨的节目，最低落的时期也磕过药； 后来在当时男友的介绍下，开始为新街边男孩、布兰妮等歌手写曲子。 08年，在为自己写的歌录和声的时候，她被R&amp;B巨星阿肯发现，并迅速签约。她的时刻到了。 22岁的Lady Gaga，第一张专辑，就让流行音乐评论界乃至全世界，炸开了锅。 这张封面，想必大家都很熟悉了 浅金色的雪儿式假发，连着兜帽的猫女服，背景里的工作人员穿着发光套装开起了迪斯科舞会—— Gaga颇为另类的横空出世，证明她不仅有大热单曲，还有绝对碾压的舞台风范。 她一夜成为了传奇人物： 人们再也不可能忘记，她怪奇的造型和重锤般的声音。 那个从小就是异类的姑娘，一举腾飞成为了流行天后。 她却仍然清楚地记得，如自己饰演的艾丽那样，她也一直被人说：想做流行明星？你还不够漂亮。 淡妆的Gaga，谁说不好看来着？  在《周六夜现场》的恶搞，nerd造型也很萌 Gaga心中的毕生偶像和业界标杆，是麦当娜和大卫·鲍伊—— 都是另类造型的鼻祖人物，都以胆大敢尝试、敢挑战、敢打破传统著称。 同样遭过千夫所指，同样坚持自己的风格，绝不妥协。 Gaga和麦当娜致敬鲍伊的闪电造型 近年来忙于为平权发声，Gaga多次进行公众演讲，呼吁女性、LGBTQ+群体等维护自己利益； 我们看到更多素颜模样的Gaga，我们听到了更多她心底的声音。 夺目的不再只是她逐渐收敛的造型，而慢慢变成了她的人性力量。 无论Gaga在做什么，她都如同一记炸弹，影响力巨大。这些，我们都很熟悉了。 2014年，“MeToo”运动还没兴起时，她公开讨论自己19岁曾遭强奸，并因此患上创伤后应激障碍，接受过精神和物理治疗； 是医生、家人和朋友帮助她度过，是她与粉丝、与整个世界互通的爱，支持她前行。 这可能是学院典礼见证过最美的表演之一 2015年2月的87届奥斯卡，Gaga在典礼上唱起了[音乐之声]主题曲，致敬电影公映50周年。 这次的表演，震惊了评论家，震惊了全世界。 那些多年来批评她穿着、说她徒有夸张表现的人们，见识到她这温柔又掷地有声的一面后，终于学会了暂时闭嘴。 那天，她像个仙女，带所有人回到了听修女玛利亚唱歌跳舞的年代。 当然，也有人非得在意她的纹身等与这次表演无关的东西，没茬也得找点儿茬出来。 这些人，在Gaga的面前，大概连路障都算不上吧。 ② 触电，一个明星的诞生 片中的艾丽，因与男主角的爱重新找到了活力，在他的帮助下被打造成了一个绝对的明星； 而这部电影的诞生过程，无疑也是Lady Gaga本人，在布莱德利·库珀的帮助下，被打造成一个电影明星的过程。 电影中两人相遇那段，其实就是来自库珀第一次遇见Gaga的场景： 一朵玫瑰一首歌，确认过眼神是爱上了 本片还在筹备期间，库珀参加一个慈善活动，听到Gaga在台上演唱经典歌曲“玫瑰人生”(La Vie en Rose)； “余音绕梁啊。那是好几年前了，我当时甚至不知道她是谁，只想着一定要找她谈谈。” 这段奇妙的相遇，她让人一眼难忘的特别，也被直接用在了电影的开头。 Gaga的歌声，两人之间的火花，使这个场景铿锵有力，温暖、魅惑又动人。 她的光环，在黑漆漆的地下变装酒吧里，耀眼得让人难以直视又挪不开视线。 而这一段，也不是他俩的经历中唯一一段被放进电影里的。 在Gaga家时，他们就弹琴唱歌 正是那天的“私人演奏”，被最终自编、自导、自演本片的库珀，用手机录了下来—— 因为Gaga没有主演过电影，后来有那么多制作人对选她都持摇摆态度； 每每这样，库珀就拿出这段视频给大家看，自然，说服力极强。 不知道给多少人看过了之后，他终于让所有人都明白，Gaga就是最适合演艾丽的人选。 靠这几分钟的随心开唱，向来在歌声里灌注情感的Gaga，迅速打动了所有人。 那次弹琴的下午时光，也同样被用在了电影里——才华迸发一刻的完美记录。 表演方面接受了库珀的帮助，演唱方面她也主动提出想法 Gaga建议不要“对口型”不要预先录制，“因为大家都看得出来啊，当然要现场演唱了。” 高要求带进剧组，库珀也很同意—— 于是进行了声乐训练之后，他们去了全世界规模最大的格拉斯顿伯里音乐节，在一个货真价实的摇滚舞台上完成了几十分钟的拍摄。 库珀不敢相信自己在八万人面前唱了歌，同时也更对Gaga佩服得五体投地。 “这片儿拍得，也太值了……” Gaga：别看我巡演了多少年，其实我看着库珀在那儿弹吉他嘶吼的侧面，心里也很紧张很害怕啦。 一开口还是震慑全场 卸了妆，洗了发色，不加修饰的Gaga，用这部电影告诉大家，她生来就是要闪光的。 在试镜过程中，亲自替Gaga擦掉妆容的库珀说“我爱上她的脸，她的眼睛”，现在我们也都看到了他所看见的： 她的歌声，她的情感，她在表演时自然流露出的热诚—— 那些欣喜和失落、欢笑和绝望，都让她如燃烧的火、汹涌的浪，使每个人为之震颤。 她是绝对的、天生的、无法隐藏的、不可能被掩盖的超级巨星。这一切，都在戏里戏外被证明。 那么，就期待“Shallow”被提名最佳原创歌曲，期待俩人能以最酷的方式上台表演吧。 库珀：我们可是疯子 不过，Gaga对自己最近听到的赞誉很淡然： “对我而言，真正的奖励在于创作这部电影得到的艺术体验。我们所希望的，只是这部电影能够触动人们的生活。” 那么当然，她做到了，他们做到了。 事实证明，最重要的是，Gaga并不需要任何人的批准才能成为明星。 这都是她为了自己而做的。 “I'm on the right track baby, I was born this way.” - 文： Yorkshire Viking  文章源自微信公众号：电影解毒",9,1.0,1
20,20,4058933,一个明星的诞生,4834811717fe78426c9bd7a8a2356fba,47bda952d6234eae499c4f6c37191ae2,4.0,2018-11-19 00:23:52,这个电影据说是美国的热门IP，隔几年就要改编拍摄一番，其实，与其说它是《一个明星的诞生》还不如说它是《一个爱的诞生》。 亚洲文化里，没有真实的爱，夫妻之间的爱被看做是财产、是占有、是来历不明的东西。 其实爱的来历很明确，它是一种独立的欣赏与完善。过气明星Jackson Maine在酒吧里遇见Ally，由起初的欣赏，到一步一步的完善对方和接受对方对自己的完善。 很多人把坠入情网当做是爱，其实那只是爱的一种幻觉而已。有一句心理学上的名言：爱，是为了促进自己和他人心智成熟，而不断拓展自我界限，实现自我完善的一种意愿。 显然，Ally得到了完善，获得了爱的力量。爱情会让人自视甚高，让人敢于挑战自己，敢于自我完善。 可是电影的悲喜剧里，Jackson Maine没能突破自己的桎梏，打破自我的界限，他以一种成全对方的方式离开了Ally，所以电影里传递出来的不是俗套的歌舞剧、音乐剧，而是爱情剧里对爱抽丝剥茧的细致探讨。 爱的不离不弃，不关乎贞操和占有，它的本质是互相完善对方的成熟吸引，脱离了这个意义上的爱，也许它并不是真正的爱。,21,,6
21,21,4058933,一个明星的诞生,48e1a933abdf60e98463dd3fc817f128,4a0d6c3f73d692544fc4e372d3588c1f,4.0,2019-04-18 10:19:56,哇，感觉作为布莱德利库伯的处女座已经很不错了。就是前半段叙事节奏好快，瞬间就结婚了，后半段又有点拖沓，感觉两人的冲突也没有太大。总体除去演唱部分，感觉很平淡。此外，我以为全片最让人的歌应该是Shallow，但其实不是，这首歌感觉前后对应的不好，最后Ally演唱会那会感觉一笔带过了，导致这首本来应该贯穿全片的歌被弱化了。反倒是最后一首Ally致敬亡夫唱的jack给她写的情歌I'll never love again给全片来了一个很好的结尾，也很感人，特别是闪回那段，真的，哇，这该死的甜美。总之全片，真的是演唱撑起，gaga演技还不成熟是真的，但是作为首次亮相，真的超棒了。而且全片那些演唱会全是真唱，全是真的音乐节和gaga的演唱会，超级好。 全片总重要的道理：酗酒吸毒害人害己。,1,,1
22,22,4058933,一个明星的诞生,446890424e508686e8d9363df36f50a4,02700e454d679f31f27c6f0768986dd1,3.0,2019-02-03 18:58:23,《一个明星的诞生》这种水准还能入选奥斯卡？！因为对音乐的梦想让他们相识、相知、相恋，也同样因为对音乐的梦想让他们最终生死两隔。这是美国著名IP“一个明星的诞生”的第四版电影，故事本身没什么可说的，就是简单直白的表达两人的情感过程与人在感情和梦想之间的那种徘徊。所以影片的重点也必然要在两大主角的情感表达上，很不巧的是这部影片在这方面做的并不好，无论是男主的自我放逐、遇到女主之后的欣喜、在对方成功对比下的迷失与没落和最后决定自我牺牲的决绝，还是女主从最开始对音乐的憧憬、得到机会之后的惊喜、在音乐与爱情之间的挣扎和最后对失去挚爱的哀思等一系列关键情绪点的处理都不够细腻、不够完整，甚至有些脱节。而之前被大为好评的Lady Gaga的演技，我想也只能是在非专业演员范围内的优秀吧。6分。Ps：片中的《Shallow》确实很好听，推荐一下！,3,4.0,0
23,23,4058933,一个明星的诞生,a956a426e7e5c943dc6e51570d1e3886,a777112078500d421f014ac19de605dc,2.0,2019-01-01 11:32:48,大概有7，8年的时间没有听过Lady Gaga的歌了。在我初中的岁月里，全班的人都为她疯狂，曾经肆无忌惮地在班上就着“Just Dance”乱舞，在操场上全班一起唱“Poker Face”。但我对她的认识也仅限于这3年，在看这部电影之前我对她的最后印象还是“Alejandro”。   这版《一个明星的诞生》好像已经是翻拍出来的第四个版本了，在1937年就有了第一版，1954年翻拍了第二版，1976年翻拍第三版。其实前三个版本我有听说，但一直都没有看。近来最新的这版登上大银幕，由Bradley Cooper自导自演，Lady Gaga主演的，不管是题材还是卡司都蛮吸引人的，特别的是我还是Bradley Cooper的颜粉啊。同时虽然很多年都没有去了解Lady Gaga，但在看片子之前我对这部片子的音乐还是抱有非常大期待的。   但，观感上真的很糟糕。   剧情很简单，一个明星歌手Jackson遇见了怀有音乐梦想的小妹子Ally，他和她一拍即合，Jackson帮助Ally进入音乐圈，帮她走向了人生的巅峰，自己却沉迷酒精毒品，最终殒命。   Bradley Cooper的导演能力真是让人一言难尽。都说“演而优则导”，虽说我是他的颜粉，但他的演技是算不上“优”，在我看来他是和Ryan Gosling一个水平的演员，可能这两年Ryan Gosling的进步还比他大。Cooper作为导演，在片子里的存在感是相当低的，大部分的戏就是两个人枯燥无味的对话，任何两个人都能随时随地聊起天，基本是非常简单的特写加正反打，谁说话就打到谁那一边，到电影的后半段一旦出现两个人聊天的戏份我就开始打哈欠。   演唱的部分不好不坏吧，能看得出来Cooper至少在他自己的声乐方面还是下了点功夫的，有几首歌当时听感觉蛮好的，但我出了影院就只记得一首Cooper和Gaga合唱的“Shallow”。可能是为了体现摇滚现场的那种动感，整个摄影就很奇怪，动感有没有我不知道，但人多现场的那种晕我是感受到了。   Gaga的表演就不评价了，毕竟不是专业演员。不过从她的第一场戏就致敬尼古拉斯凯奇的“疯癫怒吼式”表演引得全场观众笑场能看得出演技在一个什么水平上。当然全片的音乐水准毋庸置疑，在影片中听到还是非常令人愉悦的，也可以说后半部分强撑着就是为了听她唱歌。她最大的问题也在于她唱歌太棒了，从第一场的“La vie en rose”开始就碾轧全场，没有那种未被发掘的青涩感。   影片中间有一段Ally被捧红后主持SNL的戏份，个人觉得那一整段戏简直就是抄《爱乐之城》，不知道之前的几版有没有类似的情节，但在这部电影里，作为导演的Cooper和《爱乐之城》导演Damien Chazelle的差距就很直接地体现出来，基本是同一个桥段，Cooper看着Gaga在台上用着伴舞唱着一些毫无灵魂的歌词，失望而去，就像Emma Stone呆呆地在台下看着Ryan Gosling弹着他曾经最不屑的音乐，这应该是相当幻灭的一个场面，只能说《A Star Is Born》拍的太无趣了些。   两位主角的人设也有不完整的地方。Cooper饰演的Jackson作为一名音乐人，他有一边耳朵是患有耳疾的，按理说这应该像是一把达摩克利斯之剑一样，是一个很好做戏煽情的点，但每次都只是提一下就没有了是怎么回事啊，Jackson每次的现场事故都是酗酒和吸毒引起的啊。还有Gaga饰演的Ally，开头的戏份厕所怒吼，酒吧直接打了一个Cop，都显示了她很暴躁的一面，后面居然也不提了？   当然影片也有些亮点，比如前后关系的一种颠倒对照。刚开始是Jackson豪气邀请Ally去他的演唱会帮唱，专车和飞机接送，专人接待。最后则是Ally为了勉励Jackson邀请他去她的演唱会帮唱，同样是专人接待。这种关系的颠倒是很能触动人心的。还有就是Jackson自杀之前，车库两盏明晃晃的大灯打在Jackson身后就像是演唱会的灯光一般。   说是“A Star Is Born”，其实片子里更侧重了“A Star Is Fallen”这件事，到最后两条线都讲的不明不白，看完片子后感觉挺难过的。也不知道这种翻拍意义在哪，可能就是把Lady Gaga的新歌Live Video剪在一起看吧，再在最后写上“featuring Bradley Cooper”。,3,2.0,0
