,Unnamed: 0,电影id,电影名称,用户id,用户名,评分,评论日期,评论内容,有用数,没用数,回应数
0,0,4058933,一个明星的诞生,e61b6120c3c683f76b9724953f087bff,9f84bd32ded159fe6faa6ef9f8debce6,4.0,2018-12-05 21:58:35,"《A Star Is Born》在中西方观众之中的口碑走向不太一样。 这部电影在海外上映后，票房与口碑一路飘红，媒体综评达到88分，14家媒体打出满分，烂番茄新鲜度90%，基本是2018年度口碑最佳的电影之一。 但在国内释出资源后，在社交网络上口碑则相对平淡，豆瓣评分目前停在7.2分，37.5%的观众仅给予三星评价，“还行”。     其实近期还有一部在中西方观众眼中口碑两极的电影在中国上映，《摘金奇缘》。两部片子因地域、文化背景而导致的口碑分化情况虽然算不上相似，但都碰到了“想象中的世界”的问题。“摘金奇缘”幻想了一个在西方人眼中格外新奇的中国传统背景下的灰姑娘故事，大卖。但在中国人看来，毫无感觉。 《A Star Is Born》呢？ 我们碰到了三层期待与现实的差异。     先说第一层，对于“造星故事”的期待差异。 不少中国粉丝们听到这个片名，听到Lady Gaga的出演，想象的是天才女歌手雷霆佳佳超Slay一骑绝尘金光闪耀站在世界顶端唱响Super Bowl的造神画面。结果片子最激动的圆梦舞台竟然只是她初次登台怯生生闭眼献唱的画面，之后几乎再无任何画面可提供肾上腺素补给。 反之，电影大量的着墨落在了Bradley Cooper身上——关于他的听障，他的酗酒，他的情绪问题，他的过气，他的死，以及Lady Gaga与他渐行渐远的轨道。与其说这是一出《A Star Is Born》，不如说这是一出艺人过气实录，憋屈，一地鸡毛。 这样的安排显然是不能让中国粉丝满意的。因此在中国观众这里口碑平平也并不意外。 但当我们的视线转向西方媒体，他们夸赞的重点恰恰落在这部“明星诞生记”的故事讲述的真实感上。以《TIME》的评论为例，“It’s wonderful to see a first-time filmmaker who’s more interested in effective storytelling than in impressing us; telling a story effectively is hard enough.（非常欣慰，他第一次做电影就把重心放在讲故事上，没有哗众取宠。有效地说一个故事已经够难了）”。 换句话说，不少中国观众期待的是一个形式主义的、浪漫主义的、甚至有点浮夸到令人涕泪横流的明星出世现场。不少人看完之后抱怨，为什么没有宏大的演唱会场面，一点也不激动人心。 但西方观众期待的反而是一个平实的、动人的、去诉说明星作为普通人一面的故事，他们希望这个电影是现实主义的。Bradley Cooper拍摄的手法确实也很现实主义，不少部分絮絮叨叨得像一部没剪精巧的冗长纪录片素材。但恰恰是这些拙笔为电影提供了真实感。Lady Gaga的成名不是什么石破天惊大艺术家横空出世，就和无数的梦想女孩一样，巧合偶然加上天分，很合理。电影平时到Bradley Cooper饰演角色的死都没什么锣鼓齐鸣的情绪渲染，几个画面简单带过而已。 一者想要的是浪漫，一者想要的是真实，最后看到一部纪录片式的电影，自然前者不屑，后者赞叹。     再说第二层，故事讲述重点的差异。 前面有说到，电影大量的重点落在了Bradley Cooper饰演的摇滚巨星陨落身上。甚至压过了Lady Gaga饰演的Ally崛起的部分。 同样，在中国观众这里，不少人期待的是Lady Gaga的升起，并不愿去看那些负面的、陨落的事物。我有个朋友跟我说，看到Bradley Cooper的颓样就想快进。 但这一版《A Star Is Born》动人的地方则在于展现一种“世代交替”的命运之中，人的无助与失控。Bradley Cooper代表的是一个时代，一个民谣与摇滚的时代。Lady Gaga代表的是另一个时代，一个流行摩登的时代。二人在乐坛的故事就是后浪将前浪逐渐取代的残酷物语。就像滨崎步如是中天时曾在歌里唱的，“我曾目睹一个时代的结束，但怎能想到下一个轮到的竟是自己”。 这个残酷的命运历程，被Bradley Cooper转化为了一个还带着不少温度的爱情故事，使之不那么难以接受。但实际上，故事里隐藏的，就是当一个人青春不再、地位失却时的无奈与悲哀，只能滚入时代的洪流，被冲刷而去。 正如《La La Land》因叙述了娱乐行业边缘人物在被压迫之下的绽放而获得西方观众广泛共鸣一样，《A Star Is Born》叙述的娱乐行业人物被时代巨浪卷走的故事甚至要更加令人痛心。这不仅仅涉及关注电影与好莱坞的从业者的共鸣，同样能够引起热爱娱乐文化的年轻观众、以及容易联想到自身处境的中年观众的共鸣。无怪乎在国外有那么多人会在影院里哭成一片——这多容易想到行业里的心酸，多容易想到晚景凄凉的自己啊。 但我们这儿的中年人，可能会去下《A Star Is Born》来看的人并不多。     第三层，对国际巨星的观察角度差异。 世界娱乐与流行文化的中心在欧美。他们成熟的工业化体系与选拔机制能够不断产生影响世界的巨星。当我们隔着重洋看他们的时候，感受到的是因距离和仰视角度不断加成的神坛光芒。 因此我们看西方一线歌手参演的明星诞生故事，总会怀着要看到一个时代巨轮启航的震撼场面。结果电影里的Lady Gaga，说起来还有点朴实，没有那么多惊人的演唱会表演，倒是一直在排练、练舞、泡澡、吵架，就像个平凡人一样。 于是我们的期待又落空了。看明星诞生当然要看西洋镜万花筒漫天烟火，这电影拍的也太平实了一点。 但，说来有点意思，我们这里，讲自己地区的歌手成名故事的电影，其实拍的也很朴实。例如，不少人都听过的，《下一站天后》。 这样类比可能大家多少能够理解——我们对更为先进的流行文化中心的巨星，总怀着更高的期待。但在欧美观众看来，《A Star Is Born》也就是另一部《下一站天后》，要是拍得花火四溅，倒是不真实了。 再往深里说，其实东亚的偶像文化就是很喜欢造神，或者很喜欢养孩子。欧美的娱乐产业里，明星们依然是普通人，每天养马种菜岁月静好也没什么大不了（Lady Gaga的Ins每天都是这些），发表点政治观点也没什么大不了。我们这儿的明星当然没法碰政治，为了接高端广告似乎也没法表现得太平凡，逐渐社交平台就塑料化了，导致全民只能盯着一个出口“感情生活”拼了命地瞧，其实挺无聊的。 这种对明星作为“神级偶像”与“有才华的凡人”的观察角度差异，也造成了《A Star Is Born》口碑的地域分化。     在文章的最后，我希望引用Lady Gaga在美国电影艺术奖颁奖台上对Bradley Cooper的一段话。 “你有时会叫我Gaga，但你我都知道，你私下叫我Stefani（Lady Gaga的本名）。很长时间以来，我一直在逃避她。我披上我的超级英雄斗篷，以Lady Gaga自称，是你让我潜入心底深处，再次与她相见。是你让我再次成为Stefani。” Lady Gaga说起这段话时泪如雨下。这也让我明白我为什么会如此珍惜这部电影里的她。这部电影里，她脱下了那一层她出道起就披上的Lady Gaga盔甲，而是呈现出了自己作为一个有才华的平凡人，情感充沛的一面，如此鲜活而真实，有那么多不完美的情绪，但那是一个living person。 从这个角度想，或许我们对明星作为一个“非凡个体”、“超级英雄”的期待，也总令他们不堪重负、如处牢笼。虽然总有人可以冷血地说，从事娱乐行业、获取高报酬，就是会牺牲这一切。但当我们对比东亚文化之中、万众目光扫射之下，不少明星与粉丝彼此被束缚、被异化的病态场面，难道真的不愿意去思考一些更为自然的表演、交流方式吗？造神的粉丝文化，把明星幻想成无暇的神像，给予其极端优渥的回报，剥夺其为常人的权利。难道明星真的不可以只是一个“有才华的普通人”吗，他们真的需要方方面面无懈可击吗？这种无懈可击真的值得相信吗？ 或许他们也都想成为电影里的Ally，那个还能涌动真实情感的人，那个不必处处道德完美政治正确，只需要用才华证明自己的人。 THE END   感谢关注 微博：呆若木一 微信：呆若木一 作者：木一
 编辑：洗澡",2092,131.0,261
1,1,4058933,一个明星的诞生,d335d88f4b365c043c51ef8bcd710bca,f460bd7d64af734bddaf07b48103ff37,4.0,2018-10-13 13:20:51,"这IP或许大家很陌生，但是对于美国人来说这是一部跨越几代人的热门传奇故事，它就是《一个明星的诞生》。     《一个明星的诞生》是华纳的珍宝之一，早在1937年，就已经有了第一代作品，到了1954年出了第二代，1976年第三代，到今年是第四代。     最新这部《一个明星的诞生》可谓命运多舛，曾经华纳想要投入巨资去打造这部电影，当时想要找克林特斯特伍德导演，因为影片的叙事结构有些西部片悲剧的内核，不过最后找来的是布莱德利.库泊做导演。     而男主最初考虑过汤姆.克鲁斯，克里斯汀贝尔，小李等超一线好莱坞巨星来演，最后还是被布莱德利.库泊拿下男主，女主则想找碧昂丝，虽然没谈成，但却谈成了同样知名度很高的LADY GAGA。当然LADY GAGA也不负众望，她的演出和演唱，则成为了这部电影唯一值得冲击奥斯卡的保证。    前两代的《一个明星的诞生》，把故事背景放在好莱坞，讲述如何挖掘影视明星的造星过程，后两代作品，则放在了如何挖掘有音乐天赋的歌唱家。 每一部的《一个明星的诞生》，都引起当时人们关注的目光，因为影片中造星的故事，一定是会请到当时最闪耀的明星去演绎这部电影。 《一个明星的诞生》主线剧情很直白，男主杰克是乡村摇滚当红却日渐衰落的歌手，有药瘾和酗酒的陋习，在演唱时候长期不戴耳塞导致听力受损，而且性格偏执，但没关系，谁叫他是孤独的艺术家呢。     杰克音乐事业如此成功但却郁郁寡欢，某日杰克去一小酒吧酗酒，意外发现了一位很有音乐天赋的女歌手艾利，两人一见钟情畅谈一晚上音乐，还同时即兴创作了一首歌。     杰克立刻邀约艾利参加自己下一场演唱会嘉宾，之后两人不断在音乐上互相激励，艾利也因此有了更多成名机会，一发不可收拾，红起来比杰克十倍都不止，还提名并获得了格莱美奖。 而杰克则在音乐事业上急转直下，两人最初和最后音乐地位都很悬殊，但悬殊的地位正好相反。最终，音乐和爱情化解了两人的欢喜与悲痛，也成就或湮灭了这对恋人。     目前《一个明星的诞生》在西方国家口碑可以用炸裂来形容，看过都说好，有因为音乐赞扬的，有因为故事感动的，更多的是因为LADY GAGA的出演而爆打满分的。 但影片再一次上演了文化审美隔离，就像《黑豹》一样，美国和西方国家个个给好评，到了国内却觉得片子一般般。《一个明星的诞生》一样存在着文化审美隔离问题。      
 其实这很好理解，影片时长有135分钟，在这两个多小时的电影时间内，第一次拿起导筒的布莱德利.库泊不可能做到十全十美，在影片第二幕的时候电影叙事主线有些失去方向，剧情推进有些无聊。 但影片造成中西审美误差的，终其原因还是在于《一个明星的诞生》就是拍给美国人看的，说的是美国音乐界的事，谈的是美国人心中的情。     影片里面的歌曲，人物的心路历程，如果你不对美国音乐文化的艺人困境有所了解，或者不对美国娱乐圈残酷的优胜劣汰有所了解，是很难对片中作男主的设定，还有女主坚持做自己的姿态所动容的。 《一个明星的诞生》入围奥斯卡应该不成问题，而奥斯卡说白了就是颁奖给美国的电影而不是世界的，所以说如果觉得《一个明星的诞生》是烂片的人，或许你们还没有看到电影的多元和其中的味道。     ——开始剧透了—— 影片主要分为三段，从艾利角度出发，就是艾利成名前，艾利成名过程，艾利成名以后。 从杰克的视角出发，则是杰克正当红，杰克日渐风下，杰克一阕不振。 两人在最好的时候相遇，杰克需要找到音乐创新的突破口，艾利渴望有自己音乐梦想的一片天。所以在他们相识的时候，他们相爱相知，在音乐的12个音符中陶醉。     这样我想到了《爱乐之城》，虽然故事和背景都不一样，但《爱乐之城》里的男女主角，同样是在两人最需要温暖的时候拥抱在了一起，互相鼓励彼此追求自己的梦想，但最后两人却因为各自事业上的成败，以及现实和梦想之间的挣扎和妥协，让原本相爱并一直深爱的两人，却终究没能有圆满的结局。      杰克的陨落 我承认在看《一个明星诞生》的时候觉得杰克有点作，明明两人相爱，杰克亲手捧红了艾利，并取得美人归，但杰克却要一次次不成熟的无理取闹，伤害艾利和艾利的事业，伤害身边一直照顾他的哥哥（也是他的经纪人），让人看了觉得有些不可理喻。 但其实杰克的心路历程，影射的是整个美国界老派歌手在现代音乐环境的无奈和叹息。    其中影片一开始就表达了这个意思，在杰克和艾利在酒吧的时候，杰克被所谓的他人索要合影，那人目的不是偶像崇拜，而是因为那个人私人的无理要求。这也暗示了杰克全身心对音乐的付出，换来的却是别人把自己当做在快餐时代的次消费品，最后杰克自杀后大家都开始追忆他的音乐，也讽刺了这个时代确实不懂得珍惜将生命献给音乐的人。 影片中杰克的一首歌《Maybe it’s time》中的歌词，就很好的诠释了杰克日落西下的音乐路： Maybe it's time to let the old ways die 也许是时候让老派消亡了 It takes a lot to change a man 改变一个男人需要很多 Hell, it takes a lot to try 地狱，尝试需要很多    我们大部分人看到的是杰克不懂得珍惜身边人，但如果从音乐的角度去看，杰克的生命是先给音乐的，在音乐的信仰中，杰克付出了全部，所以他也用这种音乐信仰，感染了艾利，让艾利迈出自己音乐事业的第一步。 杰克当初挖掘艾利，同时也是想要突破自己音乐的瓶颈，两人在共同演出的期间，擦出了许多音乐的火花，这些火花让艾利成为明星，但却没能让杰克得到预想的成功。 这样的落差让杰克措手不及，这里不能简单的用嫉妒去理解杰克的内心，而是杰克的音乐信仰被无情的现实打碎，让他在音乐的道路上更加迷失。     影片中杰克的听力就很好的映衬了这一点，杰克的听力问题，预示着他音乐之路消亡的开始，他越想做自己的音乐，听力就会越损伤。 当杰克看到艾利音乐事业越来越成功的时候，我相信杰克一定是欣慰和高兴的，但是回望自己的音乐，杰克更多要靠药物和酗酒，来自我催眠去填补自己心中巨大的深渊，但这种填补，无形中就会伤害身边最爱的人。 所以杰克为了艾利，为了身边所有爱着他的人，他有在尝试，他有去戒酒中心，努力想要变成大家心目中重振旗鼓的人，但最终他发现自己已经无药可救，这种精神困境，是现实音乐环境带给杰克的，并不是杰克不想自我救赎，所以杰克为了更好的保护艾利，选择了结束自己的生命。     杰克的死，正是影片备受争议的点，有很多人不解和吐槽，也有人表示同情和共鸣。 杰克的死，就是在讽刺老派歌手带着音乐的初心进入娱乐圈，却被娱乐圈在一次次迭代中无情的抛弃，这是现实的无奈和规律，也是对老派歌手最沉重的打击，所以杰克以死来保持自己对曾经音乐初心，同时杰克也以结束生命的形式，来保护艾利的音乐之路。      艾利做自己 LADY GAGA出演《一个明星的诞生》，无疑是影片最大的看点，同时也是LADY GAGA几乎本色的出演。 在LADY GAGA 的纪录片《嘎嘎：五尺二寸》中，GAGA 就有提到过自己为何在刚出道时，形象如此夸张惊悚，因为她要用这样的造型去抵制唱片公司对她的包装，GAGA用这样的形象，想要在音乐圈甚至娱乐圈做回自己。    所以GAGA在兜兜转转多年后，现在回归正常的音乐人形象，真正做到在音乐上一直保持自己的姿态去诠释音乐。 在《一个明星的诞生》中，艾利也是如此，艾利在经纪人的包装下反抗着，她不需要多余的舞伴，不要染成自己的不喜欢的发色，甚至是放弃欧洲巡演，来保护内心受伤的杰克。 艾利虽然事业有成，音乐之路一路高歌猛进，但依然在抵抗着这个行业诸多的诱惑和陋习，一直努力保持着初心。 就像GAGA 在片中所唱的《Always remember us this way》，翻译成歌词，就是“永远记住我们年轻的样子”。他们在最年轻的状态，彼此相爱，共同做出了很多完美的音乐。     所以这个片子高级的地方，不在于杰克和艾利之间陈腔滥调的爱情故事，而是在于梦想与现实，爱情与事业，做自己和迷失之间的讨论。 《一个明星的诞生》这样被翻拍第四遍的电影，把这些隐藏在美国当下行业艺人困境的问题挖了出来，虽然是旧酒换新甁，但这个新甁却十分贴合时代，一个美国当下的音乐时代。     这也能侧面看出，为什么《一个明星的诞生》IP虽然在1937年就诞生，但还在翻拍，而且不止一次，因为这是美国音乐行业永远无解的遗憾，那就是总有明星诞生，也总有明星陨落，残忍的行业更新迭代，才能换取音乐行业甚至名利场的在世人面前的关注。也只有这样，我们才能不断听到更多更新更不一样的音乐。 所以只要这个永恒问题存在，《一个明星的诞生》会一直诞生下去，将来也一样会有那个时代的《一个明星的诞生》。   关注《大聪看电影》公众号，不追求跑量，只研磨精品",1197,73.0,138
2,2,4058933,一个明星的诞生,c0fe460c34ad61ecee74232b86daae35,7bf161b2e642f831ac79557aadd955c5,4.0,2018-10-12 18:45:15,看这部电影的时候我的心情非常的矛盾。一方面为男主的为爱奉献感动，另一方面因为看到了这种燃烧自我的奉献背后的人格缺陷而感到惋惜。如果“爱”真的可以用健康和不健康来形容，那男主这份爱明显是不健康的。 电影的故事毕竟是80年前的，虽然电影中加入了LGBT的元素（这一点可以给高分），比如酒吧里的变装皇后和女主的gay蜜，但女主仍然几乎是这部电影里唯一的异性恋女性角色。而且从头到尾，女主虽然有成为明星的愿望，但所有的决定都是通过听取别人的意见决定的，男主，经纪人或者她的gay蜜。反观男主的每一个行为和决定，都是跟随自己的想法来做的。他想要请她喝酒就请了，想叫她上台唱歌就派车派飞机去接了，甚至想死就死了。 唯一失控的一次是女主遇到了经纪人，代表有在他范围之外的力量可以去塑造女主了，但是有意思的是女主的第一反应是，我要问问Jack。最后一首歌女主说自己名字的时候冠了夫性，可以说是对爱人的纪念，也可以说是一种男性视角下对无内在人格的女性的塑造过程的成立。男主最后实际上成为了女主的束缚，因为女主越飞越远越独立男主的价值就越来越低了，要么女主降低自己的发展潜力留下来维持他存在的意义实现两个人的小我，要么男主只能自我毁灭放女主实现她的大我。 或者说女主最后自己实现了他们两个的价值，这样说可能理解更正面一点，但女主的独立价值是一直都没有实现的。 朋友说这部电影很虐心，但在我看来这部戏虐心情节的内核来自于男主的自毁。仔细分析会发现，男主的酗酒，嗑药，不愿保护听力，都是一种自毁的过程。我想弱弱的以一点点久病成医得来的心理学知识说，内核有点不健康，当然了，都健康也就没悲剧这种东西了。男主是一个可怜人，他欣赏女主的才华，用尽自己所有的资源甚至牺牲自己给她一个登高的阶梯，内核其实是因为对自我价值的忽视，希望投射到另外一个人身上去完成自我价值的实现。鼓励别人要自信，但自己却不够勇敢去相信自己。他一直希望自己以女主的提携者，照顾者的角色出现，但实际上这种人格的人才最需要呵护，因为他甚至不自信到不会去麻烦别人来照顾自己。所以他的死几乎是不自信的他在不断自毁之下的一个必然的结果，因为他觉得他自己并不值得让女主牺牲事业来陪伴。 对一个人最好的爱不是毁灭自己，但当我真的对自己无能为力，离开是我最后的勇气。如果可以，我希望生活把我塑造的更爱我自己。,404,23.0,67
