,Unnamed: 0,电影id,电影名称,用户id,用户名,评分,评论日期,评论内容,有用数,没用数,回应数
29,29,24733428,心灵奇旅,f1fc9ff8422854be18ac642b1852b84a,d8220bd96fe3d1d9f5c1e61e07f8d46a,4.0,2020-12-25 19:34:54,"皮克斯真是煲得一手好鸡汤。
凭心而论，这是一部充满想象力、配乐直击灵魂、成熟得几乎挑不出刺、很容易打动人的作品，导演毕竟是执导过《怪兽公司》《头脑特工队》《飞屋环游记》的彼特道格特。
甚至对于前几部作品而言，《灵魂》世界观的想象力完全不输，生之来界像是宇宙中漂浮着一片大草原，草原上又凭空出现了游乐园；作画上，简明线条勾勒出鲜明个性，从彼岸跌入来界时，那几个黑色方框如同宇宙本身一般神秘，“这只是一个箱子”世界里无边的黑暗、悬空的幽蓝灵魂、可怖的深邃巨怪，甚至比前几部更有视觉冲击力；而配乐，从男主乔在课堂上弹的那一小段开始，就不断让人跟着音符跳动，跃然升起又笔直落下，将爵士乐的自由发挥到极限...... 除此以外，本片还有两个不得不提的优点。
一是反高潮处理。又一部没有boss的电影。上一部还是《头脑特工队》。只是简单地讲述了男主角寻找梦想，在途中感受到生活真意并顺便感化一个小女孩的故事。
我实在太欣赏这种做法了。放弃了boss，就是放弃了小宇宙的爆发，放弃了最简单轻松唤醒观众热血的机会，放弃了直接煽情和表达主题的方法，而选择了一条远要更崎岖艰难的，打动人心、厘清问题的道路。
设置一个不断做恶的反派，除了易于在关键时刻和观众达成共鸣，并且在打倒它的时候突出某种主题，这样两个优点以外，其实尽是缺点。有时候我简直觉得，这像是好莱坞为了偷懒发明出来的一种叙事技巧。在今年的另外两部动画电影，《二分之一的魔法》和《疯狂原始人2》中，其缺点都有体现，具体可以参见我的另一篇影评，https://www.douban.com/doubanapp/dispatch/review/13014758
让人感动和明悟必定比让人激动要难得多，同时效果也一定好得多。因为生活里本来就没有那么多具象化的，站在你面前等你通关的boss，大部分的主题和思考都是无法通过一个简单的“打倒”或“战胜”的动作传达出来的，而需要潺潺流水般去讲述一个动人的故事、一些有益的道理。
就像本片和《头脑特工队》做的那样。 二是主题的突然转变。
前半段仿佛纯粹在讲述一个追梦故事，不惜逃离天堂也要人间圆梦。观众们都和主角一样以为，这纷扰尘世吸引着我们的，是我们难以企及但炽热发光的梦想。哪怕是这一部分，都已经足够动人，所以我们很容易就和主角达成了共鸣。
但后半段笔锋一转，主角找到了自己的舞台，却开始怅然若失。而在剧情顺其自然地发展中，观众和他一样突然意识到，生活的真意正在于生活本身。哪怕没有实现梦想，也大可享受爵士本身，就像那个吹长号的女孩，就像那个理发店老板。爵士，即自由，也即生活之美。
主题的转变使得观众的思想转变更加自然，比起从始至终贯彻一个主题，极易让人与主角一同感到生命的明悟；虽然前半段的部分算不上“抑”，但其实与欲扬先抑的手法是共通的。
 然而为什么《头脑特工队》被普遍认为优于本片呢？其一自然是本片有的优点它都有，其二是主题选取比本片更动人。本片对于生活真意的思考与探寻，其实说不上有多高级，应该是很多人日常都会产生的感悟，但大家其实一般都是自我安慰的时候想到的，而且疗效不持久。而头脑特工队告诉我们，悲伤有时候比快乐更重要，你不需要一直乐观，一直坚强，一直撑着，想哭就哭，会有人爱你。直击人心。 就像我的标题，我本人看完之后很难受，比起夸赞这部注定会被夸赞的电影，我更想唱唱反调。
上面讲述本片优点的部分，是为了证明我有认真看这部电影，也自认为懂了，并且也知道它好在哪里，表明一下公正的立场吧。
特别喜欢这部电影、甚至觉得被它感化了的人建议就不用往下看了，因为我的恶感更主要是对这部电影主题的，来源于我私人的生活感受和有些阴暗的生活态度吧，而非针对这部电影本身。甚至我自己也觉得有些挑刺了，但还是不吐不快。 首先是结局男主的复活。生死被描绘得过于随意了。而且前片其实是一个杰瑞第一次告诉男主，火花由何因点燃并不重要的。宇宙的意识被男主教化了，也实在是有些自大的想法。这样的结局像是被迪士尼带坏了。
“生活的真意在于生活本身，而不在于那个或许遥不可及的梦想”，这样的话如果不是被一个几次拿下奥斯卡最佳动画奖，甚至可能马上就要再拿一个的团队，画出的一个刚刚实现自己演出梦的爵士乐手说出来的，或许会可信一点点吧。
联系全片来看，我甚至觉得只有圆梦的人才有资格说这句话。因为实现了梦想才能回归生活。所以那个女萨克斯手可以说，所以完成演出之后的主角懂得了这点。
但那个几近封魔的基金经理呢？他大闹了一番办公室之后怎么办，回家靠父母养？像男主之前那样。那个以打嘴炮为乐的男人呢？抱着大器晚成的想法自我安慰到死吗。那个地铁站里唱歌的男孩呢？他能找到自己的乐队吗？
为什么最终乔递给那个幼年灵魂的不是棒棒糖也不是披萨或者他妈妈的线，为什么这三样东西没有那瓣蝴蝶翅膀动人呢？因为它们要花钱的。没有人可以把他们当作生命的真意又不去打工的。那我们能真的守着“取之无禁，用之不竭”的造物者无尽藏过一辈子吗？好像也做不到。
看着男主最后一幕换了一件大衣之后才幡然醒悟，明白了我的难受感从何而来。是我想买买不起的款式呢。
“生活的真意在于生活本身”，真的是一个值得去讲述的主题吗？在我看来，更像是我们一次次失意时自我安慰的话语，但是好像也没人真的把它作为人生信条，打工人终究没法摆脱打工的命运。
而且这个世界上也有难吃的披萨，有太腻的棒棒糖，落在身上的除了蝴蝶翅膀还可能是虫子......生活是无数碎片，有的圆滑美妙如鹅卵石，有的尖锐扎人比刀更甚。生活本身或许不是坏的，但它也绝不是好的。 对不起，有些传递负能量了，警告过你们了，只是我真的不吐不快。
最后献上张爱玲散文集《流言》里第一篇的最后一段话吧。
“生活的艺术，有一部分我不是不能领略。我懂得怎么看‘七月巧云’，听苏格兰兵吹bagpipe，享受微风中的藤椅，吃盐水花生，欣赏雨夜的霓虹灯，从双层公共汽车上伸出手摘树颠的绿叶。在没有人与人交接的场合，我充满了生命的喜悦。可是我没有一天不能克服这种咬啮性的小烦恼，生命是一袭华美的袍，爬满了虱子。”
这篇的名字叫《天才梦》。我甚至不是天才，我只有梦。",80,7.0,54
30,30,24733428,心灵奇旅,fcdcc68a7cc1e031ee5f3b7b332127e6,78415ada3b0219b1b6cb9986a2ba4630,4.0,2021-02-02 14:20:21,"22像极了我认识的很多人，这些人有一种基本共通的当代面貌，这种东西很难说清，算是一些非常微妙的“当代气质”的集合，是脱离了我们前辈经验的一个特定时代出现的东西，既有个体特质，又有集体共性，在《心灵奇旅》的22身上，精炼又集中地表现出来。 之所以很难说清，其实是因为这些人往往同时兼具一些矛盾的东西： 他们大多在20-30岁之间，表现出比同龄人更高的智商；然而言行、态度甚至神情方面，却会让人觉得他们比实际年龄更小一些。 他们非常聪明，在信息大爆炸的环境中，对信息的汲取可谓得心应手，这可以对应22经历过那么多世界名人当老师——如同在这个时代，点点鼠标或者碰碰屏幕，你就可以被世界最厉害的人“教导”——被“教导”了又怎么样呢，该拖延还是拖延，该无为还是无为，我们的秉性跟22一样顽固到有些令人得意。 如同22一般的我们，对任何话题基本都可以侃侃而谈，即便是没有深入研究过的那些，都能说得上一些模棱两可的“点睛之笔”，分享或转述或从碎片化信息自行总结得来的“观点”。甚至由于言语幽默、敢说，熟练且广泛地引用名人名言，能精准地调侃或者讽刺所看到的每个表面露出来的小毛刺，而轻易成为交谈的中心。也难怪22可以在理发店那么大显身手。  如果你觉得这样的“我们”只是忽悠之辈那么就大错了，“我们”往往有自己擅长的方面甚至非常深入的领域，由于获得信息的渠道多，见多识广，懂很多道理， 甚至非常深奥的一些命题都有涉及，这也是为什么22在那个“生前世界”You Seminar那么游刃有余。 但他们在某种程度上却缺乏热情——不是对知识的热情，那东西他们已经有够多了，而是对某些人类习以为常、最基础最本质的东西缺乏热情。这并不难理解，因为他们大多是透过一个屏幕跟这个世界接触的，世界通过这个小小的框框传递出来一个虚拟的东西，这些东西没有触感、没有味觉，似乎是“体验”，却没有实感。就跟片中那个培养大家Spark 的超大空间一样，虽然摆满了各种物件，似乎能让你“体验”，但这种体验是虚拟的，是形式上和观念上的——食物没有味道、画画没有手感——正如这个空间的配色一样是虚虚的，缥缈的。有的人真的可以被“点燃”，而像22这样的“我们”却无法融入或者无法感动。 所有的东西都“集成”在一处，形成的这个Hall of Everything，具象地展现了我们通过网络对这个世界的二手化了解方式——这个世界是塑料的，不，只是看起来是塑料的，比塑料还没有实体。  22平时眼睛半睁，眼神很少放光，嘴角轻浮地挂着掌控全局的得意的微笑，这种笑容不让人讨厌（因为它本身足够可爱，不可爱者慎做，容易出现死鱼眼），这个表情不算出自真心，而只是对抗这个世界所有无聊的最简单的方式。  他不屑那些“伟人”，他得意地看着自己用这种轻蔑的围笑和故意的“无为”轻易击溃他们，并且享受这个过程，典型的故意用“道理我都懂，不过……”气死你，享受着“我就是喜欢看你拿我没办法的样子。” 22可以变换各种声音，而之所以用那个声音只是因为“它让别人心烦意乱”。 但不要以为它就是故意捉弄人，小灵魂能有什么坏心眼呢~~只不过它轻蔑这些“权威”，当这些人作为“导师”一本正经地、苦口婆心地、岁月静好地感化他时，它就本能地就要挑战他们。 





 然而，当它看到身边这个人——带着帽子垂死的Joe——并不是作为单纯“导师”的高高在上的立场，而是跟他一样通过小小的手段在作弊时，就有了亲切感——它可以和这人一起玩转既成体系。当有了这种可能性，他就提起了兴趣。 所以22开始配合，并且当Jerry第一次试图宣告他们点燃火花失败，并让Joe回到Great Beyond大台阶时，22机智地说出“霹雳舞，我们还没尝试霹雳舞”，救了Joe一次，并把他带进“盒子里”，也就是那个the zone（the space between the physical and spiritual）。  进盒子之前，面对Joe的质疑，22说出了帮他的理由： 尽管可能只是一个托词 这再次反映出在这个小天才身上矛盾的共存： 虽然他法精通各种理论、具备丰富的知识，但他对一些人类基本的情感和认知搞不清楚，或者说其实是普通人没有从它的角度去想过这些生活中的问题。而且，有意思的是，它不介意去了解一下。 这才有了后面一系列的冒险。 其实促使他们能够合作的更重要的原因，是它善良的底色。这也是身边认识的年轻人经常会体现出的品质，他们会故意做出似乎有点无所谓的态度帮助你，但其实是真诚的，甚至因为感觉自己被需要而感觉有趣。 来到人间的22，刚开始与外面忙碌拥挤泛泛的世界接触时是惊慌的，甚至是被迫的。直到它尝到了“真正的滋味”，而且可贵的是，它可以毫不避讳地表达着自己的喜欢，一点都不假装——非常喜欢这种能在高兴的时候尽情表达出来的人。   22自以为已经“听过音乐”了，以为对音乐（甚至其他艺术形式）已经很懂，就像他一开始听到Joe回顾自己人生时弹的钢琴之后没有得到spark那样。但是他其实只接触到最表面的东西，只浅浅的接触了音乐零星的一小部分，没有机会听到真正适合他的音乐，更没有到过真实的音乐现场，所以当他在地铁中跟音乐人面对面的时候，听到原创而直接的Lovelove的时候，被抓住了。（虽然并不觉得那个歌很好听，但是唱的态度是投入和真诚的）。  22其实对一些活生生的细节非常敏感，喜欢收集小物，它的感知能力是很好的，只是之前用不到这些而已。而这种敏感又让它对在乎的人尤其在乎，会因为一些言语或者别人看来无足轻重的东西而备受打击。所以尽管在其他方面非常强大，但在这里它是脆弱的，轻易黑化了，当然，善良的底色也会让它重新接受那个伤害过它的人，恢复过来。  所以，虽然会觉得《心灵奇旅》确实有一点鸡汤，而且整体故事主线相对单纯了一些，但22这个角色所反映出的社会性和当代感，却让人非常喜欢，而且拿捏有度，看完后的几天，每次回想起来咂摸咂摸都觉得挺棒的一个人物设定，毕竟能准确摸到这个时代轻微脉搏，并愿意耐心感受它的跳动是一件难得的事。 所以，以后，遇到了这样的“我们”，或许可以拿“22”做一下参考，或许可以更容易理解我们一点点，而不是简单地把我们贴上“社恐”、“顽劣”或者“年轻气盛”“么得感情高智商loser”这样单维度的标签。",25,,1
31,31,24733428,心灵奇旅,f4f7c139db98d499e52c0e89cf833fb1,180ca9c99b1767c519f0b131616ac580,5.0,2020-12-28 22:40:47,"今天其实是一个人看了两部电影(平时也挺享受一个人的)，去医院整完了之后晚上打算看完这个的状态已经有点疲惫了，但也很投入。可能生理上状态也会影响到心理上，这种时候可能更容易“破防”，几度掉泪，这部电影当然会是我的2020最佳，也会是以后一定会重新看的作品，不只是因为影院的视听效果有加分。 现在来好好聊聊这个电影 我想先回答一个问题，也是表示对一些朋友无感或者低星的理解。 “为什么我会/不会突然被这么简单的东西打动了” 不会是因为主题和核心表达其实没有“新意”，就像爱情片和警匪片一样。那为什么会被打动呢，因为具体到不同电影却可以有非常大的差别，也许是某一个音画结合的瞬间，也许只是一个普通转镜，而且我觉得这和每个人的状态有关系，不是指的今天的具体状态，而是一个长期性的状态，有的人最近过得忙碌失意，有的人过得春风洋溢，当面对一部“暖心鸡汤”的时候天然代入心境就会有很大的不同，比如无感的人可能会觉得“这就是生活该有的样子呀，为什么我需要你来告诉我这些道理”，喜欢的人或者甚至是从未想过这些的人则会觉得“啊原来生活可以是这个样子”，有时候就是需要有人告诉你一些东西，有时候则是你曾经明白，但过了太久已经被打压抑或者主动放弃了，于是你又阶段性地需要啦 首先是第一个非常非常触动我的地方，这也会是这个电影对我来说特别的地方，我在初中的时候，或者说我的人生中第二次思考死亡，是因为当时我的政治老师推荐了我们一本书，书的名字和内容我都还记得《天蓝色的彼岸》，以至于当我在电影中看到这个想法的时候一度在想是不是从那本书里得到的灵感。 那本书当时非常触动我，现在仍是，内容大概就是一个小男孩因为车祸意外gg了，然后一样发现每个人都会来到一个中转地一样的地方，想清楚了冇念了就走向天堂，还有着羁绊的家伙就会一直逗留，小家伙铁了心重回了人间，发现他在教室的课桌、储物柜的位置都被替代了，喜欢的女孩两个周之后也和其他同学一样照常生活，他也发现父母和一直和他打闹的姐姐原来是那么爱他，人是听不见看不见他的，但他可以用意念微小地操控实物。在他千方百计让姐姐感知到了他的存在之后满足地飞升去了天堂。 小男孩的一生过于短暂所以不甘，认为自己没有活够，而Soul里面的家伙则是觉得自己根本没有“活过”。  之后作为一名爵士乐爱好者，或者说音乐爱好者，我天然地更可能会对这部电影代入更多感情，虽然我不是作为一名创作者，只是一个很普通的乐迷而已，但我包括爵士乐在内的爱好也时常被看作“有的没的”，面包问题也时常拿来评价头脑风暴，这是我们每个人都面临的困境。某种意义上也可以等同于电影里面的“梦想”，毕竟也是自己诚挚而狂热的主动选择。 爵士乐直到今天都和小资、浪漫、upper class等符号关联，我觉得很让人难受，这在上世纪演出唱片文化兴盛的时候对于乐手很多时候真的就是享受参半，商业参半，对于乐迷来说也是享受参半、娱乐调剂参半的东西，也就是上世纪的“popular music”，它对我来说，也就是一个爱好而已，至于那些藏在音乐里或者音乐启发我的部分，不告诉你咯~ 谈谈几个打动我的瞬间/元素⑧ 1、男主圆梦演出之后向女乐手(感觉好像Nina)表达困惑:我觉得没有想象中那种强烈的感觉，女人只是告诉他:水和大海的区别隔膜有时候没有那么带 2、之后回家情不自禁弹起来的时候对着小屁孩留下来的东西睹物思人，达到了忘我之境，我在这里不是想谈目标，这个桥段蛮俗套的，我只是想说打动/点燃一个人想为之生存和追逐的有时候真的很可能只是一个氛围，看着秋叶落下，望着天空眩晕，钓不到鱼发呆，等等，我觉得人生就是为了这些出离的瞬间而活的。 3、影片里面男主成功回去人间演奏一晚之后回去找小屁孩，终于感化小屁孩之后，小屁孩走之前说那你呢， 他说“I've lived once”，这是电影里面深深触动我的瞬间 “I can be hero,just for oneday” 这里在电影里的设定也对应了男主回去“活”过一天，我觉得这里特别好 最后，画面配乐顶级，非常享受，今天我在朋友圈发了年终音乐截图，我的一位走上工作的学长评论我:当潮流爱新鲜，我回复他:I'll stick to my old fashion.",14,,15
32,32,24733428,心灵奇旅,30acb2c486399150c653c82ea083b7bd,cb2eb8d656907edc90ecbee13ab009cf,5.0,2020-12-26 22:17:26,神作。 又灵又俏。但到底谁起的这个译名，比上次的《寻梦环游记》还拖后腿……如果不是朋友提我根本不会想起来这部。  看完绝对会愉悦快乐的作品，动画人如果能作出这种作品可以心满意足的踏上生之彼岸的那种等级。影院里有一些带儿童的家长，明显是陪孩子来的，但后面所有人都在笑，不分年龄的全场共鸣的投入感。（片尾有一个很小的彩蛋，大家哄笑着出了影院）  《寻梦环游记》是讲“死”，这次他们讲“生”。  情节很简单，但绝对不枯燥，你知道他在讲道理，但姿态一点也不高，何况他讲得那么好听，像小时候睡前床头听过的童话，听着听着柔暖的幻梦潮水涌上，覆盖你全身。是一种彻底的温柔，对成年人和幼童一视同仁的温柔。  你知道他在提问题，但并不向你要答案，只是轻轻的提醒，仿佛家人在出门时背后一声：“外面下雨，记得带伞”。  想起来呀，那些平日遗忘和忽视的东西：树叶、光线、吻过脸颊的风。  你也曾为他们而快乐，比现在如此的容易满足。  找回那双幼童的眼睛吧，以充满好奇和趣味的视线望向世界，再看向镜中的自己。  如此的温柔刻骨，会让人想起那句对电影院的形容：  此地是让人作梦之处。,20,1.0,2
33,33,24733428,心灵奇旅,22663134d0a309005e0501668289f49b,338e6a3791a037440cbd5ae1fd8a6c95,5.0,2020-12-26 13:55:44,《心灵奇旅》刚成片的时候U小姐不能透露剧情，只在群里说了一句“这片值得看，把纽约拍得太美了”，刚看完，觉得一来，纽约真的太美了，二来，这个故事只能发生在纽约。 《心灵奇旅》的故事简单说，就是一个没有太大追求的人也是可以找到生活的热情的，这种热情在生活的细节里，理发师的闲聊，亲人的激励和相伴，再简单一点，微风拂过树叶、一块钱的便宜披萨、给流浪汉的甜甜圈、以及乱糟糟的地铁。这种又丧又平凡又对生活充满激情的气质，是独特的纽约气质。在所有的国际大都市里，只有纽约有这个气质。毕竟伦敦太丧，阴郁的天气和阴郁的面庞；而巴黎又太随意，随意到对“生活的热情”这件事完全不太在意；柏林对生活的热情还是有的，但是你能想到的热情就是各种各样有趣的性和先锋的设计；香港是钱；东京太过拘谨；上海，上海是有点这气质了，但是它只属于一小部分人，毕竟在上海的大多数人都被困在系统里。北京？哦，不好意思，北京不属于国际大都市梯队里的。 “对平凡的生活也充满热情”我一直都觉得，“平凡的生活”也应该值得你的热情。试想一下，这个故事如果发生在水牛城、拉斯维加斯、西雅图、或者如皋、常德、都不太合理。理发师的闲聊人生可以，推销办卡不行；亲人的激励和相伴可以，争夺房产不行；微风拂过树叶，中央公园的落魄小提琴艺术家可以，朝阳公园里大妈偷花不行；便宜的披萨可以，豆汁不行；给流浪汉的甜甜圈，扫二维码不行；乱糟糟的地铁？当然可以啊，毕竟没有过包安检啊。 但是其实我心里知道，这个理解是和《心灵奇旅》的主题背道而驰的。它讲的大概是，无论在哪里，有没有激情，都可以感悟美好的日常和人生。“世上只有一种英雄主义，就是认清生活的真相之后依然热爱生活。”大概就是这个意思了。但是因为影片把纽约拍得太美了，每个画面都在说：来纽约，来纽约，来纽约。我和月半合伙人相互羞辱，我的杀手锏就是“毕竟你这辈子到现在也就在世界上最伟大的城市里呆过不超过一个星期啊”，每次都直击他脆弱的自尊心，嘻嘻。,78,42.0,109
