,Unnamed: 0,电影id,电影名称,用户id,用户名,评分,评论日期,评论内容,有用数,没用数,回应数
84,84,24733428,心灵奇旅,d3ba3ffb141c3622a0273f2862088972,3a698f887b65bc2dd4865373ca91b344,5.0,2021-08-12 20:34:51,"鱼游向一条年长的鱼说： “我正在努力寻找他们所谓的海洋。” “海洋吗？” 年长的鱼说， “那就是你现在所在之处。” 鱼说: “这里是水，我想要的是海洋。”       《心灵奇旅》中有一个有趣的设定，逝去的灵魂将去往“死之去处”；在“生之来处”的新生灵魂则需要被赋予独特的个性，点燃胸前的“火花”才能获得地球通行证前往人间。     但火花是什么？ 起初加德纳认为火花是人生的目标，而他的火花是钢琴。 在他最接近自己的梦想时，他死了。因此他拼尽全力也要返回人间实现梦想。 仿佛完成了这个重要的演出，他将脱离平庸且重复的生活，从此变得闪闪发亮。 但当夜幕降临，人潮褪去，完成了那场梦寐以求的演出的加德纳却一脸茫然。 “只是我这一生都在等待这一天，我以为我会有不同的感觉。”加德纳说。 生活依然一成不变，地铁上麻木的人群，一个人的房间，黑暗中静默的钢琴。        第22号灵魂始终不知道自己的火花是什么，哪怕已经有千亿灵魂找到了自己的火花奔赴地球。 她只记得她意外坠落人间后体验到了很多美好瞬间。 饥肠辘辘时美味的披萨，理发店的棒棒糖，阳光下一对父女的互动，街头转角两个女人的说说笑笑，手指拨过栏杆的音乐；树叶轻盈旋转落下，犹如人间的精灵。 我们大部分人是加德纳，忘记了以22的视角看世界。 22 作为世界的突然闯入者，拥有着好奇和纯粹的眼光，能抛开被社会规则所捆绑的东西，发现生活最原始的模样。 她对世界一无所知，却最是能发现真理的那个。 加德纳实现梦想后的空虚，在于他错误理解了“火花”的含义，割裂了梦想与生活。爵士成为了唯一，遮蔽住了他看生活的双眼。
 他满心都是爵士，从没注意过母亲的默默付出，也没耐心听自己的学生诉说苦闷，对于好友理发店老板的故事更是漠不关心。
 直到22意外进入他的身体，才帮助他补足了长期缺乏的看生活的视角。 演出结束后，加德纳回到房间坐在黑暗里，从口袋中掏出22在他身体时顺走的小物件，种种经历浮现在眼前，他的灵魂才在刹那间被唤醒。 那些埋藏在回忆里的所谓平庸的生活碎片。 妈妈帮他洗澡，爸爸带他听唱片，骑行时散落的阳光和斑驳的树影，承载了日夜变换的街道，某天城市上空绽放的烟火，雨天独享的可口蛋糕，教音乐时粉笔写下的乐谱，海浪温柔地冲刷脚掌，偶然瞥见的晨曦…… 加德纳把所有回忆弹进音乐里，这一次音乐有了情感，变得充实而丰满。 一滴水只是一滴水，无数水滴汇集在一起就成为了海洋；每个日子是单调的，无数个日子串联起来就成为多姿多彩的生活 一盏灯平平无奇，点点光亮却能凝聚成宇宙浩瀚星海。         火花是什么？ “你的火花不是你的目标，当你准备好去活的时候，最后一个格子就会填满。” 所谓火花不是目标，不是梦想，是想要去生活的激情。而这份激情可以是目标却不止是目标，它也可以是一抹阳光，一片叶子，一块披萨。 在我看来，这部电影的主旨容易被误读为舍弃梦想拥抱平凡。 但梦想和生活这两者不是非此即彼的关系，影片更多讨论了两者谁是基石，谁包含谁的关系。 因为加德纳依然凭借努力获得了演出的机会，就说明了本片没有把平凡当做失败的借口。
 他在实现梦想后空虚，不是因为追逐了梦想，而是错把梦想当成生命的基石。
 不得不佩服皮克斯，片头9分钟有意让观众认为这仅仅是一个追梦的故事，却从更大的角度探索了生命的意义。 依旧秉持我最爱的风格，脑洞大开，将精神世界具象化，童话和极富想象力的外壳下包裹着对生命的拷问。 很多时候我们身处海洋却在寻找海洋。 追逐梦想让我们的人生更有意义，但梦想并不是生活全部的意义。 在如何度过一生这个问题上，无论以怎样的形式做出回答，愿我们都能像结尾的加德纳一样，好好享受生活的每一分钟。    【首发于：公众号晨安夏】",2,,0
85,85,24733428,心灵奇旅,7ef6d3b2955bdba7de39c48bfda49359,61d5b0feaf0a4b26013c7e05b7f6f330,5.0,2021-05-01 20:39:35,"在今日头条解说电影的公众号看了这部电影。
“我们从来不分配目标，你们张嘴闭嘴就是目标、人生意义，太无聊了”
“乔伊有些落寞，我为这一天，等了一辈子，我以为会有所不同”
“一条小鱼游到一条年长的鱼旁边说，我要找到他们称之为海洋的地方，老鱼说，海洋？你现在就在海洋里啊，小鱼疑惑不解，这儿？这儿全都是水，我想要的是海洋。乔伊瞬间就愣住了，突然间，他感觉到了一种莫大的空虚感，一瞬间，人生的目标、执念、意义全都被剥离了”
“现在目标实现了，可他并没有找到那个被称之为“意义”的东西，他以为自己一直在寻找海洋，可事实上，他一直都在海里”
“火花不是目标，当你准备好要去拥抱生活时，你也就点亮了火花”
“你回到地球后会做什么？你打算如何度过自己的余生？乔伊说，我不确定，但我能确定的是，我要尽情享受每一分钟”
“其实，无论人生是顺境还是逆境，我们都需要培养自己“感知幸福”的能力，感受夏夜的风、冬日的雪，感受潮汐和日落，感受每一个温暖而美好的瞬间”——比如，我在这烦闷燥热的换季前的夜里，身后纱窗吹来微凉微暖的微风，这是烦闷里的一丝幸福，我就要放大放大再放大的去感受它感恩它感知它享受它，让幸福刻意放大放大再放大，甚至让这幸福放大到侵占烦闷，点滴这样的小幸福，会淹没大烦闷，哪怕你始终处于烦闷中，也不要放弃享受当下的点点滴滴的小幸福，哪怕只是瞬间的小幸福。 “人生的关键在于快乐，人们问我以后要做什么，我写下了“快乐”，他们告诉我，我理解错了题目，我觉得，是他们理解错了人生” “为什么要给自己的人生定目标呢？梦想也没什么了不起的，实现不了也没什么关系，因为，并不是每个人都必须要有所成就，而我们追求梦想的意义，也并不在于是否成功，而在于，可以在这条路上感受不一样的风景，我们披星戴月的赶路，不是为了到达终点，而是为了披星和戴月”",1,,0
86,86,24733428,心灵奇旅,bb5e88ed6bfd4256b3f25849a8452031,ce71246d492d5d5468f0c69dd6281b3c,4.0,2021-04-14 12:58:33,"这个世界，有人因为被罚2000块自杀，也有人被罚180个亿依然风轻云淡。更多人像《心灵奇旅》里的理发师，想当兽医，但女儿病了，于是转身学了理发，因为理发培训费低一些。

很多时候都是这样，几千块就可以让一个人放弃一条路走上另一条路。然后，就再也回不去了。因为生活像一条狼，在身后紧追不舍，想休息或者回头是很难的。我想那个卡车司机也经历过和理发师一样的无奈，你以为开卡车是他的选择么？不，他没得选。

同一个城市里，有两个没考上大学的年轻人，一个家在城市，一个家在农村，会走同一条路么？吃住无忧的，可以用几个月时间去选一份合适的工作，可以先去学习充电，甚至在家打半年游戏也不耽误什么。没吃没住的，就必须先凑合，就可能病急乱投医，还可能被骗。从事一份报酬极低的无聊工作，不多的工资，刨开衣食住行，有点积蓄还要反哺家里。几年过去，依然没有得到可以几个月不工作去学习充电然后转行的必要积累，也是大概率事件。

你有得选，因为有人替你撑着。但别人未必。中国有3000万卡车司机，有多少人是因为喜欢开卡车，有多少人是生活所迫莫名其妙成了卡车司机？

我喜欢《心灵奇旅》。它借乔伊之口说了，我的生活才刚刚开始，如果我今天死了，那我的人生将一事无成。然后用“平淡是真”“生命的意义在于体验每一天”的哲学，去中和它，破执。这部电影比较好的是，它没有将两种哲学完全对立起来，而只是善意地提醒。它既肯定了乔伊的为梦想发狂，也肯定了生命的细腻感知。而这种双重的价值肯定，是符合乔伊的身份设定的。乔伊的家境和经济状况还算不错，母亲在纽约这样的城市有一家老店，自己也做着音乐老师。也就是说，他还是有细品世界的条件的。

如果换一下，用这种平淡哲学、体验哲学去提醒那个卡车司机，就非常无耻了。一家老小的生计押在一个收入微博的人身上，自然无心看风景。如果你母亲年老多病，孩子上着很差的学校，家里一个月难得吃一两次肉，你还有心思看云卷云舒么？责难一个挨饿的人为什么不看看花开得多美是残忍的。

《心灵奇旅》是部好电影，但梦想是奢侈的。很多人的梦想在萌芽时就被摧毁了，而这些人的感知，必须马上粗糙麻木起来。太敏感的人，在恶劣环境中根本活不下去。

不要嘲笑那些人穷志短的人，不要嘲笑那些为了生活奔波忘了审美的人，更不要嘲笑那些看上去好像不珍惜生命的人。你根本不知道他们的起点有多低，生活中发生了什么。你已经很幸运了，就不要苛责泥潭里的人了。",3,,1
87,87,24733428,心灵奇旅,a56c9d6003d69dbf0d0f4f969d353bbe,61dae3af518bd4e10bce63eeac100a19,4.0,2021-03-30 21:28:44,一部制作优良的鸡汤电影，要讲的也很简单：值得你活下去的不是独一无二的目标，而是一个一个的瞬间，一个一个让你觉得值得的当下。 感觉好莱坞在人生意义上真的是在开倒车。《阿甘正传》《当幸福来敲门》里还有美国梦，还有人人生而天赋，有适合自己去做的事情。《心灵奇旅》里只能说活在当下了。 活在当下当然没问题，但是一般对焦虑症和抑郁症患者才这么说。 自从我们进入现代化，西方摆脱了神学，东方摆脱了宗族之后，一个问题就是人生的意义是什么？以前是上帝，是功成名就，是儿孙满堂。工业化之后是做人上人，是赚钱住大House。 但是现在，资本的回报率超过劳动的回报率，大多数人做不了人上人也赚不到钱。 于是就只能安慰说活在当下了，大家都要坚持苟下去，长命百岁，寿与天齐，争取看到大厦崩塌。,1,,0
88,88,24733428,心灵奇旅,35e3be616c5cccb653d0d37f525d241d,777fc891c6b348608d449778a85d7d57,3.0,2021-03-01 19:28:34,说实在，我觉得这并不是一部适合小孩子看的动画片吧，这只是给成人看的吧，小孩子等看懂这片子到底要告诉他们什么才怪的。怎么说呢，总觉得这部影片想要重新复制寻梦环游记的成功，然而却拷贝了一个不伦不类。画面没有寻梦那么魔幻那么美，故事没有寻梦那么流畅那么接地气，表达的内容没有寻梦那么易懂那么容易共情，这就注定了票房的差距那么大。看的我真是一不小心就会走神，小孩子要能坐的住看那才怪呢。反正吧，这片子定位和立意都很奇怪，不伦不类的，真是相当的不推荐，出品好的动画片也是不易啊，到时反而国产的现在越来越有水准了。,3,1.0,0
89,89,24733428,心灵奇旅,ff33022dc5d383a7cb3cf01c769c68c4,41e60ba14a035226c721d81255900795,5.0,2021-03-01 19:27:41,真的，看着片子没多一会，我想到了很多关于灵修的小说，也是很搞笑了。人为何而生，这么哲学的主题，说实在的，也不太好拍动画片吧？或者是以为动画元素可以更多想象去表现这个主题？反正我是没看出来片子的内涵来，emmmmm，果然奥斯卡也不一定适合我啊，在国内市场遇冷不是很正常的事吗？拍的不好怪观众这种怪圈哪里都有啊。毕竟并不是所有的奥斯卡都曲高和寡，口碑票房双丰收的也不在少数，说到底还是艺术和生活的契合问题。可别跟我说什么大道理，就简简单单一个活着就好好感受珍惜身边的一切，非要演绎的这么复杂，谁认哪。,4,,0
90,90,24733428,心灵奇旅,564e307d7651d59b8618d0906290a5b3,8c759874436bccf98e49e68c5eb4ca15,4.0,2021-03-01 19:26:30,这部看起来似乎很有想象力的动画片，其实一点都没啥创意。灵魂这个概念东西方都有，也都有各自各种生动全面的诠释，而这部片表现得所谓心灵奇旅，却是一点也没看出来奇在哪。整个片子里很有很重的寻梦痕迹，却没有寻梦这样相当流畅自然的故事作为载体，感觉特别生硬，设计感十足，完全不能让人产生共情。也不知道男主突然的开悟到底是什么原因，就因为有一出成功的演出？那这悟性也太好了，要真这样好，还会蹉跎这么多年吗？整个剧情的发展跟要表达的活在当下主题特别脱节的感觉，好像生搬硬套要拉郎配一样，太别扭了。,3,,0
91,91,24733428,心灵奇旅,be68373ffb502d7bf5f8baffbd6ef8c3,da71f6e9dd2bce80d248d9f7cb4e02e7,5.0,2021-02-16 00:58:22,被朋友安利着看了这部电影，过程一直觉得平淡无聊，中间简约的画风都让我怀疑迪士尼缺钱了，最后的小高潮让我觉得这个票钱还是值了。 这部电影传输的核心很简单，目标也好、梦想也好、才华天赋也好，都不应该是人生的全部，他们出现的意义是让人去爱生活，体验生活。 道理其实大家都懂，但是日子过着过着就忘记了，这电影有点醒作用吧。看完电影的这天晚上，听着歌出门买水果，回家路上抬头看清朗的天空，觉得生活真美好呀。 在《荒原狼》里有这么一段——如果你在为某种美好的事物和某种理想斗争，而认为你一定要达到目的，这样倒是要平庸得多。难道理想都能达到吗？难道我们人活着就是为了消除死亡？不，我们活着，正是为了惧怕死亡，然后又重新爱它，正是由于它的缘故，有时这一点点生活在某一小时会显得如此美妙。 目标一定能达到？梦想一定能实现？实现之后呢，生活还在继续。目标、理想等等，只是人生的一种体验，在体验各种各样的事情中，感受生活的美妙。,3,,0
