,Unnamed: 0,电影id,电影名称,用户id,用户名,评分,评论日期,评论内容,有用数,没用数,回应数
143,143,24733428,心灵奇旅,1e47a0f7ab9758512364b8e001aacfe7,cfe36210714e6a5463adec877f35930d,5.0,2020-12-30 11:09:49,"太妙了太妙了。看完电影，迫不及待想写下来点东西。此时此刻我在14th St &amp; 8 Av的公寓里，离那个可爱疯狂的街头艺术家只有一街之隔。 在钢琴的即兴音符陪伴中，听着最后一曲It's All Right, 看到影片最后一秒。我心中没有失落或者迷惘，而是感到无限的慰藉。 电影里面有两个比喻我觉得尤其精妙。 Spark是什么。为什么我们常常把它误解为Purpose？ 在黑暗荒原上，我们看到漂浮在空中的一个个云朵，那是幸福的人们沉静在自己的世界里。我们可以叫它“the Zone"",或者是""Flow""，那是一朵朵的忘我之云，代表了凡夫能体验的最美状态。 但镜头一转，云朵之下，阴影之中的迷失原野。云上的人，一不小心，就会掉落原野之间，成为被执念所笼罩，在生命原野上迷失方向的无心怪物。 就像喜欢写字的人，忘记了写字的美好（Spark），而执着于写出流传于世的作品（Purpose）。 就像在山巅的滑雪者，忘记了当下飞翔的瞬间，而想着赶超身边的人最快到达终点。 就像一开始被色彩和形状吸引而拿起画笔的人，忘记了在画布上玩耍本是多么有趣，却想着被发掘，功成名就的一天。 或者，就像Dorothea所说的，我们本就是鱼，徜徉在水中，而你却要执着去到大海。 又或者，还有很多像我这样的凡夫俗子，心中本就迸发出对某件事物的热爱了，但却觉得，这还不够，我要把它升华成什么更厉害的东西。 22号是什么？它怎么找到自己的Spark？ 由聪明幽默才华横溢+我的偶像Tina Fey配音的22号，一开始，可能代表的是我们心里最阴暗最愤世嫉俗的角落。 那个角落的我们，质疑生命，质疑存在。我们嘲笑执着的人，自以为看穿所有热爱的本质。 我们可能都曾经在某个时刻触及过那个角落，然后，我们要么是被其黑暗力量所震慑，赶快弹开，从此不敢再注视，又或者，我们走进那个漩涡，越陷愈深，最终甚至想要逃离生命。 可是，片中其实已经告诉我们了，22号厌恶的，不是生命本身，而是在“万物大厅”里陈列的所有二手经历，是所谓权威和智者想要灌输给我们的规训。 也就是说，22号厌恶的一切，都是抽象的。是一个idea，一个想法，类似于，“我要成为一个歌手” “我要拯救世人” “我要拍出伟大电影” “我要成为知名脱口秀演员” 这样的抽象的概念。它只存在于头脑之中，与世界并无任何连结。 22号厌恶这些，是因为，它自己并没有在地球上呆过一天，体验过一分一秒的生命。 所以后来，它的眼睛看到落下的银杏叶， 它的味蕾尝到世间的美味， 它的耳朵在地铁站的嘈杂里听到旋律并为此感动， 它体会到小女孩专注神情后的陶醉， 它感受地铁带来的热的风，看到蓝色天空漂浮的朵朵白云。 它才真正开始体验生命是什么。 如果说生命有意义的话，那个意义不在头脑中，不在对过去或者未来的推理中，而是在现在的这个时刻里，这个由所有体验共同组成的叫做""当下”的东西。 让人爱上地球，想要来体验一遭，可能就只需要这些吧。",8,,3
144,144,24733428,心灵奇旅,f8117805dc19747144057ed577a361bf,b00f1201fa3cda7b04e88fc24b25db7d,5.0,2020-12-30 03:46:31,"电影里灵魂状态的“人”们很可爱，想写影评是因为影片的宇宙观和我的部分相似。地球是一个体验场，灵魂们借助肉身，可以更好的体会到pizza的美味，植物的芬芳。而在灵魂状态时，没有生死，没有疼痛，甚至没有好与坏，一切处于混沌。 前半段男主Joy在灵魂训练场里，帮助22找purpose，他认为每个灵魂都会被赋予不同的热情，它们可能是音乐，运动等具体领域。（看到这我差点误以为soul和其他鸡汤电影类似） 直到灵魂指导漫不经心的说了一句， “Your purposes. your meanings of life. So basic."" 我觉得更好的翻译可以是， “生活就是你的本来目的，如此简单。”  在这里，每个灵魂是自愿选择来到地球，进行今生的体验。活着的每一秒钟，都是目的，体验肉身，体验悲欢离合，体验高尚与卑劣，智慧与愚蠢，体验阴与阳。 电影的叙述深入简出，虽然没有描述灵魂的来龙去脉，但是围绕着去地球这个体验站，已经带给我们思考的意义。 不用责怪任何人为什么把我们生出来，而是感谢宇宙让我们有“生”的机会，生活多美妙！",1,,2
145,145,24733428,心灵奇旅,d73072f9a8b85838e02a9b3ba7e6a5c5,c5105ad5a439955d9b764174613b0d7f,,2020-12-29 14:30:17,刚看完，真的太感动了。 电影讲了一个很简单的故事，但能从这个电影传达出来的东西可太多了。 就像22一样，也许我们在跳进地球之前对地球也充满了厌恶，明白地球的不美好，生活的遗憾，那我们还会不会义无反顾的前往这个不完美的世界？世界的美就恰恰在于他的不完美，而我们缺少的是从不完美中找到那些如“阳光下的落叶”，“角落里的披萨”，“地铁里的吉他”和“与爱的人的拥抱”类似的感触。 我们每个人都有spark，就是这个小小的spark一直在帮助我们更好的感触世界，找到我们的life purpose（人生意义）。理发师一开始的人生理想并不是理发师而是兽医，他的spark也有可能并不是一把剃头用的推子而是一只小动物，可他依旧找到了能让他感触这个世界东西，那同时也是他所爱的职业。 我们都有spark，亦有purpose，我们又是怎么知道这是我们的life purpose的？人人生而不同而又相同，我们对世界的感触也是不一样的。我们在人生不同的阶段找到了我们终其一生想要寻找的目标，我们也用尽全力的在为了达到这个目标而奋斗。可就像Joe一样，达到目标后的虚无缥缈，已经有了全部之后的那种空虚，是我们可承受的吗？这是我们每天都在思考的问题，或许生命真的就从跳入地球开始，在迎接那束光中结束。我们也经常在选择理想与现实之间所挣扎，我们每天都在为目标而奋斗，但得到了之后却是空虚一场，最后思考活着的意义。 但这部电影还是告诉了我们很多关于生活的东西，如何去感受美好，如何去接受他的不如意。最后希望大家和Joe一样，不管你有没有达到你的人生目的，你都依旧可以认真的享受生活。 希望你在地球上玩得开心🥳 最后说一句，迪士尼和皮克斯真的太厉害了👍🏻，respect！,3,,3
146,146,24733428,心灵奇旅,86cd61958c2a53db2c9450f7308e0115,2c29ca0e16666316348a12e93a631bdc,,2020-12-29 12:24:06,其实从最一开始Jerry就向导师们解释了Spark的意思，但Joe当时满脑子只想着怎么骗到地球通行证，走了神(于是观众也没能听见)； Jerry即将介绍何为Spark时，Joe开始走神导致先入为主 无独有偶，在人生殿堂里看到自己独自一人在餐厅吃饭时，下一秒Joe其实就能看到自己因美味而露出欣喜满足的表情，可他却在此时匆忙偏过了头。 Joe人生殿堂那些阴郁的记忆都能在之后的闪回中看到不同的一面 我全片最喜欢的一个镜头也是这样异曲同工的设计：Joey从猫的视角看到自己的身体躺在通风口放肆时，只觉得22调皮可爱，但后来再从自己的角度回忆，视线随着飘起的领带上移至天空，方才体会到22被点燃的也是自己长久以来忽视的Spark。 看看天空 有观众怀抱着对coco的期待观看本片，只得到了没什么剧情、讲述的道理也很普通这样的结论，实属可惜。如何捕捉像这样不着痕迹流露在日常中转瞬即逝的Spark，才是本片的Soul之所在，也是难度所在。它既不像头脑那样旨在建立起一个与科学理论高度契合的概念世界来探讨各种分明的情绪（本片建立的灵魂世界显然没有在追求逻辑自洽，更多还是在为引出主题提供讨论环境），也不是coco那种将人世间最普世的情感在观众眼前活生生剖开以求共鸣。它们都足够强烈和清晰。 而本片描绘的很多日常细节和其中蕴含的情感体验，都只是潜藏在生活中的一种微妙体会，往往说出来嫌矫情，想倾诉又怕言语无法真切地传递。如果导演把握不够精准充分，很容易就会沦为观众难以下咽的假大空鸡汤。但Pete用扎实的功底和对生活的热爱与细致观察，为影片注入了足够有感染力和说服力的细节，成功地至少让大多数人都经历了一场心灵奇旅。 影片对于灵魂世界的搭建对皮克斯和道导来说或许是驾轻就熟、游刃有余的，毕竟他们曾创造出过更宏大瑰丽而富有创意的世界观。但这次对于现实世界的细致描绘和几段关键情节的编写和精准调度，以及摒弃传统所擅长的重情节+强煽情模式而选择挑战具象化一些难以表达的情绪从细节上渗透，对我这个老皮粉来说，已经是一份惊喜和突破。 我永远爱皮克斯和道导。,4,,0
147,147,24733428,心灵奇旅,0704cf4e64ad99ad7f4b5afc29ba12f5,4babaa0f819ed2f34e62919ed30ce383,5.0,2020-12-29 11:34:42,我不知道世界上有多少人与我一样，对世界上的所有已知项目都称不上有多大的兴趣，顶多对个别项目能说一句略有偏好。从头到尾也没什么出众的地方，最出众的地方可能也就比平均水平高出一小些。作为一个既没有太大兴趣也没有任何特长的人，可能明明是主流，却在主流中有种迷失感，而这种迷失的感觉又很自然从社会中卷进来一些焦虑。 这部电影为我抚平了这种焦虑。 虽然大殿里放出的男主角乔伊的生活很普通，也许在一段时间内甚至很失败，但依旧很让人羡慕。在影片开头，我就觉得我不如乔伊。乔伊好歹喜欢爵士乐，好歹有着人生目标，当着教师，内心还有渴望，依旧希望着能有一份演出的工作，并且机缘巧合有了一个登台的机会。我仔细想了想我有热爱的东西吗？我可能没有。我只有偶尔逼自己看点书，学点习，上下班路上听点歌，午休医生不让睡觉所以看点电影，哪怕追星也还是很理智。我的前方可能并没有一个兴趣让我可以为之努力奋斗，至少目前我还没找到。我的才能也不足以支撑我得到一个可以成功的机会，工资太低想找个副业甚至都不知道能干什么。生而为一个普通人可能是大多数，生而为一个没什么兴趣的普通人是大多数吗？我没有问过。 我觉得这部电影主题的表达至少可以分为两个层面，第一个是，像乔伊这样有着目标与执念的人，希望他们不要把目标或者执念当成全部，就像那只想要到大海的鱼一样；第二个是，像22这样花了很长时间依旧找不到所谓“spark”的人，其实spark不一定要是热爱或者天赋，可能仅仅是我在大西北看到银河的时候那种很纯粹的心情。 这部电影对我的意义，可能更在于：对生活本身而言，没有什么必需品。 我其实一开始就哭了。我外婆也是突然走的，我想她当时也许也跟男主一样感受到了慌乱与不知所措，伴随着孤独与害怕排着队走向生之彼岸。如果她听到另一位老奶奶说我等这一天等了很久了，她也许会在内心说哎真羡慕呀，我都没有等的机会。如果老奶奶心善也许会说上一句，那你也挺幸运的，等待其实也挺难熬的。我觉得电影里生死之间的这些世界，也是我们生者的一点希望与慰藉吧。 中间还会有两段。 最后我想说，这部电影表达了很多东西，如何在表达了这么多东西的情况下依旧能保持剧情的清晰性、完整性与连贯性，我觉得是值得国内有些动画电影的编剧好好学一学的东西。分析这部电影可能可以从很多很多点出发，每个点都不是点了一个鞭炮就跑，也不是故意到处点鞭炮就为了彰显一下我很多鞭炮。一部有深度的优秀电影，对我们的意义可能不在于它的深度到达了多深，而在于它的厚度，这种厚度会带来宽容，而宽容会让每一个人看到他能看懂的部分并有所体会。,2,,0
148,148,24733428,心灵奇旅,287db5235f3bb4d9beddb5ee238a1dcf,daa9cae328ece759a4a67bd41990eb73,5.0,2020-12-29 01:24:29,《心灵奇旅》是《寻梦环游记》的原班人马制作的动画，上一次在《coco》里，他们展示了一个五彩缤纷的亡灵世界，这次他们用空灵梦幻的色彩去构建了一个the great before，降生之前的世界。之前在《coco》里，制作团队用高调的大面积暖色、丰富斑斓的色彩及繁杂富丽的花纹去展现亡者的世界，而这次，他们用冷色调渐变、大繁至简的线条去讲述“生”，不得不称赞一句：“艺高人胆大”。动画主题本是在讲生命的spark，却始终大面积应用了蓝绿紫这样冰冷理智迷幻的色调、甚至深沉深邃的黑色；但在那个“这只是一个盒子”里的暗黑世界，既有忘我心流状态中的活人，也有堕落黑化的沙人，在这样神秘未知的空间中，那艘拯救迷失灵魂的船，居然是荧光粉！这样反刻板印象的色彩运用不得不令人抚掌惊叹，可要赞叹的远不止这一点。        其中有一处令我自己啧叹的，是在我坐定不久，主角就掉进下水道，灵魂站到了通往the great beyond的阶梯上，瞬间这个画面与数分钟前我的亲身经历产生了呼应，世间巧合，妙不可言。         这部分分镜设计是最令我惊奇的部分，抛除剧情的加持，仅仅美术水准就已经超神，制作团队完全是在以做一件艺术品的态度去做动画。有博主提到“神性”，然而我对神秘学毫无所知，无法在这个层面与她交流更多。         动画里的the great before被设定为一个什么高维度量子场%#…&amp;%……（我实在不记得具体怎么称呼了），然而场景中的主持者们Jerry和Terry却是最简单的二维形态；主角在高纬度空间穿梭的镜头，同样也是用简单到最极致的直线来表达（这在静态纸面上很常见，鲜少见用于三维动画）。通往the great beyond的“阶梯”这样一个“联通生与死”的重量概念，在场景中依然只用最单薄的线与面。画面中用黑与白的溶解与汇聚，来展现生与死的分界，大道至简，大象无形，世间最绝对的对立，只用最分明的黑白来表呈现。        同样是用抽象形象，表达抽象概念，我们习惯了曾经在《超能陆战队》里高维世界里斑斓的多彩的不可名状的充满星云形态物质的世界，以至于到如今甚至已经有些审美疲劳，什么高维世界都拿这堆掉进调色盘里的棉花团来搪塞，做的好呢，五光十色，做得差……好的我努力脑补一下。《心灵奇旅》在这里返朴归真，在吉卜力选择制作三维动画的尝试时，开拓了三维动画领域的皮克斯反而选择了用二维画面展现剧情，这分别在各自技术领域登临顶峰的两者，在新的时代都选择了跳出舒适区，在过去未有触及的领域中做出尝试，令人耳目一新。我对影片的期待大多集中在故事剧情上，却完全没料想，动画技术已是世界巅峰的皮克斯（或者说迪士尼），在动画艺术上依然尝试探索。,8,,2
149,149,24733428,心灵奇旅,a97dedc740cf6eb30a78d20f1e8a8467,976cffafc0b80f9e4617d8e093dddfa2,5.0,2020-12-29 02:27:24,"买了晚上十点的票，买了一瓶柠檬汽水，25块钱，百丽宫，真有你的。人稀稀拉拉，但都围绕着中间坐开，且都是年轻人，感觉和同场观众都亲密起来。有几个男生开场时还在高谈阔论，即时发表观点，本来想戳戳他们叫他们安静点，又不想让他们心情不好，还好后来慢慢也安静下来。 在笑点到来时大家都整齐地笑起来，氛围特别好。旁边坐了个披着粉色毛衣的女生，有一些笑点全场只有我和她笑起来。我不能说我没有感到某种奇妙的连结。片子本身的构思太巧妙了，想象力疯狂飞驰，完全摈弃了合家欢电影的说教(‘you cant crush soul here, that’s for life on earth’) 和俗套段落，饱满不拖沓，很多转折我都没能预判，一次又一次被惊喜到。太可爱太有灵气了，到底是怎样有创造力的人才能做出这样的世界观设定啊？且本身制作也太漂亮精妙了，我真的很喜欢皮克斯的角色设计和视觉表达，空间也营造得很好，不论是虚构世界还是有实体的纽约（第一个纽约地铁的镜头，以及之后的纽约夜景，都让我忍不住鼻子酸了；我可以说我恨纽约，但没有人能对它不保有一丝的怀念和爱，不能吧），即使场景一直在切换看的时候也能迅速在头脑中构建很大的空间概念。 几天在写年终才在想，‘要尽力生活下去，捱到下一个重新对生活充满热爱和好奇心的时刻’，和电影本身要表达的是个奇妙的巧合。雄心壮志和远大目标从来都没有零碎的生活碎片可爱：落叶，阳光，食物，还有身边的人的快乐，可能比似是而非的终点线更值得追逐吧。我一直是这么觉得的。因为选择了终点线，而关闭感知生活的感官的人，始终都让我感到非常害怕。气温，风景，甚至只是充斥着陌生面孔的人群，都可以是生活慈悲的恩赐，人都能从中解读出美丽来。有些人是不能的，我知道他们不能，知道我不能和他们谈论天气。如果说我对自己的什么特质感到自豪，那一定是我的感知能力，我和路边小狗做朋友的能力。我是这么觉得的。 亮灯后很多人都坐着看完了演职人员表，我身边的女生也是。一直紧张地想要是勇敢一点我就找她说点话吧，但也清楚地知道我不会的。抱着也许能和她说上话的期待坐到了尾声，已经快十二点了，保洁叔叔站在我们这一排的末尾，觉得有点不好意思，所以收拾好杂物走过去把东西扔了，站在出口处靠着墙看到了最后，屏幕黑下来。妹想到Terry（它也叫Terry吗？）跳出来说，电影结束啦！快点回家！全场又是一阵哄笑，我也笑了，这也太可爱了。 广州今天的天气穿着一件单衣一件小马甲正好，晃着回家非常舒服。希望一直都是这样的天气，也希望能再看到一场这么好的晚场电影。能在生日这天看到这部电影真开心。祝我生日快乐。祝我天天开心。",1,,2
150,150,24733428,心灵奇旅,0aafef15fe22eb0a4a6a44bc7d0b778d,43f6619535e70d1709d9d1a5c486f703,5.0,2020-12-28 22:32:16,"人生的意义是为了追求目标吗，如果目标追求到了，如果梦想实现了，那又会怎么样呢，结果是不会怎么样，人生还是那个人生，就像在电影中管理着要“生之来处”的物理量子杰瑞在问完男主想要回到地球的原因之后的那句话“许多人总喜欢把追求梦想当成人生的意义，这样想就未免太复杂了。”我们穿梭在车水马龙的人群当中，每天要挤公交车，要去上班，要在梦想和现实之中纠结，人生的意义到底是什么，追求梦想？实现理想？把平庸变成不平庸？不，不，在人的一生中，这些都不是最重要的，我们可以平凡，我们可以实现不了我们的梦想，我们在人群中就是很渺小，可是我们活着，我们感受的喧闹的人群，我们感受着车水马龙，我们感受着拥挤的都市，我们感受着生活的烦恼，或许，人生的意义没有那么遥远，只是活着去感受就好。

这部电影非常地优秀，视觉、作画、音乐、情节、故事设定等都可以让观众觉得非常地震撼，去“生之彼岸”，心有不甘，因为梦想才刚刚实现，人生才刚刚进入正轨，在“生之来处”因为被弄错，成了一个数百年也不愿去地球的灵魂——22号的导师，这就是男主，乔伊，他就是位很普通的黑人音乐老师，一边想要追求爵士乐的梦想，另一边又苦于生活问题在一所学校当音乐老师，在学生中，只有一个女学生对音乐充满了热情，喜欢吹单簧管，其余的学生在他的课上找不到丝毫热情，乔伊就这样一边靠零食的老师职业维持着生计，另一边又在心中怀着对爵士乐的狂热梦想，就在他辛辛苦苦煎熬的时候，他所在的学校把他的职位转正了，按道理来说，这应该是一份不错的“铁饭碗”，可是就在同一个时间，他曾经的一个学生来告诉他，他所欣赏的一个爵士乐队因为临时缺少钢琴手，所以请他去帮忙，闻讯，乔伊立刻就赶去了爵士乐队进行排演，他出彩的表演很快就得到了女队长的认同，女队长让他晚上同一时间再到排练的地方来进行正式的演出，听到这个消息，乔伊自然是很高兴的，不过另一方面，他的母亲却在劝他接受学校的工作，因为乔伊的父亲就是玩爵士乐的，他的母亲不想让他看到他走上父亲的路，因为那会受很多的苦，不过乔伊却在坚持着对爵士乐的爱，虽然表面上答应了母亲，可是在听到女爵士乐队长亲口跟他说可以参加乐队正式演出的时候，他还是非常兴高采烈。  人一高兴的时候就会忘乎所以，乔伊也是如此，一高兴冲上马路，他差点被迎面而来的车子撞死，差点被从楼上坠下来的砖头砸死，不过，最后他还是因为掉到了井盖里，嗝屁掉了，嗝屁掉之后，乔伊的灵魂来到了“生之彼岸”在通过其他灵魂之口得知这里是通往生命终点之地时，乔伊的灵魂立刻开始往回跑，他那不惜挤过人群、不惜被“生之彼岸”的巨大引力，吸引着还要往前跑的场面，不正是每一个人对生命的渴望程度吗，乔伊一边跑一边说，“他的人生才刚开始，他不能就这么死了。”在那个时候，他只是想要活着去实现他的梦想，对梦想的强烈，对生命的渴望，让他往“生之彼岸”的反方向拼命地跑，最终他因为一脚踩空，掉入了灵魂出生的“生之来处”，然后还被管理要出生的灵魂的物理量子杰瑞，误当成了“生之来处”的一个导师，乔伊本来想从“生之来处”的出口直接往地球上跳的，但是因为缺少了通行证，所以每次下落到一半，他又会被引力吸回去，在“生之来处”那些灵魂导师的任务，就是帮那些即将去地球的灵魂，找到他们人格中所缺失的火花，让他们拿到去地球的通行证，在给要去地球的灵魂分配导师的仪式上，乔伊因为被误当成了一位儿童心理学专家，所以被分配给了一位在几百年的时间、被无数位了不起的人物教育过、却从来没有找到属于自己的火花，也并不想去地球，认为生命没有意义的灵魂22号，乔伊与22号达成了一个协议，也就是乔伊帮22号找到生命的火花，然后22号把去地球的通行证给乔伊，这样子的话，22号可以不用去地球，乔伊也可以重新去实现他的梦想，但是不管乔伊怎么努力，22号也找不到属于自己的火花，乔伊带着22号来到了有各种东西的陈列馆，让她去品披萨吧，她品不出味道，让她去弹乐器吧，她感觉不到音乐的美好，让她去试试消防员，她反而觉得大火烧起来更好玩，因为缺少感觉，所以她感受不到地球上的那些事物所带来的美好，眼见22号擦不出生命的火花，乔伊的心里也很着急，这个时候，22号灵机一动，想到可以去一个地方，她带着乔伊来到了人们专注于一件事情的时候，灵魂出神后灵魂所在的“出神之地”，这里有很多因为太过于专注一件事情而迷失了自己的灵魂，这里还有一个专门拯救那些迷失的灵魂的船长，他是男主生活的纽约一条大街上的街舞者，船上还有几个船员，要么是萨满，要么是巫师，要么是密修者，反正都是可以入神很长时间，然后让灵魂来到出神之地的，船长先是拯救了一个因为工作入神而走火入魔的灵魂，然后就开始询问乔伊和22号的问题，在了解两人的需要之后，船长表示这个事情很容易办到，然后就打开了通往地球的通道，乔伊通过感知找到了自己正确的位置，他现在正躺在病床上，脚边还有一只小猫，看到自己身体以后，乔伊迫不及待的就跳了下去，结果把22号也带了下去，然后阴错阳差地，22号进入了乔伊的身体，乔伊进入了猫的身体，而另一边，一个管理通往“生之彼岸”的物理量子发现去“生之彼岸”灵魂少了一个，开始细心的查，最终查到了乔伊。  （未完待续）",4,,0
