,Unnamed: 0,电影id,电影名称,用户id,用户名,评分,评论日期,评论内容,有用数,没用数,回应数
0,0,24733428,心灵奇旅,6d9c8e4ff95227096d8cdf2471cdec7e,6d9c8e4ff95227096d8cdf2471cdec7e,5.0,2020-12-26 13:39:11,如果你的2020年和我一样糟糕，年末实在没有什么值得总结只能勉强交出一份“我还活着”的答卷，那么当你看完《心灵奇旅》这部动画片时，也许会在世界某个角落和我一起击掌——是的，一事无成也没关系，至少这个故事给了我们慰藉。 皮克斯用第23部动画长片证明它在创新路上已走得更深更远。我一边享受视听、主题、情节各方面带来的震撼，一边又为之焦虑不已。看来它不打算做一个爆款IP，甚至不打算面向动画片的主要受众——孩子，而只是变成一小部分成年人的围炉夜话——来，我们来聊聊人生。 噢人生？有什么好聊的。尤其当30岁以上的成年人走进电影院时，大部分人不过想在平凡生活的罅隙里透出一丝张望，喘口气，大笑一场，然后若无其事地走出电影院，继续回到现实。 可《心灵奇旅》多么过分。它不仅没有把你从现实拉出去——作为一部动画片，它放弃了制造童话般的奇幻仙境——反而把你又塞回那个熟悉的世界，喧嚣的城市、热闹的街道、拥挤的人群……你依然听着市声、被闪烁着灯光、在车水马龙人来人往中感受自己的渺小。    是的，这个主角和你一样平凡。乔伊，一个黑人音乐教师，抱有音乐家的梦想，却囿于学校音乐教室担任一份并不重要的工作，和根本不爱音乐的孩子们在一起度过一日又一日，才勉强得到一个被恩赐的“铁饭碗”。 他的母亲可能和你的母亲一样。嫌弃你年过三十都没有稳定的工作，依然要靠她这半生辛劳才能换得你相对的稳定。而你漂泊那么久好不容易获得一份有社保的工作后还要和她提什么梦想，她只能把眼前所做的一切奉献展示给你，让你望而却步。 是的，多么熟悉。就像我，或者你，我们的每一天。《心灵奇旅》放弃创造更美更好的童话，哪有什么冒险王、探索队长、勇士奇兵，我们看到银幕上的乔伊就像乔伊在另一个世界看到他自己——乏味，无聊，没有明天。如果他也有生命的“丰碑”，那座雕像并不因为死亡的赞助变成一个伟人。他依然是洗衣机旁坐着发呆等衣服洗好的一个人，只是变成了雕塑，毫无惊喜。 这种平淡的回望令人害怕。它确实抛出一个我们在以娱乐为目的看电影时并不想面对的问题：我为什么活着？ 我甚至觉得创作者残酷。毕竟乔伊身为平凡人活着时还有一份执念，要做一名爵士音乐家，至少在梦想的舞台上发光，哪怕只有一刻。而大多数的人们……我们……如果连乔伊那样最低限度的梦想（或曰“人生目标”）都没有，那我们庸庸碌碌的每一天，又是为了什么？ 这个问题残酷到让你不得不面对它、思考它、考虑它的答案的紧迫性，因为生命忽然有一天走到尽头，人生最大的偶然来临。那个无比熟悉的问题令人震颤： “假如现在你就会死去，你是否遗憾？” 乔伊在通往“生之彼岸”的大道上拼命往回奔。我万万没想到在皮克斯动画片里会看到这样恐怖一幕，它预示死亡的必然，预示生命的有限，预示我们每个人都知道的常识，我却毛骨悚然如坐针毡。 我甚至迫切地想要做点什么，赶紧思考出我的答案，回到我可以追溯生命的某一端，重新开始，找到生命的火花，无悔地再过一次…… 恰在这时，皮克斯给出它暖心的一面。“生之彼岸”有多令人恐惧，“生之来处”就有多让人充满希望。在这里你是崭新的，自由的，开放的，充满任一种可能。在这里你可以畅想如何活着，无知无畏地开始一趟旅程。  不过不要放松警惕。思考生命的意义没有因为“心灵学院”的温馨环境变得无关轻重。 重要人物22终于登场，她已经活了几千年，心灵苍老到不报任何希望地“活着”，且仅以这样庸碌无为地“活着”为乐趣。 这可能是我在动画片里至今看到最“邪恶”的人物。尽管她长着一副软萌面孔，她的内心却黑暗至极。她比任何一个正邪二元对立动画片里的“坏人”都要令人心惊，因为她不是某一个别人，可能恰恰就是我们内心里的另一面，另一个自己。 代号22，她代表了无望、自卑、封闭、畏惧、偏执、仇恨、……任何负面情绪在她身上都有理由，她并不打算去活一趟。在“心灵学院”她已成了一个冥顽不灵的老滑头，人类几千年历史中的各种伟大灵魂都打动不了她，她具备一种黑暗至极的能量——没有希望。 在动画片中，没有希望已被说得太过委婉。没有那个“通行证”，没有生命的火花。生死概念被描绘为一个具象世界，没有灵魂即没有火花，不过在银幕上没有闪烁一下。可是在我的抽象意识里，她的没有火花已代表无涯的黑暗。 打造这生死两端的具象空间并非多么有创意，毕竟前有《寻梦环游记》，皮克斯已经用卓越的技术向我们展现了一个壮阔的幽冥世界。然而在《心灵奇旅》中我得到创新的震撼来得突如其然，因为在这里，生命似乎多了不少维度，除却生与死，在生死之间依然有某种混沌，需要生命的个体自己去跨越。 我们在电影中可以感知到的： 一，确切以肉身活着的现实世界。 二，生之彼岸，即排队通往死亡的大道。 三，生之来处，即心灵学院，生前塑造人格的虚拟世界。 四，生死之间，忘我之境。 如果仅仅是在活着与去死的二元世界来回穿梭，我不会说这个故事多么有新意。但是当三和四出现并变得具象丰满时，它给我们提供了许多面镜子，在观察活着的人乔伊、尚未成形的灵魂22时，连同发现自己生命的多面性。于是连我们自己也不禁要向那些代表界限的“黑洞”张望：在不同维度的世界里，我又是什么面貌？ 一个执着于成交的基金经理？一个疯狂的街头艺术家？一个为人类贡献一生学识的教授？还是一个吃吃喝喝睡睡无聊至死的某某某？…… 因为有了距离的观望，生命的轮廓变得清晰。乔伊从具象的人变成抽象的灵魂，不仅看到自己一生的幻象，甚至变成猫，看到活着的自己的肉身。 因为有了距离的观望，灵魂22号也获得了新的审视生命的视角。不仅可以看到那些伟大的灵魂导师外有多么无聊、平庸的人活着（如乔伊这般），还可以看到他们既然如此平凡还执着于活着，这确实是一个有趣的问题。 问题到这里，“我为什么活着”，已不单单是“我想作为音乐家闪耀一次地活着”。这是一个平凡的主题，在不少故事里都已被讲述过。如今在《心灵奇旅》中，这个问题已演变为，“我注定无法闪耀地活着了，可我为什么还要活着？” 问问题的过程就像剥洋葱，在剥到明明看似快剥完时，已经感到快要得到答案的欣喜。就像乔伊总是坚信自己可以成为一个音乐家，可以有一天在心爱的舞台上忘我地演出一次。因此他充满热情地活着。 可是万万没想到，这个问题还可以剥下去。答案背后还有问题。  乔伊如愿从心爱的酒吧走出大门时，他曾说“我死而无憾”的事已经实现了，他完成了一次精彩的演出。可是生命并没有因此更加丰满，更加有意义，更加闪耀，他就像女音乐家说的那样，想要看到大海的鱼，一直以为眼前的不过是水。 可大海本就是水啊。生活本就如此。 洋葱剥到最后，答案如此无味。你想要的生命中的闪光一刻，以为是毕生为之奋斗的目标，竟也不过是音乐家日复一日夜复一夜的度过。而那么闪耀的她，竟然此刻也和你一样，也在这平凡的“水”中。 乔伊注定是失望的，我也失望。当你渴望半生的某个目标终于实现后，除了在那一刻得到的快感，剩下注定是无尽的失落。因为往后的日子，我将以何目标而活？我还为什么要充满热情地奔赴每一天？我不知道。 这个问题的抛出让我感到了某种强烈的空虚。它是如此熟悉，以至于我开始想象故事创作者的面孔，他也是和我一样30岁以上的人，在某一天画着动画或写剧本时问自己，哦我如此擅长画画或写作，我生来就应该做这件事，可是人到中年我竟然怀疑以它为目标的这大半生，我是不是真的要继续做下去？谁又定义了我应该一直做这件事而不是别的事？ 质疑的力量在动画片里不是必要的，它总会把矛头对向某个具体的敌人而不可能是自己。但是在《心灵奇旅》中，我清晰地看到，敌人就是我们内心的另一面。另一面充满疑惑、不安、焦虑、否定，它像灵魂22号一样，轻易就推翻了你认为伟大或有意义的一件事。而你曾不懈地为之奋斗付出过这么多，以至于你已经不能面对付出的过去只能劝慰自己，是的，只有这个目标才是我活着的意义，我只能、必须这样走下去。 我说这是一小部分人的围炉夜话，因为这个问题的抛出已经带有门槛。它的前提是，我已经奋斗过了，也尝过了获得的滋味。比如当我梦想美满婚姻与相爱的人组建家庭后发现生活如此乏味；比如当我日耕夜作终于得到升迁加薪后依然做着重复的工作等待每月发薪日的到来；比如我渴望的一次声名大噪、一次天降横财，它们都通过我的努力和幸运得到后，我发现也不过如此…… 接下来，问题就是接下来，我该为了什么而活着？我活着的真正目标是否还是它们？答案已被推翻。我推翻了我自己。 这种空虚感就是乔伊走出酒吧大门时，他感受到的——以及我感受到的。我从未想过一部动画片把人生的意义、目标、执念、动机这些抽象的东西，剥到最后，只剩尴尬的空气。 生命在这一刻根本是无意义的。它变成了别人的一个转身，而我抓到了“空”。 因为这一层空虚，我向《心灵奇旅》投去共鸣。它不是酸楚的泪水，不是幸福的喜悦，不是为幽默的开怀大笑，种种情绪都被超越了。我竟然在一部动画片里感到了现实中曾经有过的空虚，甚至再一次逼问自己，为什么会这样？ 然而没有人能给我们答案。乔伊的偶像不会给他答案，他也需要自己追寻。反而是那个曾经执着于空虚的人物22步入现实后，任何一个小的细节都具备了意义——多么讽刺！ 不抱目的地活着，却得到了活着的意义。那么活着的意义到底是什么？一片落叶？一次奔跑？一根棒棒糖？还是一次躺在地上的仰望天空？……似乎都是，似乎都不是。 当乔伊弹出流动的音符时，我并没有得到确切的答案，只能感到情绪中的某种空洞重返充实。明白那微妙差别就像他真正在用音乐谈话——音乐，归根结底是表达自我的方式，我们的主人公并非为这种表达方式而奋斗。他要去自由表达的，是为之动容的生活的细节、记忆的触角，让他感到生命的酸甜苦辣的一切渺小与伟大，最后都会融入音乐，成为“火花”的一部分。 因此，音乐本身不是要去实现的目标。而是通过音乐，乔伊可以实现表达的自由、灵魂的放飞。他可以既活在尘世中，又可以超脱尘世，因音乐感知生命的丰沛，通过独属于他的方式，触到活着的意义…… 嗯，写到这里，对我而言看似混沌的一切似乎有了一点清晰的指向。《心灵奇旅》不是一个典型的主角追求梦想的故事。这个故事在生死不同维度空间里都有不同的标准。如果说《寻梦环游记》里我们还可以亲情为依托，找到一根绳索通往“生之彼岸”，那么在《心灵奇旅》中，我们感受到的孤寂只能是在第四空间中荒芜的追寻，个人自己的追寻，没有同伴。 电影是心碎的艺术。当第四空间里的灵魂荒漠出现时，我所获得的感动比乔伊在闪耀舞台上弹下流动的音符带来的更多、更复杂、更难以言喻。原来世界上有那么多人和我一样在这片荒漠中执迷，而我们却不能为谁伸出援助之手，只能靠自己苦苦探索。假设并没有航行的船，没有那片飘落的叶子，也没有什么化解你忧愁的灵魂舵手，在生死之间、忘我之境徘徊时，终究只有自己去辨明到底哪一部分是执着，哪一部分是偏执。22号灵魂，存在于我们每个人的心中，她是活着的幽冥。 这场晦涩的对话终要结束。从生谈到死，从死谈到生，假使给你有限的生命再来一次有限的旅程，也未必获得真正的意义，来人世一遭本就是一片混沌。 但我想不是所有故事都要告诉你，意义是什么，目标是什么，成败又是什么。在这场对话里，令人慰藉的是，失败者不是可耻的，渺小而孤独的每一个人都不是可耻的，都有了存在的理由。《心灵奇旅》如其名，只是带我们的心走了一遭，看到荒漠，也看到微光。,10627,61.0,484
1,1,24733428,心灵奇旅,9dceaa408639d37f8f986b5154b22b52,683417390670ea4b5c4bbe7d5f053bb0,5.0,2020-12-26 13:15:53,"在我的人生里，有过一场重大的幻灭。 　　那是在我即将满十八岁的夏天，我站在我小学后操场的主席台中央，伸手抓着被太阳晒得发热的旗杆，闭上眼睛再睁开，眼前的一切依旧空荡安静。 　　没有人知道那一刻对我来说意义有多重大。 　　由于我爸的工作，我从小就一直跟着父母辗转于不同的城市，导致我极其没有安全感。我小学的城市和初中的城市相隔了几乎小半个中国——从进初中开始，我就非常讨厌那个地方，接下来的几年我一直都很不开心。我反复做着同一个梦：我又回到了我的小学，可以和我那群亲爱的朋友们一起追跑打闹。我和他们一直靠长途电话保持着艰难的联系，我知道他们是惦记我的，就像我惦记他们一样。 　　我爸妈总是跟我说：那个城市已经和你没有关系了，你要学着适应现在的城市。如果你高考能考好，等你满十八岁的时候，我们就带你回去。 　　所以我整个青春期的目标就只有这一件事。 　　我不在乎自己日复一日看到的风景，我也不在乎身边每个人会怎么看待我。摆在面前的每一天对我来说，都像是某个游戏的demo，像是正式存档认真对待之前，随手试玩的版本。 　　甚至我连高考填志愿也不在乎，随便填了个我完全不了解的破学校，高三的那个暑假也什么都没干，只是在家里等待。 　　终于我等到爸妈给我买了机票，终于我站在了小学的后操场。 　　对于当时的我来说，魔法即将发生了——那一刻我集齐了一切条件，可以重置那六年的莫名其妙，可以反抗我十二岁时那一场心不甘情不愿的离别。 　　可是当我闭上眼睛再睁开，奇迹没有发生。 　　我还是孤零零一个人站在主席台中央，时间没有倒退。 　　尽管那年暑假，我和我的小学同学也聚了会，可一切总是不太对劲。原以为会再度被快乐填满的心，还是空落落的。 　　在《心灵奇旅》里，男主人公毕生追求爵士梦想，几经周折，终于得到了和知名乐手同台表演的机会，而且演出也非常成功。当晚他送走了来看表演的亲友，忽然觉得心中怅然若失。 　　他的感受，大概与我十八岁那年的感受相似。 　　你努力了这么久，你忽略了沿途的一切，一直在专注等待一个奇迹发生的时刻，让你能够有力量推翻从前所有的糟糕。 　　可是，那然后呢？    　　影片《心灵奇旅》的主人公是个才华横溢的钢琴家，然而他的职业只是中学音乐老师——而且还是兼职老师，没有保险、没有退休金。影片开头，学校给他带来一个好消息：他可以转正了，从此有编制了，不必再担心自己生活无着。 　　他的家人都认为这是个重大好消息，只有他自己开心不起来。 　　他害怕自己的人生从此被锁死在这份无聊的工作里，他志在远方，他想要和最好的乐手一起在酒吧里演奏爵士乐，激发起灵魂的共鸣。 　　演奏钢琴是最令他快乐的事，也是他认为让他存在于这个世间的唯一使命。 　　在他半生半死、灵魂出窍之际，他看到自己一生的剪影浓缩在眼前：在父亲的引导下从小向往音乐，却一次次被各种各样的表演机会拒于门外，最后在中学里当个普普通通的老师，面对着一群良莠不齐的学生，年纪不小却没有爱情和事业，孤零零一个人坐在快餐店里吃饭…… 　　那一刻他才惊觉：原来我的人生是如此的毫无意义啊。 　　但他还是想要回去继续活着，想要将那个和知名乐手同台演奏的机会争取回来。他觉得，只要能够完成那场演奏，他的人生就会有所不同。  　　在探索重回世间的方法时，他有幸得见了这个世界上每个灵魂产生的过程——在灵魂降生于世之前，它们会被分配到不同的类别，然后经历各种各样的锤炼：自恋的、冷漠的、乐观的，所有的先天人格就是在那时烙印下来。 　　而最后也是最关键的一步，就是每个灵魂找到属于自己的“火花”。 　　在灵魂诞生的世界里，那些灵魂的雏形可以在导师的指引下，尝试无数种活动：运动、音乐、美术……某一种尝试会在他们的心上燃起火花，然后他们就具备了在地球上降生的资格。 　　主人公参观了几圈之后，坚信自己的“火花”就是音乐。 　　而他在这里结识的那只早熟的、厌世的22号灵魂，似乎一切都不爱、一切都不憧憬——那是一只没有目标的灵魂，迟迟不能投胎，让所有导师都束手无策，就连特蕾莎修女和哲学家荣格都被她气了个半死。    　　在偶然的机会下，22号灵魂陪着主人公一同跌落到人世间，并且附在了主人公原本的肉身之上。 　　22号灵魂借着主人公的肉身，吹着地铁疾驰而过带来的热风，把玩着秋日枯黄的落叶，吃着街边飘着香气的披萨，听着地铁站的街头艺人表演，和理发店的大哥闲聊，看着主人公的妈妈裁剪衣服……每一件东西都令她感到新奇而向往。 　　她若有所思，对主人公说：或许我的“火花”是看天空，或者走路。 　　主人公对此嗤之以鼻：这些都算不上什么人生目标，只是最普通的日常而已。 　　可是当他们再度回到灵魂诞生的世界，大家惊讶地发现，22号灵魂竟然已经变完整了——不知不觉间，她竟然不再厌世了，竟然具备降生到世界上的资格了。 　　主人公百思不解：可是她并没有找到自己的人生目标啊！ 　　工作人员无奈地看了主人公一眼：谁跟你说“火花”就是一个灵魂的“人生目标”？ 　　人活着的意义，并不是人生有一个清晰的目标。 　　让22号灵魂变得完整的，是她对世间的向往，是Chelsea的街头表演，是7号线座位底下的ICEE脏瓶子，是地铁站吹出来的热风，是妈妈手中的针线，是那半截没吃完的bagel……是人世间那所有看似微不足道的活色生香。    　　最后，当主人公辗转回到人世间，终于成功地完成演奏，他问身旁的人：我们接下来要做什么？ 　　他身旁的乐队老大回答道：我们明晚还回来这里，把今天的内容再演奏一遍。 　　他愣住了。 　　他说：我这一辈子都在等待今晚这一刻，我还以为我的感受会有所不同。 　　乐队老大旋即跟他讲了一个寓言故事，说有一只年轻的鱼一直在寻觅一种叫“海洋”的东西，年长的鱼告诉它：你现在就在海洋里。年轻的鱼回答说：我这只是在水里而已，我想要的是海洋。 　　寓言故事到这里戛然而止，留下主人公怔怔出神。 　　回家的路上，他看着地铁窗户上自己那孤单的影子，看着疲惫忙碌各自刷着手机的人，看着那似乎毫无意义的日常。 　　或许他直到这时才渐渐意识到，自己这一路都活得太心急了。 　　他始终都眼巴巴地盯着自己的音乐梦想，觉得自己没时间谈恋爱，也不愿意困于一份舒适稳定的工作。他一心盼着美梦成真的那一瞬间，故此对于沿途的一切细碎感受都心不在焉。 　　然而，他的人生，真的可以被某一场演出的成功，或者某一种事业上的成就所定义么？ 　　他赖以生存的火花，真的是那个遥远而宏大的目标么？ 　　如果答案这么简单的话——那么，当他骑着单车在曼哈顿街头驶过时，那树杈间漏下来的阳光算什么？在午后的咖啡厅外，那谈笑风生的路人算什么？课堂上那些虔诚注视着他的孩子算什么？拂过脚面的清凉海水算什么？布鲁克林大桥上那璀璨的烟火又算什么？    　　他原以为，每个灵魂都是为了某种使命而投身于世的。 　　所以当看到自己一生的剪影浓缩在眼前，他才发现自己这步履匆匆的人生竟是如此乏善可陈。身边的22号灵魂也对他产生了好奇：你的人生如此可悲，为什么你还迫不及待地想要继续回到人世间活着？ 　　可偏偏是他这样卑微得不值一提的人生，让那个令诸多伟人头疼不已的22号灵魂，燃起了对人世间的向往。 　　他总是将“Jazz”挂在嘴边，所以22号灵魂认为，只要自己学着他的样子，成功地在生活里扮演好了他，就是成功地完成了“Jazzing”。 　　一开始他无可奈何地纠正：根本就没有“Jazzing”这个词语。 　　在影片接近尾声的时候，我们才恍然大悟：其实爵士乐的本质，就是随性而为。就像主人公那几场成功的演奏——爵士表演从来没有既定的乐章，而是根据乐手当下的心情和状态，用自己的乐器为载体、以和弦为语言，在台上对话交流。 　　随心所欲，才是爵士乐的魅力所在。 　　爵士乐于上世纪初诞生于美国南部黑人聚居、氛围自由开放的新奥尔良，后来在逐渐北上，在芝加哥和纽约发扬光大，而后盘踞在纽约哈林区，成为一道独具特色的文化风景，也是“黑人文艺复兴”的重要标志。 　　它无论是从历史上、文化上，抑或是风格上，都与“自由随性”脱不开关系。22号灵魂将自己漫无目的的人生探索定义为“Jazzing”，恰是一种绝妙的概括。  　　这些年我曾经一再地叩问人生的意义，最后得出的结论是：不要去问意义，因为人生没有意义，细思之后只会让人打退堂鼓。 　　而这部影片竟然解答了我一直以来的疑惑。 　　就像影片中那个立志要成为兽医的大哥，最后他为了省钱给女儿治病，选择成为了一个剃头匠——他说，并不是每个人都能成为震古铄今的伟人，但我每天和来来往往的客人们聊天，让每个人变得更好看，我也觉得很开心。 　　原来人生的意义，就是让我们去感受它的每一分钟，感受夏夜的风，感受冬日的雪，感受地铁上的拥挤，感受潮汐和落日。有时候机缘巧合带着你打了个转，像是走上了一条和初心截然不同的路，但其实在起点和终点之间，本就有成千上万种抵达的方式，而人生的意义早已藏在这趟旅途中。 　　每一条鱼都活在水里。 　　浩瀚无边的海洋，或许并不在远方。 微信订阅号：misslintanxi 
（我圣诞节为了奖励自己，专程给自己买了个Disney Plus会员看这部电影，这么好的电影请大家去影院支持正版！！！）",4628,37.0,236
