,Unnamed: 0,电影id,电影名称,用户id,用户名,评分,评论日期,评论内容,有用数,没用数,回应数
20,20,27199324,野性的呼唤,02b8e7463d4ec828497560821e437fb2,b2fe1a38d0942f5b5f32e696477e301d,4.0,2021-06-02 23:05:51,THE CALL OF THE WILD（野性的呼唤） 影片讲述了一只混血犬Buck经过了四任主人，历经颠沛流离的生活，最终回归自然的故事。 Buck的第一任主人是当地的法官，他把Buck当作宠物，给了贵宾一般的待遇，让他在城市里放肆地生长和奔跑，却最终因为管制过少而做错了事，被罚睡在外面而致其被拐卖。 Buck因犯错而被第一任主人关在门外 第二任主人是一个雪山上的邮差，他无条件地信任Buck，他和Buck的关系与其说是主仆，倒不如称之为忠实的合作伙伴。Buck在跟随第二任主人的过程中，学会了劳动和信任，他依靠自己的能力获取了待遇，也凭借自身的善良得到了主人以及它的狗团队的信任与认可。这也是Buck找到本性的关键节点。它在劳苦中成长，在斗争中学会了生存，也终于在长时间地跟随人类后学会了跟从自我。可惜，Buck的主仆情深终究败给了命运，输给了“社会进步”。 第二任主人对Buck的无条件信任 Buck的第三任主人是存在争议的，很多人不认可他的存在，因为他给Buck带来的是虐待。在“淘金热”的时代，总有人发了疯地要获得财富，他们自私、贪婪，把狗当作是奴隶和工具，以为只要掌握“棒槌”就可以任意操控奴隶。这样的人自然是害人终害己，自己落不得好下场，却也还是给别的他/它们留下了不可磨灭的伤害。 第三任主人对狗团队的虐待 幸亏，Buck被第四任主人John所救。John是第一个对Buck说“You are not my pet”的人，是把Buck当成朋友、亲人，甚至是生命的一部分的人，也是把Buck带到自然，并最终将它还给自然的人。毫无疑问，他是Buck的一生里产生最大影响力的一个。John一直以来都活在失去儿子的伤痛里，他对生活不抱有希望，不认为自己有家，除了喝酒就是思念儿子。而就在此时，他结识了Buck，仿佛命中注定一样，他们一拍即合，走上了探索自然的道路。 Buck与John的相互陪伴 写到这里，基本上已经把Buck这一生最重要的经历描述完了，而影片中最让人好奇的，是故事的讲述者——John。作为一个在Buck的“后半生”才相识相知的人，为何能够讲述它的一生，甚至令人无比沉浸，仿佛在诉说自己的故事。而直到John在写信时，第一次以他作为人类的口吻，代替Buck的倾诉，才让人懂得故事这样叙述的意义——一个对人生有所不满的人类，把自我的情感寄托在一只与自己有相同经历，又共同出生入死的犬身上。这也是为什么把Buck作为荒野中唯一陪伴者的他，最后愿意把Buck交还给自然，自己也决定要回归人文社会。 对于John，我认为影片最后进行了留白，没有明确地指出他去了天堂还是家乡，这也是给观众一个美好的念想。他穷尽一生在追寻已经逝去的东西，却命运般地从Buck身上找到了人生的意义，“野性的呼唤”不只是对于Buck，也是对如John一样的人类。也许倾听自己内心的声音，找到本心和本性，那么无论去向何处，都是正途。,,,0
21,21,27199324,野性的呼唤,a49a61b083b39b38f85164170bcc8998,4086871bca43fb4ef32945da11d3db16,5.0,2021-05-15 22:56:50,很喜欢很喜欢，一直最爱的就是杰克伦敦的《野性的呼唤》，影片拍出了更温馨和缓的一面，野性和冒险的成分都被些许减弱，不论自然环境还是人类社会也不再那么残酷无情，与原著氛围有所差异，但依旧是一部佳作，这种风格如果尝试改编《白牙》也许会更好，但作为一部狗狗萌宠电影我依旧超爱，狗狗就是坠吊的！！！,,,0
22,22,27199324,野性的呼唤,0db6b58378a0db4ccbbaf6924d8f16b4,f60bfeb34b621c8baa5cefc9c35fd94c,5.0,2021-04-14 16:12:03,看完了电影再看书，剧情是改编了的，比如最后桑顿并不是死在淘金者手上而是死在了一支少数民族手上。从巴克的历程中，他遇到了许多善良温情的人，也有不愉快的经历，当然桑顿是他最终的一位主人，彼此联系的惺惺相惜超越了人与动物直接物种差异，桑顿视其为伙伴，而巴克视桑顿如父。在拉雪橇中，巴克学会了如何生存，如何做一个谋略者，如何领导队伍；后面遇见桑顿，他与桑顿之间彼此扶持，学会了温情，变得更加勇敢；继而逐渐的，巴克内心的野性逐渐显现，它纠结于是否留在桑顿身边还是回归自己原本的群体，电影里一场大火烧死了桑顿，小说里是巴克回来看见他们三个都死于少数民族手下，最后巴克给主人报仇，回归了自己的群体。里面的丛林法则对孩子而言也许有些超前，但是推荐里说这是美国教育协会力荐的一百本书之一。相比老外，国内儿童教育更偏向真善美而非丛林法则。 总之，还是很不错的，看完不禁感慨，巴克是一只神奇的狗狗！（尽管他属性是野性的）  野性的呼唤 (2020)7.02020 / 加拿大 美国 葡萄牙 / 剧情 冒险 / 克里斯·桑德斯 / 哈里森·福特 丹·史蒂文斯,1.0,,0
23,23,27199324,野性的呼唤,3f591579c173bc381f4c1107746adc81,a5491fbde4faedd656e5679164dcb533,,2021-03-12 17:00:57,没有看过原著小说，只从电影出发来说一些想法。我个人比较喜欢团圆美满的结局，可是人生却很难如此，而且我所认为的不圆满，也很难说是那些人物自身的想法。遗憾本身也是一种美好吧。巴克在大法官的家里被偷走，从优渥的生活中脱离出来，从四季如春的小镇到了严寒的北方，一切对它来说都是陌生的，雪橇犬更是从未接触过的职业，但在一次次失败后，它身体内的野性觉醒了。成为了领头，一切变得适应而美好，可这样的时刻截然而止，被迫的它换了主人，新主人是个坏人，对它还有伙伴很不好，作为领头的，它尽力了，可还是......看到它们走向生命末端的身影时，真的很难过。巴克的最后一位主人踏上了最后的旅程，在旅程里，巴克和老人都得到了救赎，尽管结局有些遗憾，可对于巴克和老人来说，或许也是另类的圆满。,,,0
24,24,27199324,野性的呼唤,523b37b17aaf7c15a70c870626679c22,b463653188fcf562ceeaffcccfa920d6,,2021-03-10 11:24:31,这部影片可贵之处在于阐述万物皆有灵，在观众眼里巴克成长为头领的故事，这让我们看到了从弱小到强大，由任性到责任使命的转变，独立后的责任与担当从边缘走到中心，电影很好的阐述了外部环境的变化，对于巴克一条狗很难改变什么，但可以看到的是通过善良，勇敢，团结，有爱每逢危险的时候总会有人帮助，从原始家庭中的任性，到面对危险与新的环境，从茫然不知所措的懵懂，在勇气中学会独立与成长，到有人帮给予心之所爱，真的太好看了没有语言却胜似语言，人们迷失的心世界被打开，当老人将口袋里金子扔到河中，是发现了比金子更宝贵的东西，用已给人们启发，巴克的使命阐述了人性的善与恶，影片的宝贵之处在于幽默有趣中阐述了成长，在平凡之中心是灯塔，向往野性的呼唤自由！,,,0
25,25,27199324,野性的呼唤,c8e7629390a911ff370ad4b5a774d4e4,020c290593cef84aeac4ea2c269d326d,3.0,2021-03-07 23:28:26,在动物电影里这部电影也算不落俗套吧，我一开始老以为狗狗马上就要开口说话了，但从头至尾都没有，旁白适时的出现，不让人觉得厌烦。整部电影的主角就是巴克，想到忠犬八公了，但忠犬八公更加悲情。 1. 灵魂之间的契合 电影前期我老把巴克看作“宠物”，并没有将它看作一个独立的个体，认为他总是要跟在人们身边的，是不是巴克自己也是这样认为的呢。他遇到了三个“主人”，第一个就是主人，第二个相比之下我认为多了一层朋友的关系，他们互相合作、也有一定的了解，第三个我愿称之为知己。看到第三个我才意识到，认为只有人与人之间才能契合是狭隘的，为什么要把其他生命当作人类的附属品，为什么人类要这么自大。世间的灵魂是在各种生命体上不断流转的吗，那为我相信“转世”有了一点个人思想证据。 电影会作艺术处理及美化，但我仍然羡慕巴克和老人相互陪伴的舒适与彼此理解，而且没有捆绑。看电影时我幻想自己是否也能像老人一样，或许遇到一只猫、或许遇到一只狗（猫狗我同样喜欢），能够懂彼此，但我还不满足，我挑剔他们不会说话，是因为语言对我而言是重要的吗，为什么我会这么想，明明很多时候语言显得微不足道，总之，我是贪心的。 2. 找到自己、归宿 巴克经历了自身的变化，最终找到了自己，找到了归宿，过程中有得有失。 3. 一个灵魂的一生 各种动物跟人一样，有不一样的性格、不一样的一生，人类会根据国家分类，这里我想到了魔法精灵2，大家都是人类啊，大家也都是生命。我们常常感慨于各种人类的一生，我想通过这次我开始正视起来，各个灵魂的一生。生命有长短，那到底有没有轻重呢，是相对而言的，对于自己来说一定是“重”。 4.各种脑洞大开，狗狗是老人的儿子转世，那间屋子曾经是老人儿子所居，狗狗与老人最终发现儿子并未死亡（后来老人透露儿子发烧几天就死，意识到老人是看着儿子死去）,,,0
26,26,27199324,野性的呼唤,93aa02a9185ee8c0c2410e738b73bb6f,d902d9012ebe0e9a6119ab5c05cb7ec7,4.0,2021-02-23 17:30:27,先说说电影的主要内容 ，这个电影主要讲述了一只被饲养在法官家的狗巴克，总是在家中无所事事 ，捣乱便是他的家常，常常引起法官的不满，有一次家中请客 ，仆人们准备了不少伙食，客人来齐合照一时，巴克早已把晚饭弄得一塌糊涂 ，昨天晚上把科被迫睡在走廊上 ，结果不幸被狗贩子拐走 ，被带到了寒冷的阿拉斯加 ，经过一波三折 ，巴克终于产一片丛林 ，找到了自己生命的归宿 ，找回了自己的野性 。  整个电影总体来说比较感人 ，接下来让我们细品                                                                 首先这个电影一 寻找自由为主题 ，主要讲了一条叫巴克的狗 历险，在这个影片表达的手法很不错 ，都是一狗的角度来看事情。看世界 ，同时 ，也赋予了狗人的感情动作神态 ，还有一些更为激情的片段 ，比如说争雪橇犬头子位置 ，哈士奇和巴克大打出手，最后二哈夹着尾巴做人 ，逃走了 ，巴克变成了雪橇犬的首领 ，在这里 ，故事的情节一波三折 ，十分引人入胜 除此之外 ，巴克和雪橇犬 因为电宝的到来被卖掉时 ，也通过了对任务 巴克的细致神态描写 ，体现人物情感 ，也十分的优秀，另外这个电影的写作顺序也很有意思 ，他也是通过事情的发展顺序写的 ，饶有趣味，精心刻画情节 可以观察身临其境的感受 ，除此之外 ，文章还设置了很多悬念 ，比如说 ，把科研中的那只黑狼是什么 ，红衣服 找到了提出又发现了什么 ，这些都是 观看着值得探讨的问题 同时我们 共同探讨,,,0
27,27,27199324,野性的呼唤,6b8c9427db5ebf254cd1ef97cb9162d5,50f428f631c9281a62bb1b680f24430c,5.0,2021-02-20 19:18:38,"看完了《野性的呼唤》这部电影，我深刻地体会到拉雪橇的猎犬是多么的勇敢，强大。尤其是故事中的巴克，这部电影的原作者是美国具有民族色彩的优秀作家杰克.伦敦，他的小说作品创作极丰，1876年1月12日杰克伦敦在旧金山出生，1916年11月22日死于突发性心脏病。他的童年是在艰难困苦中度过的，曾当过报童，水手，流浪中还蹲过监狱，后来去过阿拉斯加淘过金。

当杰克伦敦发现当时期(19世纪末--20世纪初)的美国人爱好去北部极地去寻找金矿，这需要大量壮实的狗去拉雪橇，于是就出现了小说中巴克的形象，巴克原本是米勒法官的一只爱犬，一直生活在美国南部加州的温暖山谷里，不料被卖到美国阿拉斯加(也是作者淘金所在地)，那是一个即偏远又寒冷的地方。

因为大量盛产黄金，所以世界各地的淘宝爱好者都会聚集到这里来，而这又需要大量的拉雪橇的狗，巴克就是这个原因被卖到这里。

进入北方后，他才知道那里的环境有多恶劣，生活有多艰苦，那里没有任何南部拥有的法则，那里只有大棒的利齿的法则。那里也没有公平的游戏规则。

任何时候都必须坚持挺住，绝不能放弃和倒下，倒下就是弱者，遵守南部法则也同样是弱者，在这种恶劣的环境中，巴克的野性慢慢被唤醒，首先是对领头狗激怒他的做法稍微忍着点，之后不断指代领头狗斯比茨制造麻烦，最终与斯比茨挑起了一场恶斗，并将它打败后杀死。取代了斯比茨原先的地位，巴克也很聪明，怎样拉好雪橇，怎样战胜寒冷，对他来说实地是简单。

他在极地中遇到过五个主人，最后一个是叫约翰。桑顿的人，他救了巴克，而且对巴克十分关心，在桑顿身边不用长途跋涉，更不用拉雪橇，这在巴克看来是一种实在的幸福，然而不幸的是桑顿在一次淘金时被印地安人杀害，这使巴克与人的最后一根纽带被打断了，从此，巴克对人没有了信任，他决定加入狼群，回归大自然……

电影巴克的形象是强者的向征，通过人的世界看到了狗的世界，在小说中写狗就是写人，赋予了狗以人的性格和心理活动，所以称狗为“他”而不是“它”。

我在巴克身上看到许多优秀品质，但他最终走进狼群，回归大自然后吟唱的那支远古的歌，我们又怎能做到原样的接受呢?",,,0
28,28,27199324,野性的呼唤,ee44ba6011215de396d901883fb0d85b,320dfb0bc86e0253693edb420c81988a,4.0,2021-02-18 23:48:24,电影《野性的呼唤》是由美国作家杰克·伦敦同名小说改编的，电影的主角是一只调皮捣蛋的狗——巴克。原本巴克应该和主人过着幸福快乐的生活，但一场意外降临，不谙世事的它不幸落入狗贩子的陷阱，被卖到了遥远寒冷的淘金者必经之地——阿拉斯加，从此，开始了传奇的“狗生”，并在生活的磨砺中逐步成长。影片通过巴克的经历反映出逆境与成长的关系。从巴克由宠物狗为克服逆境努力奋斗变成“狼”的励志故事，对于身处逆境当中的人来说无疑是起到很大的鼓舞作用的。从古至今，在无常的生活中每个人都有可能陷入到逆境中去，有人经受不住打击，自暴自弃，但也有人自强不息，逆境求存，最终，战胜逆境，成就自我——这句话送给每一位奋斗中的人！,,,0
29,29,27199324,野性的呼唤,e8cbd5f59164ddda847ec1dc180e6fa4,f2bdd4ced484ae86f5bc2dcafd7a9adf,3.0,2021-02-15 12:57:51,不平凡的狗生，这大概就是对巴克最好的诠释。又是因为他来自小说，改编成了电影，其中的情节在我眼中多少都带了些戏剧的颜色。加之看之前对于影评的阅读，了解到这条狗的动作捕捉依旧来源于真人演员，但是呈现出的效果却有些许生硬。以上两点，让整部电影看上去不那么自然。看的时候不由得想起《南极大冒险》，总感觉有类似，却似乎点到为止。 故事剧情方面，不时的小高潮串联起了整部电影。开头宠坏的巴克是一场闹剧，之后命运急转直下。好在过了一段有使命的生活，比被淘金者买去当苦力强多了。唯一对巴克尽心尽力的就是白发老人了，一人一狗，相伴着去地图外的世界去探索。这才是命运的安排吧。在大自然中，寻着一间小木屋，不大却足够一人一狗生存。生起炭火，铺好被褥，度过白天与黑夜。但是在这样的大环境中，巴克开始放归了，他找到了这个世界上更有意思的事情。与他的同类互相嬉戏，互相追逐打闹，乐趣无穷。但他也割舍不下对恩人的感情，所以才有了最后一个高潮。结局是好的，传递出来的是一只狗找到了自己真正的主人，即是他自己。 看完之后有一点点想要看原著小说的冲动，也许之后可以安排。,,,0
30,30,27199324,野性的呼唤,5e48f4833eabbfdb282576aa68bb05c3,be1f3d52aeae52aa753af1f618845342,3.0,2021-02-09 23:34:57,#电光幻影# 《野性的呼唤》，打破规则，才有开辟新天地的戏码，共存的包容里，没有什么是唯一的。 明明是为了男主角哈里森·福特才选择看这部电影的，结果看了一阵儿发现真正的男主角是狗狗，以及这是一本世界名著的改编作品，我居然迟钝到半截才想起来。 好不好看呢。平心而论，在电影院的过程里我是基本满意的，作为一部电影来说，完整而不令人烦躁，整体还是过关的，但是有很多很难形容的问题，是在看电影的这个过程中感受到的。作品特别温和，这个我记忆中的原著似乎不太一样。整个影片中，人与狗的互动处于一种温柔的交织和沟通之中，带着几分天真，蠢萌蠢萌的，看不出太强悍和挺拔，更像是一种适合孩子们看的，很温暖的运气片，这种状态看起来很容易，但是总让我觉得这好像不是为了给我们应运而生的作品。《野性的呼唤》怎么说也是名著来的，这么风和日丽的模式不科学。 因为狗是主人公，所以很多部分的感觉比较没有道理可言，毕竟不能完全跟人一样的去沟通，思维和行为模式还是不一样的，另外，这狗太得瑟了，有时候看着它特别烦躁，总觉得你说A，它做C，完全不好掌控。作为人类的伙伴来讲，我对它实在是喜欢不起来，完全不是我能接受的类型，虽然我也不养狗，说不出一二三，但是这么复杂的心理表达模式里，真心觉得累。如果狗狗可以理解能力这么强了，还要不要这么烦人的表达呢。 看完电影回家找出书又补读了一下原著，虽然是粗略的。电影上映肯定是对书进行过改动的。原著里狗主人公是从幸福美满风调雨顺的家庭里被骗卖到残忍得连生存都要去努力的地方，反差极大，而狗主人公明显是在这个过程里成长和学习了太多方式方法的手段，所谓机智往往就是经历和积累的多了，应变提高，警惕性强了，会保护自己，能极速反应，也就是这样，但是电影里的狗狗显然是运气占了很大一部分，看起来好像个傻大个，很多事情靠身材取胜，无所谓能力的成长，或者说成长的是身体和反应，并不是心灵。 还有，影片为什么要配合那么弱智的独白，时不时就来一段狼的召唤。老实说，开始时听到这种旁白词的时候，我以为这就会像是《丑小鸭》一样，有一天狗狗发现自己是个狼。事实上是我想多了，狗就是狗，货真价实的狗。浪费我对自己的莫名质疑，这看起来狗头狗脑的庞大的狗，怎么都看不出狼的身份变异来，可是影片强行找到了各种呼唤去配合，那么至少请把狗的品种换一换吧，长成熊样的狗，让我怎么相信血液里的狼性在滚滚沸腾呢。作为观众，感觉自己好难哦。 虽然跟原著差距很大，整体温和度也拖累了原著的璀璨感，但是作为其乐融融的电影，以及给青少年和小朋友们看的普及世界名著的电影来说，还是不错的选择的。至于我，看看也是可以的。 命运都像是写好的曲谱，只要按照调子吹，效果都是一样的，可是水平高下还是会让明眼人看得明白。有些道路会慢慢显现出属于自己的方向，但是骨子里，一生都不知目的的追逐，才是大多数生命的样子。 虽然人是配角，但是配得很可爱的。 作者：小佛搞特,,,0
31,31,27199324,野性的呼唤,cd05254e413928cbbdec40628a0b05ab,a9e8f53ccfa619898ffddf61a5e4379e,3.0,2021-02-07 13:34:56,如看过原著，且记忆较深，那么，看这部电影或许有些煎熬。 我属于看过原著，但细节几乎忘干净的读者。看完片子，感觉对野性的呼唤不强烈、对人世的残酷不深刻，当巴克像狮子王一样走上狼群的封禅台时，未能激起雄浑伟大的崇高感。不过，影片的故事叙述是完整的，三段人生经历是动人的，动画特技也是过关的，巴克的表情，整合了人类与动物特征，足以打动观众，特别是动物爱好者。 此版巴克，更像是现代文明型塑出的生命活法，在妥协与抗争中，寻求着与世相处的和谐。巴克的野性虽然在基因中残存，但它有着太多的枷锁和负累，已不够原始和强劲，总有一种无奈和悲凉，萦绕在巴克的身旁，挥之不去。这也是文明的残忍之处，是走出荒野获得温饱需要付出的代价，人与动物概莫能外。 看这部电影时，你如尽量忘掉原著，或有可观。,1.0,,0
32,32,27199324,野性的呼唤,1345fdc0eb03e45bbaff50ac49ae66c1,43dd5461ea090b1115a4eaab4ee7c80e,,2021-02-07 04:36:24,没错，我用了《原始拓荒客》的名字来做《the call of wild》的影评标题。 电影看了一半，我好像感觉到我看过原著，但影片中buck的形象和我读原著时的感受相差太远，所以思绪有些混乱。 看完电影查了些资料，看了些影评，发现了几个关键点，一是buck的犬种，混血圣伯纳，看原著的时候不了解这种狗，所以把它想象成了雪橇犬那种更接近于狼的形象，我想这也是很多人诟病这一版的《野性的呼唤》的根本原因，原著中的buck狼性更多一点，而这一版的狗性更多一点。这源于对圣伯纳犬的不了解。为了符合原著中的狼性，前几版的电影也都刻意改变了buck的犬种。可见，这种误会并不因为文化差异而仅存于国人。 第二点，就是关于温情和冷酷之间的配比问题，我记得《原始拓荒客》里有一句旁边“美国正在掀起一项运动”——回归荒野。《原始拓荒客》被拍得相当温情，在温情中委婉讲述脱离社保体系、回归荒野即将遭遇的自然法则的冷酷。我想，推行任何一种“文化”，你必须把他包装成温情委婉的样子，而非冷酷血腥。由于中国人口众多，几乎已经没有回归荒野的可能性，所以很难有切身体验那种残酷了，至少我们这一代，别再去祸祸那些面积不大的无人区了，国情不同，再温情也别去尝试了。但是美国不同，他们需要用温情的包装去诠释开国的野蛮和血腥。,,,0
33,33,27199324,野性的呼唤,651c5eed370255e82c86005b7ed80ac5,651ceeebffd4fd0fc36e0981a60469d2,,2021-02-03 20:15:41,看完电影个人感觉还是不错的，但是出来看了影评，还是有些吃惊的，也勾起了我看原著的欲望。 但是没有读过原著的情况下，我对电影的喜欢程度还是很高的，剧情略显老套，但是没有显得很俗，让人看了会容易接受，并不觉得剧情尴尬。 电影中比较着重情感的表达，这个电影我感觉是老少皆宜的。画面着实很美。过段时间补了原著，我想在看一遍电影。看看会不会有一些别的想法。至少现在电影给我的感觉很舒服。,,,1
