,Unnamed: 0,电影id,电影名称,用户id,用户名,评分,评论日期,评论内容,有用数,没用数,回应数
6,6,27199324,野性的呼唤,8630acd71e5bdf730c0f2bad6ffa4ee2,d5217991a5c7374b110deb03905676f7,2.0,2020-11-15 00:26:03,好久没进电影院了，看了一场《野性的呼唤》，十分失望，电影真的是完蛋了。这次不说电影里有的，说说电影里没有啥，你就明白这是个什么货色了。 杰克伦敦真的是很牛，我觉得这家伙上辈子可能是只狗，Buck和Spitz决斗时候的描写实在太真实了。肌肉绷紧的感觉，皮肤撕裂的感觉，牙齿和牙齿撞在一起的冷和痛......而作为人类，牙齿碰牙齿的唯一场景大概只有接吻。如果杰克伦敦不是一只狗，他怎么能把搏斗中牙齿撞上牙齿的感觉写的这么好！Buck作为一条宠物狗学会了棍棒和牙齿的法则，被阿拉斯加的荒野唤起野性，也懂得真正的爱，最后成为一只传说中的魔狼。我觉得最后成为“魔狼”的Buck不再是一只狗，但也不是一只狼，它对人类的文明和舒适不再渴望和仰视，同时也超脱了动物牙齿和棍棒的残酷法则，它成了一个真正能随心所欲的神。Buck不需要学人，也不需要学狼，而人倒是应该和Buck学习如何与命运战斗，然后主宰命运，获得真正的自由。 我对《野性的呼唤》电影版的期待是看到阿拉斯加的荒野，很多人对荒野有误解，以为荒野就是美景，但当你置身其中，除了能感受到美，还有自然的残酷和生命的脆弱。我期望看到雪橇队里Buck的好朋友“卷毛”被爱斯基摩犬撕碎；也想看到Dave因为重伤被扔在荒原里等死......这些残酷的时刻统统没有。Buck也不是什么傻白甜，它处心积虑地挑起和Spitz的决斗，当上头狗，但仍然无法摆脱活在主人的鞭子下的命运。人给他多一点鱼干，给它做皮鞋，甚至给它按摩脚，Buck都清楚人这样做只是为了利益，本质上它和被淘汰的Dave没什么区别。你牛逼，你能当上头狗，甚至头狼，但你能当上主人吗？狗再优秀也不能成为人，狗必须面对狗的问题和狗的命运，狗最终要在死去的时刻回归自然，但如果回归自然，狗便不再是狗，是狼，是野兽，这是Buck给命运的答案。 《野性的呼唤》是有点残酷的狗故事，但残酷是杰克伦敦作品的底色，当底色被抽掉只剩下了温情脉脉，那这就不再是杰克伦敦的小说了。迪士尼你改编的是《野性的呼唤》啊，不能把《野性的呼唤》按《小姐与流氓》那个套路搞啊！最后还真敢整个小白狼来勾引Buck，这尼玛是野性的呼唤还是生殖的呼唤啊！ 现在有些企业提倡狼性文化，不知道这些老总们看没看过《野性的呼唤》，都是Buck你们管得了吗？杰克伦敦还有一个小说《热爱生命》，最后那书里那哥们把狼咬死了。这个故事告诉我们，什么狼啊狗啊，别扯没用的，人最牛逼。狼要这么牛逼，你们公司老总咋还是人呢？啊，也许他不是人。,12.0,,4
7,7,27199324,野性的呼唤,75947b1e7e4c3e435a7bd74e9e13bfea,88e488bc50803014ce5d6eeada287fbf,,2020-02-26 14:19:38,相比于原著小说，电影版将故事改编的更加温情，巴克也表现的更加柔情，忠贞。虽然被卖身阿拉斯加，但是还留有文明的痕迹（给老人送口琴）。在团队中也一直是替狗着想、温情团结大家。更符合大家心目中忠狗良犬的形象。 而原著中，则处处体现荒野环境下的“大棒与獠牙法则”和残酷的弱肉强食的现实。巴克也显得更加兽性。在被捕虐待之后，便已）被激发出部分兽性（暴躁易怒、强撞捕兽盒。在团队中，不是温情团结，而是机智的挑拨离间。而且，原著中决斗失败的狗是会被其他爱斯基摩犬群吃掉的。 “这里的情况就是这样，毫无公道可言。你一旦趴下，那就死定了” “这还进一步表明它的道德本性的退化或消亡。在为生存作艰苦斗争时，道德本性是没用的东西或障碍。” 所以，原著更强调的是险恶的丛林法则和巴克逐渐摒弃文明恢复兽性的过程。而电影则更着重与它与老人之前的情感故事，包括在剧情中增加它和老人互动的细节（头两次相遇、一起乘船出去冒险），使得电影更加柔情，老少咸宜。虽然没有原著深刻，但也还算是成功的改编。 不过电影白人男子追杀老人的剧情有些弱（原著老人是被印第安人原住民杀死的），虽然可以理解这是为了避免原著种族歧视的嫌疑而修改的，但是剧情逻辑上还是有些牵强。 总的来说，还是值得一看的。顺便推荐一下原著小说（中篇，不长）。,12.0,3.0,0
8,8,27199324,野性的呼唤,5125eba74995cb5b99448f4f8b865391,c7708213739d3e87e3b5c8e7d52f9712,5.0,2021-01-10 03:28:17,"Buck有过三位主人，第一任主人是位高权重的大法官，让巴克拥有优渥的生活；第二任主人是邮差，他们同甘共苦，互相帮衬；第三任主人是个穷愁潦倒的老爷爷，同时是巴克最念念不忘的人。
三段故事在我眼里不是主与仆，而是现实中人与人的故事，而且，关乎爱情！
生命中遇到的第一个人让他受尽宠爱，因此甚至变得调皮且乖张。无意间被狗贩抓走，从此开始了苦日子，受尽凌辱和谩骂殴打；在这样灰暗的生活中，他遇见了第二个人，一个让他感受到自身价值的人，他们互相成就，让彼此散发着光芒，可是光芒散尽，终是分别了；小镇有了电报机不再需要邮差和雪橇犬，巴克和他的朋友们再次无家可归；生活除了苟且还有更狗的事等着你，巴克和他的团队被利欲熏心的烂人买下，烂人不会提供给他们食物和休息时间，只有谩骂与殴打还有无休止的压榨；在地狱般的生活里，老人闯入他的世界，担心他的安慰在意他的感受。巴克在法官身边活的最安逸，但是巴克消失了，法官也不会在意，生命中的过客罢了。邮差与巴克一起成长，相互成就，但终究是因为自身的价值可以被利用。只有老爷爷是和巴克因为感情共鸣而走到一起。哪怕巴克逐渐被狼群唤醒了野性，仍然不忘老人，在深夜也要回到他身边，要监督他不能饮酒，为他打猎淘金。老人知道巴克属于森林，让他回归自然与野性，可是巴克仍然在他有危险的时候赶来救他，义无反顾。 这就是人类的爱情故事呀！三次感情，不断成长。优渥的生活，爱人的赏识，这些都比不过一个不顾一切爱你的心。",7.0,,7
9,9,27199324,野性的呼唤,f9d10d6f4e57d6a101c9a4a7be3978d5,fc0e9b9d765a6a8728013bb15f49800f,4.0,2021-11-20 14:26:26,"《野性的呼唤》。7分。

改编自杰克·伦敦的同名小说，我特别愿意高赞。

多不容易啊，要用特级做一条这么厉害的狗狗。

巴克是一条非常粗壮的大狗，能懂人性甚至能听懂人话，本在法官家过着养尊处优的生活，结果被奸人所害卖到了阿拉斯加成了雪橇犬。

但巴克就是巴克，它不仅有自己的见识、胆略，也有自己的判断，在被老人乔治·桑顿救后，它终于在狼世界找到了自我，成了森林之王。

挺好的，纯粹，干净。",,,0
10,10,27199324,野性的呼唤,eea04d94bbaf87ea15c5fc0fbcf3d545,34ee1682d28109c795df8318021c2d86,4.0,2021-10-27 22:30:06,作为一个从抖音片段穿过来的路人观影者，我没看过原著，完全把它当成一部新片在看。冲着萌宠、正能量、羁绊这几个词，让我对它的初印象还是挺不错的。看完全片后，唯一的感触就是狗生巅峰不过如此。巴克，是条幸运的狗，也很努力的大家伙。 虽然说，大部分人对于狗的印象多是忠诚，就像我的人生最高信仰《忠犬八公》。可是片中的巴克，却并没有遵循常规路线，前后有了三位主人。不过最后和老人的相处模式，我更愿意称他们为伙伴，而非主人与宠物。 在法官的家里，巴克调皮的性格表现的淋漓尽致。仆人们听见巴克奔向厨房的声音，第一时间就把丰盛的午餐收到橱柜里，而不是呵斥它不许它进来。而主人见到巴克，也只不过是宠溺地小声叮嘱它，今天是重要的仪式，所以不能捣乱哦。虽然，最后巴克还是搞砸了聚餐，被主人关在了门外。可是，还是很明显地知道巴克在家中的地位，感觉得出来大家对于它的宠溺与疼爱。 调皮的巴克就像是经常做坏事的小孩，偶尔的捣乱却带来了难以想象的厄运。狗贩子利用食物将巴克骗走，将它带离了温暖的家，扔进了现实社会中。 虽然初入社会的巴克遭到过狗贩子的毒打，但是还是幸运地碰见了他的第二位主人。而巴克也因为一个新的身份--雪橇犬，从宠物犬变成了工作犬。在身份转换的过程中，巴克也从茫然不懂，被群体孤立，变成了有使命感的领头犬。而当巴克接受主人的脖圈，撒开腿飞奔在茫茫的雪原之上时，那匹隐藏于心得黑狼，胜过了曾经温饱无忧的悠闲岁月。可能，真的只有在无尽的雪地中，巴克才能真的做自己，出于本性，出于原始。 生而为人，我很迷茫，我不知道自己的价值。而我羡慕巴克，因为它找到了自己的价值，即使看上去被绳圈所缚，但却找到了该用力奔跑的方向。 巴克的善意，不仅赢到了同伴的拥护，也结下了下一份善缘。当巴克再一次因失去价值而遭遇厄运时，老人救下了它，并与它一起完成了一段遗憾但不会后悔的旅程。在最后的探秘之旅中，老人得到了心灵的救赎，找到了回归家人的勇气。而巴克也找到了自己的生存之地，和今后会与之相伴的伙伴。 虽然，大结局中，老人还是因为掘金者的攻击不幸死去，巴克愿意告别白狼选择陪伴老人的愿望没有达成。可是，在现实的遗憾中，他们却都已经找到了自己的答案。老人放下了孩子死去的悔恨，巴克找到了本应属于自然的自己。 现实往往不能都尽如人意，但走下去就还有希望。也许也正是因为遇见了世事百态，我们才能更深的了解自己，听见内心原始的呼唤。 虽然，有些人不喜欢这部片子，觉得它失去了原作的精华。但我仍然感谢，在迷茫无措的时候遇见它，给了我小小的动力。,,,0
11,11,27199324,野性的呼唤,8ac94c0fbfaea387214f84eb73f2aab9,679bd5a41d811de2ecab2604ab72bd55,4.0,2021-10-19 21:26:28,对于巴克来说，它活泼好动，强大而又善解人意，然而它的内心一直有一匹野狼。 它可以做一条看家犬，做的很开心，每日里吃吃喝喝，撒泼打滚。都把宴会搞成那样子了也依然没有人揍它，我想也是因为这段经历，使它变得如此通人性。 然而有一天命运给它开了个玩笑，它也为自己的贪嘴付出了代价，好在它运气很好，碰到了一对做邮差的夫妻，买它回去做了雪橇犬。虽然第一次到达北方，第一次面对严寒，巴克也还是很快就适应了。甚至连雪橇犬也可以做的有声有色，这对夫妻是个以自己事业为傲的人，他们为人们带来希望，带来爱。 聪明的巴克学的很快，也因为它的善良为它带来了第一个敌人，那匹二哈。也是在这一次巴克的野性第一次展现出来，明明是一只如此强大的狗，却不会打架!这预示着它做头领的将来，如此的有气度和强大。 也许不出意外的话巴克这一生都会是一只雪橇犬了，它干的非常好，而巴克也从这里获得了巨大的荣耀，体会到了价值，远比做家犬更加的有价值。可是命运依然从来不按照认得意愿来走，夫妻的工作丢了，而它们也被卖了，新来的买主却是三个傻逼，生生差点把巴克累死，好在老头子救了它。 同时它也救了老头子，于此开始一人一狗开始了一趟探险旅程，似乎他们行成了很完美的伴侣关系，一人一狗亲密无间，他们甚至找到了那条有着黄金的河流。可是在这里，巴克也第一次感受到了荒野，它从南方的大家族到北方的严寒，再到此处的荒野，一步步它都在远离人类世界，仿佛有神在冥冥之中指引它回到荒野，回到属于他自己的地方，那是它内心深处的那个声音一直指引它。 它可以从做家犬也好，做雪橇犬也罢，都可以从这里获取到荣耀与价值，然而它真正的位置是在荒野，是领袖。这才是它应该呆的位置，在荒野里它是那么的自在，那么的强大，它回到了它自身，做一个头狼是它的路，是它的生命之道。如此它才能算是回归到了自己的生命里。 电影说的是一条狗，内里是说的生命，而人类亦然。对于我们自己的生命来说，是否跟巴克一样有着一个声音在回响呢？也许你的内在有一个存在在指引你走向你自己的道路，但这条路是未知的，它也许充满艰难险阻，但是那是你不去则会后悔一生的。你也许有胆量也许没胆量，也许你能走过去也许你死在半路上。但至少不留遗憾。,,,0
12,12,27199324,野性的呼唤,3f0214d4ad3e91a9daf279f07bca9d16,52d422db93d7db479322f55371ea6429,4.0,2021-10-10 12:31:09,巴克的找回自我之路，全篇的节奏安排还是合理的，导演是有经验，所以这部电影中规中矩没什么问题。成长式主角经历了三个主人，第一个主人宠爱巴克但希望巴克听命于他，也不善于看出巴克的价值。 第二个主人把巴克当同伴，给予巴克鼓励与支持，巴克也是在第二个主人这里发生的性格上的转折，但也只是仅此而已。 第三个主人在反思的路上遇见了巴克，一人一狗没有太多交流但似乎都知道彼此需要的是什么，所以第三个人主人带巴克回到它的“家”并帮它找回天性，而巴克也帮助第三个主人意识到他来到这里一直寻找的冒险意味着什么。 本来如果只看全篇前半小时，我以为一条狗的冒险都可以结束了，但看完后我觉得可能不是一条狗，毕竟大部分人都只活到了前半段，没办法像最后巴克找回天性一样，人找回自我地活着。 有评论说巴克太像人了，这样反而看着很出入，这让我想起前两天看的一个关于演员眼神的演技视频，我认为巴克不能说话，肢体语言有限，旁白不多的情况下，应该只有眼神能表达自己的想法，不同于《一条狗的使命》的是《一条狗的使命》都是真狗狗，狗狗没办法按照要求给出眼神交流，所以有很多点睛之笔的旁白，这很容易联想到养狗狗的人会经常幻想狗狗和自己交流并且配合上狗狗的行为，所以想要有所突破和提升，就必然会有所损失。 电影最后我打4.5，为什么呢？因为老头最后死了，可能完美人生一定要在想明白之后没来得及实现就死去，总得有点遗憾，那评分也得有点遗憾是吧（ps：拉雪橇那段故事中，狗狗们打架像是后宫争宠[doge]）,1.0,,0
13,13,27199324,野性的呼唤,4b05ee86faf6375d653135b5acdf9213,993c70d0f2355b3376fec1b289f71293,,2021-09-20 10:58:27,一条狗的命运。巴克由养尊处优的物质生活到被卖后的辛酸与磨难，在阿拉斯加里成为不入流的雪橇犬，艰难困苦造就了他不服输的性格，最后成为雪橇之王。然而生不逢时，经历了许多主人的他，深深了解生活不易，社会上的毒打，遭到坏主人的打压，差点命悬一线，最后被一位善良的老人解救下，这也得益于他开始的善良，赠人玫瑰手有余香。最后跟着这个老人之间产生了坚定的友谊。在探险过程中惺惺相惜，彼此之间照顾，都体现了一条狗的忠诚。动物世界里只有厮杀，没有温情 有的只是冷漠。胜者为王就是这个道理。找到原始森林后的他也迎来了自己的伙伴。混杂在狼群里面的他显得格外与众不同。在新的集体里他很快适应，最后一统为狼群首领繁衍后代。保护自己的家族的光辉事迹。最后结局里在老人生命的最后一刻他也在旁边守护着，简直活化了他的形象。价值以及自己的命运握在自己手中。巴克完成了他的使命，也让他自己的价值在人类世界里绽放光彩。,1.0,,0
14,14,27199324,野性的呼唤,1047267a02eaf5bc01c0a3b470d6b2d6,016cc5fb2c2104bbf2b41e566a4595a5,3.0,2021-09-02 10:45:57,Buck是天命之狗，因为它心中有原力。当它还未经世事，懵懵懂懂的时候，原力就化身为黑狼为它指明前进的道路。     而本片的确担不起野性的呼唤这个名字，充其量也就是个正义的使者。Buck路不拾遗完璧归赵、为了帮孤寡老人送信多停一站、在雪橇团队中斗倒恶势力，帮失独老人戒酒，最后惩恶扬善让坏人咎由自取。妥妥的正面人物。     但野性这两个字，可不是这些。那是披荆斩棘、是火中取栗、是涅槃重生，是舍我其谁。而片中Buck的经历甚至都没有John更让人感觉悲惨。     Buck最终的归宿是狼群的头狼，而不是全家最喜爱的狗狗。这个头衔不是靠善良正直、舍己为狼能得来的。就因为救了一只狼，就万众臣服，美人归心了。难道狼群是靠民主选举投票当首领的么。     而且Buck过于拟人，如果直接用动画或许狗设更容易接受。但本片的主题，如果用动画又显得不够厚重。这就有些骑虎难下。     或许受困于PG的分级，舍弃了一些原著的元素。但如果没看过原著，又乐于接受一部温情的电影，本片还是可以一看的。  花絮： 1.与原著不同的是，本片给了John Thornton一个过去的故事。这么做是希望让John和Buck的经历有一些相似之处，以展现人类和狗一起客服悲剧后找到勇气。 2.Buck是一半圣伯纳犬血统和一半苏格兰牧羊犬血统。 它在原著中被描述为看起来像一头大狼，而不是他在电影中的混血外型。 此外，电影中的雪橇队也没有像书中所描述的那样都是哈士奇。在电影中，只有Spitz是哈士奇，而且它是黑白的，而不是书中的全白。 3.本片全程使用CG制作狗，是为了让它具有更全面的情感表达方式，同时避免真狗在恶劣环境中受到惊吓或伤害。 4.本片是Chris Sanders导演的第一部真人电影。,,,0
15,15,27199324,野性的呼唤,276a3c70fde77becb2dfc02dabefeaf3,eeeaf337ff1e8309597ce706816eb382,5.0,2021-08-10 13:49:34,"标记印象深刻的几点
1.黑狼出现的场景。看解说之后会更加理解一点，黑狼代表巴克内心深处的野性。凭直觉做出的各种判断。
2.当领队之后冰雪上奔跑的那一段，好多人都说看的热血沸腾想套个脖套跑几圈，哈哈，带感的BGM直接入坑。
3.巴克和二哈的巅峰对决。都说二哈傻傻的，只有在寒冷的地方智商才能占领高地。最后落败孤独的背影还是很令我心疼的，，，，冰天雪地它一只狗应该也是很难生存下去，虽然后面没有讲到，但估计差不多这意思吧。
4.巴克英雄救美。和小白狼的相遇，找到自己的幸福，回归自然，遵从内心，太帅了。
5.巴克在人类世界感受过温暖也感受过暴力，看着老人的小土堆我也是五味杂陈。
个人感觉很好的片子，我没有什么高要求，能感动到我的就是好影片啦",3.0,,1
16,16,27199324,野性的呼唤,a4873386492981d478ce7d6629a4708c,a323a2e80e7d7fa3858809d9ae16444c,5.0,2021-08-08 22:37:43,巴克本来是一只无忧无虑的大狗狗，生活在一个富足的小镇，主人很宠它，所以它是有些天真和傻气的，所以在别人要带走它的时候他才傻傻的相信了吧！可是他一直是一只热心的狗狗，不忍心伤害一只小兔子，看到亲近的人和别人有冲突会去保护他，可总有经历让他慢慢成长，自然界的竞争，有些可恶的人类给他的磨炼，让他一步步召唤出自己的野性，这种野性不是坏不是残忍而是更好的保护它自己和他在乎的朋友家人，真的很感动！,1.0,,0
17,17,27199324,野性的呼唤,d60f7b5266e4bd3503e6c35eef280354,d7696b508b82cf7e0e429f948034b631,,2021-08-03 11:25:41,"巴克是一只体格健壮的狗，原本在法官家过着养尊处优的生活。却被园丁偷走，被卖到了寒冷的阿拉斯加当雪橇犬。从此巴克的坎坷命运变开始了。之后的巴克也经历了好几任主人。他们对待巴克，无一不残暴着。而且巴克为了在狗群中保住自己的地位，也面临着巨大的挑战。最终巴克走向野外，在经历各种苦难后。成为了狼群的首领。

剧中巴克的形象是强者的向征，通过人的世界看到了狗的世界，在剧中写狗就是写人，赋予了狗以人的性格和心理活动，所以称狗为“他”而不是“它”。",,,0
18,18,27199324,野性的呼唤,e0e897d98bc17154c675829bfd7ace36,6962ef5c433b67bb0643b8108bdbacee,4.0,2021-07-21 22:02:34,看完了，野性的呼唤，然感觉有点走心，故事的大概是狗的成长历程吧，这里的狗拟人化了，影片里不乏体现出了人与动物和谐相处的一面，也有人把动物当牲口的一面。如果把影片中的巴克拟人化就很好理解了，巴克是一个富人家庭的狗，小时候很受宠，主人也对他很好，在阴差阳错下开始了他苦难的历程，被贩卖到了邮差那，见证了狗狗的成长，从被养，变成了自食其力，并且可以很好完成一份工作的成长，邮差对他也不错。到后来，体制改革，被迫下岗，然后遇到了一个不好的老板，昔日的好兄弟被压榨，致死，然后不堪忍受，被一个淘金者带走，开始了冒险之旅，这时的巴克也有了新的变化，环境舒适展现了温情的一面，与老人朝夕相处。最后来，巴克听从内心的声音，独自去森林冒险，拟人的话，这一段我仿佛看到了老人对孩子的一面，老人知道自己老了，孩子终究是要长大的，放逐森林，让巴克寻找自己的归宿，在森林冒险的途中，巴克遇到了自己的爱情，与白狼，后来老人出事了，巴克送走老人后，开始了自己成家立业的生活，与白狼和狼群一起开始了自己的正轨生活，回归野性，繁衍后代，在自己的领地上生存打猎。,,,0
19,19,27199324,野性的呼唤,fe24ee4405df936fdf09d6158aaacd73,7d4b42f11f7e0f1657ce06aef647708f,3.0,2021-06-26 20:10:40,"巴克的两段（或者说是三段）故事让人有点抓不住重点，影片本身或许是想要传达巴克在人类社会中经历的几位主人的带领而后回归自我，但三段故事讲的又比较细腻让人感受不到那种沧桑感。
还有关于巴克追兔子的点，还有其他一点呼应的点，出现次数有点多了
最后吐槽一下那个淘金的反派，出现的真是莫名其妙
个人感觉这种以动物为主题的电影其实很好戳到观众的情感点，但是也很容易很“空”
这部片子有点类似《多哥》，但叙事上我更喜欢后者
以动物为主角，但是毕竟动物本身没有性格（或者说动物在表现上面的转变我跟倾向于认为本性如此），单单对其善良本性的展示只是会让人动容，情感上是丰满了，但没啥思想上的想法，讲白了真正要给观众传达一些东西还是得从人开始讲，不过综观其主旨，表达的本身就是一些比较抽象宏观的东西

还是有一些点让我挺惊喜的，比如巴克每每在晚上看见的那只大灰狼的意向，还有几个地方不同主人推着一脸无奈的巴克出画的画面",,,0
