,Unnamed: 0,电影id,电影名称,用户id,用户名,评分,评论日期,评论内容,有用数,没用数,回应数
7,7,30170833,荞麦疯长,7ef77619de8da02d60f29de6963e2313,7cb8fa850f8ffc504fb9a355910034ee,5.0,2020-08-26 04:02:37,看了评论有点懵，很好看的电影，三个人的故事很完整，剧情没有大问题，逻辑上也都通，串线自然。画面很美，配乐好听，三名演员演技都很好，全是电影脸，马思纯偷东西时的俏皮，钟楚曦的舞蹈，黄景瑜隔窗相望的笑容等等都让人印象深刻。 电影主题很明确，就是异乡人的漂泊和奋斗，通过三人不同的生活视角表现出来。生活不是升级爽文，有成功就有失败，三人戏剧性的相遇和擦肩而过，这不就是生活？这不就是现实吗？  电影里的细节也处理得不错，有几处我特别喜欢： 一是云荞爱唱歌永远带着随声听，吴风在卡拉ok遇到的她，表明了云荞在海城这半年的生活，有评论说马思纯这条线是不完整的，其实这条线是完整的，只不过是从侧面表现了出来，在男朋友死后，她在寻求唱歌的梦想失败后决定回到家乡；  二是吴风的小号，第一次小号是在吴风的柜子里出现的，我们可以发现他极尽温柔小心翼翼地保护，第二次小号却被兄弟摔在了地上，被生活捶打，第三次吴风亲手把小号甩到了地上，此时他命都不要了何况一把乐器呢？  三是李麦拿到了去新加坡的机票，她的经历虽然坎坷但生活没有辜负她的努力，她把那件美艳的绿衣裙留在了出租屋里，从此再也不需要它，她完全可以靠自己的实力得到专业认可，无需依靠任何人。  其他的一些细节很有年代感： 比如：马思纯和男友在钟楼，马思纯带着耳机听着音乐，男友用手人工调节天线，相当真实。还有21路64路的车牌、小录像厅、卖彩票、大排档等等都打着那个年代的印记！  最后，李麦坐上公交车，云荞下车看到她却不识，吴风暗恋她却没看到她，这一夜发生的事将要改变太多人的命运，如果吴风看到李麦，也许吴风的结局就会不一样了吧，也许他会鼓足勇气去和自己的爱情打个招呼……  上世纪的90年代啊，1990年1月上海第一条地铁线刚刚开工，1990年4月国务院宣布开放开发浦东，1990年11月上交所成立，1992年中共十四大提出发展社会主义市场经济，这是计划经济向市场经济过渡的年代，是各种观念冲突的年代，是有着前所未有的机遇的年代，全国各地的人口开始加速流动，不断涌入这个城市追求梦想，有的人失败了，有的人实现了，有的人把命留在了异乡。 祝愿爱和理想都能实现！ 20200825  -------------------分割线-------------------- 这个世界从来都是有多种声音的，你可以发表不同看法，但在评论里叫嚣着恰钱的小号是有多害怕这世界存在着和你们想法不同的观众？ 如果你们容忍不了其他评论，劝心胸狭隘的你们只看自己能接受的评论。 作为一名普通观众，观点就放在这里：电影总体好看！新人导演拍摄有不少缺点，七夕放映的时间点也选的不好，但电影不至于现在这个分数！没看电影前我还真被评论带进去了。 电影好不好是个很主观的东西，各位看客都可以评论，不要搞错重点，攻击看客，ok？ 我只在意自己可以依法在正常渠道和平台发表自己观点的合法权利！ok？ 一篇再平常不过的即兴心情而已，甚至都不完整，有必要如此紧张？你们是不是想用攻击别人恰钱这种龌蹉手段使不同观点的人不敢发声？或许你们才是收了钱的，所以才能对他人恶意揣测…… 20200830,82,37.0,40
8,8,30170833,荞麦疯长,559dee36b97f2c67ccbcc0d7a89f3c68,117a9b81bd89348af084d0eef48d3284,1.0,2020-08-26 22:05:45,看到后面花絮才发现作者想表达当今社会年轻人生活有多不容易的。可是这不是恶心观众的理由啊，李麦第一次遇到渣男就算了，小姑凉年轻眼睛不雪亮，第二次为啥，最后那个男的被揭穿了在化妆室就搞起来了，行为啥逻辑，作者是想表达啥，我只能用我的恶意去揣测一下，是想表现女性只能依靠男性吗？太恶心了，最后这个女孩子还去新加坡了，很难不让人想到不是依靠那个男人。还有好几处恶心的，qj马思纯的那个人，马思纯应该恨死他了吧，马上就穿上他的衣服去找他男朋友了？最后这个男的也没收到惩罚。吴风他身体素质有点猛，负伤那么严重，开车埋尸一气呵成。一部电影没有真的感动人，后面的彩蛋就很矫揉造作，我看最后有一个人哭了内心还有点想笑。 狗屁文艺片，太恶心了,16,,12
9,9,30170833,荞麦疯长,df12dd83642c6a9209e60f01ec3a4a72,d2c57e9e6ed7db417500700ea3ba39b4,4.0,2020-08-26 17:32:47,疫情后第一次去电影院看的电影，还是有点小激动的终于可以在电影院看电影啦！下面说说自己的感受和一些想法，好久没写长评了呢！       说实话看的蛮压抑的，金子买了刮刮乐是想图个好彩头，但是他倒下的那一刻就猜到了必然是谢谢惠顾，徒劳一场挺有讽刺感的。每一条故事线相辅相成前后呼应，刚一看会感觉有点乱乱的，但是整个看完后看看静下来细品是有感觉的，导演从三个人物出发想告诉观众一些东西，一些在现实社会中我们都清楚却不能放到台面上的故事。        努力的挣扎拼搏想从深陷的泥潭中挣脱出来，甚至不去思考方式方法的对错，吴风（黄景瑜）打开门窗看到那一抹红是开心的，李麦（钟楚曦）能够在舞台上跳舞用舞蹈表达自己是开心的，云荞（马思纯）有一件漂亮的衣服可以听到海城的广播是开心的，可是在开心后会想要的更多，最后三个人的人生朝着不可逆的方向发展。         看到这你一定觉得这是个狗血的三角恋关系的电影，但......还真不是。不知道该怎么具体形容这个感觉，需要看过后自己慢慢的品味，三个都是独在异乡的人，总有一些可以或者不可以说的原因促使他们离开家乡，美好的憧憬和现实残酷的碰撞，压抑的心情孤独的感觉落寞的身影，这是很多异乡客最大的感受，却也是无法改变的事实。         看完我想的蛮多的有的没的，是一部压抑的电影也是一部勾起我很多回忆的电影，自己的一些感受写出来都觉得很沉重，尴尬。。。不过还是建议去看看，我也不是专业的影评人只是觉得这三个角色有三位扮演者自己的理解和表达方式，李麦就是这样的高傲且不服输，云荞就是这样的顽劣却内心细腻，吴风就是这样的不起眼但不畏黑势力。         黄景瑜的每个角色确实给我不一样的感觉，很有灵性。百度了下这电影18年就杀青了，是蛮早拍完的。虽然被多次吐槽台词功力差，不过近期作品是能看到有进步的，另外两位小姐姐的电影看的比较少，马思纯演技还是可圈可点的，希望三位继续努力多出好作品吧。,14,4.0,7
10,10,30170833,荞麦疯长,433ecabac6ec5015f16c0e1cd6c8535b,a5f3c6a11b03839d46af9fb43c97c188,4.0,2020-08-25 15:51:26,我对《荞麦疯长》挺失望的，导演想要表达的东西太多了，却几乎每一个点都没有抓住。 荞麦上映之前，我看了许多有关这部电影的物料、预告甚至纪录片，对这部电影充满期待。“唯有爱和理想值得疯狂”这个slogan也蛮戳我的，当代都市人被生活压得死死的：没有资本谈理想，没有勇气去追求爱情。在这个暑假里，我的田野调查发现婚恋市场中的“匹配”已经有提前至大学的趋势，我们将越来越没有机会去说爱了。 《荞麦疯长》本来有机会成为一部很好的电影：用云荞来表达宿命感，一心想逃离故乡慈镇，兜兜转转最终却又选择回了慈镇；用李麦来体现对理想的追求，她是一个优秀的舞者，可以为了跳舞放弃所有；吴风则是承担了“爱”这个字，他对兄弟讲情义，为爱人奉献了生命。   云荞的宿命感可以体现在哪呢？ 1.云荞的父亲在云荞未出世前就抛弃了这个家，留在家里的是一件皮衣，皮衣里有一张父亲的照片（我觉得是父亲在海城所摄），照片里的父亲阳光帅气。我猜想父亲是在知青下乡期间取了云荞的母亲，又为了前途选择抛弃她们回了海城。 2.云荞的姐姐云舒是一个看起来很精明能干的女人，她在海城上学、工作，却也还是回了慈镇。这其中的百转千回电影没有怎么体现，只是在云荞的台词里加了一句：我能够体会姐姐的不容易了。这句台词的背景是云荞在海城待了半年后决定回家，那这半年云荞的生活里发生了什么呢？导演没有讲。 云荞离开慈镇的契机我可以理解（关键情节就不剧透了），但是她在海城的经历导演没有任何刻画，除了刚到海城时的***（也是关键情节不剧透）。这让我觉得不合理，或者导演认为云荞这个角色只是一直被命运推着走，即使是这样我也看不到疯狂体现在哪里。    唯有爱与理想值得疯狂，吴风担了“爱”这个字，李麦则是服务了“理想”一词。其实，吴风和李麦这两个角色可以单独拿出来另拍一部电影，此处暂且不表。 吴风这个角色给我一种面目模糊的感觉，仿佛吴风的存在只是为李麦角色这个服务的。 打手这条路是他的兄弟替他选的，最初只是帮兄弟一起去追债，这个追债场景具有一种荒诞美——B司令的追债团伙扮成送丧队伍去向工厂老板讨债，吴风是被他的兄弟金子临时叫过来的，穿上丧服，拿起次中音号吴风开始用心吹，金子对他说不用这么认真，吴风笑笑说：“一分耕耘，一分收获。”阳光洒在吴风纯白的丧服上，映出无数和吴风一样的人的笑脸。  这一段舞厅戏算是影片里最有趣的镜头  B司令是个黑社会老大，吴风在他面前有傲气（这部分内容应该有所删减），金子喝醉后透露了吴风的暗恋对象是海城现代舞团的。一个猜想：B司令给予李麦的“卖身”机会可能是因为他看不爽吴风，想要让吴风觉得难堪。 吴风和李麦的联结还蛮自然的（关键情节不作透露），吴风的生活里都是苦涩的味道，李麦对于吴风来说是黑白世界的一点美好。   钟楚曦（饰李麦）真美呀，人美舞也美！这是我对李麦这个角色的最深印象，同时我又觉得李麦这个角色存在很多不合理之处。 她对现实的就范在我看来更多的只是为了生活本身而不是为了理想，或  者说导演没有体现出这一点。 李麦的家庭到底是否富有呢？在那个年代能让小孩去学跳舞的，我想都不会是普通家庭。 而让李麦迫于现实去又是母亲高昂的医药费，这样还可以圆过来——因病致贫嘛。 但是，李麦的衣服饰品看起来都挺贵的，还有她为了“渣男”还债给的钱和珠宝，这些是哪来的呢（这个时候母亲已生病）？李麦在酒吧里说出的地道英语和新加坡司令酒的典故也让人觉得她是常年混迹于这种场合的。李麦最初能去日本跳舞也依靠她的日本恋人。 那个年代，舞蹈和名利场密不可分，李麦是一个早就习惯待在名利场的人。   写完这篇影评，通过自己的解读才体会到导演想要表达的宿命感，云荞一次次的选择是宿命，李麦与舞蹈的纠缠融合是宿命，吴风为了情谊和爱舍弃一切也是宿命。吴风是一个很令人心疼的角色，善良的人被命运一步步推着走，命运从未给予他糖果。就像景瑜说的，吴风最后想到的也只能是命运对他的嘲讽吧。,20,1.0,12
11,11,30170833,荞麦疯长,9ab4ee69a368d6db23bbc4ef21447325,e100520fcd45ee2177e62f0fb17a9add,5.0,2020-08-25 20:56:35,因为自己看了一遍，朋友又请我去看了所以看来两遍也就想的比较多。 但是有一些人根本没看懂在那骂无厘头我觉得不太好就来写点东西。 都是我个人的看法罢辽 肯定会有理解不同的人 有问题可以提出来大家一起交流 “唯有爱和理想不可辜负” 荞麦疯长里的三个人物都很好的诠释了这点。这就是这部电影的主题。 云荞，慈镇的小姑娘，她想着去海城闯荡。（这里插一句我一开始以为她看照片是看他爸爸，后来发现其实她在看的是照片背景上还在建造的她梦里的海城。）我觉得云荞是一个天真烂漫，敢于追求的女孩。她想让自己的人生像电影一样精彩，虽然最后只是悲剧。（“后来我才知道电影也分喜剧和悲剧”这句话很戳人）她爱秦声，她是个大胆的女孩儿，而秦声则是比较胆小，但是他虽怂也还是一直挡在云荞前面。这体现了爱。 下面是一些人觉得莫名其妙的地方我说说自己的理解： 其实很多都可以用推动情节来表达主旨来说明啊（可能这就是很多人觉得不好的，但是因为我并不厌恶） 1开头那段云荞去偷东西，在我看来不仅仅是为了展示人物性格，而云荞和片警说的话其实就表现了她对离开这去海城的向往，这直接表现了她的梦想。然后姐姐出场，并且线索之一金鱼出现。（因为几条金鱼大吵的人和拿金鱼喂鱼的B司令形成鲜明对比，表现了两个阶级的对比。而最后云荞养了两条金鱼）还要一个线索就是那个钟，一直不走的钟。云荞和秦声出发去海城，钟走了一下，但也只是一下罢了，象征着他们的生活在前进，但是也只是一小部罢了。 2有些人可能觉得云荞被强奸那一段很莫名其妙，但是也是因为这件事的发生，坚定了云荞去海城的想法，也才有了后面的故事（不然云荞没去海城，李麦顺利去了日本，吴风也不会是现在这个结局）还有云荞被强奸后裙子上的jingye很细节。然后云荞又帮妈妈关好门真的很戳我（之前因为出去玩闹帮妈妈关好门，而这次。。。）。云荞故意作弄姐夫，姐夫不可能不知道。我不知道他的坏心思是刚开始见到云荞开始亦或者在云荞穿上那条黄群给他端了那碗汤并且做作的叫他开始。 3关于姐姐给云荞钱，打他对象一巴掌我觉得有两种可能。一是姐姐知道这件事了感到愧疚和羞愤，二是姐姐关心云荞。但是我愿意相信第二者，姐姐可能从云荞过来报复这边懂了一些东西，而她也绝对是爱云荞的。云荞要去海城闯荡，姐姐也是在海城闯荡过的，她知道不容易。 4关于两个留白，秦声被黑社会打之后和被父亲打之后的留白，电影时间有限，而且之后也交代了结局，过程其实是没有啥好拍的。我觉得这没问题。 别的东西暂时没想到就不写了 可能有些东西不合理但是仔细想想也是合理的 啊没时间写了，剩下俩人物有空再写。,39,8.0,23
12,12,30170833,荞麦疯长,4c7236d1a4a00cddeddd99faff996453,7279f8c92c2026932cef4d37e2f20a2d,4.0,2020-01-01 22:29:18,你好，我是吴风。我来自一个可能说了地名你也不知道的小镇，现在，我生活在这座城市里。 我有一个哥儿们，我们从小感情就很好。那时候我成绩不好考不了好学校，在为未来发愁的时候还是他建议的我学次中音号。这次中音号嘛，特别，特别的偏门，只有部队里才有，不过在部队里吹次中音号真的是我人生中最安稳、幸福的日子。可是总得有退伍的时候，除了吹次中音号之外没有其它特长的我对未来真有点迷茫……  这时发小和我说不如一起来海城闯一闯。大城市机会多竞争也多，没啥专业技能的我难免会磕磕碰碰，不过一分耕耘一分收获嘛。虽然租房贵，几乎都是榨菜泡饭将就着就一餐。不过我租到了一个好房子，虽然是房东荒废了很久的老房，但我能在窗边看到她。 她好漂亮，我永远记得我刚来那天拆了钉在窗户上的木板后第一次见到她的场景，她笑着打开了窗，享受着风，享受着阳光，好美好、好安逸。后来机缘巧合知道了她是市里舞团的舞者，但是她应该很快就要离开这座城市了……我应该没有机会再见到她了…… 半年前，我的发小因为掉进圈套结果连命也丢了...... 这个仇说什么也得报！ 我不知道我还能不能活着回来...... 原来能安安稳稳地生活也是挺奢侈的一件事，更别提什么出人头地了……  但是我不后悔！,26,6.0,6
13,13,30170833,荞麦疯长,f54345a9137e770bd716016f956140d7,9466e9133b7b3383d96863dfbfdaee30,1.0,2020-08-27 23:16:45,"剧情烂、镜头美的mv 
人在电影院，只有憋屈和窝囊的感觉。 
不是拉踩，真的，这讲故事的水平不如小时代。 
小时代至少把狗血淋头的故事完整交代了，而且还有个起伏（虽然也很糟心）。

就算是秀脸秀身材，小时代勉强有一场维密秀的视觉冲击力，肤浅浮夸病态但是嗨。

这电影怎么说呢，它把女演员原本很高级健康的美，和令人作呕的东西挂钩，成了罪恶。

把美好的东西撕碎可以让人心神颤动。

这电影不是，

它就是单纯地摧毁，是写好的作业本烂在臭水沟，漂亮的手链被熊孩子扯得四分五裂。只会让人恼丧郁卒，给你满满的负能量。

压抑的文艺片，如果能有一个令人深思的内核，那么无论它的呈现方式，如何干瘪苍白，也值得人尊重。

但所有的这些，在这部片子里都是不存在的。

电影就像一个容器，一杯酒，你不能把乱七八糟的东西随心所欲地塞进来，就像你不能把失去逻辑和理智的剧情，涂脂抹粉来胡弄观众。

存在即合理，艺术源于生活，也许有人说，人不该用自己幸福安宁的生活去揣度评论他人的人生。这个世界上，我知道或者不知道的角落，就是有混混的争斗、女孩遭到侵害、自尊被现实摧残。

电影没有标注成喜剧，我不能要求它带给我快乐，但不该是无处宣发的恶心和愤懑。

有些烂片让我们昏昏欲睡，但作为一个普通观众，往往发两句牢骚就过了。

也许这部电影不是没有表达一些思想，或许正是这些丝丝缕缕泄露出来的脉络，才令我如此愤怒。

舞者的肉体，搭配华服和音乐，编织梦想与现实交错的羽衣，再华美，也不过是为了将她剥开，赤裸又低廉地成为金钱和肉欲的祭品。

叛逆鲜活的女孩子，要遭受出其不意又残忍的性侵害，永远失去喜爱的人，为陌生人流两滴泪，才能攫取所谓成长的养分。

阳光正气的青年，纤长的手指，唯有放下乐器，拿起匕首，在黑帮械斗中过关斩将、杀人如砍瓜切菜；再为暗恋女孩，不太有价值地献出生命，才能淋漓尽致地注解虔诚与纯粹。

当大家已经能大声抗议，拒绝青春片堕胎的烂俗设定。总有人用他智慧的脑袋瓜子，另辟蹊径地把一些自负的想法，通过电影的镜头侃侃而谈。

可悲的是，即便以上这些令人不适的表达，也是残缺且浮于表面的，就像有些明星立不住的人设一样，这部电影成功地把现实的阴暗面诠释出无病呻吟和故作矫情的意味来。 把这些设定连接在一起的细节，是天马形空地生凹硬造。演员表演地越用力，他们的哭笑越真，观众被愚弄得荒诞感越强。因为主角们的行为和遭遇，是用正常思维和普通人的处世原则，不可解的。

人物的悲惨无法让人共情，甚至站不住脚，一言以蔽之，最终交待给观众的，是一群蠢人的烂事。

人当然有资格主宰自己的梦境，但观众没理由承受这样的苦楚——身不由己地成为他人梦境的旁观者，困囿于创作者不负责任地涂鸦。导演把大家拉扯进他的梦，毫无逻辑地随心所欲，人物不过是完成剧情的牵线木偶，东一块西一块地执行编好的程序。 
这部试图自圆其说的电影，就像强行缝合的布偶娃娃，手艺拙劣，也只好曝露出粗陋的针脚。

而演员所有的努力，试图阐释出人物的灵魂和内核，不过造成观众更深的痛苦——荒诞失序的梦与现实，是撕裂的，拉扯的。被迫接收这样的信号，无疑是一种折磨和对智商的侮辱。

如果说，从这部电影里，我学会了什么，那大概是，不要将就。哪怕它只是一部电影，也能带给你一个烦闷的夜晚，浪费生命中不可追回的112分钟。",12,,5
14,14,30170833,荞麦疯长,86c3667413a25b28f3464536029c31af,92be9656259dedecd09310fbb8d404e0,1.0,2020-08-25 17:17:37,所有剧情都是围绕B司令的，所有人都没怎么关联，除了B！死了以后就大结局了，最后作为一个黑社会老大 还要单挑死去 不是主角 谁是？ 整部片就是烂到爆了！强行矫情，女孩们好像不被强女干，不被骗 不被渣，不自杀好像都不是一部片！强行文艺，大部分剧情在游离！从小到大第一次因为不爱看一部电影而在电影院打游戏，最烦的是还输了 坑了队友就更影响心情了,14,2.0,15
15,15,30170833,荞麦疯长,8c9177283a453f4b461ebc3fe7b08595,84afad6ddfeb8bf9c93be7b2a5ce8427,,2020-08-25 17:50:55,七夕给自己安排的节目是“独自到影院看一部催泪电影”，特地准备了一包没拆封的纸巾，结果直到散场竟然完全没有拆封的机会，连纸巾都蒙的一批，就这？ 先总结一句话，这完全就是一部打着文艺片情怀的旗号企图运用call back的手法结果愣是把小人物的悲剧演绎成闹剧的“喜剧”电影。一场下来，影院里的笑声此起彼伏也真够讽刺了。 槽点1：留白过多，情绪不足。 文艺影片中的留白往往是观众情绪的延伸，可是你见过连观众情绪都还没调动起来呢就咔嚓一下来个硬留白的吗？ 比如马思纯被姐夫强行侵犯那场戏，说好的让现场工作人员都忍不住哭了的情节呢？结果是观众刚想酝酿情绪，马思纯已经高高兴兴地跟男友去海城吃肯德基了？玩呢？压抑和悲伤的情绪难道要观众自行脑补？ 再比如黄景瑜在兄弟尸体面前那犹如被扼住咽喉的假哭，简直比被鱼刺卡住了还难受！ 槽点2：剧情浮夸，强行回扣。 明明是想讲小人物的故事，偏偏又要让小人物背负常人不能承受之重，那承重之后是不是得有个High点呀，可High点在哪呢？云荞一心想去大城市闯荡不惜搭上男友的性命然后混不下去想要回家再然后遇上黄景瑜意外获得了他用性命换来的一皮箱钱最后得以远走高飞？李麦为了能进舞团跳舞给母亲凑药费不惜出卖自己然后遇上嫖客猝死不知所措再然后莫名其妙被黄景瑜神助攻默默处理掉嫖客尸体最后得以远走高飞？ 这哪里是荞麦疯长，这明明是黄景瑜疯了吧！最讽刺的是黄景瑜在电影中竟然真叫“风子”，可笑吗？[允悲] 这一通驴唇不对马嘴的演绎，总结下来主要想告诉大家如下几个自然规律： 1，人各有命。黄景瑜的兄弟在械斗中身亡，他的彩票刮开是“谢谢惠顾”；而黄景瑜死里逃生，彩票刮开是“一等奖”。 2，红颜祸水。黄景瑜明明可以拿着械斗得来的一皮箱钱远走高飞，偏偏为了帮李麦处理嫖客尸体而一命呜呼；云荞的男友更是为了帮她圆心血来潮的梦想而搭上性命。 3，暗恋注定没有结果。黄景瑜这场旷世暗恋葬送了自己，成全了两个姑娘。但直到最后，即便与自己暗恋的姑娘只有转角之隔，却也难免擦肩而过的宿命。 综上所述，这部电影大概不是要讲什么梦想，要讲的应该是“爱要大声说出来，否则就要领盒饭”吧。。。。。。[允悲],5,,4
