,Unnamed: 0,电影id,电影名称,用户id,用户名,评分,评论日期,评论内容,有用数,没用数,回应数
16,16,30170833,荞麦疯长,0ae76fa97656f03440695278cfe29e09,91c4203609ca147a5f84e5277455762d,1.0,2020-08-29 16:50:39,"看了有几天了，人名可能不太记得全。我觉得这不是荞麦拼了命疯长的不容易，而是疯了的荞麦毁掉自己的人生。 朋友说想看，就请客看了这部电影，结束后朋友说对不起让你花钱了。 女主1号荞，偷东西，对姐姐阴阳怪气，男友东西被砸不该出气的时候出气让男友被打，姐姐男友送的裙子当时就穿出来（老实说这种低胸裙子我不建议姐姐男友还在就穿出来，虽然姐姐男友也是个十足的人渣，不要说女主自己一点责任没有，其他女生不同意），被侵犯后还能依旧像没事人，到了海城男友去了，最后这一系列解释就是小时候姐姐是她最嫉妒的对象，影片想表达年轻人到异乡的不容易。emm，根本就是把年轻人的不易仅仅归于人心、归于现况残忍，要是拼搏后体现残忍也就算了，主人公本身也就没有如今年轻人的奋斗还偷东西，不体谅家人，残忍也是应该的吧。 女主2号麦，腿断了，被日本男友抛弃，被新加坡男友抛弃，差点被司令说的可以帮她的人侵犯，差点摊上人命。我没有看到女主自己有主动去做些弘扬主流价值观的事情，先是依靠日本男友，再是依靠新加坡男友（虽然她也为新加坡男友付出了一大笔钱💰，但是靠这个我不接受，她虽然善良但是也傻）。母亲生病需要钱，好，她去面试，但是失败了一次她就选择捷径了。（人生可不就这一次失败呢）所谓的雨中舞蹈跳河还能螺旋上升活过来对不起我真的无法理解这种悲剧的美。 男主风，喜欢麦，为了兄弟拼命，为了喜欢的女孩子帮她清理了人命。emm，我不是很懂难道在他们那个年代就没有法律了吗？如果不是，那么他只是个无视法律，鲁莽无纪律又蠢的年轻人，不接受反驳。 最后的三个主人公穿在一起的关联,真的没必要感觉纯粹是凑时长。 谁还没看过几部LAN剧，花了钱看的，不喜欢勿BB。",8,,0
17,17,30170833,荞麦疯长,7b054573f955c96d8edbfd617a84beb6,bbe4514653d08467f8366aef7fa6738b,,2020-08-27 10:06:20,荞想活成一部电影，被姐夫强暴，男朋友被车撞死，一个人唱K还被劫持。麦跳舞，车祸撞残腿，被台巴子骗，走投无路卖个身，老东西当场心梗嗝屁了。叫风的男人，吹的这叫什么簧，三个人声光色凑全了，被损友卷入黑社会，同归于尽。 所以这部片的主旨是…文青没有好下场？三个人的命运构成一串的环，又说明，文青的内耗太严重了？ 情节很超现实，滤镜很墨镜王。但是片尾放出一系列北漂的真实采访，这是个讲小镇青年在大城市奋斗的故事？我脑袋上的云朵里缓缓升起黑人问号，地铁老人看手机，愤怒女人指猫，等一系列表情包… 钟楚曦的颜真是好啊，贡献了自己表演史上最有张力的演出。马思纯开始百无聊赖吃零食的感觉好。这个演员叫王阳明，这个名字就很欠扁唉，表演有模仿张震的痕迹，但没我震冷酷。 时空很乱入，处处90年代，哪找这么多古董道具的，但是调性很令和废柴。,9,,2
18,18,30170833,荞麦疯长,410e2bf7fc28ccb39b4a4fad3eb10a9b,2aea130909457e0d495923263e3961cb,,2019-12-31 18:44:15,今天在佛山看了超超前路演，大老远从广州地铁+骑车赶到…尿都没来得及尿电影就开始了，直挺到导演分享完，天杀的傻缺影院还把后面尾部的一段给截了，僧气！ 有剧透，不想被透的朋友不要看后面的。 整体观感荞的故事有点苍白，相反觉得荞的男朋友、姐姐还有姐夫被描画的更有故事性，也印证纯纯给的好，链接起来所有人，但不知是我期待更多还是怎样，总觉得有劲儿使不上的感觉…荞被qj那场戏，前面的xing张力真的很强烈，一呼一吸之间… 李麦，楚曦真的是太美了，每一帧都美，美的越盛越显得人物的悲，雨中的舞让人动容，导演在分享时说他们拍之前都还没雨，camera一开雨雷闪电都来了，老天爷来帮忙，终得这一舞艳绝。最后她终于得以离开海城，拿到想要的机票，妆容由艳丽回归最朴素，我也感觉她的脚终于踏在地上了，麦子还是植根进土里，不再无依无靠的飘了。三段故事里我觉得楚曦的被讲述的最完整。 鲸鱼，怎么讲呢？怎么讲我都是带着粉丝滤镜的。到目前为止，他所有自己原声出镜的作品，我都仔细看过了，我内心坚定的认为他是一个表演天才，悟性极好，他可以让我立刻感受到他所展现人物的感受，共他的情。了解他的人自然知道，和风一样，景瑜很小就从家乡到大城市打拼，影片故事里风被着重甚至是只刻画了情➡️友情和无始无终的爱情/还是凄美暗恋。和景瑜配戏的兄弟演员也很棒，短短几个片段/对话就显示出二人对人生追求的不同，兄弟想干大事情，要用小手段去赚钱，风担心兄弟，想他好好做事、做正经事，我也好奇风到底是干嘛的，影片没有透露一丝，但风会自己做饭，照顾自己照顾的很好，家里整整齐齐，相信一分耕耘一分收获，是踏实肯干的“憨憨”。但兄弟耍手段没耍过大佬，他的死打乱了风的生活，生活目标也随即变成为兄弟报仇，一箱子意外之财也不会改变他这憨憨，他不会远走高飞，一定要报兄弟的仇。电影里唯一让我觉得美好的就是风对麦的爱恋，来到大城市，租到房子，打开封住窗子的木条，阳光洒进他的新房子、新生活，与此同时，他还看到了李麦，阳光下美丽的美好的李麦，一见钟情如此简单，又充满希望。他勤恳工作，回到家里看到无法继续的小号事业，坐下吃饭获得生活中的喘息间隙，他也看到李麦在对面的房子里可以坚持下去的舞蹈，李麦对他来说就是美好。麦要去日本发展，被人车子接走要离开海城、离开风，风追着车追着他的爱恋绝望的又耗尽全力的奔跑，真的，看的难受，他无力他没钱他什么都给不了李麦，我在想是不是李麦的离开也有一点点让他没有全力劝兄弟，并且促使他和兄弟一起回瓷镇推动人生走向另一个轨道。在他为兄弟报完仇后，身体受伤的他回到家看到李麦为生活低头，不堪，他默默的用尽人生最后一丝力气，给了他爱的女孩儿最想要的——光明的未来。 荞回了家（是不？） 麦飞向未来 风托着麦子 电影结束 当然还有彩蛋，我要228以后才能看到了… 会再去影院看的，带着爸妈，在电影中重新体会80、90年代的感觉，看故事。 导演加油呀！期待看您更多作品！,45,8.0,5
19,19,30170833,荞麦疯长,b802d1a9fe38875a82d0850991957bc8,3f44a3fd2220b6637f5ed9cabf163648,1.0,2020-10-05 03:44:48,"都2020年了，这种级别的电影都能拿到投资，如果不是洗钱，实名心疼资方一波。
三段拉垮的剧情，导演想用非线性叙事结构表现自己学院派的功底，可惜能力不够，崩的一踏糊涂，
但凡一个正常人都不会被渣男连着骗，都愿意跳脱衣舞了甚至也愿意卖身给老爷爷了，为啥不跟团长呢？老爷爷精虫上脑跪了，李麦居然跑出去跳舞，还是雷雨跳舞，要是去自杀我还夸你导演有一定的野心，可跑出去尬舞就真的是不知所谓了。真是浪费了钟楚曦的舞蹈和颜值。
云荞这段更是不知所云，当小偷，怼姐姐，被姐夫强奸不知声，拉着莫名其妙成了男友的工具人离开这个小镇，然后一个人在KTV被吴风劫持之后就开始给人讲述自己的心路历程，听到FM报道男主死了，还一个劲的哭，？？？自己被强奸也没见你哭，一个劫持自己的男人死了，有啥好哭的。
最后吴风这段更拉垮，穷困潦倒被基友带着混黑社会，直接不给老大面子，就这还混黑社会？基友后面带他去找人交易，和同乡一起干掉另一团伙的老大，最后还傻乎乎的拿钱去杀B司令，B司令更奇葩，手下都背叛自己了，还让对方拿钱过来却只安排了两个手下劫杀男主，最后还死在男主刀下，男主挺着重伤还整了一出《嫌疑人吴风的替身》，最后死于失血过多，然后故事完了，导演还安排了一波小彩蛋，素人在异乡有多么不容易，追求梦想的路有多坎坷，巴拉巴拉的。
真是白瞎了王砚辉的演技。",5,1.0,0
20,20,30170833,荞麦疯长,9955684ce169ed4026b49191835f497f,c8b290490c9f711e71d2acffa202443e,,2020-08-26 00:10:44,这个电影好戳我啊，我能get到导演想表达的。故事很完整，环环相扣，三个主人公在生活的反复摩擦中挣扎，又彼此关联还不突兀，结尾的公交车站，三个人的首次“会面”这样的设计不得不让我拍手称赞👏👏作为导演的处女作，自编自导我真的觉得很厉害很优秀！ 【我们可以活得像一部电影】 云荞梦想着离开家乡去大城市，但是想离开小城市太难了，“钟总是一动不动，但是人可以动一动啊” 她离开小镇的时候，钟的指针动了。她到了海城，但是失去了男友，开始一个人生活。半年的时间里，她理解了从小羡慕甚至是嫉妒的姐姐，她感受到了在大城市的不容易。但是这个故事是不是删剪了部分，场景转换有一点点快，总觉得有哪里没讲清楚。 贯穿全片的肯德基应该给电影打钱😂 钟楚曦的表演让我改观了，就一个字——美！果然电闪雷鸣下的舞，绝望又震撼，也是重生。李麦妥协过退让过，但是最后从水底冲出水面的时刻应该是获得新生了吧。离开时她留下了绿色的裙子，下一任房客又在这里做着她之前做的梦，生气勃勃，充满希望，令人唏嘘。 【人意识到自己是傻逼的时候，都太晚了】 吴风，冲动、憨但是又仗义，一腔孤勇可以单枪匹马赴约，看着他不断的打斗受伤真的太心痛了，忍不住骂他傻，可是又心疼他的执着。躺在泥坑里，回忆从窗子里望出去看到对面的李麦，穿着红裙的鲜活的李麦，他终于笑了。在车站戴着云荞的耳机听歌，是他整部电影里为数不多放松的时刻。 整部电影的美感是时时刻刻存在的，场景的变换，整体的色调、质感都很不错，结尾小马姑娘坐在车上听见广播里播报的尸体，摇下车窗默默流泪的画面，和背景音乐绝配，没有人不为之动容😭 荞麦疯长，不就是自由生长吗？ 做你想做的事，成为你想成为的人。或许过程挫折又反复，或许你会妥协会退让甚至绝症，也没人知道成功失败，但是最终你一定在朝着你想要的方向前进，就像云荞，她走出了小镇虽然付出了很大的代价；就像李麦，她还是出国跳舞了历经磨难；就像吴风，他为兄弟报了仇，也守护了李麦虽然他付出了自己的生命。 可是什么都不应该阻挡我们去做梦，去疯狂。唯有爱与理想值得疯狂，在最应该疯狂的年纪就要尽情地狂！,5,,1
21,21,30170833,荞麦疯长,7537874a0dbab39900433252b5c4dfe5,c1c714c65b45db3411fc53d27e683eba,2.0,2020-09-30 21:55:40,拍电影这个事儿，是挺讲究功底的。 看了下导演履历，最成功的作品《心理罪》，导演是六个编剧之一，可能是第二编剧。《暗影特工局》自编自导，结果豆瓣上分儿都没开。《功夫瑜伽》编剧栏不知道为什么没有署导演的名字，《灰烬重生》导演是四编剧之一。 简单的说，单就编剧这个行当来说，导演参与的还算能看的影视作品，一般是合作。自己单独编剧的大作，似乎还没有。我们暂且可以说，导演是位有潜力的编剧。 如果导演只是到这里，那大概还是可以岁月静好，荞麦疯长。 可是年轻人总是不安分的。导演他编剧还没有做明白，又做起了导演梦。 终于，他迎来了社会的毒打。 导演拍《荞麦疯长》做的唯一正确的事情，就是用了钟楚曦。 用的是钟楚曦《芳华》的名气，用的是钟楚曦还算出色的舞蹈功底，他还透支地使用了钟楚曦的身体。 不得不说，钟楚曦的身材实在太棒了，本人就是冲着钟来的。 除了上面那唯一的一件对事，其他的他都错了。 编剧出身做导演，错了。平时用文字做电影的各方面综合水准拍起来差N口气。 启用新演员，还不是浑身是戏的那种，错了。导演调教演员的能力压根就没有。 想玩环形叙事，但是没有惊喜，错了。大家都知道故事的走向那你这不就是花里胡哨吗？ 喜欢怀旧，但是品味太差，错了。老歌选的不行，时代氛围感也全靠收音机和老房子。 马思纯的故事主要核心是青春叛逆和X侵，错了。马思纯有爱，但是不明显不够深。理想是钟楚曦的，黄景瑜什么都没有。 黄景瑜是导演漏洞最大的角色。各种混乱逻辑，错到爆。他是怎么死的？他哪里漂泊了？他明明在老四的地盘上被多人围着怎么就干掉那几个人逃出升天了？他明明不是很能打好吧。B司令听着这么牛逼怎么干黄景瑜的时候就那两个手下？黄景瑜明明那么嫌弃基友哪里感情深了？ 片尾放的短片主题错了。你这短片和影片一定都不呼应好不好！ 影片的主题最后靠文字来揭示，错了。你这是字码多了非得写点啥总结一下不然你心里不舒服。 最后是我错了。我不该听别人说这是烂片还来试试。 听人劝，吃饱饭。真理。,3,,0
22,22,30170833,荞麦疯长,7d6bfece69da7b3d8eaf3c738af16664,5030173e64543e7d31aaf55eb198dc1a,1.0,2020-08-31 14:22:13,文/梦里诗书 当自诩才华横溢的新人导演，无时不刻地想在一部电影中体现自己丰富的技艺，却忽视了剧情才是一部电影的根基，《荞麦疯长》所呈现的一切也就变得虚无缥缈了起来。过度的文艺质感，支离破碎的剧情，让电影所感受到的已然不再是文与艺的结合，而是文上的尴尬空洞，艺上的矫揉造作。  乍闻《荞麦疯长》这一名字，其实有让我对电影会去表达什么产生了好奇，但看罢此片，才明白其名来由不过是取自电影三段故事的三个主人公，云荞、李麦和吴风的名字，三个小镇青年，三段各自独立又稍有交集的故事串联起了电影，其所预表的有异乡生活的残酷，也有现实与梦想的藩篱，但初涉导演的徐展雄，显然并没有与之相匹的能力，对电影节奏掌控的完败，使本自深邃的寓意，变成了一杯索然无味的白水。 电影所展现的三个故事分别是马思纯饰演的小镇姑娘云荞经历了强暴，男友又不幸被车撞死。钟楚曦饰演漂亮喜欢跳舞的女生李麦，因为车祸而腿部受伤，再也无法跳出高难度的动作，厄运也接踵而至。黄景瑜则饰演的是一个深陷迷途，暗恋李麦，为了爱情却甘愿牺牲自己的青年。三个故事其实都有着自己的看点，但却都浅尝辄止。  如同电影《荞麦疯长》这一伪文艺的片名，文艺其实从来都不可能是一部电影所能装出来的，在这部电影中，我能很明显的感受到一种脱离了现实生活的造作，从姐夫强暴妹妹的不伦到爱的失去与欺骗，再到挣扎于黑帮间的火拼，看似噱头满满的故事，其实哪一点都没有讲好，三个故事的剧情性是趋近于零的，而由此中导演对不少经典电影的的效仿借鉴，虽然单看某一个镜头不乏意蕴美感，但串联在一起则变成了东施效颦的存在。  究其原因，便在于电影创作者其实已经完全脱离了生活，而一股自诩文艺的不凡，又赋予了其过大的野心。在电影三段式的叙事故事里，所讲述的生死也好，情爱也罢，都无从让观众能从中去产生对生活的共鸣感，从始至终作为观众的我都只是一个冷冷的旁观者，看着电影所展现的一幕幕夸张猎奇之事，其所感触，除了伪文艺风格所带来的尴尬，便是如坐针毡的冗长。 如果一部电影什么都想表现出来，那么最终他其实什么也都表现不出来。漂泊异乡的生活艰辛，其实在很多维度都可以牵动人心，然而假以文艺，故作高深的《荞麦疯长》，最终在其不匹的能力之下，所得见的仅是那疯长的野心。,3,,0
23,23,30170833,荞麦疯长,ff0325a4dea7662584cfbe859900fb43,528497c18e4252a8518318cd86c3e6fd,1.0,2020-08-31 01:07:47,忍不住的吐槽燥气来自于今天在公众号上看到的一篇文章，居然还是某地区影评学会公众号上发表的文章...？？ 题目是这样的👇 “《荞麦疯长》：这部电影只看“颜值和肉体”就太亏了！” ......😃😀😕🙁☹️🤨😐😑 看了看公众号主页，是官方的应该没错啊emmm 这篇文章，首先，点出 影片的残酷程度超出观众看物料时的想象，并在结尾加深这个观点，“在七夕这个特殊的节日，这样一个残酷的爱情故事，是不符合观众的心理预期的”。 ......🧐大胆直言，这个观点我不认同，观众不买单是因为这个故事“残酷”吗？qj、车祸、qj、s掉，单拎出来这些字眼是多么的残酷，然而放在影片里就不是内味儿了。它怎么能如此地生硬，生硬得这些所谓“残酷”元素变成了堆砌主角悲剧的工具，主角的心理转变、成长只能用这些来表现了吗？这让这些“残酷”从一个漫长撕裂的精神过程变成了一个单刀直切的“坎坷”符号，就像为了哭而把洋葱放在眼睛旁边一样。 对于观众吐槽这部影片是“狗血集大成者”的观点，作者提出👉“对于这样一个寓言体的故事，观众是否应该以现实逻辑来评判？ 或许在理解影片暗藏的深意后，会有不同的想法。”的反驳。当我正迫不及待要接着看作者要给出什么深刻的、隐晦的内涵，期待满满的时候...... 1.云荞被性侵的真相是穿姐夫买的裙子炫耀、整蛊姐夫被其误以为“勾引”，母亲在隔壁不敢阻止是因为姐夫是经济支撑命脉？ （这不是很显而易见嘛？？） 2.李麦的堕落与司令的酒局上，金子透露吴风暗恋李麦，被司令以将李麦献身权贵作为报复？ （预告片里那么明显地剪进去金子说漏嘴，吴风立马变脸的镜头，作为预告片的一个小高潮点，且司令与吴风的纠葛铺垫也很明显了） 3.决一死战前夕，吴风与李麦在街角擦肩而过，如果相遇命运将改写？？ （......能不能说点不显而易见的......） 显然，这种用影像语言进行的暗示效果，观众大部分都可以明白，且这样的“含义”距“寓言”尚尚尚尚尚远。而提及观众以现实逻辑判断的问题......观众不是傻子观众不是傻子观众不是傻子，看这篇文章的时候我一直在心里默念这句话，观众来看电影会关注它的爱情故事到底现实不现实吗？重点是，合理吗？或者再退一步，是爱情故事吗？ 云荞为什么爱她男朋友？吴风为什么爱李麦？李麦为什么爱那个小white face？如果云荞是孤独缺爱，和男朋友同属被压迫，惺惺相惜；如果吴风是馋颜馋身子，那么李麦呢？？她一个可以为父母寄钱治病而出卖身体的人，认清了白脸真面目后，把所有家当都给他了？陷入爱了？？不是说她不可以为了爱抛弃现实因素，而是总要一些事情彰显她为什么陷入吧。 再退一步，不以现实逻辑评判，整点“虚”的，可你所言及的“深刻含义”不是现实吗？ 那么这部影片真的没有可取之处吗？ 当然是有的，诚如文章所言（我难得赞同的半句话），摄影、色彩、冷暖色调提升了艺术感，是的；三条时间线并不混乱且有所关联，是的；但离神作只差一步？我只能说，皮囊掩不住破败的内核。,3,,1
24,24,30170833,荞麦疯长,48e248977f76dfcf8df84ddc0a54b8d5,ce6c5ba06a216a925b0f3235305c67e9,,2020-08-28 07:10:57,经常在圈内遇到很多新晋导演，日常说话待人接物的时候就透着一种“我看了很多世界经典名著！我就是下一个昆汀”的气场。ok，有抱负有梦想是件好事，但是看了很多片子就等于自己会拍片子，这绝对是一个极端严重的误区。《荞麦》一片，从祭出三段式叙事结构开始，就看到了导演心比天高的野心——能把玩叙事结构玩帅的，基本上都是世界顶级导演了。“三段交错又不同，不同又有千丝万缕联系（至少导演自己肯定是这么期待的）的故事，能讲出多么文艺又烧脑的故事呀！！观众一定会拍掌叫好的！（如果不鼓掌那肯定是观众没看懂）”——不知道这样的心路是否出现在过导演的内心。,2,,1
