,Unnamed: 0,电影id,电影名称,用户id,用户名,评分,评论日期,评论内容,有用数,没用数,回应数
2,2,30271236,最后一封信,a42a4d2fa6b69cf22db1eff756e943d9,a84dfe83202974bfd189dbcfc545b551,3.0,2020-07-28 18:00:30,"首发于公众号“__bk:20hn7影探” 公号ID：ttyingtan 作者：重庆大厦卖片小罗 转载请注明出处    同样的导演，同样的编剧，同样的剧本，成片却一个7.5，一个6.7？
这结果让人迷惑。   但。
单就原封不动地启用小说名这一点，任谁都能察觉到——
在岩井俊二眼里，《最后一封信》才是亲儿子。
尤记得，《你好，之华》上映前，几张先导海报就让影迷们急得抓心挠肝。
质量上，有导过《情书》的日影大神岩井俊二亲自操刀；内容上，有拍出《甜蜜蜜》的港片大佬陈可辛调试把控；表演上，还有华语电影届唯一大满贯影后周迅重磅加持。
“这组合震撼到我了。”
    
这是不少人的第一反应。
然而影片映后的口碑，却让人跌破眼镜。
有人嫌弃台词尴尬，有人吐槽泛滥的BGM和广角镜头。
抱着看国版《情书》期望来的，多数都炸开了锅：
“这稀烂的剧本，还不如郭敬明。”  这还不算，骂得最难听的。
那么，《你好，之华》翻车的锅，到底该不该岩井俊二背？
我们至少得先看看《最后一封信》。
又或者说，这部电影本身，就是岩井俊二最直接的回应。
同样从女一号姐姐的一场葬礼开始，同样由女主手机被吃醋的丈夫摔坏，引出信件这个索引剧情的重要载体。
《最后一封信》和《你好，之华》大体的故事脉络是完全一致的。
作家乙坂（福山雅治 饰）和图书管理员裕里（松隆子 饰）在同学聚会上相遇。

裕里本想告诉大家姐姐的死讯，却被误认成姐姐。

作为姐姐的旧恋人，乙坂与裕里便开始靠通信，复盘姐姐的人生。    姐姐在与乙坂分手后，嫁给了没学历、没稳定工作的渣男阿藤（丰川悦司 饰）。

婚后二人育有一女鮎美（广濑铃 饰），可阿藤的脾气却越来越暴躁。
经常酗酒不说，发起火来自己的妻子女儿一起打。
  后来，姐姐因无法忍受这样的人生而自杀。

但裕里高中时曾因为与乙坂表白被拒，而与姐姐渐渐疏远。（那时乙坂正在追姐姐）
也就是说，姐姐最后几年悲惨的人生，是自己一个人走完的。

但影片从未正面展示，姐姐遭受的痛苦和折磨。

我们只能看到乙坂、裕里和姐姐三人，懵懂青涩却又充满着各种阴差阳错的高中生活。   不断错过和无法挽回的过错，这是《最后一封信》故事的主题，也是《你好，之华》创作的母题。
两部电影从主题，到故事脉络，再到情节转折，都一毛一样。
只要你稍作留意，就能发现——
《你好，之华》的中文台词，很多应该都是直译过来的。   那两个版本的区别在哪？
首先，最直观的就是演员。
选角方面，国版的演员阵容这里不多介绍。
日版的主要演员有：

日本电影学院奖影后松隆子，学院奖影帝兼国民级歌王福山雅治，新人奖拿到手软的广濑铃，《情书》原班男女主中山美惠和丰川悦司，以及依然没有着手准备《EVA》的庵野老贼......    咖位上综合来看差距不大，但回归到影片，塑造同样的角色，演员们的表现却出入不小。
先说周迅和松隆子。     
裕里这个角色，肩负着揭开姐姐过往的任务。
而影片的闪回，又仅仅局限于高中时期。
那么，在有限的情节里，单纯依靠表情、台词和肢体，同时展示裕里与姐姐的感情，以及她对姐姐的了解。
这是这个角色的难点。
两位影后的表演都非常细腻，碍于篇幅，这里就不展开谈了。
说完相同点，我们再来看看不同。
裕里这个人物在姐姐的光环下长大，一直觉得自己很普通。
成年后工作是在图书馆整理图书，回到家还要抚养孩子、操办家务。
按这个设定走，她应该偏向于一个不善言辞、随和内向，遇事比较隐忍的家庭主妇。
松隆子把人物的木讷和迟钝，拿捏得很好。
她不太会察言观色，会下意识地回避陌生人，遇到事情的第一反应，是不给别人添麻烦。  





中年人の扫微信  而周迅就显得太精明且事故了。
她能够从容的应对姐姐恋人的搭讪，丈夫的拷问，以及找上门的初恋。   再结合高中时的闪回，我实在无法想象——
她会在高中时私藏别人的情书，还因表白被拒当场泪奔。
   我这里并无意质疑，周迅对角色的解读。
你仔细回想一下，裕里这样的人设是否太像《情书》？
又或者说，不够中国？
作为男一号，秦昊和福山雅治的表现，其实各有千秋。     人设是一个失去灵感的作家，这个人物天然会带有自卑，抑或自我压抑的特质。
两位演员都在这一点上把握的很好。

区别在于。
福山雅治是在收着演，因为他的情绪几乎全部留在去未咲家里的那场戏。
  





  而秦昊其实在放着演，因为尹川需要完成之南自杀前的拼图。   这个角色既要调动观众的情绪，又要推动情节发展。
因此秦昊跟福山雅治的处理，都是恰当的选择。
几位小演员的表现。
邓恩熙和广濑铃几乎走向了两个极端。
广濑铃全片下来一路僵着脸，好像对啥都提不起兴趣。   而邓恩熙表演时的感情过度充沛，台词上也不够克制。  
但相比之下，广濑铃制造出的疏离感，显然更符合岩井俊二的一贯风格。
两版对比，唯一一个全面碾压日版的，是张子枫。
新人演员森七菜塑造的小裕里，性格单一，人物扁平，存在感非常低。
而张子枫却在所有小演员里一枝独秀。

尤其是回忆高中期的部分，虽然台词和戏份都很少，但张子枫把青春期的那种躁动、情愫和脆弱不安全都表现出来了。  





眼睛会说话的张子枫 能够提名当年的金马女配，确实是实力使然。
另外，虽然《最后一封信》拉来《情书》的男女主，饰演恶人夫妇。（总觉着是岩井俊二的恶趣味） 《情书》中的男女主  但国版中谭卓和胡歌的表演，完全不输《情书》二人组。
这二位，也是全片最有中国味的俩人。
  总的来说，日版的选角和含蓄内敛的表演风格，虽说更贴合岩井俊二的风格。

但国版的人物个性更鲜明，角色身上的留白更少，表演上的情感也更加充沛。
这意思，是两个版本在演员方面平分秋色？
并不。

上面的比较，并没有以“中国故事和日本故事的背景”作为前提。
倘若加上这个维度，《你好，之华》就会更像——
一群普通话很好的日本演员，在追忆日式的青春。
这是《你好，之华》的桎梏，也是上限。
影片的主创，其实早就发现了这点。
在《你好，之华》的筹备阶段，陈可辛就拉来不少内地编剧帮岩井俊二做“本土化”。
两个版本相对比，我们能在故事细节上，找出不少“手脚”。
人物方面。

女主角的丈夫，在日版里就是个大男子主义。
行事独断专横，不给妻子解释的空间。
   
而国版的丈夫角色，会因为吃醋发脾气。
但第二天一早，他就主动认错，还主动给妻子买新手机。    剧情细节方面，国版本土化的改动更多。

《你好，之华》加了一条，姐姐的儿子意识到母亲去世，从抗拒到接受的故事线。
乍一看，体现了中国式、多视角的亲子关系，强调了之南去世对其他人的影响。
但这样的情节，本身就脱离了“不断错过”的母题。   另外，相比于《最后一封信》，《你好，之华》中的家暴元素，还被强化了不少。 国版中有不少姐姐和她的女儿，被丈夫打伤的口述细节 
我不知道，这是否出于某种受众上的考量。
据陈可辛回忆：
“岩井俊二一开始因为剧本问题每天黑着脸，他是个挺孩子气的艺术家，当剧本受到质疑时，还是挺不高兴的。”
剧本上的魔改也就算了，实际拍摄也有诸多细节出现问题。
岩井俊二受访时曾多次提到：
中日有许多习惯上的差异。   有这么一场戏——
张子枫从屋里跑到大门口取信。  





 在场的中国主创说，路过自家小院，直接穿拖鞋出门就行了。
这是我们的习惯。
但岩井俊二还是会面露难色：
“日本人在这种情况下，会把拖鞋脱（换）掉。”   
发现没，尽管岩井俊二最后采用了“本土化”的方案。
但他对这个故事的直觉，依旧属于日本。
当然《你好，之华》在本土化上还有不少“校正”过的地方。
大部分观众虽然能在细节上找到熟悉感，但更多人并不能产生“这是一个中国故事”的认同。

《你好，之华》只有面子，但没有里子。
反观《最后一封信》中加入的大量航拍，我们反而更能接受：

这里凝结着岩井俊二对故土的眷恋和记忆。
  





主要取景地仙台，正是岩井俊二的故乡 再扒得深一点。
熟悉岩井俊二视听风格的朋友，应该知道。
大量的逆光、手持拍摄，柔和的色调（据说就是镜头上套个丝袜），小清新的BGM（大都自己创作），一直是岩井俊二标志性的视听风格。（因为基本拍纯爱嘛）
  《情书》中的逆光镜头  《你好，之华》在原有的基础上，又增加了多机位、旋转镜头等多种技法，美术上不同场景的明暗区分也十分明显，看上去玩的很嗨。
反观《最后一封信》，增加了大量航拍，简化了技法，色调整体更加明亮。
你要说《你好，之华》拍得很漂亮，那没错。
但完全让技法服务于主题的，显然是《最后一封信》。
举一个最明显的栗子。
《最后一封信》在开头和结尾，增加了林间瀑布的镜头。
开头是一段手持的背跟，预示着女儿对母亲过去的了解和追溯。 





 结尾是一段后拉的航拍，这里展示的是女儿对母亲美好的青春，以及充满缺憾人生的凝视和回望。（以便更好的走向未来） 





  两段内容，让整个故事形成一个闭环。
母亲的青春美好又令人向往，与此同时，它也激励着大家向前。
这《最后一封信》突出强调的，也是《你好，之华》没有做到的。
我们甚至可以说：
岩井俊二是回到日本，才真正考虑清楚，要跟观众说什么。
其实《你好，之华》虽然用到了信件这个载体，但它跟《情书》的关系不算大。
岩井俊二在2017年拍了一部叫《昌玉的信》的韩国短片。   因为这部作品的口碑很好，他才准备尝试一下中国故事。
但大导拍中国故事，出现水土不服的例子太多了。
就像奥斯卡得主让·雅克·阿诺的《狼图腾》，以及两座金棕榈傍身的比利·奥古斯特的《烽火芳菲》。
让没有中国生活体验的导演，拍中国故事。
就算请到芦苇（《活着》、《霸王别姬》、《秦颂》编剧）这种级别的编剧出马，都救不活成片。

这让我突然想起，胡歌在《你好，之华》里的那句词：
“（异国的）人生啊，真不是你随便扒拉扒拉，就能写清楚的。”   当然，你可以说，我这样比较并不公平。
岩井俊二先拍了《你好，之华》，后拍的《最后一封信》。
同样的事情，再做一遍，自然会更懂得分寸，知道哪里该舍，哪里要留。
这点我认。
但与其说《最后一封信》完胜《你好，之华》，倒不如说：
拍完《你好，之华》岩井俊二才想明白——
这个故事本就不属于中国。
 文/重庆大厦卖片小罗 



",9.0,1.0,0
3,3,30271236,最后一封信,62b96e5c83a2d5b7ffafd0b6db0202bc,da0483cd9791c6cd8d6c94b56242d328,5.0,2021-04-24 23:52:35,《最后一封信》与《你好 之华》算是一鱼两吃大不同，国内版演员演技虽然高出一筹，但两部作品在意境、氛围和自然度则相距明显，果然还是淮南为橘，淮北为枳，社会环境与文化环境差异使然（爱情剧情片与文艺小清新的差别）。 （《龙虾刑警》与《极限职业》相较，韩国炸鸡硬是搞定了祖国小龙虾）    “如果有人一直挂念着的话，去世的人不就像还活着一样吗？” “农夫山泉”自诩是“大自然的搬运工”，岩井小哥在此则是那份清澈澄净的青春印记的思悼者。 春风得意马蹄疾，一蓑烟雨任平生。 影片似乎依然是在传达岩井俊二对于纸质信件的“执念”吧，真是一个有够任性的家伙啊。    “人的一生，可不是能简简单单写进你单薄的书里的。” 青春啊，那段闪闪发亮、稍纵即逝、镌刻着种种情愫的时光，莫非就是用来遗憾、用来凭吊的...... “我仿佛被初春的暖风推着，有种不可思议的兴奋感。风对我说：向前进吧，去实现你的梦想。” 这是一场青春的卒业式。,1.0,,0
4,4,30271236,最后一封信,0b55f1cca899d6991472a59866007167,3d3fe7692bf3e2f1905ff4d3ac8ca1f8,,2020-07-21 16:00:33,这个剧本真的是不能再“岩井俊二”了，羞涩的少年时代，些许颓丧的中年时代，岁月跟随镜头在时光中穿梭，晦涩的美感，清淡的爱殇。 这些元素放在霓虹社会里，就是一个经典且动人心扉的忧伤往事。 但是放在中国，那种特有的“突兀感”就变得异常显眼，日本只要是带有关于青春，人生，岁月等标签的作品，总有一种日式独有的晦涩，这种晦涩从太宰治，芥川龙之介的文学作品之中就已经表现的淋漓尽致了，这种晦涩的艺术表达方式逐渐成为了日式温情文艺片特有的“滤镜”，而这样的“滤镜”恰恰与中国社交文化体系格格不入，虽然岩井俊二一直试图努力去做“本土化”改编，也请了陈可欣来帮忙，但是这个剧本的故事架构就是一部纯粹的日本叙事剧情文艺片，以至于无论你怎么努力去调整，怎么努力去做本土化改编，但依旧会给人一种极强的“矫情感”，那种专属于日式的晦涩，压抑，宣泄通通都变成了无病呻吟式的矫情，这就是你看《你好，之华》最直接的观感，就像是被人摁在水里，一直喘不上来气，而最后的情感释放方式又完全get不到中国观众的“痛点”，以至于看完整部作品，我仿佛感觉自己已经被活活闷死在水里了。可这个故事与人物放在日本社会之中，你就会觉得很顺畅，很舒缓，一切都恰到好处。 与说到底就是文化层面的冲突所导致的必然结果。,13.0,1.0,2
5,5,30271236,最后一封信,fe8e01418eda8f16c92003e0d5fc5e68,c5fab8e5b33d34b92509ef041ef32644,5.0,2020-01-17 22:40:05,第一次看久闻大名的岩井俊二，也许是拿《你好，之华》练过手了，这部作品有着我期待之上的质量。 福山雅治是一如既往的帅大叔，而广濑铃，森七菜和神木隆之介这三个年轻演员也不只是花瓶，三个人短短的几个高中片段，就把青春演绎了出来。  岩井一定是对信件有着别样的执着吧，故事的铺陈全由信件串起。在现在这个时间段里，同学会的邀请信，裕里假装未咲写给乙坂的信，乙坂寄回到未咲家乡的信，鮎美和野颯香八卦性质的回信，还有婆婆让裕里寄出的信；高中时代，乙坂让裕里转交的情书，和裕里当面递给乙坂的告白信；大学时代，乙坂寄给未咲的小说。如果仔细想想，似乎这每一封信都不太顺利。不是收信人不对，就是寄信人从未收到期待的回音。 正是这一点一点的错过，酝酿了未咲和乙坂这最大的遗憾。 家暴男阿藤对乙坂说：“你从没有对未咲的人生造成任何的影响”。而未咲对乙坂文笔的夸赞，却最终让他成为了一个昙花一现的小说家。乙坂没能反驳，他该有多难过啊。 但也是这一点一点的阴差阳错，在最后似乎化解了一切。 乙坂寄给未咲的小说原稿，很可能就是未咲在绝望中最后的灯塔。他差一点就拯救了她。乙坂这时的眼泪，究竟是难过，遗憾，又或是有那么一点点释然呢。 而对小说内容的留白，让人不禁好奇，小说中描述的大学的他们，究竟经历了什么。 不光有留白，影片里也有几处刻意的重复。一个是未咲的毕业演讲，一个是对隐瞒未咲死因的不解。正如演讲里所说，不管将来有没有实现梦想，高中时光永远会是一段不可磨灭的回忆。尽管我们不知道未咲是否实现了梦想，但选择自杀也是未咲在世界里最后留下的痕迹，旁人又凭什么轻易用隐瞒来磨灭呢。 如果同学会再早一个月，如果乙坂坚持写信给未咲，如果他才是跟未咲结婚的人，那么是不是未咲会更幸福一点。 但人生没有如果，至少我觉得，最后知晓了一切的乙坂也不必觉得遗憾。因为人生就是这样，总会因为这样那样的原因与他人逐渐疏远，又在某一个契机突然有了联系，希望能够补回中间消失的时间。但若是能够再重来一遍，或许大多数人还是会经历一遍同样的剧情，因为我们总是做了当下最好的选择。那么剩下的，就交给命运吧。  从技术上来说，这部影片节奏缓慢，但也正好缓解了一人分饰两角给观众带来的时间线上的轻微混乱。暖色调，不时穿插的航拍镜头，加上冷不定来一个小笑点，也给人一种温暖且舒适的观感。 难以想象，这样一部充满遗憾的影片，却似乎有着治愈的能量。,7.0,1.0,3
6,6,30271236,最后一封信,869d0e45154f19138cacd1ecd0b18d56,e247a8468839e41516d2747b6a15fc87,3.0,2021-08-16 23:15:36,"整部电影给我的感觉就是“什么都将讲了，但什么也没讲清楚”的感觉。空有“壳”而忽略了“核心”。

1.因误会而产生的 妹妹野裕里 的线 还有忘年恋，本来发展下去很有看点，但导演似乎突然想起 她姐姐的存在，立马把这条线拦腰斩断了。

2.“核心” 是学生时代写的 书信，寻找 生前的地方 可以作为 支线。以 书信内容 作为 回忆片段，完全可以做为 主线。
这样的话 妹妹野裕里 的线会略显多余。

但问题就是，书信内容和回忆 少之又少，取而代之的是 冗长 的 寻找生前的居所。完全 本末倒置 。

3.姐姐未咲 明明有 男主乙坂 的书信，还让他改稿子 ，还上了同一所大学。最后却嫁给了别人。

妹妹一开始写信说 “就写这一次”，后面连续开始写信。
说实话，这 姐妹俩 的行为挺让人迷惑的。

看到后面我都想快进了，看来只能作为一个风景片了。",1.0,,0
7,7,30271236,最后一封信,606d5d57a03a33dfdbea63f835fa0a97,91588d4c2845efa215e65b0da32db9f1,4.0,2020-12-01 03:53:25,"1.乙坂在学校抬头看到窗外的两个熟悉的身影的一瞬间。 2.在图书馆裕里的那一句“终于握到前辈的手了。”
没有看过你好之华直接看了这部，觉得这样的故事还是放在日本比较有味道。唯一的遗憾就是为什他们当初没有结婚呢。影片里也没有交代，看了半天才发现两个妈妈高中时的演员就是两个孩子，也很奇妙。",2.0,,1
8,8,30271236,最后一封信,4aa814d5313fb9684d48e76090398c44,8a8eeafa25341f045a03821b01fcc789,4.0,2020-08-13 20:48:42,"观影后去补了中版《你好，之华》。中日版的对比像极了导演个人的作业订正。有一些故事的呈现本身就存在地域优劣差异，但不同方式的表达，让人看到了导演对艺术性的极致追求，或者说熟能生巧。  每一个角色的精髓都恰到好处被演绎，含蓄和深沉。“小演员”和配角尤为突出，年轻版的福山选角非常成功。同时也显得主角的主角性没有那么强烈，这一部分也和该版故事性弱化有关。另外台词功力不错，读信的部分感人可信。  导演的日式风格的确节奏感好，快慢之间都应和人物情绪。选用开头与结尾的青春感呼应，还有航拍视角和日系的充足曝光度，都使得电影表达的情绪一直是曝光状态，而非藏匿于故事本身。这种情绪，再通过部分慢镜头和定格镜头的运用，达到两种和谐。一来是电影情绪和现实导演个人情绪的应和，二来是观众对于逝去、遗憾、浪漫与深情的通感。 相较中版，日版更明显不为了讲述故事，且在细节处添加了许多更“合理化”的元素。而配乐的选择、光线的处理，这些的配合都显得很熟练，尤其是校园偶遇和雨中送别，画面虽选用了表达青春逝去的“烂俗”场景，却依然达到胶片式取景的美，且美到“窒息”。  有一部分疑惑来自于主旨的模糊。这样一部叙事手法重于文艺表达的电影，却无法读出主线里要表达的内容，仅情绪传递充足，而经典的画面几乎不具独创性，容易造成记忆困难。不过这种纯电影技巧营造出的画面，大概也不是为了表现什么，仅仅是满足导演自己的剧本，或者说他自己的人生回望吧。 最后最后，为我的泪一个8分。  （文中图片均来自豆瓣） 「不语」，公众号“不著”的艺术单元之一，更多内容可关注微信公众号(搜索""willyi_"")",1.0,,2
9,9,30271236,最后一封信,ddf62f5d74a84ab053fb287cffaddf5e,ebc7b04af8d0a954bf7e98cdb8999eda,4.0,2020-08-09 23:13:20,爱是发自内心的，爱是自私的，爱是自愿的。乙坂镜史郎的转学，掀开了三个人的故事。青春美好的恋情，在错综的心思中萦绕，岸边野裕里对乙坂是那么的动心，但乙坂对迟野未笑是由衷的喜欢。等到20多年之后，乙坂回来之后，缺发现物是人非，而期间书信的来往，更是将故事的灵魂所牵线起来，乙坂来给未笑上香的时候，未笑的女儿原野点美说出了她妈妈的心声，那些信件是妈妈的宝贝，妈妈看了好多好多遍，这也就是最大的慰藉。乙坂临走前给裕里送的相册，是对整个高中的回忆，里面两个孩子的照片更是青春的缩影，而当点美读最后一份信的时候，是对整个高中的总结，也是整个故事的总结，也是整个青春的总结。青春总是美好，青春总是希望。爱情总是甜美，超越年龄，那就是心灵的交汇和升华，超越时间和空间。,1.0,,0
