,Unnamed: 0,电影id,电影名称,用户id,用户名,评分,评论日期,评论内容,有用数,没用数,回应数
10,10,30271236,最后一封信,37def1684bc9b7e331353a9b01c8c0e7,51228cad0837f1ba09a9b11043e3bcf9,5.0,2020-01-19 21:02:39,今日は一言で言うと、「この映画観て良かった」の日。 最近上班时的背景广播常常播放一首声音青春又温柔的歌，周六上班的傍晚我记下一句歌词，留着回去找歌。然后是发现是最近发售的曲子，音乐软件的评论只有寥寥二十三条，很轻易地点开了，其中一条写着类似“不过这次的电影是岩井俊二为广濑丝丝的量身打造”的话。原来他有新电影啊，原来丝丝有参演啊，搜到了更多，变成了结果是周五刚上映啊，再到要出门的今天早上有了干脆去看看好了的想法，变成一个毫无紧迫欲望并不强烈的日常安排。这样长的前话。 这次观影的心境变化是大概情书那样的故事是不会有了，到果然是岩井俊二，到啊，到憋着声音爆哭，到看了这部电影太好了，到和情书难道不是一样的程度吗。 为什么有人能把相似的元素运用起来却毫无才尽的重复感呢。死亡，葬礼，从过去传递到现在的情书，代替他人的回信，酷似的相貌，有些可爱的邮差，并不沉重的家庭关系，重返旧校，记录校园的相机。于是连中山美穗和丰川悦司也在。最后响起重叠的声音，好像眼前又看到了病床上的藤井树和雪原中的渡边博子交替说出的那句你好吗我很好的画面。 而故事本身。 美咲的前夫对乙坂说，你在她的人生什么影响也没有留下，她死都是因为我，而不是你。 我就想怎么会呢。是啊怎么会呢，你看她最后留下的照片都是大学时代，是乙坂心中她永远会存在的样子。也许一部分她早就死亡了，死亡在毕业典礼致辞中有着无限可能的未来里。也许会有人实现梦想，也许有人并不能实现梦想，也许会有觉得痛苦的时候，也许会有连活下去都很辛苦的时刻…仿佛都是她人生的预言一般。 但是这样一方通行的无法回头的人生，乙坂在美咲的人生里留下的全部都是美好的事物。是修改的毕业致辞手稿，是所有在一起过的时光，是全心全意想着她而写下的那本小说，是在绝望时那么多次延长了她生命的一封封过去的情书。 “无数次读着信，感受到那样深沉的爱意，我想这个人一定会来接妈妈的…其实希望，如果你能更早一点来就好了。” 看完电影出来，走在前面的日本女生对男生说因为最后感觉并不是悲伤的所以没有哭。 但是人不一定是因为悲伤才会流下眼泪的。 乙坂也一定不是吧，在祭坛前听着女孩的描述留下的眼泪，不是一个简单的形容词就能总结的吧。 至少我不是。 而是在美咲踩着楼梯喊住乙坂让他帮忙一起想致辞的时候，在毕业典礼的镜头交错后的练习时只有两个人的体育馆美咲跑向乙坂的背影里，在发现那本以她为名的小说一直放在书架上之后。在，她的女儿读着遗书——被她视为珍宝的演讲稿——的声音和她高中最后的讲话的声音重叠的时候。 在发现原来那些都是回响，都是乙坂带来的影响之后，流下了眼泪。 所以不为人知晓的后话里，未来还是有无限可能的吧。因为若是在长篇作品里绝对会成为伏笔的签名版绝版书可是有三本呢，又因为裕里的初恋男主角乙坂对于写小说好像又燃起了一些斗志。 还因为飒香说，鲇美的话没事的。 “鮎美，大丈夫。”,3.0,1.0,1
11,11,30271236,最后一封信,97b3303c2555ff25878e9ac5bc6fbea7,27c04aa590bf87e0dac0f519fcc6b454,,2020-12-17 09:03:59,《最后的情书》也叫最后一封信。当看完前面15分钟，我有一种剧情在哪里看过的感觉。然后突然想到《你好，之华》原来就是翻拍的这部。但很神奇的是两部都是岩井拍的，那算是他重复的第二次拍摄，肯定这个故事对他来说有很有意义吧。 虽然我很喜欢你好之华里面的周迅和子枫，但是日影对初恋的刻画在我心中已经是非常经典的了。舒缓的钢琴曲和清新干净的生活街道才是这类片子的主旋律。 看最后的情书，开头广濑玲的画面不论是头发还是衣着，和在海街日记里面完全一模一样。让我非常喜欢。大女主也是我最爱的松隆子出演。里面的色调还是讲述的方式，感觉都有电影《情书》的影子。喜欢情书的人，绝对会爱上的。里面有最后妈妈留给女儿的一封人生的信念，是非常感动的。,1.0,,0
12,12,30271236,最后一封信,47e1eb98097bbf3d4412500b04df7d54,3d2f9e254afe4be361f104d3748e8570,4.0,2020-07-29 13:59:45,"但人生没有如果，至少我觉得，最后知晓了一切的乙坂也不必觉得遗憾。因为人生就是这样，总会因为这样那样的原因与他人逐渐疏远，又在某一个契机突然有了联系，希望能够补回中间消失的时间。但若是能够再重来一遍，或许大多数人还是会经历一遍同样的剧情，因为我们总是做了当下最好的选择。那么剩下的，就交给命运吧。从技术上来说，这部影片节奏缓慢，但也正好缓解了一人分饰两角给观众带来的时间线上的轻微混乱。暖色调，不时穿插的航拍镜头，加上冷不定来一个小笑点，也给人一种温暖且舒适的观感。
难以想象，这样一部充满遗憾的影片，却似乎有着治愈的能量。",2.0,,0
13,13,30271236,最后一封信,47a00e1996dfb1836a97bc8f6992291b,5906321f578c8b9fd489872a2755f3c6,3.0,2020-07-26 18:02:39,2018年年底，一部名为《你好，之华》的院线片在国内上映。 因为云集了周迅、秦昊、胡歌、张子枫等一众演技派明星的加盟，再加上本片的导演和编剧是岩井俊二，所以《你好，之华》上映时引起了不小的关注。     不过大概是因为国情的原因，造成了一些剧情上的水土不服，最终这部作品口碑票房都不理想，这也为岩井俊二留下了遗憾。 两年后，他又一次将这个故事搬上银幕。 不过这一次的舞台从中国小镇变成了日本的小乡村，剧情也做了一些改动。 《最后一封信》     本文有剧透 1 故事由一场葬礼开始，年仅44岁的远野未咲以自杀的方式离开了这个世界。家人隐瞒了真相，对外谎称她是因病离世。 未咲死后，妹妹裕里在收拾姐姐的遗物时，发现了一封高中同学聚会的邀请函。 她决定出席同学聚会，将姐姐过世的消息告诉众人。     转眼到了聚会那天，裕里如约而至。可她还没来得及将姐姐的死讯公布，就被大家热情的错认为未咲，还被老师邀请，让曾经身为学生会主席的她上台讲话。 裕里无奈之下，以姐姐未咲的身份做了一番演讲，随后便以路途遥远为由，逃离了同学聚会。     就在她等公交时，一个中年男子尾随而至。此人名叫乙坂镜史郎，是姐姐曾经的追求者。如今他成为了一名小说家，此次来参加同学会，也是为了能够见未咲一面。 此时的裕里，仍未能表明自己的身份，与其交换了联系方式后，便匆匆搭上公交车离开。     谁知车子还没开远，镜史郎的信息已经发了过来。他说自己这些年一直爱着未咲，希望可以和她坐下来好好谈谈。 看到这些，裕里彻底慌了。一方面因为对方把自己错认为了姐姐，另一方面，镜史郎其实是裕里自己暗恋过的对象。     回到家中，裕里的丈夫发现了镜史郎发来的信息，俩人大吵一架，不欢而散。而裕里的手机也意外掉进浴缸，彻底报废。 为了拴住裕里，让她没有时间与镜史郎联系，孩子气的丈夫给家里添了两条狗，还让母亲搬到家里来小住，这一切令裕里哭笑不得。不过她还是以姐姐未咲的名义给镜史郎写了一封信，宣泄一下自己情绪。     不过因为裕里并没有留下自己的住址，所以镜史郎回信时只能按照记忆，将信件发到了未咲的老家。 未咲去世后，女儿鮎美留在了老家，如今裕里的女儿飒香也趁着暑假留在那里陪伴她。姐妹俩收到镜史郎的来信后，鮎美因为好奇母亲与这个男人之间的关系，也学着母亲的语气，给镜史郎寄去了一封信，希望他能讲述当年的故事。     就这样，镜史郎收到了来自两个地址，而且都称自己为“未咲”的两封信。 这两封信，一封代表了现在，一封仿佛来自过去，揭开了他心底尘封多年的往事。     2 《最后一封信》的导演和编剧，是以“文艺”著称的岩井俊二。     他的代表作有《情书》《四月物语》《燕尾蝶》……几乎每一部都是日本青春文艺片的典范。     在岩井俊二的作品中，青春就是遗憾的代名词。 而他镜头下的“初恋”就像是四月天的樱花一般，虽然绚烂，却稍纵即逝。在那个不懂表达自己的年纪里，懵懂的恋情与无处安放的青春，都成为了记忆中最美的风景。 岩井俊二所描述的现实，往往充满了残酷，甚至毫不掩饰地向观众展示着死亡。但他的这份“残酷”却又总是令人心怀希望，让还活着的人充满面对生活的勇气。     岩井俊二对于“信”似乎有着偏爱，在《最后一封信》中，摒弃了手机、电子邮件等联络工具，最原始的信件则成为了连接过去、现在与未来的工具。 在镜史郎与裕里的通信中，裕里向自己曾经暗恋过的镜史郎诉说着生活中的种种。是关于她与丈夫、孩子间有趣的日常，也以正在发生的“进行时”为观众展现出了人到中年的裕里是如何积极的面对着自己的人生。     当然最终她与镜史郎还是见了面，真相也在这时得以揭晓。     而另一封以“未咲”的名义所寄出的信件，则来自未咲与裕里的女儿——鮎美和飒香。这两名16、7岁的少女，正是对“恋爱”充满了憧憬的年纪。她们好奇母亲与镜史郎之间的过去，恳请他讲述当年的故事。 原来镜史郎最先认识的是同一社团的裕里，但他却不可自拔的爱上了裕里的姐姐未咲。在裕里的主动帮助下，他给未咲写了一封又一封的情书，可对方却迟迟没有回应。     当镜史郎忍不住当面询问未咲为何不给自己回信？才发现她从没收到过任何信件。 直到此时，镜史郎才知道，原来裕里从没将自己的情书交给未咲。因为裕里爱着他，帮忙传递情书也只是为了更加了解他。     上一辈的爱情也在不知不觉间影响了鮎美和飒香，鮎美从这些故事中，感受到了母亲也曾经被某人深爱着的那种感动。而飒香也从中找到了勇气，决定向自己喜欢的人告白。 回忆与现实交错呼应，两代人虽然有着不同的经历，但他们同样都不想让青春留下遗憾。     3 《最后一封信》的选角，延续了岩井俊二的老班底。 首先是曾与岩井俊二合作过《四月物语》的松隆子，与周迅演绎的之华不同，松隆子所扮演的裕里，在很大程度上还保留着一份天真与懵懂，这也为原本略显沉重的故事增添了几分生动和趣味。 比如，当老公意外将她的手机扔到浴缸时，她一边抱怨一边露出了夸张但却可爱的表情。     扮演乙坂镜史郎的，则是国内观众比较熟悉的日本老牌帅哥福山雅治。 一向以贵公子形象示人的他，为了演绎出落魄作家的感觉，不仅进行了增肥，还蓄起了胡子。以至于在同学会上初次登场时，有不少观众都没能认出他。     而裕里那个爱吃醋的丈夫，则由日本著名的动画监制，曾经执导过《EVA》和《蓝宝石之谜》的庵野秀明担任。 在本片中，他所扮演的丈夫，也是一名漫画家，算是本色出演。 另外曾与岩井俊二合作过《情书》的丰川悦司和中山美穗，也在本片中客串了姐姐未咲的前夫，以及前夫后来的妻子，算是本片之中最大的一个彩蛋。     《最后一封信》与《你好，之华》虽说是同一个故事的两个版本，但经由不同演员的演绎，也呈现出截然不同的两种状态。 《你好，之华》所描述的一切显得更为悲伤些，它很现实，也更残酷。 而《最后一封信》则更具原汁原味的日系文艺风，在淡淡的悲哀过后，又让人心怀希望。即便有过遗憾，也会变成成长中，最弥足珍贵的礼物。,8.0,,0
14,14,30271236,最后一封信,385a01a2f9dfe077b5a1c677ff1b2e74,c4e7673e4de1391c5eb4d894ef31fd88,5.0,2020-09-05 22:34:39,如果說「情書」是青春的唯美，似雪後的純淨，那這部片便是真正將現實中「可能」的唯美刻劃的淋漓盡致 - 深層的悲傷也許會將人擊倒，但更多的只是留下歲月蹉跎後或瞭然，或癲狂，但總會在嘴角邊掛上無奈的微笑 - 也許這便是「可能」。 導演除了在畫面的唯美著濃墨外，其他更多鏡頭僅點到即止，你可以說是對「情書」的致敬，因為中山美惠和豐川悅司的出演，但這又何嘗不是將二人置於直面慘淡人生的殘忍境地下，對「情書」另一個鏡面的詮釋呢？你也可以說是「你好之華」的同劇本翻拍，但這只應屬於日本社會語境的事，在另一國的語境下就顯得唐突，刻意。或者乾脆就說是情書，一個四個主角之間錯綜愛慕後的結局篇，但至情和現實的矛盾下，曾經滄海難為水之後，至情依然，比如松隆子的一些小動作的演繹，誇張詼諧的舉止不但不顯得唐突，反而是好像故意營造的「不和諧」，只會豐富人物和讓她的角色變得更可愛；再或福山雅治手滑過芥川龍之介，但最終還是落在夏目漱石上一樣，又或用rollei 35i拍出似舊日在今日的重現一般，二位女孩還是在談論著「令人心跳」的初戀，也許如當初一樣⋯⋯ 影片整體舒服，幽默，又唯美自然，隱藏在畫布下的故事啊，青年要多像一些仙台的自然吧，少像些庵野秀明的單眼的少女畫作罷！ p.s. 庵野大爺，您太脫戲了（喜感般脫戲），是不是漫畫稿費不夠了？,1.0,,1
15,15,30271236,最后一封信,fbb0672aedcb7f63be78464725e5a405,095dbdbacabd635b9b2241836c4a92f8,5.0,2020-08-14 17:40:01,除夕那天傍晚，在平安神宫打卡了[刺客聂隐娘]取景地泰平阁，然后徒步一路向西，拜访了传说中仍在生产伪电气白兰的夷川发电所。从汇入鸭川处沿河南下，对岸可以眺望到二代目归来时住过的酒店。在河滨步道的尽头上桥，经过市役所大楼，拐入灯火熙攘的锦市场，京都倏忽间就从狸猫和天狗的世界，还回到贪婪愚蠢的人类手中。         吃完号称怀石料理级的荞麦面作年夜饭，微醺中在四下都望不到尽头的锦市场里乱转，一抬头正好来到一家松竹旗下的影院门口，想着既然已经在东京光顾了东宝的主场，那在京都自然也要照顾一下松竹的本地生意才算公平。海报栏里热映的有桥本环奈的左右互搏，还有是枝裕和与两大法国影后合作的新片，不过考虑到自己既听不懂法语又看不懂字幕，为了防止酒后再次在异国他乡的影厅里酣睡，冥冥之中，还是选了几天来一直下意识回避的，岩井俊二的[最后的信]，因为是和一年前看过的[你好，之华]讲的是一模一样的故事，至少不需要空耳揣测剧情。         岩井导演在大陆过气很久了，也许是从筱田升去世之后画风不再“物哀”，也许是因[花与爱丽丝]之后就再也没出过爆款，也许是从郭敬明的荐辞居然上了《燕尾蝶》或是《莉莉周》原著小说的腰封，总之现在的影评提起岩井俊二那些“日式小清新”曾经的开山经典时，字缝中总是隐隐含了些轻谑之意。后浪们对上代人的青春没兴趣，前浪们步入焦虑不堪的中年后，回想起曾经的感同身受，也难免觉得幼稚和矫情，甚至羞于承认曾为其热泪盈眶，我自己也是。好在前几年大陆电影市场畸形火爆，园子温这样黄暴无忌三观尽毁的变态都能拿到片约，擅长消费情怀的中国片商们，自然更不会放过这位昔日“青春残酷物语”的所谓代言人。于是就有了那部说不出哪里不好，但就是觉得水土不服的[你好，之华]，虽然也是水准之上，但可能导演自己并不满意，居然回日本又原样重拍了一遍，故事地点由大连变成导演的老家仙台，时代背景的许多牵强之处都成了顺理成章的存在。         钢琴声响起，同样格式的片名和空镜俯拍一起出现在银幕上的时候，我突然明白，这个叫做[Last Letter]的故事，和那部[Love Letter]之间，原来有太多之前看中文版时未能察觉的呼应之处，比如都是以一场葬礼开篇，都是以收到“已死之人”的回信引出悬念，都是成年与少年双线平行的叙事结构，而同样作为“已死之人”的远野未咲和藤井树，少年之后的人生经历，也都只是在其他角色的口述和回忆中出现，再没有一帧画面给他们成年后的相貌，就连葬礼上的遗像，用的也都是少年时代的照片。又比如松隆子饰演的的远野裕里，虽然已是两个孩子的妈，但像刚从[四月物语]中走出来的那份少女感仍然拿捏的恰到好处，而她的的职业，也依然是图书管理员，只是图书馆里被借走的隐喻人物未来命运的小说，从敏感温柔的普鲁斯特变成了据说是家暴狂的夏目漱石，而当海报上刻意隐藏的中山美穗和丰川悦司的角色，以气质颜值双双崩坏的形象毫无征兆的出场时，这种恶趣味竟有了多年损友久别重逢时玩笑开过火的感觉。所以这部电影与[情书]最工整对仗的译名其实就应该是[遗书]，而这也是原著中最后一章的题目。甚至和[情书]里只是在借书卡背面画了一幅肖像，并没有真的写过情书一样，远野未咲也并没有给女儿鲇美写下真正的“遗书”，留下的只是她在少年时与人合写的一份毕业演讲稿：         “我们曾拥有无限梦想和可能，或梦想成真，或抱憾终生，每当痛苦绝望时，定会再次回忆起此时此地。”         两部电影也都安排了成年后的主人公回中学故地重游和拍照留念的情节，只不过二三十岁回去时，图书馆和老师仍在，青春仍在，未来的无限可能仍在，回忆的人也只是感染了一场终会康复的肺炎。而四十岁后再回去时，校园已经废弃，被回忆的人已经因抑郁症而自杀，人生再也来不及重来。         十几岁的远野鲇美不能理解，为什么大人们都要隐瞒母亲死于自杀的真相，而只说是染重病去世的原因，不过她还有整个一生去自己寻找答案。而年近半百的乙坂镜史郎，到故事的最终也不能理解，自己少年时修改的演讲稿，为什么会成为另一个人留在世上的的最后的信。也许经历充满遗憾又不能重来的半生之后，就再也不敢认真追问，死后是否真有天国或来世？         贾樟柯说，“每个人都只能陪你走一段路”，李安说，“只可惜每次都来不及好好道别”，王家卫说，“人生如棋，落子无悔，那是赌气的话，人生真能无悔，那该多无趣啊”。,4.0,,0
16,16,30271236,最后一封信,33c30d09a16c54855f33d7f021071ef9,5f8b56d942887922ae6d08f4bbe460b1,2.0,2021-12-19 15:37:56,"其实这片应该打三星左右
剧情问题不大，但既没有倾注，也看不到手法
流于形式的信件，浮在表面上的爱情
和情书最大的区别可以说是演出效果，也可以说是缺乏共鸣和代入
情书里的爱情是极其私人化的语言，但这部电影里的爱情看上去却像一场大众演出
一个小说家对学生时代爱情的回忆，再烂俗不过的剧情，像是现实中每个人都能复制出来的东西
没有特别的回忆，也缺乏青春的况味，爱情在这里仅仅是一种象征，永远不能特殊化，具象化，触摸不到观众内心里的那根弦
你大可以认真观看这部电影，表达了什么什么，表现了什么什么，说明了什么什么
但这类影像的意义难道不在于触碰回忆里的那种暧昧和隐晦的感性吗
非要我说这片更像是是枝裕和（指风格）拍的，而不是岩井俊二
而不是把情书的视角换一下，做个姉妹編，以男方追忆女方就似水年华这么简单",,,0
17,17,30271236,最后一封信,5a5a9e573e04ed4b1bc77cbfaf089f12,cca17d86a631047538f816b2dd5306cc,4.0,2021-07-11 09:11:47,在岩井俊二的手里，书信特有的时间感，呈现出一种更深一层的缓慢和包容力。通讯不再是即时，收到回复前会额外体会一层等待的焦急心情。而曾经深切的爱与恨，成为了能够落笔于信笺上的字迹，直观上，文字所能表达出的感情可能不足真实的十分之一，但依然能传达出「啊我曾对其拥有如此强烈的情感啊」 相较于情书，last letter的元素明显更多，人物也更多，人物之间的关系更现实更有巧合，也加了一些自尽、家暴等非纯爱元素。前后两代非常相似，以乙坂的视野对前代进行描述，同时以他为桥梁来连接前后两代，所以乙坂是剧情核心吧。私心其实乙坂跟misaki的前夫那一段，觉得挺可有可无的，无非是为了说一句「你对她的人生没带来一点影响」？ 岩井俊二选演员真的是非常令人舒服。情书的客串出演也让我非常惊喜。看完本片我真是越发喜欢广濑，她无论何时，演这样十几二十岁，亲切又疏离的女生，那种迷离、慵懒、力气不足的感觉，非常地令人着迷。 边写边觉得，其实每个角色都能拎出来细细地品一段，语文能力不足又难以将之诉以文字。,,,0
18,18,30271236,最后一封信,62d0e07c4b0d5f4122d0836fee19e3c8,ebfbec5d9e5abb1d9a0ffa10f88a9426,3.0,2021-04-27 12:12:31,"电影前半部分我时常傻笑，当男主得知初恋去世时，我仿佛和他一样刚得知这个消息，一直不看这电影是对的，岩井俊二的三板斧又伤到我了。
作家仅停留在美好回忆层面时，创作便会停滞不前。岩井俊二有着片中小说家一样的困境。
我十分了解这种困境，以前写过很多情诗，但不知写给谁。后来有个明确的人可以写，那人消失后，再也写不出了。尽管那人消失后的几年，写过一些，应该是余烬。再比如停留在美好回忆层面的导演，有个突出的例子：伍迪艾伦。
年轻人总能借着那股原始的野蛮的疯狂生长的劲儿，去表达自己都不明所以的东西，有的人有着自己都没弄明白的才华在表达中发光。后来，有的人失去了那股劲儿，有的人则是敬畏着不再去表达自己没弄明白的东西。
记得以前写过一篇小说，没怎么给别人看过，过了很多年，给其中一人物原型看。她自然是知道哪个人是她，我没有多问，她也没有多答。
“有意思吗？”
“满有意思的。”
这就是我们简短的对话。是一个偏悲的故事：主角不断追求不存在或失去的爱情，最后有机会把握时，主角放弃了。
岩井俊二能打动我原因之一是点到为止，比如情书的结尾：“因为我很害羞，所以没有把这封信寄出去。”比如《瑞普凡温克尔的新娘》亲吻了不存在的戒指。比如《花与爱丽丝》两人像以前一样走着。没什么变化，却有实实在在的变化，没提有多深情，却一直怀恋在心。
岩井俊二自然是拍不出《情书》那样作品了，为此他借混蛋学长之口把自己也骂了一遍。创作这种事，不是靠积累就可以的，爱情这种事，也不是靠精心准备就可以等到的。能怎么办了？只不过是在自以为是的努力中给自己一点点盼头，被时间和生活推着往前走罢了，这个前也只是形式上的。
我想我们终究无法抵达满意的生活，爱情、理想也极大可能无法实现，公式化的喧嚣世界中，声音都能被淹没。但，那一份来自心底的无需言语的小小默契，我们会欢喜很久。
这就是岩井俊二吧，虽然老去不如当年灵性，甚至有点无赖，躺在了小清新的道路上不肯挪开。
我也记得那段可以每天通话发短消息，却仍彼此写信的时光。我们不知道甚至没去留意，某一封，就成了最后一封信。",,,0
