,Unnamed: 0,电影id,电影名称,用户id,用户名,评分,评论日期,评论内容,有用数,没用数,回应数
0,0,30289828,兔子暴力,4ff0fd0e38973395a6af1fe97bdead10,75299f6227dae1990e9c15dd57e08476,2.0,2021-08-15 22:26:22,"今天聊一聊本周末上映的新电影：《兔子暴力》
这部电影还是很有意思的。
改编2011年南京真实的绑架杀人案件。
1975年出生的妈妈因为嫌弃家里贫穷，在生下女儿半年的时候，抛下家人女儿出去“打拼”
父亲再婚，家庭并不幸福，女儿一直渴望妈妈回家。

妈妈再婚三次，均以赌博为导火索失败离婚收场，最终走投无路，回到老家投奔女儿（前夫）。

女儿把爱妈妈上升到了一种高度，接受了妈妈。

妈妈欠下30万赌博高利贷，利滚利到了70万。

最后教唆女儿绑架杀害同学。
女儿以过生日为由，原本要绑架一个富人家同学，该同学警惕性较高，没有上当。

女儿又绑架了另一个经常和富二代混在一起的同学。

这个同学家里比较贫穷，但有个养父是开婚庆公司的小老板，所以表面上看上去比较有钱。
最后母女将此同学“撕票”，残忍杀害，并放在后备箱里。
为了掩人耳目，女儿还假装自己也被绑架，没想到两家都选择了报警（因为根本拿不出来300万，都是穷人）

去派出所的路上，受害者父亲就坐在后排座位，后备箱里就是女儿的尸体。
报警后，出于恐慌，母亲指使女儿销案，说是开玩笑，又说那个女同学去扬州见网友了。

警察觉得这对母女不对劲，前夫动员所有亲戚来给女儿做思想工作。
最终在表姐夫的劝说下，女儿说出实情，绑架杀人。

到了派出所，当妈的3个小时就全供出来，并且把责任推给女儿。

女儿反而扛了8个小时，而且坚决不出卖妈妈。
出事后受害人的父亲精神崩溃。

这就是一个烂赌鬼，一个不负责的妈妈，毁了两个穷人家庭的故事。教唆绑架杀人，罪无可恕。

这个妈妈最后的底线，就是亲口承认了是自己杀人

“我想着我得自己动手，不能让女儿动手，不然她就成主谋了”  《兔子暴力》这部电影，就是改编自这个真实案件，内容大约75%以上都是一模一样的。

虽然导演很会表达细腻的情感，光影镜头玩的也很溜，技术算是比较成熟，万茜和李庚希的演技也可圈可点


但是我依旧不推荐这部电影，因为我觉得它三观不正。
它的很多改编，都在有意无意的扭曲这个案件，美化杀人犯。


女儿出于原生家庭苦难，被母亲抛弃，对母亲极度的渴望，所以愿意为母亲做任何事。
这是悲剧，但青少年思想不成熟，也情有可原。

但是作为成年人，这位所谓“母亲”，可以说就是一个烂到骨子里的人，这种人根本没有责任，也不懂感情。
在电影中，对这个角色有大量的美化，使其看起来甚至像个正常人，还会维护自己女儿，还会自责反省，还有感情和母爱。
虽然万茜演的很不错，尤其哭戏真的很动人，但我始终无法共情，因为看过原案件，我不认可这种改编。



1原案件，是妈妈两次教唆女儿
电影里改成了女儿两次主动提出

2
绑架杀人，在电影里反而变成了面对着只手遮天的黑社会团伙，所以被逼无奈，走投无路
其实是咎由自取，残忍暴力，投机取巧。
30万高利贷滚到70万，这件事有很多方法可以解决。教唆自己女儿绑架杀人，毁了两个家庭，是最不可原谅的选择。
3
主动杀人，被改成了过失杀人，而且杀人未遂，弱化了此案的严重性。

4
妈妈在电影里表现的有情有义，母女情深，甚至还有责任感

实际上这种人没有感情，也不懂责任
有责任，会教唆女儿绑架？
很多评论指出，这部电影里的感情根本不成立。
他们说的很对。
女儿对母亲的感情可以成立，可以理解，也确实是原案件真实的。
但是母亲对女儿的感情，冷笑，如果她有感情，又怎么会这样悲剧？
所以这种改编不成立。



5
原案件，妈妈鬼迷心窍，以为绑架可以脱出生天

电影里，妈妈对绑架这种事情带着轻蔑和否决，似乎是一个正常人的思维

其实不是。
两点：
有些人不是正常人，根本不配做父母。

烂赌鬼是无法挽救的。


6

《原生家庭》这本书我一直给粉丝推荐，这本书里写的很清楚，如果能和父母和解，互相救赎，那当然最好。

但有些父母是没救的，这个时候一定要切割，断绝关系。坚决断绝关系。
而电影里，处处都在聊感情，都在聊救赎，似乎这样的人，还有救似的。
这种大爱无疆，只会给那些陷在原生家庭困境的孩子，带去虚假的希望。
这种导向和三观，使我严重不适。

7
提问：
难道这个电影就没有反省，没有正面意义吗？
回答：
电影的反思立意在我看来非常肤浅，电影最后的字幕说要给孩子更多的关爱，单独来看这句话没有错，但它严重的脱离现实。

现实里，很多事情无解，就像癌症，只能切掉。现实里，面对烂赌鬼，问题根本不是救赎，关爱，而是坚决态度，大义灭亲，否则会导致更多的悲剧。
什么样的父母是可以和解的，什么样的父母是没救的，也许这需要划分。
但是此案的母亲，很明显是没救的。
这电影评分低说明观众不傻。。。
这导演编剧太喜欢讲感情，到最后还在讲感情，实际上这种不负责任，烂赌鬼，教唆杀人的妈，根本没得感情。
看看原案件吧，一模一样的故事只不过换了个残忍的妈，这就只适合法治节目纪录片，不适合拍情感文艺片。
批判得一点都不深入，甚至没看见批判，只看见美化。
可惜了演员演技。

8
提问：你的逻辑几乎都是建立在一个前提下，就是对照原案件里，妈妈原型是一个烂人。
有没有可能，这个电影是独立于原案件的？
回答：

电影就是改编自这个案件，不仅案情一模一样，连很多细节都一样。比如受害者的父亲会接女儿上学放学，会做鱼，有心脏病等等。
这根本不可能推脱，这就是一个失败的改编和立意。
单看电影，或许能讲得通，但是一看原案件，立刻就高血压了。




改编不尊重原案件，不仅体现在这个妈妈是烂人这一个点。
原案件里，受害者父亲对女儿十分溺爱，失去女儿后精神崩溃。
这个电影如此改编，考虑过该父亲，受害者家属等等一干人等，看了电影会受到二次伤害吗？

在我看来这是一种消费，而不是创作。
如果真的什么事情，都可以用爱、反省、过失杀人来解决，现实又怎么会有那么多惨剧，那么多烂人，要警察做什么？要死刑做什么？

不要搞错了重点，杀人犯不需要美化，尤其是这种有预谋的，烂赌鬼的杀人犯，绝对不需要美化。
看看电影《门徒》，吴彦祖的态度才是正确的。
这种爱和救赎，呼吁，都是导演和编剧一厢情愿的，脱离现实案件，脱离现实规律。


总结：

爱是这个世界上最伟大的事情之一。但是很多人没资格谈爱。两者并不冲突。
想聊情爱？先做个合格的人谢谢。
多少扭曲变态的欲求，以爱之名被掩藏？
少一点垃圾人，天天情情爱爱恩恩怨怨，多一点人做正经事，这个世界会干净美好很多。
虽然这部电影一些镜头很美，技术比较成熟，情感表达比较细腻，演技也不错。
但是我觉得它三观不正，立意肤浅，没有做到正确的引导，没有深入批判现实。
两星。",455.0,56.0,92
1,1,30289828,兔子暴力,7c180bcb0b8d0fd60cba95e1c0eda0da,871147d9b70c828cd0443a8acdc1bfd4,,2021-08-05 04:43:22,"看到是女性导演的女性视角犯罪作品，有点期待。然后无意中发现电影之外，有真实的案件。 我想，真实的生活可能会比艺术创作的电影更悲伤。  三联生活周刊文章报道http://app.lifeweek.com.cn/?action=weixin&amp;app=rss&amp;contentid=35867&amp;controller=api  案情报道(复制粘贴的): 母亲唆使不满16岁的女儿合谋勒索杀害女儿同学。

今年2月底，南京发生一起令人震惊的绑架案：一位因赌博欠下高利贷的母亲，被债主逼急，竟教唆不满16周岁的女儿骗同学出去吃饭，借机杀死对方并向家属勒索300万。为把绑架戏演得逼真，她还勒索了自己女儿的生父，造成两个女孩一起被绑架的假象。事后，一个女孩安然归来，另一个却下落不明，母女俩编造的谎言最终被拆穿。今天上午，这对涉嫌故意杀人罪、绑架罪的母女将在南京中院开庭审理，因女儿未满16周岁，庭审不会公开。

案情回顾

两个女孩“失踪”一个安然归来，做出蹊跷解释

1995年出生的小米是南京某职业中专的在校学生。今年2月25日晚上10点多，小米的父亲老周忽然接到一个勒索电话，对方称绑架了小米，要100万赎金。老周大吃一惊，立马向南湖派出所报警。

与此同时，小米同班同学小叶的父亲也接到一个勒索电话，对方要300万。两个父亲同时报女儿失踪，这引起了警方的高度重视。侦查连夜展开。就在侦查工作紧张进行当中，案情出现了转机：第二天，被“绑架”的小米突然回家了，并在母亲刘晴的陪同下到派出所“销案”。

小米对办案民警说出的话让所有人都松了一口气。“我们不想参加周末的补考，也不想回家，就假装被绑架了，手机卡是买的，我打给她爸爸，她打给我爸爸。”

如果真是这样，小叶怎么没回家？对此，小米解释说，小叶去扬州见网友了。但网友是谁，怎么联系，她却支吾着答不上来。为查出真相，警方让小米先回家，背地却找到小米的父亲老周，劝他开导小米。

27日凌晨，小米终于对父亲说出真相——小叶在25日晚7点多就死了，是被她跟母亲合伙杀害的，勒索电话都是母亲刘晴用变声手机打的……

真相令人心惊，母亲让女儿物色绑架对象

办案民警随即将小米及其母亲刘晴抓获。经两人指引，民警在刘晴租来的轿车后备箱内发现一只拉杆箱，箱中藏着小叶的尸体。

原来，刘晴因为赌博欠下70多万元高利贷，眼看还款期限将至，她便想出绑架有钱人勒索的法子，并让女儿在同学中物色绑架对象。16岁的小米稀里糊涂听了母亲的话，以过生日为名约班上同学小叶。

25日晚，刘晴驾驶租来的轿车带小米、小叶到饭店吃饭。中途趁着小叶离席，刘晴将安眠药放进小叶的杯子。饭后，刘晴直接将车开到紫金山附近，在那里，母女俩残忍地将小叶杀害。当晚，刘晴用变声手机给小叶父母打电话，索要300万元赎金。为了圆谎，她给前夫老周（即小米的生父）也打了一个勒索电话，索要100万元赎金，造成两个女孩一起被绑架的假象。事后，母女俩还想将小叶的尸体掩埋，但未成功。检方认为，被告母女以勒索财物为目的，共同实施绑架并杀害被绑架人，其行为构成绑架罪和故意杀人罪。两人共同预谋、实施犯罪行为，系共同犯罪，其中母亲刘晴在共同犯罪中起主要作用，系主犯，女儿小米起辅助作用，系从犯。检方建议法院对刘晴依法惩处，而对未满16周岁的小米从轻或减轻处罚。

记者了解到，刘晴离异多年，一直失业，小米的生父经济状况也一般，50多万元赔偿金对他们来说不是小数目。目前，这对母女的家人和律师还没有就赔偿事宜跟被害人家属有过接触。更多案情有待庭审披露。 
被害女孩父亲，因悲痛折磨患上抑郁症

2011年2月27日，是小叶的父亲老叶永远都忘不了的日子，这天，他在派出所听到女儿遇害的消息，一头栽倒在地，至今都没能从悲痛中爬起来。老叶告诉记者，女儿从小身体不好，4岁时还做过心脏手术，家里一直拿她当宝贝。

半年来，老叶在悲伤的折磨下无法正常生活，身体每况愈下，8月底的一天，他将家里能砸的都砸了，被诊断患上抑郁症。医生建议他入院治疗，他怎么也不同意。对他来说，最重要的事不是自己的身体，而是等待害死女儿的凶手接受审判。

好赌母亲，残忍恶念毁掉两个女孩

同样是父亲，小米的父亲老周所承受的心痛并不比老叶少。他跟家人最为心痛的是，刘晴不仅自己行凶作案，还将女儿小米拉下水。刘晴生于1975年，20岁那年，生下小米才5个月，就离家出走了，小米从小跟爷爷奶奶长大。这些年，刘晴染上了赌博恶习，借了不少高利贷。利滚利，到今年1月份已经欠下70多万。这个残忍母亲的恶念，不仅害死一个无辜女孩，也毁了自己女儿的一生。（文中当事人均为化名）",96.0,16.0,58
2,2,30289828,兔子暴力,ab0e9ba8d1e6c91137e183ab1d156b27,3a9cd088ed8bd4dbc698eb9adaef9a5d,3.0,2021-08-13 08:34:58,6.9 可与《热带往事》共同食用，都是新人导演犯罪片首作。万茜表现尤佳，有几场戏爆发力很强，看来综艺节目还是没有消磨太多的演技。李庚希在新生代演员中也算是出类拔萃的了，角色的青春感和成熟感都把握的恰如其分。表演最强的当属潘斌龙，戏份不多，但压迫感极强，尤其是桥上扇自己耳光和剁鱼扔刀的几场戏，让人不寒而栗，大潘这是《无名之辈》之后又要靠西南口音角色惊艳全国观众了。故事虽为真实事件改编，但呈现出来的可信度并不高，作案动机交代生硬孱弱，新导演雷声大雨点小的毛病也存在，好在对万茜李庚希这对母女关系的刻画足够动人，青少年犯罪的题材还是敢于挑战审查的，摄影、构图也颇有亮点而又无炫技之感。男性角色对女性的压迫过于刻意（尤其是欠债还钱的老套动机），几个学生配角的故事也实属多余，比如金熙母爱缺失的交代和曲婷、男学生的暧昧，想表达的太多又于主线无益，导致核心女性议题也难以力透纸背。,72.0,2.0,15
3,3,30289828,兔子暴力,c3fdad2c1c864c8a049b3e7cd5eceb9e,901788a12d9aa9aa7f842de3c8cb50bf,5.0,2021-08-14 23:12:59,以爱之名，母女俩变成“末路狂花” 我是万茜粉丝，她的电影我自然是力荐的。此外，本文与其说是影评，不如说是观后感更为贴切。文中会有许多主观感受，若说得不称意，就请看官多多担待了。 我在评述电影之前，想请大家先听一首歌： 小兔子乖乖，把门儿开开。快点儿开开，我要进来！ 不开不开我不开，妈妈没回来，谁来也不开！ 小兔子乖乖，把门儿开开。快点儿开开，我要进来！ 就开就开我就开，妈妈回来了，快点把门开！  这是一首耳熟能详的儿歌，教小朋友保护自己的同时，也对母爱进行了歌颂。歌词很美好，但若较起真来，也有一个细思极恐的点：把门打开后，妈妈是进来了，可大灰狼会不会也一块儿进来？ 在《兔子暴力》这部影片中这个隐患就实打实地出现了。  8月14日七夕档，由万茜、李庚希主演的电影《兔子暴力》空降影院。片中，高中女孩水青一岁时就被妈妈曲婷抛弃，在 缺爱的环境里孤独成长16年。有一天，妈妈突然来到门口，母女俩的生活发生了不可预测的转变。 影片前半部分讲述亲情失而复得后的美好生活，后半部分则是小人物在困境下与生活作斗争。本文将围绕这两点，讲讲笔者的观影感受。  1. 要不要为妈妈开门？ 这个问题若放在过去的一二十年里，在那个倡导“冤家宜解不宜结”的年代，想必大部分人都是劝和不劝分的。只是近些年来，网上流行“以德报怨，何以报德”的思想，谁若轻易原谅对方了，八成是会有人反对的。 金熙（柴烨 饰）就是反对派之一。虽说只是配角，但电影对她刻画得很真实，这个角色体现出现实生活中某一类闺蜜的特点，即对好朋友的为人处世有着很强的把控欲。她劝水青远离母亲，憎恨母亲，不要原谅母亲。  然而水青依旧对母亲打开心扉，微笑着欢迎她，亲近她。 或许有人会笑水青心肠软，好欺负，像个舔狗。而他们所不理解的恰恰就是一个好欺负、缺爱的人对爱的强烈渴望，以及对美好生活的信念。 不久前上映的《燃野少年的天空》里，女主小黄自幼没了母亲，父亲编出一个善意的谎言，告诉她妈妈在很远的地方做明星。 于是女孩便不觉得孤独，既然母亲健在，那自己和她就是天涯若比邻，总有一天能团聚。这种想法就是支持女孩克服孤独，顽强成长的信念。 从这一点来说，无论《兔子暴力》当中的水青还是《燃野少年的天空》里的小黄，她们的心态都是一致的。那个远在天边，素未平生的母亲，其实早已作为一种信念，植根于思念者的心田。并随着当事人的长大，这棵名为信念的幼苗也不可自拔地长成参天大树。  有这个信念在，就仿佛母亲还陪着自己，就能在孤独中坚强生活。 而当这一信念从抽象变作具象，从梦境变作真实时，对于当事人而言就是一扇希望之门从天而降。儿歌里的小兔子打开的是一扇实体门，电影里的小兔子打开的则是一扇阻碍光明的心之门。生活的信念、对爱的渴望将会引导她们：只要打开了这扇门，天使就会微笑着将你拥抱。至于曾经的什么弃养、埋怨这些统统都翻篇不计较！ 《兔子暴力》的重心不在于批判丑恶，不在于教人记仇，而在于对苦难的人表示同情，以及表现创作者对爱的深刻追求。无论《神奇女侠》《你好，李焕英》还是《兔子暴力》，女导演身上总会透露着一种天赋，那就是她们对爱的执着以及对情感的敏感度。人物的心态、细腻的情绪变化都在她们的镜头下一一呈现。 2. 为爱暴走 影片在第33届东京国际电影节上放映时，日方的译名为《兎たちの暴走》，也就是《兔子的暴走》。所谓“暴走”，即狂奔、失控之意。确实，当观众看到女儿为爱做出的一系列疯狂举动时，内心都不由得为之一颤。 曲婷回到水青身边后，与她唱歌、跳舞、喝酒、钻隧道，在那短短的几天里母女俩都从对方身上收获了前所未有的喜悦，暂时忘却明天的烦恼，进入“无丝竹之乱耳，无案牍之劳形”的境界。连主演万茜在拍戏时都被年轻人的欢乐氛围所感染，说出“年轻真好”。  然而，生活的苦难不会因为暂时的喜悦而消失。当大灰狼闯进屋时，影片进入黑暗沉重的后半段。无论画面色调还是角色心境都变作黑压压的一片。 女儿对母亲的执念非常强烈，“我愿意为你做任何事”这话不是说着玩玩，而是这份执念下的真实写照。甚至不惜为此犯罪。 导演在访谈中说：“她要把母亲也好，把这份爱也好，留在身边。因为她太强烈、太渴望，所以陷入了一种深深的执念，最后的事件是一个失控的故事了，滑向了她没有预想到的结局。” 水青很弱小，面对同学嘲讽、继母责难她一向逆来顺受；曲婷也很弱小，在黑恶势力面前委曲求全，担惊受怕。然而，兔子急了会咬人。母亲被坏人纠缠，女儿便拎着花枪与他拼命；女儿被坏人胁迫，一向胆小怕事的母亲也发疯似得攻击坏人。  影片将二者患难与共、互为依赖的关系刻画得入木三分，展现出弱者对爱的珍视，渴望守护失而复得之物的强大信念，诠释了“女子本柔，为母则刚”一言，并将这话的格局进一步拓展。使得她们由弱小变得坚强再变得疯狂，甚至不计后果，走上违法犯罪的道路，变成一对母女版的“末路狂花”。 3.表现手法 卡夫卡懂得取舍，《变形记》里没交代主角是如何变成甲虫的，而是直接写他变成甲虫后的故事；张艺谋懂得取舍，《归来》里没有讲陆犯焉识的漫漫经历，而是集中在焉识归来后，家庭的状态变化。由一些细微的“点”感动观众。 本片导演申瑜也懂得取舍，删繁就简。没有拍母女俩重逢、相识等戏份，对于犯罪后续也一点而过。她把重心集中在双方共同生活的几天里，通过这几天的小事情表现出痛苦十六年的人对于幸福生活的渴望。 那些没拍的情节——如现实原型里，母女受审时，母亲6个小时就招了供，女儿却硬抗了8个小时——若拍出来，自然也有其妙处。然而那就是另起一部电影了，于时长于主题都得扩张，不合乎整体基调。而且，原型受审无非是体现一下女儿比妈更能扛，这一点全片已经体现得很到位了，还差这一场戏吗？ 如果说，电影前半段讲述的是接纳爱带给人的治愈，那么后半段便是守护爱而迎来的挑战。但无论前半段还是后半段，时长加在一块儿也不过寥寥数日。这使影片的重心能够压缩在一个点上，同时也让叙事变得紧凑简洁不拖沓。  此外，本片在小细节上也颇为用心。细心的观众会发现万茜的车子是黄的，裙子是黄的，夹克是黄的，毯子是黄的，连方便面的包装也是黄的。黄色是一种象征青春与温暖的颜色，表现出曲婷与水青这对母女，俨然如一双姐妹。而黄色同时也是一种警戒色，喻示着温柔的背后危机重重，幸福的表层下困境十足。  与之相对，女儿水青的服饰则带有青色，意喻青春、青涩。  《兔子暴力》的拍摄地点在攀枝花市，当地盛产一种芒果，果皮是青的，代表女儿；果肉是黄的，代表母亲。影片里女儿成熟得像个大人，拼尽全力保护母亲，就像果皮护着果肉；而母亲给予女儿强大的信念，给了她内在的精神力量，就像果肉撑着果皮。片中正好有一个女儿吃芒果的镜头，果皮只剥一半，呈现出青一半黄一半的画面，将母女俩紧密地联系在一起。 关于几行字幕交代结尾的做法网上颇具争议。给我留下印象的主要有两点： 1. 为什么这么简单就结束了，怎么不继续拍？ 2. 还不如在光明的隧道里戛然而止呢，干嘛非加条字幕说她们自首？ 关于第一点，本文上一节已做回应，此处不再赘述。 至于第二点，我就想问一句：不放这几行字电影能过审吗？审核机制摆在那儿了，犯罪片必须要绳之以法。想当年《误杀》上映时结尾也一样引争议，主角明明把警方耍得团团转，获得全盘胜利了，最后怎么还莫名其妙去自首？记者这么问他，主角自己都不知该怎么答。 因为不自首审核通不过呀！ —【完】— ——2877字 最后发一张去年给万茜画的像，没学过，技术不太好，但不是“闲着无聊，随便画了幅画”，而是认认真真去画的。,61.0,11.0,11
4,4,30289828,兔子暴力,7ad959a41ff532e22a5cbbb08a4b7a4d,1699a2732ec6572e072df41cdde727a1,2.0,2021-08-14 22:14:27,标题起的大了点，但是真的想探讨一下现在新人导演的出路。 这个片子其实就是一个披着犯罪片壳子的亲情片，并且还用了“爱情”的方式来做母女情，这些想法都挺好的，但是这一个本该是拥有极强商业属性的电影，为什么能在创作者权衡之后做的如此沉闷？ 节奏的失衡。 以及对每个人物状态深入体验的缺乏，都让观众难以共情难以进入这个故事。 在看电影的时候不知道为什么脑海中无数次闪过《少年的你》，为什么它铺垫情绪的特写这么动人？为什么它的节奏那么舒服？ 用心，各方面的用心。是对每个人物仔细琢磨后，让他们在不同事件中做出了最贴合人物状态的行为，让观众们真的愿意相信这个故事，真的相信那个电影里的世界。 话说回来，现在新人导演好像真是酷爱做这种“荒废”小城里的罪案，他们疯狂地想在里面探讨一些自己好像都没琢磨明白的情感，乍看上去意味深长，沉醉在自己表达里，但深琢磨之下什么都没有，只能看到创作者陷在小布尔乔亚式的狂欢里，与大众们无比的疏离。 导演如果只是想做自我表达，如果只是想拍得自己爽，根本考虑观众爽不爽，根本不考虑观众是不是如芒在背如鲠在喉如坐针毡，是不是看得观众疲惫，那也没必要来院线去搞钱啊？既然不想搞商业为什么还要跪着上来营销？一边下跪一边挥拳说你们不懂我？ 这样不尊重观众的行为，如何能让观众尊重影片？ 不知道，又想挣钱，又想立牌坊（摇头）,88.0,12.0,13
