,Unnamed: 0,电影id,电影名称,用户id,用户名,评分,评论日期,评论内容,有用数,没用数,回应数
24,24,30289828,兔子暴力,b895ec337c25d0461b2e44ca22afb489,7696fb0b67115063e2247aa017caddf0,3.0,2021-08-17 23:35:53,"“这是一个青春痘一样的城市。” 有人在青春痘城市的脓痂上，变成城市的青春痘。 攀枝花的山城对望    首映日是七夕，天阴。下午我出门看电影时，攀枝花正下着小雨。 电影以未成年人被绑架后，父母去报案的场景开场。几分钟后，万茜饰演的角色曲婷说：外地的芒果就是不如家乡的芒果好吃。 然后影厅里小小一屋子攀枝花人，就笑了出来。
 随后，半黄半青的两箱芒果被打翻在地。一个明黄色的曲婷从故事里走出来，一个青绿色的水青也从故事里走出来。 到了家门口，水青却被继母以“我爸妈不想看到家里有外人”为理由，要求她暂时不要回家。连进去上一个卫生间再出来的请求都被忽视之后，她无意间从堡坎上站着的父亲口中得知：她的妈妈回来了。 于是第二天，坐在嵌入攀钢厂区转角的羊肉米线铺子里，她既不犹豫，也不必提问确认，就知道，那个穿着明黄色裙子，摇摇晃晃地从楼梯上冒出来的女人，就是妈妈。 水青不抽烟，但却也要向妈妈借火。
 正像她在废弃的隧道口所喊出的那句“遗言”：“我愿意，为你做任何事情！” 所以就算她不残忍、不暴力、不冷漠，她也可以为了妈妈去绑架自己的好友、去向好友赤贫的父亲勒索钱财。 正像她憋住眼泪，在广播室里念出的信上的句子：“如果承认这一切，那我悲惨的人生，不就更悲惨了吗？” 所以她用她在昏黄隧洞里满脸的眼泪、用好友的健康乃至生命、用边缘人的犯罪，作为赌注，尝试赎回一个不再悲惨的人生。 兔子的暴力，是弱者的武器。    人类学家詹姆斯·斯科特在对东南亚小农经济进行研究后，写作了《弱者的武器》一书。在他看来，弱者的武器是弱者用以保护自己的一些日常的反抗形式。 从东南亚的小农到美国街角社会的黑人，社会学家和人类学家发掘着边缘人的同质。 他们旷课、旷工、暴力、酗酒或者物质滥用，他们沉默寡言、或者言辞混乱，他们消极、沉沦、放弃生活。他们所表现的、利用的和武装的，都是弱者的武器。
 在片中，水青的父亲水浩，沉默地跟在妻子背后，沉默地接受妻对他辩解的无视和反对。他穿着攀钢的牛仔工作服躺在家的小卖店门口睡着，桌上摊着一本提高彩票中奖概率的指南。好像他这一生，就是在徒劳地等待天降的幸运砸在他头上。 水青的母亲曲婷，为了追求梦想离开攀枝花，又为了躲债而回到故里，住在荒废剧场的舞台上。她为了周转而投向了自己情人的敌人，为了求情对黄觉饰演的老杜柔情百转，为了钱甚至不惜去勾引女儿的同学。她一生这明黄的艳丽，成了她最大的本钱和最大的悲哀。 水青的好友金熙，在学校从来不穿校服，而是套着宽大的黑色乐队文化衫。她在空无一人的家中浴室里给自己纹身、自残，用叛逆来平复父母长期外出经商、对她不管不顾的愤怒。 温和美丽的马悦悦，为了逃离赤贫且身患疾病的父亲，对生活优渥的干爸干妈百依百顺。而面对着父亲近乎于疯狂的保护，她只能一次次地在瞥见父亲的身影后逃往别处。小城生活无疑是种煎熬，她尚在其中，只能以去往成都后的新生活作为唯一寄望。
 而水青呢？ 继母将她的头发、她的身体，当作可为了维护自己生活而随意支使、改变的对象，父亲则跟在继母的叱责后头，一言不发。她被这个她试图委身的家庭视为闯入者，被幸福的重组拒之门外。她日复一日地逃离学校，在金沙江畔的破沙发上等待时间走过。 当母亲从遥远的财富之地败退，带她走上母亲安睡的舞台、任凭她想象一个羽毛之下的美丽的吉普赛人母亲、为她戴上母亲当年的戒指、向她授以捷克舞蹈家所授的课程、为她修剪草草建了几簇的乱发的时候，她就这样被那个失散多年的母亲自然地寻回。 母亲成为她逃离罗生门的最后一根救命蛛丝，她只渴望被母亲永远地收留。  而当曲婷对自己用鸡毛掸子创造的精美服装、对她当年的成功和喜悦大加渲染的同时，三个正咀嚼着沙拉的、兔子一般的、从来那么那么缺乏、又那么那么渴望母亲的少女，也一瞬间都向“母亲”归降。 可兔子也有最终极、最私密的暴力。
 马悦悦沉默地转头，隔绝了父亲试图付出的所有亲密。 金熙认为自己暗恋的人被曲婷勾引，在愤怒之下选择了让水青在广播站念出道歉信，向全校人撕裂开水青的悲惨人生。 水青则选择欺骗朋友，策划“假”绑架和勒索，借以拯救母亲、拯救自我。 她们的暴力，是顺从、缄默、放弃，也是以弃绝自身为代价的抵抗。也正因为如此，她们不得已地走向如此的暴力之时，也弃绝了剧中人相互依赖的可能性，从而导致了“兔子窝”最终无可避免的崩塌。 如此无奈、惨烈、又必然的悲剧结局，竟然能被部分评论者看作是对犯罪的美化。尚且不论真实与艺术创作之间的固有张力，任何一个创作者看了，都会觉得啼笑皆非。 作为导演的处女作，《兔子暴力》的不足之处相当显见：剧情略微单薄、人物的彼此关系和核心特质急转直下…… 然而，不管讨论它的前提是疫情又起时可预见的成本回收压力，还是艺术电影逐渐走向吃力不讨好的创作窘境。整个团队的共同协作，都呈现出一腔孤勇的精神气质。 我与友人无法认同一些评论者的指摘。纵使现实新闻的底子已极具有戏剧性，但这并不妨碍任何夸张化的艺术处理及二度创作。无数个被摄影机屏息凝视的时刻，都让我想起了《燃烧》里黯淡日光下的舞蹈：因为真实所以绝望，因为美好所以残酷——在时光隧道的尽头，是她们以爱之名堆垒砌成的失乐园。 若荧幕最后静止在昏黄隧洞中水青带着笑意、又泪流满面的回眸，电影本身，一定会变得不一样。 而最后黑底白字最苍白的结局陈述和警世宣言，也已经是难以趋近“主流”、“正常”、“阳光”的边缘人故事的最大让步。    过去几年，电影创作的视野框住南方自身陷于新进发展与陈旧边缘之间的两难。 黔东南的郁青之中诞生了《路边野餐》、《地球最后的夜晚》、《四个春天》、《无名之辈》。江南的水系中拍出了《郊区的鸟》、《春江水暖》和《漫游》。华中和川渝的“南方”形象，则以《南方车站的聚会》、《火锅英雄》的面貌走向荧幕。  《兔子暴力》上映后，平台影评中不乏对以南方边陲、潮湿城市为故事背景的电影的调侃，彷佛它们即将成为一种类型片的热病，或成为声称“先锋”电影叙事的通行证。 而我恕难认同这种质疑。 后现代的文化书写呈现出不可逆转的“去中心化”趋势，旧有的文化高地，总经受着持续的洗涤与置换。古时长久以来被作为流放之地、蛮夷四野的南方，如今由于发展而获得瞩目。所有那些隐秘的传统与规范、在地的困惑和失落，也终于，在长久的边缘过后慢慢走向电影的聚光灯。 而短短数年间，“南方电影”其实不过是作为一个外在类别而被观众认知。其实，它们各自的题材、手法和核心千差万别，每一部南方电影实则都是一个独立的南方。“南方电影”本身，正在出现，尚未定型。过早地将其套上一些莫须有的风格判定，对其发展百害而无一利。 而在休旅途中，我曾路过云贵高原上绿野中龙骨一般的小山、乱世；望过成昆线之间的深涧与涸谷的时候；见证过重庆连日不败的雨雾。作为外乡人，我模糊感觉每一寸土地上的人，都有每一寸截然不同的寂寞。每一寸土地的人事，有每一寸截然不同的地理空间互文。 而我就算再走进他们，去看再多再多的他们的人事，也似乎永远、永远无法穿透他们的寂寞了。    但我想，我至少懂得一些，作为一个攀枝花人的寂寞。 我不懂得的，是带着对“在攀枝花取景的电影”的期待走入《兔子暴力》影厅的人，在出场之后只是在本地社群中写下“它凭什么说攀枝花不好”的指责之声。  言外之意，是要求一部犯罪电影主角积极生活、色调温暖阳光、歌颂英雄城市。如此在地的地方主义，浸淫了极其浓厚的“英雄主义”色彩，使得我和一众好友费解不已。 我们从来怀疑英雄主义、怀疑唯发展论，怀疑是否如同《阳光普照》的片尾台词一样：在炽热的阳光之下，有人、有事物不知道可在何躲藏。
 十八岁时我离开这里。像所有边缘的人注定的一次逃亡。 然后我在成年后，不断、不断地，回望我在西南隅中穿越的整个童年，拼接起被我遗漏的人事。 我曾居住的城区里，在雨季中，街道上有近乎遮天蔽日的“飞蚂蚁”。那些从来无人问津的流浪狗，吃进去完整的塑料袋、然后拉出来一条同样完整的塑料袋。 我曾经去过一个我如今忘记地址的煤矿附近的菜市场，下午六点，赤贫者们走动着收集被遗落的菜叶，带起地面上厚厚一层漂浮的煤灰。 我的一个同学父母都是井下作业的工人，他的家在步行一小时以外的煤矿附近，掌纹里永远嵌着洗不掉的煤黑。后来某天，他的父亲因为事故在井下去世，母亲离开，给他留下一个没有人参加家长会的童年。
 我对工业、城市、能源的所有信心都开始衰败。 那些黑色的煤斗悬停在金沙江上方，穿越城区的煤炭专线铁路开始荒芜。我玩着长大的那个地质勘测筒子楼早已无人问津，杂草淹没了守夜人曾住的帐篷。因为产能限制或产业升级被裁汰的工人们，在无所事事、酗酒和打骂中重新捡起更加边缘的人生。
 我在成年后，不断、不断地，尝试追溯人在土地之上的根。 我问我自己，也问周遭的所有人，似乎每个人都有确切无疑的来处。譬如C家本是由湖广填川去往重庆定居的移民，又在三线建设时因父辈随军行旅而居家迁往攀枝花；而X家则祖上是河南的农民，为躲避战乱饥荒一路南下，最终在60年代的大潮中择此而栖。 正因如此，攀枝花似乎从不隶属于统一的任何一种地方模式。方言与普通话、天南海北的习俗与观念，都挤在攀枝花和其他地方两头，生长出很多变形了的日常习惯，铺在攀枝花人的生活里面。
 在这个地域和社会进步重叠在一起的城市，我生活了十八年。我的长辈、父辈、同辈，都在这里兜转又离开，去往更大更崭新的城市，然后又在某一天回来或者永不回来。十八年之后我们暂时离开它，由边缘去往核心，才突觉许多人的生活并非如此充满流变性和戏剧感。 当我们反复、反复地尝试着，从儿童、小城人、边缘人，离心到社会和文化的中央的时候，我读了童伟格的《西北雨》。他写： 它像是真正生活的复象，又像是光天化日下，不该存在的影子。就像一个国家过往所有战防之地、矿藏之地、收谷之地等耗尽自己的地方，在那里出生、成长的人，会觉得生活本身是一场漫长的瘟疫，熟识的人泰半不会留下；留下的人唯一的出路，是将伤逝洗练得单纯易解，像风景区一样适宜开放。 而我执意认为，他写的季风下来来去去的潮湿西北雨，同时也下在西南隅。  攀钢厂区一角丨巨大的烟囱 这座依山得势的城市，因发展要求涌进天南海北人，并凭空搭建起一套工业和一套对应的生活。在所有那些乌黑的浓烟、刺鼻的废水，被磨损、被裁汰、被否定时，南方健全的一片绿野，最终被作为这个城市健康的器官保留。 它开始走向康养、走向明媚透彻的阳光。像是一具生物机体一般，它以社会发展的某种必然新陈代谢着，不断地排出“废物”、“毒素”，清理走这座城市煤烟燃烧、钢锈铁腐之后留下的疮。 不变的是，这里的人和事物，都堆叠在山河桥隧的纵横里面，主干道总是沿着山缘起伏转圜的那一条。 那些沿着主干道一直、一直走的人，不会发现，有人走着走着，就走上了再无人问津的岔路口；有人走着走着，就被漏在了“正常”、“发展”的外头。或者，有人活着活着，就成了大大的青春痘上，一颗被代谢掉的小小青春痘。
 此后的无数夜晚，我听见路桥上满载煤块的深灰色火车隆隆驶过。它是费兰特笔下那不勒斯城区加之于我的一重隐喻，一种声音，许多具象、一种植物—— 攀枝花。
 而攀枝花也绝不仅只是攀枝花。 它是一个南方，或许也可能是所有南方。它是所有那些曾经充满了灯光和烟柱，以清洁换取发展、以阵痛为代价重新生长的青春痘城市。 小小一窝兔子的暴力，也是全部兔子的暴力。是全部以爆裂、放弃、悲剧为无可奈何的最终解，并最终被滚滚而过的发展作为“青春痘”而代谢掉的弱者的暴力。一种千百年来，不断被重写、被诉诸、又被泯灭的暴力。 它还会被继续写下去。

 作者丨一条攀枝花小狗 和 一只攀枝花小鲸 附图摄影丨一条攀枝花小狗",16.0,1.0,0
25,25,30289828,兔子暴力,1122da90259515758df9fe03ae9b0863,404f53e38d50b2e662c6eea5124c03ff,5.0,2021-08-17 01:56:45,注: 电影本身含有大量改编与艺术烘托，与真实案件有较大差异，勿将剧情代入现实，遵纪守法，远离犯罪。 《兔子暴力》剧照  故事发生在西南地区的一座重工业小城市，这里的天空中常年笼罩着厚厚的阴霾。水青同父亲、继母一家住在老旧的楼里，极度渴望见到素未谋面的亲生母亲。 而在十七年后的某一天，曲婷突然回来了。她有着体面的外表，精致的妆容，优雅地抽着烟。水青一眼就认出了这个她命中注定般的女人，去找她“借个火”，别扭的搭讪逗笑了曲婷。水青在暗中搞到了曲婷的联系方式，给她发短信 “我就想请你吃个饭，不会打扰你的生活。”，懂事又令人心疼。 令水青惊喜的是，一天放血后，曲婷的车停在学校门口，车里的曲婷微笑着看着她，让她上车。俩人很快成为了亲密的朋友。 随着日渐熟识，水青发现曲婷体面的外表只是一层虚假的壳，她其实是一个靠出卖身体赚钱的中年女人，逃回家乡其实是为了躲债。而这“烂透了”的生母并没有让水青失望放弃，水青义无反顾地陪在曲婷身边，保护她照顾她，最后为了让曲婷还上高利贷，设计了一场绑架案，并失手杀死了自己的朋友。（原案件中朋友来自一个幸福的普通家庭并且无辜丧命）。 何谓悲剧？这部电影本身就是一个巨大的悲剧。没有无缘无故的恶，恶有恶的源头。曲婷或许蠢且坏，可命运也没有善待她，她一步错，步步错，最后走上了犯法的不归路。而水青则像个小大人。从小缺失母爱，因而母亲对她来说有着致命的吸引力，策划犯罪时水青极度冷静，为了曲婷不顾一切。其他角色的人物塑造也都比较丰满——金熙脾气暴躁，喜怒无常，但背后是源自原生家庭的漠不关心；马悦悦的父亲本身是爱女儿的，可痛苦忙碌的生活让他如同一个火药桶一样易燃易爆炸，对女儿的爱尽数成了伤害。一切看似是巧合，实则又是一种必然，原生家庭带来的伤害难以磨灭，不负责任的父母或将酿成孩子一生的悲剧。 电影中存在大量描写暴力的镜头。曲婷断裂的小手指、马悦悦的父亲发狂般地剁案板上的鱼、老杜用力打向曲婷的耳光、掐住马悦悦时水青的歇斯底里……每一幕都令人胆战心惊。兔子暴力，弱者承受暴力，同时也作为施暴者，其背后的逻辑令人深思。 最后便是最吸引我的一部分，爱。水青看向曲婷的眼神是复杂的。母爱缺失的童年，躁动的青春期，还有如此美丽诱惑的女性……在同性与近亲双重的禁忌下，这种复杂的感情显得畸形又沉重。水青的爱义无反顾，阴暗生活中唯一的一抹光亮，拼了命地要去抓住。而在这段感情中，两人干涸的灵魂是双向救赎。 我愿意为你做任何事情 这部电影争议颇多，有人评判其三观不正，有人认为晦暗不明，有人认为烂尾。在我看来，比起犯罪片，这更像是一部糅合着心理、剧情、爱情的悲剧，电影本身令我感到相当震撼，如果你爱这种虚幻感与矛盾冲突，本片相当值得一试。,8.0,2.0,0
26,26,30289828,兔子暴力,1890914f00d9a0b871f9792727e4ae65,f43aa4a4d4727869eb495cbd166e94f2,4.0,2021-08-15 22:08:51,"首先，这是有部一定观影门槛的片子，适合静静地看。如果你是捧着爆米花进电影院，希望看点欢乐的、爽的剧情，时不时地还要刷刷手机，那抱歉，你走错片场了。但也希望你不要因为看不懂就给人打低到离谱的分。 看完最大的感触是：太苦的人，只要一点甜，就仿佛得到了全世界。为了捍卫这点甜，他们会豁出自己的全部，甚至毁掉自己的全世界。

故事：一个落魄小城里，母亲出走十多年后突然回到女儿的身边。女儿缺失了太多母爱，十几年来对母亲的诸多美好幻想，在这个美丽的妈妈出现时，一切有了投射。她跟妈妈说：“我愿意为你做任何事情”。 而这位突然出现的漂亮妈妈，并不是一个理想的妈妈，她愚蠢、没有主见、身上带着一堆麻烦，还有点脏。但在绝境时，她依然下意识地抱紧女儿说“妈妈在”“妈妈来搞”，然后把自己抛出去面对一切。 虽然我不太理解这对母女处理危机的方式，但我们永远不要只站在自己的角度去揣测别人的动机、评价别人的遭遇。

演技：奔着万茜来的，果然很绝。她给女儿打电话的那场戏，整个人的矛盾、恐惧、自我拉扯、崩溃又建设、建设又崩溃，从手指到声音的颤抖，还有后面哭戏的爆发，太强了。给我很大惊喜的是李庚希，之前没太看过妹妹演戏，这次发现她演技挺细腻的，敲门的那边演技好有爆发力啊。她身上有与她年龄相符的稚嫩少女气，同时又有一股疏离感，还蛮特别的。柴烨也演得很出彩，身上有一股狠劲儿。 
细节：电影中有许多隐喻和伏笔，需要认真推敲和联系，所以说如果静不下来或者没有认真看，真的会觉得味同嚼蜡且一脸懵逼。几个细节：比如马悦悦爸爸案板上的鱼、比如水青用橡皮擦填妈妈送手机壳的空隙、比如一些好似无意中说出的台词，涉及剧透的部分我就不多说了。
 画面是另一个出彩的地方，很美，有种胶片感，灰蓝的色调烘托出这座小城和故事压抑封闭的基调，而曲婷的亮黄色和整个灰蓝色调形成强烈冲击，带来了绚丽，也带来了危机。

剪辑方面，我觉得是有些遗憾的。可能由于过审和排片因素，预告片里很多镜头都没了，剪得有点碎。影片结束得也有点突然，大家都“完了？”这种反应。但其实，影片的结尾和开头是能续上的。案件交代的那个黑屏写着这部片子的教育意义，其实大可不必，这个故事完全有更多的意义和想象空间。 但作为一个导演的处女作，我觉得实属上乘。 最后：「每部文艺作品都有其灵感产生的过程，一部现实题材电影它可能借鉴了非常多真实案例，咨询过非常多相关领域的专家，最终呈现在我们面前的，也会是一部杂糅了诸多元素的艺术作品，你不能说它的原型是哪个孤案，也不能将它视作某个案件的纪录片或相关资料。」",13.0,2.0,2
27,27,30289828,兔子暴力,aaa1f65dc6d9d1b95c98ed70b3a92314,8c4cc2d7509a4f495c75c6af3abea67f,3.0,2021-08-15 14:42:06,就像老师给了个有深度的命题作文，却写出了篇很烂的青春疼痛文学。看得懂影片中的暗喻和某些拍摄手法，也知道中心思想的深刻严肃。但都是浮在水面上表层的油脂，轻轻撇去，你看不到真正深刻发人深思的东西，因为真正有意义的就是它影片结尾的那串白字，也就是那个已经既定的题眼。 说看得懂里面的暗喻手法，比如受害人爸在家杀鱼，有个镜头是他把鱼从鱼腹对半切开，但当他给女儿打完电话后，他把一半的鱼的正面完整地挂在了铁丝网格上。最后一个广角镜头拍到的是一个沧桑愤懑的中年男子在铁窗里，光线聚焦到了看上去是一条完整的鱼，但其实只是一半的鱼。我猜这是想表达女儿在干父母的呵护下光鲜亮丽的外表背后，是血淋淋破碎的内心和杂乱黑暗的原生家庭。 还有，水青去广播站读给金熙的道歉信，金熙在旁边试图阻止但阻止不了，满脸的于心不忍和悲痛欲绝。不关吧，她好几次抢走麦克风。真的阻止了吗？也没有，水青轻而易举地拿回麦克风继续广播。这时观众很容易读到金熙的内心是很想水青读这封信只不过碍于面子和所谓的友情。但那场戏拍得再细腻再煽情，我只目瞪口呆无法入戏。尽管里面的女生都有者悲惨的故事，但我只是觉得无病呻吟。仿佛以前小时代顾里倒红酒在南湘头上那名场面再现了。 其实电影应该想告诉我们还有很多细节伏笔藏在冰面下的。但我感觉是薄冰而已，因为经不起推敲，节奏混乱不分轻重，细节不连贯，琐碎的伏笔散落其中，你很难找到哪怕是其中一条故事线去跟踪。不知道是不是真的为了过审删了很多镜头，但我觉得就算再加回去某些东西，它还是烂片。 已经过了看疼痛文学的年纪，但不可否认疼痛文学毫无作用，它可以至少提高文笔水平。就像你单拎出一段描写得细腻的文字，你会觉得写得还不错，但通篇看下来会很苦闷。每一段都这样，很容易产生审美疲劳。,8.0,1.0,1
