,Unnamed: 0,电影id,电影名称,用户id,用户名,评分,评论日期,评论内容,有用数,没用数,回应数
4,4,30359340,南巫,5ffed6194a9773d86278ef4852257b89,5d1c108fd1f2549e76f7b8026edfd0a9,4.0,2021-08-29 01:25:25,"今天发了个朋友圈，朋友陆陆续续给我发来了《南巫》的资源，以为会是一部关于南洋降头的恐怖电影，没想到它会是一部暗含大马华人境遇的政治隐喻电影。 
故事的开头，是村民阿昌一家的日常生活，他是当地的原住村民，妻子阿燕也是外地的大马华人～  
有天，阿昌在驱赶神龛前的蛇，过程中不小心打破了邻居阿南家的木墙。阿南得知后找到阿昌家闹事，当晚阿南便因为车祸去世。从此，阿南的母亲便变得神神叨叨，晚上还对着阿昌的房子烧香点烛，中间还出现了一系列的宗教仪式镜头…… 
两个星期后，阿昌在田间捉鱼的时候突然晕倒，苏醒后呕吐不止，还吐出了三颗带锈的铁钉。从此，阿昌便一蹶不振，只得靠妻子阿燕扛起养家的重任。
三个月后，阿昌的病情仍然不见好转，妻子阿燕无奈只得求助当地的拿督公，拿督公狠狠批评了阿燕这么晚才求助他的做法，说她的丈夫是因为在山上撒了尿，惹怒了山神娘娘，叫她让丈夫喝下符水，再去祈求山神娘娘的原谅。 
回到家，半信半疑的阿燕在恍惚间烧干了拿督公给的符水。没办法，只得一个人去祭拜着山神娘娘的象屿洞。 
在洞里，阿燕见到了山神娘娘化身的神秘女子，神秘女子躲在山洞的角落，告诉阿燕她的丈夫被下降头并不是因为受到了山神娘娘的诅咒。山神娘娘本名珂娘，是古时候泉州的一名公主，乘船南下来到了暹罗国，被当地的巫师看中，却不愿委曲求全，最终被巫师施法落在了象屿山。公主是心善的，绝不可能会因为这些小事而惩罚阿燕的丈夫。 
这下，阿燕彻底没了头绪。回到家，看见两个儿子站在屋外，原来是丈夫起床砸坏了窗户，吓得两个孩子不敢回家。  
安抚了精神失常的丈夫，丈夫阿昌告诉阿燕，有邪灵要来召唤他带他走了～ 
画面一转，阿南的母亲又开始做法。夜深人静，独自外出的她在马路上看见了死去的阿南，母子二人抱作一团，泪流不止～ 
最后，在友人的帮助下，阿燕找到了已经退隐多年的巫师。巫师一眼看出阿燕丈夫的经历，却因自己已退隐江湖不肯救助阿昌。在阿燕和友人的软磨硬泡下，巫师还是决定帮助阿燕一家。
根据巫师的指引，阿燕需要用圣水洒在家门大树的周围，再用开过光的匕首插在大树上。一旦发现了什么意像，就需要把脏东西抱在黑布里，然后扔进大海。至于丈夫阿昌能否痊愈，就全看老天的造化了～  
按着巫师的方法操作一通，阿昌果然不久便出现异样，咆哮着窗外大树上的邪灵马上就要带自己走了。 
阿燕赶紧来到了门口的大树下，从地里看见了前些日子家里丢失了衣物。慌乱中，阿燕赶紧用黑布包裹住这些衣物，驱车来到了码头。（开车过程中出现了本片中最高能的镜头，邪灵趴在车上，跟着阿燕来到了码头） 
此时已是深夜，阿燕来到码头已没有愿意带她出海的船家。绝望的阿燕又遇到了山洞里山神娘娘化身的神秘女子。她用闽南语给阿燕说着，自己可以带她出海。 
船上，邪灵就在阿燕的背后，神秘女子告诫阿燕千万不能回头，在经过短暂的思想斗争后，阿燕最终把装走脏东西的黑布包裹扔进了海里。 
第二天，疲惫的阿燕在船上苏醒。神秘女子唱起了歌，告诉她丈夫已恢复正常。往这一望无际的大海，她却说自己回不了家乡，自己的边界就在这里。  
回到家，丈夫阿昌已经恢复了正常，身体也随着时间的推移逐渐康复。后来，他成了一名巫师，为有相同遭遇的人提供帮助（我忘了后面的注解了，差不多就是这个意思。）
 
分割线……
如果你已经看完看着了我的解说，可能会疑惑为什么会说它是一部政治隐喻电影，其实就体现在电信的细节上。  
电影里，我至少听到了马来语，普通话，客家话，暹罗方言等不下四种语言，就体现出马来西亚作为移民国家，语言文化的多样性。 
为了维护各自的民族文化，各方民族可谓煞费苦心。阿燕的一个儿子因为在学校不说华语而被罚站，而阿燕在咨询拿督公的时候，因为找了翻译被拿督公大骂为什么不说马来语，就体现出各民族的排他性。 
关于被谁下的降头，电影其实并没有明说，而是通过拿督公自以为是的解释，将所有的不幸都归咎于来自中国的山神娘娘。 
而看起神通广大的山神娘娘，却只能躲在暗黑潮湿的山洞，她的化身甚至都不敢直面前来参拜的人，在最后解救阿昌的过程中，也只是起到了一个辅助作用。可见她并没有拿督公所说的那样神通广大，无恶不作。甚至她自己，都是因为被巫师下咒，被迫留在了象屿山。 
而失去了话语权的山神娘娘，就这样成为了当地人口中小气动不动就下降头的反派角色。不仅背井离乡，还遭人陷害，这辈子也回不到家乡，说到底，她才是电影里最悲惨的角色。也不禁让人想到马来西亚五一三事件中饱受迫害的华人群体，甚至整个东南亚的华人群体～他们不也是背井离乡想要新的生活，最终不少人却在民族冲突中客死他乡？ 
回到故事开头，总的来说，借助导演的镜头，我看到了1987年经过马来西亚五一三事件后大马华人生活的小心谨慎，失去的话语权的他们也逐渐被当地人污名化，所以在学校里更要保护好自己的民族语言～ 
其实关于电影，我还有一点不懂，就是那个在电影中段出现的那个在田里跳大神的角色。他到底是人是鬼？如果你看懂了，欢迎在我的评论区下方留言，咱们一起讨论。",44.0,4.0,16
