,Unnamed: 0,电影id,电影名称,用户id,用户名,评分,评论日期,评论内容,有用数,没用数,回应数
0,0,30359340,南巫,d68532adac1716df5a706f72d7b6b5e0,2ec5ce56c55e60304c6143772daa41cd,4.0,2021-08-30 02:36:54,*本文所用剧照版权归片方所有  作为一个在北马马泰边界长大的乡村孩子，我能深深的理解为何许多网友们看不明白这部电影。因为马来西亚的各个地区（简单划分为北马、中马、南马和西马半岛）本身就存在着文化差异，甚至中马地区的朋友都不一定能理解电影里的一些背景。就拿我的经历来说吧，我前段时间离开了马泰边界的家乡，到了北马的一个城市去工作。经一番交流，我惊讶地发现，我的同事甚至都不知道，原来北马地区还存在着暹人（大马暹星裔/大马泰裔）这样一个族群，更不用提那些文化背景了。在这篇文章中，我将简单地介绍一些我自己经历与了解到的马泰边界文化背景，让网友们能够更了解电影中发生的事。  皮影戏 片头的皮影戏名为Wayang Kulit，是马来西亚传统民俗表演，同时也是马来西亚的非物质文化遗产。皮影戏一般演的都是兴都教（印度教）的神话故事，据说是19世纪从印尼爪哇引进的，在与本地文化结合后，衍生出了马来皮影戏独有的特色，并以马来语为媒介来呈现。   伯公像  女主右手边祭拜的佛尊为伯公，是北马当地人祭拜的主要神像之一。神桌上方一般会配一个红灯泡，24小时不关灯。  传统排屋木房 越来越少见的中式马来西亚传统排屋木房。   拿督公像 拿督公，一般乡下的人会请一尊在家门口或是院子，出入山林前祈求拿督公庇护。阿昌所说的蛇是拿督公的化身是本地人流传的一种民间传说。一般在祭祀神明或祖先时，若祭祀点附近出现小动物，都会被认为是神明/祖先的化身。前面的供品有咖喱鸡、黄姜糯米饭、青柠、烟草、栳叶等。  天官坛 红色的神坛为天官坛，一般请在家门口。坛上的牌位一般写有“天官赐福”四字，一般都在每天傍晚上香拜一下。   阿昌家  这应该是Kaew姨在出发回泰国前在阿昌家施法下的降头。在马泰边界，一般巫师分为马来巫师（bomoh）和泰国巫师。我所闻的泰国降头一般最明显的征兆为吐铁钉、吐头发、浑浑噩噩、神志不清等。   阿昌家 绿色的旗子应该为拿督公旗子。   阿昌家院子 在北马，一般乡下的家庭都会在自家院子或是空地种些香草和蔬菜，例如小米椒、咖喱叶、香兰叶、葱花等，需要用到的时候就去自家院子摘一下。   阿昌家客厅 一般在边界的家里电视都会接收到泰国的电视频道和电台。背景祭祀的为伯公像（上）和土地公牌位（下）。    80年代教育部试图通过“3M制”、“综合学校计划”“华小集会用语事件（规定华小集会必须使用马来语）”、“华小高职事件（委派不谙华语华文者出任华文小学中的正副校长等职务）”使华小变质。影片中多次在电视与报纸上出现的新闻都在说这件事，可以当作本片的暗线去解读。    背景都是晒海鲜的平底篮子，女主正在挑小鱼鱼骨，准备晒鱼干。    本地的童谣和小游戏，类似剪刀石头布。   神龛 田伯爷神龛，马来语称为“Jelapang Padi”。祭祀品从左下顺时针开始算起为：梳子/胭脂、米浆水粉、槟榔荖叶、纱笼布、鲜花、镜子、稻穗、中间插着的为Kuku Kambing（羊指甲）。羊指甲是古早的一种插秧的工具，一般会插秧后放置在神龛里守护稻田，直到这一季收成。  邻居与女主的对话 田伯爷据说是暹罗的神明，庇佑田地的。长辈一般都不会让小孩靠近并破坏农民幸苦栽种的庄稼，因为当地民间传说流传着：这种行为可能会冒犯田伯爷，而田伯爷就会回暹罗，不庇佑田地了。     此片段为田伯爷之舞 据导演科普，田伯爷是无固定形态的。在当地马来文化Semangat Padi中，田伯爷的化身一般分为好预兆和坏预兆。当田伯爷化身为「年轻漂亮的女人」，夜晚出现在田间或者是神龛里梳妆或唱歌，就代表这一季的稻田将会长得和女子般“美丽”；化身为「白发妇人」则代表这一届稻田将会早熟，收成丰富。反之，当田伯爷化身为「眼镜蛇、黑水牛、大象、长发长须的男人、持拐杖老人」等比较刚硬的形象出现在稻田中，则代表田伯爷被触怒、遭人下降头（稻田不止可以下在人身上，也能下在稻田和物品）或是有灾害即将发生，稻主需要请巫师来察看情况，并开办「祭宴」来化解。 在当地华人文化中，田伯爷则无形态，也没有化身。当地华人会祭祀糕点等。  课堂罚站 马来西亚华文小学鼓励学生说华语（普通话），说方言就会被处罚。   老师劝女同学写已改过的名字 暹罗裔/泰裔、马来人、原住民在马来西亚都归类为土著，并有保护土著权益的相关优待政策。改名成泰文名之后就可享受相关政策。   擦黑板 黑板上的话：”我们国家，马来西亚，是个由各个种族组成的多元文化国家。其中的种族包括马来人，华人和印度人。每个种族都富有各自的民俗文化，例如特色服装…”  女主车上神符 一般信佛的当地人都会挂佛牌/符咒等庇佑出行平安。    皮影戏幕后 Kaew姨一行人举行招魂仪式 一般出车祸去世的死者家庭都会举行一场招魂仪式，把死者的灵魂招回家。 Kaew姨 Kaew姨身上的披肩是一条印着“祝君平安”的白色毛巾，一般会在丧礼出殡当天派送给往生者的家属，擦拭泪水和汗水。     一般乩童被神明上身之后，会做出一些神明的肢体习惯，和神明所说的语言。在拿督公乩童的桌上出现爪威拼写课程与左边一看发财的中奖书暗喻着这乩童不是真的，而是神棍，因为拿督公身为马来裔本来就应该会爪威拼写，而是不需要相关课程书籍的。 乩童由导演张吉安饰演。   右上角祭祀的牌位为灶君 灶君一般被当地人供奉在家中的厨房。据民间传说，灶君向火，能给家里的事业/生意带来好运。因此，一般灶君都供奉在炉灶附近。     山中的祭祀点 在大马，很多山洞中都设有庙宇。山中与女主对话的应该是珂娘本人，因为她所说的闽南语为泉州口音，而不是已本地化的福建话。后面背景响了祷告乐，女主听闻，便说天色晚了，要回家。背景响的音乐为穆斯林祷告的经文。此次的祷告为每日中的第四次（Maghrib），时间为当地时间晚上7:27左右，也正是当地日落的时间。   后面的大缸为水缸，储存洗澡水用的   高脚屋 马来巫师的家为高脚屋，现在在乡下地区还能看见，也算大马的一种传统建筑了。80年代，首相马哈蒂尔·穆罕默德实行政教合一政策，马来文明逐渐伊斯兰化，许多巫师解降师转职成为伊斯兰教宗教司，便有了影片中送出解降器一幕。导演在采访中曾说到，他的父亲在“中过”降头之后，为了保护自己和家人，便跟随解降师学习解降。   灵体/小鬼 阿昌被下的降头应该是灵降。灵降是指巫师利用自己养的灵体或是小鬼去加害受害者。图中的妖怪应该就是Kaew姨养的灵体/小鬼。   出海 在进行祭祀、火葬尸体、烧金纸等活动时，民间流传着不要回头这一说，因为会看到不该看见的东西，尤其是祭祀亲人的时候，据说会看见亲人，而让祂产生舍不得、留恋人世间的念头。   珂娘 片尾曲《出山关》由饰演珂娘/船主的演员云镁鑫演唱，导演张吉安填词。   我的一位生在北京的好友与我一起观赏了这部影片，并且和我做了大量交流。以下是他的观点：很多人把《南巫》当作惊悚片甚至恐怖片来观赏，这本身就是错的，也违背了导演的初衷。《南巫》的预告片很平，简单的叙事、写实的风格，没有一惊一乍，与近期热搜《咒》《哭悲》《灵媒》等亚洲恐怖片预告大相径庭。这种先入为主的观念与我们现在生活的大环境也有很大关系，往往我们会把不了解、不理解甚至不愿了解的未知超自然现象都划归为坏的、恐怖的，加以宣传炒作，就很容易把这类现象与相关作品扣上个帽子。降头、巫术这些听到就很吓人的词语对于一个敬畏神明的国度来说，真的再正常不过了，不准成精这样的说辞就不再适用了。希望大家在快节奏生活中能广泛了解慢慢沉淀下来的各国优秀文化，而欠张导的这两张电影票，只能等下个月北影节的时候还了。 补票来了～   撰写：肆囍 琼岛搓澡师 编辑：肆囍 琼岛搓澡师 公众号：aoicoco,429.0,1.0,114
1,1,30359340,南巫,d1534c08e71c3891e2b9d4a7887f3f27,eb7344552a6cb6eac22d7fed7a52e4f2,4.0,2021-04-11 05:23:11,"南巫剧照 
阔别了10年，张吉安以《南巫》重新将马来西亚电影带回金马奖的舞台。《南巫》和邵氏在70到90年代的降头片不同，电影中没有人头降满屏飞，也没有降头师与解降师之间的斗法对决，取而代之的是极度写实化的长镜头和故事。1987年，阿燕的丈夫阿昌与暹罗裔的邻居发生争执。有一天，阿昌在稻田里捉鱼时突然晕倒，怪事也接连不断发生：阿昌食不下咽、从口中吐出生锈的铁钉、终日无精打采，疑似被下降头。来自南马的阿燕由最初的不信邪到最后四处求医问卜，希望能早日医好丈夫的‘怪病’。《南巫》乍听之下是一部邪典恐怖片，但骨子里是彻头彻尾政治片。张吉安通过不同意象的运用推展剧情，拍出了一部独属马来西亚华人的离散史。 
电影中其中一个最重要的意象就是降头。降头是怨恨的转移，是将自己对对方的怨恨通过某种神秘的力量转移到对方身上，让受害者生不如死的一种手段。电影中的阿昌因不小心冒犯了其他人而被人下降头。阿昌的身体在被下降头后就备受困在二楼的床上，无法自理生活。阿昌身上的降头所隐喻的是当时华人社群的失语症。当时的茅草事件是一个削弱华人社会地位的手段，通过关闭中文媒体和控制华人教育机构来以保障统治群体的特殊地位（status quo）。当时的排华情绪导致了华人社群有怒不敢言，以免五一三事件再度上演。通过电影中的降头让观众看到的是一个华人在高压政治氛围地下的压迫状态，是一个赤裸裸的政治隐喻。 
但张吉安并非单纯地控诉社会的不公或清算历史，而是以此去探究潜藏于马来西亚华人身体里的身份认同问题，借以探讨华人离散身份与这片土地的关系。象屿山在电影中更是一种文化符号，同时也是对于马来西亚华人离散身份的诘问。象屿山的前身是一艘来自中国的船，载满的除了满仓的稻米还有无尽的、回到故乡的渴望。象屿山在电影更像是一种文化乡愁的符号，但是这个文化符号已被在地化：吉打州的人民，带着纱笼和槟郎来祭拜这位来自异乡的公主，仿若要将这件不属于她的衣服强硬穿到她的身上。象屿山与珂娘公主只是一个引子，张吉安通过这些符号的构建将观众引领到自我的身份认同。我们的祖先对于这片土地有着怎么样的感受？我们又是怎么看待我们与原乡之间的关系？我们应该怎么看待这片土地？张吉安将这些问题的答案放在两尊神像上。 
电影中出现的两尊神像便是马来西亚华人离散史的标志。这两尊很常出现在东南亚华人家中神坛的神像分别是拿督公与土地公。拿督公是东南亚一带（尤其是马来西亚与新加坡）华人较常祭拜的神衹之一。拿督公是巫裔，而且通常都被安放在家门外；而土地公则是来自中国的神衹，通常都被安放于家中神坛。在《南巫》里的其中一个镜头，摄影机通过门上的破洞在偷窥门外的拿督公，好似家中的土地公通过洞口观察门外的拿督公，提防他干什么坏事似的。马来西亚华人祭拜当地的拿督公以祈求庇佑，但是还是没办法阻止降头的降临；而家中的土地公似乎也在这片土地失去了功效，只能眼睁睁地看着家中的人受苦受难。这不仅仅是电影中华人离散的标志，同时隐喻了华人社群在那个年代的不安感和不同族群之间高度紧绷的关系。 
《南巫》通过运用不同的意象和符号刻画了马来西亚华人的离散史，将黑暗的1987年雕刻在影像上，同时诘问华人在这片土地上的认同。附在阿昌身上的降头则是一个政治隐喻，是一个引出当时华人失语症的一个引子。象屿山则是对马来西亚华人身份认同的诘问，引领观众进入对离散身份的诘问。两尊神像在电影中不仅仅是华人离散史的标志，也是对当时高度紧绷的种族关系的注解。这三个意象的使用相辅相成，构建了一部马来西亚华人离散史的诗意画卷。张吉安二十年磨一剑，将多年以来身为文史工作者的经历和经验沉淀，完成了这部高完成度且令人惊艳的处女作。  首发于sindie.sg
原文网址：https://www.sindie.sg/2021/04/2020-review-story-of-southern-islet-chi.html",275.0,8.0,27
2,2,30359340,南巫,37616036ae5ec1342b93d5db61e01c32,7e96959e911c2193f04a347e23752a1b,4.0,2021-08-28 17:52:16,巫界 巫界 边界 边界 人与边界，巫界 影片的最开头说了这是一个人与边界，巫界的故事，这是整个影片的主题。 人界主要是女主角，女主角老公，阿kaew姨（巫师)，tam伯（巫师)。 巫界那名男子（骑象巫师/田伯爷)是从木屋上下来的，基本可以确定不是人界，是受到巫师嘱托，来下降头的。全白皮肤的，是巫界实施降头的，偷衣服的就是他。 边界我的理解有两种意思，一种是灵界，一种是结界。泉州公主和阿南都是已死之人，存在于与活相对应的死的世界，我就叫它灵界。他们可以被人看见，就是存在两个世界相通的可能，称为结界，结界在人，灵界，巫界之间都有相通的可能，最后三种关系存在于一条船上。 理解这三种意思在看电影，就会很容易把电影看懂。  八月电影的开始，男主在拜拿督公，后不小心把对门阿南的门板打坏了（追赶拿督公显灵的眼镜蛇时）。晚上阿南前来闹事，男主赔了20块钱，阿南即去买门板，被卡车压死。 做法事前的镜头 阿kaew姨在做法事 做完法事后切的镜头，暗示与树有关 阿kaew姨当晚就得知儿子死亡的消息，就连夜下降头。由镜头可以看出，拍摄做法事的机位在2楼男主睡的房间，反之，就是在对男主下降头。最后阿kaew姨走了，还给大树镜头，很明显在暗示，降头和树有联系。这个法事需要稻草人，铁钉，拿督公，以及运用田伯爷神龛的，衣服分析不出来是不是主要道具 男主晕倒的地方 田伯爷神龛 阿kaew姨遗留阵法 巫界下降头 八月在稻田仪式后结束，这段稻田仪式我认为是在阿kaew姨在神龛摆好法阵后（就是阿kaew姨对2楼男主做法之前），巫界男前来下降头的。仔细看男主晕倒时和稻田仪式时的田，可以看出有无水稻，个人不觉得不是穿帮，而是结界的存在。 九月 阿kaew姨做法事     九月， 阿kaew姨回来做法事，她说法事的目的是带阿南回家的。法事又是在神龛这完成，最后也如愿见到了阿南的灵魂（影片中第一次出现人与灵同一个世界的场景)。这可以说明阿kaew姨是一个巫师，可以有打通结界的本领，神龛再次被用到。（阿南鬼魂好像没头，应该是直接卡车压头，后面巫师Tam伯说不可以说今晚去找他做过法，看出来做法应该有反噬。阿kaew姨也是巫师，反噬到儿子身上，最后男主还被阿kaew姨下降头，有点惨。括号这段是过度理解） 十月   泉州公主出场 十月，女主去见了信拿督公的神棍，神棍让女主带东西去象屿山洞找山神婆婆（泉州公主)赔罪，这样男主就会好了。到山洞后，讲述了一个巫师给泉州公主下降头的故事（仔细看前面，两个小孩看电视，跳转到泰国节目，节目里的台词应该就是形容巫师的内心的)。这个故事表明，山神婆婆是好的，还证明了男主信仰的拿督公并帮不了他，同时这是第二次人与灵同一个世界。 埋鸟 挖出衣服和稻草人 在男主的小鸟死后，埋小鸟时没发现衣服，后面却出现了衣服，这也表明结界的存在，是通过Tam伯的法器打破的。女主最后要把tam伯交代的几样东西到海里丢弃，女主来到码头，工人告诉她这几天都没船，而且泉州公主说她可以送女主出海时，几个工人是听不见的。船上那一段同框算是收尾呼应，最后在一首《出山关》的歌曲中影片结束。 其实这部影片还有其它很多细节，比如换个名字可以上大学，泉州公主说自己再也过不了这个结界回家，女主生活的艰难等等  以下是拿督公，田伯爷，山神婆婆的猜想 拿督公 拿督公是用小箱子放家门口的 对面阿南家有也一个 这是泉州公主讲骑象巫师下降头时的镜头，巫师是对着拿督公的。 最后女主看见海里拿督公刺稻草的镜头 这里可以分析一下，10月份背对镜头那个巫师应该是泉州公主说的那个骑象巫师，对面是有灯的（骑象巫师可以像泉州公主一样出现在这个世界)，感觉是降头的最后仪式，要直接让男主死的仪式。最后女主看见海里拿督公拿手上的东西穿过稻草，我认为稻草象征着田伯爷，稻草是接下来要分析的。 田伯爷   稻草 嘴里叼着稻草巫界男 田伯爷神龛这骑象巫师首次出场 邻居说阿kaew姨回老家，田没人看，田伯爷不久就跑回暹罗了。一种解释是阿kaew姨是祭拜田伯爷的巫师，没人祭拜了自然就走。另一种是田没人看，田伯爷不庇佑荒地。我偏向于第一种，毕竟又不是只有阿kaew姨家有地。祭拜的道具里有稻草，那个巫界男嘴里叼的也是稻草，在田里下降头。我前面之所以说骑象巫师可以像泉州公主一样出现在现世，是骑象时也是有路灯的，而且下个镜头就是对着拿督公做法，都是白衣服。我这里认为他们祭拜的田伯爷其实是这个骑象巫师，跳稻田舞下诅咒那个也是他。 山神婆婆     山神婆婆是被巫师陷害的，女主来这里是被信拿督公的神棍骗来的。Tam伯说找华人神坛求医，华人就是信田伯爷，拿督公，Tam伯还说就是信了邪神才会惹上的。这里我把山神婆婆归于好的一类，被世人抛弃，最后帮女主的也是山神婆婆，田伯爷，拿督公则是降头的一方。 个人认为降头步骤:1.阿kaew姨田伯爷神龛祭拜2.回到家中对男主做法下降（标记位置）3.稻田舞下降头4.骑象巫师根据标记来到标记位置到拿督公前做法下降头  这个过程导致男主病情加重，并可能死亡。 以上涉及迷信，信仰，宗教的分析及猜想仅是对影片内容的分析和猜想，不涉及现实。,122.0,2.0,42
3,3,30359340,南巫,657c3681dd3b86ae0aaf0f0def2eb05e,574d16b2616b454c55c87499503b2950,5.0,2021-08-28 18:04:26,我查了一下吉打好像就是马来最古老的地区，然后又是文化历史最复杂的地方被多种文化殖民统治过，导演没有用一丝对当地复杂文化铺垫，只是通过女主这个新山华人的进入就把整个主题立起来了。就是借主角老公生病求医，从这个外来人视角把那个地方各种不同信仰的人的文化串连起来。电影里面一直话外音的电视（文化多元融合推广）同时现实中对地方信仰知识的打压边缘化（不许说方言、打击巫医），其实也通过主角的行动和不同人物台词来体现了外来文化和本地文化之间的冲突和共存的过程。最初互相排斥到最终互相接受，其实边界依旧存在只是多种文化相互妥协，这部电影真的太丰富了，但是它最厉害的是它这么复杂的内涵它就是用最简单干净的方式拍出来了。,28.0,1.0,0
