,Unnamed: 0,电影id,电影名称,用户id,用户名,评分,评论日期,评论内容,有用数,没用数,回应数
13,13,30468854,秋寒江南,de88650d0b96a2e1d03e7a889280d782,36fe579e1a35632823bc433edd34202d,,2020-03-29 17:20:53,古龙创造了一个流星蝴蝶，天涯明月的时代，从那之后无数人追逐武侠曾经的风采，却再也无法得见那种名剑风流。 而透过《秋寒江南》，我们在这个故事的最深处又一次见到了那个属于中年人的梦——尽管不客气的说，这个梦被做得稀碎。 无论是海报还是宣传短片，又或者是开场时说书人的背景音，都给人一种老派、有腔调的复古感，故事一开始就是箭在弦上不得不发之势——夺镖的商山四皓，护镖的四平镖局，风萧萧兮易水寒，无名镖师惊天一剑，画面转成港漫风，相信不少有点年纪的观众看到这里也会心潮澎湃，激荡不已，以为剑还是那把剑，武林还是那个武林。 港漫风的开场结束，接着是各怀鬼胎的江湖人上场，如果说刀司空和说书人的言辞交锋仍能镇住场子，那也就不得不提到，当浅浅开口时，这个梦的节奏立刻就奇怪了…… 江湖是武侠迷的梦，盲女浅浅是时非我的梦，清风徐徐来，柔光拼命打，时非我和浅浅的相识充满了粉红色气泡，上一幕浅浅无缘无故为一个醉鬼付了酒钱，下一幕醉鬼时非我牵着浅浅出门去捉萤火虫看星星，从诗词歌赋聊到人生哲学，万万没想到镜头再一转，从星空下的小言梦又变成了不孤独的美食家。 这里其实有个隐藏的联系，时非我爱上了盲女浅浅，为了治好她的眼睛，与她归隐江湖，时非我才必须在镖局里争出一番地位，这样才有机会和掌握了宝贵医疗资源的司空平交换条件，治好浅浅。 但这个“隐藏的联系”一撤掉，这一段就让人如坠云里雾里，为啥上一幕还在谈恋爱，下一幕就抢肉吃？顺带一提，子母剑出手，胜了两个镖头后，时非我从锅里捞了一块带骨肉上来，咬了一口就吐掉了，这肉到底好不好吃，作为观众的我是真的很在意……而上一幕刚吃了肉，下一幕俩人又继续夜里荡舟湖上，从诗词歌赋再次聊到人生哲学，这就又很让人跟不上气氛和节奏了。 当然，在吃肉和谈情间快速切换气氛还不是什么难事，圆月之下，忍者悄无声息破水而出，这一幕转化成漫画风是相当自然，也相当惊艳的，但下一幕冰姬出现了，当她如风一般，带着特效出现的时候，惊艳效果还没结束，但当特效结束了，冰姬巨大的出戏感随之也跃出荧幕。毛茸茸的春丽头，软绵绵的泡泡纱，最要命的是冰姬的脸没上对妆，而持续打给浅浅的柔光又没分到她这里，于是这位剑灵强烈的Cosplay感再也无法遮掩，直接尬出天际。 与剑灵冰姬同等尬出天际的还有红衣美人龙九，我能感觉到导演抓着我的衣领的咆哮音，“她很美！她真的很美！看看她的特写！还有回忆里的大·特·写！”，但是龙九那个爆肝打游戏才会有的憔悴脸色是怎么回事！楼兰断壁，白骨蜿蜒，美人赠我黑眼圈，何以报之……讲不下去了。 类似的问题在电影里随处可见，但到了放马滩之战才变成一个巨大的灾难，刀客拔刀，出刀，Cosplay风的冰姬冲进荧幕里，按下时间暂停，带着一脸娇羞，将天罚剑奉上，刚刚被刀客与时非我之战勾出的肃杀之气在这一瞬间被玫红色给冲洗得真真正正干干净净，这个口红色系真的不适合亚洲人，尤其不适合古典武侠电影中的亚洲人，请服化道下次高抬贵手，放过玫红色，谢谢了。 正经地说，每当镜头转进客栈里时，角色们之间心怀鬼胎，勾心斗角的场景都是颇为好看的，百里无赦娓娓讲起天罚剑的过去，故事讲完，老人阴恻恻的眼神扫过去，司空平了然于胸的假笑，一桌子都是江湖上有名有姓的体面人，做起缺德事儿也一脸的仁义礼智信，如果说什么地方有江湖味儿，这里就是江湖味儿最足的地方。 要说导演没有品位，我是绝对不同意的，圆月下的忍者，铸剑峰上的惊天一战，放马滩倭寇小弟背后一剑，画面都是刚刚好，韵味十足。 但忍者之后接冰姬出场，背后一剑之后接预算明显不足的放马滩场景，这都立刻让人有种跳跃感和泄气感，甚至让观众的感情无法连贯的宣泄。 当然，最割裂的莫过于放马滩众人刚刚拔剑而上，立刻接上了一个冰姬独白，独白过后的无人机视角又把河滩上的预算暴露得清清楚楚明明白白，尽管后面补上时非我开大的特效，但仍然可以说是把梦做了个稀碎。 和《秋寒江南》一样，节奏有问题靠美感往上堆观众好感度的电影还有很多，印象最深的一个是《妖猫传》，这个不断追寻杨贵妃死亡真相的故事被男一和男二寻寻觅觅搞出了好几个版本，但不管节奏如何稀碎，观众们仍然记得极乐之宴的瑰丽与梦幻，记得灯火通明的花萼相辉楼，记得李白吟出《清平调》时深情的泪水，记得贵妃回头时的一个眼神。所谓倾国，所谓倾城，能让人在那一瞬间把节奏剧情历史全部丢进废纸堆，只专注于转瞬即逝的美梦，电影的“美”的力量莫过于此。 《秋寒江南》有没有“美”的力量，我认为是有的，这是“梦”存在的必要性，但一部好电影所需的远不止是一个美丽的清梦，你还得把梦做完整，不能碎，这才是最重要的。浅浅是时非我的梦，花家是时非我的现实，当那个轻盈美丽的梦消失之时，江湖与现实重叠起来，时非我又回归了他注定的人生之路，他的江湖是承担起许多责任的江湖，无法逃避。有人说武侠是成年人的童话，既有瑰丽的画卷，又有缱绻悠长的琴声，但更有现实中的种种缩影，大概武侠的乐趣与苦楚都在于此了。,,,0
14,14,30468854,秋寒江南,4b1db2372893aeee84b4c0f3341ffea0,e480fd705f4f7f991c166d606072e401,,2020-03-29 16:44:09,你说他是烂片，他确实蛮差的！他的逻辑你永远弄不明白！比如进门一个不认识的卖艺丫头和瞎子大叔给一个烂酒鬼买了单！比如一个镖局聘请镖师的时候不是正常考察一下业绩，而是阎王殿里一样的抢肉吃！镖局在古时候也是个正当生意好嘛，不是土匪恶霸！打架那些也是打的你不懂！可能说要还原民国之前的真实感！也说不清楚！后面各种你都离不清楚的关系和莫名其妙的伤感什么牵挂，我总觉得这故事里的每个人都是自己做死的吧！正常人都不会这样啊！然后看了一圈下面那些评论都是拖！不需要观看这个电影！甚至连个图个爆米花打斗情节都没得！这是个音乐渣，人物渣，逻辑渣，打斗也渣的电影！不要浪费时间了！,2.0,,0
15,15,30468854,秋寒江南,4b59220e200efb9cfce3036c1a8d07d1,c62659530fb0d731c9b1f22c8a4c2156,,2020-03-27 16:39:23,sadadsaaaaaaaaaaaaaaaaaaaaaaaaaaaaaaaaaaaaaaaadasssssssssssssssssssssssssssssssssssssssssssssssssssssssssssssssssssssssssssssssssssssssssssssssssssssssssssssssssssssssssssssssssssssssssssssssssssssssssssssssssssssssssssssssssssssssssssssddddddddddddddddddddddddddddddddddddddddddddddddd,,2.0,0
16,16,30468854,秋寒江南,af7d9124ab077b91b45d138c1b052be0,f26ad073e289971c1a888f4d117b1d71,3.0,2020-03-27 15:21:23,《秋寒江南》讲述了默默无闻的镖师时非我(孙健淇饰)一剑挑四皓，从此名声大噪并成为了四平镖局的总镖头，并被委以重任护送江湖宝物——神龙令后发生的系列故事。护镖途中险象环生，各路杀手为了截获宝物接连登场，时非我生死未卜。彼时，一间小客栈，镖师女友浅浅(刁秋语饰)和说书人爷爷 也被另外一群江湖高手围困，意欲威逼浅浅，引出时非我和他背后的宝物神龙令、天罚剑以及更多神秘的宝藏。,,1.0,0
17,17,30468854,秋寒江南,fedf794401b826f0a3a77806b1c60bb4,41ede17a862dfe0641438545cc40b91f,3.0,2020-03-27 13:58:57,这部电影的名字秋寒江南听着非常有古风。让人想去看这部电影。但是看电影的时候，嗯，看了简介之后就会觉得这是一部很简单的电影，很有趣是值得一看的，但是在看的过程中呢，电影的有些地方表现得非常的繁琐复杂，让人摸不清楚路线。总之这部电影还是值得看看的。电影中的动作非常的吸引吸引人。然后再看的时候忍不住去模仿。这可能就已经达到了看电影的中等境界吧，融。,,1.0,0
18,18,30468854,秋寒江南,609a4b2f1f7f7338e5dee80355231b03,69715eb188e29c205b736d7b9f7aa858,5.0,2020-03-25 02:46:42,人就是江湖，离开的方法只有一个。那就是死。。。 七杀山庄的少庄主苏少友，让我想起了金老先生笔下的东方不败。这并不是对古龙先生的不敬。虽然我从来没看过古龙先生的任何一部小说。但相信江湖里从来就不分你我，有分精彩与不精彩。。 苏少有的剑一出必要见血，七杀山庄的由来或许是七步之内必要杀死一个，如果不行就杀了自己。当然这只是我一个市井之徒肤浅得想法。能取这名的必当是武功盖世天下无双。这不由让我想起了《三少爷的剑》里的剑神。我觉得苏少有和他以及那另一个江湖的东方不败都有着一个共同点。剑可断天下之物，却断不了自己的情丝。东方不败是由男人变成了女人，为练《葵花宝典》不惜自宫。而我更愿意相信苏少有本是女娇娥，又不是男儿身。只不过生在了必须要以男人的身份过日子的地方而已。命运总是弄人，却始终改变不了冥冥中的相遇。苏少有和时非我在桥头豪饮时，时非我用男人的眼光看着一叶湾舟上的盲女。而苏少有则像女人一样看着时非我。 江湖最残忍的地方不是杀戮，而是无奈。苏少有再见时非我时已是要杀他，不杀背叛与江湖，杀背叛与自己。人就是江湖，背叛江湖和自己都是最难的。苏少有最后选择逃离江湖。当苏少有最后依偎在时非我的肩头上的时候也许那个才是正真的她。 苏少有的剑刺向别人的时候是江湖，而刺向自己的时候则是爱。 苏少有是我在这部片子里觉得最接近于江湖的人物。能够让我看到东方不败都的影子还要说什么了？ 江湖就该像苏少有这样的，既能相浓以沫与江湖，也能相忘于江湖。,,1.0,0
19,19,30468854,秋寒江南,5edaf92d52493aba2895aecaa84e8b90,384cdca011d2219b5d3e9ac2cfbd98ea,4.0,2020-03-22 21:45:13,"今天看了一个电影：秋寒江南。 看的过程总有种似曾相识的感觉，看到最后才知道我的感觉没有错。     电影的确有古龙的味道。 出道即巅峰的少年
人人利己主义者的武林阴谋，悬疑，反转，金句…… 作为一个古龙迷，看这个电影，既开心也不开心。
 开心的是古龙人不在江湖，但江湖还是流传着他的传说。
 不开心的就是电影拍得不够好，虽然有内味了，可惜瑕不掩瑜，看完电影只有最后一句致敬让我有一点感动。 看了这个电影，我更想说一说古龙还有生活。 在当时的武林文坛中，古龙就像他书中出道就巅峰的主角一样，无名小辈大放异彩，一己之力搅动整个江湖。
  227 环境塑造了你。一个人的性格往往在小时候就养成了。 浪子，最好地诠释了古龙。
浪子，最离不开的就是两件事，酒和兄弟。
 古龙染上了酒，染上了借酒消愁，染上了与兄弟拼酒的江湖义气。 酒带给了他许多，带走了忧愁，带来了灵感，也带来了肝硬化，48岁就肝硬化回天乏术，实在是令人惋惜。 兄弟，带来了武林，也给生活带来了江湖。 兄弟如手足，女人如衣服。对女性的贬低是古龙书的一个不好的特点，但这一点恰恰就显示出了古龙对女性的态度。 爱情伤透了古龙的心，于是他选择了浪子，将爱情尘封，那么，心再也不会痛了吧！
 当上帝为你关了一扇门的时候，一定会为你开一扇窗。
 尘封的心，带来的是一种特殊的视角，能让你从容不迫地观察这个世界，因此，古龙书中常常有引人深思的金句。 尘封的心也带来了灰色的世界。因此，江湖充满了血腥，也充满了对抗世界的酒与兄弟。 如果你的生活灰色是主旋律，请给自己多一抹亮色。
如果你的生活彩色是主旋律，也请给别人多一抹亮色。 最后祝愿各位都能有古龙的才，也有彩色的世界。",,1.0,0
