,Unnamed: 0,电影id,电影名称,用户id,用户名,评分,评论日期,评论内容,有用数,没用数,回应数
3,3,30468854,秋寒江南,d39c7027f914189eacfba5b1f983fb6d,08a4e9a2e266bacef5e4375db9e536c5,5.0,2020-03-08 16:39:28,古龙创造了一个流星蝴蝶，天涯明月的时代，从那之后无数人追逐武侠曾经的风采，却再也无法得见那种名剑风流。 而透过《秋寒江南》，我们在这个故事的最深处又一次见到了那个属于中年人的梦——尽管不客气的说，这个梦被做得稀碎。 无论是海报还是宣传短片，又或者是开场时说书人的背景音，都给人一种老派、有腔调的复古感，故事一开始就是箭在弦上不得不发之势——夺镖的商山四皓，护镖的四平镖局，风萧萧兮易水寒，无名镖师惊天一剑，画面转成港漫风，相信不少有点年纪的观众看到这里也会心潮澎湃，激荡不已，以为剑还是那把剑，武林还是那个武林。 港漫风的开场结束，接着是各怀鬼胎的江湖人上场，如果说刀司空和说书人的言辞交锋仍能镇住场子，那也就不得不提到，当浅浅开口时，这个梦的节奏立刻就奇怪了…… 江湖是武侠迷的梦，盲女浅浅是时非我的梦，清风徐徐来，柔光拼命打，时非我和浅浅的相识充满了粉红色气泡，上一幕浅浅无缘无故为一个醉鬼付了酒钱，下一幕醉鬼时非我牵着浅浅出门去捉萤火虫看星星，从诗词歌赋聊到人生哲学，万万没想到镜头再一转，从星空下的小言梦又变成了不孤独的美食家。 这里其实有个隐藏的联系，时非我爱上了盲女浅浅，为了治好她的眼睛，与她归隐江湖，时非我才必须在镖局里争出一番地位，这样才有机会和掌握了宝贵医疗资源的司空平交换条件，治好浅浅。 但这个“隐藏的联系”一撤掉，这一段就让人如坠云里雾里，为啥上一幕还在谈恋爱，下一幕就抢肉吃？顺带一提，子母剑出手，胜了两个镖头后，时非我从锅里捞了一块带骨肉上来，咬了一口就吐掉了，这肉到底好不好吃，作为观众的我是真的很在意……而上一幕刚吃了肉，下一幕俩人又继续夜里荡舟湖上，从诗词歌赋再次聊到人生哲学，这就又很让人跟不上气氛和节奏了。 当然，在吃肉和谈情间快速切换气氛还不是什么难事，圆月之下，忍者悄无声息破水而出，这一幕转化成漫画风是相当自然，也相当惊艳的，但下一幕冰姬出现了，当她如风一般，带着特效出现的时候，惊艳效果还没结束，但当特效结束了，冰姬巨大的出戏感随之也跃出荧幕。毛茸茸的春丽头，软绵绵的泡泡纱，最要命的是冰姬的脸没上对妆，而持续打给浅浅的柔光又没分到她这里，于是这位剑灵强烈的Cosplay感再也无法遮掩，直接尬出天际。 与剑灵冰姬同等尬出天际的还有红衣美人龙九，我能感觉到导演抓着我的衣领的咆哮音，“她很美！她真的很美！看看她的特写！还有回忆里的大·特·写！”，但是龙九那个爆肝打游戏才会有的憔悴脸色是怎么回事！楼兰断壁，白骨蜿蜒，美人赠我黑眼圈，何以报之……讲不下去了。 类似的问题在电影里随处可见，但到了放马滩之战才变成一个巨大的灾难，刀客拔刀，出刀，Cosplay风的冰姬冲进荧幕里，按下时间暂停，带着一脸娇羞，将天罚剑奉上，刚刚被刀客与时非我之战勾出的肃杀之气在这一瞬间被玫红色给冲洗得真真正正干干净净，这个口红色系真的不适合亚洲人，尤其不适合古典武侠电影中的亚洲人，请服化道下次高抬贵手，放过玫红色，谢谢了。 正经地说，每当镜头转进客栈里时，角色们之间心怀鬼胎，勾心斗角的场景都是颇为好看的，百里无赦娓娓讲起天罚剑的过去，故事讲完，老人阴恻恻的眼神扫过去，司空平了然于胸的假笑，一桌子都是江湖上有名有姓的体面人，做起缺德事儿也一脸的仁义礼智信，如果说什么地方有江湖味儿，这里就是江湖味儿最足的地方。 要说导演没有品位，我是绝对不同意的，圆月下的忍者，铸剑峰上的惊天一战，放马滩倭寇小弟背后一剑，画面都是刚刚好，韵味十足。 但忍者之后接冰姬出场，背后一剑之后接预算明显不足的放马滩场景，这都立刻让人有种跳跃感和泄气感，甚至让观众的感情无法连贯的宣泄。 当然，最割裂的莫过于放马滩众人刚刚拔剑而上，立刻接上了一个冰姬独白，独白过后的无人机视角又把河滩上的预算暴露得清清楚楚明明白白，尽管后面补上时非我开大的特效，但仍然可以说是把梦做了个稀碎。 和《秋寒江南》一样，节奏有问题靠美感往上堆观众好感度的电影还有很多，印象最深的一个是《妖猫传》，这个不断追寻杨贵妃死亡真相的故事被男一和男二寻寻觅觅搞出了好几个版本，但不管节奏如何稀碎，观众们仍然记得极乐之宴的瑰丽与梦幻，记得灯火通明的花萼相辉楼，记得李白吟出《清平调》时深情的泪水，记得贵妃回头时的一个眼神。所谓倾国，所谓倾城，能让人在那一瞬间把节奏剧情历史全部丢进废纸堆，只专注于转瞬即逝的美梦，电影的“美”的力量莫过于此。 《秋寒江南》有没有“美”的力量，我认为是有的，这是“梦”存在的必要性，但一部好电影所需的远不止是一个美丽的清梦，你还得把梦做完整，不能碎，这才是最重要的。浅浅是时非我的梦，花家是时非我的现实，当那个轻盈美丽的梦消失之时，江湖与现实重叠起来，时非我又回归了他注定的人生之路，他的江湖是承担起许多责任的江湖，无法逃避。有人说武侠是成年人的童话，既有瑰丽的画卷，又有缱绻悠长的琴声，但更有现实中的种种缩影，大概武侠的乐趣与苦楚都在于此了。,17.0,2.0,5
4,4,30468854,秋寒江南,855b558df7d2a692d42dad278f8e77e0,a819481ed6b5ed8e79d894d157929fd3,5.0,2020-03-10 01:18:22,"桃李春风一杯酒，江湖夜雨十年灯。有酒的地方就有浪子，有浪子的地方就有红颜，有红颜的地方就有争端，有争端的地方就有杀戮，有杀戮的地方就有尔虞我诈，尔虞我诈更显兄弟情深。一句话，有人的地方就有江湖。
《秋寒江南》跳出了传统爆米花电影模式，影片整体叙事风格采用倒叙，插叙，顺序三种叙述模式，通过旁白，引述，自述等丰富方式展现情节，整个观影过程中牵引观众随影片情节同步思考，是一种致敬《东邪西毒》式的电影风格尝试。
影片是一部唯美的山水片，影片开头江南烟雨，小桥流水，吴侬软语，如泼墨般的山水画，让观众情不自禁会想起古龙小说的《剑花烟雨江南》；而中间护镖情节中的大漠黄沙，又使观众不禁感受到”大漠沙如雪，燕山月似钩”的苍茫凄凉。画面整体色彩偏暖，偶尔穿插昏黄，斑驳之影，此外幽暗的镖局，阴森的古庙，老破的船头，恰到好处为情节增添诡谲之气的渲染。
这是一部快意恩仇的武侠片，带着古龙浓浓的风格色彩，刀不出鞘，出鞘必杀人。男主角不像古龙小说中的香帅，西门吹雪，更像中原一点红，外表高冷，心底温暖，浪子情怀。可以和一见如故的对手对酒当歌，歌罢来一场胡一刀和苗人凤之间的君子比试；也可以和出卖自己的同伴割袍断义，船头喋血。最终厌倦的江湖浪子归隐田园协红颜坐看秋月春风。
这是一部儿女情长的爱情片，我看不见你，却读懂了你的心。人海之中，有的人天天相见仍陌生如初，有的人纵然一面便是今生永远。情人之间，不需甜言蜜语，只需一句话，然后或携手，或独行，感情不拖泥带水，为了情人更美好，放弃自己的原则，放弃归隐，重新再走江湖路。
这是一部悬念丛生的悬疑片。护镖路上，一路刀光剑影，阴谋诡计，各路人马，五花八门，或明抢，或按夺，以武力，以智谋。烘托出一个复杂人性的江湖。
这是第一部二次元电影。漫画和实景巧妙结合，于无声处也有惊雷。
也这是一张灵动的音乐cd，古筝，琵琶，长笛，一曲柔情蜜意，一曲豪气云天。
电影美中不足之处是短短100分钟，却要塞下千种江湖。各路人马都平均分享时长，导致重点不突出，情节有突兀。不如精简场景，减少人物，细化剧本，减少漏洞，这样才能更好的诠释出制片方，导演等工作人员对本片的创作意图和主题。当然如果改成电视剧也不失为一部好的电视剧。
今朝酒醒苦短，来日未必方长。神仙眷侣江湖游，归隐李下瓜田。",7.0,1.0,0
5,5,30468854,秋寒江南,fe89661dec434b64549b9ecfcea4d851,b5941b7c45d1552fe1c2fdebc7e01fd7,,2021-08-24 23:27:13,请原谅我复制，我只想说这是一场成人礼，成人礼，成人礼，成人礼，成人礼，成人礼，成人礼，成人礼，成人礼，成人礼，成人礼，成人礼，成人礼，成人礼，成人礼，成人礼，成人礼，成人礼，成人礼，成人礼，成人礼，成人礼，成人礼，成人礼，成人礼，成人礼，成人礼，成人礼，成人礼，成人礼，成人礼，成人礼，成人礼，成人礼，成人礼，,,,0
6,6,30468854,秋寒江南,f7c682cc4c7798e312617c5282c7ffd5,04254644fb0b2c45e241c9acab5fd36c,2.0,2020-12-19 09:41:54,"感觉扶桑二刀流很出名，即使时非我刻意隐瞒，好多人仍旧认得出来，那个七杀公子女扮男装看起来很别扭，虽说影视剧里女扮男装是烂大街的打扮，可是本狼看这个角色总觉得很别扭，前半部是妥妥的武侠片，到后半截又莫名其妙变成魔幻剧，编剧比较轻松，台词抄了很多句子，叔叔跟嫂子眉来眼去的好狗血，弄了半天也没看出来娶老婆和继承家业有什么冲突的，用得着分开么。片尾说致敬古龙，特意查了一下，不是古龙作品改编的，这么硬蹭人家太不要脸了。

总评二星2分，动不动就倒叙插叙，人物又多，各条线程都没交代清楚，龙九和七杀莫名其妙的就跟大叔有纠葛了，没头没尾乱七八糟，漫画场景不是说要求你禁止使用，问题是你能不能在正确的场合使用。女猪脚很漂亮，很温柔。男猪脚并没有把角色该有的气质表现出来，台词念出来完全不是那么一回事。",,,0
7,7,30468854,秋寒江南,6ea3859aaeca3cfaf2e28290454bd603,cc150b2d92d6a4ccedc0b4fe4280c067,5.0,2020-09-01 10:41:12,此时非我 第一次看的时候以为会有很多打斗场面，才符合我对武侠的要求！可是看了两遍过后，才发现每个细节所要标的的东西太多了，也看得出来导演对武侠的诠释，对江湖的理解，已经看了第三遍了，每一遍都有不同的感悟和新的理解 放马滩那段打戏，时非我一声“剑来”配上重金属摇滚的背景音乐，瞬间燃爆全身血液。第一次看到中国武侠打斗配上摇滚，这个创意很不错，效果很好 结尾那段时非我策马扬鞭，放弃了很多，奔向未来奔向使命，也许这就是江湖，就是整部剧要表达的精髓所在吧！,,,0
8,8,30468854,秋寒江南,73f4320f294d1b5049f42bdbc2a96eb1,543236b0bb1e7f48bc4384cfe5b0afc2,4.0,2020-08-06 21:30:17,这部电影打着致敬古龙的旗号并非虚言，无论是功夫、台词、感情处处透着古龙小说的韵味，可见创作团队是花了心思的。本来这么好的一个剧本设定加上不错的演员们，八分以上不算过分，但是剪辑有点混乱。懒人觉得它在模仿楚留香最后一部午夜兰花那样，众人你一言我一语就把故事的来龙去脉给交代清楚，为此不惜加入动漫的方式来快进剧情，可惜插叙得不够流畅。特别是主角生活经历太过丰富，改名了好几次，需要一定的理解力。如果把天罚剑和神龙门的大背景前置交代清楚，效果会更好，即便如此，懒人还是愿意分享推荐这部电影。  神龙令当年的出现是为了阻止天罚剑蛊惑众生，两百年前一个少年龙一为了阻止这场武林浩劫横空出世，他约天下群雄在峨眉金顶了结一切。龙一最后拿出神龙令，见此令神龙门有求必应，专管江湖不平之事。天罚剑有剑灵名冰姬，择主白衣少年余惊澜，少年执剑入魔血洗了铸剑峰。武林各派追杀，武当道人约余惊澜比剑，却提前被人下了化功散，这笔账也算到了余的头上。 另外，海外萧谈笑自称七海贼王，他把所有财富搜刮起来，官府连同神龙大侠龙八对其清缴，但宝藏的秘密却被时非我带走。朝廷惦记这批宝藏，但萧谈笑早已分发给百姓，时非我既是萧谈笑也是余惊澜也是花家二少爷。  三个月前，四平镖局走镖被黑道四皓所拦，一个下等镖师出手力挽狂澜，这样的故事出于说书人之口，而真正的江湖也由此开始。 主角也就是这个下等镖师叫时非我，和说书人的孙女盲女浅浅结识。四平镖局局主司空平举办开锅大会，意在能者吃肉，时非我一手子母剑技压众人成为镖头。时非我押镖离开杭州时，司空平带人找上了盲女浅浅。原来时非我为了找鬼医杜仲为浅浅治疗眼疾，作为押送神龙令去川西的条件，时非我答应了。但是时非我离开后，司空平以他可能是扶桑人为由，有意抓浅浅为人质。 时非我前往川西途中遭嘉州镖局秦烈等人围攻，但秦烈却被废掉一根手指，所以也来找浅浅的麻烦，刚好同司空平遇到。六扇门铁锁薛神捕、七杀山庄百里无赦都来此寻时非我，几人你一言我一语，要共擒此人各取所需。花家花大公子也是狠人，为了花家为了时非我，真的是命都豁出去了。 时非我一路押镖惊险万分，没想到一切都是一个局，直到冰姬受伤，他决定再次拿起天罚走火入魔大开杀戒。若非神龙门红衣女龙九出现，怕他也无法自控了，想不到花家二少爷与龙九也有一段情。  江湖无眠夜，时非我回到酒馆救回浅浅，其他人结果可知。开放式的结局很古龙，懒人甚至更期待这是第二部的彩蛋，因为他配得上拥有续作，最好是有一套系列电影。,1.0,,0
9,9,30468854,秋寒江南,592d2d808fcada706bfa31765525ac4e,cc48fd094aa05292747f8b25163f3dc0,3.0,2020-07-25 01:14:10,偶然看到片名和简介，很久没看过新鲜的武侠，结果谁知道一尝鲜就踩了雷。 一开始的气氛还是营造的不错的，但看的时候我妈在旁边吐槽：太夸张了吧，女主角是个盲人，听到呼噜声就知道这是谁了？的确，非常夸张非常强行，他俩反正就是要有交集，逻辑已经不重要了。 当影片里出现第一句日语的时候，我还能哈哈大笑，不错，有点新东西。但是越来越多日本元素出现，七海贼王，忍者，分身术，有几场打斗出现的字体也很有日本书法的风味。加入这样的元素到底有无必要？除了让我想到火影海贼，觉得不伦不类之外，好像没有起到什么特别大的作用。 看完之后的我问号满满，云里雾里。首先从男主人公的性格来说，个人感觉似乎在极力塑造一个洒脱的形象，但实际上时非我太多时候不是被他人被环境束缚，而是被自己的欲望和情感牵绊。剧情上讲，各路人马聚集在客栈，一层一层揭开了时非我的真实身份和过往人生经历，但是很多都没有细讲只是一笔带过，比如他为什么要去拔天罚剑，和龙九有什么关系，与七杀公子如何成为知己的，天天仅是喝酒想必不至于成为这样舍命之交。留白这么多，也有可能这些我疑惑的都不是重点。那么什么才是重点？这部影片到底想要传达什么，看完了，我也没有找到答案。 尽管如此，整片看完也没有非常非常非常非常糟糕。我有感觉到是想把这个故事讲好，并且在镜头和画面的处理上有亮点。我希望下一次，能够看到更有逻辑和重点的故事。,1.0,,0
10,10,30468854,秋寒江南,c9bca26ad8dfb89cf062fa4f09506faf,943f41ca37ed4cf16c55d7b21a2731f6,3.0,2020-04-23 13:13:33,说实话吧，这电影剪辑得除了很碎，很迷。。。剧情设定和拍摄手法太蜜汁装逼了，致敬古龙却没古龙半点文艺气质，虽然结合了各种唯美武侠范儿的场景如江南月夜、小桥流水、凉亭抚琴、大漠黄沙，但是感觉都是堆砌，剧情不但冷冰冰还看得人云里雾里的，有点无病呻吟的神逻辑。 就拿主角来说，你是得有多少主角光环啊，这么多个马甲？又是一剑挑大腕的无名镖师、又是当年威震江湖的海盗头头、又是天罚教主（or剑主？）、最后还是什么花家二少爷，你是得有多开挂啊，一个人能干这么多事儿？古龙的主角再怎么有光环，也没你马甲多。苏软儿和苏少友有嘛关系吗？苏软儿是主角他哥的新婚老婆，大婚当天被主角抢婚了？她不还是龙一的徒弟？然后主角他哥不仅不生主角的气，还一个劲地劝主角回家，就是因为主角太能打，有本事振兴他们花家？然后苏少友跟主角的相识也很迷，这两人的惺惺惜惺惺的友情刻画得太单薄了，不知道怎么来的。这些个人物关系，太错综复杂了，恕我智商不够看不懂。然后湖边小筑里一群各路人马在那里用嘴巴推进剧情，为主角的装逼推波助澜，说得那是个头头是道的，666。 整体观感，剧情俗套+矫揉造作+意识流。,,,0
11,11,30468854,秋寒江南,de88650d0b96a2e1d03e7a889280d782,36fe579e1a35632823bc433edd34202d,,2020-03-29 17:55:43,桃李春风一杯酒，江湖夜雨十年灯。有酒的地方就有浪子，有浪子的地方就有红颜，有红颜的地方就有争端，有争端的地方就有杀戮，有杀戮的地方就有尔虞我诈，尔虞我诈更显兄弟情深。一句话，有人的地方就有江湖。 《秋寒江南》跳出了传统爆米花电影模式，影片整体叙事风格采用倒叙，插叙，顺序三种叙述模式，通过旁白，引述，自述等丰富方式展现情节，整个观影过程中牵引观众随影片情节同步思考，是一种致敬《东邪西毒》式的电影风格尝试。 影片是一部唯美的山水片，影片开头江南烟雨，小桥流水，吴侬软语，如泼墨般的山水画，让观众情不自禁会想起古龙小说的《剑花烟雨江南》；而中间护镖情节中的大漠黄沙，又使观众不禁感受到”大漠沙如雪，燕山月似钩”的苍茫凄凉。画面整体色彩偏暖，偶尔穿插昏黄，斑驳之影，此外幽暗的镖局，阴森的古庙，老破的船头，恰到好处为情节增添诡谲之气的渲染。 这是一部快意恩仇的武侠片，带着古龙浓浓的风格色彩，刀不出鞘，出鞘必杀人。男主角不像古龙小说中的香帅，西门吹雪，更像中原一点红，外表高冷，心底温暖，浪子情怀。可以和一见如故的对手对酒当歌，歌罢来一场胡一刀和苗人凤之间的君子比试；也可以和出卖自己的同伴割袍断义，船头喋血。最终厌倦的江湖浪子归隐田园协红颜坐看秋月春风。 这是一部儿女情长的爱情片，我看不见你，却读懂了你的心。人海之中，有的人天天相见仍陌生如初，有的人纵然一面便是今生永远。情人之间，不需甜言蜜语，只需一句话，然后或携手，或独行，感情不拖泥带水，为了情人更美好，放弃自己的原则，放弃归隐，重新再走江湖路。 这是一部悬念丛生的悬疑片。护镖路上，一路刀光剑影，阴谋诡计，各路人马，五花八门，或明抢，或按夺，以武力，以智谋。烘托出一个复杂人性的江湖。 这是第一部二次元电影。漫画和实景巧妙结合，于无声处也有惊雷。 也这是一张灵动的音乐cd，古筝，琵琶，长笛，一曲柔情蜜意，一曲豪气云天。 电影美中不足之处是短短100分钟，却要塞下千种江湖。各路人马都平均分享时长，导致重点不突出，情节有突兀。不如精简场景，减少人物，细化剧本，减少漏洞，这样才能更好的诠释出制片方，导演等工作人员对本片的创作意图和主题。当然如果改成电视剧也不失为一部好的电视剧。 今朝酒醒苦短，来日未必方长。神仙眷侣江湖游，归隐李下瓜田。,1.0,,0
12,12,30468854,秋寒江南,de88650d0b96a2e1d03e7a889280d782,36fe579e1a35632823bc433edd34202d,,2020-03-29 17:55:37,桃李春风一杯酒，江湖夜雨十年灯。有酒的地方就有浪子，有浪子的地方就有红颜，有红颜的地方就有争端，有争端的地方就有杀戮，有杀戮的地方就有尔虞我诈，尔虞我诈更显兄弟情深。一句话，有人的地方就有江湖。 《秋寒江南》跳出了传统爆米花电影模式，影片整体叙事风格采用倒叙，插叙，顺序三种叙述模式，通过旁白，引述，自述等丰富方式展现情节，整个观影过程中牵引观众随影片情节同步思考，是一种致敬《东邪西毒》式的电影风格尝试。 影片是一部唯美的山水片，影片开头江南烟雨，小桥流水，吴侬软语，如泼墨般的山水画，让观众情不自禁会想起古龙小说的《剑花烟雨江南》；而中间护镖情节中的大漠黄沙，又使观众不禁感受到”大漠沙如雪，燕山月似钩”的苍茫凄凉。画面整体色彩偏暖，偶尔穿插昏黄，斑驳之影，此外幽暗的镖局，阴森的古庙，老破的船头，恰到好处为情节增添诡谲之气的渲染。 这是一部快意恩仇的武侠片，带着古龙浓浓的风格色彩，刀不出鞘，出鞘必杀人。男主角不像古龙小说中的香帅，西门吹雪，更像中原一点红，外表高冷，心底温暖，浪子情怀。可以和一见如故的对手对酒当歌，歌罢来一场胡一刀和苗人凤之间的君子比试；也可以和出卖自己的同伴割袍断义，船头喋血。最终厌倦的江湖浪子归隐田园协红颜坐看秋月春风。 这是一部儿女情长的爱情片，我看不见你，却读懂了你的心。人海之中，有的人天天相见仍陌生如初，有的人纵然一面便是今生永远。情人之间，不需甜言蜜语，只需一句话，然后或携手，或独行，感情不拖泥带水，为了情人更美好，放弃自己的原则，放弃归隐，重新再走江湖路。 这是一部悬念丛生的悬疑片。护镖路上，一路刀光剑影，阴谋诡计，各路人马，五花八门，或明抢，或按夺，以武力，以智谋。烘托出一个复杂人性的江湖。 这是第一部二次元电影。漫画和实景巧妙结合，于无声处也有惊雷。 也这是一张灵动的音乐cd，古筝，琵琶，长笛，一曲柔情蜜意，一曲豪气云天。 电影美中不足之处是短短100分钟，却要塞下千种江湖。各路人马都平均分享时长，导致重点不突出，情节有突兀。不如精简场景，减少人物，细化剧本，减少漏洞，这样才能更好的诠释出制片方，导演等工作人员对本片的创作意图和主题。当然如果改成电视剧也不失为一部好的电视剧。 今朝酒醒苦短，来日未必方长。神仙眷侣江湖游，归隐李下瓜田。,,,0
