,Unnamed: 0,电影id,电影名称,用户id,用户名,评分,评论日期,评论内容,有用数,没用数,回应数
83,83,34894753,沐浴之王,e34726348f99ffc53a2351cb072280d5,8bb1e28f80e803e5dee3c2a7396339c3,3.0,2021-02-13 11:52:41,整片中规中矩，剧情逻辑没法深究，但是整体笑料还是有的，笑点基本全在大保健之父乔杉身上。 整体的剧情概述，一个富二代纨绔子弟（彭昱畅饰），继承澡堂的家业，垄断了一个地区的沐浴市场；同时也雄心大志要把沐浴文化推向国内外做大做强。但奈何只是个空包弹，对管理和商业有研究，对实际的搓澡技术却一窍不通。 另一个主角就是我们的大保健之父乔杉，有着一手的高超搓澡技术，拿了搓澡比赛的金牌冠军。却因为错误信任了一味朋友，签下了一堆的担保协议，致使赔款成为老赖。最终为了家庭生计不得不把祖传的最后一个澡堂卖了。 殊不知，这个澡堂阻碍了一个地产公司的开发，开发商雇佣了小贩以低价和各种威胁收购澡堂。 彭昱畅酷爱翼装飞行，却在一次飞行中，被自己信任的大表哥做了手脚，出现意外坠落，失去了记忆。然后与乔杉二人相遇。乔杉和彭昱畅两人矛盾起伏打打闹闹中，建立深厚的革命友谊，二人如兄弟般亲人。感受到了彼此的关爱和重要性。笑料和情感的迸发也在这阶段产生。 最后故事的结局，自然是彭昱畅恢复记忆继承家业做大做强，同时感受到了老大哥乔杉的真情，二人共进发展了沐浴文化。 说实话，故事有点俗套了。 但作为一部爆米花喜剧电影，整体还是合格的。你要从中悟出什么大道理，有什么价值观上的提炼，那就有点假了，但其中一个切入点，确实是我们此前没有关注过的：沐浴和澡堂。 在常规的印象中，各种洗浴中心，搓澡桑拿，都是灰色地带，难免带些颜色。 这种擦边球的题材，是最吸引人的眼球，能够勾起了内心的好奇和欲望，所以一开始的预售票房还是不错的。后面发现电影根本就不是一回事，既没有曼妙女郎，也没有粉红灯光，更没有戴着金链左拥右抱的土大款进出。 所以本质上，这是一部披着搓澡文化皮囊的“”变形记“”，二代下乡体验生活最后深化，穷屌丝凭借着真性情感动富二代从而走上人生巅峰。 里边的一个故事很有意思，彭昱畅搓澡的时候把乔杉背上的痦子给搓下来了，这让我们知道原来痦子是可以被扣掉的。。。 我们知道，一个喜剧要能产生笑果，最重要的前面的铺垫和后面的包袱。铺垫得足够自然，包袱得足够巧妙，包袱和铺垫还得有一定的势能产生出乎意料的结果。 回忆电影中的搞笑片段...说实话我记不太出来了。这大概就是爆米花电影吧，吃过了就不会剩下什么了。,,,0
84,84,34894753,沐浴之王,08665bacb2e8c19a916b4656c912c380,1610028a963becfbb9cb7fdc61859a5a,5.0,2021-02-12 23:19:44,有些人过于挑剔了！其实片子本身还是有8分的水准的，稍微有些逻辑不通。喜剧佳作！希望易小星与万合天宜能有更多的好作品！！！！！！！！！！！！！！！！！！！！！！！！！！！！！！！！！！！！！！！！！！！！！！！！！！！！！！！！！！！！！！！！！！！！！！！！！！！！！！！！！！！！！！！！！！！,,1.0,0
85,85,34894753,沐浴之王,0a9605ed66b9ccdc25047e1fdc97c323,f0887cabce830fadebbfa1741def0e3c,3.0,2021-02-12 22:47:14,"年初一，看了部喜剧《沐浴之王》，觉得还不错。

主演之一是筷子兄弟的乔杉，里面也出现了经典的女装镜头，就是小苹果MV里面的造型。另一个主演一开始大家猜是郭麒麟，后面发现是彭昱畅。想想郭麒麟应该演技没那么好吧。

觉得好的之一是喜剧，有一些夸张的表演，但是不是那么浮夸，比如彭昱畅的演出。

想想里面让我笑的点有：

一开始乔杉接待讨债的人的时候满嘴违心话的不违和镜头，如果没有后面一堆人和一车货，还真以为哥俩好呢。

还有就是为了伪造富二代肖翔是自己弟弟，周东海让妹妹使用技术换了脑袋，然后每个视频，肖翔都是一个表情，看着前方，没有啥表情的那种。

有点尬，想了半天也就想到了这两个比较精彩的地方。其他，更多的还是励志版。比如失忆的富二代改头革面变得勤奋，平和，然后还用自己的聪明才智帮助澡堂子起死回生。最后假哥哥教了他从生活中学会搓澡，加上他自己的努力，靠比赛勇夺真正意义上的洗浴冠军。

然后还有温情，富二代被亲表哥遗弃，跟陌生的澡堂子一家处出了感情。半吊子的哥哥，粉丝小妹妹，还有老年痴呆的奶奶。电影应该是想表现互相的照顾体谅，但是演出来的更多的是富二代对塑料亲戚的照顾和体贴。然后翻过来也让家人更加感动。

然后，我要说但是了。看的时候爱奇艺评分有8.7，我确定了一下才看的，看完了，想查具体演员的时候又搜索了一下豆瓣，得分6.2，然后我就各种卡壳写不出来了。也不知道是这个评分对我的影响，还是确实就那样。

后来想，提到喜剧就不得不说周星驰，那些电影都在脑子里面，是不是真的现在的这些电影跟周星驰的差距那么大呢？其实周星驰最有名的喜剧之王，我是有点欣赏不来的，那个嗦鼻涕的镜头让我一直有点恶心，是不是这也达到了他的目的，让我留下深刻的记忆？想想，周星驰的电影，看的最多的大话西游系列，台词都让人过目不忘，经典的有：人是人他妈生的，妖是妖他妈生的。想起来一次就可以笑一次。但是，他也有他的内涵在里面，有一些戏思才可以理解的悲情，比如最后说的那句：好像一只狗。

所以，国产的喜剧还是要加油呀，上次看过的《囧妈》比最近看的两部还是好一点，继续发掘更好的喜剧电影吧。",,,0
86,86,34894753,沐浴之王,d625975b3a04db64806703932b671e40,3752ddf7cc0fd9fd2c58b162df3f6958,,2021-02-12 21:38:48,"🌟总体评价：说实话我真的觉得这个片子的剧情很好，本土化，搓澡这个文化也是很有趣的。还有关于一些社会问题的思考真的非常不错。喜剧的底色做得很好，很有有笑点，乔杉是真的很不错，彭彭的尝试也挺好的。就是虽然富家子弟有点跳戏，可能是没那方面的气质吧[喵喵][喵喵][喵喵]但是高光时刻还是有的，特别是最后的搓澡片段，虽然不是专业人士，但是也看得出来是有训练过的吧
整个片子的节奏非常好，前有伏笔后有照应。故事的推动也很有趣，高潮迭起，对于生活的片段很有意思。对于现在网络社会，个性化的发展也是很棒的思考，就是那个兄弟澡堂。
应该去影院看的，有点可惜。",,,0
87,87,34894753,沐浴之王,e3b822942c177d9e510a85a115aa150c,4e73044c134f5b615d0e2e1e5c676af6,5.0,2021-02-11 01:58:10,2020年10月27日，集旅游、酒店、餐饮、休闲、娱乐的东方巴黎人在缅甸第二特区佤邦孟波盛大开业，便瞬间以一流的接待、服务与管理标准以及顶级的娱乐体验，获得包括香港演员曾志伟、吴孟达，歌手大壮等在内的一众明星叫好和声援。开业即爆满，那么东方巴黎人为什么如此受欢迎呢？    明星打卡圣地 香港演员曾志伟、黄一飞、吴志雄、吴孟达盛情邀约，歌手大壮、广东雨神、李明翰亲自支持，全球不限身份，普通人都可以体验的明星网红异国定制酒店，东方巴黎人让更多人在这里实现自我。      国家持牌经营 东方巴黎人是在缅甸获得联邦政府许可、持牌经营的娱乐城，安保措施严格，规章制度完善。场子服务好质量高，全天海选，停车方便。休闲会所，筹码会所，游戏娱乐等等，打造孟波第一个“娱乐集团”。      东方巴黎人全球顶不局限于一隅，异国风情，独特体验，东方巴黎人，您的缅甸消费娱乐首选！,,,0
88,88,34894753,沐浴之王,3ffa103630f632f2ab8a6a1e2f80c914,9d9a9e665b1f42e9ff8c5c58fe205081,4.0,2021-02-11 00:32:07,没事做，在优酷闲逛，《沐浴之王》会员免费了。 情节确实有些老，但这些还是会感动人，加上里面宣传的一些正能量，还是值得一看的。 乔杉配上沐浴，一个非常完美的组合。但是片中大多数表演的却是彭昱畅，演惯了翻转的电影，这个也是没有问题。从《爱情公寓》出来的展播比之前更好了，多了成熟的一面，少了稚嫩的气息。,,,0
89,89,34894753,沐浴之王,650fec4e03f889b0910e32c0ad874693,1001d7dc16cb36152d6e4f8de84516b1,,2021-02-10 20:51:51,装模作样，搞得好像自己很懂的似的，看一部影评居然带入了自己平日里的一些想法，评一部影评会客观？我都不想反驳一些楼主的拙见。当你把自己带入到影片的角色中时，你会发现你说的一些缺点都是没有问题的，而且《沐浴之王》作为一部喜剧片已经到达了它的效果了，没有很尬的情节，后面发生的事前面基本都做了铺垫了，麻烦多去多看两遍再说剧本是的问题OK？你这么一针见血你怎么不去当电影的编剧，你能想到的人家编剧想不到，那你可是真厉害。排除演技上的一些小问题，整部电影没有什么毛病，还用了隐喻蒙太奇等等剪辑手法，不知道那些瞎掰掰的人是这么编出来的？以后成为某q平台的视频小编的时候记得叫我去看哦。（不服的就在下面评论，咱们探讨探讨，看你在电影这方面懂得多还是我懂的多，拒绝喷子）,3.0,2.0,22
90,90,34894753,沐浴之王,ee08cfedd69771e527685e4f533fd120,9176b94bf96ee5bad61b02bdaf559ffb,2.0,2021-02-10 20:27:47,简单的故事，套路的情节，但不乏笑点。不必担心故事的起伏，主角基本没有低谷，适合放松心情看，缺点是没有起伏就容易乏味，合格的爆米花电影。 彭昱畅的口音不知道是不是故意的，有点像在装傻充愣，虽然但是不算出戏。最近发现小品演员的演技都有下限保障，乔杉接地气生活化的演技让人很有代入感。,,,0
91,91,34894753,沐浴之王,8c777079a847be4a10bc093eb6812f86,70ba975da2a527e768b38206e54a7cb9,,2021-02-09 23:29:02,这部电影是和家人一起乐呵呵看完的，就个人而言，是部十足的滥作，就家人而言，是部老少皆宜的诚意之作，阅片过程没有任何不愉快，没有紧绷的神经，没有留下过多的疑惑，整个过程挺轻松，再加上题材冷门，除了曾经看过濮存昕的《洗澡》之外，没有人再拍过这个题材了，这就更加吸引人的目光。整部作品没有太多的毛边，故事结构算完整，从一开头稍微有点阅片经验的人多多少少能猜到结局，这没什么好褒贬的，个别演员演技还能看，咱不追求金仕杰般的演技，单纯求个乐，足够。作为国片，我们先得端正态度，不搞媚外那一套，难道电影一定外国的好？据我所知福田雄一这种三流导演在豆瓣也有特别高的评价，但如果是相同水平的国内导演和他放在一起，那评分可未必有外国的高，这在豆瓣已经不是什么新鲜事了，难道外国话更好听能加分？ 电影作为时空综合艺术，它包含了文学和音乐图像的功能，但以目前社会生产力来看，它仍然取代不了所有的艺术形式，因为时间的限制和资金的驱使，它无法尽善尽美的重现所有的细节，这就说明电影艺术必然存在瑕疵，再加上故事题材的复杂性和人群的特殊性，没有一部电影能对口所有人的口味。若是我们把电影的门槛始终定在一个最高位，那便失去了电影的初衷。 我曾以为大师的电影一定是好电影，便私下尝试给家人和朋友播放过几部，从埃米尔的《地下》到迈克尔西米若的《猎鹿人》看得人是尿频尿急，一部《罗拉快跑》更是催人速眠，更别说谢尔盖的《石榴的颜色》和《吟游诗人》了，那非得把人弄的神经衰弱，比起《教父》反而更喜欢快意恩仇的《英雄本色》，这充分让我认识到这只不过是和朋友吹牛的谈资罢了，没有人会天天和你谈费里尼的电影和《公民凯恩》，与其一厢情愿的自命清高倒不如接受现实。看懂一部好电影需要足够的知识才行吗？这意味着电影的门槛是和学历成正比的？我看未必，香港曾有东方好莱坞之称，开埠时由于人才的贫瘠和经济的落后不得不把艺术行业的对口面向全社会，从早期的艺员班我们可以看到学历的良莠不齐，但一点也不阻碍港片的灼灼生辉，你把惠英红和箫芳芳放在一个平面上，除了学历不同外几乎没有一个人对她们工作能力的怀疑，甚至一些绿叶也常常表现出不凡的气质。反观我们国家的一些综艺一抓一大把不是北影就是上戏，一看作品就没戏，你给他配上最好的设备和最俊的演员，他可能就给你一部《小时代》，你不禁怀疑是不是又一个翟天临？多年来的轮番失望，让人对泱泱大国的文化自信深感疲惫，好作品总是和制作人员的求生本能相符，有的导演，拍过几部好电影后过上了滋润的生活，从此评价持续走低。娱乐圈的抱团让好的人才看不见，差的倒是每天风言风语的，贵圈的花边我不感兴趣，倒是作品是不停的刷新我的认知。一部电影可以轻轻松松聚集各路大牌，却看得人莫名其妙？甚至我都不禁往坏处想，是不是在洗钱啊？再加上我国对艺术事业的纵容程度，可以看到不管是什么艺术形式都有它不合理的“乱”和“腐”。 当然我们得有个解决问题的方法，光批评不改正那便是夸夸其谈。我们不妨吸取他国的经验和本国的经验，放宽艺术市场对社会的准入，取消名校效应和明星效应的门槛，吸引社会上所有有偏才的有想法的人自我组织，让草根导演编剧演员都有更多的平台，接受作品的泛滥，让市场和人民去筛选，当电影成为多数人的工具时，优胜劣汰的自然法则必然会生效。这样一来，娱乐圈中的那群天龙人自然成为了毒瘤，演员的断层和偏科也得到了各种的补充，还顺便解决了点最大的民生就业，把娱乐事业无限向人民拉近便是对娱乐抱团文化的最好冲击，因为，中国电影的失败是和演员薪资牢牢绑住的，天价的炒作和金团的操纵使得作品沦为少数人的游戏，当演员行业面对现实的时候，导演便能有更多的资金安排在其它部门，这样一来好的剧本好的特技好的美术等都有了动力，市场和法制两手抓便会驱使诚意的作品层出不穷。终究到底有病得从根上医，好莱坞和宝莱坞的演员机制都有个共同的特点，那就是和作品数量和票房成正比，资金链的合理分配使得作品能够严格把关，社会的挑剔使得作品的水准有个更好的监督，对颜值的客观选择和能力成正比，而不是国内的一张脸吃天下这种奇怪现象。 最后，拯救电影的还要靠我们自己，提高自己的素质，用正确的世界观去进行量取，始终是决定市场选择的重中之重。,,,1
92,92,34894753,沐浴之王,644af7a48e63bc5e328d3b1994812c66,cc4f89052682880e9f3d1d8511f707ab,3.0,2021-02-09 23:11:10,『沐浴之王』 乔杉荣升大银幕男一， 做起了大保健关联行业洗浴业， 电影笑点担当、表演有声有色， 百变男配张本煜确实很有feel， 影片整体结构有点周星驰《食神》+卢正雨《绝世高手》混合体的感觉， 休闲放松一看也过的去。 【6分】  『沐浴之王』乔杉荣升大银幕男一，做起了大保健关联行业洗浴业，电影笑点担当、表演有声有色，百变男配张本煜确实很有feel，影片整体结构有点周星驰《食神》+卢正雨《绝世高手》混合体的感觉，休闲放松一看也过的去。【6分】,1.0,,0
93,93,34894753,沐浴之王,98e39e5047fe1b8f756bac6b0d8971b9,58a417a67ca4ebe34f29af9766e3f22f,4.0,2021-02-09 02:51:19,这样一个喜剧故事，让我在笑的背后却看到了深深的社会悲哀。很难相信在现实社会这样的一个故事，能够过审，能够呈现在大众的面前。 这是一个有着完美结局的、很温情的故事。荒诞的结局，却无法掩盖浓浓的悲伤本质。喜剧的结局只是给悲情的人们一些虚无缥缈的希望罢了。 回到现实世界，底层小人物格局，会注定一个人的悲剧人生。 穷，让一个人无法有格局，而没有格局的人生，无论你怎么努力，最多也只是一个高级技工。,2.0,1.0,0
94,94,34894753,沐浴之王,073c1644d17cfc379758a151b328b1ee,c770c85c9a0cb85aec0b7b00f9a14649,,2021-02-08 19:07:53,老湿的解说风格现在所有抖音b站解说电影的领路人啊，金面佛和叫兽白客他们渊源真的太久了，就像所有的电竞人，主播都不该忘记sky一样，现在的搞笑电影解说up主我不信有几个没有学习过老湿，受过老湿启发的，哎，年纪也不大，干这行也不存在江郎才尽，怎么就不干了呢，跟着叫兽偶尔露露脸也很棒啊,,,0
95,95,34894753,沐浴之王,31fa4452b09554c47a77e72c54081924,0a0d7a43badf1ef439194cdd7cdbb502,5.0,2021-02-08 18:15:42,影片一开场，感觉就很不错。白客饰演的讨债员工，把乔杉家给搬空了。乔杉去给彭昱畅搓澡，惨遭“虐待”，之后彭彭的车扬长而去。乔杉不仅要给老年痴呆的奶奶治病，还要供高中的妹妹学画画，经济压力很大，于是寻思着把澡堂子卖了算了。正巧彭彭跳伞脑子被撞了，于是被乔杉接回家当搓澡工了。 之后乔杉在舞厅和杀马特胖子有争执，彭彭也参与进来…一来二去、吵吵闹闹的，彭彭就心甘情愿在这澡堂搓澡了。后来澡堂遭人陷害，名声被搞臭了。于是彭彭决定替乔杉参加比赛，把澡堂失去的名声再赢回来。 就在这个当口，彭彭被助理王叔找到了，于是回到之前的公子哥儿生活，却很不喜欢，于是在比赛当天和表哥闹掰，代表乔杉一家子参加了比赛。奶奶、妹妹为彭彭助阵，后来乔杉也来了。彭彭成为名副其实的胜者，大团圆结局，完美收官。 怎么说呢？很多部分非常不真实，比方 1. 乔杉和彭彭用水管冲水硬要把别人冲到河里。常人冲到对方懵圈就赶紧跑路了，冲下去淹死怎么办？2. 表哥原本想鸠占鹊巢，但彭彭回来了，表哥没有一毛钱股份，彭彭想开就开，那表哥最后又何必像个大反派一样地发飙？3. 最后乔杉和收购者马老板的打架更是无厘头，为了一个澡堂子要械斗、能械斗？ 虽然有这么多不真实的地方，但依然很好看，原因是：反映的情感是真实的。彭彭和乔杉一家日久生情，表哥皮里阳秋、内外两套，王叔锲而不舍、处处为彭彭着想…人物的情感是真实的，做出的行为也是符合逻辑的。一开始彭彭发现自己被骗，于是生气地走了，之后回想起过往，又不舍，最后决定为“兄弟澡堂”出征，整个人物内心挣扎冲突的脉络线十分真实。 不真实的渲染部分虽然有些夸大，但目的非常明确：那就是让故事的冲突更加激烈，把故事推向一个更大的高潮，因此观众虽然觉得这不太现实，但愿意去理解，也愿意不跳出影片外，继续跟着故事走。不过如果能够更合理圆润地去处理这些高潮前的伏笔，就更好了。 总的来说，《沐浴之王》是一部好看的电影。,,,0
96,96,34894753,沐浴之王,a2c789eca9b5a383ca4b971d978904c1,a6ad9439fe7523685cecf2574c78a480,4.0,2021-02-08 11:48:34,不知不觉中，网络科技改变着我们的生活，其中互联网的革命直接改变了人们的生活种种。二十多年前可能不会有人能想到。今天的我们可以动动手指就能完成我们想做的很多事情。这在以前简直就是天方夜谭。遇到问题的时候，不用惊慌。    在网上遇到以上情况平台一直不给提各种理由拖着，这种情况就是遇到假网了、一定要记住一点就是保持冷静。不要跟客服发起冲突、记住解决的三大要点:一保持冷静心平气和的沟通并且表示相信他们的一切理由让他们放松警惕。二在沟通的过程中夸大自己的实力。三通过。移，藏，卡，化整为零分批慢慢提出。    兵来将挡水来土掩，解决办法总比问题多。在快节奏发展的今天，我们必须清醒地认识到：终身学习紧跟时代发展的脉搏永远不会落伍给大家解释一下什么是。,,,2
97,97,34894753,沐浴之王,4875bdfcb1e0a3c49a0c79c4375573e6,ba5e14b41e9747dbc0eadc60b53e0d58,,2021-02-08 11:27:09,上映时反响应该还不错，好多人推荐说很好看，终于在下线的时候看了。看在彭彭的面子上，勉强及格吧，彭彭的霸总其实演的还不错，乔杉瘦了喜剧效果似乎也不那么明显了。主题是东北人喜闻乐见的搓澡题材，但故事线实在觉得有点无聊，失忆这个东西就比较low，决赛时乔杉在澡堂挨打这段情节着实过于煽情没什么必要，被打成那个惨样子并不会让人心疼引发情感共鸣，反而一头问号，合同还没签字呢凭什么砸我澡堂emm就有点，没必要。幸好没去电影院吧，也幸好没花六块钱。就这样。,,,0
98,98,34894753,沐浴之王,2d7648bb893faa38ab960e8a156d1c58,d0c29453596243abdea655b5d24b87e1,,2021-02-08 09:47:31,"个人认为好看 失忆不算烂梗，用好了其实很出彩，后面改造网红浴室，在比赛中重拾兄弟情啥的真的有点烂梗的感觉。

本身搓澡这个元素算不错的，又是阔少加穷鬼的组合，有笑点有泪点有起伏，也有歌颂有批判，但是痕迹太重了，就是一张写满了答案的答题纸。

可能最期待的部分是，彭昱畅演的那个少爷跟他表哥的对手戏，还以为会有反杀之类的，对那部分一直以为会是傻白甜大杀大尾巴狼，果然还是太期待了吧。",,,0
