,Unnamed: 0,电影id,电影名称,用户id,用户名,评分,评论日期,评论内容,有用数,没用数,回应数
3,3,34951210,阿伊达，你往何处去？,b48ed853e50522b0aea4a9533303cab8,bae5d684a587f8e2f7360fe89a340f67,4.0,2021-03-15 22:29:39,两次世界大战彻底改变了人类对战争的态度。一战以前，虽然大仗小仗不断，然而在西方，从上到下对战争的态度远比如今积极。年轻人被鼓励参战，穿上漂亮的军装，被民众夹道欢送，还有姑娘们的飞吻和鲜花，如果能在战场立功就飞黄腾达。这样的对战争过度美化的憧憬一直延续到第一次世界大战。 一战是第一次全民战争，战争不再是分工明确的活儿，职业军人和普通民众的界线变得模糊。战争的直接参与者范围阔大了，越来越多的平民意识到战争并没有征兵宣传和酒馆牛皮家们吹嘘的那么令人心潮澎湃。人们亲身体验到了，战争是缺胳膊断腿，是骨肉离散，是物价飞涨和饥馑，是不尽的白虱和传染病，是来不及掩埋的死尸散发的恶臭，是日以继夜朝不保夕的提心吊胆。 宁做太平犬不作乱离人，两次世界大战后厌战反战情绪一路高涨，近现代最能打的美国人也在越战时代喊起了make love not war。人民表示不要战争，无论如何都不要战争了。 战争这个始终与人类历史如影随形的巨魔，在核威胁下终于大规模偃旗息鼓。来自世界各地的文艺作品社会舆论每年不厌其烦地在封印上打卡盖章。LOVE &amp; PEACE成了绝对政治正确。 而《艾达怎么了》一片的背景，波黑战争就爆发在这样的大环境下。波黑战争时，我年纪还小但新闻里总提到米洛舍维奇，卡拉季奇这些名字真是想不记住都难。在欧亚大陆另一头发生的这场战争离我们太遥远，很多关于该战争具体的残酷的细节，也是进入新世纪后才慢慢被揭露开来。 斯雷布雷尼察屠杀固然耸人听闻，但同样在20世纪90年代，仅一年之隔在非洲卢旺达发生的种族屠杀在数量上更惊人。离斯雷布雷尼察屠杀在时间上相距很近的卢旺达大屠杀使得前者变得相形逊色。然而屠杀对于受害者及其遗属并不只是数字，当事人所受到的苦痛从来是不可比较的。 关于卢旺达屠杀有部非常有名的电影《卢旺达饭店》。在看《艾达怎么了》时我好几次都联想到《卢旺达饭店》，不仅仅是因为两者都描绘了针对平民的屠杀。而是两片都着重提到了联合国维和部队的无所作为。 这里我首先要替UN辩解下，UN从来就不是什么实权机构，充其量只能算是一个维持和平的松散组织。组织和联盟是有本质区别的，北约就算联盟，但UN不是。UN的维和更多是出于人道主义。当冤大头对抗地方武装从来不是UN的职责义务！但世人似乎很多都怀错信，觉得有UN在，那事情就有人兜底，总有大国们替自己主持公道。问题是，凭什么UN非要来给你兜底呢？ 听上去很残酷，但这是一个基本的道理，责任和义务是一对表里，没有义务也就没有责任。而道德从来不是责任。UN的主要资金来源都是长期和平不打仗的大国，对于贫弱战乱的小国UN更像是个慈善组织。 当然有人会说卢旺达的种族问题，巴尔干的分裂都是历史遗留问题，谁造了孽谁就该负责。可当殖民势力撤出，种族分裂已然形成时该怎么办呢？世界的车轮向前滚动并不不会为了只有道义占优的人而有所停留。 当艾达伸开双臂企图把丈夫儿子挡在背后的小房间里，朝着不想救助他们的UN维和部队怒吼时，我只觉得可怜，这就是把性命托付予他人的悲哀。维和部队来自其他和平国家，蓝盔士兵们在各自的国家有着各自的人生。片中给上校开车的士兵曾说道自己的妻子就要生产了，他的家庭和生活都在荷兰。凭什么要这些吃用本国人民税金的异国士兵为了一些素未谋面的异乡人去甘冒生命危险呢？战乱地区，维和人员自身难保的情况很常见。 看过《卢旺达大饭店》的观众都应该有印象，大屠杀恶化的一个拐点就是比利时部队的退出。而比利时人撤出的原因就是他们自己的士兵被杀了。图西族人和斯雷布雷尼察的穆族人面临的问题是一样的——没有人愿意保护他们。 在波黑战争中，拥有着最多人口比例的穆族人却占着最少比例的土地，没有像样的军队，缺乏自卫能力。艾达因为害怕引来塞族熟人的仇杀，把家人的照片和丈夫的笔记本都毁掉。双手抱头被装牲口一样装上车赶进大礼堂被集体枪决的穆族老百姓难道不热爱和平吗？去跟塞族谈判的三个市民代表没有一个参与政党，校长只想教书，商人只想做生意，这难道还不够和平吗？但他们并没有逃脱被战争所害的命运。 什么招致了这些和平者的死亡呢？原因当然很多很复杂，但其中一个答案我们是避不开的——因为其他国家的人民也热爱和平，大家都不想卷进战争。 一战过后民众的厌战情绪高涨，所以纳粹德国撕毁德波互不侵犯条约时，英法虽然跟波兰有安全保证协议却还是全程装睡。谁想打仗呢，你是战争狂吗？当然后来的故事我们都知道了。 没有发生战争的时候，所有人都是“没有人比我们更热爱和平”的。顺从的犹太人排着队去洗澡。直到盟军打进集中营才发现，好家伙，还有这？可即便到了现在，头脑清醒的西方人都明白，盟军为什么会攻击纳粹，根本原因可绝对不是为了解放犹太人。哪怕文艺界再不厌其烦地拿着集中营做文章，也改变不了一个冷峻现实，拯救犹太人只是盟军顺便完成的一个隐藏的支线任务。 在二战吃到大苦头的犹太人，战后终于意识到钱赚得再多没有武装保护，那就是在帮下一个加害者赚钱。他们痛定思痛建立了一个属于自己的国家。从此世界上有了个名声在外，仇恨度不低，不讲政治正确，但谁都不敢惹的国家以色列。也许现实如犹太人，在德国人的浴室里醍醐灌顶，金钱未必买得到平安，委曲求全的爱与和平只会成为装点坟头的美丽鲜花。 近年来我经常看到欧洲人嘲讽老美听到石油就打鸡血，用纳税人的钱把美国人自己的子弟兵派到鸟不拉屎的异国他乡去欺负别人国家的老百姓。这种针对美国的嘲讽在全世界已经成为一种政治正确。可不带偏见地看世界格局，热爱和平的欧洲人对世界的影响正逐年减少。旧势力撤出的地带出现了一个又一个的真空。卢旺达屠杀，波黑战争其实都是这种真空导致的灾难。为什么塞族可以把比自己人口更多的穆族吊起来打？因为塞族背后有南斯拉夫，而其他两家只有UN聊胜于无的空头支票。比如片子开头总也等不来的空袭打击。 片子看到后面我不禁想，艾达的孩子们如果真逃进了森林打游击，存活率是不是比在难民营里来得高多了？有枪有炮的联合国维和部队给了难民们不切实际的幻想，反而让本有一线逃生机会的人双手抱头交出了性命。这样的说法也许太冷酷太事后诸葛亮，但这里头有个道理是颠簸不破的——交给了外人的性命就不由自主了。 大马士革爆炸后，马克龙去叙利亚时被群众拦道抱住告御状，叙利亚人哭诉他们受够了贪污无能的当局，求法国人回来接管。马克龙表面上十分动容，心里算盘打得可响。传统殖民的时代已经过去了，学美国人玩代理，驻军赔钱完了还要挨舆论骂，谁都不傻，这种接盘侠狗都不当。叙利亚的国泰民安干嘛要法国人来维持？ 事实上现在越来越多的传统大国都已经意识到了这点，谁也不想吃力不讨好。好日子不过，非要被自家白左媒体追着戳了脊梁骨骂，欠不欠啊？ 你为什么不热爱和平？ 在这样热爱和平的大环境下，生活在战乱地区的人会有什么遭遇是可想而知了。人们厌恶大规模人道主义灾难但又无人愿意涉手，仿佛如今国内，哪儿有老人倒地立刻周围形成一圈真空，家里没矿都不敢扶。扶还能扶出一身麻烦来。法官要问你，不是你撞的你扶什么呀，你可怎么回答？ 屠杀的受害者往往是手无寸铁的平民，屠杀的理由可以是千百样的，但归根结底其实就一个，谁让你那么好杀。UN的军官要赶走艾达的家人时，呵斥她“难道要把别人的生命置于危险之中？”。道德情操再高尚的外人终归是外人，没有外人吃饱了撑的为你去死。 金钱和委曲求全没有保护犹太人，但以色列的先进武器可以。 我们的世界正处于一种前所未有的长期和平中，维持它的不是美丽动人的文艺作品，而是核武器。和平建立的基础不是绝对不战而是能战而不战。理想主义者鼓吹的单方面主动放下武装并不会带来和平，反而很有可能招来祸端。过犹不及的和平主义恰是对和平的威胁。,62.0,5.0,10
4,4,34951210,阿伊达，你往何处去？,0cdfd1c3c0372b217f9f73383da169b5,24185c8c68bbb3716cc09a8c1ed7cf07,,2021-07-06 01:27:53,"个人认为文章客观，专业水准，说明清晰。 战争这种事，一般人群绝对承受不起，一旦发生，就是灾难。  “斯雷布雷尼察大屠杀事件”的前前后后   2005-06-24　来源：光明日报　作者:本报驻贝尔格莱德记者 宋文富  在满是高山和丛林环绕的民房前，几个头戴红色贝蕾帽的军人正从卡车上卸着什么，迷彩

服的胸前缀有一只昂头挺胸的金黄色毒蝎，6名双手被绑、身着便服战战兢兢的年轻人平躺在车上，旁边看护的士兵将枪直对着他们，用力踢着他们的脑袋和身子，嘴里叫骂着将他们赶下车来。随后这些年轻人一个接一个站到前边，士兵们从背后扣动扳机，接连打死4人之后，将其余两名不到30岁的年轻人的绳子解开，待两人将4具被击毙者的尸体拉到远处后，他们也被士兵开枪击毙，随后射击者扬长而去。

这一切就好像是在拍电影，但的确是真实场景的再现。今年的6月1日，就在米洛舍维奇进行法庭辩护过程中，海牙国际刑事法庭杰弗里法官要求播放一部录像短片，这些就是录像片中的真实画面。杰夫里法官对此解释说，录像片获得于今年5月25日，摄录者曾经是塞族“毒蝎”志愿部队成员，片中记载了1995年夏季波黑塞族军队攻占波黑东部的斯雷布雷尼察城市后，将穆族被俘人员拉至特尔诺沃实施集体屠杀的实证。法官认为，由于塞族“毒蝎”武装志愿部队属塞尔维亚内务部警察部队的一部分，因此可以证明，波黑塞族军队在占领斯雷布雷尼察城市之后，在塞尔维亚军队的帮助下，该市曾经发生有屠杀大批穆斯林被俘军人及平民的惨案，由此也可进一步证明，米洛舍维奇确实在波黑犯下有种族灭绝的罪行。

“斯雷布雷尼察大屠杀事件”，犹如整个塞尔维亚民族身上的一块伤疤，再一次被国际社会揭开和重击。

事件的由来

斯雷布雷尼察，一个位于波黑东部的小城。周围群山环绕，距离塞尔维亚边境不到20公里，距离萨拉热窝约100公里。塞语中“斯雷布洛”一词意指“白银”，城市的得名，即来源于当地十分有名的银矿。据1990年时人口统计，该地共有居民3.5万人，四分之三均为穆斯林民族。1992年波黑战争开始后，当年春季几乎全部的波黑东部城镇均被塞族军队占领，惟有斯雷布雷尼察因地形特殊，整座城市易攻难守，因此塞族武装在1992年4月占领了3天后即迅速撤出，重被穆族武装控制。

作为穆族武装在波黑东部的惟一重要支撑点，周边的穆族难民不断向这里涌入，当地的穆族武装也得以壮大。到了冬季，城内饥饿的居民们与穆族武装不断袭击周边的塞族村庄与居民。当时波黑塞族首府帕莱通往贝尔格莱德最便捷的一条通道距离斯雷布雷尼察很近，这一通道对卡拉季奇至关重要，驻守在斯雷布雷尼察的穆族武装曾几次试图将其切断。因此到了1993年3月，波黑塞族下决心彻底拿下斯雷布雷尼察。就在塞族军队步步接近城市之际，美国及西方社会开始干预，经法国驻波黑维和部队的调停，塞族同意停止进攻，同时要求市内的穆族全部解除武装，停止攻击塞族居民，并且决不允许威胁波黑塞族首府帕莱至贝尔格莱德的通道安全。1993年4月16日安理会通过决议，明确该市为联合国保护区之一。

1995年春季，同样也被列为联合国保护地的克罗地亚境内的大片塞族居住区―――克拉伊纳共和国，几天时间内就被克族军队彻底攻占，大批塞族难民逃至塞尔维亚与波黑，这一行动彻底激怒了波黑塞族，最终下定决心，再次聚集力量彻底攻占斯雷布雷尼察。7月6日塞军首先包围并将荷兰驻当地的维和部队隔离开后，攻击正式开始。5天之后姆拉迪奇即通过电视正式宣布，斯雷布雷尼察已被攻占。与此同时塞族也开始受到穆族与西方社会的指责，表示在7月11日至16日的几天时间里，塞族武装曾在斯雷布雷尼察地区有组织地对穆族战俘和平民实施大规模的屠杀。

围绕数字的争议

是谁下达的屠杀命令？究竟有多少人被杀？英国BBC电视台播放的节目称，1995年7月12日―16日的几天时间里，该地共有7414名穆族居民被姆拉迪奇指挥的波黑塞族军队杀害。1995年11月代顿协议之后，数十个来自国际社会的各种委员会与专业小组来到这里，挖开数百座坟墓后重新进行核实与调查。波黑塞族政府也成立了专门委员会对此予以协助。几年时间里，死亡人数不断上升，从7000人至11000多人各种说法不一。就在今年6月1日6名穆族青年被枪杀的录像片播出后，6月11日，萨拉热窝的报纸首次将1995年斯雷布雷尼察事件中失踪的8106人的名单全部刊出，表示这是至今所做的调查结果，但还并不是全部。根据国际红十字会2004年8月公布的材料，已有1482具尸体的身份已被确认。加上其他一些国际组织的核实，目前共有2984人的真实身份被查清，其中有2173人是重新挖出尸体或尸体残块后核查得出的结果。波黑塞族实体政府斯雷布雷尼察事件调查委员会指出，综合30多个组织提供的失踪人员名单，失踪人员数量大致应集中在7000人到8000人之间，如果这一情况属实，那么至少还应有5000人至6500人的遗体，但这些遗体在哪里？多方查寻尚无具体下落。

对于这一数字贝尔格莱德提出有不同意见，“塞族居民遭迫害罪行调查委员会”主任伊万尼舍奇指出，所谓8106名失踪人员名单，1995年时国际红十字会就曾拿出来过，但也正是名单中的3016人，第二年波黑大选时，又重新出现在选民名单上。他还表示，即使在经核实确已死亡的2000多人中，其中妇女仅36人，老人及孩子约50人，很少有平民。他说，海牙法庭的军事专家梅宁金在自己的报告中曾写道，将尸体挖出后重新勘验的工作已经进行了17次，在1883具尸体中，核实确认其中有1656人为男性，只有一具为女性，另有212具无法辨别性别，此外其中有1424人是被枪弹击伤后而死。因此伊万尼舍维奇本人根本不同意所谓大屠杀一说。

塞尔维亚的反应

6名穆族平民被枪杀的录像片一经播出，整个塞尔维亚震惊了，一直以弱者或是被视为遭受国际社会不公正待遇的塞族居民震惊了。塞尔维亚总理科什图尼察当天即发表讲话，最为愤怒地谴责在斯雷布雷尼察所发生的罪行。塞各政党以及各届人士也纷纷表态，指出枪杀6名穆族青年的行动是法西斯行为，本民族同胞为这一行动感到羞愧和耻辱，一致要求应严惩当事人。塞尔维亚总统塔迪奇明确表示，他本人可前往斯雷布雷尼察，向战争中牺牲的非塞族无辜居民们忏悔。随即塞尔维亚政府也立刻下令，逮捕了录像片中显现的，目前还在塞尔维亚境内生活的4名“毒蝎”部队成员。

塞境内的人权基金会等8个非政府组织立即联名上书政府，要求塞尔维亚议会公开通过决议，承认在波黑战争中对穆斯林居民犯下有罪行。然而经两天的辩论与酝酿下来，议会最终未能达成一致。主要原因在于，多数人认为战争本身就是一极为残酷的行动，家人的死亡、战友的遇难都可能激发个别人野性的一面，导致采取极端方式，但这些更多地应属个人行为，肇事者必须受到严惩，但他们并不能代表整个塞尔维亚民族的意愿，并不能由此即认为这属于国家行为。

更多的民众强调，任何暴行都应遭到谴责和惩治，无论是塞族、穆族还是其他民族所为，议会如果通过决议，同时也必须谴责几年战争期间穆族极端分子对塞族居民实施的暴行。据塞族居民遭迫害罪行调查委员会的材料，斯雷布雷尼察同时也是塞族人的坟墓，自1992年至1995年期间，整个斯雷布雷尼察地区至少死亡3227名塞族居民，仅在该市市中心就有446人死亡，参与犯罪的穆族暴徒多达469人，所有这些都具备文字与影像等各种证据材料。委员会强调，整个波黑战争期间，共有26818名塞族人丧生，其中19%是军人，31%是农民，10%是妇女，还有不足1%的儿童，这些也必须予以澄清，因为每一个死难者都一样重要，塞尔维亚的母亲们也有权了解一切真相。

米洛舍维奇的质疑

面对法官的录像播放，法庭上米洛舍维奇明确表示，所看到的这一切“无疑肯定是罪行”。但他同时表示，然而这一罪行并不能与塞尔维亚相联系，因为“毒蝎”部队成立于1992年，被克罗地亚境内的“塞尔维亚克拉伊纳共和国”的塞族武装正式收编，总共300多人属志愿部队，工资要比正规塞族军队的士兵高4-5倍，其任务在于保护克拉伊纳共和国的石油生产地，代顿协议签订后1996年秋季该部即被解散，与塞尔维亚警察部队无关，因此也根本不能证明，塞尔维亚直接参与了斯雷布雷尼察事件。

接着米洛舍维奇询问，“请法官证明是谁、在哪里拍摄了这部录像？”“特尔诺夫距离斯雷布雷尼察159.4公里，根据什么可以断定这6个被枪杀的穆族居民确实来自于斯雷布雷尼察？”“准确的枪杀时间又是何时？”“整盘约2个小时的录像带均在左上角明确标明有录制时间，但为何恰恰在这段显示有杀人场面的约20分钟的带子里却无任何标示？”“某些部分曾被重新编辑过的痕迹明显，其中有一段话显然是被抹掉了。”由此米洛舍维奇对于这一盘录像带的真实性提出质疑，希望法官能对此作出解释。

录像为何在此时披露

根据司法程序，录像带属间接证明材料，由于种种疑点的存在，甚至杰弗里法官本人也认为，很难将其正式归入证据材料。塞尔维亚的分析人士认为，其实从一开始法官对此就十分清楚，然而录像播出的真正目的在于，取得震惊社会的轰动效应，只要让国际社会看到塞族人犯罪的这一震惊场面就够了。

今年是斯雷布雷尼察事件10周年纪念日，7月11日国际社会将在该市举行大型祭奠活动，众多国际要人均表示届时将可能前往，然而迄今为止，西方认定的斯雷布雷尼察事件的主要制造者，姆拉迪奇仍踪迹全无。下半年内，关于科索沃最终地位问题的谈判也将正式启动。因此当地一分析人士认为：录像之所以在现在披露，西方国家的主要目的在于，指责塞尔维亚不能正视自己的过去，从而以减弱塞黑在科索沃最终地位问题上的谈判立场；其次，西方希望在7月11日之前尽快逮捕姆拉迪奇，认为在这些令人震撼的画面播出之后，多数民众对于姆拉迪奇会有一个新的认识。

斯雷布雷尼察事件的真相究竟如何？到底应怎样看待这一事件？原塞尔维亚军事医学院院长、曾经多次出现在各个战场上的斯坦科维奇将军这样认为，“在斯科拉宁一个掩埋着尸体的大坑里，我们亲眼看到一个男孩走了进去，一个一个地翻找着每一具尸体，我想上去制止，但他对我说，‘我的父亲、母亲、兄弟和姐姐都在这里’。后来，我见到了身着军装的这个男孩，他背上了冲锋枪，开始去为自己的亲人复仇。”将军说，斯雷布雷尼察事件的最大问题就在于，“我们目前审判的是（战争的）结果，而不是它的起因。这些行为是什么？肯定是犯罪。但到底是种族灭绝？复仇？还是其他的什么？我们对死者有所亏欠，不仅仅是指塞族人，同时包括所有的战争死难者。”",18.0,,7
