,Unnamed: 0,电影id,电影名称,用户id,用户名,评分,评论日期,评论内容,有用数,没用数,回应数
8,8,34955843,真雄起,d43d60e78796fc822497be9cea494ca6,d69fe31a9c85d8898a0c208316114027,,2021-02-23 20:07:57,很久没有看印度电影了，这也是第一次看印度的同影。 就电影本身，评价3.5星；加上其可能对印度或者同志平权的影响，4星。 先说影片内容，哈曼和卡迪克这对同志恋人参加哈曼堂姐的婚礼，却在火车上因为接吻被父亲发现。在堂姐的婚礼上，两人激情接吻，当众出柜。哈曼父亲及家庭拼命阻挠两人，但两人用自己的真情和勇气最终说服了家庭。印度最高院同时也正在进行关于同性婚姻是否犯罪的辩论，结果认定同性婚姻合法。总之，内容很狗血，也很俗套，不算出彩的地方。 说说演技，两位主角及父母的演技都很棒，尤其是阿曼和他父亲这两个角色都塑造的很好。阿曼的听话、懦弱、矛盾、勇敢、对卡迪克的爱，演绎的都很好。父亲的古板、犟驴特性相对容易表现，表现张力也很不错。 说说主题。很感动我的一点是阿曼父母对婚姻的反思，他们各自有自己的荷尔蒙与多巴胺，但是却都听从家人选择了其他的人选结婚，没有过自己想要的生活。但阿曼母亲会在Facebook上搜索初恋，阿曼父亲也藏了心上人的相册，两人都知道彼此的情况却都心照不宣。可以说是世俗与传统的习惯性力量让他们都觉得这才是“正常”，而忽略了自己本身的荷尔蒙和多巴胺。不仅仅是印度，我们中国也存在多少多少这样的情况。好在随着人们的思想越来越独立，人们越来越会追求自己的真正的爱情。我也要告诉自己，追求爱情，不要被世俗禁锢。另外，卡迪克在鼓励阿曼出柜的时候说的话也很漂亮，“你可以决定是否做自己的英雄”。,,,0
9,9,34955843,真雄起,bdd0acc14eed9fb669011bddec716563,f9dc77cece7fa16f6edd2d1d64853e4b,4.0,2021-02-23 14:50:31,"看了一些观点，有些观点认为这部电影缺乏深刻性，过于肤浅流于形式，但是我认为这样的观点未免有些委曲求全。
这部电影显然有这样那样的问题，例如其中的“喊口号“之嫌等，但是我认为作为宝莱坞第一部主流的商业同志片，它的优点绝对是大于它的不足的。
首先它融合了宝莱坞的叙事风格。作为某种意义上的敏感话题，它融入了印度电影独有的歌舞和喜剧效果，将这同性恋这件事以较为幽默轻松的方式展现给观众，使得观众不至于产生排斥心理，没有对两位男主进行冗长的介绍恰恰是凸显了两位男主所代表的平凡普通的身份，同性恋者也很普通很常见。
其次它讲述了印度特色化的故事，导演和编剧的设置别有用心，有一个情节我特别清楚，就是男主爸妈的单独场面，他们回忆起自己的婚姻和爱情。这就将印度的包办婚姻的无奈和对两位男主对爱情的追求结合了起来。他们也希望自己的孩子过上自己的生活，这也显示出了父母对于自己孩子的爱。利用了这样的一个情节设置为全体服务，我认为这是一个非常巧妙地一个点，同时这也显示出影片制作者在认真的思考问题，而不是片面的喊口号。在传统观念如此盛行的一个国家这样的挑战无疑是巨大的
最后是它里程碑式的意义，它是应印度去年同行去罪化而生，恰巧两天前就是这部影片的诞生一周年。其实电影源于生活又高于生活，同时透过这部影片也能让我们更加的了解印度这样的一个国家，起到文化交流的意义，印度社会也具有包容的一面。毕竟考虑到电影和去罪化的时间间隔和印度宗教国家的基本国情。这样的大胆尝试是非常值得鼓励的。
结语：主演阿鱼在ins上纪念这一周年说，我们可以通过影院屏幕使得一些禁忌的话题不断被提出和解决以从来改变人们的思维模式。我们需要花时间和精力去让一些禁忌的话题正常化，并且为社会带来建设性的改变。所以我觉得我们不妨更多的注视着这样一种进步的力量，共同促进社会的包容和发展。",1.0,,0
10,10,34955843,真雄起,936b65e8844ac5c6b9a8f4cb32865132,d80dd16ca48dd72ed2e6d87ed6b50710,5.0,2021-01-28 19:38:00,看看人家的讨论话题，拍摄手法，思想性，我们相差太远了，最早，伊朗电影胜过我们，后来，眼看着韩国超上来了，泰国也能拍出超级枪手这样的好片子了，现在，印度凭借摔跤吧爸爸，还有这个电影，也把我们摔在后面，我们的电影，若干年后，可能要参加纳米比亚电影节，才能获奖吧，不过，也难说！目前世界电影界流行一句话，要看电影，看韩国片，中国人不会拍电影！加油吧，地主家的傻儿子！,,,0
11,11,34955843,真雄起,d7243e71608fd4bd1cfe441e5e8dcb3d,5985a1ab38a418e26e56d7cfd34b6292,4.0,2020-09-13 14:04:57,你难道想和她玩过家家的游戏吗，六个月后你将会被催生小孩，生了一个后还会被催第二个，你能做得到吗？你能和你那所谓的法定妻子做到吗？首先你要和Kusum欺瞒父母…接着你的父母会想办法向全世界隐瞒，然后我们还要继续骗他们，到了四十岁你就会意识到你才是那个一直被欺骗的人。         ——印度电影《真雄起》台词 上述台词出自印度电影《真雄起》，2020年的同性题材印度新片，豆瓣评分7.5。 上述台词是男主哈曼为了安慰父母，决定听从父母安排，与自己不爱的女子结婚时，其恋人（男性）对他的灵魂劝说。 最后一句“到了四十岁你就会意识到你才是那个一直被欺骗的人”尤为振聋发聩，它警示我们，你的妥协什么用都没有，谁都没骗过，只是骗过了你自己。 这不是一部纯粹意义上的喜剧片，影片刻意淡化了印度社会对同性恋的偏见与打压，但有一些较为真实的情节令人心惊。 警察来婚宴上逮捕两位男主的情节看来惊悚，实则为现实，因为现实中印度刑法典第377条规定，同性性行为是应受惩处的罪行。白纸黑字，明文规定。 除了法律的规定，印度国内的宗教势力几乎对同性恋行为也不甚包容，而宗教的此种态度无疑影响最为深入，成为印度社会各阶层人根深蒂固的观念。 这种观念和法律相比，对同性恋群体的阉割更为深入。影片中的长老甚至拒绝为两位男主主持典礼就是一个例证。 然而，经过少数派群体的不懈努力，终于，2018年9月6日，印度最高法院宣布，双方自愿的成人同性性行为不再是犯罪行为，性倾向是先天的，人们不能控制。 这一裁决推翻了印度刑法典中的第377条，其中规定同性性行为是应受惩处的罪行。 但是，这只是一个开始。长久以来的观念仍使得印度社会对同性恋群体的包容度远远不够乐观，而这也就是这部片子诞生的背景。 作为一部电影，它明显走的是好莱坞模式，且不甚成功，人物形象略扁平，父母对儿子的认可与和解也缺乏强有力的转变过程。 但作为一种观念的输出，它开了一个很好的头。 真雄起距离《真雄起》还有多远？ 这条路还远未到终点，仍是一条充满偏见与恶意的荆棘之路。 但总有人已经迈开了步，例如成为印度LGBT守护者的粉色宫殿的王子，他的舆论压力于家庭压力可不比一般人小。,1.0,,0
12,12,34955843,真雄起,cc1c8b18a68a32555eda10002746353c,2518abb55a159488a080fb3ffb94b257,5.0,2020-07-26 11:46:42,·《真雄起》影评 （全文约1000字，多图分析） 用爱，对抗世界的荒谬 ——你的荷尔蒙是爱，我的就是病？ （本文并不是一篇正常的评论，仅仅在电影的立意基础上筛选出精华进行描述）（多图警告⚠️）         商业电影的模式，善于用欢快的方式将先进的意识潜移默化的表达出来。明暗线交织的印度电影【真雄起】，将卡迪克和哈曼的故事，和婚姻平权，以及印度最高法院裁决同性恋的过程详细地普及给观众，以达到科普的目的。        如何让观众接受？答案是：于喜剧中见深刻，这是这部电影中最突出的特点。尽管没有过于深刻的立意，但是能够让印度官方一路开绿灯，已经是相当不错的啦。        卡迪克和哈曼生活在大城市，作为推销员为生。   帮助别人私奔        平日喜欢帮助其他人摆脱包办婚姻的束缚——即私奔。        哈曼的姐姐护目镜要结婚了，于是他们准备回哈曼家中。但是护目镜的左眼视力有障碍，好不容易有人愿意娶她。所以她非常看重这次婚姻。 护目镜       趁此大好机会，卡迪克希望哈曼向家人出柜，并一并举办属于自己的婚礼。        哈曼的父亲特里巴蒂是科学家，但是因为强制推广容易长虫的黑花菜而受到当地农民的厌恶。        特里巴蒂和他的妻子已经为哈曼物色了一个妻子，准备大搞包办婚姻。 “妻子”库苏        卡迪克和哈曼在婚姻列车上，热吻的时候被父亲撞上。          由此开始了第一轮矛盾对抗。哈曼和特里巴蒂之间的父子对抗。 卡迪克鼓励哈曼出柜 父子冲突         开始举办婚礼的时候，开始了卡迪克和特里巴蒂之间的对抗。 撒狗粮系列 卡迪克和特里巴蒂的斗舞 哈曼解救卡迪克 当众热吻   卡迪克被驱逐。  强制送走卡迪克时，查曼逐渐被感化。（忘记截图了） 卡迪克在铁路口遇见了结婚被迫取消，想要自杀的护目镜。             哈曼与父母的争论，这也是本电影中文戏的精华，基本赘述了核心观点。           在哈曼一家回家的时候。 但是特里巴蒂缺回应说：你站哪边？谷歌还是我们？ 在汽车上，库苏表达了自己也是假结婚。但是她的对象父母不能接受。  哈曼的父母希望做一场法事，令哈曼重生为人。  在重生法事的时候，卡迪克归来。 TA的每一块腹肌都散发这骚气 TA的每一块肱二都散发着骚气 TA的眼神散发着骚气         特里巴蒂打卡迪克。  为了挽救卡迪克，哈曼决定假结婚。 假结婚现场，卡迪克那幽怨的眼神 “结婚”的那个晚上，特里巴蒂和妻子的争论。以及库苏的潜逃。当然还有妻子的觉醒。  库苏的逃婚 卡迪克抓住机会，在护目镜的帮助下假扮库苏为妻。  卡迪克要求教士继续婚礼。 再次与特里巴蒂的对抗。 卡迪克这个发型我爱了 库苏被警察抓到，并且发现了卡迪克和哈曼的非法关系。叔父查曼作为一个法学院准律师，开始现场辩护。 这一段可谓是相当精彩 最后的辩护和法案的胜利✌️ 最后，父子和解。Happy ending   最后补充一些没有用到的狗粮图片      全文完。,3.0,,0
13,13,34955843,真雄起,9eeabcda5f0ce1d39eedd8bd60336990,67d955872b90780a88beec52dd1a2668,5.0,2020-07-13 23:48:54,Ayushmann - The Zyada Super Hero!(关于电影幕后、访谈及花絮等) 这个标题是来自影片出品公司T-Series Film放出宣传片标题 影片上映后，AyushmannK夫妇出演一个舞蹈节目，在放出的花絮中，女舞蹈教练提问：AyushmannK出演这么多不同寻常的角色，捐精者、盲人、秃子，以及男性功能障碍者，现在还出演了男同，这对他们的生活造成什么样的影响？AyushmannK夫人Tahira很是霸气直爽的回答：（这使）我拥有了精彩万分的性生活，AyushmannK满足了我所有的幻想，我不会为此遗憾! (Tahira，请收下我的膝盖) 这是我一张很喜欢的宣传照片，可以用来当桌面  关于选角 这是一部双男主影片，AyushmannK在第一次读到剧本时，很是惊讶，因为剧中双男主设定，是同等强弱同样角色鲜明，正如阴阳两面。制片方允许AyushmannK自已挑选想要出演的角色，最终AyushmannK选择了Karthik这个有女性化一面 – “带着鼻环，会倚在恋人背后撒娇”，但同时又是两人中坚强的一个 - “为自己是同志而骄傲，为了爱情跟恋人而勇于面对一切”，导演后来也讲，他最初就是期望AyushmannK出演这个角色，并且在宝莱坞也找不到别的A-list的男演员敢于出演这个角色，AyushmannK是这部影片的天选之子。 AyushmannK是这样解释，因为AyushmannK在从影的大部分影片中都扮演了是类似弱者或受害者的形象（除了Article 15，AyushmannK第一次扮演真正的男人，而不是男孩子气的角色），所以这次他想选一个主动型的角色，而Karthik的热情奔放也是他想挑战尝试的。AyushmannK确实做到了，所以我们才看到了如此奔放不羁的一个全新的AyushmannK。 对于Aman这个角色选角，就比较艰难了，根据访谈中导演跟AyushmannK透露出来的信息: 第一无可避免的是因为同志角色，尽管导演跟AyushmannK一再强调他们邀请的演员是因为其它种种不合适而没有出演，不是因为同志角色而拒绝，但很明显，目前的宝莱坞对于LGTBQ角色还是很谨慎的。否则2016年《卡普尔家的儿子们》这部影片中，对于哥哥一角只是隐隐透露出的深柜角色，在宝莱坞都找不到男演员敢于出演，最后是巴基斯坦演员Fawad Khan出演(印巴冲突加剧后，他被宝莱坞无情驱逐，这又是一个悲伤的故事)。 第二是因为这是一个双男主剧本，据AyushmannK讲宝莱坞的男演员普遍拒绝这种双男主影片，不知是否都只想做独一无二的Alpha Male。 第三根据各种评论区的观点，因为这是一部AyushmannK出演的影片，大家都清楚他的演技与活力，都清楚AyushmannK出演过的影片最后都会深深打上了他的烙印，已经有名气男演员不想被AyushmannK盖过风头，所以最终制片方只能大胆启用Jeetu这个新人出演。 关于配角 出演Jeetu父母的Gajraj Rao跟Neena Gupta在AyushmannK 2018年票房黑马《喜得千金》中就分别扮演AyushmannK的父母 出演Jeetu婶婶的Sunita Rajwar在AyushmannK 2019的票房大热《Bala》中出演AyushmannK的母亲 出演AyushmannK协助逃婚的女孩Bhumi Pednekar更是多次跟AyushmannK合作出演妻子等角色 关于Jeetu Jeetu这个名字来自于扮演者在网剧《Kota Factory》中饰演角色，因为角色深受观众喜爱，Jitendra的名字就经常被Jeetu替代 早在2009年，AyushmannK还是电台主播时，因参加一次大学现场电台活动，就与Jeetu见过面，但之后并无联系，直到Jeetu参加本片试镜，AyushmannK开始只是觉得面熟，接着很欣赏Jeetu的表演，也是在AyushmannK坚持游说之下，制片方最终才选择Jeetu出演本片 作为进入宝莱坞的第一部电影debut，Jeetu勇于选择本片中男同这个角色，也是有相当勇气与担当。 Jeetu在印度粉丝眼中可是非常受欢迎，在油管的宣传片或剧组访谈下方的留言中，留下很多诸如“Jeetu演得太棒了”，“Jeetu太可爱了”，“Jeetu凝望AyushmannK的眼神都是心型”，有时称赞Jeetu的评论会大幅超过称赞AyushmannK的评论 关于AyushmannK AyushmannK在访谈中说过，正是随着&lt;调音师、&lt;喜得千金、&lt;我的梦中情人、&lt;巴拉这几部背靠背票房大卖的热门影片，才给了他敢于选择&lt;第十五条&lt;真雄起这种禁忌话题影片的自信和勇气。 AyushmannK提及，有天晚上1、2点钟，在完成&lt;我的梦中情人的商场戏份拍摄后，他路过附近公园，目睹到2个男生在接吻，那时AyushmannK就在想，是时候拍摄一部LGTBQ相关的电影了。所以AyushmannK一直在关心&lt;雄起编剧这部同志相关的剧本进度，两人可以说是一拍即合。 当得知他要出演一个同志主角，而且还有吻戏，AyushmannK就接到很多电影行业人士的电话，劝他放弃，但AyushmannK还是坚持出演，我们最终才能看到本片。 AyushmannK说他出演同志角色，得到了家人的支持和赞扬。而AyushmannK的夫人Tahira，从最初不能接受AyushmannK在影片中亲吻别的女人，经过这么几年的沟通协商，到现在可以愉快地欣赏丈夫在银幕上亲吻一个男人。 关于吻戏 AyushmannK在拿到完整剧本前，就一再追问编剧，是否有吻戏，AyushmannK认为这部LGTBQ的电影，一定要有吻戏，用来打破一直以来存在的禁忌与隔阂。要知道这可是宝莱坞，一个在10年前男女吻戏都很少存在的电影国度(至今沙鲁克汗都不拍吻戏，No Kiss可是直接写在他的电影合约里)，湿身纱丽都已经是情欲表达的极致。而一个主流商业电影中出现男男之吻，真正是对LGBTQ做出了最正面的支持。 第一场火车上的吻戏，是在清场后才开拍的。 第二场Aman当众激吻Karthik的吻戏，真正是在大庭广众下拍摄，剧组的其他成员都对二人表示出极大的支持，因为这不是一个常人习惯上可以做到的事情。尽管现场还有一些未成年的小演员，但导演说大家都非常配合，大概拍摄了3次，就已经完成拍摄。 AyushmannK表示，自己是一个演员，为了表演会作任何事，他也做好准备去做任何事(包括男男之吻)。 关于影片 豆瓣评论中有不少质疑影片的深刻性与艺术性，从访谈看，AyushmannK跟编剧兼导演都公开表示，他们想要制作的就是一部合家欢的爆米花商业电影，是为了尽量让同志形像更正常化（接近普通人），他们希望用喜剧做为手段来打开恐同者的心防，让他们认识到，LGTBQ也是一种正常的自然天性。所以他们交出的是一个漂亮的Masala电影，有父母对包办婚姻在吐槽，也有为追求婚姻自由而私奔的青年男女，还有向往婚姻生活认为婚姻就是生活终极目标的堂妹，当然最重要的同志向传统家庭出柜而引发的的种种矛盾和闹剧。影片努力想做到，不管是谁，都可以在影片中看到自己喜欢的部分，这是电影的初衷，也确实做到了！ 这部影片投资接近5亿卢比，这样一个禁忌话题，在印度国内卖到近6亿卢比，全球接近8亿卢比，影片后期已经受到疫情影响，拿到周冠军后，排片就已经开始大幅减少，目前还高挂在2020年印度票房排行前10位，已经算是非常不错的成绩。 关于火车追逐场景 本片有一副宣传图片，是有关火车场景   在片中出现过2次真实的火车追逐场景，第一次是Aman在火车上迎接Karthik    第二次是结尾Karthik在火车上迎接Aman    这其实是复刻Dilwale Dulhania Le Jayenge &lt;勇夺芳心的火车场景，这是该片问世15年以来，这个经典场景第5次被复刻，也是第1次男男复刻。 (沙鲁克汗主演的爱情电影，影片讲述了男主如何冲破未来岳父和情敌的阻挠娶得美人归的故事)     关于歌舞 说实话，第一次在AyushmannK的电影中出现如此多的歌舞场景，简直像是过年般的喜庆，因为AyushmannK的电影历来很少或干脆没有歌舞场景，简直一反印度电影动不动就尬舞的传统。&lt;喜得千金、&lt;我的梦中情人、&lt;巴拉这三影片结尾放出的歌舞，都已经翻来覆去看了无数遍了。 这部电影的5段歌舞，直接通过歌舞蒙太奇的手法，交待细节并快速推动了剧情发展，让人不觉得累赘，甚至可以反复欣赏。 第一段双主角摩托车上那场戏的背景音乐是AyushmannK主唱的〈Mere Liye Tum Kaafi Ho〉(you are enough to me)，可以到油管上看官方完整版，印度疫情封国期间，还有AyushmannK线上自弹自唱unplugged版本，对于多才多艺的AyushmannK，不能赞赏更多！ 花絮： AyushmannK跟Jeetu        AyushmannK深受女性喜爱，在电视脱口秀上，有女粉丝直言要找AyushmannK结婚，在片场也一样，下面看看群舞女演员大庭广众下对AyushmannK做了什么    AyushmannK在2020年的filmfare颁奖礼上给了兰维尔辛格（一个观众最喜爱男演员，一个评论家最喜爱男演员）一个深情凝视    颁奖礼后的采访环节，兰维尔据说是为了表达对AyushmannK将要上映的&lt;真雄起支持，给了AyushmannK一个偷袭之吻，但谁知道呢…    最后，致本片的真英雄－Ayushmann,7.0,,0
14,14,34955843,真雄起,d0934bdb15883092d231724dae4dfc77,5a26e38f2abf6417a84cb0977ac4c975,3.0,2020-06-04 11:17:38,"2020年2月份上映的《真雄起》是宝莱坞第一部在印度大规模公映的主流同性题材电影。该电影对社会进步的意义和贡献无疑是重大的。 印度《刑法》377条的规定，任何人与男、女、动物发生违反自然定律的性行为将被判终身监禁，或最高至10年的有期徒刑，并处罚金。2018年9月6日，印度最高法院作出判决，推翻实施已久的《刑法》377条，在印度同性恋性行为不再被认为是犯罪行为。 故事就发生在印度高等法院判决前夕。 同性恋人哈曼带着卡迪克回乡参加堂姐的婚礼。浪漫不羁的卡迪克希望哈曼向家人正式出柜，结果在迎亲列车上两人热吻时无意间被哈曼的父亲撞见。从此，哈曼的父亲便把卡迪克视为眼中钉，想尽办法要纠正自己的儿子，拆散这对恋人。 老父亲的棒打鸳鸯 对于爱情锲而不舍的卡迪克，鼓励着内心百般胶着的哈曼，应该勇敢而坚定地追求自己的真爱。几乎在同一时间，印度最高法院正在就同性恋是否为犯罪进行着一场世纪辩论。。。 一切的恐惧都来自于无知 每天在世界的各个角落都在上演着不同版本的出柜。尽管各地文化有所不同，但不难发现，出柜所要面临的挑战本质上都是一样的，甚至连表现形式都是一样的：父亲的斥责打骂、母亲的哭哭啼啼、强迫结婚、强制治疗，甚至还搞一些迷信。 电影《真雄起》继承了宝莱坞一如既往的喜剧和歌舞风格，以一种诙谐的方式讲述了这段艰辛历程。真的很印度，真的很欢乐。 来自叔叔的辩护：你哪只眼睛看到他们在搞基？你有证据吗？ 在同性恋这条道路上，影片中的卡迪克坚持走直线，即出柜，然后公开在一起。而哈曼因为受到家族的巨大压力，不得不做妥协，想选择走曲线，即形婚。 虽然卡迪克劝说哈曼的话没有错：“这不是一场游戏，也不是拍电影。从新婚夜起你就会感到难受，你能够确保假装一辈子吗？你能演好忠诚的丈夫吗？……我们没有多少机会能当一次英雄，现在你来决定要成为谁？在这个故事里，当英雄还是路人？” 事实上，世界上没有什么东西可以确保一辈子，当然也包括你我之间的爱情 但每个人面对的压力和遭遇到的境况都是不同的。即便是情侣之间，我们最好也不要强加任何自己的意志给对方。我们可以告诉对方我们的想法，然后给对方时间和空间去思考，让他们自己去作出决定。 当然，为了我们的爱情，我们一定要一直奔跑！  也可以读一读： 
纪录片《同行》带你看看印度同志的生存状态 出柜大作战",,,0
