,Unnamed: 0,电影id,电影名称,用户id,用户名,评分,评论日期,评论内容,有用数,没用数,回应数
16,16,34951210,阿伊达，你往何处去？,41ecfd8485db6b5aef5c7f03ca92f54b,9ff61bd416f610e3a6b8bd19d2f2fda7,5.0,2021-07-27 02:00:41,背景： 3年半的内战。双方都已经精神崩溃了。相互屠杀平民。塞尔维亚 部队和人口最多，屠杀得最猛。然后，联合国 设立了的安全营地，反正各种黑幕猫腻。安全区穆族打游击，可把塞族恶心坏了，就有影片里塞族武装强冲维和营地一幕。最后将军授意，当地穆族男性，假意运往安全地区，实则全部清洗，关大礼堂里面，扫射，太血腥残忍 了。我暂停⏸️了半小时，压抑坏了。秋后算账，最后塞族总司令被海牙国际法庭，判无期徒刑，反人类罪。 小视角： 母亲，做为第一视角，我们太熟悉了，各种的花式违规，谋取私利。从开始的让丈夫当难民代表，到最后硬塞儿子们进工作人员室。可以说，我们非常理解，人性，母爱 ‍ ，夹带各种各样的自私念头。 大视角： so tmd what！小视角没用，在滚滚乱世中，小人物的各种努力 ，最后都被碾压成齑粉。女翻译雪❄️中回家，白茫茫，老公儿子死了真干净。靠联合国 决议，英美法德荷等出兵，强行压制当地战乱，分配国土范围。不过，仇恨又将传下去，下次，说不定是穆族反过来屠杀。 心得： 1。学习门外语，可以当狗🐶翻译，逃过一命，但没学对方向，比如他老公，校长同志，学的德语🇩🇪，没用。 2。落后就要挨打。挨打立正是看得起你，不然就双手抱头 ，跪姿排队运走。 3。祖国万岁！,,1.0,0
17,17,34951210,阿伊达，你往何处去？,79c7b86bb8ad3d804da1feecd3b0a986,df3d08c81e3762f01e6f2915f545cdc4,5.0,2021-06-21 17:08:15,#2021年上海国际电影节#  6月20日 上海市沪北电影院 四星半。 这部电影的背景是1995年的斯雷布雷尼察大屠杀。斯雷布雷尼察位于波黑东部，是穆斯林聚居的一块“飞地”，当地原有居民3万多人。1993年6月，波黑战争期间，联合国安理会宣布将波黑首都萨拉热窝以及斯雷布雷尼察等地划为“安全区”，并规定这些“安全区”为“非军事区”，不应受到任何一方的武装攻击和发生任何敌对行动。然而，这些规定并未得到有关各方的遵守。 1995年7月11日，波黑塞族武装攻占斯雷布雷尼察，并宣布建立地方政权。联合国安理会随后通过决议，希望塞军撤出该地区，无条件释放被扣押的维和人员，并在那里重建联合国安全区，但遭到塞族方面坚决拒绝。14日，塞尔维亚方开始屠杀斯雷布雷尼察的男子，共屠杀八千余人，并掩埋了尸体。 波黑战争结束后，波黑穆斯林失踪人口委员会在斯雷布雷尼察发现许多埋尸坑，并掘出数千具尸体。长期以来，波黑政府一直否认发生在斯雷布雷尼察的大屠杀事件，直到2004年6月承认。2020年是斯雷布雷尼察大屠杀25周年，《艾达，怎么了》这部电影就是为了纪念死难者而拍摄的。 这部电影的主人公艾达是联合国的一名翻译，她的丈夫是高中校长，还有两个二十岁左右的儿子。影片开始时，他们生活的斯雷布雷尼察遭到轰炸，平民前往联合国驻地寻求庇护。艾达利用职务之便，将家人接进了联合国基地。但是随着局势的发展，联合国也不再有能力保护平民，塞族军队强行进入基地，宣称要把平民接去安全的地方。这期间，艾达一边做着翻译工作，一边不断想办法，希望能为家人寻求一条生路。然而直到最后，联合国也被迫撤离，她的丈夫和儿子最终还是被塞族军队带走，惨遭杀害。 很偶然地买了电影票，看电影之前也没有做功课，没想到是一个如此沉重的主题。从电影开场心就一直揪着，一直到结尾发现一切都无法挽回的时候，有一种深深的无力感。电影的节奏感很好，紧张的氛围贯穿始终，有几个片段让人印象深刻： 一是平民在基地度过的第一个夜晚，大家横七竖八地躺在地上，主角一家围坐在一起，企盼战争结束后的生活。这是一家人最后一次围坐在一起聊天。二是艾达的家人被带走，和其他年老和年少的男子一起被带进一间空房间，房门关上，枪杆从两侧的窗里伸进来，然后镜头切到窗外的景色，一片枪声。三是战争结束后，艾达去认领家人的尸骨，当她终于看到熟悉的衣物的时候，她身体一震，却不敢上前。再后来她颤抖着蹲在尸骨旁，握着干枯的手骨，说：“我的宝贝…”。 在家人被带走之前，艾达的形象一直是果断而强悍的。在她为家人四处奔走的时候，我一直以为他们会有机会幸免于难。但事实证明，在战争面前，普通人的任何挣扎都是徒劳的；一切有关战争的、对于当权者的天真幻想，都会被毁灭，被碾碎。女性导演亚斯米拉·日巴尼奇将这段并不久远的苦难记忆刻画在大荧幕上，用一个家庭的故事折射出一个民族的悲剧。人们应当永远反思战争，死难者值得被更多人知晓和铭记。,2.0,,1
18,18,34951210,阿伊达，你往何处去？,9dd550d9310b8595c211cd978dc55edc,2ccb7e11cebf4a9f8b62df254e423ec0,5.0,2021-06-21 00:41:00,2020年4月，我毕业实习，经理是个塞尔维亚人。正值疫情期间，塞尔维亚总统武契奇常在中国媒体中出现，有次和经理提及武契奇，我说这人挺逗。经理怒了：“我恨他，你知道他做了些什么吗？” 当时没花心思去深究，这事儿就过去了。偶尔还会和经理说起武契奇又上中国新闻了，塞尔维亚经理也总借机去怒骂她的总统。 2021年4月，毕业后我从实习公司辞职回国。学国际法的我去了联合国国际刑事法庭余留机制远程实习。实习的地方主要处理的就包括“艾达，怎么了”电影中的背景，斯雷布雷尼察大屠杀。可别说斯雷布雷尼察了，我当时连前南斯拉夫都知之甚少，便想着在法院边工作边积累知识吧。 2021年6月8日，联合国国际刑事法庭余留机制对波黑塞族共和国前总司令姆拉迪奇进行终审，电影中那个伪善的司令被判无期徒刑。记得开庭前后，我每天都得在网上搜索关于姆拉迪奇的资讯，常看到有人提及 “艾达，怎么了”。看多了，没法忽略我对这部电影的好奇心。先去问了上一份实习的塞尔维亚经理，她向我大力推荐。又问了在国际法庭的几个上司与同事，全大力推荐，看来我得找找资源。正巧那几天上海电影节排班出了，这部电影位列其中。与好友提及这部电影，一拍即合，抢票也非常顺利，实在和这部电影有缘。 2021年6月20日，上电影院看“艾达，怎么了”。可能因为每天的工作与电影内容有关，电影里的真实故事，和我距离更近，直击心灵，电影结尾我哭到抽抽。好友抓住我的手臂让我冷静，我一抽一抽地说：“可是大屠杀还在继续，联合国能做什么…” 我语无伦次。 我心里难受。2021年，姆拉迪奇被判无期徒刑。民众和各国都向联合国抱怨为何正义迟到，我的塞尔维亚经理和我说，姆拉迪奇都79岁了，无期徒刑对他有什么意义呢？这也是无数克罗地亚人，波黑人，塞尔维亚人的心声。塞尔维亚人果真是中国人的好伙伴，这点我这前经理倒是和她痛恨的总统相似。抱怨完姆拉迪奇，她问我，你虽然年轻，但你知道你们在南斯拉夫大使馆被轰炸的事儿吗？我直言知道但了解不多。她感叹，姆拉迪奇被审判了，但美国呢，总有些国家会逍遥法外。 电影片尾字幕播放的时候，经理的话在我脑子里晃悠。2021年，巴以冲突。2021年，提格雷地区饥荒，更别说一场新冠疫情带走多少人的生命。放映厅的灯亮了，该散场了，我心里还是难受，世界上的大屠杀结束了吗？我们能为和平做些什么？ 姆拉迪奇审判那天，有被害者家属入席旁听，一位被害者的母亲哭着说我要在死前，看到正义到来。这位母亲可能就像艾达，这位母亲被杀的孩子或许可能和你我差不了几岁。 那天开庭前，上司对我们几个实习生说：我们要参加的是一场会被写到历史教材的审判，所以请大家尽全力融入和感受。2021年6月30日，法院又要审判另两个与前南斯拉夫遗留问题有关的战犯。我想联合国确实是在做些什么的，但还需要再去做些什么，我希望我以后也能做些什么。 电影结束后，好友也很动容。从影院走出来，她说：“我们要怎么做，才能帮助世界和平？” 我说：“我也不知道，可能多读书吧。” 和好友告别后，我在上海夜晚的街上骑行，看到养护绿化带的工人边做事边互相咧嘴笑。我又想到好友关于世界和平的问题，我想，可能有一天共产主义会实现世界和平吧？也不愿多想，暂且心里好受点了。,5.0,1.0,7
19,19,34951210,阿伊达，你往何处去？,4149c0b86ad7e6da48d8b08a82739775,194f1a83f2022e3b2502c390d3d8e681,,2021-06-12 09:02:38,"《艾达，怎么了》是一部波黑的电影，很可惜没能在看电影之前提前了解一些有关波黑战乱的历史背景，所以并没能特别理解影片中所涉及的战争局势具体是什么样的情况。但好在这部电影并不怎么掉书袋，重心还是放在对战争中人性善恶的讨论上，这样的讨论，在任何纷繁复杂的战争局势中都会出现，或者，用一个更确切的措辞——都会再次灾难性的重演。
本片当然不能算是一部特别出色的战争片，它的选题和切入角度很新颖，对难民营的呈现也很有设计感，所以影片前半段给我很大的惊喜，期待它能有一个比较惊艳的故事但后半段的走向却几乎越来越朝着套路化的方向发展，当地武装势力一出现，几乎就能猜到影片最后的结局了。
从这些剧情上的漏洞和影片拍摄手法上的不成熟可以看出，这位导演应该是刚刚开始拍电影没多久（事后我查了一下，这确实是她的处女座），影片中的很多段落都可以看出导演其实很有才华很有想法，但这些想法太过零散，她不太清楚该如何完整的把这些小心思合理的塞进一部极其重视节奏感的战争片中去。比如艾达把家人接到联合国营地后，插入了一段艾达一家曾经在酒吧狂欢的回忆段落，用以衔接一家人在难民营中畅想的“从这里出去以后，天天都过节”的美好愿望。但这个回忆段落放在此处未免过于冗余，它试图渲染的时过境迁的情绪的时机选的不太对；回忆段落里暗示出来的信息在影片后半段也没有继续交代，且这一场面中出现的人物们在之后的情节中也没有什么人物弧光的展现。
导演不止一次的在影片中安排了这种略带煽情氛围的段落，且总是将摄影机对准人脸拍摄特写，似乎是想要用最直接和粗暴的方式去让观众记住这些因为战争而遭受灭顶之灾的人们。但这样的处理手法恰恰暴露出来了导演在人物塑造方面的能力不足，她让我们记住了这些脸，却也仅仅只是呈现了这些脸，而没有通过具体的、充满细节的情节来将这些死难者还原成血肉丰满的人。
所以我想说，本片最大的失败之处，正在于导演没能在影片的形式和主题上达成统一一致。形式上的急功近利让影片失去了能够将小人物还原成丰满个体的机会，而主题上，本部影片想要探讨的最重要的主题，反而正是体制系统中的个人诉求。
艾达的诉求很简单，她希望自己可以通过职务之便，让联合国的军方给她开个后门，让她能够保护好她的家人。艾达这一人物的微妙之处正在于她的多重身份:联合国工作人员、翻译、当地居民、母亲、妻子。除了作为一个母亲和妻子之外，其余的身份都是社会强加给她的（更残酷一点的说，是战争硬塞给她的）。她一次又一次的向联合国维和部队软磨硬泡，要求他们保护她的家人时，她所拥有的那些社会身份反而成了她的负担。
我们——我是说我们这些自诩为现代人的人，当然可以非常有理由去驳斥艾达的种种开后门的行为，她的做法破坏了体制的公平和信誉，阻碍了系统的正常运作。现代性的系统要求这样的个人为了系统的利益而出让、牺牲自己的利益，最大限度的厘清公权力和私人诉求之间的界限。
但这样的逻辑在极端的善恶困境里是很难成立的。人本性中的善良和为了亲人而体现出的自私的爱是否应该永远让位于作为一个系统成员的所谓职责。而系统的合理性与强大的作用力在人性中极端的恶面前又是否真的有效。艾达不断试图破坏维和部队的规则，是希望自己的丈夫和孩子活下去，而巧妙利用规则的将军最后的目的却是要屠杀难民。
在没能解救自己的亲人之前，艾达很少想要去主动解救其他难民。但当自己的亲人短暂的脱离危险之后，她却可以选择主动站出来去帮助生产的孕妇（这是作为一个同胞、一个个体、一个母亲的帮助，而不是作为一名联合国翻译的帮助）。就这一细节来说，我们不能将艾达的诉求诋毁为彻底自私的爱，而是应该去反思体制与系统为何连人们保护家人这般最基础的私人诉求都无法保障。
影片选择的这个切入点真的很有讨论空间，但它太铺的摊子太大，没能塑造好除了艾达之外的其他角色，导致艾达这一主角的情感动机连带着也变的很模糊，难以让我共情。",1.0,,0
