,Unnamed: 0,电影id,电影名称,用户id,用户名,评分,评论日期,评论内容,有用数,没用数,回应数
8,8,35017349,龙门相,008dad01c45e793566e4c4dc8d2510be,3ad852c0aa9bf6a73488375167bc4def,4,2021-10-02 22:56:38,"至事：前后断层 影片前半部分丝丝入扣，主讲作案。作案期间的篇幅交代了人物关系，也雕刻了丰满的人物形象，一些有隐喻的细节之处也在此呈现，“盲人纹身”这种黑色幽默之处也集中在前半段。 后半部分主讲破案。个人感觉相对拉胯，可能有些主观，因为警察这个角色实在不讨喜，甚至由于一些情感带入（对男主的同理心）让人产生了对真相大白的排斥之情，警察的破案过程有些拙笨，破案原因也带有私情，让人没有爽点也没有感动点。 至情：爱恨难辨 这部影片感觉人人都有错又人人皆有苦衷，很难说谁对谁错。 男主张英豪爱情上对妻子好，分手了也送房子给地方，事业上对兄弟不薄，但兄弟给他戴了绿帽子，媳妇儿还怀上了兄弟的孩子……可是媳妇儿是花钱来买的这事儿本身又让人觉得一切多少有些“自作孽”，可他难找儿媳妇的原因是因为他是个“白事先生”有不得不说他是社会偏见的受害者。 女主虽然是被买来的妻子，因为怀了别人的孩子，因为向往自由，就想杀了丈夫，但关键时刻又不忍心…… 警察起初对王元顺妻子不错，照顾女同志，体谅她一个人带孩子的不容易；但他破案的动力之一是没有及时立功影响了退休待遇，在很多地方表现也过于冷血没有体现出人情味…… 里面的每个人物都大抵有这样的双面的人性展示，让人无法对一个角色彻底爱或者彻底恨，也没法论到底谁对谁错。 《龙门相》两个杀手剧照 至新：全素阵容 整体来看片子还是超出预期。因为全素阵容让人没有额外的/过高的期待，而且也不会因为演员的其它人设影响在剧中的代入感。所以整体表现确实让人觉得不错，表演少有“演”的痕迹，这种接近生活化的、接地气的表演至少让人看着舒服且不会跳戏。 至真：返璞归真 首映礼的时候，看到主创阵容上台，演胖杀手的演员原本职业是导演小区的保安，发言的时候非常简短然后说“我真的很害羞 不好意思”，其实导演和演员们都让人觉得有种“质真”之美好，有种作为新人的懵懂，也有一种无杂的纯粹，那一刻反而让人觉得很感动，很希望每一位演员都能不忘初心，有更好的未来。 《龙门相》 王元顺 片尾曲： 龙门相 (2020)6.12020 / 中国大陆 / 剧情 悬疑 / 肖一凡 / 何教授 马国伟 
最后想说，男主何教授唱的片尾曲不错，原片是凶杀悬疑的感觉，但是片尾曲却把人带进了另一种境界，“复杂的世界 短暂的生命 没死就是明星”，有种张英豪脱离电影之外用上帝视角回叹此片的感觉，让人对影片和人性都有了不一样的思考。  《龙门相》何教授（饰张英豪）",2,1.0,4
9,9,35017349,龙门相,ac3f754afdc69dea600d7367ced9c982,84406f04b7608f46730291df10a48bee,5,2020-08-06 12:03:42,"在西宁锅庄广场露天放影看的～
结构已经算是较为工整了，惊人首作真的可以说得过去，拿肖一凡和科恩兄弟比，比黑色幽默还黑色幽默。
外景拍摄地选得太好了，宁静冷峻的小镇，天生就有发生悬案气质～
那天和何教授同坐一部电梯，想到他手起斧落干净利落砍杀王元顺，不敢让他站在身后。
～原来认为女孩落水是多余的一场戏，映后主创见面后，导演释义，这个是促使何教授放弃抵抗的最后一根稻草，懂了。
名字有点小众，如果改个名字上院线，票房不会差，希望超过那谁～
这个杀手不太冷真的会红～。",1,2.0,2
