,Unnamed: 0,电影id,电影名称,用户id,用户名,评分,评论日期,评论内容,有用数,没用数,回应数
0,0,35014075,剧场版 假面骑士零一 REAL×TIME,7b42a85e5f58acd7925dcfa91a6c2eaf,cd147ae0698a56aaa255e263ce4b02fc,3.0,2021-04-26 12:44:14,假面骑士的剧场版我初中的时候部部看，但到了高中时，退圈了一阵子，直到大学时代中才重新捡起来。一方面是因为学业，另一方面就是在电影内容上，许多剧场版越来越不符合我的胃口。在时间上，往往6-70分钟了事，在这点上我个人有强迫症，固执地认为电影的时长就应该要在80分钟以上，不然就应该叫ov而不是剧场版；在道具场景的风格上，骑士剧场版显得非常的贫瘠，道具也好、特效也好往往和网大差不多；故事内容上偏向简单幼稚，不严谨，还常常出现“爸爸去哪了”的戏码（就是往往会有个小孩，然后骑士都为着那个小孩打来打去）。所以近几年来我看假面骑士剧场版也只是算作一个为了缅怀童年而要完成的任务吧，当然看也只看80分钟以上版的。 所以01这部剧场版要出的时候，我留意了一下，发现居然有80分钟（实际只有79分钟，唉，强迫症真难受），我就从简单留意上升到有所关注上了。没资源前，我还特意去查了国外网站对这部剧场版的评价，其中IMDB网站评分虽然高达9分，但人数太少，不具备参考价值。而日本的filmarks网站上的评分就有点让我惊了，居然有4.1的高分，这个分数可以说是相当耀眼，举个例子，魔法少女小剧场版圆叛逆的物语在filmarks上也没过4。当然由于文化的不同，filmarks的分数也不是完全可信（比如奥特曼里的下限作罗布奥特曼在filmarks评分就不低，甚至高过了泰伽奥特曼），但至少就目前而言，再结合在日本的小伙伴的评价，我对这部剧场版还是期待满满的。 在出了资源后，我也看了这部剧场版。首先不得不承认，这部剧场版没有像以往的那些特别子供向，它还是能做到让不少青年成年观众坐下来观看的，这的确是个值得肯定的地方，剧情大体上也能圆的过去，恐怕就这就能让不少骑士迷打个不低的分数了，其中最让人感到惊喜的是其中的打斗戏份，可以说真的是用心在做打斗了。整部剧主角的打斗戏总共4场：伊甸挑战男主，男主再战伊甸，男主变成地狱高跃蝗虫，男女二人双打路西法。首先比较值得肯定的是从表现来看，双方打得都有来有回，没有说因为新手保护期就在起初把伊甸和路西法抬得很高，其次是男主再战伊甸的那场是真的精彩，还有五个配角骑士表现也是可圈可点。而对于那些真正的反派（就是那帮杂兵），他们的行动理念也是可以理解的，就像现实中的网络暴力和不断劝想轻生的人赶紧跳的那些人一样，他们躲在背后冷漠地推动，以为不会出太大的事情，出了事情也难以被查出或是法不责众，所做一切可能单纯只是心里觉得好玩。这样小小的恶意被汇聚在一起，最终形成了庞大的恶流。 以上就是我对这部剧场版第一印象的优点了。 国内有资源后，我并不是第一时间看的，因为迟迟没出熟肉，所以我先看了看豆瓣上其他人的评价，不得不说，豆瓣上的评价还真有些吓到我了。开局就是8.6分，没过多久涨到8.8，这时我已经看完了这部剧场版，在我觉得已经有些虚高时，评分居然涨到了9分。我承认它的确比以往做的有出彩之处，但说它能上9分比肩其他9分神作，我觉得不至于。从我在开头给出的那三个观点来看，我个人可以给个7分：首先他没到80分钟（强迫症没办法），其次哪怕打斗做得再精良，在一些道具、场景、风格上还是像部网大（不知道是不是错觉，似乎现在的骑士挺喜欢体育场、公共广场啊，以前我吐槽老选废工厂，现在看来，至少废工厂能突出骑士的神秘感和孤独感啊），最后是故事上，虽然大体上说得过去，但细节上还是有许多理不清的地方。 我第一个疑惑就是那地狱密匙和千位劫持剑的关系上：在挑战开始时，剑已经开始计时了，也就是说那把剑到点就能灭世，那还要做地狱密匙干嘛，剧中好像说是为了连接泽雅卫星，所以要把男主引出来，从这个角度上看，那把地狱密匙是关键，计时可能并不重要，但是从伊甸以及后来的路西法的表现来看，计时没到0他们还真的没法随时随地开灭世（第二次打斗中伊甸算不算开灭世真不好说，如果算开，那金属蝗虫未免太强了些，而且这样看来路西法也是能随时开大的，如果不算开灭世，只是算把能量先用一部分的话，那计时也应该重修开始才合理吧），也就是说，那把千位劫持剑的计时还是有必要的，而这样的话，男主你既然破坏不了地狱密匙，你还破坏不了那把剑吗？ 其次有个地方也很奇怪，为什么男主要学BVS的超人一样不先把话说清楚，非要先打一架才能把话说出来，我看男主比超人都有足够的时间把话说清楚。 第三，伊甸开大顺手灭掉信徒那一段我个人没理明白，那些信徒不应该是和杂兵骑士一样是由连接器远程控制的纳米机器人组成吗，正因为这样他们才能聚集在一起吧，敢真身前往现场应该没有人吧，那么伊甸开大灭信徒就老有问题了。 最后还有不是槽点的槽点，伊兹的02实在太sao了，像怀了一样。,5.0,4.0,14
1,1,35014075,剧场版 假面骑士零一 REAL×TIME,e7766b86076f3acec03e214090fe1a5e,aa068250325852a3478835e3acbd6ccd,5.0,2021-10-16 21:05:07,超好看啊 我好喜欢这张剧照啊，呜呜 草了我还得写多少字，我只是想来发张图的，呜呜呜呜呜呜呜呜呜呜呜呜呜呜呜呜呜呜呜呜呜呜呜呜呜呜呜呜呜呜呜呜呜呜呜呜呜 怎会如此 下面是凑字数 啊啊啊啊啊啊啊啊啊啊啊啊啊啊啊啊啊啊啊啊啊啊啊啊啊啊啊啊啊啊啊啊啊啊啊啊啊啊啊啊啊啊啊啊啊啊啊啊啊啊啊啊啊啊啊啊啊啊啊啊啊啊啊啊啊啊啊啊啊啊啊啊啊啊啊啊啊啊啊啊啊啊啊啊啊啊啊啊啊啊啊啊啊啊啊啊啊啊啊啊啊啊啊啊,,,0
2,2,35014075,剧场版 假面骑士零一 REAL×TIME,23b562adcf32dffc122512706e6ed913,f286c65721a23d51231f2ac9d594863c,4.0,2021-06-12 22:34:22,"对这部剧场版期待了很久，但看完后觉得还是有点“不够”。

整部剧场版的剧情太简单了，完全就是从头打到尾，文戏太少，很多情节还有人物的刻画其实都可以再深入一点，让剧情更有深度，可惜没有。

为了给心爱的人创造天堂，所以要全世界陪葬。这是一个很中二，同时也很沉重的情感主题。但是给反派发挥这种心理演技的地方却不多，实在可惜。

还有像是或人、不破、刃姐、老千等众人打完亚克之后的生活，新伊兹恢复记忆前与或人的日常互动等等，这些其实也都可以在电影里表现一下。

从不破说新伊兹不是以前的伊兹的时候，可以看出新伊兹是很介意的，她为自己不是以前那个伊兹感到难过，这个也可以重点刻画一下，为后面新伊兹继承过去回忆做伏笔，引发一个小高潮。  但是整部电影就像赶时间一样上来就直奔主题，一直打打打。不知道是不是东映已经没把心思放这边，资金给的少，拍摄排期也少导致的。

看完后唯一开心的就是伊兹“恢复”了记忆，变回了完整的伊兹。不过想不到居然真的是「把旧伊兹的数据存到了泽亚，然后又传回给现在这个伊兹」这种剧情。

虽然这部剧场版遗憾很多，但至少伊兹和或人又能在一起了，也算是圆了我的一个心愿吧。

或人为了不让重要的人—哪怕现在这个只是“仿造品”—再次受伤，所以所有事情都自己一个人扛，最后还把自己逼上绝路，打算用肉身阻止世界末日。但是在最后的关头被伊兹拦了下来，一句“我不想失去你”，让屏幕前的我差点被甜死。    最后伊兹成功晋升令和第二位女性假面骑士，与或人夫妻双打，实在太有爱。

“总有一天我也要用爆笑段子让伊兹发自内心笑出来。”

“只要和或人社长在一起，我早晚会发自内心笑出来的。”",,,1
3,3,35014075,剧场版 假面骑士零一 REAL×TIME,0273074ab82b496703ad8fb9d030f505,9f1b3be4a82b11d104e4ef7f7ccb1c19,,2021-05-03 03:36:58,皮套设计符合审美，动作戏和特效设计富有张力，尤其是特技摩托场面，在圣刃之后更是久违，十分过瘾。配上出色动感的音乐，燃点只欠东风。 好在剧情尚可，既有对主角骑士精神更合理的塑造，也有伏笔和反转的设计，主题上的所抑所扬也与剧情结合得比较好，说得清楚、说得有一定说服力，就足矣。燃点、泪点俱备，穿插的笑点也恰到好处（当然，一些大场面的粗糙特效等槽点也成了观看的一个乐子）。 值得一提的是，这部令和“老大哥”对平成老大哥的致敬很有心意，或者说某种程度上遥相呼应。 一是教堂场景， 二是守护笑容的台词， 三是由身到头的变身特效， 以及从个人感受来说，前面提到的特技摩托场面也让我想起了看空我的摩托特技秀时的赞叹。   相比于TV留下的遗憾，这部剧场版已让我满意很多了。现在想想，去除TV中间的迷惑剧情和人物塑造，接上这部剧场版，不求有好感但求不反感的角色塑造、稳当也有惊喜的剧情、偶尔的造梗与情怀致敬、紧跟时代的主题、富有设计感或魄力的皮套设计与武戏设计、激昂的燃向音乐等等，这才是我真正想看到的令和伊始的样子。这部剧场版多多少少算是弥补了一些遗憾。,2.0,,1
4,4,35014075,剧场版 假面骑士零一 REAL×TIME,4dd12a8b3d76f4adf728e70f7818ca1f,d7a49236e61d1aa499b1dfbff8d1a53c,,2021-04-23 11:47:49,看剧场版前10分钟: 叙事设计还不错🤩 看剧场版中20分钟： 东映终于想起来有个要素叫摩托车啦😐 看剧场版后30分钟： 该死的不是我老婆而是这个崩坏的世界！我杀人放火只是不愿失去你。我洗白只是我也悟啦！🙄 看剧场版最后15分钟： 夫妻双打守护反派共斗真是太燃不起来啦！🤡 看完剧场版后： 我是繺哔，再烂骂完下次还得看。😐😐👏,3.0,2.0,1
