,Unnamed: 0,电影id,电影名称,用户id,用户名,评分,评论日期,评论内容,有用数,没用数,回应数
4,4,35123973,奇袭地道战,d4aaf792befb2200ceba453bca42587a,44db92c917ef4c0751170e756a504c94,5.0,2020-08-14 23:26:48,摸着良心说，这真是一部良心之作，也是网大的出圈之作。有故事，有脑子，有场面，有动作，有情感，还有正能量，总之，精彩！       主旋律题材能拍成这样，确实不错，也能吸引年轻的一代。让我想起了徐克的《智取威虎山》，样板戏拍成了有情有义的动作片，让主旋律电影有了新的突破。      本片人物众多，每个人物都有特点，要么是内在心理，比如强壮的男人居然怕黑；要么是外在造型，有铁头功，有“土行孙”……总之构成一组人物奇观，可见编导们的良苦用心。每个演员的演技都在线，唯独那个政委有点出戏……      老戏骨刘亚津演得真好，悲喜交加，几次让人泪目，人物本身设计的反转，也合情合理，唯独不舒服的地方是，他前面老是说歇后语，有点贫，后面几乎不说了，前后不太连贯。     毕竟是战争片，枪林弹雨，白刃肉搏，轰炸塔楼，也是拍到相当精彩到位。    总之，值得一看啊！,3.0,12.0,7
5,5,35123973,奇袭地道战,9111dfed0f6f8ee60f7a562a8a5cf368,9fe69826b777d4034aa1eb7cdf726969,4.0,2020-08-14 16:40:26,《八佰》即将登陆影院的消息，给当下低迷的影视业打了一剂强心针，不光观众蠢蠢欲动，影院也开始欢呼雀跃，只待8月21号的到来，好揭开《八佰》的神秘面纱，重温那段血与火的光辉岁月。近期，除了万众瞩目的《八佰》以外，网络电影也是佳作频出，正在优酷视频上线热播的《奇袭地道战》，就很是值得一看。影片对观众熟知的经典作品全新原创，呈现给观众的是血脉喷张的热血对决。  提起“地道战”，大家并不陌生，问世已有半个多世纪之久，在中老年观众中有着深厚的群众基础，与“地雷战”并称为上个世纪国产战争题材的“泰山北斗”。影片《奇袭地道战》，并不是对经典作品的简单翻拍，而是诚意十足的原创作品，带给观众的是全新的故事、人物和内核，并由此发散开来，在保留了“地道战”这一经典元素的基础上，充分运用现代电影技术和制作手法，重温经典IP的同时又给观众带来浓浓的新意。  《八佰》的成功之处在于演员的选择，黄志忠、欧豪、王千源、姜武、张译，每个人都各具特色，演出了个性十足的精气神，《奇袭地道战》同样如此。片中的出场人物众多，但人物并非脸谱化或是群像化，而是各具特色。敢于创新、思维敏捷的叶成，枪法精准、冲锋在前的石头，孔武有力、头脑简单的大春。机智勇敢、不怕牺牲的孙小茸……人物的演出并没有简单的流于表面，而是巧妙地找到了演员与角色之间的契合点，出场人物与所处的时期与事件相吻合，成为片中不可或缺的加分项。  影片《八佰》里，四行仓库成了敌我双方争夺的主战场，面对着日军的无数次突击，将士们沉着应战，巧妙地利用地形上的优势，在狭小的空间里做文章，令日军疲于奔命，《奇袭地道战》同样也在地道上做足了文章。面对着日军的疯狂扫荡，军民团结一心，并没有硬碰硬，而是将简易的地道进行科学且合理的改造，增设陷阱、布置机关、埋伏枪手、设置观察，把地道改造成迷宫一样，让日军深陷其中无法自拔，乖乖地落入圈套还浑然不知，成就了“瓮中捉鳖”的经典战术。  对于《八佰》而言，战争是全片的灵魂之所在，毕竟缺衣少食的四百多将士在四行仓库里对决装备精良的日军，光想想就令人热血沸腾，《奇袭地道战》也在战争上做足了文章。从早期的敌进我退、敌退我守，到战士们的主动出击，与日军决一雌雄。双方在战术上的较量也是难解难分，奇袭战、遭遇战、对攻战、肉搏战，黑暗且狭窄的地道里，成为敌我双方以命相搏的主战场，面对着数十倍于自己的日军，战士们沉着应战，在身负重伤的情况下，不惜以自己的身体做盾牌引爆炸药，那感人肺腑的一幕着实令人热血沸腾。  好作品不会被埋没，《奇袭地道战》就是最好的证明，豆瓣开分就夺下7.0的好成绩，两天后直达7.2分，称得上是今年网络电影的新高峰。《奇袭地道战》的上线热播，在致敬经典影片的同时，也走出了一条经典IP重生的新路。对于经典作品而言，翻拍并不是唯一的选择，抛弃固有的模式，抓住影片的主旨和要素，进行大胆的创新，同样能够俘获观众。,2.0,2.0,1
6,6,35123973,奇袭地道战,b6a1df7c27b31bbe34d49ca8c4a96ab6,1c8def10f678f04ddf57236ba18474f7,4.0,2020-08-14 15:39:09,对于喜欢战争片的朋友来说，眼下是一个堪比嘉年华的观影季，大银幕上《1917》和《八佰》交映生辉，网上豆瓣成绩高达7.2，正在优酷热映的年度口碑之作《奇袭地道战》，每一部都是小人物视角与宏大叙事完美结合，都是值得刷了再刷的好电影。     今天要推荐的不是前两部轰天裂地的作品，而是格局有点小而美又同样很具有震撼效果的后者，与一镜到底把技术发挥到极致的好莱坞大片相比，它的故事继承了国产战争片的美学风骨，通俗易懂又严肃活泼，浓缩了家国情怀，热血与气节，也富含智慧与技巧，螺蛳壳里做道场的精巧匠心，打造了很多让人拍案叫绝的名场面。 估计很多人和小编一样，小时候看抗战电影只是单纯的娱乐，得到表面的快乐，感觉炸碉堡送情报，打鬼子杀伪军其乐无穷，游击队武工队都是无所不能的超级战士，小红军们都很神气，成年之后回头再看这些电影，除了原来的快乐，电影本身提供的趣味，体会更多的是前辈的艰辛与牺牲，抗战历程的残酷与悲壮。     就像《奇袭地道战》和《八佰》这样，无名英雄为了捍卫家国的完整，舍生忘死，在明知不可为的险境、绝境，背水一战，放手一搏，一个地地道里，一个在四行仓库，上演战争史上的奇观。现在透过这两部电影，我们不仅很看到别开生面的视觉奇观，更是能感受到一种直上云霄的家国情怀，正是这些小人物真英雄的流血牺牲，让我们可以度过没心没肺的童年时代。 《奇袭地道战》是一部全新的电影，前半场欢快，后半场壮烈，观看体验超过好莱坞大片，因为它没有自嗨不放空炮，更尊重战争片的底层逻辑。     首先它的情节很神奇，却完全脱离了神雷剧情，没有飞檐走壁和手撕鬼子，从前面书生哥叶成从北平回来，帮老爸杀鬼子连枪栓都拉不开，到后来与乡亲们一起挖地道，在失败和挫折中不断汲取经验，与乐观豁达的战友们一起苦中作乐，热血厮杀，最后拼死一役，用生命捍卫家国的尊严，整个过程演绎得掷地有声，情绪饱满真实，有杀敌的快感，失败的痛苦，失去亲人或战友的悲伤与愤怒，也有年轻人的勇气与成长，丰富且坚实的情感，配合跌宕起伏的剧情，形成了扣人心弦的戏剧张力。 基于这样既精致又大气的美学风格，《奇袭地道战》塑造出一大批栩栩如生的平凡英雄，叶成、孙小茸、孙大春、石头、黑子，他们有情有义，有血有肉，每一个都是活生生的人，像孙大春耿直而又简单的性格，富有魔性的笑容，面无表情却一往无前的石头，他们除了战斗中的英勇与火爆，更展现了一方水土特有的豪迈与豁达，包括一度只想让儿子好好活下去的叶富贵，这些形象让人过目难忘，筑成了一道不可撼动的钢铁长城。     同时，从叶成对地道的改进和开发，充分运用自己的知识，融入全新的技术，制造了别开生面的战斗，说明了战争的成败不能只凭一腔热血，而是要由创新与科技来支撑。通过这些情节，《奇袭地道战》证明了战争不是吃鸡，战士没有外挂，没有捷径，更没有主角光环，做一部成功的战争片必须写实，用踏踏实实的情节和人物，才能获得观众发自内心的认可。 2020，是一个特殊的年份，戏里，《1917》，《八佰》，《奇袭地道战》组成炮火喧天影视战争季。在这个和平的年代，我们更不能掉以轻心，更需要通过这些电影，深入的了解战争，正视过去，提振士气，用智慧和勇气让自身变得更强大，面对未知的未来，不负先辈的英勇。,2.0,1.0,1
7,7,35123973,奇袭地道战,03cf4f03bfa4aa13409b459eadf291f7,c695a8e08ed49f433f09786d9722c50e,5.0,2020-08-12 13:03:48,这是一部八分电影，演员把握得可以，没有贬低对手，也没有拔高自己！建议把群众的力量表达出来的，毕竟老百姓干的工作也不少，主角有加分，配角也是如此！  特别是一些套路，比如一讲好话，就要死人，一说照顾好自己，就要完蛋！这样没有质量感！  总的来说，这表达的是爱国情怀。国家是我们的，需要我们来守护！,,1.0,0
8,8,35123973,奇袭地道战,d2b843de79ee7fd70cbb2c4bb9ec8035,4bb049faf8e59393f42fa81e6ac8a0e1,,2020-08-07 12:00:13,最近在优酷提前线上观看了一部抗日题材的电影《奇袭地道战》算是抗日题材的佳作。剧情节奏很好，兼顾了战斗的激情和感人的情节，还有对于反派的塑造，也比较到位。堪称是情怀再续，重塑国民红色经典！我们现在能够快乐地活在阳光里，成长在五星红旗下，正应该感谢那些先烈不屈的斗争精神，与无私的牺牲与付出！,2.0,2.0,0
9,9,35123973,奇袭地道战,cafa4baf573456e2bb97f7272befc78a,cad575d20c2f241ca5f84b20677de0b2,,2020-08-06 15:26:06,地道战是在中国抗日战争时期，在华北平原上抗日军民利用地道打击日本侵略者的作战方式。地道战战法使冀中根据地形成了一个村村是阵地的杀敌堡垒。而这些地道设施，一旦在进行作战时，又成了军政机关领导人指挥作战的临时场所。根据地军民在地下、地面和空中建成了一套完整的立体式作战系统，被称作“地下长城”的地道网，成了中国共产党领导的八路军与日本侵略军进行战斗的重要依托。,1.0,2.0,0
10,10,35123973,奇袭地道战,77a590de9ad818de6aa12dc195ff6289,35311af8f0acd404828a493f50be78c6,,2020-08-06 13:28:51,影片以抗日战争时期为背景，描绘了日寇对冀中平原进行“大扫荡”，进步青年叶成从北平学成归来加入了村里的地道建设，面对不解和质疑，在党员马政委的领导下，叶成用所学知识带领村民升级完善地道，一次次巧妙化解日军的袭击。狡猾的日军将领采用孤立策略，扫除了叶成周边的地道村。岌岌可危之下，叶成主动出击，利用周边地形将地道连成网络摧毁了敌军的后方炮楼，对日军进行反包围，大获全胜。自从看了电影智取威虎山之后，就对这这类型的翻拍电影充满了期待，希望这部也不会让我失望。,1.0,3.0,1
11,11,35123973,奇袭地道战,d2129f4491de33c5d27d7f2436e917b3,c3bb6f719742fd1e5768d6d1361cfb49,,2020-08-06 13:24:42,虽然还没有去看，但是看了预告内心澎湃。很期待影片的上映哦！看完了简介，知道这个影片讲述的是抗日战争时期的故事。和其他抗日神剧相比，这个影片国际上比较好。另外，拍摄的那些技巧也不错。总体很nice。等到上映的时候，我都会拉着自己的好朋友去看的，希望到时候得到更多的视觉体验。期待一个非常好的观影体验。,1.0,3.0,0
12,12,35123973,奇袭地道战,d2129f4491de33c5d27d7f2436e917b3,c3bb6f719742fd1e5768d6d1361cfb49,,2020-08-06 13:13:49,因为影片没有上映，所以大概提前看了一下简介。知道了这个影片主要讲述了抗日战争时期，日寇对冀中平原进行“大扫荡”，进步青年叶成从北平学成归来加入了村里的地道建设，面对不解和质疑，在党员马政委的领导下，叶成用所学知识带领村民升级完善地道，一次次巧妙化解日军的袭击。狡猾的日军将领采用孤立策略，扫除了叶成周边的地道村。岌岌可危之下，叶成主动出击，利用周边地形将地道连成网络摧毁了敌军的后方炮楼，对日军进行反包围，大获全胜。,,,0
13,13,35123973,奇袭地道战,86338729e0532f6e2a5e39e93207d77c,2c47106e924762fdda8cfdd4f3f4005c,,2020-08-06 13:11:59,"“忘记历史，等于背叛""”。 记忆与遗忘，真相与谎言，被掳与释放。

《奇袭.地道战9》电影聚焦于抗日战争时期，进步青年叶成如何在不解和质疑下投身抗战，利用所学知识带领村民升级完善地道，巧妙化解日军多次袭击，并与敌军展开最终决战的故事。

这部电影绝不同以往刻板的印象，也绝非抗日神剧，是一部非常有质感有态度的影片。在预告片的一-开场，就有一一个狗汉奸带领着一队日本人，在逼问村庄里的小孩子:“你们村其他人都躲哪了?""在日军的利刃下，村民的鲜血流淌、渗透到了泥土下方的地道里-而那里，正躲藏着更多的村民。

众所周知，抗日战争时期，日寇对冀中南地区进行惨绝人寰的“三光政策”大扫荡。而地道战这种集合了抗日军民智慧的特有战术，曾经取得过非凡的战果。但在历史上的战争初期，民兵先在自己家中挖了单口隐蔽洞(俗称蛤蟆蹲)，很快遭到日伪军的破坏。

后来又改造成能进能出的双口隐蔽地道，却还是不能有效战斗。这一-点，在剧情中也有着尊重历史的还原。在预告片中，面临着鬼子猛烈的炮火、无处不在的搜查，电影发出了震耳欲聋的口号声:地下地上，寸土不让!!影片中新生代演员搭配实力老戏骨，共同描绘了抗战时期小人物的爱国觉醒，刻画了他们共同守护家乡、抵抗侵略者的不屈热

血。“夙愿版""预告片中一句""我希望所有人都能走出地道，活在阳光下”更将这股情绪推向高潮，让观众们在缅怀先辈的同时，感受到今日幸福的来之不易。",,,0
14,14,35123973,奇袭地道战,abcd89fb7efaf1b55751e0e0a9639fe7,7ef975192509aa43c6718ea772aed119,,2020-08-06 13:11:27,"看预告本以为是一部抗战神剧没想到最后看到落泪了。本以为是-部抗战神剧没想到最后看到落泪了。在八-这个特别的日子里，也算是带着一种特别的感觉了。以抗战时期为背景，抗战时期为背景，通过一个个小人物的塑造，来致敬人民英雄，呼应当代歌颂平凡而伟大的和平守护者，""超乎小我，人恒爱之""的平民英雄形象跃然而出。年轻一辈通过影片的方式来了解祖辈们的付出，才能深知现在美好生活的不易。",,,0
15,15,35123973,奇袭地道战,95695b2b9766cd164d3f0a9a7668a218,d335a5cf4bed3e1f176eb93ab833d2b0,,2020-08-06 13:11:08,"这部电影绝不同以往刻板的印象，也绝非抗日神剧，是一部非常有质感有态度的影片。在预告片的一开场，就有一一个狗汉奸带领着一队日本人，在逼问村庄里的小孩子:“你们村其他人都躲哪了?”在日军的利刃下，村民的鲜血流淌、渗透到了泥土下方的地道里-而那里，正躲藏着更多的村民。  众所周知，抗日战争时期，日寇对冀中南地区进行惨绝人寰的“三光政策""大扫荡。而地道战这种集合了抗日军民智慧的特有战术,曾经取得过非凡的战果。但在历史.上的战争初期，民兵先在自己家中挖了单口隐蔽洞(俗称蛤蟆蹲)，很快遭到日伪军的破坏。  后来又改造成能进能出的双口隐蔽地道，却还是不能有效战斗。这一点，在剧情中也有着尊重历史的还原。在预告片中，面临着鬼子猛烈的炮火、无处不在的搜查，电影发出了震耳欲聋的口号声:地下地上，寸土不让!!影片中新生代演员搭配实力老戏骨，共同描绘了抗战时期小人物的爱国觉醒，刻画了他们共同守护家乡、抵抗侵略者的不屈热  血。“夙愿版”预告片中一句“我希望所有人都能走出地道，活在阳光下”更将这股情绪推向高潮，让观众们在缅怀先辈的同时，感受到今日幸福的来之不易。",,,0
16,16,35123973,奇袭地道战,d2129f4491de33c5d27d7f2436e917b3,c3bb6f719742fd1e5768d6d1361cfb49,,2020-08-06 13:10:32,看了影片的预告，觉得该影片应该算是致敬经典吧，燃一波爱国情怀、红色精神，向革命先烈致敬。 影片中出现的“抗日天团”，都是由一个个朴素的民兵组成的，他们是抗日战争中的英雄。而这些英雄们的后辈，也来到了路演现场，看到他们的身影，爱国魂更燃烧起来了。   有国才有家，这些人间真情，就是这些人们奋不顾身、团结抗敌的内在动力了吧。爱国不该是种教育，而是一种信念！,,,0
17,17,35123973,奇袭地道战,570c400415609e9e2d38bf37427b080d,c56ff44e82e8753a544f7706c41a3e34,,2020-08-06 13:10:09,"电影聚焦于抗日战争时期，进步青年叶成如何在不解和质疑下投身抗战，利用所学知识带领村民升级完善地道，巧妙化解日军多次袭击，并与敌军展开最终决战的故事。
这部电影绝不同以往刻板的印象，也绝非抗日神剧，是一部非常有质感有态度的影片。
在预告片的一开场，就有一一个狗汉奸带领着一队日本人，在逼问村庄里的小孩子:“你们村其他人都躲哪了?”在日军的利刃下，村民的鲜血流淌、渗透到了泥土下方的地道里-而那里，正躲藏着更多的村民。
众所周知，抗日战争时期，日寇对冀中南地区进行惨绝人寰的“三光政策”大扫荡。而地道战这种集合了抗日军民智慧的特有战术，曾经取得过非凡的战果。但在历史上的战争初期，民兵先在自己家中挖了单口隐蔽洞(俗称蛤蟆蹲)， 很快遭到日伪军的破坏。
后来又改造成能进能出的双口隐蔽地道，却还是不能有效战斗。这- -点，在剧情中也有着尊重历史的还原。在预告片中，面临着鬼子猛烈的炮火、无处不在的搜查，电影发出了震耳欲聋的口号声:地下地上，寸土不让! !
影片中新生代演员搭配实力老戏骨，共同描绘了抗战时期小人物的爱国觉醒，刻画了他们共同守护家乡、抵抗侵略者的不屈热
血。“夙愿版”预告片中一句“我希望所有人都能走出地道，活在阳光下”更将这股情绪推向高潮，让观众们在缅怀先辈的同时，感受到今日幸福的来之不易。",,,0
18,18,35123973,奇袭地道战,358a6d58578d2bc50b74413b13e03cf7,21c3fbd7942ce4b2f278470fd905ec51,,2020-08-06 13:08:23,"“忘记历史，等于背叛""”。 记忆与遗忘，真相与谎言，被掳与释放。

《奇袭.地道战9》电影聚焦于抗日战争时期，进步青年叶成如何在不解和质疑下投身抗战，利用所学知识带领村民升级完善地道，巧妙化解日军多次袭击，并与敌军展开最终决战的故事。

这部电影绝不同以往刻板的印象，也绝非抗日神剧，是一部非常有质感有态度的影片。在预告片的一-开场，就有一一个狗汉奸带领着一队日本人，在逼问村庄里的小孩子:“你们村其他人都躲哪了?""在日军的利刃下，村民的鲜血流淌、渗透到了泥土下方的地道里-而那里，正躲藏着更多的村民。

众所周知，抗日战争时期，日寇对冀中南地区进行惨绝人寰的“三光政策”大扫荡。而地道战这种集合了抗日军民智慧的特有战术，曾经取得过非凡的战果。但在历史上的战争初期，民兵先在自己家中挖了单口隐蔽洞(俗称蛤蟆蹲)，很快遭到日伪军的破坏。

后来又改造成能进能出的双口隐蔽地道，却还是不能有效战斗。这一-点，在剧情中也有着尊重历史的还原。在预告片中，面临着鬼子猛烈的炮火、无处不在的搜查，电影发出了震耳欲聋的口号声:地下地上，寸土不让!!影片中新生代演员搭配实力老戏骨，共同描绘了抗战时期小人物的爱国觉醒，刻画了他们共同守护家乡、抵抗侵略者的不屈热

血。“夙愿版""预告片中一句""我希望所有人都能走出地道，活在阳光下”更将这股情绪推向高潮，让观众们在缅怀先辈的同时，感受到今日幸福的来之不易。",,,0
19,19,35123973,奇袭地道战,570c400415609e9e2d38bf37427b080d,c56ff44e82e8753a544f7706c41a3e34,,2020-08-06 13:07:38,是一部抗战题材的国产网络电影，影片写作巧妙，开头应用旁白完整的讲述了1943年日军对冀中“大扫荡”，在党员马政委的领导下，青年叶成利用周边地形将地道包围了敌军，获胜！故事生动、台词经典、画面真实、结局完美。发扬了中国革命英雄豪杰正义正能量优秀传统的革命精神值得学习！期待上映，传递正能量，让更多的观众看到该影片,,,0
20,20,35123973,奇袭地道战,16da55deb4addae756fc167502320712,ba5e1ac05b43810a8d0883d939b43ab0,,2020-08-06 13:07:28,貌  似  一  部  满  满  的  正  能  量  的  好  片  子， 奇      袭     地      道     战 ，真  真  正  正  的   地  道战  ，  还  没  看  到，  不  过  很  是  期   待    ……，……1111112211111222222222222222222221111111111111111111111111－－4444441111//44111%%17115856555536853423336884117666841444366544%447553333665,,,0
21,21,35123973,奇袭地道战,329de4f65a657601f91995f0532f63ba,b46cde75295453538a84d3cc43773542,,2020-08-06 13:07:25,,,,0
22,22,35123973,奇袭地道战,95695b2b9766cd164d3f0a9a7668a218,d335a5cf4bed3e1f176eb93ab833d2b0,,2020-08-06 13:06:45,"《奇袭.地道战》电影聚焦于抗日战争时期，进步青年叶成如何在不解和质疑下投身抗战，利用所学知识带领村民升级完善地道，巧妙化解日军多次袭击，并与敌军展开最终决战的故事。 这部电影绝不同以往刻板的印象，也绝非抗日神剧，是一部非常有质感有态度的影片。在预告片的一开场，就有一一个狗汉奸带领着一队日本人，在逼问村庄里的小孩子:“你们村其他人都躲哪了?”在日军的利刃下，村民的鲜血流淌、渗透到了泥土下方的地道里-而那里，正躲藏着更多的村民。    众所周知，抗日战争时期，日寇对冀中南地区进行惨绝人寰的“三光政策""大扫荡。而地道战这种集合了抗日军民智慧的特有战术,曾经取得过非凡的战果。但在历史.上的战争初期，民兵先在自己家中挖了单口隐蔽洞(俗称蛤蟆蹲)，很快遭到日伪军的破坏。后来又改造成能进能出的双口隐蔽地道，却还是不能有效战斗。这一点，在剧情中也有着尊重历史的还原。在预告片中，面临着鬼子猛烈的炮火、无处不在的搜查，电影发出了震耳欲聋的口号声:地下地上，寸土不让!!影片中新生代演员搭配实力老戏骨，共同描绘了抗战时期小人物的爱国觉醒，刻画了他们共同守护家乡、抵抗侵略者的不屈热血。“夙愿版”预告片中一句“我希望所有人都能走出地道，活在阳光下”更将这股情绪推向高潮，让观众们在缅怀先辈的同时，感受到今日幸福的来之不易。",,,0
23,23,35123973,奇袭地道战,0f8568e2bf9bd4ee59e5a43e5b701c15,09fc779e8806703abc41e29acdee6a21,,2020-08-06 13:05:45,是一部抗战题材的国产网络电影，影片写作巧妙，开头应用旁白完整的讲述了1943年日军对冀中“大扫荡”，在党员马政委的领导下，青年叶成利用周边地形将地道包围了敌军，获胜！故事生动、台词经典、画面真实、结局完美。发扬了中国革命英雄豪杰正义正能量优秀传统的革命精神值得学习！期待上映，传递正能量，让更多的观众看到该影片,,,0
24,24,35123973,奇袭地道战,329de4f65a657601f91995f0532f63ba,b46cde75295453538a84d3cc43773542,,2020-08-06 13:05:09,"看了一下预告。“夙愿版”预告片中一句“我希望所有人都能走出地道，活在阳光下”更将这股情绪推向高潮，让观众们在缅怀先辈的同时，感受到今日幸福的来之不易。电影聚焦于抗日战争时期，进步青年叶成如何在不解和质疑下投身抗战，利用所学知识带领村民升级完善地道，巧妙化解日军多次袭击，并与敌军展开最终决战的故事。
这部电影绝不同以往刻板的印象，也绝非抗日神剧，是一部非常有质感有态度的影片。",,,0
