,Unnamed: 0,电影id,电影名称,用户id,用户名,评分,评论日期,评论内容,有用数,没用数,回应数
0,0,35151491,奇奇怪怪：整容液,9a97e0bb76a59295197ba7b03242a1ec,c3cc927c4514491fb6ef5349a8ba6e37,,2020-10-22 01:37:46,韩国动画电影之路任重道远……能看出很多导演思维定式的地方：女胖子一定要被陌生人身边人当面施加恶意，还一点不敢怼回去只敢像个唐氏儿一样嗫嚅几句听不懂的话；想变美一定是要寻找爱奔赴爱；女主杀人一定是被人碰了逆鳞让人感到一点点也好的情有可原；越过千帆，还是那个最初爱的人最打动自己……就很想翻白眼。漫画前后两部其实塑造了一个非常“办大事”的恶女形象，就像《狼狈》里的莉莉子，自私，缺乏对亲近人的同理心，想要的怎么也要够到，只要有一点点希望就要不顾一切的抓住的极端利己主义人格。 电影给女主加了不少矫情的内心戏，漫画里的有趣或重要的场面反倒轻描淡写。比如女主变美肥宅变现充以后，享受完男人的追逐请客大餐，最后还是选择回家喝快乐水吃炸鸡“牛排算什么，还是边上网边吃炸鸡爽”；第一次毁容是她在浴缸融化后，被她不知情的母亲一边抱怨“又不收拾”一边拔掉浴缸塞子放掉了她大部分血肉，直到露出浴缸底她的大块骨头才发现；泥浆一样的浑噩生活，让母亲崩溃想直接把她倒进河里，又损失了她一部分骨头。也是因此父母割肉才补出了她不成人形的半身，下半身却几乎没有。在这种情况下，吃过这么大的亏，即使父母劝她“好歹有个人型别再作了”，她还能找到整容液操作人并杀人夺取肉身。男主则是她捞女一样筛过“条件好”的男人之后，发现爱美的自己果然也是爱帅哥的色令智昏。也就是这样自私自我的女主，才能在第二部开局真·只剩一张脸的情况下绝地翻身。电影的女主做得到么？ 动画版是把漫画的冲突矛盾平淡化，留白暗示激烈化，大家看电影又不是专门来接受思想再教育的，就留下“以貌取人”的精神内核不是太可惜了吗？,38.0,5.0,48
1,1,35151491,奇奇怪怪：整容液,926150cdba2210a7b750386e59c99c57,949925b1857652b81b7d2b6558fe20a6,2.0,2020-10-25 17:06:10,"倒片员有话说：
《整容液》是2013年开始连载的短篇漫画集《奇奇怪怪》中最为知名的一篇，漫画集的作者是韩国漫画家吴城岱。  2015年6月，《整容液》被国内网友翻译成中文并放上新浪微博，由于贴近生活（人人都想变美）及讽刺时弊（过度整容）等原因，发文一天内已突破100万点击，之后更是刷爆朋友圈。 
放几张图你肯定就立刻想起来了        啊！实在是太可怕了！  IP红了，自然也吸引到电影公司买下版权，制作成动画长片。
电影版的故事架构跟漫画是基本一致的：肥胖丑女孩为了变美，为了追求更好的生活，使用了整容液，重塑了自己的身体和脸，从此走上人生的巅峰，然而，巅峰之后便是深渊。因为《整容液》不仅溶解了她的脸，还溶解了她的道德观，让她成为一个不择手段的人并一次又一次堕入更深的地狱。  对于看过漫画的观众来说，只要稍加回忆，就能想起原作中关于“整容液”的种种惊悚设定，也自然形成了对于改编影片的期待。
我们这次请了人在台湾的每当同学，来聊聊他看完影片的感受。  文/每当

一句话是这么说的，好看的皮囊千篇一律，有趣的灵魂万里挑一。《整容液》这部作品要告诉观众的，是人为了追求一个好看的皮囊，再有趣的灵魂、再万里挑一的特质她都能舍弃，只因为她想要享受被爱，被世人肯定的光环。 因为太过熟悉，本片就如同所有漫改电影一样，观众想看的，是编导在既有的文本基础上，还能翻出什么花样来，震惊我们这群标准严格又难搞的观众。  关于美丽与身体  有趣的是，原作某种程度上代表了2015年，社会上对于整型、崇拜单一审美的一部分价值批判。然而到了2020年，关于整形的话题，风向是有点不一样了。人们用更宽松的眼光看待身体管理这项工作。在身体自主权的大旗下，每个人都有追求舒适样子的权利，行为只要懂得适度，就没什么好批判的。 语境的转变，给本片在故事改编上带来最大的困难，即是观众价值观的舆论转向了。那么，作为一部需要讨好观众，希望引起口碑效应的商业作品，理解原作故事其中的跌宕起伏和猎奇设定，是哪个关键而深刻的命题打动观众，又不受时间变化的影响，这一认知是至关重要的。其中，最关键也是最核心的疑问，便是：  到底是什么建构了我们的身体？  在电影与原作里，建构身体的表面元素是肉块，所以要改变身体，只要把肉像黏土一样塑形、捏除、增加就好。原作中，漫画家并没有直白探讨这样行为背后的心理动机。但在电影里，编导给了一个非常直观的理由：  我想被爱，因为想被爱所以想变美。 





 你懂我吗？  原作中人物背景空白的韩艺智，在电影里被加上退役芭蕾舞伶的人设，日常工作是明星身边一个不起眼、又得饱受羞辱的化妆师。电影开头花了大量的笔墨，不断塑造艺智的悲惨处境，而这些羞辱也理所当然地成为心魔，推使她尝试，甚至滥用整容液。但是这样的铺排，却让我不禁怀疑，如此简单粗暴展示外表不够自信的人如何遭受世人白眼，得不到爱情的困境，不就是一种肤浅又刻板的想象吗？  因为埋怨自己所以可以随便对父母发脾气；因为对自己的基因不满意所以可以跟父母索讨金钱购买整容液；因为自认委屈所以可以毫无节制地表现自己的欲望与贪婪。但我们这些长相普通，甚至内心里对自己外貌不甚自信、满意的人，我们真的是这样的吗？难道不就是因为知道我们在外貌上没有特权，所以我们比天生美丽的人种活得更小心翼翼；因为了解没有人会从第一眼就喜欢自己，所以更懂得活用其他长处让别人喜欢自己。 我会努力变得幽默，我会变得更好相处，会对别人的要求什么都说好……  因为我怕别人对我说不，只因为我长得没那么好看。 





 光是在这一人性的探索上，本片从一开始就失去了与观众建立认同感的机会，更遑论后续剧情的猎奇进展，只是把观众越推越远。美学上貌似要制造不尽真实的艺术效果的动画手法，却被粗糙的人物塑造与剧情拖垮，反而给观众一股廉价、不用心的负面感受。  而这一切失误最根本的原因，还是观众不认为这部电影懂我们。  与原作的差异  在观众的反馈里，不少认为电影改编与原作的情节出现许多落差、魔改的糟糕现象。在漫画中，作者几乎没有说明艺智的职业、人物背景，也没有解释这个神秘的整容液到底是打哪来的。它就像是我们随便搜搜淘宝会跑出来的不知名的怪商品。 这凸显了艺智购买整容液的决定，完全出于自己的自由意志。她知道变美的代价很昂贵，所以若有机会花更少的钱，却能达到更方便快速的成果，这对一个长期其貌不扬的人来说，是多大的诱惑。  然而电影却为了充实人物背景，与合理化猎奇商品的设定，把购买整容液这个行为放进一个类似直销诱导的套路里。这一改动，完全弱化艺智作为主角的能动性。后续的情节甚至割除原本人物天性懒散，寻求速效而反复购买的行为逻辑，降低原作中人为了追求美好躯体不择手段的猎奇感，与惰性难改的写实情绪交织的叙事优点。 





 此外，电影剧作上刻意选择电视购物、减肥药、演艺圈、名人派对等元素，凸显美丑与阶级的关系，却没有在冲突塑造中活用这些符号，反而受陷于原作艺智被神秘男友反杀这一结局。导致整部电影的剧情走向和整体表达破碎不堪，不知所云。  面目全非的电影，电影的面目全非 爱美之心，人皆有之。但为何有，如何追求，拥有后的下场该是如何，这些关键的ABC并没有在电影改编的剧作里获得完整且细致的解答。反而为了追求心理惊悚的类型效果，增添许多不必要的桥段。这一现象反映了漫改电影的技术性两难。短篇漫画要改编成长片剧本势必面临内容不足，人物、世界观等刻画不够深刻，需待补充的技术问题。但是怎么加、怎么改，编剧动辄得咎，深怕走味失去原作粉丝的心，完全复刻又被批评没创意。 电影故事的任务是要完成一个表达。改编电影是在既有基础的文本创作，理解第一文本的表达而非元素，并将其升华，甚至挖得更深，才是电影改编剧作最重要的任务。  然而《整容液》的电影剧作，只看到原作中整容液的猎奇设定，和把身体拼贴至男体上的肉体恐怖，简化了人心对外形美的价值矛盾，将社会的审美标准粗暴诉诸于演艺工业的弊病与黑幕，把故事格局搞成《逐梦演艺圈》的档次。却完全错过原作对于身体的建构与重塑，人性颠倒矛盾的翻弄。  要说本片是一个探讨关于美貌是多么肤浅的电影，在叙事手法和美学创意上，其刻板程度倒是与故事批判的肤浅题旨不谋而合。整部片的表达和情感，都跟着主角的身体一起破碎、溶解，以致面目全非。 





 尼古拉斯·温丁·雷弗恩在电影《霓虹恶魔》（2016）里告诉观众：美不是一切，它凌驾一切。为了追求美，人可以泯灭良心，可以抛弃道德。当市场里已有前作如此精准地点破这个命题。《整容液》应该怎么突破窠臼，还能怎么论述美丽衍生的疯狂与变态，既是我们观众先行的期待，也是创作者最关键的表达责任。",22.0,7.0,1
2,2,35151491,奇奇怪怪：整容液,763bdf2d7ada5c8f02425b699fbd6d34,f87567f2159b425795ebb7ba9bc406ec,3.0,2020-10-13 09:59:33,由韓國人氣漫畫《奇奇怪怪》改編而成，《整容液》以一個肥胖的女明星助手慘被社會嘲笑身材而展開整容液的故事，箇中闡述出社會重視身材與外貌勝於內在美，從而批判韓國多年來的社會病態，老生常談的審美觀僅作淺白探討，立意不痛不癢，但論及電影出產自整容大國的韓國已屬難能可貴。 《整容液》選擇使用動畫電影形式意圖呈現更豐盈的血淋淋、黑暗嘔心場景，故事的畫風奇特無比，大量卡幀動畫顯得粗糙，角色的移動不夠順暢，某程度放大故事不真實、奇幻而誇張，黑暗陰霾的一面，但同時削弱故事本身批判社會的意味，兩者頗為矛盾，而電影最大問題在於選擇動畫作為載體，呈現的畫面卻不夠黑暗嘔心，畏手畏腳，若為好此道者入場必然失望。 「女主角親手把自己推往深淵」 電影加入女主角童年跳芭蕾舞的片段，認為只能取得亞軍在於自己貌不如人，引出女主角極渴求成功的原因，放棄芭蕾舞後她自暴自棄體重大躍進，與韓國著重外在美的文化相違，被社會放棄後變成鍵盤手肆意於網上攻擊仙氣女神，透過網民的回覆反映「美就是一切」的空洞價值觀，反映社會上對美麗外貌的渴求殷切。 故事先拋出一個誘餌的捷徑導致女主角墮入慾望的深淵，女主角使用整容液後愛情事業兩得意，春風滿面的她浸沈於生存以來的第一次成功，聚光燈打在自己身上，享受備受矚目的瞬間，她開始挑剔身體的微細缺陷，人類的貪婪毫無止境，女主角親手釀成悲劇。 「家庭教育的失敗」 女主角不斷將責任推至外來勢力上，劇作留白了童年那場芭蕾舞真正的失利原因，童年回憶的闡述不足以建構女主角扭曲心態的原因，女主角亦沒有披上一層試圖自發改變命運的過程，僅不斷注入肥胖女性被歧視的外來情節，某程度上反映家庭教育的失敗，及後父母不斷滿足女主角的貪慾，她的說詞亦是認為社會和家庭虧欠了她，角色的細節不夠縝密。故事僅片面地形容社會注重外貌的價值觀，欠缺深入摸索釀成問題的原因。 「故事未能完全利用整容液的強大設定」 整容液的設定極為強大，透過浸沈於整容液內並進行「人手調節」，可以隨意改變身體外在的任何缺陷，中段筆鋒一轉拉出一個具備超強玩味的人肉設定，讓劇作的走向擁有更多的可能，然而後續卻沒有就有關設定延續劇情，白白浪費了一個不俗的概念。結局透過雙重扭橋極力挽回故事在奇幻黑暗描繪的不足，但削弱了電影反映現實的立意。 評分: 6/10,5.0,,0
3,3,35151491,奇奇怪怪：整容液,f6c76b33bc47e1fb1ae24179104724b0,24bbbc8db41ec6fc3f1f8d43a1e80b56,4.0,2021-01-16 09:07:04,剧透分割线…………………………………………… 剧透分割线……………………………………………… 剧透分割线……………………………………………… 讲真虽然看完知道除了女主爸妈其余没一个好人，但，看到最后也不敢更不想把帅哥男主和变性人联想到一起。 毕竟女主变美后，是女主主动引导他单独吃饭相处，也是女主主动兜底说出苟刻女明星潜水男主怎么看，他讲的那番话那么真诚深刻，要女主加油，他觉得圈里水太深，感觉艺人这个职业虚假之类不适合他，不可走歪路，幸福要靠走正路什么的。  当时觉得男主长得和大力女子奉顺英里的男主一模一样啊。包括女主主动追求男主这个情节，都有种韩剧范儿，挺顺挺好，当然也深知，隐隐哪里不对会有个转折出来了。(当时我就应该想到: 既然你自己觉得圈里水很深，都和女主谈恋爱了，怎么还让女主继续在圈里混不拉她出来呀，原来是伏笔哈哈)  一知道大家能不能get这个长相的点，完全照着画的啊哈哈 以为动漫做了相应的改编，给了女主一个完美的男友，让她良心发现，深知配不上男生这样子。毕竟女主以前胖的恐怖，性格也一般，人都不会多看她一眼，但男主懂她，夸眼睛漂亮，当时真陷进去了，以为全场就男主一个白莲花，引导黑化女主发现真善美，虽女主不配，但受着内心的谴责，后来整容液用完了变丑躲起来或继续犯罪走上了没有终点的路之类 原幻想中的漫画结局，哈哈。 再回首，唏嘘。 大排面 666，舍得布置那么大一个排面，打开戒盒是颗小到夸张的碎钻时，当时我就笑了，编剧，不愧是你，果然。只想说，这个细节好评。,2.0,,2
4,4,35151491,奇奇怪怪：整容液,321bfaa62ffc12733ca562448c2cebb9,1da6dbebeb21bfe5d3aa16a25970c8ca,,2020-11-13 21:16:46,"巅峰与疯癫之间——《奇奇怪怪：整容液》         今天聊聊电影《奇奇怪怪：整容液》。 片名Beauty Water (2020)。  





   这是一部韩国恐怖题材动画电影，影片根据同名漫画改编。 《奇奇怪怪》系列漫画是韩国漫画家吴城垈创作的恐怖漫画系列，该系列由多个短篇故事组成，目前已连载到300多话。《整容液》是其中一个章节，也是最受读者喜爱的一个章节。     漫画《整容液》传播较广，除了在漫迷圈内传播，还借着互联网的力量顺势出圈。关注公众号较多的人或者刷朋友圈的话，说不定你就会看到别人转发的这篇恐怖小漫画《整容液》。 我也是先看到《整容液》这个篇章才了解《奇奇怪怪》这个系列的。漫画完成度很高，脑洞大开，画面血腥猎奇，可以让读者对美丑有不同认识。  





   如果有一款产品可以让你轻轻松松拥有天使面孔魔鬼身材，所需代价只是身上的肥肉赘肉，你会愿意尝试使用吗？ 醒醒，哪有这样的好事呢。这款名为“整容液”的产品虽说能够实现这样的效果，价格可不菲。没钱就别想这些好事了。     女主角美里是一名超大码化妆师，工作就是替高颜值演员化妆。因外貌每天遭受冷嘲热讽，唯一的爱好就是胡吃海喝，一不开心就吃，一吃就更胖，胖了更被嘲讽，如此恶性循环下去，美里活成了肉山。 某日她接到整容液广告，抱着死马当活马医的态度尝试使用了一下，没想到效果真的和广告所说一样。原来的肉山大魔王瞬间变身男神收割机，成了万里无一的超级女神。     尽情享受外貌带来的便利时，美里依旧不进行身材管理，此时整容液的副作用也开始显现。 《卡路里》里都唱到：“努力，我要努力，我要变成万人迷。”不努力哪会成功。 整容液只能一次性的去除赘肉和捏脸，对再长出来的肉就要重新使用整容液；泡整容液时间不能太长，太长会反噬身体；整容液的价格极高，不是常人所能承受等等。 美里使用前并不熟悉了解这些副作用，肉身趟雷后，陷入进退两难的地步，整件事情也渐渐失控……     《奇奇怪怪：整容液》反映了很多社会问题，算得上是字字玑珠，用恐怖漫画特有的极端方式，表达作者对各种社会怪状的关注。 别看外面的人口若悬河，说得天花乱坠一样，能给予最无私的爱的人还是父母。不管美里怎么作，父母无条件的爱都是她最坚强的后盾。虽说溺爱不好，但还是令人感动。 在整容消费主义的洗脑下，“颜值即正义”大行其道。外貌协会自古就有，唯一不变的就是其肤浅程度。其实人人都是外卖协会会员，只是程度不同而已。但如果把外貌当做唯一标准，似乎就太过了。     被媒体洗脑的人眼见着俊男靓女在荧幕上呼风唤雨，在互联网上簇拥无数，现实生活中舔狗傍身，也总想着变身俊男靓女。其实靠脸吃饭比靠本事吃饭难得多，身材管理形体管理所需的毅力足以劝退大多数人。而好逸恶劳却又骄奢淫逸的人，就别想了，美里就是一个最好的证明。 贪婪自私的人终将自取灭亡，美里变得愈发疯狂，却从没有反省过自己的行为，尽管结局很可悲，却不值得同情，是个可怜又可恨的角色。     《奇奇怪怪：整容液》改编成电影后，增加了一些漫画所没有的情节，添加的合情合理，让影片增添一分悲壮恐怖气氛。 而且比起平面漫画，动画电影让那些漫画中最为经典的恐怖画面动了起来。观众可以从视觉和心理两个层面，全方位感受整容液带来的诡异恐怖。     眼见她迈向人生巅峰， 眼见她成为人间疯癫。     这里是硬核影迷集散地，欢迎关注：妙看影视",2.0,1.0,0
5,5,35151491,奇奇怪怪：整容液,1c4c99425ba9bfcd08407aa6367e508b,f15d06eae6ea490f8c48a7bd927ff715,3.0,2020-10-23 09:07:49,"这是一部在韩国上映时上座率超过《信条》的动画电影。
在韩国入座率力压所有开画电影的票房NO.1。
《釜山行》的导演延相昊看完后的评价是

“这是一部让炎夏也能变得凉爽的高完成度动画。”
奇奇怪怪：整容液豆瓣：5.9
  
该片改编自前几年大火的网络漫画《整容液》，电影的评分两极化，其实很多人诟病这部动画画风的不协调以及结尾的血腥和绝望，忽略这些不提。
这是一个好故事，也是一个值得思考的故事。
  
故事开头是一段诡异的广告：想要拥有崭新人生？改头换面吗？为您介绍这款“神奇整容液”的使用方法。

画面中的女人按照比例把一款药水倒进盆里，整张脸需要浸在整容液20分钟，可出来后似乎没有什么变化，但就在她要扯下脸皮的一刹那....
  
艺知从小就是个自卑的女孩，因为长相一般，身材肥胖经常遭到周围人的嘲笑。
她在一家经济公司给艺人做化妆师，可当红女艺人见到她的长相就反胃。   
去超市买东西，因为一次性购入太多，怕别人嘲笑打电话装作是一群人聚餐的模样，却被店员识破。   
或者临时的一次群演在电视上吃东西的视频被网友扒下来四处传播，还嘲笑她吃香恶心，人油腻肥胖。   
似乎周围的每一个人都在提醒她，少吃一点减减肥，提醒她你这么丑为什么活着......
突然有一天，一则短信提醒艺知：她被选中，而她即将会试验那款神奇的整容液。

  
韩国是整容大国，无论是台上俊男靓女的偶像，还是道路上的年轻男女，似乎在韩国叫做“天然美女”都是件了不起的大事。

而几乎很多韩国的青少年毕业的第一件礼物就是父母送给孩子们的微整形，而这部电影似乎也在讽刺韩国乱象横生的整容象。

越来越多的人在乎外貌，甚至于享受外貌带来的福利。

也越来越多的人，因为享受到了这种福利欲壑难填的欲望驱使，变本加厉。
  
电影海报上的一句话说得好“女神一夜速成，恶魔即将现行......”

当这款整形液神奇的功效让艺知真的在一夜之间脱胎换骨，它可以任意撕扯皮肤和肌肉，增加肉或者减少肉来控制自己的外貌。
随之而来的是艺知畸形的变态心理。
变美后以前对她嗤之以鼻的人，现在看见她都眼里冒光。

她刷光了父母的卡，只为了给自己添些漂亮的衣服，或者一次次的修补身上还不够完美的地方。
她也开始钓有钱人，利用自己的美貌获得福利。
可欲望什么时候是尽头，当你被这种欲望驱使，为了达到目的又有什么是不敢做的呢？
  
电影结尾很跳跃也很残忍，但却赤裸裸的惊悚感，这是一个人吃人的社会，是一个欲壑难填的世界，艺知从小学芭蕾舞，因为内心自卑，总觉得自己样貌不如别人，即使得到了第二名，她也放弃了跳芭蕾。 
在艺知心里，长相平凡是她内心的一道墙。
她一次次的撞击这道墙，但样貌终究是父母给的。

成年后的她，这种自卑愈加强烈也自暴自弃、暴饮暴食，而后这种畸形的心里越演越烈。

我承认社会的恶意，父权社会对于女性必须漂亮的标准确实严苛。
但内心强大同样重要！！！

艺知说“我.....就只是想被爱。”   
但艺知没有得到爱吗？父母为了把身体融化的她救回来，从自己身上割下来肉填补在艺知身上，这不是爱吗？
为了修补身体艺知向父母哭诉这么多年的自卑和长相一般的伤，要求他们拿出两亿韩元（约118万人民币）修理身体。 
对于一个普通家庭这很艰难但他们还是给了，这不是爱吗？
  
我们往往一直向前奔跑，拼命的去抓那些摸不到的东西，认为那才是真的而忽略了身边实实在在的爱。
美丽固然重要，但拥有一颗可以爱人且强大的心才更重要的。",11.0,1.0,0
