,Unnamed: 0,电影id,电影名称,用户id,用户名,评分,评论日期,评论内容,有用数,没用数,回应数
0,0,35156050,狩猎,2cab1104fefe203d6e8534ef5d75aef0,c0074f43bce5ac8d350f79a7c1b7cb65,3,2021-03-02 23:55:56,看完了才发现看错版本了，狩猎有两个版本，既然如此我们就来聊聊这个版本吧 先理一下剧情: 电影的开头是在黑暗的森林里面，一位妈妈给孩子讲了一个黑暗的通话故事(故事透剧了)，然后画面一转，一位长得有点磕碜的女主(职业为建筑工程策划师?)，因为工作压力大，晚上出来到酒吧约火包，认识一位十分有魅力的男士，男士带着女主上了车，突然女主才发现车上还有一陌生男子，女主慌了欲下车，男主于是和同伙露出了本来面目，然后假意放女主走(其实是为了达到更刺激的效果)女主跑到一商店(老外开的中国商店，正在对着平板学中文)，男子追到此处，杀了老板顺带洗劫钱财，之后绑着女主上路…… 路上男主和同伙干了不少老白干(这里电影十分贴心的告诉我们:同志们，开车千万不能喝酒，喝酒差点害死人呐)，嗨到极致时居然要求弱鸡同伙吻他(握草男主基佬?)然后神奇的一幕发生了，一头慌里慌张的大野猪冲了过来，直接撞上汽车，车毁人差点亡。(猜测女主是受到森林的保护，故而派出野猪救驾?)然后女主车内逃出，男主和弱鸡一起追逐，跑到一处悬崖边，悬崖下是一条小河，女主纵身跳下，男主和弱鸡只好找地方休息不提…… 话说女主跳下水中并未淹死，挣扎到了岸边，看见一头鹿(不知是否幻觉)，然后女主在鹿身上睡着了…… 第二天女主醒来，发现躺在草地上，稍作休息狩猎继续开始，只见女主穿着醒目耀眼的红色衣服穿梭在森林里面，男主一眼就发现了她，很快就追上了女主，不料弱鸡同伙被女主一石头砸伤，男主为了不让弱鸡拖累自己，把弱鸡杀死 然后继续追逐碰到野外求生训练的母子，男主用箭爆头老妈妈，胁迫小帅哥设好陷阱抓住了女主，和女主争斗的时候不小心电到了老妈子，老妈子直挺挺的站立起来把箭交给儿子意思是为我报仇这里插一下，估计老妈子是没死透，被电流回光返照了，堪称奇迹 当男子追上女主正欲行禽兽之事时，小帅哥一箭射中男主(男主战斗力大减)，男主负伤而逃，不明白为什么小帅哥不趁机追杀男主(估计是剧情走向，也或许小帅哥胆小怕事不敢杀人) 然后精彩的来了，各种乱入也开始了 剧情走向已经变成了女主开始反击，男主开始逃亡，狩猎游戏才正式开始，至于狩猎中突然出现真人cs打彩蛋的人群是什么用意不得而知，估计是为了表现节目效果，一颗蓝色彩蛋不偏不倚正好击中女主额头，正好给女主补了个狰狞的蓝色妆容…… 最后旁边一个警察放出的狗仿佛与女主心有灵犀，直接奔着男主就开咬，在女主打了十几记花拳之后竟然掐死了男主，而突然乱入的迷幻风色彩是导演嗑药磕嗨了吧,9.0,1.0,3
1,1,35156050,狩猎,7b7837c7ce31ab4adc4967054a961ca2,10a2f9cee07455291b9a202fb7bef563,3,2021-10-22 21:55:50,"整体水平而言可以，但追杀逃生过程不够紧张和惊险，惊悚力度不够，没有扣人心弦的紧张气氛，所以只能给三星…… 
另外，本人比较喜欢单身女性与变态色狼搏斗的题材影片，这类题材也很多，如《我唾弃你的坟墓》四部曲、《猎杀艾玛》、《车库惊魂》、《劫车》、《荒野恶林》、《夺命追踪》、《 顶层楼房》、《搭车遇狼惊魂记》、《大司机》、《复仇战姬》、《羊急了也跳墙》、《准备好了没》、《蹂躏》、《孤身》、《至死不渝》等都属佳作。 
以下剧情简介：
在黑暗的森林里面，一位隐居的女猎人给儿子杰里米讲了一黑暗故事，尼哥底母牧师招募100多名农民组成一支队伍去解救耶路撒冷难民，途中食物紧缺、寒冬降临，队员接连饿死，只有少数人进入森林；在饥饿绝望中遇见一少女，这些人要把少女杀死吃掉，尼哥底母也毫不怜悯，女孩哀怜歌声唤醒森林，恶狼过来扑到尼哥底母救出女孩，牧师污蔑女孩是女巫并与狼交配，女孩冷笑回应说“和狼在一起比和人在一起更安全”；狼杀死牧师后，女孩骑着狼消失森林中…… 
伊芙在工地监督建筑进程，由于原材料没及时送来而致使进度缓慢，上司对伊芙催逼甚紧。伊芙夜晚进酒吧喝酒释放压力，被一混蛋骚扰，一个很绅士的男子赶走混蛋，伊芙遂感激其帮忙而进车打炮；不料，车里出现男子的同伙，伊芙感觉不妙而强行下车。 伊芙来到加油站，店主在学汉语且店里售卖的都是汉商品，还答应在关店后开车回家顺便带伊芙回小镇。不料，两个变态男又跟进加油站，年长男杀死店主并将伊芙电晕塞进车的后备箱…… 
车开进森林，年长男给软蛋男伟哥并鼓励他要强奸伊芙，接着年长男却要和软蛋男搞基、让其亲吻自己，二人相互要亲嘴时撞到路上的野猪翻车，伊芙趁机从车厢逃出，二人拿出摄影机烧车追捕…… 
伊芙跑到悬崖边被二人堵住，伊芙跳入悬崖下河流。爬到岸上，伊芙挣脱绳索偎依母鹿睡一觉，天亮脱裤撒泡尿并摘蓝莓填肚……二人是惯犯，此前奸杀许多女子并录影，软蛋男翻车时腹部受伤，因此拖慢了追捕……伊芙沿河逆流而上居然遇到二人，软蛋男追上时被伊芙搬石头砸断鼻梁，而后伊芙逃脱；年长男嫌软蛋是累赘将其割喉杀死。 
年长男遇到女猎人，谎称自己打猎丢失猎狗安迪，来到篝火旁，还借杰里米手机假装打电话；女猎人问出男子的破绽，男子就假装撒尿走开拿起一支箭靠近女猎人，杰里米傻逼逼得看着男子靠近自己母亲却不吱声，男子从背后用箭捅进女猎人耳朵里将其杀死。 
接着，伊芙从高处看见丛林中有炊烟，就来到篝火旁，刚要向男孩杰里米求助就被其隐藏的男子电晕。伊芙醒来发现自己脖子套着绳索，男子让杰里米去强奸伊芙，自己拿摄影机拍摄；这时飞来一乌鸦攻击男子，男子吓得将摄影机掉进篝火烧毁，伊芙趁机拿刀割绳索；男子见状来扑伊芙被杰里米抱住腿摔倒而致使电击枪误电击女猎人，女猎人居然被电击苏醒。伊芙趁机咬断绳索逃跑，男子追上伊芙拿刀刚要行凶，被背后的杰里米射穿左肩…… 
伊芙继续逃，男子继续追并抽烟壮胆将箭拔出。伊芙听到男子的威胁喊声后，愤怒得拿起木棍找男子反击……男子被打一棍后逃入附近一正在建筑的房地产向保安求救，伊芙尾追而来却被保安喷辣椒水赶跑，男子将保安鼻梁打断；男子追上伊芙扭打在一起，保安放德牧出来咬住男子手臂，伊芙掐死男子……",,,0
2,2,35156050,狩猎,cb195769f6a8a5219904c4b8ae4a39d6,48bb2b44b19d676f29ca56052b798ccb,1,2021-08-28 23:50:50,迷惑性太强了，仅仅在豆瓣上粗略的看一眼，名字叫《狩猎》的就有20部以上，仅仅2020年同一类型的叫《狩猎》的片子就有两部，更加恐怖的是，两部片子都有“猪”的元素，本作中猪导致了女主车祸，而另一部海报上有个猪头。 曾经在E站的一个画廊下看到一个傻老外声泪俱下的控诉作者起了一个单字“G”的名字，导致他凭借着这个名字完全没法在谷歌上搜索到这个作者。现在我深深地体会到了他的痛苦。 回到这部影片，彻彻底底的垃圾电影，没有任何意义，导演想表达什么？狼不在了男人还在？男人都是只会强奸绑架的畜生？血腥吗？恐怖吗？有剧情吗？什么都没有！整体俗套到任何一个看过这样类型的影片的人都不会被里面的桥段惊讶到，这种假装有寓意的片子居然连豆瓣都能只给它打4.9分，我的天！连豆瓣的文艺青年都骗不了！老老实实去吃屎吧导演！我头一次全程三倍速看完一部电影。,1.0,,0
3,3,35156050,狩猎,52d4d5727f7db7100be3bd929be01adb,da2289ac327ba1463cc125ddbfd79308,2,2021-04-10 16:24:46,"看来如我一般搞错的人很多。那个叫the hunt ,这个叫hunted，被动语态还可行？        路上那个老太太神叨叨的，结果被一招撂倒，最后还诈尸了。最后狗王洛波代替《狼王洛波》救了女主，算是勉强和开头呼应了。可是那群打彩蛋的傻逼看着这俩人就没点反应吗？总之剧情烂的1B。 开头那段便利店老板学汉语倒是狠有趣：我很好，谢谢，你呢？I am fine ,thanks ,and you?这个古老的句式我很深深的怀疑有中国人给编剧出主意吐槽中国的英语教科书。",1.0,,2
4,4,35156050,狩猎,6ccc309fe3fae4162b361118559d1c35,f114b7fe0214a94f510539128c60532c,1,2021-02-18 17:18:51,精神病患者在追女主的途中，竟然要求弱鸡同伙亲自己，因此分心而撞车，再次遇到女主时，撞车受伤的弱鸡同伙被女主所伤，两个反派起争执，精神病患杀了同伙，途中遇到在森林学习生存技能的婆孙，因婆婆多话被精病分杀了，女主来到婆孙营地，精病已埋伏许久，女主被抓，打斗中不小心电醒了被箭插头的婆婆，婆婆拔出箭给孙子，孙子用弓箭追击精分，射中了，女主乘势追击，警察见到女主在追精分，拦下女主，警察派出警犬，咬到精分，成功反杀,,1.0,2
5,5,35156050,狩猎,10c81aee079d504fcb8ce9bc53c5998a,d4a40f1d96e13aec6b85f30c3c1ce37f,3,2021-02-04 00:13:30,我感觉这个片子的前半段应该是比较中规中矩的，虽然有暗黑童话开头，有酒吧猎艳，有变态追逐，但是对看惯美国惊悚片的人来说，这种情节已经很普遍了，毕竟美国的变态太多，再变态也就那个样了，随便搜点恐怖片都能找上好几部变态杀人狂的电影。 相对于开头部分的变态绑女人情节，后来的反杀倒是感觉表现出了一个女人从无助到疯狂的转变，反正是都次逃跑后都没有成功，最后是绝望加复仇的情绪合在一起，造成了一种不要命的疯狂，就像最后在床上用拳头一拳拳把变态杀死，这是一种何等刺激下的本能。,2.0,,0
