,Unnamed: 0,电影id,电影名称,用户id,用户名,评分,评论日期,评论内容,有用数,没用数,回应数
0,0,35229091,执剑人,43e9e9efd896480f797deaacb0e79b66,d8938b81907e57928ed2af0ec3057ffa,1,2021-10-17 11:29:40,"逻辑很硬伤，节奏很慢，武打镜头几乎没有，服化道很差。看了四五十分钟无法确认谁是主角？
一个青楼姑娘，连续两天从楼里跑出来，还都跑到一个茶馆里去，就为了跟人说话？然后继续被抓回去？这是把茶楼当放风场所了吗？ 青楼老板亲自来抓人，你说他要是不知道这姑娘跑哪儿去了吧，那就是姑娘私下逃跑，那你为什么还让她跑了第二次？你说这要是知道姑娘跑茶铺里面了吧，那为什么姑娘看到你这么害怕？
一个女孩，幼年被卖进青楼，居然坐不改名立不改姓？而且就她有姓，另外一个青楼姑娘只有名。
一个杀手，年轻时杀了一个知府，年老了遇到当年的知府女儿在青楼，就见了两面，说话不超过十句，就想赎她出来？为什么？别跟我说你当杀手时间特别短，只杀了这一回人！每个人都是父母儿女，你同情心这么泛滥要不要每个人都救一救？赎人未果，就把青楼的管事杀了跑了？还留下一堆痕迹和证据等着别人来追杀？杀手都这么感情丰富且脑子愚蠢了吗？你要救姑娘出来，方法千千万，为什么一定要杀人？编剧一根筋啊？ 这个前杀手，十多年前到此地开茶铺，既然已经打算隐居了，一身武艺还天天练着？难道他知道自己十多年后会因为一个姑娘杀人？
一个男人，在一个帮派总部被人围住逼近，他一个邪魅的微笑，下一个镜头所有人都倒地了！喂！武打镜头呢？武打指导没有？
一个青楼姑娘，头上戴的假发包，颜色跟她本来发色不一样啊！马路上的汉服小姐姐都没这么粗糙好吗？
那个邪魅的男人审完了青楼姑娘，就要杀人灭口，用小臂压着脖子让她窒息，姑娘全程没有任何挣扎？求生本能反应呢？这杀人手法也很迷惑啊！
最后，我在餐厅吃饭，吃饭都盯着电视，看了至少四五十分钟吧？这个情节，跟简介完全不一样啊？ 执剑人 (2020)暂无评分2020 / 中国大陆 / 动作 古装 / 乔磊 / 李广旭",,,0
1,1,35229091,执剑人,6042546ca83e8c1ba46845548d748a1f,aa0281aa7e5c1c4ec63b5dab0320c4b0,5,2020-11-28 09:55:52,想给电影频道播出的《执剑人》写个影评，却选不定切入口。这部电影被喷出了翔，说是抄袭模仿国外某影片。豆瓣里更是一篇长影评都没有，怪可怜的。看得出剧组也无意做宣传。国外电影我很少看，即便如此，名著国际上搬来搬去的现象也并少见，能做到本土化也是值得肯定的。 执剑人 (2020)暂无评分2020 / 中国大陆 / 动作 古装 / 乔磊 / 李广旭 男主宇夺原是大内高手，皇帝身边的执剑人，只听命皇帝，执行皇帝的秘密任务。后来因为妻子被害，萌生退意，以假死隐居在一个小镇上，开点心铺为生。 一天早上店里来了一位醉醺醺的女孩，进来就要茶醒酒。不一会，又来了一个骄横男子，要女孩回去，从他们的对话得知，女孩是青楼女子，骄横的男子是青楼老板，逼迫女孩回去接客。 第二天早上，女孩又来到点心铺，这一次女孩的脸上挂了伤，宇夺亲自为她做了点心，坐下来陪她聊天，女孩说，她的梦想是开一间点心铺。宇夺说，你也可以。  女孩摇摇头，你的世界是这样，我的世界不允许。正说着，青楼的人又来了，对女孩使了个眼色，女孩乖乖的起身，说，我该走了。出门前，女孩转身，对宇夺说，还没告诉你我的名字，我叫樱雪，苏樱雪。说完勉强笑了笑，走出门外。 宇夺听闻苏樱雪这个名字，心里一震。他想起了多年前曾经任执剑人时，秘密处决了一位知府，那位知府临死前说，我的女儿苏樱雪还在等我回家过生日。如果这个女孩正是死去知府的女儿，那女孩今天的处境无疑是与他有关联的。心里放心不下，在医馆找了樱雪，樱雪已被打的遍体鳞伤，她的好姐妹告诉宇夺，樱雪很小就被送到这里，听说她的父亲是知府，被人杀了。 猜测得到证实，那一刻，宇夺就打定了主意，无论如何，不管有什么样的代价，也要救下樱雪，让她开始新的生活。我说，樱雪与宇夺注定是要相互成全的，从他们在点心铺里对视的那一眼就已经注定。 宇夺的前半生就是一个冷血杀手，退隐后也只是想行尸走肉般度过余生。直到樱雪出现，触动了宇夺内心的柔软，点燃了他嫉恶如仇的性情。宇夺开始了他的自赎，他变卖了珍藏的妻子的首饰，凑够了五十两银票，企图赎出樱雪，遭到刁难，怒从中来，诛杀了青楼的恶霸，解救了樱雪。 执剑人 但故事并未结束，青楼只是当时最大的黑恶势力判官所属的一桩生意而已。剪除了青楼恶霸，就得罪了判官，判官的能量有多大，现任执剑人司马治也在暗地里为他卖命。 在与判官为首的黑恶势力斗智斗勇中，宇夺慢慢化身为一位锄强扶弱的真正的执剑人，最终除掉了判官，恢复了一方安宁。樱雪实现了她的梦想，开了一家点心铺，宇夺留下那张银票后悄悄离去，继续行走江湖。樱雪自始至终不知道救命恩人宇夺也是杀害他父亲的人，也许不知道是最好的结果吧。,4.0,3.0,8
