,Unnamed: 0,电影id,电影名称,用户id,用户名,评分,评论日期,评论内容,有用数,没用数,回应数
2,2,4830483,喋血战士,6f193e02a35621d10f28580fb8a754e5,7356e3ee71dec27fe4a19ca52273ac86,2.0,2020-06-10 00:57:22,"“电影宇宙”的发明，可以算得上是漫威影业划时代的杰作（虽然在漫画、小说中早已存在打破次元壁的概念，但是漫威才是真正在电影中完成了多次元融合这一成就），它不仅使电影之间的次元壁被打破，形成一个紧密联合的整体，而且每个单元电影又相对独立，可以个性化创作，从而出现了一大批优秀的类型电影。 虽然这种模式被学院派的诸多电影大咖不齿，但其在全球的巨大影响力已经是不争的事实，赚到财大气粗的“赶脚”让一众电影公司眼红心跳、跃跃欲试： “DC宇宙”，“怪兽宇宙”，还有见光死的“黑暗宇宙”等。 今天耶米要介绍的电影，是号称要打造“勇士电影宇宙”的开山之作:《喋血战士》。 1、套路也有基本法 ①工业流程下的固定公式 《喋血战士》是一部基于好莱坞工业模式下的格式产品，编剧和导演背熟了固定公式，以一种及格就好的心态给期待值颇高的原著粉交上了一份他们自认为“安全”的答卷：   但是，原著粉根本不买账，烂番茄和IMDB的评分简直惨不忍睹。 而广大吃瓜群众，在看过网上流传的高清无码之后，也惊呼“看了部大烂片”。 电影在剧情方面只能说中规中矩：讲述一个美国大兵在某次执行任务中不慎暴毙，于是只手遮天的科技公司回收了他的尸体，并用纳米科技将其改造成人间兵器，并不断通过“立体投影仪”给他洗脑，让他自主杀“仇人”的故事…… 





 如此说来，还真有点儿---- 老故事的味道。 电影的节奏，则完全在公式范围内，没有突破和亮点，属于看的时候会嗨一下，看过之后就会忘记的爆米花款。 电影的分级：PG13----13岁小孩儿都可以无差别观看。  R级的露点、血肉横飞、还有爆粗口都是不存在滴，请自行收好你的小心思。 在好莱坞电影文化强输出的今日，不是所有的视觉特效片都会嗨爆市场，观影人对于精神文化的渴求，已经在引领电影工业的变化----由单一向多元转变；由量变向质变发展。 “安全”答卷不光套用了公式，还在几场戏铆足劲儿反转套路，无奈编剧和导演对于剧本的把关力度松懈，出现了很多细节错误，一颗野心碰上智障，于是把电影成功拉入泥潭，万劫不复。 ②漫威大法的绝招 “漫威宇宙”的成功不是偶然，是无数的幕后工作者经过日夜分析，将他们所面对的市场精分后，再统一对剧本严格创作----整体把握，阶段区分。 从单兵作战到联盟出击，漫威实实在在做到了不紧不慢，细节优先，通过个体英雄的形象描绘，将缜密的叙事逻辑加载于每个小事件之中，并在未来的联动故事线内，自然而然表达出来。 其中，漫威最大的绝招就是彩蛋。 彩蛋包括“片中”和“片尾”两种。 “片中”彩蛋是对编剧细节的考验，一个伏笔埋上几年再拿出来使用的时候确实够香； “片尾”彩蛋则是承上启下，给你以一种期待，让你下次可以如约而至。 你能想象当年在《钢铁侠》片尾的彩蛋有多么重要吗？局长一句“你以为你是世上唯一的超级英雄？”直接开启了一个属于漫威的电影时代。 而这部“开山之作”，竟然忘记了彩蛋这么重要的操作，那还怎么“宇宙”得起来。 DC的正义联盟虽然在彩蛋光环的加持下还是力不从心，但他偶尔牛B一下，可是连自己都害怕的存在。 甚至传奇影业的“怪兽宇宙”都在故事线中加入帝王组织作为彩蛋源，真正可以联系过去和未来，毕竟能让金刚和哥斯拉打一场，这也算得上是有生之年系列之一了。 勇士漫画虽然在国内名气不大，但按照统计，他家的超级英雄竟然高达两千多，要是打起群架来，丝毫不会输了气势。 本来身处二次元的他们还在摩拳擦掌，想要亮相宇宙，结果“喋血”只记得自己单刷，忘记了一众基友。 2、这个战士有点儿懵  ①我从来不计划 让恢复力超强的战士反复用堵枪眼这种低级战术取胜，是编剧犯下的第一个智障性错误。 这样不仅使电影的趣味性将至最低，还让观影过程十分煎熬：实在难以忍受如此直白而毫无意义的打斗----强恢复力设定加上不躲不闪让动作戏份没有任何悬念可言。 ②面粉多了会爆炸  作为物理常识，空气中的面粉浓度达到一定程度时，遇明火会发生爆炸。 当编剧开始无视物理常识，在面粉遍布的隧道随便点火，你也只想骂上一句：M的智障。 ③反派太弱也没趣 喋血战士不懂得战术，没有智商其实也就忍了，最后面对榴弹不躲图个啥？ 经过一番仔细分析，大概是反派弱到连编剧也不知道怎么打，但又不能就这么糊弄过去，安排两发榴弹搞点特效走走过场就行，总不能再出套钢铁侠套装给反派，毕竟资金有限。 ④又是一个平行宇宙 喋血战士在世界各国闹翻天，暗杀多位科技人才，但是警察、军队、甚至政治势力都不曾质疑和介入。 如此说来，编剧说不定真来自平行宇宙。 3、一桶怪味爆米花 ①五香味的故事设定 喋血战士的能力看起来凶残，但他对于前辈们的许多借鉴让剧情进展十分尴尬：开始你以为在看机械战警重生记，然后画风急转成死侍屠杀特工组，接着又来了一波碟中谍大反转，最后干脆升级了美队的电梯大乱斗。 五香味四溢，卤菜的走起。 ②奶油味的爱情插曲  电影其实在试探PG13的红线。 一夜春宵这种戏，在如此分级下，意思意思也就得了，非要赤裸上身，还把光打那么亮，唯恐别人看不到，这样的氛围真的是奶油味，入口醉。 ③原味的唐老大 范迪塞尔自从出演“速激”之后，他对角色的演绎仿佛一直在唐老大的这个人物形象上绕圈：强调家人的重要，自己形象的正直。  虽然这不是个大问题，但是放在电影里就很让人跳戏，分分钟以为在看“速激”外传，有的时候真的怕从他嘴里蹦出“我们是家人”的台词。 他属于原味出演。 





 由此，不难看出《喋血战士》口碑票房扑街，并非偶然。 作为开山之作，它缺少的不仅是资金，还有一颗潜心创作的心。 电影创作不易，而佳作更是不可多得，在现代电影工业成熟运作的模式下，很多“公式”电影逐步盘踞市场，形成一股巨大浪潮，席卷全球，但在巨浪过后，还能留下来的，才是时代的结晶，电影的砥柱。 （更多精彩，尽在“耶米看电影”公众号）",7.0,,0
3,3,4830483,喋血战士,1a8ebe4d40c14de1b0b9281bab43e62e,5e724ee8fb47ae2aeb061df520111832,1.0,2020-04-04 16:49:47,"继续点评新片，这次选的是肌肉男Vin Diesel新作---喋血战士，让我们一睹直男本色。 美国电影《喋血战士》
 作品类型：科幻 主要演员：Vin Diesel 故事概述：机械直男Ray vs科技宅男Dr. Emil Harting 上映时间：2020年3月13日在美国上映             一部令人“无言以对”的作品，故事内容老套，人物设计呆板，除了女配角秀色可餐之外，都是“垃圾”，典型的圈钱之作，鄙视之。
     直接进入点评。先简单聊一下故事，纳米改造人（美国士兵、机械直男）Ray被博士Harting算计、植入预设程序（循环设定---以解救Gina（Ray的太太）为由头，刺杀RST公司前任员工），可惜东窗事发，H的计谋被R察觉（KT告密），最终导致R与H单挑决胜负。     相当无趣的故事，好在画面够靓，吹散了昏昏欲睡之感。接下来谈一下本作的亮点。
 首当其冲的是女配角Eiza González，性感、迷人，又融入了异国情调，比肌肉直男Ray更具卖点与魅力，绝对是本作的最大亮点。     紧随其后的是画面质感，两个层面。其一是“动作戏码”；其二是“科幻色彩”。怎么说呢？前者主要依靠Vin的肉身实力（真不知道这肌肉是不是贴上去的？），后者则是凭借后期制作，都算是可圈可点，值得褒奖。
     除此以外，本作再无亮点可言。既如此，那看一看缺点。
 一，故事廉价，剧本有坑。如果回到30年前，这样的作品，可能会引起不少观众认同，毕竟那时是肌肉猛男的天下，抖抖胸肌，票房在手，但现在，科技主流了，就这，秀“光膀子”，讲述“儿女情长”，给谁看？！
     二，主角不行，廉颇老矣。Vin，这“肌肉棒”，要文不行，要武费劲，就一光头擦的锃亮，相当“狗血”的存在。
     三，逻辑堪忧，智商脱线。“机械战警”缔造者尽然干不过自己的产品，这就算了，毕竟“青出于蓝而胜于蓝”，但KT在Harting眼皮底下耍花枪、唤醒了被洗脑的Ray，这就有些玩弄观众智商的嫌疑了。
             不说了，不说了，一笑了之，就这样了。
 编剧★☆☆☆☆（故事内容零分，台词设计零分，人物设定1分） 导演★☆☆☆☆（圈钱而已，不做评论） 演员★★★☆☆（Eiza González值这个价，Vin还是歇着算了） 剧情★☆☆☆☆（给小孩看的，成年人看了伤自尊） 视效★★★☆☆（有点科幻元素，可以混一混） 音效★☆☆☆☆（不在线） 不推荐",5.0,3.0,6
4,4,4830483,喋血战士,8601c547f3538a48d77e93024e4a2180,fe5ac2030b74ec6f4c619870a18c15f8,3.0,2020-04-04 10:16:20,这部电影的评价顺序，背景设定、电影制作、人物、故事线。 背景设定：7分 核心设定是RST（rising spirit technologies）公司，这家公司的业务，是为美军士兵，提供重生； 其核心科技有： 换血纳米分子血液：这个技术非常假，如果身体只是换了这种纳米血液，不可能有这么强的能力，被炮弹打碎了身体组织，还能抗拒物理学运动惯性，自动恢复如初。差评。5分    假肢、假眼、假肺等可代替器官。这部分科技，未来应该可以实现。副骨骼的能力很强大，可以像蜘蛛一样在建筑上攀岩条约。好评。但是副骨骼的关节，看起来是不是过于脆弱了。8分    人脑记忆编辑，关于这块，电影中，有着详细的记忆场景编译的过程，非常赞；毕竟我还是挺希望能实现记忆编辑技术的，这样的话，知识就可以直接输入给脑子，不用经过学习计算。8分    人物： 正派： jina （吉娜）：男主老婆。jina出场3次， 第一次是迎接丈夫回家；第二次是被绑架；第三次是几年后Ray Garrison回乡看望老婆发现已经是别人的妻子； jina是男主心中最重要的人，（记忆中）jina的被杀，是复仇的动力。而这一点被反派boss利用，用来杀别人。 Ray Garrison（男主）： 男主 KT（男主的新队友、女一号），喉管经过替换，可以过滤气体；女一号虽然大量出境，卖了点色，但是她的能力被设计的太弱了，虽然最后发挥了频闭毒气的能力，烧毁了RST公司数据库。剧尾和男主在一起。Wigans （黑人男程序员，男主的技术伙伴） 炮灰    martin axe（马丁 艾克斯）nick baris （尼克 巴瑞斯） 很显然了，这三人以前都是RST公司创始人，后来，Emil Harting赶走了其它两个人，然后派Ray 把其它俩人杀了。 反派 Dr Emil Harting (RST公司老板)，这个反派的设计一般般吧，他利用男主的能力去执行杀人任务，这里其实我很怀疑，为什么一个科技公司ceo要执行杀人任务？电影的解释: RST公司老板，想独霸这项技术，然后高价卖给买家，这是最后一次（杀人），然后就不干了。 其实就是把其它两个创始人杀了，技术这种东西，美国不是非常保护专利吗，现实里，用专利不就可以了吗？再说你的员工还拿着别人的开源技术用，说明RST公司，本质上只是继承了市场上现有的基础技术，做了一套系统。并不具备彻底的垄断性。 Jimmy Dalton 断了腿的海豹突击队士兵，换了假肢Tibbs 神枪手，换了电子眼睛      故事线： 故事线的完整度上其实还行，但是剧情还是挺薄弱的，但看样子只是为bloodshot系列开了个一般般的头； 只能寄希望第二部喋血战士能够全面发挥更强大的威力。 电影制作： 美国电影工业的制作，只能说还是显得那么熟练，就不多做评价。 发布于 04:08,3.0,3.0,1
5,5,4830483,喋血战士,d335d88f4b365c043c51ef8bcd710bca,f460bd7d64af734bddaf07b48103ff37,3.0,2020-03-18 18:53:30,喋血战士，也叫血卫，你们知不知道，这部电影其实也是一部超级英雄电影？！ 或许大家知道漫威，知道DC，不过《喋血战士》是出自勇士漫画，这个号称第三大漫画宇宙，早已淡出大众视线几十年了。     而喋血战士就是勇士漫画的顶梁柱，所以被拿来改编成了电影也不意外，是的，勇士漫画也想在电影界开辟自己的勇士电影宇宙。 但就在当下超级英雄电影红到熟透的市场下，其他新来的超级英雄作品想挤出一点点空间，那就真的得看硬实力了。     目前，《喋血战士》在烂番茄形成审美隔离，专业烂番茄指数只有可怜的31%，但大众爆米花达到78%。 而在严格的metascore上，专业和用户评分都不高，一个只有44分（满分100），一个只有5.3分（满分10）。最平民的IMDB也只有5.7。         更倒霉的是，在疫情的影响下，对全球电影市场打击巨大，目前大片几乎全部撤档延期，剩下的这部《喋血战士》不尴不尬正好上映，再加上影片本身质量一般，导致首周北美票房只有可怜的377.5万美元，只排在新片票房第二。 而排在第一是叫《我仍然相信》的小成本电影，票房400万美元。 《喋血战士》虽然成本只有5000万，对于一部超英大片来说不高，但就目前的票房，《喋血战士》想要顺利打开勇士宇宙，应该是非常困难的事情了，除非在之后，比如在中国上映能掀起一股大的观影热潮，然后带动海外票房收益。     先说观感，在超英电影中一直说着“I AM GROOT”的范迪塞尔，终于任性自己做了超英电影的主角。 每位超级英雄都有一个背后的故事，喋血战士也不例外，他死而复生，他为复仇而崛起，他又为解放自己选择不受摆布。 这似乎和很多超级英雄的路数一样，如果说这是每位漫画超级英雄身世是不能改变的DNA，那么如何在电影剧情中让人焕然一新，就成为《喋血战士》脱颖而出的关键。     哎...可惜呀，漫威和DC这十多年拍了这么多电影，已经足够交出一份超英类型的经验考卷了，但《喋血战士》却用了一个就连现在漫威DC都抛弃的1.0套路模板。 《喋血战士》的故事大概是这样的，范迪塞尔饰演的军人雷，在战场中阵亡被改造成了喋血战士，之后被研发RST组织利用，一次次在雷脑子里植入复仇计划，被懵圈的雷在组织的圈套中展开复仇，直到一切真相大白之后，雷想要重新做自己。     放心这里聊的都是预告片给到的内容，并没有暴雷剧透。 但我想要说的是，这预告片内容基本也就是电影的大部分情节了，没错这部电影更多的驱动力，是放在雷如何一次次在复仇中，展现自己的高科技肌肉身体，还有高格动作打戏。 除了这些，其余的文戏都乏善可陈，就拿电影前面三分之一来说，这又是被预告片毁掉的电影前半小时，和《隐形人》的遭遇一样。     如果看过预告片的观众，一定会知道雷是被利用被套路了，等待雷的命运，是如何打破迷局，重获自由。 雷在开头苏醒后，影片放了很长的篇幅，让我们跟随RST组织老大视角，听他兴奋的介绍着植入雷身上起死回生的高科技。 这种解释性的对白和场景，在几十年前科幻片就已经不用了，到现在观众什么高科技没见过呢，其实想要介绍雷身上的科技含量，可以打碎在影片的其他关键场景中，以用来加强影片的节奏。     比如影片在动作戏上，已经很好展示出了雷身上的复原科技，所以又何必在前面用刀划一下雷的手去解释，然后弱化后面动作戏雷复原的戏剧张力。 还有影片前面铺垫，用了过多时间向观众展示雷和组织人员相关的互动，其中还有一段戏，是雷在欣赏女主KT在泳池水底打拳，然后两人在那不尴不尬聊了对之后剧情没有任何发展的对话，这...     关于《喋血战士》的剧情结构，我们拿《美国队长》作对比好了，并不是说《美队1》有多杰出，但对于两位主角来说，基本人物在整部电影转变不大，而且都是类似于启动了重生机制，变成了超级英雄。 但《美队1》我认为史蒂夫人物更完整的原因在于，影片在前面用了很大的篇幅，去构造了变成英雄前落寞的史蒂夫，让观众了解瘦小，参不了军，常被人欺负的史蒂夫，他始终有着一颗想要捍卫正义的心，从而能让观众对主角更有共情张力。         而《喋血战士》我们几乎看不到雷的前半生，就算前面交代的也是假的，关于雷的人设，基本靠着范迪塞尔后面和RST老大对话时，吼出来的那几句解释性台词，这样难免让人没法对主角建立很好的共鸣纽带。     关于范迪塞尔的演技，有点不客气的说，基本他的实力最高峰就停留在《拯救大兵瑞恩》的时候，这么说起来范迪塞尔还是史蒂芬斯皮尔伯格当时挖掘出来的演员，之后他靠着《速度与激情》火了起来。     《喋血战士》的编剧之一，是曾经改编过《降临》的埃里克.海瑟尔，原本《喋血战士》的重复轮回复仇模式，还是能玩出很多新花样，但编剧们却用了一个最直接简单安全的叙事方式。 回想起有些相似设定的《源代码》，《明日边缘》，《记忆碎片》等等，就能对比出《喋血战士》的平庸，可惜浪费了一个这么好的设定。     看到这很多人会说娱乐爽片，文戏剧情什么的不重要，但现实情况就是，一个又一个的例子告诉我们，没有故事核心的依托，哪怕你在文戏剧本上再下一点功夫，商业娱乐爽片的提升都不会只有一点点。 我们回顾所有好的爆米花娱乐大片，没有一部是对文戏和人物的塑造轻视的，到头来我们记住的这些电影的关键，还是里面一个个鲜活的人物，而不是重复模板复刻出来的硬汉形象。     最后再聊聊动作戏，在范迪塞尔演艺生涯主打的类型片中，他在动作戏份上更显得游刃有余，不管是秀肌肉的打斗，还是持枪对战，或是人机对战，飙车戏等等，都能让人看得很过瘾。 在预算不高的情况下，影片刻意把场景空间缩小，用了不同的元素去增加动作戏份的可看度。     片中也尝试加入了一些幽默元素，效果虽然没有达到自然融合，但也算是增加了影片更多出彩的地方，尤其是拉蒙尼.莫里斯饰演的黑客，可以算是电影角色中的点睛之笔了，比起其他模板化的脸谱角色，拉蒙尼.莫里斯轻松诙谐的人设让人印象深刻。 只可惜这个黑客人物出现的时间太晚，不然还能拉起电影不少分数。     当然，如果你只想用影片刺激一下眼球，片中的打戏还是能让燃一燃的。 我甚至觉得我虽然说了那么多影片的不足，到说不定到时在国内上映，大众会很喜欢，因为作为特效出身的导演，片中的特效，光影，动作设计的结合，有几场戏还是很爽的！ 不过影片要在国内上映，估计还得等一段时间了，毕竟现在疫情还没彻底结束。,20.0,8.0,21
6,6,4830483,喋血战士,d6b44e4a961b3afaf38a230ccae9649b,d645bb461994189893b8a9c3d1a4d10f,4.0,2021-10-22 00:51:30,"一部生物性死亡之前只记得为前妻复仇，生物性死后不仅被基因改造还被注入了芯片编程的再生人的强烈美国超级英雄色彩的故事！

一个不死的高科技版本的神奇传说，
却是被高科技赋予而被控制大脑的杀人机器，每一次地被利用都是一次被洗脑的过程！

就如范迪塞尔和创造并利用他的哈丁在电影里的神经空间，那些经典台词对话（可惜全网没有，只凭借记忆摘录吧）：

你生来就是为战争而生，每次醒来，强烈的复仇欲望都使你有着新的目标，充满了激情，这样不好吗？

可这是你的目标，不是我的！

可是我创造并再生了你？！

可我却是不停被你删除更改记忆，一次次编程洗脑，一直活在仇恨中，而利用我为达到你的目标，去杀戮一些无辜的人，他们中有的人不该死！

而也正是你，让我永远活在这个小箱子里，我的每一步都被你设计好，为了达到你的目的，虽然你让我再生，可我不过是你的众多工具之一。。。
  影评中都说这是部烧钱烂片，诚然从电影制作角度，虽然场景动作设计还能过得去，但情节仓促甚至有时有点混乱，另外这种不停再生不死的题材，也会使某些人感觉情节荒谬，可主角范迪塞尔真的就是个无脑的机器人么？ 最终在黑人编程高手维根斯帮助下，恢复了被基因改造前人性真正的初始记忆，而范迪塞尔也找到了自己最终要报仇的真正目标，那也正是给予他重生，并把他塑造成一个杀人机器的哈丁， 而在最后为了杀死能控制他的哈丁，他放弃了自己所有不死特异功能，变成普通人后用颗落地雷与哈丁同归于尽，可这些手段并没有维根斯和其他人的参与，也全是这个没脑子的被基因重组的芯片人想出来并实施的，他真的是四肢发达，头脑简单么？！  
本片唯一荒谬的就是，死不了的不停再生，不停的复活，可这本就是部奇幻题材，然而我却看到是影片背后宣扬的主题思想，——对被利用，被洗脑，被重生的挣脱反抗。。。  很难想象，这种题材思想的好莱坞电影居然是在现在这种时期，还是在CCTV6播出，不得不令我惊讶并佩服。。。。。。  借最后时刻一句台词（大致意思吧，记不清楚了）： 人的初始状态，或在以前的想法，并不能代表他的未来！",,1.0,0
7,7,4830483,喋血战士,1047267a02eaf5bc01c0a3b470d6b2d6,016cc5fb2c2104bbf2b41e566a4595a5,3.0,2021-08-27 08:47:35,我倒觉得设定还是不错的，把人当成软盘记忆擦除重写。只是即便如此还是通过记忆影响当事人，让他自己做出应激反应。最终的动作实施，还是依靠他自己的判断。所以大体上不太受控，你怎么就确定这样的记忆会诱发他怎样的行为出来，不如研发出没有感情的杀人机器，或者改造本身就听命于你的忠诚部下更保险。     反派把公司做到这么大，是否真的有必要一个一个杀掉之前的合伙人，而且至少电影里看上去，这些人没有在这个领域继续走下去，从他那里分一杯羹的企图。那这么劳师动众的杀人是否真有必要，而且杀人时候基本上是全体技术人员一起做技术支持。看上去俨然这才是这个公司的主业。而且不但前合伙人全都离开公司，他手下的几个改造人，要不良心不安调转枪头，要不好勇斗狠就想打架。就连开车的司机都因为掷来一只机械臂就下车逃跑了，这么大的产业，最后一个忠心的人都没有。     而杀了Boss后，大佬突然就放下了，觉得追逐之前的记忆没有意义，要开始新的生活。其实所有男人都会像他一样的，尤其是在新认识了一个大美女之后。  花絮： 1.本片是勇士漫画系列改变的第一部电影。 2.Michael Sheen原定出演Harting博士，但由于档期问题未能成行。 3.此片为导演Dave Wilson的电影处女作。,,,0
