,Unnamed: 0,电影id,电影名称,用户id,用户名,评分,评论日期,评论内容,有用数,没用数,回应数
8,8,4830483,喋血战士,265f03e03dd3456e0125121ac14cb86d,82f38a247b06bbdc090c2e6fdd7e1725,3.0,2021-02-09 02:36:13,人物  雷·加里森：不死战士（需要充电）低配版美国队长  KT/凯蒂： 殖装呼吸，水下，无惧任何吸入物（有毒气体，颗粒物）  艾米尔·哈汀：重生公司创始人（出场即自曝的大boss） 艾克斯：假boss（出场自带BGM和舞步的男人） 吉娜：Ray曾经的妻子 威金斯：黑人话痨编程天才 艾瑞克：对自己牛子尺寸极度不自信的阿三程序员  吉米·道尔顿 ：机械腿，机械殖装手臂，低配版章鱼博士 狄伯斯：机械复眼，人型简易监控（跟普通的特种士兵一样） 具体的剧情就不详细描述了，1星给艾莎.冈萨雷斯，妲露拉.莱莉，1星给曾经被恒星光照追逐过的男人范.迪赛尔，1星给原创漫画的剧本创意 如果不带有任何特别的期待去看的话，其实还算不错的爆米花电影，槽点不是很多，较真没必要 但是我还是要吐槽下剧本，不知道编剧是不舍得仔细构思人物关联的剧情和伏笔还是被导演咔咔的剪掉了。 第一。明明都是纳米机器人流通了，还能自行网络搜索和快速学习和掌握，怎得还要无脑莽，知道你不死，但是也不用这样脑瘫的往上莽吧，高科技莽夫？作战战术没有？ 第二。KT的反抗线完全是潦草，虽然我知道美女天生有优势，但是也没让吉米和艾米尔表现出怎样病态的为之痴迷，得不到又不想毁掉，欲罢不能的心理。所以为什么能让KT做出这么多关键的反叛事情？ 第三。老黑完爆印度阿三，阿三居然承认直接套用抄袭了老黑的源代码，除了几个显示器通过一些画面显示了科技感，还有被破坏后急速复原的特效带来了一些类似超能力的科技感，其他基本还是枪械激斗，所以科技感在哪有特别具体的体现？还不如钢铁侠的别墅里的贾维斯和星期五来的更显高科技。 总体来说，就是很潦草，但是也值得一看，毕竟就图一乐。,,,0
9,9,4830483,喋血战士,cabbf0e205057c2f8d20aed97e545f6c,de39269e42e407ff62395a17520b4557,,2020-12-29 13:50:53,男主是一个士兵，然后被一个坏人抓了老婆和自己，逼问情报，但是男主不从，然后就和老婆都被宰了，醒过来的时候自己的身体被改造了，血液里有纳米机器人，可以恢复伤口，然后男主跑去杀打死自己的人，杀完回来之后男主就被抓起来，删除记忆了，原来这一切都是救自己 科学家设计的，男主的记忆也是随便改造的，然后杀完第二个人，男主遇到一个程序员，男主的代码就是程序员写的，然后男主还有一个女同事，也是改造人，女主喜欢男主，对科学家的所作所为看不下去了，男主最后一个目标就是程序员，在修改记忆的时候被程序员设计了，然后男主没有被修改记忆，起来直接就开始打架，最后把科学家宰了，然后和女主程序员一起走了，估计会有续集,,1.0,0
10,10,4830483,喋血战士,2c77e503029822fbc9fed13b1bdc2774,eedfcb3776010769a52b0ccb31e14a8e,2.0,2020-09-30 08:11:20,"2020美国科幻动作片《喋血战士》，全球累计票房2930万美元，定级PG-13，豆瓣评分5.6，于2020年7月24日引进国内上映。 本片的剧情毫无吸引力，太过俗套，影史类似这样的生化战士题材的电影多如牛毛。都2020年了，怎么还有人在拍生化战士这样的烂俗故事。所以本片单从故事上就已经意味着失败了一半，就算由范·迪塞尔担纲也不会有什么吸引力。 本片的出台很显然是受漫威和DC超级英雄电影如日中天的影响而推出的。范·迪塞尔既不在漫威宇宙，也不在DC宇宙，与超级英雄无缘，与漫改无缘，所以范·迪塞尔试图借本片搭上漫改超英的热度。 本片在超能力设定上没什么亮点，机体自我修复这样的设置早就玩烂了，主人公除了力气大和不死之身的自我修复能力，没什么特别之处。大反派的设置也没有亮点，是创造主人公的“上帝”角色，这样的大反派设置太过常见（大反派创造主人公的目的是为了清除异己）。 本片的故事讲得支离破碎，导演不会讲故事，从头打到尾，从头乱到尾。动作戏比重很大，但除了片尾高潮戏的生化战士电梯大乱斗以外，其他动作戏都没什么可圈可点之处。 好莱坞类似这种非一流CG特效的小打小闹科幻片很多，导演不是名导演（你能相信吗，本片导演只有本片这唯一一部电影作品，怪不得这么水），CG特效团队不是一流人马，剧本不是大格局故事，片商没有大投资，靠一两个明星担纲，属于典型的流水线作品，本片就属于这种类型。 范·迪塞尔还是声音低沉、面无表情、不苟言笑的老模式表演，还是速激里的老味道，表演没有突破。其实我并不看好范·迪塞尔这个演员，他除了速激系列以外没有代表作，而且他也不能算是速激系列的挑大梁角色（速激主打的是家庭牌），在我心里算不上好莱坞一线明显。
 本片不是地道的好莱坞电影，在豆瓣里可以看到出品地区“中国大陆”在“美国”前面，博纳投资是主要投资方（博纳是美国电影片头的常见投资方），说实在的，我一直不看好有中方投资背景的好莱坞电影，这样的电影经常是不伦不类，鲜见佳作（扑街的居多）。",2.0,1.0,1
11,11,4830483,喋血战士,48636526ef92e342f63234fd5c10d706,ea049f870f2499f0f1d86f8319f6a941,2.0,2020-09-04 15:58:30,"这个故事有一个很迷惑的事情，那就是电影制片人花费很少的时间来建立电影并迅速透露出它的曲折，这使得一切在进行得非常直接。每个角色都不会感受到新鲜，你拥有坚如磐石的好人，欺负女性的恶霸，对英雄的疯狂憎恨，机智的书呆子。这些角色没有任何真实的背景知识或关于它们的任何有趣的东西。 Vin Diesels为女友报仇的事情从未得到充分发展，以至于您无法关心她的死因，因此他的横冲直撞会让观众感到无聊。

首先，Vin Diesel的扮演角色，他所经历的痛苦，愤怒和英勇动作并不像他所扮演的角色那样多，正如他从《速度与激情》中扮演自己的人所期望的那样。Lamorne Morris作为书呆子投掷了许多据称机智的内胆，但没有一个达到目标，很快就变得刺骨。赋予其他角色的能力令人怀疑，你有一个双眼失明但声纳视野增强的家伙，一个截肢者充满了机械腿，而与Vin Diesels super相比，最没用的就是调节呼吸的能力力量和再生能力。永远可靠的Guy Pearce很忠诚，但他的性格冷淡，而且考虑到她无数次地表现出不再忠诚。

明智地采取行动，这是非常标准的事情，而很少有创造力或兴奋感。当Bloodshot处于掠夺状态时，隧道的暗杀看起来令人愉悦，并且开始很吸引人，但是它演变成了一系列非常普通的踢和拳的慢动作镜头。伦敦的追逐也很单调，没有什么特别令人兴奋的事情，它对英格兰的误解令人可笑，展示了两名警官坐在警车上吃零食，然后鲜血扑面而来，将警官的步枪开火，据我所知是在英国，节拍人员不会携带自动步枪。当Bloodshot冲进恶棍的基地并与Doc Oc战斗时，结局是一场令人难以置信的事情，这场战斗本身引起了片刻的兴趣，当战斗人员从升降机井道上自由落下时，彼此之间的战斗令人印象深刻，但这是非常令人印象深刻的。短暂的。实际上，最令人印象深刻的战斗是EizaGonzález的KT角色，他与一些追随者的战斗非常迅速，展示了不错的编舞技巧，但战斗一开始就结束了。

这部电影在视觉上令人印象深刻，这是一种视觉享受。但仅凭视觉效果并不能构成一部好电影。我想这部电影可能会有些娱乐性，但是如果你想从超级英雄的故事中获得更多收获，那就不是了。",2.0,,0
12,12,4830483,喋血战士,c65a3a04be90532306ed9804ddbcf4ef,f0eba6539e9740e013596b625456fbf6,,2020-08-31 20:11:16,"这部似乎是根据一部老电影翻拍的，关于复仇战士的故事。男主原本是一名特种部队军人，后来被匪徒灭口。他醒来已经被改造成了具有超强战力和纳米复原能力的‘‘喋血战士‘‘。直到有天他觉察到违和感，当他没电昏迷后醒来，一位捡到他的黑客说他的大脑被加密了，于是他确认了自己被洗脑的事实，决定反攻这股控制他的势力。

他有两个伙伴，一个就是这位具有‘‘五十年‘‘编程经验的黑客，就他只是个不到三十的黑小伙来看，他是吹牛的。还有一位就是和他有同样遭遇的女主，只是她的记忆没有错，只是她一旦反抗，boss就会操纵她胸前的机器夺走她的呼吸，让她成为‘‘乖女孩‘‘。

当男主第一次试图反抗时，boss派出了科技部队，先是发射一枚炮弹到半空中展开成为近地面卫星追踪他。中间穿插着一段有着[速度与激情]风格的街头摩托特技，还有第一人称视角，很有大片既视感。不过这是范迪塞尔单飞的动作电影，场面不会太爆炸。

电影另一个亮点在于这位麦色皮肤的女主，原本以为她是来凑颜值的。没想到她演技了得，整部电影她每次露面都穿着不同的服装，可能是换装最勤的女主。尤其是她穿着一套米色的看起来很淑女的毛衣靠着路灯抽烟。转眼就击倒一个匪徒，还会360度翻身绞杀，一根弹出式铁棍被她使得上下翻飞，虽然她也曾被打

倒在地，但丝毫不影响她的发挥。这身手估计不比寡姐差。

她与那位黑客取得联系，帮助她摆脱了控制，并且和男主进行了一场VR对话，把他唤醒，然后她像古墓丽影劳拉一般潜入机房炸掉了那些主机。

最后这场打斗有飞毛腿还有机械手，三人在空中的电梯上厮杀，时不时的慢动作也是华丽的打击画面。喋血战士最后与boss同归于尽。

而他没有死，醒来后，黑客看他没有什么不一样，恢复的很好。黑客还提升了战士的电池续航能力，达到以前的三倍。

他打开车门，女主坐在海边的石头上，与他握手成为伙伴。因为已经复仇，他们的下个目的地就是乘车绕山坡看落日",,1.0,0
13,13,4830483,喋血战士,7d366f2cf90ae422e2dc8de0fc18d6ae,f0a2f9d95688f03eb52b173535789ca5,,2020-08-13 18:14:21,当时没啥电影看，就去看了这个电影。我感觉没有一分那么差，就是冲特效看也值2分吧。剧情也还好啊。都是大神。我只是个小普通。当时看之前也看到很多人给了很差的评分，其实不抱希望的。但是看了我觉得挺好看的。最起码不是那种很弱又很强。算是一直都很厉害的那种。我个人觉得最少3分吧！不赞同的自己不赞同，别喷我！,1.0,1.0,0
14,14,4830483,喋血战士,f663da85edd0499d36ecef5a73c4e0cf,4656024c9e879f05daac1c0e7a72ce5d,3.0,2020-08-10 15:07:43,"以下内容转载至微信公众号「缪博士的日常」(微信ID： miaosw1989 )   如果以操作系统进行分类，则目前市面上的手机主要分为苹果IOS系统和谷歌安卓系统，前者闭源，而后者开源，可以深度定制用户需要的功能。 当用户感觉手机自带的安卓系统不顺畅时，一般可将手机root后，给手机刷入第三方定制安卓系统，满足用户的个性需求。 对安卓手机root的操作，实际上就是获取对手机的最高控制权限，但root后的手机易面临被流氓或黑客软件攻击的风险，导致用户的隐私资料或其他重要资料泄露。 如果安卓手机换成一台具有强大杀伤力的安卓机器人，那么当它被root后，风险更大，后果可能致命。今天的这部电影讲述的正是这个例子： 喋血战士
 Bloodshot 中国 / 美国 2020.3.13     读者们能分清海报中谁是博士，谁是安卓机器人吗？ 电影上映一个多月来，就在豆瓣上收获5.4分的不及格成绩，这主要是因为电影情节单调、老套和冗长，虽然有部分反转情节，但熟悉套路的观众可轻松推测出剧情走向。总结来说，整部电影描述的事情可以用一句话总结，那就是： 邪恶博士利用士兵尸体成功开发安卓暗杀机器人，用于铲除异己，没想到被黑客root，终被机器人反杀。 就这么简单的事情，硬是被导演用各种特效和尬聊给拖了整整1个半小时的时长....     好，咱们来看下电影中的安卓机器人吧，就是它：     没错，这次范·迪塞尔「下称：老范」没有去开极品飞车，改行做机器人了。老范是个美国大兵，阵亡后，其遗体被捐献给了邪恶博士的实验室。博士将老范身体中的血液抽空，换上了液态微型机器人，这些机器人能增强老范的体能，迅速修复机体损伤，并控制老范的思维，使他成了一个有人类外形的机器人。 为什么说它是安卓机器人呢？ 1. 老范的光头和安卓机器人的光头太像了，一个黄色光头，一个是绿色光头。     2. 老范和安卓机器人一样可以被APP控制，每次执行暗杀任务前，博士都会对老范洗脑，让老范认为暗杀对象是杀妻仇人。     3. 老范体内的液态机器人属于消耗品，需定时补充新的液态机器人，很像安卓手机的电池，电用完后，需重新充电。     4. 老范体内的液态机器人还能超频，这和某些发烧级游戏安卓手机很像。     那为什么老范会被root呢？ 原来，邪恶博士的手下在开发老范的控制系统时，使用了黑客分享的开源项目。这为黑客入侵老范的操作系统提供了后门。     总体来说，这部电影特效很炫，打斗很激烈，喜欢「砰、砰、砰」从头打到尾风格的观众可以去下载观看，但电影情节就很单调乏味了...",,1.0,0
15,15,4830483,喋血战士,5255dedfa4380aa7e8e21b5f08c38bd7,98a0e0cb1d270711e49e4043a671bd87,5.0,2020-08-06 16:53:20,爽得一匹。帅得一匹。掏38块钱看光头老大装逼，这钱花得值。 范迪塞尔是唯一开金手指，收后宫，一顿操作猛如虎，还不让我直骂“这人傻叉吧”的男演员。听花边新闻讲丫是戏霸，跟谁谁不合了，谁谁又爆料他怎么耍大牌了，看得我津津有味甚至想再来一桶爆米花。基本上我喜欢的男演员就没有在圈里有好口碑的，默默无闻小透明就是最好的了。 这人就是独。独特的独。他跟巨石强森就是外形看着像，大块头杠杠的，但屏幕上传递的感觉完全不一样。也就冲这份感觉才一次次掏钱进电影院，这么说吧，这部电影在老范拍的一众片子里绝对不算烂。中上水平是有的。 要大长腿有大长腿，两个美女都选得不俗，越看越有味道的那种。配角里有一个黑人塑造得极其出彩，可以用艳压女主角来形容。有一段审讯的戏配上psycho killer和舞步堪称艺术。说剧情老套我不服，抄袭是有的，西部世界+终结者+一部什么大片片名我忘了，但好莱坞神奇就神奇在这里：它东抄抄西抄抄，给你鼓捣出一个味道不一样的菜。它肯定跟第一次吃到螃蟹的滋味没半毛钱关系，但是要麻有麻要辣有辣，起码有滋有味是能保证的。作为一个脱离不了低级趣味的人，我对钢铁直男爽片是有刚性需求的。阅过无数爽片，敢拍胸脯说，有些所谓口碑好的爽片实际观感效果烂得一匹。不是没有诚意，而是太有诚意了，要升华，要有思想，要不一样，结果看着看着就真的不一样了，掏了看A片的钱，最后看了一部拉拉小手的言情片。 放心，这部电影货很对版，想换换脑子在屏幕前喊666的，买不了吃亏，买不了上当。 以上影评基于本人对电影的审美原则：要讲故事，有好剧情。不要讲道理，如果有道理，让我自己悟，请你少哔哔。 看一部电影必须有大彻大悟醍醐灌顶之感，那此片巨坑，不如看《小马过河》悟道参禅，立地成佛。,3.0,1.0,1
16,16,4830483,喋血战士,b27eb0039b869db95c8266be104ea140,6afa888297dded5242c465a1db7b0c02,1.0,2020-08-05 23:45:55,先给结论：浪费时间的辣鸡！爆米花向也不推荐，除非真的不看电影会死…… 主题设定有新意，无限循环+真假梦境，结合了黑客帝国和盗梦空间的元素，这样的设定讲道理想要拍一部特别差的片子不容易，但是这位导演戴夫威尔逊做到了……差的不知道从何说起。 全片大概只有特效和画面是跳不出什么毛病的。龙傲天主角，智商低，脑子里只有打打杀杀和复仇。剧情进展其实很快，甚至显得转折有些生硬。套路就是没有套路，被利用，疑惑，恍然大悟，反杀，大圆满的老掉牙故事。 剧中简单粗暴的纳米机器人，硬是弄出了一个活死人肉白骨的天顶星科技体系。本应该势力遍布全球资产无数资源深厚的顶级黑科技公司，全部财产就是一栋看上去酷炫的办公楼，两间办公室，十来位白领，2个打手……也是醉了，最后还各种大翻车，公司小姐姐莫名其妙爱上主角，突然良心发现，冒着暴毙风险做二五仔推翻公司，疯狂搞破坏。公司的顶级程序员和安保系统还被外面冒出来的野鸡天才当玩具操控，整个公司有战斗力的就是两个打，手也被主角轻松吊打……哎，快吐了。剧情强行转折不说，下一步也完全能被猜到。 科幻片也要按照基本法吧？剧中出现的科技，不是先进与否，而是根本没法实现。比如说在地球另一端，通过身体里的纳米机器人直接对话，而且还能传输调用各种天量信息资源，甚至直接把别国城市的每一辆车的驾驶员实时定位、筛查身份，咋做到？当地警察都没法定位每一台车，更不用说实时显示驾驶员。玩游戏还有战争迷雾呢，就这也太扯淡了。就是披了一层科幻皮，里子完全经不起推敲，还不如阿西莫夫那个没有电脑的时代的科幻作品严谨。 主角就是个低能大兵，开个光环强行复仇执行正义，破坏了邪恶公司。而且反派BOSS也显得特别低能，除了大吼大叫靠小工具威胁他人没有任何技能，最后还被轻松解决。主角最后极限一换一顶着炸弹自爆，也没交代怎么就安然无恙恢复了。没了纳米机器人就应该死亡的设定，最后也被推翻，机器人去除了，人也活的好好的。心心念念的、现实中已经结婚生子嫁为他人妻的前女友也不管了，就和原公司二五仔漂亮姐姐浪迹天涯了。哎。说的比较乱，因为太辣鸡了，主角看的人想吐，感觉导演在侮辱观众智商。情节合理性和框架还不如奥特曼打怪兽，就算是打发时间我也不推荐看。看的人直恶心，非常讨厌主角和二五仔女的。就酱。,1.0,1.0,0
17,17,4830483,喋血战士,9ec990cb7e81c53ab6306bc633683bc5,e569663505021a217752d6fa28ae0dcb,,2020-08-05 16:17:14,"假肢、假眼、假肺等可代替器官。这部分科技，未来应该可以实现。副骨骼的能力很强大，可以像蜘蛛一样在建筑上攀岩条约。好评。但是副骨骼的关节，看起来是不是过于脆弱了。8分
人脑记忆编辑，关于这块，电影中，有着详细的记忆场景编译的过程，非常赞；毕竟我还是挺希望能实现记忆编辑技术的，这样的话，知识就可以直接输入给脑子，不用经过学习计算。8分
人物：
正派：

jina （吉娜）：男主老婆。jina出场3次，
第一次是迎接丈夫回家；
第二次是被绑架；
第三次是几年后Ray Garrison回乡看望老婆发现已经是别人的妻子；
jina是男主心中最重要的人，（记忆中）jina的被杀，是复仇的动力。而这一点被反派boss利用，用来杀别人。

Ray Garrison（男主）：
男主

KT（男主的新队友、女一号），喉管经过替换，可以过滤气体；女一号虽然大量出境，卖了点色，但是她的能力被设计的太弱了，虽然最后发挥了频闭毒气的能力，烧毁了RST公司数据库。剧尾和男主在一起。
Wigans （黑人男程序员，男主的技术伙伴）",,1.0,0
18,18,4830483,喋血战士,321bfaa62ffc12733ca562448c2cebb9,1da6dbebeb21bfe5d3aa16a25970c8ca,,2020-08-03 22:21:06,老兵不死，只是不让死——《喋血战士》         今天聊聊电影《喋血战士》。 片名Bloodshot (2020)，别名血卫(台)。     “喋血战士”是美国勇士漫画公司旗下的扛把子，类比DC和漫威的话，喋血战士就是DC的蝙蝠侠，是漫威的美国队长。 勇士漫画公司当年也和DC漫威有过不少纠结，最初还重金拉走两家公司的大批作者，号称自己是美国第三的漫画公司。     原本我记忆中，美国第三的漫画公司应该是推出了再生侠和鬼隐侠的IMAGE，现在又来一个勇士漫画公司……只能说除了DC和漫威，随便来一家公司都敢说自己是世界第三，反正没人知道呗。 其实吧，一般说自己是第三的都没有什么好下场。比如老大和老二互斗的时候，“不小心”就能把老三干掉。比如有好几个国家号称自己是“世界第三军事强国”，没几天就被人按在地上摩擦摩擦，要么被打得千疮百孔、要么总统被人抓走绞死。总之自称第三可不是什么好话。     《喋血战士》野心勃勃地表示，要推出《喋血战士》三部曲，打造一个勇士漫画电影宇宙。 其实看到这句话，大家就会会心一笑，吹呗，有个梦想还不行嘛。 你看隔壁的黑暗电影宇宙，死翘翘了还能没事诈尸一下，不玩大宇宙改玩小制作，推出个《隐形人》反而还不错。     就《喋血战士》的票房表现来看，影片成本预算4500万美元，票房3027万美元，简直是亏到姥姥家。 按照预算三倍保持盈亏平衡来计算，一部《喋血战士》就亏了一个多亿美金。不知道这一个亿会不会要了勇士漫画的老命。     《喋血战士》的设定十分简单，男主角雷·加里森是一名复生人，全身被军火集团重新编程，植入虚假记忆后成为高效杀人工具。雷在友人的帮助下，发现自己被控制的真相，于是一举端掉军火集团，为自己赢得自由。 死而复生的概念早已被玩烂，间隔不久就有一部女神塞隆的《永生守卫》，这些都是同一类型电影，一旦拍不好就会扑街。     《喋血战士》的缺点十分明显，作为拥有无限条命的超级战士，雷的角色扁平化，从头强到尾，缺乏一个最简单的成长过程。 想要建立一个成功的电影宇宙，人物角色是重中之重，如果人物角色没有立起来，那么就不会有好故事可言。比如死侍，观众可能不记得两部电影的剧情，但会记住他是一个亦正亦邪又重情重义的角色。比如这里的雷，观众们看到的是一个一如既往的范·迪塞尔，看不出这个角色和他以往的角色有啥区别。我的头像就是范·迪塞尔，当年十分喜欢他，但几十年一直重复自己没有改变，其实要说他的最精彩表现就是《超世纪战警2》里的瑞迪克了。     如果单纯的把《喋血战士》当做一部爽片来看，那就找对了观看姿势了。 影片中战斗不停歇，深入血液骨髓的改造让喋血战士战无不胜攻无不克。尤其是最高潮的一场战斗十分精彩，简版章鱼博士和高逼格版死侍在高楼上上下下叮叮当当地一顿乱揍。 如果观众们放下那不存在的勇者漫画电影宇宙“蓝图”，只想着看一部无脑爽片，那么选择《喋血战士》无疑是一个正确选择。比起《永生守卫》，《喋血战士》打得好看得多的多。同样是肉身硬扛，喋血战士明显比普通人类更具有观赏性。     老兵不死，只是不让死。 重复套路，走上不归路。   这里是硬核影迷集散地，欢迎关注公众号：妙看影视,,1.0,0
