,Unnamed: 0,电影id,电影名称,用户id,用户名,评分,评论日期,评论内容,有用数,没用数,回应数
12,12,24298954,疯狂原始人2,2add43b629d9176adde9e0b0ebea780e,54c8a3831fca9a157899ac2272ad1f12,5.0,2021-01-08 04:43:31,编剧，要把人物表面和潜在欲望，以及他想要的目标，以及阻碍，都想清楚。 人物的潜在欲望与表面欲望一定是相反的，不然没有写他的价值（限商业片）。   在故事进行到那个时间时，呈现出人物互相之间，当时的欲望交织情况。 讲的是人物在当时胜出的一面的欲望。 但该人物表面欲望和潜在欲望，藏在水面下的斗争，还在汹涌澎湃。 正面欲望和潜在欲望，如同孙子兵法讲的“以正合，以奇胜”，正奇是随时变化的。 人物的行动，决定了他当时的欲望是什么，在上面的就是正，在下面的就是奇。  正奇是随时互相变化的。  “善出奇者，无穷如天地，不竭如江海。 ”  角色互相之间都是水面上和水面下的欲望，互相纠缠，互相启发，回环往复。  这样也能写出丰富多彩的群像戏。  第一组： 瓜哥，爸爸 表面欲望：一家人都要在一起，但导致了大家不快乐。爱一个人抗下所有，不爱和家人倾诉烦恼。 潜在欲望：快乐才是一家人。渴望倾诉的渠道。 阻碍：小伊要和男友离开  Hope，文明人爸爸 表面欲望：想让盖当女婿，对老婆有轻微的难以忍受。相信智慧，渴望独处，看不起咕噜家族粗鲁 潜在欲望：想做好父亲，让女儿幸福。不是渴望独处，是渴望家人交心，渴望交心的友情  一开始瓜哥的表面欲望和Hope的表面欲望互相碰撞。 Hope虽然看不起咕噜家族的粗鲁，但他靠智慧激发了瓜哥的潜在欲望，让他开始倾诉苦恼，所以两人初步建立了表面友谊。 当两人发现自己都不是“好父亲”的时候，发现让家人快乐才能真正在一起的时候， 瓜哥的潜在欲望和Hope的潜在欲望瞬间吻合，所以两人热泪盈眶，如胶似漆的成为香蕉兄弟。   第二组： 小伊，大女儿 表面欲望：炙热的毫无保留的爱情 潜在欲望：心心相印 阻碍：父亲讨厌他们腻歪。盖渴望去tomorrow，但她不理解那是什么，盲目的同意。  盖，男生 表面欲望：有爱，但要寻找home，tomorrow。一开始以为文明人的家就是他找的，但其实不是。 潜在欲望：在寻找心的归处。 阻碍：瓜哥想要一家人一起，不让离开。小伊想要毫无保留的爱，不懂得妥协。  这组比较容易理解： 小伊想要毫无保留的爱，盖也追求爱，但认为找到hometomorrow，才会有真正的爱。 盖来到文明人家园，以为那就是他想要的hometomorrow，小伊认为那不对。 最后盖也认识到错误，真正理解到和小伊和家人在一起，就是hometomorrow。  第三组： 奶奶 表面欲望：混吃等死 潜在欲望：雷霆狂花 阻碍：衰老和没有响应的人。  文明人妈妈 表面欲望：想让盖当女婿，爱干净爱独立，看不起咕噜家族粗鲁 潜在欲望：想让女儿幸福，渴望狂野，羡慕咕噜家族的亲密无间 阻碍：环境和缺乏引导者。  这组很炫酷，混吃等死的奶奶带着变化最大的文明人妈妈及一群女人，化身雷霆狂花，拯救男人，打败金刚。  第四组：工具人 哥哥 表面欲望：喜欢窗户外的风景 潜在欲望：喜欢外面的世界  晓晓 表面欲望：不喜欢被过度保护，想去外面的世界 潜在欲望：摆脱束缚，获得友谊  小珊 表面欲望和潜在欲望完全统一，就是吃、闻、打！,1.0,,0
13,13,24298954,疯狂原始人2,6f163032be1d9ad9f8cfa40846341164,52e47b389023b3a3094947e142d1db56,2.0,2020-12-22 16:47:16,在近日播出的《疯狂原始人2》中，再次对不同文化进行了描述，以表面的情侣因理念不合而分开，延伸到文明的撞击与融合。  Guy和Eep一家人一起奔赴“明天”，追着光，他们遇见了一面高墙，爸爸撞开了墙，背后是一片“人间仙境”。 丰富繁茂的食物和花朵，各种新奇的生物和谐相处，伴随着这些“高级文明”而出现的，是一对白人夫妇。 他们以高姿态的“欢迎”来面对着这群“低级”的洞穴人，怀揣着夺走Guy和自己女儿配对的心思，招待起了主角一行人。 1、 香蕉  影片中，香蕉是为了安抚墙外未知的狂躁生物，白人夫妇视它为不可见、不可战胜的存在。 讽刺的是，墙外的不过是拳猴，香蕉由白人Phil不断扔出去，得到贡品的拳猴们转而把它进献给更巨大的猩猩，换来安宁。 Phil和拳猴一样，面对比自己更强大的存在，选择的都是退让，害怕去挑战，所以一旦失去了唯一的慰藉——香蕉，他们将面临的就是自上传下的压迫。 香蕉，代表着他们的逃避和不作为，自以为建起了高墙，就能隔开危险，实则是在壮大敌人的贪婪，割自己的肉来饲虎。 2、隐私  “隐私促进个性”，这句话一直穿插在影片当中。 吃住睡都在一起的洞穴人，和拥有自己私人空间的白人。来到园中的洞穴人们，除了Grug以外，都在自己的房里睡得很好，似乎隐私就是文明进化的一大步。 但他们睡得香，不是因为有了隐私空间，而是因为有了舒适的环境，空间并不能隔开他们彼此的感情。 一直以来信奉隐私的白人夫妇，实则白人Phil还有着妻子不知道的“秘密洞穴”，所以隐私带来的就是隐瞒？打脸不打脸？ 3、爱情  影片从开始的Guy和Eep狂秀恩爱，到后来互相产生矛盾分开来，再到最后谅解彼此、和好如初，不得不说，好一出狗血的爱情剧。 用两个人的爱情，来表现不同文化观念之间的冲突。Eep不理解Guy来到这里后的变化，而Guy不理解Eep为什么追求过去生命无法保障的日子，所以两人分开了。 仔细看，不就是披着爱情的皮在强行融合文化吗？爱情里可以改变自己接受对方，但文化绝不是以个人意志为转移的。 可以借鉴，但绝不会融合，融合了外来文化，就不再是原来的文化，而是被殖民的存在。 4、猴子  曾经的拳猴们也有着和白人一样的神仙国度，吃不尽的香蕉，享不完的乐趣，突然有一天它们失去了水源，然后就面对上了巨大的猩猩。 它们没有去查询水源枯竭的原因，而是在得到白人给予的香蕉后，就安心把它贡给大猩猩，再不做其它。香蕉被Grug吃光后，只知道绑走人类，扮成香蕉来平息大猩猩的怒火。 尽管它们只是猴子，不是具有更高智慧的人类，但作为土著，仅仅知道坐享其成，甘于压迫，山谷里数不清的猴子，没有一只提出来反抗大猩猩，或者去夺回水和香蕉。 这就是影片为它们加上的令人厌弃的“奴性”。凶恶的大猩猩用武力征服了它们，偷走水源的白人用分享的水源安抚了它们，它们就像一片树叶，飘到哪里就能在那安家，除了基本的需求，再无更深的思考。 5、雷霆姐妹 在美国电影里，英雄主义最为盛行。陷于危难中谁来拯救？英雄。 无法战胜的大猩猩，就像游戏里设定的反派大BOSS，等着主角英雄们去攻克它。剧情发展到这里，突然就蹦出来“雷霆姐妹”，然后年老的奶奶突发神力，成立新的一代，就这么几下，赢了。 好好的电影，就从天而降个大金手指，然后曾经的敌人，就成为了过去式。这么老的套路，连改都不改，就这么塞了进来，让我们怎么接受？ 6、HE结局 动画电影HE很正常，谁不喜欢看主角们快快乐乐的生活在一起？ 但是在这部电影里，它的内在主题是文化，不是爱情或者亲情或者理想，文化是无法妥协的底线和原则。 被夺走水源的土著猴子、生存于野外的哈士蛛、更先进文化的白人一家、野蛮冲撞的洞穴人一家……他们彼此间的关系，不是电影一个HE就能盖上幕布的。 最后的HE，在向观众传达着那些直白、暴露的剥削思想，配上萌萌的卡通人物，就能给这些隐藏在背后的恶行洗白。 对成年人来说看完或许没什么，对孩童呢？他们感受到的难道不是压榨别人最后还可以和谐相处吗？说白了，这就是在洗脑，潜意识里埋下这样的种子，然后不知道哪天，它就会发芽壮大…… 7、结语 在第一部里，我们看着洞穴人一家，从开始的野蛮、不知变通，到后来的灵活运用，用自己的双手创造出越来越多的新事物，一步步的朝着更美好的明天前进。 有了它，才会让观众期待着第二部会演绎出更吸引人的故事，但可惜，没有！ 作为动画电影，从外观上就让人不由心生喜爱，明明具备了再创辉煌的能力，却在续集里谱写了丑陋、恶心的现实，妄图以动画的外皮来遮掩。 “挂羊头卖狗肉”，能形容它的大概只有“厌恶”了。    球波关注，蟹啦~\(≥▽≤)/~,9.0,3.0,1
14,14,24298954,疯狂原始人2,27b88e11d6b686870995481a0af3caf8,5a3957870943baff54f069d57c4f33e5,4.0,2020-12-05 20:21:44,七八月暑期档来了个寒冬腊月大挪移，该是泡在电影院的一个月了。 去看《疯狂原始人2》前，还想着，去年冬天用琦同学的万达员工票看了第一部。搜了第一部的标记，竟然是15年！那去年琦同学叫我去看的是什么？再翻，不是去年？是前年！是《无敌破坏王2》……或许梦工厂在心中的印象，依然让我习惯于把好的系列放到迪士尼身上，亦或许，是不至于如《寻梦环游记》一类，每每想起，一幕幕画面顿时呈现，而后或感怀或落泪。 以前总不好理解，年长一些的人记不住具体的年份，如今我也成了这样。 此次观影体验，仓促换片，没戴隐形，儿童专场，巨小荧幕，还有……误选国语配音版。可见连日来的头脑凌乱。 然而，这样看下来，依然很喜欢，好美的伊甸园。 梦工厂太疯狂，九十分钟的动画，主题却极富探索性。现代化与原始生活的冲突，“父母”墙的保护，吃饭不能看“窗户”的手机映射，动物家园被人类侵犯后又反攻人类的“环境保护”命题，老去的岁月、女性的崛起、成长的别离都是那样赤裸又动人，蜘蛛狼、石头、火、亲吻的爱心和花生脚趾头等无数次的刻意回环令人舒适。想象力依旧令人欣羡，节奏一如既往完美。 但下一部，我想要看雷霆狂花！疯狂原始人之雷霆狂花1984吧！ 我也要给自己想一个花名了……,3.0,1.0,1
15,15,24298954,疯狂原始人2,e15e7ab38bc4525bbe07b9981960e0cd,0166716c67bc58c12b4efdad2efff714,2.0,2020-11-29 19:35:40,两点钟吃完饭突然想去看部电影，犹豫了一会是疯狂原始人还是一秒钟，尽管早就对一秒钟有着极高的向往，但是出于自己难得一见的情怀还是去看了疯狂原始人。 怎么说呢，感觉非常失望。 可能是当年的第一部给我的感觉太超凡脱俗了，无论是笑果，还是构思，还是整个故事的价值观，都让人异常舒适。我还记得当年看完之后我疯狂向周遭的人安利，担心大家错过这一宝藏。 这一幕转眼已经过去七年了，好快啊。2013年是我开始收集电影票，把看电影作为自己关注点的一个开始，那个时候总会对不同的故事迸发出不同的想象力和灵感，那个时候我还沉迷于向别人安利，我会为了能在高二高三一个宝贵的下午多看几场电影，钻进电影院里三集连映，还记得当初从超级战舰到形影不离，再到黄金大劫案？记不清了，那个时候真的很有热情。 疯狂原始人给的的第一感觉也是这样，极尽搞笑又充满创新，能从一个不同寻常的角度讲一个新鲜的故事，而不是那些玩烂了的价值观。在我七八年前对于动画电影的回忆里，这段黄金时代不是什么玩具总动员构成的，而是无敌破坏王和疯狂原始人，以及再久远一些的机器人总动员。 所以我个人今天真的非常失望，因为七年之后的疯狂原始人2在疯狂打我脸，边打边说它其实不仅俗，而且俗不可耐，它不仅开始重复一些玩烂了的价值观，甚至玩的七零八落。它不再是掏出一个新鲜的玩意告诉行业，你们其实不知道观众想要什么，跟着我的思路来才行。一切的一切都恰恰相反。 进电影院前扫了一眼评论，很多人布满说这部电影太空了，我感觉恰恰相反，这部电影是想讲的太多了，仿佛填鸭式讲道理，它要给你讲家庭成员之间的距离，要跟你讲“家长竖起的围墙”，她还想说文明和野蛮，底层和中产，一切的内容把整个故事撑的面目全非。不仅如此，还全面倒向政治正确，一边是底层族裔的恋爱自由和内心追寻，另一边呢，是两个自以为是的爸爸其实啥也不会，后半段开始尬舞瞎扯淡就等着娘子团来救，本片一共几个男性角色。一个是天天对着窗户发呆的丑角，剩下仨就全在这只会喊救命了，转眼那边姐姐妈妈奶奶阿姨们组成什么雷霆末日花还是啥的，几个人骑个猫三下五除二就把问题解决了，一个个又酷又帅气，一瞬间我搞不清楚看的是惊奇队长还是黑寡妇。这种对于政治正确的倒向和跪舔有点过分的让人生理不适了，你要是想拍女权可以拍个末路狂花，这个水准的电影我愿意一周看一次，可是偏偏把这些政治正确与说教糅杂到我青少年时期最喜欢的电影里面，感觉很难受。 所以我很失望，也很怀念我印象中动画电影的黄金时代，又或者不仅仅是动画电影的黄金时代。,27.0,8.0,10
16,16,24298954,疯狂原始人2,d375f2b01cf808a451c03a5a2856ca11,bd43768f24d6384032eed7de25c94aac,4.0,2020-11-29 06:28:47,更多影评，请关注公众号“小民码字儿”   非常羡慕美国的孩子们，有这样精美的动画可以看。 这话一出，觉得不妥。用鲁迅的话打脸：当我沉默的时候，我感到充实；我将开口，然而又感到空虚。 ▲专打装逼犯 主动交代。我的动画阅片量：44部，标记中国的才6部。 哈，哈，哈（Siri干笑声） 就这，还敢说大话。你看过多少国产？咱国的孩子就可怜，没有好动画看了？ 然而，就我个人成长经历来说，实在希望少年时能有这样精美的动画可以饱享眼福。就如小时候抱着母亲工厂发的胖滚滚的可乐，小心翼翼地拧开瓶盖，嘬进第一口，人生第一次尝过之后的那种希望。这种黑得让人发怵，好喝得让人蹦跳的水，如果每天都有的喝就好了。 如果是一个老看片的，对这部动画想必不会有多大激动。因为无非又是一部合家欢的老套而已，家庭伦理关系，往一万个故事上一套，看一万部，也还是那一套，也就那意思。老美怎么就那么喜欢讲家庭关系呢，影视里反反复复强调。看完除了让人越发爱自己的家人还能有啥？ 文，总要载道的；电影，总要输出价值观的。创作的是人，总有想法要告诉你。爱听不听无非哪边的中听罢了。 而老美这边的确实更中听。既能餍足五官，又能学做人，真正的寓教于乐。 主线剧情是这样的： 疯狂原始人咕噜一家和盖一路披荆斩棘逃避世界末日，寻求更安全的家园。某天来到一处世外桃源，有高大围墙包围，隐蔽而且安全，围墙内各种瓜果琳琅满目，食物丰足，树屋安全方便又舒适。原来这个地方是盖父母的朋友文明人（The Better man）夫妇霍普和菲尔建造的。霍普和菲尔热情接待了他们。然而文明程度的不同，生活方式、价值观的相异，两家必然产生隔阂。文明人夫妇内心里无法接纳洞穴人咕噜家族，意图将他们赶走。同时又希望把同为文明人的盖留下来陪自己的女儿晓晓。而盖早已被咕噜家族看作家庭成员，也和咕噜小伊互相爱慕。种种矛盾，两家人闹得不可开交，殊不知危险也正悄然临近。 电影画面一如既往的精致细腻，人物虽为动画，实际无限靠近真人，面部表情极其丰富，特写之下人物毛发纤毫毕现。这也是近年来好莱坞动画的特点。  相比之下，本人其实更喜欢日本的漫画风格，直接点则是吉卜力的手绘风格（哈哈阅片量也就这点了，不怕暴露）。大概是因为更愿意沉浸在一个更加浪漫的幻境中吧。 《原始人》这类动画的风格在于打造一个现实，一个适合于孩子在其中模拟、想象，学习真实社会的低维度现实世界。其本质相当于教学，带有充分的现实目的性。正因为如此，片子所表现的情境才非常具有参考价值，对于孩子非常具有代入性。这一点后面再讲。 片子的配音水平相当高，与人物性格，与情境完美贴合。也有中文配音版，大家在豆瓣预告片可以对比中英文版本的配音，中文版要稍逊一筹。毕竟不同文化，真的很难模拟不同语言的腔调和情绪。 观影之前并不知道尼古拉斯·凯奇配瓜哥，听了之后发现味道熟悉，越听越肯定就是他。甚至感觉人物形象也跟凯奇相像，这倒是观影当中难以分享的一个小乐趣。    ▲真觉得这俩货挺像的 片中对原始世界的风景描绘实在五彩斑斓，充满想象力，对于孩子的视听体验来说绝对是一场饕餮盛宴。   ▲像大便一样的火焰山藏了一堆铠甲袋鼠  ▲文明人的树屋    ▲如枫叶翅膀的巨大蜻蜓   近年来，国产动画在技术和细节上在追赶，质量上是拿得出手的，可喜的。个人最喜欢的《白蛇：缘起》在画质上人物表情还略显呆滞，人物和环境的确逼真，但是似乎有点实景化了，容易使人跳脱出动画的虚拟世界。 ▲这地面也太写实了 说一说片子所载的道。个人非常喜欢好莱坞这种爆米花的合家欢电影，因为它们格局更大，更实在，着眼于现实人情和社会。是的，格局大并非着眼于虚空，心心念着比赛谁的空中楼阁更漂亮。 文明人一家的智慧相比于洞穴人要发达得多。他们创造了那样一个高级的家园，拥有一种先进得多的精神世界。然而一切都超越低等的洞穴人吗？并不，高级的文明人竟然失去了羞耻心，丢失了良知，自以为是，自私。文明人夫妇谈笑间就谋划了驱赶洞穴人，抢夺盖的计划。接纳洞穴人也是因为盖的原因，他们从内心里就不把洞穴人当同类看待。世外桃源之外，自谋生路去吧，哪管死活。盖则要留下来，女儿是不能出去冒险的，要一辈子待在围墙里，当然更要一个相称的伴侣。 ▲文明人的世外桃源     孩子们现实生活中是优渥和安逸的，正如动画中文明人的生活。文明人的缺点是否也存在于现实生活中呢？动画中的文明人正是一个模型。 文明人一家创造了舒适安全的家园之后，对围墙之外的世界不再抱有好奇，也不再抱有探索未知的勇气。人，总是选择稳妥的。这是优点也是缺点。第一集中瓜哥不愿意离开自己的洞穴，因为它安全。本集中文明人一家不愿意离开围墙，因为围墙之内安全。正如小伊所说，这里只不过是一个更大的洞穴而已。   ▲洞穴女带文明女越狱 有时候舒适圈太大，人就望不到自己的局限性了，也慢慢丢失勇敢、无畏、探索，这些人类一直以来的优良品质。 再来说一说文明人的智慧。他们依靠智慧从高山上源源不断引来泉水，浇灌出一片肥沃土地，建立起安逸的家园。他们引以为豪，然而他们不知道的是，或者知道然而只是并不关心，他们的引水造成山上的缺水，山上植被逐渐凋零，香蕉没有了，金刚一般的大猩猩没有香蕉吃便威胁到铁拳猴的生存，铁拳猴发现山下文明人总是有香蕉提供，于是定期来找文明人麻烦。而可笑的是，文明人压根不敢了解找他们麻烦的到底是谁，只是糊涂地一直提供香蕉。文明人的智慧转了一圈，最终反噬到自己，真是讽刺。 人自认为万物之灵。然而天地不仁，以万物为刍狗。在大自然面前，众生都是平等的乞食者。故要保持一颗谦卑的心。 国内似乎没有专门面对青春期青少年的动画电影。特别强调青春期因为《原始人》给我特别强烈的感觉，它就是专门拍给这样的孩子看的。 片子中小伊和盖相互之间渐生爱慕，小伊本来就十分具有自我意识，在文明人盖的引导下，独立人格越来越强。两个人最终决定成立自己的小家庭，脱离大家庭。而这，与瓜哥“一家人就要在一起”的价值观相冲突。这里面涉及到父女的亲子关系的转变，故其目标观众，在美国我以为应该是8—15岁的女孩（美国孩子相对成熟些）。在中国，应该在12岁以上了。做这无聊的推断，因为片子放映到一半，坐我前面的男孩子实在看不下去，拉着爸爸中途退场了。 多说一句，其实这里涉及到一个影院管理的问题，引进片可以设专门的中文配音版，家长带孩子一起的建议选择这种场次，因为孩子识字阅读能力毕竟稚嫩，眼睛赶字幕，故事大意理解都困难的情况下又耽误欣赏画面，可不就烦躁退场了嘛。 片子中瓜哥与小情侣与其说价值观相冲突，不如说孩子人格的独立与父母舐犊惯性的冲突。孩子人格的独立是生而为人的必然和荣耀，父母舐犊也是生而为人的必然。两者终究要在将来某一刻发生痛苦的冲突。两者都要学会接受对方，一个要接受对方的改变，一个要接受对方的不变。 国内这些年大火的动画，如上面提到的《白蛇：缘起》，以及《大圣归来》《哪吒魔童降世》《姜子牙》等等，可以说是成年人动画。多数动画电影也倾向取材于神话传说之类，追求点在仙、侠、奇、异。而且我们关于动画的概念主要在于面对儿童，或者更确切的说，在于低龄儿童。并没有形成一种专门的产业链，针对青少年的动画创作。针对青少年的电影或许有，有专门的青春题材类电影，近期比如大火的《少年的你》。然而动画类的并没有。 市场应该更丰富起来。或许我们需要半现实半浪漫的动画电影的介入。不要忘记，模仿学习是婴儿的本能，青少年也需要。只是需要更成熟一点的模仿道具。   更多影评，请关注公众号“小民码字儿”,3.0,2.0,1
17,17,24298954,疯狂原始人2,1c067567faceee6fa1f865272a21e271,df60d44d14730f1836dc924c703c1069,5.0,2020-11-27 22:32:58,"疯狂原始人2 ⭐⭐⭐⭐⭐

盼了七年，终于盼来了《疯狂原始人2》，有幸提前看了这部电影，可以说影片满是笑点。
欢笑之余影片中还探讨了女性、儿童教育、环保、文明社会、原始人社会、还有家的问题。
影片开始的风格与第一部手法一样，都是从洞穴岩画开始引入故事。然而整个影片的矛盾冲突出现在文明人家庭与原始人家庭相遇的地方。

盖找到了明天，找到了失散多年的文明人家庭，而随之闯入的，是小伊代表的原始人家庭。两种社会，他们的生活方式完全不同，文明人表演着客气，而原始人粗鲁，直接，对于小伊一家来说，文明人的家园充满着新鲜，到处都是他们没有见过的文明设备，在这里他们体验了电梯，马桶，洗澡，窗户的美景，但是小伊的父亲不理解为什么这里的人要一人一个房间分开睡。而在背后文明人一家依然彰显着他们高高在上的姿态。

当这样的冲突毁灭了小伊与盖的爱情后，当两个社会的父亲，母亲出现冲突时，他们两大家族的男人和盖都被猴子部落抓走了，孤立无援的文明人母亲不得不打破自己的规矩，追随勇敢的原始人家庭踏上拯救男人的旅途，过程中，两个社会的人物开始出现救赎，直到他们打破规矩团结在一起去拯救他们的“家人”。 
如果说第一部的视觉风格偏向原始，那么第二部则非常梦幻。另外影片里面的各种动物造型，都非常反套路的结合，个人觉得印象深刻的就是那头蜘蛛狼。影片最后，家族中的所有女性英雄拯救了男性，而不是男性拯救女性，这样的反套路还是比较惊喜的。",8.0,4.0,0
