,Unnamed: 0,电影id,电影名称,用户id,用户名,评分,评论日期,评论内容,有用数,没用数,回应数
6,6,24298954,疯狂原始人2,75b7f5a5363d06425fc25873c51d16ad,49de27d55e1af1a5d741802494bd0fc3,4.0,2020-12-05 22:14:39,《疯狂的原始人2》真是教科书级别的阖家欢电影，它把不同年龄层的审美进行了平面化的分层，再融合到一起，从而达到老少咸宜的效果。真的展示了剧本行业的工业实力，值得国内学习借鉴。 阖家欢难就难在跨年龄层的众口难调。低龄化剧情小孩看得高兴，大人如坐针毡，比如《熊出没》；而成人化的剧情又往往吓哭小孩子，就像《西游降魔篇》、《美人鱼》。 《疯狂的原始人2》明显有多重的审美层次： 给小孩子：猫和老鼠式的滑稽表演，萌物，惊艳的场景（比如蝴蝶拟态的森林）给青少年：酷儿文化与中二病，Daddy issue （过度被保护/美国式城乡文化冲突）给青壮年：Meme 大爆炸，拼命地玩梗给中老年：复古审美（八十年代风）+ 男女矛盾（恋爱、夫妻） + 儿童烦恼给严肃的影评人：多元文化包容 + girls power 而妙就妙在它把一部电影不同的领域分配给不同的审美： 文本风格：偏儿童，滑稽表演为主人物设定：给青少年，以酷儿文化为主戏剧冲突：青少年的叛逆，中年人的焦虑剧情线索：给中老年，从高墙出现开始，剧情的线索就无限向《金刚》靠近主题升华：给影评人，女权+移民+多元文化包容 导致各种审美没有直接的冲突，实现了高度的融合，才让观众特别满意。每个年龄层的人都不必 get 到其他层的快乐，只需要 get 到自己的亮点就足够满意了。 举两个典型例子： 一、两家女儿骑剑齿虎出墙探险一幕： 给小孩：儿童奇幻，比如蝴蝶拟态的树林，在猫来时一片片飞走给青少年：女孩式友情，对酷儿文化的推崇（看到每一个伤疤都哇哦）给中年：充分表现了中年人酷爱好车的激动，实现了野兽对跑车的反向比喻（通常把跑车比喻成野兽）给严肃的影评人：城市文化和乡村文化碰撞哦，自由和主体意识萌芽哦！ 二、雷霆狂花 给小孩：不明觉厉的夸张表演给青少年：酷得不要不要的给中老年：复古的配乐、出场介绍、朋克风、暴走族、废土风给严肃的影评人：女权！就问你怕不怕 电影的这个女权主题，这几年已经成了好莱坞的显学了。《超人总动员2》、《无敌破坏王2》、《疯狂动物城》、《惊奇队长》、《神奇女侠》、《冰雪奇缘2》……都有充满自信、独立的女性主角拯救男人或打败男人的反传统桥段。 作为左青我对此当然是非常支持的，毕竟 The Teacher 就讲过《妇女能顶半边天》嘛，中国男人尤其是工业区的男人，早就习惯“怕老婆”的文化了，这叫尊敬懂吗？ 当然我最喜欢的还是电影里层出不穷的玩梗。贯穿始终的是金刚梗，从穴居人家庭看到高墙的那一幕起，我满脑子就是即将出现的“金刚”了。 当然最爆笑的是那段猴子梗，原来铁拳猴不仅是铁拳猴，还有铁头猴（脑子里响起了“少林功夫好”），铁尾巴猴，铁布衫猴，最搞笑的是还有一闪而过的铁蛋猴（疯狂打另一只猴的蛋蛋，但屏幕只给了双腿，估计这个梗是不会污染小朋友的），真是太污了。 最污的当然是 Banana 兄弟梗了，我当场就想刷个 “你不对劲”的表情包       我笑的最大声的还是那些影迷梗了，最经典的当然是致敬指环王的梗，“趾”环王——这里就不剧透了。    导演玩梗玩上瘾，最后还让鸟撞到了第四堵墙。 这些梗，小孩和老人恐怕不能 Get 到，但丝毫不影响他们的快乐。因为《疯狂的原始人2》审美和喜剧元素是分层表达，同步推进的。 这种创作方法非常值得国内的动画从业者借鉴。给我最大的启发是，电影可以跨年龄，但某一个层面上的审美和逻辑要始终保持一致，也要符合该层次主要观众的预期。 难怪国产动画时时深陷众口难调的困境。动画电影很容易成为跨年龄层的作品，每个年龄层都按自己的审美提出要求。以我中年人的心态来看，《姜子牙》主题挺成人化的，但戏剧冲突很幼稚。《哪吒：魔童降世》角色始终巨婴心态，缺乏成长。《大鱼海棠》则纯属不带脑子的中二病。 剧中出场的角色明明上有老下有小，但都按小孩子的逻辑行事……可电影又不甘愿低龄化，硬要把小孩思维套用到宏大逻辑中，自然让主题或戏剧冲突崩得不成样子。 最让人反感的是前半部分强行荒诞搞笑，后半部分强行死角色煽情，到最后强行崇高升华主题。逻辑跟过山车似的。好电影是不同线索的切换，坏电影是同一线索的断裂拼接。 我觉得他们从剧本工业的角度，都应该好好学学《疯狂原始人2》。角色言行举止可以幼稚一点，人设可以中二一点，但戏剧冲突要符合当代人的生活，剧情逻辑要符合成年人的审美，而故事主题要符合主流价值观。这样才能换来口碑，也恰恰是市场需要的。,39.0,4.0,1
7,7,24298954,疯狂原始人2,30acb2c486399150c653c82ea083b7bd,cb2eb8d656907edc90ecbee13ab009cf,3.0,2020-11-29 13:49:41,"平庸的续作。打分全在技术和开头那一小节上。
 出来之后看到评分颇高，又陷入“我这次是不是又偏离大众口味”的迷惑里。
 本片一直让我有强烈的违和感，下来之后想了想这种奇怪的感触由何而来，到吃饭时突然明白了：
 来自于制作方做的其实是一个美国社区故事。
 一对典型的美国中产阶级家庭，某一天突然遇到一个蓝领工人家庭，带着他们好友遗孤小孩来投奔。
 对方粗鲁无礼但正直，心思多爱讲究的中产家庭想让好友遗孤和自己家娇生惯养的女儿配一对，遗孤喜欢的却是工人家的女孩。年龄定位大概是高中生，恋爱的苦恼重点在于“没有隐私”。接着遇到了绑匪，中产家庭和工人家庭齐心协力化解危机，再穿插一些“当爸爸的都有不容易和不足的地方”之类互灌鸡汤，然后大家一起快乐的生活。
 这样一个以明显的美国式常见的社区矛盾为基调，生活习惯冲突为主线展开的剧情线，套上任何一个常见美剧人物设定都能炖出一个换汤不换药的相同故事。除了细节还能体现一点原作年代背景设定外，换成现代背景完全没问题。
 顺便说一句，本片的高中生主角的恋爱脑情节频出，并不是子供向。我那一排旁边的小孩看睡着了。
 失望。",16.0,2.0,1
8,8,24298954,疯狂原始人2,7544f4ea0fba121b9e03e1f285c02ecd,0d7613b73fa6694b9f0d6847022643de,,2020-12-05 20:40:12,我不明白为什么人家能够持续不断地写出这么这么多好的故事，从魔戒哈利波特，到疯狂动物城冰雪奇缘到飞屋环游到寻梦环游记到玩具总动员到… 我们的动画片，除了孙悟空唐三藏，到哪吒二郎神，还有别的什么吗？大闹天宫三百年，哪吒闹海千百遍，当然你可以说你找到了不同的角度，可是我真的不知道我们还要再看多久孙悟空和哪吒的故事，我们真的没有办法再塑造出另外一个可以横行三百年的动画形象吗？ 我发誓绝不再看任何孙悟空和哪吒的故事，管你是周星驰还是谁，绝不再看——以示一个普通电影观众对影视创作者以及动画行业的抗议，直到你们创作出新的人物和故事为止。,47.0,5.0,35
9,9,24298954,疯狂原始人2,ad9471f7c3c489d538516dc9b6443f73,9ad35680aeb6815493f68463f3d5c5b8,1.0,2021-01-06 07:37:38,其实这个影评的标题按照时下流行的轻小说漫改的起法应该叫“当一个世界上只剩下政治正确的蠢货，不开主角光环可以活几帧”。。。。。。 这是一个令人气滞神沮的冬天，天气阴晴不定，雨雪交加，风号云卷，又冷又湿，英格兰进入了第三轮lockdown，单日确诊人数突破六万人，再冲新高，究其原因，无外乎是圣诞节而已，一群自我感觉良好不知道吃几碗干饭的蠢货又得了机会聚众party，给已经不堪重负的NHS和救护车系统压上了最后一捆草垛。在这样的日子里看这个片子格外有趣，仿佛能嗅到这个操蛋的世界是怎么样一步步走到今天这个德性的。这篇影评会有点儿意识流，霰弹攻击，想起什么说什么，而且大概会伤害很多人的感情，建议您看到这里就可以切换频道了，否则后果自负。。。。。。 ++++++++++++++++++++++免责的分割线+++++++++++++++++++++++++++++++++++++++++++++ 这个片子一看主演尼古拉斯凯奇我当时就呵呵了，豆瓣8.1根本说明不了什么，尼古拉斯凯奇这几年可是烂片的航标，靠谱得催人泪下，事实完全证明了我的判断。这片子定性的讲应该怎么说呢？我还没这么评价过哪部电影——非常的cheap，这个cheap是我实在想不好在中文里应该怎么对应，好像哪个近义词都不能完整的表达贴切的含义，如果你不太明白的话，你可以试着听一下Martin Jensen的solo dance或者tones and I 的 dance monkey，大概就能找到感觉了。。。。。。当然，cheap不代表不流行不受欢迎，前面说的那俩歌都很受欢迎，但别以为这样就可以打我的脸，我瞧不起人是从来不需要什么人证物证的。 整部电影的逻辑崩得一塌糊涂，以各种强凹出来的矛盾开始，以完全无法推敲不禁琢磨的解决方案告终，但有趣的是细节满点，而且隔三岔五就振臂干嚎出一句口号，看到中途一度让我精神恍惚觉得梦工厂一定是跟拍《姜子牙》的团队共享了一套编剧班子。我能看出这个班子的野心很大，在这部戏里想探讨家庭问题、多元文化包容性问题、科技和环境的冲突问题、不同种族的和谐共处问题、甚至女权问题等等等等，可惜的是这个班子忽略了一个最基本的社会常识——你在试图忽悠别人吃屎之前自己首先需要有吃屎的觉悟，这是作为一个东北二人转演员最最基本的自我修养，而此剧的编剧显然没有真正下定亲自吃屎的决心，所以编到中途自己都忘了自己想要说的是什么，于是出现了原始人开头疯狂唾弃卫生习惯而最终还是忘记了初心加入消费自然资源污染环境的一侧，而原本属于猴子们的水源和香蕉也并没有被物归原主，然而大家居然都好像不记得曾经发生过什么一样，其乐融融的大被同眠happily ever after了。可你以为观众都一样的记性不好吗？太天真了。 整部片子最让我恶心的一幕出现在狼头蜘蛛一段，首先这个设置非常吊诡，从眼睛和身体看这个物种还是属于节肢动物蛛形纲，而且会吐丝，这玩意儿应该是不耐严寒的，然而却出现在冰洞里，从行为模式看竟然是类哈士奇的可驯化犬科哺乳动物，在和人沟通方面的容易程度居然远胜了最后可以和人类共通语言的猴子。。。。。。我简直已经无力吐槽了，只能借用当年给赵伟洲捧哏的王世勇的一句台词儿——你自己慢慢编吧。。。。。。。而且你们一看见狼头蜘蛛就知道是可以通过善待幼仔取得信任的？凭什么最后的巨大猩猩就必须是反派？你能不能给我起码一个理由？算了，片子里不合逻辑的地方罄竹难书，我问这种问题已经纯属矫情。。。。。。以我之见这个片子最后能拍到结尾没有别的，靠的就是主角光环，如果没有主角光环，这部片子就可以改名叫做《死在史前的一百万种方法》了。 不知道从什么时候开始，观众变得格外的容易收买，好像几个毫无逻辑的定格动画一段BGM就可以让人热泪盈眶热血沸腾的打出高分，这么一部破绽百出槽点满格的动画也能在imdb上拿下7分在豆瓣得到8.1，我想这种现象只能说明全球化大环境下不同地区的人类在好忽悠程度上其实并差不多，这种现实还挺让我沮丧的，我一直都对以道德代替理性的倾向抱有深刻的怀疑和警惕，这并不是被我前妻常年站在道德制高点上乱枪扫射的结果，而是天性使然。我总觉得，道德从来不是亘古不变的，而是左右摇摆不断的去迎合同时代的大多数人，这种可疑的东西绝不可能是推动世界前进的力量，而理性才是贯穿人类文明史的一道光。。。所以当年逃课看《乱世佳人》的时候，我的一个女同学评价说梅兰妮阿什利是个伪人，虽然冒众人之大不韪，我却深为击节；还是同一个人，在看《勇敢的心》的时候在梅尔吉布森最后被酷刑致死的时刻喊出freedom的时候发出哧的一声不屑轻笑，我也深表赞同，觉得太过刻意，用力过猛了。我并不是说要做一个什么事都和别人对着干的杠头才算好，可我觉得有些事，需要有些不同的见解和不同的声音。。。。。。这几天，豆瓣上很多友邻在说党同伐异人身攻击的话题，这个网站崩坏得如此不堪也是挺让人沮丧的一件事。不隐晦的说，我这个人虽然啥都不是，却是有精英情结的，我总觉得，信大多数人是特别不靠谱的一个事儿，这个世界上明白人并不是什么多数派，不信你拿自己的生活经历扪心自问一下，这一辈子里遇到的是明白人多还是混蛋多？所以这个世界归根到底是需要精英去引领的，而现在的操蛋现状只能说是因为精英阶层失去了进取心，在前互联网时代，人类的文明一直是一种扩张的姿态，不论是向宏观世界还是向微观世界的扩张，总是在把空间做大，所以我们小时候幻想的未来是乘坐太空穿梭机殖民宇宙，而互联网的普及使精英们看到了不殖民宇宙也能收割韭菜的更容易的赚钱途径，于是眼睛向内开始细分市场，搜刮尽每一个角落，这就是你们最近总提的内卷，于是到了2020年除了埃隆马斯克作秀式的往天上射了一发特斯拉之外大家都在低头玩手机 。。。。。。我想说什么来着？哦对了，我想说的是这大概就是这部疯狂原始人2里编剧拼了命想要讨好处于劣势的文化群体大撒狗血乡愿满满的原因吧，因为毕竟他们才是大多数，虽然见识浅脑筋不灵光，却胜在道德丰盈而泪腺发达易于自我感动，钱也因此而更好赚，何乐而不为呢。。。。。。您有被冒犯到吗？希望没有。。。。。。,14.0,6.0,21
10,10,24298954,疯狂原始人2,9f027acbf6f193fbb8ee5d5a83282015,272df0de4f925774fc1685700ca25ee9,1.0,2020-12-13 19:12:02,我是看到豆瓣评分8.2才去电影院看的，坐下来看5分钟，发现自己被骗了。 我曾三度拿起手机想看看时间，是不是快结束了；我曾五次要站起来，觉得中途离场会不会是个明智的决定。最后，是豆瓣评分稳住了我。8.2的高分，这部电影一定有可取之处，也许就是下一个10分钟，整个故事将焕然一新。 我抱着这样的期待，希望耐心看下去会有惊喜。一直等到影院内壁的灯已经亮起，故事结束了。 也不能说它没有优点，起码不长啊，折磨观众的时间也就95分钟，感谢导演慈悲。 1.先先说文明人的生活场景 首先整个生活设施都是复刻我们，也就是三次元人类的城市生活。 电梯。请问电梯的动力是什么？当然，我知道有些升降是通过「一个人下去，一个人上来」的重力势能交换实现的，那，如果他们想全部人都上去，是怎么办到的？ WINDOW。指的就是我们的个人电脑window，广义上是所有的智能设备，比如电脑，手机等等。但是很刻意。为什么刻意？因为这个情节在故事里面是不可能讲得通的。一个野小孩，他痴迷于在自家的窗口看窗外的二亩三分地。我们现代人玩手机，玩电脑，看视频，不是关注我们身边的事，是关注新鲜有趣的事，是想看到广阔世界的奇文奇景。你看，这两件事就对应不起来了。如果这个情节在故事里面讲不通，这种讽刺意味就只剩下刻意，拙劣。 农作物。说实话，你就三个人，没有现代化设备，居然经营这么大一个农场，不累吗？生产这么多农作物的意义是什么？除了香蕉之外，其他作物种这么多的意义是什么？现代的美国农场主经营大农场，因为产品可以拿去卖给别人。你这里没有别人，种这么多没有意义。不……我知道了，虽然不合理，但是好看啊！导演觉得这漫山遍野的五彩缤纷，多好看！确实，从这个角度考虑，导演你赢了。 2.故事的驱动力 我看了五分钟，没发现推动故事发展的力量在哪里，看了十分钟，心下暗暗嘀咕：不会吧，该不会是想拍「女儿要谈恋爱老爸阻挠一番经历后老爸认识到女儿是独立的个体于是决定let her go」。这个套路我熟悉，好像是哪一部死掉的热门IP用过，对，《冰川时代5》，坟头草两米高了。 拍家庭矛盾的套路，不是说不行。《星际穿越》也是讲家庭矛盾啊，但是人家有一个非常好的故事壳子。地球不行了，人类需要移民外星寻找出路，主角坐飞船去太空，找到了拯救人类世界的方法，同时达成了与家人的谅解。对主角来说，跟家人达成谅解也许更重要。但是诺兰知道，观众其实更想看到一个拯救地球的科幻故事，所以他就将重心放在科幻上面，家庭矛盾只是次要的剧情。用科幻的语言，重新阐释「爱」是什么，这不成经典了吗？ 回到疯狂原始人，我们来数数这些人都在干些什么： 40%的篇幅发生在文明人家庭；40%的篇幅发生在三男被掳走后，与猴子的互动，女士们在路上的冒险；10%的篇幅解决大BOSS。这帮人，遇上的惟一一个称得上有危险的东西，就是最后的大BOSS，从出场到退场只有10%的戏份。还有10%用在角色旁白上。 这他马哪是电影，这分明是肥皂剧。 没有危险，没有迫切需要解决的麻烦，整个故事就显得很松散，不能吸引人，没有驱动力，让人昏昏欲睡。 3.作为一部喜剧片，居然不好笑 很多笑点都差那么一点意思，我看了确实觉得有些幽默的成分在里面，就是差那么点儿，没能让我笑出来。也不是我笑点高，全场的观众，除了两三个小学生，其他人看的时候挺沉默的。逗小学生笑不需要幽默，小学生嘛，他们看到一只猪撞到树上都觉得好笑。喜剧片不能让观众笑，没得洗，绝对是原罪。 4.故事的恶俗合家欢结局 富兰克林说：鱼放三日臭，客住三日嫌。 电影里面，格鲁一家住了几天后，主人开始暗示客人：你们该动身离开了。 这个剧情不错，很合理。本来两家人的生活方式就是天差地别，你看格鲁有门不走，老是撞毁墙壁，一点素质都没有，就知道了。 OK，最后大家和解了，居然一起住了。女主人，你确定能忍受他们？ 行吧，我勉强认可格鲁一家也住进来。但是那些猴子是怎么回事？它们何德何能，也跑来你们家里住呢？是凭它们将你们的亲人当作祭品送给大BOSS，还是凭它们在你们打BOSS时袖手旁观？ 这些生物，又多且闹，语言还不通，你想象一下，猴子们与女孩交谈的场面？猴子一边说话一边揍她们的脸？我的天。 电影结束了，我相信很少人会注意到这三伙人，生活观念、生活方式的巨大差异，就为了有一个happy ending，外来者住进了文明人漂亮的家。 文明人本来希望男孩娶自己的女儿，结果没成；退而求其次，文明人希望两家女儿交朋友，不再寂寞——但是，故事的结局，男孩和格鲁的女儿一起走了啊！你们还让他们住进来，你们图什么？这种毫不利己专门利人的精神，是什么精神？是共产精神。  5.关于让猴子们住进来的一个可能原因之反驳 我知道会有人想为猴子辩护：文明人你抢了我的水资源，欠我们，就该让我们住进你的大房子。 首先，文明人在利用水资源的时候，不知道猴子的存在，所以是无心之失；其次，现在把原故说明白了，好办！这水资源我们文明人不会全占了，大家搁置争议、共同开发，这样很合理吧。你看，大家生活方式如此不同，连物种都不一样，交流全靠揍，何必凑在一起过活呢？ 若要说这些猴子对应现实中的XXX……打住，电影中的这种对应根本就不高明，我不认可，我就单说电影，好吗，我没有对现实中的XXX有什么不敬。现实中的白人确实欠XXX，就应该把大房子让出来给他们住；就如同电影中的文明人，不欠猴子，根本没必要让它们住进来。两者是同时成立的。  最后谴责那些给《疯狂原始人2》打五星的人，你有打5星的自由，我有谴责的自由。你有不认可我谴责你的自由的自由，我也有不认可你不认可我谴责你的自由的自由的自由……反正大家都很自由就是了。,42.0,22.0,44
11,11,24298954,疯狂原始人2,8e646e3ff83b2bb95055097c35c27b7d,31bd897b55bb708a7c7b69a2dad1ccb8,5.0,2020-11-29 11:26:51,剧透必然性85% ———————————————————— 第一部那时候带孩子看的津津有味 这一部按理说孩子更大一些 应该更欢乐一些 实际上没有 孩子们多数时候一脸懵逼 近些年的这类儿童电影 背负了太多硬核内容 《无敌破坏王》2对网络世界的反思 《冰雪奇缘》2梦幻式女性自我觉醒 到这一部原始人打破高墙寻找明天 现在的动画电影再不是简单美好的可爱故事 而是动画表现手法挣智电影 ———————————————- 没有高薔的地方就丛林法则 有高薔的地方暂且有个桃花源 但是这个桃花源是层层菠靴得来的 “文明人”“窗子”“香蕉”越琢磨越有味道 一针见血说出了当代的问题  但是也要像混豆瓣儿的所有人一样 有话不能直接说出口 要包装过才行 ———————————————————— 诚然 男人都是大猪蹄子 但是意识到这个问题之后 出现了更大的问题 《冰雪奇缘》让小女孩们都看到男孩子不可取 雷霆狂花又把傻老爷们儿拯救了一遍 两性问题渐渐南北战争化 一个踩死另一个无限循环 似乎不可以把性别去掉 大家都是普通人 回头这十年 zzzq下长大的一波男孩子  真的是无所适从的一撮男孩子  那个躲在山洞里逃避家庭的爸爸  太真实了！复杂的拧巴的表情呼之欲出 —————————————————————— 当然这部电影里还有很多的不确定性 甚至是很多站在对立面的观点 这也是我给这部电影高分的原因 我个人觉得 肯把“思考的权利”下放给观众的电影 才谈得上一部尊重观众的电影 这里没有不置可否 这里不但爽还值得思考 除了回家给孩子解释起来有点费劲 别的都值得一看！,17.0,5.0,3
