,Unnamed: 0,电影id,电影名称,用户id,用户名,评分,评论日期,评论内容,有用数,没用数,回应数
0,0,27124451,洞,00d64a1007b04d788385f60c60a36cbb,830acf96bb3a83d07d0b40dc1080e32c,4.0,2021-09-29 20:49:56,全程几乎无对白，影像文本留下的“可写”空间却很大。本身大银幕上看洞穴，就是平面上呈现的深度幻觉，村子里聚集看电视的人群和《洞》前的观众形成微妙的同构关系。        电视里播放着摩天大楼上每一层楼的企业层级关系，向更高处延伸探索，拔地而起“更高的楼”也是人类执念刷新的记录之一。电视外探险队则向着地表之下纵深行进，俯拍视角下在村镇小巷中蜿蜒流转的灯光在此转化为燃烧坠落的火种。         从洞里被撕下点燃的杂志页面，到洞外测绘家画的地图和漫画，不同媒介的能指在镜头下达成“游牧”和漂浮。开始从洞内向外看到的牛羊，面对被“降维”成漫画的洞穴，人类探索洞穴，而人的帐篷对于好奇的牛来说也是另一种“洞”。         人们在深渊里敲打、测量、试探，和人们对老人瞳孔的照射、对着嘴滴水等对照明显。这里看起来无情节的纪录片似乎可以扩展为一场体内旅行的科幻片，在灵薄界徘徊的神话，或是关于身体地形的情色片。最后洞穴走到尽头，生命走到尾声，测绘图画到闭合，影片画上句号。老人回荡在旷野中的呼喊声与片头相接为声音的回环。似乎最初的声音已经是Echo女神的回声，生命的影像也成为洞穴里的幻影和重影。,5.0,,0
1,1,27124451,洞,51358243b1f4f6bf5c87ea2d719697f6,d70e5373b66b76cebdda9659d7944ca4,5.0,2021-09-23 20:55:14,"大量固定鏡頭，少數仰視與俯視之間的搖鏡，如果説鏡頭是剋制的，那麼全片最驚人的調度是通過「光」本身實現的：探洞者頭燈和火把的晃動不斷塑造、改變著我們的視野，再加上洞內其它地方的絕對黑暗，「光」幾乎是在改變畫幅，從這裡躍到那裡，再漸漸縮小消失在深處。還有洞外的聚光探照燈突然如舞臺燈光照亮洞中的小艇，隨後一個對著洞口的鏡頭裡它如同洞內的日光。而洞外呢，弗蘭馬汀諾極力捕捉的則是白天流動的雲和陽光下草地上的雲影，還有夜晚村莊外牆上遊移的燈光以表現孩童的追逐遊戲。

我們看不到洞內的全貌，衹能看到被光照亮的部分。我們看到的所有物體何嘗不是反射到眼裡的光，而弗蘭馬汀諾把這樣一個簡單的事實，在絕對黑暗、衹能被探洞員的光有意識地照亮的洞裡具象化。

於是我們衹能在紙上重繪洞穴的形貌，而此時山谷的雲霧徹底遮住了日光的遊戲。於是我們意識到洞內洞外的光一直都是相應和的。

光影遊戲是空間性的，也是時間性的。而老人，這個在全片的遠景中景中唯一有大量特寫的人物，與其在他這裡尋找什麼隱喻，不如説他他逝去過程中的生命完成了影片的時間維度。

動物的叫聲，石頭、火把和足球墜入洞中的聲音，洞裡的水聲，沒有任何字幕的人聲，其它動物呼朋引伴的聲音和人類呼朋引伴的聲音…這是視聽媒介的「複調」，我們不再嘗試「聽懂」人們的對話，或者説，以另一種方式「聽懂」，以聆聽自然聲音的方式。

所謂人與自然的主題，因此不需要隱喻（或者説，隱喻的「生硬」是刻意為之的，以使我們意識到這種隱喻中影像的巨大權力），它們已然都在那裡了：無論是擁有了相等地位的萬物的聲音，還是那些人類留下的、洞裡洞外的紙 ，它們侵入自然，又被洞外的風吹起，洞內的火點燃而歸於自然。",1.0,,0
2,2,27124451,洞,e01722c3ef8c54b1e1a71ee624b699a0,3bba925038e334f3fe249eda296e8225,,2021-11-21 07:52:50,刚从电影院看完出来，很有意思的电影，尤其是和前天在同一块荧幕上看的“河流，奔跑者，倒映着”对比强烈。印象深刻的地方：1.讲的是探洞的故事，但前半段带到队伍在附近小镇做准备，描述了意大利的文化背景和历史环境 2.依旧是前半段，带到镇上村民在看纪录片，米兰摩天大楼的建设，与洞穴所在地南部文化形成对比，描述了意大利的南北冲突。最高的楼与最深的洞也扣上了 3.电影一开始就把老人的故事穿插剪辑，老人的牧歌和生活作为本片的statement，让人印象深刻。后来与探洞队的故事进行交叉，却又远离。4.背景音很棒，不知道是用的什么技术，有沉浸式的体验。5.画面美学和镜头语言就不说了，当然非常棒。总之，灵感来源于1962年的洞穴发掘，反映了意大利文化和历史环境，提到南北冲突，探索世界上最深的洞穴之一是一种本源的追溯，一种考古学，是对未来和未知的挑战。兼具哲学和诗学的思考。影片放映结束后，导演给我们看了拍摄花絮，怎么下到洞里面的，团队7个人准备了三年。有意思的是还遇到了论文导师，他刚做完手术，没赶上去做演讲的火车，就掉头来看电影了。,,,0
3,3,27124451,洞,4e6fc5b0f667c841c2ab6b4b0836dca2,79df5b1bfe7e185f13a4e0abc516af38,4.0,2021-10-04 16:13:16,"编译原文：https://www.internazionale.it/opinione/goffredo-fofi/2021/09/08/il-buco-frammartino 文章发表于公众号：SiDe映像    本届威尼斯电影节展映的《Il Buco》（中文译名《洞》），无疑是此次主竞赛单元最诗意且具有哲学性的电影。导演米开朗基罗·弗兰马汀诺（Michelangelo Frammartino）从一个深不见底的山洞（Bifurto）中找到了理想的隐喻。故事来源于1961年一队溶岩专家的真实探险经历，他们到达了当时被认为是地球上第三深的洞穴底部。电影全程无对白无配乐，以优美的镜头语言记录下两组时间的重叠：探险队的奇旅与牧羊人的日常。 它与雅克·贝克的同名杰作（1960年制作，与弗兰马汀诺影片中Bifurto山洞被勘探出来几乎同年）没有什么关系，前者讲述了一个注定要失败的越狱故事，因为囚犯们挖的 ""洞 “通往城市，仍在法律的管辖范围内。而弗兰马汀诺的“洞”则逃离城市，呈现 “一部边缘化的历史”，它回溯了60年前探险家们的壮举，召集一群新的、年轻的溶岩学家重温那次冒险，前往最初的地点，进入同一个洞穴，抵达同一个深度，力求呈现那段历史的张力。 开篇黑白片片段插入，将故事背景设定在6、70年代意大利的经济繁荣时期，人们投入到为实现国家城市工业化的努力中，片段是一个摩天大楼的建造插曲，这是一座大都市的巴别塔，弗兰马汀诺认为这是一项冷酷、非人道的事业，与他留在陆地上的、追求自然的愿望相悖。他说：”那是一个激进的、 垂直性的时代，意大利人不断向上看，用这种摩天大楼作为力量的象征，但是溶岩学家们却走向另一条路。”   他以《洞》反驳那种认为意大利50年前的金融繁荣惠及全国集体的看法；相反，他展示了意大利的农民群体如何一如既往地被边缘化。“在那个时候，我们开始忘记人们在第二次世界大战后经历的困难和资源的匮乏，”他说。“（全面的）经济繁荣只是一个传说，一个神话。然而，我们却一直希望它能在不久的某个时候出现。”这是非常荒谬的。   在《洞》中，溶岩专家在洞穴和其周围地区的大自然中徘徊，一位年迈的牧羊人和农场上的动物都则在一旁驻足观看。随着时间的推移，死亡悄悄地进入了这个故事，似乎是为了揭示这个孤立环境的脆弱性。弗兰马汀诺在这个项目中挑战如何处理好人类与他们无法完全理解的力量之间的关系。他说：”人类无论走到哪里都会带着自己的世界观，从已知到未知，”他说，”希望通过影像的记录来超越边界""。   随着空间的运动，与景观一起变化的还有时间。这是一部关于时间的电影，它试图找到其不同的形式和结构，并在时间中构建出情绪与感官之旅。溶岩专家的工作是向一个未知的边界下沉并逐渐描绘出洞穴的轮廓——代表了对人类存在的短暂性及其在面对影片背后的大自然时的脆弱性的微妙反思。挖掘洞穴的过程就是在寻找和挑战一个未知的，不可抗拒的极限，一个你甚至无法理清其轮廓的东西，隐喻着一个人的生命、一代人的时间或整个国家的历史。 弗兰马汀诺不拍电影，而是拍无形的沉浸感。2010年，他备受赞誉的 《Le Quattro Volte》（中文译名《四次》）通过人类、山羊和一棵冷杉树构建了灵魂逐步衰亡的过程，装载着深刻的精神内涵，仿佛事物都在缓慢而沉静地燃烧。《洞》是他沉寂十年后的首部作品，可以看出前作的影子，这位意大利导演构思了复杂的景象和声音模式，它们仿佛存在于一个自足的宇宙中，在这种情况下，观众可以完全沉浸其中。 导演在拍摄《四次》时就已经接触到Bifurto洞穴的故事，在他最初计划拍摄一部关于 ""树木崇拜 “的电影计划失败后，他带着一个根植于历史中但同时又具有现代性的构想返回了这个洞穴。但他并没有""改编“那段旅程，而是吸收了它的DNA，用一种近乎无言的、绘画般的视觉组合来追踪探险家们在洞穴深处的游走。当导演将这些镜头与对附近牧羊人的观察结合起来时，《洞》凝聚成一个奇妙的冥想，即对自然界不可知事物的好奇心。 “我们想探索边界之外的生活，探索日常看不到的东西，”弗兰马汀诺说，他与联合编剧Giovanna Giuliani花了很长时间在洞穴周围漫游，勾勒场景和视觉设计的雏形。”当你进入一个山洞时，便与未知的事物之间产生了一种关系。在谷歌街景已经到达世界每个角落时，唯一未知的地方就是洞穴""。 这种令人着迷的神秘概念是弗兰马汀诺作品的中心。他的电影需要观众有耐心，来为他们快节奏的生活提供一个灵魂休憩的场域。电影还被推荐在影院观看，不仅因为它是用杜比全景声混音，而且若要欣赏这部电影，你必须置身于完全黑暗的环境中，如同溶岩学家在洞穴里，观众也在黑暗的剧场里一样。“这部电影需要在正确的地方观看，”导演说。为了使电影得到更出色的视听效果，他非常严苛地训练音响师，并找到精通在黑暗场所拍摄的摄影师Renato Berta，以数字化方式串连出令人眼花缭乱的美丽画卷，呈现舞蹈着的火光和黑暗。 “我们花了相当长的时间来准备，”他说。他被溶岩专家和牧羊人之间的关系所吸引。“有必要了解我们所处的世界与它的人民，因为他们生活在一起，分享食物和信息”。 对于溶岩学家的历险导演还做了一个深刻的比喻，”溶岩学家总是经历挫折，但这并不丢人，有时你在一个洞穴里，转过一个角落，就会面临着一道墙壁——这意味着终止。” 这一比喻与电影中的一个关键时刻产生呼应：当一位牧羊人的生命走到尽头时，勘探队也触到了探索的尽头；另一呼应是一个足球突然从洞穴上方坠入黑色的虚空，这塑造了电影中为数不多的视觉冲击。在这部电影中，纯粹的非叙事景观与突然闪现的宇宙奇观偶尔交替呈现。  导演米开朗基罗·弗兰马汀诺 在拍摄过程中，团队还遭遇了洪水。但是“一切都在控制中，”导演通过Zoom接受采访时说，”我们本打算安静地等到洪水结束，但媒体要求播放实时救援。” 他认为电视记者夸大了救援过程，渲染了一场不存在的戏剧，这与他在洞穴下构建的沉浸式电影体验形成了讽刺的对比。他说：“在山洞外，媒体们完全虚构了一个故事，它背离了我们讲述的故事中那份日常和平静感。” 随着《洞》拍摄的结束，弗兰马汀诺还未确定他的下一个项目上是否还会花费十年时间。他说：“对我来说，确信一个新项目是相当困难的。”在完成主要制作的两年里，他没有回到过山洞，但这次探险仍然常常牵萦着他的记忆。“你可以在下面体验到许多不寻常的东西，”他说，""我还会再去的。"" 据悉，此次《洞》项目的资助者为Calabria电影委员会到、意大利文化部、Cinereach和Arte France，威尼斯电影节首映后，它将前往纽约电影节展映，目前正在寻求美国发行。",2.0,,0
4,4,27124451,洞,5e61465fa07f379730e39ac7f575d69f,31b5f1d49f55acb4ee7624813bda6b2c,,2021-09-23 21:15:48,"看完《洞》这部电影以后，非常想写一下自己的感想，因为这是我看过的节奏最最最慢的电影。它给我感觉更像是纪录片，而且是多数时间都没有解说，我只负责盯着巨幕，观察、思考导演究竟想要说什么。

这部电影有几个特点，首先它没有太多剪辑技巧，像是把所有的视频素材按顺序放在一起，然后一键成片的感觉。故事也很简单，讲了两件事儿，一是1961年的一个探险队到一个村庄去探测一个洞穴的深度，另一个故事是这个村庄的一个老人的死去，电影用平行蒙太奇剪辑方法让这两件事儿看上去是在同步进行。我一直在疑惑，老人的离去和洞穴探险有何关联，为何放一起讲述？一批年轻人冒着生命危险测量这个洞穴有什么意义，只是为了知道它的深度？

整个观影过程无聊程度也是我观影多年来的首次体验，总想叹气。不过反转来了，等影片真正结束的时候，我反而想留下来，因为最后影片才有字幕介绍了这个故事灵感来源，像是导演有意一直憋着不说，让你猜，最后他告诉你谜底:这是历史上某次非常重要的探险，这个洞穴的深度排名世界第三。你知道了答案后，恍然大悟，进一步思索，于是不愿离去。到这里，我之前的疑惑似乎有了答案，但也只是我的答案，我想，或许电影是在说，生命来了，走了，像火苗跳动一下又熄灭一样平常，但有的人留下了一些成果被世人铭记，有的人没有。生命可以普通，也可以不普通。又或者是在说人生就像探险，过程充满未知，但总有抵达目的地的时刻，不必惧怕、担忧，勇敢向前走好了。最后我还是想知道，导演怎么想_(:зゝ∠)_",,,0
