,Unnamed: 0,电影id,电影名称,用户id,用户名,评分,评论日期,评论内容,有用数,没用数,回应数
0,0,33457594,摩加迪沙,5f04cfc4965091701d571f997f6d80d7,615c1b0bab0ba9af883be402c4822cc2,5.0,2021-10-14 18:51:09,"（首发于公众号：霧風誌，欢迎关注） 最新韩影《摩加迪沙》由柳昇完担任导演兼编剧（导演代表作《军舰岛》、《柏林》），金允石、赵寅成、许峻豪、具教煥主演。 讲述1990年代索马里内战爆发背景下，韩国与朝鲜外交官们为了生存而联手逃出摩加迪沙的故事。《摩加迪沙》耗资200亿韩元，全片于摩洛哥取景拍摄，在韩国已经突破300万观影人次，成为2021年韩国年度票房冠军，并收获了超高口碑。目前豆瓣8.4分。 说起近年的韩影年度代表作，2019年看《寄生虫》，2020年有《南山的部长们》，2021年应该要属《摩加迪沙》了。这部融合了战争、政治、动作的类型片，究竟厉害在哪儿？  真实历史事件改编    首先，豆瓣简介中一句话似乎有些混乱：“影片将基于一个从未出现在韩国外交历史上的真实故事改编。”
 容易使人误以为是韩国把自己凭空“套入”了本无关的真实历史中。有必要说明一下，避免误导。 实际上，索马里内战背景下朝韩联手逃生，是真的发生过。但因为某些原因，没有被记录在韩国外交史上。  电影中金允石扮演的韩国外交官韩信盛大使也确有其人，原型是姜信盛前大使。  姜信盛仍然记得1990年12月30日，叛军进占首都；91年1月，他与6名大使馆人员试图赴机场离开这个动荡的城市，遇见了朝鲜大使金勇洙（音译）以及13名职员和家属。结果机场也一片混乱，他们都无法离开。     朝鲜大使馆已遭到袭击，姜信盛提议一起去韩国大使馆等待。当晚他们对坐用餐的场景，大概就像电影里描绘的那样，尴尬而别扭。 不过姜信盛描述当时心境：“感觉像是一家人。我们试图克服我们的难处，像家庭般团结起来。那超越了意识形态、国家之分。” 后来，姜信盛向意大利大使求助，意大利大使同意送韩国人撤离，但不愿帮助没有邦交关系的朝鲜人，“我向他抗议，说我怎能抛下那些朝鲜人，要不一起走，要不一起留。”姜信盛这样说。     这里与电影中试图让朝鲜大使投靠韩国而产生肢体冲突的情节不同。姜信盛表示从未有过让对方归顺的提议。 改编真实事件的电影，一定会在保留原色的基础上润色，为了戏剧张力而增加冲突。我认为就影片本身来说，完成度已相当高，尤其体现在导演对复杂题材的掌控，角度的选取，以及尽量克制的观点表达。  异域中孤立，讽刺却悲悯
     从影片一开始便强调了“异域”与“孤立”强烈氛围感。国外取景、异域风配乐增强了可信度，将人物放进陌生、未知的环境中。 开头，赵寅成饰演的韩国参赞因为外交身份而迅速通关，免遭搜刮，其他人则被开箱、贵重物品被扣。 侧面反映了压迫、混乱、不公，矛盾一触即发的状态，为后面的爆发铺垫。而参赞孤立于这样环境中，他英文不好，看上去还有点“虚势”。 当战争爆发，冠冕堂皇的广播内容与混乱失序的暴力形成了鲜明讽刺。 镜头透过浓浓的烟雾记录了束手无策的平民被暴打的场景，广播声音放着：“家人像朋友一样，朋友像家人一样。”画面却放着男人被拖行留下的一道血痕、女人捧着一只鞋绝望痛哭······           而此时在大使馆内的参赞仍是孤立于战争的旁观者状态，他在高处亲眼目睹了暴行，镜头拉近，烟雾散开，他震惊的表情暗示着这一场危机从此刻开始，不再与他无关。        与韩国大使馆相熟的司机竟然是反叛者一员，他被打死时流下一滴泪的特写镜头，和高处的俯角镜头，是对战争中个体的悲悯。       导演特别把目光放在了不同境遇下的“孩子们”身上，反叛的孩子们拿着枪发出“突突突”的声音，玩游戏一般，而逃亡中的朝鲜孩子们率先配合地佯装中枪倒地，大人们先是愣在原地，才配合“游戏”，谁知下一秒反叛的孩子仰天疯狂开枪，然后满足地离开了。        年幼的孩子们还不懂得战争、死亡是什么，但他们懂得游戏的暴力，并拿起了真正的武器。最简单的游戏语言不分国籍即可相通，暴力也是。 被救援后，又拍路边拿枪的孩子们，和车内撤离的孩子们的处境对比，一窗之隔，却有截然不同的命运。        
 世上有时存在两种真相
    《摩加迪沙》野心很大，又讽刺又悲悯，既要拍索马里内战，又要拍朝韩关系，戏剧的张力就藏在这内战中的“内战”。自相残杀中的“自相残杀”，电影中浓缩成参赞两人之间的冲突。 赵寅成与具教煥分别饰演两方参赞，一开始是水火不容、因为归顺问题而大打出手。 最后朝鲜参赞在车内没能出来，导演偏偏让韩国参赞去开车门，发现了他已经中枪身亡的事实后，长长地叹了一口气。           即使中了枪还是到达后才死，眼睛都没能好好闭上的这段情节，导演并没有故意去煽情，只是在天还没亮的时候，大家一起为死者举行了葬礼，这也是全片最唯美的一个画面。是对死亡的悲悯。     有些事情是不会改变的，死亡与日出都是。 看完仍然记得那句台词：“有时，存在两种真相”，其实全片都是对这句台词的论证与省思。 反叛者眼中的真相跟军队眼中的真相一定是不同的，朝韩两方的真相也不同。世界上任何对立的两方眼中的真相可能都是截然不同的。只有暴力、死亡、以及大自然的真相永远相同。
 多亏了导演克制而冷峻的表达，这部电影里没有一个超人般的英雄人物，这点很难得。没有谁“开挂”拯救全部人，他们只是艰难地互助，因为惧怕死亡而多出了一丝逃生的勇气和蛮劲儿。 直到最后回归安全地带，才回归“现实”，两方在飞机上致谢、握手道别，下了飞机连看对方一眼都不能看，孩子们忍不住看的话，还要捂住他们的双眼。        而大人们是不需捂住双眼就能离别的人，即使对方是过命之交。这种“现实”还真是冷酷啊。    公众号：霧風誌",519.0,23.0,337
1,1,33457594,摩加迪沙,e9fe43a75b6c3517eab707539eb01e91,1ce8c1dfcdf125de2985fde0e076e222,4.0,2021-10-24 00:00:40,2个长期隔离、仇恨、互相攻击的前兄弟国家，在突然爆发的危机面前，被迫抱团求生，就像冬天里的刺猬，为了抱团取暖需要挤在一起，但又不能太近，这种题材本身就很吸引眼球。 话说，咱中国大使馆就这么被攻克了吗？？俺们的同志们呢？？   中国驻索马里使馆间断23年后复馆 前大使回忆撤离往事 2014-10-14 07:59:00 来源：中国广播网 　　央广网北京10月14日消息（记者王宗英）据中国之声《新闻纵横》报道，位于非洲大陆最东部的索马里，北临亚丁湾、东濒印度洋，长期以来总是和战乱和海盗联系在一起。但很少有人知道，索马里是第一个同中国建交的东非国家，1960年12月14号，中国与索马里建交。然而在30年后的1990年，索马里内战爆发，1991年1月，中国驻索马里大使馆、医疗队和工程技术人员被迫撤离。在随后的23年间，索马里饱受战乱洗礼。 　　在索马里过渡政府正式成立并逐步走上正轨之后，索马里首都摩加迪沙，呈现出方兴未艾的景象。今年10月12号，在被迫撤出23年后，中国驻索马里使馆于正式复馆，中国外交官们重新回到这里。从撤离到复馆，这其间经历了哪些不为人知的往事？此次复馆对中国和索马里意味着什么？ 　　复馆仪式在摩加迪沙半岛皇宫酒店五层大厅举行，欢快的中国民乐，精致的中国结、大红灯笼，让这里洋溢着浓郁的中国氛围。当地时间10月12日12时30分，在激昂雄壮的《义勇军进行曲》中，中国外交部副部长张明和索马里总统马哈茂德共同为新馆揭牌。索马里总理办公室官员古诺表示，复馆是中索政府和人民共同期待的结果： 　　古诺：中国需要我们，我们也需要中国，我们需要中国对政治方面跟中国配合，我们需要中国的技术来到索马里，所以我们两个国家最重要的是一定要开这个大使馆，我认为最好的一个好事。 　　索马里虽然相距中国遥远，但是频繁报道的“索马里内战”、“索马里海盗”让这里具有了较高的出镜率，人们对这里也许并不陌生。而23年前的撤离，也正是因为突然爆发的当地内战。 　　上世纪90年代初，索马里内战爆发，反政府武装加紧进攻摩加迪沙，市内一片混乱，地处摩加迪沙市中心、紧挨着总统府的中国大使馆竟然也成了前线。过去23年，时任驻索马里大使徐英杰依然清楚的记得当时除了子弹不断飞进使馆，竟然还有一枚炮弹在经参处爆炸： 　　徐英杰：我去那时候物价是很高的，那时候我们使馆出去买菜用麻袋背着钱走去买菜，钱很不值钱。战争是在外围打开的，它越打越近，后来反政府军队就打进城来了，我们使馆北面是朝着总统府的。一天到晚机枪、重机枪在扫，扫的时候我们使馆有时候子弹穿到里面来，后来我们把面向总统府的那一面堆了些沙袋，然后把人撤到后面的房间去。经参处还落了一个炮弹，亏得没伤到人。 　　停电、停水，使馆的两个餐厅皆被炮弹炸烂。除了不断从头顶飞过的子弹和炮弹，更为可怕的是，不断有散兵游勇进入使馆抢劫，抢走了使馆的好几辆小汽车。徐英杰大使说，当时中方人员撤离刻不容缓。 　　徐英杰：那些散兵游勇冲进使馆里面就抢，我们院子里放了不少小汽车，他把小汽车都给开走了，如果冲进楼里面，那后果就不堪设想了。抢的最多的就是美国使馆，它那的东西多，好多都在里面抢劫，最后我们得到这个情况就商量商量，还是把人员撤出来。 　　撤离也并不容易，使馆的同志们先是撤到摩加迪沙南部的中国农场，又从那里转到港口，登上赶来救援的“永门”号轮船。几乎是船刚刚开走，港口就被反政府军控制： 　　徐英杰：人想撤出来也不好撤，后来在南边农场的同志开一辆车把他们接出来的。接到农场以后我们的船把第一批同志送到肯尼亚以后，又回来在南边索马里城市把农场的同志接回来。那时候港口还没完全瘫痪，还是有人的。但是我们上船不久这个炮弹什么的就往这边打，我们走的时候摩加迪沙局势已经失控了。完全是无政府状态。 　　一转眼，惊心动魄的救援和撤离已经过去23年，如今随着索马里国内形势好转，近几年，包括英国、土耳其在内的多国陆续重启驻索马里使馆，美国、意大利、加拿大等国也在准备中。,140.0,7.0,121
2,2,33457594,摩加迪沙,d9c58ff6315923e7a8fa15025a3cad6d,4e88c704040b74576a4ac1b74e496968,5.0,2021-10-17 05:41:10,首先电影很多细节做的很好，汉城奥运会的旗帜，录像带，墙上的全斗焕（感谢指正：卢泰愚）照片都在说明那个时代的朝韩问题。 1988汉城奥运会元素还原的相当到位，当时的汉城奥运会对韩国历史意义重大，韩国迎来了意识形态和国家经济发展的大变革，迫切需要得到国际社会的认可，奥运会是一次展示自己的绝佳舞台。 有一个细节是朝鲜孩子走进韩国大使馆看到的汉城奥运会太极虎吉祥物，孩子的父母马上遮住孩子的眼睛。背后的原因是朝鲜强烈抵制过这次奥运会。 1988汉城奥运申办成功后，朝鲜突然向国际奥委会和韩国提出了一个意想不到的提议：朝鲜是否能与韩国共同主办1988年的奥运会，各自承担一半比赛项目？并且朝鲜政府在未获得国际奥委会同意的情况下就着手修建了若干体育场馆，包括修建世界最大的体育馆五一体育馆。 韩国建议朝鲜可以举办足球、乒乓球和射箭等体育赛事，但朝鲜想要完整的举行大型的赛事，想要举办几个完整的体育项目，而不是像国际奥委会所提议的那样在一项运动中举办几次比赛。眼见此事不成朝鲜甚至请求我国和苏联，要求抵制这一届奥运会。但最终我国和苏联都选择参加奥运会。国际奥委会也谢绝了朝鲜的共同举办提议。 气急败坏的朝鲜准备企图破坏1988年汉城奥运会的计划，韩国政府也把国家安全等级拉到最高。最后，朝鲜选择制造了大韩航空858航班空难，并遭到国际社会的一致谴责。而汉城奥运会则顺利举办，韩国也从一个不为人知的国家变成了一个众所周知的国家。 韩使馆人员在救治叛军时讨论到韩国也会把大学生当成赤色分子。1987-1988是韩国政治环境变革的时代，相关电影非常多，威权总统在运动中被迫下台，1988年被破下野让位，也标志着韩国真正从军政府独裁统治中解放出来，也预示着韩国将要到来的历史大变革，但在变革前，大家说话还是很小心的，例如台词中说到的在姜参赞面前说话要小心，因为姜参赞隶属于治安本部，其工作就是纠察出间谍和赤色分子，1987首尔治安本部在审理时就虐待弄死了首尔大学学生，此事件也是当时全斗焕下台的导火索。 一些后续故事，韩国在结束威权统治之后发生了巨大变革，包括结束了和台湾蒋家王朝的外交关系，与我国建交。和朝鲜一同加入了联合国，迎来了朝韩历史上第一次蜜月期。1991年，那一届是世界乒乓球锦标赛，朝鲜和韩国联合组队参与了比赛。而我们再一次看到朝鲜和韩国组队参加奥运会，是在2000年的悉尼，两个国家同时举着朝鲜半岛的大旗进入了开幕场…,95.0,6.0,23
