,Unnamed: 0,电影id,电影名称,用户id,用户名,评分,评论日期,评论内容,有用数,没用数,回应数
15,15,33457594,摩加迪沙,133ee538147df338484ab432f5f0d5d1,badaeef7a21530dac1dab63567089737,5.0,2021-10-27 00:12:20,电影有娱乐功能，有宣传功能，其实更有现实教育和启示功能。在今天这个接近娱乐至死的时代，本片这样涨姿势的好作品值得肯定。 韩国电影这些年发展的非常好，既借鉴好莱坞，又保留了自身的文化和特色，已经完全形成了自己的独特风格和表达。近二十年，韩国的真实历史改编类型片强势来袭，揭历史事件、揭黑幕、揭腐败，尺度之大、力度之猛，世界罕见。这些年水平又有提高，尺度开始减少火药味，但是思想越来越深刻，这是越来越成熟的体现。 本片根据1990年索马里内乱，韩国外交人员逃离摩加迪沙的真实历史改编。对于一次狼狈不堪的逃离，愣拍出几个忠诚祖国的孤胆英雄好像又太扯。导演用新视角，围绕敌对的南北韩外交官在困难面前联手合作来表现，比较成功。 对于一场地狱般的政变灾难的逃离，导演大胆尝试了幽默的方式去展现，观众既感受到了内战中军队和民众的狂暴和血腥，也明白了所谓高大上的国际外交其实就是国与国之间各种拉关系做交易的本质。 本片也顺便讲清了十年前名震世界的索马里海盗的起源；讲清了世界各国为何都对非洲情有独钟，原来那些小国手里有“选票”；也介绍了一个国家内乱不止的根源，索马里原巴里政权专制毒菜腐败，军阀艾迪德挑起民众反抗，巴里政权垮了，艾迪德上台后更残暴腐败，今天的索马里的日子就是当年民众争取来的。 摩加迪沙内乱这一段，影片拍的场面很大，也挺震撼。其实能让人强烈感觉到，地球真的需要世界警察，有些内政必须国际干预，否则世界会有无数索马里，会有无数打着为了国家和人民利益的军阀艾迪德，出现这种情况，其它国家也不可能置身事外，不受影响。,1.0,,1
16,16,33457594,摩加迪沙,3419ec27e5211046bd8d589b1c804abb,2b8e8f00b9b8cf763927d7203686fa3e,5.0,2021-10-17 21:09:59,这个电影再次触及了韩朝的敏感话题，上一部让我感动得直流泪的是特工，这部虽然没有泪水，但给人更压抑，让情绪得不到释放。要说韩朝的问题强度甚于我们的T海问题，毕竟几十年都是刺刀顶刺刀，所以在处理矛盾时，两国也是用尽了朝鲜族的智慧，几十年来让其他大国为他们买单，一个成功拥有了核武，一个成为世界经济强国。从这点可以看出鲜族人的团结和狡诈，而本片也深刻的表现了这点。    但让人敬重的是韩国文化和电影的开放程度，一部又一部接触敏感领域，正因为对现实和历史的尊重，无论是失败还是胜利，韩国电影都选择直面。我以前是不看韩剧的，因为10几年前韩剧的影响，感觉太娘，但后来看了一系列的韩国犯罪电影后，发现韩国电影发展得越来越快，早就冲出亚洲了。再看我们的电影，前几年模仿韩罪片的几部还不错的，如暴雪将至那一类的，因为溶入了真实的90年代背景。再看其他的电影，根本感觉不是在真实的社会，而是在爱丽丝仙境和一系列晚会小品里，因为你感觉不到普通中国人的生活。   这个电影说了国家分裂之痛，但给人希望，人性战胜了意识形态，虽然不知道未来如何，可美好的东西得保持住，不能丢掉，这可能是2个国家共鸣的部分。中国擅长拍摄正面的电影，如80年代也有一系列反应台港同胞的电影，虽然略显夸张，但现在看来，感情朴素而真挚，那是发自内心对同胞的热爱，只是表现得比较稚嫩。我看来，中韩两国对分裂之苦的这类电影题材，其内在是诚恳的，这就是美好的东西，这就是不同地区的共鸣，得永远保留。,23.0,4.0,61
17,17,33457594,摩加迪沙,246b271c13834fe90ddf2dfba9db91c9,ca8845430b33583cdbfc449062c9f124,5.0,2021-12-17 12:57:07,一直以来就特别喜欢韩国电影，也对朝鲜韩国兄弟阋墙的历史感兴趣，大概这种好奇源于《太极旗飘扬》、《高地战》等电影吧。我永远忘不了第一次观影后的那种震撼，震惊于他们对于人性矛盾的挖掘、对于残酷战争的反思、对于意识形态分歧背后民族情怀的执着，也可能最关键的是在韩朝问题上看到了我们自己国家的影子吧。       《摩加迪沙》 以90年代非洲索马里内战为背景，讲述了被孤立的韩朝大使馆工作人员在生死悠关的紧急时刻，共同携手逃离的故事。电影中暴力和混乱无序状态随处可见，当朝鲜大使迫于生存压力逃进韩国大使馆躲避抢夺杀戮的时候，朝鲜大使想的是反客为主，韩国参赞想的是编造对方投诚。接触过程中，原本猜疑隔阂的双方，竟也逐渐有了交心的可能，从韩国大使为朝鲜大使提供胰岛素，到朝鲜大使家属夹菜时为韩国大使家属按住粘连的菜叶，再到韩国大使在意大利大使馆借口朝鲜使馆人员“已经投诚”坚持共同逃离，朝鲜大使也同样在埃及大使馆中另外委托埃及大使转告韩国政府协助其外交人员，同源同宗的他们最后终于心无芥蒂地在救援飞机上并肩而坐并真诚道谢交流。然而片刻的和谐后难掩下飞机后分道扬镳的事实。影片中朝鲜小朋友有两次被捂住眼睛，一次是朝鲜小朋友逃进韩国大使馆看到汉城奥运会吉祥物，另一次就是结尾处韩国朝鲜大使及家人互相装作不认识，分别被两个国家的人接走，双方如同陌生人一般没有一丝眼神交流。如果没有意识形态的分歧以及历史遗留问题，本就是一个全身而退的大团圆结局，结尾处却那么遗憾和感伤。       真的不止一次被韩国南北题材的电影所打动，《特工》里韩朝两国工作人员手拿对方送的礼物隔人群相望，《摇摆狂潮》里战俘营中意识形态压迫和追逐自由梦想矛盾反衬的悲惨结局，《国际市场》中大历史变迁下小人物奋斗的心酸和寻找兴南撤退时离散妹妹的坚持……都会让人如同身临其境般去思考“本是同根生相煎何太急”的苦痛。可能这也就是电影本身最大的意义吧。       前阵子电影长津湖大火，引发热议，顺势看了《朝鲜战争》和《长津湖》纪录片，了解了朝鲜分裂的背景起因，抗美援朝的介入，期间对于战俘处理的拉锯谈判和战争影响及战后重建。尤其《长津湖》纪录片虽然是美国拍的，但是丝毫看不出美国退役士兵对于我们志愿军的轻蔑和侮辱，言谈中流露的反而都是对于中国志愿军英勇无畏的敬重和同为生命同在经历苦难的怜悯。当前全球疫情泛滥，亿万生命烟消云散，无数家庭支离破碎，真的希望世界和平，少些意识形态的政治对立，多些互谅互商的合作交流。,,,0
18,18,33457594,摩加迪沙,fd6685de84718f53c40ba467c8e04955,c46cd5df6dceb0014e95e7a1d6c07a22,3.0,2021-12-10 16:56:15,韩国人太喜欢先拍充满矛盾的个体，再让他们为了对抗更强的势力（经常直指统治者和资本家，偶尔是中国）走向合作了，不论在电影还是在剧里。对这样的模式早就感到腻烦，似乎他们从来只是做正确的抱怨和呼唤，我承认这已然比许多创作有价值，但我不相信最好的作品需要携带如此强的煽动性，且我找不到一个支点与身处不同国度的他们共情。刚刚看完《摩加迪沙》，我绝对不承认这是一部优秀的电影，但它让我开始理解韩国这种不自觉的创作习惯或许打根儿上就来源于对“统一”的向往，但他们的态度又是拧巴的，因为更强，所以不能直言。所以即便他们的类型片愈渐成熟，我们也很少看到那种属于好莱坞式的集结各路人马，协同完成任务的模式。他们似乎更愿意表达主角间某种心照不宣的关系，表达那种“就算我们有过节，但大敌当前，我们先合力解决更大的问题吧”。于是塑造互不理解的角色是他们的首要任务，然后便开始寻找他们的共同目标推动剧作，甚至最终一方要为另一方做出巨大牺牲。这同样也是属于东方的含蓄表达。此外，从历史的原因去看，我也理解了为什么他们的创作看起来总是在抱怨（我不认为这要完全归结于社会结构问题，相似社会环境的地区有很多，却只有韩国的这个特点明显），那就是南北韩的命运是被冷战中的大国关系所裹挟的，他们的分裂不似大陆与台湾是本国政党之间的博弈，他们的分裂随冷战起，却没有随冷战终。因此他们无法在这件事上自我反思，但又应该怪谁呢？这本就是无解的，因此他们的疑惑只好化成声嘶力竭的呐喊和抱怨，不自觉地将一种愤世嫉俗的煽动性极强的情绪贯穿在创作中，至今如此。,,,0
19,19,33457594,摩加迪沙,48ab5c07a3d1ce14d4cae94f46906827,cd3e5b64998d9bbcacdd2947a8f824ed,4.0,2021-12-09 10:13:07,本片导演的思路很有意思，政府军和叛军朝外交官们疯狂扫射，皆是以警告为主。意大利军队和索马里军警向叛军的扫射，也是以警告为主。 政府军和叛军的恐吓，明显是想绑票求财。 所以很多军迷不过瘾，才死了1个人。 因为本片的走向跟《战狼》《红海》《黑鹰》这种杀得黑叔叔尸横遍野，几百上千的完全不同，杀得不过瘾连巡航导弹都安排上了。 要知道政府军和叛军手里也是有RPG和坦克的，如果他们真想杀人，意大利大使馆也是守不住的。,,,0
20,20,33457594,摩加迪沙,ea0a5e757c55c7601304d20dc277a50f,48f75a24bcb4d03161c22565eb502333,5.0,2021-12-04 15:46:32,1969年，索马里军官巴雷少将发动军事政变，成为该国最高领导人。并用了七年时间巩固自己的执政基础。1976年，一切准备就绪以后，巴雷解散了临时的“最高革命委员会”，成立索马里革命社会主义党，并在随后的总统选举胜出。自此，索马里被巴雷统治了15年。 巴雷非常独裁，但对美国却是极度地“友好”（为了换取美国的军事和经济援助），他允许美国石油公司在索马里境内几乎所有地区进行石油开采和生产，美国石油企业因此获得了巨额利润。这种情况，引起了索马里民众的广泛不满。这也是为什么造成游行队伍一即触发便这么庞大的原因之一。 巴雷在1986年连任总统以后，一些像艾迪德一样的巴雷政权边缘人物觉得，如果不联合起来推翻巴雷，可能他会一直连任总统到死，那样的话，自己的苦日子不知道何时到头。于是成立了反动派，艾迪德是这些人中间军事履历最“耀眼”的，因此被推举为军事领袖。 1991年1月艾迪德领导的索马里联合大会党，通过政变推翻了巴雷政府的统治。推翻巴雷以后，艾迪德自认过渡政府的临时总统一职已成为囊中之物，不料半路杀出个程咬金，阿里在1991年1月28日被任命为为临时总统，艾迪德只是个联合大会主席。 因此，造成了艾迪德的极大不满。同年11月，索马里联合大会内部的支持暂时总统的一派与支持艾迪德主席一派之间又发生了内战。,3.0,,0
21,21,33457594,摩加迪沙,5a024462a69fc86a107d06b4db5221df,3bbc0c52624ceccc450a9e54e9807ec7,3.0,2021-12-06 00:24:52,总体还能看，尿点也少，节奏也比较紧凑。不过剧情还能看看，场面也还算真实，场景布置、剧情发展比较自然。      但是佩服韩国人真能吹——厚书本挡机枪子弹，真要像电影这么搞，这四车人要死光了。只能说导演对军事很外行，或者为了剧情不顾实际，片中还时不时黑北边一下，就是一部充满意识形态而又做作的电影，,,1.0,0
22,22,33457594,摩加迪沙,8e7a32d9f371cb640caf85cb09a5cf63,de2748f00c31bd7a8b6655edd8c13343,5.0,2021-12-05 15:08:16,作者：我的旁观者    公众号：生活可以在别处         2019年底，全球电影观众随着奉俊昊导演的韩国电影《寄生虫》获得奥斯卡最佳影片奖而聚焦于韩国电影时，我更被李沧东的同期宝藏电影《燃烧》所折服，两部电影其实都在表达阶层差异带来的矛盾和悲剧，《寄生虫》偏重于故事的构思，而《燃烧》则通过人物生存状态的差异为人物最后的悲剧宣泄做出惊悚但合理的铺陈。          而2021年真正触动到我的除了黑白历史片《兹山鱼谱》，便是这部动作片《摩加迪沙》了。无论是《兹山鱼谱》还是《摩加迪沙》，相对于《寄生虫》和《燃烧》充满张力的故事情节和矛盾冲突，这两部2021年备受青龙电影节肯定的电影，却都根据真实历史事件或人物改编，故事的调性平和、朴实，而《摩加迪沙》更是被定性为动作片。对于动作片并不感冒的我，某天闲来无事，碰巧找到这部有老戏骨金允石、长腿欧巴赵寅成主演的《摩加迪沙》，抱着大不了弃剧的心态，却没想到短短五分钟的开场，我已被彻底惊艳到，只因为那些看似信手拈来却让人感同身受的真实细节：          故事的地点是1991年非洲的索马里，彼时的韩国和北韩都没有加入联合国，为了争得索马里这个非洲神奇国度支持的一票，韩国和北韩使馆展开了势不两立的缠斗。          --金允石 ：开篇，金允石作为韩国驻索马里大使正在索马里国立大学组织开展宣传活动，马上要进入活动的最后一个环节：和与会代表拉着索韩友好的横幅拍照留念。金允石身着90年代记忆中的大翻领白色衬衣和当年流行的藏青色西装，夹带着非洲大地飞扬的尘土，年代感和地域感瞬间扑面而来，连负责拍照的使馆秘书那身妥妥的90年代商务“碎催”低配装扮（俺91年曾经几乎同款打扮出现在拉哈尔的街头，不堪回首，不堪回首）和紧锁眉头焦急看表的不安感，还有拍照时蹦出的那两句熟练但满是韩式泡菜味英文（当然，还有后面金大使尤其是赵欧巴那蹩脚的英文），让我顿时穿越，脑海中满是泛黄记忆杀。            --郑满植，印象中大多是硬汉或黑道大佬般的标配，这次扮演韩国驻索马里大使馆书记官。急匆匆赶到活动现场的他，忙着弯腰去取车后座上放置的标语横幅，一扭身西服被车门铰住， 瞬间那身劣质西服一分为二。那一刻，作为有过类似工作经历尤其曾经是在那个要啥没啥，但工作偏偏要求你要啥你就得变出啥的非洲大地上，我瞬间读懂了书记官那生无可恋绝望的特写眼神。那种裹着西服，貌似光鲜却时时刻刻紧张高压的工作场景，伴随着郑满植暗淡无光的眼神，我甚至能感受到那裹在西服里焦躁的汗味和着尘土的味道，在空气中弥漫，久久不息。             --下面一个该帅哥欧巴赵寅成扮演的商务参赞登场了，机场里一个洋妞的珍珠项链被海关人员没收打劫；下一位白人身着西装、手提公务旅行箱，显然是深谙此道的常客，颇有眼色地在护照里夹入了一张美钞；而赵欧巴则身着就是搁现今也毫不违和的米色西服，笔挺且一尘不染，时髦的太阳镜丝毫挡不住他享受外交豁免的傲娇。真是廖廖几笔，摩加迪沙海关边检的腐败生态、赵欧巴那初来乍到的得瑟劲，隔着屏幕呼之欲出。。。           至此，五分钟的开场，让五分钟前还心猿意马的我居然产生了灵魂共鸣。鉴别过“动作片”的标签，我开始自我脑补这部剧的走向：电影前辈金允石携赵欧巴于枪林弹雨中解救南北韩使馆人员逃离摩加迪沙的英雄故事。。枪战、特技、摆平各方势力、金允石大咖掌舵、赵欧巴长腿炫技，一场韩国版《战狼》闪亮登场（《摩加迪沙》与《战狼》的背景设定同款）。。。          但是，但是，后面近2个小时的故事充分证明了我那被深深套路的浅薄。          《摩加迪沙》显然有着更宏大的野心，但因这野心悄无声息地扎根于真实的土壤，无需更多直白的阐释（在这点上平心而论《兹山鱼谱》显得略有些着急，但在文化已日趋娱乐化的今天，它焦虑的直白仍是瑕不掩瑜的稀缺），在那片土地上无论是树木还是花草生机勃勃并最终在观影者心中开花结果，这算是比较高级的润物细细无声吧。         索马里内战即指索马里从1991年持续至今的武装冲突。在这块苦难的非洲土地上，各路武装、政治势力层出不穷，导致战乱延绵不断，混乱的局面演变成一场场人道主义灾难。《摩加迪沙》用近乎写实的手法，把韩国和北韩使馆人员置于摩加迪沙失序混乱的大背景下，他们为了联合国那张选票互相算计、勾心斗角甚至不择手段地贿赂拉拢政府官员，在他们为了各自国家利益，秉持着职业操守或惯性争斗正酣之际，索马里内战爆发了。影片将国家陷入多方政治、武装势力角斗的残酷现实一一呈现，军队成为权力较量的工具，百姓在各种疯狂、失真的宣传中失去思考和判断能力，麻木或盲从，甚至在杀戮中体验着正常人性无法理解的刺激和快乐。战争带来的野蛮失序残酷而真实地呈现在观影者面前，更加令人震撼和脊背发凉的是满目疮痍的人心。              关于双方如何被迫摒弃前嫌，联手合作，设法逃出摩加迪沙的过程我不在此一一剧透，不过还是抑制不住要表达下这部影片带给我的深度共鸣与思考：         1. 作为两个政治上长期嫌隙甚至对立国家的代表—大使馆工作人员，在事件冲突中本能地选择站队立场并付诸实施，如两位商务参赞（赵欧巴与具教焕）的对立、冲突、甚至互相设置有利于自己政治利益的小把戏、赵欧巴本有靠山支撑但仍被“发配”到索马里的心有不甘、金允石大使在韩国外交部的地位调侃（这么细枝末节的描述简直是外科手术刀般的精准、狠辣，谁不知道国家地位决定着大使在国内的级别。。。换成驻美国、俄罗斯大使，哪用得着像金大使这样在活动现场亲历亲为，各种狼狈），还有万年不变的大使馆与经商参处、大使与商务参赞那微妙敏感的关系。。。不用说，你懂得。         2. 开场赵欧巴从韩国带来赠送索马里总统及政府人员的礼品，关于礼品包装的抱怨和责任的相互推诿，还有北韩贿赂索马里总统府的情节，甚至利用当地势力互相使拌，部长从韩国打来电话的噪音搪塞。。。简直就是工作之日常，无需夸张润色。看来生活永远比戏剧精彩，来源于生活的真实更具有摄人心魄的魅力。         3. 赵欧巴策划大使与索马里总统国务秘书见面的情节，堪称经典，他们绞尽脑汁的策划方案，在国务秘书眼中一钱不值，他所关心的是他能从这个交易中得到多少立竿见影的利益。在这个腐败已深入骨髓的国家，国家利益、政治诉求都是一句口号而已，更别提民众的基本生存权利。本片对于索马里战乱之初的各种乱像以克制的讽刺传递出对生命无言的悲悯。                         被总统府国务秘书索要回扣时金大使那张错愕无语的脸         4. 冲出重围的那场戏，那几辆防弹车的造型注定了这是一群普通人死里逃生的纪实，这里没有英雄，只有因为孤立无援不得不抱团取火自我拯救的普通人。车身上贴着挂着的书籍此刻成为了抵挡子弹的“武器”， 这是一场多么悲凉的文明与野蛮的对抗，别无选择却又那么义无反顾。          5. 战争的血腥，透过政府军与反叛军的残酷杀戮、韩国使馆黑人司机因支持叛军导致其最终丧命、年幼的孩子手持机枪跃跃欲试、哄然大笑等场景而展现，不说荒诞，已是荒诞。这种血淋淋的真实反讽，我却感受到影片中想要传达的悲悯情怀，人类与野兽、理性与残暴似乎只有一步之遥，政治裹挟下理性只能让位于乌合之众的疯狂，并最终演变成自我戕害或互害的悲惨结局。         6. 北韩商务参赞之死以及他的葬礼成为本剧最为悲壮和悲悯时刻，赵欧巴打开车门的瞬间，是立场、意识形态完全对立的两个人在生命面前的和解。而他的葬礼在那个安静的晨曦，呈现出本片最美的画面，海岸线上初生的太阳，自由翱翔的海鸥，那是对生命和希望的致敬和礼赞。           7. 最后一幕是本片高光时刻，克制得没有高潮的结束，却突然让我泛起无以名状的情绪，金大使和北韩大使（许峻豪因为这个角色刚刚获得“青龙奖”最佳男配奖）同样面无表情的脸，却是共同经历过生死劫难后内心最波涛汹涌的表达：从此就是陌路，甚至我们从未相识，但此生一定会深深记得。。。           因为众所周知的原因，这个惊心动魄的真实事件从未在韩国和北韩的外交史上有过任何记载，也许真正的历史就是那些封存于亲历者心中的记忆，从未开启，却日久弥新。,1.0,,0
23,23,33457594,摩加迪沙,d6ed62f181b1e08cda397d5085af3d62,15e8226dcbd51a7f6a639497f67d6517,5.0,2021-12-04 23:39:10,外交际会、索马里内战、南北对峙、冷战铁幕、一层一层放大的国际政治背景下，那一个惊心动魄的非洲大地烈火熊熊。无因的、随机的、怪诞的暴乱行径推翻和平情境下的一切底层逻辑。撤销DJ20年，韩国电影已然起飞，势不可挡。 不满字数，为了鼓励有益的分享，一共要140个字，加油加油啊💪140个字,,,0
24,24,33457594,摩加迪沙,2c46bfadc4dee6d963438ebef90b4eae,4ccbe8f1459515c2310d2b2c8963fbdc,4.0,2021-12-04 10:50:31,韩国电影人从情有独钟的南北题材大金矿里，再次挖出一锹珍宝。这回，他们将朝韩两国恩怨放进非洲索马里叛乱的动荡局势中锻造，锤炼出一道超越生命的光芒！  真实事件的改编，让电影故事更具厚重感。朝韩两国大使馆工作人员，身不由己被卷入索马里国家内乱。面对无可逃避的死亡阴影，血脉相连的民族情谊终于战胜国家立场，化为一席人性的帷缦，遮住枪林弹雨，将两国使馆难民紧紧笼罩在一起，不分彼此，没有敌我！  然而，历尽艰险从摩加迪沙逃出生天的朝韩难民一下飞机，国家立场立刻显现，占据上风。 一路佑护他们的民族情谊完成使命，转眼消散，同生共死过后的两国人员快速分道扬镳，心中纵有千言万语，也只能通过匆匆一暼隔空诉说！  片尾的处理手法，让我想起几年前的另一部更加优秀的韩国电影《特工》。朝韩两国人员之间短短不到10米的距离，却仿佛隔着千山万水，时代的大潮于此间起伏翻卷，震荡人心....,,,0
25,25,33457594,摩加迪沙,e7ff3c7333690abf922621298c2d8559,032feda2923df5c7bc27c3ddfc66ebff,4.0,2021-12-01 13:40:57,韩国关于南北关系的电影总是能得高分，说明南北关系是韩国剧情类型的优秀题材。朝鲜半岛本是一家，却由于美国和苏联的插足导致不同意识形态在朝鲜半岛水火不容，可是意识形态的不同与人民何干？其实归根到底意识形态的不同，是政治的冲突、是领导集团之间的冲突，不是家人之间的仇恨，“本是同根生，相煎何太急”。很多韩国电影中北朝人都是红色信仰的激进分子，摩加迪沙中在收留朝鲜人时韩国女人说表示风险太大说“他们都经过特殊训练，徒手就能杀人”，当主角夫人说他们还带着孩子呢，这个女人却说“夫人没听说他们孩子也接受过训练啊”。这就是韩国多数人对北朝鲜的印象，但当灾难来临，所有人的信仰都会放下政治和隔阂，一致的变为求生。这也是摩加迪沙的主线剧情，我们联合逃生不代表加入你们，度过灾难回归正常我们依然是敌人，但也不妨碍一起逃生过程中我们也是生死相依的队友。这也正好说明，人生在世，除了生死其余都是小事，所以无论如何都要好好活着。,1.0,,0
