,Unnamed: 0,电影id,电影名称,用户id,用户名,评分,评论日期,评论内容,有用数,没用数,回应数
7,7,34439631,蓝调天后,5514cff647b04f12d07d96583bfaaa01,8eac26b849185ed59d1b2b74fbe80e91,5.0,2021-07-03 12:39:10,"森森大军影评人 讲师 编剧 回答影迷提出的以下问题 1 片名如何解读？到底“black bottom ”在哪里？白人的屁屁又在哪里？ 2 剧情与主题思想的关系！本片因何获得服装设计奖？ 3 大量镜头语言解读 奥斯卡最佳服装设计奖 第78届金球奖 电影类 剧情片最佳男主角 第27届美国演员工会奖 电影奖 最佳男主角 女：千呼万唤始出来，您怎么才分析这部电影？网上已经有很多热评了！ 又怎样？我写这影评从来不抢先，你们先来，我肯定没人跟我重样！ 女：总感觉他们分析的“驴唇不对马嘴”！ 嗨，应试教育就别指望了，无论是不是学电影的，看这些艺术片确实吃力！ 女：之前您解读的《两个遥远的陌生人》简直盖帽了，看来以后奥斯卡级别的影片也只有您美学教父为大家指点迷津了！    森森大军：奥斯卡最佳真人短片《两个遥远的陌生人》：艺术家“写论文”zhuanlan.zhihu.com 女：有个问题不明白，这电影如何获得服装设计奖呢？ 你可以问问清美的“眯眯眼”，那也是搞服装设计的！ 女：哎呦，论美学艺术，中国有几个真内行？我们上学也都是混学历，别人不清楚，您还不知这里怎么回事？ 之前奥斯卡提名的《花木兰》也是服装设计奖，最终颁给这部《蓝调天后》    森森大军：看《花木兰》打麻将……zhuanlan.zhihu.com 别说观众，连《花木兰》的女主刘亦菲都犯蒙，服饰化搞成那样，怎么还能在奥斯卡获奖？ 学术理论干嘛的？指导你观影学习，搞创作！ 一千个人一千个哈姆雷特，谁听你bb啊？这大学上个什么劲儿？ 影片中出现的所有疑惑，要给观众解答，剧情，对白，镜头……有问必答，这影评才有意义！ 女：咱也不能妄自菲薄，中国学生也有强项：给奥斯卡挑毛病啊！ 哦，没错，这玩意儿叫“电影批评”对吧？ 女：呵呵，又称之为“不学无术”！ 打小就没经受过艺术和美学教育，土包子看两本破书瞬间“成精”了……你忽悠鬼去吧！ ……除了会云山雾罩吹牛b你们还会啥？ 女；对，土包子也只能教学生“土猪拱白菜”，真没啥可学的，太不入流！ 你们大学生千万别吃这套障眼法，为什么学艺术要去国外留学？这些家长精得很，见过世面，知道中国教育圈怎么回事！ 本来就没钱还让人割韭菜，老惦着“土猪拱白菜”……做什么梦呢？ 想靠“眯眯眼”博出位，伤害中国人感情，你觉得靠谱吗？ 女：群嘲……这年头谁傻啊？！ 对，没实力没本事，咱就低调，成天装b有啥用？市场买你账吗？翟天临拿你当回事吗？一个郑爽就把你降维打击了吧？ 说难听点，艺术压根就不是你们这帮人玩的，这水平还教课呢，宁也配？洗洗睡吧！    女：小帽结束了吧？您先给咱说下，女主这身行套好在哪里值得获奖？ 这服装设计让人觉得智慧，聪明，艺术，体现出创造力，这就获奖了！ 女：在哪里？ 看到没？马桶圈！    女：哈，大师果然是“后脑勺看电影”，确实很像……那又如何？ 有马桶就有屁股啊！片名《马雷妮的黑屁股》，到底“屁股""在哪儿，哪位看到了？ 女：这是一首歌名！ 歌曲是什么，艺术呈现！ 大家注意这女二号，黑淫娃……     她被男主做爱时屁股黏在钢琴上，还用手指弹奏两下…… 言外之意： 本片的“屁股”要以艺术的方式呈现！ 女：但是没有“露点”啊？ 每次都说，“露点”是典型的镜头语言，电影符号！ 假如明明有床戏做爱场面却“不漏点”，同样也蕴含导演的创作思想……我的四维一体拉片分析法绝不会放过这些细节！ 我盯紧的内容跟你们完全不一样，你关注的那些我未必放在心上…… 女：嗯，我也觉得，很多时候跟大家不在一个频道上！ 我不但在片中找到“黑人的屁股”，甚至还有“白人的屁股” 因为你不懂艺术，也就无法感知大师级别的“艺术表达，呈现手法”！ 女：您是开天眼了，我们还不行，请继续讲…… 剧情之间都有连带关系，而且紧扣主题！ 女：对啊，观众不明白的是，为什么要设计这些剧情对白，剧中人物还要讲各种故事？ 四维一体理论是干嘛的？电影创作的指导思想…… 好比魔方的六个面，“精准对接，丝丝入扣”，这才叫玩意儿，才叫艺术！ 故事想怎么编怎么编，影评想怎么写怎么写？连大傻子都会，还用学吗？ 我先总结本片主题！ 和《两个遥远的陌生人》差不多，本片着重分析美国的黑人为什么“受欺负，受歧视，受压迫……why？”   女：先讲片头，一片深山老林，两个人影……有何特殊用意？ 先问问自己的内心感受，此时观众肯定琢磨，这是音乐片吗？怎么好像犯罪题材……我是不是进错影院了？ 黑人社会的歌剧院，就这样搭个帐篷，开在树林里…… 女：白人世界不用问，车水马龙的downtown，大家盛妆出席！ 这说明一个问题，黑人成长环境就让人联想到低级，原始，犯罪……和高雅艺术不沾边！ 生存环境很重要！即便这个人再懂艺术也就救不了人们对黑人的既定印象！ 女：哦，开篇就开始分析美国黑人问题存在的各种原因了！    没错！ 后面咱主要看人物…… 男主黑豹，小号手！ 我们都知道黑人的表现欲极强，黑豹凭借自己的才华，从来都是很高调的炫耀自己，在台上就敢和蓝调天后一争高下！ 女：他确实很自信！ 他是一个自信，自卑，自负的混合体！ 注意，片中所有的黑人都有典型性，代表性，符号性！ 这样我们才能看出黑人为何在白人世界被无情碾压…… 黑豹被大家嘲笑，因为他给白人当舔狗，于是讲出自己的身世…… 原来这家伙小时候受过刺激！ 女：他亲眼目睹妈妈被八九白人男子轮奸…… 看对白怎么说的，当他等待妈妈的炸鸡，这时候，闯进几个白人…… 言外之意： 黑人孩子还没有吃饱，白人已经谋划解决“下半身”问题了！ 女：哈，有feel……从历史上看，黑人一直处于落后的，被欺负的对象，而白人又是那么无耻和下流！ 他爸爸杀了四个白人，最后其他白人捉住，烧死……相当于用私刑！ 女：这里导演想要说什么呢？ 白人团结啊！ 看片尾，这个乐队多少人？一个指挥，把大家聚拢起来，各司其职……       这四个黑人呢？对比一下…… 即便冒出一个敢反抗的，你一个最多也只能打四个，最后还是完！ 女：黑人确实不团结！谁服谁啊？ 对白中还提到乱炖……一锅炖菜！ 美味的炖菜，属于白人世界，最后剩的萝卜土豆，残羹冷炙……    看到没，自相残杀……这些画面对比分析马上就能明白导演的用心！ 大家看，黑豹的两次挥刀，针对的是谁？ 女：黑人同事？这家伙只敢跟自己的黑人兄弟下死手！ 是的！ 别人嘲笑他不带种，他声色俱厉，咬牙切齿地讲起童年往事…… 女：土猪拱白菜，还真泡上了黑人马子，也不错！ 他也只能泡黑人马子，我不是说了嘛，这家伙自卑和自负的混合体！ 在同族面前，他凭借自己的小才华，表露出天然的自信！ 当受到白人的羞辱，发泄对象马上转移到黑人身上！      为什会这样？一切都有心理动因的！ 小时候那道疤，白人刺到他的胸口，留下深深的烙印……这种恐惧是挥之不去的！    注意看，他与老板台阶上的对话…… 谁在上，谁在下，高下立判！ 台阶，也代表一个人的事业发展…… 黑人想要向上爬，他眼中的老板高高在上，始终压着他…… 牛逼半天，咬牙切齿，还以为这人多有手腕，韬光养晦，洪兴乌鸦……没想到却是这么个东西！ 但对于白人的惧怕，敬畏，那是深入骨髓的！ 之前很多大学，表面上抵制洋节，七个不服八个不忿……实际呢？舔狗终归是舔狗，内心很敬畏的！ 女：哈，还真是，还是您眼毒……我们老师只会跟学生嘚瑟！ 呵呵，一撅屁股就知他拉什么屎！ 千万别跟美学教父来这利格儿隆，把这帮人看到骨髓！ 现在明白“鞋子”的用意吧？ 宁可忍受白人在我胸前留下印记，也绝不容许黑人同族对我的鞋子踩上一脚…… 女：绝！ 本片所有的剧情都有明确的指向性，分析透了才能看出本片为什么获奖，对于艺术，奥斯卡是怎样的存在……    黑豹挥舞刀子，亵渎上帝……他把母亲所受的痛苦归咎于上帝没有帮忙 直接侮辱他黑人兄弟信仰的那个上帝！ 他发泄的对象全是黑人，板子全打在黑人身上，而对于白人，他万不敢逾越雷池！ 女：白人给他胸口留一道疤，又能咋滴？同胞给他皮鞋留个印，不依不饶…… 骨子里是自卑的，自己就看不起自己这身黑皮！ 你看，童年时期的烙印好使不？让他一辈子自卑，将其踩在脚下…… 女：杀人诛心啊！ 不少黑人都是这样，什么叫敬畏，其实就是怕，厦大的…… 有机会我给你们讲讲人性，可好玩了，跟狗性差不多！ 女：玩人的社会，看准人就能分析预测社会时事，我最佩服您这点！ 呵呵，教你们不上当少受骗，多看电影，多刷知乎和抖音，千万别埋书本里，书呆子一事无成！都什么时代了，还整应试教育小儿科的东西！ 女：yes sir！    我继续讲，再分析马雷妮，女主和白人是怎样的关系？谁在上谁在下？ 女：女主在上吗？！ 高高在上，天后级别！ 这就叫“内心的骄傲”，我才是这里的王，一切听我的！ 我看那经济人特服她！ 说明白人同样是金钱的奴隶！ 用才华捏着你，跟我合作你才有钱挣……敢嘚瑟吗？ 再看这个口吃的黑人孩子，马雷妮的侄子…… 我们知道，人在紧张的情况下很容易口吃！ 为什么紧张？还是在上和在下的问题！ 真正融入环境，融入集体，大家处于平等的地位，哪里还有紧张？ 女：有天后罩着，那孩子终于说出一句整词！ 马雷妮对自己的亲戚是真的好，而对天生逆骨的小号手死不待见，将他开除……尽管她认为这小子挺有才！ 女：这剧情说明什么？ 说明黑人对家族血亲还是有爱的，而种群之间就缺乏向心力和团结包容的精神！ 这也是黑人斗不过白人的原因之一！    另外，几人还聊到一个关键词，及时行乐！ 有钱就花，买鞋，有今儿没明儿似的！ 黑人淫娃也是，她实际这是通吃的角色！ 无论女人还是男人，她都能应付，进入角色嗨起来！ 这边刚刚受到冷落，马上又想起男人！ 黑人最擅长的就是找乐子，缺乏长远计划…… 女：这还怎么跟白人斗法呢？ 既然目标是推翻蒋家王朝，就不能打个胜仗就要当山大王……干不成大事！ 女：难怪弹琴老黑讲出一番大道理，原来另有所指！ 想把这样一群人凝聚起来，劲儿往一处使，简直太难了！    再说信仰 有人讲了一个故事，关于黑人神父被白人羞辱，逼着他跳舞…… 黑人信仰的上帝和白人的上帝是同一个吗？ 通过这个故事说明，完全不是啊！否则那些白人还敢亵神吗？ 不但黑人（小号手）觉得上帝不罩着他，连白人都认为你们黑人心中的上帝和我们不一样！ 说明什么？ 说明在美国，信仰对解决种族矛盾根本起不到作用！    女：片中还提到门，黑豹企图砸开一道门，却发现原来是天井…… 黑豹想凭借自己的才华为自己打开“一道门”， 关于门类似用法，在《雪国列车》这部电影也有！ 女：天井代表什么呢？ 典型的镜头语言，说这家伙这就是“井底之蛙”！ 没有格局，贪图享乐，及时行乐……这货只会把刀子捅向自己人！       女：您给大家说下马桶圈，厕所，黑人屁股，白人屁股…… 其实本片对白中就出现多次厕所和卫生间…… 女主多采取“坐马桶姿势”，时常摆出臭脸，焦躁地踱步……时刻处于“便秘状态”！    直到最后，坐在汽车里，她也没真正爽过…… 女：哈，中途还憋回去一次！ 黑人怎么可能在白人世界得到“真正意义的宣泄，实实在在的爽”！ 我总说电影是比喻，以艺术视角去看待这些镜头画面！ “black bottom”，片名明明有，到底藏在是哪里？ 做爱没有露点，观众看不到黑屁股，提示你倒是找啊，看导演如何进行艺术呈现……       这胸脯不就是大肥屁股吗？遮遮掩掩，马桶圈都扣上了还看不出来吗？ 女：哦，原来这样啊！ 这就是指代，艺术呈现，看不见下面看上面啊！ 女：那“白人的屁股”呢？ 在片尾，这个歌手，一看就是特型演员！ 女：怎么就特型了？    没发觉吗，这人长得跟屁股似的？ 女：哈哈，还真是，梳个中分，一分为二！ 后面这一连串特写都有导演的意图……      看这胶盘，中心位置，菊花一紧…… 再看这麦克风，更像菊花吧？还没擦干净…… 之后还有“皮搋子”，小号手给特写，一下一下……厕所都有这玩意吧？       你看，还是这“小白屁股”排得畅，虎躯一震，收肛，音乐戛然而止…… 女：太有意思了，终于找到了bottom…… 还要总结思想，导演对白人的观点：骂人不吐骨头 把脸比作屁股，就说这些人不要脸啊！ 剽窃，剥削黑人的劳动价值，创作才华……自古以来，一直如此！    黑人对白人是怎样的？ 当白人低声下气地说出please，女主还是在合同书上签字…… 明明可以捏死你，当听到你的祈求，黑人还是宽容的！ 就这一点，你们白人能否做到？你们对黑人父亲怎样处置？你们听得进黑人母亲的哀嚎与求饶吗？ 连最基本的怜悯之心都没有，还能叫人吗？ 女：我想起白人曾经对待黑奴，手段真的很残忍！    怎么样，所有剧情和对白都连贯起来了吧？ 女：通过您的解读，我这才真正领略到奥斯卡级别……以后再不敢“批评电影”了！ 学什么，跟谁学很重要！这世界永远是选择大于努力！ 女：yes sir！          森森大军：奥斯卡获奖影片《前程似锦的女孩》：复仇天使“加百列”zhuanlan.zhihu.com森森大军：奥斯卡最佳国际影片奖《酒精计划》：飞跃，定格……zhuanlan.zhihu.com森森大军：奥斯卡最佳真人短片《两个遥远的陌生人》：艺术家“写论文”zhuanlan.zhihu.com",,,0
8,8,34439631,蓝调天后,78c73312b444e5fa2cc579e4c7067031,2591c98b70119fe624898b1e424b5e91,,2021-06-27 08:36:13,“他们根本不理会我的感受，所以连可乐都不给我买。” “他们从来都不关心我这个人，只是想要我的声音（为他们赚钱）。” “你之所以说（没给我侄子也发薪水）是个误会，是因为你发现犯了个错误：我还没有签发行合约。” “艾尔文做我的经纪人6年了，只邀请我去过一次他家，还是为了给他的那些朋友们演唱。” 跋扈如玛，其实是人间清醒。 看上去刁钻刻薄，蛮横无理，不过是因为她看透了真相，才用恶劣的态度回敬与报复。  一旦进入演唱，玛就立刻转换为沉浸和投入、满足和幸福的状态。由衷热爱音乐，天生才赋，无愧“蓝调之母”的赞誉。 1927年，黑人大量北迁，虽然废除了制度上的奴隶制，但实际上的歧视无处不在，黑人处境艰难，影片背景正基于此。 玛的乐队成员各自对社会环境和黑人命运有各自看法，但结果是，他们没有互相帮助、共同解决，反而是彼此倾轧、互相伤害，这升华了影片主题，但多少让人觉得心有戚戚。 黑豹遗作，他把主角那种轻佻功利刻画得如此生动，体型清瘦，我甚至没有认出他来。,,,0
9,9,34439631,蓝调天后,70039b2f8fa9b2082c4c5b3f73772df6,7a734bcf0d7ca938a6b80f729a33f5ec,2.0,2021-05-27 16:44:11,"1920 年芝加哥的某个午后，一支乐队焦急在紧闭的排练室，等待极具开创性的表演者「蓝调之母」Ma（由维奥拉戴维斯饰演）莅临。有自己野心的小号手列维(Levee)（由查德威尔鲍斯曼饰演），愤愤不平地向伙伴控诉自己境遇的不满。 最开始，误以为是一部音乐传记片，但是开头天后的炸场演出之后，在录音室里的乐队成员就开始了喋喋不休，迟迟不演奏，才发现这是一部舞台剧。越演越烈的对话，小号手Levee突然开始述说他的辛酸往事，又给人一种感觉：这是一部揭示美国黑人种族血泪史的政治电影。真的让观众搞不清电影的立意！ 虽然，片名叫“蓝调天后”，但是片子重心明显偏向了查德维克博斯曼饰演的小号手上，片名取得有点挂羊头卖狗肉之意。如果说剧本力道比较足，戏剧范儿也很浓，通过小屋里的对话与冲突，达到了为角色立传的效果,但是电影主旨也仅仅停留在角色的悲痛情节上，并不能上升到社会问题、种族歧视等的更高层面上。只是单纯的从某种意义上，塑造了一个被“上帝”忽视和被遗忘的角色。   维奥拉戴维斯饰演的Ma, 极度强势的背后是看清现实的锤头丧气，拥有自知之明的她知道，声音是她站在白人面前唯一的筹码。她那些看似傲慢无礼的行为，也只是为了能得到白人的认可，既然身份不被认同，得不到尊重也还有金钱。关于带着小侄子录音的那段，没太看出她作为音乐人的谆谆教导，影片刻画出来Ma的形象更多的是狂妄自大的暴戾，飞扬跋扈下的唯利是图。无论是人设上还是剧情上那段都略显多余。 查德威尔鲍斯曼饰演的小号手Levee，是一个对音乐满腔热情的音乐人，他有对成功的渴望，面对现实处境的怀才不遇但也独自聪明，对未来有自己的展望和规划。他可以无视5美元的报酬，为的只是他的歌可以录制成为专辑。然而压死他的却是老伙计“踩了他的鞋”，其实，压垮他的更多的不是被拒绝的失败和不理解，而是没有人支持，就连他的同伴都给他泼冷水。借着心爱的鞋被踩，情绪的发泄最后酿成悲剧。他那双镜头给与特写的小黄鞋，应该也暗指他的作品和才华。另外，剧中和他打得火热的黑人小妞，也曾经向Ma提到要买一双小黄鞋，影片中很多特写还有情感线，都能看出他们的关系，女方是真心欣赏男方的。 影片时长94分钟，想要讲的故事太多，导致最后影片没有一条清晰的主线。Levee的故事潦草结尾，Ma的故事也不完整。匆匆收尾的效果也不能起到戛然而止，给人带来意犹未尽的点睛之感。实则败笔！  影片是根据舞台剧改编的，原本台本想要表达的是对种族歧视沉痛的控诉，结果被硬生生的影视化，加上再创作，不但不能表达出精髓，反而成为一部舞台剧感十足的电影。没有展露电影独有的语言叙述与抒情魅力，却被大量的台词与对白堆砌，又加上电影制作的手法，最后成了一个不伦不类的成品。 正如Ma在电影里的台词所说，白人不懂蓝调，观众不懂这部“电影”。",,2.0,5
10,10,34439631,蓝调天后,bce6c7df9c0493442a08ef02a50fa854,ad8f296ab845fcb975eaed69d2fb8ff4,,2021-05-01 17:47:42,"#电影# 乔治·乌尔夫《蓝调天后》
终于看到一部能让我从头到尾都满意的电影了
我想知道谁翻译的这片名，这根本不是传记，跟蓝调天后没啥关系，蓝调天后只是引子，应该叫《蓝调录音室》才对
整部电影一个半小时只记录了一个发生在录音室的半个下午的故事，时间跨度极其小，而且是群戏，没有太明显的男女主演，导演处理得非常好，堪比我无比崇拜的《热天午后》，大部分时间都是对白，为了不显得枯燥，故意把节奏加快，个个说话跟机关枪一样突突突地，就这样还加了一个隐寓，年轻黑人发现录音室多了一道门，一直想打开，都没成功，直到最后不顾一切抛掉工作返回录音室时才终于打开那扇门，却发现门外面不过是围住的高墙，什么都没有，这门就是暗示年轻黑人的命运
表演也没话说，尤其是蓝调天后的表演
还有就是音乐，全片四分之三都在放蓝调音乐，蓝调我了解得甚少，总之，好听就对了",,,0
11,11,34439631,蓝调天后,b7af54ef00599f2f0f431e74e2329dce,ed43adb1b226ac748d6c7595c4c401c4,,2021-04-28 12:15:22,蓝调天后 (2020)6.52020 / 美国 / 剧情 音乐 / 乔治·乌尔夫 / 维奥拉·戴维斯 查德维克·博斯曼 藍調天後 2020 美國 喬治烏爾夫 今天我們不說主角天后瑪雷尼，說樂隊裡的小號手利維，他是個天真又有天賦的小號手，有精湛的演出功底還能創作曲目，但是他倨傲無禮，他說他最懂白人，到頭來他什麼都不懂，還是跟他父母一樣被踩在腳底下踐踏，自己的創作被五美金賤賣，最後還是由白人來演出，不就像他的人生一樣是場笑話嗎？ 我們還回歸於歷史，美國奴隸制度是十八世紀開始一直到現在，在美國對黑人還是有色眼光的歧視，而藍調在十九世紀末誕生，顧名思義Blue象徵低落、悲傷、憂鬱，透過音樂宣洩對生活的不滿及不公，但我認為他們通過音樂表達對生活的態度，透過音樂理解生活，所以當他們的腦子裡總是音樂時，音樂就能調節保持平衡，音樂有力量能填滿他們，在這世界有更多的音樂，這世界就更豐滿，所以他們才唱歌。 音樂可以帶給人，美的享受和情感，並且調和生活的困境與難題，藉由音樂達到生命的昇華！,,,0
12,12,34439631,蓝调天后,5c9c4b82bfa462ff3f6d153526db26d1,7cc7de91ce782cd38510a2c63ca87df3,3.0,2021-04-23 18:19:08,去年，“黑豹”男星查德维克·博斯曼的意外离世给全世界影迷留下了巨大的遗憾，而他的遗作《蓝调天后》却意想不到成为了今年奥斯卡颁奖季的一匹黑马，他凭着片中的精彩演绎接连获不少最佳男演员的奖项，还有望在本周日晚获奥斯卡影帝。“沾死人的光”这种说法也许有点刻薄，不过这部份量甚轻的作品在往年能否受到如此多的关注，还真的不太好说。因为每年一到颁奖季，自然就冒出数不尽的黑人题材影片，前些年的《月光男孩》和《绿皮书》顺利登顶奥斯卡相信大家还记忆犹新。 从片名来看，这部影片让我觉得是那种老一套的人物传记片，而事实上却并非如此。这是由戏剧改编成的讽喻剧，带有强烈的舞台表演风格，仅仅截取了上世纪20年代如日中天的蓝调女伶和乐队在一个下午录制唱片期间发生的故事，题材和格局远非是荡气回肠的史诗题材。核心自然是美国黑人的种族问题，借古讽今的故事引人深思。 遥想当年，黑人音乐家看似风光无限，实则依然摆脱不了悲剧的命运。不论是资历深厚而霸气逼人的歌后，还是寂寂无名而富有潜力的乐手，全都成为了白人手中的玩物。只要白人剥削和利用完了，自然将你打发走，到头来还将黑人引以为傲的东西据为己有，这个结尾相当讽刺。影片有别于常见的黑人互助观点，大胆展现出黑人之间内斗，甚至自相残杀的刻画，暗中再次将矛头指向白人。黑人面对的不公待遇和悲惨状况时至今日也没能彻底扭转，去年爆发的BLM运动就是最触目惊心的证据。,,,0
