,Unnamed: 0,电影id,电影名称,用户id,用户名,评分,评论日期,评论内容,有用数,没用数,回应数
0,0,34865507,小人物,ceb1694c5fe6d96fc12ba8dacff44d27,d0dbe915091d400bd8ee7f27f0791303,4.0,2021-04-16 10:13:38,"很久没看到这么扎实的动作片了，动作戏的质感比John Wick和飓风营救更进一步，没有过度依靠血浆、断肢来卖弄痛感，而是在肢体交接的瞬间和二次打击上下了功夫，让人从视觉、听觉和逻辑层面同时感受到力量感。华彩片段是公车戏，到了结尾大战反倒有些退回到了常规动作片的套路。 而且没有了苦情戏，不为营救谁，不为复仇，纯粹的以暴制暴，女儿的小猫手链只是个借口，他需要逃离他本以为自己向往的平凡生活，他期待着一些意外的发生，让他有借口可以回到他属于的世界，所以最后在家中桌子底下发现手链时，没有任何懊悔，只是有些意外，因为找到手链从来都不是重点。 他可以轻松搞定公交车上这帮小混混，但那不够，他需要亲身感受疼痛，来唤醒在周而复始的日常生活中钝化的身体，对这帮人下手正合适，他们不是被生活逼迫走上行窃道路的小夫妻，他可以毫无心理负担的释放天性。 面对俄罗斯黑帮时，他的反应不是苦恼，而是跃跃欲试，他早就过腻了cosplay中年loser的生活，厌烦了儿子鄙视的目光和二百五小舅子的夸夸其谈。 所以，在被不断警告别惹那个俄罗斯人时，他没有任何逃避的想法，反倒有些跃跃欲试，第一批人杀到家里，结束战斗后犹豫了一下，只是打理一下自己，根本没收拾遍地横尸就打开了地下室的门，让儿子重新认识他老子。 和公交车逻辑一样，是你们先动手的，你杀到我家，我就要杀到你的大本营，他当然可以不做的这么绝，但他不想给对方放手的选择，他做好了所有的铺垫，在与朱利安对峙时，也不断地在用话激对方，说的好像是冤冤相报何时了，选择权在你，我们可以一别两宽，相忘于江湖，但却又告诉朱利安你所有的钱都被我烧了，现在我们扯平，你可以整个容，找个离我远点的地方猫着，这事儿就算了了。 这是讲和吗，明晃晃的挑衅。就这样，出门上车还担心对方不追出来呢。看朱利安冲出门，才算放了心，开始把对方往工厂引。 这也是美国当下情绪的一种反应吧，很多人都有一股怨气要发泄，娱乐业自然会有人看到这个需求，你以为我是个中年loser，我就要让你长长见识。 飓风营救里连姆尼森女儿被绑，不得不出手。 John Wick，你杀了我相依为命的狗就要付出代价。 到了Nobody，主人公已经不想先承受任何损失再出手，而是引导你先动手，我再大杀四方，占理又解气。 从绑我女儿到杀我狗再到你来打我呀，使用大杀器的门槛越来越低，但道德制高点不能放，“我”永远都是被迫出手的，“我”身怀杀人技，但“我”是善良和正义的化身。 最后找补一句，类型片的关注重点应该在类型元素的完成度，而不是其他辅助元素，动作片的核心就是动作戏，文戏服务于类型要素，是应该给予较大宽容度的，不同类型的作品没必要拉到一块对比。 用冯巩的话说就是 “和潘长江比个大，和陈佩斯比美发，和帕瓦罗蒂比劈叉，和美国总统布什比说中国话。” 都能赢，但没什么意思。  个人微信公众号【万物票友】
或在喜马拉雅、小宇宙APP搜索【浅尝】订阅我的播客",450.0,8.0,94
1,1,34865507,小人物,5b2e6d65b53202c816e68d50b0744a72,6a749036216270d3b46d03e4e0ce21da,5.0,2021-04-16 19:49:46,"江湖上又一个规矩 第一，不要碰John Wick的狗 第二，不要碰Liam Neeson的闺女 第三，不要碰Saul Goodman闺女……………………………………………………………的Kitty Cat 我是Saul Goodman，我过着一成不变社畜的日子，我老婆是Kim，在风骚律师第五季她开始放飞自我了，第六季连我自己都不知道，我老婆还是不是Kim。 在这一个家里面，我只喜欢我闺女，因为只有闺女不歧视我。  直到有一天，我的潜在客户深夜过来找我，看到他们辛辛苦苦的犯罪，这不就是送上门的生意吗？ 咦？？？入室盗窃，这我的开庭费就大几百刀，如果是入室抢劫，吼吼吼，大几千刀不就到手了吗？ 我准备先打个Call，先给Saul Goodman办公室预约一下，先给你们两个打点好，你们狱中的室友，你们狱中的上司， 来来来，从我碗里面是拿走我的钱，再付给我，成为你的律师，保证不会让你们牢底坐穿， 靠靠靠，不是把我去年买了个表给抢走，你放心，保证让你们两个人牢底坐穿， swing，我为什么要swing，我是一个律师，a lawyer，我是要靠客户犯罪，才恰饭的，怎么去swing自己的客户呢？  MD，这一个家还能不能继续待了，我都说了，你TMD不是我老婆，我老婆是Kim，TMD，我也说了，你TMD也不是我儿子。 我只有一个我闺女，她昨天还说要小猫咪，电影一开头，我都掏出来了。 你们两个人还没有一点逼数码？还不知道你们两个人在家里面的地位吗？你们两个瞎BB什么呢？靠靠靠，TMD当着我的面说我不够man。 TMD，之前两个入室盗窃，不，入室抢劫，你拿钱你就拿钱呗，把我女儿的东西也拿走，这我绝逼不能忍。 你们就是把我假老婆和假儿子都kill了，我都不会care的，但是你们敢动我女儿的东西，嘿嘿嘿，还记得《风骚律师》S5E2，那两个被我打骨折，不，打五折的那两个人吗？ 放心，我懂得，你们打工是不可能打工的，这辈子不可能打工的。放心，进了里面去个个都是人才，说话又好听，你们超喜欢在里面的。  回家的路上，我在想，这回家对闺女没法交代啊，都说上帝关门开窗什么的， 我的天，送上门的客户啊，我数一数，12345个人，发了，这是要发了， 之前，一直想要找大客户，找大客户，原来遍地都是大客户啊， 看我的骚操作，先引一波仇恨，把武器放下，子弹褪下，来一场看似两败俱伤，自杀式打法， 我看哪一个sb会去捡枪，我靠，还敢捡子弹，我靠，还敢开枪，靠，你的每一步都是朝着联邦一级重刑犯的方向发展啊， 靠，你这不牢底坐穿，我都不叫 Saul Goodman了。 为了以防万一，我留一个名片，这你再联系不到我，那你们就太垃圾了， 为了保证我见义勇为的行为正当防卫性，我肯定不能再继续留在案发现场了， 手机我交给人证了，911一call，小钱钱很快就会到手了。  咦，不对劲啊，已经这么多天，怎么还没有人过来找我……的Fxxxxxk，找人来灭我口， 我去，这一个性质更不一样了，客户这样玩，没有大几十万美元都摆不平的， 我以为我会吃5条小鱼，客户这是怕自己吃不饱，这TMD是要再送自己N条大鱼啊，贫穷限制了我的想象力，城里人真TMD会玩， 我靠，我靠，还绑架，我去，我去， 再加这一条罪名，合计怎么滴也得是大几百万美元了， 哎哎哎，这都杀人了， 怎么我的犯罪直觉，不，我的律师直觉，感觉还差点什么东西呢？ 放火啊，从客户那边捞一个纵火的重罪，之后从保险公司那边再捞一笔，Double翻倍赚啊， 对了，再顺一辆车，客户的车辆盗窃罪，get， 应该先去受害人，不，被告，不，金主客户家去看看，看一下他能赔多少钱出来。 嗯嗯嗯，这一个银行装修的，不错不错，人员也是人高马大，人高马大的， 我去，可以可以，富豪的钱都是股份，真正的现金没有多少，见过的现金都是论张的，这是成吨的现金啊。 我想，注意哈，我想把这一些money给burn了，但是也是想想，我烧这么多钱，冥界人民银行不得通货膨胀了吗？ 我们的受害人，不，被告，不，金主客户家，我自己算了一下，大概，没有1-2个亿，别想摆平这一系列的官司了 走了，找大佬聊聊天， 糟糕，价钱谈崩了， 大佬感觉这么多钱，花少了，怎么滴，以大佬的身份。 至少，对公犯罪也得安排上啊，对公犯罪，对公犯罪？顾名思义，对公司犯罪对吗？工厂算不算？金主爸爸说，算 好的，安排上了， 金主爸爸还说，多安排两个人，一起打真反恐精英，真人道具赛那种哈， 好的，安排上了， 金主爸爸还说，作为VVVVVIP客户，给我单独安排一个military级别的道具。 好的，安排上了， 最后，警察出来洗地了。 问我是谁？知道《战争之王》吗？尼古拉斯·凯奇的那个，我都跟上面打过招呼了。 原文如下： Let me tell you what's gonna happen.This way you can prepare yourself.Soon there's gonna be a knock on that door and you will be called outside. In the hall there will be a man who outranks you. First,he'll compliment you on the fine job you've done, that you're making the world a safer place,that you're to receive a commendation and a promotion.And then he's going to tell you that I am to be released.  You're going to protest.You'll probably threaten to resign.But in the end I will be released.The reason I'll be released is the same reason you think I'll be convicted. I do rub shoulders with some of the most vile,sadistic men calling themselves leaders today.But some of those men are the enemies of your enemies. And while the biggest arms dealer in the world is your boss, the President of the United States, who ships more merchandise in a day than I do in a year,sometimes it's embarrassing to have his fingerprints on the guns.  Sometimes he needs a freelancer like me to supply forces he can't be seen supplying. So , you call me evil. But unfortunately for you,I'm a necessary evil.",282.0,25.0,57
2,2,34865507,小人物,09916ff7d36b5bed9ad8bd9890157ef1,94b2602c3f8ba77964843eac200a4ae3,4.0,2021-04-17 21:33:52,"作者： Bind   早在去年五月，影迷心心念念的《疾速追杀4》就因疫情被延期到了2022年5月27日。也就是说，「杀神」约翰·威克备战结束后那一触即发的血腥反击战，还要让大家苦等一年有余。 不过这样的「杀神」不止一位。 在约翰·威克待机之时，代号「Nobody」，「师出无名」的某位中年杀神也已经跃跃欲试了。 同样招惹了麻烦的俄罗斯黑帮，同样是归隐田园的传奇杀手，但这位「无名小卒」真心想念鲜血四溅的滋味。  哈奇，一年到头循环着无趣人生，平平无奇的废柴中年男人。 打卡上班，夫妻冷淡，每个星期二准时错过垃圾车，生活好似流水账一般来去匆匆。 直到一天晚上，两个小毛贼闯进他家打劫。哈奇乖乖交出了手表和桌子上的零钱，但此时儿子却英勇地挺身而出，直接撂倒一个歹徒。 手持高尔夫球杆的哈奇本想顺势反击，但在最后一刻，他选择放走了歹徒。 





 只是微不足道的经济损失和皮外伤，家人们都安全了。 但儿子打心底里看不起这个废物父亲，警察、邻居和小舅子也阴阳怪气嘲笑哈奇是个怂货。 这种窝囊气，搁谁身上都不好受，更不用说是有着神秘背景的哈奇。 兄弟哈里劝他不要惹事，息事宁人就好，而老爹则质问他： 「你还记得我们曾经是谁吗？」  郁郁寡欢的哈奇最终被一个猫咪手链点燃了—— 毛贼拿钱的时候可能不小心顺走了女儿最爱的手链。 是可忍，孰不可忍。哈奇，上路寻仇了。 在寻找仇人的同时，哈奇找回了以前肆无忌惮、刀尖舔血的感觉，感受到了真正的「爷青回」！ 但他马上就摊上了大事儿：在一场由他挑起的公交车斗殴中，他把俄罗斯黑帮老大的兄弟打成了脑损伤...... 





 看了上述简介，你大概也发现了，《小人物》在剧情上和《疾速追杀》非常相似——简直是一个模子刻出来的。 这也正常，因为该片编剧德里克·科尔斯塔就是《疾速追杀》系列的缔造者（该系列三部影片的剧本均由他操刀），属于自我临摹了。 卸甲归田隐姓埋名的传奇杀手，只想安静享受家庭的温暖，但一件小事令他无奈回归，面对仇人大开杀戒。 不过这样苦逼的心路历程，只属于约翰·威克，一反常规不走寻常路的哈奇，乐在其中，爽得一比。  这也是《小人物》和《疾速追杀》系列风格上最大的不同——《小人物》带着浮夸且没心没肺的黑色幽默。 不可否认，哈奇享受过退休后的平静日子，可他内心一直怀念着过去的杀戮生涯。导演伊利亚·奈舒勒还借用了梵高的名作《梵高在阿尔勒的卧室》来衬托哈奇的内心。这幅画展现了梵高心中那个宁静而不能被打扰的卧室，是个独属自己还有些孤独的艺术乌托邦。而哈奇在影片中获得它的方式则是无所顾虑、我行我素的大杀四方，以至于画布最后也染上了鲜血。  这位为美国「三个字母」的调查局工作的职业清道夫，内心完全清楚自己是什么样的怪物。迟早有一天他会重操旧业，毛贼的出现，只是给了他提前复出的借口。所以当哈奇发现这一连串事件的导火索猫咪手链压根没丢时，他只是会心一笑。 加上曾经以「风骚律师」索尔一角深入人心的鲍勃·奥登科克自带文职气场，看上去俨然是个战五渣，和杀神简直不沾边。人设和演员加成，让无名杀神哈奇自带黑色幽默感。以此为乐、外柔内刚的反差感也让他显得比约翰·威克还凶残。 





 上文提到了导演伊利亚·奈舒勒，接下来想要点名表扬这位俄系导演对动作片的深厚理解。 2015年时，由伊利亚·奈舒勒执导的第一人称动作电影《硬核亨利》助他一炮而红。第一人称的视角游戏感十足，血腥又暴力，观众头晕目眩的同时也惊奇这电影是真™酷炫过瘾。 到了今年，虽然《小人物》没有第一人称视角加持，但导演对动作戏的把握更加精深，拳拳到肉的动作戏不乏夸张色彩。比如全片第一场正经打戏——公交车械斗，小空间内近身肉搏，一点儿喘息时间都没有，完全不存在那种「一人挨打，队友围观」的尴尬情况——哈师傅，切他中路！  最终战的风格则浮夸幽默，杀神两兄弟带着老爷子集体出马怒战俄国黑帮，在工厂里上演杀神版《小鬼当家》，老弟哈里狙击枪爆头一穿三，打游戏都不敢这么玩！  除去哈奇自带的黑色幽默，导演和编剧还加入了许多冷冷的小笑料。比如一直被人追问的俄罗斯黑帮的黑人成员，比如哈奇在枪战中忙里偷闲擦去了工厂的安全生产天数......  爽快又幽默，融合诸多元素的该片开启了一个有别于《疾速》系列的新范本。熟能生巧的编剧德里克·科尔斯塔高度概括了这一类型片中主角和剧情的特征，简直创造了动作电影的全新亚类型——片名与哈奇的特工代号「nobody」，宛如美式枪战武侠中的扫地僧，座右铭是「人若犯我我必犯人」。 除了设定高度相似的《疾速追杀》外，在《小人物》中，影迷还能看到很多其他电影的影子。 电影开头，画面一天一天快速闪回哈奇无聊的中年生活。这和《通勤营救》的片头非常相似，该片的主角是推销保险十余年被对手低估了的退役警察。 





 哈奇为政府工作的神秘背景，被完全掩盖的秘密档案，一通电话就能免除罪行的逆天特权，《伸冤人》中单枪匹马剿灭俄国黑帮的麦考尔，肯定愿意和他碰一碰。 《伸冤人》/2014 截止目前，成本1600万的《小人物》已经喜提3000万+票房与超高口碑，上线流媒体后基本稳赚不赔。 最近有消息称编剧德里克·科尔斯塔没能和狮门续约，将不会回归《疾速追杀》的第四、五部参与剧本创作。所以，天时地利人和，说不好他会接着搞哈奇的故事。 何况，《小人物》的结局已经埋下伏笔：哈奇的退休生活正式宣告结束，《Nobody: Chapter 2》不是梦！",61.0,1.0,12
3,3,34865507,小人物,532fb44b41ec5f162c3db570bd500bbd,ba57b55e450ccc15ac5daf7012d36f6c,3.0,2021-04-17 22:32:54,"每天早起干着家庭主妇的活，在公交站练习引体向上，不知从什么时候起就没了性生活，还被内弟强行送了一把枪。影片一开始勾勒出的简笔画，告诉我们小职员Hutch正遭遇着可能是中年危机中最严重的那一种，因为他要解决的麻烦并不来自家庭与工作、时间与金钱——他可以怀抱女儿安然入睡，也可以抽出高尔夫球杆而不担心损坏家具。他所面对的最大问题，恰恰就是他自己：他缺乏男性气概。""Nobody""并非“小“人物，而是“无”人物。Hutch的”无“，表现为内在气质的缺失。换句话说，他不是个男人。 于是，证明自己是弗洛伊德忠实拥趸的一员，同跨过中年危机的高危门槛便自然而然地混杂在了一起，挥动拳头、扣动扳机、喷洒鲜血一类简单粗暴的展示男子力量的活动，在保护家人、为民除害的高尚动机的支持下显得熠熠生辉。小职员爆发了，他开始拼命，开始反击，他让欺负他的人无话可说，他让坏人恶棍受到了应有的惩罚。他让我们喘不过气，他让我们热血澎湃，他让我们放弃了思考。 但很遗憾，思考是人的天职。在影片背后，实际“藏”着一个狡猾的手段，就像Hutch的名字所含有的动词之意一样。随着故事发展，这位中年危机患者的身世逐渐揭开，我们发现他并非不是男人，相反，他做到了不少男人都梦寐以求的事情，体会得到雄风威震带来的豪气和快感。Hutch是男人中的男人。他只是把自己的男性气概都“藏”了起来。他根本无需证明，只需显露本性。 这是狡猾的。用不存在危机的中年危机来解决中年危机，用伪装成小人物的大人物来代言“无”人物，这是狡猾的；让观众对Hutch产生共情，为他打得精彩而大声叫好，甚至在眼花缭乱中忘记了他的真实身份，这是狡猾的。电影抛出一个问题，却只为观众留下一堆放火烧光的空架子和道具钞票，以及真真切切、实实在在的中年危机（还有能够联想到的一切生活危机），有待诸位去自行处理。如何处理？大概就像影片开头的Hutch，忍耐，再忍耐。 用九十分钟的满足感，换来九十分钟后的失落感——失落自己不能打、没有枪、缺少同样的男子气概……不知道有多少陷在泥淖里观众也想做一场Hutch这样的春梦。别忘了，片子告诉我们，如果你能像Hutch那样勇猛，不仅中年危机可以迎刃而解，老年危机也根本不在话下：只要看看他的老父亲就明白了。 这是我们爱电影的原因，也是我们恨电影的理由。",109.0,10.0,14
4,4,34865507,小人物,1fd2fd8dada55ec92f8b18365221c313,d0ff37e039e917c2aabf2479c3378450,4.0,2021-04-16 22:09:34,"打从《疾速追杀》系列开始，人们仿佛才新发现了这种“扮猪吃象”的电影是如此合人胃口，之后无论是各类模仿其动作风格的影片，亦或是《极线杀手》，《第一滴血5》，《伸冤人2》，各种连姆尼森的老爸营救，乃至这一部《小人物》，让身怀绝技的主角退隐江湖，却因为世道纷争不得不重新披挂上阵，且装得一手好逼。  是的，这类电影最重要的便是装逼，无论是打斗时有闲情逸致地倒杯红酒，还是打斗完后悠闲地开罐猫食，游刃有余写在脸上，留有后手不会告诉别人，点上一根烟，你们就知道老子的段位比你们高了不知多少。   剧透预警  《小人物》这部电影的剧情脉络，其实还是非常典型的，看似普通人的男主背地里曾是cia/fbi的高级特工，只不过因为向往平凡的生活所以归隐闹市之中。   而这类电影之所以引人，身为“平凡人”的主角开始必须吃瘪栽跟头，然后再展现出十八般技艺，把之前欺负自己的人打个落花流水。 看上去，其实这也是“复仇类型”电影的主线，但是复仇题材一般会是：被欺负-磨砺自身-绝地反杀这样的流程，前面被虐得越惨，后面历经千辛万苦命悬一线的反杀才越让人拍腿称快。 但是“退休杀手”题材的电影，则可以完全省略掉中间为了复仇而“增强自我”的环节，主角开始就已经是满级用户，吃瘪并非无力反抗，更多是没有准备，或是无心反抗，于是后面的所谓“复仇”则是通过砍瓜切菜来完成对前面剧情的颠覆，相比于常规复仇题材，退休杀手的反杀显然要更加潇洒写意。  虽然先抑后扬这样的剧情起伏并无问题，但要如何将前面的憋屈和后面一个劲儿释放出来的爽快营造好，且合情合理，《小人物》在这一点上还是有点东西的。  最大的一个问题就是，为什么满级大佬会被小喽啰欺负，甚至被打个落花流水。 《小人物》给出的原因就是，他是个只想过平凡生活的好人。这点说起来容易，但是拍摄出来很容易让人出戏，还好本片中的主角不仅在努力做一个“普通人”，还是个不折不扣的“好人”，面对菜鸟雌雄大盗，看出了他们其实并无伤人的意图，哪怕后面去找他们，一看到这对苦命鸳鸯还要照料孩子就下不去狠手。
  而这一来二去没能畅快的复仇，反而为公交车上的爆发蓄满了力，全片从公交车片段开始才全面发力，三场动作戏，一场比一场庞大，但还是公交车上拳拳到肉的搏击更有看点，主角有着精妙的技巧，但毕竟以一敌多，时不时会被破防，但是影片里的男主仿佛开了无限血条的挂一般，皮糙肉厚，回血迅速，就算会被小年轻偷袭，但是反手一拳回击，力道反而更猛。 至于后面的几场戏份，尤其是最后工厂里的老鬼当家，反而因为枪械的间接性与场景的割裂而缺乏了拳拳到肉的极致冲击，特效做出来的爆头血花，显然也没有刀尖划破皮肤带来的冲击感强。    动作戏之后，自然就要说道说道，怎么装逼才能让观众看得开心满意。 装逼有好几种类型，一种是自己装，一种是别人帮你装。 自己装自然好说。 大隐隐于市，人称nobody，档案全涂黑，碰到麻烦有人保，这就是一种“老子虽是无名氏，但是我后头有人”的装逼。 男主以一打多车轮战赢了不说，打完电车上的痴汉们后，给俄罗斯混混做了一个喉部手术，这就是“持久续航，手法精湛，手术刀般精确打击”的装逼。  男主杀光了一屋子的特种兵，把他们摆在一起听他讲课，血腥的场景配合男主回忆的侃侃而谈，又是一种“恶趣味之好为人师”的装逼。  而男主在意女儿的蝴蝶卡子和最后给女儿带了只猫和猫粮，就属于那种“永远在意自己的小算盘”的装逼，这种逼装得最狠，可不仅是临危不乱，更是无论何种危急的情形，脑中挂念的都是自己的一亩三分地，那可不就是根本不正眼瞄一下敌人的轻蔑吗？   自己装逼爽一时，别人帮你装，那能爽一辈子。 《小人物》中虽然也努力在用反派和群众演员的态度试图表现出男主很牛逼的模样，然而怎么看都像是对《疾速追杀》的拙劣模仿，《小人物》里面很多人似乎只是嘴上害怕男主，相比于《疾速追杀》里那些反派对john wick噤若寒蝉却不得不头铁顶上的模样，火候还是欠了几分。    总之，《小人物》真的可以称得上是一部低配版的《疾速追杀》，无论是故事脉络或是制作团队都是相当一致的，虽然经费确实要更少一些，导演用他特有的B级风格的幽默或多或少填补了这些欠缺，至少，打得开心，看得开心。  最后，不要忘记我们更加装逼的老爷子，坐在沙发上就手刃两名壮汉，实在不行，老爹爹还可以回到未来干掉你。      （最后拉个票，我参加了豆瓣阅读的“第三届长篇小说拉力赛”，欢迎点击《夏日的终焉》这个链接关注我的参赛作品哦）",108.0,12.0,52
