,Unnamed: 0,电影id,电影名称,用户id,用户名,评分,评论日期,评论内容,有用数,没用数,回应数
0,0,34913671,哆啦A梦：伴我同行2,b69646f43a4911c2c6507259891b4df5,15d5b360bc6fe04e104c4d550ef662a5,3.0,2021-05-31 14:13:27,"先上结论：制作精良，但实际上完全强改原著精神，可谓是假哆啦a梦。真哆啦a梦为孩子们打开更大的世界更远的梦想，去探索去担当；假哆啦a梦拿原著设定搞意淫，很多桥段挺猥琐的。我对男性向爽文没意见，但男性向爽文充全年龄就是制作方不对了。 我们逐一分析一下。 1、两部《伴我同行》和原作漫画、以及其他一些哆啦A梦剧场版究竟有什么区别？ 是把原作连载早期的章节给提炼了，但是串联得并不高明，总体上说是强改了《哆啦a梦》的精神。作为90后，我第一次看多啦a梦是七岁做胃镜怕痛，爷爷在儿童医院里面的小书摊里给我买了一本多啦a梦超长篇漫画，在即将做胃镜之前它给了我很多勇气。我一直觉得哆啦a梦好看就好看在那种孩童视角的、很淳朴很生活化的魔法想象，类似一个永远在喷可乐的可乐瓶子啊永远也舔不完的冰棒这样，都是以快乐为导向的生活视角。 超长篇更是把世界观扩大，讨论了很多环保和科技的问题，有很多对当代世界的反思，能去侏罗纪去太空去外星，这些故事曾经为很多很多读者种下了很多梦想的种子，相比之下能不能和静香结婚简直太次要了。去年才陪小朋友看了一个，演到小伙伴们手拉手为了拯救文明追求正义、甚至做好准备迎接死亡，我和小朋友都感动得不行，这种基础上人物才可爱啊。 （我很喜欢的《月球探险记》） 《伴我同行》这两部，看了才知道和那些没关系。主体是坐着时光机穿梭，大雄完全彻底从根本上不支棱了，主要矛盾就是大雄的恋爱烦恼、结婚疑云（单身派对婚礼还有其他等等情节，充分说明这个系列确实是面向成年观众的，完全可以使用这种批评方法），格局一下子小了。角色当然有缺点，这两部电影里大雄的缺点以前作品里或多或少也有，但也不能把所有缺点一口气占全吧。咱们梳理一下—— a小学就连续考0分考得理直气壮（日本城市小学生考0分这是天赋异禀啊，小学生会把自己代入他吗？）
b遇到任何事情都只会大哭，喊哆啦a梦
c运动神经没有
d被欺负就被动挨打（讽刺的是胖虎和小夫还来救他，积极想办法，胖虎甚至说能欺负大雄的只有他，我寻思大雄和胖虎才是真的应该在一起啊） （要靠胖虎小夫静香拯救的大雄同志，你废得有点过了） e对身材丰满的胖妹极尽揶揄能事，觉得和她结婚就完蛋了，嘴脸简直恶臭，就是bodyshaming啊，太low了，各种丑化。《伴我同行1》中大雄手里拿着那个平板，平板交替呈现和静香结婚还有和胖妹结婚的画面，一切换到和胖妹结婚的照片大雄就愁眉苦脸，实在有点恶心…… （这段实在有点恶臭，太恶心了） （这种情节太屌丝了吧，和胖妹在一起就是子孙十八代倒大霉，非要和静香在一起？静香和胖妹凭什么和你在一起？） f想使用哆啦A梦的魔法道具——印随蛋让静香爱上自己（印随现象是说小鸟孵出来以后会把看到的第一个物体当成母亲，所以人从印随蛋里钻出来就会疯狂爱上对方），实在太low了，这一件事就足够拉黑他了，没劲，这种人就是没劲 （印随蛋，标准屌丝道具啊） g结婚也能逃，第二部可以看出来他成年以后也是毫无主见缺乏胆量，为防剧透这里就不写了，反正看的时候觉得他可真是离谱啊… 2、这些不是原作中的情节吗？ 哆啦a梦原著里是有些集数让人看着难受，不过原著作者有有成熟过程，还有历史阶段，同时漫长的连载过程中编不出来也可以理解……而且《哆啦A梦》的情节中后期变了很多，各种上天入地下海的剧场版都不这样了，很纯粹很勇敢（躺平佛系的人生也可以很纯粹很勇敢啊）。 《伴我同行》靠名字把我唬住了，我以为像River Phoenix《stand by me》那样是小伙伴们有点惆怅的情谊和成长呢。引一下豆友@Doctor-s-cony  的留言， “好几个故事在原著跨度是很大的，他偏偏取大雄废柴的部分，并且放大废柴串到一起。比如原著里有大雄通过未来电视，误以为静香和出木杉在一起，然后发奋改变自己的情节。原著里《我出生的那一天》，大雄看到自己出生的时候爸妈对自己的诸多期望，回到现在就努力学习到半夜，这些剧情都被删掉了。” 这只能理解为为了吸引成年观众故意为之，从头到尾都是那种……很纯的屌丝感。屌丝和佛系、躺平等等完全不一样，屌丝是说“女人都爱有钱人”“不就是嫌我没钱”，整天幻想女神倒贴——这样他就可以在比他强的雄性面前洋洋得意了——同时对他觉得长得不好看的女性极尽嘴贱揶揄之能事。《伴我同行》这两部，还真就是有种说不出来的奇怪，which是原作、其他剧场版里并没有的。 3、所以《伴我同行》系列的策划逻辑是什么呢？ 哆啦a梦和速激其实是同一种电影啊。光头是全世界就他最强都给他面子，大雄是全世界就他最弱，但所有人都包容他，哆啦a梦上赶着给他收拾烂摊子，还能娶静香。尤其第二部《伴我同行》里，大雄可是我的同龄社畜啊又不是小学生，居然能更幼稚了，令人发指……你活到二三十岁还这样也没关系，送给你、送给你、送给你……这和躺平佛系可是完全不一样哦，躺平佛系是要自己解决自己的问题自己面对自己的欲望不给别人添麻烦的，你爽文向这是什么？放弃一切，只剩下发梦了？ 也因此，《速度与激情》和《哆啦A梦伴我同行》，作为大投资大制作，最大的难题就是，看到主角让人如坐针毡。 这是给男人造的幻觉啊！假如我带女儿去看，我只想说： a这里面演的不对，《伴我同行》里面大雄这样的男的万万不能找啊！！！
b这种结婚都能逃跑的男的是不能给你幸福的！！！
c女生不能因为“觉得一个人好可怜”就和他谈恋爱啊，要寻找有品质的真爱才行！！！不自救的人是不能去爱的！！！
d女生也要扩大社交圈子，这样就不至于成年以后还是只认识那几个人了…… （坦白说我想在上面画个红叉） 4、那么大雄作为废柴应该想哪个方向成长呢？ 完全可以做现在最流行的“躺平界”爱豆。
电影好看，就是好看在不是乱造梦，其中有很多引人共鸣的东西，这才是审美体验的核心之一。 （躺平的艺术） 躺平是需要很多勇气的，要承受他人白眼，要接受物质上不完满，被喷了也只能笑笑，要忍受孤独。人生就是个有得有失的过程啊。野比大雄这个人设最适合的成长方向是积极和自己的各种欲望搏斗，最后接纳了自己就是这样的，勇敢躺平。大雄本可在这个大家都想躺平的时代再做爱豆，让制作组搞成纯屌丝了，毁了…… 这样写哆啦A梦系列，只是因为爱这个ip。
与自我充分达成和解的幸福生活来之不易，所以才需要珍惜。
就这样轻易给了毫无担当的大雄，未免太过儿戏。 —————针对一些争议的补充— 补充一下我对长篇漫画的理解吧。很多国民度高的漫画连载周期十好几年乃至好几十年，中间编不出来啊、编辑压力啊、读者票选啊、时代变迁啊还有作者成长等等，能像荒木飞吕彦和井上雄彦乃至老贼那样对作品坚持控制力、不烂尾的人是很少的。《伴我同行》这里面确实大量是原著里有的（我原文里也写了），不过哆啦A梦系列有今天的地位不是因为它讲“屌丝啥都有”，而是对科技、文明等等的反思还有陪伴童年的哆啦A梦。 如果按照《伴我同行》的改编思路，套到其他作品上，就类似：1、认为《名侦探柯南》是一部纯粹的柯学作品，专门把牛顿气活，主角上天入地无所不能——而忽视了作品本身积累下庞大读者群的本源：连载过程中许多精彩的推理剧集和早期的人物设定。2、认为《龙珠》走红是因为专门把宇宙搞得灰飞烟灭，各方互相PK数值… 《伴我同行》已经叫了stand by me，甚至预告片里也曾经用过这首感人的曲子（stand by me音乐后面有很多故事，一听就想哭啊）。这个思路下写剧本是很容易的，类型很成熟——原作里有很多大雄体贴小伙伴、成年大雄考上公务员等情节，但制作方就是不选。明明可以做的思路，我随便想几种，都可以从原作里找到对应故事： a大雄嘲笑胖妹，后来成长以后不这么想了，也为她漫画家的才华感到厉害
b大雄用印随蛋（类似迷情剂）想用作弊的方法让静香爱上自己，被静香讨厌了，后来大雄发奋努力，虽然在其他方面失败了，但他发奋努力对静香好，原著中有不少单元剧是讲大雄很暖，对其他人很温柔哦
c成年大雄勇敢开公司，经营不善还被税务部门刁难，这不比成年大雄被小孩欺负得泣不成声合理多了…… 如此种种，不一而足，都很好想，也能保留奶奶的片段。 童年回忆童年回忆，谁想看见童年的小伙伴成为彻底的five还挺得意的啊？？？？？明明是哆啦A梦的日常故事让我们明白了为什么要节制欲望、不要依赖、重视友情，做个平凡但勇敢的人啊！",510.0,119.0,344
1,1,34913671,哆啦A梦：伴我同行2,22e2ebc6f3887e2a1c41ce4e7d97156e,84828de7da1116f06c481c9b5e0cb911,4.0,2021-05-28 19:15:20,没有任何准备地去看《哆啦A梦：伴我同行2》，结果一上来就被烧脑到：频繁的时光机之旅，交织的时间线，奇妙的灵魂互换，加上“反祖父悖论”，可以说是我看过叙事上最多设计的一部哆啦A梦了。然而随着剧情的不断推进，情感上涌，亲情攻势开始如浪潮一般袭来，令人猝不及防。最终当野比大雄在婚礼上发表那番感言之时，才赫然发现眼镜被一层湿湿的东西弄花了。这次的罪魁祸首不是口罩漏气，而是怎么努力也摒不住的眼泪。  作为全新的3DCG动画电影系列，《伴我同行》也在6年后迎来了第二部。主创阵容基本沿用了原班人马，导演依然为八木龙一和山崎贵的“双核配置”。八木龙一在CG动画领域颇有造诣，而山崎贵作为知名导演，其电影《镰仓物语》曾登陆过中国院线。在两部《伴我同行》中，山崎贵都担任了编剧角色。所以从制作团队的角度讲，电影完全延续了上一作的水准。  《伴我同行2》拥有一个引人入胜的开场：那是一个近乎教科书般的“未来世界”，幽蓝色的摩天大楼披着水银般的线条，像计算机编好的程序那样叠在一起，自动驾驶的汽车行驶在真空管状的马路上。胖虎开了超市，强夫仍是他的小跟班 ，大雄和静香明天就要结婚了。举办地在一座叫梅隆什么的酒店，整个建筑风格就像瑞典艺术家Simon Stalenhag在《环形物语》中的概念设计。  接下来的一系列叙事，正如开头第一段所言，线索比较复杂。“现代”的少年大雄不仅仅穿越到幼儿时代看奶奶，还穿越到未来假扮成年的自己。而未来的成年大雄，则偷偷驾驶着时光机来到了少年大雄的时代。  好在适应了叙事节奏之后，观众很快就会明白导演的意图。少年大雄是主线，他一出场就让人很无奈，又爱哭又爱闹，总是考零蛋，动不动就挨妈妈的骂；成年大雄是支线，他完全则是少年大雄的未来版，因为害怕无法给静香一个幸福的婚姻，当了落跑新郎。两个大雄在现代相遇，因为都嫌弃自己，索性交换了身体。他们在一段段奇幻的旅程中，体验到人生的种种酸甜苦辣，也开始审视各自平凡却仍然充满爱的命运。  亲情是永远的内在驱动力，尽管它的呈现方式各自不一。少年大雄穿越到奶奶身边，再次体会到被人疼爱的滋味。成年大雄和胖虎、强夫三人合力打败了小混混，他也收获了被认可的鼓励，感受到真切的友情。当两个大雄来到他们出生的那一天，听到爸爸妈妈那番望子成龙的对话时，都产生了一种既感动又难过的复杂情感。两个大雄终于意识到，尽管他们常常让爸爸妈妈失望，但父母对自己的爱却始终未曾改变过。  这或许就是亲情最最让人难以理解，却又如此真实存在的一面。东亚式亲情总是充满含蓄，父母都不愿大大方方地对子女说出自己的爱，有时甚至会用一种很拧巴的方式来传达感情。但在《伴我同行2》中，主创团队却用了一种很高明的方式来展示亲情，让观众在毫无防备中败下阵来，同时也让电影的整体格局得以升华。  这便是成年大雄在姗姗来迟的婚礼上，做出的那番朴实无华却又真挚感人的“演讲”。在目睹了自己出生的一幕后，他终于明白了此前一直嫌弃的名字——野比大雄的由来。他爱上这个名字，就像重新爱上自己那样。因为他终于明白，无论他变成一个怎样的大雄，他的人生永远被浓浓的爱意包围着。这其中有父母，有最爱自己的奶奶，也有始终在照顾自己的静香。爱让他成长，让他有勇气成为一个好男人，一个好丈夫，一个坦然接受自己是个普通人的普通人，一个有信心可以带给他人幸福的人。毫无疑问，这就是属于任何一个普通人的“爱情宣言”。  你嫌弃过自己的名字吗？你曾经因为父母的一句无心批评而孤枕难眠吗？你还记得那个在寒夜里为你悄悄盖上一层棉被的奶奶吗？看完《哆啦A梦：伴我同行2》，走出电影院时却沉浸在过去的点点滴滴中很久很久。我们的世界中没有哆啦A梦，没有竹蜻蜓、任意门和时光机，但我们依然可以成为一名主宰自己命运的超级英雄。爱是这个世界上最稀缺的一样东西，也是很容易从你手边轻轻滑落的一样东西。十万两真金白银难买一次幸福的微笑，但有时你若无其事地弯一下腰，便会发现整个宇宙如星辰般散落在地板上。,116.0,6.0,20
2,2,34913671,哆啦A梦：伴我同行2,34a84e28123e916cdafe21bf3ae02a84,70e7b9f8027ec3d12420e272dddeea9e,4.0,2021-04-30 19:31:26,提到“竹蜻蜓”你会想到什么？是上手玩过的实体玩具，还是屏幕里见过的虚拟飞行器？ 作为飞行器的竹蜻蜓带着哆啦A梦飞越了半个世纪，而作为传统玩具的竹蜻蜓，却已随着一代人甚至几代人的童年一起消失了。藤子·F·不二雄先生从自己的童年经历深处汲取灵感，将遥远而真实的梦延长到其它热爱幻想之人的童年里，使竹蜻蜓成为了无数人的童年象征，它代表了怀旧，也预示着冒险。 生长于信息爆炸的时代，成长对这一代人来说，是一个发现流逝之事比握住之物多得多的过程。传统家庭、旧日玩伴、初恋爱情、二维动画、简单童心，这些事物脆弱易逝，却也弥足珍贵。藤子·F·不二雄先生的成长环境与当今世代千差万别，他经营一生的哆啦A梦也从面向儿童的童趣作品转变成大人心中永恒童年的纪念品。《伴我同行》系列正是面对这种转变的回应，试图在代际交替的观众中寻找更大的公约数。标题中的“伴”，既是展望和新观众的相伴，也是回望与老观众的羁绊。它明显有别于根据大长篇漫画改编的传统哆啦A梦剧场版，剧场版经常从一个小冒险的失控开始不可思议的大冒险，落入异世界，发现大阴谋，拯救全地球，主题常常带着深沉的忧思。而《伴我同行》系列却是试图找回初心，回到第一次在电视机前见到竹蜻蜓的小小新鲜感，3D CG的画面又让所有观众的感官，都重新来到与哆啦A梦相识的新起点。这是一个真正的全年龄向作品，不只适配孩子的单纯，更唤回了成人的童心。 《伴我同行1》是一张哆啦A梦的精选集，竹蜻蜓、任意门、时光机、时光包袱、四次元口袋等经典道具通过3D CG的画面走马灯般纷至沓来，剧情加速浓缩了“伴”的内容，让新旧观众都在这个精选的主题公园中完整体会哆啦A梦陪伴大雄成长的美好瞬间。而《伴我同行2》则怀着更丰富的感情，它更像是我们人生的精选集。表面上是一次复杂时空穿越大冒险，内核却是一场爱的发声练习。 影片有两条主线，一条是成年大雄的逃婚，一条是童年大雄怀念奶奶。开场从成年大雄结婚前单身派对结束的落寞开始，成年大雄迷茫胆小幼稚，面对人生的下个阶段显得毫无信心。他下意识选择了做落跑新郎。然后是另一条主线是童年大雄思念去世的奶奶，穿越回去见奶奶时，奶奶告诉他自己的愿望是看到大雄的婚礼。童年大雄来到婚礼，新郎落跑，一个小孩子又无法替代新郎去致辞。于是两条主线合流了，童年大雄出发寻找成年大雄。 童年的自己寻找成年的自己，这是颇为有趣的事情。草东没有派对的《山海》开头的歌词：“我看着天真的我自己，出现在没有我的故事里，等待着我的回应，一个为何至此的原因。”这一次，成年大雄与童年大雄站在了一起踏上了寻找自己的旅行，目的地是他们共同的出生。他们在那个一切开始的时间点，发现大雄这个普普通通的名字背后饱含了父母的期许，但在沉重的期许背后，是父母最真实的愿望：希望他能成为一个快乐的平凡人。于是最后一切回到婚礼——成年大雄的婚礼致辞，这也是大雄在经历了这场爱的发声练习后得到的回答：只要有爱与被爱，人生永远都不算坏。 电影中不断有两个不同时空大雄的对比，这样的镜面下，小观众会畅想自己的美好结局，大观众也会不自觉地对比着现在和过去的种种变化，或许也会唏嘘不曾拥有哆啦A梦和时光机。那些平凡的故事里没有大冒险、异世界、大阴谋，但是电影带我们穿越时空回到每个的大同小异也独一无二的剧情，里面有亲情、爱情、友情，真诚且真实，这张人生精选集不曾拯救地球，却能让“每天过的都一样”的人们，再次回想起那个“偶尔会突发奇想”的自己。,48.0,3.0,10
3,3,34913671,哆啦A梦：伴我同行2,74d61669085a4337f72e86bf1ee29c02,7fc0ac5100d193e37677d2011538e9a6,4.0,2021-06-01 23:13:36,（ 如果你小于18岁或者心理年龄小于18希望你能不要看这篇影评）      对于哆啦A梦这样长寿的动漫来说，在2D转向3D的时代大浪中也选择了融入，当哆啦A梦由平面变成立体，那还是原来那个藤子·F·不二雄创造出来的哆啦A梦吗？之前就有民间流传的哆啦A梦的一个结尾，在这个结尾中，大雄是一个植物人，而他的生活中也从来没有出现过哆啦A梦，哆啦A梦只是他在昏迷的弥留之际臆想出来的一个根本不存在的人物，就好像有一天突然有人告诉你，龙猫其实是死神一样，这个解释看似让人难以接受，但实际上仔细想想，我们看过的的动漫越是热闹繁华，不也越让人担心背后若隐若现的落寞沉寂吗。          《伴我同行2》还是选择了在“时间”维度上做文章，多数动漫为了避免剧作硬伤，都刻意逃避了时间维度，像哆啦A梦将时间逻辑缜密至此的动漫少之又少，也是正因为此，赋予了哆啦A梦的“时光机”以特殊的符号记忆。说实在，看到大雄逃婚真的出乎意料。在大多数动漫还停留在热血复仇，打怪升级的阶段，哆啦A梦的思考已经进入了个体与社会的层面。大雄之所以成为主角就是因为在每个人心中，多少都会在这个笨笨的，总挨打的男孩身上找到一些自己的影子，大雄就是我们身上的痛点，其中就包括自卑，恐惧，逃避。因此出现了大雄“逃婚”的桥段，哆啦A梦和少年的大雄想要让死去的奶奶看到自己结婚的样子，因此回去补救婚礼，构成了影片的叙事动力。        从情感层面，大雄有哆啦A梦，我们又有什么呢？那个蓝色的大狸猫，带给我们的难道仅仅是一件件帮我们解决问题的道具吗？在给孩子构筑一个蓝色幻梦的同时，不二雄也用漫画让我们深刻地认识到，在我们考试答零蛋的时候，不会有人给我们准备记忆面包，在我们将来活得一塌糊涂的时候，不会有时光机带我们回到小时候重新来过，在我们因为不敢承担责任而逃婚的时候，不会有人替我们上场给新娘戴上戒指。在影片中，提到了未来纸币上印着的“手冢治虫”——日本动画之父，《铁臂阿童木》的作者，要知道，铁臂阿童木的出现，最初是源于丧子之痛，是常人不能承受之痛。从这时候开始，有意或者无意地，给日本动画罩上一层难以消散的浓雾。        如果说喜剧都有一个悲剧的内核，那么，给儿童观看的动画有一个成人也思考不通的问题似乎也显得合理了。近些年，动画片似乎也在叩击着孩子的心门，用最轻柔的口吻问着最残酷的问题：“你准备好长大了吗？你准备好面对最平庸的自己和最残忍的世界了吗？”,34.0,4.0,6
