,Unnamed: 0,电影id,电影名称,用户id,用户名,评分,评论日期,评论内容,有用数,没用数,回应数
8,8,34913671,哆啦A梦：伴我同行2,0aafef15fe22eb0a4a6a44bc7d0b778d,43f6619535e70d1709d9d1a5c486f703,5.0,2021-06-04 20:01:12,"要给爱的人幸福，在不知道自己行不行之前，成年的大雄在畏缩与逃避，等到，明白自己可以承担责任后，便不顾一切地要回去 ，那些躲避实际上是在犹豫，在害怕，在徘徊，如果只是静香觉得自己没有人照顾就活不下去，所以才嫁给自己，那静香岂不是太可怜了，给所有爱的人，幸福，这是一份责任，是一份义务，就像成年的大雄在最后的婚礼致辞上说的， “以前总对父母给自己起的名字表示不满，可是等到后来，知道了父母给自己取的名字的意义之后，明白了这名字背后父母殷切的期待，不免甚觉感动，自己的父亲、母亲、奶奶，还有岳父、岳母，一直以来对自己都是充满希望，他们也希望自己更加优秀，自己有信心和静香，组建起一个幸福美满的家庭，一个不输给自己父亲、母亲、岳父、岳母的家庭。”小时候的大雄、哆啦A梦、乘坐时光机过来的奶奶，都在婚礼现场中的一棵树后躲着偷偷地看 ，静香也明白，一开始跟自己举行婚礼仪式的不是成年时候的大雄，她等到成年时候的大雄落座之后，直接就这样说了，还问是不是哆啦A梦又帮了他，看到这里，我已然泪崩。

一场感动的婚礼，一个与奶奶之间的约定，一份关于名字背后父母深切的期望与关怀，一条交换身体的绳子及这条绳子引发的一系列骚动 ，构成了这么个感人至深的故事，这场婚礼虽然举行的不顺利，但前前后后，可以说是满满的泪点，电影中有好多经典的场面，大雄去看奶奶的时候，其实旁边还有放爷爷的照片 ，还有那个不倒翁 ，其实也是在致敬那部名篇《那天那时那个不倒翁》。

电影一开始的情节就设置了很多的悬念，大雄，因为今天是生日，兴冲冲地跑了回来，结果一到家就因为市场零分考卷被妈妈骂了，沮丧地来到房间，哆啦A梦让大雄不要在意，以后不考零分就行，大雄，顺手拉开桌子下面的抽屉，一抽屉都是零分考卷，让哆啦A梦异常无语，大雄想找哆啦A梦借用遗忘棒让妈妈忘了自己零分试卷这事，哆啦A梦没有同意，哆啦A梦用超重力油漆把天花板变得和地板一样，在整理道具，大雄随手拿起了一件，哆啦A梦说这个道具不能乱动，这是遗忘棒，未来百货公司送了新的体验道具过来，这是一根可以交换身体的绳子，哆啦A梦与大雄在不知情的情况下试了一下，然后很快就换了回来，大雄突然晕倒了，然后又醒过来，然后就说要赶快，不然来不及，哆啦A梦还没反应过来，大雄就坐时光机跑了，不一会儿大雄又跑回来说不记得自己去干什么了，可是这个时候妈妈上楼来了，然后另一个哆啦A梦又穿着隐身斗篷走了进来，顺手拿起地上的寻人手杖，然后又跑到时光机那，走了，当时我就没有搞懂这剧情是怎么回事，虽然也明白这是在设置悬念，但依旧百思不得其，幸而后来全部都给解释了，这个设置，我就觉得很厉害。

我感觉整个故事特别感人，从头看到尾，泪腺崩坏，成年人的大雄不敢去参加婚礼，不就是因为怕不能给静香带来幸福吗 ，还是孩子的大雄，因为看到了小时候奶奶给自己的玩具小熊，触发了对奶奶的思念，从而和哆啦A梦乘坐时光机去看以前还活着的奶奶，尽管受到了那个时候还年轻的母亲还有幼年大雄的误会，但是奶奶相信大雄，奶奶说自己想看到，大雄上学背着书包的样子，他就坐时光机回到以前去背的书包，再去见奶奶，然后奶奶又说她想看到大雄结婚时的样子，大雄想带奶奶坐时光机过去，哆啦A梦觉得这样略有不妥，大雄提出让奶奶用时光电视机看，哆啦A梦同意了，但是婚礼现场似乎出现了问题，身为新郎的成年大雄不见了，小时候的大雄与哆啦A梦发现到了问题严重，奶奶也问大雄，是不是出了什么差错，大雄表示一定会让奶奶看到婚礼现场，这是他和奶奶的约定与承诺，后面，哆啦A梦与大雄前往未来婚礼现场，因为成年时候的大雄一直没有出现，成年的胖虎和小夫很着急，大雄的父亲，母亲，岳父，岳母也是焦虑万分，静香更是担心大雄会出什么事，不过岳父表示看了新闻，附近没发生什么事故，眼看所有的人都越来越等不住，婚礼策划也在催促 ，哆啦A梦让小时候的大雄上，小时候的大雄代替成年时候的大雄与静香参加婚礼，可是却在婚礼致辞上卡壳，小时候的大雄，觉得还是要去找回成年时候的大雄，他与哆啦A梦匆匆忙忙下了电梯去往时光机停放处，因为太过匆忙，都没有注意到与自己擦肩而过的人，找成年人大雄无果，哆啦A梦想到了寻人手杖，不过因为来的时候在整理道具，再加上大雄过于着急，寻人手杖没有带出来，只能坐时光机回去拿，大雄怕耽误时间，哆啦A梦给他解释了一番时光机的原理，表示坐时光机去再回来，只要回到他们现在的时间点五分钟之后就可以了，二人赶忙去之前停时光机的地方，结果惊讶地发现，时光机不见了，哆啦A梦想了起来，他们把时光机停在厕所，然后从厕所匆匆赶往婚礼现场时，他们身后的一扇厕所门打开，出现了一个人影，此人应该就是成年时候的大雄，成年时候的大雄坐着小时候的大雄带来的时光机，去了小时候的那个时代，小时候的大雄，会为了成年时候的大雄的婚礼如此操心，一方面是因为与奶奶之间的承诺，另一方面也是因为对静香深沉地爱，他在为了这个约定，以及这份爱而拼命的努力着。

最后我听到片尾曲的时候，我的头一直是在向上仰着，因为我不仰着，我的眼泪就一直在往下淌，到后面成年的大雄做那个婚礼致辞，然后奶奶还有年轻的大雄在后面看着的时候 ，我真的，我真的好感动，从一开始大雄见到奶奶的时候，我就开始哭了 ，到中间小时候的大雄代替后来的大雄去参加婚礼的时候有点想笑，但是再到后来他们碰上时光机被拿走，回不去 了，还有交换身体的绳子的危机的时候 ，又为他们捏了一把汗，到后面他们，知道了交换身体的绳子有问题，大雄在三个小混混，初中生面前独立保护静香时候的场面 ，又让人非常感动，不过，大雄，还真的就是大雄，不管是成年时候还是小时候，运动神经都不发达，还能惹事，小时候的大雄直到成年后的大雄来到他们那个世界以后，由于没有时光机，他们也回不去，哆啦A梦用还童机把大雄灵魂送到了他和大雄出发的时候，大雄的灵魂进入了还没有出发的身体之前，导致那个时候的自己晕倒，但是大雄灵魂很快就把曾经的自己的身体唤了起来，然后坐上时光机去拯救被困在未来的自己跟哆啦A梦了，没有了灵魂的大雄躯壳，还被未来的老人怀疑，还好，哆啦A梦用这个孩子翻着白眼睡觉搪塞了过去，哆啦A梦让大雄灵魂回到了自己本来的身体中，以前的大雄因为突然来到未来，而不知所措，不明白发生了什么，问东问西，哆啦A梦觉得解释起来太麻烦，就用遗忘棒，让过去的大雄把这发生的事情给忘了，所以过去的大雄坐着时光机回去后，完全记不得发生了什么，妈妈上楼，那时候的哆啦A梦与大雄慌乱之时，哆啦A梦穿着隐身斗篷悄悄拿走了寻人手杖，回到时光机上，哆啦A梦用寻人手杖那么一转，发现成年的大雄也在这个时代，这样的话一切就说的通了，成年的大雄没有考虑好自己能不能承担责任，躲到了厕所，小时候的大雄与哆啦A梦刚好乘坐时光机也落在旁边的厕所，成年的大雄就用他们的时光机躲到了这个时代。

在空地水泥管上找到了成年的大雄，哆啦A梦让他回去，成年的大雄表示如果静香只是觉得自己没有照顾活不下去，才嫁给自己，那静香会不幸福，哆啦A梦用时光电视机给成年的大雄看，静香在他失踪后等他的场景，成年的大雄表示，让静香再等一段时间，她就会忘了自己，哆啦A梦问那你要不要继续往下看，成年的大雄表示不用，说自己不想看到静香跟别的男人结婚生子的幸福场面，哆啦A梦想到了用身体交换绳，跟现在的大雄交换身体，重新体验这个年纪的一些东西，再去思考，能不能回去跟静香结婚，成年的大雄跟小时候的大雄，交换完成身体以后，就跑去跟胖虎小夫打棒球了，不过，成年的大雄也只是大雄摆了，运动神经不发达，胖虎队把把零分，胖虎气的火冒三丈，成年的大雄还像个没事人一样，胖虎、小夫追着成年的大雄就打，另一边，未来百货公司的店员找到哆啦A梦还有小时候的大雄（现在用的是成年的大雄身体），一开始还遮遮掩掩，后来知道他们用了以后，表示这个身体交换绳有质量问题，只要身体交换超过一个小时就会失忆，听到这一点，小时候的大雄慌了，如果失忆了，成年的大雄，就永远不可能跟静香结婚了，小时候的大雄赶忙与哆啦A梦用竹蜻蜓去找成年时候的大雄，成年的大雄在躲开胖虎的攻击后，撞到了三个初中小混混，成年的大雄还以为自己有大人身体，肆无忌惮，挑衅三个小混混，后来才反应过来自己是孩童时的身体，三个小混混领头大哥要大雄赔偿，成年的大雄掏出未来的纸币（上面印的是手冢治虫）给他们，被他们以为是假钞，小混混要打成年的大雄，成年的大雄抓着旁边一辆摩托车，还以为是未来的自动款，可以语言控制，喊了半天摩托车不动，慌乱之中成年的大雄启动了开关，三个小混混在后面穷追不舍，成年的大雄开着摩托车，后面三个小混混在追，此情此景被静香看到，成年的大雄技术不行，最终落地，在一个河边，三个小混混追到，成年的大雄与他们纠缠，身体交换绳，时间要到，飞在天空中的小时候的大雄也感觉身体不适，成年的大雄也感觉不行了，关键时刻静香跑出来保护成年的大雄，成年的大雄看到静香要被欺负，鼓起勇气站出来保护她，快失去意识的身体还给三个小混混来了一套“形意拳”，关键时刻，胖虎小夫站了出来，他们说的一句话让人很感动，“你们没有资格打大雄，只有我们有。”一番混战，双方挂彩，三个小混混逃走，成年的大雄因为失去意识倒地，小时候的大雄，也因为撑不住倒了，哆啦A梦终于想起来用任意门，第一次因为描述不清失败，第二次终于成功找到了成年的大雄，但是绳子一开始已不能交换，哆啦A梦用泪水唤醒了两个大雄的记忆，一切终于化险为夷，成年的大雄也意识到了自己可以保护静香。

在回到婚礼现场之前，成年的大雄与小时候的大雄，都想看看自己出生时的场面，想知道父母为什么给自己取这个名字，哆啦A梦带他们用时光机回到了那天，父亲慌慌张张回到家，遇到了成年的大雄和小时候的大雄，在家中找了一圈没见到妻子孩子，两个大雄提醒他说，应该在医院，父亲赶了过去，两个大雄尾随而至，见到出身的自己，发现并不漂亮，说很丑，父亲很生气，父亲说给孩子取名叫大雄吧，希望孩子可以茁壮成长，以后做一个对社会有用之人， 父母对孩子的未来做了一系列展望，两个大雄在门外说，希望父亲，不要对这个孩子有过高的期望，再一次激怒父亲，两个大雄就这样被父亲赶出医院，知道名字的由来以后，成年的大雄回到了婚礼现场，就在这个时候，小时候的大雄才知道他们下电梯的时候跟他们擦肩而过的，就是被找回来的、成年时候的大雄，婚礼现场，那只从小时候就一直陪伴大雄的小熊，也在旁边，举着牌子。

奶奶相信了大雄，而且一直相信着，最后大雄也没让奶奶失望，大雄最终带着奶奶看到了自己的婚礼现场，看到这里，我不禁感慨良久，谁爱大雄最久、最永恒，甚至超出了生死的界限，那只有一个人，奶奶，这个感情，我感觉超越了时空，超越了生命，这实打实的感情线 ，让我的眼泪止不住地流淌。
“Well, I guess I'm not that good anymore，
But baby, that's just me，
And I will love you, baby ~ Always，
And I'll be there forever and a day ~ Always，
I'll be there till the stars don't shine，
Till the heavens burst and，
The words don't rhyme，
And I know when I die, you'll be on my mind，
And I'll love you Always.”
“我会守着你，直到海枯石烂，直到永远，我会陪着你，直到星辰消逝，直到天堂毁灭，直到言语悄然，至死你都会萦绕在我脑海，我会爱你，直到永远。”大雄奶奶对大雄那份深挚的爱，或许就是如此吧。

我又想到了那一段 ，就是少年时候的大雄装成年时候的大雄跟静香结婚 ，中途要说致辞，大雄什么也说不上来，然后大雄就跑了，去跟哆啦A梦找那个真正的成年的大雄，这个时候胖虎就上来唱歌救场，那个时候我真的是，哭着哭着，突然笑了，再来就是大雄失踪，静香在等他，然后大雄说自己不回去，再过段时间静香就会找个别的男人嫁了，哆啦A梦说，要不你在往后看看，然后大雄说自己不看了，大雄说自己不想看到静香跟别的男人在一起结婚生子，这叫什么，人世间最极致的爱或许也就不过如此，我想起了徐志摩的那首诗《两地相思》“我怕，我爱，这来我真是难，恨不能往地底钻；可是你，爱，永远有我的心，听凭我是浮是沉。”我怕，我爱，这来我真是难，可是你永远有爱我的心，陪我走过人生的浮浮沉沉。

“Don't hang your head in sorrow，
And please don't cry，
I know how you feel inside，
I've been there before.”

“我一生都会陪伴在你身边，
所以也请你一生伴我同行，
竭尽全力 一生都不要分开，
不要解开紧紧相连的羁绊，
不要放开紧紧相握的双手，
妈妈的温柔和爸爸的爱哭，
好像是我们的样子。”

完。",5.0,1.0,3
9,9,34913671,哆啦A梦：伴我同行2,cdc600a69b6a03b034e0de3a7339b219,80818d037dbc205a288b011f6e7b4b78,4.0,2021-05-30 13:45:53,机器猫应该是我看过最多的漫画，没错，我习惯称之为机器猫。 说几点动人之处： 1、机器猫一直陪伴在大雄身边，不管大雄有多少的缺点。就像朋友亲人，但我觉得更像是那个了不起的自己，一直没有放弃的自己 2、静香对大雄的爱是发自内心的，他看到大雄身上的闪光点，即使大雄有那么多那么多的缺点，从小就不止一次的对大雄说，做自己就很好，不需要扮演另一个样子 3、奶奶对大雄是无条件的信任，即使在认出大雄之前，我想这也是大雄如此怀念奶奶的原因，我们都会感恩与怀念那些对我门无条件信任的人吧 4、父母的爱总是带着期许，虽然我们大多数没有活成父母期待的样子（我们也无需活成别人期待的样子，包括父母，活成自己想成为的样子就好），但他们是以自己认为好的方式爱着我们，我们应该理解与感恩 5、朋友的情谊，儿时的玩伴能一直联系到现在就很难能可贵，又有多少个人陪你一起经历大部分时间的成长直到现在呢？ 大雄就是我们大多数人，没有世俗里的成功，没有成为别人期望的优秀的样子，一直觉得因为不够优秀所以不值得别人对自己好，不值得被爱，不值得拥有喜欢的人乃至美满的家庭。 然，优秀永远不是被爱的必要条件，你出现在我的生命里，不管是亲人的身份还是朋友的身份，甚至是爱人的身份，或者仅仅是路人擦肩而过的缘分，都值得我的爱与付出，这是每个生命存在的意义。 也因为你的出现，我的爱和付出有了意义，也让我的生命本身有了意义，所以我这个定义，才有意义。,31.0,3.0,6
