,Unnamed: 0,电影id,电影名称,用户id,用户名,评分,评论日期,评论内容,有用数,没用数,回应数
18,18,34913671,哆啦A梦：伴我同行2,0aafef15fe22eb0a4a6a44bc7d0b778d,43f6619535e70d1709d9d1a5c486f703,5.0,2021-06-05 08:18:19,"要给爱的人幸福，在不知道自己行不行之前，成年的大雄在畏缩与逃避，等到，明白自己可以承担责任后，便不顾一切地要回去 ，那些躲避实际上是在犹豫，在害怕，在徘徊，如果只是静香觉得自己没有人照顾就活不下去，所以才嫁给自己，那静香岂不是太可怜了，给所有爱的人，幸福，这是一份责任，是一份义务，就像成年的大雄在最后的婚礼致辞上说的， “以前总对父母给自己起的名字表示不满，可是等到后来，知道了父母给自己取的名字的意义之后，明白了这名字背后父母殷切的期待，不免甚觉感动，自己的父亲、母亲、奶奶，还有岳父、岳母，一直以来对自己都是充满希望，他们也希望自己更加优秀，自己有信心和静香，组建起一个幸福美满的家庭，一个不输给自己父亲、母亲、岳父、岳母的家庭。”小时候的大雄、哆啦A梦、乘坐时光机过来的奶奶，都在婚礼现场中的一棵树后躲着偷偷地看 ，静香也明白，一开始跟自己举行婚礼仪式的不是成年时候的大雄，她等到成年时候的大雄落座之后，直接就这样说了，还问是不是哆啦A梦又帮了他，看到这里，我已然泪崩。

一场感动的婚礼，一个与奶奶之间的约定，一份关于名字背后父母深切的期望与关怀，一条交换身体的绳子及这条绳子引发的一系列骚动 ，构成了这么个感人至深的故事，这场婚礼虽然举行的不顺利，但前前后后，可以说是满满的泪点，电影中有好多经典的场面，大雄去看奶奶的时候，其实旁边还有放爷爷的照片 ，还有那个不倒翁 ，其实也是在致敬那部名篇《那天那时那个不倒翁》。

电影一开始的情节就设置了很多的悬念，大雄，因为今天是生日，兴冲冲地跑了回来，结果一到家就因为市场零分考卷被妈妈骂了，沮丧地来到房间，哆啦A梦让大雄不要在意，以后不考零分就行，大雄，顺手拉开桌子下面的抽屉，一抽屉都是零分考卷，让哆啦A梦异常无语，大雄想找哆啦A梦借用遗忘棒让妈妈忘了自己零分试卷这事，哆啦A梦没有同意，哆啦A梦用超重力油漆把天花板变得和地板一样，在整理道具，大雄随手拿起了一件，哆啦A梦说这个道具不能乱动，这是遗忘棒，未来百货公司送了新的体验道具过来，这是一根可以交换身体的绳子，哆啦A梦与大雄在不知情的情况下试了一下，然后很快就换了回来，大雄突然晕倒了，然后又醒过来，然后就说要赶快，不然来不及，哆啦A梦还没反应过来，大雄就坐时光机跑了，不一会儿大雄又跑回来说不记得自己去干什么了，可是这个时候妈妈上楼来了，然后另一个哆啦A梦又穿着隐身斗篷走了进来，顺手拿起地上的寻人手杖，然后又跑到时光机那，走了，当时我就没有搞懂这剧情是怎么回事，虽然也明白这是在设置悬念，但依旧百思不得其，幸而后来全部都给解释了，这个设置，我就觉得很厉害。

我感觉整个故事特别感人，从头看到尾，泪腺崩坏，成年人的大雄不敢去参加婚礼，不就是因为怕不能给静香带来幸福吗 ，还是孩子的大雄，因为看到了小时候奶奶给自己的玩具小熊，触发了对奶奶的思念，从而和哆啦A梦乘坐时光机去看以前还活着的奶奶，尽管受到了那个时候还年轻的母亲还有幼年大雄的误会，但是奶奶相信大雄，奶奶说自己想看到，大雄上学背着书包的样子，他就坐时光机回到以前去背的书包，再去见奶奶，然后奶奶又说她想看到大雄结婚时的样子，大雄想带奶奶坐时光机过去，哆啦A梦觉得这样略有不妥，大雄提出让奶奶用时光电视机看，哆啦A梦同意了，但是婚礼现场似乎出现了问题，身为新郎的成年大雄不见了，小时候的大雄与哆啦A梦发现到了问题严重，奶奶也问大雄，是不是出了什么差错，大雄表示一定会让奶奶看到婚礼现场，这是他和奶奶的约定与承诺，后面，哆啦A梦与大雄前往未来婚礼现场，因为成年时候的大雄一直没有出现，成年的胖虎和小夫很着急，大雄的父亲，母亲，岳父，岳母也是焦虑万分，静香更是担心大雄会出什么事，不过岳父表示看了新闻，附近没发生什么事故，眼看所有的人都越来越等不住，婚礼策划也在催促 ，哆啦A梦让小时候的大雄上，小时候的大雄代替成年时候的大雄与静香参加婚礼，可是却在婚礼致辞上卡壳，小时候的大雄，觉得还是要去找回成年时候的大雄，他与哆啦A梦匆匆忙忙下了电梯去往时光机停放处，因为太过匆忙，都没有注意到与自己擦肩而过的人，找成年人大雄无果，哆啦A梦想到了寻人手杖，不过因为来的时候在整理道具，再加上大雄过于着急，寻人手杖没有带出来，只能坐时光机回去拿，大雄怕耽误时间，哆啦A梦给他解释了一番时光机的原理，表示坐时光机去再回来，只要回到他们现在的时间点五分钟之后就可以了，二人赶忙去之前停时光机的地方，结果惊讶地发现，时光机不见了，哆啦A梦想了起来，他们把时光机停在厕所，然后从厕所匆匆赶往婚礼现场时，他们身后的一扇厕所门打开，出现了一个人影，此人应该就是成年时候的大雄，成年时候的大雄坐着小时候的大雄带来的时光机，去了小时候的那个时代，小时候的大雄，会为了成年时候的大雄的婚礼如此操心，一方面是因为与奶奶之间的承诺，另一方面也是因为对静香深沉地爱，他在为了这个约定，以及这份爱而拼命的努力着。

最后我听到片尾曲的时候，我的头一直是在向上仰着，因为我不仰着，我的眼泪就一直在往下淌，到后面成年的大雄做那个婚礼致辞，然后奶奶还有年轻的大雄在后面看着的时候 ，我真的，我真的好感动，从一开始大雄见到奶奶的时候，我就开始哭了 ，到中间小时候的大雄代替后来的大雄去参加婚礼的时候有点想笑，但是再到后来他们碰上时光机被拿走，回不去 了，还有交换身体的绳子的危机的时候 ，又为他们捏了一把汗，到后面他们，知道了交换身体的绳子有问题，大雄在三个小混混，初中生面前独立保护静香时候的场面 ，又让人非常感动，不过，大雄，还真的就是大雄，不管是成年时候还是小时候，运动神经都不发达，还能惹事，小时候的大雄直到成年后的大雄来到他们那个世界以后，由于没有时光机，他们也回不去，哆啦A梦用还童机把大雄灵魂送到了他和大雄出发的时候，大雄的灵魂进入了还没有出发的身体之前，导致那个时候的自己晕倒，但是大雄灵魂很快就把曾经的自己的身体唤了起来，然后坐上时光机去拯救被困在未来的自己跟哆啦A梦了，没有了灵魂的大雄躯壳，还被未来的老人怀疑，还好，哆啦A梦用这个孩子翻着白眼睡觉搪塞了过去，哆啦A梦让大雄灵魂回到了自己本来的身体中，以前的大雄因为突然来到未来，而不知所措，不明白发生了什么，问东问西，哆啦A梦觉得解释起来太麻烦，就用遗忘棒，让过去的大雄把这发生的事情给忘了，所以过去的大雄坐着时光机回去后，完全记不得发生了什么，妈妈上楼，那时候的哆啦A梦与大雄慌乱之时，哆啦A梦穿着隐身斗篷悄悄拿走了寻人手杖，回到时光机上，哆啦A梦用寻人手杖那么一转，发现成年的大雄也在这个时代，这样的话一切就说的通了，成年的大雄没有考虑好自己能不能承担责任，躲到了厕所，小时候的大雄与哆啦A梦刚好乘坐时光机也落在旁边的厕所，成年的大雄就用他们的时光机躲到了这个时代。

在空地水泥管上找到了成年的大雄，哆啦A梦让他回去，成年的大雄表示如果静香只是觉得自己没有照顾活不下去，才嫁给自己，那静香会不幸福，哆啦A梦用时光电视机给成年的大雄看，静香在他失踪后等他的场景，成年的大雄表示，让静香再等一段时间，她就会忘了自己，哆啦A梦问那你要不要继续往下看，成年的大雄表示不用，说自己不想看到静香跟别的男人结婚生子的幸福场面，哆啦A梦想到了用身体交换绳，跟现在的大雄交换身体，重新体验这个年纪的一些东西，再去思考，能不能回去跟静香结婚，成年的大雄跟小时候的大雄，交换完成身体以后，就跑去跟胖虎小夫打棒球了，不过，成年的大雄也只是大雄摆了，运动神经不发达，胖虎队把把零分，胖虎气的火冒三丈，成年的大雄还像个没事人一样，胖虎、小夫追着成年的大雄就打，另一边，未来百货公司的店员找到哆啦A梦还有小时候的大雄（现在用的是成年的大雄身体），一开始还遮遮掩掩，后来知道他们用了以后，表示这个身体交换绳有质量问题，只要身体交换超过一个小时就会失忆，听到这一点，小时候的大雄慌了，如果失忆了，成年的大雄，就永远不可能跟静香结婚了，小时候的大雄赶忙与哆啦A梦用竹蜻蜓去找成年时候的大雄，成年的大雄在躲开胖虎的攻击后，撞到了三个初中小混混，成年的大雄还以为自己有大人身体，肆无忌惮，挑衅三个小混混，后来才反应过来自己是孩童时的身体，三个小混混领头大哥要大雄赔偿，成年的大雄掏出未来的纸币（上面印的是手冢治虫）给他们，被他们以为是假钞，小混混要打成年的大雄，成年的大雄抓着旁边一辆摩托车，还以为是未来的自动款，可以语言控制，喊了半天摩托车不动，慌乱之中成年的大雄启动了开关，三个小混混在后面穷追不舍，成年的大雄开着摩托车，后面三个小混混在追，此情此景被静香看到，成年的大雄技术不行，最终落地，在一个河边，三个小混混追到，成年的大雄与他们纠缠，身体交换绳，时间要到，飞在天空中的小时候的大雄也感觉身体不适，成年的大雄也感觉不行了，关键时刻静香跑出来保护成年的大雄，成年的大雄看到静香要被欺负，鼓起勇气站出来保护她，快失去意识的身体还给三个小混混来了一套“形意拳”，关键时刻，胖虎小夫站了出来，他们说的一句话让人很感动，“你们没有资格打大雄，只有我们有。”一番混战，双方挂彩，三个小混混逃走，成年的大雄因为失去意识倒地，小时候的大雄，也因为撑不住倒了，哆啦A梦终于想起来用任意门，第一次因为描述不清失败，第二次终于成功找到了成年的大雄，但是绳子一开始已不能交换，哆啦A梦用泪水唤醒了两个大雄的记忆，一切终于化险为夷，成年的大雄也意识到了自己可以保护静香。

在回到婚礼现场之前，成年的大雄与小时候的大雄，都想看看自己出生时的场面，想知道父母为什么给自己取这个名字，哆啦A梦带他们用时光机回到了那天，父亲慌慌张张回到家，遇到了成年的大雄和小时候的大雄，在家中找了一圈没见到妻子孩子，两个大雄提醒他说，应该在医院，父亲赶了过去，两个大雄尾随而至，见到出身的自己，发现并不漂亮，说很丑，父亲很生气，父亲说给孩子取名叫大雄吧，希望孩子可以茁壮成长，以后做一个对社会有用之人， 父母对孩子的未来做了一系列展望，两个大雄在门外说，希望父亲，不要对这个孩子有过高的期望，再一次激怒父亲，两个大雄就这样被父亲赶出医院，知道名字的由来以后，成年的大雄回到了婚礼现场，就在这个时候，小时候的大雄才知道他们下电梯的时候跟他们擦肩而过的，就是被找回来的、成年时候的大雄，婚礼现场，那只从小时候就一直陪伴大雄的小熊，也在旁边，举着牌子。

奶奶相信了大雄，而且一直相信着，最后大雄也没让奶奶失望，大雄最终带着奶奶看到了自己的婚礼现场，看到这里，我不禁感慨良久，谁爱大雄最久、最永恒，甚至超出了生死的界限，那只有一个人，奶奶，这个感情，我感觉超越了时空，超越了生命，这实打实的感情线 ，让我的眼泪止不住地流淌。
“Well, I guess I'm not that good anymore，
But baby, that's just me，
And I will love you, baby ~ Always，
And I'll be there forever and a day ~ Always，
I'll be there till the stars don't shine，
Till the heavens burst and，
The words don't rhyme，
And I know when I die, you'll be on my mind，
And I'll love you Always.”
“我会守着你，直到海枯石烂，直到永远，我会陪着你，直到星辰消逝，直到天堂毁灭，直到言语悄然，至死你都会萦绕在我脑海，我会爱你，直到永远。”大雄奶奶对大雄那份深挚的爱，或许就是如此吧。

我又想到了那一段 ，就是少年时候的大雄装成年时候的大雄跟静香结婚 ，中途要说致辞，大雄什么也说不上来，然后大雄就跑了，去跟哆啦a梦找那个真正的成年的大雄，这个时候胖虎就上来唱歌救场，那个时候我真的是，哭着哭着，突然笑了，再来就是大雄失踪，静香在等他，然后大雄说自己不回去，再过段时间静香就会找个别的男人嫁了，哆啦A梦说，要不你在往后看看，然后大雄说自己不看了，大雄说自己不想看到静香跟别的男人在一起结婚生子，这叫什么，人世间最极致的爱或许也就不过如此，我想起了徐志摩的那首诗《两地相思》“我怕，我爱，这来我真是难，恨不能往地底钻；可是你，爱，永远有我的心，听凭我是浮是沉。”我怕，我爱，这来我真是难，可是你永远有爱我的心，陪我走过人生的浮浮沉沉。

“Don't hang your head in sorrow，
And please don't cry，
I know how you feel inside，
I've been there before.”

“我一生都会陪伴在你身边，
所以也请你一生伴我同行，
竭尽全力 一生都不要分开，
不要解开紧紧相连的羁绊，
不要放开紧紧相握的双手，
妈妈的温柔和爸爸的爱哭，
好像是我们的样子。”

完。",3.0,1.0,0
19,19,34913671,哆啦A梦：伴我同行2,c89b233537067c830d087948de770228,e1c1d2f557b0bb5dcd1c89c27e8b4434,,2021-05-31 19:34:28,从《哆啦A梦：伴我同行1》上映的那年开始，每年的六一前后，我都不会忘记按时奔赴与哆啦A梦的一期一会。那是因为伴我同行1骗走了我好多眼泪，可惜之后的剧场版都差强人意，较为简单的冒险故事更适合小朋友观看，作为奔三的大人自然很难有什么共鸣。很幸运的是，今年的《哆啦A梦：伴我同行2》又让我找回了当年的感觉，作为一个在社会上摸爬滚打了多年的三十岁老阿姨，我居然一个人在电影院哭得稀里哗啦的，能感觉到自己日渐被岁月风化得硬邦邦的内心有被触动，变得湿润而柔软。 故事的主线还是比较简单的，大雄和哆啦A梦要完成的就是两个任务：一个是让大雄的奶奶看看大雄的新娘；另一个是帮助逃婚的成年大雄重拾信心去完成与静香的婚礼。而穿越元素和加入的新道具让剧情又曲折了不少，而且很多桥段都很有喜感。 我想这部剧场版最打动人的应该是大雄与去世的奶奶的重逢。与很多人的奶奶一样，相比于妈妈的严厉，大雄的奶奶总是慈祥而温和，不管大雄多么任性都不会生气，一直慈眉善目、笑眼弯弯。当大雄穿越回奶奶身边，奶奶的愿望就是看一看大雄背上书包读书的样子，看一看大雄未来的新娘。看到这里我不得不感叹，真是同一个世界，同一个奶奶。还记得，在我初中时，我的奶奶得了重病，她就说过多么希望能看着我上高中，可是很遗憾，她还是没能坚持到那一天。就像大雄的奶奶一样，我奶奶虽然腿脚不好但还是很乐意步履蹒跚地陪我去想去的店，也任由我在她一个端庄的人民教师头发上扎奇奇怪怪的小辫。后来，我的爷爷接过了奶奶的接力棒，担起了催婚的重任。五一去看爷爷，可能是怕给我太大压力，整整一顿饭的时间他都没提起这茬，最后把他送回养老院的路上，他终于憋不住了，把我叫到了身边，我用膝盖想也知道要问我找对象的事。 对于当下的年轻人而言，催婚一般都是让人压力山大又有点反感的事，为什么从爷爷奶奶口中说出来，我却没觉得反感呢？我想主要有两个原因。首先，祖辈的爱往往代表了真正无条件的爱。尤其是作为一个成年人，父母的爱往往带着要求、挑剔和枷锁，伴侣的爱也有可能带着索取、抱怨和权衡利弊。只有童年时祖辈的爱，是温暖、宽容、不求回报的。其次，祖辈的催婚一般不会以布置任务的形式出现，而是更接近于表达一个希望孩子幸福的愿望，只不过结婚是幸福的具象化罢了。所以，当奶奶在角落里看了一眼大雄的婚礼，心满意足地回去的那一幕，应该会打动很多观众吧。 相比于奶奶这条线，另一条大雄的逃婚线确实弱了很多。首先，大雄的人设就有点自相矛盾。按照剧本设定，成年大雄应该是一个能体会到他人痛苦、懂得怎么爱家人的人。然而这么一个人，居然因为怕给不了静香幸福而恐婚，选择在婚礼前临阵逃脱。当然，编剧也有给出一个说法，大雄因为可以穿越所以只要想明白了及时出席婚礼就行，但从大雄一次次看静香未来的生活状态等种种表现来看，这说法似乎缺乏说服力。大雄在逃婚期间的表现，完全可以用自卑、懦弱、缺乏担当来形容。其次，最后大雄因为什么想通了，又勇敢地出席了婚礼现场，也有点莫名其妙。就感觉电影的前半部分把成年大雄塑造成了一个不靠谱又不自信的渣男，但是后半部分又硬是把他拉高成了一个平凡但善解人意的好男人，而促成这个转折的过渡明显不够充分。 也许，用真实的成人世界的法则去衡量虚幻的童话世界，有点过于苛刻。从某种程度上说，童话的重要意义之一不就是满足我们普通人的幻想吗。哪怕像大雄这样不优秀、不聪明、又不勤奋的男生，在哆啦A梦的强力助攻下，只要保持善良和付出一点点的努力，也可以稀里糊涂地迎娶女神，登上人生巅峰。可能这样屌丝逆袭的故事能让更多人喜闻乐见吧。 如果不用成人的逻辑去深究，这部剧场版还是可以算得上是一部很好看又很好哭的影片。大雄娶到了静香，童话里的笨小孩也有春天，童话里的普通人不用很优秀也会有美好的结局。而现实中努力的我们，希望也能被命运温柔以待。,2.0,,9
20,20,34913671,哆啦A梦：伴我同行2,602a110cc49351338ea1bfabf62ee483,c853278d3da47781b45f64e7b512e003,3.0,2021-05-30 01:34:29,被预告片骗看完了这部戏，预告片几个月出来后我就很期待这部大作，毕竟几年前的第一部赚走了我不少眼泪，感情真挚，3D人物也很新鲜。 第一部刻画大雄和哆啦A梦的感情，最后大雄为了让哆啦A梦放心离开他，一个人跟胖虎他们打下去，很难不让人动容。这样的友情是双方一起付出的，正如第一部结尾处大雄岳父点题的话，虽然大雄毛病一大堆，但他有一个难能可贵的品质，善良，他能真切的感受到每一个人的难处。这也是我第一部中最喜欢的场景。 这部看到近三分之二处，我女朋友已然看不下去，别说她，我要不是知道结尾处前后应该肯定有一段高分戏码，如同第一部似的，我也看不下去了。因为，真的没有人会喜欢去一个懦夫的故事。 讲真，第一部的完整剧情，我不完全记得了。但明明未来大雄和现在大雄都有了挺大的成长，这一部为了故事能进行下去，两个男主角又故态复萌了，尤其是未来大雄，即使有时光机的bug道具，婚礼当天因为信心不足临时逃婚我应该只是勉强接受了，后来回到10岁大雄互换灵魂之后，只顾着玩耍完全不想正事，我是真的看不懂！懦弱，信心不足还有得救，不负责任是没有救的！ 10岁的大雄也一样，闹完了婚礼，也跟个没事人一样，因为紧张过度跑了，留下一大桌宾客，还有他一直说的他最爱的女人面对这个难堪的场景，我是很难想象这是种什么爱。虽然两个大雄都有时光机的道具，但如此儿戏，如此不负责任，这已经不是我能接受的常见主角身上一些无伤大雅的小缺点了。这些都是极大的缺点，到影响整部戏观感的程度。可能我跟周某人在一起久了，沾染了一点点女性思维，对不管什么年龄段的男生。自然要求会高一点点。 另一点我觉得这一部差了一点意思的原因是，哆啦A梦和静香两个角色，几乎成了一个工具人，没任何发挥的空间。哆啦A梦就是道具人，哆啦A梦跟大雄之间的那条线，比第一部差太远了，可能我不是原著粉，可能TV版一直都是这样的，但既然作为一部电影出现，观众角度当然希望好的方面要继承。静香，就是一个花瓶，如果第一部我认为她是独具慧眼，发现了大雄的优点。这一部，就只是人物太单薄了，就是个纯种的傻白甜，无限相信男主，一个不负责任，信心不足的懦夫。这个角色就是一个工具人，我突然理解《夏洛特烦恼》底下的差评，凭什么男人不管差成什么样，电影里总有一个女人无条件的爱着你，这就是男权当道，把女性写成了工具人， 我也尤其不喜欢前三分之二的剧情，来回拉扯。完了多重穿越，看着挺热闹的，但却也实实在在把故事拉的很散了，电影的根本是在于，你有没有讲到一个好故事，很显然我个人观点，大部分时间就是用了一个看似复杂的方式讲了一个很蹩脚的故事。这个所谓的复杂，有点绕圈圈的感觉，无趣且无聊。 最后成年大雄婚礼里的发言内容，是这部戏最大的亮点，大雄通过家人的爱找回了信心，相信用爱就能创造美好幸福生活，他终于相信他能给静香带来幸福，这一段拍的很好。但最触动我的点是，奶奶的出现。已故的长辈，最大的心愿是出现在子女或者孙辈的结婚盛宴上，看看儿媳妇儿，孙媳妇儿长啥样。戏里的奶奶有这个机会，可我的家人在天堂最后没等来这个机会，不免联想至此，内心更加感慨。 最后说一个搞笑的彩蛋，不是这部戏的，是关于大雄的，近几年我发现一首歌是写给大雄的。侧田的《大雄》，听歌词几遍后，一开始印象最深是，“自问是未满分，自问是没信心，实在是太没本事”，词太配大雄了，后来更喜欢“头上就帮着竹蜻蜓，飞过尘世吧”，这一句很浪漫，也是这一句我发现这只能是哆啦A梦的故事曲目，两个人绑着竹蜻蜓飞行整个城市，真的很美。 我之前总以为这首歌是大雄写给静香的，因为歌里不止一次道出了倾慕之情，写文之前完整的看了一遍歌词，有一个新的猜想，玩的有点大，我不厚道的笑了。,6.0,1.0,0
