,Unnamed: 0,电影id,电影名称,用户id,用户名,评分,评论日期,评论内容,有用数,没用数,回应数
0,0,34919090,断电惊魂,1b5c47f10401e0d10d6e40c418d37efb,ff173059779e99b9781f5313cfa4015b,3.0,2021-04-20 20:39:00,除了震惊还是震惊，性侵堂而皇之的摆在了在桌面上，夸夸其他，变成了谈论的资本。女人们变成了玩物，病人变成了随手拈来彰显权力和泄欲的工具。就如同羊群里混了一只批着羊皮的“恶狼”，宛如自助餐一般得到选取猎物，自视为王者，因为没有绵羊敢于反抗，就如同绵羊们自愿选择灭亡一般.......        其实这个电影也只是说了实话罢了，毕竟近五年超六成未成年性侵案为熟人作案。性侵害未成年人犯罪案件，主要包括针对未成年人实施的强奸罪、强制猥亵罪、猥亵儿童罪、组织卖淫罪、介绍卖淫罪、传播淫秽物品牟利罪。“2015-2019年，性侵害未成年人犯罪案件占侵害未成年人刑事犯罪案件的45%至70.3%，性侵害未成年人犯罪案件中的熟人作案，2016年占比最高，达91%。 　　熟人“成分”：邻居占比为8.3%至31.3%，学校及教育培训机构的教职人员占比14%至25%，家庭成员占比5%至24.9%，网友占比5%至22%。其中，罪犯多为可以长期、密切、近距离接触未成年人的成年男性。从统计数据分析，熟人作案的场所多为学校、培训机构的空教室、杂物间、厕所等隐蔽场所以及未成年人的居住地。在熟人作案的案件中，犯罪行为造成“信任”关系崩塌，将直接影响被害未成年人在心理、性格、智力、认知能力等多方面的正常发育。 　    熟人性侵害未成年人案件多存在持续时间长、犯罪次数多、案发时间晚的特点。被害未成年人以及监护人对此类犯罪人员存在一定的信任，加之未成年人身心发育不全、自我防范能力较差，施害人再次或多次实施犯罪的比例较高。未成年被害人对性侵害的表述含混不清或羞于启齿，也是造成此类案件被发现较晚的原因之一。        写道这里的时候想突然想起了电影《水果硬糖》，又有多少人能为别人付出那么多的努力........,4.0,1.0,0
1,1,34919090,断电惊魂,12d2a9cbdf07664b5003b08666aa4f20,81ca3fd612e4258742edb5affb9483cf,,2021-04-17 23:37:49,最后护士长眼里带着愧疚的说了一句there’s another way感觉还是屈服于了父权的power让val和saba命丧于此。后来val一手牵着saba一手牵着gail也算是应证了这一点（？）。电影名字power和男医生那句i have the power之类的算是首尾呼应了。如果结尾交代了babs和comfort的副线剧情可能会更出彩（？）babes 和comfort这两个名字感觉也是瞎起的...babs负责icu病人的临终关怀，comfort负责新生婴儿的呵护。大概是导演充满讽刺的恶趣味了,3.0,,1
2,2,34919090,断电惊魂,054b5ad389780e8f63515b44be5d5b1b,ba9187507e952a5f5038d459b1cba883,4.0,2021-08-17 14:56:50,作为惊悚恐怖，氛围营造很不错，步步惊心。但受限于坏医生欺负女患者女护士这个弱势群体的题材早就拍烂了，确实没有什么新意。本以为是重症患者快要离开人间，灵魂出体，调戏一把漂亮女护士，来个做鬼也风流，结果后三分之一就成了老套的你是精神病，没人相信你。然后三鬼联合愣的是把坏蛋吼死了？？？我tm直接疑惑，这是把坏蛋的魂叫出来了吗？我是走错片场在看《邪恶力量》吗？本来用橡皮擦去图画显出真相这个桥段很精妙，结果最后又绕回三俗的女拳。不知道是剧本的原因还是为了迎合女性观众的原因，女导演就只能拍拳师片？拳师导演天天喊着女权，你们倒是拍点别的啊，拍点《花样年华》这样的文艺片也行啊。狼来了喊多了就没人信了。这种自我受限，把自己限制在女拳的圈里，自己不能突破，就别老说都是男权的错。自己争点气，不用喊口号自然就受到尊重了。当然也不排除有的女导演想拍别的，但是投资人一看女导演就只让你拍这种片，如果是这样，那本片真是对男权投资人的莫大讽刺，导演符合你们金主爸爸的心意拍了个片，结果在骂你们，这就很幽默了。打4分完全建立在以上我的意淫上，说不定导演或者剧本根本没这意思。没办法，现在连自杀小队2这种爆米花也7分＋，我只能靠意淫赏片了。,1.0,5.0,0
3,3,34919090,断电惊魂,42f1d2bae70f3b6427f2bf5c2396e2ee,2de5b543a0428f6605fed05e3a5710c1,1.0,2021-08-07 22:30:34,以为是恐怖片，其实是一部反对男权思想的道德伦理片，当恐怖片看就错了。而且外文本片名为《The  Power》，明为“电源”，实为“权力”，但是我们的中文翻译是《断电惊魂》，完全从伦理暗喻片变成了十足的恐怖片……所以翻译的水平直接决定着你对内容理解和观看的角度，不知道曾经发生过多少“误人子弟”的谬翻，直接把大家带偏。 故事发生在十七世纪的英国，一个孤儿院出生的女孩到一家大医院应征护士，护士长提出了很多苛刻的要求，态度也很傲慢，但是小护士一开始就违反了，先是和医生搭讪，还发表自己的见解，结果被护士长责罚要求她在晚上值守医院重症监护室，因为晚上会停电，只留下重症和婴儿科室的人员值守，其他人员全部转移到其他医院去。 小护士还没达到重症病室就停了电，她到处乱转，到了婴儿科室，这里是专门帮生病的新妈妈照顾婴儿的。婴儿科室的护士很热心，将她送到了重症科室。在那里她遇到了同一孤儿院出来的另一个护士。护士警告她不要多和男医生搭讪，特别是今天搭讪的男医生。这时又停电了，另一个护士丢下女主护士，去找人打开发电机。这个电工很是花心，搭讪了女主护士，还和另一个护士纠缠不清。因为女主护士发现另一个护士哭了，就去安慰，结果却被警告不要被男人控制，还让她一个人下楼去拿药。 护士下楼又遇到电工，电工让她进了他的房间，让他给所有护士的评分，还有很多变态的照片，护士不为所动，拒绝了电工，电工用脏话谩骂了她。 她下楼时总是感觉有人跟着她，还是不是掀她衣服，不知怎么的，就去了地下室，在那里看到了一个给烤焦的玩具小狗，护士就摸了它一下，就看到了很多恐怖的东西，好像被什么捂住了眼睛，护士警醒时已经回到了重症室，但是另一个护士不见了。护士电话找来了婴儿室的两个护士，告知她们另一个护士不见了，找了半天发现是个小女孩逃跑发出的声响。这时女主护士突然被鬼上身，身体扭曲成各种模样，把一个护士吓走了。另一个护士没有办法，将她关进了一个房间。但是不一会儿她又破窗而出。婴儿室来得护士害怕，跳窗逃跑跌下了楼，另一个护士眼睛看不见了，却总喊着一个人名字，跌下了楼。女主护士又一次被鬼上身，醒来时，发现自己满手鲜血，她以为自己杀了小女孩，就吃药自杀。 醒过来天已经亮了，小女孩还在，女主护士很开心。但是院长和医生还有护士长都觉得她有问题，就要让她走。她说自己走没有问题，但是她让自己搭讪的医生照顾好小女孩。小女孩说了很多话，但是因为语言不通，女主护士没有听明白。最后在小女孩的本子里女主护士发现了端倪，原来她搭讪的医生就是小女孩说的坏蛋。女主护士赶去营救小女孩。医生就把女主护士带到了地下室要欲行不轨，女主护士让被医生害死的鬼魂上身，吓死了医生，在护士长的帮助下逃离了医院…… 面目可憎的护士长虽然严厉，给人印象不好，但是她却固守着正义和善念，帮助女主护士和小女孩逃离魔掌。那个看似热心，善于相处，彬彬有礼的医生却是个十足人面兽心恶魔，到处为非作歹，作恶多端。这样看来护士长一开始不准和医生搭讪的警告并不是什么变态、不近人情的规则，反而是一个保命的善意提醒…… 在男权下，女子只能成为猎物，就像电工墙上的照片，让一双双色眯眯的眼睛注视着，她们的反抗反而变得不近人情，真是一个变态的社会理念，压迫得人喘不过气来，西方国家变态的社会体制，真是让这些生活在底层的女人没有办法获取自由和应有的尊重。 以女主护士本人为视角的入魔也是第一次看到，蛮新颖的。不过让鬼魂上身杀变态医生，让人接受不了，自己没有办法控制，做一个媒介，这样并不是真正意义上的自身复仇，而是她人啊，有意义嘛？ 情节有点拖沓，不连贯，怎么一下子就从地下室到了重症室了，是入魔，自己都不知道嘛，如果真是这样，那导演的第一视角也太过真实了，真实到看得有点看不懂了…… 女主的演技的确不错…… 整体黑咕隆咚，很是压抑，恐怖气氛和絮絮碎语都不错，就是看着有点累……,5.0,1.0,2
4,4,34919090,断电惊魂,6fcba33d7cc90f0afafbb928eac9f739,8ec55b550f9e83d5bf695f613be3c12c,5.0,2021-10-08 20:00:02,讲实话这片子黑暗氛围的营造绝对可以打9分！！ 话归正题，片中娇小女护士瓦尔是孤儿院出来的修女，信神。 但是，信神，体质太弱。 所以，很不容易进了医院工作实习第一天就被院长看不顺眼直接去上医院夜班，哪里知道这个夜班是个恐怖黑暗的夜班。于是，她成了被鬼欺负的对象，借身报复的工具。 讲真话，我对于片中的这些小鬼我只能说四个字–欺软怕硬！ 你这算什么呢？呆医院那么长时间那么多机会你不报复，非要等这个体质弱胆子小还找不到工作的小女生来做你报复工具，实在太过分了。只能说鬼欺负人也是看人。 对于本片的开始五十分钟小护士点着蜡烛去医院拿药那一段，氛围是真的好。不过感觉这瓦尔小护士，胆子是真的小的可怜，一惊一乍的。 片子最后揭露的就是道貌岸然下的人性之丑陋，只不过最后小护士左手右手一边牵一个出去是打算干什么，难不成养小鬼？ 总之，片子作为恐怖片来说还是优秀的！建议大家看看！,,2.0,0
5,5,34919090,断电惊魂,3d45e414f11741aa3037c4243b7048ae,51c5c82bfa00bdd4dfaac964bcc12ba8,,2021-10-06 14:10:53,................................................................................................................................................................................................................................................................,,,0
6,6,34919090,断电惊魂,6ea57bde621f4ec868218d953a1ac3b8,446d1608280972a016a602266369df1c,2.0,2021-08-16 22:20:17,电影的英文原名为《The Power》，译名为《断电惊魂》，港台译名为《鬼护士 / 电源》，片名有极其严重的翻译问题。英文名和中文名在意义上相距十万八千里。 The Power，除了指代能源、电能之外，还是力量、权力的意思。所以，断电在片中就有两重含义， 第一层：断电带来的黑暗中，没有了光明，她没有力量反抗。 第二层：断电带来的黑暗中，没有了光明，作恶的权力无法穿透黑暗，所以她有力量反抗。 影片通过剧情推进，向观众展示了剧情意义上的逆转。影片一开始，护士长有权利安排新来的女护士在断电的晚上值夜班。而在断电的黑暗中，出现了藏身其中的恶鬼，不停地在夜晚作恶，从护士到患者，全都深受其害。 随着女主觉醒了反抗意识，觉醒了女权意识——被鬼附体，便在黑暗中，在男权到达不了的地方，开始了反抗。    如果10分满分的话，我最多给本片打4-5分，不能及格。 虽然导演拍出了自己想要表达的思想，但实际影片给我的观感不是特别好，整体有些拖拖沓沓。女主非要真鬼出来，附体在她的身上，才能反抗，这其实挺绝望的。因为这种反抗在现实里不可能出现。（也许他们不是无神论…）或者说，本身需要鬼附体才能反抗，这也是悲哀的。她自己无法反抗，或是打不赢，这种正义其实需要借助鬼神，实在是对本意的扭曲。 这到底是想拍出女权来，还是不想拍出女权来？ 另外，这部片子的背景是73年英国煤炭工人罢工，导致伦敦夜间停电，并在1974年导致了保守党下台。无关男权女权，为自己的阶级，为自己的团体，争取正当利益，才是斗争的正确方法。这片子也能让我们很清楚地看到，简单地去做性别切割，是多么的荒谬，片中的权力不只是男权，就是阶级权力，劳动人民团结在一起，才能有足够强大的力量。       你不会认为煤矿工人有什么男权女权吧？他们都是最辛劳的劳动人民。,2.0,3.0,1
