,Unnamed: 0,电影id,电影名称,用户id,用户名,评分,评论日期,评论内容,有用数,没用数,回应数
0,0,35183254,野蛮人入侵,f03fc79f17253feb702102e328e097f3,f442141fcf4c2a06babd66227ef7dc3f,,2021-06-19 15:49:56,"导筒Directube &amp; 陈翠梅 Chuimui Tan 陈翠梅《野蛮人入侵》剧照Barbarian Invasion（2021） 导筒： 新千年开始时您差不多从大学毕业，那时让你真正开始决定从事电影创作是怎样的契机？  陈翠梅： 马来西亚2000年开始有人在拍独立电影。 我是2001年大学毕业，本科是电脑动画。一毕业就在大学当助教。 当时我邀请了一些导演（Amir Muhammad, 李添兴，何宇恒等人）来我的大学放映电影，分享创作。还记得是每个星期三。 学生们没太感兴趣，我这个做老师的却大受启发，开始参与独立电影制作。 陈翠梅《爱情征服一切》Love Conquers All (2006) 导筒： 你之前拍摄了大量的短片作品，相比之下长片创作的频率会比较缓慢，这样的选择是哪些原因决定的？  陈翠梅： 2003年到2009年我拍了很多短片。 2003年，朋友们都在拍短片，我那时候或者摄影，或者美术，或者剪接或者演员。我没学过电影，那一年是我的电影教育。 其实自己非常享受短片创作，形式上相对自由。我还记得2005和2006年我都有短片在鹿特丹竞赛，但老是有人问我，“你什么时候拍一部电影呢？”我那时候想，难道我的短片不算电影吗？于是愤愤地拍了第一部长片《爱情征服一切》。拍完之后，发现还是拍短片比较欢乐。于是又拍了很多短片。 陈翠梅《野蛮人入侵》Barbarian Invasion（2021）片场 导筒： 距离您第一部长片《爱情征服一切》Love Conquers All (2006)完成已经15年过去了，如今回看当时的创作会有怎样的感受？  陈翠梅： 我还是觉得自己像个业余者，没有真的把电影当专业。也一直没学会怎么拍电影。一直还在尝试不同的东西。 我现在看回自己以前的作品，甚至是15岁时的文字，一般都是惊讶的，原来以前就这么厉害了，好像自己没什么长进啊。 现在看《爱情征服一切》，虽然技术粗糙，还是会惊讶于那时候看爱情的残酷或老练。 陈翠梅《野蛮人入侵》Barbarian Invasion（2021）片场  导筒： 您的新片《野蛮人入侵》的创作初衷和灵感来源是怎样的？  陈翠梅： 会有这么一个项目，也是因为2019年三月我在香港电影节的HAF会场遇见杨瑾，他突发感慨，说很怀念以前拍独立电影的时候。然后没头没脑地问我，“60万人民币你能拍一部电影吗？”我说没问题。过几天他约了我在酒店早餐，就把这个项目决定了，6个导演，每个人100万的预算来拍一部电影。 同年6月就在上海发布了这个计划。 上海之后我去了一趟北京，在宋庄约了王宏伟吃饭。他突然说他要拍一部谍片，让我演女间谍。我开玩笑说那你送我去做三个月的武术训练吧。 然后我突发奇想，反转局面，“不如我来拍一个伪纪录片，关于一个中国独立导演，转型拍动作片，找了合作多次的过气女演员，把她送去泰国普吉岛受训三个月。后来项目黄了。女主角却通过练武找到自我，最后还参加了自由搏击赛。”我跟王宏伟说，“我来让你演这个不靠谱的导演。” 7月我就带了阿良，热奶和陈佳宁去普吉岛做考察写剧本。不幸的是，我没办法安排家人照顾我三岁的小孩，所以要把他带去普吉岛。 就在普吉岛写了《野蛮人入侵》。 陈翠梅《野蛮人入侵》Barbarian Invasion（2021）片场 导筒： 这部影片采用了“戏中戏”的结构，这样的模式会对叙事带来一定的挑战，您是怎样整体考虑的？  陈翠梅： 其实我的创作，也只是一个疑问，或者自问自答。 什么是我。 假作真时真亦假，无为有处有还无。  导筒： 你之前在生活和工作闲余之时，会运动健身吗？巴西柔术的学习还有武术的，是因为本片的拍摄而特地去进行的吗？你能分享一下这种习武对、身体方面的问题，或者是你的动画电影创作带来的新变化或者灵感吗？  陈翠梅： 我运动量比较大。不是校内的活动。 我中学的时候，学校对面有座小山，我每天都会独自一个人爬山，之后去游泳。也不为什么，就是一个人单独思考。 2004年有学过三个月的自由搏击。 2019年学巴西柔术。可惜2020年三之后，因为疫情爆发，学习停止停工。 其他还有泰拳，菲律宾武术，太极推手等等。 不是为了电影而学的。比较像静坐。 武术我比较外行，只懂些皮毛。 虽然一直对武学感兴趣。真正学武还是筹备电影的时候。时间比较短。胡乱地学了菲律宾棍法，泰拳，巴西柔术。 我觉得真正懂得武学的人是徐皓峰。不只是历史或理论。他说的很多东西，是真的实战能用上的。只是很难学。有一天我真的要认真学武，希望可以拜他为师。 王家卫、徐皓峰 导筒： 影片中提到了著名的谍战动作影片《谍影重重》，同时看过这部作品和《野蛮人入侵》的观众应该能发现，《野蛮人入侵》中有一些段落是对《谍影重重》的直接致敬，聊聊您对这个经典系列片及其在包含的动作，打斗感的理解。  陈翠梅： 其实选择《谍影重重》，主要是呼应电影主题那个“我是谁？” 当年《谍影重重》里几场几场打斗都很经典，所以也刻意模仿。 这些打斗设计跟我们熟悉的香港电影很不一样。里面用了Kali(菲律宾武术）和Krav Maga，都是军人实战训练的近身格斗。 陈翠梅《野蛮人入侵》Barbarian Invasion（2021）片场 导筒： 您在片中也有大量的动作戏，拍摄这些激烈的打斗戏，您会有怎样的摄影方面的要求？
 陈翠梅： 这次的动作场面设计其实主要依靠动作导演李添兴。模仿《谍影重重》的部分，几乎是每个镜头和动作都抄。其他原创打斗部分，基本上希望动作一气呵成。  导筒： 你之前提到过自己的很多作品都是5D Mark II拍的，而且《无夏之年》中的夜景也都用了这个机子，因为感光度强。 这一次的拍摄的机器设备是怎样的？在使用过程时和以前的状态相比觉得如何？你觉得拍摄设备的不同会给你不一样的状态吗？海边的风很大，还是用的Zoom H4做收音工作吗？  陈翠梅： 这次用的是Panasonic 的机器，灯用了Aputure。 We used the Panasonic S1H with Zeiss lenses (we combined Compact Primes MK2 + Otus + ZF series). Most of the film is shot with the ZF series. Regarding lighting we used a very small setup from Aputure: 2 x C300 + accessories and a set of 4 x Aputure MC. besides that we used some par lights and quite a lot of practicals. 我们使用的是Zoom F6多轨录音机。由于马来西亚海风非常大，在海边拍摄时，所有录音话筒完整的防风罩以确保能收到最干净的声音。  陈翠梅《野蛮人入侵》Barbarian Invasion（2021）片场 导筒 本片的音乐设计由Akritchalerm Kalayanamitr担纲，在影院观看本片的时候除了东南亚标志风格的海浪声音，还有在像打斗桥段的电子乐，关于声音创作的部分，和往常的独立电影创作声音设计是否很不一样？对你和Akritchalerm Kalayanamitr来说是否也是一种挑战？你们是如何沟通的？  陈翠梅： 设计电影的时候，也会在想，这是导演胡子杰要拍的东南亚版的《谍影重重》。 所以音乐找来马来西亚做声音实验的Kamal Sabran。 混音部分找了泰国的Rit (Akritchalerm Kalayanamitr，以下称Rit)。 后制部分遇到很多困难。因为疫情，没有办法到泰国，所以都是用电邮沟通。 在调色和混音，导演不能在场，其实是没有办法做判断的。 我是2007年在鹿特丹认识Rit的。 Rit是多年来都在跟Apitchapong合作，我很喜欢他在电影声音设计，这次的终混，我去不成曼谷，所以就让他做最终决定。 陈翠梅《野蛮人入侵》Barbarian Invasion（2021）片场 导筒： 剪辑方面，最终登上大银幕的版本是按照一开始的拍摄脚本来剪辑的吗？是否会因为了“类型／动作片”或者要“反类型／动作片”，按照“作者”的方式，而去有意地调整剪辑节奏呢？与Kai Yun Wong的合作是怎么样的？中间有过怎样不同的尝试吗？  陈翠梅： 剪辑师黄凯韵是廖庆松老师的学生。这是她第一次剪长片。但是我很相信她对电影的判断。 我们非常聊得来，在拍摄现场，我们的关系是： “来，抽根烟，妳觉得刚才那场戏怎么样。” “刚才那个镜头怎么样？ 剪接师黄凯韵本人回应—— “我觉得有可以分成跟场和后期两个部分，拍摄时是根据素材尽快剪出每一场故事通顺，然后也在一些场次拍摄前，让导演看其他部分的素材，比如Adnan的完整章节，帮助一些拍摄时的思考？然后后期的思考就不一样，不能被任何类型的手法绑住。就做Mui的味道，就是不需要那么准确，人生就不是每一件事都那么清清楚楚嘛。 故事里有一些选择，是一些模糊的感情，比如Moon在看Adnan的每个眼神，都有着戏里戏外的情绪，有爱也有恨？这个角色的层次就会出来了，我在剪接期间，其实回归到很本质的东西，把技术通通丢掉！最后做得，还好，尚须生活更多的经历吧！ ”  陈翠梅《野蛮人入侵》Barbarian Invasion（2021）片场 导筒： 主人公李圆满在片中一直在与儿子和昔日恋人发生纠缠与反复，您如何看待这个角色的设定，为什么会选择亲自来出演李圆满？  陈翠梅： 我是为了可以练武，硬是自己要演的。开始有考虑过找杨雁雁。她真是影后，也是母亲，而且打戏不错。 但是我觉得练武这件事情，还是必须是我自己经历。这是导演的自私。 陈翠梅《野蛮人入侵》Barbarian Invasion（2021）片场 导筒： 你曾谈到自己会“在前期准备时，花很多时间去彩排，至少三次”，譬如《爱情征服一切》的女主角走路的姿态多次排练调整出了不同的效果。这一次的准备工作是否格外的漫长？你和制片是怎样分配安排时间的？可否和其他的青年电影创作者分享一下经验？  陈翠梅： 前期准备越充足，拍摄时就可以专心拍摄。 这次的前期准备，写剧本大概是三四个月，前期大概是6个月。 最吃力的是我的动作训练，但那恰恰是我最享受的部分。 彩排有动作彩排，也有摄影彩排，最后还有Full Dress Rehearsal，就是演员服化道具都彩排。 陈翠梅《野蛮人入侵》Barbarian Invasion（2021）片场 导筒： 演员李圆满在片中熟练切换着亚洲多种语言，在马来西亚的现实情况中，电影工作者是否都具备这样的能力，东南亚跨国合作电影制作的情况是否逐渐成熟了？  陈翠梅： 马来西亚语言环境比较复杂。基本上马来西亚华人在生活上会需要英文，马来文，普通话，和一两种方言。（吉隆坡广东话，槟城柔佛闽南语。） 马来西亚和印尼用的同样是马来语。印尼的电影工业和市场都比较成熟。 Bront Palarae是马来西亚演员，但是是在印尼成名的。  陈翠梅《野蛮人入侵》Barbarian Invasion（2021）片场 导筒： “演员”和“导演”的身份是一种身份，你说怎么样？哪个更能给你带来更多的创作满足？如果没有疫情，也有合适的电影演员，让你重来一次，你会选择自己演还是用其他演员呢？  陈翠梅： 我其实不喜欢表演，因为控制欲过强。 我喜欢跟演员合作。  导筒： 影片中从筹备影片的现实阶段过渡到电影阶段的节点，是怎样选择的？之后再拉回到现实，是否会想制造虚实不明确的效果？  陈翠梅： 其实没有虚实真假。从一开始就是一场电影。 虚假里面的虚假，不会让本来的虚假变成真实。  陈翠梅《野蛮人入侵》Barbarian Invasion（2021）片场 导筒： 片名《野蛮人入侵》（英文电影名Barbarian Invasion）有怎样的用意？  陈翠梅： 我很久以前读过，每一个小孩的诞生，都是一次野蛮人对这个文明社会的入侵。 原文是Hannah Arrendth, Every civilisation is invaded by barbarian, we call them children.” 开始是这个意思。一个小孩对立着社会，到底谁是野蛮人。 后来比较是，所谓的文明社会，是对每个个体的侵占和控制。 我愿意做那个野蛮人。 陈翠梅《野蛮人入侵》Barbarian Invasion（2021）片场 导筒 影片中有一段关于宫本武藏和电影的台词，某种程度上来说，这部片子也可以理解成一部关于电影自身的电影。然后我们也看到影片中有很多和其他电影串联的细节，比如您提到了洪尚秀的电影，当然这是一个友善的关于洪尚秀电影风格的梗，但就电影本身来说，是否可以对比洪尚秀的电影风格谈一谈您是如何理解电影和创作电影这件事的呢？  陈翠梅： “一切都是剑”，原来是这一切的核心。 很多年前我问过Bruno Dumont杜蒙这个问题：电影是什么？ “这是一个形而上的问题，”他很郑重是说，“这个她问生活是什么一样的。” 陈翠梅《野蛮人入侵》Barbarian Invasion（2021）片场 导筒： 可以简单向大陆观众介绍下这次拍摄《野蛮人入侵》的团队主创，他们应该都是活跃在马来西亚的优秀电影人。  陈翠梅： 监制胡明进是导演，2010年他的电影《虎厂》进过戛纳导演双周。 动作导演李添兴（也演罗师傅）是导演，是最早发起马来西亚独立电影的旗手。 演导演的张子夫是个歌手，演员，他在Ghost In the shell 里还演了黑帮老大，折磨了Scar Jo。 演情人的Bront Palarae是演员，今年也导了一部情欲片。 陈翠梅《野蛮人入侵》Barbarian Invasion（2021）片场  导筒： 您长期以来一直与大陆的电影界及独立电影人们保持着良好的连结，这次入围上海电影节，有怎样的感受，这一次不能来到电影节现场，对于大陆的电影创作同仁们有什么想表达的吗？  陈翠梅： 整个项目本来就和大陆独立电影人很有渊源的。只是后来疫情紧张，我们只能用马来西亚团队。 “一切都是剑”——与所有创作同仁共勉。  导筒： 去年有您监制的《一时一时的》（Sometime, Sometime，2020年叶瑞良导演作品）也曾入围上影节，马来西亚目前新导演的创作环境是怎样的？您也有举办为青年影人提供展示平台的seashorts电影节。  陈翠梅： 马来西亚不太有扶持新人的平台。年轻创作者还挺困难的。 陈翠梅《野蛮人入侵》Barbarian Invasion（2021）片场 导筒： 您之前出了电影创作，还经常会写小说和散文，现在是否还有这方面的创作习惯？  陈翠梅： 我现在是迷上了巴西柔术，把很多精力和时间在钻研这个，可能要十年的时间。  导筒： 在未来一段时间，还会有怎样的电影创作计划？  陈翠梅： 其实这几年一直想写科幻爱情小品的。有了几个构思都没实现。 陈翠梅《野蛮人入侵》Barbarian Invasion（2021）片场",15.0,,0
1,1,35183254,野蛮人入侵,1fbb0195032d791c8a948e74e4a40a31,c4bc4eb5a61480d95f6941a92dc2f59f,5.0,2021-06-28 00:49:48,首发于奇遇电影：图文版 功夫片终结了吗？《一代宗师》和《叶问》系列之后，如果《战狼》系列不往功夫片发展，那肯定是终结了。功夫片终结了之后怎么办？徐浩峰给出过一种路线：在“练家子”的基础上去写“武林”，不再去展现“功夫”的奇观，反而去分析其背后的意识形态性（《倭寇的踪迹》），以及以“功夫”为名的权力斗争（《师父》）。陈翠梅的新作《野蛮人入侵》令人惊喜地给出了另外一种重启功夫片的路径，这也是本片最重要的意义所在。  徐浩峰2015年作品《师父》，探讨功夫片的一种可能性 陈翠梅即便不是绝无仅有，也肯定是为数不多敢于挑战功夫片的女导演。“打女”在功夫片里也早有传统，现在能看到的最早的影片，大概是1929年的《红侠》和《女侠白玫瑰》（中国电影资料馆偶尔会拿出来晒一晒），那还是“神怪武侠片/古装稗史片”脉络里的作品。  《女侠白玫瑰》（1929） 《野蛮人入侵》明线里挑战的是《谍影重重》，暗地里却是对整个功夫片片种的数据库式拆解。看出这一层意思来，不禁击节叫好，也是当场打出高分的道理所在。 《野蛮人入侵》初看去是一部“剧组故事”式的“元电影”（更时髦一点的词儿就是“后设电影”），自编自导的陈翠梅亲自扮演影片的大女主李圆满（Moon）：一个带着学龄前儿子（目测大概四五岁）的离婚前著名女演员。Moon因为生娃淡出演艺圈，这次因为导演召唤，带着孩子来参加电影的筹备。  他们要拍什么电影呢？一部“女版的《谍影重重》”，电影的开场是，一个女人在海滩上醒来，不记得自己是谁，但是会说五种语言…… 当然了解陈翠梅或者马来西亚的读者都会知道，马来西亚华人至少会讲中文、英文、马来文，很大概率再会讲粤语或者闽南语方言，而且关键在于可以无缝切换。这里面就有极为有趣且可以深入展开的文化身份问题。不过在这里本身就是一个指向导演/主演自己的元素。 影片的前一半略多的时间就是在讲这部“东南亚打女版《谍影重重》”的筹备过程，一方面是片中导演和演员的各种探讨，其间有很多有趣的迷影梗，比如片中导演比出了《宫本武藏》的故事，Moon反嘲导演“我们是要拍一部洪尚秀电影吗？”，甚至在讨论过程中还细致地铺陈了女演员的人设、职业经历和感情经历，比如演过什么缅甸难民，越南新娘（此时五国语言凑齐了），吐槽了电影宣传，融资，选角等等。  另一方面则是Moon为了角色而开始了武打训练。而这个武打训练则是本片最绝妙的地方，将功夫片的套路全数拆解开来：首先，功夫片里的打斗，主要不是为了攻击，而是为了好看；但为了好看，也要看上去是有了很长时间训练，这就是“练功”和“作戏”的区别。 但影片处理的有趣之处就在于，设定是“作戏”，Moon的目的不过是为了学习一下套招，便于表演，但实打实地拍成了“练功”。最具“元功夫片”特性的莫过于这样两个桥段：教练告诉Moon“你要用身体表达自己”，Moon问“什么是自己？”教练一拳上去，Moon当场鼻血喷涌，此时教练再进几招，并不断追问“是谁在流血？是谁在痛？是谁在躲闪？”，当然这个段落挪到一部正常功夫片里，就该是主角练功到了关卡，亟待突破的时候由高人点化的桥段。想想黄飞鸿，方世玉、张三丰……  另一个桥段则是片中导演告知Moon，因为大陆影星“黄璐璐”看上了这个项目，直接丢了三千万过来，要求自己演女主角，所以Moon很生气地就要退出这个项目。她离开练功房的时候，教练告诉她“学功夫，是为了寻找自己。你要答应我三件事：不参加比赛，不和人打斗，不让人知道你练过功夫。”看到这里观众都发出了愉悦的笑声。这么一个老掉牙的学成下山之前的桥段，但反过来用就用得这么妙趣横生。当然这也再度印证了我刚才的分析：这一段名为作戏，实则练功。 而这一段“作戏/练功”中还有着对功夫片堪称数据库式的拆解，具体到了近身格斗，摔跤，扭打，兵器选择，随手抓起各种物体做兵器等等套路的分解教学。而这些教学都伴随着教练颇为“元功夫片”式的指导。加上之前“筹备”部分中有意铺陈的细节，两者共同构成了影片第二个段落“电影”的“预叙”。 “电影”段落开始的无声无息，Moon离开武馆后，一直带在身边的孩子“宇宙”（由陈翠梅的儿子宇宙扮演）突然被人劫持，Moon与几个劫匪打斗之后，被打昏并丢入海中，然后在沙滩上醒来，忘记了自己的身份，被当成了缅甸难民……这正是片中“筹备”的那部电影的开场段落。而这个美妙的转场也应了影片刚开始时导演和Moon的那段对话“一切都是电影”“生活本身就是一场电影”。  这个“电影”段落充满了套路和迷影梗，但是因为前面近一个小时实在太过精彩，而且早有铺陈，观看这个段落的愉悦感就会集中体现在“哦这个地方前面交代过”上面。这既是数据库电影的奥义之一，又有着对套路“意料之中”但“居然可以这么用”的评论式观看的快乐。这种手法其实左岸派大师阿兰·罗布-格里耶就用过多次，但哪有这么好看啊！ 影片的另外一个重要面向就是女性议题。这部影片里Moon和孩子相处，显然也是来自于陈翠梅的生命经验。片名里的“野蛮人”正是指无法/尚未被文明社会规训的孩子。许多文章都谈到陈翠梅带孩子带得“心力交瘁”，片中的Moon虽然能水下闭气三分钟，能演缅甸难民越南新娘能跳钢管舞，但是现在“连个小孩也搞不定”。用Moon的台词说：“一旦成为妈妈，身体就属于社会了，我最讨厌他们讲‘你的小孩是你最好的作品’，我不过是他来这个世界的管道而已。” 生孩子对Moon有多大影响呢？武馆的一个学员跟导演讲他最喜欢的电影，却认不出眼前的Moon就是那部影片的女主角。当然影片并不是反生育女权宣言啦，而是非常难得的心平气和的女性角度对“生孩子并和他共处”的一次讨论，而且是“带着孩子工作”的讨论和实践——戏外的陈翠梅不也是带着孩子拍了这部电影嘛！  所以从这个角度再看，《野蛮人入侵》是多种维度上的“元电影”，既是剧组故事和戏中戏，又是元功夫片与数据库电影，同时也在导演生命经验上形成了绝妙的“自指”。我能想到的一个类似文本就是北野武的《导演万岁！》，在那部神经刀片子里，北野武在创作焦虑下，尝试了十多种风格，最终拍出了一部大杂烩的乱炖电影，也是在元电影-数据库-自指的范畴中进行了绝妙的创作。当然我故意没有写片子里密集的科幻梗，从《银翼杀手》到《黑客帝国》乃至小说原作都出现在“电影”部分，以及影片中的爱情线——留待大家自己去发现吧。陈翠梅的下一部作品将会是一部“科幻小品”，实在是不能更期待了。 《野蛮人入侵》是天画画天与香港国际电影节协会合作的“Back to Basic（B2B）”项目第二部完成的长片。这个项目集合了蔡明亮、石井裕也、翁子光、张律、陈翠梅和杨瑾，每位导演只用一百万人民币的低成本，以“爱情征服一切”为主题拍摄长片。石井裕也的《只能唱的心声》已于2020年完成并入围釜山国际电影节。其余四部电影也值得我们重点关注。,25.0,,1
