,Unnamed: 0,电影id,电影名称,用户id,用户名,评分,评论日期,评论内容,有用数,没用数,回应数
11,11,35245762,神偷军团,0658a8e1cb9c18b3e49d91953d6f1b48,d79762817c341dddd0e050d751405381,3.0,2021-11-03 10:43:26,"扎克施耐德导演了个说起来牛气冲天，其实不怎么样的《活死人军团》电影。
然后，这《神偷军团》是它的前传。据说，扎导这次仍旧是重要参与者，主演是正片里的保险柜开锁匠，不记得名字，照电影设定，是个掌握着高超开锁技术的专家级“神偷”。呜呜渣渣的，电影应该是冲着牛X去的，可惜电影里，没让人觉得他牛，只感觉他一直在虚张声势。 《活死人军团》，最左边的，是前传新片《神偷军团》的男主 然后，相对的，哥一直想起《神偷联盟》。
名字相近是一方面，更重要的是，哥觉得它们设计“偷”的桥段，都没什么出乎人意料的。
就都挺平庸！远远说不上巧妙。
更说不上有什么“神”的！
但，它们的目标，是不同的，正所谓“道不同，不相为谋”！
《神偷军团》目标，是让主角酷炫，目标没达成！
《神偷联盟》目标，就是让那个听着就糟糕的“偷盗”大计，看起来像一个笑话！它的初衷，就是把这个电影，弄成一个笑话、一个冷幽默喜剧。
结果，目标成了！ 《神偷军团》 《神偷军团》男主一直的老梗——听、转 《神偷联盟》 《神偷军团》电影重点——保险柜开锁天才，破解传说级系列保险柜！
爽点设置应该是——开锁天才，破解传说级系列保险柜的过程展示。
就该是很传统的“神偷”类型片啊！
看卖点，应该是，传统到不怕大剧透的那种电影。只要“神偷”细节在，就行了呗！
《神偷军团》也该是这套路。
然而，剧本故事的重点，没有放在这上面，是主要放在男主身上，争取怎么让他发光发热，让他和漂亮女主，谈情说爱。
后来，才知道，这男主，还是这电影的导演，估计，也能是投资人之一，释然…… 《神偷军团》男女主 剧本故事不怎么样，就一心一意假公济私，不知道是不是，反正个人感觉是。
表现开锁技能的桥段也不怎么样，一个开锁听加转的老梗，反复用……
然后，演员嘛，除了男主有点名气，女主应该也有点名气，记得几部大作里，似乎都有她！
其他人，比较一般，都是客气的说法了！他们，就该是为了满足需要存在的“纸片人”。
毕竟，预算有限不是?
画面和特效嘛，也远远谈不上惊喜，那是好莱坞大片的标签。这电影，主创团队来自欧洲，想跟东方不败级的好莱坞比这个，近乎自取其辱！
尤其，是在，预算有限的情况下。
看着就小家子气！
与其，说是电影，倒更像是普通电视剧水准。
这个，倒也跟剧本故事和演员阵容配套，都只是为了满足男主的酷炫私欲，而存在的。不那么好，自然而然。

剧本故事不怎么样，演员阵容不那么齐整，画面和特效小家子气，还想着靠撞大运一飞冲天，近乎痴人说梦！
所以，总结:就一不那么“神”的“神偷”类型片，短视频就足够体现它的精髓，如果有的话。 《神偷联盟》剧照 与之相对的，个人觉得，是《神偷联盟》。
也是不那么“神”的“神偷”类型片。
主角是一对亲兄弟，一个瘸腿，一个断手，“天残地缺”级别；
两个主力帮手，特点是又二又弱智，基本就是俩人形哈士奇；
一个关在监狱里、爱呜呜渣渣、张牙舞爪扮高手的“爆破专家”！
……
等等。
就是这么一帮奇奇怪怪的非主流，组成一个奇奇怪怪的“神偷联盟”，号称“乡村版《十一罗汉》”，要实现一个奇奇怪怪的计划——不是去“偷”银行，TMD要去“偷“赛车场！
骨骼惊奇的一群人，十年脑血栓级的脑洞计划！
听着就恶搞！
这，恰恰就是这部电影的重点。
然后，电影设置的爽点应该是——就这么一群奇奇怪怪的“神偷”，磕磕绊绊地实行着他们的“神偷”计划，过程展现。！
这帮只有神经大条的奇奇怪怪“神偷”，当然不会那么“神”，“神偷”计划过程，理所当然地错漏百出！
但，它就是要他们错漏百出，越错漏百出，越能成功！
因为，它是一部恶搞的喜剧片。
让“神偷”不“神”，是它的目的！
这《神偷联盟》，跟《神偷军团》，目的就不同。
“道不同，不相为谋”得天经地义！
它不管“神偷”计划荒诞不荒诞，可不可能成功！
这本来就不是重点！
……
所以，这《神偷联盟》，就推荐全片翻，能逗一乐，就好啦！短视频算了，这“神偷”计划，没什么出乎意料的精妙！
电影，有的能知识，有的能哲理，有的，能娱乐一下就好嘛……

胡说八道不要钱，胡说九道不负责。
个人意见，尽管不同。
网图，侵权必删。",2.0,1.0,0
12,12,35245762,神偷军团,84ccd0597f916507725e8dee25f552f3,cbf80fd5ed7a756fab083b2a32f290ec,3.0,2021-10-31 19:58:31,"如果说年初的活死人军团是美国导演常规脑洞大开的商业大片。。。。。  
谁会想到年尾其中饰演开锁专家。。。来自德国的帅锅会顺流而上， 沿着故事线搞了个欧洲风格的前传来ヾ(@^▽^@)ノ 

《尼伯龙根的指环》(Der Ring Des Nibelungen)是著名音乐家瓦格纳于1848年开始创作，至1874年完成，历时共26年。创作灵感来自北欧故事及人物，特别是冰岛家族传说 。英雄故事散文）。 《尼伯龙根的指环》由四部歌剧组成，莱茵的黄金， 女武神， 奇格弗瑞德，诸神黄昏。。。。  
故事的主线涉及的保险箱也是根据此部作品的前三部曲创作，命名ヾ(@^▽^@)ノ  解锁的过程也是了解这位制锁大师的故事(*๓´╰╯`๓)♡ 最后的诸神黄昏应该就是活死人军团里的那个

这个影片稳重内敛 又有德国人特有浪漫和幽默。。。。。另欧洲小镇和山间风景太美啦(*￣︶￣)",4.0,1.0,0
13,13,35245762,神偷军团,26e24afd5785a93ed73c0c583aca2252,36e01da63159cf48f1f47d68bb81db0f,4.0,2021-11-09 00:56:43,"《活死人军团》在今年Netflix的大片里让人失望后，没想到姐妹篇的《神偷军团》居然基本抛弃了丧尸元素，回归了老不正经的盗窃类型片，盗窃保险柜、抢银行、飙车、枪战俱全，还有舍己顶罪的美女，都让人眼前一亮。
    身为《活死人军团》前传，直接拍成了开锁大神塞巴斯蒂安的“个人宣传片”。马提亚斯·施维赫夫自导自演，他从一个德国屌丝菜鸟被神偷军团招募，到打开“诸神的黄昏”保险箱，再到豁出性命救了黑人老兄，彰显他的成长过程。  从德国某银行的小职员，每天过着朝九晚五的枯燥生活。他在社交网络上录了个小视频，神秘人士让他去参赛，他稀里糊涂去了地下开锁大赛。结果，哥们从懵里懵懂晋级，到越战越勇获得冠军在，自然被犯罪组织盯上。  根据北欧神话和冰岛传说进行创作《尼伯龙根的指环》是德国音乐家瓦格纳的大型歌剧作品，《莱茵的黄金》、《女武神》、《齐格弗里德》、《诸神的黄昏》四个章节则用在保险柜上，用闪回的方式交代，添加了趣味。  起初，屌丝男主角不乐意参与犯罪活动，但他做了一个关于丧尸的梦，觉得生命短暂，不拼搏开不了世界上最强的保险柜，便去找招募他的美女格温，从此加盟了“神偷军团”。  “神偷军团”有两名美女，还有黑客大耳环、飞车手大胡子，甚至还有一名精品打手，长得像“迷你金刚狼”！先是难度最低的一号保险箱“莱茵黄金”，众人去银行搞里应外合，男主角开启保险柜，不费吹灰之力就盗窃了巨额财产！  没想到到了2号保险柜“女武神”，就出现了各种危机，不仅警察在外面严阵以待，里面保安也守候着。但是要抢银行怎能不靠点武力？格温这个女武神，一通拳打脚踢，干倒了众多保安，就让男主角直接开柜子！  “迷你金刚狼”则在银行内跟保安展开火爆枪战，直接肩膀中子弹，摔出了窗户逃逸。他还很不仗义地抛弃了男主角，扔他下车，让后者陷入恐怖危机。  故事这个转折很不赖，男主角因此路边抢了一辆自行车，一路慌忙逃逸，还冲下台阶的狼狈样子很像《A计划》里面的成龙，拍得幽默惊险俱全。  《神偷军团》在拉斯维加斯被活尸攻占沦陷的背景世界观之下，大家本想借机发一笔横财，没想到有人携款潜逃就内讧，两位美女自然是不满走人。  第三个保险柜在瑞士的圣莫里茨赌场里，警察刚部署好监控，没想到“神偷军团”改变了策略——他们忽悠赌场说保险箱很危险，趁着贼来之前赶紧运走，在晃晃悠悠的山路上进行开柜。   男主角跟格温在一起出生入死过程中，有了革命般的感情，但本片没走向盗贼童话的大结局。“迷你金刚狼”与警察的相继来袭，让曲折的故事越加揪心。女主角最后顶罪，让心上人离去，这样的故事略显悲情。  本片彩蛋里竟然成了另外一部电影《活死人军团》的序幕，男主角成为了锁匠，继续去冒险，这样故事看来很老不正经，却娱乐性很强。 尽管127分钟的片长有点超时，故事有一些老不正经的漏洞，却叙事流畅紧凑，枪战、盗窃、飙车、情义俱全，放在Netfilx的网大里算精品。",3.0,,0
