,Unnamed: 0,电影id,电影名称,用户id,用户名,评分,评论日期,评论内容,有用数,没用数,回应数
136,136,26363254,战狼2,cce3ac67fc28780737da38c356bb3385,3621af61ba58a91bcec9f28e0c70a33a,2.0,2017-12-03 19:35:27,"首先反驳一个几乎在所有《战狼2》谈论里都会高亮的观点，这个观点是这样的:“《美人鱼》和《捉妖记》都能获得那么高票房，我认为《战狼2》是值得50亿的。”有没有觉得很怪？2015年度豆瓣电影评选的年度国产最佳是忻钰坤的《心迷宫》，该片仅有几百万票房，看过的人应该都会觉得超过《美人鱼》不少吧，这票房成绩怎么说。我终归只想讨论电影本身，反驳这个观点的原因在于，用奇怪的参照系来证明自己的观点，一般来说是没有说服力的。我去市场看到青苹果买50元一公斤，我不想买，卖家说，隔壁烂苹果都要买30元一公斤呢，可我明明看到5元1公斤的红苹果在隔壁的隔壁出售，反正我是不会拿烂苹果作为参照系的。

说回电影本身，我拿国庆档的“烂片”《空天猎》做比对，为什么拿这一部做对比，因为两个电影的主题和构架是相同的，目标都是对我方人员营救。

1.就从这个构架来说，一般营救应该有营救不成功的plan b，两个电影都没有。当然，因为是电影，如果计划非常完美无瑕，就失去了挑战极限的紧张和刺激感，我们先不认为是瑕疵。但是《空》更好的一点，在于有地面营救分队和空中打击力量两个部分，也就是说，《空》的整体结构里，最低目标是救出我方人质，最高目标是摧毁敌方战斗力，打击kb分子，那么，如果风险极高的空中打击遭遇地面防空力量破坏，难以实现最高目标，地面营救分队还是有一定几率实现最低目标的（计划中的营救地点就在导弹井），尽管没有B计划，但在操作中是互为备份的。而《狼》的最低目标是救出陈博士，最高目标没有，救多少算多少，而实践中救援目标变成了男主角的干儿子的妈妈和自己偶遇的混血美女，这个救援行动只有一个人，计划都没有，根本谈不上B计划。

2.我们说电影的矛盾冲突应该是被剧情推动着向前发展的，就拿制定营救计划来说吧，《空》制定作战计划既有前期失败的教训（王千源受伤），也有对障碍和路径的探索经验（李晨有躲过导弹的经验），至于为什么是李晨担纲主角，因为王千源受伤了，自己有经验，也是那个情况下最好的飞行员，这是合乎情理的。《狼》的剧情推进到选定吴京去营救是因为东来局长说：“就目前情况下，我方作战人员禁止进入交战区，但必须坚决完成撤侨，必须有一个人单独执行任务。”什么狗屁逻辑，怎么听怎么觉得这话就是说给吴京听的一样，“一个人单独完成”是怎么推算得来的，自己不出人还要坚决完成撤侨，拿什么坚决？这一段剧情往前推得很莫名。

3.人设。一般商业电影的设定，是正反派因为某个目标进行争夺，反派形象的塑造是重难点问题。从这个角度来说，两部电影都不算成功，但《空》主要的问题在于人物不够丰满，但矛盾冲突是足够的，反派是王牌飞行员，但因为没有得到足够的重视，和kb分子在一起，准备建立新的政权，至少是有实实在在的矛盾冲突的。而《狼》的反派直接是一朵大奇葩，作为一个雇佣兵头子，莫名其妙就把雇主给杀了，然后自己出钱出人出力，就为了跟吴京对着干，根本不在乎自己这样做以后江湖上谁还敢雇佣自己，也不在乎以后谁还敢跟着他干，更奇怪的是既然要杀雇主，也要杀吴京，却听雇主的话放了吴京一条生路，我想了很久，还是不理解这个设定，希望懂的兄弟给解答一下。

4.特效，这个见仁见智吧，《空》的空中格斗我个人非常喜欢，《狼》的打斗动作也不错，吴京作为功夫明星出身，这方面一直很强。不过枪林弹雨里的流血的特效真的是太差了，感觉有点像使命召唤里的流血特效，在这方面可以借鉴下《血战钢锯岭》，特效真是好的多。多说一句开场的水中打斗戏吧，其实水中是发不上力的，子弹都没太大力，别说拳头了，不过很多电影都有水中打戏，也不是《狼》自己创造的，不作为电影槽点了。

5.以上都是些大的方面，其实这几个方面没做好，电影整体就崩了，至于说主角刀枪不入，剧情需要也没什么说的了，但我还是要反驳一个观点，“美国队长怎样怎样你们都不说，非说冷锋这样就不行，这就是崇洋媚外。”队长是科幻片，队长注射了特殊的血清，队长还要跟灭霸作战，性质不一样的好吗。再说了，《狼》在国内，的无论是评分还是票房都是超过《美队1》的，这不恰恰说明了，国内影迷对国产电影的包容吗？《队长1》是不那么好看，也没有我上面说的几个硬伤吧。

6.楼主也算是阅片量比较大了，有些导演刻意创造的情节真的是看不下去，而《狼》恰恰是一部处处见刻意的作品，比如说披国旗过交战区，这个事是有过的，是说在一个动荡地区，我国国旗是一定程度上的保护伞，尼玛，不是说两方交战人员近距离突突，看见一面中国国旗就停战了好吗？这也太科幻了，人家都杀红了眼，你玉皇大帝如来佛祖旗过来都不好用好吧，一个营救任务即将完成，难道不是开着车绕道吗？居然一头扎进战场里去，万一别人不买你的帐怎么办？我知道吴导想把国旗通过交战区这个情节加进去，但这个加法，真的是刻意到我无力吐槽。再比如说，吴京和女主误入瘟疫区，放下了些食物，然后这些灾民在死神面前给远道而来的中方友人热烈的鼓掌，要表现中非友谊也不是这个样子吧，你不给人家就上来抢了呀，都没几天活头了，至于给你鼓掌么？再多说几个吧，吴京一行人逃到大使馆附近时突然从汽车上扛下来一个女人；老林安排上飞机时大喊，中间给我让出一条线，让我们看清你们。这些设定，处处体现着导演的刻意，让我很难受的刻意。从这个角度来说，吴导距离一个优秀的导演还有很长的路要走。

写的有些杂乱，总结一下吧，《战狼2》有它优秀的地方，但不足也非常多，最大的问题在于，听不得反对意见，我想我们都是对国产电影有很多期待的，而不是一味的把差不多当成最好的，更何况有些片子还不一定是差不多呢。我经常说，我们要“论而不争”，我有我的意见，也尊重你的意见，希望你也可以尊重我，愿意讨论可以讨论，扣帽子就没必要了，如果非要争，可否先回答我一个问题，为什么雇佣兵的小型无人机不需要弹药就可以无限发射呢？",6.0,,0
137,137,26363254,战狼2,5eb2089bdfa0e7efcb3ffe9a8ebf88a7,58a417a67ca4ebe34f29af9766e3f22f,1.0,2017-11-27 17:01:54,"一开头的海里打戏就把我腻住了，好恶心！当着警察面飞踢强拆流氓（不知死没死，死了怎么才判3年，没死怎么会判3年那么久？半死？），未经同意就要带小黑孩回中国，我只能说吴京三观非常清奇。非洲国家战乱中国使馆人员出面立刻逼退刚才还在胡乱射杀的匪军，大国崛起了！海军军官和使馆人员一见面就不像俩大活人在讲话，我还奇怪这聊的是什么呢？互相居然还能沟通，原来是为了引出营救Dr.陈的情节，电影语言差评。于谦告诉吴京关于子弹的线索是为了劝他不要去送死？还是要送他去死？这情节是闹着玩吧？跟春晚小品似的，原来碰瓷的老头是为了给站岗的警察同志送饭饿昏在车轮前，编剧差评。海军军官摇头摆尾一脸火气地说：没有联合国允许我方作战部队不能进入交战区，但我们要坚决完成撤侨任务，只能由一个人独自进入完成任务。我了个大去！这是人说的话吗？幸亏有吴京这个集国仇家恨于一身又能打的在场，这任务简直就是天造地设一样的难得，结局吴京这角色就会洗得比白莲花还白吧？如果死了那更是得感天动地哭倒长城吧（不会死的，还要战狼3呢）？你这次的行动没有支援没有盟军也没有武器，陈博士还有四十七名中国同胞都带回来，ex扣me？真是又要马儿跑又要马儿不吃草。这都是人话是人干事吗？所以就把这么重要的陈博士还有一个也不能少的四十七名中国同胞交给了这个突然不知从哪儿钻出来的前特种兵，看来即使救不出来也没什么大不了的，替陈博士心塞。坏人们从哪儿听说Dr.陈的，谁都想要他，却连他什么样是男是女都不知道，这是生活在古代吧。妈蛋！吴京开着车就冲进医院了，不怕撞死无辜百姓吗？每个镜头都有槽可吐，这是要累死人了！Cao泥马，听说让保护好Dr.陈的黑人小女儿，立刻拽着人家让跟他走，小女孩也不傻，挣脱了他，这会儿子弹可都在往他身上招呼啊，而且其他人他就不管了？打了一圈，医院里的雇佣兵骨干分子一个也没死，而且伤好像都没伤，不舍得多雇几个反派是吧？差评。那个跳到他车上的女雇佣兵也是个二百五，一般只有主角才那么拼命，你没必要吧。而且明确那女的和小女孩不是Dr.陈，他们穷追个毛啊。（原来小女孩是活药引，反派明显被剧透过，不然就是跟吴京同样的高智商。）特意嘲笑了美国使馆和海军陆战队，用贬低别人来凸显自己的做法挺小家子气的，而且你也是偷偷摸摸进来的，正式救援也没进入啊。当人面侮辱对方的国家，我只能说，吴京你素质够低的。塘主还是那么霸气，如果他不是工厂的少主，我只能说管理层全是神经病。还真是老板！ 吴京总能未卜先知子弹炮弹落到哪儿，第六感强到不像纯爷们。坏人不走运，石头都帮吴京。吴京是不是原来古装片拍多了，传染病发作了跟中了毒镖似的。武装分子不要走，撤退命令再紧急，把吴京一枪干掉也来得及，花不了5秒钟1颗子弹几块钱。原来是叛军首领意识到中国是个负责任的大国，是联合国常任理事国，所以不能杀中国人。好的，吴京，我错了，你说服我了，全身心的。吴京眼睛变黑了，马上要从战狼变狼人了，不用担心了，大家有救了！好悲情啊，刚刚拼命打斗，得了恶疾却得不到关心的怀抱，shame on you, shame on all of you.但要其他人怎么办呢？而且说他救了其他所有人的命的说法我也不认同，确实坏人的目标是他们几个。不过工厂不给辆有玻璃的车有点说不过去，心都黑了，资本家呦！原来感冒发烧可以治病？当然不，原来女孩有抗体，输了血，吴京就好了，甚至比得病前还硬朗，血型也正好对的上，说不定小女孩就是O型万能熊猫血，苍天有眼！当然不是！原来已经有药了！！吴京你又吓唬我们，其实你是中国队长改了基因力量增强并不会死对不对？反政府军并不知道Pasha是活体药啊！如果这时候让吴京露出真面目，一枪干掉女医生，掳走pasha和药，原来他才是反政府军卧底，我会多给这电影一分。磨树枝，做弓箭，你们是不是吃饱了撑的？妈蛋！好容易做了几只毒箭，全用在喽啰身上了。那美国女医生德行品格比吴京不知高到哪里去喽！吴京居然硬把女医生肩扛到飞机上，留下一队等待看病的黑哥们儿！好爷们儿啊！我代表其他病人艹你祖宗！吴京蹲地上等直升机起飞的表情，简直帅。。。找揍透了！！又是典型的关系凌驾于秩序之上，比起电影开头一点长进也没有，三年牢白坐了。吴京不但能救人，还能救飞机，爆炸冲击波根本震不动他，坦克也不怕。女医生被他心肺复苏差点救死，幸亏他及时停手了，要不她差点缓不过来。两人抱头痛哭。我要是女医生就冲他喊""You almost killed me. You Motherf*cker""。吴京就是牛，能把坦克开出法拉利速度！吴京是河北人？不是！吴京仗着导演光环和主角光环，硬是把坏人的智商拉到了他想要的程度。吴京你再不变身真来不及了，其实你不光是中国队长，还是蜘蛛侠雷神绿巨人，身上那片黄的压不住你的！关键时刻想想孙悟空！妈蛋！黑人Diva唱amazing grace了，这不是在侧面说明美国文化影响巨大吗，为什么不唱一条大河！！吴京还是牛逼的，干不了别的，举个手机录个像秒连作战指挥部，同时收获敌人位置和屠杀我人民罪证！钢铁侠也做不到啊！北京爷们儿最喜闻乐见的终极武器板儿砖终于亮相了！原来，他只是需要别人拽一把就出来了，傲娇。妈呀！导弹啊，这不死也得死啊！子弹也找着主儿了，定制的吗？在每颗子弹上都雕花？太浪费了把。不过好在这时候亮相了，不然真来不及了，电影就要结束了，这下好了，一举多得，一个梦想也没浪费。中国导弹，牛逼，长眼！比子弹精确，杀伤力也不铺张，需要多大爆炸就多大。“别打了”她们也喊出了我的心声，吴大大，别打了，我真的吃不下了，太撑了！反正我见识少，这么尖的子弹没见过。过不去的坎儿也没关系，有国旗就好使，你们都得感谢国家！而且这还是面特制国旗，吴京的粗胳膊都能套进去。以后中国国旗就是隐身衣，就是特洛伊！妈蛋！就这么两步路中国还有联合国维和部队不能去接一下？！我要是吴要强就把他们先突突了几个。果然是真超级英雄，结尾还安排了彩蛋，这是在阿拉斯加啊？吴京停下狗拉雪橇，从怀里掏出根大骨棒咬了一口，塞给了阿拉斯加，阿拉斯加啃了两口，又递回给吴京。   整么说吧，这个电影看下来，只有吴京被痛殴的时候我才稍微出口恶气，原谅我，铁汉吴。   中国观众就这么缺春药吗？强拆现场非要靠以暴制暴，必须要有后台才能把事儿平了，这到底是反映现实呢还是农村或者市井英雄主义的惯性思维？之前看采访，吴京说自己不够老男人味不够凸显。这电影上映之后又说了不少听上去容易遭受非议的话，不过貌似也不全是别人别有用心断章取义，靠好勇斗狠拼酒撩妹体现男人魅力，思想境界还不如赵家班。   画面交代不了情节还要靠字母旁白补充，差评。特效给7毛，不能再多了。   最后的最后，还是诚挚的深深的失望的，这就是我们的票房冠军！这就是个大舅客啊！",10.0,1.0,3
138,138,26363254,战狼2,91afde85d03bf0ed5eb680c0ec8337da,2109848cdf9374a89a93ca02eb04178b,1.0,2017-11-27 02:18:21,看完只能用小岳岳一句话形容：“我的天那！”真不知道这部片怎么来的那么多票房？台词僵硬毫无幽默感，演员做作（尤其张翰），于老师让我有跳戏的的感觉。剧情老套没创新更是毫无逻辑可言。整个剧情看不到高潮，没有起伏，更没有惊心动魄的感觉，因为根本不用担心主人公会死嘛。个人英雄主义是可以有，好歹不要太夸张嘛，不然我以为你是蜘蛛侠超人呢。总之看完觉得吴导只是要表达中国在非洲很牛b，中国人永远打不死。很抱歉完全没有激发出我的爱国心，反而觉得很反感。,6.0,2.0,1
139,139,26363254,战狼2,eef602b95c3b990f5fe68a52fe059ec3,3a63256f84ecbe187d0930034955068f,3.0,2017-11-12 07:22:08,昨晚上看了《战狼II》，还行吧，评价如下：这是一部中规中矩，毫无新意，制作有点粗糙的标准类型片，美国B级片，甚至有点小成本B级的水准。没看之前还以为作为精神食粮他应该达到了北京烤鸭的程度，现在看来顶多是个红烧排骨，而且火候欠佳、调味生硬，还拿腔肋排冒充肋排在原料上作了手脚那种，可以算是中国的逼级片吧。其实也就是美国院线制度比中国严格得多，很多相当用心的B级片上不了大银幕，只能给编导演练手用，不然票房绝对能吓人一跳。中国没这院线和分级的忌讳，所以玩出这么个高潮来。 至于这么高的票房说明了仨问题：1、说明中国人民的大众审美跟美国人民一样，压根没有中国特色这一说。既不高人一等，也不低人一头，口味一致。2、在中国文艺作品普遍是屎是蛆，吃糠咽菜等于改善伙食的大环境下，突然给你来这么一碗红烧排骨，食客（观众）能不跟疯了似的买单么！3、足见现阶段甚至可以说一直以来，中国的主要矛盾尤其是精神领域就是中国人民跟美国人民一样的需求和远远低于美国社会的供应水平的矛盾。美国的心中国的命，发达国家的心落后国家的命，超级大国的心失败国家的命，小姐的身子丫鬟的命……诸如此类。想想给西藏农奴吃块糖就能配合共产党削奴隶主搞民主改革，金珠玛米伢咕嘟的膜拜起来。一碗欠火候、调味平常、食材作手脚的红烧排骨卖出了满汉全席的天价，中国观众其实也真够可怜的～～ PS：我跟其他人不一样，他们觉得精华是抗拆迁那一段，而我则觉得军迷那段设定才是真心不错，B级味十足，bbGUN熊孩子分分钟变战士秒杀专业雇佣军，比拆迁还抽政府脸。,1.0,,0
140,140,26363254,战狼2,5e66cd2cd2cc0466cef4f4cddfee791f,6a5a5de1232e47a8307a5caf65003901,3.0,2017-11-07 12:08:27,上周末，我终于看了这部史上神剧！关于这部电影的所有优点、槽点都已经被扒的没啥扒的了。讲个故事：传说上世纪九十年代中期，各国首脑在纽约开了一个闭门会议，商讨怎样让自己国家的人民越来越顺从。根据心理学研究的结果，人们如果长期观看娱乐节目或者低水平的影视作品，会被这些节目所宣扬的价值观影响，从而智商被降低。与会的首脑们听到这个研究结果，大喜过望，这是个好办法啊。我们回去就让自家的电视台制作一些弱智节目给我们的国民看，久而久之，他们都变成弱智，自然就成为顺民了。这个办法在其他国家有没有效果，我不知道。但是在天朝，你看看过去这20年银屏上充斥的娱乐节目，凡是有点深度的要么被禁播了，要么被改造了；现在荧屏上播的节目有几个能看的？ 所以，这部电影成功了！但是我必须说，吴京的敬业的拼搏是非常值得尊重的，这点是毋庸置疑的！,2.0,,0
141,141,26363254,战狼2,7081f463ae8bda6403139c5e3f411b32,0154e79e142c1c73e0859db1b7ce523d,1.0,2017-11-07 02:33:03,"深夜放毒
战狼2从昨晚看到现在，确实有话要说。
电影院播放的时候没去看，可能是因为当时没钱吧，嘻嘻，反正是没去看。
当时朋友圈晒电影票的非常多，同样身边的朋友也吵着去看，同时关注的公众号也在说这部电影，当时跟着关注了一下，最主要的是这部电影票房离奇的高。
当然也有一部分人是买了吴京的帐，对吴京这个人，小时候还喜欢，因为他也喜欢上了太极。
犯我中华者虽远必诛，朋友圈吵着男人就该去看，爱国主义者就该去看，好多女的都去看了，嗯，这时候就有爱国情怀了，对于中国人，我一直都很无语，这一点吴京确实聪明，从国际情景，边防问题，以及今年严峻的国防问题上来说，这部电影占了便宜，反而让我觉得中国人最大的特点虚伪在这部电影上体现的淋漓尽致，看过战狼2的都是爱国情怀深的，哈哈，反正我没去看。
这部电影有着极力反天的炒作，借着国际问题炒作，仔细想想也有，肯定有，并且赞助的公司媒体，大多数都有实力，没有炒作鬼才信了。哦，对了，关于炒作，这也是中国人最大的特点，中国的炒作是全世界独一无二也是霸占榜首的。想说，试问中国的媒体有几句是真话。
还有说这部电影，是最近几年中的一颗青石，好，说说这两三年的电影电视，搞笑的很，傻逼导演傻逼明星，最后被一帮无知少女养着，确实这样，什么傻逼跑男，这种烂节目都霸占榜首了，还能说什么，中国的观众都成嘿嘿一笑的傻子了。在这样的电影中有这样一部算是好一点。
还有说这部电影可以跟好莱坞的比了，能比吗，只能说是三岁小孩，这一点我极力反对，有侮辱好莱坞之作，中国的电影要赶上好莱坞，至少还得几十年，因为你中国的教育赶不上去，你电影还能比吗，中国的教育搞不上去，中国的关观众永远都是嘿嘿一笑的傻子。还是慢慢搞教育吧。
最后影评，看了这部电影，我回到了小时候玩魂斗罗了。文化艺术咋就不提了，在中国的电影影坛提这几个字，感觉有点吐血有点侮辱这几个字，从头到尾都是吴京做了一场梦，自娱自乐。我的评分仍然不及格，评这种剧有点浪费口舌。
我想不通的就是怎样的炒作让这样一部烂剧票房极力反天的，有点让人担心所在的是一个怎么样的国家。
不得不为中国的电影担心！",8.0,2.0,0
142,142,26363254,战狼2,598cf69580beec8486005c103fe7665b,b74977f209441bd5549f565638db9346,4.0,2017-11-04 18:29:57,文/进击的小懒人 首先，这作为一部动作片的话，我已经是非常满意。 自高中起，我就特别喜欢看动作片，刷了很多很多，好多都不记得名字了，有让我看得想睡觉的，也有让我看得热血沸腾的。《战狼2》里面的枪战和搏斗，我还是认可的，虽然并没有特别让人眼前一亮的打戏。其中，吴京那把刀几次出境，我还以为他最后要拿它消灭敌人，没想到是那枚子弹……有没有人科普一下，手戳子弹是否真能爆头，那需要多大的力气？我稍微保持点疑惑。冷锋和达康书记联手扫杀；冷锋独自一人闯工厂，木质弓箭荼毒射射射；与反派大boss搏斗这几部分，还是很值得一看的。 不太能理解吐槽影片暴力血腥的，我仔细搜索一下动作片库，没有几个不这么暴力血腥啊…… 最好的解决办法还是出一个电影分级标准吧。 在情节上，该片走的就是典型的好莱坞英雄片套路嘛。一个人，或者一个小队，因为各种各样的原因，被切断后援，只能靠自己去营救他人，或者逃生。没什么不妥，非常中规中矩的故事。要说不妥的话，我觉得开篇冷锋的入狱的过程有点儿突兀，编剧应该可以编一个更自圆其说又突出主角性格特点的故事。 但是有一些情节逻辑吧，总让人觉得有点儿奇怪，比如反派拿下这片厂后——按我观影多年的经验——他们应该逼问冷锋下落，顺便广个播，明天午时你不来我这里送死，我就一个一个解决他们之类的。 不过作为一个动作片，故事的完整度还是可以的，有前因后果，有冲突，有转折，有递进。虽然我比较疑惑的是，陈博士才刚刚研究出来的药，还没做过任何一次活体实验来验证效果，怎么反派军这么快就知道并且大开杀戒？    剪辑上么，确实有点儿缺陷，一个是有关情感的部分，反正那几个镜头渲染的不够到位，然后重复镜头又多了点。一开篇的大战海盗片段，让我到现在还有点搞不清时间线，这个应该是冷锋出狱后去非洲碰上的吧？你不觉得这段是强行放在开头为了秀一段打斗的吗？然后画面突然转到了拆迁现场，还没写个“三年前”，我刚开始还以为海盗那段是一次任务呢。 我在看的时候，顺便给我这个影评想了几个副标题：论直播的重要性，论航拍的重要性，论中国的重要性……在论中国的重要性那方面，可以表现出来，但是开篇那部分其实就够了，结尾穿过作战区部分实在有点多余，何况那个人不知道为啥迷之微笑着说是中国人。兄弟你为啥笑呢？优酷不允许我保存gif动图，我只能放一张截图了……  搞笑部分吗？几乎没。那其实也没关系，可是张翰真的是演任何一部剧都是满屏的“霸道总裁爱上我”气息，我就看看你们尬聊熊孩子的问题，我不说话，也笑不出来。 吴京的硬汉演得妥妥的没问题，吴刚真是惊喜，一点达康书记的柔弱都没有，就是一铁血汉子，班长，你好，班长，佩服！ 特效嘛，我就真的不多说了，泡沫的砖头，说不出感觉的直升飞机……    总的来说，是一部我还比较满意的动作片，虽然中规中矩的了点，但是是国产的呀！已经算国产动作片里还算不错的了，希望今后能有一些其他方面的突破，包括人物的塑造方面，抖包袱的时机，另外，求不要再来霸道总裁了，谢谢您嘞！,2.0,1.0,0
