,Unnamed: 0,电影id,电影名称,用户id,用户名,评分,评论日期,评论内容,有用数,没用数,回应数
0,0,26363254,战狼2,ef754bbc805564396e0e2ea2ee3defd0,f68d9883a74d1aff9be0694c8cdf584a,3.0,2017-07-31 13:03:50,什么时候开始，中国电影经不起一点批评？   文 | 执麦者  2017年7月31日   中国电影市场，是好，还是不好？   截至到2017年8月6日实时票房，《战狼2》累计票房31.09亿，超越《美人鱼》在2016年创下的33.9亿的中国内地总票房记录，咫尺之遥。   说来奇怪，在内地总票房排行榜上，排名前十的作品，居然只有两部豆瓣评分超过了7分，一部是去年被自来水蜂拥推荐和赞美的《夏洛特烦恼》，一部则是《战狼2》。   而显然，《夏洛特烦恼》的制作诚意，在电影品质上，受到的争议，远远要小于《战狼2》。包括《美人鱼》《捉妖记》在内，几乎都是在争议里，一路势如破竹创下票房记录。   《美人鱼》在营销中宣扬的“欠星爷的一张电影票”，成就了它至少在现在还保留的中国电影票房第一的称号。   事实上，你不得不承认，在一部电影安插上一个极具话题性的标签，在网络社交时代，传播性极为快捷的病毒式扩散。   《百鸟朝凤》被方励一跪，从而票房翻身，这件事被电影业传播了很长一段时间。之所以电影能够从一部立意落后的文艺电影，成为年度佳作的原因。并非方励的跪地，如果跪地就可以换来几千万票房，以中国电影人现有的节操，估摸着每次电影发行，制片人都是愿意下跪的。之所以独得成功，缘由是方励直播后，媒体的关注，观众怜惜，加之导演吴天明老师过世，在诸多情绪的包裹下。媒体跟进，社交平台，到处都有关于心疼“匠心作品”的发言，一旦网络这个利器打开，几乎以网络为平台社交的年轻人，被“情怀”和热点事件吸引，流行性的观影，和好评，便成为中国电影历史，一个新的现象。   十年前，中国电影方兴未艾时，纵然电影票房不高，院线不够多，但是实实在在，每一部电影的评分匹配品质，都算实在。十年过去，中国电影市场，迎来了资本时代，看电影，已经成为时下年轻人，最大的消费方式之一。晒电影，以及晒简评，也成为社交平台，最流行的生活方式之一。   但是，中国电影品质，并没有随着市场的转温，而真正迸发。大量的烂片，充斥市场，早年那些依靠佳作，盛名在外的导演，已经开始胡言乱语，撕破底线，似乎当年的初心，在票房的诱惑下，变得毫无原则。   电影，越拍越烂，而引进片多数为视觉大片的前提下。中国多数电影观众，并没有建立其完整和成熟的观影思维，和评判理智。在“羊群效应”的驱使下，在烂片的大氛围的厌恶下，人们还算不敢造次。一旦媒体发功，水军出动，就很有可能出现，网络上的超级口碑，实际质量平平的作品。   一旦电影，成为粉丝电影，他们形成的保护效应，和反击理智声音的能力，会前所未有的放大。烂片在历史的最终评判里，还是会很烂，那些票房大卖，得分尚优的佳作却未必真的很佳，这大概是华语电影，目前经历的一个尴尬的时期。   《忠爱无言》，论电影立意，是有其感人之处，但是电影品质，实属平庸。但是依托先行上映的引进片《一条狗的使命》，引发许多爱狗人士的集体飙泪。但是实际上《一条狗的使命》本身电影品质就粗糙而直白，远远不如早期宠物题材电影的细腻，深沉。和《忠犬八公》等电影相比，这部电影显得急躁，而煽情刻意。虽然电影的一些元素还算新颖，但是的确难称佳作。   比起这部略显矫情的作品，《忠爱无言》除了依托题材的的真实性，电影技巧实在难言专业。但是依托水军的强大力量，宣传上的“宠物情怀”的绑架，不明真相的电影爱好者，便开始跟从性的好评。和容不下客观性的评判。   这就好比你吃到一坨屎，当所有人不敢说自己迟到屎的时候，你还是会随大流的说好吃。   其实形容吃屎也好，或者说你赴宴吃到难吃的东西也好。最终的结局是，你长期的这样被潮流审美，其结局是，你永远没有真正独立的思考，和底蕴性的审美。   如批评不自由，则赞美毫无意义。   这句话告诉我们的，在现有中国的文艺境况里。中国很难衍生《霸王别姬》《活着》这种艺术大师级电影，甚至很鲜有《阳光灿烂的日子》《让子弹飞》类型的商业电影。   《湄公河行动》固然拍得激烈，雄壮，但是在电影工业的评定里，它也只是依据电影规划的优秀之作，并不能一味的因为涉及国家荣誉层面，就需要另眼相看。在网络上，任何稍微质疑其电影品质的言论，都会遭遇围攻，谩骂，奚落。这种只能听得见赞美的现象，的确是极为可怕的一种行为。   你可以诋毁《小时代》，那是因为媒体盖棺定论它是烂片。所以，人人可以踩一脚的嘲弄。但是你千万不能批评《湄公河案》《百鸟朝凤》一句，因为它有“国家”“情怀”护体。   电影的本质，因为是电影的本质，它有艺术的价值，时代的需求，国家精神的传播，但是一旦刻意绑架上精神和图腾。那么这样的电影，就成为一种特攻，和压迫。一旦，只允许歌颂，文艺本身就是一种失陷。   所以，不得不，吴京在经历影视行业起起伏伏之后，深谙电影产业的诸多门道。当然，也或许是他背后军师和制作公司的功劳。《战狼1》是一部合格的中国出品军事题材作品，也因为这样的政治正确性，所以才审查和拍摄过程中，可以获得更多政府性的支持。   《战狼1》的拍摄，吴京是冒着倾家荡产的风险。毕竟此时的中国，最流行的，还是青春题材作品。但是正是因为电影产业的跟风，和荧幕上青春题材的萎靡，造作，娇柔，使得硬汉题材的《战狼》取得了异常不错的票房和好评。   比起2002年那部后半段有些浮夸的同类型题材电影《冲出亚马逊》，《战狼》实际上仍然是这种塑造“美国队长”式中国军人的形象。对于中国这种尚武，崇拜英雄的国家，观众是相当喜欢这种设定。   而吴京，从那个风流倜傥的“太极少年”，再到硬汉残忍的《杀破狼》杀手，到不死军人“战狼”，这一系列的变化。我只能说，吴京找到了自己最合适的商业荧幕塑造形象。而就此，电影艺术的吴京，恐怕不会再有多的造诣。   并非涉及军事题材，个人魅力就会消失。只是，演员的责任，是诠释好的角色，一旦被角色所固定，你可以得到商业上的回报，但是艺术性必然折损。甄子丹当年拍完《叶问》，票房大涨，但是成也叶问，败也叶问，后期的甄子丹，再无超越之作，甚至风格固定，火了两年，一时无两，后颓败。   说回战狼系列，第二部的品质，不做评价。我个人认为军事题材作品，其实反而是纯商业作品。眼光敏锐也好，投机题材也好。总之，3天近10亿，十天逾30亿的票房，可以佐证这种“倾家荡产”拍摄的眼界。   只是仍然不愿意看到，在各大视频网站，多数著名视频Up主商业化推荐电影，网络明显水军带节奏的前提下，豆瓣、时光等电影评分网站和自媒体平台，几乎容不下一点质疑的声音。批评不懂电影算小问题，提升到不爱国，就算是其心可诛的诡辩了。   吴京在近日的采访里，也回击到，大意是说中国需要英雄式荧幕形象，不能够只有美国才有离奇的剧情，中国拍，就是烂片。   事实上，电影，本身就是许多不合理情节的结合。但是，好的电影，让你在观影过程里，接受所有超越人之常情的设定，自然而然的接受。而反之，你时刻能够感受电影在喜剧，热血，或者感动里跳戏，即便在票房上，他们能够成为成功的商业电影，但是在电影艺术创作下，不可以盲目歌颂。   票房能够体现一部电影的优秀，正如同一个的美貌可以证明一个人颜值；但是完整的电影结构，和剧情的设计有加，内涵提升，才是一部电影真正的文艺魂魄。   而一旦把不喜欢，或者剖心一部电影的缺憾，上升到不爱国的层面，你和这种言论的人，已经不再是一个思想和道德层面。如果以这样的角度结合时代的本质来审视一部电影，你会发现，电视剧里所厌恶的“手撕鬼子”，只是另一种的变种的不可战胜。   电影工业娴熟的好莱坞，美国队长和漫威电影体系之所以被追捧，是因为他架空历史的“凭空捏造”，既隐藏了美国梦，又巧妙的把美国人渴望的面对战争和军人的精神，流畅的表达。中国人，最懂得的留白，在电影工业上，恰恰是美国人玩得最溜。爱国太突兀的话，这样的表达，往往就会尴尬。   而一部电影，因为刻意标榜爱国，而多出来的分数，恰恰是这部电影，现在需要减去的分数。   我个人觉得吴京是一个很好的演员，《战狼》系列也是很有诚意的作品。但是，过度的捧杀，对于中国电影，和文艺本身，毫无帮助。   最后，祝愿《战狼2》大卖，更希望中国电影，和文艺，更成熟的成长。不仅仅是商业电影，粉丝电影，爱国电影可以盛行，那些可以启发人类的美德，善良，爱和感动的电影，也可以被珍视。而独立思考，永远是一个人，面对生活和文艺作品最需要的品质。,16595.0,2748.0,5494
1,1,26363254,战狼2,3172eb8dca15a3eb70ec1333d04da6ca,90df5d435d2d5703505ab6be7a9d9b3d,5.0,2017-07-28 00:45:18,电影的原型是2015年的也门撤侨事件  2015年也门危机，中国海军直接派出2艘054A护卫舰，开进也门亚丁港  由于当时港口外枪炮轰鸣，中国海军入港全部自主完成  中国驻当地使馆和全副武装的武警特勤在岸边保护中国侨民  而054A护卫舰直接靠港，舰上的海军特种兵和水兵持枪下舰，拉出了警戒线  当时054A上的730近防炮已经瞄准了岸上的冲突地区  最终，两艘054A护卫舰已最快的速度撤侨  而当时的美帝表示“鉴于也门形式非常危急，不可预估，派军队撤侨会让美国公民至于更加危险的境地”  在影片中，吴京对女主说的那些话，虽然在影片中只是一个笑点，但并不是空穴来风     所以看到很多短评说这部电影是中国人的意淫，是浮夸，是一部非常垃圾的主旋律  很不赞同  几乎里面所有内容都是有证可考的  我不是军迷，但我也知道中国特种兵在国际比赛上屡获大奖  我不关心时政，但我也知道也门撤侨时候所展现的中国速度  或许唯一意淫的地方，就是被强拆时一打五十的豪迈了   说回到电影上面  可以毫不夸张的说  完全可以把《变形金刚5》、《速度与激情8》给爆出翔  这是一部十分成功的商业电影  笑点很多，泪点也不少，铁汉柔情，打戏燃到爆  最重要的是，有共鸣  走出电影院外的时候，一个不算太大的小姑娘和她男朋友说  这是她看过唯一一部想哭的电影  当那些导弹从战舰上面发射的时候，真的看到了一个强国的影子   吴京、达康书记、赵东来甚至包块张翰的演技全部在线  唯一不在线的或许就是女主角了，但这姑娘的大长腿承包了一半的屏幕  我也不计较她捉急她和梅根福克斯有的一拼的演技了   情节方面可以算是十分紧凑，一张一弛，有笑点，有泪点   逻辑方面只有略微的瑕疵  小女孩的活人抗体疫苗，我不是学医的我不清楚真假  但张翰作为一个嘴炮公子哥，竟然能活到最后，实在有些不可思议  还有雇佣兵杀死雇主，这确实是有点假了  除了这个到是没有让人觉得十分突兀的地方，所有的点都安排的十分合理，每一个伏笔都用的很好  至于主角开挂，无限子弹，无限生命，这是世界所有动作片的通病了   剧本安排的不行到是真的  一开始，我以为片中的主线是吴京的找到杀死余男的凶手，然后复仇  然后画风一转，造反了。OK，我觉得这是吴京保护于谦，因为瞧于谦那样就知道他一定知道这枚子弹的底线  剧情在这都在我的预料之内，但之后就出现了莫名的偏差  救陈医生，救小女孩，救工厂华侨，自己被救，在救华侨，然后又救华侨  你忒么的就不去报仇了？  剧情的主线已经成功的从复仇变成了撤侨  PRG变成了塔防了  直到最后的时候，大BOSS才说这妞很漂亮  什么玩意儿啊，这编剧MDZZ吧，你这样子干嘛不直接把这条线给删掉啊  看到最后彩蛋，才终于不纠结了  因为我很想直到吴京会在余男和美国妞之间怎么做出选择  这点十分考究编剧功力   至于人物的塑造，并不是太过于扁平化  除了大boss是绝对的邪恶  其他的主要人物都算是比较丰满  吴京是军人，但被于谦坑了之后，看到自己干儿子偷茅台的时候，也没说什么  那个大个子，也算的上铁汉柔情   最后要说的  电影最后一幕 是中国护照上的一句话  不在国外艰难生存过的人，永远不知道原来春节联欢晚会这么好看，竟然能把人看哭了  不在国外经历过战争、瘟疫的人，也同样不知道护照背后的话，是一种无形的力量  不走出去的人，永远不知道家的温暖   我是一个资深的足球迷  从02年到14年，经历过了四次世界杯  每次世界别的时候，总是在贴吧里面对骂  德粉小学生，意粉脑残，英粉伪球迷，阿根廷没球王，诸如此类巴拉巴拉  意大利赢了，球迷们会高声欢呼，我意赢了，  西班牙赢了，球迷们高声欢呼，我西赢了，梅西万岁  德国队赢了，球迷们会高声欢呼，我德赢了  哪怕日本队赢了，球迷们也会说，我日，赢了  那如果中国队赢了呢？我中赢了？我华赢了？  不不不，那一天，所有的中国球迷都会说，我们赢了！   国家在一点一点的强大，虽然依旧有许多的缺点，但这是我的家  中国电影也在一点一点的崛起，虽然烂片依旧很多，但能不能不要双标，不要看都没看过就随意的诋毁，不要受美分影响？  多一点包容心，不要用一大堆的批评、讽刺来衬托你的专业性  别忘了你是以一个中国人的身份看的电影,28575.0,5730.0,6959
2,2,26363254,战狼2,d1c4bea0ef7dd7bf79a7057fc5392b0f,3b3442cee7b8f9b50cf5efb8e3350326,2.0,2017-08-03 17:20:18,"第一篇长评下面有很多人表达了疑惑、谩骂、支持。 https://movie.douban.com/review/8701257/（跳转） 以下，是我的回应。  不可否认的是，吴京通过战狼向观众传递的积极的价值观，以及它为激发每一位观众的民族自豪感而做出的努力。 但是如果一部电影，只要一个正确价值导向就应该被表扬，那么每年全中国上映的那么多部电影，就没有什么可以被称作烂片了。至少在我们广电总局的严格审查下还能够上映的作品，向来都是政治正确的。 如果这个逻辑被认可，那么以后好作品的标准就简单了，只要使劲歌颂赞美，只要符合我们社会主义核心价值观，那么这就是一部好电影。 这几天，几个平台都一些关于战狼2的差评，但无一例外地受到了绝大多数人的吐槽、抨击。 有的人骂着：卖国贼、美分、崇洋媚外的狗东西。 有的人问：为什么眼里装得下美国队长，却不容许有这样一个开了挂的中国队长的存在？ 有人的说：或许这部片子所有主演都换成白人，豆瓣的评分会高更多吧。 还有的人纳闷：既然史泰龙、杰森斯坦、阿诺施瓦辛格森这些人的电影都看得下去，那些给战狼差评的人，良心不会痛吗？ 如果你真有如此这般高尚的不容一点亵渎的爱国情操，或许战狼并不是最适合你的电影，隔壁的建军大业，更能让你的爱国心炸出一朵蘑菇云。 为什么我的眼里装得下美漫的超级英雄，却不许中国特种兵在电影里开挂？ 首先人家根本就不是正常的人类，两者也不是同类型的电影，那些下意识把美队和战狼做比较的人，是不是变相承认了战狼里那不符合正常逻辑的剧情呢？其次你真的以为战狼和美队有一丝丝的可比性吗？况且人家成片质量是真的好，这有什么疑问？就算拎出战狼里所谓的大场面，和人家几年前的片子相比都逊色很多了。难道承认自己不如别人，就是卖国？就是美分？就是崇洋媚外？ 我知道人家资金多，一部电影的投资都好几个亿，战狼的投资不过区区2个亿，能做到这样非常不容易了。但是差不多的投资（3500美元），同样是开了挂的主角，看看血战钢锯岭是怎么拍的。 这就好比上学期原本考二三十分的学生，这学期努力考到了60分，而另一个人每个学期都是八九十，发奖状的时候人们逼着老师把奖状发给刚考及格的孩子，说，这孩子基础差，进步了这么多，不应该把奖状发给他吗？ 是不是很可笑？ 也别说什么这部电影要是美国的片子，评分会更高。 得了吧。 这样的片子充其量也只是好莱坞流水线的水平，如果真是美国制造，只会被批得体无完肤。如果永远不正视自己身上的不足，一昧地对国产电影从宽看待，那么中国的电影永远也不会进步。 至于有些人把战狼和敢死队这类的片子做比较，但我就纳闷了，你以为敢死队是什么多么优秀的作品不成？既然你们这么钟爱这部片子，还自降身份和敢死队一比高低这又是何苦？ 这部电影真正问题不只是开了挂的主角，以及诸多的bug，还有在叙事、节奏、剪辑都存在不小的问题，而这些问题，不是一口一个爱国就可以掩盖的。个人英雄主义同样可以振奋人心，可是这样的个人英雄主义就是意淫。湄公河行动力的张涵予和彭于晏都能力出众，可人家也知道团队相互协作的重要性。他们面对只是一堆毒贩，可是战狼里面对的是全世界最厉害的雇佣兵以及非洲的反政府武装，一个特种兵加一个退伍兵人和一个连枪都不会拿的富二代就足以抵挡。这合理吗？ 当然了，很多人视而不见。他们只看到那面五星红旗穿过战火不断的非洲草原，只听到吴京打死雇佣兵说的那句“那tm是以前”。就这么几个情节，就足以给一部电影满分好评。敢情电影史上的那些优秀的电影，一遍又一遍地打磨还不如人家往电影里埋几个爱国梗？ 所有人都在聊，这部电影拍摄有多么艰难，有多么不容易。 我必须要承认这部电影以及整个战狼剧组上下，为了这部电影付出的不屑努力。但并不是说你努力了，你就是优秀的。那些高喊着“吴京玩命拍出的电影，竟然有人好意思批评”的和那些承认喊着我的爱豆有多努力你们知道吗的小鲜肉粉丝有什么区别？ 不是用心拼命就足以做出一部好电影，不是努力了就能做出一部好电影，用功读书的人也不一定就能考出好成绩。 吴京和他的战狼还有很长一段路要走，中国电影也是。 我实在不知道战狼的成功究竟算不算一件好事。虽然它的成功，让更多电影人知道，这种题材的电影也是被需要被认可的，中国电影市场会更加繁荣。但是这是否又会导致，主旋律由此在中国泛滥，如同当年雨后春笋般涌现的青春片，又会不会给许多电影一些都投机取巧的机会，靠硬生生把“爱国”塞进电影，来绑架观众的爱国情怀？ 如果今天，因为否认一部国产主旋律电影而被网友扣上一顶“汉奸”的帽子，这是中国电影的耻辱。无端引起骂战的这些人，你们，就是中国电影的蛀虫，毒瘤。 我和任何人一样，无比热爱自己的祖国，我会因为自己是一个中国人而感到自豪，也为中国日渐强大而感到骄傲。 但非要我承认这样一部假大空，满是为了爱国而爱国的电影是一部好电影，抱歉我真的做不到。 如果批评不自由，则赞美无意义
公众号：我是尾号2473",4755.0,990.0,1587
