,Unnamed: 0,电影id,电影名称,用户id,用户名,评分,评论日期,评论内容,有用数,没用数,回应数
28,28,26389696,大闹天竺,6d5bda82a1b150adb43e5e03eb3ee1df,bfed3b43bbf40c377906afb033f49b98,4.0,2017-06-04 13:11:33,马蓉爆出轨的时候我个人也觉得王宝强是为了新片炒作，看了豆瓣影评，清一色说烂片的，我就放心了，上映半年后才看，看完之后就360翻转  首先说一下王宝强这个人，三观超正，爱国，说WE are come from china的时候，白客的语气眼神是很自豪的  重感情，对被抛弃深恶痛疾，恨爸爸，坚信弟弟一定会回来，宝宝把这种现实情感带入电影中  白客自己坦白撒谎的剧情，觉得宝宝本身性格也是敢于认错的，一般人肯定在撒个谎给自己解围。   选角色方面；白客是唯一一个面瘫却不被喷的人，表情很到位，和某凡对比起来，天分彻底碾压               小岳岳和柳岩也算是本色出演，发挥了搞笑的本能                银毛杀手的台词体现了东北人该有的风趣幽默                宝宝本身打斗的场景太多，飞檐走壁的，不难想象背后吃了多少苦才能拍出想要的镜头                   剧情方面：虽然整体分贝过高，但是抄袭的元素几乎没有。            见识了印度阿三开挂，头顶火罐，一台摩托车坐十几个人，小巴车顶也坐满人。            印度风情载歌载舞，印度歌舞是我一直喜欢的元素，阿米尔汗的电影里边经常会出现类似桥段            吃辣椒的场景，口中喷火，用了一台蒸汽火车比喻，很形象            另外一个是印度的歌曲，邓超唱的插曲“乱炖的木吉他”，笑到我了，细节用心            另外白客自己坦白撒谎的一个场景，抒情歌曲赵俊的“守护”，现在已经进入我的循环列表            重感情，对一块手表都有感情，不是爸妈的遗物这种电视剧套路，看到荒岛余生里汉克斯的影子            说宝宝鸡年拍猴年电影人，这是宝宝本人的情怀，他喜欢猴子有关的，并不为过            最后六小龄童重演孙悟空，可能是章老师00年后第一次重登银幕，感慨，一代人的记忆            不知名的老妖怪，红色菊花的底裤，真是萌到我了。       不尽人意的地方，金箍棒出来的剧情，还有最后六小龄童带着宝宝飞上天，这两点剧情太夸张      哭要笑呀的太多太用力，让我体验了什么叫辣耳朵      建哥的造型太辣眼睛       本人基本上看完了豆瓣评分高的电影，阿米尔汗，汤姆汉克斯，诺澜，大卫芬奇，史泰龙周星驰的所有电影  不下百部，优劣基本和大众眼光一致，不过对这部电影，真心觉得大多影评太不公道  其他明星被喷的时候，基本上评论里都会看到粉丝说，你知不知道xx有多努力，对不起我不知道，我想说看看宝宝打斗的场景，是容易拍出来的吗？  总体来说，比西游伏魔篇，从台词剧情上完整严谨的多，西游的台词，太多网络过期用语，演员表情动作，看的我尴尬癌要犯了,5.0,4.0,6
29,29,26389696,大闹天竺,c9095333b1362a9139a560ce06a06943,fbcaad37e912f7710c4a6e00462cb1b1,3.0,2021-10-29 08:39:54,我记得，这个电影上映的时候我还奔着王宝强的名头儿去电影院看了，结果真的就是开开心心走进去，一脸懵逼走出来，怎么能差成这样的感觉哈哈哈哈哈哈！事实证明，真的是有的人比较适合当演员，但是真的不太适合当导演，现在人人都想当资本咖，人人都想当人上人，但是有的人的资质真的不太适合吃这碗饭。。。,,,0
30,30,26389696,大闹天竺,915122396c287fc839e05fbc178e5a66,07540b148e356fb716029ea82372f6b5,2.0,2021-03-13 17:01:06,出场便是拆迁现场，挖掘机施工队布阵森严严正以待待小楼主人缴械投降却爱在心头口难开。为什么钉子户主武空那么厉害？从冷兵器到热兵器到唐少的高科技对他都缴械投降了呢？母鸡，只是插了一段“悟空，你尚有一难”便活生生的把猴子从西天扔到地上的镜头，便为主角宝强注入了不可剥夺的超能力。这里不禁想要吐个槽，武空能够无师自通从人头攒动的机场辨认出金毛银毛便是追杀唐森的刺客大概也该拜超能力所赐吧，不然剧情如何发展！ 被铁栏杆五花大绑的小楼就像围城，只见刚经历丧父之痛却毫无悲伤感的唐森少爷前来谈判，你陪我去印度取遗嘱，我便保你的小楼一生一世千秋万代万古长青。OK，没问题，换身印度风情服，梳掉头上的猴毛，Let's go！  说到这里真该佩服剧组的生拉硬拽能力：岳云鹏-朱天鹏-猪天蓬，完成了完美的变迁，更不要提后来将“悟净”抽象为“吴静”的想象力，加10分！总之他们按照西天取经的既定模式相遇相知相伴一路风吹日晒肩挑背扛到达幸福的彼岸……后来发现一个不痛不痒或者早已被观众怀疑已久以至猜到的结果：武空是唐森儿时失散的玩伴。如此煽情，怎能不打高分？看完我以为《大闹天竺》和8分相得益彰，回想过来营养价值并不高呀~ 过于苍白无力的剧情只能用搞笑的小插曲来填充，仿佛这就是吴静和天鹏存在的意义，顺藤摸瓜的回忆一圈下来，只有吃辣椒比赛难得的精彩。我不禁想问苍天：西游系列的冷饭还能炒多久？就算王宝强在影片结尾致敬六小龄童顺带贺岁也难以掩饰其对剧情驾驭的无力，换言之，编剧笔下的是水平还是水分深度值得怀疑。创新在哪里？趣味性在哪里？深度又在哪里？不禁想象公映时带着孩子的观众挂着一脸尴尬的表情将爆米花杯扔到地上轻轻踩一脚留下一个鞋印再唉声叹气的离开的情景，想象一对刚开始擦出爱的火花的情侣松开紧握的手默默无言一前一后走出电影院的情景，sigh。 有那么一瞬间，我以为《大闹天竺》被《三傻大闹宝莱坞》附体，因为那印度风浓郁的搞笑小插曲和它滑稽可笑的歌词。然而只是一瞬间，《大闹》距离《三傻》还有太长的路要走。 各行各业都在相互吐槽创新能力短板，做软件的吐槽卖汽车的，卖保险的蔑视搞风投的，一时间火药味浓重唾沫星子横飞即将宣布进入战争状态……然而抬头看看漫天星斗才发现自己还不是井底之蛙么，与其嘲笑别人不如提炼一下自己的脑细胞，好好在完成原始积累掘到第一桶金的同时完成一次真正意义上的原生创作。编剧们，醒醒吧！别再打着传承文化的旗号炒冷饭了，要炒也要有营养好么？编剧们，起来吧！重新评估下自己的想象力和创造力！ 海娜百川，好奇心旺盛的睡神，各类浅层文艺尝试经验丰富，如诗词创作、科幻小说、话剧编导、动画制作、美术设计等。2015年6月创建公众号“谁家郁金香”。（个人微信号：IcyConnieCat315）,,,0
31,31,26389696,大闹天竺,145bf1dc753d50cb019ab33e2e235130,d8f7de479b1fae3d85d341f380524de5,4.0,2021-02-13 21:03:51,其实今天再次看了一遍这个电影，更大一部分原因是因为赵英俊的《守候》这首歌吧。当然还有唐人街探案。作为一部商业电影我觉得三星到四星完全可以理解。毕竟每一个人的观点都不一样吧。就像最后被消耗的童年一样。明明我们都很怀旧童年时候的孙悟空，但是这个角色让某些人火了，然而某些人却让这个角色死了。我们怀念的不再是这个人，而是童年时候的童真和纯朴。还有每一个人向往猴哥那样的英雄榜样与自己的梦。而电影则是在大年初一上映，必定带有喜剧和爱情故事为基础。这个电影致敬就是我们熟知的西游记四人行。拼凑的四人正好夹杂着爱情故事加上迷幻色彩其实基本满足了故事的框架。而大闹天竺和基本设定都是印度天竺。故事的展开也基本不算太唐突。一波三折也还可以接受 ，开局就交代了还有一难，旅途必定波折，其中悟空的离开则是致敬三打白骨精片段。而之前的参加婚礼则是白骨精的幻术，这里则是二人的关系摩擦。两个人的故事展开则是在旅途中完成。以及柳岩和岳云鹏的加入，此时有点衔接不好。最后点题我觉得则是最差的。爸爸不容许儿子交朋友竟然没有给任何原因。我想的结果是儿子是收养的弟弟。最后爸爸安排的一出相认。皆大欢喜，走丢的人终于相聚。拆了的小楼也不在需要，因为弟弟找到了。结果居然是我帮你找爸爸。淦，最后的猴哥硬消费。基本一下子拉底了所有的感觉。,,,0
32,32,26389696,大闹天竺,a8173ccbc7aa22ddba3301b043a64117,8df702f4accfd6930aa10c532eac3ebd,,2021-01-27 20:48:18,烂片看了无数次，这部让俺第一次有被烂片烂到窒息的感觉😂看完就整个人都不好了，。。。。。。。。。。。。。。。。。。。。。。。。。。。。。。。。。。。。。。。。。。。。。。。。。。。。。。。。。。。。。。。。。。。。。。。。。。。。。。。。。。。。。。。。。。。。。。。。。。。。。。。,,,0
33,33,26389696,大闹天竺,74b21e86b101a00903a16269b7651448,16a6601642df4693f1f0aad9d464d7cb,4.0,2020-11-24 11:37:23,一部电影可以说是每个人的梦想，有好有坏，好的大家是可以接受的，不好提出来也是剧情来的，打发时间还是可以看的，毕竟也是很多人付出我们才能看得到，值得我们尊重的，希望下次给出一部良心电影。 不过王宝强演电视剧那演技还是可圈可点的，给人的印象是深刻的，会让人记住的角色。 好好调整状态。不要在意外界的评价。专心把戏演好。我觉得这才是。一个演员应该有的态度。,,,0
34,34,26389696,大闹天竺,79dce3422cd49e60407b391f982c37c1,ad1616ad1efb0242602a720cf69718aa,1.0,2020-05-07 02:57:46,当看耍猴的是合格的，要是称为电影，那就是侮辱艺术，电影和耍猴是有区别的，如果评价，看你当什么看的。王宝强当演员也不算是个演员，更别提导演，没上过学也能当导演，那这门槛太低了，看门大爷也能自导自演来个毛片了。当演员也就是本色出演，谈不上演技，演的不是无脑儿就是农民，这个挺像，基本不用演。冯小刚有的话不好听，但我觉得是对的。什么样的电影都有人花钱看，被骗了理解，还觉得好看就是智商问题了,,,0
35,35,26389696,大闹天竺,97e094b8257cdb1cbeb520893a260109,27674d77411d0d1a443d7300c1eb89fc,,2020-03-31 21:41:22,武打设计挺棒的，隐喻的唐僧悟空，金角银角大王等也蛮有意思，中间笑了好几次，还算是及格的公路片呀，一水儿的差评一星我也是有点懵逼……不过，柳岩 岳云鹏的角色毫无意义，演技也尴尬，砍掉都没影响。还有最后尾声部分，特技1毛，最最后部分花果山逼出尴尬癌！！！但是总体来说，还是不错的贺岁片，王宝强一贯的搞笑风格。,5.0,,0
36,36,26389696,大闹天竺,e848560cf67cf67da714b3c994daabb0,b2ad10ce58c23f895f5b28ee8f3189b1,2.0,2020-02-23 15:34:07,长城之后，没有最烂只有更烂～先讲明前提，我去晚了，所以是从大约30分钟开始看的，到现在过去六个小时左右，基本内容已经差不多都忘完了，总结完毕～当然，不吐槽不是我的风格。影片本身我不想多说了，到现在也不明白脑洞得有多大、态度得多将就才敢拍这么一个本子，四个主要演全部本色出演，也是创了我的观影之最，故事内容我概括就是噼里啪啦轰，反正就是乱糟糟。不客气说，放网络上顶多也就是个自制剧的水平。音乐虽然不可避免有大部分宝莱坞的影子，但还算不错，尤其是让你哭笑不得的中文歌词，难得的有“档次”的笑点。镜头和动作设计都不错，就是慢镜头太过泛滥，有时显得重复单调。特效，太渣了，五毛都达不到，顶多三毛五，六小龄童的美猴王一出来，我快喷了，跟2000年重拍西游记的效果一毛一样啊，令人发指！西游2我还没看就知道肯定甩它一个东土到天竺的距离。不说还说了这么多，我个人对宝强没有什么偏见，但是一码是一码，作品水平真不敢恭维，有些评论说“留点口德，宝宝第一次当导演”，我觉得有些圣母了，我掏钱看的就是你的作品，头一次这不叫理由！小岳岳和柳岩我一起说，小岳岳，这电影拍的值！[呲牙]柳岩，我票价的二分之一都给她了，看的时候我就这么安慰自己。越来越接受不了漫无边际的恶搞，电脑屏幕还行，放在影院怎么也觉得格格不入，尤其是宝强这种已经定型为以朴实真情动人的演员，恶搞完硬补一碗鸡汤，真是喝药般难以下咽。其实话说回来，也许将来的某一天，人们再次回味这样的作品，恰好符合了彼时的口味，反而奉之为独树一帜的风格，这又怎么能说的准呢，就如同如今被太多人奉为经典的大话西游一样……PS：听到票房归马蓉，我很桑心，谁能告诉我这是不是真的？[流泪],,,0
37,37,26389696,大闹天竺,a4d39575e2fc4f88b9487d9cd2eb5863,e85db99ede8f3617706998b94b7806d3,3.0,2020-01-28 21:10:36,寒假被封在家里，哪里都去不了，什么都不想做，只想欢乐地摊在床上当一张猫饼，然后就随手挑了一个爱奇艺推荐给我的《大闹天竺》来看，看都看了那就顺手来写个影评。 整体来看，《大闹天竺》的故事和人物设计都很单薄，看完电影的我现在回想起来剧中人物： 武空：很能打，养猴，视猴如命，有点憨傻。小唐总：呆，倒霉，菜鸡，没用，有一个好爸爸没有朋友爱玩。 吴静：先追着小唐总又追着小岳岳，缺爱，有钱，狠。 朱天鹏：憨憨傻傻，爱玩。 唐爸爸：有钱，有良心。唐察苏：没钱，坏。 但是生活中不会有这么片面的人啊，武空从哪学来的武功？他为什么要养那么多猴子?他爷爷是怎样教他的？他弟弟真的死了吗？吴静为什么会纠缠小唐总？她一个女孩子从哪来的钱？小岳岳是什么公司过去接头的？他到底是不是内应？小唐总喜欢机器人为什么不去研发而要继承他爸爸的房地产？每一个人物给我的印象都只是一个个标签，而我想不出来每个标签之间的联系就让我感到每一个角色都不真实，是为角色存在而存在的角色也就没有了叙事性。 再说故事情节里一开始是武空对打小唐总，对打金角大王银角大王，对打印度民众，对打陷阱里的女人们，是身姿矫捷也是武功高手，但是小唐总他们就都成了一个摆设，是统统设计出来为衬托武空真的很能打的吗？以及故事整体的大框架里，老唐总既然是为了让武空父子团聚为什么非要配上自己儿子千里迢迢一起去，他明明知道有人要谋夺他的家产还不防着点唐察苏这就说不过去了吧，他凭什么凭一个胎记就认定了武空会帮助小唐总顺利到达难陀迦耶？我百思不得其解。 最后，对武空身上的佛光加持更是显得突兀而没头没尾，他跟猴子到底是什么样的一种情节呢？是对弟弟的情感寄托还是天生就有这样的佛性？最后六小龄童老师的出现着实好好打了一把情怀牌，以及那个不伦不类的花果山，只能说结局里宝强老师确实很有自己的梦与情怀但是与本片无关。 综上，本次影片纵然有丰富的色彩和打斗场面，再怎么说它却也只是喜剧情节的堆砌和几个标签化人物的随性表演，作为王宝强老师的第一部影片，可能他也想借此圆一下自己的武打和孙悟空梦，但是不管怎么说，故事和人物的设定都有待加强，也有可能是我太严肃了，看个喜剧还要想一下剧情。。。,,1.0,0
38,38,26389696,大闹天竺,541a77246e006c8761d47ea86ee24231,c6805a17933283569c6e14291d4810c6,1.0,2019-11-04 09:50:18,导演编剧臆想印度的感觉有点类似欢乐颂编剧臆想上等人的生活状态然后安在安迪（刘涛）身上一样 并且把印度传统电影的歌舞段落这种皮毛强行作为本片的精髓 周星驰哭晕在厕所 剧情生硬 不合逻辑 讲了一个gp不通的故事 冯小刚哭晕在厕所 主线剧情抄袭《泰囧》 徐峥哭晕在厕所 摄影剪辑混乱 有出现强插痕迹的桥段 顾长卫哭晕在厕所 颜色使用失败 全片始终是极其糟糕的衣物颜色与款式的使用 张艺谋哭晕在厕所 动不动就乱加MV 堪比报告老板第二季 刘循子墨哭晕在厕所 柳岩坦荡荡用胸飙戏 昔日独立自强女性勇敢摆脱花瓶称呼 今日却彻底丢弃演技再不显露实力沦落为“奶瓶” 大鹏哭晕在厕所 白客无视前方璀璨的发展大道 选择应付表演不思进取 使其水平始终停留在网剧明星的档次 易小星哭晕在厕所 小岳岳遭到的骂声也非常大 但我觉得还好 他基本就是本色出演了 郭德纲表示为了队形也可以哭晕在厕所 自暴自弃式结局 不仅把六小龄童拉下了水 也让杨洁哭晕在厕所 黄渤有史以来最糟糕作品 管虎哭晕在厕所 陈佩斯朱时茂老年不得志自贬身价友情客串 正所谓人生最难吃的三碗面即人面场面情面 杜月笙哭晕在厕所,1.0,,0
39,39,26389696,大闹天竺,f2b882cfa12a2d81c46507a9192a1798,135a2dc49169a5513bf8f42658713dd6,3.0,2019-10-23 10:35:36,"在现实生活的社会中也一样，有些能力差不多的人，做同一件事，懦弱的人会知难而退，最终一事无成，被社会所淘汰。而坚强的人，总会迎难而上，最终欣赏到了风雨后的彩虹!

　　看完《大闹天竺》这部电影，让我对王宝强有了新的认识，更让我明白了生活没有平坦的大道，但只要我们学会坚强地去面对，最终会铲除路上的荆棘，到达自己理想的巅峰!",,1.0,0
