,Unnamed: 0,电影id,电影名称,用户id,用户名,评分,评论日期,评论内容,有用数,没用数,回应数
19,19,26389696,大闹天竺,afef71506d956013af22c0eb15ec738a,51c17ef65f18236e6ba5481bb3944048,1.0,2017-02-02 23:46:11,"让人发笑是件简单的事，也是极其困难的。大年三十晚上，长达4小时的晚会，很多次我明明觉得自己应该笑的，可就是笑不出来。看着大红大绿堆满高饱和色彩的舞美，听着强行插入的各种千年老梗，我忍不住在朋友圈开始吐槽，有朋友留言调侃说我是在发送实时弹幕。后来想想，算了，毕竟吐槽很容易陷落成为吐槽而吐槽，堆砌情绪，失去客观，尖酸刻薄。

我突然很怀念陈佩斯和朱时茂，怀念不如相见，站在贴满贺岁片海报的电影院，我毅然决然避开了《西游伏妖篇》《乘风破浪》，欣然选择了有陈佩斯和朱时茂客串的《大闹天竺》。听着身边的小鲜肉们兴高采烈念叨着周星驰、韩寒、吴亦凡的名字，热情地讨论他们之前的电影作品，我顿时有了一种众人皆醉我独醒的羞耻快感，为自己的少年老成在心里暗暗点赞。

看了不过20分钟，王宝强和白客正准备大闹天竺，我已经想大闹电影院去退票了。当然了，看电影没有退票一说的，否则全国的电影院得倒闭一半以上。想掏出手机刷会儿朋友圈或者玩玩游戏，又觉得手机屏幕发出的亮光会冒犯到身后正你侬我侬说着甜言蜜语的一对年轻情侣，也会干扰正在聚精会神听妈妈讲解剧情的小朋友的注意力。

自己买的票，哭着也要看完，我成功做到了。

任何电影都有一个内核，如同药丸，通过故事，给药丸包上糖衣。观众乐呵呵地嗦舔着糖衣，一不留神药丸也下了肚，回家咂摸咂摸，内化于心。应该说，这是所有文艺作品的标准范式。即使是仅囿于逗人发笑打发时光的爆米花片，也从来不会把自己局限在只顾挠观众咯肢窝顺带着从口袋里顺走票钱的低级套路。王宝强的目的更不止于此，他的成功经历本就是传奇般的存在，首次当导演，在《大闹天竺》中，他更想向观众传达自己对生活的认知思考和某种他认同的价值观。

《大闹天竺》的内核很简单，也很正确——钱不重要，亲情最重要。这句话在电影快要结束时由主角直接说出来，听得我一愣神，这也太强行插入了吧，之前所有的大闹经历插科打诨毫无逻辑，完全在指向另外一个内核——啥都不重要，开心胡闹最好。要不然，怎么解释王宝强和白客毫无愧疚地搞砸印度邻邦欢天喜地的婚礼现场？怎么解释王宝强通过作弊赢得吃辣椒大赛冠军被发现后又是大打出手继续砸场子？除非解释成「我弱我有理」，所以我不必对规则产生任何敬畏之心，也不必对他人充满同理心，凡事对我有利让我能开心就好。

《大闹天竺》是部公路片，甚至可以说是现代版的《西游记》。《西游记》里，唐僧领着悟空、八戒、悟净、白龙马去印度求真经。《大闹天竺》里，唐森带着武空、天鹏、吴静、还有一匹不知从哪里突然冒出的白马，去印度找遗嘱。86版《西游记》在各个电视台轮播播出了几十年，无论是大朋友还是小朋友，对西游情节简直烂熟于心，《大闹天竺》直接套用，于是王祖蓝版哪吒强行出现，「大闹天宫」得以重现。莫名其妙要去沙丽厂遭遇一群以吴静为首挽着布条荡秋千的惊艳姑娘们，「盘丝洞」得以重现。吃辣椒大赛的主办方顶着牛魔王和白骨精的造型，于是「火焰山」得以重现。到了结尾，六小龄童以美猴王造型现身，含情脉脉牵着王宝强的手向幸福深处飞去，这简直就是《西游记》本身了。

我完全可以理解，导演处处互文，向《西游记》致敬，可你拍的是《大闹天竺》，并不是新版《西游记》。人物角色没有冲突，故事架构根本看不到，剧情推动不讲逻辑，东一榔头西一棒子，从《西游记》里敲下一些边边角角，闭着眼睛拼凑在一起，如果这也叫致敬，如果致敬是个人，他一定会感觉到智商受到了深深的蔑视和侮辱。

既然没有剧情，既然就是过年期间只图观众哈哈一乐，那我们可以再单纯说说笑点。按理说，王宝强、白客、岳云鹏随便哪个单独站出来，就是行走的段子，不说话就能让人乐。可在电影里，成功实现了1+1+1&lt;3的效果。

笑与笑不同，有一种笑承认观众的智商存在，视观众的脑子为活物，呈现的场景或对话乍一看一听觉得很平常，再一回味，让人不禁恍然大悟捧腹大笑，笑过后五味杂陈。还有一种笑，把观众当圈养动物，认为观众除了呼吸之外没有任何生命迹象，一切都是食物，只为果腹活命，满足最低级的生理需求。因此，在《大闹天竺》里，我们看到的笑点是哪吒内裤上印个桃儿，终极杀手内裤上绣朵菊花，吃完辣椒嘴唇翻肿，胸口上烙个「我是狗」，讲个「亲爱的」的老段子……幸好，当这些笑点出现时，我身边的观众没有几个发笑的，更多的声音在嘀咕：这什么玩意儿？我迅速从心底消除了对他们在观影时做出的各种不文明举动的嫌弃，对他们肃然起敬。

哦，对了，有个笑点还是不错的，白客被胶带粘掉了眉毛，真是万万没想到。结果下一个镜头，眉毛又长出来了，速度真快。

《美人鱼》涉及到了拆迁，《乘风破浪》涉及到了拆迁，《大闹天竺》也以房地产商和钉子户的对抗开场。坦然讲，我并没有指望这样的商业片能真正触及底层群体和权贵阶级之间的矛盾冲突，能在影片中出现这样的场景，即使一带而过或者仅仅作为故事背景，就已经很不容易。毕竟，商业片还是要有商业票房回报的，谁也不希望不过审，投资打水漂，导演成了「地下导演」。同样，没有真正的人物冲突没关系，没有真正的选择也没关系，看不到两难境地迸发的人性光芒也没关系，我所奢求的仅仅是讲个好故事，起码是个合情合理，令人信服的故事，从头到尾能串起来，而不是支离破碎的尴尬与无语。《大闹天竺》全都完美避开。

与其当导演，王宝强更适合去竞争一年一度的晚会导演。无论是对大红大绿颜色的偏好，还是含辛茹苦向观众喂食宁愿哭也笑不出来的笑料。都很符合。

精彩影片一向体贴观众，即使全片一气呵成，但为了照顾观众膀胱，会忍痛割爱牺牲几个小片段作尿点。这一点，《大闹天竺》更体贴，因为全片都是尿点。

还有一点，导演可能并没有意识到，喜剧的意义并不是简单的逗人笑。",33.0,,22
20,20,26389696,大闹天竺,570dfe4a0c95f68a80fee6c38919b467,2ed92a97fadcf6455220edff131cdde2,3.0,2017-01-28 19:01:21,开场后的半个多小时，我基本都是在一种很尴尬的氛围下观看，甚至觉得很可笑，莫名其妙的笑点，逻辑线上的崩盘，毫无意义的剧情，就看了开头我就知道这片不会很高分，但是慢慢观看下去，其实，王宝强也是尽自己把想表达的东西表达了出来，那栋小楼可以说就是他的家，而当他的家被拆时，那两个小孩子或许就是代表他的小孩了。    他一直强调他最恨就是抛弃，其实我们也无需那么苛刻，如果单单看电影剧情来说，真的很莫名其妙，但是如果看多一点的话，我觉得也不必老纠结针对谁，或者说什么炒作，就问大家电影里表达最简单的责任，你我又时候做的好？我们应该看到里面好的东西吧。如果我们每次就纠结着各种不好的地方，而不去发掘一些有意义的，那么电影对于我们来说，好像也变了质，总体来说，虽然我不怎么喜欢这片，但也不至于那么差，至少我们感受到一点王宝强的心意，最后的致敬也还好，章老师的客串让我颇有感触，毕竟他是我们这代人心目中永远的齐天大圣。,50.0,30.0,13
21,21,26389696,大闹天竺,5dda7a18fad5ab5c1693924827dc37f1,a6ffc67c60084738ef023e23b8073121,3.0,2017-12-25 21:03:46,本文首发自文慧园路三号（现更名为幕味儿），2017年1月30日   2012年的现象级电影《泰囧》成就了几波人，徐峥的第二部导演作品《港囧》收获了高达16亿的票房，黄渤已然成为中国电影票房号召力最高的男演员。如今，王宝强也执起了导话筒，和《泰囧》的编剧束焕带着团队一起打造了一版和前者颇有几分相似之处的“印囧”。     与其说，《大闹天竺》是一部对西游故事的改编，不如说这是一部灵感来自于西游的公路喜剧片。放到现在来看，《西游记》应该算是最经典的公路题材。   20世纪80年代后，随着社会价值观日趋保守，中产阶级精神困惑日益凸显，美国公路电影开始揉入新的类型元素，出现了许多像《午夜狂奔》、《雨人》、《预产期》、《阳光小美女》这样的公路喜剧片。不同于之前公路电影强烈的边缘性色彩，公路喜剧有着更多的娱乐元素，同样是“在路上”的故事结构，公路喜剧让主人公们在旅途中遭遇各种窘态，借助喜剧完成人物价值伦理的回归。     相较而言，我国的公路喜剧类型电影出现的就比较晚。2001 年，施润玖导演的《走到底》，被认为是中国第一部国产公路片，直到2007年张杨导演的《落叶归根》，公路类型电影的意识逐渐被建立。《人在囧途》、《泰囧》、《无人区》、《心花路放》、《后会无期》以及去年的《港囧》，一部接一部的公路题材电影获得了不俗的票房与口碑，可以说，公路电影已成为国内较为成熟的类型电影。   《泰囧》所引发的现象级观影热潮，更是让一系列带着“囧”字的电影在电影市场上出现，《泰囧》、《心花路放》、《港囧》之后，公路喜剧逐渐成型，“与傻瓜同行”的“治愈之旅”似乎成为了一剂票房良药。   公路喜剧片中总有一组或多组呈现聪明／愚蠢、高雅／庸俗或是合理／无理的二元对立关系。《泰囧》中的徐朗和王宝，《港囧》中的徐来和蔡拉拉，前者都代表着社会中产阶级，后者则是底层小人物的化身。    同样，《大闹天竺》中的主人公唐森（白客 饰）和武空（王宝强饰）也是富二代与穷武小子的差异对比，两人因为一份比“经书”还难找的遗嘱和一栋要被拆掉的小楼被拴在一起，一同去往天竺“取经”。   与《泰囧》、《港囧》略微不同的是，前两者中无论是徐朗还是徐来，都是处于事业压力大、家庭生活种种不顺的中年中产阶级，相比之下，《大闹天竺》的主人公显得年轻一些，富二代唐森的生活困境是父亲去世以及一直以来的亲情与友情缺失。   无论是哪一种，似乎都是当今中国社会中产阶级所面临的精神困惑，高速发展的现代化科技与物欲横流的经济社会下，精神压力与内心孤独无处排解。当唐森对着武空撕喊，“你弟弟和我爸一样，他们都回不来”之时，我们知道，再多的金钱也换不回来亲人的复生，顽劣不羁的主人公终是剖开内心的空虚，渴望家庭的回归。   经历一路的追拦堵截之后，唐森对武空的态度从一开始的嫌弃变成可以为其当掉自己心爱之物。唐森与武空的友谊看似是短时间的利益互绑，实际上是两种阶层人的行为与价值观相互碰撞之后所完成的相互救赎。   几天的寻找遗嘱之路成为了唐森最快乐的几天，唐森收获了朋友；而武空也终于在发现小楼被拆除后彻底放下了心中的执念，一直随身佩戴的桃核掉入水中消失，象征着过往的不快被放下，从印度“猴王”哈奴曼手中接过宝物，斗战成佛。   “别和往事战斗”，如同影片配乐歌词写得那样，放下执念的情感主题是王宝强个人情感的投射。   电影中武空弟弟的故事是王宝强执意让编剧束焕加入的，第一次做导演的王宝强在接受采访时称自己做导演其实是为了弟弟，因为少时的一场意外，想要成为武打明星、想要做功夫片导演的弟弟早早离去。片尾，王宝强向六小龄童致敬，在我看来，这更是他在对过去、对最初梦想源头的致敬。   寻找与救赎的主题之下，旅途中的自然人文景观是公路喜剧片的另一类型特征。大部分拍摄在印度的《大闹天竺》同《泰囧》一样，影片中有着许多印度独有的社会人文景观。   印度歌舞、特色的婚礼习俗、街头魔术表演、街道上洒五颜六色的粉末庆祝、吃辣椒比赛等等，都构成了兼具异域色彩和猎奇性的电影镜头，一旦影片热映，说不定又会带动一拨国内游客去往印度旅游。   B故事线上朱天鹏（岳云鹏 饰）和吴静（柳岩 饰）的爱情片段为旅途增加了更为多元的色彩，可惜展现得不够充分，让人物沦为功能性作用。   王宝强第一次导演，影片固然有许多稚嫩之处，文戏武戏之间的剪切节奏、场面调度、镜头选取，难免显得生涩，但是，就如同王宝强自出道以来演得角色那样，这部电影处处给人一种执着的认真之感。打一句不恰当的比方，隔壁星爷和徐老怪在用特效拍电影，而宝宝在用生命拍电影。   影片结束，彩蛋中落入法网的唐察苏（黄渤 饰）在监狱中忏悔，为大家献上一曲悔过之歌。“这就是命”四个字一经出口，场下观众大多会心一笑。经历宛如一场闹剧的家庭风波之后，王宝强带着这样一部有着自我感情映射、恰又是和亲情相关的影片与大家再次相见，仿佛有种命运之感，而“调侃自己”的喜剧是这世上最有善意的幽默。     “最重要的不是金钱，而是亲情”。王宝强借黄渤之口说出了这句不知是解嘲还是劝言的话语，现实的互文让人觉得笑中带了点苦意。无论如何，王宝强从演员到导演的转型已然完成，希望他可以真如自己的影片里那样，放下过去，从头开始，斗战成佛！,1.0,1.0,2
22,22,26389696,大闹天竺,32a6451882faf75a8871979205dfab8d,24412ce4147d4cc83cb607ed1d2c74ec,1.0,2017-04-04 13:11:39,在物质匮乏，与主流世界严重严重脱轨，甚至81年才有第一部国产电视剧的80年代，中国人没有资金，设备，技术和经验的情况下，可以靠头脑找土法子，甚至一张胶片一张胶片的加工做特效，做出了一部西游记，也做出了中国第一支电子音乐。这个叫做情怀。 而30年后的你们这些电影人，或者说只能从称谓上叫做电影人的人，靠一些机会一夜成名，而从不思进取。每每做出一部部大粪来侮辱中国影迷的眼睛和智商！你当演员，当装傻卖笑的谐星，这是你的招牌，生活不易，靠这种方法挣俩钱我们理解。可你们偏偏没真凭实学还想装逼！你当导演？你新华字典的字能认识多少？ 成龙说过当年香港电影辉煌不是因为能挣大钱能出名。只是电影是很多人的饭碗，这只是他们的工作 做不好就要没饭吃。你们呢？你们真的把这当成你们的工作你们的特长吗？那么好的市场摆在你们面前，每年那么大的票房就让你们争先恐后的拍这种连鸡巴毛都不是的东西？还致敬六小龄童，我们这一代人的情怀是让你用大粪来致敬的？你那是赤裸裸的侮辱！ 我记得克里斯蒂安贝尔在拍机械师的时候好像是两周每天吃一个苹果然后疯狂做有氧运动减了70斤。而莱昂纳多拍荒野猎人的时候的样子大家还记得 胖成那个样子然后被媒体嘲笑了一段时间然后最后大家才明白人家是为了冲影帝牺牲自己偶像包袱。还有波特曼，人家13岁成名天下还要去考哈佛，那知识和智商就更不用说了。 当然很多这种例子在全球也是非常顶级的。不能把你们和人家做比较。但是你们就算不进取也不要去争相堕落吧？每年出那么多电影，能看的一个手都数的过来？让人家外国说你们什么？人傻钱多？随便一个什么地产老板，煤矿老板拿点钱出来投个电影，最后说中国影迷就是傻逼，投电影比盖楼回钱快多了。,2.0,1.0,1
23,23,26389696,大闹天竺,11c0cd5c8fa8316d92f2265cd2eafcbf,541c7d9586a44265314452b33ea33f14,2.0,2017-01-28 20:38:19,说实话，本来很期待王宝强的这部电影，毕竟有泰囧在那放着，又看了大闹天竺的片花觉得应该挺好看，可惜此剧狗屁不通。 白客从头到尾声音太大，没有一句让人发笑，只让人尴尬。王宝强的打闹片段让人觉得无聊无趣。小岳岳因为是说相声的，所以一张口就是相声的感觉，还能有点笑点。 好的电影还是要看编剧，演员再卖命，主题再明确，可惜剧情不连贯，没有情节，也是一场闹剧。,34.0,7.0,4
24,24,26389696,大闹天竺,dd54165a21782ee29c433f99d4df7b90,4bf73803006b57b16f031c8a3195f5bf,2.0,2018-01-20 21:45:53,17年的大年初一，几部大热的片子《西游降魔》、《功夫瑜伽》、《乘风破浪》都看了，说实话都挺不满意的，都拍的啥东西，国产电影让我吐槽的都不想吐槽了。要吹毛求疵说一个最差的，那一定是非大闹天竺莫属。混乱的无趣的剧情，浮夸杂乱的表演，纯粹是为圈钱儿圈钱，王宝强当导演的第一部片子以失败而告终。和学泰囧，港囧的风格，但画虎不成反类犬，王宝强没有学到徐铮核心的味道，温情不让人感动，搞笑不能让人笑，引不了大家的共鸣，当然7亿多的票房对其他档期来说也是好票房，但春节档就是表现平平，希望宝强好好当个演员吧，没有金刚赞不要揽瓷器活。,41.0,1.0,5
25,25,26389696,大闹天竺,c257bf3a1ab9a931e71d47ce65960fe6,67a2a324cb08c0b2f02d096eceee933b,1.0,2017-02-06 22:04:01,"这部片子我是一星，其他不赘述，说下我好奇的地方：  1，90%以上宝宝动作镜头中都会加慢镜头再展现下，如果少了这些费神的慢镜头，可能电影会少5分钟左右吧。我觉得宝宝其实是一个挺有自信的人，不然不会这么多镜头来凑。  2，威亚感已经强烈到我都快看到了，真的需要这么多威亚吊来吊去吗？动作并没有变得好看起来。（我真的发自内心佩服成龙，武打动作好看又比较有趣，不要说进步了，我觉得几十年能保持住就已经很了不起了）  3，每一个角色塑造都很失败，举个栗子：同样是玩世不恭的富二代，当年百变星君里面，星爷塑造的李泽星人物非常立体，可是白客的，也就是照剧本念了。我是很喜欢万万系列，也很喜欢白客，和演出经历也有关系吧，毕竟经验没有那么多，我觉得这部戏里，只有白客是相对来说有进步的，反观之王宝强，在这么丰富电影演出经历下，演了一个又难笑，又非常个人英雄主义的无聊人物，硬要贴西游走，西游师徒四人的情怀，不是你名字叫谐音就可以带大家入戏的。  4，中间所有的煽情戏，多余又无聊（但是这里白客的演技还不错），杂七杂八放在一起，不一定就是火锅，这就是一桶厨余，都是别人玩剩下的。  5，整个逻辑就是混乱的，陈佩斯把六小龄童儿子弄丢了，六小龄童不怪他，自己跑去学经，这种大无畏的精神真的挺超脱。  6，六小龄童被拉下水了，估计也是为了推广西游文化操碎了心，本想和电影一起将西游文化传播更远，但是我看到他出现在荧幕说着小时候的台词，我觉得很心酸。  7，不只是沿袭徐峥囧系列，我觉得陈思成的唐人街探案也有借鉴，电影➕歌曲的模式，btw,唐人街探案是我觉得国内这几年演员转导演最成功的电影。  8，先这样吧，其他大家都说过了，但是电影结束的时候，居然有几个观众鼓掌，大家笑的乱七八糟的，电影市场还是大，钱还是好赚啊，我记得上一次看电影看到全场鼓掌是在巴黎看招魂2，好怀念在电影院看好电影的日子。",8.0,,5
26,26,26389696,大闹天竺,84ad10c32fbb20d86c4472fa60dd9c4e,399b56f2420506add6cc9f658c14e103,3.0,2017-01-31 22:13:20,宝强再出事的时候，我曾经说过:宝强之所以可以成为一个喜剧角色，是因为他本身给人的感觉是轻薄的，没有负担的，没有悲伤的，所以他在电影里遇到那么多惨事，他可以笑的出来，观众也可以笑的出来。宝强出事以后，失去这个加持，无论未来他做什么搞笑的事情，大家都会这个人背后是有故事的，就笑不出来了。因为他真的可以很难过。  宝强更适合当一个演员，我知道他想把饱满的色彩表现出异域风情，但是这种运用直接导致了眼睛很累，影响观影效果。 为了搞笑，几乎放弃了情节推进，情节结构不完整，而努力的搞笑，使得观众没有办法沉入，反而笑不出来。 最后向六小龄童的致敬太突兀，好像是为了这个点，强行改变剧情，违和感太重了。  我还是喜欢徐峥呀。,4.0,3.0,0
27,27,26389696,大闹天竺,e7756b31fff0dae20807377d1bc0de5a,ff397427e01e891a2b114926dbb240af,4.0,2018-01-04 12:07:13,没有看大闹天竺之前在网上看豆瓣评论觉得这个电影很垃圾，很不值得一看，然而今天当我亲自看了一下觉得这个电影并没有想象中的那么混乱，至少说并不是那种年度最佳烂片，反而觉得是一部很不错的电影。在这部电影里面王宝强将泰囧的嘻哈，乱斗风格和印度的载歌载舞融合起来，看着像是一锅炖，其实并不混乱，结构清晰在贺岁片中应该还算合格，电影中主要通过，宝强的兄弟情谊，真假美猴王，火焰山遇牛魔王，以及经历千辛万苦取得真经，等等几个故事情节线索来展开，上现在的西游记，故事衔接的自然，即将西游记重温了一下，又有自己的特色。里面的搞笑场景也没有传说中的那么生搬硬套。也许是水军开始的代入感，也或许是大家对王宝强的过高期望，或者是很多人对这个傻根的不屑一顾导致对这个电影的偏见。当然这部电影也有很多不足点，但是我觉得作为第一次导演能做到这样已经不容易了。,6.0,12.0,7
