,Unnamed: 0,电影id,电影名称,用户id,用户名,评分,评论日期,评论内容,有用数,没用数,回应数
0,0,26747836,喵星人,3abdfc164fa6c73581e206324d9fc713,246088ef3cb0ef59e0bdb3633a5baac0,5.0,2017-07-14 23:05:21,今晚看了这部电影，说实话本来开始以为是烂片，纯粹为了看古仔，但是看了后真是出乎我的意料，全程有笑点有泪点，影院几乎满座，大家都笑得很开心，我男朋友也笑得像傻子，后面感人的地方我也眼里有泪，明知道是煽情了但真的是有戳到我内心，后排小朋友都哭出来了，看完后真的觉得是一部非常不错的片，美团也上了8分，所以兴致勃勃来了豆瓣，真是简直了！！！看了那些短评自以为是的人，对不起，你们智商太高了，看这种你们所谓的“弱智片”真是玷污你们的智商了，明明就是一部单纯的喜剧片，也很有意义，不知道怎么就被你们说得一文不值了，是我们影院的人都像智障所以觉得好看，还是你们内心真是太成熟了所以完全get不到点，谁说get不到小朋友的点，至少我那场的小朋友笑得很开心，哭得也很伤心，所以真是不明白那些一星差评的人，你们到底是想怎样，客观来讲这部片可以值四颗星，但是看到那么多一星的我多加了一颗星，至少我觉得看这部片……值！！！还会介绍我周围的朋友去看！注：那些说古仔沦落到演这种弱智的人注意了，我没有看到弱智，我看到的是一个很好很好只是有点老实傻傻的爸爸，有这样一个爸爸我是非常幸福的，这部片让我更爱古仔了！！！,31.0,8.0,5
1,1,26747836,喵星人,369e1c6a787de6a47a9a597a83ca8d1c,f38fa0fa951a84dbe9e28968f381dddc,5.0,2017-08-21 18:18:03,喜欢猫咪，而且喜欢动画电影或是奇幻片，被片名吸引来看的，相信很多人也是出于这个原因，但是更多人应该是看到古天乐主演才来的，我觉得评分拉低应该是这部分人由于个人不喜欢这类片而不理解觉得古天乐拍了个烂片，我要为古天乐为这部片子喊冤！ 这部片子我想给七分，但是评分居然这么低我只好给五颗星均衡一下，一颗星给肥猫，一颗星给古天乐，一颗星给他们一家人的爱，一颗星给编剧和造型师，人物造型都是符合人物形象性格的。 很多人说烂大概是因为他们没有童心吧，所以他们不觉得巨猫可爱也不理解这个剧情，首先，它的标签是喜剧奇幻片，不是现实片，不应该用现实角度去批评它，它是一个很温馨很纯真的片子，可能更适合年龄小和童心未泯的人看，就我本人来说，比起现实的谈情说爱和打打杀杀的雷剧，我更喜欢动画电影和这种有爱的片子。 我看了很多差评， 有人说“太烂了，成人看着一点没有意思，如果是给小朋友看的，但我又get不到小朋友的点也不适合给小朋友看”，你是个成人，已经没有童心的成人，你怎么可能get到小朋友的点，真是呵呵了，这个差评真是莫名其妙，明明电影院里前几排的小朋友看的很开心，一直哈哈笑，自己想不通就算了，居然用自己想法臆测小朋友的想法。 有人说“这就是个烂片，我从未见过如此丑的猫”，我不说这个猫到底丑不丑，就说你这个差评给的真是任性，你不喜欢这个猫的形象不应该成为给一星的理由吧。 有人说“古天乐又没钱了吗？来拍这种烂片”“古天乐又缺钱盖学校了吧”说这种话的，你真的认真看了吗，怕是只为了针对他个人吧，古天乐有没有钱我不知道但他是在认真的演戏我看到了，而且，现在做公益也变成人们的笑点了吗？他盖学校是真的帮助到了很多贫困的小朋友，不说什么大大地赞扬，怎么也不该是嘲讽吧？把这两个联系起来过分了吧。,137.0,20.0,32
2,2,26747836,喵星人,20d9825fa1c895a97ddca46cebfeff0e,95329286fdc0020049971c4ef8fc0b7e,1.0,2017-07-18 23:16:46,"一、和几天后的一张电影票把时间弄混了，到影院时间晚了十几分钟。
二、到影厅时，蓝猫刚好爬出飞行器？，第一感觉，谁家的劣质染色剂，这毛一看就是假的，差评；第二感觉，这猫好丑；第三感觉，这是反派？
三、整体感受很不好，非常极其之不好，或许有偏颇，但这是我真实感受，接受相左意见，不接受反驳。 四、不明白男主为什么要一直眨眼睛，这个设定对人物塑造有帮助吗，好像爸爸还是个足球运动员（以前），这样老是眨眼睛能踢球吗，严重怀疑。 五、男主太傻，傻成这样，很难说是心地善良容易被骗可以说的通的。 六、犀犀利的主人最后也没有来找猫，是把犀犀利（地球的那只）忘了吗。 七、喵星球来的猫，西米露？配音太失败，旁白差评。 八、真没看明白，大喵（外星猫）是怎么就转变了态度的，一秒钟转变？ 九、女儿很可爱，老觉得很熟悉，可年纪也不大，想不起来在哪个综艺或电视剧里看到过她，还给我留了印象。或许我记错了。 十、哥哥喊爸爸时感觉有点违和，太客气，如果是配音，嗯，没配好，如果是自己配的音，我接受。 十一、看到还有四十多分钟结束时，我开始时不时的看手机，编剧，你出来，我绝对不打死你，毕竟，我很珍惜自由。 十二、整个影厅有五个人看，我去之前有俩人，我去之后几分钟，又到了俩人；我看到了最后，还看了彩蛋，最后一个走的，有俩人影片没结束就走了，在我开始看手机之后一会。 十三、喵星球，有宇宙旅行的能力，整个星球一点绿色也没有，整一个荒芜星球，你搞笑呢；吃的还是生土豆，土豆长在地下，这没错，但你告诉我，地上的叶子呢；汪星犬，对着生土豆流口水，我想打人。 十四、我一度怀疑古天乐和玛丽被制片人和导演绑架了，表扬一下两个小演员，最起码，养眼。",21.0,14.0,12
3,3,26747836,喵星人,b6f2551c5d3ef78a7f369ed4cfc3ace9,4bf8c839351ea15a2dfeab7fd202ce07,5.0,2017-07-15 06:21:05,说这个片子幼稚的人，是不是内心已经老掉牙了？中午看到评分也是醉，心想这究竟是有多烂？喜欢萌猫的我晚上拖着四岁的儿子一起去看，影院里坐着的观众从60后～2010后都有，全程笑点无数，犀犀利的大眼睛很像怪物史莱克中的那只穿靴子的猫，性格也真是又贱又萌肥坨坨还傲娇，这很猫咪呀！剧情很温馨，马丽演的妈妈，除了上班还需要操持一家大小的日常，非常辛苦的时候难免脾气躁，这很符合现在很大一部分妈妈的现状！哥哥和妹妹都好乖，小芈月的表演灵气十足，特效也还不错的！唯一要吐槽的就是男神的发型，古天乐你这个抹布头真的丑爆了哇哈哈哈，我那少女时代的杨过只能留存于记忆了（泪奔～）那又怎样呢？剧中的爸爸就是这么个傻不拉叽老被骗的但又耿直憨厚的铁闸门啊！反正大家都笑得座椅打颤，我儿子回来也是念叨犀犀利，能带给观众久违的童真童趣和无压力的快乐，就是这部片值得赞扬的地方啦～,20.0,10.0,16
4,4,26747836,喵星人,da0e330675f64ff779e9f058dfa8a488,39376f8c9f3f981d9c6cd99e8c823d53,4.0,2017-08-23 00:47:34,嫌弃古仔拍这电影的大多直男癌吧，认为香港男演员就只能演硬汉？ 影片用童趣的外星猫元素通过表现喵星人与这一平凡的一大家子善良单纯。虽然房子一看就知道是家有儿女式的布景，整体暖色调能烘托出这家庭氛围的温馨简单。也符合影片诙谐逗趣的风格。都说里边的男主傻，我倒觉得他不是傻而是太善良，而最后发现藏宝图是真的也点出了傻人有傻福的简朴乐观的一面,20.0,4.0,2
5,5,26747836,喵星人,383cc06e47181f4e1fa698499de8eb65,635724bf659742d0e51d60a393515f79,5.0,2017-08-24 00:35:02,晚上吃完饭，我们一家人坐在沙发前，一起看了这部喵星人。 电影意料之外的好看。之前我一直以为豆瓣6分以下全是烂片，没想到这次万能的豆瓣也会有不准的时候。 剧情逻辑还算过得去，古天乐，玛丽都算是正常发挥，大部分的笑点都很自然，没有那种强行挠咯吱窝的生硬。儿子老婆看的都很开心，全程都在笑。结束的时候还有点依依不舍。 特技也很不错啊，在水准线以上。 作为一部偏儿童化的家庭喜剧，这部片子算是很不错了，最起码比国内很多同类型片都要强很多，没有洗脑，没有说教，没有少儿不宜，没有尴尬，但是全片都有一种家庭的温馨在环绕。 凭良心两讲，打三分都算是有点低估。 但是豆瓣里面一面倒打一星的，我实在看不懂，难道豆瓣这些观众审美就有这么高？高到我们普通观众都高攀不起？ 有些上来就说片子低幼，弱智的，这本来就是儿童片，你一个大人跑到小孩子面前秀智商，有意思吗？ 为了这部被严重低估的喜剧片，我打五分。,11.0,2.0,1
6,6,26747836,喵星人,62807546acdb68becf28a5971302a27c,fcad230655089cfd2cabbbde3673612a,1.0,2017-07-17 13:41:58,上映之前猫眼上评分8.4分，看着这个我才买的票，但是根据观后感来看，建议大家上映一周之后再看豆瓣或者猫眼的评分，上映前的评分多半都是通过水军吹上来的。      言归正传，我先说一下这部电影好的地方：      （1）画面做的还算细腻，当然不是说的特效部分，而是说的那种温情的正常画面，很有那种欧美叙事电影的风格，其中的画面我觉得还算是世界级的。      （2）想法还不错，能够通过大开的脑洞叙述了一个还算说得过去的故事。      （3）主题反应的就是温情、人间的爱。总体思想还不错。     这部电影 不好的地方：      （1）受众不明确，这是中国电影最大的毛病，受众不能明确，整部剧有的片段是小孩看的，有的地方是大人看的，像日本动漫（龙猫、千与千寻等）老少皆宜；      （2）主题生硬，我一直认为一部优秀的电影，其表达的主题一定要贯穿整部剧里面，比如千与千寻、龙猫等电影主题都是贯穿全剧，而不是像中国电影一样主题都是在最后强塞进去。      （3）特效太假，一直搞不懂为什么中国的特效都是如此之差，是因为技术原因还是资金原因？喵星人里面那只犀犀利造型也实在是太难看了，一点都不萌。      这部电影作为香港影视作品，感觉到香港电影已经停滞不前了，仍然停留在星爷那个年代，里面的搞笑剧情、语言、表情都是非常生硬的，感觉不到自然的流露。      总体来说，这部电影我觉得10分满分的话，豆瓣评分4.4分还算是比较中肯的。,12.0,9.0,7
7,7,26747836,喵星人,2e86ef348001738ff5afb7ae31e7837f,934428e12d75f9ffc7bf630408669cc8,2.0,2017-07-15 10:25:21,作为以猫为主的一部电影，猫真的太丑了，我的审美告诉我不能接受。。。两个小孩倒是很可爱。 搞笑电影嘛，就笑呗，古天乐是一代男神，马丽称得上是搞笑女王了，这两个人的组合可以说是天马行空的尴尬。 怎么说呢，可以说是小孩子电影了，逻辑简单，没有新意，不知道拍这部电影来干嘛？ 中国电影什么时候能给人希望。😞,16.0,4.0,6
8,8,26747836,喵星人,2e32f680abe1e4c92a0539554f1263b7,54397fdfdc3ec6fe38b764e56e4a322e,5.0,2017-07-14 23:36:13,看了豆瓣那么多负面评价！今天全家出动看了犀犀利，这是一部很赞的合家欢电影，有点超出意外！所以你们买票前要慎重！ 合家欢电影！合家欢！合家欢！重要的事情讲三遍！无论什么电影都不能满足所有人的爱好，所以买票前请慎重！！这不是烧脑片不是科幻片也不是浪漫爱情片，导演也说了这是一部合家欢！ 古天乐在剧里不是男神！他只是一个很疼家人但是心底善良容易给人骗的爸爸！为了给女儿治疗天生残疾所以拼命想挣钱！！“我就算再没用！我也要守护这个家！做这个家的铁闸门！”只是想看男神盛世美颜的请去神雕、寻秦记、创世纪、圆月弯刀…… 划重点！古仔和恬恬演技很爆炸，赞一个！恬恬和古仔哭的时候我都心酸的要哭，马丽和开心麻花的成员也增色不少！靠颜值维护地球和平的李老师让全场爆笑😂主角犀犀利蠢贱萌肥浪到我想回家马上再做一只粘土犀犀利！！！有小朋友的各位一定不要错过了！一定可以让小朋友留下一个美好的回忆！！建议全家出动去看！好了不剧透了周六周天大家一起去看哇！,11.0,6.0,0
9,9,26747836,喵星人,214f24fdd3dcf8e5d5900f28953d9df4,51dc2c24c4bd2408a2b4b6dd385bdf94,2.0,2017-07-11 13:51:02,这是一个喵星人想要侵略地球，却被地球（人）反攻略的故事。   此片南北不调，水土不服，香港的背景加上了马丽，艾伦等一众北方喜剧演员，强行植入，南不南，北不北，古天乐和马丽这对“天马”CP是集聚了人类之想象，尴尬程度远超《拆弹专家》里刘德华和宋佳的“佳华”CP，再搭配两人的几次吻戏，真是世界玄幻，无法直视(๑⁼̴̀д⁼̴́๑)ｯ   剧情套路套路套路，看了前面猜到了后面，关键是剧情如此套路的电影，你却会觉得逻辑清奇，不要说bug了，这整部电影就是一个bug。主角那只猫“犀犀利”那么大只，我实在是get不到它的萌点。其实电影的核心感情是很动人的，可惜电影完全传达不出来，成功达成了看完整部都没有入戏的成就，还是让那些小朋友看吧。   再说一句，陈木胜导演的动作片可观性还是很强的。此等魔幻喜剧还是再考虑下吧……,21.0,5.0,0
10,10,26747836,喵星人,df162656f47b3a2a15158b5bbd39e07f,eea990e2777414017a0ce741daed2029,1.0,2021-04-16 14:49:42,只想说，这是少儿向，但是分众不明确，毕竟，作为一个正常人，不会这么傻逼！ 1.这么大的猫，正常人最多以为是玩偶 2.这么大的猫，脑回路清奇也不会带回家，毕竟猫科动物可不是什么善类 3.剧情笑点很生硬，就是尴尬，接着尴尬 4.剧情走向很迷，莫名其妙，泪点和笑点都无法撮中人 5.我是时隔很久来看的，但是依旧无法接受这么幼稚的剧情居然没有 放在少儿频道,,,0
11,11,26747836,喵星人,e1925d838a92a652df456e106aa30fc9,9141828a169cab2e3996997450a330af,4.0,2020-12-22 07:07:44,它原本来地球是来为了让猫家族占领地球的，想出了一系列的方式来破坏一个原本幸福的家庭。可是它却屡战屡败，结果却放弃了这个想法，反而融入到了这个大家庭。成为人类的好朋友，还帮助电影里的妹妹吴优优治好了脚伤。 这部电影让我明白，只要爸爸妈妈同心，家就在；家在，幸福就在。这真是一部值得一看的电影啊！,1.0,,0
12,12,26747836,喵星人,97e094b8257cdb1cbeb520893a260109,27674d77411d0d1a443d7300c1eb89fc,,2020-04-01 09:16:53,故事中王葆钓到了宝葫芦。从此他自己不做题，总是让宝葫芦替他做题，就连考试也让宝葫芦替他。但宝葫芦却把苏鸣风的答案和名字照抄到王葆的卷子上，结果被老师骂了一顿。以后王葆想什么宝葫芦就变成什么，但宝葫芦总是帮倒忙，王葆很生气，把宝葫芦扔到河里。最后王葆凭自己的实力赢得了游泳比赛。宝葫芦觉得自己没用了，就离开了王葆。 这部电影告诉我们靠作弊赢的，根本不威风，凭自己实力赢的才是真功夫。我以后要好好学习，不让老师和家长失望。俗话说“世上无难事，只要肯攀登。”只要努力就一定会成功。,6.0,,0
13,13,26747836,喵星人,a1687ddda5a4ca3352af97e517dc728e,b63a8e25f1634501ecedc9335bba19d2,5.0,2019-08-23 01:01:38,这部片的故事魔幻、搞笑再结合家庭复杂的关系，确实是一部大乱斗。但是就是这样的片子我竟然看了五遍。记得电影院一遍，其他都是陪不同的侄子侄女一起看，他们刚开始又些烦躁，但是很快都喜欢上这部片，而且笑得很开心。 据说这部片票房惨淡，真的没想到评价这么低，电影非常适合家人陪小朋友看，大人要站在小朋友的角度去欣赏这部片。 我家也有一个八岁的小朋友，他爸爸是一个漫威迷，也因此从小和他爸爸出入电影院，所看的电影都是他爸爸喜欢的漫威电影或者科幻打斗场面。于是小孩子内心世界“童心”真的很少，他的世界没有童话故事，没有格林兄弟，没有龙猫，也没有千寻，也没有小猪佩奇……他8岁，很多思想已经接近成年人，所以说现在孩子早熟，真怪不了奶粉，这和社会发展和变化息息相关。其实孩子早点了解这个世界也挺好，可是在孩子身上总觉得少了点东西……不用思量，因为一玩起来就感觉到了，孩子缺那份该有年龄的天真烂漫与可爱，所以，往往在我们的眼中，他们已经不是孩子了。 为什么这样说呢？ 因为他们这么小就已经无所畏惧…… 比如，你告诉他你不可以撒谎，否则会在你的功德簿里记录下来，到死的时候你很可能会接老天的惩罚，我们的鬼差会在地狱用烧红的刑具打你的舌头。 你猜小孩子会回答什么？ 他会回答：我信你个鬼，你个糟老头…… 然后一本正经的告诉你这个世界上没有鬼，你在骗我😭…… 尴不尴尬，尴不尴尬…… 或者你告诉他，你要像孔融一样让大梨给别人，舍己为人。 小孩子会说：我听都没听过要让自己喜欢的东西给别人，你是不是傻…… 尴不尴尬，尴不尴尬…… 而这部片其实挺童真的，古天乐真的是一个敬业的演员，在电影中将一个单纯老实的父亲、丈夫的幼稚、呆萌演得特别到位。女主也不错，虽然还有点其他电影中的风格在，一点没有香港太太的味道，但确实挺认真扮演着搞笑的妈咪，其他小演员也都有特色。 评分这么低有点偏坡，这部电影确实数都数不来的亮点。比如犀犀利在锅里下毒，结果三文鱼是给他准备的。比如闪电眼要电死这一家四口。比如晚上摸黑去杀他们四个。都表现得很棒。笑得哈哈哈哈哈。 也是偶然刷抖音才知道这部片评分这么低，据说票房也亏得一沓糊涂。毕竟我也是个受益者，看了人家五遍，也应该来声援一下。希望未来多一点儿童适合看的电影，小孩子世界应该要有小孩子的故事。陪伴小朋友的同时也可以感化大人。,,1.0,0
14,14,26747836,喵星人,05b5abf0864b60490b082906d7834ecb,106f090fd9edc05d41c5c6bc092dca15,3.0,2019-06-17 19:22:00,一只来自喵星的猫（西米露）因为弄丢神器而附在普通同类身上变成了超大猫犀犀利，从破坏一个家庭的多次尝试到成为这个家庭的一份子。腿有缺陷不能跑不能跳的优优妹妹，梦想成为大导演的哥哥，善良但脾气暴躁的妈妈，保护家庭却总是犯蠢的爸爸，一家人的欢乐，一家人的爱，一起渡过困境。犀犀利找到神器之后却又舍得这一家人，明白爸爸妈妈为了妹妹的腿才那么在乎钱的它用光神器所有的力量换回了优优的健康。返回喵星时发出的强光也未能消除这家人关于犀犀利的记忆，因为爱不仅在脑海里，也在心里。,,1.0,0
15,15,26747836,喵星人,c28e66e7d2c1a48d602e590df99e0677,9e513bb89895143457a3270c908e9474,2.0,2019-05-06 11:02:24,我这种开了头就一定要看完的强迫症都不行。 全片唯一的演技担当马丽，马丽告诉我们哪怕是喜剧，哪怕这么烂这么弱智的剧本，都要投入，你要相信你的角色，给出真实的反应，给马丽点赞。 and猫咪这么可爱的生物都能塑造的这么恶心？导演你真行，这个猫咪的虚拟角色很多反应特别不真实，像一个演技很差的演员，没有抓到猫咪本身的动物性灵性，推荐大家穿靴子的猫。 从马丽的瓣嘴过来的，有的演员演技很好，有的演员天分特别高，但是输在了不会挑剧本上，比如我老公，他自己挑的剧本都是些什么玩意？比如马丽。 瓣嘴有一个评论是这个猫的造型太丑了，为什么不找一只真的猫来演。马丽的回复是你一定是一个没有爱心的人，真实的猫哪有这么大？Excuse me？这么烂这么垃圾的儿童片，我不喜欢看，我就是没有爱心？What？你这是道德绑架啊，我的天。还有这个猫这么丑，你哪怕好好设计一下形象也行啊，你到有没有看过全片啊？ 个人其实真的很喜欢马丽，无论是人还是演技，但是，我觉得她没有挑片子的眼光和品味。我觉得这姑凉相信她演的角色不仅仅是因为演技好，可能是实诚真相信，233，小姐姐，你这么善良天真是会吃亏的呀，愿老天厚待你。,1.0,,0
16,16,26747836,喵星人,0e662ba748b48e36354647220ebef9bb,793d06548a25f42635adfc1c4c54c666,3.0,2019-02-12 23:41:51,听说是动作片导演做的温馨宠物电影，所以，就……嗯……就这样吧。没有瞧不起动作片导演的意思，但确实整个叙事啊节奏啊都还有待提高吧。演员我也是挺喜欢的，但是略浮夸，没必要，并不是说儿童电影就一定需要这样夸张的表演才能吸引孩子们。 总之，就，小朋友们暑假去咯咯咯笑一下就还行吧。 写于2017-7-15,,1.0,0
17,17,26747836,喵星人,e54bc24a0a89f65912d02b6a045a10a3,2feb30b044656b21680f1c20a935084b,4.0,2019-02-04 14:04:07,此电影是一部关于亲情和家庭的电影，其中含有幽默的剧情，搞笑的人物。其中吴优优因为身体差异，而被其他人排斥。正因为如此，犀犀利的到来，让她倍感开心，她终于有了一个好朋友。而吴优优对待犀犀利的态度，也单纯天真。 我推荐这部电影是因为，吴优优的单纯可爱，和对犀犀利的友情让我感动，而犀利利最后也被吴守龙一家的行为感化。,,1.0,0
18,18,26747836,喵星人,1bf6319a346b10ca433ce6c5cf7bb4a2,4a7dcccc6f81ab32083a34a05f82f6ae,2.0,2018-09-23 14:25:15,"可能因为比较喜欢猫，一直都想养一只但从来都没有实现，所以对这本片子情感上加了一些分吧。
说说我觉得好的地方。可爱？略有一点感人吧，反正我看到最后哭了。然后好像就没啥了(๑˙ー˙๑)
下面是我觉得不好的地方
第一
抄袭啊朋友们！大家都没有看出来么？简直了。一开始旁白感觉就是抄的《我的个神啊》，然后那个什么绿色的神器出来我就真的，无力吐槽，简直就是PK那个遥控器的翻版。然后不出所料的丢了……后面那个小男孩拍的视频点击率迅速上涨，有没有？又抄《神秘巨星》？感觉连镜头都差不多就是把英文改成了汉字？？醉了。然后照这个思路最后肯定是PK，哦不，犀犀利又回到地球了，果然……欺负印度人不看么？其实这本片子根本不需要抄袭啊，不用这几个元素又能怎样？这么没骨气的么？如果不抄袭我可能会给8分？
第二
觉得有点偏题了，这个剧情的话不应该叫《喵星人》，换个名字可能更好一些。然后点题处有点生硬，就跟写作文一样…… 第三 确实有些低幼，中心思想比较浅显。还有吻戏有些多有些长，个人不是很喜欢。 不知道包不包含剧透。就这样吧。四分是鉴于我真的很喜欢猫而且整体思想还是积极向上的吧。 不好意思图懒得找了。大家就当吐槽看看吧。",1.0,,0
19,19,26747836,喵星人,b0b3080fe14719c4b8c6b0008251264f,b66a3475dcb6e5a1c94f9e3a17673742,2.0,2018-07-24 13:33:00,二倍速看完了电影，猫狗来自外星的想法很奇特，里面的动物也都很萌，但是不知道这部电影的意义何在，整个剧情看下来感觉水分太多，部分笑点和泪点有些尴尬，也许是儿童电影门槛太低，这部电影卡着门槛出现。 整部电影就是一部儿童电影，开头故事背景的旁白很像小时候电台里读的童话故事，人物刻画也过于单一，男女主角的性格过于戏剧化，当然，表演也很浮夸，感觉白瞎了古天乐和马丽的演技。 电影的头尾有些不接，开头男主角是帮一位老板暂时养猫，但到后面的剧情编剧已经忘了前面那位老板了，直接将猫写回星球，但对那只被附身的猫以及老板并没有交代，如果猫已经融合了，那么男主角该怎样跟老板交代。 电影的泪点有些刻意，不过也许正和小朋友的心，笑点不算多也不算少，但是很多笑点很尴尬，有些传统香港电影的感觉，但通过浮夸的肢体动作和表情表现出来，感觉不到搞笑，只有尴尬。 艺术源于生活，但这部电影的有些内容离生活太远了。,2.0,,0
