,Unnamed: 0,电影id,电影名称,用户id,用户名,评分,评论日期,评论内容,有用数,没用数,回应数
14,14,26756258,狐步舞,704b257191d37f84b7686bc70db6dbb8,c1a67a86b34338831f6e80b5bc4bca72,4.0,2018-06-21 12:44:53,一部以色列电影。2017年威尼斯电影节银狮奖作品。希腊悲剧三段式结构：每段都是悲剧，层层推进，直至第三幕呼应第一幕，呈现出无可挽回的荒诞。摄影极为工整，美工无可挑剔。所有封闭空间的戏，基本上都穷尽了一切角度，以背景衬托人的心情。通常来说，诗性十足的电影，容易拍的沉闷。可这部电影却一环紧扣一环，毫无松懈之处。看完之后，读了一篇导演访谈。这部猛烈嘲讽军方的电影，让他承受了很大压力。反战、批评当局、宣扬虚无主义。 假设我们能够拥有一个承载“悲伤”的容器，它也许呈现无形，或因气温、季节与假想“爱而不得”的忿怒随之同步上升，再径自扩大，直到涨破倏忽坍塌沦为废物。三段式沉浸人类心理描摹，从外界感官，到艺术成分，再退回到对与错的分界，张弛有度。掩埋在内心深处的意外与巧合，始终让赤贫的人生回到起点。,36.0,2.0,0
15,15,26756258,狐步舞,409e39a1e607bcc3bf8157b14d3e858c,d3300730b1f7e6d9361733686b9c78a0,5.0,2021-06-11 23:05:32,这部电影太好看了，我真的好喜欢三大电影节，能给这些好导演一个展示自己的机会，能给欣赏作者电影的人莫大的享受。 这部电影的镜头让我折服，开局在房间里男主老婆昏过去后，推到后面那幅混乱的画，在我理解中，这幅多次出现的画展现了男主复杂、抑郁的心情。在房间内，俯视镜头后接跟拍、压花玻璃后走近的男主、边境湖水的镜面效果、隐喻蒙太奇，还有最后男主夫妻的旋转镜头——人不转，背景转，这个镜头真的太美了，表达了夫妇此刻复杂的感情。在边境男主儿子的部队修录音机(似乎是)的镜头又为这部艺术感十足的电影添加了理工科的色彩——果然，文理不分家，整个世界是粘合在一起的。 剧情也是一波三折，简单但有趣——男主儿子去世，虚惊一场，又间接因为男主而去世，而背后的哲理，在我看来是因果报应+宿命论，男主因为让别人替自己踩地雷，而让儿子受到了报应，而儿子因为误杀一车无辜的人而受到了现世报，但这样解读未免太过狠毒，所以我又想到了另一个解释，那就是宿命论。大多数艺术造诣高的影视作品都有宿命论的体现，《寄生虫》、《老无所依》、《花样年华》都体现了人物在命运面前的无力，我认为这部电影也不例外。男主和儿子都因为宿命的指引而造成了他人的死亡，而男主一家人也默默地接受了这个安排。反战因素已经不算新鲜，但这个世界上只要还有战争。那么反战元素就永远不会过时。 因为这部电影，我对现在的以色列这个国家有了更深的认识，好希望中国也能出一部这样的电影，给世界提供一个更好认识中国的窗口。,,,0
16,16,26756258,狐步舞,16185972834bd73ea637f10c5099f693,1fd0b4a5b8b310f600ba9214f55ee957,,2021-05-31 16:07:01,从92部各国申奥片中，翻找到一部非犹太复国主义论调的以色列电影 —《狐步舞》。导演曾凭借处女作《黎巴嫩》斩获威尼斯金狮，影片基调同样超然于政治立场与是非争执，专注于刻画人物自身的矛盾与困境，这样的切口还是蛮刁钻的，毕竟大多数人选择战争片还是为了满足感官体验。 但其实《狐步舞》更应该被定义为非标准类型片，全片分为三幕：“悲恸”、“荒诞”、到最后一幕运用黑色幽默解构“解脱”，剪辑、叙事风格与正歌剧间穿插的幕间剧极为相似。巧妙的是，全片的镜头语言表达是统一的，而幕与幕之间的叙事线索却做到了决绝的隔离，一幕阐释一种情感，更能引起观众的共鸣。不像某些深爱非线性剪辑的导演（比如诺兰…），刻意营造时空交错感，比如囊括六层梦境的《盗梦空间》和涵盖一周、一天、一小时海陆空三军撤退的《敦克尔克》，不画出一条完整的逻辑链，就没办法理解所有情节，太伤神。电影作为第七艺术，优势还是在于视觉听觉上的直观刺激，太多弯弯绕绕就显得不可爱了。 从获奖情况来看，民族主义电影还是有一定市场份额的，只不过个人英雄主义仍旧大行其道，过度神化个体不如塑造一位悬置的上帝，战争本身的罪恶和无意义，不该输给所谓的moral code. 最后推荐两个最能体现文化多样性的片单吧，每年的“欧盟影展片单”和“世界各国送选奥斯卡最佳外语片的片单”，可谓百花齐放、百家争鸣。,,,0
17,17,26756258,狐步舞,5d042276424411af413814b54944b207,afbaf48751fb1ec3ecf1a6de68fc2dc1,5.0,2021-04-03 14:28:29,"60年前著名的犹太裔政治思想家汉娜·阿伦特以《纽约客》特约撰稿人的身份报道了以色列政府对德国纳粹高官、犹太人大屠杀“最终方案”主要负责者阿道夫·艾希曼的审判。并在此后提出了著名的“平庸之恶”的概念。在阿伦特看来这种恶广泛地存在于现代生活中，它的平庸正是由无数个个体的无意为之而塑成的。在这种平庸之恶的笼罩下个人永远屈服与时代境遇或体制，默认其中的不道德行为甚至成为这种不道德体制的实践者。同时他们的良心不安也在体制的庇护和同类个体的认同中得到了开解，也即用外在的肯定强化了个体作恶内在意识的正当性，抹除了不经思考的恶行所带来的负罪感。在《狐步舞》这部电影中，处处充满着这样的平庸之恶。负责传达士兵乔纳森死讯的军队慰问团无视死者亲人的悲痛，只想用机械的流程完成他们的任务；军队的信息处传达错了了死讯，死者是另一个乔纳森，却把因此而暴怒的父亲定性为“思觉失调”；而一边痛斥军队不作为和官僚主义的父亲刚驱逐走慰问团后转身就托关系将儿子从前线调回家；边境哨岗的通讯员喜欢捉弄过境的车主，让他们难堪和吃瘪；边防指挥官教育手下的士兵彻底忘记他们误杀的四个年轻人，因为他们是奉命行事，战争就是战争，战时这种狗屁倒灶的事情是很多的，把一切当作没发生过就是最好的结果。
仿佛所有的平庸之恶都能像影片中那辆巨型挖掘机轻易掩盖失手杀死的四条鲜活生命一样被抹去它们曾经明确存在的痕迹，只要你愿意放弃个人价值的判断权利，把自己当做庞大意识形态机器的一颗螺丝钉，一个轮齿。但是电影的结局昭示我们这种平庸之恶最终是会传导到我们自己身上的。影片中有一只骆驼始终无知无觉地穿行于以色列的边境，它的“越轨行为”之所以被士兵们放任，是因为它没有边界意识，不辨善恶。这里骆驼就是所有施行平庸之恶个体的象征。影片结尾，载着士兵乔纳森的军需车为了避让公路上的骆驼而从高坡坠落，“死而复生”的乔纳森再次死去，他的父母再次痛失爱子，一切就如用狐步舞的舞步一样回到原点，而这一切仅仅是因为那只无知无觉的骆驼。电影《火星救援》的原著作家Andy Weir写过一篇名为《蛋》的小说，里面有这样一句话：“只要你加害他人，你也同时在伤害你自己；你的每个善举都会落在你自己身上。”小说中设定每一个人其实都是自己宇宙的上帝，自己即是所处宇宙中过去现在未来的每一条生命，是“每一个存在过或者或将存在的人”。以此视角来看待生命，平庸之恶侵蚀个体道德底线的行为是对全人类的绝对精神领域进行的道德迫降。
影片中还有一个指涉平庸之恶非常有趣的点，即父亲在年少时用家中祖传的希伯来语圣经去交换了一本二手色情书刊，据他自己所言是“像僵尸一般被牵引到阿伦比街上的商店，旁观自己交出了圣经”。在影片中好几处用垂直俯视旋转的镜头为我们呈现了这种旁观视角，在重压下精神的高度抽离与晕眩。同时这种旁观也可看成个体作恶的无意识的一种辩解，通过把自我的主体性消解于幽深的人性、战争的阴云，思想的同一中，试图逃避恶行带来的一系列恶果。在诺奖得主犹太裔诗人内里萨克斯的《致旁观者》一诗中，我们可以轻易地挑破这种旁观的虚伪面纱，并得证平庸之恶对普遍个体的心灵荼毒。

致旁观者

已有人死于你们眼前。
在你们的身体上
你们能感觉到死者的目光，
正如我们也能感觉到背后的眼神。


当你们走出隐匿处采摘堇菜花时，
有多少白色的眼睛在注视着你们？
古橡树的枝条痛苦地相互缠绕，
有多少高举的手臂在树上
苦苦哀求？
又有多少回忆生长在
残阳的血液中？


哦，斑鸠在夜里鸣啭，
摇篮曲已无人哼唱——
有人曾想摘下高天的繁星，
此事现在只有老井才能办成！


你们这些旁观者，
虽然你们没有举起屠夫之手，
但是你们从未抖落
渴念上的灰尘，
你们纹丝不动，看着那人
变成了光线。

20世纪以来，在各种新价值观的突袭与围困下，道德的普遍崩坏成了人类社会共同面对的一道难题。就像罗翔老师所言：一个遵纪守法的人完全可能是一个人渣，更何况在法律只是对人行为的最低要求，而在法律无法监管到的阴暗处还有多少恶行在无休止地产生。而唯有一个个个体开始觉醒，拒绝旁观，拒绝平庸之恶的引诱，心怀敬畏承担起人之为人的道德责任才能重塑这片道德废墟，将人类的精神重新献给天空与骄阳。",,,0
18,18,26756258,狐步舞,d292a72983ee36fb1b0d98d0ae0d6511,743b77b7b28d76f6432e4b926c74d035,4.0,2021-03-23 14:07:22,我是被电影海报吸引而来的。在海报上，一位年轻士兵胸前端枪双手作环抱状将枪口指向天空，双腿微屈双脚呈八字型向外跨立，脖颈向后头颅朝天空扬起，上身穿着黑色作战衣，下身着卡其深灰色裤子，脚上蹬着一双沾满污泥的半高帮沙漠靴，身形定格在片名《狐步舞》的一个舞姿动作上，上面是清澈的蓝天白云，下面却是泥泞的土路洼坑，旁边停着辆浅绿色印有一副风姿绰约的女子肖像在上头的面包车，背后是一眼望不到尽头的土黄色沙地，初看似互有冲突、荒诞惊奇，但细细看来却相互融合、一份奇异的美感，让人久久难以忘怀。才点开第一次观看了那个时不时登上国际新闻头条国家的影片，也才没错过这部片子。      影片共分为三段，在叙事上并非完全的平铺直叙，按时间先后来讲述故事，而是有诸多引子埋伏，时间上也是间有重合和跳跃。影片开头与结尾时间叠合构成闭环，第一段中父亲麦可听到儿子乔纳森平安消息后透过圆窗看到候鸟成群结队飞过与第二段中儿子乔纳森在狐步舞结束后的某天执勤傍晚透过望远镜看到鸟群出现在视野里的场景相同，构成时间上的重叠，而在跳跃性上，我们不难发现第三段并非承接第二段发生，而是有所略过，所以我们会产生不明所以的感觉，但通过本在军营儿子乔纳森手中的画册到了父亲麦可这与麦可与妻子的对话了解到时间的跨度多少。叙事上更是埋下诸多引子，在第三段其中爆发，悬念营造十分出色，如第一段的生死反转、父亲的种种奇怪举动（卧室埋头强忍不去抽泣、卫生间打开热水龙头冲手、踢伤无辜的狗）和过激情绪反应、麦可母亲只记得孙子乔纳森却认错儿子麦可、抽屉的杂志封面女郎、不断强调“士兵只有倒下”这一意象，都在第二段有所补充在第三段集中引爆所有冲突，最终让我们明白了人物的动机和心理。      在色调及氛围上，全片充斥冰冷肃杀和压抑孤寂。家里逼仄的过道门廊、狭窄的人物活动空间、触目皆是的黑白色彩（白墙黑架、黑白相间的菱形地板）、军营里杂乱的狭小营房、凄清阴冷的雾气清晨、苍茫空旷的无人洼地、大雨磅礴的寂寞夜晚无时无刻不给人压力，进入导演营造的氛围中去，看着角色缓慢一步一步走向结局。      而对于主题而言，除了我们能相对较容易理解和感受到父母失去子女那种锥心之痛外，我觉得在更广义面向来看，或许我们能从士兵阿米坎的话得到些启发。他说:我们是在和未知作战，但我并不知道未知是什么。”未知的极大不确定性，使得人人往往很难即时准确的反应和行动，因而乌云无时无刻不笼罩在那个国家上，无论你在战场或是战场外，两者并非孤立开来，而是互相紧密联系。儿子乔纳森在雨夜因长期作战训练反应杀死了一个他颇有好感的姑娘，本以为未知是炸弹没想到一罐啤酒；父亲麦可因惧怕儿子乔纳森阵亡而匆忙找关系将其调离边境导致儿子乔纳森以意想不到的方式死去，本以为未知是敌国枪炮威胁却不料只是头骆驼；儿子乔纳森在边境执勤端着枪防备未知，父亲麦可在战场外为儿子乔纳森担忧为儿子防备未知，每个人都身处这样的巨大不确定性里，随时防备着未知，最终改变了每个人的轨迹。,,,0
19,19,26756258,狐步舞,c635be313f4c472d3f91b742ec71a568,77b8c6c19860a9832c0c296d604996c7,5.0,2021-02-13 11:58:09,"很多名导都拍过反战题材的电影，我约略想了下，比如科波拉的《现代启示录》，库布里克的《全金属外壳》，波兰斯基的《钢琴家》，李安的《比利·林恩的中场战事》，斯皮尔伯格的《辛德勒名单》，诺兰的《敦刻尔克》，伊斯特伍德的《父辈的旗帜》等。
     我之前一律把描绘战争的影片都归到战争片中，事实上战争题材与反战题材的界限是非常清晰的，其中作品在道德与人性上的选择倾向也大为迥异。 战争片中，恢弘的场面，弥漫的硝烟，纷飞的炮火。影片把此类场面作为情绪推进的助手，在此处所展现的是某种精神、主义、抗争与奉献。而在反战题材中，通常战场在人的心中，即面临生存本能时，面临自己或他人的死亡时，人类的价值观的变化。其中有可能是善良与牺牲，也有可能是良知被洗去的晦暗或者怀着深切的创伤与内疚。他们的自省，由外部环境的意义转而向内探寻的结果才是影片的高潮。     昨天看了《狐步舞》，相对于其他描述战争的影片更安静一些，没有硝烟，甚至全片只开了一次枪，但并不妨碍它在艺术上的成就。    电影的结构清晰，围绕着乔森纳的两次死亡，讲了三段故事。第一段主要描述父亲的悲伤，第二段是士兵乔森纳执行任务时出的差错，第三段是父亲与母亲的和解。  这三段故事的拍摄手法特别违反“常理”，比如第一段，直接用镜头描述父亲的悲伤，其中难度在于形容词很难拍，影片也用了长时间的大特写，旋转的俯拍镜头，在封闭空间的俯拍镜头。第二段故事中，只发生一个核心事件，即乔森纳误杀车内平民。其余大部分是日常琐碎，而且用大段对白讲了他父亲的故事，没有配任何画面。而第三段竟然只有一个场景，既所有事情都发生在同一空间中。
 本影片完全可以从以上三幕作为观影线索并加以思考分析，但在影片的三幕背后，伏着一条隐形的故事线。按时间叙述的话，迈克尔（即死去的乔森纳的父亲）是犹太人，迈克尔的父亲死在了纳粹集中营。迈克尔青年时入伍当兵，在一次部队行进中，让后车先行。后车开到前方后地雷爆炸，全员死亡。迈克尔把这件事埋藏在内心深处，他看似正常的娶妻生子，儿子长大后又当兵入伍。一天，部队前来告知，儿子乔森纳光荣牺牲。迈克尔陷入悲痛，并由自己经验推断，部队甚至连自己儿子的尸骨都没有拿到。接下来部队又告知搞错了人，是另一个乔森纳死亡。迈克尔当然无比愤怒，而且这种愤怒是他人所难以理解的。迈克尔凭借自己的关系，唤回正在执行任务的儿子乔森纳，但乔森纳在归程中却真的意外死亡。这件事也让迈克尔的妻子无法接受，两人关系崩塌。半年后，迈克尔在与妻子谈话的过程中，袒露一切。 以上由迈克尔的视角切入，似乎更容易理解该人物所面临的困境，以及人物在一次次想摆脱战争所带来的内心伤痛时，所遭遇的阻碍。也由此可见，战争的伤痛不是由儿子乔森纳的死开始的，也不是由迈克尔目睹地雷爆炸开始的，而是从父亲进入纳粹集中营就开始了。这个隐性故事，也是本片的真实意图。事实上，片中的每个人物都因战争而带来了心里困境，而每个人也都在其中用不同的方式挣扎。 儿子在战争中的死亡是因为一只骆驼。车内年轻人的死亡是因为一厅啤酒。然而片中最大的讽刺点并不在这。由隐形的故事线可以看出，片中核心所讲是迈克尔的自我救赎，所以我觉得，那本被换了色情杂志的祖传圣经，才是最大的讽刺。     另外，影片以画面去省略文本的方式还有很多。比如父亲家中的陈列摆放与装修风格，服饰装扮，在面对悲伤时的行为举止，漫画中脸上的叉。这些视觉元素的创作使得文本或对话显得累赘，它们不仅为隐形的故事线提供了坚实的证明，也描述了人物在环境中的挣扎状态，同时也是在描绘一幅战争画面，让我们知道战争给人带来的不仅仅是炸裂的碎片和生命的消弭，而是贯穿了3代人，几十年都难以走出的心里困境。     影片上映后，在以色列本国引起了相当大的轰动。以色列文化部长雷格夫在影片上映前攻击了它。雷格夫抨击的点在于误杀平民与斗车掩埋车辆，即抹黑了政府对于处理此类事件的态度。《狐步舞》导演塞缪尔·毛茨对雷格夫的抨击感到惊讶，同时他也觉得讽刺，因雷格夫的攻击恰恰证明了这个故事的准确性。雷格夫说狐步舞对以色列有害，不应该由以色列电影基金会这样的政府机构建立。但导演塞缪尔·毛茨觉得这不是一部关于占领或巴勒斯坦人的电影。这是一部关于以色列社会的电影。第二，一件艺术作品不应该渴望模仿和再现现实，它应该解释、阐明或揭示它隐藏的方面。这正是狐步所要达到的。而在雷格夫攻击《狐步舞》后不久，这就成了一场争取言论自由和支持艺术的斗争，在社会上引发了相当激烈的争论。     雷格夫在网上的新闻不少，比如在戛纳电影节红毯时，裙摆上的耶路撒冷全景图。又或者推行《文化忠诚法案》，规定艺术家或艺术机构只有表示对国家的忠诚，才有资格获取公共资金等。这导致艺术家们焚烧自己作品，他们表示这项法律将使艺术为政府服务，使创作者开始思考‘议程’，假如没有独立自主的议程，艺术就无法存活。当有人对你发号施令之时，艺术将不再有，只有宣传。当然所谓了解仅限新闻而已，就不妄加论断了。
    在我国，我尚不确定一部电影应服从于自由艺术还是服从于宣传。电影可以是民族的，国家的；也可以是人类的，世界的。如果从战争片角度来讲，中国近代战争皆是抵抗侵略，国情不同，议题自然无法照搬，所以说这是一个相当大的辩题。但我根本无意以我思想去引领他人，因从我接触到的电影业界来看，目前最显而易见的所谓冲突并不在此。目前业界在创作上主流冲突在于是我们是否需要“高级”的，因为深沉的东西，观众看不懂。这是在迎合观众的贪欲，而不是价值观。这也是我上文中提及常理时，打了引号的原因。 好像对于我们来说，能不能看懂才是狐步舞的原点，这也挺荒谬的。 可以看出《狐步舞》在商业上未必能取得惊世骇俗的成绩，但现实中它涉及了诸多议题，尤其影片对英雄主义、战争，是一种讽刺与消解。政府对以色列本国的定位成为了探讨议题的根源，其中有支持，有极度困惑甚至彻底否定。对影片所表达思想的质询，同样也是我们在去认知历史、艺术时所抱有的主观臆断与思辨。但不论如何，《狐步舞》以特定时空为语境，在现实中激发了人们对人性，对过去、现状的自省。未来是否会因此而改变，我觉得不见得。我不认为电影除了可以激起一时的辩论或个体行为差异外，真的可以促使世界的改变。或者说电影在个人、社会、历史、科技、文化领域的广度与深度的探索中，传播只能占其中之一，而不是全部。 于是觉得还是让艺术自由纯粹一些更好，它只是通往其他维度的魔法门，在那里我们可以体会到不同的时空里不同的人生，那里有爱、恨、暴力和死亡。当我们跳完一曲《狐步舞》又会回到原点，此时的我们对过去的遗憾和解，对未来多了一些期盼。对于战争的思辨，也在我们脑中萦绕不去。",,,0
