,Unnamed: 0,电影id,电影名称,用户id,用户名,评分,评论日期,评论内容,有用数,没用数,回应数
0,0,26756258,狐步舞,dd6a821b1a146f2c218c86d1952ee203,7aab1af470d3f26079c9cbfe5ec45b96,4.0,2017-09-16 11:34:24,"贴在眼睛上的X (几乎可以做成另一个独立故事) 影片结束后是观众问答环节，末了有个女观众问了个我以为非常愚蠢的问题：说你这戏这样严肃沉重深刻的主题，为什么加那么些喜剧元素，看得老娘我直跳戏。导演和男主角你看我我看你，小心赔笑道还好吧，稍有几个comic relief，也不是刻意追求的喜剧效果啦——我们在以色列送审和威尼斯影展的时候，骆驼踱过来时观众里也会有一些嗤嗤暗笑的，但没像你们这样全场哄堂大笑的。话音刚落观众又哈哈大笑。

茂兹在答这话的时候我疑心他英文不够溜，或许辞不达意。影片里这些冷幽默于我看并不是卡通色彩的喜剧元素，而是absurdity，是ridiculousness。这些荒谬与滑稽正好彰显创作者对战争与国家主义的看法，无关喜剧色彩。

和大多那个年代的男孩子一样，我小时候的游戏喜欢舞枪弄棒，大些后的成长过程中也看了不少描述战争的电影。我们在中国战争片里学会了国家主义和民族情结；在苏联战争片里见证了恢宏、浪漫、甚至诗意；在美国战争片里我们享受到了无懈可击的视效音场以及肾上腺素飙升的快感。当然我指的是主流院线和一般电视台愿意做的片子。虽然我从没有参加过战争，也永远不想参加战争，但我总疑心真正的战争是和看过的那些电影里的那些不一样的。

真正的战争大约并不会让所有参与者都热血沸腾，而且绝不会那么——怎么形容来着？——那么“好看”。

≪狐步舞≫一上来就给了我们一个荒谬的设定：军部的人来到父母家，门才打开就老老实实通报：你儿子死了，“为国捐躯”，现在作烈士等论，军衔照例加两级，丧礼明天下午，你想的话可以帮忙去抬棺材，不过我们建议你还是扶着你老婆......  当娘的往后一仰开始要抽搐了，这些人二话不说把她放平了衣服撩起来就打了一针镇定剂。看着不是报丧，简直是预备劫持了后撕票。当爹的脸上表情都还没有全部就位，这些人在他开始发作前早替他计划好了下一步适当的反应：来喝口水。按着脑袋再喝一口。我们替你把手机校好了闹铃，接下来半天里一小时闹一次，闹铃响了你要记得喝水，渴不渴都要记得喝，待会会有计划丧礼的军方人员来做心理辅导...

看到这第一节时，我只当它是导演玩弄什么意像的什么的魔幻主义先锋主义之类，因为荒谬得瘆人，看着只可能是寓言而不是现实。谁知最后的问答里茂兹那些人说以色列的军方报丧就是那样的，有一套严格而完善的程序可走，负责镇定的心理疏导的各类人职真的都现场侯在那里。那么这就成了非常严重的问题：战争的阴翳虽然可能随时降临，但至少此刻在我们的视线之外 —— 在这种状态下军人的身体已经属于国家了，那没去从军响应号召保家卫国的人们呢？他们的身体、应激反应、表情、甚至情感、难道都也都一切属于国家？

接下来——咦艹弄错了，死球的不是你儿子，闹重名了。要不要再来杯水？再打一针？

这场发了疯原地打转的狐步舞跳到第二步的时候，我们见到了他家的公子——原来不过是个稚气未脱的娃娃兵。还以为驻守的是什么了不得的危机四伏的关卡天堑，原来却是戈壁滩上孤零零的一条破路。不要说什么哇啦哇啦嚎着的恐怖份子圣战士，除却4个年轻美丽的娃娃兵外，连个他妈的人影都难得见到。一匹野骆驼比他们还百无聊赖，无精打采地踱过来踱过去。
 身体。思想。感情。一切的荣誉归于国家 这四个小兵哥要放在美国片里，估计满嘴妈妈叉叉的扎姘头段子和大麻烟。放在苏联片里他们保不齐突然很专业地合唱一段俄罗斯民谣。放在中国片里他们随便哪个一张嘴都能说出许多保家卫国的崇高道理。但他们是以色列兵，格局小了很多，顿时看上去呆滞了：他们并没有怨言，但相互间交流也不频繁，俊俏的大眼睛里是as-matter-of-factly的空洞。除此之外他们在做着一些大约沙漠里的文艺兵才会做的很文青的事情：修复古笨的军用电台，雨夜里放老歌，将父亲和自己的黑暗秘密画成漫画，就着老歌跳艳舞，等等。只有那些时候他们看上去身体和思想才不再属于国家，看上去不再呆滞，开始有了灵性和人格。

但这群年轻的，美丽的，有灵性的娃娃兵不管多么纯真和文青，那个时候到来的时候，他们下一秒就会变作杀人机器。眼都没来得及眨一下，就可以把一车同样年轻美丽的男女扫射成马蜂窝，而且理由可以简单淳朴到“不怕一万，就怕万一”。

有些人看到这里或许会以他们国民的焦虑感替这几个小兵做解释——天天生活在恐惧与警惕里不容易，毕竟是居住在抢掠来的土地上。可他们一旦发觉闯了祸，很快地又脑子情感统统上缴国库，因为知道会有国家爸爸来擦屁股，脸上复又呆滞的表情。他们自小受的系统训练大约如此。

这出戏里并非都是这类任由国家安排的木头人。饰演父亲的国宝级演员阿什肯纳齐演技奇好，他做的Michael是全片最有反骨的角色。小时候偷了老娘从集中营里带出来的希伯来古董圣经去换了黄色画报，长大成人后又将威严的满口德语的母亲送入精神病院。虽然也服过兵役，但他基本的人生走向都是自己的设定。这样的不服管束放在国家民族利益的宏大前提下当然不会有什么好下场——他死而复生的乖乖宝贝儿子，最终还是等于间接死在了他自己手上。
 自古红颜多薄命：水嫩如斯，莫明其妙就死球了 狐步舞最后跳回原地时，那军车在破败的野路上驶着。我屏着气息等着地雷爆炸。一颗火箭弹呼啸着飞过来。一个捆满炸药包的黑衣阿拉伯婆娘啦啦啦啦啦地锐叫着朝车子冲上去。

结果都不是。钟灵毓秀的Jonathan死的是最无聊没有意义的死法。看上去简直是最愚蠢的牺牲。这说出去了居然也是冠冕的为国捐躯。

这戏在威尼斯得了评审团银狮后，据说在以色列国内被文化部暨军方点名批评了。观众问答时茂兹说那儿骂什么的都有，似乎叛徒卖国贼之类的话居多。那你为什么想到的是这个题材、这个切入点？观众席上一个大胡子的男青年接着问。“因为我是以色列人。因为我会为这个国家忧虑。因为我care。” 茂兹缓缓回答道。

我忽然一下子想起来另外一个国家。想起了过去现在的许多事情。
 导演和男主角  TIFF 2017  Wed Sep 13th. Elgin Wintergarden",110.0,10.0,21
1,1,26756258,狐步舞,422f5fddfea5db02ce76ca885818cad0,422f5fddfea5db02ce76ca885818cad0,5.0,2017-11-01 08:11:07,2009年以长片处女作《黎巴嫩》斩获过金狮奖的以色列导演塞缪尔.毛茨，终于拍出自己的第二部电影《狐步舞》。它套用上经典的古希腊悲剧框架，通过父子隔空感应的三段体故事，创造出一个情感充沛、命运揪心的因果报应故事。   电影以戏剧舞台感极强的家庭室内戏揭开帷幕。妻子Dafna应铃开门，外面却站着这辈子最不想见到的严肃军人，“您是Johathan的母亲吗？”毋庸置疑，这只可能是带来轰天噩耗的亡情信使。母亲当场晕厥过去，客厅景深处的父亲Michael，则以让观众有着切肤代入感的微妙表情变化登场，完美表演出一个听闻噩耗的硬汉父亲所该做出的身体反应——内心情绪崩溃，表面又得坚毅强撑。   于送信人和收信人，这都是一个非常尴尬和难堪的局面。导演以非常干练的拍摄手法，在这个大居室舞台上，呈现出战士阵亡后，来自军方的一切程序化慰问，以及既要抚慰烈士家人感受又得严格执行军规的简单粗暴丧葬流程。尤其在以色列，这样一个有着全民皆兵政策和繁复宗教仪式双重特性的国度，通过军方来人单方面的向父亲Michael告知流程，导演也非常高效的让观众大概知晓了犹太律法是怎样与军事系统相裹挟的。   观影情绪被进一步引向一种尴尬境地，这家人尤其是得负责善后的父亲Michael，什么时候才能走出情绪最低谷，去抬那具覆盖着犹太六角星国旗的棺材啊？这家人还不为我们所知的关系，会不会在随后的电影时间中走向崩溃，如另一部以色列佳片《七天丧期》所呈现的封闭压抑环境如何让一家老小反目成仇的互揭伤疤。配角们，认真帮忙度过难关的Michael弟弟、仅作为表述“这家人还没绝后”而过场存在的女儿，以及作为某种古怪神秘意象的奶奶，纷纷登场，也像是要把故事引向分崩离析的毁灭道路。   不过，塞缪尔.毛茨显然有着比讲精彩故事更大的哲学野心。有一场客厅戏，叔叔扭过身来，桌上的笔记本电脑屏幕上是军方发来的哀悼仪式流程，旁边是一碗橘子。在导演看来，这个画面就是同时包含了特产和战争处境的以色列国家象征——橘子与阵亡者。当然，在电影故事中，另一时空中的兵营狐步舞替代了橘子，成为总得回到原点的命运之舞。   边防哨所的第二段故事是超现实的，简陋的兵营正在倾斜塌陷，从营房走到公路哨所得踏过深深的泥沼，公路旁有一个装载探照灯的集装箱，随时可以将过路车里的司机和乘客打上高光，成为危机四伏查验戏份中的主角。机关枪可以保障突发情况时候的压制性火力，却也可能失控酿成悲剧。   城市公寓与边防哨所两个时空的不可控事件，以及纽带父子关系的一本没画完的性幻想漫画，将儿子与父亲前后脚着，塑造成希腊戏剧中得为错误付出代价的悲剧英雄，而且是在一个循环反复的闭环中永远摆脱不了自己命运的英雄。故事编织之精巧与命运寓言之含糊，在这部电影里，竟能形成某种并行不悖的默契，像越跳越能熟谙的狐步舞。   塞缪尔.毛茨深知自己被命运眷顾过。他的长女读高中时，曾经非常赖床，赶不上公交时就只好花老爸的钱，以不菲的费用打出租去学校。塞缪尔不想再纵容女儿，勒令她必须早起，和其他同学一样，搭乘5路车去上学。一个早晨，女儿离开家门半小时后，他在电视上看到恐怖分子在5路公交上自爆的新闻，焦急地拨打女儿手机，可是蜂窝移动网却因突增的数据量而崩溃。又过了半小时，女儿出现在门口，她又迟到了，没赶上那班被炸的5路公交。   导演和女儿从没做过什么天大的错事，因此大可不必迷信着担忧某个迟早到来的报应。可电影中的小兵Michael，在犯下大错前又何尝不是快乐的大男孩呢？他想象着父亲色情幻想漫画中巨大胸部贴着黑条的宇宙女神，紧紧抱着一把冲锋枪，在明快的拉丁音乐中，左一步、后一步、右一步、前一步，跳着狐步舞。,36.0,5.0,5
2,2,26756258,狐步舞,91230e9366993bebf7bbd7e16657bdd0,54fda8afa010d33e5a38ac75c7f3383a,5.0,2018-03-18 10:35:07,实在太爱此片，分三点陈述它的好 1. 结构精巧        “悼亡电影”最令人害怕的，是平铺直叙编排主人翁一直垄罩于低气压中，任凭演员演技再细腻，观众在两小时内迟早会麻木。此时“设置悬念”就是好用的招数，本片用了两次悬念，第一是“被告知儿子死了-怎么死的？-死的不是你儿子”的悬念，第二是“第三幕开始气氛异常-儿子死了-怎么被老爸害死？”的悬念，前年《海边的曼彻斯特》同样也是利用“设置悬念”的高级悼亡电影。这两处加上很飞的第二幕都极具魅力的引领观众继续看下去，加上“第一幕-家庭、第二幕-战场、第三幕-家庭”本身就是个踏回原地的狐步舞！结构精巧、错落有致。 2. 摄影精心        全片出现两次“垂直俯视旋转镜头”，首先是老爸在军人告知噩耗完离去后，独自坐在椅子后出现，再来是儿子误以为被手榴弹攻击，枪杀全车无辜四人后伴随着烟硝与震惊。呼应着中段出现的故事“老爸被色情书刊迷惑，情不自禁“看着自己”做傻事，像殭尸般把家传经典卖掉换取色情书刊。”这组镜头太令我讶异，如此精准的传达当重大事件降临，不希望是发生在自己身上的抽离、晕眩。Bravo！搭配主观、客观镜头的交叉使用加强“看着自己”的抽离感，倾斜的货柜和画象征人心的失落。摄影诗意，却有精心的骨干撑起。 3.对“宿命论”的有力论述       在看此片前，笔者对于“宿命论”是毫不相信的。假设没有铺陈，或者最后一幕“战车为了闪避骆驼，打滑冲到悬崖下”是顺叙的接在第二、三幕间，笔者肯定会噗嗤笑出声（是的，又是此片结构上的胜利。）但导演用第一幕的离谱误会、第二幕战争的荒谬虚无、第三幕父母的追悔自责，母亲以前就想堕胎，不想让生小孩的快乐如此理所当然，失去孩子又更加痛苦；父亲想要小孩，觉得是上天对于害死同侪所赐予的原谅，却又残忍的收回这种天启，并且是自己酿成的果，如此细节如此层层铺垫完全说服了我对于结尾的宿命论。         此片灵感来自以色列导演Samuel Maoz的生命体验：女儿坐公车上学，电视新闻却传来此公车被袭击，电话也打不通，最终女儿出现在家门口，原来没赶上那辆车！虽然根据访谈，导演本人也不相信命运，从女儿的遭遇觉得没有可汲取的教训，但我很感谢导演，说服我另一种看世界的宿命角度，相见恨晚，莫过于此。,12.0,,1
3,3,26756258,狐步舞,44f4e41e809f34979e888548c71e25d3,c49c543bd445d98a4e9c2915761e8d35,4.0,2018-07-05 10:32:22,（文/杨时旸） 怎么说呢？《狐步舞》甫一开场就弥漫着一股荒诞不经却又严阵以待的古怪气质，它始终肃杀、阴郁却时不时斜刺入一截让人们忍俊不禁的桥段，但似乎又让人笑不出来，很快就被挥之不去的阴冷与凝重遮盖掉了。它就这样在不同的气质之间跳来跳去，塑造出一种难以名状的特殊腔调，混搭着家庭剧和战争片的类型，既没有宣泄讲述家庭中的情感也没有铺排战争的现场，它似是而非，但意外因此力道十足。导演毛茨自己说，他想在这部电影中呈现出古希腊悲剧的气质，确实，从某种程度上去看，它确实做到了，用一个现代故事呈现了古典的意蕴——悲怆的感情氛围，宿命的轮回报应，无处可逃的命运之手。 故事是从报丧开始的。镜头紧紧盯住母亲的脸，然后，人物晕眩，露出背后玄关的一幅画作，抽象的线条，缠绕在一起，像胡乱挥就又像有条不紊，散发浓郁的精神狂乱气质，镜头转过弯，露出站在原地震惊不已的父亲。这一层一层的显露和剥落就像一次对之后故事的预言，一切都是一层藏着一层，有待于慢慢展开。 《狐步舞》是那种适合细细观看细节的电影，相较于剧情的演进，那些丰沛细节中的象征、隐喻以及背后展现的精神危机，是更有趣的内容。玄关悬挂的那副抽象画，以及这所宅邸铺满的几何图案的地砖，还有方圆相称的窗子，都在通过明确的构图展现意义，一切层叠又排布，充满眩晕感但又不停地强调秩序。这就是《狐步舞》想要显露的特征，混沌与清晰，非线性与线性的干扰与缠绕。 那场报丧是肃穆的，军队的相关人士前来告诉父母，他们的儿子死亡的消息，但旋即，这种肃穆被推到极致之后产生了间离的荒诞感，士兵们训练有素地给昏死的母亲注射镇定剂，像在战场上照顾伤员一样，配合起来将她送到卧室，给男人设置每小时一次的闹钟提醒对方喝水，生硬地和对方谈论丧礼的细节。导演在一次采访中提到，以色列军队去报丧时基本就是如此，有一套高效的流程。而当这套流程被艺术化地呈现在那幢充满隐喻符号的房间里时，产生了一股难以言明的感受，死亡的降临是急促的，但亲人的接受过程应该是缓慢的，但在这里，这种应该缓释吸收的悲伤被纳入了一套军事化的规训，荒诞再一次被凸显，而更荒诞的是，当悲伤即将被确认的瞬间，反转又一次降临，父母被通知，发生了错漏，死难者是同名同姓的另一个男孩，但谁知道这不是喜讯，只是另一场命运玩笑的开端。 随后，一切转移到战地场景。这故事分为三幕，空间，也就成为了《狐步舞》的另一层重要的叙事基础。房间——战地——房间，就像狐步舞，平移，后撤，平移，回归。在一种看似对称，平衡和闭合之中，袒露那些微妙的变化，一切从表层上看，已经回到原位，完成闭环，达成平衡，但实际上，内里一切都已彻底改变，这就是这部电影想传递的况味。所以，非要总结这部电影的情节，无非就是一次虚假的死亡和一次真正的死亡，以及夹杂在二者之间的私密与宏大交织的意识流。 如果说第一幕房间中呈现的是荒诞，那么第二幕战场的荒诞感就更加浓烈，而在浓烈之外又平添一丝超现实的气味，那个荒凉哨所外每日途径于此的骆驼，一副无辜的表情，面对着同样无辜的值守士兵。与其说那是战地不如说那更像流放，而现实层面的流放之外更有精神意义的放逐，几个人在一起讨论着自己的身世，这身世里掩藏着宏大的历史，浓缩的个人经验，庄严的精神悸动和燥热的性启蒙互文，典籍与色情杂志呼应，这一切微妙的窃窃私语都化进了冰冷泥泞的现实。 这故事讲了周而复始，以及无法挣脱的苍凉，年轻人躲避于战火，却死于看起来人畜无害的骆驼，惹人发笑吗，却又无比凄凉。最不可言说的两个字或许就是“命运”，在它面前谁都无计可施。这部电影的海报中，人脸上有一个橡皮膏交叉粘贴的×，那标记来源于色情杂志封面敏感部位的张贴，欲盖弥彰的封条，看似禁忌实则充满魅惑，就像这欲盖弥彰又出人意料的生活。,19.0,6.0,1
4,4,26756258,狐步舞,69e31357731dda85f3ef389dbed60f75,a7ce521c8d73ac61e665d8262efa264f,4.0,2018-06-13 03:20:48,本文首发于【MOVIE木卫】（微信公号：movie345） 在西方国家的婚礼上，新人通常选择一支狐步舞蹈或者一支浪漫的华尔兹舞蹈作为结婚典礼上的第一支双人舞蹈，预祝他们从此以后开始幸福的、美好的、浪漫的崭新生活。 而在以色列导演Samuel Maoz的电影中，狐步舞被运用成一个包含多重意义的符号，它不再是崭新生活开始的标志，而是以色列边疆关卡的代号，也是 “总是会回到起点”宿命式隐喻。狐步舞的步法被精心设计成电影故事发展和空间位移的运动轨迹，构成“前进—向旁—后退—归位”闭环结构。 前进 电影开场，两个军人敲开主角家门，带来儿子Jonathan阵亡的消息。噩耗像一颗子弹，突如其来将这个家撕开一道口子，击倒了母亲Dafna，震晕了父亲Michael。军方显然对于如何处理阵亡战士家庭的反应已经习以为常，他们熟练地给Dafna注射镇静剂，安抚其入睡，建议Michael设置闹铃，提醒他每个小时都喝一杯水以避免脱水。对于后事安排有条不紊地进行的同时，死讯却如轰鸣作响的泵机般抽干Michael身边的空气，让他不断陷入与外部世界的撕扯和摩擦以及自身的逃遁和惩罚中。 第一段的绝大部分的场景都在Michael和Dafna的公寓中发生，简约现代的装饰风格、精心布置的空间、不真实的窗外景物和受限的镜头位移触发了一种舞台式的情景，创造出置身其中的剧场式幻觉。而在这幽闭空间之内，压迫性的镜头特写，将Michael围困于逼仄之中，无限放大他暴露在巨大悲伤之下的狂躁不安，由情绪推进而升温的张力，如同尖锐的噪音刮擦着观者的神经。 向旁 电影的第二段则转移至荒芜人烟的北部边境关卡，那里驻守着包括Jonathan在内的四个士兵——他们的主要任务除了例行检查往来的车辆和人员之外，还得对怡然自得缓慢路过的骆驼予以放行。 第一段中几欲崩塌的情绪张力和幽闭受限的物理空间，突然在开阔无垠的沙漠中得到缓释。一时间，由死讯所诱发的悲伤突然转换成超现实的荒诞无稽。 天空如同被颜料染蓝一般不真实，废弃过时的手绘广告牌前，寂寞的士兵抓起来福枪作为舞伴，在空无一人的公路上踩踏起孤独的狐步舞；在潮湿泥泞的集装箱中，他们一遍遍地用滚落的午餐肉罐头测试其倾斜的程度，用咸腥的“最后一个睡前故事”调剂枯燥无味的重复生活。 当然，别忘了他们所身处的战争泥沼和背负的军人职责，以及这一职责所附带的那一点点高于巴勒斯坦平民的权利：经过关卡的阿拉伯旅客总是被迫要接受士兵们漫长乃至羞辱的检查。而这一权利使得这群与普通青年无异的士兵过早地被推上杀伐决断的位置之上，于是酿成一场误杀的惨剧。 后退 也许并不能成为一名优秀士兵，但Jonathan却画得一手好插画，将父亲的故事和驻守关卡的经历记录在笔记本上。这些插画以有趣的动画形式呈现，串联起“最后一个睡前故事”的前世今生：父亲Michael如何用一本种族大屠杀中幸存下的圣经换来一本印着裸女封面的色情杂志，裸女乳房上的黑色大叉引诱着饥渴少年对于女性身体的炙热幻想，同时也像胎记一般烙刻在他的眼睛上，伴随他成长、毕业、参军、工作、结婚乃至生子；在人前，黑色大叉封印起他年少时的怯懦无知，隐匿起战争所留下的创伤，而只有Jonathan看到父亲在这层伪装下的孤独无助和默默流下的辛酸泪水。 这本笔记随着Jonathan一起从战场上被带回，被送到他的父母手中。它架起战场回撤至家庭的虚构空间，避开对于家庭情感的直接阐述，从特殊的切口勾串起父子之间的温情和会意。 归位 电影的第三段又切回到Michael和Dafna的公寓，此时这个家庭已被丧失亲人的悔恨和痛苦的所拆散。曾经充斥着悲伤哭嚎和喧闹争吵的空间变成了默哀的空虚容器，紧张的舞台张力和戏剧冲突消失，眩晕的超现实感被拉回静默的真实。 Dafna无法面对间接促成悲剧的丈夫，而Michael认为他曾经在战场上避开的厄运如同迟来的惩罚降临在儿子身上，正如狐步舞的步法一般“总是会回到起点”。而这场徒劳无益的悲剧背后，更指向了将年轻鲜活的生命送上战场的国家机制。 电影三段式的结构，却完全不同于传统意义上三段式章回的起承转合，每一段都具有独立的影像风格与节奏基调，维持着时间线上的连贯性，但不以线性形式展开，组合在一起却形成奇巧而轮回的结构。就像在前一部作品《黎巴嫩》中，坦克成为绝对的叙事空间和叙事工具一样，Maoz在《狐步舞》中将公寓建构成为主叙事空间，来呈现家庭个体与外部世界的对抗，融合家庭的思想、回忆和梦以及家族的过去、现在和未来。《黎巴嫩》中坦克无坚不摧的沉重外壳所包裹住是的四个怯懦懵懂的灵魂，而在公寓这个远离战场的庇护场所中，个体的痛彻心扉的哀嚎反弹在坚固墙壁上，折回的是沉重而满溢的回忆。 Maoz并不满足于仅仅讲述一个失去至亲的故事，关于死亡、战争和家庭，《狐步舞》试图挖掘地更深。Michael的母亲——一名奥斯维辛幸存者象征着犹太人难以磨灭的创伤记忆，苦难情结的阴霾形成一种扭曲的正义促使着当局持续战局；裸女乳房上的禁断符号却愈发煽动起年轻人对世俗享乐的狂热向往，阴错阳差止步于回家路的儿子却指向另一种深不可测的未来——极力想要逃脱却最终会回到原点的古希腊式宿命悲剧，这同时也是Maoz对于国家和民族当下现状的焦虑。,30.0,7.0,1
