,Unnamed: 0,电影id,电影名称,用户id,用户名,评分,评论日期,评论内容,有用数,没用数,回应数
9,9,26756258,狐步舞,0292c711312676e82ddfe36d05abd93a,0e898c035da956e1c8da939100db3d5e,,2019-01-07 20:07:10,第一次看以色列电影，以为是战争片，结果很失望。 故事的主角是一个士兵和他的父母。讲的是某一天以色列军方的俩人突然造访费德曼，告诉他，他们夫妇的儿子乔纳森在值勤中遇难。噩耗传来，一家人悲痛欲绝。过了几小时，军方又来，告诉他。死掉的是另一个乔纳森，现在他的儿子平安无事。乔纳森在边境的一个执勤点上，和三个战友一起，设置路障，检查过往车辆。余下的大量时间，则穷极无聊。他的父亲利用关系将他调回，不料回家路上，却遭遇车祸。真的死了。 将近两个小时，就这么个简单的故事。影片中的几乎所有人都是慢性子，听到外面的信息或是看到外人，都是痴痴的盯上半天，然后再默默的思考半天，结果仍然是一言不发。充分阐释着”后好莱坞主义“的精髓。 那么编导向通过这个电影告诉我们什么呢？ 如果说是影片中间接描述了隐含的政治主题，那么以色列这个国家确实有一个特殊的政治环境。二战之后，为了让漂泊多年的犹太人有个自己的家园，列强们强行在中东给犹太人划了个地盘，以色列建国，却始终没有安定的生活，纷争不断，四面受敌，生灵涂炭。战争与不安就是以色列人生活中的常态。曾经看过一篇龙应台的游记，对以色列和瑞士这两个国家做了比较。在瑞士，人们似乎在人间天堂里生活，风光壮丽的山水，平静悠闲的生活。然而人与人之间的关系却是冷漠的，人们只想着过好自己的日子，别人的事情，外界的纷扰，只要与自己无关就好。在以色列，人们最关心的是土地还是和平。邻里关系紧密，国家的认同感也很强。大街小巷满是背枪的人，警惕的目光中也饱含热情。如果你是游客问路，会有许多人为你解答。影片中乔纳森的小队就是在这样的环境中无聊的生活着。一个荒无人烟的边境执勤点，他们住宿的货柜在慢慢倾斜，检查站旁的破旧大巴上涂着美女明星的过时海报，除了偶尔的过往车辆，只有孤独的骆驼在漫步。四个人寡言少语，偶尔间才有气无力的聊聊自己的生活。通过的每一辆车，都会使他们的精神紧张，都可能是潜在的敌人。因此才有了后来发生的事情：四个年轻男女的车辆经过，乔纳森和里面一个美女四目相对，刚刚准备送上秋天的菠菜，一个啤酒罐掉出，士兵们误认为是手榴弹，立刻拔枪扫射。顿时车内烟尘四起，硝烟散尽时，无声。下一个镜头里，挖掘机缓缓的将千疮百孔的汽车推入坑中，一切归于平静。留下的只有乔纳森对汽车和挖掘机的速写。此时又联想到前几天看到的新闻。几位以色列士兵面对远处示威的巴勒斯坦群众，在商量着如何用有趣的方式射杀他们。这样的事情在以色列在巴勒斯坦每时每刻都在发生着。 人们会责怪谁呢？是以色列的凶残，还是巴勒斯坦的极端？两边的人们难道不都是追求着美好平静的生活吗？只是由于命运之手，才将这些原本是善良的人们带入了无休止的杀戮中。 纵观整个影片，我觉得政治的背景远远不是编导想要表达的。这部影片所要反映的是命运的无常和人们面对这命运的无奈。 影片一开始，当费德曼得知儿子的不幸后，他的神情显得很茫然。摄像机从俯拍的角度慢慢追随着他的失措的脚步，从客厅到走廊到卧室，像是在展示上天对他的无比压力。这时他感受到的首先不是悲痛而是这种压力。在他得知儿子真的死亡后，这种压力就更大了。画面用中央特写的近景，看到了费德曼的那眼神，无助、悲哀、忏悔。看到他留在眼眶中的泪水。儿子的死甚至影响到了他们的生活。尽管在外人眼里，费德曼是个标准的成功人士，一个出色的建筑师，有自己的公司，无忧的物质生活。然而在此时，他和妻子之间没有物质的纷扰，只有感情的折磨。最了解他的妻子说：“为什么他不能在第一次通知时就死去？正常、合理的死去，为什么成了一种惩罚？或是复仇？是神要向我们报复。抱歉，是向你报复，我不想抢你功劳。你曾经那么坚持带他回家，就算你无意杀死他，也于事无补。我还是无法和你共同生活。我曾经可以陪着你的伤口过日子，假装看不见，不让你窘迫。我过去靠着你，让你觉得自己强壮。所以你不晓得我早已明白，你很脆弱。你不齿于你自己。你的一生：公司、我们、名车，以及你努力展示的可靠形象，一切都只为了掩饰你的软弱。”我倒是觉得说费德曼性格上的软弱是对的，但是他在此时此地想的更多的是：命运的捉弄。因为自己的错误造成了儿子的死。也许真的是冥冥之中造物主在对费德曼的错误实施报复？ 影片中向我们传达了人们经常所犯的错误，一是军方弄错了乔纳森的死，二是乔纳森误杀了人，三是费德曼托人让儿子回家。如果这些错误没有造成后来的结果，那么也就不成其为错误了。如同一个驾驶员操作失误，没出车祸，最多也就是自己私下反省一下；而如果因为这错误撞死了人，那么要承担的后果也许会影响许多人许多家庭。进一步的问题是：谁又能够预测这些错误所产生的后果？谁又能保证以后永远不犯错？ 接下来引申到的是：谁能够预测命运？长期以来，无数的人求助于祭司、神汉、算命先生，更多的人祈祷上帝佛祖的安排。目的只有一个，希望提前预知自己的命运，以便尽早趋利避害。可实际上，你信与不信，命运都在那里。似乎在挖了个坑等你去跳。平凡的我们永远不可能知道坑在哪里。 面对命运，人们有几种态度。不信邪的人屡屡向命运挑战。例如贝多芬要“扼住命运的喉咙”。这种勇气确实令人钦佩！结果是，他为人类留下了许多伟大的作品，而他自己，一生未婚，饱受耳聋的折磨，晚年贫困潦倒；无为的我只能“但做好事，莫念前程”，好好去生活，管它天塌地陷，坦然接受和面对任何不可知的命运；而理性的人们更专注于那种大概率事件。所谓大概率，就是人要向上。可是什么才是向上的标准呢？一些人追求真理，追求知识。也有一些人追求权力，追求财富。只要不影响别人，这些都不能说是错的。向上的结果，也许会使自己的命运变得好一些。但仍然不能排除小概率事件，即那些偶发因素的纷扰。而这追求这些无为这些抗争，不也是命运的一部分吗？ 影片用“狐步舞”的规则，借助费德曼的口告诉我们：“人不论走到哪里，永远会回到同样的起点”。这似乎是说，人尽管时时刻刻都在生活中挣扎、快乐、痛苦、享乐，人可以有不同的信念和理想，最终仍然逃脱不了命运的摆布，还是要回到人原本的思维中。面对命运，人仍然是个瞎子，如这个电影海报中所描绘的那样，无奈的在看不见的世界中爬行。这样的解读不知道对不对？ 本人评分：6.5。,1.0,,0
10,10,26756258,狐步舞,4ff0fd0e38973395a6af1fe97bdead10,75299f6227dae1990e9c15dd57e08476,5.0,2018-07-30 23:35:50,"一部风格独特，观影体验非常奇妙的电影。 导演的灵感，来源于自己的一次亲身经历： 自己的女儿因为贪睡迟到，错过校车， 结果校车遭到恐怖分子袭击，伤亡10几个。 所以这部电影的内核，就是中国的一句老话： 祸兮福之所倚，是福不是祸，是祸躲不过。  电影的画面非常干净，构图优美， 尤其是天空和图画，总感觉在给我传达一些什么信息。 摄影和剪辑都非常独到，导演功底出色，这些优点我就不多说了。 主要说说细节吧。这部电影情节简单，适合那些细细观看细节的影迷。  首先最重要的 狐步舞，是一种回到原点的舞。 前前，左停，后后，右停。 这舞步，就象征着人生，在一个小圈子里循环。 不管舞蹈多么精彩，最终都要回到原点。 





 电影开场的时候，母亲首先接到儿子的死讯，当场晕倒。 她后面，有一幅非常抓眼的画。 这幅画看上去非常零乱，画中似乎有几个浓墨重笔的方形，但是这方形被凌乱的线条，遮住了，两者互相融合在一起，没有条理可言。  





 这幅画，便象征着这个社会。表面有规则，似乎只要按着规则来，就会很有条理性，很美好。 然而现实里，没有规则。人们的行为，祸福，正如这零乱的笔触，谁也无法完全预测。 所谓道可道，非常道。能在生活里时时刻刻内化这一点，就已经算智慧了。 主角（父亲）如果内化了这一点，在后续剧情中不表现的那么狂躁，儿子也不会真的死。 





 在第二幕中，军方一直刻板的，肃穆的安慰安抚家属，表面上非常全面化，面面俱到的妥善安排家属的情绪，以及后事。 但实际上处处都透着公事公办，流程套路，军规。 仿佛这次牺牲，在军队眼里，只是家常便饭。只是一套标准化流程。 导演在访谈中，一再的强调，真实的以色列报丧，就是这么死板。 忽然而至的死讯，和缓慢套路化的安慰， 极度的悲伤打击，和肃穆礼貌却带着距离感的报丧， 正如那副乱序相对的画，造成一种极大的拉扯感，甚至带着荒谬和滑稽。 而更滑稽的，是军方要求主角，设定闹钟喝水。 而主角每次对话到重要的地方，闹钟都会响起来，提醒 他喝水。  无论夫妻二人怎样折磨自己，怎样自残 都没办法消解这丧子之痛。  好像还不够滑稽似的。 最终军方通知，说报错丧了的时候。主角彻底压抑不住了，彻底失控了。尖叫着一定要立刻见到自己的儿子，才能安心。 而这个强烈的要求，却让儿子在回家的路上，送了命。 错愕悲伤中，阴郁凝重里，似乎只剩下了黑色幽默。 然而电影最精彩的，还是第二个场景。 荒凉的路边哨所，一只骆驼，面无表情的走过。 士兵之间大部分时间，也都是面无表情的。  尽管偶尔，四个士兵还是会跳下舞，讲下趣事，修收音机来打发时间。 可大部分时间，他们都是麻木的。 一旦到了军队，似乎就不再有人格。军队真正需要的，是暴力机器。 而处在战争中的以色列，这种情况尤为突出。 而这种情况，似乎也是无解的。战争在人类的历史上从来都没有停止过，而社会也需要军队来承担责任。 只是在承担的同时，在这社会无解的BUG具体落在单独几个士兵身上时， 便格外显得冰冷无意义。 





 几个私下里表现的仿佛人生可以很美好很丰富的士兵， 和几个同样正青春的年轻人，只因为误认一罐啤酒为手榴弹 便毫不犹豫的残杀射击。 





 而长官只说了一句， 我们在战争中，战争时就会发生这种事。所以就当它没发生过好了。 是啊，在高度紧张，你死我活的战争中， 错把一罐啤酒，当成了手榴弹，虽然滑稽荒唐，却好像也可以理解。 于是，于是。 于是洗好地，盖上土，这事就过去了。 社会，战争，人生，都继续。 





  





 也就是这个地方，展现出来了反战的思想，
 使得这部电影被骂为不爱国，政治意图倾斜明显。
 讽刺的是，四个士兵住的罐子，在泥泞里一天天倾斜， 乃至于沉没的时候他们根本来不及发出声音。 可人人都对此危害，视而不见，继续任之。 只要小车还没倒，就继续推。这便是所有人类行为的共同规律。  所以其实在我看来，这电影并不是反战，并不是描写战争。 而是描写命运。 生而为人，便犹如生在一片虚无中。 人们明知道有些事情不对，但是没有更好的方法去解决。 说起来是一点点的在进步，但其实进步最多的 是科技，是道德规范的修改和细分，是社会模式结构的进化 而人性，并没有多少进步。 许多千万年前无解的问题，至今还是无解。 而在我们的有生之年，也不可能看到解答。 欲望好像钟摆，永无止境 社会好像牢笼，穷追不舍 人生好像地狱，周而复始 每个人都想在这命运之内，找到一个解脱的方法。  其中最突出的，便是主角父亲这个角色。 从乔纳森的讲述，和那几幅画来看 父亲是一个非常叛逆的人，他的一生都在抵抗命运，和社会压力。 他还是少年时，就拿自己母亲，从德国纳粹集中营里逃出来时， 带着的那本祖传的圣经，去换了一本色情杂志。  并且，靠着这本色情杂志，他成为了孩子王。 直到有一天，他发现那本色情杂志，因为有太多人在上面打飞机，所以黏在了一起，打不开了。  于是，他把这本色情杂志当做传家宝，传给了儿子乔纳森。 并让儿子继续传下去。 这个故事，也是他作为父亲，给儿子讲的最后一个枕边故事。    这种荒诞的行为，正是父亲性格的写照。 父亲是一个成功的商人，他想逃避命运，逃避社会。 所以他不守成规，他出奇制胜，什么道德礼法，想必在他心里是很淡的。  甚至在失控之后，他召回儿子的方法，也是托关系找到一个“将军” 可是电影表明，这样的逃避是没有用的。 当儿子第二次真的死亡之后，妻子对他说 你很脆弱。    虽然你外表很成功，你成为你想成为的，你教导你想教导的。 但我知道，你很脆弱。 这里，妻子所说的脆弱，不仅是父亲作为一个男人的脆弱， 更多的其实是，所有人类在面对命运，面对整个社会时的脆弱。  





 儿子那几张画，也是在描述，一个带着面具，脆弱不堪的人。 这个人反叛，成功，生活一帆风顺，仿佛没有烦恼。 可揭开那层面具，也有一双流泪的眼睛。 主角的书房里，还有一幅画。 那副画，颇有些宁静致远的意味。 河岸的中间，一条水道直通天际，豁然开朗。 仿佛人生找到了出路。  这幅画的意境算是很高，很优美了。 可我想借用瑞克的一句话 宇宙是一头野兽，它以平庸的人为食 创造出无数的白痴只是为了吃掉他们 聪明的人有机会爬到巅峰 骑在现实背上 但现实会不停的试着把你甩下去 并且，它最终会成功 没有别的出路。 ——瑞克 





 也许有很多聪明人，强人，一时的骑在社会身上， 但他们终究会被甩下来。 没有出路  而这还只是极少数的“成功”人士。 绝大多数的人生，都是充斥着无奈的，谁也不可否定这一点。 生老病死，求而不得，周而复始，无可奈何。 所以我才觉得，这部电影，反战，只是顺带的。 它其实什么也没反，只是替所有人在命运女神面前， 不甘的叫了一声。  在夫妻二人的谈话中，从埋怨，到反思，再到最后，二人笑了起来。 幽默，正是无可奈何的人类，发明出来的绝佳的武器。 也是我个人认为人类最好的两个品质之一。 在荒唐荒谬，错愕的命运面前，人们似乎只剩下自嘲。 在禁锢，责任，道德等等人类所有虚拟出来方便更社会化、方便每个人更好生存的概念的束缚下，每个人都是囚徒，在跳着回到终点的狐步舞。 





 主角的反传统，叛逆，强势，伪装，和私底下的脆弱，无可奈何悲极反笑的幽默，都无法改变这个事实。 儿子在军队，麻木的服从军队的指挥和命令，按照训练做事。世上在没有比军队更讲规矩的地方了。可依然没有改变。 回头再看看这幅画，越发觉得有趣。 人活着就得和社会妥协。社会诸多不美好，最终都需要人来承担。电影反思的，荒谬的表现，似乎更多指向的是军队，国家和战争。 但其实是指向整个社会，指向每个人的人生。 文明的社会，当然给了人类大量好处。 





 而军队，其实本质上也是保护这种社会在各个国家运行下去所必需的。 但是，为什么总有些无解的问题呢？ 因为人，并不只有社会一个属性。 举个非常简单的例子，一夫一妻。 （与电影无关，只是举个例子） 一夫一妻，文明，公平，忠诚，并且稳定。是现代社会稳定的基础。 貌似我在知乎的第一个不匿名答案，写的就是婚姻和爱情。 但是，大部分人的爱情，和他们忠诚，并不能保证一夫一妻。 因为爱情的效力，只有2年。就算多一点，5年。 过了这段时间，支持婚姻的，是亲情，是理智，是责任，是心态，是高级道德。 是超脱了爱情和性，的一种契合，一种长期合作和陪伴，珍惜。  





 是高级动物的一些自觉性和克制性。 然而，大部分人的自觉性，没有那么强。 正如这个一辈子都胸有成竹的父亲，此刻的失控一般。 这是一种本能反应，性欲啊，恐慌啊，犯傻啊， 各种人类的BUG 人不是机器人，没有那么完美。 如此，便有了矛盾，有了bug。 我不是反对文明，而是想提出，不管再怎么强调这不道德， 也总有人会出轨。 不是隔壁老王，就是隔壁老李。每个小区都有无法坚持一夫一妻的人。 每个小区。都有进化不完全的，按耐不住的兽性。  也许未来的文明，会更加优化，会有更合理的社会规则和道德。 但我们估计是等不到了。 我们只能庆幸，我们很多地方比古代合理了很多。 发扬一点啊Q精神，才能活下去。 正如住在这倾斜的屋子里，却假装一切正常。 





 仅仅是举个例子，来说明现象上的一些尚不合理之处。 在这种无解的现象，和社会的规则下， 就正如在人类的渺小，和命运的荒诞下， 才让人觉得讽刺，觉得虚无，觉得无奈。 而也是此时，主角跳起了狐步舞。 无论舞姿多么优美，最终都会回到原点的，狐步舞。  这舞蹈，让我想起了电影《燃烧》的意义之舞。 同样是面对人生的虚无和命运的嘲讽 《燃烧》的女主脱光上衣，在夕阳下翩翩起舞  却最终归隐在黑暗中。 可能她到死去，也找不到生命的大意义。 《麦克白》有一段我非常喜欢的台词， 熄灭吧，熄灭吧，瞬间的灯火。 人生只不过是行走着的影子。 对人生绝望的麦克白，认为人生是毫无意义的、愚蠢的，人因欲望而产生的各种争斗、倾扎也都是毫无意义的、愚蠢的。 人只是受命运驱使的木偶，命运是导演，人是演员，人只能听从“命运”这个导演的安排，所以人好像是没有灵魂的影子。 在人出生的那一刻，命运就决定了他最终将要死去，所以人生只是闹剧一场，毫无意义。  我常常觉得世界是一张无比 巨大，也无比细致杂乱的网。 每个人都只是网中的一条细线。 大多数人不知道自己在网里，也不怎么想思考这些事情， 他们凭着本能去收紧或放松自己手上的线， 却丝毫不知道，什么时候自己会被缠进死结。 而就算你心中有一张网，你也不太可能预测自己的动向。 这就是所谓的“道可道，非常道” 





 事实上，不仅是莎士比亚，也不仅是老子的《道德经》偶尔会给我这种感觉。 很多艺术作品，对这种无奈都有写照。 比如上星期推荐美剧《亿万》，后来推荐了其中一首金属摇滚，木偶。 以及今天还可以给各位推荐一首，来自鲍勃迪伦的 这首歌在网易云音乐，歌词翻译是我刚刚上传的。 You may be an ambassador to England or France 你也许是英格兰或法兰西的使者大人 You may like to gamble, you might like to dance 你也许是赌圣，又也许是舞王 You may be the heavyweight champion of the world 你也许是重量级世界拳王 You may be a socialite with a long string of pearls 你也许是一身珠光宝气的社交名媛 But you’re gonna have to serve somebody, yes indeed 但内心深处你只能是某人的仆从 You’re gonna have to serve somebody 只能是某人的仆从 Well, it may be the devil or it may be the Lord 也许出卖给魔鬼，也许献身给上帝 But you’re gonna have to serve somebody 总之你只是某人的奴仆 最后，
 与《燃烧》不同的是，电影的最后， 主角夫妻仅仅的抱在了一起。 这也传达了导演个人，对人生的态度。 也许最后我们会曲终人散，也许人生没有什么堂而皇之的意义。 但紧紧抱住眼前人，温柔的珍惜拥有的， 然后和乔纳森在兵站时那样，痛痛快快洒洒脱脱的跳完这曲狐步舞吧。  温柔的珍惜，就是我个人认为，人类最宝贵的品质之二。 我是俊俊，以上是我从这部电影中，看到的一些细节和感悟 一家之言，感谢阅读。 完 想看电影，想看影评 欢迎关注我的微信公众号，保证不会后悔  



",15.0,2.0,0
