,Unnamed: 0,电影id,电影名称,用户id,用户名,评分,评论日期,评论内容,有用数,没用数,回应数
25,25,26756258,狐步舞,13801d2573a33f8e38654f42ea0aba46,49941f4ad8f1e8846e71b6bb6b39408b,4.0,2019-12-14 10:20:51,原文地址： http://www.qh505.com/blog/post/5605.html  车缓慢地向前，在荒无人烟的边境上行驶，在无人经过的小路上行驶，当被通知离开关卡，当目标指向那个家，是不是一种回归？应该是畅通的，应该是没有危险的，但是那路中央为何站着一只骆驼，只是站立，却变成了“敌人”：在不设防的刹那，车偏离了路线，车滑向了悬崖，车坠落在深处，没有战火，没有硝烟，没有对峙，一场死亡却在无声无息中发生。 骆驼何罪？骆驼曾经通过关卡，又返回进过关卡，一种边境上的普通动物，是不存在任何危险的，甚至没有人身上的那种证明，但是当它站立在道路中央的时候，是不是在紧张的神经里，一切都会变成真正的敌人？而可以控制的方向发生偏离，人生在偶然中走向死亡，那个敌人是不是就是自己？坐在车上回家的是乔纳森，一个在国境线上执行关卡检查任务的士兵，当他从检查哨所返回那个家，应该是平安的开始，但是乔纳森的手上拿着的是自己完成的一幅画：推土机的头部是一辆普通的轿车，似乎它正用机械的力量将这辆车推向深渊。一幅画，展现在乔纳森面前，却是那个残酷现实的映照：那辆桥车停在关卡前，司机和后座的女人下车接受身份检查，下起了雨淋湿了肥胖女人的衣服，身体的曲线似乎若隐若现，而副驾驶室里的另一个女人看着乔纳森，脸上显出微笑，身份通过，轿车放行，但是女人的裙子被车门夹住了，当她打开车门将衣服拉进去的时候，身边掉下一个罐头，“炸弹！”坚守的士兵大声喊道，话音刚落，在高处监视他们的乔纳森下意识地扣动了扳机，一阵枪响之后，是冒着烟的汽车，是一片沉寂的夜晚。 仅仅是一个啤酒罐头，却被命名为“炸弹”，那种微笑，那个身体，以及可以通过的身份，都在一阵枪响之后消失了，死亡就这样发生，不是敌人的敌人葬身于错误的命名。错杀，只是一个起点，在那个光照亮的椭圆形区域内，被打穿的轿车被推下了里面的深坑，推土机将石块和泥土推过来，慢慢的，那辆轿车被覆盖，慢慢的，那些死去的无辜者被掩埋。从一次错误开始，最后的掩埋却变成了罪恶，当乔纳森从哨所离开回家，他一定还没有忘记自己的那次射击，当无辜者变成敌人，当敌人必须死去，推土机和轿车组成的漫画仿佛是内心的一次忏悔，但是这种忏悔在被掩埋的死亡面前，变得苍白，而当骆驼制造的死亡在沉寂中发生，是不是用另一种偶然取代了错误，是不是用另一个深渊报复了残酷？ 无法回家，仿佛也是乔纳森命运的一种注解，他其实已经“死了”，在骆驼事件之前就已经死了，“令郎乔纳森昨晚在执行任务时死了。”门打开，那个军人长官面对乔纳森的母亲达芙娜这样通知道，儿子乔纳森死了，母亲听到消息时倒在地上，长官随即给她注射了药物，而在身后的父亲费德曼站立在那里，泪水湿润了眼眶。一场噩耗猝不及防，对于家人来说，是最大的悲痛。达芙娜昏迷过去，费德曼关在卫生间里用拳头发泄痛苦，他们的身体和心灵都受到了创伤，可是这噩耗同样变成了错误：“我们搞错了，死掉的士兵不是你儿子，他还活着。”沉浸在悲痛中，迷失在噩耗中，却原来是一场乌龙。“我要见他。”费德曼开始怒吼，儿子没有死，想要见到他便成为一种迫切的愿望，但是当“死而复生”成为一种惊喜，为什么在经历了杀人乌龙事件之后，乔纳森又走向了死亡，变成了“生而复死”的另一场悲剧？ “他死而复生，都是你们说了算。”当军人长官告诉费德曼自己无权决定是否可以让乔纳森立刻回来，费德曼愤怒地说道。儿子没有死，从悲痛中解脱出来，费德曼或者并不需要如此着急，而其实他的这种态度完全是针对军方，当听闻乔纳森牺牲时，他的眼中只有泪水，似乎他接受了这个现实，作为曾经的军人，他知道上前线的士兵随时会有生命危险，这是一种命运。但是当军方监视了他们的生活，让他的手机定时提醒他喝水，当妻子达芙娜的身上被注射了镇定剂，一种私人意义上的死亡变成了公共事件——死亡后来被改说成是“倒下”：“以色列士兵都有倒下的权利。”倒下意味着牺牲，意味着生命的意义超越了个体，所以军方组织了葬礼，一切的仪式都按照规则来办，费德曼说：“我想见他。”作为一个父亲要见死去的儿子一面，天经地义，但是军方说：“没这个必要了。”费德曼生气地说：“我怀疑根本没有遗体。” 死亡变成了规则中的隔阂，变成了命令之下的消失，就像费德曼去看望在精神病医院里的母亲，母亲把他叫做阿维格多，母亲问他：“谁是乔纳森？”似乎军方就像是患病的母亲一样，把所有一切都涂抹了。所以当乔纳森“死而复生”，费德曼需要的是一种确定，这种确定是去除拨打乔纳森的电话是传来“我已在世界尽头”的虚无，是在消除如母亲一般“谁是乔纳森”的病态，是在平复错误的消息带来的悲痛和茫然，但是费德曼的愤怒却又被理解为另一种病态：“他是恐慌发作，他身上的恶魔被激活了。”说出这句话的却是自己的妻子达芙娜。 母亲已经失去了正常的思维和逻辑，妻子指责他内心的恶魔被激活，似乎乔纳森之死以及乌龙消息不再是单纯的家庭事件，里面很多的线索、很多的细节被某种强大的力量覆盖了，而错误的死亡似乎变成了揭露这一切不正常秩序的进口。而这个进口在活着的乔纳森故事里，比那个家庭故事打开得更为彻底。边境线上的哨所，一切都是压抑的，那辆监视车上已经布满了污泥，车身上那个面带微笑的美女已经失去了光泽；士兵们住在简陋的营房里，那个营房正在一天天倾斜，起初罐头从这头滚到那头需要8秒，之后的时间越来越短，这意味着倾斜度越来越大，“我们终将沉没。”从营房到关卡，必须渡过一段泥沼，他们的军靴上都沾满了泥巴。站岗、休息、发呆，或者沉默，这便是他们的生活，“爱已经消逝，只能走向孤寂。”在这个孤寂的状态中，他们眼前的一切似乎都幻化为潜在的敌人，当有车停在关卡前，他们总是投过去敌意的目光，仿佛检查的每一个瞬间都危机四伏，也正是在这样高度紧张的对立中，乔纳森的子弹会射向那些无辜者，而无辜者之死，对于他们也不是忏悔，而是偷偷地掩埋。 对面的人都是潜在的敌人，而自己呢？在寂寥、麻木和压抑的世界里，他们或者跳一段狐步舞，或者唱起某首关于爱消逝的歌，而乔纳森说起的那个父亲“床边的故事”，似乎为他们的生活注入了一些鲜活色彩：乔纳森家族有一本传了十代的希伯来《圣经》，当到了乔纳森奶奶的手上，她和这本圣经一起逃过了大屠杀，但是乔纳森的父亲小时候却看见了街上报刊亭的一本色情杂志，于是用这本圣经换了色情杂志，还和同学们分享——杂志上裸体女人的关键部位被打上了黑色的叉，像是一种禁止，却又像是重点的标注。“父亲后来把这本杂志传给了我，这是父亲最后的床上故事。”乔纳森向队友们叙说着。 一本用祖传的圣经换来的色情杂志，一本被打上了叉的裸女画刊，以及父亲传下来的“床边故事”，似乎充满了某种亵渎意义，性被放大，被标注，被传承，即使打上了叉，也似乎成为信仰生活中的污点，甚至成为一种罪，的确，费德曼的母亲在精神病院，就是缘起于这种亵渎，当她问“谁是乔纳森”的时候，不仅仅是病理上的遗忘，更像是一种逃避，而这个“床边故事”在幼小的费德曼世界里演绎之后，是不是他也永远背负了这种罪？长大后，费德曼成为同学中的风云人物，和哲学系的女生坠入爱河，加入军队成为作战指挥官，之后又成为了建筑师，成为家庭中的支柱，这一切的人生高光时刻，似乎都在远离“床边故事”的罪恶，但是这无非是一种掩盖，达芙娜说：“你怀有不可告人的秘密，你的地位、财富都是为了掩盖它。” 掩盖而隔阂，隔阂而疏远，对于达芙娜来说，费德曼似乎永远不想从那个故事里走出来，长大而成为上流社会的一员，却只是掩盖，而这种恶的思想又传给了儿子乔纳森，用色情杂志代替圣经的传承，仿佛亵渎不曾远去，而且正一步步回来，“我怀孕的时候本来不想要孩子，但是遗憾没有去堕胎，生孩子的喜悦是一时的，可失去他的痛苦却永远不会消失。”达芙娜所说的失去，一方面是乔纳森“死而复生”之后的“生而复死”，第一次的错误信息，第二次的死亡现实，都让她备受折磨，“他为什么不能在第一次通知时就死去？”她如此质问；另一方面，她所所说的“失去”也意味着在她看来乔纳森就是费德曼的复制品，“倒下的都是天使，也许他现在正享受着灵魂的性高潮……” 一本色情杂志，一种床边故事，实际上所谓的亵渎，所谓的邪恶，都只是在一种规则下的定义，它们是《圣经》，是信仰，是道德，是秩序，但是当世界变得压抑，变得病态，那些规则本身也是一种对于人性的亵渎：军方为什么安排好了一切却不让父亲看到遗体？在哨所里为什么危机四伏的状况下一罐啤酒瓶会误认为是炸弹？已经失去了理智的母亲在精神病院里为什么会说德语？费德曼想要立刻见儿子为什么会被认为是“恐慌发作”？一切的努力，一切的突围，似乎总是回到可怕的规则里，就像狐步舞，精神病院里的老年人在跳，驻守在哨所的士兵在跳，在家里的费德曼在跳，“前，前，右，停，后，后，左，停，前，前”的步子，看起来是变化，但实际上最后回归到原点，“不论走到哪里，都会回到一样的起点。”狐步舞就是命运的轮回：从死亡到复生，从复生到再死，谁也无法逃离这个循环。 回家其实就是“我已在世界尽头”，复生是“没有见遗体的权利”，正常的欲望是被打上了禁忌符号，“我在镜子前看到了帅哥，我只能对着自己勃起。”这便是真正生存的悲哀，而当一切都是回到起点的狐步舞，命运再也无法超越现实，“我们在对抗着未知”，那些士兵这样说，未知是慢慢倾斜下去的营房，未知是一罐啤酒导致的射杀，未知是推土机制造的覆灭，未知是“谁是乔纳森”的病态，未知是“我应该去堕胎”的扼杀，没有确定的生存与死亡，没有明确的爱与不爱，没有指向目的地的离开和抵达，当一只毫无杀伤力的骆驼站在路上，它同样可以制造死亡，因为未知是个巨大的牢笼，敌人却遍布每个角落。,1.0,,0
26,26,26756258,狐步舞,0b4851860cb6ed73e45df9817bcacc7a,e931b96957500a1816a45bf282cd217f,,2019-12-01 23:58:33,周末的夜晚想着找一部轻松点的电影看来着，结果却是如此沉重，刚刚开始看的时候很惊喜 ，哇这个镜头的角度和运镜。这个色调！还有好多对称形势的构图把整个画面构建的特别美。很艺术很讲究很有风格。特别对我的胃口，然而越看到后面困意越强，因为主要是表现人物的内心状况，台词很少节奏很慢。真不适合深夜观看。        故事非常之简单，如果描述一下故事内容的话你未必有兴趣看下去，就是以色列的一个家庭接到军方通知自己年轻的儿子在战场上牺牲了，没过几个小时还在悲痛情绪中有被告知搞错了死的是另一个同名同姓的士兵，父亲非常激动先要立马见到“死而复生”的儿子，走了关系强行把儿子从边境调回家，而他儿子却在回家的途中发生意外离开了人事。 这么简单的结构却拍出了112分钟！所以比起整个故事的进程，它更加适合细细的感悟那些细节背后展现的精神危机。里面不管是大结构和小细节的荒诞气息不比荒蛮故事少。        它是一部艺术电影，把很多平淡的现实用艺术形式的表现，从而产生出了这些诡异奇怪的感受。让人说不情的怪异感。在结构上用舞蹈的形式呈现总共四段故事，狐步舞的舞步很简单的四段：往右边一步（家）-往后一步（边境）-往左一步（家）-回到原点。有一种逃不过的宿命的感觉。        里面很多镜头手法都值得更加深一步的考究，影片一开始打开门母亲晕倒后镜头对着玄关的那幅抽象画停留了几秒杂乱无章（后面这幅画被搬到了客厅不知何意）然后摇过去对着愣住的父亲。接下来就是一套军事化的报丧流程，看似人性化体贴有各种服务都给你安排妥当但是却冰冷生硬，一个小时喝一杯水 精确到分的丧礼流程。当事人还沉浸在悲痛中就被迫被一步步被安排。死亡是迅速的，然后接受是缓慢的。          在构图画面方面给有很多值得参考学习的地方，我在这部片里面感受到了导演的很多镜头语言。主要都是用来酝酿人物情绪，还有很多细节的点不是很能理解不知道为什么设计 抽象画、狗狗、骆驼、倾斜的货柜、车窗的女人 。人脸的叉叉太多太多充满寓意的元素在里面了，真正要看懂这部片子得花更多的时间去理解体会。就像是一个艺术品。        所以电影讨论的是宿命吗？我们应该相信宿命吗？我更欣赏它的艺术感。,,,0
27,27,26756258,狐步舞,4cb2d65f32266687e59bf772e9e8eaf7,8c3248ea5c3efb6ff873a785ac92d5b9,4.0,2019-08-17 15:43:23,"富有荒诞感的三个段落，构成了一个完整的环形结构，通过环境统一的车上作业将内容连续起来。

第一段，行政失误给受害的主人家庭带来巨大情感起伏，这部分画面调度，极度工整漂亮，镜头内容的运行有焦虑感。事件转机处，散开的黑色粉末作为一种主观的情感释放，是一处新意，也是一个集中意象。

后面两段，岗哨的狐步舞作为一种荒诞的消遣，是中心。慵懒的边防生活给了乔纳森幻想空间；而另一空间，家中则实现了情感和解。就在情形向好的进展中，乔纳森在撤离回家的路上遭遇意外。通过车上作画的暗示，连接了两个空间的情感，同时也间接坐实了“荒诞”的世界观。这种“荒诞”是一切事物的表面，而“宿命”是已注定好的，终究会发生。

整体讲，是一部有着极好工艺水准的艺术电影，作者观点明确，内容上具有很突出的学习价值。",,,1
28,28,26756258,狐步舞,4f381e4119ce8f091674bca0a84badbe,0c2eca9e3b4bbd3e47a75254a885f022,4.0,2019-07-31 16:49:16,导演塞缪尔·毛茨已不是第一次处理反战题材，相比他的前作《黎巴嫩》，《狐步舞》委婉得多，并无枪林弹雨浴血奋战的战争场面，以一种相对冷峻的笔调勾勒出一个以色列中产家庭，以小见大，反思战争对家庭和个人带来的创伤。全片三段式结构，以乔纳森驻守边境的枯燥生活暗讽战争的无情与荒谬，更凸显开篇“乌龙报丧”事件的可笑。驻守边境的四个士兵活得仿佛囚徒一般，镜头平移缓慢扫过他们面容的拍摄方式，仿佛一个未出现在画面中的人在监视他们。特别之处在于以乔纳森的手绘漫画揭开父亲费德曼的人生，用胶带贴在眼睛上的“✖”隐喻意味丰富，胶带下流出的泪也格外打动人。尾段从母亲达芙娜的视角出发，其右手指关节的伤痕与父亲费德曼左手手背的伤形成呼应。两人和好后，影片接近尾声，在萦绕着温馨气氛的背景下，以乔纳森归家途中遭遇车祸来收结，着实出人意料。车毁人亡的画面中，背景音乐始终是舒缓的调子，似乎极力克制情绪；与之相似的是影片中段填埋被误杀者的车辆时，将车辆推入坑中的巨大撞击声并未传来，背景音乐也停下，保持完全的静默无声，感染力却极强。,,,0
29,29,26756258,狐步舞,587755a19c1cce1c9fc4c0d0331282c0,8752a82e5bca727b7985145b70e126df,4.0,2019-07-29 23:23:09,"第一段的绝大部分的场景都在Michael和Dafna的公寓中发生，简约现代的装饰风格、精心布置的空间、不真实的窗外景物和受限的镜头位移触发了一种舞台式的情景，创造出置身其中的剧场式幻觉。而在这幽闭空间之内，压迫性的镜头特写，将Michael围困于逼仄之中，无限放大他暴露在巨大悲伤之下的狂躁不安，由情绪推进而升温的张力，如同尖锐的噪音刮擦着观者的神经。向旁电影的第二段则转移至荒芜人烟的北部边境关卡，那里驻守着包括Jonathan在内的四个士兵——他们的主要任务除了例行检查往来的车辆和人员之外，还得对怡然自得缓慢路过的骆驼予以放行。
       第一段中几欲崩塌的情绪张力和幽闭受限的物理空间，突然在开阔无垠的沙漠中得到缓释。一时间，由死讯所诱发的悲伤突然转换成超现实的荒诞无稽。天空如同被颜料染蓝一般不真实，废弃过时的手绘广告牌前，寂寞的士兵抓起来福枪作为舞伴，在空无一人的公路上踩踏起孤独的狐步舞；在潮湿泥泞的集装箱中，他们一遍遍地用滚落的午餐肉罐头测试其倾斜的程度，用咸腥的“最后一个睡前故事”调剂枯燥无味的重复生活。当然，别忘了他们所身处的战争泥沼和背负的军人职责，以及这一职责所附带的那一点点高于巴勒斯坦平民的权利：经过关卡的阿拉伯旅客总是被迫要接受士兵们漫长乃至羞辱的检查。而这一权利使得这群与普通青年无异的士兵过早地被推上杀伐决断的位置之上，于是酿成一场误杀的惨剧。",,,0
30,30,26756258,狐步舞,44baccbe3b5f5f353f2f48bb1c5df8e7,dd859630be883bc84c21eb1c4882966c,5.0,2019-02-14 07:11:57,狐步舞是起源于美国黑人的一种四步舞蹈，同时也暗示了故事里角色的命运：无论他们怎么舞动，最后还是会回到原地。狐步舞同时也是部队的暗语，电影里对以色列当局胡乱征用年轻军人进行了强烈的批判。外国媒体对观众是否能够解读电影里的政治隐喻抱有怀疑，《好莱坞报道者》将这部电影称为无处可避的超现实命运之舞。 为什么两部电影之间相隔八年之久，这八年你都在做什么？ 我在这八年之间，主要是在为下部电影筹集资金。但是我也有做其他的事情，我有在写书，上节目，养育孩子，同时带着我的《黎巴嫩》环游世界，到处展映。 据说这个故事是根据你的一个真实经历改编的？ 是的。我的女儿上学总是迟到，每次要迟到就跟我要钱打车，我觉得这样既浪费钱，又对子女的教育无益，于是我就让她自己坐公交车上学。当天在她走后，新闻里播出这路公交车出现了恐怖袭击，我当时害怕极了，给她打电话也接不通，直到一个小时以后，她自己回来了，她跟我说她没有赶上那一班车。 这是一种非常不好的经验，你想在电影里表达什么？ 我想表达的是，有些事情我们可以掌控，但又有些事情我们无法掌控，甚至出现问题也无法解决，就像结局里载着米歇尔儿子的车开下了山崖这个情节。我想表达的另一个是，养育子女的过程并不会让你持续的开心，但一旦你失去这个孩子，你会心碎。 你相信命运吗？ 我不相信，我女儿的遭遇里没有任何我可以吸取的教训。 电影的三部曲的结构非常有趣，为什么运用这样的结构？ 这是典型的希腊悲剧三段式的结构，英雄自掘坟墓，在不知情的情况下和想要帮助他的人对抗。我试图让看我电影的观众体验一次情感之旅，让观众去体验这种情感变化：第一层父亲篇是体验震惊，非常戏剧化；第二层儿子篇，是体验像船一样失衡，漂往未知地方的感觉；第三层母亲篇柔肠百转，是纯粹的丧子之痛。情感之旅才是我电影的主菜。 电影里无差别击杀平民这个情节，是延续《黎巴嫩》吗？ 是的，但是这部电影里的年轻士兵并不是蓄意为之，而是一时慌乱，措手不及才杀死了那些平民。你看在戏里，士兵和车上的女孩眉来眼去，有一刹甚至会觉得两人共入了爱河，紧接着意外就发生了。与《狐步舞》不同的是，在《黎巴嫩》里，子弹并没有打出去。 为什么电影里和《黎巴嫩》里的坦克一样，几乎看不到公寓以外的世界？ 我想持续探索人性中批判和同情的部分，在密闭的空间里，你可以审视自己的灵魂。如果你想要窥伺一个角色的内心世界，你不能把他的世界设定得无限大，这样无益于你传达角色的内心世界。 电影的声音很特别，反差非常明显，常常是这一幕是无声的，下一幕就是非常响的音乐或背景音，这是你刻意打造的吗？ 是的，这种创意是为了给观众带来视觉上的刺激，为观众提供一种沉浸式的体验。声音是一个具有操纵观众情感的工具，我在为电影配乐的时候，尽量做到不要让音乐太影响观众的观影体验。不仅声音是这么设计的，图像也是如此。我的电影更具实验性，比如米歇尔家的戏就是这样，每一幕，都是环境，台词和空间的结合。 你曾经说过每一代人都在承担父辈的错误，这样的错误还在延续吗？ 历史是在不断重复的，其实这里很多错误都是可以避免的，每一代人都经历过类似的情形，但是错误还在延续。 于是你在这部电影里每一章节都设置了一个致命错误来呼应是吗？ 是的，第一段是军队噩耗通知的错误，第二段是士兵开枪错杀平民的错误，第三段是叫儿子回家的错误。 《黎巴嫩》和《狐步舞》都提到了很多相同的东西，包括驻黎巴嫩士兵的精神状态，一代人一代人之间传承的错误，几年过去了，这些有发生什么变化？ 其实没有什么太大的变化。年轻的士兵在戏里什么改变都没有做到，他们只是孩子。 对于不了解以色列历史的观众，你是如何平衡电影里的本地元素和共通元素的？ 我平衡的方法是尽量少的描绘细节，把本地的元素上升到一定高度，用很抽象化的手法表现出来。我所选择的本地元素，就好像《黎巴嫩》里的坦克一样，这里的坦克可以是世界任何一个地方的坦克。 你的电影在以色列上映的情况怎样？比如《黎巴嫩》，在以色列能上映吗？ 当然能上映了，毕竟拿了金狮奖。年轻一代人的反响更加积极，这是个好现象，他们才是国家的未来。 你有看黎巴嫩裔导演的新片《羞辱》吗？这部电影可能会是你的主要竞争对手。 我是在这部电影上映之后才到达威尼斯的，但是我很想去见见他，和他喝酒畅谈，聊一聊当局。,,,0
31,31,26756258,狐步舞,c3d7d61711ca1d471bcafb62c61e3618,3b09719451aada0d92cb854f48d68c5b,4.0,2019-01-15 02:02:05,"正如之前预想文艺片的略微乏味一样，看了开始二十分钟后昏昏睡去，晚上接着看完，最后看到水嫩的儿子翻车后影片结束字幕出现，呆坐片刻，怅然若失。
整体感受十分细腻，无论拍摄画面还是剧中人物感情。导演讲故事功力深厚，开始的暴击让父母崩溃，紧接着的反转让父亲没有出现常人的惊喜和感恩，反而更加狂躁并利用自己的军方人脉资源把儿子从军队调回来，似乎到此如是顺利发展则全家团圆，皆大欢喜。
画面切换到儿子的服役生活，无聊茫然充斥着他的心灵，一次意外让他葬送了四个年轻人的性命，同时被军方给掩盖了，四条无辜的生命就这么不了了之，而且还可以被送回去。
看到这里我有两点个人情感的不爽，先是父亲在得知噩耗是个意外不但不感恩上帝还无比狂躁地无理取闹，儿子失手杀手却无事般提前回家。现实难道如此不公，最终导演让一切回溯到影片开始的情形设定，儿子服役期间倒下了，既让我觉得有点公平又让我觉得为这个孩子和家庭得而复失的圆满感到难过。 最终一切又回到原点，就像狐步舞一样，不管怎么跳都还是回到原点，谁也逃不过命运的安排。",,,0
