,Unnamed: 0,电影id,电影名称,用户id,用户名,评分,评论日期,评论内容,有用数,没用数,回应数
0,0,26816086,银魂,4d2ef9b329c44911f18f9eadc3cf2e45,52e397c6950be3ff458da9845a5236cd,4,2017-09-01 23:04:59,最后居然成了新吧唧的亲妈。（？    其实七月份我就已经看过一遍银魂了。 在日本。 听不懂？哈哈哈哈哈哈开什么玩笑那我当然确实一定是听不懂的啊，再说银魂原著我根本就没翻两页连情怀税都上不上，所以我和小姐妹一开始是拒绝的。可是天有不测风云，小姐妹一大早刷了首日影评突然就飞扑过来说你知道吗！高杉打架露大腿了大、腿、哎！不得了太英俊了我们现在就去为反派boss打call吧！ 现在你们知道了，宅男们为偶像小姐姐打call的真实理由。说是为了支持梦想，其实也是去看小姐姐露大腿的。 梦想是无限的，大腿也是无限的，所以国内上映第一天，我们又去看了一遍。 等第三天再一遍。 小姐妹说接下来还要看五遍。 因为真的还蛮好笑的啊。连听不懂的第一遍都好笑，就是那种，不用看原著，放之四海而皆准的好笑。 当然，大腿也是放之四海而皆准的大腿。 然后电影就这样开始了……啊，福田雄一，果然还是一样的配方一样的味道。 不清楚的话请看以下导演作品简介： 《33分侦探》：5分钟能搞清楚的简单案件，废柴侦探一定要撑足33分钟才能解决的故事。 《勇者义彦》：喜欢大胸的废柴勇者一点也不想消灭大魔王的故事。 《变态假面》：把内裤套在头上废柴就能变身假面超人的故事。 《天魔大师》：看到鬼就会晕过去的废柴驱魔师靠友好协商的办法驱鬼的故事。 基本上就是我国现当代年轻人赤裸裸的生存写照了。  而且这部电影是东京电视台出品啊，东京电视台，大家想起来了吗？就是那个不管日本大地震还是朝鲜射导弹，永远安定的播出动画片的东京电视台啊。  所以银魂一开头就让看惯了好莱坞大片的大家根本分不清楚开头在哪里这种尿性我是服气的。按说主角英雄救眼镜之后插个片头走走主演字幕就该进剧情了吧——等一下这主题歌怎么这么难听啊！难听到我只能相信这是小栗旬唱的了！ 毕竟换一个不帅的来唱早就被打死了。 主题歌嚎没两句又突然插入群口相声，群口相声讲完了万事屋终于出场了，接下来一群人就，开开心心，去捉独角仙啦—— 等一下，说好的外星人占领地球呢，说好的高科技妖刀杀人传说呢。 大家不要怕，日本电影就是这样的，你们看到后面就知道了，虽然前面不正经，但是架不住他后面会，会变得更不正经啊。 小栗旬菅田将晖桥本环奈柳乐优弥新井浩文吉沢亮早见明里室毅长泽雅美冈田将生佐藤二朗菜菜绪安田显中村勘九郎堂本刚等日本娱乐圈半壁江山联袂为您带来霓虹春晚大联欢之偶像包袱算什么我今天就是这样不要脸子了。 帧帧表情包，幕幕是小品，笑话冷烂欠，遍地是包袱。 比如这种：  小栗旬你够了！你已经演了工藤新一鲁邦三世花泽类织田信长坂田银时了，不要再搞什么海贼王的男人了好吗！   还有自己吐槽自己道具水平这种事也请适可而止吧。 不过在这一片恶搞中却猛然get了菅田将晖的可爱，菅田将晖怎么这么可爱啊，新八小眼镜歪着又怂又孬的也好可爱，可爱到让人原地受孕，三秒钟把他生下来穿越时空养大自动升格成他的亲妈。  好了废话不多说总之呢嘻嘻哈哈了半天故事终于舍得进主线了。 主线就是从前有个中二病恋师癖他叫高杉晋助，他觉得搞毛啊这个世界不能好了居然抓走了我的老师所以我要毁灭整个世界！于是他去上了珠算培训班（？）苦练技能，又收了一堆比他高很多（？）的手下，造了一把从名字到颜色都中二到不行的黑科技中二刀，闲着没事弹弹琴砍砍人刮刮腿毛（？）一不小心砍到了主角团这边然后就大事不好了的故事。 虽然演反派恋师癖的这位老师上映前被原著粉包括自己的亲姐姐大肆diss了一番比如“这人除了矮哪里像高杉了高杉哪有这么胖”之类的。但我作为亲生的老母亲还是对他充满了指望的。 人家已经很努力减肥了你们不懂！这哪叫胖！以前那个月半你们怕是没有见过！好你不要拿原画对比图给我看我不看我不看！胖子也是人我跟你讲！   况且我们中二病演得夺好啊，阴阳怪气的分分钟想先掐死再说。出场自带紫色花瓣特效CG大满月什么的也很是大方，一看就是终极boss才有的顶级配置。 况且他的手下都这么难打了！boss那得狂成什么样啊！想想就有点小兴奋！而且boss可是初代金田一呢跟总共就这么一代工藤新一打架，这种史诗级画面简直不要太壮观哦！啊快看他要上了！要上了要上了！啊啊啊啊他拔刀了啊啊啊啊他嗷的一声冲上去了！我王小狗今次就不要放过你了！人家才不要你们这些小学同学！一个两个都一米八！都是吃一样米饭长大的凭什么啊！比我高的都去死辣（？）  终于被我等到了，金田一VS名侦探柯南，日本两大死神的终极对决，是中二病更强还是小学生更飒？让我们拭目以亻 等一下，您怎么这就躺下了？！我买电影票的时候不是这么跟我说的啊。 反派装了这么久的逼你就给我看这个！五分钟！五分钟都没有！砍二boss砍了一整集还苦哈哈的砍废了一把一看就是氪金装备的盘龙大便刀，轮到大boss的时候银桑路边随便捡一把不要的kao没两下就给人kao到刀飞肉搏了！ 肉搏啊朋友们，一米六对一米八的肉搏你们见过吗？柯基跟哈士奇打架你们见过吗？没见过就不要见了，很残忍，很暴力，扛起来，kao下去，铛的一声，特效都还没来得及加，boss已经废了。 然后，在万籁俱静中，我们终于看到了boss的大腿。白白滑滑，躺平任揍，毫无暴力美学，只有我见犹怜。 什么啊，居然是这样的大腿。 糟糕，脸红，默默收起了我的打call机，然后回过头来写了这个影评。 《银魂》：一个废柴大反派装逼两小时KO五分钟的故事。  完。,476,63.0,120
1,1,26816086,银魂,b58308126837ab6175d00c46a0cbde4a,6b79e7c81d567327ed4e248db8656916,2,2017-09-01 13:56:27,看有的评论挺有意思的～银魂本来就是吐槽番～有吐槽就好了其他的不尽人意又怎么样？我想问问银魂饭们～银魂是一部吐槽番嘛？银魂只有吐槽吗？吸引我们的银魂是单单因为他的吐槽吗～我知道银魂一出很多人都会跟风去看～可能在他们眼中银魂真的只是吐槽而已吧～因为他们并没有关注过银魂最激动人心的部分～以及有这么多人粉银魂的原因。很多评论说我们这场笑的人很多啊，笑点高的人真可怜～我觉得吧，银魂最重要的不是让我笑，是让人笑着哭，让人哭着笑。无厘头的吐槽和搞笑桥段中穿插的是每个人物的真情，是每个人物和作者的心。问问大家，可以在评论区回复，这部电影真的让你感动到了嘛，真的让你感受到人物与人物间的牵绊和感情了吗，如果都没有，大家想一下这真的是我们想要的银魂吗，真的是我们喜欢的银魂吗。        作为原著党，首先从头到尾，看得出很还原，每一个场景都用特效做的神还原，本作以红樱篇为剧本，甚至最后红樱掉入海底的场景都还原了出来。但是说实话，我没有看到导演为了这部电影所付出的诚意。         还原，确实是很还原，照搬动漫不做改动的还原，剧本上为了让真选组登场，最终奇袭高衫的改成了真选组，这个挺好的，满足各种原著饭，但是也仅此而已了。台词基本靠照搬，有几个点还是可以的，诸如恶搞了夏亚三倍速，恶魔果实，还有一些现实生活中的梗，确实挺好玩的～但是其他方面我真的没看出来制作团队对这部超人气作的敬意，也没看到主创团队对观众的诚意。很多梗，说话的语气，只有配合上动漫一些夸张的动作和不现实的场景，会效果异常的好，而照搬则免不了满屏的尴尬。演员们请的都是日本优秀演员，演技肯定是过关的，但是在本作中，为了去“还原”，为了夸张，显得很别扭。像桥本环奈，本身是偶像出身，演技逊色倒没什么好喷的。但是像饰演来岛又子的菜菜绪，饰演假发的冈田将生以及诸多老演员，在各自的影视作品中都表现十分出色，但在本作中，却显得像是不会演戏的新人演员。         再来谈谈打戏，在发布会时，说是小栗旬从韩国请来的专业团队。对不起，这么幼稚，这么简单的动作设计，想象不到是专业团队设计出来的。两个人在激情对战的时候，前一秒还在面对面，后一秒一个人就跑到后面去了，在动漫中这是常见的动作场景设计，但是在电影中，这不符合逻辑，会让人看的莫名其妙。这也可以认为是导演的不走心，在设计镜头的时候，照搬动漫分镜，没有意识到这是一部电影。整部电影打戏部分让人看起来像是cos舞台剧（微笑）。在银时和冈田似藏对战的时候，完全像动漫一样给了打铁的大哥很长时间去“解释”两个人的战斗。“他的动作已经不是人类能完成的动作了！” 下一秒切换到两人战斗画面，普通的打斗，这哪里不像人类的动作了？？？“难道。这个男人在用超越红樱的进化速度成长？”下一秒依旧是跟之前一样的打斗画面。对不起，恕我接受不能。        举个不恰当的例子真人版浪客剑心，原作中同样的超现实战斗，在电影中还原的极佳，并且作为电影来说故事完整，叙事流畅，情感铺垫到位，作为电影，在还原原作的基础上，做出了适合电影的改进，不管是剧情也好人物设定也好，都是能让普通观众欣赏，让原著党接受的。 最终浪客剑心三部都获得了豆瓣7分左右这样一个还不错的成绩。        我是带了两个没看过银魂的朋友去看的，本来是想安利，没想到本作质量这么差。看完之后，我觉得很气，气我喜欢的作品被拍成这样，气主创团队没有诚意出了这样一部骗钱作。只能说银魂，你可能真的不适合真人化吧。 --------------------------------------------------------- 分割线，补充一点，本作是电影，电影不以笑或不笑评判好坏，大家笑点不一样不笑不说明电影不好。但是故事的完整流畅，镜头的运用，背景音乐的切入，情感的带入铺垫等等等等来评判，所以恳请大家，理性评分，不要坏了银魂的名声。,486,218.0,207
2,2,26816086,银魂,4e080e3aa468e0144074cb1b52dfbd4e,e38d6c592e50a972f0028cb3a0449924,2,2017-09-02 08:53:05,一、电影画质清晰度不高，也不是标准宽幅，拍摄手法接近电视剧的拍摄，基本上没有远景 二、打斗动作十分老套，动作剪辑混乱，全是近景，打斗背景用5毛钱特效背景，整体的特效也是5毛钱 三、里面的梗是十分随意的日式梗，不常看日剧的会感觉这些笑点很尴尬 四、故事剧情发展也不顺畅，整个有点莫名其妙 综上，建议非动漫粉的可以弃了！也不知目前为止这豆瓣7.8分是怎么评出来的！,180,37.0,47
3,3,26816086,银魂,c820ec8f61f52b5794d2c0cfc4ca00be,d663163917f1a22296ab9d0d7f317d16,4,2017-07-18 01:07:00,"我来打自己的脸。
去年听到真人化消息时我特别抵触，丧心病狂地吼出“别说银桑了，连假发子都没人能演，主角改成猩猩和阿妙好了。”“24能演啥？巴嘎王子吗？！”之类带有十足主观情绪的言论。然而看到预告时我的抵触心理几乎消失了。 漫改要做到两边讨好十分不易。对原作粉来说，人设崩坏、内容删减、场景失真等等常被诟病。对没看过原作的观众来说，架空设定、剧情交代、各种梗的说明以及表演是否符合三次元常理都成为难题。不知道后者是否接受这部片子，对身为原作粉的我来说，正片惊喜大于失望，场景和情节还原度颇高，角色塑造可圈可点。
至少有三处让我狠狠笑出声，并且都是导演和演员超越原作的自我发挥。一处是神乐在甲板上嘲笑又子，一处是阿妙读七龙珠，一处是新八跟武市变平太的对手戏。 以下全是个人观点。
我觉得小栗旬比较合格地还原了银桑。其实看到主演名单时我最抵触的就是他，一是他和银时的形象相去甚远，二是银时这样的人设诠释起来太困难了，我一直觉得他是最无法被真人化的男主之一。所以观影的过程中我始终在观察小栗旬是否有脱离角色的肢体动作或表情——并没有。漫改电影里主演的演技一定不能够糟糕。
新八的戏份很足，正经的、扮酷的、吐槽卖萌的，作为平成若手里演技过关的一员，菅田将晖完成得很漂亮。唯一的问题是，对本体是眼镜的新八来说，演员本身的气场稍微华丽了一点……
桥本环奈的神乐一开始充满了违和感，然而越到后面越发顺眼起来。甲板上和又子的对手戏非常欢乐，不遗余力毁形象，你很难想像在银魂之外她还能有这样的颜艺啊。 除了银桑，堂本刚的矮……高杉应该是被最用心塑造的角色。堂本刚是导演福田中意的演员，高杉是红樱篇的主线，于是当初导演（可能是夹带私货）的选角倍受争议。一方面，除了身高，形象上堂本刚与原作里清瘦的高杉不符，另一方面，虽不如其他角色形似，他的角色也有另一番味道，比起原著里邪魅的娼妇，真人高杉的眼里少一丝狂狷，多几分哀绪。低语像贴着声带滑出，没有毁灭的气息，慵懒的傲慢仍在，妖气不足，人气有余。至于好坏与否，还得看观影者的喜恶了。（唉我招了吧，我是路好）
人斩似藏虽然是红樱篇主要角色，却是容易被忽略的一环，因为没有身为反派的闪光点。新井浩文的演技是非常不错的，大部分角色你多少能看到演员自身的影子（尤其是佐藤二朗和室毅这种个性派，演啥我看着都像佛祖和美列布啊——虽然可能是故意的），新井浩文却一直以来演啥像啥，可以彻底抹去自己的气息，以至于你可能看了好几部他的片子，记住了他的角色，却对这个演员本身没什么记忆。 真选组的戏份增加了不少。毕竟作为银他妈的重要组成部分，第一次真人化不能成为红樱篇原作里那样酱油的存在。三人组猩猩、十四和总悟还原度都很高。
影帝镜头不多，发挥空间不大，不过几个特写的眼神控制得很好。（去影院刷了两遍，第二次更加留意了影帝的部分）
猩猩本身不算难演，我觉得选角的要点是虽然行为迷之变态，气场不可猥琐，要有种刚正的、理直气壮的愚蠢感。中村勘九郎做到了。
吉泽亮不说了，那张脸就是总悟，颜即正义。 非常惊喜的是阿妙。笑起来是恬静的，读起书来是蠢萌的，扯起嗓子就是不良界扛把子。我非常喜欢长泽masami的脸，却一直觉得她的演技“有待提高”，但这次她塑造了一个在我眼里比原著更鲜活可爱的阿妙，无关演技。当她就那么静静地站在万事屋门口，真的像一个家在等待归人。真人版银桑和阿妙，竟神奇地生出了cp感......
另一个亮点是佐藤二朗的武市变平太，跟主线无关，从头到尾萌态百出，承包了本片的多数笑点。
子役的选角非常敷衍，尤其是银时小朋友，就像从路边顺手牵过来充数的。 动画片尾处有一场桂和高杉在甲板上的对话，真人换成了银时和高杉。
在我的理解里，把桂换成银桑有两个原因。其一，最后在船上跟春雨的交战被弱化了，于是同伴间的正邪对话成为全片点题的存在，此处应由主角完成。其二，若是借由假发之口点题，以冈田将生的演技，暂时还撑不起这个场面……
银时及桂带领的攘夷小队与春雨的交战，在真人版里也变为银时与高杉一挑一单打独斗，或许是出于强化高杉“终极反派”身份的缘故。同时为了增加真选组的份量，改由真选组对付春雨。
略遗憾的是，银高两人的对话与昔日好友的挥刀相向并未传递出足够感染观众的情绪（至少没有打动我），动画里同伴间的羁绊和纠葛没有体现出来。 这是美中不足之一，也可能是目前为止少年漫改的通病。就像之前说的，打破次元壁要做到形似已实属不易。连内核都完全传达出来难上加难。
红樱篇作为银魂的第一个长篇，不是最经典的，却在早期具有重要意义。
银魂的原作是笑中带泪的，它把很多的催泪剂揉进更多的笑料里，也许你笑着笑着猝不及防就哭出来。坂田银时将满目疮痍的旧时光收进刀鞘，转身为带着猥琐大叔气质、吊儿郎当、形容颓散的废柴武士，血液里却淌着正统少年漫画主角的执拗、好心肠、有担当。就是这样嬉闹的日常，能让你在某一集突然鼻子发酸。
在你即将习惯它的插科打诨时，突然出现了正经的红樱篇，第一次，它将同伴间的羁绊和过往铺展开来。红樱篇啊一点都不催泪，只不过它的主旨和全作是契合的——守护比毁灭更艰难，也更重要。毁灭一切的红樱、想要毁灭一切的高杉；造出守护之刃的铁子，想要守护同伴的银时、桂、新八神乐……每个人都为了想要保护的人而浴血挥戈。
想要把这些东西完整传递到三次元屏幕，似乎一直都太难了。  关于小栗旬自己唱的被新八强制中断的片头曲和片尾曲——非常难听，应该是刻意的——有个暴露年龄的梗：向真人版《GTO》片头曲致敬，小栗旬也模仿了反町隆史的唱歌风格。
顺便总结一下跟其他影视作品相关的梗和小neta。如有遗漏还请补充。
万事屋的书架上放着一排七龙珠，后来有阿妙为银桑读七龙珠的桥段（此处笑出猪叫）。动画里阿妙读的是赤丸JUMP。
平贺源外递给银时橡皮果实和草帽，此处连BGM都换了。
平贺源外替老年夏亚修好了他的专用扎古。
借滑翔翼给银桑的是吉卜力动画《风之谷》的主角娜乌西卡，滑翔翼是娜乌西卡的交通工具。
片头曲模仿反町隆史版《GTO》。有趣的是，当时16岁还是软糯少年的小栗旬也参演了此剧。
银时念“神乐”时拖着长音的“カーグラ”，模仿的是《花样男子》真人版里小栗旬饰演的花泽类称呼杉菜的语调。
片头的万事屋三人组卡通形象借鉴自日本音乐节目CDTV的卡通主持三人组。CDTV是日本TBS电视台的节目，所以神乐说“TBS一定会生我们的气”。 比起本格少年漫画，含有大量恶搞元素的银魂更不容易被真人化。其实从试水的红樱篇也能看出，福田对多线程交织的部分情节进行了简化，使片子对没看过原作的观众尽量友好一些。我可以举出几部即使没看过原作也不太影响观影的漫改，银魂不在其中。想到此，我很难再对它严苛起来。
最后依然推荐大家去看，至少，它能让你笑出声来。",310,30.0,72
4,4,26816086,银魂,e83a5fcdf6cd625386d3b98db9b97b8a,6c9e99b08e36bc83b4038054f253d826,3,2017-08-20 18:14:59,在海外看的，下午场，一共四个观众，全是中国人。 可能是因为年纪大了，中二病有所缓和，刚开始看的时候总是觉得有点儿尴尬。尴尬的点有三，一是特效，二是打斗戏，三是导演的风格更适合电视剧，和大荧幕不太贴合。 特效可媲美风云雄霸天下，意外增添了新的笑点。 打斗戏完全摆拍，人为设计感非常重，演员动作不够快，慢动作与停格都有点好笑。有些确实是原动画的打斗方式啦，但是放在电影里，由于演员的速度比不上动画，就会显得非常违和。 关于导演的风格，其实我非常爱勇者闯魔城系列，但是拍摄的方式太电视剧了，够不上电影的标准。 欲扬先抑完了，说说片子的最大优点，就是演员的还原度非常之高。 小栗旬，有些镜头非常帅气，完全撑起了这个角色，演技制霸。 新八和神乐，尤其提一下神乐，演的比我想象中好很多，非常可爱，连她的大屁股都非常可爱。定春是还原度最高的！！！！！！特效的钱是不是都花它身上了！！！！ 真选组其实戏份不是特别多，没能完全展现出角色的魅力，但是三个主要角色也都还原度很高。十四和总悟够帅。 来岛又子真的让我惊艳了，爱上了她的颜和腿……我觉得比动画里可爱。另外她背上的线，是涂的吧？一拍到就虚化…… 冈田将生很适合桂这个角色，真的太适合了。意外get到了他的帅点。 我最不满意的两个演员，就是高杉和志村妙……我知道244粉丝很多，年轻时也非常俊俏，声音很苏，但是麻烦他保养一下吧……他越长越像徐铮加曹西平了，完全经受不住大荧幕的考验，看着那个松垮垮的凹凸不平的脸，真的不想让人承认这是高杉…… 至于志村妙，真的演技垫底，几场戏做作的头皮发麻，尤其还有其他演员做对比，显得更为惨烈，感觉演员没好好演。另外妙姐是温柔的暴力，英文字幕写的是tough cookie，她只演出了傻大姐似的暴力。看动画和漫画的时候，还吃的下去银妙CP，但是看真人版，希望她和局长百年好合。 哦，忘了，子役才是让人最出戏的地方。小银时傻笑加驼背，这到底演的是谁啊。 片子只适合粉丝看，不太吸引得了其他观众，大概值3.5星。 卖票的小哥听我说要看Gintama，露出了谜一样的暧昧笑容，类似于“哇哦真的有人看这个片你个小二次元”。 入场之后，红樱篇开始前的几场戏，也让我尴尬的坐立难安。 在那一瞬间，我突然意识到，原来我已经从日漫毕业了，我已经不是那个去日本玩都要买银魂周边的我了……不过从日漫毕业之后，我进入了美漫就读哈哈哈。,92,45.0,31
