,Unnamed: 0,电影id,电影名称,用户id,用户名,评分,评论日期,评论内容,有用数,没用数,回应数
29,29,26816086,银魂,345bfbd49573f8f298c73eba33ec197b,e8403e17705c6e99d898dbd7bce3324e,4,2017-09-07 18:02:52,9月1日，怀着鸡冻的心情看了《银魂》电影真人版，毕竟银桑即使不是本命，也是众多动漫男性角色里我很喜欢和欣赏的，何况还有很多高人气的成功塑造：蛋黄酱超人十四，冲乐cp，四眼仔……额….还有我的微信头像神秘的伊丽莎白酱。2017年春节过后，银魂的漫画就没有追更了，舍不得，因为日常篇不会回来了，说再见的日子也终将来临了。    言归正传，楼主第一篇长篇走心走肾走不回来的长篇影评就献给银他妈电影版了。  一、先说人物/演员       坂田银时 演员 小栗旬   小栗旬不用多说，帅的一逼，至于他是不是符合大多数原作党心中男神银桑的形象，就留个粉丝们评论。不过在我看来，还是很满意的，身形、眼神、还有与动漫银桑声优杉田智和有点相似的声音，很性感啊阿鲁。       作为全篇的独白加唯一正常一点的人物，就是吐槽界的鼻祖新吧唧（新八？辛巴？傻傻分不清楚，喂，你是不是走错片场了，该随便来段freestyle）。人物形象比较贴近，除了部分特写面部比较崩。。      还有我喜欢的中国妹子，神乐，这张剧照很不错，萌萌哒。演员。。。。，也算用心良苦，尽量参照动漫的动作。、表情、语气来表达人物的特点。就表演方式而言，神乐应该是最用心的“翻版”   还有不能忽视的男配光环直逼男主的“真选组”们及永远都是“假发”的桂和吉祥物伊丽傻白、定春。“鬼之副长”的演员我觉得不太有感觉，不知道是不是眼睛太大了。。。桂和莫名人气高的爆的高杉画面都很崩，高杉除了矮就没有觉得特别符合原著的了。      二、剧情    银魂动漫选取了长篇选集的其中一段，“红缨篇”，这是银魂第一段热血篇章？(你确定热血？)至少，我再看动漫的时候确实感受到了紧张及血液膨胀，但是电影里却没有。缺少点什么呢，是打斗场面不够精彩？还是演员不够投入?都不是。我觉得有一部分原因来源于配乐吧。大家都知道，日漫的配乐及音效向来都是所向披靡的，会让人感觉热血沸腾，这里就不一一列举了。电影中的音效及配乐就效果而言，是有所不足的。再者，银魂固有的搞笑吐槽，在短时间呈现的电影作品里，压住了热血的打斗场面，既要交代故事情节和人物，又要努力搞笑吐槽，与一般热血电影不同，节奏自然就断了，慢了，观众的心也就乱了。电影中的很多嘲点，例如海贼王的果实、寄生兽的小右等等，除了很多日漫爱好者，很多作品大家是没有看过的，就像小右的嘲点，我在的影厅里就我和另外一位美女笑了笑，其他观众估计都没反应过来。这样，也导致了很观众是不能接受这部电影的，因为不懂，何来满意？            三、这部电影想要表达什么？    主题，即电影灵魂所在。电影版灵魂又想表达什么呢？武士之道还是伙伴的羁绊？看完电影之后，我只想说一句：你想多了。。。连主演小栗旬都说，这就是一部没有内涵电影。无下限，无节操，就是银魂的主题；那些想看激情热血的可以看其他的大片，而银魂除了给动漫粉福利之外，带给观众的就是轻松，平常的人生也能过得如此、、额、无节操；银魂的灵魂所在，就是没有想表达的内容，没有要带给观众的东西，人生艰苦，就一定需要别人透过别人的故事给你传递所谓的思想吗？这样的鸡汤才更容易接受是么？所以，本就是仁者见仁得事，其实，银魂也表达了很多，对于我而言，看到了诚意，也满足了我的情怀，不就是乐一乐，不比什么都重要么？,1,,0
30,30,26816086,银魂,5311f6e4010e1271baa1accba350f420,0c0bd240af68913cdaab15aa9c6c708f,3,2017-09-05 16:14:57,既然我的短评发了永远显示不出来，那我就来影评这里吐槽。 作为原著粉的非卡司粉只想客观的问一句:那些说演矮杉的那个演员长得帅演得好的人，你们是认真的吗？？肤色偏黑长得像陈思诚，哪里帅了？矮杉的笑声只是阴冷但笑得是很男人的好吧，这个真人矮杉笑得好讨打！矮杉只是矮不是瘦弱好吗！这真人矮杉又小又廋，怕是连新吧唧都干不过吧，热评还说什么性感白滑的小腿，日，卡司粉占领高地真的让人闹心。银他妈的打斗如此精彩，真人版里全是尬打，就不能向剑心真人版取取经吗！ 日本黄晓明演紫拉一开始我是无法接受的，方脸太出戏，不过后面的短发看起顺眼多了。当时动画看到这里，也是被短发紫拉给惊艳到了。,7,3.0,6
31,31,26816086,银魂,26d189117d0d0ee66bc346db09e685b6,a12fcf6617840c5ca442aee0b73bd311,4,2017-09-04 21:51:46,最起码这部片子让我哈哈哈，而我又不是二次元的人，我也不是《银魂》动漫的粉丝。 本来想打3星的，毕竟和小栗旬在宣传时候说的一样，“这就是一部没啥内涵的电影。”正确无比，而我刚给了同一天观看的《敦刻尔克》打了三颗星星，而那是一部逼格十分高的拜神之作。在不去看的情况下，这就是网络片和张艺谋等人的巨制之间的差别。 但这又有神马关系，《银魂》确实让我笑，让我开心，让我轻松，这就是它最有价值的定位，谁叫他没什么内涵。-_-|| ————————————————————————————————————————————— 就像开头的无厘头介绍，这个一头银发的男主银石带着一个四眼仔新八，以及一个拥有奇异力量的美少女神乐，开了个私人公司，什么业务都接，叫做“‘’万事屋”，类似于“某某事务所”，日本貌似这种类型的小事务所好多，脑海中迅速跳出毛利小五郎的事务所画面，据说日本有“侦探事务所”、“建筑事务所”、“会计事务所”、娱乐圈也离不开事务所，著名的“杰尼斯事务所”、摩天大楼里各种楼层贴在玻璃上，简单粗暴的大字标注的众多私人事务所的广告，这应该就是日本最生活化的场景吧。   先来科普下“次元”世界： 二次元，就是指二维的平面空间，用来指动画，漫画，动漫，CG，游戏等一系列平面的视界产物。 在日本ACG作品当中所指称的“次元”，通常是指作品当中的幻想世界以及其各种要素的集合体。另外，在传统上，以平面的媒体所表现的虚拟角色，如漫画或动画中的人物，因其二维空间的本质，而常被称为“二次元角色”，以有别于现实的人物。但是，以三维电脑制作的角色，因其处于虚拟世界又具有立体性的概念，而被称为2.5次元角色。  简单说：动漫、动画、游戏世界中的世界就是“二次元”世界；现实中，我们所存在的就是“三次元”世界，而这部真人版动漫电影所展现的虚拟人物与现实人物一同存在的世界，就可以称为“2.5次元”世界。科普这些的意思其实很简单，拉低你和90/00后世界的差距，这比电影更重要。 回到电影，银石是个拽拽又有点二货、又不关心形象（爱扣鼻屎）的人，我估计，这个人设一定是创作者碰到一头哈士奇后想到的==111这在众多动漫男一号其实都有类似的人设，可能小人物更能博得二次世界粉丝大军中的主力，那些宅男们的青睐和认同。这种垮挎人设一般都拥有毫无人性的超级才能，一副“你看不惯我又干不掉我”的无聊神情出现在你面前。 和小栗旬介绍的一样，片中充斥着各种“无内涵”，最让我喷饭的就是里面有关《七龙珠》和《海泽王》的片段，毫无违和感的调侃，拉近了其他动漫迷们的关系，因为他们就是这些经典动漫中成长起来的。如何喷饭的情节，没看过的可以电影院了解啦。 片子没有那些为煽情而煽情的点，各种点到为止，接着搞怪无厘头，让人轻松愉快。但最后还是能让人感到日本动漫片一贯宣扬的那种“可以赴汤蹈火的友情”、以及美少女和男主直接若有似无的“爱情”。当然还有还原度非常高的表演水准，比如静若处子，动如脱兔的一动一静，一会安静的都能听到风铃声，突然鬼畜一般的大喊一声，音调拉长，房子都感觉要颤抖，男女主有一没一的让人想不到的动作，都是日漫的风格啊——突破固有形象，才能让人记忆深刻，产生亲近感。 而日漫一直蔓延着热血青春风格，从灌篮高手、足球小将、海泽王、幽游白书、到银魂、火影，这些都是受众最广的类型；当然还有黑暗系，如死亡笔记、死神等，还有其他少女系列，各种风格的优秀作品，带来大量的受众，日漫的影响还是一直存在的，虽然近来超人气动漫都一个个在完结。 客观的说，日本的娱乐产业化还是世界顶尖的，他们在娱乐工业化的同时融入自己的本土风格，比如动画电影，它产生了如宫崎骏的一批的大师，他们的作品带有东方的温暖、含蓄，却拥有着在内心深处让人思考的哲学力量。还有日本那短小精悍的电视剧产业，他们没有美剧英剧那种电影般的大画面，却又极富生活化和想象力，节奏悬链又如电影一般高度紧凑，以及高超的逻辑性。这都是日本娱乐工业的良性发展的内在传承。他们的定位是这样，而我们的定位又是什么呢？这让我想到了中国男足，一段时间学习巴西的技术，一段时间学习西班牙的传配，又一段时间学习意大利的防守，我们还没有找到自己的方式和定位，但我相信，这不会太久。 其实日漫电影，简单的说，就是打怪升级，友情至上的热血青春，这可能不需要看也能猜到，但这部片子在这样一个合情理的情节中，让大家欢笑和轻松愉快，这就是“没内涵”做到最好的地方。 这个世界所有人都想做到“有内涵”，但并不是每个人都能在最终做到这三个字，他需要太多的加持，或许还要加上那虚无缥缈的运气，往往过了大半生去辛苦拼命的追逐，最后仍做不好自己当初梦想的“有内涵”； 不妨就做一个“无内涵”的人吧，放下对自己的严苛要求，放下脸皮，一身轻松的去打怪升级，或许有一天，你就能收获最真实的友情，最珍贵的爱情，说不定还能拯救世界。 说不定哦~  没啥内涵,1,,0
32,32,26816086,银魂,f85614a35968547aa6ef6bee4ee9ee01,e75eff0332dc1864649ee0022baeffca,3,2017-09-04 13:35:14,三星半，优缺点比较明显的一部电影。 优点：大部分人物还原度较高，小栗旬真是演什么都无违和，虽然有点不能接受不是钉宫之外的神乐酱，但是桥本环奈也很可爱，当然服装能看起来不那么廉价就好了，好显胖啊！！！新八绝对是惊喜，造型还原，演技也在线；阿妙也太赞了，像从漫画里直接走出来的。紫拉感觉是耐看型，伊丽莎白其实蛮还原的，电影里还自己吐槽了一下2333……为了给真选组加戏紫拉的手下都没了……真选组看起来有点奇妙，还原度较高的也就是总悟吧。鬼兵队方面，矮杉不知道为什么好像差点意思，比起原作想要毁灭一切的野兽，这位更像是中二少女……气场显然不足；但是鬼兵队其他人真的是异常还原，尤其是萝莉控……哦不女权主义大叔，简直是太有意思了！人斩似藏也不错，来岛又子可真漂亮，初见惊艳到了。其他人铁匠兄妹，源外老头都很不错。人物造型还原是最明显的优点之一。其次剧情也尽量按照原作，改动的地方就是给真选组加了点戏。 缺点也蛮明显的，主要是特效太渣了有些地方看起来迷之尴尬……动作场面也显然比不上动画那么流畅有张力，当然电影与动画确实有很大不同，但生搬硬套真的不可取，尤其是红樱篇作为原作第一个正经的篇目作为粉丝还是希望可以看到一部比较燃的动作电影而不是一部低成本喜剧片……继续努力吧～,2,,0
33,33,26816086,银魂,801e11ad25cd5604dcb1c688dc6a882e,d8710f0653a849ea6d9b4436d6c877e4,5,2017-09-04 12:34:53,"1.首先《银魂》的本质的热血和正能量，这个是毋庸置疑的，只是他的表现方式很独特而已（例如通过各种段子，颜艺，吐槽同行，无节操，经常性的黄暴情节）。这个可能就是和常规热血漫画的不同了，像JOJO就是经常性热血，偶尔恶搞（这辈子都忘不了典明粥）。所以，要是无厘头恶搞各种同行的时候，大家看出来的笑出来就好。而当打斗很精彩的时候，屏住呼吸看就好。        说道段子，在下不才，为看过但是没捕捉到笑料的各位非原著党扒一扒，解释一下为什么那个镜头出现的时候，你听见了笑声（欢迎各位留言补充啊）。首先是一开始就是，Q版人物登场的时候银桑顺道为JOJO宣番，然后这个和他之前的《银魂》电影宣番是相呼应的。大概就是说“大家别走错放映厅啊，以为这是山崎贤人的《JOJO的奇妙冒险 不灭钻石》”（PS：这部国内没有引进。orz对不起伊势谷，熊猫和masaki啊）。      然后电影一开始出现的独角仙的独角仙片段是因为银时的设定是攘夷战争失败后依靠万事屋（就是拿钱帮你办任何事的万能办事处）度日的幕末落魄武士 ，他的房东是楼下居酒屋的登势婆婆（电影中没出现，但是店名字“お登勢さん”出现了）。每个月他愁的就是房租，所以一听见独角仙能挣钱他眼睛都亮了。这个在之后他负伤的时候拜托阿妙垫房租的笑点是一样的。但是身为武士，他却不拘泥武士的规则，他爱挖鼻孔（对，当时他往桂衣服上弹的就是鼻屎），他爱吃甜的（店里面的“糖分”横联和新八拿出的银时专属草莓牛奶），但是又战力高强。       万事屋三人到森林里面看见一个金灿灿的变态（咳咳），吓了一跳。然后接下来就是各种吐槽。这个变态--是近藤勋，新选组组长（相当于江户警察局的局长？）反正还是蛮大的一个职位。然后他天性就很正能量，总能用自己的乐观感染他人，所以他身边聚集了一堆愿意追随他的浪人，尤其是土方和冲田，后来就组成了新选组。但是，就是这么一个正能量的人，漫画家空知给他的属性设定是大猩猩，所以他，毛发浓密（包括他的屁屁毛，然后当初阿妙说了一句“假如喜欢的男人屁屁毛很浓密，那就连他的屁屁毛也一起爱”，然后近藤就坠入了爱情的漩涡），括约肌及其发达紧缩（人送外号“菊长”），偶尔智商掉线，喜欢阿妙喜欢到成为了跟踪狂，特别喜欢裸着（当时土方汇报斩人事件的时候，估计这货也是只穿了一条兜裆布）。        然后一群人从森林里面跑出来也有人笑，不仅是因为这个场面很搞笑，还有就是小栗旬扮演的银时和桥本环奈扮演的神乐身高差实在太大，就变成了微博里面经常看见的一米八的大长腿和一米五的小短腿赛跑的动图笑点。        桂小太郎登场的时候口头禅是“不是假发，是桂”。是因为假发（tsu ra）和桂(ka tsu ra)很接近，所以这就是一个梗，再加上他头发真的十分柔顺（从后面人斩似藏的评价也可以知道），所以一直被银时吐槽他戴假发。        中间的很多小细节记不清楚了，最后再说一说一些电影里用的新梗吧。首先是《寄生兽》，这个看图之后就大概明白银时在吐槽些啥了。  寄生兽   然后就是源外老头子那儿出现的《海贼王》的恶魔果实和黄色草帽以及《机动战士高达》里面的船长和机甲（说实话这个系列只看过00,具体这是哪个型号我就不认识了，感觉像是捏他独角兽。望大神们科普一下）。  恶魔果实  路飞  最后让银时飞到战舰上的飞行器就是恶搞宫崎骏的《风之谷》，上面的人物也是《风之谷》的女主娜乌西卡（因为会侵权，所以当时消音处理了，银魂里面这种情节多了去了。大家就当是笑点看，不要想太多。因为这也是《银魂》的卖点之一）。  《风之谷》的娜乌西卡        2.然后由于这部电影是以《新译红樱篇》为主线剧情的，所以省去了人物关系的详细介绍。大家不太能懂这种互动的有趣点在哪儿。          坂田银时、桂小太郎和高杉晋助三人都是松下私塾吉田松阳（电影和动画中的声优都是山寺宏一操刀）的弟子。松阳对于这三个人来说都是救赎，都是不可代替的存在。但是当时松阳被天人（其实是天道众的暗杀部队天照院奈落，这个说起来太复杂了。就当它是天人吧）抓走了，三人后来去救松阳，但是除了白夜叉银时之外，狂乱的贵公子桂和鬼兵队的高杉都被抓了，当时天人给出的选择就是，你要救你兄弟还是救你老师。然后银时选择了救兄弟，就含痛选择手刃了松阳，当时经历了这一切的三人之后就走上了不同的道路。所以三人的对话和打斗感觉上会稍微gaygay的，但是这就是三人羁绊很深的证明。         新选组里面副组长土方十四郎（恶魔副长）和一番队队长冲田总悟（抖S）的设定都是崇拜近藤勋，但是两人却相爱相杀，所以经常互卖队友，虽然土方被卖得比较多。平常没啥危机感的时候也会买买他们的老大就是了。两人也都超级能打（虽然电影里面不太能看得出来）。          至于万事屋三人的关系就当是废柴老爸带着俩娃吧一起过生活吧。          3.虽然这部电影里面新笑点不多，但是原著党还是看得很开心，一是场景设定真的很还原，二是演员真的很卖力。说实话，要不是看了《Crisis公安机动侦查队特搜班》中，栗子（小栗旬）从阳台掉下去还乐呵那段，我真的还在担心银时会不会被演砸。的确，组长（动画中银时的声优--杉田智和的昵称）当年见面会cosplay银桑的时候我真的觉得他把银桑演活了，假如说空知给了银时形体，那么组长就给了他灵魂。这两个真的气场蜜汁吻合（谁能想象他当时还配过《滑头》里面温柔的鸩大哥，《JOJO》里面的骚气二乔呢orz）。            菅田（菅田将晖）和masaki（冈田将生）还有伊丽莎白里面的熊猫（山田孝之），合着栗子是把他的小后宫都搬过来了。桥本环奈的神乐就不用多说了，然后扮演高杉的是244堂本刚是双人组合KinKi Kids的“大爷”，源外老头子是室毅（说实话我第一眼没认出来。。。），来岛又子是菜菜绪，变态军师就是那个“萝莉控”是佐藤二朗（喜欢他在《审判长，肚子饿了》里面的吐槽），阿妙是长泽雅美，近藤是中村勘九郎（中村家的歌舞伎演员哦），土方是柳乐优弥（老早就通过《无人知晓》斩获戛纳影帝，虽然那之后就低迷了很久，不过现在又复出真是太好了），吉沢亮（一出场场内妹子都在喊好帅）。。。还有好多，这些演员都是差不多是日本一线演员，演技都是有保障的，所以大家要是想吐槽他们的演技的话可以先去看看他们正常一点的剧，至于银他妈嘛，这个剧只负责让他们开辟新世界的大门。",2,,0
34,34,26816086,银魂,5190c0db8cca5cdb303d952a51a352eb,828ccc4eba8871295c76742a3ce4a08f,2,2017-09-04 10:46:30,"昨日14:10分准时开始看电影。人很少，可能不超过20人，不知道是电影热度不高，或者影院本来就人少，或者两者兼有。 这版《银魂》真人电影的主演是日本知名男演员小栗旬，我看过他演的日剧《无间双龙》，印象还不错，查了查也算是漫改电影的常客，之前还有演过鲁邦三世和名侦探柯南，于是稍微还是有些期待的。《银魂》原作是日本漫画家空知英秋2004年开始连载的作品，以曾经的日本历史上明治维新之前的“尊王攘夷”、新选组等为参考，结合了大量新鲜元素，加之作者本人的才华，使这部作品大放异彩，成为日本漫画中难得的佳品。我虽然没看过漫画原著，动画也只看了一丁点儿，但因为其在二次元中的地位，还是时不时能接触到，这次出真人版，抱着重新认识这部经典的心态前往观影，想着如果拍的好的话，说不定会重燃我补番的热情呢。
然后，我，超失望的哎。
简单说感觉，就是不好看。如果我是原作的老读者，原动画的老观众，可能我会比较有代入感，虽然电影竭力还原原作的各种梗和笑料，甚至一些动漫独有的夸张表情和动作，但是仍然显得有些僵硬，故事逻辑链勉强完整，但对于男主和其他角色的各种刻画和背景展现并没有详细交代，也因此让一些行为有些突兀，如果不熟悉原作背景，是很难去理解这些行为和想法的。为了人设而设人，我觉得这是很失败的。记得有人说过，小说、漫画、电影电视剧代表不同的次元，而不同的次元在讲述故事的时候，是各自有不同节奏的，如果不能熟悉其间表达节奏的不同，不明白一部作品真正想要传达的内涵，那么任何一者向另一者的转换都难以获得使人满意的结果。
而这也是为何我觉得这部真人版《银魂》不好看的原因。
希望有一天我补完了银他妈原作，再一次有机会重览这部电影，可能会稍稍有点改观吧~大概...",2,,0
