,Unnamed: 0,电影id,电影名称,用户id,用户名,评分,评论日期,评论内容,有用数,没用数,回应数
27,27,26831711,熊出没·奇幻空间,4b43f6803811acaa3d901a9cbf4e1a93,787b63b519ba9f4f38276fa75cbbb31b,5.0,2018-01-27 12:31:39,我真不理解那些说奇幻空间抄袭的人怎么想的，首先国产动画做到这个水平已经很不容易了，从制作难度上就值得五星，然后其实那些说抄袭的也没有证据，而我又有他们没有抄袭的证据，下面说一下目前主要有争议的3个角色：首先我觉得应该说一下神鹿，神鹿的造型完全是熊出没剧组自己设计的，有人说抄了幽灵公主，但是它们的原型不是同一品种的，而且导演自己也说了，这个造型是为了致敬九色鹿设计的。然后纳雅抄袭幽灵公主，我认为判断a片中的b人物是否抄袭c片中的d人物的最佳方法是，把b和d互换，然后看看a片和c片是否能正常运转，这里能么？而且纳雅的原型明明是鄂温克族人，这个可以参考黑鹤的驯鹿六季，里面说到的驯鹿鄂温克族生活的地方和本片的取景地差不多，都是在东北，都是在森林里，而且还有一件很重要的事就是他们把纯白色的驯鹿称做神鹿，这可以同时证明以上两个角色不是抄袭。再来看小铁抄袭瓦力，按照先前的方法，把他俩互换，片子还能正常运作吗？还有说这个抄袭的人一定没听小铁的自我介绍，他用的是什么零件？瓦力这个扫了700年地的清洁工又用了什么零件？这就证明了这3个主要有争议角色都没抄袭，至于大闹天宫，这不应在抄袭范围内，而是引用，这个引用把片子引导到反派基地处。胖子的铁拳抄袭超能陆战队的这也不对，如果真是抄袭，有抄得这么明显的吗？要是有，那导演真的是傻。然而导演不杀傻，也许老板和超能陆战队在同期不同地点发明了同装备呢？科学史告诉我们，这并不是不可能，另外两位盗贼的装备可以此类推。 最后，顺便说一下，说熊出没奇幻空间传播软色情的，要照你们这么说，有个女角色的片子都在传播软色情咯？那导演都犯了传播淫秽物品罪是不是？那宫崎骏还不是要被判死刑了啊？还有宫崎骏作品和本片有可比性吗？两个针对不同年龄段做片子的导演不应类比，那你们说说，宫崎骏做过那些面向儿童的作品？(龙猫和幽灵公主除外),12.0,4.0,26
28,28,26831711,熊出没·奇幻空间,4b43f6803811acaa3d901a9cbf4e1a93,787b63b519ba9f4f38276fa75cbbb31b,5.0,2018-01-27 12:31:34,我真不理解那些说奇幻空间抄袭的人怎么想的，首先国产动画做到这个水平已经很不容易了，从制作难度上就值得五星，然后其实那些说抄袭的也没有证据，而我又有他们没有抄袭的证据，下面说一下目前主要有争议的3个角色：首先我觉得应该说一下神鹿，神鹿的造型完全是熊出没剧组自己设计的，有人说抄了幽灵公主，但是它们的原型不是同一品种的，而且导演自己也说了，这个造型是为了致敬九色鹿设计的。然后纳雅抄袭幽灵公主，我认为判断a片中的b人物是否抄袭c片中的d人物的最佳方法是，把b和d互换，然后看看a片和c片是否能正常运转，这里能么？而且纳雅的原型明明是鄂温克族人，这个可以参考黑鹤的驯鹿六季，里面说到的驯鹿鄂温克族生活的地方和本片的取景地差不多，都是在东北，都是在森林里，而且还有一件很重要的事就是他们把纯白色的驯鹿称做神鹿，这可以同时证明以上两个角色不是抄袭。再来看小铁抄袭瓦力，按照先前的方法，把他俩互换，片子还能正常运作吗？还有说这个抄袭的人一定没听小铁的自我介绍，他用的是什么零件？瓦力这个扫了700年地的清洁工又用了什么零件？这就证明了这3个主要有争议角色都没抄袭，至于大闹天宫，这不应在抄袭范围内，而是引用，这个引用把片子引导到反派基地处。胖子的铁拳抄袭超能陆战队的这也不对，如果真是抄袭，有抄得这么明显的吗？要是有，那导演真的是傻。然而导演不杀傻，也许老板和超能陆战队在同期不同地点发明了同装备呢？科学史告诉我们，这并不是不可能，另外两位盗贼的装备可以此类推。 最后，顺便说一下，说熊出没奇幻空间传播软色情的，要照你们这么说，有个女角色的片子都在传播软色情咯？那导演都犯了传播淫秽物品罪是不是？那宫崎骏还不是要被判死刑了啊？还有宫崎骏作品和本片有可比性吗？两个针对不同年龄段做片子的导演不应类比，那你们说说，宫崎骏做过那些面向儿童的作品？(龙猫和幽灵公主除外),7.0,4.0,6
29,29,26831711,熊出没·奇幻空间,8ca008cc71ef19256c72717af22c96fd,e68a96d332d692f144e7809ee8ab25e9,5.0,2017-12-30 10:16:01,你们已经注册完的特殊水军太多了，一贴多少钱？你们先打字累才写短评的吧！一呼百应，还点赞，再说说探险日记，那么精良的动画，你们水军还鸡蛋里头挑骨头，说没意思！卧糟，这么个话竟然那么多人点赞附和，一看就是水军！熊出没太可怜了，谁黑熊出没我黑谁。奥，原来是喜羊羊，我黑你所有作品！！！！！！！！！！！！！！！,10.0,3.0,5
30,30,26831711,熊出没·奇幻空间,1f4c207abf1613a9411116a4500d6b24,a7e1f5d8f24af1282e7fe593c58006d3,2.0,2017-12-29 22:48:23,1.《奇幻空间》中的COCO  .       《机器人总动员》中的瓦力    2.《奇幻空间》中的纳雅       《幽灵公主》中的幽灵公主桑    3.《奇幻空间》中的猴头菇        宫崎骏《龙猫》片头      4.《奇幻空间》中的瘦高个抛球技能           《超能陆战队》中哈妮柠檬的技能——不同颜色的球不同的作用      5.《奇幻空间》中的胖子没穿钢铁侠衣服的拳头        《超能陆战队》中大白的拳头    6.《奇幻空间》      《疯狂原始人》中的某些景和剧情    7.《奇幻空间》       梵高《星空》   8.其他         我个人认为，反而是那些客观评价的人，对国产动画的爱是最浓厚的，因为他们在你“偷拿别人一针一线”的时候给你一巴掌，他们希望能打醒你，让你明白你应该是谁，而不是看你“偷拿完一针一线”之后还怂恿你去“再接再砺”，大声喊着爱你的同时送你走向穷途末路。,8.0,13.0,7
31,31,26831711,熊出没·奇幻空间,8ca008cc71ef19256c72717af22c96fd,e68a96d332d692f144e7809ee8ab25e9,5.0,2017-12-29 19:34:45,版权归作者所有，任何形式转载请联系作者。 作者：神龙屁屁（来自豆瓣） 来源：https://movie.douban.com/review/9027228/ 既然可以无脑给一星。我喜欢熊出没也可以无脑给五星。的时候才来找我要做一次又一次的确是的我们的生活方式，我们的生活方式，我们的生活方式，我们的生活方式，我们的生活方式，我们的生活方式，我们的生活方式，我们的生活方式，我们的生活方式，我们的生活方式，我们的钱包的钱包的确是的我们的生活方式，我们的生活方式，我们的生活方式，我们的生活方式，,5.0,4.0,0
32,32,26831711,熊出没·奇幻空间,b84a47f4540e91846c93989e8d2853ae,60a710f5b855778e7d3021aae8ce45e7,4.0,2017-12-15 16:52:29,整体来说这部片子还是非常不错滴，适合中小学生，适合大人回味童年，可以提高你的幻想思维~可以跟小黄人系列片媲美咯~~可惜豆瓣给的评分低，大多好像说是因为抄袭吧？           在一片矗立在雪山之中的奇妙森林中，有着各种超乎科学认知的动植物~，灰常可耐的猴头菇精灵，异常庞大的飞行甲壳虫？以及会发射“子弹”的花儿，还有那粘人的球球，（好多植物叫不上名字，植物盲，怪我咯~~）再加上美丽的异次元鹿族少女纳雅，简直就是动画世界中的世外桃源~看完之后瞬间心情愉悦了许多~有木有！！！          电影以金箍棒开场，这要是不知道的人，还以为跑错片场了呢，囧~~，其实是坏蛋BOSS想要搜集动画世界的所有好玩珍贵的东西，而设立的一个情节。坏蛋BOSS因童年被剥夺，在其母亲强制管理下，所有时间完全用于学习各种知识，参加各种竞赛，最终获得了各种博士学位，成为了一名天才，也因此发现平行宇宙并以此创造出了虫洞，实现了人类自由穿越动画世界的梦想~。而他想获取动画世界里的各种好东西也是为了想弥补自己的童年，所谓因爱生恨，走了偏激的道路而已。不过故事最后金大鹿穿过他的身体，也感化了他，还是一个完美的结局~           COCO是一个考古机器人，被熊熊们强称为小铁，虽然它本身一直嫌弃，哈哈哈~这个逗比机器人原本跟着教授来狗熊岭考古，并负责寻找和保护金鹿角遗迹，后来教授和助手被绑，COCO也被坏蛋各种强追，这才碰到了光头强和熊熊们。并和他们一起踏上了保护金鹿角的路途~           光头强这个角色契税也要好好说下……他呢其实映射的是我们当下的普通大众，别笑，因为你或许还不如他呢~~首先光头强是一个伐木工，其次呢又是一个修理大师，更是一个民间发明家，每次东西坏了都是自己修，而且还经常发明一些稀奇古怪的东西来对付熊熊，虽然结局每次都失败……但这并不影响他成为一名优秀的发明家！！！哈哈哈~`光头强也很聪明，连熊二都说了，要是光头强在就有办法了，说明光头强还是一个拥有各种办法的人~办法总比困难多，不是么，/发呆%%%~          光头强一直想发奋图强，但命运不济，遇到的老板也不咋地，因为太想成功了，太想逃离这种苦日子了，所以看着马云爸爸的励志书就走了偏激之路~中途盗取了地图，计划自己去偷金鹿角，不过很快又醒悟了~跟着大家一起去守卫金鹿角，，特别是最后的英勇之战很是拼力~~所以本质还是很不错滴。           那个鹿族无敌美少女纳雅有时候也会犯傻~咯咯咯~~太可爱。          片中出现的那只猫竟然叫薛定谔……好吧，又是一个梗~          该片涉及了虫洞理论，量子力学，平行宇宙……           还有很多好玩的，就先说到这儿吧~~哈哈^^,5.0,1.0,1
33,33,26831711,熊出没·奇幻空间,1cdd0f300964a953404f112df7177bc3,e82010dfd7b5b1af67118a2c4ec344c9,2.0,2017-12-01 20:16:20,有创意，制作有可圈可点的地方，但是故事主线情感线纵深度依旧比较弱，觉得主创团队在编故事的方法上应该存在很大问题。 第一，很多人头脑风暴出来的各种创意情节是有亮点之处，但是应该在主线故事逻辑文化背景的调查研究人物小传挖掘更深，让故事更简洁但潜台词更丰富，一些有意思但对故事帮助不大的创意要果断舍弃，不然总是在大杂烩的怪圈里； 第二，现在熊出没已经是一个大IP了，不应该总是再蹭其他知名动画的热度，基于各种山寨逻辑的创作注定被人诟病，更重要的是这种模仿只能浮于表面，因为那些优秀的动画之所以优秀，不仅是动画形象，关键是对现实生活深入洞察和思考的隐喻。 麦基说：“电影是生活的比喻” 这句话甚至对动画电影更加适用，所以觉得熊出没团队应该放开手脚，从现实出发创作故事，而不是基于其他动画再创作，用动画表达自己对世界的看法和美好期望。 当然啦，这并不容易，其一是熊出没被固定人设和观看受众层的限制，其二是创作团队本身文化底蕴的限制，其三是其他各种环境限制。,5.0,15.0,0
34,34,26831711,熊出没·奇幻空间,80fec5c2984e5c086ccb954677716c1a,c76d76ca35c87e0d4d5240ee45cb5906,2.0,2017-09-09 16:08:37,这部片子的画质不用说，当然是用心做的，属于上乘。但内容就难说了。          在开头，尚雯婕知道金鹿角。         但是从剧情上来看，熊大熊二一开始都不知道金鹿角的存在，光头强就更不用说了。鹿族人知道金鹿角，但在之前的动画片中从未提到过鹿族人和金鹿角。那这就奇怪了，尚雯婕是怎么知道《熊出没》中有金鹿角的？而且，其他动画宝物都是标志性的，而片中一直未说明金鹿角对《熊出没》的剧情有什么影响，根本算不上标志性的东西。          这羽毛明显不一样。            救熊兄弟的不是纳雅的爷爷吧，羽毛都不一样。而且纳雅虽然几次说到爷爷，但是纵观全片，插入羽毛的故事情节对推动故事发展真的没什么作用。我也很好奇光头强怎么推断出纳雅是鹿族人的，熊兄弟根本没有说过救他们的人是鹿族人。         海螺跟这些森林里的植物有什么关系？就算森林靠海，还有这种操作？虽说这是奇幻森林，奇幻的动植物还可以理解，但这也太**了。  纳雅是森女，怎么会有眼影。。。。。。你当我没看见？           这是纳雅在片中所有的射箭的时刻。乍一看好像没问题，但仔细一看就会发现纳雅都是用左手射箭的！也许会有人说纳雅可能是左撇子，但是看她的箭袋是怎么放的…… 在这画面前面几秒的画面中纳雅箭袋里居然没有箭，只能用这张不太好看的图        你不觉得这样射箭很别扭吗？而且可以发现，纳雅的弓此时莫名其妙不见了。仔细看这部片子，你会发现纳雅的弓时有时无。         BOSS 小时候是动画形式？          我不明白，森林哪来的海螺？片中没有说奇幻森林靠海吧？这都不重要，重要的是为什么吹海螺，大鹿就会来保护他们？在之前讲金鹿角的传说时，并没有说猎人吹海螺，大鹿才出现了啊。可是在最后海螺就莫名其妙地召唤了金色神鹿。这样硬生生插入海螺能召唤大鹿的情节，不觉得唐突吗？        在传说中没有提及海螺和鹿的关系兼森林靠不靠海的情况下，你硬生生蹦出个“吹海螺，大鹿就会来保护我们”的言论，这种烧脑逻辑也是没谁了。         在晚上，COCO 才向纳雅问了金鹿角的事情。那么在之前的白天，熊大熊二光头强和COCO跟随纳雅在奇幻森林（唱《鹿be free》的那段时间）是在干嘛？是在……玩？显然他们认为保护金鹿角是十分重要的，这么重要的事情，他们都先不把金鹿角的事情问纳雅一声，却还有心思先和纳雅一起在奇幻森林探（wán）险（shuǎ）？还是COCO到后来问的金鹿角……         他们还没弄明白金鹿角究竟对《熊出没》世界有什么影响，就说要保护，他们的动机到底是什么也不说明白！            在《熊出没》的动画片中，普通森林的动物能说人话，那为什么奇幻森林的动物不能说人话？而且纳雅作为一个人都能听懂它们说话，两头熊作为动物居然听不懂，又一烧脑逻辑。  记忆是个好东西，纳雅你一定要有。光头强有说过要保护金鹿角吗？    这也能叫山谷？  一开始COCO为了阻止BOSS 而抓住他的脚，把他的鞋脱了下来。  可是到了后面，BOSS脚上的鞋怎么回来的？         结尾，正派除了吹海螺什么也没有做。反派更是什么也没有做，金鹿角就幻化成金色神鹿，自己恢复了奇幻森林的生机。这是不是告诉我们，破坏了自然，什么都不做就等着自然自己恢复就行了？那前面的斗争有意义？        然后，金色神鹿消失。我这时想弱弱地问两句：金鹿角现在在哪里？还放在原来的地方吗？结尾没说。。。。。。而且仍然没说金鹿角对《熊出没》世界到底有什么影响，只是说了对奇幻森林的影响。。。。。。就这么结束了。。。。。。        纳雅说话老是会有停顿，说话不利索。        这部片子中的角色个人感觉没塑造好。熊兄弟在片中几乎没起什么作用，光头强虽比熊兄弟稍微好点，但也差不多，这还能叫熊出没吗？片中的女主纳雅，很多人都喜欢她，但喜欢她的理由却仅是因为她漂亮，这种理由真的很恶心人。纳雅在片中的作用就是在与三人组争斗中炫一下自己有多么身手敏捷，和在其他的时候炫颜值，其性格特征一点也没体现，没有灵魂，说好听点就是片子的颜值担当，说难听点就是装饰这部电影的花瓶，一个好看的空壳。        应试教育出不了科学家。        认为动画不需要讲逻辑的人请绕道，谢谢。也不要跟我讲“动画片认真你就输了”，动画是不是就可以不认真讲故事了？        你可以喜欢这部片子，但你不能干涉别人打多少分。我就是不喜欢这片子，是不是就是喷子和无脑黑？是不是连打低分的权利都没有？打个分是不是还要看你们这些熊粉的脸色？        方特卡通靠《熊出没》出名，但不能一直吃《熊出没》的老本。没有哪一个动画巨头是靠吃仅一部动画的老本而活下来的。（？广电总局）,8.0,13.0,41
35,35,26831711,熊出没·奇幻空间,0953ecd1668abc33ca7a829479a3e226,d00e05eabe8a2d0236c8c7643af3e9fb,5.0,2017-08-30 19:33:02,看到6点几的评分，这应该说是大人的影评分吧。豆瓣上应该没水军了，但看不起国产动画的有许多(动画)。这是动画，而不是动漫，所以对于动画，打8分才是这部影片的真实评价。      这部动画的开始，有一种浓浓的烂片风味，我一开始是厌恶的。但是其中的内容却使我沉浸其中。思想上可以说是不幼稚了，达到了初级动漫的水准。(个人觉得其实这不是动画，是动漫)，人物画的也很好，3d建模的不错。配乐必须点赞。总之对于我不看日本动漫的人来说，是很不错的了，甚至感觉比迪士尼的海洋奇缘要好。  对于有些人说抄袭，但也有许多的片子也是会用相同的情节，很正常。不能说外国的是致敬，中国的就是抄袭了。     希望熊出没有更多自己的故事，比如这次将动漫世界串联就很好，当然真人的部分真的烂片风味太浓重了。 ps:或许很多人会喷我所写的吧，喷子应该说是网络上使人激素分泌是在现实中不一样，所以会暴躁的人，所以有人会看到国产就喷吧。但是不可否认，这是一部不错的动画，不是烂片！,8.0,2.0,7
36,36,26831711,熊出没·奇幻空间,8d167cb0f6572bbd4b2ff1de41b17a18,f3d9900b3bc7daeace06fd6f7230923b,4.0,2017-08-08 13:55:51,怎么说呢，其实熊出没拍这么多部了，但是每出一部都会来看，感觉比电视剧都还好看。回归剧情了，那个从小就被人誉为天才神童的小男孩童年里都没有愉快的记忆，只有不停的上补习班真的是很可怜的了，好不容易有只小猫猫陪着它，但是呢却没有多长的快乐童年时光，这就引出了他因为童年过的不快乐，就想抢到所有动画世界里的玩意，这就出现了金鹿角的故事了，熊大熊二还有光头强对了还有coco为了保护金鹿角踏上了征途，途中遇上的景真的很漂亮，真的得夸，还遇上了鹿族少女，一起来保护金鹿角，真的是很好看❤❤,5.0,1.0,0
