,Unnamed: 0,电影id,电影名称,用户id,用户名,评分,评论日期,评论内容,有用数,没用数,回应数
11,11,26876252,无所不能,99b34b84bea8bdb1b190cd84b2ef3961,16712705a1900eb26b8c463ae248c94c,1.0,2021-08-22 10:09:11,说实话，有时候跟无情欺压一样惹人反感的是无处不在的优越感，尤其在以爱之名的时候。上次是“摔跤吧爸爸”前半段一个自己得不到金牌生不出儿子的loser，卯着全身得劲强迫自己女儿去掉小女孩的特征（长发）和个性帮他实现梦想。好歹电影给了一个“不管喜不喜欢，对于印度女孩而言这是唯一的出路”的解释，强迫自己摔跤比早早结婚好。一旦接受了这个设定，爸爸的自恋和自私也就被腐烂的大社会背景冲淡了。 而这部电影，可以说一无可取。从女性视角来看就是恶臭又油腻的一部电影。男主完全不爱女主而是从始至终自恋又干啥啥不行，还一天到晚自我高潮。 前半段就是标准普信男心理：我超普通也很瞎，但是只要代入霸总剧情强迫女生，美女就会爱上我，如果没爱上就多强迫两次。内核不是浪漫而是图穷匕见的男权意志的强加。尤其说服女生收起盲杖依赖他那一段，为了装一波而不顾女生安全，而且很写实最后因为男的更瞎而掉链子了。多菜都有一颗带美女飞的心，如果人家可以自己飞，那就先把女的翅膀给撅了。这个逻辑，可以说很印度了。 中间重大不幸发生后，之前牛逼闪闪无所不能的人整个沉浸在“我这么牛逼居然被人搞了我老婆”的心理大崩溃中，内核就是男性尊严被侮辱后的冲击。而对真正最大的受害者——妻子的处境毫不顾忌，好一点解释是无能脆弱到真正发生悲剧时完全无力支持和保护妻子，这不是说现实中的无能，而是心理上的弱鸡。差一点解释就是感觉自己是宇宙中心，自己的尊严被侵犯远比妻子被侵犯重要。连妻子发出被强奸后经典的自我厌弃言论“我在你眼中不再是原来的我”时，也像死了一样无动于衷。毕竟女性只是被强奸了，他可是被伤害了男性尊严啊。 妻子上吊后没有一丝愧悔。先不说男主对妻子的死有责无责。一般遇到重大悲剧，人的正常情绪应激反应之一就是自责。何况在不知道有二次侵犯前，正常推论就是“如果我及时安抚，多加陪伴本可避免悲剧”。 更有甚者遗书直接不看掉地板，意思就是妻子的感受并不重要，只有当发现遗书跟自己还居然被“二次侵犯”的事实相关时才从床底下翻出来。妻子的死可以说反而让男主舒了一口气，妻子的洁烈净化了他可笑的男性尊严，合理化了他把所有悲剧归因于外的逻辑路径。 后半段篇幅最多，但乏善可陈。简单点说就是直接开挂。完美犯罪个粑粑，暴力把男主武力值调高1000点，智商不够武功来凑。建议男主这么牛逼直接加入复仇者联盟，又及这么厉害的话当初妻子当面被调戏时干嘛不直接设局干死那俩混蛋？或者在家安点机关保护老婆？ 最合理的解释就是后半段是男主失智了自己YY出来的。又又及，一看到背后火光冲天男主凹英雄归来造型就想吐。这个复仇有多少是为了妻子？多少为了耍帅？yue出来了已经，1星都嫌多。,,,0
12,12,26876252,无所不能,0d3b8ffa6ead1fbb7d8b7e15c20784ab,b50df5cbddbcfd5dcfa85cb50b426491,,2021-07-11 21:46:01,无所不能 (2017)7.02017 / 印度 / 动作 犯罪 悬疑 / 桑吉·古普塔 / 赫里尼克·罗斯汉 雅弥·郭德姆 这世界多完美，众生皆盲！ 其实哪有这么多完美犯罪， 只不过你我都被某种无形力量“遮蔽”了双眼...... 比起眼盲之人，迷失人性的心盲之人，才更可悲！ 切勿以为罪恶在道义面前无所不能！ 切勿以为软弱在黑暗面前一无所能！ P.S.：印度电影是有多厉害，每一次都能直击人类灵魂深处，一层层剥开人性的罪恶与阴暗面，袒露出最血腥恶臭的肉体，用暴力手法，挑战法律与公正，拷问正义与道德...... 以暴制暴，以眼还眼！也许有时，复仇与怨恨，是压抑痛苦、脱离绝境、苟延残喘的唯一动力和出路！ 让我想起阿米尔汗另外一部经典《未知死亡》开篇也是美好 可是随着剧情深入 慢慢的把一个好人变成恶魔🦹‍♀️ 本部影片男主开始复仇阶段 真没想到靠声音 感觉有点夸张 我一直以为会不会失明之后眼睛好了才能复仇 看来我还是并没有达到脑洞大开 而且影片在男主配音阶段给予那些提示 映射的官官相卫 百姓阶层如何保护自己 又有点像误杀瞒天记 普通人犯罪如何不在场证明 很棒的一部影片,1.0,,0
13,13,26876252,无所不能,c53a7606adf0800561e2d41fa5e28bbb,05b7ba8cb7b2b7a2be57766a1801e55e,1.0,2021-05-19 21:31:10,（豆瓣er的双标：如果这是一部中国电影，是绝对不能有7.1分的，换成印度/美国/日本/韩国则不然）        我就不说这情节有多少bug、所谓的完美犯罪有多少漏洞了，这是复仇电影？害死他妻子的真正凶手应该是剧中的坏警察，正是警察的错位、助纣为虐、滥用职权、徇私枉法最终导致了悲剧的无法挽回，而两个坏警察最后一点惩罚都没有。这算啥？还有，被强奸之后痛苦都是男主的？女主为不让男主继续痛苦而自杀？我一个男的都看不下去，充满了偏见与傲慢。         就这一部电影，居然7.1分。,,,0
14,14,26876252,无所不能,dc3e919a5c1b8a251d79a2c5b003199f,ff6ad9d346fcfca3b85261f7b5f927f0,5.0,2021-04-06 22:07:37,前期的美好让我意外的认为只是简单的爱情片，后边开虐片段真是深恶痛绝，看到各位恶人罪有应得的下场真是畅快淋漓，以牙还牙以眼还眼。今日脑海中还依然在浮现着情节，无法释怀女主和男主绝望的表情，弱势群体被如此欺负能够反抗成功的又有多少?电影中男主绝地反杀确实痛快，但我知道现实生活中却未必能够如此。,,,0
15,15,26876252,无所不能,0c33e98ae9f08883aa9a740417049941,5a631c6c294ea7a0c08d79ad34cb74e3,5.0,2021-01-10 14:06:15,没有什么完全适合所有人的，只有适合自己或者不适合自己！ 说歌舞的，只能说文化之间的差异吧，或者这是他们电影与歌剧的结合，在者歌先不论旋律如何，歌词真的没得说，那才叫真正的歌词，诗歌诗歌，歌词如果不靠旋律读起来有诗的感觉那才叫歌，不像国内的，瞎编乱写就是歌词，只要配上些旋律就敢大声的唱出来了！！！ 。。。。。。。。。。。。。。。。。。。。。。。。。。。。。。。。。。。。。。。。。。。。。。。。。。。。。。。。。,,,0
16,16,26876252,无所不能,aa49758af267d804cfb6712159f07fca,e6597c083f2fd49cf582f1ee09dd104e,,2020-12-31 16:03:28,被剧中一句点题戳中， 讽刺且真实， 如一句古老的告诫， 诉说无奈。 用戏谑的糖浆，包裹着粘稠漆黑的愤懑； 极端的报复之下，是一份一意孤行，坦然为之的确信。 ——“这世界多美，众生皆盲。” 我想世界上能够导致发生最大结果的力量，无不是来自于绝对纯粹专注的善念，与绝对纯粹专注的恶念。 唯意识到自己盲者，能看见真相。,,,0
17,17,26876252,无所不能,0ff5668585fe330c1d0432129cc57d46,1ab331af3828da3aeda07d2899604920,4.0,2020-07-26 14:52:30,"本周评分最高的电影，莫过于排片最少的印度电影《无所不能》，复仇主题—而且是盲人复仇主题。因为把现实社会描述得够黑暗（不是说盲人的世界够黑暗，不过……也可以这么说），后半场暴力复仇血腥场面就够解气。电影作为一种价值观宣传输出手段，其实担任了古代社会中民间祭祀的功能。每逢节日，宗族或者官府会出相当大的人力财力来组织民间祭祀，选一些宣扬因果神怪的表演，对民众进行教化作用，毕竟识字的人不多。在现代，通过电影故事来了解各个国家的社会状况，就很有代表性了。        印度电影一向敢于挑战底线，看了《无所不能》之后，我发现我对于人性之恶的了解又上了一个台阶。特定的社会、特定的人群、电影故事形成了一个完美且人力无效的闭环，权钱勾结，践踏弱者尊严，希望毫无出路。哪怕男主运用高智商杀完了所有仇人，依然身在此环中，印度现实社会中有多少人能拥有主角光环而“无所不能”呢？     近几年印度电影几乎每部都是爆款，在错过《摔跤》、《巨星》、《护垫侠》之后，总算是领教了印度电影的尺度。社会题材电影不像史诗电影那样美奂美伦，磅礴浩瀚，但是揭露腐朽尺度大胆，把每一处光都熄灭，看着你如同蜉蝣一般挣扎，看着你复仇，看着你仅凭个人之力也无法改变“众生皆盲，无间地狱”的终局。     故事情节很简单，三段式。头场，两个自信独立的盲人在邻里的介绍下认识相爱，积极向往和普通人一样的工作生活，心心相印之下他们也逛庙会、舞池约会、看楼盘、海边求婚、直到结为夫妇。中间还附有几段非常不错的歌舞片段以烘托气氛。中场，本区议员的纨绔弟弟羡慕嫉妒他们的幸福生活，认为“瞎子居然还能结婚？我都没有一个妞儿”，同时觊觎女主美貌，带领混混趁男主不在家侵犯了女主。第一次侵犯后，两个人在议员的恐吓和警局的偏袒下失去了证据作罢，当然，盲人看不见本来也很难佐证。有恃无恐，议员弟弟和混混又对女主进行了第二次侵犯，并告知她，这种事会一直有，女主绝望之下精神崩溃，上吊自杀。终场，男主独自开展了三轮复仇，杀死议员、议员的弟弟、混混。     女主是钢琴老师，两人在舞池的部分是歌舞部分，印度电影必备。不过彼时有多欢快，之后就有多残忍。因为悲剧就是把美好的东西撕碎给人看。
     两个人在朋友的陪伴下去另一个居住区“看”楼盘，憧憬为了幸福生活，此处有歌舞部分。     在老房子里终成眷属，举行了隆重的传统婚礼，此时，幸福指数经过几轮推波助澜，层层加码，已经到达顶峰，为后面的黑暗拉起摔下去的距离。     中场，灾难降临这个小家庭，无休止地被侵犯，弱势残障人士被欺辱，不能诉诸法律，当权者一手遮天。女主自杀，整个色调都是阴郁的，没有光照进来的地方。第一次被侮辱，两个人都坚强地挺过来了。但是第二次来得太快，而且施暴者明明白白告知女主，以后会经常来，怎么报警都没有用，这才是绝望的。 葬礼上，议员上门进行威胁，直言我弟弟喜欢你妻子，就会经常来，那是她的福气，她死了是活该。我是我弟弟的靠山，你不要试图报警，没人会理你，不然把你也咔嚓。（惊呆，作恶居然能这样嚣张直白？）感觉像旧社会，不像现代社会。     而我们之前以为对男主遭遇有怜悯之情的查乌比警长，其实是城府颇深，暗中引导一些事情，想干掉议员自己上位的人，全片中掌权者无一个是好东西。最后想把男主抓住未能成功。     终局，复仇局。 第一个杀人是在废弃的歌舞厅吊死了混混并嫁祸给议员的弟弟。其中用薯片垫地听脚步声等技巧凸显盲人特色。    
 第二个复仇，在议员弟弟曾囚禁他们夫妇的仓库炸死了他，点燃的火烛由议员不知情下亲手燃爆，以毒攻毒，解气。 第三个复仇，雨夜，在新居毛坯大楼里将议员推下去，自己利用安全绳逃生，“我妻子看着是自杀，其实是他杀。而你，好像是他杀，其实是你自杀。（咎由自取）” 查乌比警长终于露出真面目。在他操控下警察不作为一是为了顺从议员的意思，二是想发酵整个事情然后立个大功，顺便将议员干掉自己上位，当他洞悉男主一切行为，却因为没有目击证人无法抓捕男主。正常人都不能以己之力对抗权贵，何况一个盲人？说出去没有人会信他，他总算明白男主的“众生皆盲”。     片中还调侃了另一位印度电影天王，男主是配音演员，模仿阿米尔汗逗弄妻子。    印度教的葬礼分两程路，火葬和水葬，火葬之后，男主进行了千辛万苦的复仇，了却痛苦，才将妻子的骨灰撒入大海，这也是终章。     但是有什么用呢？存在的黑暗依然存在。我想不出有什么力量可以改变这一切。印度裔在北美科技精英和商业精英阶层占比比中日韩裔多多了，据说印度首富比中国首富还要多钱。这一切仿佛意味着印度进入现代化社会文明了，但众所周知，在某些方面，印度一直活在古代。我也曾打算从种姓制度来解释议员们的嚣张，但是议员自述“我父亲是个旷工”，又堵上了这条路，电影想告诉你，就是制度腐败。     解放前旧社会，也是官场腐朽，《二十年目睹官场怪现状》、《老残游记》、《呼兰河传》包括江浙一带地主初夜权的研究报告，记录的光怪陆离的惨事儿真的是数不胜数。个人的复仇除了生者了结怨念，对这种状况无能为力。     片名《无所不能》是指作为一个盲人对抗遮天的权贵阶层，确实是挑战智商和体力的胜利（其实也没有什么胜利，如果使仇人肉身消亡也算胜利），让人觉得这个男主的设定真可谓是无所不能，而他屡次给女主灌输的无所不能的基础，就是自信、自尊、独立自强。另一层意思，大概也是说权力的无所不能吧。",,,0
18,18,26876252,无所不能,fcf13cc7f81b3a2163bff2eb69b39ca4,9a0ee734f8dcd536cfa75fa59620ffa9,3.0,2020-06-06 20:30:02,满足你对所有不公的反抗和审判 满足你对所有不公的反抗和审判 满足你对所有不公的反抗和审判 满足你对所有不公的反抗和审判 满足你对所有不公的反抗和审判 满足你对所有不公的反抗和审判 只想看完电影，发个想法，但是系统说我的评论太短。 印度电影，在剧情设计上还是值得学习的，也是比较细腻的。让你觉得不可思议也有道理，这很像欧亨利的小说。 这个故事，其实没有什么很特殊或者新奇的地方。这应该是我们每个人受到不公正想法后想做的事情，但是不是像主人公一样可以实现的。 也正是这样才是电影所要表达的，这个世界不完美，还需要努力，需要所有人的努力。 从电影本身来看，用了很大的篇幅去描述复仇手段，也就是说很符合它的主题，就是为了复仇。没有用很多的画面去展示两个人的甜蜜，那样估计复仇的基调会平淡很多。 但是，前面不长的篇幅，可以看出两个人的恩爱和幸福，也就知道为什么他有那么大的仇恨。 相亲时的幽默，让人很舒服；跳舞的场景让人很向往；一不留神就开唱，当然是印度的特色；商场购物，失而复得的新喜；看房子流露出对未来的憧憬和幸福。 很多很多这些小事情让人觉得很亲和，不是那种高不可攀的恋爱。 电影前半部分告诉我们，要幽默可以帮你增加闪光点，随带解决单身问题；后半部分告诉你，no duo no die。 系统，你再不让我通过，我可要剧透了。,1.0,,0
19,19,26876252,无所不能,eee03fdb7062cdea3767a7e9f816340d,6e3ab5377f5e11ce0e8027ebe00f8a9b,4.0,2020-04-30 17:05:15,"有点不太喜欢后面一半的复仇情节，虽然设计得很精彩。但是我在想男主是怎么到那个酒吧以及那个小黑屋的，他怎么知道位置以及怎么去的。
还有就是电影给我一种渲染男主复仇之后的那种成就感，比如火烧活人的那个镜头。
然后印度电影，emmm一贯的歌舞部分，我在想没有这些片段时长可以短好多，虽然它有些是为人物的心情以及推动电影发展服务的，但是那段夜店的真的无法理解。
前半部分挺喜欢的，开头描写男主盲人生活的镜头也拍的很好，男主的演技挺好的，不知道男女主是不是真瞎，如果是睁眼演盲人的话，那真的很强了，但是女主总给我一种不是盲人的感觉，个人感觉。
然后男主积极乐观，头脑聪明挺厉害的，尤其是他还是个盲人。不得不说，印度的美女也是好看的，就是皮肤被太阳晒得黑了点。
这部电影给人一种很强的两分的感觉，前一半描写男女主，后一半就是复仇，最后还没绳之以法，虽然他是盲人，但他也违法了啊，这电影要是在中国估计得闪或者改。
还有就是台词以及隐含的对社会的揭露不错，以及对盲人的欺辱。",,,0
20,20,26876252,无所不能,ae7be0d05641a609cc9570f15f3f6612,bf17f4ab50fe9cb9e90ac041351d3946,4.0,2020-04-29 16:09:19,虽然都是盲人，在他们的世界中是一片黑暗，但是美丽贤惠的苏普丽雅遇到了高大帅气的罗汉，一加一大于二，他们都感受到了光明，生活、人生从此不再黑暗。作为主角的罗汉，让我们见识到了作为盲人的不易，但同时也让我们感受到了他们身上所散发出来的正义之感，对生活、人生的信心和热爱。有着不同于常人的缺陷，内心却从来没有丧失对美好的向往，不管是苏普丽雅还是罗汉，还是万万千千的盲人，他们唱歌他们跳舞，他们享受着生活中的一切，与那些健全的人士相比，他们才是真正的健全之人。尤其当罗汉面对妻子的离世，满含热泪，怒火，复仇的勇气和坚定在罗汉的展示下，更显得无比纯粹，将一个个恶人除掉，无疑就是现实版的正义与邪恶的较量。,,,0
21,21,26876252,无所不能,610d8610499b9df2dfbe7c7963411011,821d61c68e1cea9784ca815790389501,,2020-03-31 22:46:11,第一，这女主真的好美！ 第二，两个男帅女靓的盲人主人公好不容易找到爱情，两个该死的混蛋结束了这一切。 第三，印度电影可以一如既往可以抨击时政，与我们中国风格大不相同。像电影中的私刑，我们的结尾一定是得到严惩。 其实拍拍电影，批评下时政也无妨，说不定会推动时代进步，不一定就会教坏人。 电影拍得很美，特别是男女主人公，以及主人公决然复仇的决心！,,,0
22,22,26876252,无所不能,a424d644f24311175baaff6f4d9b6500,9682b2bd8ad3c6be09fd0cc8fa19a667,3.0,2020-03-30 21:07:36,虽然剧名叫无所不能，其实主人公并不如想象中那么无所不能。这部剧的女主非常出彩，也正是如此当她自杀的时候，整部剧都暗淡了。至今为止所看过的印度电影，都以表现女权思想崛起居多。一名美丽自信优秀的女性，即使经历了如此不堪的事，还是坚强着生活，我以为这是女主最大的亮点。结果最后为了男主自杀了。然后就是男主的独角戏，整个基调就偏了。你说这是爱吧，但对方给予的回应却显自私。不成熟的复仇计划，不专业的杀人手法。说不出他是为了谁，但女主的死，白瞎了。,,,0
