,Unnamed: 0,电影id,电影名称,用户id,用户名,评分,评论日期,评论内容,有用数,没用数,回应数
0,0,26876252,无所不能,77a1fdd8c966be171d04adf31a74afb5,e3551c5caf9b712070314314c173c745,4.0,2017-05-26 20:49:08,"尽管从人设特质到剧情细节，有诸多不同，但这个前半段叙述爱情，后半段为爱复仇的故事，还是很容易让人想起阿米尔·汗的经典影片《未知死亡》。 但不同是，相较于《未知死亡》对爱情的纯粹歌颂，《Kaabil》（印坛译名《无所不能》）更着重于宣扬个人尊严。   主角罗汉，是一个盲人，然而他并没有因为身体的残疾，成为生活中的弱者，他擅长模仿声音，并因此成为配音演员，拥有稳定的收入，他有灵敏的嗅觉与听觉，能迅速对自己的处境作出精确判断，他心思缜密，会通过计算步数等小细节，让自己在无法看到的情形下，掌握甚至超越常人更多的环境信息。 这些非凡的特质，也许会让罗汉看起来与众不同，但对于他而言，这一切只是为了能让自己像正常人一样活着：生活自理、经济独立。    以残缺的身体，去追求正常人的生活，必然是艰辛的，但罗汉做的无怨无悔，因为能够不依赖他人的照顾、施舍、同情获得的生活，才是有尊严的生活。 显然，罗汉是一个极其看中尊严的人，所以当车夫欺负他是盲人，少找他十块钱的时候，他立即指出，要求其改正，不是十块钱有多重要，而是尊严不容践踏。 在罗汉和苏皮莉亚的恋情中，尊严同样占据着重要的位置。 相亲第一次见面时，苏皮莉亚向罗汉表达了不想结婚的想法，因为她觉得两个身处黑暗的人，无法找到光明，言谈之中，有一种深刻的自卑情结。罗汉则表示，一个人的自信是他最大的力量，而这种自信，源自他强烈的尊严感——身有残疾的人，一样拥有爱的权利。    不但如此，罗汉没有因为自己的身体状况，表现出对爱情的屈就、凑合，他告诉苏皮莉亚，只有当她真正爱上自己，他们才会走向婚姻。 随后，罗汉通过舞池共舞、商场寻人、新楼置业等等行动，打动了苏皮莉亚的芳心，因为她不仅感受到了浪漫、美好，更体会到了从未有过的尊严感，盲人的生活不比正常人差，盲人的爱情，同样美妙动人。   





  





 然而，这种可贵的尊严，很快遭到了毁灭。 权贵的弟弟阿密特带着手下混混，乘罗汉不在家时，强奸了苏皮莉亚，收受了好处的警察，对此坐视不理，很快苏皮莉亚再次遭受强奸，不但如此，阿密特还告诉她，以后会经常来侵犯她，阿密特离开后，她用一条白布结束了自己年轻的生命。 阿密特的权贵哥哥，曾问罗汉，“要是她那么想自杀，干吗不在第一次强奸后自杀，干吗要等到第二次性侵？”   原因很简单，苏皮莉亚的自杀，不是因为传统意义上的女性失贞，因为按照这个逻辑，被强奸一次和被强奸很多次，并没有本质区别，反正她都是失贞了。 苏皮莉亚的自杀，是因为在权贵与司法勾结的体制下，尊严无法被捍卫的绝望，只有死，才能制止尊严继续被蹂躏。      与此同时，阿密特的强奸动机，也非常值得揣摩。 在罗汉和苏皮莉亚大婚之夜，他和混混瓦西姆进行了一段非常猥琐的对话，调侃两个盲人该怎么做爱，随后，他们还在罗汉夫妇回家的路上，对他们进行骚扰，嘲笑罗汉是个瞎子，居然还能有老婆。 可见，阿密特的内心相当歧视盲人，他会想到强奸苏皮莉亚，虽然有仗势欺人、贪图美色的成分在内，但更多的都是想要毁灭罗汉夫妇的生活，践踏他们的尊严，因为他觉得盲人没有资格享受爱情与婚姻。   一向重视尊严的罗汉，自然无法容忍这一切，妻子死后，面对警察的继续不作为，他决心复仇。 印度人的想象力和创意，在这场盲人复仇戏中，得到了充分的体现。 罗汉巧妙利用了平日生活的技能与智慧，依仗着捍卫尊严的巨大勇气与决心，策划了一场堪称精妙绝伦的复仇，借刀杀人、挑拨离间、埋设陷阱，玩的可溜了，一度被认为是软肋的眼盲，甚至还成为了罗汉有利工具，最终酣畅淋漓的惩戒了仇人，又逃脱了法律制裁，让人看来十分过瘾。   





  





  





 当所有人都认为罗汉作为一个生理上的弱者，必定会选择忍气吞声时，他用自己的行动告诉人们，为了捍卫尊严，他无所不能，印度电影论坛选择的片名，可谓是极其精准。 影片糅合了爱情、歌舞、动作等印度电影常见的元素，属于相当主流的娱乐片，但它内在传递的主题，是非常严肃的，宣扬了个人尊严的神圣不可侵犯。   与此同时，选择一个盲人作为主角来宣扬尊严，不仅仅是增加故事的戏剧张力，还揭示了尊严是人的基本权利，不论什么层面划分出的弱者，都不会因为自己的弱势，而失去尊严的享有权。 换言之，任何人的尊严，都具有同等的价值，并无一例外的不容践踏。      —————————————————————————————————————— 想看更多有关印度电影的评论，欢迎订阅公众平台“Indianmovie”。",76.0,9.0,16
1,1,26876252,无所不能,7ce7a56d7730ed4b410e417e59fea3f8,9c67548e8bb02352708ef02dc15ac5ab,1.0,2019-06-15 22:47:49,这电影过于辣鸡我甚至懒得点剧透警告。 本片最大的两个问题：其一、复仇部分的“完美犯罪”根本不完美，我原本以为会有什么高智商局，结果最终也不过是“将某人约出来然后杀掉”；其二、男主对妻子的爱情看上去根本就不对头，让人感觉他爱的并不是妻子，而是自己。 关于复仇的部分吧，其实问题也不算那么严峻。说到底，男主只是个普通人，我也不期待他像阿婆小说里的凶手一样设计出超级精巧复杂的局，然而他一开始跟警长那里放了大话说要犯下“完美犯罪”……那你既然没那个本事，干嘛要打草惊蛇啊？就直接开始复仇然后警长来调查的时候装傻不是更合理一些吗？现在可好，人家一开始就锁定你了，要不是这个片区的警察似乎都是智障，否则根本不可能轻松解脱。 复仇还有各种奇怪的bug，比如说议员破门打翻蜡烛导致爆炸，自己居然没连带着被炸死，这个爆炸简直逊到极点。 不过最要命的还是这部电影的情感内核之虚假。男主的动机都是为了给挚爱的妻子复仇——但又或许不是。妻子被强奸后夫妻走投无路，哑巴吃黄连有苦说不出，但电影的重点几乎放在了男主的痛苦上。男主无法从事自己的配音工作，男主因为感觉自己的无能无法安慰妻子，妻子被侵犯了但男主因为社会的黑暗也同样被侵犯了，甚至最后妻子的遗书都说自己自杀是不想让他继续受到伤害。 可是，拜托，妻子才是被强奸的那个人啊。她遭受了这样的伤害，反派为了毁灭证据还绑架她，把她关了一整天，随后她的证词不被采信，丈夫对自己态度疏离——但是我们几乎看不到她的视角。在她死之前的闪回里，她甚至多少开心地做着饭，还和邻居家的孩子有说有笑。我不是说强奸受害者一定就要哭天喊地蜷缩在床上，每个人都有应对创伤的方式（而被强奸毫无疑问会带来创伤，人被打了都会不开心，更别说这种方式的侵犯了），可是对比之下，女主受到的伤害毫无疑问被弱化了。 她最好的呈现自己痛苦的机会是和男主说他们应该分开的时候，男主没有反驳她的“我知道你觉得我已经和以前不同了”。然而之后她似乎又想通了，可是电影没有告诉我们她是怎么想通的，哪怕让悲伤的女主摸着男主送给她的那块表，想起甜蜜时光从而重拾对爱情的信心呢？但是她就是在遗书里告知他自己想通了。就算本片的重点是男主，反映一下女主的痛苦也能让整部片子的情感变得更加充沛有力。 可是我们只透过男人的眼睛来看这一切，我们只感受到男人的痛苦。 其实一开始我就确信男主也是一个反派角色。他只为了“能听见你的声音”而强行给女主买高跟鞋，尽管她明显穿着走路时歪歪扭扭；之后他又拒绝让女主使用盲杖，说是有自己牵着她的手就够了，然而到头来还是松开了她的手。这种把自己的意愿强加于人的行为和真正的浪漫差十万八千里。最终，连带着其他不算那么有问题的行为也让我感到膈应了：拉着女主跳舞、尽管她有表还给她再买一块（虽然她之前的那块表对她来说有着纪念意义）、甚至一开始女主表示不想结婚还非要表示自己想结婚什么的，放在别人身上不是什么大事，但放在这位男主身上就只让我看到自大和自私。 就是他的自大和自私，才让他没能对妻子的分手请求作出回应。就算再怎么对自己失望或者是不知道该如何回应，回一句“我爱你”或者“这不是你的错”也不是什么难事，只要你心里在意对方，就算再没有话讲也总归能传达些许心意。但是他没有。就算遗书里说女主知道他是爱自己的，但他当时的表现仍然可鄙，这是原则性问题。 遗书一事更让我匪夷所思。发现女主自杀之后，男主明显摸到了纸，但当时就没有想到要看，甚至让它掉在了床底。就算当时过于难过，这也可能是女主留下的最后话语（就算无法肯定是遗书），一时不想看也好歹收起来吧……你到底有没有在意对方啊？？？ 就连最后，复仇也只是为了让他，男主，得到心灵的平静而已。对此我只能翻白眼并且后悔买票进电影院。,42.0,14.0,20
2,2,26876252,无所不能,b4581065ffc340bd0ee01d093a40d7ce,5058f1af8388633f609cadb75a75dc9d,4.0,2019-06-08 14:17:02,当一个国家拍的电影可以公开对本国公权力系统进行反思，这本身就意味着该国已经进入了民主化运行的系统。无论是美剧，还是韩国、台湾的电影都是典型。电影，作为现代的视觉化传播工具，与古代定期在宗庙中举行的礼仪和日常民间的戏剧一样，本身即寓有着对民众行为训练的职能，借此使得一个社群组织既定的行为价值观念加强的目的。孔子所谓“施于有政，是亦为政”。如果古代的戏剧扮演忠臣孝子之道是维护着父家长的权力，那么在现代社会的印度电影中，还重演春秋复仇故事，那就绝不仅是唤醒公民原始的基于血性的正义观，其背后映射更重要的是，让民众反思政府的行政系统是否可信。无论是否可信，当这种思考在民众的心智中激活，就已然意味着现代民主政治的科普教育成功了。 影片的关键环节在于受到性侵后举证材料的缺失，而举证材料的缺失源于他们被囚禁与被抛进海水中丧失了关键的性侵证据采样。抛开官匪勾结，从证据而言，确实无能为力。换言之，故事切换一下，抛除勾结受贿的环节，夫妻两人因为各种原因自己没能保留证据，那么结果可能同样是不了了之。因为现代法律本身是依靠证据链，而非个体感情，进行法律判定的。 由此我们可以回想一下什么是法律，法律产生的环境是什么？ 在不负责任的法学家嘴里，他们可以把法律史勾勒的很长很久，恨不能从三皇五帝开始就产生了刑罚，就成为了法律。但实际上，古代的法律和现代的法律从根本上可以说毫无联系。基于证据为核心的法理审判，是现代社会的产物。而古代社会的法律，本身是宗教性的、族群的规则。而这正是我们理解故事的核心所在。我们可以把古代和现代的法律截然划分如下： 古代的法律，本身与宗教权威和固定化的社群生活联系。谁来秉持正义？是族长或宗教的首领，他所管辖的区域，是一个同姓或共同宗教信仰的小村落，村落与现代城市不同，他的人口极其有限，是一种熟人社会，族长和宗教法官的司法不是基于证据的判定，而是基于对每个人品性的熟悉以及原始的道德。如果影片的案例在传统的印度社会中，无论是印度教的祭司还是穆斯林社会的阿訇，这种行政和司法合二为一的管理者，会直接基于对被性侵夫妻和村寨内酗酒闹事青年的品性了解，进行判处，一个人的品性就是毋庸置疑的证据，古代司法文献中大量的各种“考诚观志、视声观色”就是其例，不再需要任何外在的现代司法证据链条，为了这个独立的小社群的延续，自身的宗教与司法权威以及绝对的行政权力，不会发生受贿情况，很快的这个案子的强奸犯会被乱石砸死之类的刑罚予以处理。  现代的法律，则是基于人口流动的产物。尽管如上所述，古代的法律看似合理，但请注意，他要求的是绝对小的血缘或宗教社群，他要求的是，人被限制流动拘束在这个自给自足，从粮食到理发师一应俱全的小社群内。在柏拉图的话语中，一个城邦之外的人，不是野兽就是天使。人，无法脱离城邦存在，脱离了城邦意味着没有保障。我们现在之所以能跨区域的流动、旅行、移居，是基于已经存在国家内普遍一致的审判法则、警察体系、监控系统、公共医院，各种公共的工作岗位。而古代，脱离本城邦外就意味着暴徒横行、为非作歹，无人庇护，无人救济，丧失土地，随时面临不确定的危险侵袭。所以，在古代社会中，城镇不是社会发达的象征，反而意味着流民和暴力所在。从印度来说，目前其实并非彻底脱离古代社会的秩序，除了德里、班加罗尔、加尔各答、孟买这几大城市以外，大量的地区仍然是一个小型的传统的宗教社会。所以电影中夫妻二人决定搬家，其实前半个小时近乎梦幻的印度刻画基本是不现实的，因为印度本身的社会规则还是社群规则，而未建立以上一套现代的保障随意人口流动的社会保障体系，人只有在自己的种族和宗教聚落中才能有安全感可言。 所以影片设定的场景就耐人寻味了，我们回忆一下男女二人，在影片中，女主被设定为没有任何亲属和家人的一个孤儿，而男主同样没有任何家属和亲人出场。最多只有一些街坊邻居，而在违法发生后，影片设定的环节是没有任何亲人予以援助，两人能依靠的只有他们认为应该合理运转的印度司法体系。而他们居住的环境，主要的人物既是印度教徒，但同时还有穆斯林生活在期间卖肉为生。既有现代的司法系统和公共警察，但是又基本处于一种混乱状态。甚至我们发现有意思的环节，当穆斯林的父亲被一个印度小子在清真寺的楼顶捅了一刀，也并没有发生宗教冲突，似乎完全没有穆斯林人为自己的这个兄弟来血债血偿，这就意味着这不仅故事的男女主，所有在这个区域生活的人，都是一种散沙和原子的状态。宗教已经成为一种纯粹的个人信仰，而不是作为社群保险保护的团体存在了。宗教社团的保护性失效，公正司法和现代政制未建立的时候，这就是故事中绝对混乱的时空设定。那么，个人能依靠的也只有执行私刑，那就没什么意外的了。 这就意味着影片所设定的，正是古代的社会组织中流散出来的个体向现代社会转型的过程。 而事实上，这种过渡的环境就是印度的现状，一小部分人既希望能成为现代社会的个体人，但印度社会又没有能建立其维护这些试图流入现代社会秩序的安全保障。所以，印度很难像中国一样，大量乡村的人流入到各个区域的中心城市进行工业化的生产，因为对他们而言，只有生活在原有的社群组织内部，自己才能有安全的保障。一旦离开原有的社群，正如我们都所知的所想象的，正如一个外地游客来到印度一般，那面临的就是随时会发生的抢劫、强奸、克扣工资、警察无力、司法无效的社会，任何人都会感到不安和恐惧，那我就不如继续在我的村落苟活着，至少安全能得到保障。 在本片中近乎戏剧化的表演者，反派被设定为立法委员、立法委员嚣张跋扈的弟弟、贪污受贿的警察系统。故事场景就围绕着一个近乎直白在中国历史中被演绎过无数次的官官相护纵容豪强的点展开。然而，就这么一个被古典戏剧演绎过无数次的官官相护，底层任侠的故事，却几乎从我们当代的视野中逐渐消失了，为什么？因为当现代政府以追求普遍化治理并伴随之建立普遍法后，就不需要塑造“复仇”的故事了，在中国，典型的反思公权力，并以“私刑”的方式完成报复，恐怕只有在贾樟柯的电影中，诸如《天注定》这类违禁片内才能看到。没有例外的是，那样的故事大多发生在山西这种县城，也就是类似与印度电影中既丧失村内同姓血亲保护，又缺乏公开司法的环境的十八线城镇环境中。 最终，我们要回应还需要私刑复仇吗？我想这个问题问的不是个人，应该是你所处的这个社会，他到底是哪种社会阶段，当他选择建立现代工业化体系和资本主义生产的时候，他有没有提供给人民相应的流动性安全保障，当他呼吁地方gdp指数提高希望向现代化国家迈进时，他有没有保障人民的医疗权力、教育权力、食品安全。生活城市中抚养幼童的生活环境。诚如，对大多数人而言，危险发生，退回旧秩序，退回旧有的宗教价值、宗族村落，怀念旧有的秩序、观念和社会保护体系，当然是他们所能想到的。但是走向现代化社会是必然的，我们的问题不是呼吁宗教来解决，不是希望再把儒家那一套靠中国哲学搞一搞复兴，我们能选择的，只有义无反顾的向现代治理迈进，出现问题，敢于反思我们秩序监管的漏洞，思考我们的体制是否在保障基本的权利时出现问题。而不是仅仅希望返回到古代的安全的洞穴中。 当然，如果当政者不再这种角度思考，那么民众显然也不会有我这么理性地剖析，他们看完电影所接收到的信息只有一条，那就是：私刑抗暴，天然正义。所谓让黑暗照亮黑暗。,85.0,5.0,10
3,3,26876252,无所不能,141855c10d1b3847dd8780c81ecfaab3,40687c8206d15373954d8b27c6724f62,4.0,2019-06-03 13:23:28,原本对该片没什么期待，看片名以为只是一部普通的美国动作片外加肌肉秀，可没想到是一部印度电影，而主角居然还是残疾人。影片开头是中国人非常有代入感的相亲场面，只不过相亲的是盲人，从陌生的抗拒到相识、相恋，一切都显得非常自然美好，相信有过相亲经历的小伙伴们肯定会对这些会心一笑，不过影片没有仅仅停留在这些表面，很快画风一转，女主角被强暴，警方不作为，女主自杀，男主开始复仇，真正的故事拉开序幕。 　　影片每隔一段时间就设置了一个小高潮，抗拒相亲→甜蜜相恋→盲人的不便→男主的天赋→女主被强暴→证据被毁灭→警方不作为→女主自杀→男主复仇，故事层层推进，每个环节丝丝相扣，时刻抓住观众的眼球，罗斯汉的表演非常出彩，很多细节也设置的相当巧妙，此外印度特色的歌舞和音乐植入也毫无违和感，反而有种让人眼睛一亮的感觉。 　　影片中有一个细节，就是那个司机用手在他们眼前来回晃，看看是不是盲人。这个情节很多电影都有，每个盲人看不见的原因或许不一样，但这种方式他们其实是能察觉到的，一般情况下盲人都能感觉到外面光线的变化，就像你闭上眼睛也可以感受到手电筒的照射，因此他们往往不需要借助任何工具走到一堵墙面前也会自动停下来，这并不是什么特殊能力。另外要提醒的是这个动作大家不要随意去做，因为这是对盲人的不尊重，除非你是做医学检测或事先作了说明并得到允许。 　　宝莱坞电影充分借鉴了好莱坞的编剧手法，将那一套流程融入到自己的电影体系中，而且还学的很好，相比中国大部分国产片还远做不到这点，各种不接地气的高富帅，各种生硬的恋爱，强行安排一方为另一方挡子弹……印度和中国有很多相似的地方，片中的故事甚至可以直接搬到中国，照样可以反映国内的社会现实，可为什么我们拍不出来呢？当然影片并非完美，从爱情故事转到复仇主题略显突兀，复仇的手段存在BUG，贪腐的警察依然逍遥法外……但瑕不掩瑜，该片依然是一部值得推荐的上乘佳作。,18.0,1.0,4
