,Unnamed: 0,电影id,电影名称,用户id,用户名,评分,评论日期,评论内容,有用数,没用数,回应数
23,23,26876252,无所不能,e2eabebd9c9bf1413a46029be61bb7d9,7a8f50d05a2864119add55f4fe57a503,3.0,2020-03-30 20:12:57,"复仇电影 《无所不能》是一部复仇类的影片。 什么叫复仇电影？ 就是反派会伤害甚至杀死主角身边重要的人或者其他东西，之后被主角复仇的故事。     因为属于先压抑后爆发的类型片，所以复仇电影一般被定义为爽片，就是能让观众看完以后有一种出了口气的感觉。 不过随着时代的发展，对比老牌的复仇电影如《我唾弃你的坟墓》等，如今不少复仇片或多或少都会在里面添加一些隐喻社会问题的剧情。     比如韩国电影《蚯蚓》《别哭妈妈》隐喻的是校园欺凌，上个月在天朝上映的《一个母亲的复仇》则是印度社会的女性地位等问题。     而《无所不能》，也是这么一类的复仇片。 老弱病“残” 社会的弱势群体，也就是通俗意义上的老弱病残里面，往往残疾人是最容易被大众忽略的。 没办法，单纯是“扶不扶”这个问题就足以让老人们频频得到社会的关注，更何况还有不少国家都出现人口老龄化严重的情况。 校园欺凌、女性被侵害的新闻在如今这个社会也是屡见不鲜。 病人们的话，医患关系的问题历来都是最热切的关注点。 只有残疾人，很少人会去关注他们，甚至社会上对这个群体的歧视也是屡见不鲜，而这种情况，在阶级观念非常强烈的印度社会更加常见。     《无所不能》的男女主角，就是双目失明的残疾人。 身体有缺陷的男女主角，虽然凭着自己的努力，也能找到工作并自力更生地活下去，然而他们对待生活的态度却并不一样。     女主角苏一直都因为自己是残疾人而自卑，而男主角罗汉则一直都坚持着自己的尊严，并且一直带领着苏，让她也慢慢走向自信的道路。     电影的前半段是很美好的，讲述两个盲人从认识到相恋，从自卑到自信，从“这辈子也就这样了”到“我想有一个家”，可以说对气氛的渲染相当好，这也与后来的不幸形成了强烈的对比。 盲人眼中的世界 罗汉与苏在一起不久之后，就被“权贵子弟”阿密特盯上。 阿密特之后趁机强暴了苏两次，并声称以后会经常来侵犯她，罗汉与苏去报案，但阿密特后台强硬，警察们早就收取了好处，结果不了了之。     之后苏上吊自杀，诉讼无门的罗汉决心要以自己的一切向阿密特等人复仇。     阿密特其实就是印度的“社会人”的缩影。 他有权有势有背景，因此天生就有一种强烈的优越感。 残疾人是否就不配享有正常人的权利？在这些阶级观念很强的人眼里答案是肯定的。 他们觉得，你残疾，就意味着你离正常人的标准线都还差一点，那么你自然就没有权利去享受正常人才能拥有的东西。     具体到本部电影，阿密特的态度就是：“连我们这种正常人都没能跟漂亮的女孩儿上床，你这瞎子又有什么资格了？” 当然，苏在他眼里也只是一个很漂亮随时可以侵犯的女人，因为她也只是个盲人，在阿密特眼里，苏这种“离正常人还差一线”的残疾人根本不配得到什么美好的生活，只配让成为他的发泄物品。     在不幸发生之后，苏选择了自杀，这也是可以预见到的---她没有其他路可走。 如果是认识罗汉之前那个自卑的苏，或许她就会逆来顺受，那个时候的她，自卑到不敢相亲，不敢结婚。     但在于罗汉在一起之后，她明白到其实根本无需为自己身体上的缺陷而烦恼，他们盲人也可以拥有正常人的生活，像普通人那样成家立室，他们也有自己的尊严。  在被侵犯之后，在警察不受理的情况下，面对阿密特“以后想搞就来搞你”的威胁，她为了维护自己的尊严，只能选择自杀。     至于男主角罗汉，在苏自杀之后决心向权贵们复仇，其实也是电影对现实的一种美好寄托。     因为现实里的印度社会，并没有罗汉这种“盲侠”。 大多数残疾人面对欺凌，要么只能苟且地活下去，要么只能选择以死明志。 毕竟印度的律师等高材生都认为“女性被强暴是她们的错”，连普通女性的权益都无法得到保障，更何况是残疾人呢？     盲侠 《无所不能》始终是一部爽片，因此对社会与残疾人关系的探讨也就到此为止，电影的第三幕是罗汉对权贵们的复仇。 虽说是爽片，但鉴于罗汉始终是个盲人，让他像普通复仇片那样拿着把刀一个一个把权贵们杀死是不靠谱的，所以电影里采用了一种别开生面的做法---挑拨离间。     因为影片设定罗汉的工作就是配音员，他具有模仿各种不同声音的技巧，并最终通过变声成功挑拨了权贵们之间的关系，先让他们自相残杀一波。         但或许是考虑到通过这种计策来复仇不够刺激，电影后面还是陷入了俗套的搏斗模式。 罗汉一个盲人跟四肢健全的大汉战斗又屡屡获胜，最后阿密特的哥哥谢拉尔已经用枪指着他的头却不下杀手非要继续肉搏，虽然观众们看得是很爽，但却也进一步增加了失实性。  





   不过影片最戏剧性的是结局，在中段腐败警察们以“盲人不能作为证人”为理由拒绝了罗汉与苏的报案，结局警察自以为找到了罗汉用电话离间权贵的线索，谁知道电话亭的亭主也是一个盲人。         虽然复仇戏段看的是很爽，但然而不禁让人深思。 让一个残疾人去“无所不能”，这对社会而言是多么的讽刺。 就以电影本身来说，倘若没有官官相结的勾当，能给罗汉与苏还一个公道，罗汉又何至于要让自己双手沾满鲜血？ 要知道他可是什么都看不见的盲人，他的复仇之路比正常人更加困难，这是把人逼到什么地步，他才会以残缺之躯去行险恶之事？           严格来说，因为影片后半段的失实感略微严重，因此《无所不能》并不能算是一部非常精良的电影。 但不管怎么说，这部影片还是可以一看的。",1.0,,0
24,24,26876252,无所不能,68fa5d36fa856fc0cb045643cb7b2147,bf17f4ab50fe9cb9e90ac041351d3946,4.0,2020-03-29 20:01:44,"这部电影，从细节中可以看得出导演是十分用心的。印度电影肯定缺不了歌舞片段。男女主角载歌载舞时，动作的编排设计上也充分体现出了盲人的特点。另外，男女主角的动作和表情，几乎都是大特写，这对演员的演技又是一大考验，中国很多小鲜肉演员是无法特写拍摄的，只能拍远景。

电影前半段：男女主角从相识到相恋，再加上印度歌舞的气氛烘托，导演把那种爱情的浪漫感觉，简直拍得有点甜死人，感觉自己仿佛也跟着一起恋爱了一样……电影如果到这里结束，就像美丽的童话一样，王子和公主从此幸福地生活在一起。",,,0
25,25,26876252,无所不能,0683b94f0fa915d988bebc3174bfc0c0,a34841181f657c08ec52fbbd0d19027e,4.0,2020-03-02 21:57:04,近年来印度很多关于爱情的影片评分都非常之高，如之前的《调音师》、《雨中的请求》等，在豆瓣都在评分8分以上。 而在这些电影中，反应印度女性地位和权益的电影也非常多，如《厕所英雄》、《一个母亲的复仇》《炙热》等。 今天要跟大家讨论的是一部盲人为爱情复仇的影片《无所不能》。 这些年，印度反映女性的影片中，都反复的指向一个观点：当法律和整个社会道德体系、舆论导向等都无法维护正义的时候？唯有以暴制暴，维护心中的正义。 1.影片故事梗概 首先来简单介绍下影片的主要内容：罗汉是个生活积极向上，温暖又聪慧的盲人，通过别人介绍，认识了另一位盲人女孩苏皮利亚，一起度过了一段浪漫美好的时光，并结为连理，得到家人和朋友的祝福，并为心爱的妻子买了一套房子，准备好好装修。 可是好景不长，这一天回家的路上他们遇见了以前经常欺负罗汉的两个混蛋，他们看到苏皮莉亚姣好的面容就起了坏心思，幸而罗汉抱紧妻子向邻居呼救，才使得妻子免遭调戏。可是坏人怎么可能罢休，他们趁着罗汉不在家，就偷偷潜入房间并对苏皮莉亚行不轨之事。 罗汉回家后，在卧室里听见妻子低微的呜咽声，连忙将捆绑妻子的布拉下来，才知道妻子遭遇了暴力强*，他们马上报警，可是警察说盲人无法指认，只能通过提取体内的残留物来指控犯人，在去医院的路途中，有辆车说是有警官的命令让他们换乘，这辆车并没有将两人带到医院，而是囚禁了他们，并在24小时候将他们仍到水里，洗去了身体上的残留物。 他们没有了证据，警察还污蔑说他们是骗子，这让罗汉和苏皮莉亚悲伤不已。可是事情还没有完，因为警察的包庇，犯罪分子更加的恶劣，苏皮莉亚再次遭受了侵犯，这一次苏皮莉亚感受到绝望，就此自杀。 就像第一次警察包庇犯罪者时，苏皮莉亚哭着说的那样：“我被侵犯之后，他们又用这样的方式侵犯了你。”罗汉的生活陷入一片绝望中。 这时犯罪者的哥哥来到家中，本以为是来道歉的，没想到他却说：他是市政人员，两个犯罪者是他保释的，而警察局那里也是他打的招呼。 又问罗汉：她如果自杀的话，为什么不再第一次被侵犯后自杀？为什么要等到第二次？ 这让罗汉感到愤怒，对犯罪者和包庇者。他走到警察局告诉警察：我会为自己报仇。 可是警察根本不信罗汉一个盲人能够报仇。 罗汉开始策划整个报仇计划，他利用自己的天赋技能：模仿声音，展开了报复行动。先是录音犯罪者的声音，利用犯罪者本身的矛盾，制造了他杀人的现场。 又利用犯罪者哥哥的声音约他出来，并设计吊死了他，之后一路凭着坚强的意志和聪明的谋略将犯罪者一一杀死，警察还没有任何证据。 2.高颜值演员+温情复仇故事 剧情与《一个母亲的复仇》何其相似，不过这一次是弱势群体盲人，再加上演员是印度著名的动作影星郝里尼克，罗斯汉的颜值在线，他拥有着迷人的微笑、强健的体魄，外加上剧情温暖又铁汉柔情，就使得整部影片加分不少。 前半部分的浪漫剧情，再加上后半部分的智慧复仇，观者在感受到快意恩仇后，又对主角们的温暖爱情所包围，发了糖不说，还让观者燃烧了一把，仇人被手刃更是让观者体验到正义永远在线。  而影片的最后，更是不泛柔情。完成妻子的愿望，将其骨灰撒入大海之中，背影萧瑟中又有一份洒脱的意境，有点像是武侠故事中江湖儿女的侠骨柔肠，整个复仇过程的荡气回肠。 3.电影中所体现的精神实质 这些年印度反应女性权益的电影都是这个类型，最终正义会战胜所有，也反应出印度文化中的因果论，印度社会的现状，整个社会对女性的抨击等。 女性被侵犯的问题，一直都是备受争议的。整个社会对于女性恶意，都是相似的，无论是否是女性的问题，最终都会有人将问题抛回给女性。 无论是被害者身体上精神上造成的伤害，还是对家人的伤害，都是严重的。可是在对犯罪者的制裁上又有诸多出于道德宽恕的考量，这一点永远是令人绝望的现实。 如果一个人犯罪，量刑标准会基于社会危害性和人身危险性。如果对于女性侵犯类的量刑过重，就会影响到人身危险，出于对人身危险的考量和预防必要性。 最怕的是犯罪者得不到应有的惩罚，而女性又基于社会舆论，不敢为自己伸张正义，这又助长了犯罪者再次犯罪。 而影片中犯罪者之所以敢再次犯罪，是由于法律对其的包庇，这种包庇助长了犯罪者的气焰，又使得被侵害者不堪其辱，对社会和生活绝望，而选择自杀死亡的方式决绝的与爱人告别，用死亡的方式维护自己的尊严不被继续践踏。 爱人的死亡让主角罗汉心死如灰，可是恶人却嚣张的来质问他，让他燃起熊熊的复仇火焰。既然更弱势的群体得不到更好的保护，更得不到正义的伸张，那么亲自手刃仇人，就是对正义最好的解释，也是对这场爱情最好的回馈，更是对自己尊严不容践踏的维护。 尊严是不容践踏的，在弱的弱者都拥有尊严，这是生而为人最基本的权利，而当尊严被践踏，幸福被抹杀，正义又不来的时候，化身复仇的使者，弱者也能够变身为无所不能的英雄。    S&lt;��Oq,1.0,,0
26,26,26876252,无所不能,c7aa4a71567ef8dcabee4b738fe5a16a,d51eae713c15d7f1ccf2a03ca0f5344d,4.0,2020-02-19 17:14:33,"（2019.06） 如果一个毫无背景的普通盲人，想要报复连警察都能收买的议长，他能怎么做？

这是一个很悲伤的故事，影片开头很甜蜜，两个盲人的相亲彼此都很欣赏，相识、相知、相恋。

尽管她说黑暗不能点亮黑暗，生活中负负不能得正。然而他的自信和人格魅力让她不由自主的走近，最终成为夫妻。
  可惜天不遂人愿，议长的弟弟垂涎女主的美貌，和兄弟一起侵犯了她。

俩人报警，鼓起勇气去医院检查取证。

被收买的警察让人将他们关押、随后又扔在海边。超过了案件发生24小时内的最佳取证时间。被海水浸泡冲刷后，犯罪证据消失了。

警察百般嘲讽、羞辱、污蔑他利用妻子进行敲诈诽谤，伤口上再捅刀的诛心之言，这种场景看着愤愤不已。
  
女主是一个很优秀也很坚强的人，经此磨难，她并未像传统的印度女性那样被打倒、低到尘埃里去。

她爱丈夫，甚至理解他在事后的情绪与沉默。如果没有第二场劫难，他们本该一起走过这场阴霾。

第二天男主还向之道歉，诉说当时的自责与痛楚，然而他只摸到了一具尸体……
  很沉重而令人心碎的故事起因，复仇路漫漫，何况一个看不见的盲人。电影中的很多细节，都是后面的重要呼应。

无数次的练习，他自己的声音天赋，内心坚定的信念，以及他对亡妻的深爱，支撑着他计划并实施完美犯罪。

其实细究，还是会有很多破绽和漏洞的。比如现场一定会遗留的指纹、毛发、DNA。比如他要去往的地方，肯定需要询问其他人或有人带他去……

但这也不影响影片的精彩。除了过程中的惊险、情节环环相扣的紧凑，更有男女主各自优秀的魅力令人折服。

起初以为和《调音师》很像，不过这是不同风格的片子。前者是目击凶杀案为了自保的被动迎战，后者是为爱复仇的主动谋划。",,,0
27,27,26876252,无所不能,4523604f513c9c3a8f9fee4f5b9218cf,99d61ec4eb4faa99f0d892c1bc1692ba,5.0,2020-02-05 20:14:08,"自从《三傻大闹宝莱坞》之后，印度片成了内地影院的常客。 像近年来上映的《小萝莉的猴神大叔》《摔跤吧爸爸》… 印度片就像开挂似的，一遍遍刷新内地观众对它们的印象。 还有快搜君最近挖到的这部宝藏片—— 《无所不能》 豆瓣评分：7.1  男主名叫 罗汉，是个盲人。  虽然眼睛看不见，但除了眼睛，哪里都比正常人好使。 听觉敏锐：看不见的人通常都有一双好耳朵，罗汉也不例外，他能通过耳朵，判断对方的位置，及周边大体状况。 嗅觉灵敏：即使对方不说话，他也能通过鼻子闻出他刚吃过什么，从而通过习惯辨认他是谁。 而且他还可以模仿多人声音，这也让他找到了一份配音工作。    虽然看不见，但他性格乐观积极，让他邂逅同样是盲人的苏。

苏美丽且独立，是个钢琴师，两人经介绍相谈甚欢。 印度电影少不了舞蹈，不过这盲人双人舞倒是头回见。 为了赢得苏的心，罗汉主动邀请，向来只弹琴的苏，半推半就的接受了。 罗汉热情四射，苏就像个提线娃娃，等着罗汉的接近指引。 





 两人感情逐渐升温，接下来便是谈恋爱，结婚，一段甜到糖尿病的爱情戏，羡慕的人直流口水。 但是这是一部“前面相爱有多甜，后面复仇就有多燃”的电影。  两人虽弥补了各自不完整的人生，但看不见依旧是不能避免的缺陷。 看到瞎子都能娶上漂亮媳妇，同小镇的阿密特心怀妒忌。  阿密特的出现让高甜的剧情转瞬即逝。 在罗汉出门上班后，一个人在家的苏被他和同伴侮辱了。 





 苏被封住口，绑在床上，罗汉回来后，只能不停地摸索，焦急地询问她怎么了。 





 然而两人报警后，警察对此事也坐视不管。 不仅如此，还把两人送上了车，说是送他们去医院，实际却是送去偏远的仓库。 被关24小时之后被丢进了海水，而这都是为了消灭证据。        罗汉带着苏又去报案，却被警察嘲笑戏谑了一通。 苏拦住愤怒的丈夫，无论如何要回家，不告了。 我被强奸了，但是他们也在侵犯你呢。 苏明白社会对他们的恶意，为了保护丈夫，她选择了忍气吞声。  罗汉沉浸在巨大的屈辱中，没有理会更需要安慰的苏。 即使苏主动提出离婚，他也没有理会。 





 然而当他再次回到家时，苏已经离他而去了… 





 一开始还觉得苏有点太过刚烈，后来才明白原来是罗汉不在家的这段时间，苏再次受到了阿密特的侮辱。  警察不会管，毫无还手之力的苏知道这事不会有结果，在绝望中的她选择自杀。 而且她的自杀也是为了不想让罗汉崩溃。        而阿密特之所以猖狂，是因为他背后有议员哥哥。 《无所不能》的复仇，剑指植根于印度社会的三方恶势力。 被金钱蒙蔽双眼的警察。 在接到罗汉报警后，警察接到了议员的电话。 每当有强奸案发生，总会有电话打进来，小警察一语道破印度强奸高发的本质。  被宗教蒙住了眼的印度男人。 影片中的印度男人很有意思，他们不懂得将心比心。 阿密特的损友，他可以和阿密特一起侮辱苏，却不允许自己妹妹被人欺负。 既是被害者也是害人者，男权也在侵蚀危害着这个社会。  还有被权力蒙了心的政府。 议员看着弟弟胡作非为，只是给他擦完屁股，随便斥责几句。 他还曾安慰罗汉：她的新婚之夜是你的，阿密特也没拿走什么。 言外之意，女人初夜过后，就一文不值了。    三方黑暗，无论哪一方都比罗汉个人强大，更何况他还是个瞎子。 但为了你，我就无所不能。  铺垫一半的剧情，终于在罗汉找警察宣战后，火力全开。 既然你们开启了游戏，那我就陪你们就玩下去… 





   有网友评论说：它是《调音师》和《一个母亲的复仇》结合体，超级燃。 确实如此，影片节奏分明，复仇酣畅淋漓，前文浪漫美好的诸多细节，都在后文的复仇体现出了价值。  “盲”是影片从头到尾的特点。 但影片把盲人分成了两拨，一边是眼盲的罗汉与苏，另一边是心盲的警察议员和更多人。 拿着昧心钱，当着睁眼瞎的警察，为了高官位，蒙骗民众的议员。 还有更多为了达到目的，选择间歇性心盲的普通人。 相反地，在腐败黑暗中，罗汉的心，却比谁都明亮透彻。  盲人对明眼人的完美复仇，在极大的讽刺后也应了那句话—— 比起眼盲，更可怕的是心盲。 





 PS：智能电视下载当贝影视，精彩电影一搜即看！",,,0
28,28,26876252,无所不能,b44b8d6ff59f8c7a3bbbf026a632c2ae,27b326a73b12d8146be87c526c77013d,,2020-01-21 00:07:55,没事蹭抖音，蹭到一部电影的剪辑版 ，剧情很有意思，一下子被吸引过去。讲的是一个盲人的老婆被人侵犯，警察被收买，求助无门绝望的妻子自杀，男主复仇的故事。 印度电影怎么都喜欢拍这种完美犯案的题材，总觉得很多人在逍遥法外。之前的《误杀瞒天记》现在的《无所不能》感觉有很多的共同之处。 都是被侵犯，犯罪的人都是权贵的亲戚，被欺负的人得不到该有的公道，只能靠自己的力量去反击，最后反击成功的故事。 这部电影最特别的地方，大概就是男女主都是盲人吧，一般情况下的盲人肯定没法活成他们这般乐观开朗独立自信，但毕竟是电影，所以一切都预先被可能了。 他们的世界原本是黑暗的，可遇到对方之后，彼此就成了对方生命里的光。 女主一开始是不想见罗汉的，但是不想辜负穆吉太太的一番好意，于是赴了罗汉的约，然后和罗汉表明了自己的立场，说自己不想结婚，一个人工作生活很好不需要依靠他人。而罗汉通过这番交谈，对女主一见钟情。 她说“两个负加起来怎么可能得正呢” 他说“一个人的自信 就是她的力量 你和我虽然都是盲人 但并不软弱 为什么你会害怕和我在一起” 她：“黑暗不能点亮黑暗啊 罗汉 ” 他:“对 但是结伴前行  能让黑暗看起来不那么让人害怕   对吗 ” 最后，他成功的用自己的真诚打动了她。 看着他们的笑容，压根就让人忘记了他们是盲人是事实，爱情是盲目的，他们的爱情却不。 有时候会很讨厌突然为了热闹而开始的唱跳，但是这里的舞蹈不知道是因为太短还是因为人设的原因，竟让我看的有种恰到好处的感觉。甚至觉得很美好，让人一度以为他们没有失明，让人很沉浸在这样的欢愉之中。 前面有多甜，后面就有多大的反转，剧情向来如此，虽然早就习惯，也还是很期待后面的走向。一个盲人要怎样翻身，反败为胜。 接下来，就开启了不好的开始，坏人一号在拜象神的时候看上了女主，在男主和女主走在街上的时候，叫来了坏人二号去围堵，女主喊来邻居才让他们走开了。 在男主去工作后，实施了坏事。 男主回来后，便报警，警察受理的时候，接到坏人一号的哥哥（某有钱的大佬）的电话，于是给坏人放水，男女主去医院取证的路上被抓去关了起来，后来以证据不足为由不予立案。 男主再闹着去医院的时候，女主明白了警察的意图，哭着说她想回家，带她回家。 就在风波刚平的时候，坏人一号二号居然再次作案，女主写下一封盲信就自杀了。 崩溃的男主知道警察的不作为之后，到警察局跟那个警察说，申请立案这样的傻事我不会再干了。 “我根本不会指望你们办案了。她也一样。我就是来跟你们说一声，你们警官哪怕之前帮过我们一下，我也不会采取行动的。但现在为了苏，我要采取行动了。” “我要回击，以眼还眼。” “到时候只要给他们验尸就可以了” “你们可以睁大眼盯着看但你们什么也看不见 你们可以伸长耳朵听 但你们什么也听不见 到那时你们想发声 恐怕也是有口难言” “最关键的是，你们会识破一切，但无法和任何人澄清真相。” 于是他真的一步一步将坏人二号一号以及一号的哥哥全部处理掉，过程虽然艰难，但好在都无大碍。 各种恰到好处的设计，以及最后取证的时候，所谓的目击证人也是一个盲人，让他所说的照常发生，让人不得不佩服这逻辑。 一切都结束之后，他终于让她的骨灰撒入了大海，也恢复了以往的平静。 看完之后，感觉一类电影都有一类电影的共同之处，未必能说出很多来，但感觉就在那了。 就像看了很多美剧之后，再看罗宾汉起源，就会有很多共通之处，不再有那种哇哦的惊奇。倘若没看过之前那些，这也算是很精彩的电影，但是看过之后，就会觉得很普通了。普通到不想再看打了好几小时也只是消灭了一个傀儡还要继续打傀儡的故事，现在的耐心只够我看他挑战终极boss了。。。。 嗯，今天的分享就先到这里。 这个电影别处看还是收费，老规矩，后台私聊给你资源。,,,0
