,Unnamed: 0,电影id,电影名称,用户id,用户名,评分,评论日期,评论内容,有用数,没用数,回应数
4,4,26876252,无所不能,99179c9826e0be46dd32fc978da6f3d3,e1e94a90c43b967be92c40685ac2bb49,4.0,2019-06-07 00:28:39,一部两年前的印度电影 一个独出心裁的盲人角度 一支剪得不算出彩的预告片 带着平淡的心情包场看完了这部《无所不能》 观末 我只想说一个字：爽！ 时间线就不多梳理了 再此主要罗列一下二刷发现的埋的梗和一些小细节的安排（图多慎入） 一、伏笔 烟雾 小男孩 自行车 片头的放雾者 片头修自行车的小男孩  片尾罗汉利用小男孩和放雾者打掩护逃离监管 不得不说 小男孩最后终于发挥了作用挽救了前两次造的孽…… 手表 苏的遗书 两个罪犯的死法  女主遭二次凌辱自杀后留下两块手表并留下遗愿 以同为上吊的方式伪造瓦西姆的死 瓦西姆被男主解决 在下葬时（对应“埋掉”）男主抛下手表   另一块手机被戴在阿密特手上 随后被赶来救人的哥哥点燃仓库 活活烧死   这几个镜头太帅了 忍不住多截几张 蜡烛 深井 安全绳 女主曾提过喜欢香槟蜡烛  男主用蜡烛当导火索等谢拉尔亲手烧死弟弟 施工现场的深井 解决掉了谢拉尔带来的助手（之前的图就没有截啦） 男主绑着安全绳与谢拉尔共同越下 男主松手 谢拉尔game over 电影的特点之一就是精辟 每一秒的存在都是有意义的 前文的每一个镜头都在未之后的复仇做铺垫 不拖泥带水又能给观众恍然大悟的感觉 在铺垫方面我找的都是一些显而易见的大手法 至于星座图啊印度文化什么的没有细抠也没这个水平 二、选角 男主是印度的天王级演员 女主模特出身 两人在诠释盲人空洞的眼神方面都把控得挺到位的 颜值演技都是杠杠的 讲真都是那种动的比静的好看百倍的类型 海报拍得也挺烂的 完全没有正片上档次… 吹爆罗尔的表情处理 废话不多说 看图      另外 男主甩盲棍这个镜头是真的百看不厌啊 动图就不接截了你们随意感受下这张（其实我没截好 lue）  【人设方面】 男主是一名配音演员 在黑暗的世界里 为了像正常人一样生活 盲人罗尔在听觉和声音方面都有着超乎常人的敏感 配音演员这个人设的创立为后来电话仿声复仇做了一个合乎情理的解释 这也是本片的创新之处hh 罗尔正在为动画片配音 【戏剧性的结局】电影的黑白照暗示了当时的年代 没有监控却又空口无凭的情况下 “目击证人”成了办案的标准 警长以没有证据的理由驳回了罗尔的申诉 而罗尔在同一个电话亭模仿多人的声音打电话 正是因为那里唯一的目击者也是一位盲人 当警长最后拿着男主的照片企图找“目击者”破案时 却得知他从未成为目击者的答案 升职的计划泡汤 罗尔的第四个选项“你知道一切 却什么都无法解释”得到了完美的诠释 盲人又如何？盲人的世界并不见得比光明的世界黑暗 负负亦可以得正 正如那句——完美的世界里 众生皆盲   【关于逻辑】虽说剧情的设计有许多可圈可点之处 但明显的逻辑漏洞还是有的 每一次通话都是有风险的 但所有的风险都被回避了：阿密特和瓦西姆的妹妹在屠夫赶来之前难道只会一味争执而对电话一点都不怀疑？谢拉尔一个大官为什么要一个屠夫打电话只是为了告诉他他的女儿在勾引那个花天酒地的弟弟？屠夫受伤住院后难道不是谈起电话一事吗？等等等等 相对较好的地方是 在有充分准备的废弃酒吧 即使也毫无例外发生了剧情的反转 但罗尔杀瓦西姆显得轻松很多 此后的仓库和新房 都是九死一生才换来的胜利 戏剧性是一个无可置否的原因 但男主的作为盲人用智慧和勇敢杀人四个 也正是对应了网友投票选出的《无所不能》这一片名 “我本无能无力 但我爱你 我愿意为了你无所不能 让你的每一个愿望得以实现 就是我的人生目标” 还有一个点 前期罗尔多次录音 我本以为是为了最后提供证据 又或者是赶贪污的警长下台 但录音带最后也没能发挥作用 不知道是不是暗示印度在社会建设方面还有很长的路要走呢？ 最后说一下 这几年国内引进的印度片口碑都挺爆的 印度电影在悬疑领域的成熟度已经高得吓人 总能在一个好点子上延伸出一个细节充沛 剧情饱满的好故事 从一瞬间的甜到令人窒息的虐 最后促成了拳拳到肉的燃 男主的每一次都是观影者的一次宣泄 对剧情 对社会 对不堪重负的生活 无比真实 却又无比遥远 四星力荐 这是一部对缜密性要求不太高的悬疑爱好者不容错过的好电影 值得二刷 罗尔坦然说出作案全过程   还有别的之后再补充。。,24.0,,7
5,5,26876252,无所不能,dbf4bbb1e53d81cd7316be97ae3ea55e,9ea98792f6fdd07c021303d252ecfc78,4.0,2019-06-10 03:06:47,不知道为什么豆瓣评分才7.1分，但是我真的觉得比调音师好看。 影片的开头罗汉和苏餐厅相识，她们都是两人盲人，却做了许多浪漫的事情： * 罗汉带着苏跳舞💃（很难想象盲人居然可以跳的这么好） * 罗汉给苏买了一双能够听的很清楚脚步的鞋 * 和苏在商场走失时能够想尽办法走到舞蹈中间对着麦克风说我在商场中央的舞台上等你。 * 买了一套房子🏠准备做婚房，说：“不要害怕苏，我现在的人生目标就是让自己强大起来” * 结婚那天，摆满苏最爱的香薰灯 * 模仿苏喜欢的明星给她打电话（男主是配音演员）  婚前的甜蜜生活却总是迎来坏人的嫉妒垂涎，命运的齿轮却像另一方向运转…苏被强暴两次，面对官匪勾结，不堪受辱，只能上吊自杀！ 为了爱与尊严，即使眼不能视物，依然无所不能。男主角罗尔聪明的选择了他的特长配音！利用伪声复仇，加上对环境敏感度（从罗尔带苏看房子计算步数确定电梯井的位置），对触觉敏锐性（坐三轮车司机故意找错钱💰，一摸便知），听觉敏锐性（回家路上被两个坏人跟踪，直接叫出名字让他们出来）。从复仇前的小细节可以看出罗尔的自强与智慧。  苏上吊自杀死后遗书和两块手表⌚️是放在一起的。后期复仇，在杀死第一个坏人瓦西姆时，就把它伪装成上吊自杀。葬礼时，他把一块手表埋葬下去。杀死第二个坏人阿密特时，把另外一块手表也给他带上。手表在复仇之路上也巧妙运用地极好。  两个强暴犯杀死之后，幕后大boss谢拉尔也是被从新房推下去伪装成自杀的。正如他妻子死时自杀未能立案，第一个凶手死时，警长却说：“每一个自杀的背后都有一个凶手。”这不是与最初她妻子死时警方的态度截然不同，那时警方仅仅把它当作自杀，拒不立案！竟然你们要当“瞎子”，那么我也只能让你们“变瞎”了！男主角复仇之路真的相当酷🆒了！  在罗尔决定复仇时曾经去找警长说的最后一句话：“这个游戏不会有连线环节的，警长。”就已经暗示了他要通过连线伪音来复仇！而当警长识破后，洋洋自得说：“我给你24小时，怎么不会有连线环节呢？哈哈。”而影片的最后警长去电话亭时，才发现，附近的人都是盲人，无法提供证明。又对应了罗尔复仇前跟警长说的：“你知道一切 却什么都无法解释。”得到了完美的诠释 。  警长虽然是一个戏份不多的角色，但是他这个人功利性还是很强的，还自作聪明。在得知罗尔的计划时，故意给了罗尔复仇的最后24h。警长的心理我分析如下： 1. 在强奸案发生后，任凭手下放了嫌疑犯。并且在女主要去做身体检查时，被关起来超过24h时，男女主角来警局寻求帮助。警长却不闻不问，明哲保身。可能他不坏，但是也绝对不会是一个好人！ 2. 在罗尔找他说明要复仇时，他却不以为意，说不定他还在暗自期许这个盲人能够干掉谢拉尔，毕竟他这个警官有点名不副实，很窝囊。他的下属根本就是谢拉尔的走狗。所以第一个凶手死后，他下属怀疑是盲人复仇，他一边帮其开脱说他只是一个盲人，不会有这样的能力的！却还偷偷找罗尔对话问是不是他干的！足以说明他在放纵罗尔的复仇。 3. 当罗尔的复仇手段被警长知道后，警长却给了他24h复仇时间，用来杀掉最后一个坏人谢拉尔。他一边搜集罗尔的犯罪证据，一边跟谢拉尔说：我知道谁是杀死你弟弟的凶手，给我钱吧。并且跟谢拉尔谈话时，说他自己可以不仅拿到钱。意思是他心里还渴望替换掉谢拉尔。明天24h一到，谢拉尔被干掉了，而且他又搜集到罗尔电话伪音复仇的证据可以让他加官晋爵。他已经喜上眉梢了！ 第二天警长知道了谢拉尔已死，得意洋洋去找罗尔说：“真是高明啊，罗尔！可惜罪犯犯案后都会留下痕迹。只有一个小时了。”遂拍下罗尔照片，打算去寻找目击证人。罗尔说了句：“你还记得第四个选项吗？”警长疑惑问什么？罗尔说你之后会懂的。  最后还是具有讽刺效果的，上述我已谈到，目击证人是盲人！  其实最后一幕罗尔在大海撒骨灰的时候，朋友在旁边问我，他是不是复仇完也要自杀去陪她妻子？我说不会的，因为她妻子最后的遗书上面写着：你要在这个世界好好活下去！  我愿为你，变得强大，无所不能！,13.0,2.0,0
6,6,26876252,无所不能,782254e69667966e3d831bef8f033468,99a1e06b7ce7afb7e4a388847c774679,4.0,2019-06-09 08:45:40,宝莱坞纯熟的艺术技巧，使得整部电影丝丝入扣、观赏性极高。情节设置上层层铺垫、环环相扣，不浪费任何一个细节，在伏笔利用上，堪称戏剧创作的典范。观众的预期，始终被编剧牢牢握于股掌。 两个盲人相爱相守，风景会是怎样？又会遭遇怎样的起伏？ 从一开始，就让人不由得猜想： 主角的爱情，困难将来自何方？相恋时两人商场走散，竟然没有发生自动扶梯的意外；新婚之夜新床脚下一堆蜡烛，竟然并没有意外引起火灾；尚未完工的新房施工现场，竟然也没发生失足。层层拨开，全片真正的危险，来自于权贵鸡犬觊觎女主美色，欺负两人目不能视。在女主第一次被侵犯、男主回家探寻妻子时，剧场观众就响起私语：自杀了。但是女主坚强地活着，报案、遇到绑架、发现警方被收买、投诉无门，但还会温柔地安慰丈夫，对生活充满希望。看到这里，不由得佩服印度这些植根于苦难的社会现实的艺术作品：要深度有深度、要复杂性有复杂性。 然而，女主遭遇第二次侵犯后，自杀了。 尽管男主不断地重复着“我的妻子很坚强”的台词，但是影片总算是顺了大部分观众的意愿——被侵犯的女人只有死路一条。尽管接下来的故事从爱情片一转而成悬疑动作片，精彩异常，但是故事更多的可能性已经被抹杀，接下来的讨论也不再触及社会苦难，而是一部纯商业片了。在这个转折点上，影片失去了灵魂。如果女主不自杀，就不能激发男主去复仇，演出一场与《未知死亡》类似的复仇故事。如果女主不自杀，编剧应该就不知道要怎样去发展情节线了。 印度苦难的社会现实滋养了繁荣的电影艺术，从《贫民窟的百万富翁》到《神秘巨星》。但这同样的现实苦难，也限制了编剧的艺术想象力。 被侵犯或被杀害的女性，在美国影视中会变成什么呢？猫女、CSI……各种被侵犯的女性角色，不记得有自杀的。 那么如果女主不死，电影还要怎么演？ 可不可以两个人一起复仇？可不可以死的是男主，女主来复仇？可不可以加入辅助角色？……各种可能性，在女主被安排自杀的那一刻，也都随之被抹去。虽然影片一路精彩好看，但也仅仅是精彩好看而已了。,5.0,2.0,5
7,7,26876252,无所不能,092111e9c29be74d7c322124a9abedfb,38f953e470fd4d83b2cfa96aed3a79f8,4.0,2019-06-08 01:16:40,印度电影果然没让我失望。观后感：1、男主真是扛打。2、印度破案手段太原始了，如果在我天朝，监控+指纹+血迹，哪还有破不了的案。3、女主在结婚前就没碰到过人渣，自己生活的也挺好的，结婚后咋就这么倒霉。4、编剧脑洞挺大，想法很特别，好看。5、电影节奏真好。6、总是联想到调音师是怎么回事。7、不该在晚上10点看，现在1点多睡不着。,5.0,,6
8,8,26876252,无所不能,f65169207d4def06bf62335a301f7980,14ba1f89ecac495a053ba733897c0443,3.0,2019-07-21 21:19:38,1，首先这部电影脉络很简单，就是盲人丈夫为妻子复仇的故事 2，这部电影一开始的画面我还以为在看《调音师》，你们印度就互抄起来了？ 3，说实话，前面都没有问题，盲人丈夫和妻子的相遇，爱情，美好，结婚，都很顺畅，到后面妻子被逼死，丈夫复仇的情节开始，就开始侮辱智商了。 4，怎么侮辱智商呢？待我一一细数。妻子被逼死之后，丈夫去警察局投诉无门，坏人已经和警察勾结了，OK，丈夫发现了，很流弊去到警察队长跟前跟他摊牌：你放心，你不帮我抓坏人，我就让这些东西一个一个死掉，然后你还没有证据，拿我没办法，吧啦吧啦… 5，看到这里我热血沸腾啊，高潮要来了！我兴奋啊，印度电影好流弊啊！复仇开始了！结果呢！我告诉你，期待越大，愤怒越大，你这是侮辱观众智商呢还是侮辱印度警察智商呢？丈夫通过模仿声音，把这些坏蛋一个一个勾引出来，然后弄死。这叫高智商？我还以为他设置什么精密的连环局让他们自相残杀呢 6，OK，可能导演你喜欢，没问题，我继续看。片中一场戏是丈夫把坏人骗到废弃舞台然后打死，最后吊起来。警察来了说自杀？舞台一大堆脚印没有看到？死者身上有指纹查不到，你们警察水准差没问题，死者身上还有互殴的伤痕总能看到吧？高智商复仇？我的天啊！ 7，OK，我以为这场戏是意外，后面没想到都是差不多的桥段，甚至最后跟大佬厮杀的时候，两个人身上一大堆血迹啊接触啊，这些活生生的证据都找不到，警察最后因为找不到目击证人，就真的拿盲人丈夫没办法了！对此我只能说666 8，然后一大堆人打了高分！好厉害啊，印度高智商复仇神作？对此我无话可说，我希望你们站起来！ 以上 6.2/10,8.0,,15
9,9,26876252,无所不能,2583baa1137d4a68dcaf0139f35a97dd,c225bcf1ae1a41b013427d5d816d8c9c,3.0,2019-06-11 11:08:06,"最近的院线电影真的是一个扑过一个。 6月第一周上映的影片，不仅国内没啥爆款，连国外的好莱坞大IP都扑掉了。 一水的6分片，制片方真会为观众省钱啊~ 然而要看口碑，这部唯一上7分的《无所不能》竟然是一堆烂片里的最高分。  7.1分虽然是矮子里面拔将军，可也绝对称不上是一部佳作。 一部结合了《一个母亲的复仇》和《调音师》的电影，汇集全爱情，犯罪，悬疑，复仇等爆点元素，打眼看上去相当热闹。 再加上这个，长得活像史泰龙、布拉德·皮特和迈克尔·杰克逊三合一的印度“天王级”男星，赫里尼克·罗斯汉。  还有美艳的亚米·高塔姆，再不济也是个浪漫养眼的爱情电影吧？  前半段还真是传统的印度爱情片套路。 男主罗汉是名盲人，但他乐观自信，还是名职业的配音演员。  在朋友的引荐下，罗汉结识了漂亮的盲人姑娘苏，并对她一“见”钟情。 很快，两人就确定了恋人关系，进入了婚姻的殿堂。  可是好景不长，突然有一天，当罗汉照常去公司上班后，两个流氓潜进了他们家中，轮流强暴了苏。 而等罗汉回到家，发现被绑在床上的苏时，一切都已经太迟了。 





 罗汉气愤的报了警，但收受了贿赂的警察，不仅没有理会他们，还派人绑架了二人，并将二人丢进海中，任其自生自灭。 当他们逃出来赶到警局时，强奸事件早已过去了30多个小时。罪犯留在苏体内的证据也早已被损毁殆尽。 没有了证据指认凶手的罗汉和苏，还被警察指责是报假案。 见到官匪如此勾结，罗汉和苏都沮丧极了。    回到家中的罗汉夫妇原本以为事情隐忍就会结束，但谁料逃过法律惩罚的两个流氓并没就此收手，反而很快再度潜入罗汉家，强奸了苏。 大流氓阿密特还告诉苏，只要自己高兴以后会经常来侵犯她。不堪折辱的苏终于无法忍受，便用一条白布结束了自己年轻的生命。    其实到这里，整个片子还没什么大问题，除了偶尔破坏节奏的“歌舞环节”，整体还算不错。 但条姐做梦也没想到，《无所不能》的后续剧情竟急转直下，又搞起了“高智商复仇”的卖点。 还记得《一个母亲的复仇》是怎么扑的吗？ 就是因为满是bug的剧情，根本爽不到看惯高智商对垒的国内观众啊。  先是大流氓阿密特的哥哥马特洛（议员），也就是绑架罗汉夫妇的幕后黑手，直接跑到男主家中，一通嘚瑟自家弟弟是如何侮辱他的妻子，自己又是如何神通广大的安排策划，为弟弟洗清嫌疑。 并威胁罗汉不要试图找媒体曝光，因为自己有权有势，啥都搞得定。 拜托，你可是个议员啊，这种幕后大boss竟然没有一点沉稳劲，逮住机会就各种挑衅，不是自己找死吗？ 这下罗汉毫不费力的就得知的三个需要复仇的对象：大流氓阿密特，小流氓瓦西姆，议员马特洛。    对司法极度失望的罗汉，随即开启了“高能”的复仇模式。 精通声音模仿的罗汉，首先录下三个复仇目标的声音，并进行模仿，直到完美复制出他们的音色。 然后模仿议员的声音，给警局内线副局长打电话，要求副局长找理由监禁瓦西姆三天。 不要问罗汉是怎么知道副局长就是议员内线的，片子里没说，条姐也不知道啊。 当然也不要问副局长接到陌生号码来电，为什么问都不问缘由，直接听从电话里的“议员”吩咐照办，一点警觉性都没有。 也许配角傻到一定程度，才能彰显出主角的“智慧之光”吧。 接下来罗汉又模仿阿密特的声音，打电话调戏瓦西姆的妹妹。 





 瓦西姆的父亲怒不可遏的来找阿密特理论，不料扭打之间竟被阿密特刺伤。 罗汉一手挑拨离间的好把戏，将众人玩弄于股掌之间。 





 此时，出狱的瓦西姆接到了“阿密特”的电话，试图解释两人之间的误会。 瓦西姆赴约，可不料来与他见面的却是罗汉。 在黑暗中，能听音辨位的罗汉，轻而易举的干掉了瓦西姆，让他如苏一般，吊死在空中。  接下来好戏来了，警察到场，指纹和现场物证通通不采集，只盯着一条罗汉留下栽赃阿密特的手帕不放，直接把远在另一个城市的阿密特定为嫌疑人。 真心为这帮警察的智商捉急啊，大概在编剧眼里，男主的主角光环大概能直接蒙蔽反派的心灵，不利于男主的证据通通看不到。 这还不如让主角光环，直接感化反派投案自首来的痛快。  第一个目标就这么轻而易举的干掉了，接下来是大流氓阿密特。 这次罗汉模仿议员的声音，打电话约出了阿密特。 二人一见面就大打出手，但这次没那么容易，因为在光线明亮的环境下，罗汉根本不是阿密特的对手。 可编剧依旧没有放弃罗汉，直接让罗汉嗅出对方的脚臭，判断出位置，一击爆头。 是的，你没看错，就是这么神奇，脚臭成了反派的最大弱点。 哈哈，看着编剧这么辛苦的逗笑观众，我都不忍心吐槽他了。 





 然而设计干掉阿密特后，这次终于轮到议员了。而罗汉又开挂了。 还记得黑人中那幕躲子弹的情节吗？暴帅有没有，但那是科幻片啊喂。 可这次我们的盲人罗汉，仅凭借听声辨位，竟然也躲过了子弹，神奇的干掉了所有人，还能全身而退。 只能说这主角光环真的太强大了。正常人都难以完成的计划对于盲人来说，简直不是事。  虽然影片的节奏相对传统商业片来说，完成度还是在及格线以上的。 但由于观众其实对于高智商复仇片的需求，说到底还是希望得到更强的爽感和智商上的碾压。 好的商业影片总能时刻牵动观众的情绪，让观众毫不费力的跟着剧情走。 可满是bug的剧情却会伤害掉观影过程中的流畅爽感，一旦出现太过弱智的bug，观众总会不由自主的去挑错，并在心里早已吐槽了上万遍。 使得一个本来轻松的观影体验也会充满负担。",7.0,1.0,0
10,10,26876252,无所不能,94f2cfcc29776d1a2f71b492ff7eacd6,f7acf3faa7e2f75e5c32c9b7ba540729,,2021-11-27 21:16:31,"以前对印度电影的第一映像就是，一言不合就尬舞，可能出于文化的不同，看着看着确实有点出戏了。
比较熟悉的也就只有印度国宝级的演员阿米尔汗了，好几部电影都十分精彩而且很有深度，不再是那种尴尬的歌舞片了，说实话那种真的欣赏不来。
看完这部《无所不能》以后，虽然也有尬舞的桥段，但对印度阿三，不对…应该是印度电影有了一个新的认识。对国人而言一提起印度就是，强奸，脏乱差，素质低下，杂技阅兵，航母开裂……各种贬义的标签接踵而至。当我们还在沾沾自喜大天朝国富明强，嘲笑别人的时候，却忽略了一个重要的事实，社会在不停的发展，人也都是在不停的改善和进步的。
而我们呐！电影越来越商业化了，比的都是卖座率，比的都是票房，，这部卖了多少钱，那部又赚了又几个亿。现在真正有意义的片子又几部呢？还没老电影好看，感觉都是大佬们圈钱的工具罢了。当我们还沉浸在仙魔的侠骨柔情，欧巴的绝世美颜，你侬我侬的言情剧的时候，别人都已经又上一个高度了。
不过话说回来，这样的故事，在大天朝拍出来如果不改结局绝是对过不了审核的，坏人是该死，就算是好人为了报仇杀人，但杀了人就是犯了法，就要得到制裁，你敢公然藐视法律吗？谁敢呀！
就像《少年的你》里面一样，该死的人死了，锅也有人背了，这样的结局就挺好了！但非得要整出一个“郑义”来，让人心里堵得慌！到底啥才算是正义，穷人的“伙伴”，还是权势的“工具”？不过法律也有失误的时候嘛！前几天不是一直报道那个坐了十几年冤狱的学霸吗？十五年的青春啊！又岂是区区金钱能换得回来的。
有些人眼睛瞎了，但心如明镜；有些人睁着眼睛，却是个睁眼瞎。本片以弱势群体盲人的“第一视角”切入讽刺的太到位了，又以“强奸”这个对印度来说很敏感的主题为临界点，把剧情推向了高潮，深刻的揭示了政府和警察的腐朽，还有弱势群体的无奈。导演也是有颗爱国的心啦！鲁迅说过“医不救国”大概也就是这个道理了。
这世间哪有什么无所不能，无所不能还不都是被逼出来的，就像罗汉在妻子自杀后，找警察老大面谈时说的那样，“我根本不指望你们这些人了，苏也不指望，要是你的制度能帮到我们一点点的话，我本可以不做什么事了，但现在我得做了。”",,,0
