,Unnamed: 0,电影id,电影名称,用户id,用户名,评分,评论日期,评论内容,有用数,没用数,回应数
23,23,26892281,青年警察,a61bb2d2fbeee2b9c5b12a629959c5d5,46f5a2332851e5022f433e32ebf26682,3.0,2020-06-10 14:13:00,这个电影从去年我就很想看了，还缓存在了手机里，但是一直也没静下心好好看完，每次都是看了开头5分钟就关掉了，后来一度因为手机内存空间不足删掉了，昨天终于把这部电影看完了，当然，也是用了很长时间才看完，我现在真的是耐不住性子，看个电影也要玩玩手机，做做面膜，这个是要改的 朴叙俊和姜河那都还算是我很喜欢的演员，在朴褶子还没有非常火的那时候就很喜欢他了，韩国的新生代的演员们演技也都很过关的，啥时候我国的年轻演员们也可以把演技提升一下，而不是注重撕番位啥的，哎、、、、 其实电影的bug还是挺多的： 1.很多时候都可以报警，为啥不报警或者不给老师打电话呢？就靠两个人吗？ 2.一群打手，还是专门的打手，拿了棒球棍什么的打不过这两个人吗？ 3.如果人家想要取你的器官怎么可能吊着你？估计醒来的时候器官就已经不见了吧？ 但是忽略了这些bug的话单是看想表达的意思，以及演员的演技的话其实电影还算是不错的吧 1.孤儿、离家出走的这些孩子们是在社会中比较被忽视的团体，他们失踪了即便报警也不会太被重视，也太难去查找了，其实这个问题我国也同样存在，希望电影拍出来可以有人去看到这个问题，我昨天刚在微博看了我国鞍山一位体育老师柏剑，他收留了120位孩子，他们有问题儿童、有孤儿、还有未婚生育被遗弃的、还有单亲的，这些孩子们原来有的就只会打架、或者思想很偏激、很孤僻，但是因为有这样的一位好人，所以改变了他们的人生，我真的觉得看的非常的感动，这些群体都是不太常被关注到的 2.在验收成果的时候，同学们为了在1小时之内达标看到了摔倒的同学都不搀扶，美杜莎喊出来这句‘警察是市民发生危险的时候第一个冲上去的人，你们竟然连同学都忽略，还怎么保护市民’的时候真的是帅炸了，现在很多学校的教育大概是太爱比较了，所以也让很多学生们变得越来越自私 3.在最后两位学员救了少女们却还要被讨论是不是应该退学的时候，教授又说了这句“警察是在市民发生危险的时候第一个冲上去的人”，是啊，警察，就是需要热血不是吗，即便还没有毕业不是真正的警察，只是警察学校的学生，但是明知道市民有危险还无动于衷那不是更可怕吗？这样毕业的学生以后会是好警察吗？ 4.拐卖人口以后取卵子这个真的是我被震撼到了，原来还有这么可怕的产业链的，好好活着真的是要感恩啊 5.成东日饰演的教授和朴河宣饰演的教官，我都很喜欢，尤其是教授，从原来的重案组警察到警察学校的教授，不知道他还是否热血呢？ 最后，真的也很希望我国可以多拍一些热血的、阳刚的、职场的、专业的剧，我国的电影和电视剧真的质量差的太多了，投资的倒是比人家多不少，但是很多电影拍出来就真的是给流量们拍着玩儿的吧，我希望演戏都真挚些啊，说到底，我国的明星们钱真的太好赚了，韩国的体制问题，他们不得不磨炼演技，毕竟没了演戏、没有票房是真的说换你就换你的，韩国的放送局最大，编剧也有绝对的话语权，不像我国，带资进组的想加戏就加戏 一部电影，延伸出来的废话似乎太多了，但是每每看到韩国的电影都会深深的感慨，我们国家，怎么就拍不出这种电影或电视剧呢，那些披着行业剧的外皮胡乱拍的简直就是资源浪费,,,0
24,24,26892281,青年警察,55e3d80e4829b71fc4bac8b6a427d9bc,524145c28f697ebe0d828ea7591a2865,4.0,2020-06-04 22:45:43,"朴基俊（朴叙俊饰）和姜熙烈（姜河那饰）是两名警校的在读学生，外出时意外目睹了一场绑架案，在不断深入调查中发现了这是一伙通过绑架离家出走的女孩，贩卖她们的卵子而获利的犯罪团伙。在这一过程中，朴基俊和姜熙烈也想尽一切办法展开营救。

在电影里，有很多让人有感而发的瞬间。

梦想，是必须的吗
在夜店里，被朴基俊搭讪的女人知道他毕业后将成为警察之后，笑着反问道：“干嘛做没钱途的职业”。这句十分平常且现实的话是否击中了你。
朴基俊和姜熙烈都不是梦想成为警察而就读警校的，他们只是被命运推着向前就顺理成章地接受了安排，不同于身边出身警察世家的同学一样对这份职业满怀热情。但他们也很好的给对未来充满迷茫的人们做了示范：无论当下所处的环境如何，认真完成好眼前的学习与工作。

在与犯罪团伙的缠斗中，朴基俊和姜熙烈发现老师们在课堂上教授的知识都是很实用的，例如失踪案件的追查方法、格斗防身术等。

说实话，一开始看这类韩国电影单纯是为了打发时间，看多几部就能发现这类型的韩国电影其实已经有一套比较成熟的制作体系。没有大牌演员主演，没有巨额投资，也称不上是大制作，但总体来说剧情完整，贴合社会现实，有笑点、有泪点，演员演技也自然不出戏，总体观感不错。也有观众吐槽剧情太多bug，主角光环太大。就个人而言，这都不影响我喜欢这部电影。",,,0
25,25,26892281,青年警察,0793385a3d1faba57c0b40f60019eabd,4ecb62ba94003fce1c01432fbfdb42ec,5.0,2020-05-17 09:48:26,这周末的观影名额给了《青年警察》。 这部电影放在电脑上有段时间了。当时韩剧《山茶花开时》热播，主角姜河那憨憨的样子很受欢迎，于是吃到了这部电影的安利。  韩国的警匪片、剧情片看过很多，不少都反映了社会现实的腌臜一面，这部电影也不例外。 两个主角是新入警校的热血青年，满怀对警察这份职业的敬意、憧憬和向往。一次外出的时候，偶然发现了一起犯罪事件，一群黑社会绑架了离家出走的年轻女孩，非法抽取卵子谋取利益。两青年当即选择报警，但刚好警方出动了全部力量去搜寻大佬走丢的孙子，没有空闲理会。两人决定独自行动，找到了匪徒的老巢，因寡不敌众被抓起来拷打。当夜两人挣脱再次报警，警员却坚持走流程并把两人扣押起来。无奈两人请来了警校的教授帮忙，却被教授要求忘记此事好好学习。幸好两人坚持理想，决心拯救不幸的女孩们，经过一番苦练和装备后，终于解救成功，还顺利通过了校方的惩罚。       故事略显俗套，两人受挫后奋发努力的场景，在各种作品中见过无数次了；但观影的时候，仍然热血不已。电影中，也明显黑了中国朝鲜族人，塑造成无恶不作、无法无天的黑恶形象，看的不太舒服。     总的来说，怎么讲呢。 一部部韩国电影勇于揭露社会的黑暗面，抨击媚上欺下的政府，描画贫富阶层的鸿沟，反映底层人民的苦难，等等，表现出来的韩国电影人的社会责任感、文艺作品的良心，让人很受触动，也推动了社会的进步，甚至像《熔炉》、《素媛》这样的电影，还改变了法律，忍不住为他们拍手叫好。   但韩国社会好像有巨大的遗忘性，又好像有根深蒂固、无法改变的现实，电影中批评的故事一次次在现实中接连上演，目不暇接，眼花缭乱，分不清哪是现实哪是电影，心生失落，又感叹不已。好像拍再多电影，再怎么揭露，再怎么批判也不能改变现状。最近的N号房事件又是一例，据说又要拍成电影了。   反观自身，我们好像连这种电影都很少，我们又怎么好意思要求更多呢。 电影或许只是一种艺术吧。,1.0,,0
26,26,26892281,青年警察,3dff13329c587e82e7f970c0801b4639,b0d71a2c988c38631e6b599f4bbfd17b,,2020-04-24 20:29:43,就个人而言，一部电影好看与否最重要的还是要情节抓人，节奏紧凑，表演真实，情绪到位，逻辑能严丝合缝，再能引人反思，那就是最好了。也看过不少韩国经典犯罪片，不管是电影还是电视剧，基本都能满足以上我的观影需求。但唯一不太妙的就是会让人唏嘘许久，心口堵上好长时间缓不过来，真想说自找的。还好，《青年警察》不是这样，虽然它也不遗余力地展现了让人哑然失笑又带着根深蒂固阶层印记的韩国警察体系，但更多的是让我看到了在最初的时候，那份惩奸除恶打击罪犯的热血愿景。 朴叙俊和姜河那，一个自信又开朗、并不因为自己是单亲妈妈养大就自卑的大胃王，一个木讷严谨家境优渥又有严重洁癖的优质学霸。最开始两人的互动特别有意思，轻松又搞笑。剧情和台词上都精心设计和铺陈了不少交代人物性格特点的细节，这不可不说是韩国影视剧的强项。而两个人的表演也是细致入微，表情细节把握得很好，代入感很强，想说都是演过霸总的人，耍宝装怂转换得就是那么自然，一点也不串。 后来故事开始画风一转，切入正题。本来想要撩妹纸，没想到眼睁睁看着妹纸被敲晕绑进车里。于是开始一连串的奔走营救。这里暂且不说逻辑，单看故事编排和主题呈现亦是可食用的。 本来二人各自报考警校都是别有想法，朴叙俊是因为警校免费，姜河那是因为不想循规蹈矩，想要突破一下。说到底，都是不知道为什么要当警察。这个伏笔一开始就埋好了。后来在拼命营救人质的过程中，逐渐认清自我。总的来说，是合情合理的。,3.0,,0
27,27,26892281,青年警察,b03737c331b4294204e3b25efdf09a58,423a2ace9b1e747146305116649368dd,5.0,2020-04-05 01:48:13,我已经很久没有看过这么让人热血沸腾的电影了 最初我只觉着电影终归是电影 现实哪会存在可以用轰轰烈烈来描述的成年人友谊 现实说 没有永远的朋友 只有永远的利益 我会怀着一颗赤诚的心去交朋友 与此同时也不乏防范之心 是的 我们之中的大多数人未老先衰 我也是这样 我欣赏这部电影 首先是它具有大多数韩国电影共同的优点 真实 它敢于揭露社会丑陋的一面 ql机关责任的缺失 zf的不作为 但同时又不单纯只是为了批判 青年警察用了更大的篇幅表明一个观点 正义也许会迟到 但绝不会缺席 其次 最震撼到我的是它对人生价值的敬畏 相比同学的那种生来环境优越 从小拥有远大志向并有能力实现的境况 我们大多数人和黄基俊一样 为了活下去 为了更好地生活而被迫作选择 被现实推着前行  黄基俊在考试中写下的“调查的三种方法：热情，执着，真心” 正是我一直不足的 对人生价值的认知和应试教育从未教过的正确答案 最后我想说 尽管影片有很多引人争议的话题 你所看到的才是你内心真实的影像 很爱这部电影 希望热血的影片一直存在 希望我们都不要未老先衰 心累疲惫,1.0,,0
28,28,26892281,青年警察,73570025246a046550aa2353fdd550c2,7bf4ef71f93f9909dbed98d7c64ae391,,2020-03-26 11:07:21,刚看完，就来写评论了，故事内容没有什么太出彩的，无论是在学校学习，还是办案过程中都没有什么太过出彩的片段，整个影片都以一种搞笑的方式呈现，影片有多长次提到俩位警察学校的学生，寻求警察帮助办案未果，对于这种敢讽刺警察的内部管理机制和办事效率，确实值得表扬，影片中讲到的犯罪地点是华人比较多的地方，我想这应该也是一部分该囯人对于华人的普遍认知，但无论出于什么原因设定的，我想这应该不是导演以及创作人员的创作初衷吧，如果是的话，那就格局太小了! 青年警察 (2017)7.52017 / 韩国 / 喜剧 动作 犯罪 / 金周焕 / 朴叙俊 姜河那,,1.0,0
29,29,26892281,青年警察,752bf62d3759036a54127dbd1f85d388,413f0b018a3254cc8b26fd1060912c67,5.0,2020-03-11 21:32:04,"宰烈和基俊坐在小饭馆里开始讨论，我们选择警察这个职业是对的吗。
一个因为家里穷一个因为觉得酷，都不是因为像同期那样热爱警察事业向往成为一名警察，于是怀疑并且迷茫了起来。
怎么说呢，让我很不是滋味的是，这个情节对我来说：感同身受。
我也不是出于热爱医学事业也从未有过什么良医梦想而突然“被选择”了从医学习，同样也平平淡淡的在医学院过了两年了。 往后继续看。在他们怀疑自己怀疑初衷开始动摇之后，在看到犯罪事件时几乎出于本能的不顾安危去救一个陌生女孩，拼尽全力去救。两个铁憨憨在这个过程中，也是在寻找结果，寻找自己要做警察的理由——为了社会秩序和公正，是杨教授教了他们两年的道理：在市民遇到困难时，警察要第一时间挺身而出。 这里感触很深，也许很多事情开始的时候都稀里糊涂，像我突然被家人推着成了一名医学生，但当危机来临，警察、医生，我们这样深沉的被需要着的职业，是可以毫不犹豫站出来的，当我们被需要，这就是我们当初选择的理由。",2.0,,3
30,30,26892281,青年警察,4b5f9a77b789456d272697fc18f2cb39,a25ce144a2d07d0dc3319bf4d9033ccd,,2020-03-02 20:16:52,等你长大以后， 你会发现很多事情并没有那么简单， 你想做的你却做不到， 正义的事情也会遭到批驳， 日夜遭受洗刷的心灵， 会让人变得麻木， “算了，反正我也做不到”， 可我们仍是热血的青年， 我们或许会被许许多多的东西束缚， 但我们可以去争取， 去打破那藩篱， 因为总有正义的人在， 青年警察，愿你永远身着蓝装。,,,2
31,31,26892281,青年警察,cddcf46ad7c8832240810d9572a8fff9,7ff3b72661b91774ef5f6490ced635b6,5.0,2020-02-27 01:52:35,从DY被安利的一部电影，第一次生出了想为这部电影写点什么的冲动，电影的主线很简单，可能跟个人原因有关电影的开头到结尾都让我有一种主人公的感觉，而且这部电影是属于看了开头就能猜到结尾的电影，那五分的原因在哪里？我想更多的是给了它的细节以及前后呼应的放映顺序，如没有一开始的互帮互助就没有最后点题的那句话我们教了他们两年，他们学的很好。很直白的认为，一开始背着下山的思想就是为了后面结尾做铺垫，还有女教官后面出现的援手，也证实了这一点，当然如果这部电影换个结局可能就对于我来说没那么出彩了，因为最厉害的就在于被援助的女生后面找回来了，就有一种他们通过自己的方式完成了去酒吧的梦，细节太多了，不一一列举了，真心的推荐这部电影，感同身受，所以炙热。,,,0
32,32,26892281,青年警察,6210445eabf20f3cc03e3fea44c473ce,54df4bc38294528e48d78c78c5be9220,4.0,2020-02-03 13:55:51,就像杨教授说的“我真的很羡慕他们，毕竟我们曾经也像他们一样热血”  年轻的时候 我们的热情总是被形形色色的制度框架所束缚 慢慢地 我们适应了这个社会的生存法则  可是 那些曾经的热情 执着 真心 才是正义所需 而不是这些死板的步骤手续  虽然影片有部分夸张 但是我们依然为正义 热血沸腾 愿我们 永远年轻 永远热泪盈眶❤️,2.0,,0
33,33,26892281,青年警察,0dab0c173647cebaec46ca247c98ab00,f8a2e958b36f916ac155c89bc455bb42,,2020-01-28 23:27:42,我觉得这算是一部有意义的带点无厘头喜剧色彩的电影。 两个年轻人又憨又帅，莽撞中充满了责任感，有这样的青年人，未来才有希望。 我觉得比较好的地方 配角医生的出场，哇靠，忍不住想说脏话，真的是谁能想到呢，看起来那么儒雅，结果背地里做这么恶心的事，也是电影特意刻画出来的地方。 还有其他一些细节，比如女警察端着饭看监控；派出所那个小警察在车上听到他们交谈知道女学生的事明显出现了愧疚害怕的表情 算是部还不错的片子，虽然有教育意义，但是并不沉重，值得一看。,,,0
34,34,26892281,青年警察,8379511ad08c56b7f627b126b6a51c1e,9bfd4d38083a3790adae8b4ea436e958,4.0,2020-01-25 22:03:56,自己的个人观点，望少量批评！ 刚刚看完进入无限回味，两个青年演员为主线进行描述，展开一系列关于非法取卵子的犯罪事件并最后将其成功抓获。 剧中的bug很多，对于剧本的编写也存在小小的问题，整体突出的主题： 1.热情，真心，执着和教科书也就是规则方面的冲突 2.都是身为警校学生的两个人，却是不同的处事和方法看似不同却同样怀着一颗真挚的想要救人的心 3.初出茅庐和久居官场的强烈对比，保持真心还是听从安排，这是我们在成长过程必须经历也必须选择的事，可能也不需要选择，有一句话说的好：愿你走出半生，归来仍是少年。当时不太懂，但是现在可能多了一些思考，圆滑和棱角在两者不断变化时也是我们成长的过程。 4.向现实屈服和对现实命运抗争，在两人已经有物证人证线索时，老师现实的告诉他们，警方着手时间长，难度大，并将他们带回了警校，在看似放弃的同时又是另一个新的开始，他们不断增强自己的体魄增强自己的装置和设备，等时机到时却迎来了一大波敌人，他们没有畏惧不断向前，在各自受伤时不断为对方着想，面对罪犯不放弃，最后靠一己之力获得了成功。 5.对当代韩国警察的嘲讽，在危难面前的圆滑态度 可能整体不太好，但是我的热血被带动出来，在自己的人生中不要怕自己最后的遭遇，世界好像就是不公的，但是世界的好坏不论自己，守住自己最后的公正就守住我自身的底线，让自己可以无愧于心，无愧于自己处在不公的环境和世界。 “警察是市民遇到危险时，最先伸出手的人,,,0
35,35,26892281,青年警察,07bee3ed475c7a67db94bb9778f7d1e5,c96be7a45761c151628a8c3b3075fc51,4.0,2020-01-08 17:32:37,虽然被归类为动作喜剧，但丝毫不妨碍导游极力表达的，韩国社会的黑暗面，或者说僵化的制度。还在求学的大学生找不到当警察的意义，但通过亲身经历，勇敢无畏，哪怕黑暗势力强大，哪怕制度僵化，依然义无反顾，救助眼前受难的女性，从而找到职业的意义。 影片虽然故事情节简单，甚至中间有些情节刻意营造幽默，不太符合实际，但是导演所要表现的内容，所要讽刺的现象，所要吐槽的制度，都让人在观影后，意味深长。 韩国的很多反映社会问题的电影，或者换句话说叫根据真实事件改编的电影，都非常不错，所以韩国的一些电影一直也是我比较喜欢的。其实这部影片所反映的社会问题，在很多国家都存在，只是题材问题，不能拍或者不能上映，或者水平问题，不能表现的淋漓尽致，发人深省。希望国产电影能有更多此类令人意味深长、唤起社会共鸣的好片佳片。                特别喜欢看电影，但第一次写影评，写的混乱，以后希望能坚持写。,,,0
