,Unnamed: 0,电影id,电影名称,用户id,用户名,评分,评论日期,评论内容,有用数,没用数,回应数
36,36,26892281,青年警察,da4f6816bf1f64850c276cae3e1378e8,7e3f1352f03cdd99bba53c17c2217e77,4.0,2019-12-30 16:09:01,"今天说一部韩国较为青春的讲述警察的影片，由朴俊烈和姜河那主演的《青年警察》，这也是新人导演金柱焕暌违四年的新作品，还因此片获得第54届韩国电影大钟奖最佳新人导演的提名。   一、青春诙谐的叙事 首先本片的主角是两位警察，所有的剧情都与警察这一工作相关，而不同于以往我们眼中的电影警察形象，帅气的干练的本领高强的等形象，导演用了十分诙谐的方式来进行叙事，且融入了大量青春的元素与气息。两个警察就像两个叛逆的孩子。没有特别充分的动机，一个因为没钱一个因为觉得警察学校很酷才报考了警察学校，发现这很像现实中的我们，这样的脑回路更符合青春的少年。  主角相互倾诉上大警察大学的缘由  在夜店表明身份 开头介绍警察学校的若干生活，导演用喜剧来表现，主角也因此而相识，再到后面的去夜店，也是因为青春期男性无处释放的荷尔蒙，从而引发后面整个事件。影片赋予主人公青春的气息和幽默的表达以及做事方式，让我们看到警察这个严肃职业和我们也是相同的，更好的拉起群众的共鸣。  为了吸引警察目光尽情沙雕  夜店尬蹦 二、无处不在的讽刺

韩国影片一大特点就是强大的讽刺性，黑政府早就是家常便饭。本片同样随处可见的讽刺，在第一次报案后，原先的学长只能奉告一句署长孙子是第一位的，还是在众多人命面前。夜店里歌舞小姐都会看不起警察，没有钱别想要什么地位。派出所里的大叔，必须按照步骤行事，无论是多么危急。更不用说那个取卵的韩国医生。展现出一种社会上流社会是靠着不断压榨底层小人物甚至吸食来延续的。真是莫大的讽刺。  学长拒绝立刻出警  夜店小姐看不上警察 二位主角当警察都不是心中向往的，在警校每天都要高强度的训练，在教官一句“警察是市民遇到危险失误最先伸出手的人的”教导下，在看到市民遇难后勇救市民，破坏犯罪分子老巢，可随时都有丢命的风险，警察也没有那么光鲜亮丽，侧面也告诉了我们警察最真实的一面。  教官的教诲  差点被贩卖器官 三、关于正义的思考 影片一个最大的主题是有关于正义的讨论。电影中当两位主角再次报警之后，派出所的警察不管他们说的多悬，就是按程序索要身份证，对此三人发生了争执。男主质问“步骤比人的性命还重要吗？”警察回答他“不按步骤还怎么救人！”，这一对话烘托了影片的主题，面对邪恶该如何，是要程序正义还是即时正义，这使影片上升了一层高度。这个问题同时也是社会里凸显的，对此导演最后用了正义的回答告诉我们，面对邪恶就是要燃起胸中的正义。当然这不能代表所有人的答案，想必每个人心中都有所想吧。     四、现实是残酷的也是真实的 导演对于剧情安排很巧妙，在被救回之后，两位主角每年不停地训练自己，为了救回那些女子，导演用以往励志电影的方式来展现这段，让观众以为即将大显身手，走老套路的时候，在最后的救援里，没有多精彩的打斗，还是像之前那样乱斗一气，准备好的秘密武器也都用掉和损毁了。打大BOSS的时候，两个人轮流而上，不断地被打退，但依然靠着热血与冲劲击败对方，说实话我个人感觉是因为人多，在最后也使出了平时训练的招数。导演用这样的手法告诉我们，青春的我们是美好的，我们用着热血单纯的想法去面对世界，可最后面对现实的时候，依然要被猛然一击，即使有完全准备，也仍然要面对挫折，但靠着心里的坚持我们总能成功，这一方面激励了我们也告诉了我们要认清现实。     五、剧情的巧妙安排 两位主角也是很卖力的，首先演技上表现是可圈可点的，再加上两个人身材的优秀，使本片的青春诙谐气息更足，且虽是年轻演员，我们的话应该叫鲜肉，但从未看到演技不足或者敷衍了事，影片中的表现很是亮眼，对比我国的青年演员，不说别的，有这样身材的都是少的吧。  放个毒 在充满男性的警校里两位男主忍不住寂寞，为了青春事业前往夜店在遇挫之后，遇到了绑架事件，调查中发现了更大的阴谋，在最后皆大欢喜的同时也让主角经历了成长从而形成一整条完整的故事线。不得不说导演对于剧情的掌控很有火候。最深刻的在于主两位主角在考试时，面对面对同一个问题“搜查的三个办法”，一个按照标准答案写下“以物品、受害者、现场为中心”进行，一个因为不会蒙着写下“热情、执着和真心”。这在之后的二人调查案件中也应用到了二人所写下的答案，且靠着热情执着和真心这个看似不靠谱的考试答案，在现实中却赢得了重大突破，这样巧妙地安排为影片增色很多。而两个答案更像是正义相互碰撞，是程序还是及时拯救生命，导演似乎表明了他自己的立场。    这三者你有吗 六、故事逻辑上的硬伤 影片的剧情逻辑有着相当不通的地方，在最先发现有关嫌疑人时就可以报警了，在发现受害者时选择了最蠢的背起她跑，关押重要人质的地方竟然所有人都睡着了……等等为了让二位男主不断闯关成长，困难设计的有些不合逻辑。而在结局的处理上，导演选择了老套路，皆大欢喜，而在对现实的残酷进行描写后，也没有多再深入的挖掘，影片的深度停留在了主角的成长和对正义的探讨，不得不说都点小遗憾。  发现犯罪现场和受害者没有选择第一时间报警  看守的所有人都在睡觉 作为一部较为商业的动作喜剧，本片已经十分成功，而且还有它自身的思考，这样一部兼具深度的商业片中国电影界要做到实非易事。虽然本片有着严重的逻辑通病，但它依然可以唤起我内心对于正义的一种冲动。我们曾经年少，也正青春，但总是要面对残酷的现实。我们的社会总是有这样那样的问题，让我们深陷其中，可我们依旧要保持心里的那份正义，毕竟热情、执着和真心才是我们成功的秘诀。",4.0,,1
37,37,26892281,青年警察,1fb7e40a819cfb5dbace1be5d7d2df5c,a4181890b5a491cf96f9399d63da03d7,4.0,2019-12-04 07:22:37,朴叙俊好绝   有个镜头腰细到裤子都快挂不住了 警察学校辛苦，天天都是早起高强度体能训练，去蹦迪撩个妹还要被嘲笑当警察没钱赚。但是真的碰到案子，危险程度又是一次比一次高。 从侧面反映了警察系统的拖沓走流程，警力不足，首先出警也是因为财阀被绑架，而别的绑架案就被耽误了救助时机。 导致单枪匹马两个在读警校生去闯贼窝，还得担心是不是会被退学，输了搭上命，成功了没奖励，就是夸一句年轻人有热情。,1.0,,0
38,38,26892281,青年警察,41dbee9d22852ea3aaf3defb81a9c7e5,178ce40b5e6156e9ff74001ff5695efb,3.0,2019-11-26 20:48:41,电影前期还行，看到一个小时后就开始扯淡了，完全不知道导演在想写什么鬼，两个男主角身为警校教出来的学生连一个正常市民的智商都没有还想着去救人我佛了，或许是导演可能是想黑韩国警察的无用吧，中间还黑了中国人（韩国警察类型电影好多都是将中国人设定成坏人，无语）。 然后为了突出动作戏，两个人一个一个上去打斗，被打得差点废掉，最后两个人合作就赢了，他们咋就不能一开始就一起上呢。 还有就是为了突显他们的热血和嘲讽韩国警察无能，然后两个人冒着被开除风险去救人，这很正常，但是一开始两个人给人打得快惨了，就因为练了两天就敢继续孤身战对一群人，再次无语，我就想问问他们热血也该有点脑子吧，如果两个人去了被打死了，救不了人就算了还把自己搭进去了，那该怎么办（虽然明知道主角有光环不会死），用点脑子不好吗?  想到利用前辈查监控，就不能利用前辈和那个父亲是警察的同期同学吗；想到冒充身份领武器，就不能利用其中一个男主高智商去搞点黑科技吗，这么多资源不用，白瞎那个脑子了。 只能说电影题材不错，就是后期被拍废了。太过于没逻辑了，无语。 最后只能心里安慰自己：这大概就是戏剧吧，没有这些脑残设定，戏大概就拍不下去了吧。,2.0,1.0,1
39,39,26892281,青年警察,199574db40a6b1b5e4435be5ad740221,6bd702f44b299a86acfd1ab91e6e3fd4,3.0,2019-11-18 14:59:36,剧情有点扯 逻辑混乱 不知是不是我播放源的问题 感觉画面总是黑漆漆的 有点好笑但不到捧腹大笑的程度 犯罪团伙居然被两个在校学生捣毁 影片前三分之一还很正常的节奏 后面越来越扯真是我有点扯了 但是主体鲜明的 想要表达和传达的主旨明确 就算是好电影~ 最让人印象深刻的是朴叙俊写在卷子上的办案的三种方法：热情，执念，真心 他们也确实是身体力行这样做的~,,,0
