,Unnamed: 0,电影id,电影名称,用户id,用户名,评分,评论日期,评论内容,有用数,没用数,回应数
7,7,26965856,双生薄荷,0821c66d0e7a90eb58d67a2d3a492228,be0db16f1acdbaf581d8356e7afa7ee5,4.0,2021-01-14 20:41:41,以我的感受来讲，如果这部剧结局再明确一点我会给8.5分，但是结局让我很失望，总体观感7.5分吧。 整个片子剧情线很流畅，不会给人混乱的感觉，导演和演员展现给观众的都非常好，可惜在最后的戛然而止，让我感到十分迷惑。 光夫和光央，表面上看是光央性格缺陷霸凌光夫导致光夫变得不正常，但实际上真正对比下其实光央才是正常人，不正常的反而是光夫。大概我说这种话会被别人重拳出击，但是在我的理解里光央反而比光夫正常。 如果班里会出现一个和我同音名字的存在，作为普通人我会在意一会儿就一笑了之，可是对一个校霸来说，他接触的人和所处环境氛围是和普通人不同的，在普通人眼中的小事或许会导致其他不良同伴的嗤笑。 尤其日本那种校园霸凌时时可见的环境下，因为这种好面子的潜在原因霸凌对方仿佛就是一种正常事，这其实是环境氛围的不正常，而不是光央这个人的不正常。 对于一直是好学生形象的光夫来讲他永远不会想到和光央因为名字的音同有了人生线的相交点。 高中时候光夫被光央当成狗来对待，被光央睡了交往几年的女朋友，甚至各自步入社会走向不同人生的时候还被光央叫回来当他的帮凶，表面上看好像是霸凌方对被欺负方的要求，可是这背后看着光夫的完全接受，看着光夫从高中到最后一直没有变过的联系方式，光夫从思想上完全崩坏了。 在高中回忆的第二幕，光央笑着问光夫和女朋友什么时候交往的时候，光夫面对一个欺凌他的男性真的和狗狗一样的笑着回答是初二。在光央打电话叫光夫来，光夫第一时间跑来并且看着光央和自己女友从开始到结束，从头到尾他只是在门口听着，哪怕是可能挨打的阻止甚至大喊行为都没有。直到光央离开，光夫进去要求女友再做一次的微微笑的表情其实和后来麻美活着暴露，光夫在光央面前亲完麻美的笑是一样的。 明明是被霸凌的一方，明明是被当成狗的一方，明明一点都不像得了斯德哥尔摩综合征的光夫，却对光央有着无法言说的极致的占有欲，他是不正常的，无论是从身心还是从社会环境来讲他都是不正常的，非常不正常。 当影片中间光央问光夫你想做什么光夫回答我想找到你的弱点的时候，当看到光央被打针玩弄的影像红着眼睛流着泪大口吃着桃子的时候，当看到光央知道自己看了影像之后的自尽行为而焦急无措紧张大叫的时候，其实就已经无关弱点和那好似不存在一般的可悲的报复心了，光夫只是想找到让光央完全属于自己的方法、道具、物品、情报等等这些而已。 只是爱而妄想的占有欲而已。 整个片子故事线很流畅，可以说有很多绝美镜头。尤其打动我的是片中光央两次对光夫说“我要杀了你”对照结局的“你愿意和我一起去死吗”来表达光央对光夫的接纳和施舍般的情感，这里是整部剧最动人的一个告白，甚至应该是影片中的一个小高潮，可惜故事最后没有光夫的回答只有镜头下海面起伏海浪拍打的声音。 这导致我第一反应是两个人跳海了，满脑子只剩“wtf？这是什么意思？完全看不懂”的声音，这里让整个片子的故事性下跌了不少。 光央是不会想死的，他毕竟逃离了日本黑道的人生线，得到了愿意毁容陪伴他一起逃离的光夫。光夫也是不会想光央死的，他或许对自己的生死无所谓，但是他每次看到光央受伤都会全红的眼圈代表他是爱光央的，他已经得到和光央在一起的机会，他不会让光央死也不会让自己死的。 真的可惜，但凡中间差劲我都可以接受，但是这个想给开放性结尾却给暗示性结尾的最后，我只能说导演卡的太急了，让我的感动随着最后变成了玩笑一般。想法很好，做法错误收效甚微。 很喜欢日式影片镜头下的真实感，明明知道这只是个电影，但是却感觉或许生活中真的会有这样的故事存在也说不定。明明知道这是个血腥畸形的情感，却一次又一次的觉得浪漫甚至感动。演员演技和制作都很高水准，建议不要抱着有色思想来观看这部影片，因为在这部影片里性不仅有好的一面，也存在人性难以理解和完全噩梦的一面。 相较于对爱情这一概念的解释，希望国内也可以给予一些脱离思想禁锢的偏激的多元的解释。这个词包涵的意义是巨大的，就算是变态的不被理解的爱情也是爱情解释的一种。  以上仅代表个人观点，谢谢观看。,4.0,,1
8,8,26965856,双生薄荷,aa8da52d42f2e3556d68ff4173d9b506,5e6ef3e13adecddae093133e6f5e4eb4,4.0,2020-09-22 15:46:06,偶然看到这部的预告，有兴趣想看一下，发现是中村明日美子的作品，果断看了，我很喜欢这位作者的《同级生》，可能有些人不喜欢她的画风，但对我来说，我挺喜欢的，简单的线条风格但能传递出该有的情感。 我是看了漫画《double mints》之后再看剧场版，老实说，这部漫画的画风和同级生的画风是有相差的，所以在看漫画有些不是很喜欢，但剧情是OK的，有些诡异的剧情，会很好奇作者画这个故事，加入这样的人设，到底是想传达什么呢？ 漫画+剧场版看下来，剧场版的表演会让这部漫画的剧情更加生动，两位主演都表现得挺好的，他们很投入，以前我是非常抗拒这种第一眼就不是帅哥的颜去演这样的耽美剧，但现在可以接受了，而且演员选角上还是很符合这部漫画的主角形象，但不懂的是，他们俩明明是同级，为什么出到社会，反而小攻的角色会比较显老，像是大叔，而小受依然很年轻，像年上攻x年下受的设定。（有点奇怪） 不过也不影响剧情，演员演技挺好的，看他们的吻戏不会觉得尴尬，也没有那种生硬感，感受的出来他们在用心的融入角色诠释该有的状态，这个好评（毕竟不是每一位演员去饰演同性角色都可以有这样的表现）剧情其实就挺日常的，这个日常是在黑社会的角度上，上班族的大叔攻x混混的胆小受，我觉得他们的爱情是畸形的，虽然整部影片没有一句台词是透露着我喜欢你，我爱你这些，但在他们的故事里，感受得到他们对彼此的爱，这个爱是从高中就产生出来，只是当时不懂这些情感，所以埋在心里，没想到多年过去，因为小受的电话而打破了他们俩的关系，他们对彼此的爱是绝对的，没有后路的爱，赤裸裸的面相对方，可以有血腥，可以有暴力，可以有情欲，看到他们两，我觉得一切真实的情感表达都可以，一切不顾一切都可以，一切只钟情于你都可以，这种情感在另一个角度看是唯一的，影片最后一句话“你跟我一起死吗？”就已经能够说明他们俩对彼此的感情了。 看到这种纯粹的、不顾一切的、我只要你的情感，过了一下瘾，感谢中村明日美子，感谢导演，演员。,1.0,,0
9,9,26965856,双生薄荷,cfc1a04eb30fda465fca71700f676726,7e35b060d0f0d19625754479a5e75ab7,5.0,2020-07-10 21:42:50,影片刚开始略显灰暗的画面感，是日剧一贯以来给我的感觉。 电影一开始便突出了光夫的性格，从他敲打节奏的手指再到答应同事的请求，一系列的动作语言都能隐隐透出光夫是一个理性、有能力、且与社会接轨的人。 而光央恰恰与光夫相反，光央是一个没有正经职业、遇事无措慌忙，似乎与这个社会格格不入的人。 但是，就算是这样的光央，光夫仍愿意陪在他身边，履行着高中时的誓言，成为光央的狗，这如果说不是爱情能是什么呢？ 后来光央得知女友没死，光夫瞒着他时，光央打了光夫，在这里我私以为光央生气的原因是担心光夫背叛他，在这里开始光央已经离不开光夫了。 我最喜欢的片段是光夫吃桃子，看着光央被虐待的视频那里。光夫的眼睛慢慢充斥满了泪水，他的指尖陷入了桃子里，桃汁顺着他的手指流了下来。光夫此刻的心，就像是这桃子，已经千疮百孔了。 光央在砸了电脑之后问光夫看了吗？这里是光央的最后一点倔强，就算别人知道也没关系，但光夫不行，光央在害怕，害怕光夫会瞧不起他，不再做他的狗，不在他身边。以至于他有勇气把刀刺进自己身体里，就算如此他还是舍不得伤害光夫。 光央在医院里醒来后，说他重获新生了，其实是他心里放下了那段视频，他不在乎了。光央让光夫靠近他，再靠近一点，再近一点... 明明发生了被虐待的事情可光央还是愿意待在黑道里，但是直到光夫走进他的生活后，光央才想离开黑道，这时候其实他是想要和光夫一起生活了吧，和那个光鲜亮丽的光夫一起，所以他要改变了。 后面，光央问:我们能到哪里去呢？这里的光央是爱极了光夫的，他想和光夫在一起。同样的，光夫也爱极了光央，所以为了他可以划伤脸，不惜毁了自己只要能在一起。 “光夫，你愿意和我一起去死吗”这是性格倔强的光央的表白，我们不妨理解为，光夫，我爱你。 电影从头至尾两人都没有说过爱这个字，但他们的每一个眼神、每一个动作都在细微地诉说着对彼此无法割舍的爱。 这爱是含蓄而强烈的。,,,0
10,10,26965856,双生薄荷,d7ddb15ffbbc61051e0c87404b8be8c0,3013a14de21c2ce74c4b154bde28e625,5.0,2020-05-19 18:19:41,看这部电影的起由是无意间在豆瓣上看到让我念念不忘的一句短评：“爱是血肉模糊的伤口相互厮磨。”阅览过一些文学作品，多数时候总认为其对爱定义的刻画均是模糊而浅显的，临界点的迸发条件仅仅是当下的心情与兴致。可以是随处可见的普遍，也可以是泛泛而谈的寻常，像是不经脑的荷尔蒙蓬发，更像是看似深不可测的湖面实则脚可着地的清池。我有些厌恶这种不热烈的情感，如同想要打翻一杯口感极差的温水，让它洒在冰冷的地面彻底清凉，或让玻璃碎片扎进我的手指，将温暖的血液灌入使它变得滚烫。  所憧憬的是极具毁灭性的，浓烈得仿佛将人稀释分解的爱意，撕开我的心脏染上浓稠的赤色，厚重的感情断化分割为成片墨彩。渴盼将你的肢体拆解为世上最精美的标本，让你的躯壳与灵魂永久属于我个人的秘密禁地。这本虽然是另一种意义上的相互救赎，还是不可抗力的迷上了这种病态的情感。  “‘据说以前人类是分成三种的，男性、女性，球形的双性。由于双性的力量强大而傲慢，激怒了神明，受到了惩罚，将他的身体一分为二。从此，他们的半身便一直在追逐另一半身。’我想我和光央一定本是一体的。”  “之后又怎样了呢 本来是一体的变成两个体 两个残缺的半片缠在一起 像球一样滚动 到底会怎么样呢 要往哪里去呢 我们又能往哪里去呢”  于我而言感触最深的不是光夫手紧攥着桃子汁水横流，眼眶通红却仍隐忍平静地看着光央被践踏的场景。而是当光央想要逃离仍可以身处正途中平常生活的光夫，不愿将他拉向同自己一样的无法挽回的炼狱里时，光夫却不顾一切的找到了他，毫不犹豫地将利刃划向自己的脸，同他说：“这样，我也不再是原来的我了。”  故事在光央望向光夫说：“你能和我一起死吗？”时结束了叙述。看完这部电影及漫画时我心里一直有一个的无法忘却的场景：想象着光夫牵着光央的手在荆棘遍布中前行，他们的身上都被无数的尖利刺伤，鲜血汩汩而流，沿路间淌满了扎眼的鲜红，仿佛无数朵曼珠沙华一同盛开。在这条始终看不到尽头的路上，他们注视着彼此的眼底因瞧见了愿意支付生命去爱惜的珍宝而笑意盎然，携手并进的前方万丈光芒、旭日东升，和你并肩便能忘却一切痛苦而所向披靡。即使变得苍白，即使昏迷不醒，即使逐渐冰冷，能与你共赴地狱成为我锈迹斑斑的生命最完美的谢幕。  同你共生，携爱相逝。也许我们活该被坎坷纠缠，被曲折撵损，因为我们互相依存的力量强大到令神明心生忌惮。纵使神明再度因愤怒而将我们的身体割裂，我们也会不断支撑着残缺的身体爬向对方，沐浴着彼此的血流紧紧相拥。,2.0,,0
11,11,26965856,双生薄荷,b05c1ac5ae26e5a83e32dccef128ab77,bebbcb7b9c0fa083d10e5ba64744c047,4.0,2020-03-03 01:38:33,看完以后！我的内心是崩溃的，揪心无奈痛恨。 明明爱着彼此要互相折磨！ 好不容易看到希望被毁灭！ 到了这一步一起死结局更好吧！ 带着伤过余生我没这样的勇气！  光央决定要放开光夫，让他回归正常生活，可是他不知道吗？对光夫来说他意味着什么，还不如去自首，或者自杀，这样才是对光夫好，我要是光夫，我找他光央视我就自杀，死在他面前，让他永生永世忘不了我………,,,0
12,12,26965856,双生薄荷,8f77db0dc9a727dc417fb6cab37fc452,de54c542d4e2a0dec296ccfc984ff66c,4.0,2019-09-22 01:15:11,大叔攻，中二受，一个程序员，一个小混混。电影里面没有提及两个人的家庭，但我觉得两个人的童年应该都不幸福。似乎他俩的世界里，只有自己，后来又只有了对方。活着的意义是什么？程序员，收入不错，一个人的生活看似不错，但也只是活着。小混混，一天天的，得过且过，杀了人，受不了做噩梦，那就自首吧，反正也没什么好失去的。两个孤独无聊到极致的人，火花一旦产生，便是星火燎原。无聊的生命里，出现了不一样的东西，自己的世界里不再只有自己，还有了对方。每一个吻都想把对方吞噬掉，这样就不会再失去。在遇到对方以前，生活百无聊赖，自从爱上对方，对方就是彼此生命的全部，没有了彼此，也回不到从前了，宁可结束掉这无聊的生活。 大叔为了一个小混混放弃了看似还可以的生活，一开始我很难理解。但不错的生活，是为了什么？是为幸福。小混混才是大叔的幸福，没有了他的生活，活着没有任何意义。其实能够遇到一个全心全意让自己深陷其中的人，必定是痛苦的，但也会是快乐的。痛到极致，才能在相爱的那一瞬间感受到前所未有的幸福，感受到生命的意义。大叔其实是幸福的。他放弃自己，放弃一切，就为了好好爱着一个人，最后他也得到了他想要的那个人。为爱而生，求仁得仁，很幸福。 希望每一个为爱倾其所有的人，都能爱而所得。,1.0,,0
13,13,26965856,双生薄荷,63b4840255c89f7417ef2d33a8a29b96,e49df6cd205538a0ec752acebe5feccd,5.0,2019-03-18 18:11:19,光夫是白色的，优秀的，前途光明；光央是黑色的，堕落的，游走在犯罪边缘。光夫平淡无奇的生活由于光央的出现而改变，狗爱上了主人，无限包容和顺从。悲惨的命运过后，两人都无法离开彼此。本人对小情小爱的平淡温馨俗套的恋爱故事不感冒，能够看到这样另类的BL漫改电影，已经很难得了，主角间的情感扭曲而深刻，演员颜值很耐看，演技在线，简直是腐女的福利，必须支持一下，希望以后还能有更多优秀的作品被改编。不理解很多人为啥接受不了还要看这样阴暗题材的电影呢，是由于好奇心吗，看完还要给差评，边看边否定，何必呢。ps:很喜欢光央的颜+身材，颓废的气质，骨感的线条，还有一些少年感，太吸引眼球了。,,,0
14,14,26965856,双生薄荷,84b7e8deaad2d8fb760bded960a27e9d,df2a74124cf02bdae615151273a099c6,4.0,2019-02-18 06:53:48,非常盲目的四星（有种以前看的文终于被人拍出来了的感觉，抖S的笑容逐渐变态嘿嘿嘿），没看过漫画，有时间补一补。 虽然剧情依旧比较游离，人物与环境脱节（一部分原耽的通病）但比前几年（霓虹国）一些原耽影视要精良多了（比如斋藤工出道时期的那些蜜汁搞笑的bl短片）。导演可能是想往文艺的路子走，丢了一堆空镜头，然鹅并没有什么卵用。再多的空镜头也比不上那一小段“吃桃子”的戏，（说到🍑，突然想到了cmbyn……）那一段可以说是“点睛之笔”和全片的高光时刻。 bl片嘛，演员之间的互动肯定要有爱嘛🙆两位演员的几次对手戏都不错，分开来说，演M的男演员各方面优于演S的那位小哥哥，翻了一下演员条目，前者还演过昼颜和其他尺度较大的BG电影，这就说得通了，老司机啊。然鹅，这片里并没有男主们的床戏，什么柏拉图、创世纪都安排上了，结果就一个口的镜头？？？（而且连借位都懒得搞） 最后扯一点我觉得两个人比较“可爱”的地方。每次被主人欺负完，小狗狗那个楚楚可怜又欲罢不能的小眼神啊，看得我施虐欲大发，内心的小鞭子甩起来，啪啪啪。演员很赞了👍（但明明是同级生为什么有种年下的感觉（遁走 随手贴两张截图⬇️,3.0,,0
15,15,26965856,双生薄荷,dc3a56a16fb1b98d13db6a677728e2e4,4d4ee49b2cf9bf073643daa213a823ba,4.0,2018-08-02 14:43:16,六字老师的忠粉打卡完成！这部电影拍得比我想象中好很多了，毕竟漫改真人一般都一言难尽…… 选角很不错，很符合漫画里的人物设定（虽然高中光央稍微不够意思），一些情节改编也不错，但是就像之前很多评论说的那样……啊啊啊我也想看这两个人的肉啊！ 浴室play被删掉了啊！ 最后原作里是偷渡到中国的来着，结果怎么去韩国了啊喂！ 最重要的是，原作结尾明明两个人是在中国过上了幸福快乐的自由生活，还在一个路过的小男孩面前狠狠秀了一把恩爱，怎么就变成要殉情了一样的啊喂！这刀子我不吃QAQ,,,2
16,16,26965856,双生薄荷,f2d6e1e807a5b9b9a975024ed96acacc,b14035c3aaa6fea0b69d91cfb87e9e99,2.0,2018-07-10 15:48:08,奴役关系一旦揉杂了情欲就变成了影片中的特殊主仆关系。 这种语境下，主仆之间并非单纯的支配和被支配关系，而是感情以一种扭曲的方式相互交换。 在《痴人之爱》中，大叔收养妙龄少女作为自己的奴仆，在享受调教乐趣的同时，不断倾注自己的感情，最终不知不觉爱上了自己的奴仆，最终反被奴役。和本片差不多一个路数。 最后，与其说狗和主人之间因互虐生情，不如说两人原本就看对了眼，但因为都是SM体质，所以只能通过主仆play的方式谈越虐越欢的恋爱？,,,0
