,Unnamed: 0,电影id,电影名称,用户id,用户名,评分,评论日期,评论内容,有用数,没用数,回应数
3,3,26981174,你好布拉德,d8b930184db080cd1824178a60118f93,9697c25dfbc4f38f459f80e6fe6465b7,5.0,2018-03-01 16:15:42,"深夜，一个中年男子在属于他的那半边床上辗转反侧，他失眠了。就在送儿子去参加大学入学面试的前夜。 这个夜晚在若干年前一定在他的人生中上演过，不过那时他是一个要去大学面试的男孩。 在类似这样的中产阶级家庭中，孩子上一个还不错的大学几乎在所有人的意料之中。 当然如果能上一个特别棒的大学，也是值得在亲朋好友中炫耀一番的。 以上，是美国2017年的一部电影《你好布拉德》的开篇。  主演本·斯蒂勒，是一张大家都很熟悉的面孔，曾出演过《我为玛丽狂》、《拜见岳父大人》、《博物馆奇妙夜》等。 在这部《你好布拉德》里，他出演了一个工作和家庭都还不错的中年男人。尽管如此，他却羡慕甚至是妒忌着他的老同学们比他拥有更好的命运。 在观众眼中，他的表现很容易让人觉得无病呻吟、顾影自怜，但是在这些表现的背后，拧出的却是他深藏内心的不安和无力。  然而，他联想的有点多了。 唯一雇员在他这儿学到了几乎所有的本领却不领情还要离职，只因为感觉工作的压抑……（这或许只是年轻人渴望自由与好高骛远） 朋友聚餐时从《建筑文摘》杂志上看到他大学同学的成功事迹，他感觉全世界都在针对他……（或许大家只是羡慕他有个厉害的大学同学） 在他不完整的信息带来的想象中，大学同学一个比一个有出息，过着腐朽堕落的生活……（他在手机中捕捉他们享有名誉、地位、财富、自由以及出风头的镜头）  没有比较就没有失败感，哪怕这种失败感只是自己内心中的自卑。 终于，他翻身的幅度太大，弄醒了身边的妻子。 一些不切实际的幻想接踵而至，却包含了令人懊恼的无情、无耻、贪婪等不道德的想法。 妻子以为他为儿子的学费苦恼，却没有意识到，在他的内心当中，原来和谐美好的生活，在这一刻都不值得拥有了。  在消极的比较中他感觉到了虚无的失控感。他内心中有些东西被引爆了，犹如一直潜伏在暗处的魔鬼亮出了獠牙。 人到中年，时间的紧迫感被一下子放大，仿佛人生的一切都快要尘埃落定，却不是自己曾经或一直以来梦想的样子，于是无比渴望突如其来的转机与平步青云。 没有比较就没有伤害感，哪怕这种比较都是自找的甚至是幻想来的。 在美好的早晨醒来，社区里的一样都如常。 桌上和墙上的照片记录着孩子的成长，做父亲的他却仿佛突然发现儿子已经成人的体格，一下子有点不知所措。 在妻子眼中，他一点时间观念都没有，所以酒店资料都发在儿子手机里，这样才比较靠谱。  孩子的母亲因为工作不能送儿子去面试，他却一直心不在焉。 想起和亲友们的家庭聚餐，他坐在角落里感觉无聊又乏味。他觉得他不属于那里，那不是他要的生活。 排队安检、候机、升舱……本想在儿子面前秀优越感，却屡受挫折。 才发现他与那个享受特权的阶层始终还差着一截。  而周边环境变得更加嘈杂和难以忍受。 儿子带着耳机、听着音乐、看着杂志，随遇而安；他却唠唠叨叨，报怨不休。 在他眼中，他的世界犹如战场，而理想的世界是游乐场，是梦工厂，是天堂仙境…… 思绪飘回大学时光，那时的他还深爱着这个世界，他感觉世界也爱着他。  而现在发迹的同学，当年都追随着他，他曾经是他们当中的核心。 什么时候他和那个爱他的世界分手了？ 出了什么问题？ 觉得自己不行还不够，他开始找“客观”——他的妻子不如别人的妻子，对他事业没有助力。 在生活中，他的妻子总是赞美他，但是这种“知足常乐”影响了他的雄心壮志。  可是，理智告诉他，报怨别人是不应该的。 这种情况下，他对儿子的前途也不乐观，却还刻意表现得对名牌大学不屑一顾。 而儿子却展现出颇强的实力，对自己的学业早有规划，对上哈佛也很有信心。 突出其来的惊喜，使他开始回顾17年来培养儿子的点滴，终于觉得人生还是有价值的，没什么可后悔。  而幻想中那些事业有成的同学们家庭出现各种危机，于是他的内心一下子平衡了。 庆幸中，他与儿子玩起了小时候父与子的游戏——挠痒痒，重温难得的亲密感，而体能上却也已经不占优势。 他又失眠了，想象着儿子被哈佛录取，想象着他和妻子的各种开心。 然而，儿子却记错了学校面试的时间…… 于是，他与校方面试人员交涉和争执、在街面上当众责怪儿子，完全不顾儿子的感受。  不得已，只好打电话求助那些他根本不想联系的老同学——太伤自尊了！ 他还记得，第一次看到老同学费舍上电视时，自己那种实实在在的痛苦（这种痛苦，绝不是稍纵即逝的嫉妒）。  尼克的（同性恋）婚礼没有叫上他，让他觉得进一步证实了自己的恐惧感：不仅没有过出自己想要的生活，在别人眼里也混得不行。  消极的态度帮助他组织与自己相关的信息，并且只选择那些与其消极态度相符的信息。 于是他脑补着婚礼现场，觉得那些到场同学顶着各自的光环，联结他们的不是友情，而是特定阶层的成功。 所以，他坚信，他不是被遗忘了，而是被排斥了。 这个中年大叔行走在高校周边的街道上，目光扫过身边经过的年轻女孩和老人。 他觉得这个世界讨厌他，而他也讨厌这个世界。 结果，老同学费舍打来电话，并安排了他儿子重新去哈佛面试（看来走后门这件事哪都有）。  借助老同学的面子帮儿子搞定面试，让他兴奋得难以自持，幻想着接下来一系列的胜利，幻想着靠儿子的成功让他在同龄人中脱颖而出。 可是转瞬之间，他又“黑暗”了，开始嫉妒儿子在他幻想中的成功，希望这一切成功都是直接属于他的。  他害怕并憎恨想象中儿子用成功来打击他，让他更相形见绌的场景。 而看到街头艺人的潦倒，他又担心儿子将来的生活可能过得不好，因为哪怕是名校出身的音乐家，也不容易挣到钱。 于是，儿子能上哈佛的喜悦也被冲淡了。 让他烦恼的老同学费舍的“成就”，在儿子中学同学——大三的哈佛女孩看来，根本不值一提。而让他觉得自卑的工作（非营利性慈善组织）却让充满热情和理想主义的女大学生非常钦佩。  同样的热情、同样的理想、同样的使命感、同样的神采飞扬……在他大学时代的每个夜晚，同样洋溢在他和同学中。 但是，现在，他却冷漠地审视着这一切。 另一方面，他深深感到悲哀的是，他错过的无法去爱的这样美好的女生，和他无法经历的儿子即将度过的充满激情的人生。 于是，他接下来的幻想有点污（大家自行脑补吧）。  深夜，趁着儿子熟睡之机，他悄悄溜出去，到酒吧制造了与女生的邂逅。但是价值观的碰撞，让一切变得不像他想象的美好。 他对生活的各种报怨，在女大学生看来就是无病呻吟，是不知足；他与那些成功的大学同学的比较，是自寻烦恼，是病态的；他所羡慕的那种生活，则是白人特权的、男人特权的、第一阶层特权的，同时给世界带来各种问题。  在小女生那里哀叹完自己的人生，并被批评一通之后，他只得臊眉耷眼地回去睡觉。 年轻人的世界他融不进去，他的人生经验在那里不好使。年轻人的世界属于他儿子那代人。 儿子去面试后，对之前景仰的音乐教授反而印象不佳，似乎教授过于自我炫耀，并竭力推销音乐商业化的思路。 这又是一个两代人三观不合的实例。 在美国式“说你是为你好”思路的引领下，在女大学生面前没有找到的尊严，他力图在儿子面前找回。  结果依然是“悲剧”的。 在他的母校，他悲哀地发现那个他念念不忘的中年人，他当年的教授已经去世了，而年轻的学生们依然活跃在绿地上。 傍晚，和老同学费舍一起用餐，免不了各自吹嘘一番，然而他又受伤了。 生活境况的差异已不必再提，作为当年教授最得意的弟子，他既没有像费舍一般被召回给学生们开讲座，也没有像费舍一样被邀请在追悼会发言，甚至他都没有被通知参加教授的追悼会。  与费舍不欢而散，他选择去陪儿子听音乐会。
 这是一部适合家有中年男子或者有人到中年感慨的观众看的电影。 如果没有，可能你就很难体会到影片的精髓，从而觉得无聊。 片中男主角在自己脑子里想了太多，自我吹捧、自我打击，其实他的生活还在有条不紊地进行着。  只是在他的内心，如何看待自己已有的生活需要认真梳理。 不怒君觉得，传统心理发展中过于强调青年人的同一性危机，但其实在人生的许多关头，尤其是面临选择的时候、面临自我认知和自我确认的时候，都会面临同一性问题。 而作为中年人的同一性危机爆发起来，也是如此汹涌！ 直至影片最后，在音乐的聆听中，他开始感受自己的内在生命： 周围的一切都是那么美好，可以一直爱着却不需要强求去占有什么，从而不给自己徒增烦恼。  切实把握好自己已经拥有的，在乎自己爱的和爱自己的人，就够了！   本文为作者原创，发自微信公众号“梅花鹿语”（meihualuyu）,作者：雷神不怒。",35.0,1.0,6
4,4,26981174,你好布拉德,b881aa3c0f0ae759b2539f61ab36f4f3,aa31426ed46276bd8db441be2a4fdb89,5.0,2018-01-28 14:35:28,僅獻給那些還在懷念象牙塔日子的人們。 你在想誰 就算是一農村婦女，也會想誰家的豬賣著了好價錢。人生，不想想其他人，漫漫時光，如何度過？ 男主想得最多的，便是那幫大學同學。大学，是男主人生最美好的時光——想當年校園裡的風雲人物，Professor的得意門生，前途無可限量。如果在當時做對了某些決定，如果把握住了某些機會，那麼，登上時代雜誌的，坐擁億萬家財的，便有男主一份，幸福得飄飄然。 其次，男主會去想周圍的人，那個一無所有只懂傻乐的老婆，那個當年用澎湃熱情慫恿男主加入NGO行列的前輩，那些人成了男主的紧箍咒，每每自惭形秽，loser感强烈时，男主便把根源找到那些周围的人束缚了他，至少沒有幫助到他这儿来。 以上這些想法，相信同樣出現在千千萬萬人的腦海中。人們總是想停留在美好時光里做夢，總是想擺脫現實的泥潭重新開始。那些曾經出現在我們身邊，和我們同一水平線的人，怎麼就走上了飛黃騰達的平行線？ 隨著社交媒體的發達，我們越來越容易看到那些“羨慕對象”的一舉一動，此刻的他們正在風流快活，而我只能刷著手機看風景。人們活得越來越焦慮，越來越沒有自我。 男主想那麼多，也托賴於曾經在他生命里出現過的光輝時刻——考上了塔夫茨大學。大學是象牙塔，裡面有視之登龍門者，或墊腳石者，但始終在大學裡，我們擁有相對的公平和平等，當出到社會，世界便的黑暗、骯髒，一切才剛剛開始。 想再多，往日時光也是無法回去，換來一身惆悵。 誰在想你 男主不止一次，強調“圈子”。男主其實活得並不差，老婆在政府工作，兒子也馬上升讀大學，週末也有一幫子朋友到家中聚會，不是中產，也是靠近中產的邊緣。只是這些不是男主所追求的圈子，分分鐘幾百萬上落，妙齡女子的相伴左右，男主想活在這樣一個圈子裡。大學同學ABC君，他們都做到了，曾經的同學，已混進Top Class，自慚形穢。 你在羨慕別人，其實也有別人在羨慕你。 大學裡肯定有混得更不濟的，在男主的成長軌跡里，遇到的那些人也一定有在羨慕男主的。男主心裡也很清楚，只是他心裡也知道何必去在意這些人？人向上看，不是往下看，比下有餘的滿足，人已活過大半輩子，阿Q精神能麻痺一時，不能麻痺一輩子。 人生好比一場攀登，我們總望著攀登到更高處的人，或許有時也會替突然從高處墜下者同情或竊喜，萬物，都是逆地心引力生長。 至少男主還有老婆和兒子在想他，這個孤獨的世上，難得的牽繫。這個老爸，在關鍵的時候，竟然能找到老同學，為兒子安排一場特別的哈佛入學面試，能做到這件事，非常酷。 插播自己一件事，當年想上某家比較好的高中，因為一時輕視疏忽，沒在網上報名成功，去到申請現場時，招生老師查來查去沒查到我的名字，一副不讓我來上學的意思，那時我只知道在那哭泣，也是老爸，二話不說，立即打了幾個電話，托了一些關係，才成功給我解決了這個入學問題，那是一個改變命運的決定。 想其它人，是比較。想家人，是愛。 相信自己 人到中年，難免回顧半生，自覺一事無成，時不我與。如果說，有一個愛你的老婆和兒子，便是最大的寶貴——恕我現在還未看開到這種知足的程度，生而為人，應該盡己最大努力，推動世界的進步，為人類繁衍後代做了貢獻就算功德圓滿，非我價值觀也，也非男主的價值觀。 那要做到什麼？電影告訴我們，最起碼是“真”。真切地面對自己。 當在女學生面前侃侃而談自己的NGO理念，可以輕易收穫其崇拜目光，男主可以繼續裝下去，但他並沒有這樣做，他毫不掩飾地說，如果再選一次，他會毫不猶豫地想賺更多錢，這個答案無疑只會得到鄙視。但男主更在乎說出自己的真實想法，說不定包含一種勸勉後人的情懷。男主真實地面對了自己和他人，然而社會需要包裝，把坐在私人飛機的照片上傳至社交平台；在電視上，在人群前，不厭其煩地說著自己見了什麼厲害的人，參加了什麼厲害的活動……只有這樣，才能獲取別人去想你，成為那個被仰望的人。 不適應症，大部分人都有。如何緩解病情？答曰，相信自己。 結尾處，男主念叨著我還活著。活著，是那麼的真切。那些讓我羨慕的同學們，原來已經在一個和我無法交流的世界，為何要聽他們廢話？ 做好自己，多感受感受世界各個角落正在發生的事，世界並沒有我們想象的那麼日新月異，那麼高大上得無可觸及。那些讓人艷羨者，很快你就會發現他們只懂得自吹自擂，無足稱羨。相信自己，勇敢踏出那個幻想的泡泡，其實我還活著，其實我也還好。Be proud of myself.,18.0,1.0,0
5,5,26981174,你好布拉德,21e1c1c0514ae14bf6b73c77d458e861,dbcbf71fb7246467582fec9caf9be20d,4.0,2018-01-28 12:50:09,是受过良好教育，内心纠结的中产中年；在乎社会地位 在意别人的评价，又时时内心为自己开脱…我们即将到来的中年 大概也会如此，刷朋友圈艳羡别人的生活  知道人家过的其实也很糟糕 居然浮现了一丝笑容…回不去年轻时的理想纯粹，也无力去教导影响他人，inner peace才是归宿  如同置身艺术美好中  不由自主的泪水,12.0,1.0,3
6,6,26981174,你好布拉德,02c19409a0b6df35a302834d53c56951,c7fe7ccfacd026b4edfd2c57c94b926b,5.0,2018-10-19 14:25:04,"这电影，给五分我很矛盾，我还想给它零分，因为它太真实了，真实的就好像是在演给我看，就好像是写我的生活，我的心境，看完很不是滋味。这部电影还有个名字叫《布拉德的中年危机》，没错，就是大家口中中年危机的那个中年危机。虽然说中年危机题材的电影好莱坞拍了一部又一部，好的坏的扯的，但像这部这么真实贴近生活的，这是我看过的电影中唯一一部。在前一段国庆假期时间小gigi推荐给我的时候，他担心我不去看，所以反复说了好几遍:超级好看。我也是有天晚上无意中想着那就点开看看吧，没想到出其意外的好看，不是以往电影那种好看，而是直戳内心的感觉，里面好多细节让我看完不知道是该哭还是该笑。
 早年的同学都事业有成，而自己却依然碌碌无为；谁谁谁的老婆本身就是女强人，和她老公互相竞争，又在竞争中进步；那个从小和你竞争的人，现在成为了大牛逼货；那个谁甚至都有了自己的私人飞机，他老婆家很有钱，甚至他第一桶金的客户都是岳父大人介绍的…等等等等。再看主角，咬牙想着坐回头等舱，却因为是打折机票而无法升舱。这一段真的是太他妈的真实了，好多事我们想去做却因为没钱而受阻，最后一咬牙心伴随着“反正一辈子就做一次”的决心去做，这不是穷人思维，这就是穷，仅此而已 出门坐高铁二等座，飞机经济舱，连锁快捷酒店。至于那些头等舱，五星酒店，米其林餐厅，或许只在电影里体会，亦或是“一咬牙”，对，就是咬牙硬上的感觉。但殊不知这些可能是有些人的家常便饭而已，尤其是当你知道“有些人”是你小时候的玩伴的时候，尤其是当你发现自己已经三十岁的时候，这种挫败感，四面八方，向你袭来… 电影里年近五十的男主被二十出头的小姑娘数落得一无是处；自认为曾经是相互竞争关系的同学，结果压根没把你当做竞争对手；同学的婚礼请的都是成功人士所以你没被通知到场；老师的葬礼请事业有成的同学去做演讲，而作为上学时候最被老师喜欢的你，却因为碌碌无为的现在，被拒之门外。那个圈子的大门，没为你打开，并且以后应该也不会打开了。 这电影给了我很多触动，不知道是不是因为到了三十岁，就变得矫情又脆弱。《无双》里周润发有句台词是：这世界上大部分的人都是观众，一百万人里只有一个能当主角。《布拉德的中年危机》这部电影，好就好在结尾，结尾什么都没改变，男主并没有有如神助般的裂变成功，影片也没讲他儿子到底去没去哈佛，或者最后去了男主当年的母校，平平淡淡，真真切切。这真切，就像一把刀，并不是一到扎进我心，而是一刀刀的反复划着我的皮肤，那些伤口久久不能愈合。",3.0,,0
7,7,26981174,你好布拉德,c1980382295fa9f3f3d8a86e2dc70e68,2dda8c50de05c697b2cc9d790f32b8d3,4.0,2018-02-04 23:53:52,"如此浮躁的我在这如此浮躁的时刻，安静的看完了让人内心翻滚的无聊电影，这一刻我仿佛看到了二十年后的自己，一个鬓角泛白的老男人凌晨失眠对着天花板发呆，工作已然稳定的融入了生活，平稳不失乐趣的家庭，突然发现不知什么就点燃了中年危机的导火索，发现周围的人都比自己牛逼，羡慕别人有着自己无法经历的人生，开始觉得一丝自卑、无助，怀疑一直信奉的平淡人生的宗旨。睡在旁边的老婆轻轻的发着鼾声，抓抓她的手不再细腻光滑，内心起伏不再，但还是忍不住吻了一下她的额头。看看表凌晨两点了，隔壁房间还有隐约的动静，突然发现自己的孩子不知怎么的都这么大了，你根本不知道他内心在想什么，不再像小时就那样追着你跑，见面多了几分客气和距离。呼一口浊气yy一些美好的事物渐渐睡去。本以为到了这个年龄看透了世间百态，便一切尽在掌控，但当遇到一件超出了能力范围的困难，便不由得开始怀疑自己，也无法逃避。看着自己的孩子就像看着多年前的自己，时光如白驹过隙，没人能叫你放弃雄心壮志，也没人要你必须知足常乐，终于明白了什么叫性格决定命运。身为最普通的中产阶级，胡思乱想，不满意的现状导致越来越焦虑很容易陷入一种负面得情绪里。到头来不过是跟自己的较量，纠结，较劲。puffing myself up, tearing myself down.何不去放过自己，享受和爱着这个世界却不想着去占有。最后的音乐会和儿子的一句:i love you.解救了老BRAD，而我们的人生终需要家人的救赎和自己的放下。换句话说如果那时好用得起iPhone，那就很不错了还要什么手表，要什么自行车。
忠于自己，忠于家庭，忠于生活
       peace&amp;love",6.0,,0
8,8,26981174,你好布拉德,a7374ac077ff24fe5a2ff142736185dc,7aac09f2e600b35940fdcea0ec7823ee,4.0,2018-01-27 23:29:54,"我们大部分人的生活都会归于平凡，只有少数幸运儿会成为人中龙凤。也许你在学校里是佼佼者，然而数十年后还是会被中年危机所困扰。世界不是绝对公平的，许多事情我们无能为力，即使你对别人的成功眼红、不服气，但事实就是事实，真实的世界没有标准答案。
         爱和别人比较是我们的天性，它可以有正面的刺激作用，但如果眼中只有竞争，凡事都要争个高下，就会失去人生的趣味，陷入一种不断自我吹捧或者是自我否定的情绪中。我们时常可以静下来，感受生命本身，可以去爱这个世界而不想着占有它。虽然有些事我永远没法完成，但我已经拥有了许多东西，我依然爱这个世界，最最幸运的是——We're still alive, I'm still alive.",3.0,,0
9,9,26981174,你好布拉德,3dd31893d400e68d59ceb7cfb40e0cd6,38e705cb740cc563f406859001a6dd6f,,2021-10-20 22:48:05,《Brad' status》认识的自己是一个想象极其丰富的人，他会常常失眠，一副沉思者的样子，仿佛是另个世界的人。每个人都会觉得世界是围着转的吧，特别是很小的时候，每当做完一件事，觉得要是没了自己，肯定发展会有所不同。但事实是事情总是需要有人做，而你只是恰巧在哪里而已。长到后慢慢接受即使你离开，世界完全不会因为你的离开会有所改变，这其实是非常残忍的。 几次对白都说到我很爱这个世界，但表达后面有所改变，分别是以前这个世界也很爱我、世界好像不太喜欢我、无法拥有这个世界。 或许很遗憾，但是这一路的成长确实没有办法靠想象就可以去完成的。其实电影总的来说不需要两个主人公，如果只有布拉德，通过与不同的人对话，或许也没有违和感。但是在我们的现实生活中，不可能脱离其他人，而独自拥有丰富的想象力和对生活的期待，主人公也是在不断和其他的做比较中获得更多的。总之这部影片非常值得反复咀嚼，特别你在不同的年纪，肯定感受是不同的，但共鸣总是存在。,,,0
