,Unnamed: 0,电影id,电影名称,用户id,用户名,评分,评论日期,评论内容,有用数,没用数,回应数
0,0,26981174,你好布拉德,0aff9cd602e63e954f0dd26b06f8817e,780f4820cd9480f627e066b106145e2b,4.0,2018-01-10 21:42:40,生活就是由一个又一个小确丧组成的。 2018年第一个觉得很好看的电影：《你好布拉德》。  大概是一个天命之年的中年人渐渐知天命却不认天命的故事吧。 很有趣的一点是，我一个距离天命之年还早的人却莫名地有一点能理解男主角布拉德的纠结。所谓三十而立四十不惑的说法，很大程度上是扯淡。任何时候，人都是会“惑”的，除非老年痴呆。这种“惑”更多地体现为一种迷茫，一种对自我的认知和对当前所处的社会地位的怀疑。说是诉求不满也好，说是无事生非也好。这种精神上的饱暖思淫欲一旦触发，就会很长时间挥之不去。之前坚定不移地走出去的路，下出去的棋，突然有一天，就会在某一个闲得冒泡的午后，史无前例地觉得有一点点后悔了；突然有一天，就会在某个睡不着的半夜瞪着双眼看着吊灯悄悄问自己：他娘的，当初是不是不该这么玩？ 这样的困惑必然是不可能说出去的，至少对于男主角布拉德是这样。要老婆有老婆，要儿子有儿子，有车有房有存款，不管跟谁说这些有的没的，都会被人说是胡思乱想。可是憋着就是一个牛角尖，一个死循环，想不通的事，任你想多久都想不通。 睁开眼照照镜子，看着自己过着中产阶级的小日子，锦衣玉食谈不上，说是衣食无忧还是不为过的。闭上眼却总能想到当年一块Happy的老朋友们一个个都身家发达，私人飞机起落往返，哈佛大学讲座不断，提前退休拉着两个小两轮的女孩做女朋友在私人小岛逍遥自在。再看看本来可以一直做下去的工作被自己换成了非营利组织的企业，员工离职，自己四处拉着人捐款投资不说，还被土豪哥们拉黑了；想买张飞机票还因为是个打折网站上的便宜货换不了舱。都是两个肩膀扛一个脑袋，由不得你不去想。要不然怎么说，货比货得扔，人比人得疯呢。  这也正是表面上布拉德不动声色，但心里总是不放过任何一丝可以给自己带来哪怕一点成就感的细节。所以当他听说儿子有可能，哪怕只是有一点可能申请到哈佛大学的时候，整个人都振奋了。对于他来说，这就是一根救命稻草，是绝大的自我肯定。哪怕前一秒钟自己还不知道儿子有可能申请到哈佛，也丝毫不耽误他下一秒看着儿子沾沾自喜地说我怎么培养了这么一个天才出来。 你说是成就感也好，说是虚荣心也罢。毕竟大多数人都不是佛，看不了那么开，就算偶尔看开了，想想私人飞机和小岛，也就又看回去了。 最惨的不是比不过人家，而是明知自己比不过还没有缩短差距的空间。如果有什么比这个还要惨，就是明知比不过也缩短不了差距，还得装着不在乎。    每当电影里出现布拉德内心独白，暗叹岁月飞逝而自己虚度时光而无所作为的时候，都会出现相同的背景音乐。我看的字幕版本是对场景音效有标注的，而那段经典的配乐被叫做agitated instrumentals. 这个词很有趣，焦虑不安，躁动难耐都可以用它表示。不仅仅是音乐，更是男主角的内心，那种似乎觉得自己有所作为，又发现无所作为；想要有点作为，却终究止步于内心的纠结与不安，或者说，不爽。 真的不爽。 这很现实。不是每个人都和电影里光环附体的主角一样，随随便便就不顾一切了。家庭和睦生活幸福，这个时候硬说不满想推翻重来太难了，回头看看说好听一点是牵绊，说不好听是包袱。 有一段情节非常妙。学音乐的儿子说自己可能会申请到哈佛，布拉德当天晚上就做了儿子申请到哈佛的梦，一家三口举杯相庆；儿子错过面试，布拉德赶紧一通电话找各种朋友成功争取到一次机会，然后大白天的就梦到儿子的未来一片大好，成了家喻户晓的明星，上了杂志封面，他和妻子买了一沓杂志见谁都往手里塞。然后看着喜不自胜的儿子一转念突然又想到，成功都是人家的啊，你算老几？上哈佛的又不是你。然后脑子里瞬间闪出儿子在电视节目上嘲讽自己的画面，整个人都不好了，担心儿子的成功更反衬出了自己的失败，幻想着未来的自己嫉妒着成了大明星的儿子，把人家照片都从墙上摘下来扔了。 一愣神，自己还和儿子站在大街上。 他就是这样一个内心戏爆炸的人，任何一个细节都会让他浮想联翩。就算是在白日梦里，他都能想像出各种可能性让自己变得更加纠结。 现实，真的现实。  类似的内心活动极其多。也就像我一个朋友说的，人生的意义就是折腾。布拉德在电影里的每个晚上都睡不好，有的没的都要去想。他也不想钻这个牛角尖，但是没用，性格如此，要换成他知足常乐的老婆，必然不会在乎这些。 人的纠结就在于，环顾四周似乎每个人都过得简单粗暴，只有自己最复杂，也只有自己最平庸。 遇到儿子同学的经典桥段更不必说。他看着儿子年轻有为的哈佛政治系大三学姐和自己师出同门，又是那么富有激情而理想化，就好像看到一个年轻的自己。热情，饱满，高谈阔论，指点江山。那种沉寂许久的热血又冒了上来，甚至背着儿子去参加人家的聚会，和女孩侃侃而谈。而现实是女孩听完这些却嗤之以鼻，反问他：你知道什么叫贫穷吗？你可知足吧，五十岁的人了，还觉着全世界都围着你转。 好容易涌起来的热血又凉了。  诚然他是知道这一点的，可终究是有点不甘心。 从这个角度看，这片子也挺丧的。但是这种丧不是《海边的曼彻斯特》里那种绝望到窒息的丧，是那种小人物在挣扎中上天无路入地无门，安于现状又不爽的丧，是小确丧。 你敢说他得知光鲜在外的大款朋友也要为病重的女儿四处求医时心里没有一丝平衡吗？你敢说他在大款告诉自己所谓的私人飞机是公司租来的时候他没有一点释然吗？如果没有，他就不会在得知自己一直在暗中较劲的那个在哈佛教书还经常上电视的同学压根就没有一丝一毫和他比的念头的时候那么郁闷与懊恼了；如果没有，他就不会在得知那个给朋友租飞机的公司就是那朋友自己开的的时候禁不住地黯然神伤了。生活就是由一个又一个小确丧组成的。 甚至直到他甩开那个自己嫉妒得不行，人家却丝毫没把他当作任何比较对象的朋友，独自起身离去的时候，那朋友都是一脸懵逼的。很多时候就是这样，你一心一意地嫉妒人家，人家干脆没想过跟你较这个劲。就好像卯足了劲的一拳打在一团棉花上，怎么着都不爽。 电影里把这种小人物的复杂心情表现得淋漓尽致。有人说演了半天他依然是个Loser，既没有逆袭也没有看开。这太正常了，芸芸众生又有几人能看得开？这从一开始就不是一个励志的故事。如果最后他咬牙打破自己平凡却稳定的生活，开始创业开始变革然后一路逆袭，这电影就完了。 就像他想对当年的自己说的：“别搞什么理想化的非营利组织了。挣钱，挣得越多越好，你想实现梦想，就要做比尔盖茨。没钱，没有梦想。”他这样说是因为倒退三十年，那个时候还有可能。他就不会对现在的自己这样说。 我很喜欢这部电影呈现的各种各样细腻的感情。甚至回头重温的时候会发现比自己意识到的还要多。布拉德和儿子之间的感情，和妻子之间的感情，和不同朋友之间的感情，和连面都没见就已经永别的老教授之间的感情，都值得细细寻味。 结尾的音乐会上，他看着舞台上亭亭玉立的表演者们，感觉这世界也不过如此。聚光灯只有一个，虽然照向的不是他，却也并不妨碍他爱着这个世界。尽管他曾坚定地认为，对于那些身价菲然的朋友们来说，世界不是战场，就是个游乐场。 生活还要继续，人也还要奔波。整部电影看下来，布拉德一直都在思考，从未做出行动。这一场发生在他脑中的春秋大梦从开始到结束，起承转合，前因后果都只有他一个人知道。这才是最值得琢磨的乐趣所在。没有人知道他曾经是如此的纠结，这样挣扎，这样不爽。每一天，当你走出家门，像无数个布拉德打招呼，并问他今天怎么样的时候，他们都会告诉你，好极了。  （完）,271.0,5.0,19
1,1,26981174,你好布拉德,9f642b797115d8fcef5ff2e9082b3fd8,1b6f6dda7ae99911ce1911aa8736783f,3.0,2018-04-12 05:48:33,"就在今天我还为自己发稿有错别字感到挫败不堪，心灵不堪一击到全世界黑暗。我老公不停安慰，我却甩下一句今天你刷碗吧。感觉自己要完蛋，一点失败造就全盘不想干。 看了这部号称喜剧的电影：片中男主对自己的傲娇而狂妄为自己的一生而惋惜，为自己的野心而羞耻。多角度怀疑自己到底是什么视角对待人生，不仅仅是把希望寄托给下一代，喜悦背后却又惶恐自己被儿子将来的成功所打败----来自每个人身上根深蒂固的自卑。 男主挖掘角色之深，眼神动作的设计都透露出男主的纠结，对表象的不解。与自己的“朋友”有一条无法逾越的鸿沟，异想与年轻女孩子在一起的自由无拘，殊不知根本不是一个天空下的云彩。到头来觉得自己是一个无知的笨蛋。如其所言：At night, my mind drifted back to college. So many friends who have become successful. Craig Fisher worked for the White House. Jason Hatfield had his own hedge fund. Billy Wearslter sold his tech company at 40. What do I have? I work for a non-profit and nothing to show for it. （着实惭愧） 其实故事是很打动人的，不光是那些理不糙的lines，当他对自己一次次怀疑的时候那一句句voice over真他妈是句句扎心字字刻骨，连同今天发生在我身上的事情，对自己的否定对自己的自责，如此不专业愧对家人愧对老板愧对党。看完电影我只想对自己说：WHY SO SERIOUS? 喜剧的魅力，一是往往来自剧中人物所处的特殊情景，在这个情境之下，规定着主人公的言语行动二是“特殊情景”通常是单一型的，是比较容易预测到的，差不多每28秒钟就会出现一个笑料，因此产生高度的可预见性结果。此片虽然没有笑料百出，没有固定的收尾却让人释然。阐述整个故事的背后小人物的悲喜，反正是满足了我今天的心情味蕾。 人，自然不可能完美，每个缺点弱势的背后自然会有延伸出来的反转，即不会倒霉一辈子。这电影说道最后就是让你看开释然，我呢，看完以后释然了很多。于是。。。。洗了盘子刷了碗，扫地拖地准备晚饭。很简单，工作中的失误别污染了美好生活的一角，一个人的不开心可以想方设法的消化，你的不开心影响到了别人（这里指我爱人）那就是双重失误了。过失之重大，责任之沉重啊。",8.0,,1
2,2,26981174,你好布拉德,2f6e76adf6c259c16d39c442de5e7668,dae2bae11a6feacdabf4fe47edd1a040,5.0,2018-09-25 20:47:27,"这两年最流行的一个词叫大叔。 而与大叔一次相对的是，师傅。 师傅就是人们常说的中年油腻猥琐男。 看看这个触目惊心的描述。 说的是你么？ 如今都市的男人们过早的把自己划归到中年。 18岁一过就开始怀旧，感叹青春。 什么原因？ 我问了几个男性朋友，他们对于中年的理解如下： 87年的大脑门说： 1.我觉得我自己已经算是中年人了。2.目前在我看来，开心的事是我发现很多人不能独处，自己却很享受独处，同时，在独处的时候还能思考，找到自己的兴趣。3.中年危机，我感受到了，我目前感受到的中年危机是前面有点迷茫，不知道自己该做什么，能做什么。而且，自从有了孩子，父母年龄大了，顾虑多了。4.进入中年后，我觉得最悲哀的就是自己身体，精力有明显的下降，同时，有一些安于现状，不够果敢，对任何事考虑得失太多了。 82年的汤糖躺烫说： 看着孩子慢慢长大，一天比一天变得更有意思，这是我最开心的事； 我的中年危机就是不能和比我身体好的人比熬夜，比工作强度。身体是我认为中年人最可怕的问题；我不觉得有悲哀的事，如果说因为工作原因，陪孩子时间没有想象多，我认为是很遗憾的事。危机的关键是机会，中年人比年轻人的危就是身体和精力。解决好这个问题，对年轻人来说，中年人处世技巧和能力对年轻人有降维打击的力度。 81年的太原太原说： 中年就是烟酒少了，但都精致了；怕生病，更矫情；对别的女生，也就看一眼，没有更多想法；怕惹事儿了，怂了；吵架多了，但更爱老婆了。 84年的丰乳肥臀说： 半个身子都入土了，唯有读书，修身养性了。 81年的吴彦祖和87年的木木说： 我不是中年，我是少年。 八月的北京，我看了一部电影《你好，布拉德》。 布拉德，40多岁，真正的中年，白发满鬓。 他在脸书（facebook）上看到大学死党的聚会，他没有被邀请。 他想到工作在白宫的克雷格，在高档餐厅和家人聚餐； 他想到拥有对冲基金的杰森，在私人飞机上喝着香槟； 比利卖掉科技公司，买了个小岛，和两个玻利维亚女模特过着乌托邦式的糜费生活。 而他，在自己没有还完房贷的屋子里，失眠了。     其实布拉德工作也不错，在一家非盈利机构做慈善，他到处找资金，和自己的团队一起努力帮助更多的人。 只不过，如今的年轻人更现实，希望赚更多钱，过的物业一些。 一个个辞职的年轻人，刺激着布拉德，他怀疑自己当初的选择。 他还有一个从大学恋爱结婚的妻子，非常相爱，虽然也在一家非盈利机构，但是工作认真努力，单纯，简单。     18岁的儿子特洛伊高中毕业，他的音乐天赋很突出，准备申请大学的面试。 当特洛伊告诉布拉德，自己可能可以申请耶鲁，甚至哈佛的时候，布拉德看到了希望。 他想到白宫-克雷格的青春期的孩子们很娇惯； 科技公司-杰森的孩子很任性； 而那个住在小岛上的比例，压根还没有孩子； 他看着自己的特洛伊，仿佛看到了自己的未来，一个成功音乐天才的父亲。     他决定陪孩子一起去面试，顺便来一场亲子旅行。 在机场时，他觉得应该给儿子升舱，他从来没有做过商务舱。 可惜，他的特价机票不能升舱，除非他重新购买全价机票。 其实，特洛伊并不那么在意，而布拉德却无比窘迫。     特洛伊记错了哈佛的面试时间，他需要回到自己的城市参加面试。 布拉德不能接受，他希望说服校方给自己儿子一个机会，在他的眼中，特洛伊是个音乐天才。 特洛伊和校方都认为布拉德无理取闹，因为这不过是一次面试而已，哈佛还会在他们所在的城市举行面试活动。 布拉德给妻子梅兰妮打电话询问他们在哈佛有没有熟人。 梅兰妮说提到白宫克雷格一定与哈佛私交甚好。 布拉德陷入忧郁。 他想到克雷格多年前对自己慈善事业的漠不关心，自大的家伙。 他在犹豫中还是拨打了克雷格的电话。 “对不起，你拨打的号码不存在。” 布拉德看着在听音乐的特洛伊，他给杰森拨打电话。 无人接听。 他不得不给浪子比利打电话。 比利描述着自己无与伦比的生活，一个岛，两个玻利维亚模特，男人渴望的梦幻版生活。 布拉德忍着比利对他的奚落和忽视，希望比利可以给自己克雷格的新号码。     克雷格接到布拉德的电话后，热情的为他的儿子安排了哈佛最好音乐教授的面试。 布拉德喜出望外。 当他把这消息告诉儿子的时候。 他成为儿子眼中的上帝，万能的老爸。 他心情大好，并决定和儿子一起去参加他朋友的聚会。 阿纳尼亚和玛雅是特洛伊在故乡的朋友。 她们已经考入哈佛，成为音乐系的学生。 阿纳尼亚聪明健谈，玛雅理智性感。 布拉德为她们的年轻和活力着迷。 当阿纳尼亚说出自己毕业后的理想时，布拉德告诉她，自己正在从事的事业，就是她的理想。 布拉德享受着年轻女子的崇拜之情，感觉自己回到了学生时代。 聚会结束时，阿纳尼亚希望他们父子俩可以继续去隔壁的酒吧喝一杯，那里有很多她们的朋友。 布拉德想去，但是，特洛伊希望早点休息。 于是，他们回到了酒店。 父子相对无言的睡下。     布拉德再次失眠。 他确定特洛伊熟睡后，他跑去了阿纳尼亚所在的酒吧。 阿纳尼亚热情的上前打招呼，她很想和他继续交流。 阿纳尼亚：“说真的，对于未来，你给我些建议？” 布拉德：“真的，我希望你先去赚钱，当你有了钱，你可以做一切。”     布拉德自认为把自己真诚的分享告诉对方的时候，阿纳尼亚失望至极。她眼中的大叔，变成了师傅，一个虚伪的慈善者。 他们就这样尬聊了几个小时，然后无趣的分开。 布拉德感受到了这一切，他本可以用这几个小时的时间好好休息的。     特洛伊的面试很成功。 特洛伊很快从兴奋中回到现实。 他的失望在于，他眼中权威的音乐教授，居然讨好自己。 因为自己是白宫克雷格朋友的儿子。 他眼中的知识分子，居然向权贵献媚。 布拉德和特洛伊争吵。 特洛伊讨厌世俗的音乐教授，他讨厌商业化的音乐。 布拉德再次拿出了自己的价值观来说教。 特洛伊愤怒的觉得自己的父亲是个疯子，他不喜欢这样一个世俗的意见。 布拉德接到杰森的回电。杰森的小女儿换了严重的脊髓栓，等待手术。关掉电话的布拉德感到轻松了不少。     原来，大家过的并没有他看到的那么好。 布拉德去见大学挚友克雷格。 他穿上最好西装，提前到达餐厅，却被服务生带到了最差的位置。 而克雷格到场后，立刻被带到最好的位置。 布拉德希望和克雷格来一场掏心窝子的对话。他忍受着克雷格对每一个大学好友的不屑一顾。当他问克雷格，对方有没有在大学时候拿自己当竞争对手时，克雷格感到莫名其妙，自己从没有把布拉德当作竞争对手。     布拉德失去了最后的尊严。他愤怒离席，留下克雷格一人。 他赶上了儿子朋友的音乐会，坐在特洛伊的旁边，听着音乐，泪流满面，他紧紧拉着儿子的手，紧紧拉着。         旅行就要结束。
 回到酒店的父子俩没说什么。 布拉德告诉儿子：“我担心人们看着我，觉得我是一个失败者。” 特洛伊说：“每个人都会想着自己，没人在乎你，唯一在乎你的人只有我。我爱你。”     故事结束。 这个电影给我的启示就是： 1、美国人也会从微信朋友圈（脸书）来猜测别人的生活，也会对比，和我们一样。 2、很多人认为美国人不会走关系，更公平。其实，都一样，圈子和关系在全世界的游戏规则中通行。 3、看到你过的不那么好，我就放心了。 4、我们太过在意别人对自己的看法，其实更多的时候，没人在意我们，而我们反而忽视了身边最亲近的人，他们才是最爱我们的，最在乎我们的。",7.0,,2
