,Unnamed: 0,电影id,电影名称,用户id,用户名,评分,评论日期,评论内容,有用数,没用数,回应数
32,32,26981174,你好布拉德,40fd9654e40e9173451932f3a5b46144,64c5836fb4f3ac05dd451e0bf0c7219f,5.0,2020-01-28 09:54:09,《布拉德的中年危机》是2017年上映的一部小制作电影。导演麦克·怀特虽然不为国内观众熟知，但两位制片人却鼎鼎大名，一位是好莱坞巨星布拉德·皮特，没错，就是那位安吉丽娜·朱莉的前任，他的代表作有《七宗罪》《本杰明·巴顿》《搏击俱乐部》等吸人眼球的大片，另一位迪·加德纳也相当厉害，代表作有拿到三项奥斯卡大奖的《为奴十二年》和叫好叫座的《时间旅行者的妻子》。 《布拉德的中年危机》虽然是部小众电影，但折射出的困扰中年人的焦虑和不甘却非常接近生活。看到主人公布拉德，仿佛看到生活中的自己，他和我们一样，为逝去的青春懊悔，为没有获得巨大成功而迷茫。我们每个人身上，或多或少都有布拉德的影子。     苏格拉底说，认识自己，方能认识人生。 这句话放在布拉德身上再合适不过了。 影片通过布拉德为儿子选择上哪所大学过程中发生的一系列事情，展示了布拉德渴望出人头地的焦虑，折射出中年人在危机困扰下对现状无力改变的无奈。布拉德在经历了儿子的淡然、妻子的乐观、朋友的真诚三重情感洗礼后，终于醍醐灌顶，放下了身段，认识到平凡的人生才是自己的主旋律，自己热爱世界依旧精彩。从而走出自己营造的怪圈，回归本我的故事。 影片开始，47岁的布拉德在熟睡的妻子身旁辗转难眠，他觉得一切都糟透了： 自己供职的慈善组织机构，唯一的雇员在学会他的全部本领后辞职了，他一个人即当元帅又当兵，到处拉捐款、找投资，遭受各种白眼，沮丧又失败。 目前住的房子太小了，怎么才能得到改观呢？他脑子里蹦出一个可怕的念头，如果岳父母死了，他们就能继承遗产，彻底摆脱现在的蜗居。     最让他受不了的是，他大学要好的四个同学非富即贵，个个活得都很滋润，在上流社会里过着众人景仰的贵族生活。 再看看自己，事业与生活一地鸡毛，无奈与落魄作伴，一切都不尽如人意。布拉德不禁心烦意乱，辗转反侧，陷入无尽的煎熬。 影片通过白描的手法，让我们看到布拉德平静外表下精神世界的挣扎。布拉德的焦虑与儿子的淡然，布拉德的不甘与妻子的满足，布拉德的嫉妒与同学的真诚，这些人的平静自然与布拉德波涛汹涌的内心形成了鲜明对比，在碰撞中，中年人的庸人自扰不堪一击。 01、布拉德与儿子特洛伊：生活中的父子，精神境界的身份互换 布拉德的儿子特洛伊面临高中毕业，选择心仪的大学成为摆在全家人面前的头等大事，于是，布拉德陪同儿子从小城市萨克拉门托前往波士顿参加大学面试。     十几年来，布拉德在怀才不遇中忽视了儿子的成长，特洛伊的一切他明显心不在焉。这次择校旅途，父子俩才有机会真正坐下来交谈。无意中，他发现儿子音乐天赋相当高，很有可能被哈佛录取，知道这个情况后，他两眼一亮，心情一下阳光起来，如果儿子能上哈佛，会给自己失败的人生挽回漂亮一局，也有了在同学面前炫耀的资本。 来到哈佛，他们却发现错过了面试时间，布拉德不顾儿子劝阻，找到面试工作人员，质问人家为何不给特洛伊一个机会，知道他有多优秀吗？ 可怜天下父母心。争执无果，为了能让儿子上哈佛，布拉德不得不低头，求助他讨厌的大学同窗克雷格，克雷格如今是社会名人兼哈佛大学客座教授。在他的斡旋下，特洛伊重新参加了面试，并得到了知名音乐教授的欣赏，如愿以偿被收在了门下。 布拉德宴请克雷格以示感谢，吃饭过程中，有克雷格粉丝要求合影，布拉德久积的不快顿时爆发，他问克雷格大学好友为何将自己边缘化？克雷克非常不解，问他为什么会这样想，他和同学们一直当他是好兄弟，从来没有做过淡化他的事情。布拉德却认为克雷格撒谎，拂袖而去。    返回父子俩住的小旅馆，布拉德的心情很差，他看着儿子，心中又升腾起不被人重视的愤懑。特洛伊就此说出了自己的感受和看法。他说，您在哈佛那么多人面前斥责我，的确让我很难堪，我当时在想，如果上了哈佛，我会在同学们面前抬不起头，想想学校里的人永远都记得这件事，实在是太糟糕了，我觉得别人会因此而嘲笑我。但是，你知道，没人会记得这件事，因为每个人都在想着自己的事。 唯一想着你的人就是我，如果有谁的意见需要你注意，那就是我。因为我爱你。    特洛伊的话不但让布拉德深思，也让我们明白，幻想自己站在舞台中央，被炫目的灯光照射，成为众人的焦点，只不过是自欺欺人的想法。我们都是普通人，不像明星，吃饭逛街都会上热搜，你没那么重要，别人也没有那么多精力关注你的生活。 看到过一句话，深表认同：认识到父母平庸，自己平庸，孩子平庸。 特洛伊年纪虽小，但对生活的认知，淡然超脱，对父亲的愤世嫉俗，他用看得见的亲情表达了自己的爱，让布拉德感受到温馨与关怀，他委婉地告诉父亲只需做好自己的事情，不必太在意他人的看法。困扰布拉德的心结就这样被儿子解开了，他终于明白，家庭和身边的人才是他需要关注的，也才是真正关注他的人。 02、布拉德与妻子梅兰妮：同床共枕的伴侣，知足常乐与愤世嫉俗的碰撞与反转 布拉德的妻子梅兰妮在政府机关工作，她是个乐天派，对目前的工作生活非常满意。老公毕业于名牌大学，有轻松稳定的工作，儿子帅气懂事，学习成绩优异，一家人住在小城市萨克拉门托，有自己可心的房子，生活有条不紊地向前，一切都是她喜欢的模样。     但布拉德却认为妻子太容易知足了，她没有宏图大志，自己不思进取，还拉了他的后腿，让他沉浸在温柔乡里不能自拔，布拉德觉得妻子缺乏对他的鼓励和鞭策，没有给他奋进的动力。就连他随意为家人煮的番茄汤，梅兰妮都不吝赞美之词，他把自己的不成功，归结于梅兰妮对平庸生活的满足，这种满足削弱了他大展宏图的野心。 他不禁想到了大学同学，杰森娶了一位很有钱的妻子，她的父亲给杰森介绍了很多重要资源客户，带他走进富人圈子，社会地位逐渐显赫。克雷格的妻子，本人就很有声望，夫妇俩在各自领域相互竞争，比翼双飞，成为彼此成功的动力。     尽管布雷德一家过着衣食无忧的中产阶级生活，但在他看来，无异于贫穷和寒酸。只有像他同学那样飞黄腾达才是成功的标志。妻子梅兰妮却觉得，普通人的生活温馨而真实，这就足够了。 在分析了所有不成功的客观因素后，布拉德终于认识到，不能因为自己和同学的择偶不同而去责怪梅兰妮，把不成功的原因归结于妻子没有给他足够的鞭策也是借口，不思进取是他的错，而不是妻子的问题。 接受梅兰妮平凡真挚的爱，珍惜拥有的一切才是他今后真正应该重视的。 03、布拉德与朋友，睡在上铺的好兄弟，真诚与嫉妒的交错认知 布拉德大学期间有四个好友，他是五人中的灵魂人物，因为表现出色，深受德高望重的教授喜欢。毕业后，人生之路却出现了巨大差异。 尼克成了好莱坞大片导演，过着纸醉金迷的生活。杰森有自己的对冲基金，拥有三幢别墅，富得流油。比利40岁就卖掉了自己的科技公司，在小岛上与各色美女过着逍遥自在的日子。克雷格在白宫上班，写了不少畅销书，是电视上的热门人物，还是哈佛的客座教授。    他们一个个身价发达，金钱美女事业应有尽有。再看看自己居然被曾经的上铺兄弟拉黑。去波士顿想把经济舱升到头等舱，在儿子面前摆摆谱，也因为是从网上买的打折机票，而被工作人员冷漠拒绝。 当儿子申请哈佛大学受阻时，因为没有人脉，只能向讨厌的同学克雷格求助，一方面是为了儿子的前途，更重要的是能在同学面前炫耀自己培养出了一个天才，与成功的同学缩短距离。 实际上，杰森情绪低落地跟他诉说家里隐私，克雷格从未边缘化他，比利并没有觉得高他一等都是事实。同学还是原来的同学，布拉德已经不是过去的布拉德了。看到同学上了权威杂志封面或在屏幕上侃侃而谈，他的胸口就像被人重击了一拳，感觉全世界都在揭他的伤疤。 独白中，布拉德一边感慨光阴飞逝，自己一事无成，一边却止步于内心的纠结与不安，在嫉妒与郁闷中，错过了欣赏周围美好的一切。     电影中有个情节很有意思，老同学克雷格帮他安排了儿子去哈佛重新面试，最终被特洛伊喜欢的音乐教授录取。布拉德宴请克雷格时想坐中心位置被餐厅拒绝，而克雷格一露面，就被直接领到了布拉德想坐的位置上，领班还亲自为他俩斟酒，布拉德长久以来的嫉妒一瞬间爆发了，质问克雷格为何搞小团体排斥他？克雷格非常惊讶地说，我们从来没有这样做过，你怎么会这么想？在我心里，你们从来都一样。布拉德却认为他说了假话。 同学的真诚在布拉德看来都是做戏，他的嫉妒就像魔鬼，时不时出来让他不爽。原来，同学的真诚一如既往，是他的认知变了颜色。 04、布拉德与自己，矛盾的双面人，庸人自扰的焦虑与自我救赎的释然 1、幻想靠儿子的成功在同龄人中脱颖而出，瞬间又嫉妒儿子成功，希望这种成功属于他。幻想儿子在电视节目上嘲讽自己，让他相形见拙，于是儿子上哈佛的喜悦也被冲淡了。 2、看着儿子年轻有为的哈佛学姐，布拉德好像看到了年轻时的自己，指点江山，充满激情，甚至趁儿子熟睡，偷偷溜出宾馆和女孩子假装偶遇侃侃而谈，但女孩听完他对生活的抱怨后嗤之以鼻：您知足吧，50岁了还觉得全世界围着你转？     3、当听到杰森的私人飞机是是公司租来时，当得知在沙滩上与美女嬉戏的比利倍受毒品困扰时，布拉德的心里居然有一些释然与平衡。 4、布拉德从打破稳定生活选择激情创业，到后来逢人便说，别搞什么理想化，挣钱越多越好，想实现梦想就要做比尔盖茨，没钱就没有梦想。如果时光倒退30年，我的一切皆有可能，他幻想成功后，拥着两个美女走向海滩。     结语 有位作家说过，一个人如果不能按照自己所想的方式去活，总有一天你就只能按照自己所活的方式去想。 布拉德表面镇定自如，内心却深藏着不安和无力。人到中年，时间就像一首快进的歌曲，速度很快却听不清在唱什么，一切即将尘埃落定，有生之年却一事无成。想在尴尬的年龄搏一把，却让优柔寡断主宰了人生。 影片最后，布拉德放弃了与朋友的进餐，回到特洛伊身边，与儿子静静地聆听音乐，感受生活的美好。他看着舞台上的表演者，想到儿子即将迎来充满激情的人生，心情坦然而轻松，原来每个人都有自己的世界，聚光灯虽然照着别人，但不妨碍他热爱这个世界。     李诞说过，你不喜欢你生活的时代，你就只有痛苦。 所以，珍惜身边人，把握好自己拥有的，在意的，足矣。,,,0
33,33,26981174,你好布拉德,8804216495d7db0b589a036eca0b0f50,a32ec292850865cc502dbb6fc97abff4,4.0,2020-01-18 20:57:29,"确实是一部很有现实意义的电影，似乎能够看到自己未来中年的焦虑。 
布拉德似乎是未来的每个我们，默默接受自己的平庸，但是又不甘于平庸。
他甚至没办法去幻想自己儿子特洛伊的人生未来的不确定会让人陷入无尽的胡思乱想里。 
他爱着妻子梅兰妮的理想主义，却又为她的知足常乐觉得遗憾。但是平淡的生活里本来就是充满了很多不稳定不可能，常人很难去掌控自己人生的步伐。
每个人都想变成家里的超人，渴望成为家人的保护伞，可是很多时候我们还是觉得对一些变局觉得无能为力，心有余而力不足的感觉是不好受的，可是确实是每个平凡人生命中的常态。 
当布拉德在酒吧里和女孩谈论自己失败的职业选择后和过去时，突然觉得每个人不被怜惜的过去。 
“我觉得你挺幸运的，你50岁了，还觉得整个世界应该为你而转动。”  伤感的布拉德 
想来也是，没有经历过磨难的人，总是会为一些无足轻重的事情伤神，但总是无法走出。而经历过世间至痛的人，反而更能冲破一些世俗的束缚。这想起来有点讽刺，却又是真实的人生。人总是无法正视自己拥有的东西，而渴望获得自己没有的事物，并为此烦恼。 
中年人总是非常现实地思考问题，这让青涩的少年觉得古怪，中年人总是想要炫耀自己的成就，赢得别人的尊重，但是却忘了自己的初心。这大概是大多数人一生难以抗拒的走向。

每个家庭都有自己无法言说的苦痛和烦恼，人总是羡慕别人的闪光之处，却忘了自己有时候也是别人眼中的星光。

“老朋友是很重要的。”  老朋友的聚会 
需要多少年，我们才能明白这句话。很多时候，自己的直觉会产生许多误解，而误解会让人疏离。

高气场的人不理解对低气场人忽视会产生多大的伤害，而低气场的人会格外聚焦自己的情绪和感受，这才是最拧巴的地方。不在一个圈子或一个level的人很难成为知心的朋友，这也是很多矛盾的起源。所谓抗争，都是人在和自己的情绪作斗争。我们爱这个世界，却无法完全拥有这个世界，明白这一点，也许人不会有太多执念和烦恼。

“我依然热爱这个世界。”

希望中年的我也可以对自己说出这句话，也许，那时候的我，不至于让自己每天撕裂。

结局真的很棒，让人深思，又让人泪目。

我们还活着，还有很美好的未来。

布拉德：
""我担心人们看着我，觉得我是个失败者。""
特洛伊：
“他们并不会记得，因为每个人都只想着自己。你知道的，他们并不会在意。唯一你需要在乎意见的人，那就是我，我爱你。”

自己的家人永远是最重要的，着眼于当下，好好活着，每一天。",1.0,,0
34,34,26981174,你好布拉德,c33c7269f5738a890547195a799f6acb,a36e5df6089966dca4b38397aae00efd,,2019-11-16 20:43:22,人生的焦虑，一半是因为悔恨过去，一半是因为畏惧未来。活在当下，比什么都重要。 布拉德认为世界应该围着自己转，而不承认自己仅仅是世界的一个过客。 但当未来的可能性越来越少，过往的“错误”越积越多，这种无力感真的可能让一个人被压垮、被摧毁。 其实活在当下，是否又是另一种自我安慰呢？过往不恋，未来不迎，是智慧，也是自我的一番劝解吧。当人生明白大多事情并不掌握在自己手中的时候，活在当下也不过是另一种形式的随波逐流罢了。 但，随波逐流，不才是真实的人生吗？,,,0
35,35,26981174,你好布拉德,52ece6e9ea6939974c15779f375803a7,da8bde17a0eb54c8c2c73989151d6807,5.0,2019-11-09 11:42:48,什么叫更年期？哄热  失眠  烦躁  血压上升，过去说到更年期  多半是指女性-----女性月经不调   一月一次的不按时来了！体态臃肿，该紧致上耸的胸部也塌陷了。不该上肉的地方腰部腹部横肉满布。其实  男人 也有更年期现象，性功能能力下降。也有臃肿体态。更年期除了身体有病外  心理上认知能力也失去平衡。失眠   难经事情，一点小事就激惹  乱发脾气，搞得周围家庭人际关系紧张兮兮。牢骚  后悔不自信 自卑------ 有个作家来自大家族-------每天的晚餐是十多人一起聚餐，寒暄说话，不亦乐乎。某日，这个作家想试验下自己在大家心目中的作用，于是想做一个恶作剧------把自己藏在柜子里面等大家吃完饭再出来。结果没有一个人发现他的异常---别人该吃的吃该喝的喝，根本没有发现少个人。最后恹恹的作家只好灰溜溜地从柜子里出来，自顾自上餐桌打扫残羹剩汤------ 这个试验证明你在他人眼里并没那么重要。 过年过节，亲友聚会，大家也是高声喧哗其乐融融。 但是农村那种人多的流水席，动辄上100人数百人，吃饭排队抢座。吃完立即走人的，人与人也是没有多少寒暄的。就算是过年团聚，真正在乎自己的也不会超过家里的几个人-10多个人-----父母 配偶 子女 父母的兄弟姐妹------ 一句话，你在他人心里眼里并没有那么重要。就算是情侣，昔日的同宿舍死党----也是时过境迁各奔东西。就算是情人吧  不会有人原地等你的。旧情复燃-------当你厌倦后来的情人再去找寻过去的伴侣的时候，那个人也不会以前心目中的那个了。 片子里面的布拉德大叔，年轻时候选择了诗与远方。但是若干年过去后，与成名成家的时不时上电视的大学同学比较，与买小岛  买私人飞机的同学比较----发现自己被世界遗忘。经济上贫困（只能买打折机票  经济舱  为孩子大学学费发愁）上不了台面。 当遇见自己儿子的学姐时，面对对方投来的崇拜的水一样清澈眼神，不免自毁形象出其不意地戳破自己年轻时代的“”诗与远方“”，向对方大倒苦水。说假如能够重来，他愿意首选发家致富，大力蓄财而不是选择“诗与远方”。 其实我说人到中年，发展至今已经是过去的集大成者。成熟的你就要学会与现实和解，不客气地说------就是认命---认同现实中的自己。比东比西，或者懊悔自己的当初选择，已经于事无补；怪不得那个女孩子要教训他---快50岁了 还以为自己是世界的中心，全世界都该围着你一个人转。 人活的再成功，就是做了一国之长，或者富可敌国------要权有权要钱有钱，也会还有没落感  失意感-----看看那些大公大人物  几个临死时安心撒手瞑目。不安心  失眠   没病的人会克制自己，男人女人到了更年期了，控制自己情绪的能力下降，于是失落溢于言表有了种种懊悔----,,,0
