,Unnamed: 0,电影id,电影名称,用户id,用户名,评分,评论日期,评论内容,有用数,没用数,回应数
4,4,27077266,米花之味,989e7f41fb32ed6cd2236b71db247e68,4da5add9dbbed15445859a6965ddda15,4,2018-05-12 10:41:55,"首发：后浪剧场    《米花之味》从去年威尼斯电影节开始，就受到了国内影评界持续的赞誉。甚至在一些评论中，带上了“最”、“新”等颇具里程碑意义的词。从它的影响力，我们甚至可以说，谈论《米花之味》，是今年华语电影最为重要的事。
 《米花之味》，讲述了一个外地务工的母亲回到地处中缅边境村寨的故事，在母亲返乡期间，和自己的孩子，和村寨，发生的种种事情。这样的题材，在近两年的华语电影中并不罕见，《石头》《旺扎的雨靴》《那年八岁》《冈仁波齐》都算是其中的代表者。它们或表现孩童世界与成人世界的内在碰撞，或表现边陲的一隅。无论成色如何，起码我们在大银幕上感受到了文化的多样性。而《米花之味》，则拥有了更加轻盈的姿态，这也是它最为难得的一面。 这期后浪剧场，我们向《米花之味》导演鹏飞、女主角英泽，抛出了对这部难得作品的好奇和疑问。那些使电影成为电影的动人瞬间，也应该是我们留意和抓住的。
 体验生活 后浪剧场：我看完电影，对片中母女的印象非常深刻，有一种沉静之美。台词很少，动作很少，但能感觉到沉静中有一股强大的内心力量，我就在想演员是当地找的吗，后来查资料吓了一跳，发现女主英泽是高材生，专业还是社会政策和犯罪学。 英泽：我上大二的时候，就挺厌倦周围的生活，自己又有很多东西想要表达，就想做一些创作，加入了电影。找电影实习时，认识了鹏飞导演，参加了他的第一部片《地下香》，本来一开始想做制片的，结果做了演员。 后浪剧场：为了拍这部电影，你们有过两次实地考察，体验生活的经历。 英泽：对，少数民族非常热情，但要真正深入内心是很困难的。所以我一开始就用当地的语言，学习当地的技能，包括打扮，每天穿着当地的衣服，挨家挨户的串，慢慢让自己融进去。到后面就把自己当本地人了，有很多当地人还问我，“你是哪个寨子的”。 后浪剧场：除了一起干活、生活，有没有哪个瞬间产生“我变成了他们的一员”这种想法。 英泽：应该是思想上的靠拢吧，作为外来者总会带着偏见，一开始我以为他们会很向往城市里的生活，其实不是。很多价值观其实是外来人对他们的误区。 后浪剧场：所以是你先适应他们，不是他们适应你。 英泽：对的，我每天基本都被当地人所环绕，完全融在了这个环境里，中间只回过北京一次。 后浪剧场：你穿的是自己的衣服吗？ 英泽：没有，穿他们的衣服。 后浪剧场：这个很重要吧，衣服就像一个符号，如果你穿着耐克进去，他们会觉得不是一路人。 英泽：对，而且我会把自己涂黑，一边晒，一边涂助晒油。比如和我搭戏的小孩，当我们的肤色接近时，在情感上，她也会觉得很接近。但当我卸了妆，她就有点感到陌生了。 鹏飞：这里有个误区，其实他们也穿耐克、阿迪达斯。 后浪剧场：我的偏见。 鹏飞：那里的年轻人都很潮，棒球帽还歪带着，特别嘻哈。有一个男生，平时声音很细，到了摇滚节就开始嘶吼。完全不是我们想象的那样。 英泽：对，到了拍摄后期，我在候场时，有个人还过来拉着我说，“别往那走，他们在拍电影呢！”完全把我当本地人了。 后浪剧场：跟小朋友融入会不会比大人要更容易些。 英泽：是，而且我和这个小朋友非常有缘。在磨合过程中特别有默契，她有时会偷偷学我。比如最后一段的双人舞，有时我跳错，她也会跳错。长期在一起，就会越来越像。 后浪剧场：这也是我在观影过程中印象非常深刻的地方。整部片里，母女形似且神似。到了溶洞跳舞那段，这种感觉就到达了高潮。 英泽：谢谢，好多都是现场发挥。像溶洞跳舞，本来是有台词的，后来导演说让我们自己发挥一次，我们就没有说话。 鹏飞：那条我拍了八次，每一次对白都不一样，最后一次就试试不说话，让她们发挥。 后浪剧场：后来选的是最后一次。 鹏飞：对。  后浪剧场：说到留守儿童，我的第一印象就是沉重。据说中国的留守儿童有八千万，当时就觉得这个数字非常沉重。但从电影的第一个镜头小孩趴在车窗外，就打破了我的印象，整个影片都体现了一种轻盈。而且没想到边陲会这么美，鹏飞导演刚到那的时候，是这样的感觉吗？ 鹏飞：我一开始听说要去中缅边境佤族的自治县，想到的是牛车、雨淋和泥土，结果完全不是。高速一路就开到那里了，既有酒吧、KTV这些很现代的元素，又有浓郁的少数民族文化。 后浪剧场：有可能是我们被媒体的视角所控制了，很多电影和宣传片就是那种感觉（泥土、牛车）。相反，这种很轻松的氛围是不常见的，包括电影里有很多幽默的桥段。 鹏飞：其实是不经意间出现的。本来是很认真在拍的地方，没想到大家觉得很好笑。这就是生活当中的魔力吧。 所以，我不太愿意说是去体验生活，这就是生活。我去那时，没有和当地人说是拍电影，而是说一个志愿者，就像英泽一样，把自己当成本地人。我记得吃第一顿午餐时，傣族人民很热情，拿出一个白色的罐子，说你一定要吃，这是我们傣族的特色。我打开一看，酸蚂蚁。没办法，我就来一点吧，安慰自己是在吃鱼子酱。结果还挺好吃的，在嘴里砰砰砰的。后来在学校，和小朋友们做活动，校长给我做了一汤，挂了一爪子，咬呀咬的，咬不动，我说这什么肉啊。校长说，蝙蝠，吃吧。我说，哟！这蝙蝠能吃吗？吃吧，昨天吃的松鼠你也不知道。 后浪剧场：就是上来先把饮食上的习惯给统一了。 鹏飞：对对对。如果我没有生活在那个地方，我可能就拍不出来了。 后浪剧场：这个也需要很多成本，现在的电影比较追求速食，可能不愿意花这么多时间去体验。   最后一场戏用舞蹈来表现  千言万语都能汇聚  后浪剧场：电影里有很多神秘主义色彩的东西，比如各种仪式、山神，让我想到阿彼察邦，而且泰国也属于亚热带气候，也多山，是不是在这种地理环境下就会出现这样的文化呢，您是怎么理解和捕捉这种情景的。 鹏飞：首先我是不相信的，但很多寨子里的朋友都和我说，山神每次来都是附在阿婆身上。其实就是当地的传统，他们很相信这个东西，我要做的就是去还原。其实，当我写完这个山神戏的时候 ，都不知道怎么去拍。拍摄前一天，依然没想好，大伙都在等我，我说再等一会。这时，我就去要了三炷香、两根蜡烛、两杯茶，偷偷地跑到竹林后边，说山神大哥，小弟在此拍戏，请保佑我们拍摄顺利，请给我点力量，这样子。拍的时候，我把卷烟的烟丝给阿婆抽，她抽不惯这种，一抽就咳，但她摆了摆手，示意副导演继续，她就一直忍着，脸红了，声音也变了，一下子状态就不一样了。后面又拍了一次，就不行了。所以，在我想不出办法的时候，我也会用这种当地的方法给自己信心。 后浪剧场：我个人非常喜欢最后那场舞，最近以舞作为电影结尾的片子，从奉俊昊的《母亲》到贾樟柯的《山河故人》，都是表达一种情绪的释放和抒发，而在这部片子里是作为关系的和解。这场舞是一开始就设计好的吗？ 鹏飞：对， 没写剧本前，就决定以舞蹈来表达人和人的情感。我第一天到傣族寨子是个晚上，我放下书包就去旁边的寺庙看他们跳舞，当时是在准备泼水节，后来我发现，不管是节日、演出，还是结婚生子，他们大多都是以舞蹈的形式来表达情感。我就在想，为什么是舞蹈，可能这种肢体语言在表达情感上会更加虔诚，比语言要更准确，用舞蹈表现的话，千言万语都汇聚在这里了，每个人的心声也都在里面。 后浪剧场：看这场戏的时候，两个人在跳舞，光打过来，两个人的影子都印在了墙壁上，下边又是水和倒影，有一种柏拉图的东西在里面，蒙昧与文明，各种观念的揉杂就像影子一样，分不清到底什么才是真实的。不知道您有没有这层表达？ 鹏飞：没有（哈哈哈哈）。我觉得这就是肢体语言的力量，或者最原始的表达的力量。能展开自己的理解。 后浪剧场：有一种返璞归真的感觉。    “后浪剧场“是一个电影播客，在喜马拉雅、网易云音乐、荔枝、podcast、QQ音乐搜索“后浪剧场”即可收听。 https://movie.douban.com/review/9361231/",8.0,1.0,0
5,5,27077266,米花之味,5c9c4b82bfa462ff3f6d153526db26d1,7cc7de91ce782cd38510a2c63ca87df3,3,2018-04-24 00:13:38,导演鹏飞曾作为蔡明亮的助理导演合作过多部影片如《脸》和《郊游》，不过这部新作里却少见蔡明亮的影响，尽管还是有几个固定机位的静默长镜头。鹏飞镜头下的人物充满了灵气与生活气息，与蔡氏电影里沉默寡言的角色有着天壤之别。显然地，导演的风格更像是小津安二郎和是枝裕和的日常化，用琐碎的生活片段拼凑还原出一个云南傣族乡村小镇的模样。从开篇的民族舞蹈，到神秘的请神仪式，再用上清新脱俗的配乐，无疑都令人眼前一亮。 然而这毕竟只是导演的第二部作品，掌控力远不及刚提到的两位日本大师，叙事太过碎片化，难以用一个人物或线索统领起来。母女关系的演变貌似贯穿整个故事，发展到中段却转移到乡村留守儿童问题的探讨，更遑论还有诸如传统思想与现代价值观的碰撞，以及乡村与城市化的利弊等，这些众多抢眼的素材在影片里此起彼伏，蜻蜓点水般的处理导致主题过于涣散而失去焦点。 令人欣慰的是，国产片里的留守儿童题材终于不用摆出凄凄惨惨的苦脸，或者阴郁消极的姿态去招徕观众，反而换上一副乐观轻松的口吻进行叙事。出其不意的幽默与流畅的生活感不断瓦解掉故事里的沉重感，令此类反映现实的故事有了新的呈现角度，这也算是导演的风格化标签。而影片中关于传统与现代，以及乡村与城市的思考，跟意大利女导演爱丽丝·洛尔瓦彻那部《奇迹》十分相似，尤其是两部电影的结尾都有一个发生在山洞里的超现实意味场景。不过相比起《奇迹》那个梦幻十足的结尾，《米花之味》的神秘气息不够浓烈，没能充分利用云南这个少数民族地区的特色，如果结尾处理得再飘逸一点，会更有鲜明的作者风格。,2.0,3.0,0
6,6,27077266,米花之味,bd5420f06fe6808b619977222ebf0c95,11dd207ee25bf54dfb31bafc3c698059,5,2021-11-02 13:20:03,"味觉，是人类感知食物最灵敏的器官之一。很多人小时候也吃过米花糖吧，那种酥酥脆脆的感觉，依然在心头怀念。

云南的小村子总是静谧而又神秘，而村子的孩子也比大都市的孩子更加淳朴和无邪。而留守儿童和这两种孩子都截然相反。影片开始出现在镜头卖鸡蛋的孩子折射出留守儿童的悲悯之处，进一步引出了女主孩子的处境和她也类似。当叶喃从外面回家时，发现自己的孩子和以前判若两人。爱撒谎，玩手机，与同学争执，跟老师唱反调，还偷寺庙的钱，一切不好的习惯都养成了。叶喃用她认为的教育方式教导孩子时，却丝毫没有作用。从小不在父母的身边的孩子，被爷爷奶奶带大的孩子，或多或少都会无法管教吧。留守儿童是中国目前最大的问题之一。多少孩子辍学，多少孩子从可爱善良变成了浑身充满恶习的人。农村教育和经济改革和发展才能让年轻的父母不在远走他乡，陪伴孩子一起成长。

楠杭朋友的突然离世，好像是化解母女关系的契机，没有父母在身边，老人很多时候无法觉察孩子是否健康。叶喃学着村里人炸米花，教女儿舞蹈，为她的朋友祈祷，在这一刻，两人的隔阂好像慢慢消失了。生活，也像炸米花的过程。开始的油温似平静如水的童年，后面油温越来越高似热烈滚烫的青春年华，而后逐渐绽放光芒。酸甜苦辣皆在此，幸福的日子也总会来临。

影片结尾，又出现了卖鸡蛋的小女孩。叶喃似乎想明白了，不再远走。留在女儿身边，陪伴她成长。父母也许都很矛盾和无奈吧，但孩子们很多时候所需要的不是父母每个月的生活费，而是和父母能够一日三餐酱醋茶。

一部小众的文艺片，却带给我们深刻的思考。导演将母女之情和自然之景恰到好处的融合，含蓄的表达之下而耐人寻味，像一部画面感十足日本温情电影。",,,0
7,7,27077266,米花之味,dcf37d7e7257153266ba16fa1abb7b48,1c529e4b4545b7e59533dda85044fcf6,4,2021-10-05 22:36:38,叶喃是不容易的，赚钱是为了让孩子有更好的生活和教育。而为了赚钱又不得不缺席孩子的成长，真的是一个两难的选择。辞掉大城市的工作是很不容易的，选择回到村子里。生活品质其实是下降的，而且还要忍受村子里的流言蜚语。我觉得女生离了婚不代表她就是有问题的，这是老一辈的思想。喃杭有了很多坏毛病，长期留守，老人家不会教总是说长大就好。但是习惯的培养是一朝一夕，而不是一夜之间。她想为女儿提供更好的生活固然没错，但时间很无情。如果女儿长大了，成人了养成了坏毛病那她又从何管起，赚再多的钱又有什么用呢？片头卖鸡蛋的小女孩，埋下了伏笔。片中后叶喃心凉准备离开，但是看到小女孩又想到自己的女儿。她又留下来了，她可以去往大城市追求自己想要的生活 。但是她没有。她为了喃杭忍受村子里的流言蜚语和一般的生活。她非常的伟大，非常.....,,,0
8,8,27077266,米花之味,dcf37d7e7257153266ba16fa1abb7b48,1c529e4b4545b7e59533dda85044fcf6,4,2021-10-05 22:36:36,叶喃是不容易的，赚钱是为了让孩子有更好的生活和教育。而为了赚钱又不得不缺席孩子的成长，真的是一个两难的选择。辞掉大城市的工作是很不容易的，选择回到村子里。生活品质其实是下降的，而且还要忍受村子里的流言蜚语。我觉得女生离了婚不代表她就是有问题的，这是老一辈的思想。喃杭有了很多坏毛病，长期留守，老人家不会教总是说长大就好。但是习惯的培养是一朝一夕，而不是一夜之间。她想为女儿提供更好的生活固然没错，但时间很无情。如果女儿长大了，成人了养成了坏毛病那她又从何管起，赚再多的钱又有什么用呢？片头卖鸡蛋的小女孩，埋下了伏笔。片中后叶喃心凉准备离开，但是看到小女孩又想到自己的女儿。她又留下来了，她可以去往大城市追求自己想要的生活 。但是她没有。她为了喃杭忍受村子里的流言蜚语和一般的生活。她非常的伟大，非常.....,,,0
9,9,27077266,米花之味,dcf37d7e7257153266ba16fa1abb7b48,1c529e4b4545b7e59533dda85044fcf6,4,2021-10-05 22:36:34,叶喃是不容易的，赚钱是为了让孩子有更好的生活和教育。而为了赚钱又不得不缺席孩子的成长，真的是一个两难的选择。辞掉大城市的工作是很不容易的，选择回到村子里。生活品质其实是下降的，而且还要忍受村子里的流言蜚语。我觉得女生离了婚不代表她就是有问题的，这是老一辈的思想。喃杭有了很多坏毛病，长期留守，老人家不会教总是说长大就好。但是习惯的培养是一朝一夕，而不是一夜之间。她想为女儿提供更好的生活固然没错，但时间很无情。如果女儿长大了，成人了养成了坏毛病那她又从何管起，赚再多的钱又有什么用呢？片头卖鸡蛋的小女孩，埋下了伏笔。片中后叶喃心凉准备离开，但是看到小女孩又想到自己的女儿。她又留下来了，她可以去往大城市追求自己想要的生活 。但是她没有。她为了喃杭忍受村子里的流言蜚语和一般的生活。她非常的伟大，非常.....,,,0
10,10,27077266,米花之味,b38fac2fee6285145c40094139d6d062,75fe2bae8013252a8129a1550c3cd0e8,4,2021-03-29 09:16:57,今天看的这部电影名字叫做《米花之味》，电影还不错，最棒的一个场面就是最后的时候女主和自己的女儿在洞窟里面翩翩起舞，这段有点儿《山河故人》里面那个味道了，不过不如那部电影。        电影还挺好看的，山洞里面的易拉罐桥段很讽刺，因为山洞一直一直锁着门，就算是大家专程上山，也没有进去。现在的时候母女两个人偷偷进去了之后，才发觉里面其实有一个易拉罐的瓶子，而且还是最近才放进去的新的易拉罐的罐身，很讽刺。        电影没有大悲大喜，没有大起大落，平平淡淡的一个个场面，每个场面里面的情节都让我觉得感动的不行。                      “小小少年，很少烦恼---但愿永远这样美好”        上周看学生自习的时候，他们趁着这个时间在玩笔，然后他们把这个笔放在一起看谁能够把“笔”弹下去，我看到这里的时候我笑的不行，我想说这有什么好玩的呢？         然后我就发微博讲说：“正如我理解不了孩子们的快乐，他们也理解不了我的痛苦”。有些时候我们隔得这么近，但是又隔得这么远。        我们小小少年，这么少的烦恼。 Part   01. 叶楠：游离漂荡，变味的米花---        叶楠从外面回来了之后，发现了城市里面变化多端，很多地方都不如以往。叶楠在上海买了一辆车子回来，回来了之后村子里面闲言碎语讲说这钱来得不干净---不知道叶楠的钱到底是怎么来的，但是这些话语让人听起来的时候也挺难过的。       女儿说叶楠离了婚就拿着自己撒气，和姥爷生活在一起的时候，孩子痛快自在而且还开开心心，我看小孩子就是喜欢那些不管自己而且还对自己好的人吧，爷爷天天做好吃的饭菜给她吃，只要你对孩子们好，还不吵他们的话，他们比谁都开心。        叶楠刚刚回村，拿了一大堆的好吃零食给她。她背着书包，拿着零食，身后一堆小孩子一起在吃饭，我看到这里的时候我觉得很庆幸，因为虽然孩子们是留守儿童，但是大家都很开心，大家都觉得很幸运。        女儿说妈妈离了婚拿着自己出气，从始至终不见自己的父亲。生命大概就是如此吧，生命就是如此难熬的吧，生命就是这么让人惊讶不已的吧。        村子里面的闲言碎语把人搞得透不过气来，米花早已经变了味道，自己的孩子也变了味道，变得叛逆，夜不归宿去打电脑游戏，母亲归来，爷爷稍微轻松了一点点；母亲看到孩子这么让人生气的时候，真的是气不打一处来，生命就是这个模样的吧。 Part   02. 喃杭：只要你回来，什么时候都不晚---        我觉得喃杭没有讲出来的一句话就是：妈妈，只要你回来，什么时候都不会晚的。        喃杭像是所有的坏小孩一样，会偷东西，会乱拿钱，会因为自己的班主任吵了自己而拿走他的手机，也会偷偷拿走他的车钥匙，因为大家真的是有很多的难过和不开心，所以说才会变成如此。        喃杭一直没有讲说自己很爱自己的妈妈，喃杭也一直没有讲说自己很希望自己的妈妈回来，喃杭也一直没有讲说自己很期待自己的妈妈带回来的零食。        哪个孩子不渴望自己的妈妈爱自己呢？哪个孩子不渴望自己的妈妈对自己一直一直很好呢？想来想去，每个人都希望吧，希望生命变得更加美好吧。,,,0
11,11,27077266,米花之味,6b95550ec6625ef0b1386569d533c22c,599cb526ec8e85e6f9e59cc5d24bc417,5,2021-03-21 20:35:35,因为《又见奈良》的宣传，《米花之味》浮出水面。 云南话和四川攀西地区的腔调很像（其实气候和风土人情也像）。曾经去西昌支边半年，也有好朋友在那里，这部影片让我倍感亲切，想回去看看了。 纪录片一样娓娓道来，好多空镜头，天空山地田野竹楼，没有大悲大喜，但却润物无声，看得很感动，眼红鼻酸，有些小细节又让人忍俊不禁。 智能手机已经广泛普及的今天，仍有很多查询不了解决不了的问题，善良虔诚与愚昧无知，似乎也不冲突，无可奈何，至少看不到精致的利己主义者。 如果你喜欢日式美学，喜欢《那山那人那狗》和《熊谷守一在的地方》，你会喜欢这个味。,,,0
12,12,27077266,米花之味,37b70a6572c65427ee438787fa2ea3c9,d0915f45cb8404bf59238ce85c822a0b,3,2021-03-13 12:36:17,"我是觉得分成三部分来看
第一部分，无比抠脚尴尬的唠叨戏份让我一直找倍速键在哪，她们就是说话怪怪的，就是感觉像假人在说话，冲突不明显很平淡，而且是话语来回唠叨没力量，没话找话让我非常不舒服，可能导演是想给我们这种感觉，让我们察觉母女之间的尴尬与沟壑，但是真的很劝退
第二部分，网吧事件以后，就在我以为这个女人要用无力的话语大闹网吧之后，她却出乎我意料的平静，这种让我开始思考和舒服，有点日本的那种感觉了，沉静带着点淡淡的愁苦，以后他们母女好像是关系开始发生变化
第三部分，旁边那个女孩死掉的前后，宗教部分之前就有埋线，无论是结婚去寺庙，还是叫魂情节，请山神，这些都在最后“今日休息”那全部爆发出来，让我大笑，但笑完之后，飞机飞过，又让我有点想不通，他好像并没有故意强化封建文化与当代文明矛盾，好像就是淡淡告诉我，“你看，是这样”，这种淡淡的话语反而让我笑后沉思，最后的跳舞很惊艳，光影姿态摇曳，傣族自带的神秘感出来了 其实感觉导演想说的蛮多，两个矛盾，留守儿童与打工父母的，封建文明与当代文明的碰撞，但其实是有些东西没看懂，比如女主为什么突然不走了，是什么启发她继续留下来陪女儿呢，那个男孩大嘴巴又是为什么给他特写呢，还有那对两只鸡分手随后结婚的人代表什么呢？快餐爱情上山下乡吗？ 感觉镜头上，总是这样，看着手上动作特写，画外人说话，还有那种莫名其妙的凝视，各种凝视，可能是有些留白和日本电影那种感觉吧，后半段有了事件（网吧）就感觉有意思了，前半段让我真的想退出，整个素味带着，有些素味回味让我觉得奇妙，有些则觉得就还好，食之乏味 整体还是觉得厉害的，不过他对标的那个日本的电影还没看，回头去看一下",,,0
13,13,27077266,米花之味,8fda4a0e0e49db73df0c89bc6aeab994,82c09946cb71c4ce0eef694d90da53c5,5,2021-03-04 22:05:40,叙事 典型的古典叙事 叶喃和楠杭，一对执拗的母女，两人之间夹杂着不善表达的，生疏的爱。也终于在共同经历了许多之后，达成了和解。面对女儿的坏毛病，叶喃没有像我们期许中的一样，强烈的反抗和斥责，更多的掺杂了一种愧疚和无力，女儿的叛逆或许也只是作为孩童偶然寻找的快乐。整部电影像纪录片般真实。各种冲突，落后都被幽默的摆放整齐。很独特。叶喃的衣服也随着故事情节的发展改变着，或许是过度解读吧，我不知道。在构建真实世界时，鹏飞过滤掉了许多故事性的片段，都说起承转合，米花之味不会过于强求你的眼泪，也不会陷入思维定式而理所当然的认为留守儿童就应该是多么悲惨，他们自己都在开心的唱着小小少年，他们只是一群快乐的孩子。,,,0
