,Unnamed: 0,电影id,电影名称,用户id,用户名,评分,评论日期,评论内容,有用数,没用数,回应数
0,0,27077266,米花之味,09916ff7d36b5bed9ad8bd9890157ef1,94b2602c3f8ba77964843eac200a4ae3,4,2017-09-17 15:15:17,"不散完美记者 | 蜉蝣／哪吒男 首发于：不散微信公众号（ID:busan-movie） 拍摄当下中国的哪一面会最触动你的心？ 过去，人们总批评中国电影是靠“卖惨”来获取外国人的同情，但这个时代已经过去了，讲述中国人生存现状的电影，在国际舞台上才真正具有竞争力。然而青年导演的作品往往会陷入“为了吐槽而吐槽”的恶性循环，根本没有搞清楚自己要表达什么，先摆出“揭露”的姿态，题材大于讲述，立场大于情感，反而拍不出真正打动人心的作品。 正在举行的第74届威尼斯电影节一部“特殊”的中国电影，取得了不错的上座率和评价，它叫《米花之味》。作为世界上最古老的国际电影节，威尼斯电影节秉持意大利电影新现实主义的传统，表彰过《秋菊打官司》《三峡好人》《站台》等表现中国现实的作品，那么《米花之味》呈现的是怎样的中国现实呢？ 威尼斯电影节闭幕 《米花之味》女主英泽和导演鹏飞 见识大城市之后她回到云南边境的小寨子里，发现自己的故乡和女儿都变了。《米花之味》对准当下中国最大的现实——改变，在改变的大语境里代际沟通、女性地位、宗教文明、城乡差异都被《米花之味》用圆融的姿态讲述。 《米花之味》作为导演鹏飞的第二部作品，入围了2017年威尼斯电影节“威尼斯日”竞赛单元，这是他的第二部导演作品，也是他第二次入围威尼斯电影节，这位年轻的80后导演正在把中国的另一面带给世界。    不散： 电影虽然是讲留守儿童的题材，但是非常乐观健康，而不是用很极端的叙事来博得大家的关注，我很喜欢这种态度。 鹏飞：一般我们想到留守儿童就会觉得比较灰色、比较惨，但我不想拍这些，拍这样风格电影的导演很多，也不差我一个，我希望能从另外一个感觉把它拍出来，所以我选择了一种比较调皮的方式。 也是跟我喜欢的导演有关系。我很喜欢北野武。有些话题确实是残酷的，但是他的镜头很简单、很干净，该爆发或者感人的时候，又能做得很准确。这是我很喜欢的。当然我很喜欢蔡明亮导演，他对我影响非常大，甚至有一段时间我还陷到他的美学里边，无法找到自己，现在是试图在找自己。  ▲作为蔡明亮和北野武的“粉丝”，鹏飞导演幸运地在《米花之味》中组合出偶像级阵容： 摄影廖本榕是蔡明亮的御用摄影师合作过蔡明亮的几乎所有电影；配乐铃木庆一与北野武合作多次并凭借《座头市》《极恶非道2》屡获大奖，还为《东京教父》《不求上进的玉子》等作曲；剪辑陈博文六次提名金马奖，是《一一》《牯岭街少年杀人事件》《赛德克·巴莱》等电影的剪辑师。 不散：很意外地知道您居然是北京人，是为了这部电影特意去云南生活的吗？ 鹏飞：我是在去云南的中缅边境一个傣族的寨子体验生活了一年。这个寨子我找了八个月才找到。我的小演员们住在很远的一个山上，回家要八个小时左右，所以他们大概每个月只回去一次或两次。有时候我会送他们回家。在送他们的路上，我注意到这个寨子，旁边的寨子已经都是水泥造的了，只有这个寨子还是竹子的。 不散：怎样开始的剧本创作？女主角英泽也是编剧之一，她具体写的是哪部分？ 鹏飞：剧中的大部分事情都是真实的，我把它记录下来，慢慢编成一个故事。演员除了英泽和老师那个角色之外，都是当地人。对于母亲这个角色还有女性的心理，有时候我拿捏不好，就会请英泽来帮我。她也是我上一部长片的制片和女主角。她给我的很重要的启发是，她觉得女性是坚强的，而不是哭哭啼啼或者脆弱、懦弱的。所以这片中的母亲你能看到好像有女性光环在里面，她是情感不那么容易外露的一个女人。 
不散：女演员也是提前去寨子里面学习的吗？ 鹏飞：提前四个月去学习语言和舞蹈，更多的是了解当地人的走路、习惯、眼神、风气，这样的东西。 不散：带动小孩子去表演对你来说困难吗？ 鹏飞：其实都还好，孩子都很聪明，只有一场戏，当时我记得我给这个小孩写的是悲伤两个字，她好像平时不怎么说这个词，拍了好几遍都绊嘴，她就是说不出来。而且关于悲伤，我们和她的理解好像也不太相同。妈妈悲伤是因为看到寨子里面的人在女孩刚死就急着分钱，女孩的悲伤则是她完全不知道死亡是什么东西。 ▲导演鹏飞与女主角英泽都常年在国外求学，《米花之味》中小女孩面对刚刚回家的母亲躲在被子里和母亲说话的场景就来自于英泽自己的亲身经历。  不散：电影为什么要叫《米花之味》呢？ 鹏飞：米花是傣族的象征着团圆和祝福的一个食物，他们会在泼水节的时候做，送给佛祖和送给我们身边的亲朋好友。对于留守儿童和返乡青年，这个东西也象征着他们的团圆。而且米花这个东西我觉得更有一层深意，我自己是这样去想的：米是我们种出来的，就像孩子一样，如果我们没有管教他的话，米花、米酒都会变了味道的。所以就像片中山神说的，觉得村子里的米花、米酒都不好喝了。但这个是藏在我心里的，可能观众不会捕捉到。 
不散：片子的女主角是有原型的吗？ 
鹏飞：是几个形象结合到一起，融合了当地三个女性真实的故事。  不散：电影里关于宗教的冲突其实很有趣，可以为我们讲讲吗？   鹏飞：电影是在中缅边境沧源一个佤族自治区的傣族寨子里面拍的，它是一个少数民族融合的地方，佤族居多，佤族、傣族、拉祜族、彝族还有一点点回族。有很多宗教习俗可能在大城市看来是没必要的，也是对女性稍微有点歧视的，但当地的女孩们都非常的遵从。我觉得这是这个地区的特色，所以想保留在电影里。 这个母亲是一个相信宗教又很有原则的人，但她在着急找女儿的时候，这些（宗教的禁忌）对她而言就都不存在了。而且英泽也给了我一个启发，她觉得母亲这样在外面见过世面，又会思考的女强人，是不会轻易打骂孩子的，而是会意识到因为自己不在身边而欠缺了对孩子的管教，所以想要弥补去教育她。 
不散：我想说的是，你在电影里对年龄、城乡、性别、宗教的冲突采用很巧妙的方式，就是你既不是很尖锐地说我跟你撞吧，也不是说那我就妥协吧，而是很圆融，让双方都保持尊严，这样的处理方式很少见，为什么你会有这样的一个态度？ 鹏飞：可能是因为，如果我再去说这个冲突，加紧力度的话，我可能会让观众迷失，你到底是要讲宗教，还是要讲母女？专注于讲述母女之间的故事的时候，那些冲突其实就不见了。  不散：为什么电影里没有关于母亲在城市或者她婚姻的任何交代？ 鹏飞：因为当没有这些镜头的时候，就会给你无限想象，去猜测她的生活是怎样的。我觉得交代得太完整，这个故事就被锁住了。 
不散：我们都知道您是蔡明亮导演《郊游》的编剧，当蔡明亮的编剧是一种什么体验？ 鹏飞：这个问题的话我不知道我答出来，蔡导看到会不会骂我（笑）。 蔡导他的电影，你说它没有什么剧情，其实编起来非常难，怎么样在这样长的镜头，这样简单甚至没有故事的过程中，能让观众感受到你的想法、你的意识。所以要在每一个镜头、每一个人物的细小动作反复推敲。 
不散：比如有些节奏非常缓慢的镜头，在普通观众看来可能是没有严谨控制的，节奏方面也会在剧本里面体现吗？ 鹏飞：我觉得蔡导的剧本，是有他自己的节奏的。他的剧本有点像诗的感：小康、走路、举牌、累了、尿尿、回来.......就是这种感觉。所以我们编剧的时候会在想小康做这个好不好，做那个好不好，做这个有意思，那个没意思，需要在找到诗的节奏和韵律来设计动作。 ▲蔡明亮导演，鹏飞参与编剧的《郊游》曾获得第70届威尼斯电影节评委会大奖，第50届金马奖最佳导演、男主角。  ▲正在举行的2017年威尼斯电影节蔡明亮导演（左）执导，李康生（右）主演《家在兰若寺》入围“VR电影”竞赛单元，鹏飞（中）导演《米花之味》入围“威尼斯日”竞赛单元。 不散：这次的摄影也是蔡明亮导演的御用摄影师廖本榕，但《米花之味》的影像风格跟蔡导的差异很大。 鹏飞：对，蔡导对我的影响确实非常大，我拍片子的时候他的美学对我的影响到，机器摆成什么样的我都觉得不好看，只有摆成蔡导那样，我才会满意。 
但那是蔡导的镜头语言，不是我的。 
也有人劝我说不要找廖本榕先生，不然会更加影响我。但我觉得导演和摄影之间的沟通是更加重要的，我跟廖先生聊了很多自己的想法，他也会给我一些指导，才慢慢的摸索到了自己的风格。廖先生是台湾元老级的摄影师了，今年快70岁，但是他的敬业真的打动了我们全组。他坚持要自己拍，经常还要爬到很高的山上，我们都是又担心又感动。 
不散：注意到音乐的部分是请到了铃木庆一，有云南的特色，又有点电子。 鹏飞：我希望用到一些乡村的声音元素，还有傣家的特色。我很喜欢北野武导演的《座头市》，它的故事也是在乡下，所以我们会听到锄头锄地、木屐等等的声音组成一个节奏，我觉得很有特色，所以就试着去找了一下铃木庆一先生。他来到云南的文工团，把所有的民族音乐和街上的声音全录了一遍，来感受一下当地的习俗，回去之后就做出了这样的音乐。  不散：上一部作品《地下香》去威尼斯的时候，有人采访你，你说，可能从第三部作品或者第四部作品开始就进入商业，或者比较有商业意味一点。那现在第二部作品了，你这个计划改了吗？ 鹏飞：没有。因为我觉得商业也可以做成很有意思的商业，也可以讲一些更有意义的事情。比如《米花之味》你可以觉得它是一个艺术片，但是又比其它艺术片那种更加大众可以接受一些。所以今后要拍一些商业片我也会坚持这种原则。 
因为蔡导也跟我说过：电影是一个很认真的东西，你不可以为了取悦谁而随随便便地拍一部东西，作品必须有属于它自己的完整表达。

不散：《地下香》是你的第一部电影获得了2015年威尼斯电影节“威尼斯日”单元的最佳影片，是讲什么题材的？ 鹏飞：它是讲北漂，其实《米花之味》可以说是《地下香》的一面镜子，《地下香》是讲出去在外边的人的生活，《米花之味》是讲外边回来人的生活。《地下香》在地下室里拍的，还是会有点压抑，但我已经很努力地把它拍到最有美感、最优雅。 不散：那你下一部电影大概会拍什么题材呢？ 鹏飞：我会把我在云南这一年的经历拍下来，还是剧情片。因为在云南经历了很多很多，我希望能把《米花之味》里没讲的故事继续讲下去。  不散：非常喜欢结尾溶洞里面的那场戏，这个的感觉都特别的清新、空灵，好像能够把电影带到另一个地方。 鹏飞：我希望大家在看到最后溶洞那场戏的时候，能够把前面的故事都忘掉。有个镜头是母女两人在抚摸岩壁，其实她们实在抚摸宇宙行程的历史，我想能够在结尾升华一下，让观众来感受历史的痕迹。  
当明亮、乐观、俏皮成为观察中国现实时的一种异类，《米花之味》带来的感动与惊喜才显得珍贵。
希望更多人珍视这块米花简单真挚的味道。   
· THE END · 这是“不散”的 第 462 期 文章，女演员本人特别白特别美。 ©️本文原创首发于不散微信公众号（ID:busan-movie），未经授权禁止转载。",196.0,30.0,27
1,1,27077266,米花之味,f262f8afe3af418db0941a91b65b2d77,fc5963ac52cdeeddd9241035e75ae877,4,2018-04-18 19:23:14,"By艾晨 在天山电影院看了《米花之味》的路演。电影没有大喜大悲、大起大落，平平淡淡，看着确实有点米花的味道。导演说米花在傣族里寓意团圆、祈福，电影里的“米花”当然另有所指，点题就是片中神婆那句“你们在地里加了什么，米花味道都变不好了”（大意）。理解这个“变”，我想也就理解了这部电影。 一开始我觉得叶喃（电影女主角）演得很生涩很拘谨，以为这是一种“近乡情更怯”，加上留守儿童题材，这种既熟悉又生疏的感觉也是理所当然。但是随着剧情的推进，各种生活琐事接踵而来，叶喃的这种生涩和拘谨反而显得更真实。 关于这点，可以参考《杰出公民》，所谓的“回不去的乡愁”，叶喃回家吃饭时，说每天念着想着的就是这个，但是真吃到的时候却不是那个味；女儿以前可爱懂事，现在也各种叛逆不听话；邻居不再淳朴，反而各种八卦、诋毁……一切的一切，都让她觉得无力。 此外，女儿与妈妈，老人与年轻人，飞机与泥路，城里与山里，发展与守旧，片中充满了各种尴尬和对立。有的人习惯了“村里”的生活状态（比如那些老人），有的人尝试去接近“城里”的生活状态（比如说发展旅游业、太阳能那几位），有的人则两边的状态都经历又都想逃离（比如女主），还有的人则处于选择的阶段，比如女儿，她不懂“村里”和“城里”有什么区别，对她又意味着什么。她任性地行使着这个年纪的权利，因为这是父母不在家带她、老人在家不懂带的结果，做错了她说她要“和外公呆一辈子”，却又好奇地问妈妈“城里是什么样的”。 电影开场买鸡蛋那一幕，叶喃当时的眼神是“饶有兴致”的那种，觉得眼前的小女孩很有趣；但是经历了一系列事情之后，当她决定开车回城里的时候，再次在路上看到卖鸡蛋的小女孩，却眼睛一酸，快要哭了。前后两个镜头的对比，不只是说明叶喃“恍然大悟”，也是要让观众看到，村子里这么多留守儿童，包括卖鸡蛋的小女孩、自己的女儿，都是叶喃这样出去城市的父母造成的。 当然电影主题的东西见仁见智，《米花之味》最精彩的地方是丰富的生活细节。这些细节让电影变得异常可爱。 PS：以下涉及剧透，不过没太多关系。 叶喃给女儿买了好多吃的，第二天上学路上，四个小孩一前一后走在路上（后面又进来第五个人），这一幕应该是在致敬“abbey road”，导演你说对不对？              老师摆弄巧克力那场戏就不用说了，简直可爱死了。 叶喃去女儿房里，开灯查看后又走了。女儿开灯却发现她就在旁边。这个桥段，现在抖音经常可以看到。 女儿去看望生病的喃湘露，说要给她变魔术，然后拿布一抖，当当当当。这个桥段也是抖音的大热门：karma is a bitch。 叶喃带着女儿和其他人回来，在车上叫他们唱歌那一幕，一群人摇头晃脑的，让我想起了金凯瑞“周六夜现场”那个经典的摇头晃脑的镜头。 





 类似的有趣的细节电影里还有很多。不过关于《米花之味》，我最好奇的一点是，叶喃为什么回来？从电影里提供的信息来看，她以前也回来过，但都是匆匆几天就又回去了。这次回来，别人问她什么时候回去，她说还不确定。她在外面（城市）到底发生了什么？邻居的闲言碎语说她是在外面做了不好的事，女儿则质问她是离婚了才不要自己。但叶喃却说不要信他们乱说。具体发生了什么我们并不知道，但是这件事情肯定不是可以一笑而过的小事。 电影最后，母女二人在溶洞里共舞。这也是全片最美的一幕。溶洞内外，两个世界，虽然暂时的隔绝不代表完全的和解，但是当母女两人一起翩翩起舞，那一刻，你的心也会跟着静下来，连时间都仿佛停止，只有溶洞里的滴水声清晰可闻。 2018年4月18日",39.0,14.0,4
2,2,27077266,米花之味,597439f19f260c12ad4a7016e87f77ee,a2eed603a29ec4d1a5a2248714ee09a8,3,2018-04-21 15:26:35,"将于4月20日在全国上映的电影《米花之味》4月8日在中国人民大学举办了首场校园路演。影片放映后，导演鹏飞、女主角英泽与观众进行了1个多小时的现场交流。 据鹏飞介绍，影片《米花之味》主要讲述了外出务工的叶喃返回家乡云南省沧源县的一个边境小寨后，与处于叛逆期的女儿喃杭之间由陌生、疏离到互相理解、和解的故事，其间产生了一系列城市与乡村、传统与现代观念的冲突和碰撞。影片结尾，母女二人在溶洞共舞的超现实表达方式，更是引发了观影者对于“什么是人类最本真的追求”的思考与探讨。 之所以用舞蹈而不是其他形式，鹏飞认为，“《毛诗序》说，""情动于中，而形于言；言之不足，故嗟叹之；嗟叹之不足，故咏歌之；咏歌之不足，不知手之舞之足之蹈之也。""舞蹈是人表达感情的最高境界、终极手段。”正如影片在平遥国际电影节获“观众票选最受欢迎影片”的颁奖词所言，“明亮艳丽的画面背后，蕴含的是人文主义的关怀，让我们看见了这个时代最珍贵的东西。” 溶洞共舞是整个电影的结尾，也是高潮，母女之所以去溶洞共舞，是因为女儿喃杭最好的朋友得了红斑狼疮，引发肾衰竭而去世，大家要到溶洞的石佛前为女孩祈福。据导演介绍，这个情节源自寨子里真实的故事，“而且现实比电影还惨，直到去世，孩子在外打工的爸妈也没有回来。” 根据民政部2016年11月9日发布的数据，我国的留守儿童数量有902万人。鹏飞向中国青年报·中青在线记者表示，他自己小时候也是个留守儿童，和姥爷一起生活到15岁，这是他选择这个题材的一个重要原因。鹏飞和英泽是本片的编剧，影片中关于一些留守儿童的生活细节出自英泽之手，在北京长大的英泽坦言，“自己小时候也是一个星期才能见到爸爸一次。” 在观影过程中，影片中小主人公——女儿一角的许多举动让观众忍俊不禁，对此，现场有观众表示，“影片的表达细腻又不失童心，难能可贵的是，影片里的儿童形象那股原生的生命力。片中即便展现了一些乡村陋习，但表现得真实不刻板。”而导演鹏飞也对此发表了见解，大多观众可能不了解当地留守儿童生活的真实状态，这一认知差异也让观众有了不同体验。 鹏飞在沧源县边境小寨生活了一年之久，英泽在当地住了大约半年，他们与乡民同吃同住，感受那里的山水，变成那里的人。剧组人员在拍摄时，也已经融入了当地，很多让人感到新奇的场景，比如一群小孩拿着手机到寺庙蹭WiFi等，在他们眼中早已司空见惯，因此只是在影片中对这些场景真实地做了还原。 当今留守儿童的真实情况，可能会让不少人大跌眼镜：随着党和国家持续的开发扶贫和结对帮扶，他们的物质生活有了巨大的改善，许多孩子不再为衣食发愁；他们并不怎么用功读书，像《米花之味》中的喃杭一样，是玩着手机的低头族，在小镇网吧中通宵达旦，时不时吐出一句脏话，为给自己的欢乐埋单而小偷小摸，把老师家长耍得团团转，然后偷着乐；他们不怎么喜欢去外面，更希望当个本地“土豪”，不喜欢大城市激烈的竞争、快节奏的生活。精神空虚、性格叛逆已成为当今留守儿童最大的问题，《米花之味》着重刻画了这一点，希望由此引起社会的关注。 尽管描述了大量矛盾冲突，但影片的主基调并未因此而灰暗、晦涩，而是偏风趣幽默、俏皮明快。喃杭与数学老师围绕巧克力斗智斗勇；老人分不清双胞胎孙子，经常给其中一个吃独食；大嘴与喃杭在学校和车上的打打闹闹等场景都为影片增色不少，不仅增加了真实性，而且提高了观赏性。正如导演鹏飞所说，“很多留守儿童有自己的欢乐和欣喜，不是外在认为的负面悲苦形象。” 对于电影的最亮眼之处，参加观影的中国人民大学学生表示，“在许多现实题材电影风格比较阴暗的趋势下，《米花之味》创新地使用喜剧元素，整部影片轻松明快的影像风格，也给人带来耳目一新的观影体验。”对此，导演鹏飞也曾表示过，“反映社会问题的题材不一定颜色就要灰暗或者单一，在油画般的景色中，讲述生活中的困惑，留给观众更多的回味和反思。我选择退回几步，静静观看，以日常生活中的幽默的瞬间来展现这个故事。” 《米花之味》是一部以小见大、以一滴水折射出七彩虹光的电影。导演鹏飞、编剧/主演英泽两位90后新生代电影人尝试着用生动活泼的表现手法，去呈现深刻严肃的思想主题。鹏飞认为，中国的形象传播，既需要宏观叙事，也需要微观情节；既需要描写精英，又需要书写大众，尤其是“小人物”的日常生活。这正是《米花之味》的价值所在，向世界展示一个微观、平常、人情味的中国，使中国的国家形象鲜活、立体、丰满。",43.0,3.0,1
