,Unnamed: 0,电影id,电影名称,用户id,用户名,评分,评论日期,评论内容,有用数,没用数,回应数
5,5,5041518,在切瑟尔海滩上,a42a4d2fa6b69cf22db1eff756e943d9,a84dfe83202974bfd189dbcfc545b551,5.0,2018-08-06 09:38:11,"本文首发于公众号“影探”，原创文章未经许可禁止转载。 相信再纯洁的影迷，也一定看过不少床戏。  商业片里有，文艺片里就更多了。 不管承担着画龙点睛，还是多此一举的功能，床戏都是影视剧中最好用、最“养眼”的表现形式。 但你见过一整部电影都在讲床戏的电影嘛？ 在切瑟尔海滩上  改编自英国最会讲故事的文学大师，伊恩·麦克尤恩的同名小说。 就算你没听过他的名字，也应该听过他最出名的“虐番”——《赎罪》。  原作者亲自编剧，还不是最吸引我的地方。 这片最吸引我的，是女主演——西尔莎·罗南。 从当年《赎罪》里的腹黑萝莉，《可爱的骨头》里的甜美少女，到《布达佩斯大饭店》里的甜点厨娘，从《布鲁克林》里的纽漂青年，再到《伯德小姐》里的率性girl……          她绝对是90后英国女演员里，最会演戏的那一个。 当然，这片的男主也不弱。 比利·豪尔，BBC新版《控方证人》的主演，还在《敦刻尔克》里打过酱油。  这实力杠杠的英伦班底，拍了个啥？ 一对新婚夫妇的洞房花烛夜。 全片都在围绕着一场床戏在讲故事，前戏丰富、高潮激烈、后劲绵长。  看到这，老司机先别急着拿纸巾。
 因为这是一场性生活不和谐引发的悲剧！ 这漫长的床戏，称得上是影史上最尬的一场！ 到底有多尬？怎么个尬法？ 请听小影慢慢跟你讲。 电影的故事，从一对新婚夫妇，爱德华和弗洛伦斯的酒店套房开始。  今晚就是那个大日子，两人正在你侬我侬之时，门外传来了粗暴的敲门声。  是两个笨手笨脚的服务生来送晚餐。 在此之前，他们刚刚打翻了红酒，然后掺了点水进去。  但是爱德华并没有喝出来，于是面对年轻的夫妻，这俩服务生完全没有尊重，举止粗暴，拿了小费之后还在走廊里发出哄堂大笑。  本来好好地晚餐，气氛开始就不太愉悦。 用餐过程中，弗洛伦斯说待会想去外面走走，但爱德华完全不这么想。  男孩子应该都懂的，春宵一刻值千金啊。 俩人小小的争执了一会，然后还是决定留在房间里，做该做的事。  然鹅，问题来了，俩人都是处，面对这场重头戏都相当紧张。  一会拉链拉不开、一会又抢着脱丝袜……    然后就姿势问题，纠结了好久。  作为新郎，爱德华那叫一个着急啊，很快把自己剥得只剩衬衫压了上去，然后…… 找不到位置，嗯。  尽管自己也很紧张，弗洛伦斯还是用手慢慢引导着正确的方向。  但对于男主来说，第一次得到这种体验，真是太刺激了——随着几声呻吟，这位新郎就……完事儿了。  唉，这床戏整的。 这么快、这么尬，怎么能拍成一整部电影？ 其实，在这场床戏的每一个过程中，穿插了他们当初恋爱的过程。 当初恋爱的时候可一点都不尬，全是甜！甜！甜！ 男主爱德华，是个爱听电子摇滚，又喜欢研究历史的cool boy。  女主弗洛伦斯，是个爱听古典乐，还是弦乐四重奏乐队的淑女。  两个看似没啥交集的人，却巧合的一见钟情。 某天爱德华拿到了历史学科的一级学位，兴奋不已，却无人和他分享喜悦。 憋得慌的他一口气跑到了城里，喝酒闲逛，来到了一个反核战宣讲会。    在宣讲会上，他一眼看到了发传单的弗洛伦斯，弗洛伦斯也一眼看到了他，主动上前和他说话。  爱德华把自己拿到学位的事情告诉了她，得到了对方温柔真诚的赞赏。  于是，两人开始聊天，感情慢慢升温。  一个是需要肯定和倾听的孤独boy，一个是需要新鲜和活力的传统girl，性格上简直是珠联璧合。 在女生眼里，他是她循规蹈矩的生活里，最不一样的存在。  在男生眼里，她是他沉闷生活里的一淙清泉。  约会、拥抱、亲吻，恋爱中的种种，都按照正常情侣的进程走下去，可谓是神仙伴侣本侣了。  可是在上演了一场史上最尬洞房花烛后，女生羞愧难当，逃到海滩上，男生恼羞成怒，乘势埋怨。 恐慌的弗洛伦斯说出“你在婚后可以和别人上床“的提议。  怒不可遏的爱德华则叱责“你是个性冷淡”。  他们在切瑟尔海滩上大吵了一架，闹到分手，结束了这场仅仅维持了6个小时的婚姻。 这对被初夜搞砸的璧人，差的是性教育嘛？ 爱德华可能没有，但弗洛伦斯曾经在婚前做了不少功课，已经尽可能的做足了心理准备。  就算第一次不顺利，两人还是可以慢慢磨合啊，怎么就闹到分手了呢？ 实际上，在他们甜蜜的热恋之下，早就有一个无法弥补的矛盾，像定时炸弹一样埋伏着。 阶级差距。 尽管爱德华很酷，但他的家庭一点都不酷。 乡下小屋，交通不便。  一个为艺术痴狂的母亲，一言不合就裸奔；一个压力山大的父亲，眉头从来就没舒展过。  两个忧郁寡言的双胞胎妹妹，常年宅家不出门。  而弗洛伦斯，其实是标准的温室花朵，不食人间烟火的小仙女。 出生在一个高知富裕的家庭，母亲喜欢在饭桌上聊政治，父亲开了个“高科技”工厂，还有个性格和自己差不多的妹妹。  13岁的时候去买火车票，她都要像背莎士比亚台词一样练习，成功买到后就觉得自己长大了，是社会人了。 弗洛伦斯在爱德华家里，是广受欢迎的完美媳妇。 上得厅堂，下得厨房，连最难搞的婆婆，都会笑眯眯的和她聊艺术。    爱德华的父亲看到欢声笑语的家庭，只对儿子说了一句话：赶紧把这姑娘娶了！    爱德华在弗洛伦斯的家里，却是个备受嫌弃的“乡巴佬”。
 弗洛伦斯的母亲曾经直接和友人抱怨自己的准女婿有多土，弗洛伦斯的父亲则一直对男方家境耿耿于怀。  二人的成长历程与文化认识差异，最终在新婚之日爆发出来。 如果是包办婚姻，还可以理解。 但他们是自由恋爱，深爱着彼此，就算有不可调和的矛盾，怎么着也得过个几年再炸。 新婚之夜就炸成这样，至于吗？——这是不少人给这部电影差评的主要原因。 但结合这个故事的时代背景来看，这片绝对是要上8分的。 《在切瑟尔海滩上》小说发表于2007年，但故事的背景发生在1962年。 这是《查泰莱夫人的情人》被解禁，披头士走红的前夕，被称为“最后的纯真年代”。 对亲身经历过那个年代的英国人来说，这是一个让人又爱又狠的特殊年代——有太多的天真，又有太多的禁忌。 《在切瑟尔海滩上》的小说开头，伊恩·麦克尤恩这么写道： 他们⽣活在⼀个根本不可能对性事困扰说长道短的年代。 这么一看，其实就很理解了。 不要小瞧一个时代对于年轻人的压力，更何况是这么敏感的事情，这么敏感的年轻人。 禁忌造成了无知，无知带来了误会。 最糟糕的是，女主还有被父亲骚扰的童年阴影。 其实刨开客观存在的阶级差距，和摆不上台面的性，这对情侣算得上是真·灵魂伴侣了。 尽管现在看来，这些都不足为提，更像是一个苍白的玩笑。 但这种时代背景下，宿命意味前，年轻灵魂在“小事”上的无力挣扎，难道不是每个年代都有的悲剧嘛？  这部由原作者亲自操刀的电影，将初夜的前戏、升温、高潮、结束和感情的相识、热恋、矛盾、分手巧妙结合。 再加上两位年轻主演的演技，把热恋时期的甜蜜温馨，新婚初夜的青涩懵懂、局促不安，再到最后海滩的矛盾爆发，都呈现得相当精彩。 罗南妹子的那双蓝眼睛啊，真是温柔得要滴出水来。  本来以为这片是春药，看到中间以为是糖果，没想到看到最后是毒药。 女主真的是性冷淡嘛？ 她后来再婚生了3个孩子。  男主真的是不行嘛？ 他后来变成了左拥右抱的嬉皮士。  看到最后，让我哭的最凶的，并不是那个酷似《爱乐之城》“你在台上，我在台下”的相视一笑。    而是在切瑟尔海滩上，两个相爱的年轻人，冰冷的渐行渐远。  关于这段，有一句小说文本的评论，说到了我的心坎上： “他们（爱德华和弗洛伦斯）被困在⼀座孤岛上，岛就是⼀张床的尺寸，托起这座岛的海，却像人生那么浩瀚。” 《&lt;在切瑟尔海滩上译后记》黄昱宁 或许他们的感情，就像那瓶掺了水的红酒，并没有他们自己感觉得那么好。 或许他们只是在那个夜晚，刀锋转错了⽅向，本该刺破时代的锐利，最后伤害了对方和⾃⼰。 或许这部电影，就像海滩上那条鹅卵石道，只有走上去，自己脚下的感觉，才最真切。",21.0,2.0,1
6,6,5041518,在切瑟尔海滩上,a977aad956bb95d6039a4052aab2a009,2428e88e70ec2af686492ac59c6bb721,4.0,2019-05-19 19:20:13,在空荡的海滩上，在一艘破碎的渔船边，一对相爱的新婚夫妻在此永别。极简的构图带来无尽的视觉舒适，在那个性解放还未到来的年代，性爱一如波涛汹涌的海水一般让人不安。比较可悲的是，现在的年轻人还是没能逃脱类似的命运——通过色青文学或者色情影视获得性教育，以至于第一次实战总是带着恶心和恐惧。可以说，这个故事的悲剧来源是性教育的失败。妻子的蓝裙子在阴霾的海滩上美的令人心碎，蓝色是属于新娘的颜色，悲伤也是属于新娘的颜色。  第一次性爱的失败，带给这对年轻人的是颠覆式的毁灭。妻子的心里或许还隐藏着曾经遭到猥亵的秘密，而这只能令她倍感耻辱，以至于看到精液在腿上时失控大叫；丈夫虽然从恋爱之始便对性爱这件事蠢蠢欲动，奈何只有身体的冲动而毫无实战经验的他，将性爱失败的屈辱统统发泄在了年轻的妻子上，且妻子对性爱的怀疑更是让他有了埋怨的借口。这其实让我不合时宜的想起一个搞笑剧里的一句台词：“这就是年轻人，即便是世界末日来了也觉得他们自己最重要。”性爱，对于整个人生来说，其实也只是一件逐渐磨合的小事，而对这两个对此毫无经验和知识储备的年轻人来说，简直就如洪水猛兽到来、需要慷慨就义般要命。  影片采用回忆插叙和现实交织的形式，为我们展现了一对爱人相爱到分手的过程。前半段很精彩，年轻的恋人寻求着奇迹的光芒，试图冲破阶级门第的观念勇敢在一起，然而并不都是美好：这其中男孩发现自己母亲的病情不得不真实展现在女孩面前时、他接受强势的岳父为他安排的工作时、他得知岳父一家为女儿准备了丰厚的嫁妆时，强烈的自备情绪和与此疯狂匹配的自尊心都为他后日不稳定的情绪埋下伏笔；而女孩在准备结婚前，不得不通过色青文学了解性爱这件事、以及看到自己父亲暴虐、酗酒的模样时，即将到来的婚姻带给她的只有焦虑和恐惧。  新婚的晚餐上，男孩并不适应有侍者服侍的环境，同样也喝不出来被兑了水的红酒，侍者的嘲笑如针般扎在他脆弱的自尊上。尽管女孩试图掩盖这一切，提出要到海滩上吃晚餐，男孩却只能用迫不及待的性爱掩盖自己的窘迫。本该是美好的前戏，这顿饭却生生吃出了山雨欲来风满楼之感。  当丈夫强硬着心，担心自己的性生活被女孩破坏而立刻选择分手。多年后，他发现女孩嫁给了当年拉大提琴的查尔斯。这也是那个年代的局限，女人的选择并不多，另一方面，类似的阶级也使他们的思想更为相通。幸运的是，这个查尔斯想必要温柔、善解人意的多，所以女孩可以完美的平衡了家庭生活和事业的天平，在拥有了3个孩子数个孙子女的情况下，依然保持住了当年的梦想和优雅，在年华老去时实现了曾经说过的豪言壮语。  当新婚妻子在海滩上勇敢的说出“我是说当我同意某些事的时候，其实并不是真的想要”这句话时，其实非常令人欣慰。这也是她自身性意识的觉醒，自己并不需要为了迎合、取悦某个人、而可以大声的说出自己的需求，即便带着困惑也好、恐惧也好、甚至自己都不明白的原因也好，婚姻里不应该存在强迫、奉献性质的性爱关系，非婚姻关系也是如此。,6.0,,0
7,7,5041518,在切瑟尔海滩上,c007dd62d2b467dde3548207966b29a4,f0417357ff364f2ce732d60d763d6416,5.0,2018-05-31 01:05:05,"早前在电影贴片预告中看到了这部电影的预告片，看到罗南的脸基本上就能确定这部电影不会差到哪里去了，再加上之后出现的作者名——伊恩·麦克尤恩，因此对这部电影更是充满了期待。 光看预告片其实并不是很能完全猜测出故事到底发生了什么，但是又隐隐约约地能让人猜测出一些东西：男女主角之间有某个东西出了问题。而这种隐隐约约、似是而非的感觉就像是问题本身一样，是一个大家避之不谈却又不得不要面对的事情——性。 之前大四读闲书的时候，有幸读过几本伊恩的书，知道他描写故事基本上都是从小处着眼，但情感的描写非常之细腻，甚至都很让人怀疑他作为一位男性作家，是如何深入细致地描绘一些女性的心理和情感变化。本片的编剧也是伊恩，虽然没有读过原著，但内心还是相信这种细腻的心理变化会最大可能的在电影中有所保留。自然而然的，在片子开始的前20分钟，我就开始期待导演如何用镜头体现出那些细枝末节，那些难以捕捉的情绪变化。 电影采用了插叙手法，以夫妻两人在切瑟尔海滩边的酒店度过的新婚初夜为主线，时不时穿插一些两人之前幼年和恋爱时的闪回。不出我所料，在一个个细微的镜头下，可以看到两人无声的心理变化：那种拘谨，害羞，紧张，害怕，期待……但这些情绪无论正面负面都被各种回忆和此刻的经历所放大。 女主出生在一个算是比较有钱的中产家庭里，父母管教十分严格，因此对女儿的教育十分挑剔，无论是桌边谈话，到女主幼年和父亲出海，再到网球场边父亲愤怒的质问等等，可以看出女主是一直压抑的状态，碍于父母的权威，为了博得父母的喜爱和关注，能够牺牲自己的意愿，步步妥协退让。这一点最后在海滩上女主自己也承认了，她总认为自己达不到别人的期望，总是要答应他人，满足他人的要求，但其实内心一点都不快乐。 而男主则和女主不一样，出生在一个乡下家庭，家庭并不算富裕，并且家里人数多，因此家人对他的关注并不是很多，即使他获得了优异成绩，但家人要么不感兴趣要么不理解。再加上母亲有些精神疾病，男主多多少少对此感到有些自卑，但碍于面子总是不愿意承认，无论是他在酒店面对服务生的嘲笑，被安排在女主父亲工厂工作等等，他对自己的社会地位感到不自信。因此也导致男主郁郁不得志，而这一点在家里得不到发泄，因此他就选择在平时与朋友相处或独处的时候爆发出来。 而恰好这两种性格碰撞在一起，他们都希望一切事情都是完美无缺的，然而一旦问题出现，一个怪罪别人，一个责备自己。再加上两人结婚之后面对初夜同房的问题又毫无经验，矛盾更加升级。 电影剧情慢慢推进着，我们也通过闪回部分了解了这两个人的情感经历。不可否认，他们是真的深爱着对方：为对方演奏，为对方鼓掌，互相鼓励和支持，安慰对方脑功能受损的母亲，接受对方父亲的工作安排，为了讨好岳父的网球比赛……然而这一切都在面对两人对于性的态度上，分崩离析。 虽然可能初夜的那段情节会显得很荒唐（毕竟电视电影上宣传的都是水到渠成、干柴烈火的性），但是两人的反应却都是细思恐极的，因为这可能十分真实，根据他们各自原生家庭对他们性格的影响来看。 就我个人观点，全片高潮有两处：一是海滩上的坦白和争吵；二是男主最后去听女主的演奏会。 海滩上的争吵基本上把两人的心理问题表现的十分完整了。男主出了问题之后因为自卑，觉得是对方是在羞辱自己，再加上冲动的性格，急于发泄，所以将所有坏情绪都宣泄了出来，怎么样都不愿意原谅对方。而女主则依旧认为一味忍耐是解决问题的方式，她深爱男主，所以宁愿退一万步，允许男主去睡其他女人也不想破坏这段婚姻。 而男主最后看到女主的女儿，才明白女主其实是真的爱着他的，也许只是当时无法接受性(女主自己在海滩上也坦白了，也许之后会改变但她不清楚)。而只怪当时他一时太冲动太愤怒，所以面对女主的挽留，选择了（字面上）turn a cold shoulder to her。这一点在影片最后一个镜头也体现出了那种“一转身就是一个世界”的感觉。 而男主在现代选择最后去一次女主的演奏会，那个场景我觉得简直可以媲美《爱乐之城》里最后那个场景，Mia去Seb's看Sebastian演奏。那种其实依旧深爱对方，但是却最终错过，而音乐里表达的都是当初我们在一起的那些美好回忆和梦想。看着男女主遥相对望，默默流泪，不禁又让人想起拜伦那著名的《春逝》的诗句： If I should see you，after long year.如果我们再相见，事隔经年。
How should I greet, with tears, with silence.我将以何贺你，以眼泪，以沉默。 因此到最后镜头切回当初那片海滩，看着两人渐行渐远的背影，作为观众，我不停的在心里问自己：如果当初他们的选择不同，结局会不会不一样？因为女主最后还是有了孩子，甚至孙子。说明她最终还是接受了性，那她到底是迫于生活接受了性，还是她最后真的改变接受了现任丈夫？我更愿意选择相信前者。就像她自己在海滩上说的，他们可以只有爱没有性，也依旧能够过的很快乐。所以她最终妥协接受了性，那她是否真的感到快乐了呢？如果是的话，为何见到男主依旧止不住眼泪呢？ 可惜这部电影不是《爱乐之城》，没有办法有幻想的平行空间存在，那个当初改变两人命运轨迹的又一种结局。（当然我觉得这个也是可以的，毕竟伊恩和罗南之前合作的《赎罪》就用了这个手法，不过这样就会显得现实更加残忍。） 最后说说电影拍摄本身。本片的画面和色彩实在是太美了，还有女主的各种裙子和英国的自然风光，有好几次都想截屏做背景了哈哈。而且可能是因为故事主要发生在60年代，所以电影画质还有一种颗粒感，不是现代那种特别清晰的感觉，多增添了一份意境。 而电影的音乐也很优美，可能和女主的音乐背景有关，全片大部分都是古典乐，尤其是两人相处的时光，但演到最后却发现，男主其实爱的是摇滚乐（从之前学生时代去酒吧听乐队演奏再到最后开了一家唱片店），所以不知道这里是不是也是一种暗示，其实两人需要面领的挑战不仅仅是性，还有社会阶级甚至是音乐品味？ 全片的镜头无论是风景还是人物，还是细节捕捉（如两人交握的手，以及两人在酒店桌下的脚等等），都十分美丽。可以说构图十分匀称美观，尤其是最后两个人海滩分手的场景，一个长镜头从男主冷峻的面容一直延伸至将两人全身都呈现在镜头中，并且随着镜头调整，在之后几分钟内依旧努力将越走越远的两人包含在同一个镜头中。到了最最后，到达了镜头范围的极限，只能让女主慢慢走出了镜头，留下男主孤单的背影和绵长的海岸线。 男女主的表演都十分到位，女主罗南自然是不用说，心理上的变化从细微之处就可以看出来，比如去见牧师时微微皱起的眉头，阅读“小黄书”时那种不是很自在的感觉。而男主体现出的那种有些呆呆的老实，又十分感性（会偷偷抹眼泪），到后面在海滩上的暴怒和冷酷的情绪恰到好处地表现了出来，再到最后和他人诉说自己的故事时的神情以及最后见到女主不可抑制的眼泪，表现可以说是十分惊艳了。 这部电影看完之后给我感触很深，这个故事感觉很小，但又总是真实细腻的可怕，就像一张细密的网，看到最后将观众的情绪全部包裹了起来。于是，我觉得有机会要去好好拜读一下原著。",21.0,,4
8,8,5041518,在切瑟尔海滩上,ac09fdefcbbc7f4b2dd062752cf7a4cd,0d6f1e7980be2080a9bff35cd5a026b1,4.0,2018-09-11 16:26:27,看过《在切瑟尔海滩上》后，让人心情沉重。那些相爱的人结婚了，也可能离婚。 女主温柔善良，出色的小提琴手，家境优渥，父亲有实业，身边有追求者。男主虽英俊帅气，是历史系的高材生，但家境一般，还有一个疯疯癫癫的母亲。 但二人却鬼使神差的一见钟情，深深相爱了，相爱时是甜蜜温馨，浪漫可人的。女主的温柔善良，善解人意在与男主疯母亲相遇时表现的淋漓尽致。女主不但赢得了男主的心，更赢得了男主全家人的心。他们的婚姻未来似乎一片光明。 但幸福的婚姻绝不像恋爱那么浪漫。 男主外表高大帅气，内心却是简单粗暴。生活中只想赢，否则就瞧不起自己。除电影开头在女主专业也想强势的对话外，他在外面暴力打仗，他与女主父亲打球，不顾女主提示，非得赢。以至于女主父亲的不明之火油然而生，喷向女主。这些看似小事，没有被浪漫的女主正视。 恋爱中所有美好，不是未来婚姻美满的决定因素，恰恰是那些自己隐藏，不愿暴露，和对方隐藏，不愿暴露的一面才是未来婚姻幸福与否的决定因素。 好的婚姻是要遇上对的人，能引导自己接纳自己不完美的人。 但是比失败的婚姻更可怕的是从此之后不会爱，不敢爱，不能爱。 二人分手后男主一蹶不振，一个历史系的高材生沦落为卖碟片的小商贩。靠买爱来满足男性的欲望。 而女主却比较幸运，那个一直爱着她的人，虽然来的晚，但更细腻，对她更呵护，更体贴。对她来说是那个对的人。是她需要的人，是适合她的人。因此，女主在之前出现的问题全不是问题了。所以他们爱的长久，幸福，即使人到暮年，仍然能从女主的眼神中看出幸福满足。,5.0,,1
9,9,5041518,在切瑟尔海滩上,6d5cf2c244e3eec909e1f7a36cf47944,5e0f5ed116e3cebeeaf82089757ee712,5.0,2018-08-13 00:40:23,1.同年龄段，男生女生成熟程度的gap的确是件蛮恐怖的事情 2.感情中，尝试去理解，而不是辩驳。感情不是打官司，当冲突或矛盾发生时，讲理（所谓理，会偏主观，且大多数情况下是由屁股决定的）是最不被需要的 3.有时候只需要几秒钟做的决定，会影响今后几十年甚至整个人生。所谓“如果当时” 4.观影过程一直很难受。前半段被初夜的尴尬搞的坐立难安，后半段陷入回忆无法自拔。不得不说，导演在营造氛围上做的不错，且通过插叙方式处理回忆的手法上也比较舒服并不突兀。后半段代入感也很强。 5.有一处剧情设计感觉很真实，女主会带男主去自己曾经工作的场所分享回忆（但是过程中立的flag就有点刻意了）。尴尬一晚过后男主回家时的胡渣细节也很赞。 6.最后，女主好美～ 7.看的这么难受，忍痛给五星TAT,3.0,,0
