,Unnamed: 0,电影id,电影名称,用户id,用户名,评分,评论日期,评论内容,有用数,没用数,回应数
10,10,5041518,在切瑟尔海滩上,d39be2528773c4aa503bac9346f95822,c3dee85b6f31b560aea8c364112f6be0,4.0,2019-07-01 15:48:25,他们的分手并不全是因为性冷淡，而是男女主角间不对等的关系，以及男生一直没有真正成长起来的内心。 由性冷淡引起的探索人与人之间关系的话题其实值得更加深入的探讨，但这部电影以它为切入点，却终结于爱情题材，让我觉得虽然最后也有被感动，但还是少了点厚度。 先说下电影本身，完成度很高，所有最后的结果都是有原因的，在回忆线上都交代清楚了。 男主角爱德华和女主角弗洛伦斯的那场争吵是过去几年、从相识到结婚这么长时间的一个情绪累积。这是他们的第一次争吵，也是最后一次，爱德华把之前所有积累的怨气全部在这个海边喊了出来，不管这些怨气和弗洛伦斯的性冷淡有没有关系。  爱德华的原生家庭其实有点不幸，他有一个精神不太正常的母亲，没有在他成长过程中给到他正面的能量（不是说精神病不好，而是对爱德华这个心灵还没成熟的孩子来说，精神病中的偏激是不利于成长的）。 从他领到录取通知书想给家人看的那个片段能很清楚的发现，他在家中没有得到足够的重视。这样一件大事，家中竟然没人表示兴奋和祝福。可想而知他是在一个缺乏爱的环境中成长的，不过也许并不是因为父亲不够爱他，因为他们在乡下，父亲一个人要养全家，所以可能他会因为太忙而疏于关心。 在这样环境中成长的孩子，会极度想得到别人的认可，当别人对他稍微表示出一点点的不尊敬的时候，就戳到了他由自卑带来的自尊心，于是会大打出手。 而弗洛伦斯呢，她则是看到了爱德华脆弱敏感的这一面，于是一直在用她的方式保护他。 这一点让我想到了我和前男友的关系，他由于6岁时。父母离异，母亲离开了他，这对他一直到现在都产生了非常大的影响，我觉得他的心理年龄从此就再没怎么成长过，可能现在也就是小学三年级的样子。我能够在我们的交往过程中感受到他在我这里获取了母亲一样的温暖。（我的性格非常温和，有很强的包容心。而且我发现，一直以来对我感兴趣的男生都是单亲家庭的孩子= =） 和弗洛伦斯一样，我会经常鼓励、夸赞前男友，并经常表现的很小女人，崇拜他的样子。因为我知道，即便是在上小学的男生，他们也有英雄情结，会希望被女生崇拜。 当然，前男友也会有和爱德华一样的问题，就是当面对问题时，情绪会非常激动，控制不住自己，同时处理问题的方式是“回避”。 回归到“性冷淡”这个话题，我非常能够理解弗洛伦斯的心理。首先能够看出来弗洛伦斯是一个非常热爱生活的人，她对世界充满热情，她有自己的爱好，有自己工作上的理想，性格也很好。 于是当她面对一个她非常爱的男生的时候，她首先想到的是去妥协。  她并不是一开始就拒绝了爱德华，我们能够看到她在非常努力的克服自己身体和心理上的不适，去配合他。甚至在最后，她还想起了书中的话，伸手帮助爱德华进入自己的身体。所以在这样的背景下，任何人都没有任何理由去责备她。 I just want to be with you all my life 在海滩上，她提出可以让爱德华出去找人做，但是他们两人还是相爱的。我完全能够理解。毕竟对于一个抗拒性的人来说，既能解脱自己又能满足伴侣的需求，这种解决方案是没问题的。但是爱德华却把这视作是对自己的侮辱。 爱德华其实也是非常尊重弗洛伦斯的，要不然也不会一直到结婚之前都没做过。但是在当时如此尴尬的情况下，他作为男性受到的屈辱，再加上之前被岳父瞧不起的画面一下全部爆发出来。而他又缺乏控制自己的能力，所以冲动之下做了一个不可挽回的令人后悔的决定。所以，其实他们的分手并不全是因为性冷淡这个问题，而是一直以来，男女主角间不对等的关系，以及男生一直没有真正成长起来的内心。 影片最后，是以一个“遗憾的爱情”来收尾。但看完之后，我会联想到： 如果现实中，一个男生知道自己女朋友是性冷淡之后，会作何反应？ 如果他们想去一起解决，该如何解决？ 这其中牵涉到的人性之中各种美丑的较量，是我更感兴趣的。 当然这部也很好啦&lt;,3.0,,1
11,11,5041518,在切瑟尔海滩上,63d10bdbcc9da39bc79a705afe08a652,159c9595f87c66b0a451ea94831c6448,4.0,2018-07-28 23:17:35,我真的真的非常抱歉，让我们一起回去吧！爱德华。激烈争吵过后，弗洛伦斯如是劝慰，但爱德华倔强地转过身，不再理会深爱的人儿。就这样，镜头缓缓拉开，爱德华立在镜头的边缘，弗洛伦斯则一步一步地离开他，直到消失不见。 究竟为什么，深爱彼此的人儿会终身不再相见？初夜之时遇到的尴尬，竟然将深爱彼此的心意完全消解。难道弗洛伦斯被父亲伤害过，不然她怎么会对爱德华将要进入自己的身体那么恐惧？ 影片以爱德华和弗洛伦斯在酒店度蜜月的场景为基点，穿插讲述两人的相知相恋。 爱德华的母亲性格热情，喜爱艺术，却因一次意外精神失常，经常裸身作画，自言自语。弗洛伦斯的到来，似乎令这个支离破碎的家庭体会到久违的温馨与欢乐。那幅主要由母亲绘制的乌切诺的画作，正是在弗洛伦斯得鼓励之下造成的。 还有一英里，弗洛伦斯独自一人，拿着地图，找到爱德华工作的球场。多么幸福，我没有走错一步路，知道你就在离我还有一英里的地方。 爱德华最不堪的那一面，帮助犹太同学出生气，却遭到对方的厌弃，从此不再说话。 弗洛伦斯最大的渴望，就是现在舞台上，为观众演奏莫扎特的五重奏。爱德华听着，奔到台下，预先献上热烈的掌声。 那么多幸福的时刻，分享彼此的喜怒哀乐，深深相知，发誓相守。 为什么？弗洛伦斯不能接受爱德华进入她的身体。海滩之上，她竟然说自己可以同爱德华住在一起，但是并不能满足他性方面的需要。对爱德华来说，这是巨大的羞辱与拒绝。于是，相爱的两人从此分道扬镳。 但是，弗洛伦斯竟然结婚了，有了孩子。影片并没有说明，孩子究竟是不是弗洛伦斯亲生的。或许，那位丈夫接受了弗洛伦斯的提议，他们只是生活在一起，窗帘拉上，并没有人知道在卧室中发生了什么。 告别演出之上，爱德华坐在台下，与弗洛伦斯对视的瞬间，泪如雨下。终其一生，他都爱着这个女人。但是偏偏，初夜的尴尬与真相阻隔了两颗紧紧相系的心灵。 肉体与心灵，真的能够合二为一吗？爱德华和弗洛伦斯深爱彼此，却终身无法实现肉体上的结合。雾霭、林间，清流，他们穿行在美丽的英国乡村，酝酿着真纯动人的爱情。那样的时刻越是迷醉，情感碎裂之时，哀叹更其悠长，低徊不去。 这部影片讲述了一个非常独特的故事。或许我们的生活中真的存在这样的事情，但是搬上屏幕，大约是头一次吧！ 这是另一个视角的真实，没有虚幻的美化。诗意相知最终败给了性的错位，我们都活在对错交织，美丑互渗的世界。恋爱的灵魂愉悦最终要面对肉体交合的暗礁，那些赤裸裸的声响、触感和液体，会将所有柏拉图式的幻想消解殆尽。恰也是从这一刻开始，我们才真得开始碰触到生活。 弗洛伦斯并不接受这样的性，但又无法在那样的时代里，公然单身，反抗世俗。她选择坦诚相待，可以爱德华不接受这样的妥协。他推开了弗洛伦斯，自己则终身不能走出这份伤害，等待老去，等待弗洛伦斯遥遥无期的一声问候。 古典乐和摇滚乐相互交织的配乐，也颇为新颖。巴赫的哥德堡变奏曲，配合着海浪的拍打，将两人之间即将爆发的情绪烘托得动人心弦。,5.0,,0
12,12,5041518,在切瑟尔海滩上,a75539122cda5b257116654b1ee19178,b9d285c7d9aa2d9cbccb07938fd019fb,4.0,2018-08-14 15:48:39,前部分讲真节奏有点慢，零零散散插着回忆，终于看到高潮了，但是又觉得难受，也许初夜不和谐并不是他们最主要的问题，如同没有交流过性知识一样，他们也并没有向对方讲述最真实最深藏的想法和经历。是不爱吗，好像又很爱。婚姻，6小时就结束，就这样吵完气冲冲的结束，总是看得有点压抑有点难受。但是在沙滩上的画面真的是好简洁又好漂亮~,1.0,,0
13,13,5041518,在切瑟尔海滩上,8059cd9a278c535b2a0862d9199c531d,f148557e92353b70d94b25e152b163cf,4.0,2018-08-03 22:56:02,不是一个世界的两个人，即便再爱，可是在面对现实和处理矛盾的时候永远想的是自己，童年和原生家庭决定的太多，还是不够了解吧，彼此都想让对方开心，展现出自己最好的样子。爱就是这样，能让人不知辛苦，为他们纯纯的爱动容。影片结局，看着罗南越走越远走出镜头，很心酸，如果当时两人一起回去了，结局一定不一样吧。哎 往往一个决定就改变了人的一生。只有回忆和遗憾一直都在~Bravo，可惜没如果。,1.0,,0
14,14,5041518,在切瑟尔海滩上,f8dd8c9be43aec307f1ee88a06b28846,8e354fa0e6b9d6fc300686dc3be9842c,4.0,2018-08-03 18:46:52,《在切瑟尔海滩上》，纯正的英国电影：灰蓝色的空气 不阴不晴的白天 爱历史的乡村学霸男孩 爱古典音乐的性冷淡女孩 温馨的英式家庭聚餐 冷幽默和冗长的日常对话……而最重要的三个字 应该是“仪式感“。 前几天朋友聊到 现在社会把年轻人逼的 感情只能选快餐式的，感情无法作为优先级去考虑 要衡量的现实问题太多 人纯真不起来 人和人之间越来越没有仪式感。当时我说 英国中老年人倒是真的很有仪式感也很纯真—— 他们周日去教堂一定要穿着正式的Sunday clothes，拄着拐杖、要人搀扶 但是胸口的方巾一定叠的整整齐齐，礼貌可能旧了破了 但是不能不戴。去老人家喝茶 他们一定亲自布置餐桌，所有茶具全部要配套 茶点就算不吃也要摆上一整桌 餐巾纸会特意准备在画廊买的印有特殊图案的，摆盘绝对不可以没有。男士一定会开车送女士回家 绕着圈给每个女士开车门……一切都要尽善尽美地 甚至是有些做作死板——我实在太喜欢这样的英国人 他们用一切细节告诉你 你有多么重要 他有多么重视。 这部电影里两个年轻人生于性解放运动前夕，两人因为新婚夜无法圆房而激烈争吵 女方甚至提出“你以后可以找任何女人解决你的需求 只要不是我就行”，直到几十年后 男方才理解 那时海滩上荒谬的谈话 她只想表达一句“我爱你 我想让你开心”。 本该觉得幽默或不可思议 本该感叹着“没必要吧”，打开豆瓣发现第一条热评“急死我了 想给他俩灌春药”，大多数人 都给了低分。但是在看完结局 听完那段音乐之后 我却真的觉得难过。 因为当年没有好好告别 导演甚至安排了伦敦的乐队告别演出 让男女主角终于对视 然后落泪，以此才完成了那一句“再见”。可是现在的人 一边问真爱在哪里 一边搞快餐式的爱情 一边说爱情真是没意思，在一起不用再郑重其事地问“你愿不愿意做我女朋友”，分手也不用说明原因消除误解，上床也不代表爱到深处要为未来做打算……再看这个故事，实在觉得 这真是纯真的不太像话。 有两个片段真的很喜欢：男主的画家母亲因为事故患上精神病 他很自卑很担心 不想让女主见母亲。女主拿了一张画廊买的明信片送母亲 正是她喜欢的画，然后女主说 我们一起来画一张赝品吧。后来她们相谈甚欢 完成了“赝品”，男主百感交集地冲了出去 一边笑一边痛哭。 第二 是女主的女儿去男主开的音像店买唱片 说话的语气和咬字跟女主一模一样，不知道为啥这段看哭了。,3.0,,3
15,15,5041518,在切瑟尔海滩上,002e3d0df4a4b33c60960f0b501fce29,5f3c73f334928ade199125381f726892,4.0,2018-05-26 05:01:06,这篇不是影评，只是随便写点个人东西做记录啦...不用认真看了 英国院线上映的第一天，我抱着挪威海鳌虾和香茅草酱沙拉的便当，两瓶金汤力冲到电影院，和平时一样，迟到了一点。凭我对院线的了解，新片都是同一天上的，这周几部大片一起上，那个时间多数人才去吃晚饭，略早，这种IMDB评分也不高的文艺片我是大概率包场的，可以一边饕餮喝酒一边躺着看片儿。结果走进放映厅我被那满场乌压压的人震撼到了。要不是每次习惯性定掉双人沙发的两个座位，估计连沙发都要和人共享了。 当然，不出两分钟，看见牛津的风景，我恍然大悟。再看下去几分钟，不忍直视，这简直就是你我的本科年代啊。弦乐四重奏的背景音乐很美，我尽量在两人每次开始用回忆带起音乐的时候开始撕咬沙拉叶子，以免太大的声音和这部安静的片子格格不入。这么一来二去，便进入了一种对影片回忆杀节奏把握和预测的游戏中。要不是这个游戏，估计我早就在这一部分睡过去了。当节奏进入摇滚，我突然开始真的兴奋。后边的二十分钟节奏太快，但却突然潸然泪下，让我决定把这部本来想打三分的片子加了一分。 当我也觉得自己非常老，所以有那么大女儿的三十六岁老妈妈放在今天简直是黑色幽默的背景下，一部历史上关于性与家庭的片子是多么需要感同身受才能体会的滋味。六十年代的英国，似乎却和平移五十年的中国有太多类似的语境。情人坡上想牵不敢牵的手，紫操上觉得某人太猥琐恨不得一巴掌扇过去的耳光，宿舍里一起看电影当年让人面红耳赤，今天简直就是过家家的情节。虽然两个人因为新婚夜的误解就可以分道扬镳终生的作死心态还是无法理解，不过关于性教育重要性的点是一定传达到了吧……少女啊，一定要充分理解才能不会错过真爱吧。,3.0,2.0,1
16,16,5041518,在切瑟尔海滩上,95632fec60a91bd456a061aac3080006,7699fbdfef0f4da6d646259da399a699,4.0,2021-08-15 21:25:19,下午趁着童上网课，看了这部《在切瑟尔的海滩上》，很文艺的一部片子。 一开场就是男女主新婚在切瑟尔海滩度蜜月，两个人在海边交谈着、笑闹着，回到酒店里点了浪漫的Room service，一起吃着餐前点心、牛排，这里就开始有点尴尬了。然后男主开始寻找话题供双方交谈，说什么海滩上的石头经过亿万年的冲刷是按大小排列的之类的，出海的人们可以通过海滩上石头的大小来判断自己的方位云云 接着开始闪回两个人的原生家庭，都是有些问题的家庭。男主有个精神病妈妈，并且有个不关心自己以优异成绩考上了大学的家庭；女主的家庭看上去很中产很温馨、但实际上有些刻板和压抑，就是要沿着父母的规划和期望生活的家庭，但女主自己实际上是有些叛逆和固执己见的。接着双方要履行夫妻之间的义务，慢慢的展现出了女方的xld，在双方发生关系后她觉得恶心尖叫着跑开，然后她向男主坦白她只想不发生关系的维持夫妻之名，让男主可以在外面随便找人，被男主严厉的拒绝了，然后双方分开。 几年以后，开着唱片店的男主接待了一个特殊的客人，是一个十岁左右的小女孩，她要买一张古典的唱片，并且说要送给自己的母亲。男主从里面听出了也许那个妈妈就是他当年的妻子，往更深层次了想，也许这个女孩就是他们那一天晚上的结晶。。。但是男主追出去以后只是看着海滩边的女孩子慢慢的走远，然后回归到自己的生活里。 影片的最后他们都已经很老很老了，这时候男主收到了一个消息，女主的那个四重奏演奏团要举行最后一次的演出，白发苍苍的男主去了演出现场，白发苍苍但是依旧优雅的女主几乎是眼角带泪的演奏完了她的最后一场演出，然后电影就完了。。。真的是一部很文艺的片子啊。,,,0
17,17,5041518,在切瑟尔海滩上,bf9aa314195bb1caa8c953019d4b6805,1abcf1622371d03f992001cb6cd78919,4.0,2021-07-30 20:29:01,电影构图精美，色彩华丽，演技细腻，但从情感的细节铺陈，可能和原著稍有距离。余华这样评价过麦克尤恩：他在写下希望的时候也写下了失望，写下恐怖的时候也写下了安慰，写下寒冷的时候也写下了温暖，写下荒诞的时候也写下了逼真，写下暴力的时候也写下了柔弱，写下理智冷静的时候也写下了情感冲动。”两个人在热恋中的纠结与执着，两个理想化而又超级理性的人，终于成为了陌路人，就如刘若英“后来”里面的那对少年。,,,0
18,18,5041518,在切瑟尔海滩上,abd0219a22e730a678453b402f151681,d0790d7bdee3249fcda178661e404f9b,5.0,2021-07-25 20:02:13,相爱的两人在激进的情感下错失，大概是太过相似导致的美丽错误。无言的伤害最为刺痛人心，性知识的缺失也是一大遗憾，这份遗憾是双方的纯情导致的，我们当今看到的最多的则是滥情、纵情。始终不渝坚守的的人反倒成了傻瓜。 那段细节快闪的几个镜头值得推敲，而我又不想拘泥于此，抛开它们，整体营造的悲情爱情故事氛围使人潸然泪下，一段佳话逝去。折磨彼此的竟是爱情中作为烈性调剂——性——的失败。 爱情，往往一个眼神的对视，一段相处融洽的化学反应就能持之以恒，或许持之以恒是未来不可知的引号，而大多数女生希望得到的都是这样的一种持之以恒。而现在快节奏的生活方式，渐渐转变了这种对婚姻的态度，需要的不是什么永久远，而是充满妥协和未可知。是头脑一热的冲动，是一阵情感和行动的宣泄，是对生活和自己模棱两可的揣测、试探。 沙滩上的抉择，对对方没有很深了解的前提下，这样的婚姻给未来埋下了隐患，也有了这篇故事。有着悔恨，随着时间这剂良药，使痛苦钝化，潜藏在深处，成为了癌症。 分手——世界上最痛，却不会出血的伤。分手的理由千千万万，千变万化，但归结到最终，竟然只是——不适合。 艺术创作者此处代表女性，抽象，坚韧，包容，创造，能把天马行空的思绪用双手转化为满室妙曼的色彩和音乐。和她们在一起每天都充满惊喜，可是要忍受她们喜怒无常的脾气，大多数时候她们都像猫一样乖巧，可也有抓挠你的时候。铲屎官们痛并快乐着，脸上挂着包容的微笑——僵硬。 男人们总会在情感的迷宫中迷失方向，他们琢磨不透他们到底踩到了什么陷阱，他们不说话是错的，他们安慰她们是错的，他们不买买买是错的，买了还是错的。一脸问号，战战兢兢站在她身边，而她们要他走开，不要靠近她。你真的走开了？Too youang！十大未解之谜，女人的心情排第二，没任何事物敢认第一。,,,0
19,19,5041518,在切瑟尔海滩上,047230e16ac6b8c28a4ed5ce050f668e,36ba9b0f0cdaed5df6999f6395a95978,4.0,2021-05-08 22:59:13,"其实并不是非常的能看懂。发现其实对于很多东西，我只能看到真情。就像最后男主坐在观众席鼓掌流泪，女主也相视流泪，我相信随着时间的流逝，他们还是像最初分开前所说的那样，爱没有消失。
我依然觉得也相信自己还是有着很纯真的内心，但是我已经不会再轻易心碎，但我还是很脆弱。我之所以敢于表达我的感受 我不再害怕了，我不再觉得在公共区域表达感情是一种危险，相反，我发现我的情绪需要被看见。
我一直向往爱情的美好，不完全的美，但爱情的美并不是因为它的不完美，没有任何东西是完美的。我很喜欢爱情电影，它对我有特别的吸引。性吸引maybe哈哈
也许我从这部电影看出的就是情 露骨的情节只让我感觉到欲望 我也只关注了欲望 没有看到更深一步的情感 
也许爱是永恒吧 能在老年喜欢少年倾心的那个她心爱的音乐 能在知道对方有伴侣之后依然遵守当时诺言 赞叹她  但是这种爱 从一方面看是感人的 但从另一方面看 似乎就有点不道德的味道 一个老男人爱着一个有夫之妇 就有些不大对劲 爱可以是很正面 很纯粹而有力 散发着耀眼的白色光芒的 用心就可以看到它  爱也可以掺杂其他的东西 掺杂的东西或好或坏 但是爱也许只能是贞洁的  守护好自己拥有的每一份爱 他们像天使一样降临 好好保护他们 记住他们 就像小时候守护自己美好的想象一样吧。",,,0
20,20,5041518,在切瑟尔海滩上,eb65f54fbfa51370c4d6c3b68e31a54d,5b9a10c6e3548d88a0ea2dad40629d9c,5.0,2021-01-30 11:44:03,这俩人谈恋爱的时候真美好，罗南总是那么善解人意的去照顾她男朋友的自尊心，巧妙维系着话题贫瘠的对话，还凭借自己的美术修养搞定了脑袋受过伤的男主妈妈，除了女主的垃圾父母这一关过的艰难，可以说还算是比较顺利的一段感情，可是怎么能在蜜月的第一次之后就吵架分手啊？ 男主你到底行不行！你总发什么疯，那女主不是最后都说要你跟她回去再谈谈吗？你干嘛不回去，哦！那你有本事别去参加女主和第二任好丈夫年老之后的告别演奏会啊，你哭什么？你有什么脸哭？狗男人！ 原来西方也有谈性色变的时候啊，看了电影才知道！结婚之前还是应该正经了解相关知识，只靠黄色小说学来的东西不科学，解决不了实际问题！ 看的太久了，男主女主的名字都不记得了，就用演员名了，peace！ 难过，原来真正相爱的人也会因为破烂事一拍两散各过各的啊！反正本人原则就是悲剧不会再看第二遍（但是贯彻的不好，会有妥协，比如再点开看会在发展成悲剧之前我就点×，机智如我），一想到最后没在一起就好难过！bad！ sad！ Finally——扣题：最后两个人渐行渐远的镜头拍的真好啊！我是女主妈妈！所以不客观！,,,2
