,Unnamed: 0,电影id,电影名称,用户id,用户名,评分,评论日期,评论内容,有用数,没用数,回应数
21,21,5041518,在切瑟尔海滩上,55380b46d3324d77a7121b847512a92c,7fe8d4cdb29f5b6c91ec6abc930ce09b,5.0,2021-01-18 11:57:45,一般较少看爱情片，虽然希望看到理想圆满的结局，但一想这似乎都不是大多数人的现实生活，总觉得不如意，凑合才是多数。《在切瑟尔海滩上》有点特别。片中我看到我相，人相，众生相，看到了生活。   影片前段夹着一些还看不懂的画面外，演员出色的演技下让人不禁让人期待这是唯美的爱情故事，有一见钟情的桥段，有软语温言。但是到后半段以爱德华初夜中的急躁与弗洛伦斯的恐惧产生的冲突展开，剧情张力的转变，看的我心绪起伏。从影片中我看到以命运、原生家庭、阶级、爱、心灵创伤、性、缘、理解体谅等关键词编制的故事。   看简介似乎是因弗洛伦斯对性的担忧和恐惧而产生误解，最终分道扬镳。实际对性的恐惧而产生的冲突只是在某种原因下的表现形式。如果因果律是我们认识和改造世界的客观规律，那这些终归是有缘起的。有些影评谈弗洛伦斯性冷淡。实际性并不是造成冲突的根本原因。    女主童年时被父亲猥亵产生的心灵创伤，对性非常排斥和恐惧，虽然片里并没有明示，但片中画面有序的衔接并不是随意的，这是隐喻。最明显的证据就是，女主晚上睡觉侧向一边双手紧抱，表情焦虑且恐惧。本片以新婚夜的冲突展开，所以童年的女主在看起来温馨的家并在入睡时出现如此表情是令人疑惑且惊异的。    爱德华在新婚夜解开弗洛伦斯的连衣裙背后的拉链卡住时如此急色，鲁莽以至于没有发现弗洛伦斯已经出现恐惧的情绪。这看起来是爱德华性格的问题，急躁、鲁莽在弗洛伦斯不管是神态情绪和动作都不太对劲时还如此着急。不，性格有先天之因，我以为后天的环境对性格的塑造依然扮演着非常重要的作用。   男主出生在一个乡村的普通家庭，家庭条件远逊于弗洛伦斯，且关键的是爱德华的母亲在一次意外脑部受伤，基本丧失了社交的能力。一次爱德华带弗洛伦斯回家见母亲时，看到母亲在客厅裸着上半身摆弄着画板时有点局促不安，而女主过去帮爱德华母亲穿好衣服并安抚情绪，爱德华到厨房煮水时既难过又夹杂着自卑。虽然有人先天性格脾气相对鲁莽暴躁。但影片多个描写爱德华母亲神志不清的画面，我认为是爱德华脾气急躁的关键隐喻。爱德华拿到第一学位时的喜悦他母亲无法理解，自然生活中其他不快，痛苦，彷徨也不能从与母亲中得到任何温暖，这不是一个解释爱德华情绪暴躁的原因吗（一言不合就打人）。影片没有告诉观众爱德华的母亲是什么时候脑部意外受伤，但我推测应该是和弗洛伦斯受伤同个年龄段也是童年。长期母爱的缺失对人在童年期的成长影响是深远的。所以爱德华在弗洛伦斯出现恐惧的时候并没有停下来，影片中大量的画面描写了弗洛伦斯惊恐情绪下的表现，包括不限于因恐惧双眼睁大，握拳，并在进行时让爱德华说点什么（为了转移在沉默中进行性爱时弗洛伦斯不自觉重新回忆童年被猥亵时恐惧的情绪），这是恐惧的表现并不是出于第一次的紧张，爱德华并不知道，也没有追问弗洛伦斯为什么会这样（弗洛伦斯曾准备把这个秘密告诉爱德华，但被爱德华急色打断）当然除此外还有好些场景都有反应女主对肉体亲密关系的排斥，比如在电影院一起观影的一刻。    彼此的相遇带给双方注定是痛楚。倘若爱德华的母亲并没有遭遇意外，爱德华会不会更温柔一点，在察觉到到弗洛伦斯恐惧的情绪时能停下来问问？或者开始遇到个温文尔雅且懂心理学的张德华又如何？   影片中有些场景我觉得挺有趣，掺了水的红酒，爱德华喝不出来，在弗洛伦斯眼神的提示下才知道要给一直没走的服务员小费，为什么弗洛伦斯最后是和查尔斯结婚生子到终老（爱德华遇到的问题查尔斯一样会遇到，但查尔斯是陪着爱德华的那个人且有了子女，可以说明性爱这个问题上查尔斯多少抚平了弗洛伦斯的伤口），能不能猜测一下因为查尔斯的原生家庭比爱德华好，更理解他的另一半（查尔斯观察到弗洛伦斯看起来羞涩，其实内心是很坚硬的人），可以温暖给这个童年曾受过创伤的心？   作为观众我们可以知道悲剧的原因，但剧中人身在其中不自知，这也意味着悲剧的必然性，也就是常说的宿命，遗憾的现实生活中也如此，爱德华在后面可能明白了，但却什么也无法改变，有些经验真正获得时，却已太晚，今生仅用来聊以自慰罢了。,1.0,,0
22,22,5041518,在切瑟尔海滩上,ed36c4824fb119cebf9fbeba97ac30db,eac83424171b917a8aa38a4a736f982b,4.0,2020-12-26 16:37:10,在切瑟尔海滩上，7.5/10，导演：多米尼克 库克，原著，伊恩 麦克尤恩，女主，西尔莎罗南，伯德小姐的主演，男主，比利豪尔，敦刻尔克的主演，阵容非常豪华，描写的是上个世纪六十年代初，英伦社会处于拘谨闭塞的状态，一对青年男女，克服原生家庭带来的心理影响，相互仰慕，走到了一起，却无从相互亲昵，意外的终结了一段六个小时短暂的婚姻。既可以说是彼此家庭的阶层差距带来的隔阂，也可以说是那个年代对个性不可见的束缚，一段真挚的恋情，终究因为无法把握而错过一生。切瑟尔海滩，岸边的鹅卵石，沿着水流方向，大小分明的列开，就像不同的时代，给每一代人留下的烙印一样。电影构图精美，色彩华丽，演技细腻，但从情感的细节铺陈，可能和原著稍有距离。余华这样评价过麦克尤恩：他在写下希望的时候也写下了失望，写下恐怖的时候也写下了安慰，写下寒冷的时候也写下了温暖，写下荒诞的时候也写下了逼真，写下暴力的时候也写下了柔弱，写下理智冷静的时候也写下了情感冲动。”两个人在热恋中的纠结与执着，两个理想化而又超级理性的人，终于成为了陌路人，就如刘若英“后来”里面的那对少年。,,,0
23,23,5041518,在切瑟尔海滩上,cf37057679287055f885277d65e750d8,907abea3b5e1085e42b6da0d833b462e,4.0,2020-12-26 02:55:03,在切瑟尔海滩上，7.5/10，导演：多米尼克 库克，原著，伊恩 麦克尤恩，女主，西尔莎罗南，伯德小姐的主演，男主，比利豪尔，敦刻尔克的主演，阵容非常豪华，描写的是上个世纪六十年代初，英伦社会处于拘谨闭塞的状态，一对青年男女，克服原生家庭带来的心理影响，相互仰慕，走到了一起，却无从相互亲昵，意外的终结了一段六个小时短暂的婚姻。既可以说是彼此家庭的阶层差距带来的隔阂，也可以说是那个年代对个性不可见的束缚，一段真挚的恋情，终究因为无法把握而错过一生。切瑟尔海滩，岸边的鹅卵石，沿着水流方向，大小分明的列开，就像不同的时代，给每一代人留下的烙印一样。电影构图精美，色彩华丽，演技细腻，但从情感的细节铺陈，可能和原著稍有距离。余华这样评价过麦克尤恩：他在写下希望的时候也写下了失望，写下恐怖的时候也写下了安慰，写下寒冷的时候也写下了温暖，写下荒诞的时候也写下了逼真，写下暴力的时候也写下了柔弱，写下理智冷静的时候也写下了情感冲动。”两个人在热恋中的纠结与执着，两个理想化而又超级理性的人，终于成为了陌路人，就如刘若英“后来”里面的那对少年。,,,0
24,24,5041518,在切瑟尔海滩上,d042e07bd0501bff812ea352df7f1a0d,64489c85dc2fe0787b85cd87214b3810,4.0,2020-10-31 17:36:30,刚开始以为两人不了解彼此家庭阶级就结婚 后来发现二人是有一定了解的 虽然阶级性格差异有一定影响 但最重要的还是性啊 多少无性婚姻不幸福或离婚 不过也间接表明男主真的爱女主啊 多少男的巴不得有个这么贤惠的妻子照顾他照顾家庭 还有个有钱的丈人给自己找工作 自己可以寻欢作乐跟不同女人上床 这简直理想生活啊  要一般男的做梦都要笑醒了 男主还是真心的单纯的 是个老实人 电影不错 本以为很无趣 没想到蛮有意思 演员演的很到位  整个观感就是唏嘘不已啊 如果当时男主能稍微忍让一点 愿意了解下原因 说慢慢来 或许就不会这样了 结局女主孩子那么多想必心结打开了 可惜没有如果 男主那样的出身和家庭导致他自尊心强敏感易怒 秒射又想到工作又让他找别的女人 他就觉得自己真心受骗 于是冲动行事 错过了一辈子 8分  其实两人的性格也非常有意思 从女主在乐队和家庭表现来说 显然是个雷厉风行 果决干脆的形象 可以说是个女强人 但在男主身边和家庭表现的就是小鸟依人 温柔可人 而男主在自己家庭也没咋发过脾气 平时确实打架 但总体来说表现的腼腆顺从 但新婚那天他性格中所有负面的一面都展现出来了 急躁暴躁易怒 看着就像要打人 可以说男主结婚那天表现的就是最真实的深层次的性格 女主呢 一直伪装的温温柔柔 实际是个强势的 二人性格展现 都是爱彼此的表现吧 女的明显喜欢男的所以各种迁就各种温柔小意 对不喜欢的查尔斯她就毫不留情面 直接拒绝和使唤 男主呢 可能不想自己表现那么糟糕 于是各种展现自己强势的一面。拉拉链 说自己有几个女友 都不想自己丢了自己男性的面子 看着强势霸总 实际自卑胆小的不行 一秒射马上觉得女主在侮辱他 有骂女主婊子 其实也是为了掩饰自己的怯懦吧 最后选择离婚也是他真的爱女主 自己的自尊各方面作祟 导致如此冲动的结束了婚姻  可惜啊可惜 如果新婚那天女主能稍微表现的强势点 男主就像之前性格一样温和腼腆 就好了 可惜不行啊 他们都爱彼此 都觉得自己得展现出好的一面 于是女主表现的顺从 理解 甚至要男主找别的女人 男主为了不让女主看不起自己男子气概 硬是各种强势发脾气 结果就是这样的悲剧 二人就是卑微的深爱着彼此 想着改变自己性格可能对方会更爱自己一点  结果因为深爱导致这样的误会 又导致错过了一辈子 可惜又可叹,,,0
25,25,5041518,在切瑟尔海滩上,17e54147f491ec71196f7f21d473422f,657eef39908faf0cc8286ff003d9a084,5.0,2020-09-17 02:58:27,这一躲藏，便是一次自我隔绝，直到老，他依然孤独一人。而在那时候，他惊讶发现曾被他认为是性冷淡，是应该承担他们婚姻失败全部责任的她，竟然再婚，育有三子，事业成功，幸福美满。原来她不是排斥性，她只是需要一个人耐心地引导她重新理解性，解开恐惧，真正去体验性的幸福感。可惜那个耐心的男人，并不是他。 只可惜这场演奏会是她和丈夫合演的，一切都已经物是人非了。曾经深爱的她和他只能相望一眼，接着在悔恨中度过余生。 我不止要你爱我，更要你了解我，连我自己也搞不清楚我自己，但我要你懂我。 她早已经被丈夫治愈了，解开了困扰自己的心魔。他呢，在台下痛哭流涕，又如何。 爱慕是多么简单的事情，仅凭本能就可以做到。可是，想要婚姻，组建家庭，想要长长久久相亲相爱，是需要双方都勤劳且智慧。 爱我你就治愈我。我不仅仅爱你，也爱治愈你——婚姻不得不承受之重。 两个相爱的年轻人，冰冷的渐行渐远。经历过后，才能看到爱情最美的模样。 或许他们的感情，就像那瓶掺了水的红酒，并没有他们自己感觉得那么好。 她和他深深相爱了，相爱时是甜蜜温馨，浪漫可人的。幸福的婚姻绝不像恋爱那么浪漫。恋爱中所有美好，不是未来婚姻美满的决定因素，恰恰是那些自己隐藏，不愿暴露，和对方隐藏，不愿暴露的一面才是未来婚姻幸福与否的决定因素。好的婚姻是要遇上对的人，能引导自己接纳自己不完美的人。 比失败的婚姻更可怕的是从此之后不会爱，不敢爱，不能爱。 她却比较幸运，那个一直爱着她的人，虽然来的晚，但更细腻，对她更呵护，更体贴。对她来说是那个对的人。是她需要的人，是适合她的人。因此，她在之前出现的问题全不是问题了。所以他们爱的长久，幸福，即使人到暮年，仍然能从她的眼神中看出幸福满足。 多幸福的时刻，分享彼此的喜怒哀乐，深深相知，发誓相守。男孩变成男人，可惜那个女孩已经不在。 雾霭、林间，清流，他们穿行在美丽的乡村，酝酿着真纯动人的爱情。那样的时刻越是迷醉，情感碎裂之时，哀叹更其悠长，低徊不去。 一个转身，即是永远。,,,0
26,26,5041518,在切瑟尔海滩上,c7149253d9e695736cb924af9a868071,ea8dbc7900082678e2e4f7275c945902,,2020-07-08 22:15:10,全片最好看的场景，自然是海滩那段争吵。 新婚第一天，男女主在酒店经过漫长的压抑、试探、回避式的第一次身体亲密接触后，直接去海滩来了一场海啸式的互相伤害，结束了仅仅六小时的婚姻。 争吵开始，男主说了一句话让我印象深刻，他责怪女主没有学会床事才让他颜面扫地，但他没有机会知道女主看过性教育书，从他急急忙忙要解开女主的拉链起始就关闭了女主和他开始真正了解彼此的通道。男主只想马上占有女主美丽的酮体，他内心的自卑在那句“被所有人都渴望的如此美丽的你，现在身心都属于我”中体现的淋漓尽致，得到梦中女孩满足了他的虚荣心。不同的是，女主对性充满了恐惧和抵触，他们在酒店亲热的场景既尴尬也不舒适，女主紧张的都快窒息，她的恐惧最终还是被男主的精液引爆，引出女主对性抵触的原因源于父亲的性侵(也可能是猥亵，导演没有给出更具体的说明）。 导演对这个隐藏的剧情表达的非常隐晦，看到有影评说这部电影关于纯真的爱情和性冷淡，在我看来背后其实讲述阶级差异无法跨越和原生家庭的伤害和治疗，男女主感情的纯真会停留在彼此家庭碰撞出现前，像一座没有阴影的空中楼阁。 男主是个善良的普通男孩，家里有位遵循守旧但爱老婆的父亲，和拥有艺术天赋但脑部受损的母亲，作为长子，他对家人的态度既爱又觉得自己与他们不同，拿到一等学位是他的荣光，他的思维方式简单直接胜负欲很强，喜欢用力量表现自己且自恋，即使成年还用打架的方式引起对方的重视，他处理问题的方式不太可能看懂他人关系内在的暗礁，他和女主的父亲打网球那场，女主忠告认怂就好，但他还是用一局的赢面驳了胜负欲更强的岳父，岳父把愤怒转嫁给女主，那场网球像是两个情敌的对抗，女主父亲畸形的控制欲和占有欲，女主自有一套应对方式——做表面的乖乖女维护父亲的面子，实则也是反控制对方。很可惜，男主凭自己无法理解这层暗礁，而女主也没有告诉他为什么，反而是他那个聪明敏感的妈妈，从一开始就看穿了女主，知道自己的儿子会被女主碾压。男主在海滩的愤怒没错，只是换个简单的女孩，也不会遇到这么多人生难题，他不适合女主。 而女主，家庭富裕、内心细腻敏感，对父权是表面顺从实际非常渴望逃出，和男主的婚姻是她对抗父亲的一种表达，故意选了和她家不匹配的坏小子傻男孩，因为她太渴望内心自由，如此，婚姻短暂结束也是必然。 海滩那段对话很好看，真实呈现各说各话无法沟通的夫妻有多气观众，男主把自尊扫地的原因责怪到女主身上来维护他的自恋，而女主不说真正的原因只一味想用办法解决情绪，可以拿来做无效沟通经典语录。 男主更成熟的时候学会了反思，知道了当初女主是因为爱才说出了荒唐的话，而女主遇到了一眼看穿她本质的人，也可以生儿育女，过上普通人的生活，摆脱父亲的阴影。男主挺让人同情的，虽然都真心爱对方，但男主终究还是会因为自己的单薄撑不起女主的深沉而醒来。 在切瑟尔海滩上曾经争吵过的一对年轻夫妻，除了他们自己，几十年以后谁还记得呢？,,,0
27,27,5041518,在切瑟尔海滩上,332a1662b88a8042be540eb242f4b75c,709ef0706c599f0723f05bbe7171cdf0,5.0,2020-06-15 18:14:39,我的一个大学同学，经历了和青梅竹马为期十年的爱情马拉松。毕业之时，他们迅速的领了证，然后迅速的换了证。 后来这位兄弟放弃了所有招聘会和面试，自己在学校附近开了一家卖音乐CD的小店。 我起初去过几次。我们偶尔小聚。但是由于各自走上了不同的人生道路，又是一个十年，昔日的朋友，如今也只是隔朋友圈相望的联系人。 这十年间，他的碟铺几经辗转，却始终经营着。 同学们大多离开毕业时的企业，或者不知改行多少次。 只有他始终操持着卖碟的营生。 一直以来，我有过很多猜测，关于他对碟铺的执着。 可能是对音乐的挚爱，或者心满意足于自己熟悉的角落。 看了这部《在切瑟尔海滩上》之后，我多年的困惑有了答案。 原来受过情伤的男人更容易选择去卖碟。,,,0
